,all_awardings,allow_live_comments,author,author_flair_css_class,author_flair_richtext,author_flair_text,author_flair_type,author_fullname,author_is_blocked,author_patreon_flair,author_premium,awarders,can_mod_post,contest_mode,created_utc,domain,full_link,gildings,id,is_created_from_ads_ui,is_crosspostable,is_meta,is_original_content,is_reddit_media_domain,is_robot_indexable,is_self,is_video,link_flair_background_color,link_flair_css_class,link_flair_richtext,link_flair_template_id,link_flair_text,link_flair_text_color,link_flair_type,locked,media_only,no_follow,num_comments,num_crossposts,over_18,permalink,pinned,retrieved_on,score,selftext,send_replies,spoiler,stickied,subreddit,subreddit_id,subreddit_subscribers,subreddit_type,thumbnail,title,total_awards_received,treatment_tags,upvote_ratio,url,parent_whitelist_status,pwls,whitelist_status,wls,removed_by_category,author_cakeday,post_hint,preview
66,[],False,mightymighty99,,[],,text,t2_dwmsr9d2,False,False,False,[],False,False,1645905278,self.dating,https://www.reddit.com/r/dating/comments/t25jqz/i_really_need_help_guys_im_miserable/,{},t25jqz,False,True,False,False,False,True,True,False,#ea0027,dating,"[{'e': 'text', 't': 'I Need Advice'}]",19ec58c2-9f74-11e7-81a1-0e2bf15991f0,I Need Advice,light,richtext,False,False,True,1,0,False,/r/dating/comments/t25jqz/i_really_need_help_guys_im_miserable/,False,1645905288,1,"So I(M19) met this girl (f23) around 5 months ago and ever since the first time I saw her, i can't stop thinking about her. She is amazing and I love everything about her. We go out sometimes for drinks or dinner and we kissed a couple of times but when i asked her about something more she said she currently doesn't have the time and she is not looking to date anybody cuz she needs to finish college (medicine) and she has finals this year so she needs to focus on that. There is definitely chemistry between us but I can't stop thinking about her and have trouble sleeping and doing stuff. I always think about her to the point its getting exhausting and I can't help myself. Idk how much longer my brain and heart can keep this up. I guess it was one of those love at first sight for me. Every time I see her I still get butterflies like the first time. So idk should I keep seeing her as friends (its more like semi dating since we kiss sometimes) or should I stop talking and going out with her and try to forget about her but i rly don't want to do that cuz I really think this can be something special. But on the other hand im scared cuz what if we keep seeing each other for the next half a year or so and there is still no progress in our relationship i will throw a year or more of my life away because i hoped she would one day open up to me. But if she does I really think this could be something special. Should I wait till the summer so she is done with her exams and has more time? Idk what to do my brain and heart are all over the place. I've never been in love like this. Usually it goes away after a month or 2 but not with her... i'll appreciate any advice :)",True,False,False,dating,t5_2qhb1,1161980,public,self,"I really need help guys, I'm miserable..",0,[],1.0,https://www.reddit.com/r/dating/comments/t25jqz/i_really_need_help_guys_im_miserable/,no_ads,0.0,no_ads,0.0,,,,
67,[],False,PrairieDuck84,,[],,text,t2_k2s2efdr,False,False,False,[],False,False,1645905396,self.dating,https://www.reddit.com/r/dating/comments/t25l7z/wish_it_were_not_freezing_cold_outside/,{},t25l7z,False,True,False,False,False,True,True,False,#00a6a5,dating,"[{'e': 'text', 't': 'Support Needed'}]",fd9c03b8-a1ce-11e7-9172-0e8c9f9ecf4c,Support Needed,dark,richtext,False,False,True,1,0,False,/r/dating/comments/t25l7z/wish_it_were_not_freezing_cold_outside/,False,1645905406,1,"Someone wants to introduce me to a nice woman who (from their short description) sounds like someone I'd get on well with. This is all well and good; and I'm delighted to meet her when I get a chance;

But I wish it were not -20 celsius here so that I could ask this woman out on a walk by the river or something. 

If you live somewhere where the rivers don't freeze and the air doesn't hurt your lungs, be happy. 

That's all.",True,False,False,dating,t5_2qhb1,1161980,public,self,Wish it were not freezing cold outside.,0,[],1.0,https://www.reddit.com/r/dating/comments/t25l7z/wish_it_were_not_freezing_cold_outside/,no_ads,0.0,no_ads,0.0,,,,
68,[],False,General-Island3170,,[],,text,t2_8ivp3xw1,False,False,False,[],False,False,1645905657,self.dating,https://www.reddit.com/r/dating/comments/t25oyw/girl_wants_me_to_text_her_regarding_my_decision/,{},t25oyw,False,True,False,False,False,True,True,False,#ffd635,dating,"[{'e': 'text', 't': 'Giving Advice'}]",7bca2c58-4211-11e5-9ecb-0e60d8112001,Giving Advice,dark,richtext,False,False,True,1,0,False,/r/dating/comments/t25oyw/girl_wants_me_to_text_her_regarding_my_decision/,False,1645905668,1,"My dating question is kind of weird, but it really bothers me. So, I want to post here and ask for some help. I grow up in China and I came to US to study when I was 19. Now I worked in US. I have dated some Chinese women in the past, but only a few American girls. I didn't meet any American girls that I'm truly interested until this week. 

I went to a website called Fetlife, and I met a girl there. She was pretty 'brave', as she agreed to invite me to her house and have sex with her without even seeing me. She even told me I don't have to use a condom....  I insisted to meet first so we met on the next day. I was supposed to just talk to her for like 20-30 minutes as this was a hook-up background check for me... But I ended up finding myself very much attracted to her personality and her look. So, our first meeting turned to be more like a date. We talked a lot, obviously her life is a mess now. She told me she was addicted to alcohol and sex since pandemic. She got herself into jail because of drunk driving. She had to go to a rehabilitation group to get rid of addiction to alcohol. So, this girl is by no means someone that I would even consider to date in real life. But I got so attracted to her personality. She told me she really wanted to explore her BDSM fantasy, which is what many people have been doing on Fetlife. I told her that my life value was totally against lifestyles described in this website, and the only reason I went there was because I need sex. So, our life values are very different. Nevertheless, she seems to be interested and enjoyed our conversation. Before she left, she told me to text her to let her know if I want to be a friend, or like to date or to have sex with her. 

I knew that I should not meet her again because I think allowing myself to develop a deep feeling for someone like her is just very unhealthy. She told me she was on that website mainly because she wanted to explore BDSM fantasy, but I even naively thought I could somehow change her mind and start a vanilla relationship with her.   I am very attracted to her, so I ended up texting her 3 days later after we met.  Although she never texted me after she went to her home. 

I didn't text much, I just let her know that I wanted to move forward with dating. Surprisingly that she texted me she did not want to move forward. So, can anyone let me know what do you think of this lady, why she ended up saying she was not interested? Even though she expressed a lot of interest when we met. Any advice would be appreciated.",True,False,False,dating,t5_2qhb1,1161981,public,self,girl wants me to text her regarding my decision over the next step,0,[],1.0,https://www.reddit.com/r/dating/comments/t25oyw/girl_wants_me_to_text_her_regarding_my_decision/,no_ads,0.0,no_ads,0.0,,,,
69,[],False,jaymae26,,[],,text,t2_aduyfg7a,False,False,False,[],False,False,1645906009,self.dating,https://www.reddit.com/r/dating/comments/t25tjf/how_to_get_my_male_significant_other_to_clean_and/,{},t25tjf,False,True,False,False,False,True,True,False,#ea0027,dating,"[{'e': 'text', 't': 'I Need Advice'}]",19ec58c2-9f74-11e7-81a1-0e2bf15991f0,I Need Advice,light,richtext,False,False,True,1,0,False,/r/dating/comments/t25tjf/how_to_get_my_male_significant_other_to_clean_and/,False,1645906019,1,"20F/25M
I have lived with my boyfriend for almost 4 years. I haven’t always been the most clean individual but at some point I had to grow up. We got a new apartment in September after living with my mom for a year. 
I do all of the cleaning. All of it. He does take the trash out but sometimes will leave it for days. 
If i ever ask him to clean he might do one task but if i ask for another one, even quite simple, he will get pissed and act like he is godly for doing the first act and how dare i ask him to do something else. When he does clean something (never a lot) he is super rude about it. He doesn’t do it to be nice. He isn’t nice about it. He acts like I’m the worst girlfriend ever for making him do it 
I’m a college student full time getting all A’s and struggle immensely to keep the house clean even though i clean every day.  We split the rent and i use my savings. He does work but not full time and he just lost his job 3 days ago. 
He doesn’t clean up after himself, either. He leaves his food on the dresser next to bed every morning when he leaves for work and puts his clothes on the bathroom floor. I do literally every piece of laundry and he will not even put it away when it’s done and will sit it on the floor until it gets unfolded again and I have to refold it. His grandma lived with him all of his life and he has never had to do laundry. He cannot understand the concept of putting dishes in the dishwasher. If he cooks, (he acts like an ass while he does it most of the time) then he leaves shit EVERYWHERE. like i mean wrappers. anything he goes into the kitchen to get he leaves shit behind. he makes easy mac? he leaves the wrapper on the counter. 
I cleaned the entire house before my wisdom teeth surgery yesterday and thought he would take care of me (this includes taking care of our house)
He went to the grocery store and left groceries on the counter. The sink was full of dirty dishes and food when I woke up today. I waited to see if he would clean it and he got on his game again. 
He lost his job 3 days ago and has done nothing but play video games for 12+ hours a day, not looking for a job or anything.  ( don’t get me wrong i play video games too but i also get my shit done )
So i cleaned today. While recovering from surgery. I cannot rest while my house is disgusting. 
I am so tired of being his maid it literally sickens me at this point. If i stop cleaning it will get so bad and he won’t do anything about it and then i have punished myself because I have to clean more then. 
Someone please help me…",True,False,False,dating,t5_2qhb1,1161983,public,self,How to get my (male) significant other to clean and value cleaning?,0,[],1.0,https://www.reddit.com/r/dating/comments/t25tjf/how_to_get_my_male_significant_other_to_clean_and/,no_ads,0.0,no_ads,0.0,,True,,
70,[],False,snuty,,[],,text,t2_zimo0,False,False,False,[],False,False,1645906357,self.dating,https://www.reddit.com/r/dating/comments/t25y91/ladies_of_reddit_please_help_me_understand_what/,{},t25y91,False,True,False,False,False,True,True,False,#00a6a5,dating,"[{'e': 'text', 't': 'Support Needed'}]",fd9c03b8-a1ce-11e7-9172-0e8c9f9ecf4c,Support Needed,dark,richtext,False,False,True,1,0,False,/r/dating/comments/t25y91/ladies_of_reddit_please_help_me_understand_what/,False,1645906368,1,"I was dating this girl (25M, 25F) for two months starting in December. If it matters, **she has untreated bipolar disorder**. We met on an app, first time hanging out was at her apartment, slept together and after that we hung out basically every day for the next month and a half. We talked/texted all day every day too. We got super close, super fast, it was AMAZING. We have insane chemistry.

She would always bring up dating/being in a relationship with me but I always tried to play it cool. Until I caught legit feelings and mentioned maybe we should take this to the next level. She said she was down and ""we're already exclusive so nothing would really change."" Shortly after that she had a ""mental breakdown"" (as she calls it) and cut everyone off for a few days. She came back to me apologizing profusely... She said she realized she can't be in a relationship right now and she's extremely depressed and hung up on her ex from October. But she ""really likes me and still wants to hang out.""

This was about a month ago. Things haven't been the same, she said she wants to be friends but I can't tell if she means FWB. We both agreed the sex we had was incredible and she always talked about how attracted she is to me. We completely stopped talking but randomly she texted me last week ""I'm doing my face and it makes me think of you."" And replied to my story and texted me first again the next 2 days.

What does this mean? Any idea what she's thinking? I really don't understand what happened. The lack of understanding is really messing with my head. We had so much fun together and I could tell she was really into me and the sex was incredible. Any advice/input would help a ton, thanks.",True,False,False,dating,t5_2qhb1,1161981,public,self,"Ladies of reddit, please help me understand what happened with my ex...",0,[],1.0,https://www.reddit.com/r/dating/comments/t25y91/ladies_of_reddit_please_help_me_understand_what/,no_ads,0.0,no_ads,0.0,,,,
71,[],False,Apprehensive_Low6883,,[],,text,t2_9jxgrxzz,False,False,False,[],False,False,1645906751,self.dating,https://www.reddit.com/r/dating/comments/t2632a/am_i_being_played_here/,{},t2632a,False,True,False,False,False,True,True,False,#ea0027,dating,"[{'e': 'text', 't': 'I Need Advice'}]",19ec58c2-9f74-11e7-81a1-0e2bf15991f0,I Need Advice,light,richtext,False,False,True,1,0,False,/r/dating/comments/t2632a/am_i_being_played_here/,False,1645906761,1,"This guy I  started seeing a few weeks ago only texts me about twice between dates (we see each other once a week), despite having what feel like amazing dates where he always asks to see me soon afterwards. The texts are always very curt - ""Sure. See you then"" etc, even though I'm very chatty in mine. It usually goes two days after date til text - I text back the next day - I get a text back two days later. He genuinely isn't online very often, but I feel like if you liked someone you'd make the effort? Also it makes it feel like every date is our first, which makes me very anxious and worried. Is this a classic case of ""he's just not that into you""?",True,False,False,dating,t5_2qhb1,1161981,public,self,Am I being played here?,0,[],1.0,https://www.reddit.com/r/dating/comments/t2632a/am_i_being_played_here/,no_ads,0.0,no_ads,0.0,,,,
72,[],False,ChristieFaye,,[],,text,t2_k1jy3ra4,False,False,False,[],False,False,1645907062,self.dating,https://www.reddit.com/r/dating/comments/t2675x/connectiondating_app_for_disabled_neurodivergent/,{},t2675x,False,False,False,False,False,False,True,False,#ff4500,dating,"[{'e': 'text', 't': 'Question'}]",a9531dce-194e-11e5-b177-0eff099c3d1f,Question,light,richtext,False,False,True,1,0,False,/r/dating/comments/t2675x/connectiondating_app_for_disabled_neurodivergent/,False,1645907072,1,[removed],True,False,False,dating,t5_2qhb1,1161983,public,self,Connection/Dating App for Disabled &amp; Neurodivergent Folks!,0,[],1.0,https://www.reddit.com/r/dating/comments/t2675x/connectiondating_app_for_disabled_neurodivergent/,no_ads,0.0,no_ads,0.0,moderator,,self,"{'enabled': False, 'images': [{'id': 'I9v7r-e1GHEEhnmYJfT-fhaG0FCmHuDRa2qR6DsiPEI', 'resolutions': [{'height': 108, 'url': 'https://external-preview.redd.it/LrrStTmrvTdMQdV5aA0MmxLp5Rg7SJZw3032L_n-cSY.jpg?width=108&amp;crop=smart&amp;auto=webp&amp;s=e2511252f4a1f30c985b9c54c84d74648ee169c2', 'width': 108}, {'height': 216, 'url': 'https://external-preview.redd.it/LrrStTmrvTdMQdV5aA0MmxLp5Rg7SJZw3032L_n-cSY.jpg?width=216&amp;crop=smart&amp;auto=webp&amp;s=4f8655dee18ec8e3bb0dbaa85974785adf9123f0', 'width': 216}, {'height': 320, 'url': 'https://external-preview.redd.it/LrrStTmrvTdMQdV5aA0MmxLp5Rg7SJZw3032L_n-cSY.jpg?width=320&amp;crop=smart&amp;auto=webp&amp;s=7286ecc4500f00fe95fa60f30c61dd9284b79e19', 'width': 320}], 'source': {'height': 500, 'url': 'https://external-preview.redd.it/LrrStTmrvTdMQdV5aA0MmxLp5Rg7SJZw3032L_n-cSY.jpg?auto=webp&amp;s=33cbb6e4e184edcb7f55af4ddb974e9a858dee40', 'width': 500}, 'variants': {}}]}"
73,[],False,marvelallain,,[],,text,t2_7aadjxh7,False,False,False,[],False,False,1645907477,self.dating,https://www.reddit.com/r/dating/comments/t26ci5/im_scared_i_might_sabotage_our_relationship/,{},t26ci5,False,True,False,False,False,True,True,False,#ea0027,dating,"[{'e': 'text', 't': 'I Need Advice'}]",19ec58c2-9f74-11e7-81a1-0e2bf15991f0,I Need Advice,light,richtext,False,False,False,1,0,False,/r/dating/comments/t26ci5/im_scared_i_might_sabotage_our_relationship/,False,1645907488,1,I love my boyfriend with all my heart and he’s the first guy to ever really love me right- like all the guys I’ve dated are absolute a-holes. We have a quiet type of love and sometimes it kinda bores me. Like  I want to find mistakes just so we’d fight and we’d make up again. IDK. I’m suffering from depression and anxiety and my thoughts are too much for me sometimes. I’m scared I’ll do something stupid just to feel some “excitement” or whatever and it will ruin us. I think I just hate myself and don’t think I deserve him. Any advice?,True,False,False,dating,t5_2qhb1,1161983,public,self,I’m scared I might sabotage our relationship,0,[],1.0,https://www.reddit.com/r/dating/comments/t26ci5/im_scared_i_might_sabotage_our_relationship/,no_ads,0.0,no_ads,0.0,,,,
74,[],False,Glass-Bit3658,,[],,text,t2_jghf0b4d,False,False,False,[],False,False,1645907929,self.dating,https://www.reddit.com/r/dating/comments/t26i41/what_does_it_mean_when_a_guy_tells_you_hes_single/,{},t26i41,False,True,False,False,False,True,True,False,#ea0027,dating,"[{'e': 'text', 't': 'I Need Advice'}]",19ec58c2-9f74-11e7-81a1-0e2bf15991f0,I Need Advice,light,richtext,False,False,True,1,0,False,/r/dating/comments/t26i41/what_does_it_mean_when_a_guy_tells_you_hes_single/,False,1645907939,1,I went to get my nails done today and the Asian nail tech guy told me he was single. He just said it out of the blue he said he hasn't been in a relationship in a long time. I believe he said he used to be married and he said he doesn't want to be married again. He told me he has a condo and asked me where I worked and who I lived with etc. It was weird and I'm just wondering why he'd say he was single out of the blue.,True,False,False,dating,t5_2qhb1,1161983,public,self,What does it mean when a guy tells you he's single?,0,[],1.0,https://www.reddit.com/r/dating/comments/t26i41/what_does_it_mean_when_a_guy_tells_you_hes_single/,no_ads,0.0,no_ads,0.0,,,,
75,[],False,FantasticWrangler916,,[],,text,t2_j1m6fz1e,False,False,False,[],False,False,1645908091,self.dating,https://www.reddit.com/r/dating/comments/t26k6m/need_advice_on_my_relationship/,{},t26k6m,False,True,False,False,False,True,True,False,#ea0027,dating,"[{'e': 'text', 't': 'I Need Advice'}]",19ec58c2-9f74-11e7-81a1-0e2bf15991f0,I Need Advice,light,richtext,False,False,True,1,0,False,/r/dating/comments/t26k6m/need_advice_on_my_relationship/,False,1645908101,1,"

Hi! I’m 24F dating a 26M. We are dating for about 3-4 months. Everything seems to go really well! We would make plans to see each other 2 times a week. I met his friends multiple times. He’s so sweet and affectionate with me. Always telling me i’m beautiful and that i’m an incredible cook. Giving me cute nicknames. Opening up to me about his past. Doing my dishes and making my bed before leaving. Buying me chocolate. The sex is great (he told me) the sexual tension is still there. And i reciprocate these things, i show him that i care too. We speak on the phone almost everyday. Yesterday he texted me that we neeeded to talk. I knew it was either for the what are we talk or break up talk (which was less likely because of how he acted). Less than 2 days, ago he told me he could’nt wait to see me. He wanted to talk in person. I was going away for the week-end at my parents so i told him to call me today. He told me on the phone that he wanted to take some time alone. That he always does this when it gets serious. That something is missing. Why would he act like this if he doesn’t care about me? I really feel like we would be great togheter. I developped strong feelings for him. We agreed on still meeting up in person. (I feel like it’s his fear of rejection speaking because he lost his parents when he was young) what should i say/ask when we meet up? I feel like it’s too late :( thanks for your advice",True,False,False,dating,t5_2qhb1,1161984,public,self,Need advice on my relationship,0,[],1.0,https://www.reddit.com/r/dating/comments/t26k6m/need_advice_on_my_relationship/,no_ads,0.0,no_ads,0.0,,,,
76,[],False,sally_poinsettia,,[],,text,t2_jzeandh5,False,False,False,[],False,False,1645908162,self.dating,https://www.reddit.com/r/dating/comments/t26l19/coming_out_an_abusive_relationship/,{},t26l19,False,True,False,False,False,True,True,False,#24a0ed,,"[{'e': 'text', 't': 'Long Distance'}]",5dc9d60a-cc75-11eb-86e9-0ea78081bf43,Long Distance,dark,richtext,False,False,True,1,0,False,/r/dating/comments/t26l19/coming_out_an_abusive_relationship/,False,1645908173,1,"Needing some bit of close and empathy too, it's scary going out these days when you just got out of a really abusive relationship, it's not an easy task as it makes trusting any hard",True,False,False,dating,t5_2qhb1,1161986,public,self,Coming out an abusive relationship,0,[],1.0,https://www.reddit.com/r/dating/comments/t26l19/coming_out_an_abusive_relationship/,no_ads,0.0,no_ads,0.0,,,,
77,[],False,3twotreeme,,[],,text,t2_k41kbekx,False,False,False,[],False,False,1645908225,self.dating,https://www.reddit.com/r/dating/comments/t26lub/meeting_someone_through_instagram_need_advice/,{},t26lub,False,False,False,False,False,False,True,False,#ea0027,dating,"[{'e': 'text', 't': 'I Need Advice'}]",19ec58c2-9f74-11e7-81a1-0e2bf15991f0,I Need Advice,light,richtext,False,False,True,0,0,False,/r/dating/comments/t26lub/meeting_someone_through_instagram_need_advice/,False,1645908235,1,[removed],True,False,False,dating,t5_2qhb1,1161987,public,self,Meeting someone through instagram (Need advice),0,[],1.0,https://www.reddit.com/r/dating/comments/t26lub/meeting_someone_through_instagram_need_advice/,no_ads,0.0,no_ads,0.0,moderator,,,
78,[],False,AdmirableBobcat58,,[],,text,t2_j9oz7gol,False,False,False,[],False,False,1645908570,self.dating,https://www.reddit.com/r/dating/comments/t26q6s/meeting_someone_through_instagram_need_advice/,{},t26q6s,False,True,False,False,False,True,True,False,#ea0027,dating,"[{'e': 'text', 't': 'I Need Advice'}]",19ec58c2-9f74-11e7-81a1-0e2bf15991f0,I Need Advice,light,richtext,False,False,True,1,0,False,/r/dating/comments/t26q6s/meeting_someone_through_instagram_need_advice/,False,1645908580,1,"This is kind of a long story, im 18F senior in hs and there’s this guy I saw on Instagram awhile ago (my age) and he looked just like a celebrity crush of mine so he caught my eye (I know superficial)… I followed him, we had 20+ mutual followers and he goes to a school in my town (I go to school outside of town). Anyways we followed eachother, and I just thought he was really cute and I developed somewhat of a internet crush on him even though I hardly know him. He would post really funny edits, I saw his youtube channel, and he seemed really funny and smart . My close friend actually sits with him in a class and she said he was very sweet and nice… I added him on snapchat and wished him a happy birthday today but I don’t know how to talk to him more, I don’t want him to think i’m super weird or something… is everything i’ve done kind of weird? i feel bad about it all, and I guess I don’t really know how to get to know him further without seeming creepy or something. I think it’s semi normal for people to pursue others because of social media but I don’t know I feel weird about it. I also am super afraid of rejection :/ i’ve also never really tried pursuing someone romantically so it’s all new…",True,False,False,dating,t5_2qhb1,1161989,public,self,Meeting someone through instagram (Need advice),0,[],1.0,https://www.reddit.com/r/dating/comments/t26q6s/meeting_someone_through_instagram_need_advice/,no_ads,0.0,no_ads,0.0,,,,
79,[],False,StickyToffeePudding7,,[],,text,t2_fdiejqjh,False,False,False,[],False,False,1645908615,self.dating,https://www.reddit.com/r/dating/comments/t26qrm/meeting_amount_per_week/,{},t26qrm,False,True,False,False,False,True,True,False,#ff4500,dating,"[{'e': 'text', 't': 'Question'}]",a9531dce-194e-11e5-b177-0eff099c3d1f,Question,light,richtext,False,False,True,1,0,False,/r/dating/comments/t26qrm/meeting_amount_per_week/,False,1645908626,1,What’s a healthy number of times a week to meet someone you’re dating when you’re 31?,True,False,False,dating,t5_2qhb1,1161990,public,self,Meeting amount per week,0,[],1.0,https://www.reddit.com/r/dating/comments/t26qrm/meeting_amount_per_week/,no_ads,0.0,no_ads,0.0,,,,
