,all_awardings,allow_live_comments,author,author_flair_css_class,author_flair_richtext,author_flair_text,author_flair_type,author_fullname,author_patreon_flair,author_premium,awarders,can_mod_post,contest_mode,created_utc,domain,full_link,gildings,id,is_crosspostable,is_meta,is_original_content,is_reddit_media_domain,is_robot_indexable,is_self,is_video,link_flair_background_color,link_flair_css_class,link_flair_richtext,link_flair_template_id,link_flair_text,link_flair_text_color,link_flair_type,locked,media_only,no_follow,num_comments,num_crossposts,over_18,parent_whitelist_status,permalink,pinned,pwls,removed_by_category,retrieved_on,score,selftext,send_replies,spoiler,stickied,subreddit,subreddit_id,subreddit_subscribers,subreddit_type,thumbnail,title,total_awards_received,treatment_tags,upvote_ratio,url,whitelist_status,wls,post_hint,preview
66,[],False,rickyrudd7,,[],,text,t2_3cz3pb49,False,False,[],False,False,1620856829,self.dating,https://www.reddit.com/r/dating/comments/nb0nml/girl_24_wanted_to_break_up_with_me_27m_after/,{},nb0nml,True,False,False,False,True,True,False,,dating,"[{'e': 'text', 't': 'I Need Advice'}]",19ec58c2-9f74-11e7-81a1-0e2bf15991f0,I Need Advice,dark,richtext,False,False,True,14,0,False,all_ads,/r/dating/comments/nb0nml/girl_24_wanted_to_break_up_with_me_27m_after/,False,6,,1620856844,1,"Hello hopefully the title says it all. Long story short :

Been going out with this girl for two months. We actually have been in contact for over a year after we matched on an app. Couldn’t go out before because of covid.
Everything was doing good. Actually I was a bit too intimidated because she was moving too fast with me. I mean she started talking about important stuff like if we were in a exclusive relationship or official. Wanted to meet my family, asked me about my ideal home or if preferred to rent for now, or asked me about ideal wedding. Asked me to travel with her. Actually she booked trip ( only three days ) that we were supposed to go this week but I didn’t go because of this “fight”. She went with her mother instead.

So all the things she was telling me made me think she actually liked me a lot . Only that I wanted to go slower because she wanted to do everything too quick.

Now let’s get to the point of this thread :

Last week she told me that she couldn’t go out that all week because she was busy with work- so I said okay and gave her space. She was actually busy as she was working a lot, so nothing wrong here.

Coming Wednesday I notice something weird: she blocked me from her Instagram stories. I come to find out she went out with someone else and posted a story and wanted to hide from me.

I was mad/upset/surprised not because she went out with someone else, but because she blocked me, especially  after talking about how we started to trust each other more!

So I confronted her, didn’t say anything mean , only that I was surprised and we needed to communicate better. Her reply ? She was actually surprised that I found it out, and that it was better to leave things like this because we are two different people. Then I sent her another message, and she got back to me in the morning saying she needed time to make a correct decision, too many things on her head. Haven’t spoken since then, she is on this vacation, she restricted me from her Instagram ( but still watches my stories), and actually went out with guy one more time. What’s going on here ? She wants to leave me for good but keeping me around to see if this other guy is any good ? Or she was impulsive didn’t want confront me and wants to think about her actions ? Either way I am focusing on myself and avoiding her",True,False,False,dating,t5_2qhb1,770451,public,self,"Girl (24) wanted to break up with me (27M) after first argument, and then told me she wants time to think about “things”? What’s going on here ?",0,[],1.0,https://www.reddit.com/r/dating/comments/nb0nml/girl_24_wanted_to_break_up_with_me_27m_after/,all_ads,6,,
67,[],False,fogotmyBDAY,,[],,text,t2_buzctnrx,False,False,[],False,False,1620856910,self.dating,https://www.reddit.com/r/dating/comments/nb0oqk/i20_feel_like_im_missing_out_on_so_much_because/,{},nb0oqk,True,False,False,False,True,True,False,,dating,"[{'e': 'text', 't': 'Venting'}]",a616c322-194e-11e5-ab91-0ed1c06bdad7,Venting,dark,richtext,False,False,False,12,0,False,all_ads,/r/dating/comments/nb0oqk/i20_feel_like_im_missing_out_on_so_much_because/,False,6,,1620856922,1,"It’s just so hard to do so when every time I’ve asked a woman on a date it’s been rejected. 60% of the time is a bad rejection too. I’ve had so many private messages posted on social media, I’ve been laughed at, “ew’d”, been told “I’m out of your league”, told that I’m too ugly, just insulted, and one time a girl posted on social media a few days later about how it’s shocking when ugly guys ask you out because it means they think they can pull you. 

I don’t think I’m that bad of a guy. I’ve been told by my girl friends that they think I’d be a really good boyfriend but I just can’t get any girl to give me a chance. I don’t get matches on online dating, and as stated earlier, trying with girls I know typically leads to painful rejections.

I feel so ugly all the time. I lay up at night questioning why I’m so inept that I can’t even get a first date. I’m still a virgin, I’ve never done anything physical with anyone, and I doubt I’ll even get my first kiss before I’m 40. It’s honestly so depressing when I think about it, it makes me not want to get out of bed. I just want to go to sleep and never wake up. I just want someone to think I’m attractive.

I’m missing out on so much. Everyone around me is experiencing what it’s like to be in a relationship. Everyone is experiencing sex. Everyone gets to experience young love but me. I’ve never told anyone this but I cry about this. I just feel so awful all the time.

I don’t want to be alone for the rest of my life but I know there’s a good chance I’ll never find anyone.

I wish I had someone to talk to about this, but no one around me can relate. My guy friends are out here having threesomes and having fun and I’m the weirdo that can’t get a girl to spit in my direction. And I can’t talk to my girl friends about things like this for obvious reasons. I have no one that can relate.",True,False,False,dating,t5_2qhb1,770454,public,self,I(20) feel like I’m missing out on so much because I’m not dating young.,0,[],1.0,https://www.reddit.com/r/dating/comments/nb0oqk/i20_feel_like_im_missing_out_on_so_much_because/,all_ads,6,,
68,[],False,Apart-Improvement817,,[],,text,t2_96l34bhm,False,False,[],False,False,1620857358,self.dating,https://www.reddit.com/r/dating/comments/nb0uj9/what_do_guys_mean_when_they_say_they_arent_ready/,{},nb0uj9,True,False,False,False,True,True,False,,dating,"[{'e': 'text', 't': 'I Need Advice'}]",19ec58c2-9f74-11e7-81a1-0e2bf15991f0,I Need Advice,dark,richtext,False,False,True,10,0,False,all_ads,/r/dating/comments/nb0uj9/what_do_guys_mean_when_they_say_they_arent_ready/,False,6,,1620857370,1,"I had been meeting with an old school friend for a month. We would meet twice or thrice a week. We clearly showed interest in eachother and would casually flirt. One day on text things escalated and he indicated that he wanted to makeout with me to which i hinted that I'd be okay with that. The day we were supposed to meet i asked him that shouldn't he be asking me out on a date before kissing me. To which he said ' i don't mind considering it a date' ' i really like being with you' 'but, i don't think I'm ready for relationships' 
After which i called off our meetup by saying that since the both of us are looking for different things its better we distance ourselves. To which he replied for how long.
I am genuinely confused as to what he wants out of this? Is he looking for something sexual? Is he not ready yet does he need time. 
After this we haven't met, but have talked on and off on text. 
I really like him and i miss hanging out with him
But, i am afraid i will get emotionally attached to him.
Should i meet him up and ask him what his intentions are and what is it that he's looking for or should i just let it go? And move on?
A little background, in school we started talking in the last year and developed feelings for eachother. We mutually asked each other out for prom. 
A month before prom i asked him wether he was still up for it or not as even though we had feelings for eachother he didn't really spend much time with me.
Upon confronting him facetoface he didn't give me a reply or anything and i simply walked away.
I genuinely don't know what to do. I am really confused.
I am unable to let him go as i really enjoy his company and have been missing him alot.",True,False,False,dating,t5_2qhb1,770466,public,self,What do guys mean when they say they aren't ready for relationships.,0,[],1.0,https://www.reddit.com/r/dating/comments/nb0uj9/what_do_guys_mean_when_they_say_they_arent_ready/,all_ads,6,,
69,[],False,Okgror,,[],,text,t2_5az7v91q,False,False,[],False,False,1620857747,self.dating,https://www.reddit.com/r/dating/comments/nb0zp7/help/,{},nb0zp7,True,False,False,False,True,True,False,,dating,"[{'e': 'text', 't': 'I Need Advice'}]",19ec58c2-9f74-11e7-81a1-0e2bf15991f0,I Need Advice,dark,richtext,False,False,True,4,0,False,all_ads,/r/dating/comments/nb0zp7/help/,False,6,,1620857758,1,"First off, I don't know if this is the community to do
this, but I'll just try.

Okay, so here's my problem; I like a girl friend of
mine (from my friends group, we're all teenagers
and the group is formed by aprox 3 guys and 10
girls), but I think she's out of my range.

She's smart, understands and talks English very
fluently, she loves reading, and she's actually very
pretty. She's basically like me (except for the last
part), so I honestly think we're compatible.

But here's the thing; some months/weeks ago
discovered through other people that, if one of the
other guys in the group asked her out, she would
think and possibly say yes. This concerns me.
Luckily, that friend doesn't like her anymore.

So what's the dilemma? I don't know how to proceed.
Do l just ask her out and risk my reputation and
friendships with people on the group, do I remain
silent, do l try to give her little hints, etc.

I'm just looking for advise from more experienced
people, I've already had a couple of girlfriends but
I'm still not really ""comfortable"" in this area.

Thanks for reading this Bible from a stressed
teenager, and please respond if you think you can
help.


P.D: Yes, I'm a boy, and she's a girl, just in case I forgot to mention it",True,False,False,dating,t5_2qhb1,770474,public,self,Help!!,0,[],1.0,https://www.reddit.com/r/dating/comments/nb0zp7/help/,all_ads,6,,
70,[],False,angelgp123,,[],,text,t2_6afmno9j,False,False,[],False,False,1620857972,self.dating,https://www.reddit.com/r/dating/comments/nb12q0/any_advice_please/,{},nb12q0,True,False,False,False,True,True,False,,dating,"[{'e': 'text', 't': 'I Need Advice'}]",19ec58c2-9f74-11e7-81a1-0e2bf15991f0,I Need Advice,dark,richtext,False,False,True,5,0,False,all_ads,/r/dating/comments/nb12q0/any_advice_please/,False,6,,1620857983,1,"Me (21F) and this guy (25M) from tinder have been talking since February and we had out first date 2 and a half weeks ago (18 days) on a weekend and then I asked him to go out again the following Wednesday (14 days) to a drive in cinema because he drives and I don't &amp; I just thought it'd be cute! both dates went really well and we've continued talking since but I thought I'd wait for him to ask me out for the next one but he hasn't - I did ask if he was free 2 weekends ago (11 days) but he was busy. I decided again to stop asking, so I didn't seem so keen, and wait till he asks me to do something but he still hasn't🤔 he lives a 15 min drive away from mine so I don't see why we couldn't go for a drive / a walk one evening? 
 with covid restrictions here as well it is harder to meet up but from next week we can go out for food indoors so I'm hoping he asks me then?  - any advice appreciated :)",True,False,False,dating,t5_2qhb1,770481,public,self,Any advice please 🥺,0,[],1.0,https://www.reddit.com/r/dating/comments/nb12q0/any_advice_please/,all_ads,6,,
71,[],False,IThrewAwayThisAc,,[],,text,t2_9fjr0p26,False,False,[],False,False,1620858126,self.dating,https://www.reddit.com/r/dating/comments/nb14vx/is_there_a_way_to_get_my_first_kiss_without_a/,{},nb14vx,True,False,False,False,True,True,False,,dating,"[{'e': 'text', 't': 'Question'}]",a9531dce-194e-11e5-b177-0eff099c3d1f,Question,dark,richtext,False,False,True,5,0,False,all_ads,/r/dating/comments/nb14vx/is_there_a_way_to_get_my_first_kiss_without_a/,False,6,,1620858138,1,"I wanna get it over with. I don’t see it happening with a gf tbh lmao. I’d like it to, but I’ll take what I can get. How do I kiss a random, consenting, girl in highschool? I just wanna be able to live saying I did it once because no matter what I do, I won’t be successful in relationships. I know that because every time I feel hopeful, shit goes wrong.",True,False,False,dating,t5_2qhb1,770486,public,self,Is there a way to get my first kiss without a relationship?,0,[],1.0,https://www.reddit.com/r/dating/comments/nb14vx/is_there_a_way_to_get_my_first_kiss_without_a/,all_ads,6,,
72,[],False,throwawai66,,[],,text,t2_8dcapdt9,False,False,[],False,False,1620858301,self.dating,https://www.reddit.com/r/dating/comments/nb177p/am_i_rushing_things_too_much_extrovertedignorant/,{},nb177p,True,False,False,False,True,True,False,,dating,"[{'e': 'text', 't': 'I Need Advice'}]",19ec58c2-9f74-11e7-81a1-0e2bf15991f0,I Need Advice,dark,richtext,False,False,False,11,0,False,all_ads,/r/dating/comments/nb177p/am_i_rushing_things_too_much_extrovertedignorant/,False,6,,1620858312,1,"For context, I'm an 18 year old male. I'm an athlete, somewhat built, tall, healthy, and many people tell me I have a beautiful face and hair.
That was for context regarding my physical looks if that matters - Anyways, I'm a very extroverted guy and I like meeting lots of new people. I adapt to new circles and people pretty fast and can fit almost anywhere.

I sometimes like to approach girls when I'm out and MOSTLY like to message them over instagram, asking them to go out sometime. 99% of them reject me when it comes to going out.

Now lets talk about dating. After 2 dates max, I already settle in and ask for a relationship or make a move. I've been in 3 unsuccessful relationships. Many girls tell me ""slow down"" or ""just wait i need time to form a decision"" and the ""decision"" takes about 3 months to form, and I don't have the patience for that because I was led on in the past a lot, and I always want a normal relationship - whether that would be serious or just something fun.

I just don't have the patience for that type of bullshit - I'm a ""take it or leave it, all or nothing"" type of guy.

What am I doing wrong? I don't have the personality of a dry sponge, nor am I a ""nice guy"" (by nice guy i mean a shady dude who acts nice so he can get sex)",True,False,False,dating,t5_2qhb1,770485,public,self,Am I rushing things too much? (Extroverted/Ignorant) Need advice,0,[],1.0,https://www.reddit.com/r/dating/comments/nb177p/am_i_rushing_things_too_much_extrovertedignorant/,all_ads,6,,
73,[],False,MaryJaneMorales420,,[],,text,t2_c2xmi0i6,False,False,[],False,False,1620858881,self.dating,https://www.reddit.com/r/dating/comments/nb1f45/hello_everyone_its_such_a_good_day_to_start_nee/,{},nb1f45,False,False,False,False,False,True,False,,,"[{'e': 'text', 't': 'Tinder/Online Dating'}]",5214d2ac-61f1-11e8-8bb1-0ed15e4a39c0,Tinder/Online Dating,dark,richtext,False,False,True,0,0,False,all_ads,/r/dating/comments/nb1f45/hello_everyone_its_such_a_good_day_to_start_nee/,False,6,moderator,1620858893,1,[removed],True,False,False,dating,t5_2qhb1,770503,public,self,Hello everyone its such a good day to start nee relationships into kinky and erotic play here good at pleasures.. Kik me if interested maryjanemorales420,0,[],1.0,https://www.reddit.com/r/dating/comments/nb1f45/hello_everyone_its_such_a_good_day_to_start_nee/,all_ads,6,,
74,[],False,Typical738,,[],,text,t2_9x5wvgqg,False,False,[],False,False,1620859011,self.dating,https://www.reddit.com/r/dating/comments/nb1gwc/i_want_to_thank_all_the_lady_redditors/,{},nb1gwc,True,False,False,False,True,True,False,,dating,"[{'e': 'text', 't': 'Other'}]",fd9c03b8-a1ce-11e7-9172-0e8c9f9ecf4c,Other,dark,richtext,False,False,True,5,0,False,all_ads,/r/dating/comments/nb1gwc/i_want_to_thank_all_the_lady_redditors/,False,6,,1620859021,1,"
Who reached out to me with honesty and support

Yesterday, I asked people to just admit that they have a preference for tall hot white guys and I had several admit it that they love tall hot white guys in my DM. Much respect to each and every one of them. Honesty is a virtue.",True,False,False,dating,t5_2qhb1,770505,public,self,I want to thank all the lady redditors,0,[],1.0,https://www.reddit.com/r/dating/comments/nb1gwc/i_want_to_thank_all_the_lady_redditors/,all_ads,6,,
75,[],False,DryState9004,,[],,text,t2_anee13d2,False,False,[],False,False,1620859044,self.dating,https://www.reddit.com/r/dating/comments/nb1hci/18_m_need_some_help/,{},nb1hci,True,False,False,False,True,True,False,,dating,"[{'e': 'text', 't': 'I Need Advice'}]",19ec58c2-9f74-11e7-81a1-0e2bf15991f0,I Need Advice,dark,richtext,False,False,True,2,0,False,all_ads,/r/dating/comments/nb1hci/18_m_need_some_help/,False,6,,1620859055,1,I Just turned 18 and am about to graduate high school. It just now dawned on me that I’ve never had a girlfriend and and am a virgin. I would consider myself decently attractive and have talked to multiple girls throughout high school and never really had a problem doing so. I’m a late bloomer and never really had a true friend group only had “school friends“. I was basically a very popular loner lost somewhere in the middle between being not weird enough and not necessarily cool enough everyone would approach me in school talk to me and it’s always been  extremely easy for me to strike up conversation and make people laugh. I’m not a naturally introverted person and am only happy if I’m constantly interacting with others or doing something. However I’m starting college next year and am becoming concerned about my lack of experience and how it will effect my future dating life as well as social life. Everyone tell me that I still have time to do these things but I almost feel like I am too far behind to catch up. I don’t plan on waiting for marriage or anything like that i really just would like to get it over with TBH. I’m just so scared that If I tell a girl that I am inexperienced that she will be no longer be interested in me and I will end up getting nowhere. Does anyone have any advice as to what I should do at this point it is really stressing me out? Would I be better off just lying and trying to act more sexually experienced than I am or should I just be honest? I know that I’m only 18 and not 30 but it is becoming legitimately concerning to me especially because it seems like everyone around me is much more experienced. Any advice would be greatly appreciated as I’m not sure where else I can turn too at this point thanks,True,False,False,dating,t5_2qhb1,770505,public,self,18 M need some help,0,[],1.0,https://www.reddit.com/r/dating/comments/nb1hci/18_m_need_some_help/,all_ads,6,,
76,[],False,Porsche_Benz,,[],,text,t2_9mc6kw8q,False,False,[],False,False,1620859175,self.dating,https://www.reddit.com/r/dating/comments/nb1j1w/should_i_message_this_girl/,{},nb1j1w,True,False,False,False,True,True,False,,dating,"[{'e': 'text', 't': 'Question'}]",a9531dce-194e-11e5-b177-0eff099c3d1f,Question,dark,richtext,False,False,True,5,0,False,all_ads,/r/dating/comments/nb1j1w/should_i_message_this_girl/,False,6,,1620859186,1,"
I’m in college and a lot of the times people post group chats for different classes so a bunch of people can join them and just talk and have conversations about the class, ask for help, study together, etc.

Now class is over and there is this one girl that I find cute and want to just message and pretty much cold approach over messages since the class was all online.  

However, I don’t know if this is ideal and I feel like it could come off as creepy, weird etc. If by chance it works out I probably won’t see her until this fall when classes start up again since lots of people are going back home for the summer. 

Should I message her or just wait until fall? If I should message her what should I say or how would I approach it?",True,False,False,dating,t5_2qhb1,770506,public,self,Should I message this girl?,0,[],1.0,https://www.reddit.com/r/dating/comments/nb1j1w/should_i_message_this_girl/,all_ads,6,,
77,[],False,SublimeMelody,,[],,text,t2_8k8yggwg,False,False,[],False,False,1620859579,self.dating,https://www.reddit.com/r/dating/comments/nb1or3/i_have_to_self_improve_to_stand_a_chance/,{},nb1or3,False,False,False,False,False,True,False,,dating,"[{'e': 'text', 't': 'Venting'}]",a616c322-194e-11e5-ab91-0ed1c06bdad7,Venting,dark,richtext,False,False,True,0,0,False,all_ads,/r/dating/comments/nb1or3/i_have_to_self_improve_to_stand_a_chance/,False,6,moderator,1620859590,1,[removed],True,False,False,dating,t5_2qhb1,770513,public,self,I have to self improve to stand a chance,0,[],1.0,https://www.reddit.com/r/dating/comments/nb1or3/i_have_to_self_improve_to_stand_a_chance/,all_ads,6,,
78,[],False,ytilaerdetalupinam,,[],,text,t2_apk3j63o,False,False,[],False,False,1620859776,self.dating,https://www.reddit.com/r/dating/comments/nb1rde/something_always_comes_up/,{},nb1rde,True,False,False,False,True,True,False,,dating,"[{'e': 'text', 't': 'I Need Advice'}]",19ec58c2-9f74-11e7-81a1-0e2bf15991f0,I Need Advice,dark,richtext,False,False,True,9,0,False,all_ads,/r/dating/comments/nb1rde/something_always_comes_up/,False,6,,1620859787,1,"Hey, 

Just seeking some advice from both parties here. I matched with this girl on Bumble and we've been talking pretty extensively. It seems all good until it's time either meet or FaceTime and there's always an excuse that causes it to be delayed or rearranged. 

We started chatting last Monday and 3 of the dates I've tried setting up, something last minute came up, either 2-3 hours before. Same thing for our FaceTime which she didn't respond until after. 

Today was the same thing. I told I was coming to pick her up in 2 hours and she texts back saying she's unavailable due to something she forgot. It's a little frustrating at this point and I honestly don't know how to respond. 

Like, how do I bring up this frustration to figure out exactly what's going on?",True,False,False,dating,t5_2qhb1,770523,public,self,Something always comes up.,0,[],1.0,https://www.reddit.com/r/dating/comments/nb1rde/something_always_comes_up/,all_ads,6,,
79,[],False,n-word_checker,,[],,text,t2_4hiptd08,False,False,[],False,False,1620859788,self.dating,https://www.reddit.com/r/dating/comments/nb1rj5/texting_anxiety_with_girl_20f_i_20m_have_been/,{},nb1rj5,True,False,False,False,True,True,False,,dating,"[{'e': 'text', 't': 'I Need Advice'}]",19ec58c2-9f74-11e7-81a1-0e2bf15991f0,I Need Advice,dark,richtext,False,False,True,2,0,False,all_ads,/r/dating/comments/nb1rj5/texting_anxiety_with_girl_20f_i_20m_have_been/,False,6,,1620859798,1,"So for context I've been on 3 long dates with this girl, and one short one during finals week when we were busy.

Haven't escalated past cuddling (I wanted to make a move on our last date, but she got up after the movie so we weren't cuddling. I really regret not trying on the prior date, though).

After the short 4th date when saying goodbye, I said ""stay in touch, alright?"" and she said ""obviously"" while smiling so I'll take that as a good sign.

Now, for the past 2 months that I've been talking to her, and even now, I ALWAYS get way too excited when I get a snap from her. I'll be checking my phone pretty often to see if she has snapped me or not. When she doesn't snap me for a while, it messes with my mood until I get a snap from her. I hate it. It's not healthy. And now that college is over for a couple months, I have more time to focus on this bs lol.

I just know that there are two outcomes this summer. 

A. She still talks to me by the end of the summer, and we start from where we ended before we left college. Here I'd be pissed because I stressed this much over her not texting me for nothing (because she's interested).

B. She ends things in the summer. Here I'd also be pissed because I stressed this much just for things to be ended.

The only way I'd not be pissed is if I get over this childish shit. How can I do this? How can I make her attention not be so important to me?",True,False,False,dating,t5_2qhb1,770524,public,self,Texting anxiety with girl (20F) I (20M) have been seeing,0,[],1.0,https://www.reddit.com/r/dating/comments/nb1rj5/texting_anxiety_with_girl_20f_i_20m_have_been/,all_ads,6,,
