,all_awardings,allow_live_comments,author,author_flair_css_class,author_flair_richtext,author_flair_text,author_flair_type,author_fullname,author_is_blocked,author_patreon_flair,author_premium,awarders,can_mod_post,contest_mode,created_utc,domain,full_link,gildings,id,is_created_from_ads_ui,is_crosspostable,is_meta,is_original_content,is_reddit_media_domain,is_robot_indexable,is_self,is_video,link_flair_background_color,link_flair_css_class,link_flair_richtext,link_flair_template_id,link_flair_text,link_flair_text_color,link_flair_type,locked,media_only,no_follow,num_comments,num_crossposts,over_18,permalink,pinned,retrieved_on,score,selftext,send_replies,spoiler,stickied,subreddit,subreddit_id,subreddit_subscribers,subreddit_type,thumbnail,title,total_awards_received,treatment_tags,upvote_ratio,url,parent_whitelist_status,pwls,whitelist_status,wls,removed_by_category,author_cakeday,post_hint,preview
50,[],False,GreenAd6995,,[],,text,t2_j4vw4z2m,False,False,False,[],False,False,1645900329,self.dating,https://www.reddit.com/r/dating/comments/t23qfi/why_did_she_treat_me_like_shit/,{},t23qfi,False,True,False,False,False,True,True,False,#ff4500,dating,"[{'e': 'text', 't': 'Question'}]",a9531dce-194e-11e5-b177-0eff099c3d1f,Question,light,richtext,False,False,False,1,0,False,/r/dating/comments/t23qfi/why_did_she_treat_me_like_shit/,False,1645900339,1,"Earlier this year i met this girl at school, she just had breaked up with her ex( which is a BIG red flag in my book ) we talked a look ( we are in the same class ) one day she told me she wasnot looking for a boyfriend or anything i didnot mind, she does what she does and thats it. it is it what it is. And i respect her. So i respect her decision 200%.
Monday she get in the class with a second bag. I asked whats up with the second bag. She told me last night i went sleeping to a friend house with fucked all night. I was like alright cool for y’a what else can i say. The next 2 hour she treated me like TOTAL shit. She treated me like a TRASH 🗑.she NEVER treated me like this before.

Then the next day tuesday. Early in the morning i get a text from her( she never texted me early in the morning) « hey whatsup »

I dont get it, can someone enlighten me?

Since then i am distant, i didnot say anything ( i dont think she is worth my effort, i had sex 1-2 time while we were having a good time/ talking a lot and i NEVER treated her like trash the next day NEVER.

I want your opinion!",True,False,False,dating,t5_2qhb1,1161963,public,self,Why did she treat me like shit?,0,[],1.0,https://www.reddit.com/r/dating/comments/t23qfi/why_did_she_treat_me_like_shit/,no_ads,0.0,no_ads,0.0,,,,
51,[],False,leeclancey,,[],,text,t2_k0plor73,False,False,False,[],False,False,1645900781,self.dating,https://www.reddit.com/r/dating/comments/t23wb9/cant_go_outside_online_dating_is_dangerous_hell/,{},t23wb9,False,True,False,False,False,True,True,False,#ea0027,dating,"[{'e': 'text', 't': 'I Need Advice'}]",19ec58c2-9f74-11e7-81a1-0e2bf15991f0,I Need Advice,light,richtext,False,False,False,1,0,False,/r/dating/comments/t23wb9/cant_go_outside_online_dating_is_dangerous_hell/,False,1645900792,1,"basically i can't go outside. everyone around me is either taken or a crack addict. im not asking

for much here im not demanding a girl or boy (im bi) be absolutely thin and every way i want

em. all i want is to be loved and feel loved but im into classic shows and movies i have a passio

&amp; interest for things most people don't so that isolates me further. it feels like theres no escape

i don't what to do. i can't date online because i screw up or run into a sociopath (literally ran

into someone part of a racist organization, one was a serial killer &amp; the other was a female rapist)

like what in the hell. so online dating is out. nobody likes me around here and i can't go outside

my situation seems pretty hopeless. what the hell do i do?",True,False,False,dating,t5_2qhb1,1161966,public,self,"can't go outside, online dating is dangerous hell and nobody thinks im attractive.",0,[],1.0,https://www.reddit.com/r/dating/comments/t23wb9/cant_go_outside_online_dating_is_dangerous_hell/,no_ads,0.0,no_ads,0.0,,,,
52,[],False,MadHatter212121,,[],,text,t2_c2siweh5,False,False,False,[],False,False,1645901420,self.dating,https://www.reddit.com/r/dating/comments/t244x6/online_dating_edicate/,{},t244x6,False,True,False,False,False,True,True,False,#ea0027,dating,"[{'e': 'text', 't': 'I Need Advice'}]",19ec58c2-9f74-11e7-81a1-0e2bf15991f0,I Need Advice,light,richtext,False,False,True,1,0,False,/r/dating/comments/t244x6/online_dating_edicate/,False,1645901430,1,"I need advice, meet a woman 2 years ago on a chat and got to talking. She was married and I was just at the tail end of a divorce. We became good friends and would meet for coffee and just talk. Nothing was ever sexual or inappropriate, just coffee and conversation. We lost touch and I didn't think much about it till a week ago and thought about reaching out to her and see how life was. I've been on dating sites off and on never finding a good match, and her picture pops up and says she is divorced. So I swiped right and went about things. Then 2 days later she pops up on my Facebook page under ""people you my know."" Now here is where I need advice, I swiped right and nothing, would it be bad edicate to message her on Facebook? Or would that be OK? Any input or advice would be appreciated.",True,False,False,dating,t5_2qhb1,1161967,public,self,Online Dating edicate.,0,[],1.0,https://www.reddit.com/r/dating/comments/t244x6/online_dating_edicate/,no_ads,0.0,no_ads,0.0,,,,
53,[],False,nicks-9906_,,[],,text,t2_7solwmep,False,False,False,[],False,False,1645901443,self.dating,https://www.reddit.com/r/dating/comments/t2457i/wtf_is_wrong_with_me/,{},t2457i,False,True,False,False,False,True,True,False,#ff4500,dating,"[{'e': 'text', 't': 'Question'}]",a9531dce-194e-11e5-b177-0eff099c3d1f,Question,light,richtext,False,False,True,1,0,False,/r/dating/comments/t2457i/wtf_is_wrong_with_me/,False,1645901454,1,"I think this doesn't has a lot to do with dating but I hope my post isn't taken down. I have a GF, about a year together now, one semester left in college, almost done, great grades, got a job in my trade already, doing great too... She's so good for me, nice and good, like fresh baked bread... But I wanna leave her... I feel empty. Wtf is wrong with me? Why do I feel like this? Fuck. I finally find a good girl, she cares a lot about me but I just don't feel it. I don't feel the same... Everything is going great in my life and somehow I feel... bad?? It's hard to explain. Bought a gaming pc, I enjoyed putting it together and built my whole setup, but I barely game on it... I don't feel interest in nothing... I'm good looking, good money, good car, good everything... I feel empty...",True,False,False,dating,t5_2qhb1,1161967,public,self,WTF is wrong with me?,0,[],1.0,https://www.reddit.com/r/dating/comments/t2457i/wtf_is_wrong_with_me/,no_ads,0.0,no_ads,0.0,,,,
54,[],False,PlumthePancake,,[],,text,t2_641rm,False,False,False,[],False,False,1645901493,self.dating,https://www.reddit.com/r/dating/comments/t245v4/26m_feeling_hopeless_about_dating/,{},t245v4,False,True,False,False,False,True,True,False,#00a6a5,dating,"[{'e': 'text', 't': 'Support Needed'}]",fd9c03b8-a1ce-11e7-9172-0e8c9f9ecf4c,Support Needed,dark,richtext,False,False,False,1,0,False,/r/dating/comments/t245v4/26m_feeling_hopeless_about_dating/,False,1645901504,1,"I’ve never been in a long term relationship. Recently I had a one month thing with a girl I met on tinder and I fucked it up. This has been a part of a trend with me fucking up things with women. 

The issue is I don’t feel like what I’m doing right now is setting me up for success. Like I’m using OLD to extremely little success. I don’t have a ton of hobbies, I’m overweight. 

The good news is that I’m planning on hitting the gym more (although we’ll see how that goes) and I’m planning on going out to meetups and signing up for clubs and shit, but right now I feel pretty much like a loser. I don’t want to be alone for the rest of my life, but sometimes I feel like I will. I’ve even thought about just cold approaching women at this point although I’m too much of a coward to do it.",True,False,False,dating,t5_2qhb1,1161967,public,self,26(m) feeling hopeless about dating,0,[],1.0,https://www.reddit.com/r/dating/comments/t245v4/26m_feeling_hopeless_about_dating/,no_ads,0.0,no_ads,0.0,,,,
55,[],False,swoldierboitoldmeso,,[],,text,t2_jq43qqz1,False,False,False,[],False,False,1645901975,self.dating,https://www.reddit.com/r/dating/comments/t24c37/shout_out_to_all_the_4050somethingyearold_fit/,{},t24c37,False,True,False,False,False,True,True,False,#ffb000,,"[{'e': 'text', 't': 'Tinder/Online Dating'}]",5214d2ac-61f1-11e8-8bb1-0ed15e4a39c0,Tinder/Online Dating,dark,richtext,False,False,False,1,0,False,/r/dating/comments/t24c37/shout_out_to_all_the_4050somethingyearold_fit/,False,1645901985,1,"It hit me yesterday that I've had more dates in the past year with attractive, fit women in their late 40s and early 50s  who look a decade younger than their actual age than I have had dates with women around my own age in their 30s. For context, I'm a guy in his late 30s, I myself look younger than my actual age, I'm very fit, handsome, and all-around well put together in my career, personality, and lifestyle.

The reason why I think dates with older women happen and the ones with women around my own age do not are because older women actually show up to conversations, make the effort two-way, are very transparent about what they're looking for, and don't flake on plans. Meanwhile, women around my own age have a funny way of disappearing after a conversation that barely got off the ground after two or three days, or in the instances where you make plans to meet up, they either back out at the last minute or will even stand you up flat out.

Now, you are probably wondering: Why don't the dates with the older women work out? The reason usually comes down to being in very different places in our lives. I'm single, never married, have minimal relationship baggage, and don't have children. I still want to do enjoyable things in my free time like go see live music, see new places, and am generally seeking someone who is available on weekends to start off, where as older women have family obligations because of their children, are in different places with their careers, they're also more experienced in relationships, and they basically just want a guy to go to dinner with or watch a movie with on the odd days when the kids are at their other parent's. They are often surprised I'm still single, though, and don't get it why women around my own age keep missing me since they think I'm a big catch. 

I appreciate them giving me a shot. I wish women more in sync with where I am in life did the same.",True,False,False,dating,t5_2qhb1,1161972,public,self,Shout out to all the 40-50something-year-old fit attractive women going on dates with me while women around my age just flake/disappear all of the time,0,[],1.0,https://www.reddit.com/r/dating/comments/t24c37/shout_out_to_all_the_4050somethingyearold_fit/,no_ads,0.0,no_ads,0.0,,,,
56,[],False,Sufficient_Summer505,,[],,text,t2_haobm5et,False,False,False,[],False,False,1645902143,self.dating,https://www.reddit.com/r/dating/comments/t24erp/first_time_being_ghosted_damn_this_shit_hurts/,{},t24erp,False,False,False,False,False,False,True,False,#00a6a5,dating,"[{'e': 'text', 't': 'Support Needed'}]",fd9c03b8-a1ce-11e7-9172-0e8c9f9ecf4c,Support Needed,dark,richtext,False,False,True,0,0,False,/r/dating/comments/t24erp/first_time_being_ghosted_damn_this_shit_hurts/,False,1645902153,1,[removed],True,False,False,dating,t5_2qhb1,1161973,public,self,First time being ghosted… damn this shit hurts,0,[],1.0,https://www.reddit.com/r/dating/comments/t24erp/first_time_being_ghosted_damn_this_shit_hurts/,no_ads,0.0,no_ads,0.0,moderator,,,
57,[],False,Ironicgal,,[],,text,t2_4afmz1hp,False,False,False,[],False,False,1645902592,self.dating,https://www.reddit.com/r/dating/comments/t24kmy/why_do_guys_text_you_after_a_first_date_say_they/,{},t24kmy,False,True,False,False,False,True,True,False,#ff4500,dating,"[{'e': 'text', 't': 'Question'}]",a9531dce-194e-11e5-b177-0eff099c3d1f,Question,light,richtext,False,False,False,1,0,False,/r/dating/comments/t24kmy/why_do_guys_text_you_after_a_first_date_say_they/,False,1645902602,1,I absolutely do not get it. Why even bother to contact me if this will absolutely get to nowhere?,True,False,False,dating,t5_2qhb1,1161971,public,self,"Why do guys text you after a first date, say they have a good time but has no intentions on pursuing/continuing the relationship?",0,[],1.0,https://www.reddit.com/r/dating/comments/t24kmy/why_do_guys_text_you_after_a_first_date_say_they/,no_ads,0.0,no_ads,0.0,,,,
58,[],False,Open_Pass_3251,,[],,text,t2_d1mosmbt,False,False,False,[],False,False,1645903083,self.dating,https://www.reddit.com/r/dating/comments/t24r7y/me_and_my_gf_wanna_ask_you_about_something_guys/,{},t24r7y,False,True,False,False,False,True,True,False,#ff4500,dating,"[{'e': 'text', 't': 'Question'}]",a9531dce-194e-11e5-b177-0eff099c3d1f,Question,light,richtext,False,False,True,1,0,False,/r/dating/comments/t24r7y/me_and_my_gf_wanna_ask_you_about_something_guys/,False,1645903094,1,Does playing with the male nipples ( her touching or playing with mine)  cause cancer?? or she just trippin. Because she told me her roommate told her that yesterday. And we're confused. Any doctor who can tell me about it !!!!,True,False,False,dating,t5_2qhb1,1161973,public,self,Me and my gf wanna ask you about something guys,0,[],1.0,https://www.reddit.com/r/dating/comments/t24r7y/me_and_my_gf_wanna_ask_you_about_something_guys/,no_ads,0.0,no_ads,0.0,,,,
59,[],False,No_Upstairs_2831,,[],,text,t2_81w5f84y,False,False,False,[],False,False,1645903101,self.dating,https://www.reddit.com/r/dating/comments/t24rg3/cant_seem_to_attract_anybodys_interest_not_sure/,{},t24rg3,False,True,False,False,False,True,True,False,#ea0027,dating,"[{'e': 'text', 't': 'I Need Advice'}]",19ec58c2-9f74-11e7-81a1-0e2bf15991f0,I Need Advice,light,richtext,False,False,True,1,0,False,/r/dating/comments/t24rg3/cant_seem_to_attract_anybodys_interest_not_sure/,False,1645903111,1,"Subject really says it all, I don't ever seem to grab anybody's interest, not even if I express my own interest. I'm 34, living in the suburbs, in and out of jobs at the moment, but this has been going on since my teens. I feel like my desires are both unwanted and invisible and I'm not really sure what to do.

Most of my meeting people now is through the internet, twitter/reddit generally. I get along with lots of people but I can never seem to get the kind of interest back that I show. I'm not really looking to be on social media just to get laid, but I see other people having fun flirty conversations and I can never really get on that level. People seem to find me okay company but I just don't grab that further look.

I've tried tinder and hinge but really had no dice there either. It's not that the conversation goes badly, it doesn't even get to that point. I don't like pickup lines because I feel it's a bit gross and obvious, so I just try to start out with a conversation, a question, anything. 19 out of 20 times it's an instant unmatch. The other 1 time it doesn't tend to go anywhere. I've had one decent date through tinder in like a decade, we got to making out at one point then she ""suddenly got serious"" with someone else.

I just don't really understand what it is about me that doesn't get over. If I ask my friends they say I'm alright, clean, fairly funny, interesting thoughts. I don't think that I'm an ugly person. I just can never get a sexual/romantic interest out of people that I'm interested in, and no one that I'm not interested in (yet) has ever brought anything to my attention. I've had girlfriends but they were short things and were kind of out of the blue, I can't say that I was doing anything different.

My goal is to be able to flirt online, either over apps or on social media. I just want to be taken seriously as a sexual person. I never have been and I think it's really deeply damaged my confidence. I just don't know what to do about it. Any help or advice appreciated.

Note: as far as meeting people in person goes, I just don't have good luck with friends. I've got friends around but they are not the kind of people who hang out with others that often, so I don't actually meet new people much. Going to bars around here is a bust because everybody goes in a group and there's pretty much nothing else to do in this area where you'd naturally be in a situation to talk to new people. If there's something I haven't thought of, I'd love to know about it.",True,False,False,dating,t5_2qhb1,1161973,public,self,"Can't seem to attract anybody's interest, not sure what the issue is",0,[],1.0,https://www.reddit.com/r/dating/comments/t24rg3/cant_seem_to_attract_anybodys_interest_not_sure/,no_ads,0.0,no_ads,0.0,,,,
60,[],False,justreading55,,[],,text,t2_i0khv2w8,False,False,False,[],False,False,1645903659,self.dating,https://www.reddit.com/r/dating/comments/t24yke/my_first_date_in_years_is_tonight/,{},t24yke,False,True,False,False,False,True,True,False,#ea0027,dating,"[{'e': 'text', 't': 'I Need Advice'}]",19ec58c2-9f74-11e7-81a1-0e2bf15991f0,I Need Advice,light,richtext,False,False,True,1,0,False,/r/dating/comments/t24yke/my_first_date_in_years_is_tonight/,False,1645903669,1,"I literally haven’t been on a legit date in years, and I have one tonight with a girl I met on bumble. I’m nervous asf and I can’t help it. I hope she finds me attractive in person, and I’m afraid of the conversation being dry. 

Any tips?",True,False,False,dating,t5_2qhb1,1161975,public,self,My first date in years is tonight,0,[],1.0,https://www.reddit.com/r/dating/comments/t24yke/my_first_date_in_years_is_tonight/,no_ads,0.0,no_ads,0.0,,,,
61,[],False,Ccsabrina,,[],,text,t2_fsrqyxju,False,False,False,[],False,False,1645903755,self.dating,https://www.reddit.com/r/dating/comments/t24zru/does_he_still_like_me/,{},t24zru,False,True,False,False,False,True,True,False,#ea0027,dating,"[{'e': 'text', 't': 'I Need Advice'}]",19ec58c2-9f74-11e7-81a1-0e2bf15991f0,I Need Advice,light,richtext,False,False,True,1,0,False,/r/dating/comments/t24zru/does_he_still_like_me/,False,1645903766,1,"Hi everyone, been talking to this guy since December. We have gone on a lot of dates and recently there was a death in his family. He was kind enough to tell me how he gets which is closed off…I do check on him from time to time but also giving him his space..everything is still a little fresh. He also does text me first also from time to time. He told me he hung out with his childhood friends. I feel a little down that he has not asked me to hangout yet..maybe he doesn’t want to show vulnerability idk. Thoughts?",True,False,False,dating,t5_2qhb1,1161975,public,self,Does he still like me?,0,[],1.0,https://www.reddit.com/r/dating/comments/t24zru/does_he_still_like_me/,no_ads,0.0,no_ads,0.0,,,,
62,[],False,AlphaFury34,,[],,text,t2_cmnnbabt,False,False,False,[],False,False,1645903779,self.dating,https://www.reddit.com/r/dating/comments/t25045/should_i_make_a_move_or_is_it_too_early/,{},t25045,False,True,False,False,False,True,True,False,#ff4500,dating,"[{'e': 'text', 't': 'Question'}]",a9531dce-194e-11e5-b177-0eff099c3d1f,Question,light,richtext,False,False,True,1,0,False,/r/dating/comments/t25045/should_i_make_a_move_or_is_it_too_early/,False,1645903789,1,"so I met this girl in uni like 2 weeks ago we share a couple of classes together, it wasn't until this week that we starting chatting more and so on. We talked small chats on WhatsApp just for study reasons so I'm thinking of asking her out next week when I see her on campus . My question is 1- am I being too fast or should I wait ( 2- should I develop the relationship through social media I personally think a date is better to get to know each other ). What's your opinion on this guys?",True,False,False,dating,t5_2qhb1,1161975,public,self,Should i make a move or is it too early,0,[],1.0,https://www.reddit.com/r/dating/comments/t25045/should_i_make_a_move_or_is_it_too_early/,,,,,,,,
63,[],False,Mcawesom96,,[],,text,t2_9nwefqoz,False,False,False,[],False,False,1645903800,self.dating,https://www.reddit.com/r/dating/comments/t250d3/do_you_consider_your_so_your_best_friend/,{},t250d3,False,False,False,False,False,False,True,False,#ff4500,dating,"[{'e': 'text', 't': 'Question'}]",a9531dce-194e-11e5-b177-0eff099c3d1f,Question,light,richtext,False,False,True,1,0,False,/r/dating/comments/t250d3/do_you_consider_your_so_your_best_friend/,False,1645903810,1,[removed],True,False,False,dating,t5_2qhb1,1161975,public,self,Do you consider your SO your best friend?,0,[],1.0,https://www.reddit.com/r/dating/comments/t250d3/do_you_consider_your_so_your_best_friend/,no_ads,0.0,no_ads,0.0,moderator,,,
64,[],False,Yolayyolayyolay_,,[],,text,t2_jxk31bqw,False,False,False,[],False,False,1645904739,self.dating,https://www.reddit.com/r/dating/comments/t25cze/single_confused/,{},t25cze,False,True,False,False,False,True,True,False,#ea0027,dating,"[{'e': 'text', 't': 'I Need Advice'}]",19ec58c2-9f74-11e7-81a1-0e2bf15991f0,I Need Advice,light,richtext,False,False,True,1,0,False,/r/dating/comments/t25cze/single_confused/,False,1645904749,1,"TLDR: where are the single men? Why don’t they want to date me? And in what ways am I the problem? 

 I am 27(F) and my life’s dream has been to be a wife and a mother to a large family, but despite my desires, I have not even been in a relationship before. Not that I actively tried to be in a relationship nor did I actively avoid it but it just never lined up for me. I grew up very academically focussed so I never considered dating in my high school years. In college I went on a couple dates here and there but they never really went anywhere. There was a time that I felt almost overwhelmed with multiple options for a partner but then the pandemic hit and my potentials all quickly fizzled out and since then I have never even spoken to a man. That’s going on two years now. I tried the dating apps but aside from those seeking hook ups, I haven’t found anything of substance yet. 
Some of my girlfriends who vowed never getting married in order to pursue their careers are all getting engaged left and right around me now and it seems to me like everyone else is finding incredible relationships effortlessly which leads me to wonder more everyday; what is wrong with me?
As far as looks, I am 5’5/120lbs and average body I guess. With a masters, no debts, and trained at all the wifely duties in the book, I worked this hard so far in my life all in hopes that it leads me to becoming someone’s wife. I look forward to putting in the work to build a healthy relationship, and I happily await the highs and lows, but yet I can’t find anyone available to start this chapter of my life with. 
I have some male friendships and plenty of male colleagues but they either see me platonically and/or they are married even those in their early 20s, which I find so odd in a big city. 
Has the ship sailed for me in this department ?
Hopeless and dismayed - please help! 
Do I change my dreams or I change the plans to get there?",True,False,False,dating,t5_2qhb1,1161979,public,self,Single + confused,0,[],1.0,https://www.reddit.com/r/dating/comments/t25cze/single_confused/,no_ads,0.0,no_ads,0.0,,,,
65,[],False,throwawayy52905,,[],,text,t2_9pl1wt58,False,False,False,[],False,False,1645905177,self.dating,https://www.reddit.com/r/dating/comments/t25ii1/never_been_in_a_relationship_in_my_20s_am_i_weird/,{},t25ii1,False,False,False,False,False,False,True,False,#ea0027,dating,"[{'e': 'text', 't': 'I Need Advice'}]",19ec58c2-9f74-11e7-81a1-0e2bf15991f0,I Need Advice,light,richtext,False,False,True,0,0,False,/r/dating/comments/t25ii1/never_been_in_a_relationship_in_my_20s_am_i_weird/,False,1645905188,1,[removed],True,False,False,dating,t5_2qhb1,1161980,public,self,"Never been in a relationship in my 20’s, am I weird?",0,[],1.0,https://www.reddit.com/r/dating/comments/t25ii1/never_been_in_a_relationship_in_my_20s_am_i_weird/,no_ads,0.0,no_ads,0.0,automod_filtered,,,
