,all_awardings,allow_live_comments,author,author_flair_css_class,author_flair_richtext,author_flair_text,author_flair_type,author_fullname,author_patreon_flair,author_premium,awarders,can_mod_post,contest_mode,created_utc,domain,full_link,gildings,id,is_crosspostable,is_meta,is_original_content,is_reddit_media_domain,is_robot_indexable,is_self,is_video,link_flair_background_color,link_flair_css_class,link_flair_richtext,link_flair_template_id,link_flair_text,link_flair_text_color,link_flair_type,locked,media_only,no_follow,num_comments,num_crossposts,over_18,parent_whitelist_status,permalink,pinned,pwls,removed_by_category,retrieved_on,score,selftext,send_replies,spoiler,stickied,subreddit,subreddit_id,subreddit_subscribers,subreddit_type,thumbnail,title,total_awards_received,treatment_tags,upvote_ratio,url,whitelist_status,wls,post_hint,preview
29,[],False,Historical_Date1619,,[],,text,t2_b2fkkcy9,False,False,[],False,False,1620845792,self.dating,https://www.reddit.com/r/dating/comments/naweh9/lyrics_that_speak_to_you/,{},naweh9,True,False,False,False,True,True,False,,dating,"[{'e': 'text', 't': 'Other'}]",fd9c03b8-a1ce-11e7-9172-0e8c9f9ecf4c,Other,dark,richtext,False,False,True,3,0,False,all_ads,/r/dating/comments/naweh9/lyrics_that_speak_to_you/,False,6,,1620845803,1,"Just a random post about music and dating. In the song This isn't the End by Owl City, there's a lyric toward the end that goes: ""love is confusing and life is hard, you fight to survive because you made it this far.""

I don't know why, but it made me laugh despite being a rather melancholy phrase. Even though the song isn't at all about dating, I thought it definitely applies to myself, as well as people in this sub. If the end of physical life is the end of life after all, why not keep fighting to find someone? At the end do you want to say you gave it your best, or that you just gave up. Ultimately the outcome is indeed the same, but for me, I think I'm gonna keep fighting.",True,False,False,dating,t5_2qhb1,770173,public,self,Lyrics that speak to you,0,[],1.0,https://www.reddit.com/r/dating/comments/naweh9/lyrics_that_speak_to_you/,all_ads,6,,
30,[],False,throwra__1989,,[],,text,t2_bljmh56f,False,False,[],False,False,1620846175,self.dating,https://www.reddit.com/r/dating/comments/nawjsm/catholics_and_old/,{},nawjsm,True,False,False,False,True,True,False,,,"[{'e': 'text', 't': 'Tinder/Online Dating'}]",5214d2ac-61f1-11e8-8bb1-0ed15e4a39c0,Tinder/Online Dating,dark,richtext,False,False,True,6,0,False,all_ads,/r/dating/comments/nawjsm/catholics_and_old/,False,6,,1620846186,1,"Hey there! Catholic here, recently single and only interested in dating fellow catholics. I tried CM but most profiles are either dead or not that appealing... Despite being catholic I still care about physical attraction and a substantial amount of the people there were not nearly as active as I am (I've been into powerlifting for a decade, someone who shares my passion for fitness is a must). I downloaded Tinder but the profiles there made me believe those people were mostly into hookups, or definitely not religious. Is there any sort of middle ground?",True,False,False,dating,t5_2qhb1,770180,public,self,Catholics and OLD?,0,[],1.0,https://www.reddit.com/r/dating/comments/nawjsm/catholics_and_old/,all_ads,6,,
31,[],False,jane_212,,[],,text,t2_8to98fj8,False,False,[],False,False,1620846297,self.dating,https://www.reddit.com/r/dating/comments/nawlf5/being_overly_cautious/,{},nawlf5,True,False,False,False,True,True,False,,dating,"[{'e': 'text', 't': 'Question'}]",a9531dce-194e-11e5-b177-0eff099c3d1f,Question,dark,richtext,False,False,True,2,0,False,all_ads,/r/dating/comments/nawlf5/being_overly_cautious/,False,6,,1620846308,1,"Does EVERYONE have problems dating or even finding a friend to hang out with?? I mean what the heck? I thought one guy would be cool to hang with. We have chatted some, hung out once, just friendly talk. One day, he texts &amp; said how about I come to your house tonight &amp; we will do takeout &amp; hang out?  Now, I have only met this guy one time, talked maybe 4/5  times.  My red flag went up..shouldn't he have maybe asked?? Whatcha doing, would you like to?...maybe I'm too cautious now a days.  I had to work that weekend, so no big deal. A few days later he asked how I was, I responded a little down &amp; out over mothers day (he knows my mom has passed).  His response was, ""well I am sure you have a lot of friends to talk to, but I am here if you want to talk.  I threw it out there, so if you don't talk about it, its on you"".   REALLY?  Is that weird or are my red flags just too numerous???  Thats about the third time he has said something and I'm like...um...no...🧏‍♀️",True,False,False,dating,t5_2qhb1,770186,public,self,Being overly cautious?,0,[],1.0,https://www.reddit.com/r/dating/comments/nawlf5/being_overly_cautious/,all_ads,6,,
32,[],False,japooki,,[],,text,t2_8l0cb,False,False,[],False,False,1620846370,self.dating,https://www.reddit.com/r/dating/comments/nawmk4/is_there_a_thumb_kiss_app_available_in_2021/,{},nawmk4,True,False,False,False,True,True,False,,dating,"[{'e': 'text', 't': 'Question'}]",a9531dce-194e-11e5-b177-0eff099c3d1f,Question,dark,richtext,False,False,True,3,0,False,all_ads,/r/dating/comments/nawmk4/is_there_a_thumb_kiss_app_available_in_2021/,False,6,,1620846381,1,"I remember there being a thumb kiss app years ago, where you hold your thumb on the screen and it displays where your partner's thumb is on theirs. When you overlap it buzzes and stuff, quite cute. But I've been looking everywhere and can't find one!",True,False,False,dating,t5_2qhb1,770189,public,self,Is there a thumb kiss app available in 2021?,0,[],1.0,https://www.reddit.com/r/dating/comments/nawmk4/is_there_a_thumb_kiss_app_available_in_2021/,all_ads,6,,
33,[],False,freeneasy1,,[],,text,t2_2liyofg4,False,False,[],False,False,1620846522,self.dating,https://www.reddit.com/r/dating/comments/nawonn/texting_and_dating_am_i_thinking_too_much_or_has/,{},nawonn,True,False,False,False,True,True,False,,dating,"[{'e': 'text', 't': 'I Need Advice'}]",19ec58c2-9f74-11e7-81a1-0e2bf15991f0,I Need Advice,dark,richtext,False,False,False,2,0,False,all_ads,/r/dating/comments/nawonn/texting_and_dating_am_i_thinking_too_much_or_has/,False,6,,1620846533,1,"So I’m 22M met this 21F from uni from one of the school clubs, initially we hit it off really well and were texting a lot from early Feb till mid March, sometimes even through the night till about 4am. Could really tell we really clicked with similar interests and backgrounds/ upbringings. But the messages kind of died down as mid semester tests and end semester finals came around, and during finals it was sometimes just 1-2 texts per week. Being an introvert, I was kind of hurt and thought she was losing interest with such a drastic change in texting habits. She’s in com science and I’m a double major so we have really packed academic schedules and since I don’t stay in hostel, I’ve only had 1-2 study dates during the school term with her. Since exams ended, I did ask her out for dinner initially but she rescheduled for lunch and we had a great time a few days back, talked for three hours with almost no silence and she initiated walking about the area + dessert enthusiastically. Mustered a bit of courage at the end to ask if she wanted to go out next week and she said sure, and to arrange a time since both our internships are starting. From what I know from talking with her, I don’t think she’s the type to lead people on (she’s never had a bf before), but I’m just a little confused why the texts have become more sporadic. Should I broach the subject with her on the next date or just let it slide? Or are texts a non-indicator of interest at all because she always agrees to go out just that lengthier convos in text have kind of died since school started getting more hectic? Her actions face to face seem to show a lot of interest (comparing our first study date with lunch days ago) -eg. Some light touches and she’s always asking me to try/finish her food, offering her drink to me first",True,False,False,dating,t5_2qhb1,770194,public,self,Texting and dating - am I thinking too much? Or has she lost interest?,0,[],1.0,https://www.reddit.com/r/dating/comments/nawonn/texting_and_dating_am_i_thinking_too_much_or_has/,all_ads,6,,
34,[],False,grapesvindaloo,,[],,text,t2_9t0n1cm2,False,False,[],False,False,1620846636,self.dating,https://www.reddit.com/r/dating/comments/nawqaa/i_had_to_move_back_in_with_parents_should_i_even/,{},nawqaa,True,False,False,False,True,True,False,,dating,"[{'e': 'text', 't': 'Question'}]",a9531dce-194e-11e5-b177-0eff099c3d1f,Question,dark,richtext,False,False,False,11,0,False,all_ads,/r/dating/comments/nawqaa/i_had_to_move_back_in_with_parents_should_i_even/,False,6,,1620846648,1,"I’m just concerned this is a universally unattractive aspect at my age. Any anecdotes on the matter?

Thanks in advance.",True,False,False,dating,t5_2qhb1,770197,public,self,"I had to move back in with parents, should I even bother dating rn? (25M)",0,[],1.0,https://www.reddit.com/r/dating/comments/nawqaa/i_had_to_move_back_in_with_parents_should_i_even/,all_ads,6,,
35,[],False,RelativeFirm5796,,[],,text,t2_bp9a6vm8,False,False,[],False,False,1620847293,self.dating,https://www.reddit.com/r/dating/comments/nawzkf/love/,{},nawzkf,True,False,False,False,True,True,False,,,"[{'e': 'text', 't': 'Tinder/Online Dating'}]",5214d2ac-61f1-11e8-8bb1-0ed15e4a39c0,Tinder/Online Dating,dark,richtext,False,False,True,3,0,False,all_ads,/r/dating/comments/nawzkf/love/,False,6,,1620847305,1,"If you are not ready at the moment please don't chat me up. Don't ask for nude I offer full services bbj,gfe, anal,massage pls no drama and am clean am not here for stupid question

I’m sandra a female hooker ready for hookup",True,False,False,dating,t5_2qhb1,770216,public,self,Love,0,[],1.0,https://www.reddit.com/r/dating/comments/nawzkf/love/,all_ads,6,,
36,[],False,SentenceOk9351,,[],,text,t2_c114ibwb,False,False,[],False,False,1620847371,self.dating,https://www.reddit.com/r/dating/comments/nax0oj/testing_before_a_ons_or_fwb_relationship/,{},nax0oj,True,False,False,False,True,True,False,,,"[{'e': 'text', 't': 'Tinder/Online Dating'}]",5214d2ac-61f1-11e8-8bb1-0ed15e4a39c0,Tinder/Online Dating,dark,richtext,False,False,False,19,0,False,all_ads,/r/dating/comments/nax0oj/testing_before_a_ons_or_fwb_relationship/,False,6,,1620847383,1,Am I crazy to ask for previous tests before having sex with a ONS or FWB? Like I’ll ask people and they’ll say that they lost it or that they took one a year ago when they were in a relationship. I’ve had people say they’ll only take a test if they think they like me enough to see me again or say why do they need to. Like I literally only have protected sex and have still managed to get stis and it’s like people really don’t care if they give someone something or get something after a ONS? Like does nobody do this so I know whether I’m overthinking or are  people just that unforgiving if you want to be safe?,True,False,False,dating,t5_2qhb1,770218,public,self,Testing before a ONS or FWB relationship,0,[],1.0,https://www.reddit.com/r/dating/comments/nax0oj/testing_before_a_ons_or_fwb_relationship/,all_ads,6,,
37,[],False,Resident-Ad779,,[],,text,t2_bx0bz2c0,False,False,[],False,False,1620847399,self.dating,https://www.reddit.com/r/dating/comments/nax127/how_much_have_you_spent_on_average_in_a_month_of/,{},nax127,True,False,False,False,True,True,False,,dating,"[{'e': 'text', 't': 'Question'}]",a9531dce-194e-11e5-b177-0eff099c3d1f,Question,dark,richtext,False,False,True,8,0,False,all_ads,/r/dating/comments/nax127/how_much_have_you_spent_on_average_in_a_month_of/,False,6,,1620847410,1,"What city and how old are you?

I'm late 20's and spend on average 375$ USD in new york city. Average 6 dates. 

What about you guys?",True,False,False,dating,t5_2qhb1,770220,public,self,How much have you spent on average in a month of dating whether 1 girl or several girls?,0,[],1.0,https://www.reddit.com/r/dating/comments/nax127/how_much_have_you_spent_on_average_in_a_month_of/,all_ads,6,,
38,[],False,kurouse_mike,,[],,text,t2_bjns89ph,False,False,[],False,False,1620848317,self.dating,https://www.reddit.com/r/dating/comments/naxdur/what_should_i_do/,{},naxdur,True,False,False,False,True,True,False,,dating,"[{'e': 'text', 't': 'I Need Advice'}]",19ec58c2-9f74-11e7-81a1-0e2bf15991f0,I Need Advice,dark,richtext,False,False,False,2,0,False,all_ads,/r/dating/comments/naxdur/what_should_i_do/,False,6,,1620848328,1,"(First of all English is not my native lenguage so I'm sorry for my Bad English)

Lately I(16) have been thinking about this girl(17) that has a crush on me and it really makes me wanna date her

I'll give some context

When I was at highschool I overheard that she had a crush on me and I really didn't care at the time bcuz of my depression and social anxiety,I was constantly thinking about ""ending my suffering""

 when I was in math class, I was talking to one of my friends and I noticed her looking at me, she was looking me in my eyes and when I catched her staring she didn't turned away or something she kept staring and it made me feel a little bit uncomfortable and I looked away, then she smiled and talked to her friends. The way she stared at me made me feel like she really loved me and it melted my heart honestly. 

(I'm the stereotypical quiet guy in the class that nobody talks to, she is the social extrovert popular girl in my school that is friends with everybody, so the fact that she gave me that stare really tells me something )

When I was stretching in the gym class I caught her staring again, she gave me that seductive smile,I looked away again.

(It may sound creepy but I don't really get that creepy vibes)

I remember this time when I was crying bcuz one of my ""friends"" humiliated in front of the class (i'm really sensitive btw)and then she comforted me and told me that everything was ok, she told me it wasn't that bad, it made me feel better. Again it melted my heart again bcuz none of my friends helped me, they laughed and left me alone.

One time in the classroom she put her hands in my waist to get to the table next to me, she could've tell me to move away or just avoid the physical contact at all

there's a lot of stories like this  but I can't write them all

Idk I've been thinking about her lately should I ask her out? But Idk how, I can dm her but it might be wierd bcuz I've never texted her maybe I can wait until we go back to school but I don't think so bcuz of the covid situation atm 

I need help what do you guys think?",True,False,False,dating,t5_2qhb1,770241,public,self,What should I do?,0,[],1.0,https://www.reddit.com/r/dating/comments/naxdur/what_should_i_do/,all_ads,6,,
39,[],False,Feeling-Elderberry56,,[],,text,t2_bzfxt1vb,False,False,[],False,False,1620848606,self.dating,https://www.reddit.com/r/dating/comments/naxi0p/im_a_guy_lonely/,{},naxi0p,False,False,False,False,False,True,False,,,"[{'e': 'text', 't': 'Tinder/Online Dating'}]",5214d2ac-61f1-11e8-8bb1-0ed15e4a39c0,Tinder/Online Dating,dark,richtext,False,False,True,2,0,True,all_ads,/r/dating/comments/naxi0p/im_a_guy_lonely/,False,6,moderator,1620848617,1,[removed],True,True,False,dating,t5_2qhb1,770245,public,nsfw,I’m a guy lonely,0,[],1.0,https://www.reddit.com/r/dating/comments/naxi0p/im_a_guy_lonely/,promo_adult_nsfw,3,,
40,[],False,all_teh_sandwiches,,[],,text,t2_hce2v,False,False,[],False,False,1620849297,self.dating,https://www.reddit.com/r/dating/comments/naxrp7/there_is_a_very_big_difference_between_im_sorry_i/,{},naxrp7,True,False,False,False,True,True,False,,dating,"[{'e': 'text', 't': 'Giving Advice'}]",7bca2c58-4211-11e5-9ecb-0e60d8112001,Giving Advice,dark,richtext,False,False,True,2,0,False,all_ads,/r/dating/comments/naxrp7/there_is_a_very_big_difference_between_im_sorry_i/,False,6,,1620849308,1,"Everyone can get shitty when they have a fight with a partner. When it comes to making up and fixing things afterwards, though, there is a big difference between saying ""I'm sorry I/my actions hurt you"" and ""I'm sorry if you were hurt.""

The first sentence is active- it takes accountability for one's own actions, acknowledges how their partner might be feeling because of them, and demonstrates regret, along with an unspoken commitment to be better moving forward. The second sentence is passive- it shifts the blame to the other person for their feelings and does not take accountability.

Its a subtle difference, but one that is significant when you've started to invest in a person or a relationship. Its also a very easy mistake to make yourself, and one that, if corrected, will help your partner feel seen and respected after an argument.",True,False,False,dating,t5_2qhb1,770278,public,self,"There is a very big difference between ""I'm sorry I hurt you"" and ""I'm sorry if you were hurt.""",0,[],1.0,https://www.reddit.com/r/dating/comments/naxrp7/there_is_a_very_big_difference_between_im_sorry_i/,all_ads,6,,
41,[],False,kurouse_mike,,[],,text,t2_bjns89ph,False,False,[],False,False,1620849409,self.dating,https://www.reddit.com/r/dating/comments/naxtay/how_should_i_ask_her_out/,{},naxtay,True,False,False,False,True,True,False,,dating,"[{'e': 'text', 't': 'I Need Advice'}]",19ec58c2-9f74-11e7-81a1-0e2bf15991f0,I Need Advice,dark,richtext,False,False,True,8,0,False,all_ads,/r/dating/comments/naxtay/how_should_i_ask_her_out/,False,6,,1620849420,1,"(First of all English is not my native lenguage so I'm sorry for my Bad English)

Lately I(16) have been thinking about this girl(17) that has a crush on me and it really makes me wanna date her

I'll give some context

When I was at highschool I overheard that she had a crush on me and I really didn't care at the time bcuz of my depression and social anxiety,I was constantly thinking about ""ending my suffering""

 when I was in math class, I was talking to one of my friends and I noticed her looking at me, she was looking me in my eyes and when I catched her staring she didn't turned away or something she kept staring and it made me feel a little bit uncomfortable and I looked away, then she smiled and talked to her friends. The way she stared at me made me feel like she really loved me and it melted my heart honestly. 

(I'm the stereotypical quiet guy in the class that nobody talks to, she is the social extrovert popular girl in my school that is friends with everybody, so the fact that she gave me that stare really tells me something )

When I was stretching in gym class I caught her staring again, she gave me that seductive smile,I looked away again.

(It may sound creepy but I don't really get that creepy vibes)

I remember this time when I was crying bcuz one of my ""friends"" humiliated in front of the class (i'm really sensitive btw)and then she comforted me and told me that everything was ok, she told me it wasn't that bad, it made me feel better. Again it melted my heart again bcuz none of my friends helped me, they laughed and left me alone.

One time in the classroom she put her hands in my waist to get to the table next to me, she could've tell me to move away or just avoid the physical contact at all

there's a lot of stories like this  but I can't write them all

Idk I've been thinking about her lately should I ask her out? But Idk how, I can dm her but it might be wierd bcuz I've never texted her maybe I can wait until we go back to school but I don't think so bcuz of the covid situation atm 

I need help what do you guys think?",True,False,False,dating,t5_2qhb1,770279,public,self,How should I ask her out?,0,[],1.0,https://www.reddit.com/r/dating/comments/naxtay/how_should_i_ask_her_out/,all_ads,6,,
42,[],False,Icy_Reference_515,,[],,text,t2_8xm9i67w,False,False,[],False,False,1620849941,self.dating,https://www.reddit.com/r/dating/comments/nay0tu/how_do_i_get_rid_of_the_misogynistic_thoughts_i/,{},nay0tu,False,False,False,False,False,True,False,,dating,"[{'e': 'text', 't': 'I Need Advice'}]",19ec58c2-9f74-11e7-81a1-0e2bf15991f0,I Need Advice,dark,richtext,False,False,True,0,0,False,all_ads,/r/dating/comments/nay0tu/how_do_i_get_rid_of_the_misogynistic_thoughts_i/,False,6,automod_filtered,1620849952,1,[removed],True,False,False,dating,t5_2qhb1,770289,public,self,How do I get rid of the misogynistic thoughts I have learned from the red pill?,0,[],1.0,https://www.reddit.com/r/dating/comments/nay0tu/how_do_i_get_rid_of_the_misogynistic_thoughts_i/,all_ads,6,,
43,[],False,nbhu2kiiq,,[],,text,t2_be9p9s5o,False,False,[],False,False,1620849989,self.dating,https://www.reddit.com/r/dating/comments/nay1hj/did_i_blow_it_here/,{},nay1hj,True,False,False,False,True,True,False,,dating,"[{'e': 'text', 't': 'Question'}]",a9531dce-194e-11e5-b177-0eff099c3d1f,Question,dark,richtext,False,False,True,10,0,False,all_ads,/r/dating/comments/nay1hj/did_i_blow_it_here/,False,6,,1620849999,1,"so, I like this girl at work, very hot, we talk sometimes and I wanted to ask her out. However, something embarassing happened to her on a conference call and I made a joke and I don't know if I screwed up. She farted on a zoom call. Here is what happened. She thought her camera and mic were off and she gets up, bends over and lets out a really big fart onto her chair. On the call were 3 girls, 4 guys including myself. Immediately, everyone is laughing. One girl said, ""Kelly, your camera and mic are on. She quickly turned her mic and camera off. I made a joke and said, ""damn, I wish I was that chair"". Everyone cracked up even more. do you think that joke was appropiate? I mean, it was sort of funny I think.",True,False,False,dating,t5_2qhb1,770291,public,self,did I blow it here,0,[],1.0,https://www.reddit.com/r/dating/comments/nay1hj/did_i_blow_it_here/,all_ads,6,,
44,[],False,MApappass,,[],,text,t2_c1z762lr,False,False,[],False,False,1620850331,self.dating,https://www.reddit.com/r/dating/comments/nay67m/most_younger_asian_americans_women_prefer_white/,{},nay67m,False,False,False,False,False,True,False,,dating,"[{'e': 'text', 't': 'Question'}]",a9531dce-194e-11e5-b177-0eff099c3d1f,Question,dark,richtext,False,False,True,2,0,False,all_ads,/r/dating/comments/nay67m/most_younger_asian_americans_women_prefer_white/,False,6,reddit,1620850342,1,[removed],True,False,False,dating,t5_2qhb1,770301,public,self,Most younger asian Americans women prefer white men,0,[],1.0,https://www.reddit.com/r/dating/comments/nay67m/most_younger_asian_americans_women_prefer_white/,all_ads,6,,
45,[],False,Pure_Salamander1952,,[],,text,t2_beqmcryc,False,False,[],False,False,1620850490,self.dating,https://www.reddit.com/r/dating/comments/nay8b8/how_do_i_ask_a_girl_out/,{},nay8b8,True,False,False,False,True,True,False,,dating,"[{'e': 'text', 't': 'Question'}]",a9531dce-194e-11e5-b177-0eff099c3d1f,Question,dark,richtext,False,False,True,5,0,False,all_ads,/r/dating/comments/nay8b8/how_do_i_ask_a_girl_out/,False,6,,1620850501,1,I just really like this girl and I don’t know how to ask her out,True,False,False,dating,t5_2qhb1,770302,public,self,How do I ask a girl out,0,[],1.0,https://www.reddit.com/r/dating/comments/nay8b8/how_do_i_ask_a_girl_out/,all_ads,6,,
46,[],False,earl891,,[],,text,t2_88iho0ny,False,False,[],False,False,1620850515,self.dating,https://www.reddit.com/r/dating/comments/nay8nr/the_outcomes_in_dating_are_bullshit_generally_lol/,{},nay8nr,True,False,False,False,True,True,False,,dating,"[{'e': 'text', 't': 'Other'}]",fd9c03b8-a1ce-11e7-9172-0e8c9f9ecf4c,Other,dark,richtext,False,False,True,6,0,False,all_ads,/r/dating/comments/nay8nr/the_outcomes_in_dating_are_bullshit_generally_lol/,False,6,,1620850526,1,"One day I’ll talk to women about “creepiness” and such. And eventually that leads to them trying to emphasize to me that I don’t realize how common rape and abusive relationships and bad guys are.

But it’s like most of the guys that have never had a girlfriend are the guys that would probably be the least likely to be aggressive or anything like that of all of them. That’s what seems tragic. You can’t call them nice guys anymore or people will get the wrong idea. But that’s probably why they’ve never had a girlfriend. They just aren’t assertive enough. And being assertive might just be a distant relative to being aggressive?",True,False,False,dating,t5_2qhb1,770303,public,self,The outcomes in dating are bullshit generally lol,0,[],1.0,https://www.reddit.com/r/dating/comments/nay8nr/the_outcomes_in_dating_are_bullshit_generally_lol/,all_ads,6,,
47,[],False,bloodyalvin0,,[],,text,t2_az6c554f,False,False,[],False,False,1620850590,self.dating,https://www.reddit.com/r/dating/comments/nay9r2/most_asian_american_girls_prefer_white_men/,{},nay9r2,True,False,False,False,True,True,False,,dating,"[{'e': 'text', 't': 'Question'}]",a9531dce-194e-11e5-b177-0eff099c3d1f,Question,dark,richtext,False,False,False,24,0,False,all_ads,/r/dating/comments/nay9r2/most_asian_american_girls_prefer_white_men/,False,6,,1620850601,1,"

I see AFWM couples in my area all the time. I think it’s the norm for asian women to have a preference white men. Especially if they grew up in the US. Many choose white men over Asian men. Does anyone else not notice that?",True,False,False,dating,t5_2qhb1,770307,public,self,Most Asian American girls prefer white men,0,[],1.0,https://www.reddit.com/r/dating/comments/nay9r2/most_asian_american_girls_prefer_white_men/,all_ads,6,,
