,all_awardings,allow_live_comments,author,author_flair_css_class,author_flair_richtext,author_flair_text,author_flair_type,author_fullname,author_is_blocked,author_patreon_flair,author_premium,awarders,can_mod_post,contest_mode,created_utc,domain,full_link,gildings,id,is_created_from_ads_ui,is_crosspostable,is_meta,is_original_content,is_reddit_media_domain,is_robot_indexable,is_self,is_video,link_flair_background_color,link_flair_css_class,link_flair_richtext,link_flair_template_id,link_flair_text,link_flair_text_color,link_flair_type,locked,media_only,no_follow,num_comments,num_crossposts,over_18,parent_whitelist_status,permalink,pinned,pwls,retrieved_on,score,selftext,send_replies,spoiler,stickied,subreddit,subreddit_id,subreddit_subscribers,subreddit_type,thumbnail,title,total_awards_received,treatment_tags,upvote_ratio,url,whitelist_status,wls,post_hint,preview,removed_by_category
0,[],False,SebastianPatel,,[],,text,t2_ncd3c7c,False,False,False,[],False,False,1630390010,self.dating,https://www.reddit.com/r/dating/comments/pf012k/does_the_naked_man_strategy_from_the_show_how_i/,{},pf012k,False,True,False,False,False,True,True,False,#ff4500,dating,"[{'e': 'text', 't': 'Question'}]",a9531dce-194e-11e5-b177-0eff099c3d1f,Question,light,richtext,False,False,False,33,0,False,all_ads,/r/dating/comments/pf012k/does_the_naked_man_strategy_from_the_show_how_i/,False,6,1630390020,1,I think the guy said it worked for him 2 out 3 times. It is of course a show but you never know LOL.,True,False,False,dating,t5_2qhb1,980913,public,self,"Does the ""naked man strategy"" from the show How I Met Your Mother work?",0,[],1.0,https://www.reddit.com/r/dating/comments/pf012k/does_the_naked_man_strategy_from_the_show_how_i/,all_ads,6,,,
1,[],False,Jose434328,,[],,text,t2_59ixttab,False,False,False,[],False,False,1630390035,self.dating,https://www.reddit.com/r/dating/comments/pf019z/3_weeks_later/,{},pf019z,False,True,False,False,False,True,True,False,#ea0027,dating,"[{'e': 'text', 't': 'I Need Advice'}]",19ec58c2-9f74-11e7-81a1-0e2bf15991f0,I Need Advice,light,richtext,False,False,False,8,0,False,all_ads,/r/dating/comments/pf019z/3_weeks_later/,False,6,1630390045,1,"I’ve been talking to this girl for about 3 weeks now. We’ve been hanging out at least 3-5 hrs for at least 3 days a week. We’ve also actually known each other for about 3 months. The first couple of days of us officially talking I asked if she did any drugs/smoked. She avoided the question and today she confessed that she smokes weed once or twice a week. 

Im not sure how I feel about the fact that she waited until now to tell me. I’m not a fan of weed etc, but if she would have been upfront, I wouldn’t have taken issue… advice?? Should I continue talking to her?? Or? 

Must be added that I really do dig this girl. She is about 5 years younger than I am, and well she even mentioned to me that she mentioned me to her mother. Not sure what to do…",True,False,False,dating,t5_2qhb1,980913,public,self,3 weeks later…,0,[],1.0,https://www.reddit.com/r/dating/comments/pf019z/3_weeks_later/,all_ads,6,,,
2,[],False,Syrup-Cheap,,[],,text,t2_8j1lwa0e,False,False,False,[],False,False,1630390663,self.dating,https://www.reddit.com/r/dating/comments/pf05wy/how_do_i_show_a_girl_that_i_fancy_her/,{},pf05wy,False,True,False,False,False,True,True,False,#ea0027,dating,"[{'e': 'text', 't': 'I Need Advice'}]",19ec58c2-9f74-11e7-81a1-0e2bf15991f0,I Need Advice,light,richtext,False,False,True,4,0,False,all_ads,/r/dating/comments/pf05wy/how_do_i_show_a_girl_that_i_fancy_her/,False,6,1630390673,1,What would be the appropriate way to show my interest to her,True,False,False,dating,t5_2qhb1,980923,public,self,How do i show a girl that i fancy her,0,[],1.0,https://www.reddit.com/r/dating/comments/pf05wy/how_do_i_show_a_girl_that_i_fancy_her/,all_ads,6,,,
3,[],False,sexualscholar1,,[],,text,t2_8qk4gqse,False,False,False,[],False,False,1630391565,self.dating,https://www.reddit.com/r/dating/comments/pf0cjs/is_the_friend_zone_actually_real/,{},pf0cjs,False,False,False,False,False,False,True,False,#ff4500,dating,"[{'e': 'text', 't': 'Question'}]",a9531dce-194e-11e5-b177-0eff099c3d1f,Question,light,richtext,False,False,True,2,0,False,all_ads,/r/dating/comments/pf0cjs/is_the_friend_zone_actually_real/,False,6,1630391577,1,[removed],True,False,False,dating,t5_2qhb1,980936,public,self,"Is the ""friend zone"" actually real?",0,[],1.0,https://www.reddit.com/r/dating/comments/pf0cjs/is_the_friend_zone_actually_real/,all_ads,6,self,"{'enabled': False, 'images': [{'id': 'EpBn-hMLXsY_N45kffivYZ5RudwHzw1vreLghdWHY4o', 'resolutions': [{'height': 56, 'url': 'https://external-preview.redd.it/bNHKrdxPgOf5Mxdt2KNDA31z6poSX8g0gq_FNciQOpE.jpg?width=108&amp;crop=smart&amp;auto=webp&amp;s=71befafff28670f86573f921a9f4dba5e226c118', 'width': 108}, {'height': 113, 'url': 'https://external-preview.redd.it/bNHKrdxPgOf5Mxdt2KNDA31z6poSX8g0gq_FNciQOpE.jpg?width=216&amp;crop=smart&amp;auto=webp&amp;s=48e4d1281973f323fddb0a61020e84553fc9706d', 'width': 216}, {'height': 167, 'url': 'https://external-preview.redd.it/bNHKrdxPgOf5Mxdt2KNDA31z6poSX8g0gq_FNciQOpE.jpg?width=320&amp;crop=smart&amp;auto=webp&amp;s=08958375025374660ee2dc7d272102b2033672b4', 'width': 320}], 'source': {'height': 314, 'url': 'https://external-preview.redd.it/bNHKrdxPgOf5Mxdt2KNDA31z6poSX8g0gq_FNciQOpE.jpg?auto=webp&amp;s=4f59480048b3d072e1d2a6fc1f438dcf06900286', 'width': 600}, 'variants': {}}]}",moderator
4,[],False,shaqcho666,,[],,text,t2_kj6mdkz,False,False,False,[],False,False,1630391605,self.dating,https://www.reddit.com/r/dating/comments/pf0cv3/desperately_need_help/,{},pf0cv3,False,True,False,False,False,True,True,False,#ea0027,dating,"[{'e': 'text', 't': 'I Need Advice'}]",19ec58c2-9f74-11e7-81a1-0e2bf15991f0,I Need Advice,light,richtext,False,False,False,2,0,False,all_ads,/r/dating/comments/pf0cv3/desperately_need_help/,False,6,1630391616,1,"Hello greeting people!

Guys this will be a bit of long text so keep reading 😊 So I (25M) found this girl(24F) from Facebook and she sent me a hi through FB and said to share an online class banner. I shared it and I started talking with her very politely. So after like three or four weeks, we get to know each other well. At this time she was having some exams and she was pretty much stressed about it because she didn't study at all and her ex. Her ex used her two times and cheated on her. So she has that regret of being used. I told her how to manage the stress and other negative emotions just to make her life better because I felt bad for her. So again to exam topic, she said to she doesn't want to come on Facebook because of the exams and said to me let's meet later when the exams are over. So I said ok and time went by.

After two weeks a friend of mine called me and said a girl was trying to find me and she was scared of me because I didn't see the text she put to me (it's because of the covid). I immediately went to messenger and found that she sent me a message yesterday and I explained why I didn't see her text. My friend told me she asked my number too and he kind of supported me to hook this girl by giving her my number. I said ok to that. So we messaged and finally, she asked by sending my number to her saying ""is this ur number? a friend of mine gave it to me when I'm trying to find you"". I said yes it's my number and we started to message through WhatsApp. 

When I'm texting with her I feel a very genuine connection because she is always eager to message fast. She is a fan of animals(especially cats) Korean music and drama and me too. She sent me love emojis and very romantic, happy kind of songs from youtube. I also did the same. So after some days, I asked her why she takes pictures on her Facebook with the backside open not the front side. She said to me her face is ugly because of her big cheeks and slim body. So it feels like she has low esteem and insecurities. When she brought that up she said to me no one likes her because of her face and people neglecting her.  She thinks she is very ugly. But she is beautiful to me! I said ur beautiful and told her things to make her happy. But she kind of thinking about her insecurities more. We connect well. I want this girl in my life. I don't care about her face. But how can I convey this to her? How should I make her think of me? I really can't think of a way to connect with her more.

PS: Unable to meet with her IRL because the country I'm living in has covid Lockdown now. I kind of have trouble with texting because I'm a newbie and very shy. I have told her that she came into my mind when listening to a song before. Her answer was"" it's really good if you thinking of me"". I think maybe she feels something towards me.",True,False,False,dating,t5_2qhb1,980937,public,self,Desperately need help,0,[],1.0,https://www.reddit.com/r/dating/comments/pf0cv3/desperately_need_help/,all_ads,6,,,
5,[],False,sexualscholar1,,[],,text,t2_8qk4gqse,False,False,False,[],False,False,1630391795,self.dating,https://www.reddit.com/r/dating/comments/pf0ebl/does_the_friend_zone_actually_exist/,{},pf0ebl,False,True,False,False,False,True,True,False,#ff4500,dating,"[{'e': 'text', 't': 'Question'}]",a9531dce-194e-11e5-b177-0eff099c3d1f,Question,light,richtext,False,False,True,28,0,False,all_ads,/r/dating/comments/pf0ebl/does_the_friend_zone_actually_exist/,False,6,1630391806,1," 

Growing up I always understood the ""friend zone"" to essentially be what happens when a woman tells a man that they are ""just friends"" which is code for ""I don't want to date you"".

But it always thought it was an odd concept because I never liked the idea of dating a stranger and never understood why other people would want to do it, or even why people would prefer it. It seemed to me that most women preferred it and I grew up believing that if you didn't ask a woman out within the first few interactions and started to become even slightly friendly that romance was automatically out of the question; many dating coaches, gurus, and pick-up artists even teach this (not suggesting that I'm particularly fond of any of those teachings). I'm not really stating what I believe here, just past experience.

So after seeing a study that found that 80 percent of relationships viewed by the study began as friendships and that blind dates, dating apps, and bars were the worst way to find relationships, I got to thinking ""does the friendzone actually exist and is starting with friendship really a bad thing?"" Of course I understand that if you're already friends for a long time and no romantic relationship has been established or romantic interest shown then that is one thing, but I'm thinking in more absolute terms. Women: are you strictly against dating men after you've met them and they haven't immediately shown romantic interest, and are you strictly against dating a friend? Is it more advantageous for men to avoid being friendly with romantic interests and/or should a man give up if a woman doesn't immediately show romantic interest after initially meeting?

I don't know because all I know is, I can't date someone I've just met. If I haven't known you for a few months at least, have had a handful of interactions, and have a decent idea of who you are, I'm not going to be interested whatsoever. Disclaimer: I (22m) have never been in a romantic relationship, so take that as you will; kinda late to not have ever had a relationship I know.",True,False,False,dating,t5_2qhb1,980940,public,self,"Does the ""friend zone"" actually exist?",0,[],1.0,https://www.reddit.com/r/dating/comments/pf0ebl/does_the_friend_zone_actually_exist/,all_ads,6,,,
6,[],False,zellyjelly25,,[],,text,t2_7ehfi7eb,False,False,False,[],False,False,1630392990,self.dating,https://www.reddit.com/r/dating/comments/pf0mso/how_do_you_handle_the_friendzone/,{},pf0mso,False,False,False,False,False,False,True,False,#ea0027,dating,"[{'e': 'text', 't': 'I Need Advice'}]",19ec58c2-9f74-11e7-81a1-0e2bf15991f0,I Need Advice,light,richtext,False,False,True,0,0,False,all_ads,/r/dating/comments/pf0mso/how_do_you_handle_the_friendzone/,False,6,1630393001,1,[removed],True,False,False,dating,t5_2qhb1,980953,public,self,How do you handle the friendzone?,0,[],1.0,https://www.reddit.com/r/dating/comments/pf0mso/how_do_you_handle_the_friendzone/,all_ads,6,,,automod_filtered
7,[],False,shzoom1,,[],,text,t2_cznroyj2,False,False,False,[],False,False,1630393332,self.dating,https://www.reddit.com/r/dating/comments/pf0pjl/who_should_pay/,{},pf0pjl,False,True,False,False,False,True,True,False,#ff4500,dating,"[{'e': 'text', 't': 'Question'}]",a9531dce-194e-11e5-b177-0eff099c3d1f,Question,light,richtext,False,False,True,78,0,False,all_ads,/r/dating/comments/pf0pjl/who_should_pay/,False,6,1630393343,1,"I have a question.  Who should pay for the date? I think it should be the person who asked the other person out for the date irrespective of gender. Its usually the guy who asks out. But if the rarity that the woman asked the guy out, should the guy still pay or should it be split or should the woman pay. This is ofcourse is a het situation. I don't think same sex couples have this problem...

Also what happens in a long term thing? Does the payment of not just dates but the other stuff that's common is also shared. Obviously all this given the fact that both of the people earn and earn in almost equal amount and that they do share the household responsibilities and its not one sided 

Want to ask this also in another but i wont be allowed to. So if anyone who is an old member of that sub can give me their opinion on what is expected I would be very much obliged.",True,False,False,dating,t5_2qhb1,980955,public,self,Who should pay,0,[],1.0,https://www.reddit.com/r/dating/comments/pf0pjl/who_should_pay/,all_ads,6,,,
8,[],False,Emotional_Mess0913,,[],,text,t2_e75feqtd,False,False,False,[],False,False,1630393580,self.dating,https://www.reddit.com/r/dating/comments/pf0r9o/i_wish_he_would_just_talk_to_me/,{},pf0r9o,False,True,False,False,False,True,True,False,#ea0027,dating,"[{'e': 'text', 't': 'I Need Advice'}]",19ec58c2-9f74-11e7-81a1-0e2bf15991f0,I Need Advice,light,richtext,False,False,False,3,0,False,all_ads,/r/dating/comments/pf0r9o/i_wish_he_would_just_talk_to_me/,False,6,1630393592,1,"I recently met the perfect guy, and he was younger than me. Me(33f) him(25m) and everything was great, until it wasn’t. He started being distant towards me, he said it was because he was scared of his strong feelings for me. I told him we should date and date other people too. I didn’t mean it, but I was on Xanax for anxiety and thought I was dying from cancer. I was a mess. I’m off the Xanax and I’m actually not dying. The tumors have shrunk. Regardless, he cut me off and I really miss him.",True,False,False,dating,t5_2qhb1,980959,public,self,I wish he would just talk to me,0,[],1.0,https://www.reddit.com/r/dating/comments/pf0r9o/i_wish_he_would_just_talk_to_me/,all_ads,6,,,
9,[],False,fjschai,,[],,text,t2_dq2v7j8j,False,False,True,[],False,False,1630393610,self.dating,https://www.reddit.com/r/dating/comments/pf0rhj/how_should_i_make_a_move/,{},pf0rhj,False,True,False,False,False,True,True,False,#ea0027,dating,"[{'e': 'text', 't': 'I Need Advice'}]",19ec58c2-9f74-11e7-81a1-0e2bf15991f0,I Need Advice,light,richtext,False,False,True,5,0,False,all_ads,/r/dating/comments/pf0rhj/how_should_i_make_a_move/,False,6,1630393621,1,"So I’m posting a lot but it’s because people are giving me polarizing advice

There’s a girl I like at my work and I think she likes me. I wanna make a move but idk how. Should I just ask for her number at the end of the day and that’s it? Should I say “we should hangout sometime” and then if she agrees go for the number? Like what should I say so she says yes but if for some reason she says no it ain’t weird? We’re both 17 btw",True,False,False,dating,t5_2qhb1,980959,public,self,How should I make a move?,0,[],1.0,https://www.reddit.com/r/dating/comments/pf0rhj/how_should_i_make_a_move/,all_ads,6,,,
10,[],False,DragonDinner22,,[],,text,t2_35yfqkqx,False,False,False,[],False,False,1630393975,self.dating,https://www.reddit.com/r/dating/comments/pf0u42/if_you_want_sex_then_act_like_it/,{},pf0u42,False,True,False,False,False,True,True,False,#ffd635,dating,"[{'e': 'text', 't': 'Giving Advice'}]",7bca2c58-4211-11e5-9ecb-0e60d8112001,Giving Advice,dark,richtext,False,False,False,2,0,False,all_ads,/r/dating/comments/pf0u42/if_you_want_sex_then_act_like_it/,False,6,1630393986,1,"I can’t stand how phoney casual relationships are these days. 


After 2 years of decent success as a pick up artist, I grew tired of the manipulative nature of the ‘game’, so one day I decided to change my approach. 


If I wanted to have sex with somebody I would just ask. That’s it. If I saw an attractive women at the bar, I would go right up and start some dirty talk. Or if I saw a hot women at the grocery store I would tell her she’s hot, if I managed to grab her number I would get straight to sending those dirty messages. 


As expected, I was met with hostility majority of the time, but that was ok. I guess we just wanted different things in life, there was no need for me to get angry about it. Respectfully part ways and try with the next.  


This was 1000x less effective than your traditional manipulative seduction bullshit hey I still managed to get a small amount of lays. I don’t even see the point of getting to know the person if all you’re going to do is screw each other. Wtf for? We’re here to screw man! And guess what these women had to say afterward? They respected it. There was no bullshit. This is how the world should be....


But everybody loves living in a fantasy. Everybody loves hearing sweet little things in their ear. Everybody loves fake. That’s the kind of world we live in. 



Even though I was getting a lot less sex (no sex at times) , a little voice inside of me felt proud. I was being authentic. I was being legit in a phoney world. Which fulfilled me more than what I was doing before. I used to be a fake Casanova who would woo his way into the pants of women. And guess what? It didn’t even make me happy. I just felt like a massive phoney. If you want sex then act like it, if you want a relationship then act like it. I rage inside when I see men picking up women at the bars, spitting all that phoney bullshit just to take them home and have sex for one night. What kind of world do we live in. We shouldn’t even be pretending to care about each other’s lives. 



If you want a relationship, then act like it. Don’t pretend to be interested in her romantically if you just want to have sex. If you really want something deeper don’t you think sex can wait??? 


I’m not saying to get on your knees and propose to her on the first date, what I’m saying is keep the aura about you. If you become what it is you are trying to attract the universe will have your back. STOP being scared and JUST BE HONEST that is how you will live a greater life and make the world a better place.",True,False,False,dating,t5_2qhb1,980965,public,self,If you want sex then act like it,0,[],1.0,https://www.reddit.com/r/dating/comments/pf0u42/if_you_want_sex_then_act_like_it/,all_ads,6,,,
11,[],False,IAmAnAnonGirl,,[],,text,t2_7xen7xtc,False,False,False,[],False,False,1630394200,self.dating,https://www.reddit.com/r/dating/comments/pf0vrn/confessed/,{},pf0vrn,False,True,False,False,False,True,True,False,#ea0027,dating,"[{'e': 'text', 't': 'I Need Advice'}]",19ec58c2-9f74-11e7-81a1-0e2bf15991f0,I Need Advice,light,richtext,False,False,True,2,0,False,all_ads,/r/dating/comments/pf0vrn/confessed/,False,6,1630394211,1,"So I finally confessed to the guy I like on vanish mode on messenger.
He never responded to that message and it’s been almost 24 hours. 
He is still messaging me though about other stuff on regular messenger just like normal so it’s throwing me off!
Not sure what to do really now cause I feel awkward ha",True,False,False,dating,t5_2qhb1,980972,public,self,Confessed,0,[],1.0,https://www.reddit.com/r/dating/comments/pf0vrn/confessed/,all_ads,6,,,
12,[],False,PipeAlternative4614,,[],,text,t2_b3dwozam,False,False,False,[],False,False,1630395127,self.dating,https://www.reddit.com/r/dating/comments/pf12du/just_a_little_encouragement_if_you_can_spare_some/,{},pf12du,False,True,False,False,False,True,True,False,#00a6a5,dating,"[{'e': 'text', 't': 'Support Needed'}]",fd9c03b8-a1ce-11e7-9172-0e8c9f9ecf4c,Support Needed,dark,richtext,False,False,False,3,0,False,all_ads,/r/dating/comments/pf12du/just_a_little_encouragement_if_you_can_spare_some/,False,6,1630395139,1,I don't know what it is about tonight but I feel absolutely defeated and I feel like I'll be alone and I will never find anyone.,True,False,False,dating,t5_2qhb1,980978,public,self,Just a little encouragement if you can spare some,0,[],1.0,https://www.reddit.com/r/dating/comments/pf12du/just_a_little_encouragement_if_you_can_spare_some/,all_ads,6,,,
13,[],False,DragonDinner22,,[],,text,t2_35yfqkqx,False,False,False,[],False,False,1630395409,self.dating,https://www.reddit.com/r/dating/comments/pf14ec/what_is_the_point_of_getting_to_know_somebody_if/,{},pf14ec,False,True,False,False,False,True,True,False,#ffd635,dating,"[{'e': 'text', 't': 'Giving Advice'}]",7bca2c58-4211-11e5-9ecb-0e60d8112001,Giving Advice,dark,richtext,False,False,True,23,0,False,all_ads,/r/dating/comments/pf14ec/what_is_the_point_of_getting_to_know_somebody_if/,False,6,1630395419,1,"I honestly think the world would be a better place if us men would stop all our manipulative bullshit when it came to trying to get laid. 


My preferred approach is as simple as this: 

I see an attractive women shopping. I go up, look her in the eye and tell her she’s hot and I want her number. After getting the woman’s number, I’m sending her dirty messages straight away. This is as authentic as it gets. I’m signalling ‘I don’t want to get to know you, I just want to fuck you’. 

Or if I see a hot woman at the bar, I’ll go up and tell her ‘ I wanna fuck you. You wanna come home with me?’ . That’s it. You don’t need to exchange life stories to have sex with each other. It’s just pointless. I think flirting is pointless to be honest.


The problem with pick up culture is that there is too much emotional investment. It relies on Jedi mind tricks to bed women. Pick up is an industry I was heavily influenced by, and after becoming disillusioned with it and awoken to the bullshit nature of this world I had a massive problem with romance in our culture. 


Us men initiate everything right. So the problem starts with us. If you want sex, ACT LIKE IT. If you want a girlfriend, ACT LIKE IT. In this phoney world we live in, I promise you that being authentic will fix all your issues. 


Imagine if men were actually honest with women. A lot of bullshit would be avoided and no women would get get her heart broken. 


In my opinion, if a man is taking the effort to get to know you he should be screening for more than just sex. If he is pretending to care about your life just to lay you, he is nothing but a gutless coward. If you really want something deeper, don’t you think sex can wait? I’m not saying whip out a wedding ring on the first date but just make sure your actions and words match your intentions.",True,False,False,dating,t5_2qhb1,980984,public,self,What is the point of getting to know somebody if all you’re going to do is have sex?,0,[],1.0,https://www.reddit.com/r/dating/comments/pf14ec/what_is_the_point_of_getting_to_know_somebody_if/,all_ads,6,,,
14,[],False,Then-Resolution9052,,[],,text,t2_7mpr5key,False,False,False,[],False,False,1630398114,self.dating,https://www.reddit.com/r/dating/comments/pf1mj5/do_girls_like_it_when_guys_approach_them/,{},pf1mj5,False,True,False,False,False,True,True,False,#ff4500,dating,"[{'e': 'text', 't': 'Question'}]",a9531dce-194e-11e5-b177-0eff099c3d1f,Question,light,richtext,False,False,True,255,0,False,all_ads,/r/dating/comments/pf1mj5/do_girls_like_it_when_guys_approach_them/,False,6,1630398125,1,"Of course, in the right context I mean. I don’t mean when guys are intrusive - just when an average guy approaches you in a social setting.",True,False,False,dating,t5_2qhb1,981026,public,self,Do girls like it when guys approach them?,0,[],1.0,https://www.reddit.com/r/dating/comments/pf1mj5/do_girls_like_it_when_guys_approach_them/,all_ads,6,,,
