,id,created_utc,title,selftext,subreddit,subreddit_id,url
80,pdf40a,1630175149,What would you do?,"So when I was young like 8 &amp; my sisters brother who was a couple years older he wrote me out a letter with a beautiful heart drawn on it asking will you go out with me? Well being embarrassed because I liked him too but I’m 8 soo I ripped it up right infront of him and broke his heart, now fast forward I lose touch with his sister and his family but surprisingly enough he found me on face book when we were both in our 20’s needless to say we both fell completely in love with each other, a year after dating I ended up pregnant and engaged.. after we had our son around 6 months later something changed his love was not there anymore or care, he cheated and left me for the Secretery at work, when he left it broke down he meant everything and in my mind stupidity I thought we had something really special from knowing him so young, my breakdown was just terrible and he would text and call me still like we were together and fuck with my head he would even come over every once in awhile to see his son and have sex and leave swearing he was coming back needless to say he was lying, then a year later he was engaged to her with a really nice ring and it made me feel like such garbage he tried to deny it and said she was just crazy and bought the ring herself yeah yeah… not long after that he left her and we started seeing each other every weekend… for about a year… then he was obligated to help his son and me with a living situation and I knew he was not mine and would never be mine why would I even still want him? He destroyed me and has been talking and lying but still I love him and He won’t let me in a way get over him because he knows if I see him or hear his voice it makes me just run back I can’t get away because We have a son… now I’m here I know he’s seeing someone else come to find out it was some girl, &amp; the ex he left me for… I don’t know what to do.. he constantly messes with my head and I can’t figure out what it is that I fell in complete love with him  it sounds so stupid when I tell someone and when I hear myself because if someone else told me my story I would tell them your an idiot get away! But it’s not as simple as that it just isn’t… why do I still love and adore and even want this man so much, also he is extremely protective of me and very very jealous he doesn’t want me but he doesn’t want me with anyone else… I just don’t know what to do anymoree",dating,t5_2qhb1,https://www.reddit.com/r/dating/comments/pdf40a/what_would_you_do/
81,pdf4lg,1630175207,anyone dating someone in an activity group?,"# 

i would think it is similar to school/ work due to regularly meet up schedule, but then again I may be wrong.

I graduated from college, i've worked a few years, took time off for myself... really didn't meet many people, so it goes without saying i didn't meet any women

anyways i am now 30, and i am thinking about joining some classes i am interested in. of course if i meet someone nice that'd be great but I am doing it mostly because i enjoy the class and i want to meet new people.

anyone who went this route and got success? activity groups could be anything like a running club, a sports league recreational, craft &amp; arts, movie night, whatever

were the people generally closed off to the idea? I generally find the people there to be much more on the older side (ironic, because i am old too!) but they likely married , either just moved to a new city and not out looking for dates/flings/relationship.

am i wrong?",dating,t5_2qhb1,https://www.reddit.com/r/dating/comments/pdf4lg/anyone_dating_someone_in_an_activity_group/
82,pdf4w2,1630175235,Am I in the wrong for not talking to a girl after we had sex?,[removed],dating,t5_2qhb1,https://www.reddit.com/r/dating/comments/pdf4w2/am_i_in_the_wrong_for_not_talking_to_a_girl_after/
83,pdf7wx,1630175515,How to talk during a date?,"Got a really casual date with this amazing girl. We’ve never met in person and have been chatting for about a month.

I’ve dated before but it’s been years.

I’m the type of person that has terrible memory, blanks out easily, and can’t think on the spot. So I’m terrified of having awkward silence and not being able to recover the convo.

Any recommendations for keeping the convo going?

I wanna avoid the terribly boiler plate “how was your day?” “Where you from “ Type questions and also yes/no questions.

I’m usually throwing jokes in to keep her laughing but making jokes with time to think through text is waaaay easier than on the spot.

Any tips for this as well?

Thanks y’all",dating,t5_2qhb1,https://www.reddit.com/r/dating/comments/pdf7wx/how_to_talk_during_a_date/
84,pdfalz,1630175772,Why do I struggle to talk to multiple girls at a time?,"I feel like a lot of people give me this advice but I just can’t get myself to do it.  I’m the type of person to obsess over one girl, which i KNOW is bad. But if I talk to multiple girls I can never fully put my energy into any one girl. Like I completely forget to text them back. By the time I engage with them, they don’t care about me anymore and have moved on.

I may just be lazy when it comes to dating. Any tips?",dating,t5_2qhb1,https://www.reddit.com/r/dating/comments/pdfalz/why_do_i_struggle_to_talk_to_multiple_girls_at_a/
85,pdfbbh,1630175838,Question about purpose.,"A lot of people say they want to date someone that has a purpose - a goal. Or I guess you could call it a life's work. This is commonly thought of as attractive. As in, just going to work and coming back isn't going to cut it unless you love what you do. 

My question is, in a small tribal setting, where the purpose or goal was shelter and food, and presumably that was enough - why is there now this supposed primal attraction to the pursuit of a special dream/calling in life?",dating,t5_2qhb1,https://www.reddit.com/r/dating/comments/pdfbbh/question_about_purpose/
86,pdfxge,1630177954,It's just disrespectful how often this happens.,"https://i.imgur.com/CQiyElg.png

I make it pretty obvious that I'm a service member too, it's not like I try to hide it.",dating,t5_2qhb1,https://www.reddit.com/r/dating/comments/pdfxge/its_just_disrespectful_how_often_this_happens/
87,pdg1bz,1630178310,IS she interested or does this sound disinterested?," I have been seeing this woman (29F) and we have been on a few dates and things seem to be going good from my POV. Before leaving town she suggested a date idea and I gladly accepted and told her to have a good time while out of town. Since leaving I have not heard anything from her it has only been 3 days and is only going to be gone for like 5 so not a huge deal, not necessarily expected because we have only known eachother for a really short amount of time. One thing I was just thinking about and noticing is that normally when I have been early in dating women and they leave town the ones who were really interested would message me not be in radio silence. So curious from a womans point of view is she interested or luke warm at best?",dating,t5_2qhb1,https://www.reddit.com/r/dating/comments/pdg1bz/is_she_interested_or_does_this_sound_disinterested/
88,pdgb54,1630179229,"In love, confused and worried","Yesterday I went out with a girl whom i've been talking to for a month and a half and I've never felt such connection to someone... We talked, laughed, had a great time. In the end it even got pretty physical since i ended up resting my head on her thighs while she was stroking my hair (i gave her lots of kisses as well (which she really liked), but we didn't have a ""real"" kiss since she's very shy)... I couldn't be more happy with how it turned out, yet today she took more than seven hours to reply back to some messages i had sent (that's the longest she'd ever taken) and i'm scared that i screwed up somewhere... Am i overthinking? Is this completely insignificant? Or is it a sign?",dating,t5_2qhb1,https://www.reddit.com/r/dating/comments/pdgb54/in_love_confused_and_worried/
89,pdgeh9,1630179549,He said I always make him feel I am better than him… what do I do with this now?,"I have been seeing this guy for a few months now and as I get to know him, I also learned about the attachment styles… he is avoidant. I try to understand him and give him more space but whenever I try to get close to him (like talk to him or ask some easy and hard questions) or let him open to me a little a bit.. I turn out to be a bad person. I am still figuring how to approach him out but sometimes I think is this worth it? He shuts me off and pulls himself away. I don't really know how we could work this out.",dating,t5_2qhb1,https://www.reddit.com/r/dating/comments/pdgeh9/he_said_i_always_make_him_feel_i_am_better_than/
90,pdgm4d,1630180287,"Not sharing my [M21] feelings, has led my girlfriend [F22] not wanting to confide in me about things","We [M21, F22] have been together for almost a year now and have always just clicked in a way where we almost know exactly when something might be wrong.

Whenever things are going smoothly and calmly in the relationship, we have these small petty arguments about things that's often caused by miscommunication. Despite having very open and honest communication, these things still happen sometimes. I've always been a very private guy when it comes to my emotions and feelings

When she goes through hardships and bad times, I am always there to show my support and cheer her up. This is anything from flowers, to supportive texts. She has always been open about her feelings, but this being my first relationship, I find it quite difficult to do. She feels that I am always there for her, but she is never there for me when I need it.

Recently, things in my personal life have taken a turn.  When I was grieving, I told her what would help me cope and she tried her best despite being busy herself. A part of me is always hesitant to come out or text her how I'm feeling during the week, because  she is usually very stressed with work and I don't want to be a burden to her with my issues.

She told me that she feels that I am not open enough with my feelings to her and this has led her to not wanting to share her own with me. She thinks that I do not want to confide in her during my time of need. When I told her that I find it hard to communicate about my feelings past the usual ""I'm good"" and ""I'm feeling meh"", and that I need help being more open about it, she told me that it's as if we are not serious and that she feels reluctant sharing her feelings with me because of it. Even when I really am feeling ""fine"" and I tell her, she suspects that there is more I'm feeling.

At times, I just don't really feel in touch with my feelings myself and despite loving her, it's hard for me to communicate it with her. This is ruining my relationship.

TL;DR: I find it difficult to express my feelings openly in my relationship. This has made my girlfriend think that I do not want to confide in her and has led her to feel reluctant about sharing her feelings with me.",dating,t5_2qhb1,https://www.reddit.com/r/dating/comments/pdgm4d/not_sharing_my_m21_feelings_has_led_my_girlfriend/
91,pdgyn6,1630181436,I think I’m catching feelings,[removed],dating,t5_2qhb1,https://www.reddit.com/r/dating/comments/pdgyn6/i_think_im_catching_feelings/
92,pdh1t9,1630181733,My baby mamas baby daddy,[removed],dating,t5_2qhb1,https://www.reddit.com/r/dating/comments/pdh1t9/my_baby_mamas_baby_daddy/
93,pdh6ht,1630182164,Is my friends BF flirting with me?? Is This Normal??,"I recently had a surgery (minor) and I'm recovering well at home and as part of the surgery ppl were checking up on me to make sure I'm doing ok. So through that he received my number and he would text me things like ""did you take your walk hun?"" And I'll be like ""yes"" and he will respond with ""good girl"" and that smirking emoji this one 😏.  He has now called me good girl three times over text and I don't know if this is how he talks?? But the only time I heard someone call me good girl over and over was my Ex during bedroom activities. He also asked for a selfie to see if I was getting better and I declined. This is weird. I obviously don't want to overreact but I would like to get ppls views. His gf is out of town for work and I don't want to disturb her rn. For what it's worth I love in the South USA and hun isn't a huge deal typically only women say it though so I'm confused and he isn't even from the south. I'm 23 my friend is 25 he is 33

Tl;Dr: confused about my friends BF texting patterns",dating,t5_2qhb1,https://www.reddit.com/r/dating/comments/pdh6ht/is_my_friends_bf_flirting_with_me_is_this_normal/
94,pdhaf8,1630182535,3 years of love is over,"I just ended a terrible date last year. I found him at 35F and met 37f. He looks very handsome. We were together for three years. One day he cheated and found another rich and rich woman. Our relationship for three years was just So broken

Hi, I’m 35F, hello, if you are here, send me a text message and look forward to hearing from you.",dating,t5_2qhb1,https://www.reddit.com/r/dating/comments/pdhaf8/3_years_of_love_is_over/
95,pdhcju,1630182728,Going on a first date - outfit questions,"Hi all, 

I am going on a first date with someone i met on my friends’ wedding.

My relationship before this (5years) was pretty abusive and my ex was always on the phone or texting me unless I was in the silent treatment periods. The guy I am texting now is not like that even a little bit. He is very busy due to work and social life (he told me, but my friend also told me), so he texts me or once a day or sometimes keeps a few days apart. He starts, because I am a bit shy and feel like maybe I would burden him. I am 29, but my ex was my first bf, so I am veeery nervous and excited. 

He lives in Germany and I live in the Netherlands. He asked me suddenly if I wanted to meet in the middle and go for dinner together. So I assume it is a date? 

Few questions on how to prepare and dress:

He is my height and I don’t mind, but would it be weird if I wear a bit heels? For me it is not a problem, but I don’t want to make him feel uncomfortable.

I was thinking of heeled boots, long skirt and a cardigan. What do you think?

Also I haven’t texted with him for 2 days now and should I text him whether he found a hotel already and that I am excited? 

So sorry for this. I am so nervous!!! 🤗🤗",dating,t5_2qhb1,https://www.reddit.com/r/dating/comments/pdhcju/going_on_a_first_date_outfit_questions/
96,pdhirz,1630183317,Men on Reddit are shit at giving dating advice,[removed],dating,t5_2qhb1,https://www.reddit.com/r/dating/comments/pdhirz/men_on_reddit_are_shit_at_giving_dating_advice/
97,pdhkjs,1630183484,I Need advice,[removed],dating,t5_2qhb1,https://www.reddit.com/r/dating/comments/pdhkjs/i_need_advice/
98,pdhnl5,1630183770,"Am I a ""nice guy""?",[removed],dating,t5_2qhb1,https://www.reddit.com/r/dating/comments/pdhnl5/am_i_a_nice_guy/
99,pdhpd5,1630183947,Going to be alone forever… tips?,[removed],dating,t5_2qhb1,https://www.reddit.com/r/dating/comments/pdhpd5/going_to_be_alone_forever_tips/
