,all_awardings,allow_live_comments,author,author_flair_css_class,author_flair_richtext,author_flair_text,author_flair_type,author_fullname,author_is_blocked,author_patreon_flair,author_premium,awarders,can_mod_post,contest_mode,created_utc,domain,full_link,gildings,id,is_created_from_ads_ui,is_crosspostable,is_meta,is_original_content,is_reddit_media_domain,is_robot_indexable,is_self,is_video,link_flair_background_color,link_flair_css_class,link_flair_richtext,link_flair_template_id,link_flair_text,link_flair_text_color,link_flair_type,locked,media_only,no_follow,num_comments,num_crossposts,over_18,parent_whitelist_status,permalink,pinned,pwls,retrieved_on,score,selftext,send_replies,spoiler,stickied,subreddit,subreddit_id,subreddit_subscribers,subreddit_type,thumbnail,title,total_awards_received,treatment_tags,upvote_ratio,url,whitelist_status,wls,post_hint,preview,removed_by_category
69,[],False,jayhbt,,[],,text,t2_8y1qwu5,False,False,False,[],False,False,1630428150,self.dating,https://www.reddit.com/r/dating/comments/pf9mtv/a_girl_sent_me_a_message_and_removed_it_before_i/,{},pf9mtv,False,True,False,False,False,True,True,False,#ea0027,dating,"[{'e': 'text', 't': 'I Need Advice'}]",19ec58c2-9f74-11e7-81a1-0e2bf15991f0,I Need Advice,light,richtext,False,False,True,2,0,False,all_ads,/r/dating/comments/pf9mtv/a_girl_sent_me_a_message_and_removed_it_before_i/,False,6,1630428161,1,"There's this girl who works at the same place as me. She's pretty cute, and I like her. Previously on Facebook, it said she was in a relationship. Now I noticed that relationship status is gone completely. Despite us working at the same place, we don't have much contact. We just say hi, and have short chats sometimes. A year or so ago, before I knew she had a thing with her soon to be bf, I was into her and may have given her small hints of interest. She may have noticed me looking at her a few times, and I went to talk with her a few times. I can't know for sure if she saw it as interest, but I did stop doing that after she announced her relationship on FB (which she did shortly after all of this). I'm thinking maybe she realized I liked her. Anyway, I started to keep my distance from her from that point.

Fast forward a year. I check my phone a Monday, and to my surprise, there are two messages from her. Then I see that the two messages have been removed by her three minutes after she sent them. So I couldn't read what she had written. They were sent in the late evening the day before I checked my phone. I had been asleep when she sent them. This was on FB Messenger btw, and we are on each other's friend lists. At first, I thought it would be best to ignore it. Then I noticed she no longer had the relationship status, and it made me curious. I sent a message asking what the messages were about, and this is what she replied: oh I just sent it to the wrong person, in the second message I wrote that I sent it to the wrong &lt;insert my name&gt; 🙈.

That was probably what happened, but I just find it so weird and coincidental. I'm the only person on her friend list with my name, out of 130 or so ppl. How did she send it to me, if she was going to send it to someone else with the same first name? Wouldn't you have to search for that persons page and then hit the message button? And how often do you message someone who isn't even on your friend list? How do you NOT notice my close-up face profile photo when sending a message?

Could she have done it on purpose for some reason? To make me click her profile and see her relationship status gone maybe? Did she write something to me, and then panic and regret it? Was she just messing with me?

She wasn't at work the next few days after that. She had called in sick. Related? Today, I met her at work again and said hi with a normal polite smile. She seemed normal and greeted me back the same. Both of us are shy, and I find it hard to approach her to talk.  I wonder if she feels the same lol.

Any thoughts?",True,False,False,dating,t5_2qhb1,981514,public,self,"A girl sent me a message and removed it before I had a chance to read it. Now I'm wondering if it was a mistake, or if she did it on purpose.",0,[],1.0,https://www.reddit.com/r/dating/comments/pf9mtv/a_girl_sent_me_a_message_and_removed_it_before_i/,all_ads,6,,,
70,[],False,DifficultyTop9993,,[],,text,t2_71avc1ab,False,False,False,[],False,False,1630428234,self.dating,https://www.reddit.com/r/dating/comments/pf9nv0/do_you_think_i_have_a_chance_with_him_or_should_i/,{},pf9nv0,False,False,False,False,False,False,True,False,#ea0027,dating,"[{'e': 'text', 't': 'I Need Advice'}]",19ec58c2-9f74-11e7-81a1-0e2bf15991f0,I Need Advice,light,richtext,False,False,True,6,0,False,all_ads,/r/dating/comments/pf9nv0/do_you_think_i_have_a_chance_with_him_or_should_i/,False,6,1630428246,1,[removed],True,False,False,dating,t5_2qhb1,981516,public,self,Do you think I have a chance with him or should I forget?,0,[],1.0,https://www.reddit.com/r/dating/comments/pf9nv0/do_you_think_i_have_a_chance_with_him_or_should_i/,all_ads,6,,,moderator
71,[],False,Muchmoss,,[],,text,t2_y3u9b83,False,False,False,[],False,False,1630428236,self.dating,https://www.reddit.com/r/dating/comments/pf9nvu/not_attracted_to_my_dates/,{},pf9nvu,False,True,False,False,False,True,True,False,#00a6a5,dating,"[{'e': 'text', 't': 'Support Needed'}]",fd9c03b8-a1ce-11e7-9172-0e8c9f9ecf4c,Support Needed,dark,richtext,False,False,True,3,0,False,all_ads,/r/dating/comments/pf9nvu/not_attracted_to_my_dates/,False,6,1630428247,1,"I'm really not interested, attracted physically or mentally to a majority of my dates that I get. It's really beginning to kill my motivation for dating. On top of that I rarely get second dates with these women, granted I wasn't interested but I still would be intrigued to go on a second date with some of them. Dating is not fun and just feels like a process, ask dull questions sit around with someone, laugh at their jokes talk about another date and just end up getting rejected.  Maybe I just feel like all my dates will end at the first one so I don't even want to have fun or get excited about them.",True,False,False,dating,t5_2qhb1,981516,public,self,Not attracted to my dates.,0,[],1.0,https://www.reddit.com/r/dating/comments/pf9nvu/not_attracted_to_my_dates/,all_ads,6,,,
72,[],False,hidefromthesun11,,[],,text,t2_7ew0cvwg,False,False,False,[],False,False,1630428365,self.dating,https://www.reddit.com/r/dating/comments/pf9pf6/my_honest_impression_of_dating_apps_and_takeaways/,{},pf9pf6,False,True,False,False,False,True,True,False,#ffb000,,"[{'e': 'text', 't': 'Tinder/Online Dating'}]",5214d2ac-61f1-11e8-8bb1-0ed15e4a39c0,Tinder/Online Dating,dark,richtext,False,False,False,11,0,False,all_ads,/r/dating/comments/pf9pf6/my_honest_impression_of_dating_apps_and_takeaways/,False,6,1630428376,1,"As a disclaimer, I live just outside of NYC, so it's not like I'm in a bad area or short of options. I'm not here to start any arguments or try to encourage sexist views of any sort. These are simply my observations. Please don't bring any negative energy

I'm an athletic, good looking PhD student who just moved to start his new program. Decided to get on Bumble recently to try and meet people I could explore the city with. Uploaded my best pictures, made sure to have a solid bio, and got swiping. After several days, I've been pretty underwhelmed

My takeaways:

- Though I've gotten a lot of good matches, hardly anyone actually messaged me (for those of you unfamiliar with Bumble, the women have to message first). I rarely extend, because the way I see it, if someone couldn't be bothered to message in a 24 hour window, they're probably not that interested (and I have no interest in playing games if the person is waiting to see whether I extend or not). On the rare occasion I did extend, it made no difference

- The messages I did get were incredibly low-effort: just ""hi"" or ""how are you""

- A lot of the profiles I've seen are really lazy. At least half of them just seem like the girls advertising their Insta page (you know the type: nothing in their profile other than their handle)

- One girl unmatched me after finding out I'm ""not American"" (I'm ethnically Middle Eastern but born and raised in the USA). Not sure why she matched me to begin with?

- While it's easy to quickly feel defeated on these apps, I think it's important to remember they're not a reflection of your quality as a person (this is true for guys and girls alike). I'm not sure how much this serves true for guys on these apps, but a lot of the girls I came across gave the impression of only being there for attention, validation, etc., and have no interest in actually meeting

- **This is especially important for guys to keep in mind on dating apps**: For those of you ""normal"" men like me, remember that most women on apps deal with a lot of awkward/creepy guys. I've heard a lot of horror stories from friends/acquaintances/dates. If a girl seems hesitant or wants to take it slow, don't take it personally

- That said, if someone seems flaky/dodgy, it's better to assume they're not interested and move on. If someone is genuinely interested, you'll know it. If you find yourself wondering if the person actually wants to go out or if they're interested, the answer is most likely ""No"". Trust your gut and don't get too hung up on one person

- While there is a lot of nonsense on these apps, there are also people who are willing to meet up with you. I've got two dates planned within the next week 

- Above all else, I think using these apps should complement your real life efforts, not replace them. I'd still rather meet someone organically, because then there's no ""hiding"" or tailoring a profile to only showcase somebody's ""greatest hits"", but having these apps, especially as someone new to the area, doesn't hurt. Just don't take them too seriously

- Last, and most importantly: love yourself and keep improving",True,False,False,dating,t5_2qhb1,981518,public,self,My honest impression of dating apps and takeaways,0,[],1.0,https://www.reddit.com/r/dating/comments/pf9pf6/my_honest_impression_of_dating_apps_and_takeaways/,all_ads,6,,,
73,[],False,eurekareelblast22,,[],,text,t2_dz27udny,False,False,False,[],False,False,1630428791,self.dating,https://www.reddit.com/r/dating/comments/pf9uga/old_friend_zone/,{},pf9uga,False,True,False,False,False,True,True,False,#ea0027,dating,"[{'e': 'text', 't': 'I Need Advice'}]",19ec58c2-9f74-11e7-81a1-0e2bf15991f0,I Need Advice,light,richtext,False,False,False,13,0,False,all_ads,/r/dating/comments/pf9uga/old_friend_zone/,False,6,1630428801,1,"Just looking for some advice here. I (22M) matched with a girl (22F) on an app and went on our first date, which was terrific. About a week after the date when I followed up I was told that she's not ready for dating right now and that she just wants to be friends. We hung out four additional times and finally I decided to ask for some clarification. I really respect what felt like honesty from her but I have noticed inadvertently that she's still getting notifications on her phone from a dating app. At this point I would rather her just tell me that she's not interested in *me*. But she's said multiple times that she's not in the right headspace to date *anyone* right now. So, my question is: am I getting duped because she's trying to be nice, or should I just take this at face value and keep going?

My secondary question is how to handle this situation going forward. We would exchange 100 messages a day but I think to sustain that I would become even more attached romantically to her than I already am, and she's still texting me quite a bit. It's a perfect match, honestly, so it's very difficult for me to deliberately not reply right away or send too many messages. What do I do here?",True,False,False,dating,t5_2qhb1,981530,public,self,OLD Friend zone?,0,[],1.0,https://www.reddit.com/r/dating/comments/pf9uga/old_friend_zone/,all_ads,6,,,
74,[],False,Dry_Baby250,,[],,text,t2_8x1a4q0m,False,False,False,[],False,False,1630429129,self.dating,https://www.reddit.com/r/dating/comments/pf9yff/is_a_two_year_age_gap_weird/,{},pf9yff,False,True,False,False,False,True,True,False,#ea0027,dating,"[{'e': 'text', 't': 'I Need Advice'}]",19ec58c2-9f74-11e7-81a1-0e2bf15991f0,I Need Advice,light,richtext,False,False,False,3,0,False,all_ads,/r/dating/comments/pf9yff/is_a_two_year_age_gap_weird/,False,6,1630429139,1,"Hi whats up y’all. Anyways, I’m a 17 yr old guy turning 18 in a few months and a few days ago I met a girl (15 going on 16 soon i think) that seemed cool and all but I think we might be in different life stages as I skipped a grade and I’m currently a college freshman while she’s still a junior in high. Anyways, I just wasn’t too sure and have been a bit freaked out, so just wanted to get opinions and see if this is something I might try to pursue or just keep it as a courteous friendship.",True,False,False,dating,t5_2qhb1,981535,public,self,Is a two year age gap weird?,0,[],1.0,https://www.reddit.com/r/dating/comments/pf9yff/is_a_two_year_age_gap_weird/,all_ads,6,,,
75,[],False,kianisthename1992,,[],,text,t2_dp7mh4aw,False,False,False,[],False,False,1630429348,self.dating,https://www.reddit.com/r/dating/comments/pfa1cu/is_it_possible_for_a_someone_to_be_truly_bad_at/,{},pfa1cu,False,True,False,False,False,True,True,False,#ea0027,dating,"[{'e': 'text', 't': 'I Need Advice'}]",19ec58c2-9f74-11e7-81a1-0e2bf15991f0,I Need Advice,light,richtext,False,False,True,30,0,False,all_ads,/r/dating/comments/pfa1cu/is_it_possible_for_a_someone_to_be_truly_bad_at/,False,6,1630429359,1,"I met this absolutely phenomenal gal ( they all are in the start aren't they ;) ? ). We vibe so well. I did notice she's not the most enthusiastic texter. Mostly I've to start the convo. But when we do meet, we have a grand time. 

I wanted to ask her out after the third time we hung out ( the first being the actual time we met ). But I was hoping for some kind of increased enthusiasm or excitement. Most of you will probably say she lost interest, but she's been this way from the start. Her texting patterns are interesting too..she replies ASAP if I ask about a plan, but takes forever if it's a general text. Kinda confusing. 

Wondering if I should just go for it? Or maybe she just isn't interested.",True,False,False,dating,t5_2qhb1,981536,public,self,Is it possible for a someone to be truly bad at texting? Most advice claims if she doesn't text back she's not interested. But I wonder if this is just a blanket statement.,0,[],1.0,https://www.reddit.com/r/dating/comments/pfa1cu/is_it_possible_for_a_someone_to_be_truly_bad_at/,all_ads,6,,,
76,[],False,superdupersecretive,,[],,text,t2_8t1q0u0m,False,False,False,[],False,False,1630429417,self.dating,https://www.reddit.com/r/dating/comments/pfa277/should_i_hangout_with_my_summer_fling/,{},pfa277,False,True,False,False,False,True,True,False,#ea0027,dating,"[{'e': 'text', 't': 'I Need Advice'}]",19ec58c2-9f74-11e7-81a1-0e2bf15991f0,I Need Advice,light,richtext,False,False,False,4,0,False,all_ads,/r/dating/comments/pfa277/should_i_hangout_with_my_summer_fling/,False,6,1630429428,1,"i’m moving across the country at the end of this week and my summer fling wants to hangout before i go just as friends. we already broke things off a week or two ago (tho didn’t really talk much about)

the thing is i got very attached to her, even tho i knew this was likely going to end (i was already looking to move away when we started seeing each other) and the last week or so i’ve been insanely heartbroken about 1) the fling ending a couple weeks before i even leave and 2) the fact that i finally met the girl of my dreams and it happens to be when i’m moving thousands of miles away. 

is it a good idea to hangout just once as friends before i leave? i generally don’t see exes again so i’m not sure what to even expect. today is the first day where i’m not totally down in the dumps of everything, but i’m worried seeing her would make me feel terrible again. the thing is she lives in the area i’ll be visiting my parents in every few months, so there’s a good chance i’ll see her again

this is probably overthinking especially with a huge life change coming this week but i just don’t know what to do or how to feel",True,False,False,dating,t5_2qhb1,981539,public,self,should i hangout with my summer fling platonically before moving away?,0,[],1.0,https://www.reddit.com/r/dating/comments/pfa277/should_i_hangout_with_my_summer_fling/,all_ads,6,,,
77,[],False,ForgotMeAccount,,[],,text,t2_8x0p7olh,False,False,False,[],False,False,1630429524,self.dating,https://www.reddit.com/r/dating/comments/pfa3fj/2_year_age_gap_weird/,{},pfa3fj,False,True,False,False,False,True,True,False,#ff4500,dating,"[{'e': 'text', 't': 'Question'}]",a9531dce-194e-11e5-b177-0eff099c3d1f,Question,light,richtext,False,False,True,9,0,False,all_ads,/r/dating/comments/pfa3fj/2_year_age_gap_weird/,False,6,1630429535,1,"
Hi whats up y’all. Anyways, I’m a 17 yr old guy turning 18 in a few months and a few days ago I met a girl (15 going on 16 soon i think) that seemed cool and all but I think we might be in different life stages as I skipped a grade and I’m currently a college freshman while she’s still a junior in high. Anyways, I just wasn’t too sure and have been a bit freaked out, so just wanted to get opinions and see if this is something I might try to pursue or just keep it as a courteous friendship.",True,False,False,dating,t5_2qhb1,981542,public,self,2 year age gap weird?,0,[],1.0,https://www.reddit.com/r/dating/comments/pfa3fj/2_year_age_gap_weird/,all_ads,6,,,
78,[],False,United_Razzmatazz_92,,[],,text,t2_e990d2lm,False,False,False,[],False,False,1630430769,self.dating,https://www.reddit.com/r/dating/comments/pfaivx/what_do_you_think/,{},pfaivx,False,False,False,False,False,False,True,False,#ff4500,dating,"[{'e': 'text', 't': 'Question'}]",a9531dce-194e-11e5-b177-0eff099c3d1f,Question,light,richtext,False,False,True,0,0,False,all_ads,/r/dating/comments/pfaivx/what_do_you_think/,False,6,1630430782,1,[removed],True,False,False,dating,t5_2qhb1,981563,public,self,What do you think.....,0,[],1.0,https://www.reddit.com/r/dating/comments/pfaivx/what_do_you_think/,all_ads,6,,,moderator
79,[],False,IllegalPhilosopher,,[],,text,t2_ck0mkb84,False,False,False,[],False,False,1630430850,self.dating,https://www.reddit.com/r/dating/comments/pfajyb/high_school_dating_advice/,{},pfajyb,False,True,False,False,False,True,True,False,#ea0027,dating,"[{'e': 'text', 't': 'I Need Advice'}]",19ec58c2-9f74-11e7-81a1-0e2bf15991f0,I Need Advice,light,richtext,False,False,True,7,0,False,all_ads,/r/dating/comments/pfajyb/high_school_dating_advice/,False,6,1630430861,1,"So I am 16, starting offline school tomorrow and it's been more than a year since I last went school, I was 14 at that time.

So back then I wasn't really interested in dating anyone but in these two years I have kinda become interested in the other sex and would like to date girls possibly have a girlfriend.

I was generally good at talking and I don't those skills have deteriorated much in the pandemic but I have no idea about how to talk to girls you are romantically interested in.

Like what do you say to a person when you are into her? How do you communicate that? 

Also how to flirt? I can do banter in general but how do it in that sexual tone?

Also any other things that I need to know about dating?

Any other advice would be helpful too",True,False,False,dating,t5_2qhb1,981565,public,self,High school dating advice,0,[],1.0,https://www.reddit.com/r/dating/comments/pfajyb/high_school_dating_advice/,all_ads,6,,,
80,[],False,tizzy20,,[],,text,t2_5q9ybefy,False,False,False,[],False,False,1630431239,self.dating,https://www.reddit.com/r/dating/comments/pfaoqs/how_do_i_stop_myself_from_getting_attracted_to_a/,{},pfaoqs,False,True,False,False,False,True,True,False,#ea0027,dating,"[{'e': 'text', 't': 'I Need Advice'}]",19ec58c2-9f74-11e7-81a1-0e2bf15991f0,I Need Advice,light,richtext,False,False,True,8,0,False,all_ads,/r/dating/comments/pfaoqs/how_do_i_stop_myself_from_getting_attracted_to_a/,False,6,1630431251,1,"I am bordering 24 and I have never had a girlfriend. I think I might be the only one from my friends who’s never had one. Idk why, but it’s like every time I’m interested in a girl, she’s either interested in someone else or is just not looking for anything, and somehow I’m always the common denominator. I’ve had maybe one or 2 girls ever show interest in me, and unfortunately for me, I just wasn’t into them. This past month I met a girl that lived right next door and we were hitting it off for a while, but ofc, she recently tells me that she’s not looking for anything, which hit me harder than usual since I was really into her and closest that u got to a girl in a really long time. So I’ve decided that I should just completely avoid girls in general, but I can’t help but feel like there will come a time where I’ll meet a chick that I’m into and the same dang thing will happen again. How do I prevent it. Should I just avoid female completely? Should I adopt a ducking attitude that’ll drive any women that I meet away immediately so that I don’t get the chance to get close to them and catch feelings? I always end up in the same position so idk what to do. How to u stop urself from getting attracted to the opposite sex when you’re heterosexual?",True,False,False,dating,t5_2qhb1,981568,public,self,How do I stop myself from getting attracted to a girl,0,[],1.0,https://www.reddit.com/r/dating/comments/pfaoqs/how_do_i_stop_myself_from_getting_attracted_to_a/,all_ads,6,,,
81,[],False,Thebigkong,,[],,text,t2_5q4roxa6,False,False,False,[],False,False,1630431318,self.dating,https://www.reddit.com/r/dating/comments/pfappj/something_i_cant_understand_m22/,{},pfappj,False,True,False,False,False,True,True,False,#ea0027,dating,"[{'e': 'text', 't': 'I Need Advice'}]",19ec58c2-9f74-11e7-81a1-0e2bf15991f0,I Need Advice,light,richtext,False,False,True,11,0,False,all_ads,/r/dating/comments/pfappj/something_i_cant_understand_m22/,False,6,1630431329,1,"I’m considering myself as an above average looking guy (at least in my county) no major flaws, but bald at young age. 

I just can’t get dates, can’t. It’s like impossible for me. I’m lucky if I get date once a year with a girl that I can feel I’m attracted to which is nothing I can work with. Every day I see at my job pepole that look less good then me, they have no special charisma but they dating girls I can only dream on. I’m not that shy person, I can be pretty confident sometimes but still 0 success. 

I don’t know if baldness is completely kill me, I don’t know what I do so wrong. Yes, I have standards that I think they are realistic for me so I don’t gonna date everyone.

when I tell my friends/family that I think the thing that prevent me to succeed is how I look like they ignore me or saying that I’m psychotic (yes, that’s happened) 

Anyway I’m not here for self pity, I wanna know how to succeed. I don’t see any other option but yet I’m finding myself in cycles of downloading dating apps, delete. Feel lonely, download again and so on. Can’t keep living like that. 

Sorry for my grammar",True,False,False,dating,t5_2qhb1,981570,public,self,Something I can’t understand M22,0,[],1.0,https://www.reddit.com/r/dating/comments/pfappj/something_i_cant_understand_m22/,all_ads,6,,,
82,[],False,straitjunky,,[],,text,t2_60ftmfui,False,False,False,[],False,False,1630431689,self.dating,https://www.reddit.com/r/dating/comments/pfau36/need_help_reading_signs_from_a_girl/,{},pfau36,False,True,False,False,False,True,True,False,#ea0027,dating,"[{'e': 'text', 't': 'I Need Advice'}]",19ec58c2-9f74-11e7-81a1-0e2bf15991f0,I Need Advice,light,richtext,False,False,False,8,0,False,all_ads,/r/dating/comments/pfau36/need_help_reading_signs_from_a_girl/,False,6,1630431700,1,"So I’ve been hanging out with this girl for a few weeks now and at first I thought we were just good friends however recently it’s seemed like something different. I’ll head over to her place and we will watch movies and talk for hours which seems like something friends will do but recently she has become extra touchy, constantly leaning on me and always trying to be really close whenever she can. We have even went to the beach at night just to lay in the sand and listen to music, talk and look at the stars all the while being snuggly and touchy. So it got me thinking that she was trying to give me a sign that she thought more of me possibly. I went to one of her best friends that I know really well and asked her if she would know about it and proceeds to tell me that she definitely does not like me and is just “vibing” whatever tf that means. I just don’t know wtf this means. I’ve never had a girl best friend before so I don’t know if this is something that happens often but whatever the case is these signals are very confusing. Let me know what you guys think.",True,False,False,dating,t5_2qhb1,981576,public,self,Need help reading signs from a girl,0,[],1.0,https://www.reddit.com/r/dating/comments/pfau36/need_help_reading_signs_from_a_girl/,all_ads,6,,,
