,id,created_utc,title,selftext,subreddit,subreddit_id,url
58,pa4meu,1629739844,A friend found out that the guy she’s seeing is on Tinder for boys and girls,"My friend just told me that using an old account her friend(gayM) made, they found out that the boy she’s going out with appeared to him as well.

Don’t know if it’s worth saying that the account they’re using was first made by her and then deleted or something like that. She can’t remember if they made it directly for him. 

Anyway, Tinder should only show you what you’re looking for right? What do you advice to do?",dating,t5_2qhb1,https://www.reddit.com/r/dating/comments/pa4meu/a_friend_found_out_that_the_guy_shes_seeing_is_on/
59,pa4nr9,1629739952,Girlfriend going to a bar with friends.,"So my girlfriend 28(F) told me 22(M) she might go to a bar with her friends on Friday. She asked if I wanted to come but I don't really care for clubbing. I never have. Probably because I'm not a super social person. Anyways, she asked if I would get mad and I said no. But i also said i probably would if we were more serious like living together etc. We both were on the same page having a quick convo about it. 

Like I don't want her to go not because I don't trust her, but shes bound to get hit on if she's drinking with her friends. But we are also not super serious right now so I can't really say anything. I don't want to be controlling. 

Thoughts on your girl going out to a bar with friends?",dating,t5_2qhb1,https://www.reddit.com/r/dating/comments/pa4nr9/girlfriend_going_to_a_bar_with_friends/
60,pa4w9y,1629740670,M/18 Searching for perfect girlfriend add me on snapchat rytis_chill if you are intrested,[removed],dating,t5_2qhb1,https://www.reddit.com/r/dating/comments/pa4w9y/m18_searching_for_perfect_girlfriend_add_me_on/
61,pa51q5,1629741118,The gender imbalance on OLD is just too much,"I dated a woman a while ago, we went on a couple of dates and in the end it didn't work out romantically but we did become actual friends.

6 weeks later I spoke her again and she asked me how dating went. 

Me: Yeah pretty well, had a date through the app this month, it didn't work out but it was still nice.

Her: I went on 15 first dates.

Me:.....

That's one date every 3 days. She can just pick and choose who she wants to go on a date with. Her profile is 2 pics, no bio and she is hardly visible in the second one. It's also not all douchebags. She said 3 people were actual douchebags, but the rest weren't.

Sorry but the imbalance is just too much......",dating,t5_2qhb1,https://www.reddit.com/r/dating/comments/pa51q5/the_gender_imbalance_on_old_is_just_too_much/
62,pa56l5,1629741529,"Can someone please explain to me, what's the deal with women who put pictures of their feet/shoes in their profile?","Is it a fetish thing? I'm not asking as a kink shaming thing, Let Your Freak Flag Fly! But, honestly, do you really think that this is your best attribute? And why shoes? Are you showing shoes you have? Shoes you want? Your taste in shoes?
And who exactly do you expect to like your these pictures?🤨",dating,t5_2qhb1,https://www.reddit.com/r/dating/comments/pa56l5/can_someone_please_explain_to_me_whats_the_deal/
63,pa59s6,1629741775,How can I control my anxiety and insecurity towards my girlfriend having friends?,"
TLDR: Girlfriend emotionally cheated with friend and now having I’m having problems trusting future friendships 

My Girlfriend (F22) and I (F20) have been dating for almost a year. We went long distance for about 3 months during the summer due to school break and I’ve just recently (about a week ago) returned. During the summer my girlfriend admitted to having a crush on one of her coworkers who was her friend. She didn’t outright physically cheat but it still hurt nonetheless as she had denied liking her for months and would lie about communicating/ hanging out with her. She’s since cut off all contact with her coworker and changed jobs. While I’m grateful for the steps she’s taken to help rebuild our relationship..I’m still a bit hurt and weary of future friends. Every time she’s met someone new recently and have showed interest in becoming friends, I get this gut wrenching feeling that this can happen all over again. I know trust is absolutely needed in a relationship and I really love her and can’t imagine breaking up but it’s really hard. 

She’s complained that I’ve been smothering her lately and has suggested spending less time together to do different clubs. I know that is a absolute reasonable request and would have no issue with this in the past but now just the thought gives me terrible anxiety.

I’ll add that I don’t get these feelings when she hangs out with the friends she had before knowing me…just new people. 

What can I do to ease my feelings so I don’t push her away?",dating,t5_2qhb1,https://www.reddit.com/r/dating/comments/pa59s6/how_can_i_control_my_anxiety_and_insecurity/
64,pa5c3v,1629741963,I felt lead on after she knew how much I liked her so I blocked her and it hurts,"A little background and sorry for my bad grammar because it’s my second language but try to bare with it while I go through this rant and confusion on why this happened.

&amp;#x200B;

I met this girl online a year back and it started off as us just being casual friends that just did things with each other because we were bored and we had fun doing things. 

&amp;#x200B;

I, unfortunately, started growing interested in her but she never felt the same way (at least that’s what I thought but we will get into this part later down in the story). Throughout the time we spent together, I was always there for her when she was sad or depressed or just had problems that she needed to talk to someone with and vent. 

&amp;#x200B;

Fast forward 8 months and I confess to her in which she rejects. I end up getting hurt and told her I could no longer be her friend or spend time together because it wasn’t fair to me if I kept sticking around when she was talking to other guys while I sat and watched. So we end up not talking for a few months and she reached out to ask if I wanted to meet her in person for the first time since she was coming to the city for something. I obviously agreed and realized I still had feelings for her and confessed it to her through text the next day and to my surprise, she said she felt the same way!

We then went on 2 more days and between those dates, she tells me how much she likes me and has liked me from the very beginning but she didn’t want to say anything because she was still hung up on this guy who she is now over, and proceeds tell me how much she misses me but on the day before she was leaving for schooling, I asked if she wanted to be official and she said she thought about it and realized she can’t do long-distance… we were supposed to go on a date that night when I confessed but she cancelled on the last minute because she had to pack and run errands and that’s why I asked if she wanted to be officially over text. 

&amp;#x200B;

After she rejected me, I then informed her that I probably won’t be meeting her the next day(we were supposed to go out Friday and Saturday) because since we were friends I didn’t wanna see her on my day off (petty I know) but she just responded with “ok” and I just blocked her since. 

&amp;#x200B;

Did she lead me on or was her reasoning of rejection valid?

&amp;#x200B;

Ps. She wanted a relationship with me after our second date but I told her I’ll ask in person rather than text.

&amp;#x200B;

TL;DR girl I’ve liked for a long time tells me how much she likes me and misses me but then rejects me.

&amp;#x200B;

Message u/Bobby3000",dating,t5_2qhb1,https://www.reddit.com/r/dating/comments/pa5c3v/i_felt_lead_on_after_she_knew_how_much_i_liked/
65,pa5dmw,1629742088,I felt lead on and it’s hurting more than I want it to,"I felt lead on after she knew how much I liked her so I blocked her and it hurts
Question
A little background and sorry for my bad grammar because it’s my second language but try to bare with it while I go through this rant and confusion on why this happened.



I met this girl online a year back and it started off as us just being casual friends that just did things with each other because we were bored and we had fun doing things.



I, unfortunately, started growing interested in her but she never felt the same way (at least that’s what I thought but we will get into this part later down in the story). Throughout the time we spent together, I was always there for her when she was sad or depressed or just had problems that she needed to talk to someone with and vent.



Fast forward 8 months and I confess to her in which she rejects. I end up getting hurt and told her I could no longer be her friend or spend time together because it wasn’t fair to me if I kept sticking around when she was talking to other guys while I sat and watched. So we end up not talking for a few months and she reached out to ask if I wanted to meet her in person for the first time since she was coming to the city for something. I obviously agreed and realized I still had feelings for her and confessed it to her through text the next day and to my surprise, she said she felt the same way!

We then went on 2 more days and between those dates, she tells me how much she likes me and has liked me from the very beginning but she didn’t want to say anything because she was still hung up on this guy who she is now over, and proceeds tell me how much she misses me but on the day before she was leaving for schooling, I asked if she wanted to be official and she said she thought about it and realized she can’t do long-distance… we were supposed to go on a date that night when I confessed but she cancelled on the last minute because she had to pack and run errands and that’s why I asked if she wanted to be officially over text.



After she rejected me, I then informed her that I probably won’t be meeting her the next day(we were supposed to go out Friday and Saturday) because since we were friends I didn’t wanna see her on my day off (petty I know) but she just responded with “ok” and I just blocked her since.



Did she lead me on or was her reasoning of rejection valid?



Ps. She wanted a relationship with me after our second date but I told her I’ll ask in person rather than text.



TL;DR girl I’ve liked for a long time tells me how much she likes me and misses me but then rejects me.",dating,t5_2qhb1,https://www.reddit.com/r/dating/comments/pa5dmw/i_felt_lead_on_and_its_hurting_more_than_i_want/
66,pa5e6f,1629742132,Help I got no clue what I am doing,"I grew up in a very strict religious house hold and shortly after I turned 18 I spent 3 years in and out of hospitals, which lead to severe depression, as a result I have never actually been in a relationship, I've only had sex with two women.

I just turned 29 and I am finally in a place mentally and financially where I want to start dating but I am absolutely clueless, I've had almost no luck on dating sites and the few matches I had I couldn't keep the conversation going. 

I would appreciate any input, specially from women on how to go about getting better at introducing myself or making myself look interesting.

PS: I do not believe in lying to get things started, I have been told I'm too honest sometimes and that's fine by me",dating,t5_2qhb1,https://www.reddit.com/r/dating/comments/pa5e6f/help_i_got_no_clue_what_i_am_doing/
67,pa5h4e,1629742372,how much of a turn off is a guy with no social media and no actual friends?,"i just never had friend stick after college, after working a job. like don't get me wrong i had a great time while i was there in the moment, but either I, or they didn't continue connecting and we just lost touch. same with social media. i don't even know what to post. i started it late so i didnt add anyone from college. i only added people from work and then i just ended it. nothing exiciting in my life to post, and i don't want to post selfies. 

&amp;#x200B;

most people who have social media post about concerts and event they went to during college, or trips or vacation during/after college and then i notice their feed becomes rather inactive for some time because it seems the best time to post was in college when they are always around people and events.. 

&amp;#x200B;

now that it is over and i'm entering 30 there is no point but i know people will judge me if i dont have social media. they will think i am a loner and a creep/ serial killer :(",dating,t5_2qhb1,https://www.reddit.com/r/dating/comments/pa5h4e/how_much_of_a_turn_off_is_a_guy_with_no_social/
68,pa5hgh,1629742400,How long into talking to someone on a dating app do you exchange numbers?,"Just curiosity really. I’m new to online dating having gotten out of a relationship about six months ago and I’ve been talking to someone since Saturday. We get along well and he seems awesome. But I’m curious, how long into talking does one usually ask to take it off the app?",dating,t5_2qhb1,https://www.reddit.com/r/dating/comments/pa5hgh/how_long_into_talking_to_someone_on_a_dating_app/
69,pa5zok,1629743946,Did she subtly tell me she loves me,"Went for a walk today.. she points out some tiny almost hidden paintings that you literally walk over but would never see unless you know it's there
Text says on the first one says.. I love you 
We've only need 'dating' if even that.. for a week or so but been friends 6 months",dating,t5_2qhb1,https://www.reddit.com/r/dating/comments/pa5zok/did_she_subtly_tell_me_she_loves_me/
70,pa6006,1629743972,I (26m) asked a friend (24f) out and now she's not reading my messages.,"To put it simply, how do I deal with a friend I'm gonna hangout with in the future not even reading my messages. I take it as a clear sign she isn't interested in me at all. It's just feels weird and bizarre that we know each other for so long, we hangout in the same group from time to time and the other week in person she said yes to going out, and now she doesn't even read the one text that I sent her that was bassicly asking if she had time after she got back from a trip. 

I just don't know how to deal with this in the future because I inevitable have to be around this person. Like if this is where she drew a line and was uncomfortable with, should I stop talking to her in real life to? Because I don't know if I would come off as bitter or angry if I stopped talking to her, but at the same time I don't want to talk to her or interact if I made her this uncomfortable to stop even reading my messages. The worst part is that if I would stop hanging out because of her, then she would probably be the one not being invited because she just tags along my friend. 

TLDR,
I asked a friend, she said yes, later when I check in on her asking if she had time after coming back from her trip she straight up just ignores me. Haven't sent more then 1 text.",dating,t5_2qhb1,https://www.reddit.com/r/dating/comments/pa6006/i_26m_asked_a_friend_24f_out_and_now_shes_not/
71,pa651l,1629744403,Ghosted/moving on,"So at the end of July/beginning of August I (22F) met up a couple of times w this person (25M) from Tinder. Both times we hung out were really amazing, in my eyes at least. For context, I recently got out of an on/off serious relationship probably around the beginning of July. It had been a long time coming and I honestly was already over him. So the couple of dates I went on w this new guy were really refreshing and honestly, I don't mind if its not a full blown relationship or if it stays a FWB kinda thing. 

So onto why I think I'm being ghosted. Last time we hung out, beginning of Aug., was really nice and ended on pleasant terms. We watched movies, we did some other.. stuff.. and overall I really got over my initial nerves and felt comfortable around him. I tried keeping convos going with him after that day, and it was limited response from him. I point blank asked him if I came on too strong and he said yes, and stated he was dealing with stuff. Last message I sent, I left the door open and said I'd give him space and if he needed anyone to talk to, Im there for him. It's been a lil over two weeks now since we last talked and he read the message but never replied and hasnt talked to me since. and I hate to say it but I'm hung up on him. 

I feel like I messed it all up big time and I hate it cause I'd like to even just be friends cause hes a nice guy. Plus, I can see when he's active (we message on Insta) and that kills me even more to know he's just choosing to not talk to me.

Am I overreacting to the lack of response? Should I keep holding hope or just cut my losses and try to move on? (In which case any advice for that?)",dating,t5_2qhb1,https://www.reddit.com/r/dating/comments/pa651l/ghostedmoving_on/
72,pa65eo,1629744436,I (M24) need advice on situation with a women (F21)," 

I met her through work in february through work and what started off as just a bit of fun with talking on the phone slowly evolved into a really strong connection, we meet for the first time 30 march and after the second date we spoke out to eachother that we like eachother. I always have a hard time opening up but she did not mind and was willing to wait, two weeks later i slept at her place and we slept together. Until that point everything was great between us until a week later she said she does not know if it just friendly between us or romantic. I told her it would be hard for me as i do have those romantic feelings, She just had some doubts about it, some moments she did had attraction towards me and sometimes she did not.

As time progressed we remained friends, still talking on the phone everyday, telling eachother everything going on in our lives and she frequently said things like she is really happy that she has me in her life and that she needs me. But as time progressed it also was harder for me at times. Especially if she was hanging out alone with her guy "" friends"".

I was feeling jealous and really questioning my own self worth/ respect at times. I know i just should have go NC the moment she friendzoned me, but yeah stupid me.

But i was becoming more distant from her to just protect myself and 3 weeks ago she send me a messages that she really misses me and did not thought our bond would ""break"" this quickly. I told her i miss her aswell but from the moment she told me she just wants to be friends a lot had changed because i really thought we were building something more then just friends. she did not respons on my reaction.

For the last 3 weeks our conversations are really dry and it feels forced. I got a snapchat from her last week from her that she was taking a drive with her ex, which she always complained about to me and talked alot about when we were ""dating"" in hindsight it maybe meant she was not over him still. But since she send that snap i did not contacted her and it has been 3 days now.

I need some advice on what to do next, should i stay no contact or should i contact her? i have to be honest and tell you all i am having a hard time, also because she is undergoing surgery coming thursday and i want to be for her, but on the other hand it is hard to be in her life as just a friend.",dating,t5_2qhb1,https://www.reddit.com/r/dating/comments/pa65eo/i_m24_need_advice_on_situation_with_a_women_f21/
73,pa67tp,1629744639,"If you’re a woman with a non-close up selfie as her first OLD profile pic, you’re already way ahead of the game.","I know I’m not particularly in a position to be picky and choosy (I’m a guy), but I absolutely love genuine profiles instead of a barrage of selfies and filters. It’s getting to the point where it’s nearly an automatic right swipe now (at least on Tinder, where it’s a needle in a haystack).",dating,t5_2qhb1,https://www.reddit.com/r/dating/comments/pa67tp/if_youre_a_woman_with_a_nonclose_up_selfie_as_her/
74,pa698h,1629744762,Dating as a Demisexual guy is rough.,"Pretty much what the title says. I’ve [25m] found out that hookups aren’t for me about 2-3 years ago and haven’t slept with someone who I wasn’t dating since then. 

However, I’ve found that women have often lost interest in me and one even told me it was because I didn’t try and make a move in bed. Even though it was only the 2nd date. 


What should I do to better my chances at finding women who are willing to get to know me a little bit first before heading to the bedroom?",dating,t5_2qhb1,https://www.reddit.com/r/dating/comments/pa698h/dating_as_a_demisexual_guy_is_rough/
75,pa6pcm,1629746085,How to deal with ghosting?,[removed],dating,t5_2qhb1,https://www.reddit.com/r/dating/comments/pa6pcm/how_to_deal_with_ghosting/
76,pa6pkf,1629746104,Polyamory: Dealbreaker or No?,"I’d just like to hear everyone’s perspective on how they feel about polyamory in OLD. I’ve encountered people that have a strong negative reaction for sure, but being polyamorous myself I’m always happy to see it on someone’s profile.",dating,t5_2qhb1,https://www.reddit.com/r/dating/comments/pa6pkf/polyamory_dealbreaker_or_no/
77,pa6swi,1629746387,Date idea advice,"Hey folks,
It's a rainy day here in my home town, so this girl I've gone on a few dates(5-6) with and I had to cancel our original plans(kayaks@lake).
I'm now rushing around trying to find an idea for a date tonight. I don't want to be generic and lame, so I don't want to go to the movies or get dinner or whatever.

Now for context, she's just a normal caucasian woman. I however, am Mexican American. So I am bilingual and she isn't.
I was thinking I'll give her a spanish lesson because she finds it super hot that I speak Spanish.

I also thought I could cook her a latin dinner. I was thinking arroz con habichuelas(because everyone can handle rice and beans), and ceviche (pickled fish dish) because it's a little more impressive and exotic.

Is this like cool and unique? Or is it kinda weird or lame?",dating,t5_2qhb1,https://www.reddit.com/r/dating/comments/pa6swi/date_idea_advice/
78,pa6url,1629746551,I’m shallow &amp; terrified,"I’m talking to this guy I met on a dating app and I’m just not attracted to him I think, but conversations are great! We have yet to meet but it’s been so long since I’ve dated anyone that I’m terrified to meet him and terrified I won’t like him even more in person. 

Has anyone experienced this? 

I kinda just want to run away from all of this.",dating,t5_2qhb1,https://www.reddit.com/r/dating/comments/pa6url/im_shallow_terrified/
79,pa6xxk,1629746815,I've friendzoned the guy I like and he got colder,"We were walking by a hand from a party (he took my hand) and I mentioned him as a friend. He asked me ""am I your friend?"" I said ""yes"" and he got angry and suddenly started talking excessively about his exes and girls that find him attractive but he doesn't want them.
After that he became much colder and kind of unbothered, even more flirtatious with other women and not really paying attention to me and stopped asking me personal questions and leads conversation really officially.

A month ago he tried to kiss me and I pushed him away because I felt like he hasn't invested anything in me emotionally at that point of my life. 

How to let him know I want him more than a friend?
I see him almost every day as we attend dance classes together 4 times a week + parties with our friends
I'm 23F he's 26M",dating,t5_2qhb1,https://www.reddit.com/r/dating/comments/pa6xxk/ive_friendzoned_the_guy_i_like_and_he_got_colder/
80,pa70va,1629747070,They were the worst four words you could say to another person: I. Want. Some. Space.,[removed],dating,t5_2qhb1,https://www.reddit.com/r/dating/comments/pa70va/they_were_the_worst_four_words_you_could_say_to/
81,pa71sb,1629747151,Is it time to move on?,"I've been dating a guy for about 7 months. I told him I loved him about 3 months ago and told him I didn't want him to feel pressured to say it back. He has not said it back. This genuinely didn't bother me until recently.

He left town for a week. He said he wants to hang out the night before he left. Both of us were working until 10pm. I told him I had to work early the next morning so I only had a couple of hours and couldn't sleep over (we usually sleep over unless one of us has to be up early \[usually me\]) but that I'd still like to see him before he leaves.

 I'm off work at 10pm, I ask if he wants to come over, he says he's wrapping up but it might be a little late. I don't hear from him until 12:30am saying he just got home. I was falling asleep at this point, and just told him goodnight. He said he wants to plan for this weekend when he gets back but truthfully I'm hurt/disappointed at basically being blown off so I didn't respond.

IMO, we've been seeing each other long enough to where he knows I'm not going to drive 15 minutes to his house in the middle of the night when I have to be up at 8am. This is not the first time this happened. Last time, I said I'd rather not make plans when he's working late and I have to be up early. He apologized, said it shouldn't be a problem in the future etc.

I'm having a hard time not taking this a sign that he really just doesn't care about me the way that I do him. I understand that a miscommunication is not indicative of the whole relationship, but the fact that this isn't the first time is making me think that this is more like a pattern and I'd been letting it go.

Do I tell him I feel like he blew me off? Was it my fault for making plans with him knowing that he's working late and probably won't be available until hours after he said he would? Is it worth it to even talk about this at all, or should I just accept that we had a good run but I need to move on?",dating,t5_2qhb1,https://www.reddit.com/r/dating/comments/pa71sb/is_it_time_to_move_on/
