,id,created_utc,title,selftext,subreddit,subreddit_id,url
29,oepd97,1625553029,"Some advice, after matching with a lot of cute guys and ghosting a few","I am 23F and let's say, I tried OLD again, just cause I was bored, I don't really date and well I even avoid hookups, just cause I don't inherently feel the need 

Anyway, I decided to have fun cause they are so many cute guys on there, so I went around swiped around 10-15 people, matched with most of them and this is what was so turning on about some and so turning off about some 

This is just personal advice, I hate all kinds of PUA stuff but man some of this is good, weather or not the guy is doing on purpose 

Guy 1 : Cutest of them all, I was drooling over him and well he was really smart about keeping the conversation clean and just using one emoji now and then, which was enough to make me feel things, I complimented him and expressed my interests and we might meet up for drinks 

Guy 2 : Attractive, not as much as in the pics but 100% made it up for his humor, which was actually funny, not braggy or trying hard and not trying to be too cool, also definitely putting me on pedestal and being dramatic but also very accepting, so accepting that he was the only one I sent some sexy videos because I was sure he wouldn't judge! 

Guy 3 : Younger to me, cute, a bit shy and awkward, we are both really sub, so we just dropped the whole sexual thing but good friends anyway 

Guy 4 :  attractive at start, liked deep conversations, started to kill it once he got braggy about his body count and also asking me questions that indicated him questioning my hotness (blocked) 

Guy 5 : attractive and cute, too forward, sent me a dick video on the first conversation and some muscle flexing, he is a bit younger, so forgivable for the immaturity but would not meet him because, it ruined the spark for me 

Guy 6 : looks average but really keen on eating me out and made it very obvious in the first 10 mins of the conversation, unfriended right away 

Guy 7 : matched with an old friend, cute, hit it off mutually and wow, this guy impressed me, when I mentioned about STDs, he was like let's get me tested, and he was okay and concerned about my convenience, cute and agreeable, also someone who explicitly asked me to not put any real effort in dressing up or anything and just show up, when I told him I need some heads up to meet him

So, overall, if a girl swiped you, she is already attracted, yes everyone puts their best pics out there and you'll be 30% less attractive in real, everyone knows that, please make it up with being a genuine person who can talk about things and add in healthy flirting, she will signal back wanting more and only then get actually dirty but still stay in lane, check for her comfort, respect boundaries, go that extra mile because honestly, if you don't, someone else will 

I ended up telling some guys how they are too good to be true, because of how sweet they were, even if I am not 10/10 into them looks wise

Also, I am not fussy about height in men, tho most of them were tall, it doesn't matter, yes, I am a bit concerned about weight because I am myself pretty skinny 

So, being authentic is as good as it gets, that doesn't mean anything but not following some dumb tactics, if you're nice, be nice, if you're an assol, be better, playing hard isn't cool, but some restraint shows you're a man of culture 

If you have any other questions, ll be happy to answer 😁",dating,t5_2qhb1,https://www.reddit.com/r/dating/comments/oepd97/some_advice_after_matching_with_a_lot_of_cute/
30,oepgtx,1625553489,Am i a bad person here?,"I matched with a girl last year but we couldn't hang out or go out on a date but i found her very intresting and we kept talking. Well i think in all this time i have figured she's not looking for something serious, but i am. So i have kind of started to refrain from texting, she hasn't texted me either so i guess she's okay with it too. Am i being a bad person here?",dating,t5_2qhb1,https://www.reddit.com/r/dating/comments/oepgtx/am_i_a_bad_person_here/
31,oepkdm,1625553974,Broke up over watching porn ? asked before not to tho (im a cheater i guess),[removed],dating,t5_2qhb1,https://www.reddit.com/r/dating/comments/oepkdm/broke_up_over_watching_porn_asked_before_not_to/
32,oepog7,1625554523,817-217-1103,[removed],dating,t5_2qhb1,https://www.reddit.com/r/dating/comments/oepog7/8172171103/
33,oeq0eu,1625556143,Am I too chill for some people?,"I (25, M) recently  was dumped (26 F) because I wasn't as extreme in my thinking on some issues. My life's mantra is ""Look man, I'm just hear for the food.""

During our talk I got the impression  that I was being blamed for this now exes emotional feelings about me not having a hardcore extreme opinions  regarding certain topics. (I won't be share them them since they are touchy.) It divulged to her only taking into consideration  her feelings and emotions  not mine.

Then I got utterly ghosted. Blocked on everything. I think of myself as a pretty good person but this just sucks to go through. 

This seems to be a trend with me. I only attract certain types of people  but the incompatibility  is insane and it never works out",dating,t5_2qhb1,https://www.reddit.com/r/dating/comments/oeq0eu/am_i_too_chill_for_some_people/
34,oeq0ii,1625556158,First time in a long time,"Let me start off by saying, I’ve been out of the dating scene for years. I was with my ex for over 15 years, so my 20’s and most of my 30’s. Have not been on a real date Per say. I recently went out with a friend and after drinking ended up with a lady at her place, it was a strange interaction for me as I have never done anything like that. I’m not sure if we clicked really or it was just the drinking, I’m hesitant to find her as my friend I was out with Called her “ the crazy asshole” also not sure what to do if we cross paths again. 
What are the rules on this these days?",dating,t5_2qhb1,https://www.reddit.com/r/dating/comments/oeq0ii/first_time_in_a_long_time/
35,oeq2eu,1625556425,NEED ADVICE! please help,So I’m 21m virgin anyways my friend finally got a girlfriend and he always talk to me about what they do together and while I’m happy for him but I can’t help but feel really sad and depressed because I haven’t really done anything with a girl besides kiss one girl and things between us didn’t work. My friend doesn’t think I’m a virgin and I kinda lied to him about my virginity status and said I’ve done things when I haven’t even dated a girl. I feel so much pressure to get a girlfriend and have sex but I’m so inexperienced with girls. I don’t have a hard time introducing myself but I’m very anxious  when it comes to escalating things passed “friends” I feel like I have no one to talk to about this problem and I don’t wanna admit I lied to him because it seems like such a stupid thing to lie about but I’m just self conscious about my dating/sex life and it’s making me so miserable. I know there are things more important in life then this but I can’t help but feel this way no matter all the positive affirmations I tell myself. I NEED ADVICE!,dating,t5_2qhb1,https://www.reddit.com/r/dating/comments/oeq2eu/need_advice_please_help/
36,oeq2if,1625556439,Virgin guy dating non-virgin girl,[removed],dating,t5_2qhb1,https://www.reddit.com/r/dating/comments/oeq2if/virgin_guy_dating_nonvirgin_girl/
37,oeq3op,1625556603,Tips for improving my approach to women?,"So after a bad sItuation with someone and 2020, I’m (21M) going back on the market. I’m going back to uni in a few months and I think I’m a little rusty. My last relationship was in 2019 which shouldn’t feel like a millennium ago, but then COVID hit right? I pretty much these past years healing and developing. I think my approach could you use some work. Do I approach them or do they approach me? If the later is the case, how do I present myself as more of a commodity? Idk if I believe in that alpha/beta male stuff, but is their validity in that shit? That last girl I asked out rejected me because I did what got me with the previous one “Told her how I felt.” Yeah, I’m cringing harder than you. 

Definitely am NOT doing that again. Idk what translates to confidence. Is it body language? How do I strike up a conversation. (All of my past gfs I’ve had been decently acquainted with or had mutual friends.) Help a guy out please.",dating,t5_2qhb1,https://www.reddit.com/r/dating/comments/oeq3op/tips_for_improving_my_approach_to_women/
38,oeq7w4,1625557176,Message again or wait?,"So I matched with this guy a week ago on bumble! We haven’t talked much because he works nights and I’m at uni in the days. But he asked me how my week was going almost a week ago, and I replied, and he hasn’t said anything back. I know he went away for his week off because his location changed. He just got back today but also changed his photos.

Should I message again? Or just wait because I think he’s heaps cute and have never done this before..",dating,t5_2qhb1,https://www.reddit.com/r/dating/comments/oeq7w4/message_again_or_wait/
39,oeq9jo,1625557400,Guys who have/have had long hair: what has the dating scene been like for you? Better/worse?,,dating,t5_2qhb1,https://www.reddit.com/r/dating/comments/oeq9jo/guys_who_havehave_had_long_hair_what_has_the/
40,oeqbbp,1625557640,Mysteries at the party,"I  started going out to party with some friends some days ago. Because I  was never the most social person of my class, I was happy to have some  fun with them. It began that my friend got invited from a girl from our  class (90% of the people there were from our class) and I asked him if I  could come along. He said yes and he was happy, because he is a pretty  unsecure person and wasn't completely sure if he goes to the party(the  ""party"" is just a couple of people next to the river channel drinking  some alcohol etc.). So we went to that party and drank a little bit and  had some fun. The girl that invited him talked with him a lot, but I  thought this was because she liked him more than a friend. But he also  got into some chats with a girl thats normally also a little shy and  temperated(she got also long black hair, so I will refer to her as girl  with black hair, she's 18), so I was a little bit confused.

At  the second time partying, it was even more noticeable that some girls  gathered around him. A lot of the time he sat next to the girl with the  black hair and they talked. She was already a little bit intoxicated, so  she did things like resting her head on his shoulder etc. But not only  she was talking with him, also the girl that invited him aswell as an  other girl thats (atleast in my oppinion) one of the prettiest girls I  know from our school. While he was talking to a lot of them, I also  tried to talk to some girls. But every girl I spoke to, didn't seem very  interested in a conversation with me, so I never came into a longer  chat.  I also tried to sit next to them, tried making new chats with  them aswell as helping them, for example at the time the black haired  girl was a little drunk, I suggested keeping an eye on her while the  others are somewhere else. We went home at 2:00 am, and because the  subway wasn't running at this time, we had to go home. So my friend, the  black haired girl and me are walking back home, because we got the same  general direction. She was a little bit scared, so she cuddled herself  to my friend.

And  thats the thing I don't get. Why is he talking to every girl for hours,  while I am just talking to a girl that seemed the most interested for a  few minutes? I don't want to be a bad friend and be jealous on all the  girls, but I am asking myself, what am I doing wrong? I don't know if  it's because how I look (I would rate myself as a average looking boy,  17 years old, 177cm and 65kg and I got long brown hair, thats tied to a  bun) or maybe just how I am as a person. Because at the beginning of the  conversations the girls seemed interested in a chat, but I got the  feeling that during the talking they lost the interest. Also I had to  begin the chat everytime. I would rate my friend also as average  looking, he is pretty thin and \~180cm big and is not really good in  social skills, he is unsecure and a bit fidgety.

The  reason why thats so deppressing for me is because I want to be part of  the class and the people, I want to have a good time with everybody.  Also, I would really like to have an girlfriend, so I am trying to talk  to a lot of girls, especially the black haired one, because I really  like her. But ever time I talk to girls, it seems that they don't want  to speak with me etc. And I don't know why that is, because I would say I  am at the same ""level"" as my friend, or I would rate me even a little  bit higher, but nevertheless everybody is talking with him, and nobody  with me. I don't know if it is because I was never originally invited or  that I am jsut as a person not so attractive, or maybe there's a other  reason I don't know. And at this point I begin to overthink the whole  situation, and I'm telling myself that maybe it's because they actually  want to get to me, because sometimes some girls look to me while they  whisper to each other, so I am even more confused what they want from  me.

Any advice? Because this whole thing has depressed me for the last few days and I dont know how to handle this situation.

Thanks for reading this and sorry about the typos",dating,t5_2qhb1,https://www.reddit.com/r/dating/comments/oeqbbp/mysteries_at_the_party/
41,oeqh4j,1625558433,What country has the best women?,[removed],dating,t5_2qhb1,https://www.reddit.com/r/dating/comments/oeqh4j/what_country_has_the_best_women/
42,oeqi5s,1625558569,Starting Over Again,My BF and I got back together but he said that the trauma I gave him is still there. It’s the same for me. It still hurts that he might leave again. How can we thrive our love and get off the mindset of “this will always be the person that hurt me”?,dating,t5_2qhb1,https://www.reddit.com/r/dating/comments/oeqi5s/starting_over_again/
43,oeqifg,1625558606,"Really stupid question, but what exactly is a date?","I mean, what is considered a date? My first and second dates with this girl have been walking around just talking, since we both like that, now we are going ice skating... Is that a weird progression? I mean, wouldn't going out for dinner be more appropriate at this stage of dating?.

I'm 26, have barely any social skills, and this is my first time dating. It's confusing, and it makes it worse when I avoid eye contact so can't even see if she looks at me when talking... But she keeps in contact, so, I mean, that's a good sign...right? I'm not shy or lacking in confidence or anything though, it's another issue I have...",dating,t5_2qhb1,https://www.reddit.com/r/dating/comments/oeqifg/really_stupid_question_but_what_exactly_is_a_date/
44,oeqlnx,1625559041,Can't get into anything serious. Am I lacking softness? (28M),"These last two years I've had lots of random hookups (mostly women I meet in person. Not on apps). Some for a couple months at a time, but never progressed into anything more. Recently, a girl I was falling for ended up getting together with someone else, distance to me was a factor so it might have not mattered what I did.   


But it has occurred to me that maybe I'm not being soft enough? A (girl)friend saw our texts and told me I was treating her like a hookup (the way I see it I was just super playful and super sexual, how we chatted definitely translated to how we interacted. Sexually the chemistry was insane and literally couldn't keep our clothes on more than a couple hours at a time, and since day one there was light bdsm contrasted by very passionate cuddling). But I wasn't at all clear about how I was feeling about her, just tried to be playful and fun and not overly emotional (which I think is part of the reason why the physical chemistry was there and so intense).  


Am I, as the guy, expected to bring up the commitment conversation? I usually let women do it, and pay attention to their subtleness, but it seems like when it's one I'm very into, I try to play it extra cool, and end up treating her differently from how I feel. (for example, I never initiated texts, she just hit me up when she was in town every couple of weeks). The fact of the matter is that I wanted to text her every day, but didn't wanna come off as clingy. When it's women with whom I don't care how I come off, I'll text them more often.  


Any tips to get out of hookup purgatory for a guy that does the ""player"" thing well?",dating,t5_2qhb1,https://www.reddit.com/r/dating/comments/oeqlnx/cant_get_into_anything_serious_am_i_lacking/
45,oeqrps,1625559899,Honey Moon Phase Ending?,"Hey all! I (22 F) have been dating my bf (23 M) for 2 months (but we've been ""together"" for 4.5 months). The first month we knew each other was spent together, then I moved for school, and eventually we made it official. I even flew with him across the country to meet his parents a couple weeks ago, so we are very serious about each other. But we are both experiencing some relationship anxiety that we have pretty much attributed to the honeymoon phase beginning to wear off and the fact that when we do see each other, it's a lot of time spent together in a very short amount of time (overstimulation maybe?). This makes for an unstable-feeling relationship, but we can both imagine that if we were together (not LDR), we wouldn't be feeling that instability, because there is literally nothing else wrong in our relationship. We love each other a lot, we are both very emotionally mature and open and honest with how we feel, and we want to be together in the long run. This is the healthiest relationship I've ever had with the most amazing guy. He summarizes his feelings as feeling like falling out of love but knowing that he wants to be with me and can't imagine it any other way, and it makes him anxious to be having these feelings of doubt about his love. He assures me that he thinks I am wonderful and that it is nothing I am doing. He thinks it is the initial ""high"" wearing off, and I know exactly what he means, because I was having those same thoughts about a month ago. I was questioning my feelings for him quite a bit, but it felt like self-sabbatoge because everything seems perfect and he is amazing. These feelings are pretty distressing and self-perpetuating for me, and I know they are for him too.

Neither of us have been in a LDR before, so I'm just wondering if this is a normal thing that people go through in LDRs, how long it lasted, and how you came out of it (or didn't). I really love him, and he says he loves me, so why are we doubting our perfectly good relationship? Thanks!

\-Hopeful romantic",dating,t5_2qhb1,https://www.reddit.com/r/dating/comments/oeqrps/honey_moon_phase_ending/
46,oeqv0v,1625560390,"Need your help, why he is like ths?",[removed],dating,t5_2qhb1,https://www.reddit.com/r/dating/comments/oeqv0v/need_your_help_why_he_is_like_ths/
47,oeqv1i,1625560393,Girl I like giving mixed signals,"So I need advice about this one girl I like, I met her in January on a party and on that party we talked for 3 hours non stop and when I got home I texted her and thats where all this began. The first evening we texted from midnight till 6 AM
Since then we have been texting when she sent me a text lets say I replied in 4-5 hours and then she replied in 9 hours and then I replied in 17 and then she replied in 28hrs and this went on and on until we got to not replying for a few days to each other. Not leaving on read, just not opening the message. But when she did open the message she wrote a long reply and continued the conversation asked questions and so on. In Feb. I asked her out she said she was busy with school (she is 18 and so am I) and I said its okay no worries. About 2 weeks later one day in the morning I went near the area she lives (she is about 30min ride from my place) and told her that im going there to do some shopping and we can get a coffe if she wants it. She said she isn't in town and she really wasn't she posted another town on her story. From then we have been on 3 parties and I saw her on 3 of them and talked her on 2. The first party we talked a little bit and she asked me how I was and just small talk in general and I went home early because I had work tomorrow morning. The next party I saw her talking to some guy and I lost all hope I just got sad. When she saw me I think she wanted to go in for a hug because she like went to spread her arms but there were a lot of people around us so she couldnt? Anyway we also talked a bit there. Next party I saw her talking with the same guy again and then I saw her walking with some other guy with his hand around her hips. I didnt even approach her at that party and the next day she asked me was I there and I said I was and she said ohh how didnt i see you... 2 weeks after that I was talking on the phone on a bus station and she and her friend got out of the bus and I pretended I didnt see her to see what will she do. She tapped my arm and said heyyyy, I said oh hi sorry I didn't see you and she repiled oh you never see me. And so we continued texting and one day I decided to not reply for a whole week because I thought she was interested in that guy I saw her on the party with and so I did not reply for a whole week
When I opened her message 7 days later and started typing she instantly went into the chat and replied I didnt even finish typing my message which really suprised me.
And so we talked for a few hours again first time after 2 months we talked like that.
She asked me am I working anywhere this summer and I said yes and she said she is working too and told me where and from when. I told her I'm gonna come visit her one day when I have the time and she said I can come.
I visited her 4 days ago we talked for half an hour and she said she needs to work and can't let her boss see her talking this much on work. And so I went home and I reply to her texts after 4-5 hours and she replies to mine in the morning usually cause she works in the afternoon but since we are talking on snapchat, I can see her snapscore going up by a few even though she doesn't reply to me when it goes up.
I don't know what to do but I need to get this over with its having an big impact on my life because I feel down whenver I think of it. I dont know what to do next so please, give me advice and if any more details interest you feel free to ask.",dating,t5_2qhb1,https://www.reddit.com/r/dating/comments/oeqv1i/girl_i_like_giving_mixed_signals/
48,oer48y,1625561755,How to be friends again?,"So I (M16) know I’ve been posting a lot on this sub lately, but I just need one more piece of advice. So I got rejected after first date with my crush (F15), she said that she just wants to continue being friends. I respect that and I’m okay with that, but how do I approach being friends again? I’m afraid I’ve put a horrible stain on our friendship. Do I keep liking her posts on Facebook, like I do my other classmates? She recently posted a very nice selfie, and on any other occasion I would like the post, but I’m scared of what she’ll think.",dating,t5_2qhb1,https://www.reddit.com/r/dating/comments/oer48y/how_to_be_friends_again/
