,id,created_utc,title,selftext,subreddit,subreddit_id,url
0,mhnfmq,1617250826,I need a girlfriend!,"Feel so lonely these days, need someone to talk to! :(",dating,t5_2qhb1,https://www.reddit.com/r/dating/comments/mhnfmq/i_need_a_girlfriend/
1,mhnfr4,1617250841,Feeling like I won't Find Anyone Better than Him,"I have recently gone through a breakup. It really hurt me initially and seemingly came out of nowhere. In a way, I felt like the carpet was dragged from under me. Even though the relationship was relatively short (a few months). I had really fallen for him. We were really compatible with each other. We shared nearly all important values and beliefs. Even more than that, we really had a lot of chemistry. I rather not go into much detail, but I have been thinking... Would I ever meet anyone like that again. Someone I work super well with and can talk to for hours. Someone who's my match so-to-speak. 

&amp;#x200B;

I guess I'm more so asking how to escape this mentality of feeling like my dating life is heading towards a downward spiral. I have dating some pretty interesting and fun people before, but we never clicked the same, and obviously a no relationship came from them. I am just scared I'll end up in a flurry of mediocre relationships. Is there even a way to avoid this? I really don't want my ""best"" relationship at such a young age. I wanna find more wonderful, quality people but it doesn't feel like they exist. Or exist in my realm anyways.",dating,t5_2qhb1,https://www.reddit.com/r/dating/comments/mhnfr4/feeling_like_i_wont_find_anyone_better_than_him/
2,mhnm1c,1617251545,Bf made a joke about marriage .. am i reading too much into this?,"My bf and I have been together for 5 months and we’re very happy and in love . We haven’t discussed marriage or anything too much into the future but I can see him as a long term partner. 

Anywho, last night he made a bit of a strange comment . We were talking about arranged marriages and he said he wouldn’t want to be told who to marry, unless it was me . I was a bit taken a back and before I could respond he said “ just kidding !” . I just ignored it . Maybe it means nothing , but it hurt my feelings a bit . As if the idea of marrying me is a joke ? He didn’t even give me time to respond . Maybe it meant nothing. 
Maybe I’m thinking too much about it and he really did not mean anything about it.",dating,t5_2qhb1,https://www.reddit.com/r/dating/comments/mhnm1c/bf_made_a_joke_about_marriage_am_i_reading_too/
3,mhnofs,1617251827,She Wants to Get to Know Me More But She Wants to Take it Slow,"So I have been messaging this girl for at least 7 months since I rekindled our interest in dating each other (we met through a dating app and had 1 date in person a few years ago, but I was being cynical and for reasons I won't go into too much atm I decided not to follow up on a 2nd date since she got sick). We only started virtual dating about a month ago because we felt weird about video chatting for a while and dating in person was not possible due to this pandemic. 

After a couple virtual dates, she tells me she still wants to get to know me more and wants to do it little by little since she has had some issues with relationships in the past. I told her that is fine and I am cool with that. I am concerned I might have come off a little too strong or fast-paced. 

So my question is, do I tell her she can let me know when is a good time to have another date? Or should I ask her if we could not do another date for another couple weeks or so? What I am concerned is if I tell her to ""let me know"", I feel like I would be giving her too much power or simping, while the other option also seems simping.",dating,t5_2qhb1,https://www.reddit.com/r/dating/comments/mhnofs/she_wants_to_get_to_know_me_more_but_she_wants_to/
4,mhnqsh,1617252094,Is it legal for a 19 year old to date a 16 year old in Florida ?,[removed],dating,t5_2qhb1,https://www.reddit.com/r/dating/comments/mhnqsh/is_it_legal_for_a_19_year_old_to_date_a_16_year/
5,mhnrhg,1617252170,Is this legal in Florida ?,Can a 19 year old date a 16 year old &amp; have sexual relations ?,dating,t5_2qhb1,https://www.reddit.com/r/dating/comments/mhnrhg/is_this_legal_in_florida/
6,mhnum8,1617252533,I'm [30M] going on a date [18F] and she wants to bring her sister [20s]. WTD?,[removed],dating,t5_2qhb1,https://www.reddit.com/r/dating/comments/mhnum8/im_30m_going_on_a_date_18f_and_she_wants_to_bring/
7,mhnvs0,1617252665,Men be honest what type of female bodies do you like?!?,Pls be honest men what type of bodies do men prefer? I'm short with small boobs and a round butt I'm a size 2 I'm always insecure that my boobs aren't big enough. Or that men won't pay attention to me!,dating,t5_2qhb1,https://www.reddit.com/r/dating/comments/mhnvs0/men_be_honest_what_type_of_female_bodies_do_you/
8,mhol5w,1617255583,Not feeling ready to put myself back out there,"I’m no stranger to the dating world, I don’t consider myself shy, and I really don’t think I’m ugly or antisocial. So technically there’s no good reason why I should actively avoid people and hide from the world. But I spent a good three years of my life focused on someone who was emotionally unavailable, and I just had the courage to end it with him, once and for all, this month. Our way-too-long situationship really ended up hurting my self esteem and my belief that real intimacy, real trust, and real love exist out there, let alone that I’m worthy of them.

Now I’m in a weird place. I’m a very sensual and sexual person and I crave connection, but it’s not that easy for me to let anyone into my space. I can go on a date and have a really good time, but then I ghost the person regardless of how nice they may have been. I can look at people and say who I’m attracted to, but it’s very matter-of-factly and I don’t really feel an urge to go talk to them or do anything about it. Pretty much no one seems impressive or interesting enough to keep my attention. People have to be very persistent to get through my walls, and no one has that kind of patience. They just interpret my silence and passiveness as lack of interest.

I know this is entirely my problem and there’s nothing wrong with the people per se... but how long is this phase supposed to last? Does it mean I’m not ready to move on yet? How have others gone out of this purgatory where you really crave a real connection, but you’re completely closed off to even giving other people a chance.",dating,t5_2qhb1,https://www.reddit.com/r/dating/comments/mhol5w/not_feeling_ready_to_put_myself_back_out_there/
9,mholrd,1617255653,Girl seems too eager?,"Hi! I (19M) met a girl on bumble yesterday and we traded snaps after a few messages and started talking on there since last night. I suggested we could hang out this upcoming Monday. Initially I felt pretty into her, but recently somethings just not sitting right with me. Out of the blue, she asked me when my birthday is and she told me hers, so I told her mine. She then asked about my music preferences and then jumped right into taking a video of her stuffed animal collection for me. She also asked if when we hang out I could pick her up (despite literally only having met on bumble yesterday), and she literally opens my snaps as soon as I send them.

I don’t know if I’m being the weird one here, but she just seems... overly eager, if that makes any sense, and it’s just not sitting entirely well. We also didn’t really establish what we’re both looking for (she put down “don’t know yet” on bumble). She also has repeatedly told me how cute she thinks I look, saying, and I’m paraphrasing “I know I’ve already said this but you’re just so cute I can’t even”.

So help me out here, is there something genuinely off here, or am I just being a weirdo?",dating,t5_2qhb1,https://www.reddit.com/r/dating/comments/mholrd/girl_seems_too_eager/
10,mhomti,1617255774,What will happen when I go to this guys house??,"So I've gone on a couple dates with this guy, and we've been talking for a while now too. To be honest I really like this guy, and we've been connecting so much which is amazing to me. We planned the next time we hangout it would be at his house, by the way we've never kissed only hugged, held hands, he's grabbed my waist a lot when we've stood beside each other or just casually walking. and honestly I don't mind that, I like the slow pace that we are going it's something I really appreciate! anyways so I'm 18, he's 19 and obviously still living with his family which is no problem at all! obviously I'll probably meet his parents for a moment, and we'll be alone for a bit of the majority which is totally fine too, I feel pretty comfortable with him, I don't want to have sex with him but I'm not opposed to having that first move of a kiss be taken place, I'm just wondering what are the possibilities that could really happen when I go to his place? and if I should kiss him or continue to wait?",dating,t5_2qhb1,https://www.reddit.com/r/dating/comments/mhomti/what_will_happen_when_i_go_to_this_guys_house/
11,mhp8qe,1617258405,They all lie... Everything is a lie,[removed],dating,t5_2qhb1,https://www.reddit.com/r/dating/comments/mhp8qe/they_all_lie_everything_is_a_lie/
12,mhpb6b,1617258708,Situationship gone sour,"Okay so long story short, 

Long time fwb (25m) and I (25f) had been wanting a threesome for a minute now but things took a wrong turn.

Backstory: He’s def more like a situationship bc I have feelings for him. We met about three years ago, while still in college. Didn’t attend same college but nearby so convenient. We have been semi long distance (opposite sides of LA) for about a year and half now since we each moved back home. See each other about every other week. Super close, tell each other EVERYTHING, not even exaggerating it’s true. 

Anyway, we had been wanting a threesome for a minute. I wanted a stranger bc I felt more comfortable kinda like a one time thing with that person. But last weekend I wanted to go out and get drinks with him and friends nothing sexy. He asked I he could bring over another one of his “friends” which was the girl he sees much more often bc she lives down the street for him. Lucky girl. However, she also has feelings for him and I know that bc he told me. He also told me that he doesn’t reciprocate those feelings. I felt bad for her bc I know how she feels. However my fwb doenst know I still harbor feelings for him (I lie and say I got over him) which is why he tells me everything. Anyway, he had to lie to this girl that we hadn’t seen each other in a long time (even tho we got a hotel room the weekend before) in order for her to feel comfortable. Even tho he’s been honest about him seeing other girls, she’s more sensitive so he twists some truths (which I see wrong and have pointed it out to him.)

Fast forward to last weekend. The three of us end up going out, drinking, laughing. Tbh I really liked her and thought we can make good friends. We got a room, more liquor, and started to fool around once we broke the ice between us. My fwb due to a mixture of liquor and insecurity, could t get it up. We just laid there, consoling him and making sure he didn’t feel emasculated. The girl heads to the bathroom, and I told my fwb to place his phone down bc I had seen him grab it multiple times due to work. I had been a bit bothered bc we had waited so long to have this moment at last (the threesome) and here he was working. Well he snapped and raised his voice at me.

Never in the years I met him did he do such a thing. With alcohol in my system I got emotional and started crying. The girl came out and tried to calm him down but he was still not having it. Then I decided to leave and he grabbed me and started hugging me, while apologizing. I told him we never ever fight like that and how could he do that to me. Next day, he texts me to say sorry, I forgive him, but he’s the one that says he needs distance to clear his head and he told both the girl and I that. 

My dilemma is:

1) should I really forgive him and/or keep seeing him? (I’d be fine to be strictly platonic friends in The future)
2) should I befriend the girl? (I really liked her but I know she will still see him)",dating,t5_2qhb1,https://www.reddit.com/r/dating/comments/mhpb6b/situationship_gone_sour/
13,mhpc3m,1617258823,Confession,[removed],dating,t5_2qhb1,https://www.reddit.com/r/dating/comments/mhpc3m/confession/
14,mhpe8n,1617259078,I have a problem with basically everyone my age.,"I'm 17m hetro, and it seems like every female my friends try to force on me(I do appreciate it) or even people I meet and just talk to seem the most self absorbed kind of people you could possibly meet. Like the kind of people you'd see post a "" felt cute might delete later"" pic. Or make a big ass deal about a camera filter since it makes them look a certain way. I understand you want to look good for people, but like constantly worrying about it? I used to date a girl who would refuse to send me so much as a profile pic for my phone without a heavy filter that honestly made her look horrible. And people who try to fit the latest mold or trend with clothes or DOING A TIK TOK IN PUBLIC HOLY SHIT that infuriates me. I don't like being so negative but it really seems like they're all the same.",dating,t5_2qhb1,https://www.reddit.com/r/dating/comments/mhpe8n/i_have_a_problem_with_basically_everyone_my_age/
15,mhpgky,1617259365,What to do???,"I have this crush on my (f)riend and idk to do. Our families are close together, and basically consider each other as cousins. What's more is her brother is my best friend. She has been saying things like, 'I really appreciate you'. We send each other cute things all the time, we sometimes hold hands. But I'm not sure if it's because she likes likes me or it's due to the 'cousin' feeling. 
Should I make a move or get over this crush?",dating,t5_2qhb1,https://www.reddit.com/r/dating/comments/mhpgky/what_to_do/
16,mhpko6,1617259865,Does he want a serious relationship? Should I start making myself more available?,"I'm seeing this guy since the end of January, I really like him and I think he does like me the same. In the beginning, I confess I started seeing him try to get over another guy that played me hard, the kinda guy that sends super expensive flowers to your house, takes you on trips, and great dinner finally gets sex, and then ignore you for a month, he uses the excuse he is always traveling for work and blah blah and sends more flowers to be forgiven, and 2 weeks later disappears again. I really reeeeeaaly liked the flowers guys and I wanted to make it work with him. I felt rejected and terrible when he disappeared so I blocked him in every form possible and decided I needed a distraction. I felt skeptical of putting my heart in the line so I decided I was only gonna date for fun, and I would do everything the opposite that I did with the flowers guy: not making myself too available, waiting to have sex, not hyper-focusing on him and let him take initiative.

I met this really cute guy on hinge we went on dates basically every week and we waited to have sex until a month and a half in, and even now we don't do it every time we see each other.  He asks me out for dinner, we have great conversations every time. We went ice skating and on walks and all that stuff. He messages me every day in my native language. I was really dating to pass the time but I ended up really liking this guy. He is a sweet and real gentleman when we hangout. He has that traditional charm to him you would expect an actor on an old movie to have. He has a great job, is finishing up college, and owns a property already at a very young age. He loves kids and plays the guitar, and has great smile. He is very supportive when I talk about projects and he is overall a great listener. He likes to go out with his friends and drink a little and I kinda like to do the same with my friends and none of us see it as a problem.  I really do think though that he gets confused with my actions sometimes because I try to be very diplomatic and I don't say what I feel/think, and I'm never the one setting up our dates or messaging first. Pure PTSD if you wanna know. Of course I show a lot of interest and make sure he knows i love spending time with him. 

I like him and I think that's the moment where I have to decide if I want to risk it (again) and let myself feel more. I really feel like I start falling for a guy once I start letting myself express more of what I feel for him. And I really don't want to get hurt again. I also don't want to directly ask him if he is looking for something serious or not because I feel like that puts pressure and I don't want to pressure anything. I just want to at least have an idea of his intentions and let it roll. 

Those are some indicators I got from him:

\*Our 2nd date was actually on valentine's day. He specifically invited me that day.

\*He introduced me to two of his friends.

\*He makes plans with me for the summer.

\*He takes me to his house and he told me last week I could come over whenever I wanted.

\*He invited me over to hang out with him on his birthday.

I know it seems pretty obvious, but my question really is: would any guys here say and do all of this to a girl they didn't themselves long term with? Do you think he could still just be looking for something casual? really don't want to get hurt. And should I start to take initiative sometimes? What do you think?",dating,t5_2qhb1,https://www.reddit.com/r/dating/comments/mhpko6/does_he_want_a_serious_relationship_should_i/
17,mhpsli,1617260798,Quick question,As it says in the title there this is kind of a quick question here but not too Long of a post. Is it just me or just other woman as well? When you go on a date  with a man in dating apps or in social media is it nice for them or is it kind of awkward for them to open the Car door for you? What I mean is when a woman goes to see a man in dating apps is it kind of weird or just nice for them to always open the Car door for you or is it just me being weirded out?. Let me know your thoughts.,dating,t5_2qhb1,https://www.reddit.com/r/dating/comments/mhpsli/quick_question/
18,mhpty7,1617260960,I [M19] think my friend [M19] might have messed up a relationship for me with [F19] when he was “looking out” for me. Or maybe I did.,"This happened last year so this is why age has been changed 

So me and my friend go to the same university. We get along just fine and often laugh at funny memes. A cute girl liked me and I don’t really care. I was excited at first because I like them too but you know act cool and unphased. My friend didn’t look happy about that. 

I told him about this girl who kept staring at me in class and how we started talking. He told me that he thinks he knows who I’m talking about. He told me that her ex was a gangster in a gang, she had a boyfriend last year (2018) and when some kid asked him out he got rejected and left the school. What weirds me out is that he said that “she’s hot af but has a bad choice in men”. She likes tough guy. I’m no tough guy. I was put off by him saying that but that’s my friend. He did seem a bit put off by the fact that she liked me. 

I’m a skinny fat, asian nerd who wears thick frames, works part time, goes to classes and yes I have been in fights and done some crazy stuff but nothing like gangsters would. I’m not built for that. That too when I was young at ages 12-16. My parents getting called up everyday and me getting suspended. I was very mischievous. However in college I became more mature, calm and reserved. 

Now I remember what my friend said and took it has the all truth. Me and her spoke I acted like a grey rock and was hoping she lose interest in me. Which she did. 

She was very nice, very helpful and in a way was sharing too much about herself. I wanted to cry. Like you don’t want me, you’re probably going to get my jumped. I felt very guilty. For 8 months. I reached out through socials out of nowhere and got blocked. 

But now when I talked to my friend again he tells me that there was no one who had done that. He doesn’t know anything. 

I feel a bit betrayed because I always looked out for him. We had so many funny and good memories.

Tl:dr friend told me something and then when asked about it again he contradicted himself. I think gaslighted me. Causing me to mess up a relationship.",dating,t5_2qhb1,https://www.reddit.com/r/dating/comments/mhpty7/i_m19_think_my_friend_m19_might_have_messed_up_a/
19,mhpxaa,1617261365,"Would you date a fat-funny guy, or a fit-boring guy?","Would you date a fat-funny guy, or a fit-boring guy?

If the fat-funny guy can make you laugh and be real at the same time, but the fit-boring guy has a great body, but is very deep and serious all the time?",dating,t5_2qhb1,https://www.reddit.com/r/dating/comments/mhpxaa/would_you_date_a_fatfunny_guy_or_a_fitboring_guy/
20,mhq229,1617261964,"Getting to know you better, a yes or a no?","Hey, recently asked someone out on a specific date and she responded with something along the lines of being really anxious when it comes to dating, and she wanted to get to know me better first. Then she suggested a bunch of things that she’s comfortable doing.  I really do respect that she gave alternatives in things that she feels ok doing, and I’m perfectly happy to go down this route as well. 

However, I’m a little confused on how that’s different than going on dates and looking from a pessimistic perspective, it feels like maybe she’s just not interested in pursuing a relationship. Although, it is possible she really just does want to get to know me better and the suggestions for things to do would make her feel more comfortable than “typical” dates and be more casual overall. 

Just kind of a difficult to interpret situation so any help would be appreciated.",dating,t5_2qhb1,https://www.reddit.com/r/dating/comments/mhq229/getting_to_know_you_better_a_yes_or_a_no/
21,mhq34v,1617262098,I feel like like never find anybody,[removed],dating,t5_2qhb1,https://www.reddit.com/r/dating/comments/mhq34v/i_feel_like_like_never_find_anybody/
22,mhq3r0,1617262173,Is it safe trying to find love online apps or websites? Why or Why not?,[removed],dating,t5_2qhb1,https://www.reddit.com/r/dating/comments/mhq3r0/is_it_safe_trying_to_find_love_online_apps_or/
23,mhqds2,1617263528,"I slept with him on the second date, told him I didn’t want to anymore on the third?","I slept with a guy too early. I don’t regret it, but it’s not something I normally do. We had a deep connection our first couple dates and he did contact me after we slept together wanting to meet up again. He asked me to dinner a couple days later. After we met for dinner; he wanted me to come over and watch a movie so I did. Things started to get physical but I didn’t let it go past kissing. He was confused and I told him I didn’t want to sleep with him again until we’re exclusive. He said he didn’t want to be exclusive yet because 3 dates is too soon and that he doesn’t think he’s ready. Which I totally understand because I’m not either, but I think it’s fair to not have sex until we’re exclusive. I’m just worried that I pushed him away. I’m sure he was expecting me to do it again tonight after last time but I wanted to be firm in my boundaries. Did I screw up? If I’m going to continue to sleep with someone I want to know that it’s going to lead to a relationship because I’m not into FWB. I told him this straight up. He said that he still wants to continue seeing me but he seemed really sad/confused and I left soon after we had this conversation. I feel like he thinks that I rejected him or something. Should I send him a text to try to let him know I’m still attracted to him and I’m sorry I made things awkward? I really like him. Literally we had a perfect first and second date. I feel like I blew it but I just wanted to be firm in my boundaries. I don’t know where to go from here. I really want to send a text to try to save face.",dating,t5_2qhb1,https://www.reddit.com/r/dating/comments/mhqds2/i_slept_with_him_on_the_second_date_told_him_i/
24,mhqg69,1617263834,It’s 2am in the morning,"When I read posts on here I end up feeling sad and alone. Contrary to all of my personal experiences, men not only want relationships but they’re willing to fight for them. They want emotional intimacy, and they are capable of compassion, empathy and kindness. 
When a man pours his heart and soul into a post about his lover or girlfriend; I feel devastated. 

Till this day, I’ve only had those feelings for two people. The type of feelings where you cry yourself to sleep and feel physical pain in your chest. Everyday I would emotionally torture myself- will he define the relationship, why is he stringing me along, why am I second or third choice, why am I chopped liver to literally everyone I date? 

I’m tired of the excuses. Imagine spending months on each and every person to hear: 

“I’m not looking for a relationship. I’m too busy for a relationship. I’m just having fun. I hope you aren’t expecting me to get you anything for valentines. I care about you but I don’t have feelings for you like that. I don’t want to lead you on.” 

....... So, I pretend that I don’t want a relationship. I pretend that none of this bothers me. I pretend like I love being single. I pretend like men don’t want commitment or love. But then I read posts on here and it hits me like a fucking freight train going 100 miles per hour.",dating,t5_2qhb1,https://www.reddit.com/r/dating/comments/mhqg69/its_2am_in_the_morning/
