,all_awardings,allow_live_comments,author,author_flair_css_class,author_flair_richtext,author_flair_text,author_flair_type,author_fullname,author_patreon_flair,author_premium,awarders,can_mod_post,contest_mode,created_utc,domain,full_link,gildings,id,is_created_from_ads_ui,is_crosspostable,is_meta,is_original_content,is_reddit_media_domain,is_robot_indexable,is_self,is_video,link_flair_background_color,link_flair_css_class,link_flair_richtext,link_flair_template_id,link_flair_text,link_flair_text_color,link_flair_type,locked,media_only,no_follow,num_comments,num_crossposts,over_18,parent_whitelist_status,permalink,pinned,pwls,retrieved_on,score,selftext,send_replies,spoiler,stickied,subreddit,subreddit_id,subreddit_subscribers,subreddit_type,thumbnail,title,total_awards_received,treatment_tags,upvote_ratio,url,whitelist_status,wls,removed_by_category,author_cakeday
69,[],False,fkan01,,[],,text,t2_ayyjn584,False,False,[],False,False,1625529057,self.dating,https://www.reddit.com/r/dating/comments/oejbxh/do_women_observe_how_men_treat_other_women/,{},oejbxh,False,True,False,False,False,True,True,False,#ff4500,dating,"[{'e': 'text', 't': 'Question'}]",a9531dce-194e-11e5-b177-0eff099c3d1f,Question,light,richtext,False,False,False,8,0,False,all_ads,/r/dating/comments/oejbxh/do_women_observe_how_men_treat_other_women/,False,6,1625529067,1,"I (M23) recently went on a date. She said it’s sweet how I treat other women especially my grandma who I’m a caregiver for and have a very close bond with. I don't know why she said this, I thought maybe she's seen women mistreated in her past or something or was mistreated herself, but I didn't wanna be too nosey so I didn't ask. Do women find it more attractive when they have close bonds with their mother, sister and what have you?",True,False,False,dating,t5_2qhb1,880131,public,self,Do women observe how men treat other women?,0,[],1.0,https://www.reddit.com/r/dating/comments/oejbxh/do_women_observe_how_men_treat_other_women/,all_ads,6,,
70,[],False,christopherliam20,,[],,text,t2_62t1zmq,False,False,[],False,False,1625529282,self.dating,https://www.reddit.com/r/dating/comments/oeje3j/how_much_an_asset_is_being_a_doctor_when_it_comes/,{},oeje3j,False,True,False,False,False,True,True,False,#ff4500,dating,"[{'e': 'text', 't': 'Question'}]",a9531dce-194e-11e5-b177-0eff099c3d1f,Question,light,richtext,False,False,True,15,0,False,all_ads,/r/dating/comments/oeje3j/how_much_an_asset_is_being_a_doctor_when_it_comes/,False,6,1625529293,1,"All other things aside, how much of an asset is being a doctor when it comes to dating?",True,False,False,dating,t5_2qhb1,880137,public,self,How much an asset is being a doctor when it comes to dating?,0,[],1.0,https://www.reddit.com/r/dating/comments/oeje3j/how_much_an_asset_is_being_a_doctor_when_it_comes/,all_ads,6,,True
71,[],False,Mary-andrew2003,,[],,text,t2_d3b9y6nd,False,False,[],False,False,1625529283,self.dating,https://www.reddit.com/r/dating/comments/oeje3v/im_new_here_and_im_mary_andrew_looking_for_a_good/,{},oeje3v,False,False,False,False,False,False,True,False,#ffb000,,"[{'e': 'text', 't': 'Tinder/Online Dating'}]",5214d2ac-61f1-11e8-8bb1-0ed15e4a39c0,Tinder/Online Dating,dark,richtext,False,False,True,0,0,False,all_ads,/r/dating/comments/oeje3v/im_new_here_and_im_mary_andrew_looking_for_a_good/,False,6,1625529294,1,[removed],True,False,False,dating,t5_2qhb1,880137,public,self,"I’m new here and I’m Mary Andrew looking for a good relationship with a right man for me ,and I’m single never married with no kids,you can text me on my email at andrewmary2003@gmail.com",0,[],1.0,https://www.reddit.com/r/dating/comments/oeje3v/im_new_here_and_im_mary_andrew_looking_for_a_good/,all_ads,6,automod_filtered,
72,[],False,Unfair_Claim_4541,,[],,text,t2_c48gj15r,False,False,[],False,False,1625530255,self.dating,https://www.reddit.com/r/dating/comments/oejni8/when_a_girl_responds_fast_and_initiates_pretty/,{},oejni8,False,True,False,False,False,True,True,False,#ea0027,dating,"[{'e': 'text', 't': 'I Need Advice'}]",19ec58c2-9f74-11e7-81a1-0e2bf15991f0,I Need Advice,light,richtext,False,False,True,5,0,False,all_ads,/r/dating/comments/oejni8/when_a_girl_responds_fast_and_initiates_pretty/,False,6,1625530266,1,"We don't text eachother everyday or anything like that. In person we flirt pretty often and are very playful sometimes. I noticed texting between us has increased from hardly texting eachother to texting every week. She is the one who initiates most texts now. She responds very fast (instantly-5 min) and sometimes takes like 5-20 min.

Is there any significance to this?",True,False,False,dating,t5_2qhb1,880162,public,self,When a girl responds fast and initiates pretty often? any significance?,0,[],1.0,https://www.reddit.com/r/dating/comments/oejni8/when_a_girl_responds_fast_and_initiates_pretty/,all_ads,6,,
73,[],False,Tribestar95,,[],,text,t2_1lhs09vq,False,False,[],False,False,1625531209,self.dating,https://www.reddit.com/r/dating/comments/oejwdv/how_long_is_too_long_before_making_it_official/,{},oejwdv,False,True,False,False,False,True,True,False,#ea0027,dating,"[{'e': 'text', 't': 'I Need Advice'}]",19ec58c2-9f74-11e7-81a1-0e2bf15991f0,I Need Advice,light,richtext,False,False,True,10,0,False,all_ads,/r/dating/comments/oejwdv/how_long_is_too_long_before_making_it_official/,False,6,1625531219,1,"I (26m)was regularly seeing a girl (24f) for 6 months. Everything you’d imagine of your typical relationship (spending nights together, meeting friends/family intimacy, future plans etc.) but she would never bring it up. Eventually when she got cold towards me out of no where brought up the status of the relationship and she told me she wants to be single. She has not spoken to me since and it’s been over 2 weeks. I’m still struggling after this. It was 6 months of seeing each other nonstop, not a couple weeks.",True,False,False,dating,t5_2qhb1,880185,public,self,How long is too long before making it official?,0,[],1.0,https://www.reddit.com/r/dating/comments/oejwdv/how_long_is_too_long_before_making_it_official/,all_ads,6,,
74,[],False,Shot-Nature770,,[],,text,t2_d3muqsbk,False,False,[],False,False,1625531282,self.dating,https://www.reddit.com/r/dating/comments/oejx1n/looking_for_fun/,{},oejx1n,False,False,False,False,False,False,True,False,#ffb000,,"[{'e': 'text', 't': 'Tinder/Online Dating'}]",5214d2ac-61f1-11e8-8bb1-0ed15e4a39c0,Tinder/Online Dating,dark,richtext,False,False,True,2,0,False,all_ads,/r/dating/comments/oejx1n/looking_for_fun/,False,6,1625531292,1,[removed],True,False,False,dating,t5_2qhb1,880187,public,self,Looking for fun,0,[],1.0,https://www.reddit.com/r/dating/comments/oejx1n/looking_for_fun/,all_ads,6,moderator,
75,[],False,MajorityHippo,,[],,text,t2_i76yl,False,False,[],False,False,1625532453,self.dating,https://www.reddit.com/r/dating/comments/oek87w/am_i_boring_or_uninteresting_why_does_no_one_want/,{},oek87w,False,True,False,False,False,True,True,False,#ea0027,dating,"[{'e': 'text', 't': 'I Need Advice'}]",19ec58c2-9f74-11e7-81a1-0e2bf15991f0,I Need Advice,light,richtext,False,False,True,23,0,False,all_ads,/r/dating/comments/oek87w/am_i_boring_or_uninteresting_why_does_no_one_want/,False,6,1625532464,1,"I'm a 23 Male, I don't think I'm bad looking to be honest, I look in the mirror sometimes and I'm like... damn, you fine looking today. The only downside I have is vitiligo, it's where some cells in my skin lose their pigment. It's not noticeable at all on my skin, but it has turned 3 small patches of my hair grey... I be looking like a muthafuckin anime character sometimes.

I work in retail, and will often spend like 15-30 mins with some customers, some of them are very attractive women. The only problem is that they NEVER seem to be interested in me... like I'll be joking with them and nothin back... 

Its getting to the point where, I need to attention, like pronto. Because being 23 and not having any female seem to reciprocate any feelings or flirtations towards me ever is... well, starting to damage my esteem and confidence in the world.

What I don't understand is that... everyone will tell me?! Theyll say ""some people need plastic surgery, not you tho, good lookin lad"" or ""you look like a Calvin Kline model"" but NO ONE WILL EVER GO BEYOND THAT... What am I the women repeller? I have all these people giving me compliments and nobody ever wanting me? It's like everyone is thinking ""yea your nice, but not me type""

Man imma kill myself if I get to 25 without doing anything, 14 year old me would be very VERY disappointed in current me. 

Btw I smell good, and dress good... I think I'm just cursed. Pray for me. Thx.",True,False,False,dating,t5_2qhb1,880217,public,self,Am I boring or uninteresting? Why does no one want me?,0,[],1.0,https://www.reddit.com/r/dating/comments/oek87w/am_i_boring_or_uninteresting_why_does_no_one_want/,all_ads,6,,
76,[],False,Visual-Wrongdoer-358,,[],,text,t2_7xz63880,False,False,[],False,False,1625532884,self.dating,https://www.reddit.com/r/dating/comments/oekcdi/got_stood_up_text_message_thoughts/,{},oekcdi,False,True,False,False,False,True,True,False,#ffb000,,"[{'e': 'text', 't': 'Tinder/Online Dating'}]",5214d2ac-61f1-11e8-8bb1-0ed15e4a39c0,Tinder/Online Dating,dark,richtext,False,False,True,11,0,False,all_ads,/r/dating/comments/oekcdi/got_stood_up_text_message_thoughts/,False,6,1625532895,1,"
Her: Sorry, something came up
Me: A better looking date?
Her: 🤣
Her: Men don't get their panties in a
bunch like you.
Her: I don't know what you do
Me: I own my own business
Her: Ru rich?
Me: I would say I life a ""rich life""
Her: How much do you make
Her: I have needs
Her: Over $75,000?
Me: Way over that
Her: orry to stand you up
Her: I can go out tonight
Me:Can we do Picasso?",True,False,False,dating,t5_2qhb1,880226,public,self,Got stood up Text Message... Thoughts??,0,[],1.0,https://www.reddit.com/r/dating/comments/oekcdi/got_stood_up_text_message_thoughts/,all_ads,6,,
77,[],False,modemarkt,,[],,text,t2_9ezhzdju,False,False,[],False,False,1625533039,self.dating,https://www.reddit.com/r/dating/comments/oekduw/i_30f_have_a_hard_time_choosing_between_what_i/,{},oekduw,False,False,False,False,False,False,True,False,#ea0027,dating,"[{'e': 'text', 't': 'I Need Advice'}]",19ec58c2-9f74-11e7-81a1-0e2bf15991f0,I Need Advice,light,richtext,False,False,True,2,0,False,all_ads,/r/dating/comments/oekduw/i_30f_have_a_hard_time_choosing_between_what_i/,False,6,1625533050,1,[removed],True,False,False,dating,t5_2qhb1,880230,public,self,I (30F) have a hard time choosing between what I truly want and what my family/culture wants for me.,0,[],1.0,https://www.reddit.com/r/dating/comments/oekduw/i_30f_have_a_hard_time_choosing_between_what_i/,all_ads,6,moderator,
78,[],False,modemarkt,,[],,text,t2_9ezhzdju,False,False,[],False,False,1625533136,self.dating,https://www.reddit.com/r/dating/comments/oeker0/i_30f_have_a_hard_time_choosing_between_what_i/,{},oeker0,False,True,False,False,False,True,True,False,#ea0027,dating,"[{'e': 'text', 't': 'I Need Advice'}]",19ec58c2-9f74-11e7-81a1-0e2bf15991f0,I Need Advice,light,richtext,False,False,True,15,0,False,all_ads,/r/dating/comments/oeker0/i_30f_have_a_hard_time_choosing_between_what_i/,False,6,1625533147,1,"I grew up in a culture that is pretty traditional when it comes to marriage/settling down. So like we're traditional but not traditional to the point of having arranged marriages ok?

We (mainly our parents) value education, status, money (sadly) – as it is a sign of power, and other superficial things like that. Of course, OBVIOUSLY, good character, respectfulness, moral values, etc are also very important but those other things are just as equally important. These are traits and characteristics women (men too but more so women) and their friends and families look out for when finding a suitable partner. All this makes it nearly impossible for women from my culture living here in The West to find a ""suitable"" guy that meets all that criteria because guys like that who live here are very much accustomed to American life and don’t choose to settle down until late 30’s-early 40’s, leaving my only options at this age, 40 year old guys who are ready to marry in 6 months to a year after meeting. Which is not what I “desire”.

I know these are some common things in American culture but just imagine what you all go through and then times it by a million, that’s how my culture is.

Now, I grew up very American too. I’ve had my fun like any normal American teenager/young adult. I’ve had bfs, relationships, gone on dates, did all that but I didn’t feel ready for a relationship that would lead to marriage until I’d say 28. And I started to see how my dating pool, based on my culture/family standards and the dating culture of America, was not what I “desired”. I had no interest in settling down with some guy in his late 30’s+ who’s just looking to wife anybody. I kind of have a wild side to me, I’m not gonna lie. I desired younger, more care free men and I could easily get these guys’ attention but I kept telling myself no no you’re getting older you have to settle down and marry as is expected of you.

I just recently moved out on my own. I used to live at my parents’ up until 2 weeks ago (very common thing for someone my age in my culture). Anyways I feel so free. I have a very good job and I’m going back to grad school so eventually I’ll be making even more and ok I’ll be honest, I also have wealthy parents too so I don’t think money will ever be an issue for me. Meaning money is the reason I would need to partner up with someone.

When I think about what I want from a guy, I think of someone who I can have fun with like just be silly and go on adventures and have lots of sex, gooood sex. Not boring marital sex. Someone I can be vulnerable with but not dependent on. I want my own life, my own freedom and he also has his. We’re monogamous but we’re not prisoners stuck in a relationship or marriage.

Idc what anyone is about to say about how “I just haven’t met the right person” because 

EVERY MARRIED COUPLE I KNOW IS MISERABLE AF.

Ok maybe not completely miserable but idk I don’t see true happiness in majority of the couples I talk to. Or even their interaction with each other gives me weird vibes. Keep in mind I mainly am thinking of examples in my own culture. Like all the girls who settled for the ""well-off doctors who are 10-15 years older"". Like I sense the suffocation in their faces lol.

So here is my issue.

I was running errands at the mall last week and I saw this guy at Nordstrom, he worked there. He was so cute, he made feel excited in a way I haven’t felt in a very very long time. You know being stuck inside for a year and then before that most of my dating was done online, I missed that feeling of seeing someone cute in person and getting butterflies for them. Anyways, I couldn’t stop looking at him. I was at customer service resolving an issue I had with an order, he was helping another customer but he eventually left that area so I decided to ask his co workers if he’s single and how I think he’s so cute and they were all so eager to set me up with him. I gave the girl my ig and told her to tell him to add me. My order issue had to be escalated with another manager, so I was there for quite some time (it was eventually resolved for anyone wondering lol). This guy eventually came back to that area and the girl who was assisting me previously pulled him aside and I’m assuming she was updating him on what I had told her because when he came back, his demeanor was different, he kept looking over at me. Anyways like I said my order issue was eventually resolved and I left. He requested to follow me as soon as I left the store and messaged me  asking me out.

I’m so conflicted. I think this guy is so adorable and I went on his Instagram page, we totally have similar vibes. He’s artistic, he's stylish, creative but all I keep thinking is how my mom is going to be like “you’re dating a guy that works at Nordstrom?????” or my friends will be with their professional bfs/husbands and view who I’m with as a loser or a low life. These are stupid thoughts that have been put into my head my whole life. I come from an extremely judgmental culture and family that has turned me into a judgmental person as well to the point where I even judge my own decisions.

I don’t know what to do? Like where is this going to? I feel like even if I go out with him and date him or whatever I’m just going to have to call it quits one day right? I will eventually have to marry someone “suitable” AKA be miserable. I feel like well what’s the point then? Why delay that process, why not just do it now that I’m young and have a better chance of ending up with someone who’s just slightly cringe and not absolutely horrid.

I have no one to talk to this stuff about. I literally cannot confide in anyone in my life about any of this. I have today off work and just relaxing and anytime I have downtime, my brain just goes all over the place. I enjoy working for this very reason, because I don’t think about my own life and problems.",True,False,False,dating,t5_2qhb1,880233,public,self,I (30F) have a hard time choosing between what I truly want and what my family/culture wants for me.,0,[],1.0,https://www.reddit.com/r/dating/comments/oeker0/i_30f_have_a_hard_time_choosing_between_what_i/,all_ads,6,,
79,[],False,KeyPimeLie,,[],,text,t2_ccv2cf2t,False,False,[],False,False,1625533427,self.dating,https://www.reddit.com/r/dating/comments/oekhoh/how_do_i_meet_women_in_real_life_in_my_late_20s/,{},oekhoh,False,True,False,False,False,True,True,False,#ea0027,dating,"[{'e': 'text', 't': 'I Need Advice'}]",19ec58c2-9f74-11e7-81a1-0e2bf15991f0,I Need Advice,light,richtext,False,False,True,25,0,False,all_ads,/r/dating/comments/oekhoh/how_do_i_meet_women_in_real_life_in_my_late_20s/,False,6,1625533438,1,"In short, I'm sick of online dating. I get a match every few months or so, and even if I do go on dates with them it ends up going nowhere. It's also nowhere as intimate as meeting someone with whom you really ""click"" in-person.

Where can I meet women nowadays? Work is not an option as there are simply no women in my age category there. The bar/club scene isn't for me. I've yet to develop interesting hobbies and skills (I know, this is something I need to work on). Moreover I don't have a lot of time for leisure.

I feel that, as I approach my older years, the prospects of me finding a quality partner might drastically diminish, especially for someone who has zero experience in relationships or sex. A part of me wants to continue working on myself and delay my search for a partner until I've become a high-quality individual, but I'm seeing no light at the end of a very dark tunnel.",True,False,False,dating,t5_2qhb1,880238,public,self,How do I meet women in real life in my late 20s?,0,[],1.0,https://www.reddit.com/r/dating/comments/oekhoh/how_do_i_meet_women_in_real_life_in_my_late_20s/,all_ads,6,,
80,[],False,Cowgirl_Hannah_,,[],,text,t2_d1wd1qqf,False,False,[],False,False,1625534462,self.dating,https://www.reddit.com/r/dating/comments/oekrfx/wanting_to_chat/,{},oekrfx,False,True,False,False,False,True,True,False,#ff4500,dating,"[{'e': 'text', 't': 'Question'}]",a9531dce-194e-11e5-b177-0eff099c3d1f,Question,light,richtext,False,False,False,14,0,False,all_ads,/r/dating/comments/oekrfx/wanting_to_chat/,False,6,1625534474,1,"What is a good app to use to find people to chat with? I’m a 22(f), no OF account, and I don’t want to hookup with anyone. I want to chat and find better connections.",True,False,False,dating,t5_2qhb1,880271,public,self,Wanting to chat,0,[],1.0,https://www.reddit.com/r/dating/comments/oekrfx/wanting_to_chat/,all_ads,6,,
81,[],False,Efficient_Ad_5310,,[],,text,t2_9tsm49rm,False,False,[],False,False,1625534638,self.dating,https://www.reddit.com/r/dating/comments/oekt2g/wondering/,{},oekt2g,False,True,False,False,False,True,True,False,#ff4500,dating,"[{'e': 'text', 't': 'Question'}]",a9531dce-194e-11e5-b177-0eff099c3d1f,Question,light,richtext,False,False,True,7,0,False,all_ads,/r/dating/comments/oekt2g/wondering/,False,6,1625534651,1,Are there ant single women in their 30's? It seems like most of them are taken. I wouldn't mind going with someone a few years older than me.,True,False,False,dating,t5_2qhb1,880279,public,self,Wondering,0,[],1.0,https://www.reddit.com/r/dating/comments/oekt2g/wondering/,all_ads,6,,
82,[],False,Sheldon_Wiebe,,[],,text,t2_9910796b,False,False,[],False,False,1625535215,self.dating,https://www.reddit.com/r/dating/comments/oekyjj/how_to_cope/,{},oekyjj,False,True,False,False,False,True,True,False,#ea0027,dating,"[{'e': 'text', 't': 'I Need Advice'}]",19ec58c2-9f74-11e7-81a1-0e2bf15991f0,I Need Advice,light,richtext,False,False,True,7,0,False,all_ads,/r/dating/comments/oekyjj/how_to_cope/,False,6,1625535226,1,"How do you cope with being jealous when literally everybody you know is dating or married, and you are nearly 30 and never had sex?",True,False,False,dating,t5_2qhb1,880298,public,self,How to cope,0,[],1.0,https://www.reddit.com/r/dating/comments/oekyjj/how_to_cope/,all_ads,6,,
83,[],False,Crazy-Situation7471,,[],,text,t2_alraxkyj,False,False,[],False,False,1625535491,self.dating,https://www.reddit.com/r/dating/comments/oel16m/she_comes_back_during_no_contact/,{},oel16m,False,True,False,False,False,True,True,False,#ea0027,dating,"[{'e': 'text', 't': 'I Need Advice'}]",19ec58c2-9f74-11e7-81a1-0e2bf15991f0,I Need Advice,light,richtext,False,False,False,5,0,False,all_ads,/r/dating/comments/oel16m/she_comes_back_during_no_contact/,False,6,1625535502,1,"she first followed me on VSCO. Then a week later, sent me a Hey in Instagram. 

She blowed me off sayin we are goin too fast, blah blah blah. 

So it went like this - 

Hey 2:40 pm 

Me - Hii, How yoi doin (8:30pm) 

Puts me on seem for 30 mins and then replied 

Good how abt you. 
 
Me - Not bad at all. 
Likes and leaves. 
Its been 5 days now. No text aftr that.


Im not sure wht i should do now. I dont wanna double text. 

Wht was she trying to do there? Testing the waters or coming back ?

Help me with some suggestions. 
I want her but dont wanna be needy like before.

All thr comments appreciated. 
:)",True,False,False,dating,t5_2qhb1,880303,public,self,She comes back during no contact,0,[],1.0,https://www.reddit.com/r/dating/comments/oel16m/she_comes_back_during_no_contact/,all_ads,6,,
84,[],False,Emilybootsnstuff99,,[],,text,t2_3relixp9,False,False,[],False,False,1625535497,self.dating,https://www.reddit.com/r/dating/comments/oel18q/what_to_do_when_a_partner_does_not_respect_your/,{},oel18q,False,True,False,False,False,True,True,False,#ff4500,dating,"[{'e': 'text', 't': 'Question'}]",a9531dce-194e-11e5-b177-0eff099c3d1f,Question,light,richtext,False,False,True,35,0,False,all_ads,/r/dating/comments/oel18q/what_to_do_when_a_partner_does_not_respect_your/,False,6,1625535507,1,I (21F) have been dating a guy (24M) and he is a great guy. There’s just one thing I can’t quite understand how to deal with. My best friend told me one of the most important things to look out for is if a man respects your boundaries. He doesnt. I tell him to stop (for example not to dunk me in a pool or not to push me in a tire swing bc its going too fast and hurting my head or tickling me… etc.) and he doesnt stop. He doesn’t listen when I ask him to stop and it seriously concerns me. At first it can be something funny or joking but he takes it too far to where I don’t have fun anymore. Anyone have any suggestions on what to do or how to make it better? What can i say to him to make him understand it’s serious to me. I just feel like plain telling him to stop or being upset doesnt work so idk what to do.,True,False,False,dating,t5_2qhb1,880303,public,self,What to do when a partner does not respect your boundaries.,0,[],1.0,https://www.reddit.com/r/dating/comments/oel18q/what_to_do_when_a_partner_does_not_respect_your/,all_ads,6,,
85,[],False,Spectrasol,,[],,text,t2_d4sfklza,False,False,[],False,False,1625535559,self.dating,https://www.reddit.com/r/dating/comments/oel1su/help_i_dont_understand_why_he_do_it/,{},oel1su,False,False,False,False,False,False,True,False,#ea0027,dating,"[{'e': 'text', 't': 'I Need Advice'}]",19ec58c2-9f74-11e7-81a1-0e2bf15991f0,I Need Advice,light,richtext,False,False,True,0,0,False,all_ads,/r/dating/comments/oel1su/help_i_dont_understand_why_he_do_it/,False,6,1625535570,1,[removed],True,False,False,dating,t5_2qhb1,880304,public,self,Help.. I don't understand why he do it,0,[],1.0,https://www.reddit.com/r/dating/comments/oel1su/help_i_dont_understand_why_he_do_it/,all_ads,6,moderator,
86,[],False,Spectrasol,,[],,text,t2_d4sfklza,False,False,[],False,False,1625535808,self.dating,https://www.reddit.com/r/dating/comments/oel45a/why_he_does_this_to_me_help/,{},oel45a,False,False,False,False,False,False,True,False,#ea0027,dating,"[{'e': 'text', 't': 'I Need Advice'}]",19ec58c2-9f74-11e7-81a1-0e2bf15991f0,I Need Advice,light,richtext,False,False,True,0,0,False,all_ads,/r/dating/comments/oel45a/why_he_does_this_to_me_help/,False,6,1625535819,1,[removed],True,False,False,dating,t5_2qhb1,880309,public,self,Why he does this to me? Help,0,[],1.0,https://www.reddit.com/r/dating/comments/oel45a/why_he_does_this_to_me_help/,all_ads,6,moderator,
