,all_awardings,allow_live_comments,author,author_flair_css_class,author_flair_richtext,author_flair_text,author_flair_type,author_fullname,author_is_blocked,author_patreon_flair,author_premium,awarders,can_mod_post,contest_mode,created_utc,domain,full_link,gildings,id,is_created_from_ads_ui,is_crosspostable,is_meta,is_original_content,is_reddit_media_domain,is_robot_indexable,is_self,is_video,link_flair_background_color,link_flair_css_class,link_flair_richtext,link_flair_template_id,link_flair_text,link_flair_text_color,link_flair_type,locked,media_only,no_follow,num_comments,num_crossposts,over_18,parent_whitelist_status,permalink,pinned,pwls,retrieved_on,score,selftext,send_replies,spoiler,stickied,subreddit,subreddit_id,subreddit_subscribers,subreddit_type,thumbnail,title,total_awards_received,treatment_tags,upvote_ratio,url,whitelist_status,wls,removed_by_category,author_flair_template_id,author_flair_text_color
0,[],False,audiostarling,,[],,text,t2_1mrro3y1,False,False,False,[],False,False,1636177849,self.dating,https://www.reddit.com/r/dating/comments/qntynu/pulling_out/,{},qntynu,False,True,False,False,False,True,True,False,#ea0027,dating,"[{'e': 'text', 't': 'I Need Advice'}]",19ec58c2-9f74-11e7-81a1-0e2bf15991f0,I Need Advice,light,richtext,False,False,False,205,0,False,no_ads,/r/dating/comments/qntynu/pulling_out/,False,0,1636177860,1,"So im hanging out with my crush form college in hopes of getting into a relationship. So we were hanging out today and we started talking about contraceptions. So i said i would use condoms, but she said that she likes it without it, and expects me to just pull out, which made me pretty uncormfortable. 

I dont know how common this is, but i have heard my best male and female friend have used this method. I dont have a lot of sexual experience, almost none, but i thinks its pretty risky, im not ready to be a parent and to give my child a good life, and im afraid of getting her pregnant. Any advice?

Btw, im not going thru with it, i just dont know how to discuss this, i was pretty straight forward with saying im not cormfortable.  But in the future when we are in a relationship, i know its gonna come up.",True,False,False,dating,t5_2qhb1,1123986,public,self,Pulling out?,0,[],1.0,https://www.reddit.com/r/dating/comments/qntynu/pulling_out/,no_ads,0,,,
1,[],False,johnfischer3124,,[],,text,t2_8bpkjx85,False,False,False,[],False,False,1636178508,self.dating,https://www.reddit.com/r/dating/comments/qnu41i/all_i_crazy_for_thinking_this/,{},qnu41i,False,True,False,False,False,True,True,False,#ff4500,dating,"[{'e': 'text', 't': 'Question'}]",a9531dce-194e-11e5-b177-0eff099c3d1f,Question,light,richtext,False,False,True,2,0,False,no_ads,/r/dating/comments/qnu41i/all_i_crazy_for_thinking_this/,False,0,1636178519,1,"Hi all, I've been seeing this girl for about 2 months now. She's a dope person. And when we first met, she was intriguing as she's also a great conversationalist. Overtime, I've still communicated with her daily via text. However, for some reason, that I don't know, Im just not as motivated to call her. Like calling her seems partially seems like a chore now. I don't know why. I did mention to her that I wish she had more interests and hobbies of her own. After which, she found her self telling me that triggered her because she's been struggling to find herself and things that she likes to do. As for me, I have many hobbies and interests. So I partially feel like I'm unequally adding more value to this relationship. 

Am I wrong for thinking this way?",True,False,False,dating,t5_2qhb1,1123992,public,self,All I crazy for thinking this?,0,[],1.0,https://www.reddit.com/r/dating/comments/qnu41i/all_i_crazy_for_thinking_this/,no_ads,0,,,
2,[],False,THEPhilThePain,,[],,text,t2_9hy0vyur,False,False,False,[],False,False,1636178578,self.dating,https://www.reddit.com/r/dating/comments/qnu4ni/can_you_tell_by_their_eyes/,{},qnu4ni,False,True,False,False,False,True,True,False,#ea0027,dating,"[{'e': 'text', 't': 'I Need Advice'}]",19ec58c2-9f74-11e7-81a1-0e2bf15991f0,I Need Advice,light,richtext,False,False,True,11,0,False,no_ads,/r/dating/comments/qnu4ni/can_you_tell_by_their_eyes/,False,0,1636178589,1,"Sooo there’s a girl I think is interested in me. She makes frequent eye contact with me and she has a look that seems … dim how to describe it… but it makes me feel nice. She(21F) is older than me(18M) so I feel like I’ll be rejected. But is it reasonable to assume someone is attracted just based on how they look at you? Because if so, I might try to make a move/get to know her more and slowly ease into things since we are in a competitive collegiate team and I wouldn’t want to make things awkward between us when we may compete together(same team) next semester or next year. I’m pretty sure no one I know is going to identify me on here, so I’ll just say that my team captain specifically told all of us not to date people in the program because of past drama, but people often do date within the program anyways.",True,False,False,dating,t5_2qhb1,1123992,public,self,Can you tell by their eyes?,0,[],1.0,https://www.reddit.com/r/dating/comments/qnu4ni/can_you_tell_by_their_eyes/,no_ads,0,,,
3,[],False,Additional-Owl2736,,[],,text,t2_9tk1fuui,False,False,False,[],False,False,1636179104,self.dating,https://www.reddit.com/r/dating/comments/qnu955/insecurities/,{},qnu955,False,True,False,False,False,True,True,False,#00a6a5,dating,"[{'e': 'text', 't': 'Support Needed'}]",fd9c03b8-a1ce-11e7-9172-0e8c9f9ecf4c,Support Needed,dark,richtext,False,False,True,6,0,False,no_ads,/r/dating/comments/qnu955/insecurities/,False,0,1636179115,1,"I'm a shorter guy(21) with a girlfriend(20) that is about the same height as me. (5'3 and 5'2)

The other day we were out and we walked pass this 6'4 guy, looking alot younger than I am. She commented to herself ""wow, he's so tall"" and I said "" what?"" even though I clearly heard her. She replied fast with ""nothing"".

I with low self of steam and insecurities because of my height,  decides that the rest of the day was going to be crappy.

I talked to her about it today, and how it made me feel. I asked her if she remembered that moment and she said yes. She told me she didn't want me to feel bad because she knew I'm insecure about my hight. I said to her ""why didn't you just say it then so it didn't come out like that, now I feel insecure because I heard what you said and didnt want me to hear, and it hurt me"". 

Am I being too selfish and childish to be bothered by somethings like this? 

I wish I was tall so I can be attractive. I hate it here that I'm short. I fucken hate it. 😓",True,False,False,dating,t5_2qhb1,1123994,public,self,Insecurities,0,[],1.0,https://www.reddit.com/r/dating/comments/qnu955/insecurities/,no_ads,0,,,
4,[],False,Union-Weak,,[],,text,t2_b14yzcxy,False,False,False,[],False,False,1636179154,self.dating,https://www.reddit.com/r/dating/comments/qnu9j7/starting_to_rethink_everything/,{},qnu9j7,False,True,False,False,False,True,True,False,#46d160,,"[{'e': 'text', 't': 'Success!'}]",6b44dc18-cc88-11eb-95f2-0ed00be16b15,Success!,dark,richtext,False,False,True,2,0,False,no_ads,/r/dating/comments/qnu9j7/starting_to_rethink_everything/,False,0,1636179165,1,"Don’t get me wrong, love is beautiful and to be treasured but these days, especially in such a toxic society, dating is becoming more of a burden. Guys are only interested in hookups and casuals. So far I haven’t met anyone I can actually take seriously. 

I’m not the most compassionate and loving person but when I care, I CARE. Guys that I’ve spoken to and had situation-relation-whatever the hell 😒 with have said I’m wifey material or that I take really good care of them or that I have great motherly instincts but NOT ONE has tried to make me more than a body for them. 

So I’ve come to a place where I’m over questioning my worth and constantly praying and wondering when will someone value that part of me. I am good with being single forever. I know that’s a huge thing to say/ write but I’m honestly at a point where it is what it is. 

I’m not holding out for someone, looking through my window for Prince Charming, scrolling through dating apps to find anyone. I’m good alone and if someone comes along well good for you but I’m not holding my breath. Now, I’ll focus on me and my goals and future. And just find true happiness. So in my book this is a success. 


That’s it, that’s the rant.",True,False,False,dating,t5_2qhb1,1123994,public,self,Starting to rethink everything,0,[],1.0,https://www.reddit.com/r/dating/comments/qnu9j7/starting_to_rethink_everything/,no_ads,0,,,
5,[],False,pardon_01,,[],,text,t2_8t2immq1,False,False,False,[],False,False,1636180307,self.dating,https://www.reddit.com/r/dating/comments/qnuirv/anyone_wanna_talk_dm_me_open_for_any_conversation/,{},qnuirv,False,False,False,False,False,False,True,False,#ff4500,dating,"[{'e': 'text', 't': 'Question'}]",a9531dce-194e-11e5-b177-0eff099c3d1f,Question,light,richtext,False,False,True,2,0,False,no_ads,/r/dating/comments/qnuirv/anyone_wanna_talk_dm_me_open_for_any_conversation/,False,0,1636180318,1,[removed],True,False,False,dating,t5_2qhb1,1124003,public,self,"Anyone wanna talk dm me, open for any conversation.",0,[],1.0,https://www.reddit.com/r/dating/comments/qnuirv/anyone_wanna_talk_dm_me_open_for_any_conversation/,no_ads,0,moderator,,
6,[],False,alexistheadventurer,,[],,text,t2_fnxig3zv,False,False,False,[],False,False,1636181230,self.dating,https://www.reddit.com/r/dating/comments/qnuq3t/does_she_mean_what_she_says_when_drunk/,{},qnuq3t,False,True,False,False,False,True,True,False,#ff4500,dating,"[{'e': 'text', 't': 'Question'}]",a9531dce-194e-11e5-b177-0eff099c3d1f,Question,light,richtext,False,False,True,4,0,False,no_ads,/r/dating/comments/qnuq3t/does_she_mean_what_she_says_when_drunk/,False,0,1636181241,1,"I’m (33F) very casually seeing a woman (40F). 

We have a really great connection and luckily want the same thing: a long-distance friendship where when we do see each other, we enjoy each other’s company and hook up. Nothing more serious than that.

We live far apart, and we text and talk on the phone every couple of days. 

She drinks a lot and often. 

When she’s sober, she’s not vulnerable at all, and definitely doesn’t express much in the way of feelings, especially about me. We talk casually about our work and hobbies. 

When she’s drunk, she’s much more talkative, vulnerable, and tells me she’s really into me. She lists all the reasons I’m “perfect” in detail. She sexts assertively and writes long role plays where she calls me her girlfriend and strongly expresses her interest in me not just sexually but as a person and partner. It’s super hot and flattering, and really enjoyable. 

I’m really into her, and I love our current casual status; I’m enjoying my single life and don’t want to be in a serious relationship. She is with someone else and doesn’t have any plans to change that. Perfect - we’re on the same page about not wanting to enter into a serious relationship with each other. 

So I’m not looking for relationship advice as much as I’m looking for information: 

(1) When someone expresses these things while drunk, especially multiple times and in the same way, is that because they feel that way sober, and alcohol just lowers their inhibitions so they’re just expressing what they feel? Or can alcohol significantly exaggerate feelings that might only be mild? 

The reason it matters is because when I express affectionate things to her, if she’s sober, her responses have textbook “she’s not that into it” vibes. But if she’s drunk, SHE is the one pouring praise, affection, admiration, romance, and sexiness toward me. Lately, in our sober conversations, I’ve found myself holding back and staying platonic because I can’t tell if she enjoys me initiating that stuff. I’m getting completely opposite signals between when she’s sober vs. drunk. So, I’m asking this question to see if I should just stick with platonic conversation, and just enjoy the moments (and reply accordingly) when she initiates affection/more. 

I would normally just directly ask someone how they feel, but I’m hesitant to ask her directly, because I don’t want her to get the impression that I require an answer. Part of what we both love about our situation is the spontaneity and lack of expectations. (I know, I know… good communication is always an expectation… but help me out here 😄)

TL;DR - If someone says something whenever they’re drunk, is that likely their true feeling, or could alcohol be exaggerating the actual feeling?",True,False,False,dating,t5_2qhb1,1124005,public,self,Does she mean what she says when drunk?,0,[],1.0,https://www.reddit.com/r/dating/comments/qnuq3t/does_she_mean_what_she_says_when_drunk/,no_ads,0,,,
7,[],False,PS5_deprived,,[],,text,t2_fy3ur3pq,False,False,False,[],False,False,1636181711,self.dating,https://www.reddit.com/r/dating/comments/qnutxv/the_pressure_in_getting_a_partner_and_not_being/,{},qnutxv,False,True,False,False,False,True,True,False,#ea0027,dating,"[{'e': 'text', 't': 'I Need Advice'}]",19ec58c2-9f74-11e7-81a1-0e2bf15991f0,I Need Advice,light,richtext,False,False,False,3,0,False,no_ads,/r/dating/comments/qnutxv/the_pressure_in_getting_a_partner_and_not_being/,False,0,1636181722,1,"Not a rant, I just feel depressed and confused about dating.

I keep seeing posts about Tinder, dating, sex, hookups, you name it on here. I'm 25 and in college, and I can run a half marathon. The only issue I see is my face, as it isn't ""masculine"" like George Clooney or some underwear model. I have a full beard though. I've written a proper bio on my Tinder. The only explanation I can think of is that most girls don't frequent Tinder, even if they have a profile. Does it take living in a multimillion population city to get multiple matches, like it's advertised for? Is Tinder really a successful tool for 90% of guys that don't live in London or NYC?

Is it a major loss to not be having promiscuous sex or being in a relationship? I try to not think about being alone but every time I see a guy and a girl holding hands/studying together I feel a loss. It makes me keep going back to Tinder in hopes of somehow beating the ridiculous odds and landing a match, resulting in only seeing the same like I got 3 months ago when I joined. I wish I didn't think so much about this and could enjoy life like I did up to age 10.",True,False,False,dating,t5_2qhb1,1124006,public,self,The pressure in getting a partner and not being able to,0,[],1.0,https://www.reddit.com/r/dating/comments/qnutxv/the_pressure_in_getting_a_partner_and_not_being/,no_ads,0,,,
8,[],False,DidaBalkan,,[],,text,t2_g2r7o6yl,False,False,False,[],False,False,1636183356,self.dating,https://www.reddit.com/r/dating/comments/qnv6zu/what_was_your_worst_date/,{},qnv6zu,False,False,False,False,False,False,True,False,#ff4500,dating,"[{'e': 'text', 't': 'Question'}]",a9531dce-194e-11e5-b177-0eff099c3d1f,Question,light,richtext,False,False,True,2,0,False,no_ads,/r/dating/comments/qnv6zu/what_was_your_worst_date/,False,0,1636183367,1,[removed],True,False,False,dating,t5_2qhb1,1124006,public,self,What was your worst date?,0,[],1.0,https://www.reddit.com/r/dating/comments/qnv6zu/what_was_your_worst_date/,no_ads,0,moderator,,
9,[],False,CherLaMaine,,[],,text,t2_a5ujkiv4,False,False,False,[],False,False,1636184724,self.dating,https://www.reddit.com/r/dating/comments/qnvhje/should_i_go_back_to_my_90_day_rule/,{},qnvhje,False,True,False,False,False,True,True,False,#ea0027,dating,"[{'e': 'text', 't': 'I Need Advice'}]",19ec58c2-9f74-11e7-81a1-0e2bf15991f0,I Need Advice,light,richtext,False,False,True,27,0,False,no_ads,/r/dating/comments/qnvhje/should_i_go_back_to_my_90_day_rule/,False,0,1636184736,1,"Honestly ever since discovering Im(f20) demisexual this has been weighing heavily on my mind. I want a relationship but no guy I like seems to think I’m worth their time and wanna keep things casual. The thing is hook ups feel TERRIBLE, but I still crave touch😭 I just thought something was wrong with me but no it’s because I require some type of emotional connection to be sexually attracted to someone and feel comfortable enough to enjoy it. As much as I like sex I think I need to wait the 90 days to guard myself but I’m afraid no guy would be willing to, ugh am I doing too much? Is this me being unreasonable ? I feel like less than a year ago when I was a virgin things were easier😭 but also do dating apps have some role to play in my expectation of men? I have friends that have found great success in finding decent guys that weren’t on the hunt for just sex…",True,False,False,dating,t5_2qhb1,1124011,public,self,Should I go back to my 90 day rule?,0,[],1.0,https://www.reddit.com/r/dating/comments/qnvhje/should_i_go_back_to_my_90_day_rule/,no_ads,0,,,
10,[],False,juliancerc,,[],,text,t2_5mlmheeq,False,False,False,[],False,False,1636185416,self.dating,https://www.reddit.com/r/dating/comments/qnvms6/long_distance/,{},qnvms6,False,True,False,False,False,True,True,False,#ea0027,dating,"[{'e': 'text', 't': 'I Need Advice'}]",19ec58c2-9f74-11e7-81a1-0e2bf15991f0,I Need Advice,light,richtext,False,False,True,7,0,False,no_ads,/r/dating/comments/qnvms6/long_distance/,False,0,1636185428,1,"Really feel like I could truly love somebody, but we’re headed in directions where we’re gonna be apart for some time. Is long distance worth it? I’ve only heard bad things but I care about this girl so much it seems like a good idea. Please weigh in I need some external opinions.",True,False,False,dating,t5_2qhb1,1124015,public,self,Long distance?,0,[],1.0,https://www.reddit.com/r/dating/comments/qnvms6/long_distance/,no_ads,0,,,
11,[],False,icangodown,,[],,text,t2_8cwsmavk,False,False,False,[],False,False,1636186907,self.dating,https://www.reddit.com/r/dating/comments/qnvy8p/what_makes_guys_stay/,{},qnvy8p,False,True,False,False,False,True,True,False,#ff4500,dating,"[{'e': 'text', 't': 'Question'}]",a9531dce-194e-11e5-b177-0eff099c3d1f,Question,light,richtext,False,False,True,12,0,False,no_ads,/r/dating/comments/qnvy8p/what_makes_guys_stay/,False,0,1636186918,1,Im 20F. I had been in a relationship but broke up soon. I tried to date but the boys were mostly interested in sex. I even ended up being someone's mistress lately. It just hurts and I think I'll never find someone who would love me the way i would want them too. Is it just my age or loyal guys are hard to find?,True,False,False,dating,t5_2qhb1,1124015,public,self,What makes guys stay?,0,[],1.0,https://www.reddit.com/r/dating/comments/qnvy8p/what_makes_guys_stay/,no_ads,0,,,
12,[],False,0PPR3550R,,[],,text,t2_o8z8t,False,False,False,[],False,False,1636186987,self.dating,https://www.reddit.com/r/dating/comments/qnvyso/how_do_i_start_a_conversation/,{},qnvyso,False,True,False,False,False,True,True,False,#ea0027,dating,"[{'e': 'text', 't': 'I Need Advice'}]",19ec58c2-9f74-11e7-81a1-0e2bf15991f0,I Need Advice,light,richtext,False,False,True,14,0,False,no_ads,/r/dating/comments/qnvyso/how_do_i_start_a_conversation/,False,0,1636186998,1,"Usually I read her bio, look at her photos and get creative with a detail. However, i get ignored all the time(past 2 years). In fact, the only conversations and dates i had were when she started the conversation. Some examples: ""hey nice restaurant picture, i remember that place, isn't it (name)?"" or when she's all about emoticons in her bio ""👫➕🍕❓"" target audience is 22-32, I'm 27

So how do I start a conversation?",True,False,False,dating,t5_2qhb1,1124016,public,self,How do I start a conversation?,0,[],1.0,https://www.reddit.com/r/dating/comments/qnvyso/how_do_i_start_a_conversation/,no_ads,0,,,
13,[],False,Here-Is-Your-Answer,,[],,text,t2_4vtv6gom,False,False,False,[],False,False,1636187522,self.dating,https://www.reddit.com/r/dating/comments/qnw2xq/serious_ive_been_dating_an_incredible_woman_with/,{},qnw2xq,False,True,False,False,False,True,True,False,#ea0027,dating,"[{'e': 'text', 't': 'I Need Advice'}]",19ec58c2-9f74-11e7-81a1-0e2bf15991f0,I Need Advice,light,richtext,False,False,True,5,0,False,no_ads,/r/dating/comments/qnw2xq/serious_ive_been_dating_an_incredible_woman_with/,False,0,1636187533,1,"I know their mother and I have incredible chemistry and we’re very focused on building our relationship as we’re immeasurably compatible. How do I help manage how best to become the parental figure she wants for her sons? I knew what I was getting into. She, and they, deserve a great man and I’m up for the task. I’m hoping for some advice as to what I should do from now on.",True,False,False,dating,t5_2qhb1,1124017,public,self,[Serious] I’ve been dating an incredible woman with two young sons; they are two and three years old.,0,[],1.0,https://www.reddit.com/r/dating/comments/qnw2xq/serious_ive_been_dating_an_incredible_woman_with/,no_ads,0,,,
14,[],False,abbyehe,,[],,text,t2_4inmqi2h,False,False,False,[],False,False,1636187604,self.dating,https://www.reddit.com/r/dating/comments/qnw3lg/am_i_bisexual_or_i_view_women_as_objects/,{},qnw3lg,False,True,False,False,False,True,True,False,#ff4500,dating,"[{'e': 'text', 't': 'Question'}]",a9531dce-194e-11e5-b177-0eff099c3d1f,Question,light,richtext,False,False,True,5,0,True,no_ads,/r/dating/comments/qnw3lg/am_i_bisexual_or_i_view_women_as_objects/,False,0,1636187615,1,"When i watch porn sometimes, the sight of men do not turn me on but women. However, men would be the ones appearing in fantasy more than women do. 

I’ve been thinking of dating women for a while now but I am afraid that I might have developed a skewed, rather fucked up view on women and I do not just want to date them for the sake of that.",True,False,False,dating,t5_2qhb1,1124017,public,nsfw,Am i bisexual or I view women as objects?,0,[],1.0,https://www.reddit.com/r/dating/comments/qnw3lg/am_i_bisexual_or_i_view_women_as_objects/,no_ads,0,,,
15,[],False,christhechaldean,,[],,text,t2_en55pzag,False,False,False,[],False,False,1636187688,self.dating,https://www.reddit.com/r/dating/comments/qnw46q/how_cringey_is_it_to_confess_feelings_over_text/,{},qnw46q,False,True,False,False,False,True,True,False,#ea0027,dating,"[{'e': 'text', 't': 'I Need Advice'}]",19ec58c2-9f74-11e7-81a1-0e2bf15991f0,I Need Advice,light,richtext,False,False,False,3,0,False,no_ads,/r/dating/comments/qnw46q/how_cringey_is_it_to_confess_feelings_over_text/,False,0,1636187699,1,"She's super busy for the next week and I'm feeling lonely right now and I want to tell her how I feel and I have a text typed up that expresses adequately how I feel. We've been dating for a couple months, nothing sexual yet and barely physical contact because I'm really shy about that and I think she is too, not sure how into me she is. So yeah basically ladies if you got a ""hey I know I don't show it but I want to hold hands and kiss and stuff"" text how cringey would it be. For context we're both students at the same college but we met on a dating app.",True,False,False,dating,t5_2qhb1,1124017,public,self,How cringey is it to confess feelings over text?,0,[],1.0,https://www.reddit.com/r/dating/comments/qnw46q/how_cringey_is_it_to_confess_feelings_over_text/,no_ads,0,,,
16,[],False,sparklykai,,[],,text,t2_67ssrxpv,False,False,False,[],False,False,1636187694,self.dating,https://www.reddit.com/r/dating/comments/qnw485/should_you_not_date_someone_because_of_what/,{},qnw485,False,True,False,False,False,True,True,False,#ffd635,dating,"[{'e': 'text', 't': 'Giving Advice'}]",7bca2c58-4211-11e5-9ecb-0e60d8112001,Giving Advice,dark,richtext,False,False,False,52,0,False,no_ads,/r/dating/comments/qnw485/should_you_not_date_someone_because_of_what/,False,0,1636187705,1,"Hello!! I’ve been seeing m(29) for about 4 months. we’ve just been a fwb who casually goes out to do things. there is definitely emotion involved and i’ve grown to love hanging out with him. we connected well because we both have never been in a relationship. though recently we were in a rough situation but it’s been taken care of. he was very supportive. 
last week we started talking about feelings and all, i admitted mine and there was an emotional rollercoaster and he started crying  when i told him everything i felt. he then he told me “i do too but the age is a huge factor for me i hate that timing is off” i got upset and accused that as being an excuse and bs but he said “i take you out, we do things together and i drive 40 mins out to see you i care about you. i’ve always been honest with you” and then he kept saying “we’re just at different life stages best way i can put it is would date an 18 year old if you were my age” which is understandable. however he still is taking me out to dates and everything is still amazing between us but is age a factor or could he be lying? he did prove points.",True,False,False,dating,t5_2qhb1,1124017,public,self,should you not date someone because of what age/life stage your in? f(20) m(29),0,[],1.0,https://www.reddit.com/r/dating/comments/qnw485/should_you_not_date_someone_because_of_what/,no_ads,0,,,
