,id,created_utc,title,selftext,subreddit,subreddit_id,url
49,oercv1,1625562994,Don’t know if I’m missing something or if it’s something I’m doing?,"I went out the other day and long story short my cousin brought her friend, I didn’t think anything would happen, and she had a boyfriend too. She made some comments asking me why I’m not dancing with any girls (everybody seemed older than me at the club I just turned 21) and was calling me her freak lol, but somehow at some point in the night we get to talking one on one and holding hands away from the group. 

Long story short she said I was cute and said actually would actually use my  sperm if I was a sperm donor, which was a really nice and funny compliment. We end up holding hands walking to where someone was going to pick us up, we held hands on the car ride and that was pretty much it.

Now here’s the problem, I wish girls were genuine when they make moves like this, in this situation it’s kind of easier see things clearly. She has a long distance boyfriend I think and she probably just got carried away while drunk, but I’ve been in situations where I’ve had girls have sex with me and not want to see me again. 

I had a girl that I was hanging out with every weekend, I really liked her, I knew she was not the relationship type, and I kind of steered her in the relationship direction until she said that she didn’t want one once things got more serious (so she basically said that she thought it would be better that we end things). 

I’ve had female friends say I give off a very fun, carefree vibe, but that’s just my natural personality so I’m guessing like girls maybe see me and think like they can have some fun with me. That’s cool and all but honestly, without trying to sound all lovey dovey or anything, I just want a genuine relationship with a girl.

I just want something real tbh, and I’m tired of feeling like I’m just this girls guy for the night. I’ve been thinking about asking more reserved/shy girls bc they seem to be more loyal/genuine, but it’s so hard to read them so I’ve always been hesitant since never know if they actually like me. In my heart of hearts I feel like I have a lot to offer (in terms of like being caring, or being “boyfriend material) but I’ve never been in a relationship.

I’ve always been sort of shy and struggle with self esteem sometimes, but I wonder if my low confidence could be holding me back from going after girls who are better for me. Or it could just be something completely different, I have insecurities about being too dorky, not attractive enough, etc, but I’m just brainstorming.",dating,t5_2qhb1,https://www.reddit.com/r/dating/comments/oercv1/dont_know_if_im_missing_something_or_if_its/
50,oerdxr,1625563144,Dating advice for self employed non driver living with their parents,"I like a simple life and I work from home with my parents, I'm 25 from the UK and don't really want to live in a city where most of the people my age seem to live, work and party every weekend, I have a ton of hobbies some of which I monetise, I don't get any matches on the 5 different apps I use.

I don't drive and I don't want to

Should I just give up?",dating,t5_2qhb1,https://www.reddit.com/r/dating/comments/oerdxr/dating_advice_for_self_employed_non_driver_living/
51,oerf61,1625563326,BDSM MISTRESS,"Hello, I’m Luciana Scott and I’m a BDSM kinky mistress and I’m here to get a slave that will be dominant for me only and I’m ready to commit myself to him/her and I’m a trustworthy lady. Anyone who is ready to be submissive to my domain should hit me up on my following details:

kik: luciana1275
Mobile number: (479) 407-0749",dating,t5_2qhb1,https://www.reddit.com/r/dating/comments/oerf61/bdsm_mistress/
52,oeri8e,1625563759,My Bachelorette moment when I am usually the DUFF.,"This has never happened to me before so I thought that I would share this experience from July 4th. I had no expectations for the night but I did not expect to feel like I was on the Bachelorette. I should note that I am not someone who is approached romantically often, a lot of it has to do with how awkward I am with flirting and the fact that all my friends are gorgeous so i’m usually the one overlooked. Don’t get me wrong though, I’m still outgoing and a good time but at the end of the night the men turn to my friends and ask for their numbers. On Sunday night, I arrived at a rooftop party with my best friend, Paulina, and it starts off normal; we chat around and take shots with guys but nothing comes of it. The party begins to die down at 1 am and so a handful of us are left hanging out at the rooftop apartment. I was with Paulina, her boyfriend Cole, and his two friends whom I just met for the first time, Alex and Gary. At this point, I’m drunk and like most people I get less awkward when I’m drunk. I was flirting with Alex and Gary but nothing too serious. We decide to go swimming around 2 am and we invite a few more friends to join. Alex and Gary separate themselves and go into the hot tub and ask only me to join them. I enter the hot tub and they both keep lifting their feet up so I ask why. Alex says “Look at how big Gary’s feet are. but you know my d*ck is still bigger.” I was surprised about that last bit because there was no sexual nature in our environment at all prior. Out of the blue, Gary puts his arms around me and starts complimenting me but it makes me uncomfortable. I’m not a very confrontational person, so I just say I’m going to go back into the pool with my other friends. I start feeling awkward because I am deadass wearing my underwear and br* in the pool because I didn’t have a swimsuit, I didn’t feel weird before because our interactions were light hearted flirting but now it’s progressed further and I realize half my *ss is hanging out around these guys. I wanna add that I find both Alex and Gary physically attractive, but Gary’s pushiness makes me begin to find him unappealing. I go to the pool and start talking to my male friend and Gary gets into the swimming pool and is hugging me so I told him to stop because I didn’t want to do that in front of a bunch of people. He was starting to hover over me, when I moved around the room, he followed. When another guy flirted with me he would put his arm around me like he was trying to claim me as off limits and it BUGGED me. As time passed, we were sitting in the hot tub when Cole’s friend ended up joining us, Dayln. We introduced ourselves and in front of everyone, Dayln says a cheesy pick up line to me and everyone laughs but Gary, as you can guess, tried putting his arm on my back to “claim” me in front of Dayln. At this point, I’m annoyed and ready to just end my night because it was like 4 am. So we decide to all head back to the apartment as we were heading up a new friend joined us, his name is Chris. Things were calmer back in the apartment, but Gary continued to get weird whenever someone flirted with me. I end up being alone in a room with Chris and he tells me that he always sees me around and that he has wanted to try to talk to me. So we exchange numbers and he asks me on a date. I guess Gary got the memo and he separated me from everyone else. He tells me “You are so amazing, I need to take a girl like you on a date.” and I exchange my number with Gary too. I go up to Paulina and tell her about how two guys have asked for my number and Paulina tells me that Alex asked her if I was single. At this moment, I was shocked that all these guys were interested in me. So this is my interactions summed up: I walk into the kitchen, Gary comes up to me and is hugging me so then I make my way to the living room alone. Chris comes up and we are flirting, he’s putting his hands on my thighs. So I go to Dalyn, I end up somehow giving him a back rub. Then the next second i’m flirting with Alex. Like i’m having these moments in front of the other guys. It really felt like a “Hey can I steal her for a sec” scenario. Out of everyone though, I really liked Dalyn, he wasn’t pushy, he was sweet and goofy. There was a moment where he was reading a book to me and he had a really soothing voice. So I grabbed the book and was reading to him and he was just lovingly staring at me. He says “I’m sorry, i’m being creepy.” I said “why because you’re staring at me?” and he replies “I can’t help it.” It was really sweet. At 8am, everyone collectively agrees it’s time to end our ‘night’. I was kind of bummed out that I never got Dalyns contact. I was texting Paulina later in the day about how out of everyone, I liked Dalyn the most. At about 6pm Paulina texts me “So Dalyn just asked Cole for your number.” VICTORY!!! So I have a date with Dalyn on Tuesday, a date with Chris on Wednesday, and a date with Gary on Saturday. 
It was a fun experience to be *that* desired person because I normally get overlooked. I also don’t find any of these guys creepy or anything, keep in mind we were all drunk.",dating,t5_2qhb1,https://www.reddit.com/r/dating/comments/oeri8e/my_bachelorette_moment_when_i_am_usually_the_duff/
53,oerkj5,1625564098,Do women feel insecure with very attractive men?,[removed],dating,t5_2qhb1,https://www.reddit.com/r/dating/comments/oerkj5/do_women_feel_insecure_with_very_attractive_men/
54,oerpj0,1625564766,Tired of Dating,"21F so i use Tinder and i get a good amount of messages on a daily basis. 

i think im pretty down to meet new people but after a while im getting really tired of having to reintroduce myself to someone over and over again. with the amount of attention i get, i can probably schedule a date every weekend but thats so exhausting to me. 

im sick of dating, i dont even think i want something serious from the jump but something consistent with the potential to grow would be nice. it seems like i can never get passed the initial talking stages. 

this suckkkks",dating,t5_2qhb1,https://www.reddit.com/r/dating/comments/oerpj0/tired_of_dating/
55,oerw5j,1625565662,I can't let myself cry because I'm afraid I'll never stop,"I (M25) went through a really hard breakup a little over a month ago. We checked back in a few weeks after the initial breakup, and my ex (F25) officially told me that she was done. That was about two weeks ago. She told me that there was no chance of getting back together. But I still mourn her every day. She cried like a baby the day she ended it, and I didn't shed a tear.

But I am sad. I've never felt so lost and alone. I feel as if a part of me is dead. She made me a better person, but the side of me that grew while I was with her is fading away, like a wraith in the winter mist. I want to cry, but I can't bring myself to shed any tears. If I do, then I feel like the tears will never stop. I'd drown in my own sorrow.",dating,t5_2qhb1,https://www.reddit.com/r/dating/comments/oerw5j/i_cant_let_myself_cry_because_im_afraid_ill_never/
56,oes43m,1625566705,Hi People,"Life always gives us another chance.  Her name is tomorrow, I wish you all happiness",dating,t5_2qhb1,https://www.reddit.com/r/dating/comments/oes43m/hi_people/
57,oes5fh,1625566875,How do women today view aggression in their male partners?,"Focusing here on biological female/male relationships, but it’s open to all couples of course. 

I consider myself (M21) someone who has my behavioral balance pretty honed in. I used to be a very non confrontational person, even if someone was rude to me I would avoid conflict if that meant not sticking up for myself, but the last few years I feel like I have developed a tougher outer shell. I consider a pretty friendly guy, but I admit sometimes I can still be blunt with people. My girlfriend (M23) assures me she likes it when I’m sweet to her and mean everybody else (of course not outside the parameters of being polite), which I try very hard to do. 

I have a friend (M24) who is an absolute sweetheart. He’s such a nice guy and all my peers like him, he’s known around work as being the main positive energy. Unfortunately he hasn’t had much luck in the dating department. I ended up dating our mutual friend (my now current girlfriend) and I am trying my best to help him find a partner. My advice has always been to him, “friend, you’re really kind and sweet. That’s great. Keep it up. But women like a little bit of an edge. Be rough on the exterior and soft and gooey on the interior, be a little more sharp.” 

I am not sure if I have him good advice. My question, is women who are interested in men, how do you feel about male aggression? Do you like it only in certain scenarios? If so, what kind? If not, why? Do you prefer if your partner was more of a lover than a fighter? Or vice versa? How much of an edge do you like, if at all? Would you rather he deliberately choose to be aggressive or it be automatic, if so? 

I am defining male aggression not as toxic masculinity, but as a male’s ability to get aggressive If stimulated whether he does so consciously or it being a natural response.",dating,t5_2qhb1,https://www.reddit.com/r/dating/comments/oes5fh/how_do_women_today_view_aggression_in_their_male/
58,oes6v4,1625567060,Im 182cm (barefoot) and wear shoes that give me 2cm extra height.,[removed],dating,t5_2qhb1,https://www.reddit.com/r/dating/comments/oes6v4/im_182cm_barefoot_and_wear_shoes_that_give_me_2cm/
59,oesfo8,1625568257,Do you creep on your crushes social media’s?,"Do you think that creeping on your crushes social media’s is weird/unhealthy? And if you do, how often do you do it?",dating,t5_2qhb1,https://www.reddit.com/r/dating/comments/oesfo8/do_you_creep_on_your_crushes_social_medias/
60,oesfre,1625568267,27 year old woman who's biological clock is ticking and has no time to waste when it comes to starting a family. Is dating officially out for me?,[removed],dating,t5_2qhb1,https://www.reddit.com/r/dating/comments/oesfre/27_year_old_woman_whos_biological_clock_is/
61,oesood,1625569391,Story time,[removed],dating,t5_2qhb1,https://www.reddit.com/r/dating/comments/oesood/story_time/
62,oesr56,1625569699,Relationship,[removed],dating,t5_2qhb1,https://www.reddit.com/r/dating/comments/oesr56/relationship/
63,oesrhm,1625569750,What they really mean,"I am not sure if I should post this here since it's a gay story but anyway straight people can be related as well. 

When someone tells you he's not looking for a relationship or not looking to date now, what he/she  really means is I'm not that into you, but I will eventually date someone else. 
I met this guy last year, when we were chatting I asked him what are you looking for he said: ""I want someone to have sex with, if we like each other and it gives more in the future, I won't be opposed to something serious "", I said ok let's do it.

After a while I was catching feelings cause sex was good and he's my dream guy. When I told him that I like him and where things are going between us, he replied back "" I know you like me, but I'm not looking to date right now, cause I'm super busy with job, bla bla bla"", I  knew it was some random excuse but I couldn't let him go. After he started to distancing himself, taking more time to reply back to messages,  canceling on me etc... when I saw the situation were becoming unsustainable, I asked him to stay away from me, wich he did without hesitation. Last time we had sex was in March, after that total ghosting. I unfollowed on social media until last weekend I went to check his IG, and surprise surprise the busiest guy in the world happens to be dating a new guy, it was all over his IG, all of his IG stories were about the new guy, travel together doing things only I could dream of. 
I've been depressed for more than a year now because of him, im seeing a psychiatrist and a therapist, im on medication. But since last week after checking is IG, I feel like I'm the most worthless piece of garbage ever, a loser, a low life, an idiot who became attached to a man who were using me for sex only while was looking for something better. 

I blame myself more than I blame him cause I knew better but on the other hand he always made me feel like a complete obsessive lunatic everytime I confronted him about the mistreatment, saying that I'm overly dramatic, that it's all in my mind ect... Please guys, don't please with people who only have love and good intentions for you. 

Sorry English is my 4th language",dating,t5_2qhb1,https://www.reddit.com/r/dating/comments/oesrhm/what_they_really_mean/
64,oeszac,1625570682,"27 years old, biological clock is ticking and can't afford to waste anymore time. Should I quit dating?",[removed],dating,t5_2qhb1,https://www.reddit.com/r/dating/comments/oeszac/27_years_old_biological_clock_is_ticking_and_cant/
65,oet1vz,1625570988,Missed opportunity,"Hi all. Last month I went on vacation to a foreign country. Stayed at an all inclusive resort and my friends and I hung out in the pool all week. One day, we were hanging out and we started talking to this group of girls. I was talking to one and it turns out we are from the same state and frequent the same places. At one point this girl just kisses me out of nowhere. She was a perfect 10 and stuff like that never happens to me. She disappeared after that and then the next day we saw each other briefly and it was like nothing ever happened. I’m still sad about this. I could have hung out with her more there, gotten her number and all that stuff. This experience also has me fed up with people. Another group that was talking with all of us was a group of swingers (a throuple in their 20s) and they started hitting it off. I don’t know if this girl wasn’t involved in anything with them, but her friend was and I just feel embarrassed about how weird the situation was. I feel like I wasn’t intriguing enough and the absolute extreme went wrong. I could have gotten closer to this girl but maybe my anxiety got the best of me. Crazy life lol. Just needed to vent because this has been on my mind a lot.",dating,t5_2qhb1,https://www.reddit.com/r/dating/comments/oet1vz/missed_opportunity/
66,oetfxu,1625572668,Dating with a religion/faith based background?,"I guess polls aren’t allowed but I was curious to see if you could drop a comment if you’re a 24 or older male or female who is waiting til marriage for sex/losing your virginity. 

What have your personal experiences been in navigating dating in today’s day and age/through dating apps?",dating,t5_2qhb1,https://www.reddit.com/r/dating/comments/oetfxu/dating_with_a_religionfaith_based_background/
67,oethg4,1625572822,New video up 😈,[removed],dating,t5_2qhb1,https://www.reddit.com/r/dating/comments/oethg4/new_video_up/
68,oetjpm,1625573068,Help: I don't know how to handle the situation as I never experienced it before...,[removed],dating,t5_2qhb1,https://www.reddit.com/r/dating/comments/oetjpm/help_i_dont_know_how_to_handle_the_situation_as_i/
69,oetmol,1625573397,Ex asked me for old photos of us,"Me (20M)and my EX(20F) broke up about 9 months ago because of the stress from Uni and we haven't talked since. It was a rough breakup and despite her initiating it she said she still cares about me, that I will always be her first love and that we would meet again one day.

 I have finally been able to  move on when unexpectedly she texts me at 1 am a couple of days ago asking if I can send her some old photos of us from when we were dating. I send them through to her, and she starts asking me lots of questions about how I'm doing and if I have a new GF while also bringing up fun things we did in the past and reminiscing.

Part of me is happy that we can be friendly while part of me misses her in a way that I haven't in months. I don't understand why she would want them when she broke up with me and why she would be so interested about what I'm up too now after so long? Does she miss me?",dating,t5_2qhb1,https://www.reddit.com/r/dating/comments/oetmol/ex_asked_me_for_old_photos_of_us/
70,oets2q,1625573976,Sleepover with no sex,"I’ve (23 F) been seeing this guy (24 M) for about a month and we have been hanging out a lot. I’m not sure what he’s looking for yet or what he wants, we haven’t had the conversation yet, but I like him a lot. We have had sex a few times, and it was amazing every time. Last night he came over late after getting back from his weekend away with friends for the 4th of July. We just watched part of a movie, talked, kissed, cuddled, and went to sleep. No sex. I kind of expected that we might want to have sex, but he didn’t initiate anything, and when we kissed and stuff he didn’t take any opportunities, but was still very affectionate. He brought his clothes for work and headed off to work in the morning. Could this be a sign that he might want to be serious with me?",dating,t5_2qhb1,https://www.reddit.com/r/dating/comments/oets2q/sleepover_with_no_sex/
71,oetvr0,1625574364,He doesn’t text on the weekends?,"I(23) met a guy (23)on a dating app. Very nice but also very cute .. which sometimes scares me. Anyway, we’ve met only 2x and then I had to get sinus surgery so we knew it would prob be 2ish wks until we saw each other. I honestly thought he’d drop me when he found out about the recovery time. But he texted me the whole time through. I’m finally feeling human again and ready to make plans. But haven’t heard from him since Friday. It’s Tues. he does this every weekend where he doesn’t text me during the weekend but we text during the week. It’s hard for me to text during the week sometimes bc of my job so I could go hours without answering. But anyway what do you think of him not texting during the weekends. I always see that he’s with his friends on his story and also he lives with his parents. Not sure opinions?",dating,t5_2qhb1,https://www.reddit.com/r/dating/comments/oetvr0/he_doesnt_text_on_the_weekends/
72,oeu1kh,1625574974,At what age do you start feeling ashamed of being single?,"The tittle says everything. What you guys think? 

People are getting engaged and i cant fcking get a single date. 

Its so sad and embarrassing. 

I cant even tell how many dreams i have often where im in a relationship and wake up and im completely single and lonely.

Im so ashamed of going around and seeing other couples while i have to pretend that i am okay having no relationship. 

At some point it starts to affect you physically, mentally, emotionally. 

Sorry about the venting.",dating,t5_2qhb1,https://www.reddit.com/r/dating/comments/oeu1kh/at_what_age_do_you_start_feeling_ashamed_of_being/
73,oeu3xp,1625575210,Where am I supposed to meet women at ?,[removed],dating,t5_2qhb1,https://www.reddit.com/r/dating/comments/oeu3xp/where_am_i_supposed_to_meet_women_at/
74,oeu9uc,1625575818,Is age important?,"I’m a 35F and chatting to a 30M who seems quite keen. I’m not sure why, but I am thinking I might be too old for him… Is that a stupid thing to think? Pretty sure you’ll all say it depends on how mature he is. He owns his house, which is a good sign. He’s only lived in one area his whole life though and I’ve lived in many and travelled a bit. Am I just overthinking this? We haven’t even met yet?! 🤦🏻‍♀️",dating,t5_2qhb1,https://www.reddit.com/r/dating/comments/oeu9uc/is_age_important/
