,id,created_utc,title,selftext,subreddit,subreddit_id,url
0,qdy06z,1634964252,Feeling decent but not great after 1st date.. what to do?,"As the title says, I feel decent but not great after a 1st date with a new girl. She's really nice and we had decent conversation with some moments of genuine fun. I feel decent but not necessarily super compelled. I find her quite cute and physically attractive, and I don't think that would be the major issue. I'm wondering if this is just because it's still too early or if there's an issue with compatibility. Help! What should I do? What are my options?",dating,t5_2qhb1,https://www.reddit.com/r/dating/comments/qdy06z/feeling_decent_but_not_great_after_1st_date_what/
1,qdy2kb,1634964536,How to comfort your girlfriend when she's scared ?,Me and my girlfriend were watching the Travel Channel she loves those haunted shows but she gets scared to watch them at night especially close to bedtime. She's got a nightlight and the hallway light is always kept on most nights she sleeps with the TV on. How else can I comfort her ?,dating,t5_2qhb1,https://www.reddit.com/r/dating/comments/qdy2kb/how_to_comfort_your_girlfriend_when_shes_scared/
2,qdy2vm,1634964573,Why haven't I found my love yet?,"Speaking of dating, I've been single for five years because my ex-husband's trauma scared me to look for a relationship, and I've been busy with my career and accomplishments.

I want to be an interesting person, walk more, read more, see more of the world, financially independent. Do a wonderful individual, there is a wonderful love. Although I have been very traumatized before, I still believe in love. I think American men are gentlemen, polite, cheerful, intelligent and outstanding men who advocate freedom.

If a relationship depends on appearance and body, I think it is meaningless thing, appearance and a boy's love will not last long, I think a girl should have her own ideas, can talk about life and goals with her lover. In any case. I also hope he and moral equality, emotional equality, ideological equality!

So I need a man who loves me, respects me, takes care of me and cherishes me...... No matter what happens, he's gonna be there for me, live or die, okay",dating,t5_2qhb1,https://www.reddit.com/r/dating/comments/qdy2vm/why_havent_i_found_my_love_yet/
3,qdy46v,1634964735,What things would tempt you to cheat on a partner?,"If you’re never tempted to cheat, then you don’t have to answer (some of you still will anyway)

In my cheating days…usually my reason was the woman simply wasn’t beautiful enough to keep me interested long term or I’d discover a major personality flaw (daddy issues, entitled, etc.) but I still liked her enough to date her just not enough to be faithful. Over time id get bored with her. There’s a huge gap between a decent and gorgeous. I’ve only met one woman I thought was a perfect match inwardly and outwardly . I married her and have never cheated in 14 years. But before her I cheated a lot.",dating,t5_2qhb1,https://www.reddit.com/r/dating/comments/qdy46v/what_things_would_tempt_you_to_cheat_on_a_partner/
4,qdy57d,1634964862,what am i doing wrong??,"i (18F) have had just terrible luck with dating. every guy i meet us unavailable and has no intention to commit to anything serious. Marriage is a huge goal of mine, and a goal i want to meet younger than most do (around 22), so i date intentionally. Of course i don’t tell 18 year olds boys on the first date i’m husband hunting, but i always make it clear in a non-intimidating way that i take my relationships seriously. 
I don’t necessarily have trouble getting male 
attention, i just can’t seem to get any attention from good ones! i’ve honestly been feeling super discouraged and down about it lately. 

This is absolutely not to be conceited but i think i’m very pretty, have a good personality, i’m in school and i work full time. Im pretty outgoing, but I tend to be a little shy with guys.

I know there are good guys out there who think and feel the way i do, how can i find them?!",dating,t5_2qhb1,https://www.reddit.com/r/dating/comments/qdy57d/what_am_i_doing_wrong/
5,qdy649,1634964972,What are these guys looking for in me?,I joined Hinge about a week ago.  I’m a F (56yo) &amp; I keep on getting hit on by 20 year old males.  What are they looking for?  I feel immoral just looking at their profiles when they reach out.  Am I missing something?  Should I delete them?,dating,t5_2qhb1,https://www.reddit.com/r/dating/comments/qdy649/what_are_these_guys_looking_for_in_me/
6,qdy798,1634965115,Toxic relationship,"My (20m) boyfriend (20m) and I fight more than we should. We’ve been together for a little over 3 months officially but met 4 months ago. There’s a lot of turmoil, way too much stress, and too much arguing. He’s just too emotionally immature for me. We are literally long distance now because of college. I can’t imagine how bad this would be if we actually spent more time together in person.

I need to break up with him, but it’s so hard to get myself to do it. I’m holding onto the idea that it might work out, but deep down I know it won’t. I love him. I don’t know how to get over this idea and just fucking do it. Any advice? 

Tl;dr I need to break up with my emotionally immature boyfriend bc our relationship is too toxic, and it’s hard for me to get myself to do it. Any advice?",dating,t5_2qhb1,https://www.reddit.com/r/dating/comments/qdy798/toxic_relationship/
7,qdy7bh,1634965122,Should I tell my crush that I like him?,[removed],dating,t5_2qhb1,https://www.reddit.com/r/dating/comments/qdy7bh/should_i_tell_my_crush_that_i_like_him/
8,qdy9jo,1634965358,What’s wrong with me?,"What’s wrong with me? I overthink everything when it comes to females. I’m a 25 yr old male that takes a month to warm up to any girl. Until I feel comfortable around them I’m not the same person. This really inhibits me from ever making a move. I feel like girls just see me as some massive ogre. I’m 6’3” and have a beer gut although it’s shrunk since I put on muscle. I’m tired of doing anything fun because when I go out all I notice is attractive females and the happy couples. It always makes me feel loss and hopeless.

I also can’t pick up on banter. I have a learning disability so that contributes somewhat to not understanding banter. So if someone’s trying to get to know me I seem disinterested. Anyone have advice on how to warm up to people faster? I always see girls I wanna make a move on but don’t.",dating,t5_2qhb1,https://www.reddit.com/r/dating/comments/qdy9jo/whats_wrong_with_me/
9,qdycmr,1634965706,Not sure if I got ghosted or if he's going through some family problems.,"Back story: Hi so I (23F) was talking to a guy (26M) for about two months at the end of the summer. Met online. We talked for a month (very engaging conversations) until I finally agreed to go on a date with him cause I barely ever go on dates and he seemed super genuine and looking for something serious. First date went well. We grabbed sushi for dinner and he texted me after saying he had fun with some flirting going on during the date and after as well. After a few days he asked for a second date the next up coming week cus that week he was busy starting a new super demanding job. 

Long story short, the date kept getting pushed either on my end or his cause he had a trip out of the province for about a week. When he got back he tried to schedule it in but I was sick then he was busy with important meetings to get adjusted to his new job. Then he got sick for a few days. Over text everything was good. We kept talking like we did before and conversations were engaging with genuine interest being shown. It just kept taking a while to set up the date cause life kept getting in the way which is understandable and when he was available I wasn't and vice versa. Just September was a busy month.

Anyways, the weekend before the week of our potential second date he texted me saying he's going through some family problems and has been in a hard situation and won't be able to text me for a while. He also unfollowed me on Ig and got me to unfollow him which really threw me off. I told him I hope things were okay and just asked for some honesty rather than be in a ghosting type of situation. He replied by telling me his family found out he was on dating apps and was in a sticky situation and apologized again. I replied by saying that I was still confused cause it felt like a 180 and mentioned he could just say I'm a friend but if not I guess do what you gotta do and take care with everything. He didn't respond. 

Also it's important to mention that we both come from more religious households where we aren't supposed to date before marriage and all so that's why he got into trouble and maybe lost trust with his parents. 

Not really sure what to make out of the situation or if I got ghosted cause I've never been ghosted before and am pretty new to online dating. Lol",dating,t5_2qhb1,https://www.reddit.com/r/dating/comments/qdycmr/not_sure_if_i_got_ghosted_or_if_hes_going_through/
10,qdydwf,1634965852,Help!!! What should I do,"I met this guy on dating app, we have been seeing each other for two months now, on the 3rd date he ask me to not seeing other people and he is not going to see other people either. And I mentioned two time for him to delete his dating app, he agreed both time, he said he doesn’t really use it anyway. But he is still active on the app, because I found out yesterday he just matched with one of my friend and he messaged her too. he just told me few days ago he wants to be exclusive with me, but The past week he been acting weird. From replying in few minutes to it take him a whole day to reply a message. I do really like him, I’m meeting him tomorrow night, what should I do?",dating,t5_2qhb1,https://www.reddit.com/r/dating/comments/qdydwf/help_what_should_i_do/
11,qdygp7,1634966206,Had a girl flake an hour before concert,"I’m (27M) and I’ve been trying to take this seriously. I’m looking for a relationship, but I’m down to make friends and get to know people.

This is like the third time post covid I’ve been flaked on well communicated plans. I know it’s apart of it, but it just makes me feel shittier and shittier every time it happens.

Is it time to take a break from OLD or just come to terms that it’s bound to happen?",dating,t5_2qhb1,https://www.reddit.com/r/dating/comments/qdygp7/had_a_girl_flake_an_hour_before_concert/
12,qdyik7,1634966436,Girl not texting after perfect first date?,"I met this girl on a dating app a few weeks ago. We spent 3 weeks texting before going on a date 2 days ago.

For the past 3 weeks, she has been initiating texting almost every day. She'd send everything from 'good morning' to 'good night' texts.

Then we went on a date and it was AMAZING. Best date I've ever had, amazing chemistry, ended up having sex at her place before I left to let her sleep. She told me before I left what a nice time she had.

Next morning I woke up to find no 'good morning' text from her. So I texted her something about an inside joke. She texted me that day most of the day, although seemed more 'cold'. Then that afternoon I suggested to hang out again and she didn't even address that request, just texted back about something else.

Haven't heard from her in the last 24hrs+.

Any ideas why this could be the case?

I don't want to look needy and start initiating texts all of a sudden, but I don't know whether she might be turned off because I seemed needy by requesting to hang again, or because she's playing it cool.

Any advice?",dating,t5_2qhb1,https://www.reddit.com/r/dating/comments/qdyik7/girl_not_texting_after_perfect_first_date/
13,qdyl0a,1634966760,How to tell her I want to go out with her by ourselves?,"So the title says it all, I have a crush on this friend of mine that I’ve invited to go out a couple times, but she always asks if some of our mutual friends can come along too. I get that she may not see me as her date, but we’ve always had great chemistry. We’re supposed to meet tomorrow, but how can I tell her that I want to go out by ourselves?

On simpler terms, I know for a fact that she’s single and looking, so I understand that she only sees me as a friend, how do I change that?",dating,t5_2qhb1,https://www.reddit.com/r/dating/comments/qdyl0a/how_to_tell_her_i_want_to_go_out_with_her_by/
14,qdynhf,1634967085,Worried that this girl lost interest that I didn't make any moves on the 2nd date?,"Yeah the first date went well.  We didn't kiss, but I could tell she liked me a lot.

2nd date I was a bundle of nerves having had a weird day.  We talked by my car for a bit and just hugged.  I regretted it very hard when I got home.

She works this whole week, but I'm worried there now won't be a 3rd date.

It really sucks that I may have blew my chances over something like this.

Any thoughts you have are a blessing.",dating,t5_2qhb1,https://www.reddit.com/r/dating/comments/qdynhf/worried_that_this_girl_lost_interest_that_i_didnt/
15,qdypa1,1634967308,Physical vs emotional priorities,[removed],dating,t5_2qhb1,https://www.reddit.com/r/dating/comments/qdypa1/physical_vs_emotional_priorities/
16,qdyz1h,1634968526,"I've noticed that the ""normal"" tall guys are rude","A lot of tall guys that are 6'0 - 6'3 end up being complete douchebags to short guys, average guys and tall women. A lot of you tend to have this superiority complex and feel as though you're better than short and average guys. You also love to gloat about how much better short women are than tall women as if they're some kind of premium type of women. As a short man myself, tall guys that are like 6'0 - 6'3 are dicks to me and try to make me feel like a lesser. Its usually the biggest tall guys that are mad chill and end up being friendly, like usually guys that are 6'5+ who tend to be laid back and don't need to make their height their personality. Also less stuck up too.",dating,t5_2qhb1,https://www.reddit.com/r/dating/comments/qdyz1h/ive_noticed_that_the_normal_tall_guys_are_rude/
17,qdz5m5,1634969290,Witty responses after being left on read?,"I know a lot of people will suggest to let it go, but this girl and I really hit it off on Tinder and exchanged IGs. She told me she wanted to hang out, so I proposed going out to a local pier this weekend. She left me on read and continued to post on her IG story. 

She may very well likely not be interested, but I kinda want to push her in case she’s playing games with me (that’s less likely the case tbh). 

What do I send to follow up? I just don’t like being ignored/I thought we’d likely be a good match. 

I don’t just want to stay silent, I want her to remind her that I still exist and have feelings. Not many ppl are willing to stick up for themselves and just wait it out. 

I’m not needy, I just don’t like being left hanging. And I know she doesn’t owe me anything, but it’s generally impolite to ignore people after a cordial conversation. 

Any ideas?",dating,t5_2qhb1,https://www.reddit.com/r/dating/comments/qdz5m5/witty_responses_after_being_left_on_read/
18,qdzapn,1634969938,Should I try getting back together with my girlfriend?,[removed],dating,t5_2qhb1,https://www.reddit.com/r/dating/comments/qdzapn/should_i_try_getting_back_together_with_my/
19,qdzb0o,1634969977,What are some best app for introvert to find relations/friend?,[removed],dating,t5_2qhb1,https://www.reddit.com/r/dating/comments/qdzb0o/what_are_some_best_app_for_introvert_to_find/
20,qdzjux,1634971142,I really wanna DM someone from college but incredibly nervous about it,"I (25M) graduated from college in 2019 and while I don't really talk to a ton of people from then, other than brief exchanges over social media, I absolutely cannot get this girl out of my head. At the time of meeting her back in my third year, I was in a committed relationship at the time. We worked on a project together but nothing of any real significance happened; although admittedly, I definitely thought that she was the cutest girl in the class. We did another project together, still nothing, but we were more comfortable around each other at least, but still, I didn't do anything since I wasn't single. I'm single now though; have been for about a year and a half. And every time I think about her, I get those goddamn butterflies. 

I know I shouldn't feel dumb for having feelings, but I kinda do since I don't know her super well, especially in terms of what she's up to now. But I wanna get to know her because it seems like we both have a lot of similar interests just based on IG posts; I just have a lot of first message anxiety I guess. Any tips y'all might have? 

Thank you in advance!",dating,t5_2qhb1,https://www.reddit.com/r/dating/comments/qdzjux/i_really_wanna_dm_someone_from_college_but/
21,qdzk06,1634971161,Flowers,"So I’m seeing this girl, we’ve been on two dates so far and she’s coming round to mine tomorrow. I got her a book she mentioned she wanted after the first date and gave it her the last time I saw her. Is it too much to buy her flowers for this date? Don’t want her to think I’m trying to buy her into a relationship!",dating,t5_2qhb1,https://www.reddit.com/r/dating/comments/qdzk06/flowers/
22,qdzkpc,1634971244,26 F - I’m good enough to have fun with but not enough for a chat or response?,So I’ve been seeing this guy for over a month and sleeping together a few times. We’ve agreed fwb and it’s like I’m good enough to have fun with in bedroom but too much effort to reply too or chat with and get half swiped on snap chat during the week. I literally opened up to him drunk when he was sober. I literally hate some men :/ I just sent him a message like “good enough to sleep with but too much effort to chat”,dating,t5_2qhb1,https://www.reddit.com/r/dating/comments/qdzkpc/26_f_im_good_enough_to_have_fun_with_but_not/
23,qdzl9v,1634971317,Been doing online dating for a couple of weeks and I'm hating it,[removed],dating,t5_2qhb1,https://www.reddit.com/r/dating/comments/qdzl9v/been_doing_online_dating_for_a_couple_of_weeks/
24,qdzlnr,1634971369,How to start dating when you don't really know what you're looking for?,"So I haven't been on a date in 4 years actually, since I went out with my first bf and we broke a few years ago.

So I've really never been good at flirting or attracting people really, and I'm not entirely sure why, I guess I'm mostly a wallflower type of person.

Now, I don't really know what In want. I guess I've been kind of bored and lonely this last year, I certainly haven't had sex this entire time since my break up (since before quarantine actually). I'm not really sure what I'm looking for, so how do I go about dating? Any advice?",dating,t5_2qhb1,https://www.reddit.com/r/dating/comments/qdzlnr/how_to_start_dating_when_you_dont_really_know/
25,qdzq5n,1634971935,Point of exclusivity?,"Without sex, is there a reason to be exclusive? Or does that come across as more shallow?

Sex makes sense because of concern for stds or risk of pregnancy, and more intimate, but logically exclusivity/official outside of that is more emotional than logical. 

Thinking about asking about exclusivity at some point but I don’t know if I actually have a good reason for it. Input?",dating,t5_2qhb1,https://www.reddit.com/r/dating/comments/qdzq5n/point_of_exclusivity/
26,qdzu33,1634972426,"""Dating"" someone more than 10 years younger","This one previous employee mustered up the courage to tell me that she found me attractive and wanted to go out. I was hesitant to go out with her because she’s only 19 and has never been in a relationship but I wanted to be nice so I said yes. Then she told me since it’s her first date ever, her mom wanted her sister to go with us. I was upset because I only took her date because I found it awesome that she had the courage to ask me out. Something a small and shy girl like her would almost never do. Well all three of us went to the movies, she didn’t talk much or like the movie at all. She wanted another date and promised it would be different, but this time she wanted to have sex because she never had it before. It had been a minute and I let her know that I wasn’t in love with her and that it would be strictly for pleasure. She said that she just wanted someone to lose it to, but she wanted that person to be a good person and willing to treat her right. So I found it as a win-win but still wasn’t sure if I was just taking advantage of a young lady like that. Then she sent me some nudes and I was game. I picked her up a few days later and I asked if she wanted to get some food or watch a movie before heading to my place. She said no and we went to my spot. The problem is that she was nervous and as much as I tried to work with her, she didn’t let me. She kept saying that I was too big and that it hurt but I was barely rubbing against her slit, not even going in. My initial approach was to be romantic, then I tried to be kinky, then Netflix and cuddles, then just stimulating the usual things (since I couldn’t stimulate her mind). Nothing was working for her and I could tell it was that she was scared. I told her that it was ok if we didn’t do it and that we could just watch something together. She picked Hulu and the Simpsons. She didn’t laugh in funny scenes, she didn’t try cuddling or holding hands. Luckily work called and said they needed me so I took her home but she was disappointed we didn’t hang out more. She also asked me how I could have a Long Distance Relationship… What a train wreck tbh… After I told her I didn't want an LDR with someone I don't know yet she wanted to stay as pen pals until she gets back. Tomorrow I'm going to tell her that I don't like her like that and stop talking to her. 

&amp;#x200B;

I learned my lesson: Think with the right head and stop being so nice.

&amp;#x200B;

I am posting this because I don't think I can talk to anyone I know about this. Thank you for reading.",dating,t5_2qhb1,https://www.reddit.com/r/dating/comments/qdzu33/dating_someone_more_than_10_years_younger/
27,qdzyh9,1634972964,Need help,So I feel like I’m relatively attractive and I have a lot of hobbies like skating and playing guitar but I don’t have a girlfriend and I want one but I never ever text anyone or introduce myself and I guess I’ve just been waiting for someone to come my way but obviously that isn’t an efficient method even then I’m extremely socially awkward so how should I go about finding a girlfriend?,dating,t5_2qhb1,https://www.reddit.com/r/dating/comments/qdzyh9/need_help/
28,qe0149,1634973349,"Question to women here: Do you see sex as something special that you do with someone that you care about or as an activity like a sport that you can do for fun with someone that you feel like it or if none of these apply to you, what is sex for you?",[removed],dating,t5_2qhb1,https://www.reddit.com/r/dating/comments/qe0149/question_to_women_here_do_you_see_sex_as/
29,qe01fp,1634973397,Stupidly naive woman here - what does it mean when men say they have no integrity?,"I dated a flake who led me on with fake promises until I got sick of it and dumped him, and then he tells me that it was his fault the relationship degraded because he has no integrity.

Integrity is the foundation of my life, so I have no concept of someone not having it.  What other common words or descriptions would I have come across to describe someone like this?",dating,t5_2qhb1,https://www.reddit.com/r/dating/comments/qe01fp/stupidly_naive_woman_here_what_does_it_mean_when/
30,qe026g,1634973508,"Question to women here: Do you see sex as something special that you do with someone that you care about or as an activity like a sport that you can do for fun with someone that you feel like it or if none of these apply to you, what is sex for you?",Just curious about how women here see sex. What is sex for you ladies?,dating,t5_2qhb1,https://www.reddit.com/r/dating/comments/qe026g/question_to_women_here_do_you_see_sex_as/
31,qe05kp,1634973977,Scared to talk to girls,"Hey, im 20 year old male, 190cm tall, 121kg.
Sorry if i have any typos, since english is not my main language and im currently using a phone.

There are some girls i like that live near me, but i never have balls to just go and talk with them or ask her out or whatever. I have never been in a relationship.
I used to go out with my old classmates back then, but after injurying my leg and not going out with them for a month they kicked me from the groupchat we had (one of the boys kicked me).

Since then i have lack of confidence when talking with pretty much anyone, but especially girls, since i automatically think what if they dont like me?

You are probably going to say to go to the gym and get fit or go get some hobbies, but for personal reasons, i cannot lose weight until next year summer. And i honestly dont know any hobbies also that would interest me. Most of the time i play csgo or watch netflix, and thats pretty much it.

What do you suggest me to do? How can i get rid of my lack of confidence and how could i possibly meet new friends or maybe someone special? Im gonna say honestly, thinking about making a tinder account is a big no from me, because i keep thinking if some of my friends see me there and start making jokes or something

Sorry for the long post.",dating,t5_2qhb1,https://www.reddit.com/r/dating/comments/qe05kp/scared_to_talk_to_girls/
