,id,created_utc,title,selftext,subreddit,subreddit_id,url
0,nk5btf,1621882528,Friendzone," Me and this girl have known each other for about a year now. about 4 months ago I told her I had feelings for her because I did and I knew that she had feelings for me too (she had told my friends). But to my surprise she said that she was talking to her ex again and she would like to remain friends with me if I were ok with it. Later that night when I got home I texted her that I was fine being friends but she told me she likes me as well and doesn't want our relationship to end because of her ex but she needs time to which I said ok. Next day she massages me and says that she misses me?! I told her that I missed her as well and that was the end of our conversation she went offline.

   One night  About a week later I told her if she could come out with me to which she said that her mom wouldn't let her, later that night she posted an Instagram story that she was out with a guy that she told me she hated so much?!

 Every time that we chatted and she talked about her ex she would say that she loves me more and she wishes that she saw me before she saw her.  So that was it after that in the span of 3 months we saw each other about 3 times which every time she told me to come out I found out that she got in a fight with her ex again.  Every time she posted Instagram stories with me then I found out she did because her ex was insecure about me.  

 Last night she asked me out and arrived 40 minutes late she even brought her friend like we hadn't seen each other in 2 months and nothing happened and kept talking about another guy that she has developed a crush (I think she does this on purpose to see my reaction once she kept talking about her ex and my friend asked her why does she talk about her so much to which she replied I want to see \[ME\]'s reaction) on meanwhile she's back with her ex.....  

Note that every time we have went out in the past 4-5 months she asked me out and sometimes when she makes plans she even flakes about 4-5 time now. she has never agreed to come out when I ask her, not even once. 

 I never liked someone so much but I can't take this anymore day and night I'm thinking about her but when I see that she doesn't even care about me or that she doesn't value me at all it destroys me. Even my mental health is getting worse and worse even close to when I was extremely unhappy with my  life I can't even sleep right.  

writing all the things she did I think I know my answer. the question is should I tell her that I don't want to be friends anymore or simply ignore her until she askes me why ?",dating,t5_2qhb1,https://www.reddit.com/r/dating/comments/nk5btf/friendzone/
1,nk5dz8,1621882681,Society and age gaps," 

For it to be legally and morally acceptable to date someone is highly dependent on the country you live in. For instance, a 20 year old dating a 16 year old would be regarded as creepy in a typical reddit discussion where majority are from NA, and it would (at least in many states) be illegal if there were sexual intercourse involved. On the other hand, we can take the same scenario and implement it in a swedish forum and it would be acceptable, both morally and legally. That's what I've noticed when I browse for questions. People tend to have completely different mindsets depening if you live in the NA , EU or other continents.

Now, obviously we can make a conclusion that the laws on the age of consent and the age of adulthood in different countries are flawed which is unfortunate. A scientific fact we know is that the human brain isn't done developing (frontal cortex) until the age of 25 and that's when the human brain reaches a stage of maturity, yet we still regard 18 year old as adults. Or let's mention the fact that you can't drink until you are 21 but you can buy assault rifles when you are 18 in the US.

So what law is really right in the end? That's my first question.

Secondly, I wonder why there is such a prevalent hypocrisy in regards with age gaps. Today I've browsed on reddit and people even had a problem with 17 year olds hanging out with 20 year olds, especially if the younger part is female and the older is male. But when such scenarios really occur in public, people don't seem to care about it. Let's take FaZe Clan as an example. When Jarvis who has 16-17 years old at the time joined this clan, he hanged out with people who were 5-10+ years older than him. No one even mentioned that being weird. And there are A LOT of real examples like this. But if I decided to post this on reddit ""Im 16, is it normal for me to hang out with a 25 year old"" you would have very few people actually thinking it's normal, ESPECIALLY americans.",dating,t5_2qhb1,https://www.reddit.com/r/dating/comments/nk5dz8/society_and_age_gaps/
2,nk5pys,1621883529,Hey I’m here for fun,[removed],dating,t5_2qhb1,https://www.reddit.com/r/dating/comments/nk5pys/hey_im_here_for_fun/
3,nk5r0z,1621883606,Should I enter a relation at a time when I am not ready?,[removed],dating,t5_2qhb1,https://www.reddit.com/r/dating/comments/nk5r0z/should_i_enter_a_relation_at_a_time_when_i_am_not/
4,nk5r5k,1621883614,I get turned off very easily...,[removed],dating,t5_2qhb1,https://www.reddit.com/r/dating/comments/nk5r5k/i_get_turned_off_very_easily/
5,nk5ron,1621883653,What is the best way to meet new girls 2021,I think only dating don’t work for me I have no clue why I’m 6‘7 and not ugly or anything like that. I have the feeling That it’s simpler for me to flirt with girls in the real world but due to COVID that’s very complicated. I was wondering how u guys get dates and I’ve u have some advise for me,dating,t5_2qhb1,https://www.reddit.com/r/dating/comments/nk5ron/what_is_the_best_way_to_meet_new_girls_2021/
6,nk5s4j,1621883683,"Done with all of this for a while, my heart can’t take it.","Why is it that the women I really like always have extenuating circumstances that keep us apart? They are always moving somewhere far away, or work a job with too much of a conflicting schedule. I don’t like many people at all, so the ones I do connect with I tend to really like. 

These past few months I’ve woken up to more than enough “This isn’t going to work out” texts, and I’m so tired of being left, especially because every time I genuinely believe they are feeling those sparks too. Too many times now have I looked in someone’s eyes and thought they were feeling those butterflies too, just to be ghosted. I want to have someone, and I just can’t take all of the people I like telling me they don’t like me enough to bother, or they’re just leaving and it’s not worth it. 

I’ve deleted all of those apps from my phone, I’m officially off the market until further notice, my heart just can’t take this.",dating,t5_2qhb1,https://www.reddit.com/r/dating/comments/nk5s4j/done_with_all_of_this_for_a_while_my_heart_cant/
7,nk5tdy,1621883774,Should I just let it go?,"A guy and I matched on a dating app and had talked back and forth every couple days for a few weeks before he asked for my number and asked me on a date. Later that week we went out and had a great time (I thought so anyways), and he said that we should do this again. I told him that I was a bit concerned about the distance (we live an hour from each other) but he mentioned we could meet halfway and so I said sure. Later that night I texted him to say thank you for the date and that I had a great time, to which he agreed and said that he had an amazing time. He also mentioned that we should go to \[insert bar\] next time and I said sure. 5 days went by without us texting so I texted him and we had a conversation for about an hour (back and forth texting). Since then its been two weeks and I haven't heard from him.... Not sure if I put him off by expressing concern over the distance, or, if he just lost interest naturally. I don't know if it would be a good idea to text him again and strike up a conversation (I haven't because I texted him first the last two times) or if I should just assume he wants nothing to do with me and let it go (because, he too could have texted me in two weeks). My guy friend told me that I should text him and just say hey how's it going, and let him know I have been thinking about him. To me, that sounded a bit desperate. Thoughts?",dating,t5_2qhb1,https://www.reddit.com/r/dating/comments/nk5tdy/should_i_just_let_it_go/
8,nk6cpc,1621885157,I can’t even pick up girls in real life.,"I tried sparking a conversation with a girl at Disney World who seemed to be by herself. We were just sitting down. It’s about 84 degrees and I said to her, “Hot today, huh?” She nodded and then looked back at her phone. She probably thought I was being creepy.

I’m just going to not acknowledge girls’ existence anymore.",dating,t5_2qhb1,https://www.reddit.com/r/dating/comments/nk6cpc/i_cant_even_pick_up_girls_in_real_life/
9,nk6dx8,1621885244,Dating and living in my moms basement/with family.,"I'd like to start dating again. I also live in my moms basement. I was never good at it when it was acceptable to live in moms basement. Now I'm older, have a kid, and am going back to school. 

I just also don't want to die alone. I'd like to get married some day. I don't know how to cross that bridge. 

Any tips? 

For a clearer picture; I'm in my early 30's, my kid is nearly elementary school age and I have 50/50 custody. I'm going back to school because as it turns out an HR degree *isn't particularly gainful*. So long term my goals are not just to coast into oblivion....but I'm living in the now. I can't do speculative relationships because that's not healthy. 

What do I do?",dating,t5_2qhb1,https://www.reddit.com/r/dating/comments/nk6dx8/dating_and_living_in_my_moms_basementwith_family/
10,nk6n4n,1621885901,"What’s with guys in asking women if they know of Jordan Peterson, Joe Rogan, Ben Shapiro, etc?",Can’t tell you how many women have told me that guys always ask them that in the app messaging. Or ask them if they know about the “intellectual dark web”.  Why? I get interest in it but why is that an icebreaker that you bring up on dating apps? Lol. Very strange.,dating,t5_2qhb1,https://www.reddit.com/r/dating/comments/nk6n4n/whats_with_guys_in_asking_women_if_they_know_of/
11,nk6o5w,1621885972,[18M] the last date of my life,"Hi everyone. I’ve just turned 18. Yesterday, i went out with a girl i really liked. We wanted to have lunch in a pretty cool place, i was super anxious about it all, but eventually managed my stuttering pretty well.

A little bit of context: I’m super worried about my balding problem. I’ll surely have to shave my head one of the next years, and i’m not even good looking. Just average, i hope. I’ve NEVER had the confidence to talk to girls, or approach them, especially for my looks and my stuttering ( it can get pretty severe ). My self esteem is another serious problem: i’ve always had 1 only friend, and he was super good looking, and very successful with girls or friends in general.

So i was sitting with this girl and we were talking/laughing. Suddenly, that friend of mine comes, greets me, and sits in the table near us. She spent the whole time looking at him, eventually asked for his number, and found an excuse to go away.

I was feeling a special connection with this girl. She was the only girl i could barely talk to. I can’t believe this happened. I’ve never been good with girls, and people in general, i always felt like trash ( being 18 and still never been in a relationship can hurt ).

i honestly think i won’t be able to recover from this anymore.",dating,t5_2qhb1,https://www.reddit.com/r/dating/comments/nk6o5w/18m_the_last_date_of_my_life/
12,nk7037,1621886797,A Rejection of Modern Dating Methods - Delete your Apps Post Pandemic,[removed],dating,t5_2qhb1,https://www.reddit.com/r/dating/comments/nk7037/a_rejection_of_modern_dating_methods_delete_your/
13,nk72ge,1621886959,A Rejection of Modern Dating Methods — Delete your Apps Post Pandemic,"Hello all, this is a re-post from another sub that I wrote a couple of days ago. It got a lot of positive feedback before it was removed by a mod who disagreed with the premise. Hopefully this sub is more open to debate and discussion and will not do the same

I’m writing this as a rejection of all modern online dating advice that I’ve read for the past year. I believe men and women are suffering due to a small minority of loud, miserable and anti-social people who exist on Reddit. These people tell men and women that the only appropriate place to ask someone out is on an app or at a bar/party and that every other place should be deemed as “harassment” and “creepy”. I should point out that when I refer to Reddit, Im referring to it as a whole. This sub is a lot more accepting to “alternative” ways of dating and pick-up, obviously

I will talk about this from a man’s perspective because I’m a guy

The modern advice is problematic for men in many ways.

#### Most men are not successful in online dating and should abandon it now that the pandemic is mostly over in the US

* Online dating is a multibillion dollar industry. The way they make money is by having a large, single male population that pays for premium services. Their goal is not to actually get you into long-lasting and or fulfilling relationships. Their goal is dopamine hits that get you to pay more. The stats don’t lie. Most men get very few matches. Even when they do get matches, the conversations rarely go anywhere. There is a small minority of men who do have success, but 90% do not and are just wasting time and money.
* This time could be used for other activities, work, exercise, social activities, or day and or night game
* Just on the basis of demographics, the user base for most dating apps ranges between 60–90 percent male users. Let’s assume a 1 to 1 pairing for everyone. If the user base is 75 percent male, 50 percent would be left without a “pair”. Meaning people like me, as a straight guy, literally have no one left to actually match with you (if you fall into the bottom x percent of profiles). This is theoretical and actually worse due to how people actually swipe on these apps.
* This is not to blame women. How do you possibly expect women to sift through hundreds to literally thousands of potential matches, solely by going off of 2d images and profiles that are about 30 words long? I’ve talked to a lot of women about this. All of them say it’s virtually impossible to deal with. It is set up for failure. Bumble and Hinge have made this issue less of a problem, but it’s still a problem
* Attraction in real life has infinitely more variables than 2d images and a short profile that consists of 10–40 words. Body language, ability to carry an in-person conversation, voice, smell, height, body shape, muscle mass, pheromones, viewing people in real 3d life rather than 2d images that may or may not capture everything about them, actual interests, general intelligence, social and emotional intelligence, etc.
* Many of the things I stated above can be gauged in a short 5-minute conversation with a stranger in real life

#### I like to go out at night, but not that much

* I like to go out between 4–8 times a month. I think a lot of men my age (mid 20s) are in the same boat. Basically a Friday and or Saturday night. That’s it. And a lot of times, going out maybe a guy’s poker night or a small gathering in someone’s apartment. Many of us don’t go out to bars enough to actually make a dent in meeting attractive women

#### The case for “day game”, or at least abandoning the awful apps

* I’ve seen arguments against the day game so many times on Reddit. I believe it’s horrible advice. “Don’t ask out x person here because x person is trying to work on themselves in y way or do z activity without interruptions.” If your future wife or husband interrupted a set at the gym or while you were reading at a coffee shop, you would be mad at them for interrupting you? Give me a break. You’d likely be at least flattered, and at worst, uninterested.

#### Ill cite a few examples

* Don’t ask someone out at the gym because they are there to exercise
* Don’t ask someone out at the library because they are there to study
* Don’t ask someone out at the grocery store because they are there to buy food

#### Why the above is garbage advice (don’t ask out…), especially if you are looking for a long term and or fulfilling relationships

* Lets assume for a second that you reject the anti day game sentiment and actually ask someone out in one of these environments. Lets also assume that they say yes. Lets also assume that you marry this person or enter into a really great and fulfilling relationship with this person for a year or two. Are you going to look back and give a fuck that it was deemed an “inappropriate interaction” by some stranger who’s sitting in their basement jerking off all day on Reddit?

**Why “day game” is a good way to ask out women.**

Let’s use a few examples to create the argument in favor of it

* **Why should you ask out someone at the gym**
* You are both into health and fitness.
* If the person is there all of the time, they are likely not into partying and drinking (so you wouldn’t meet them at a bar)
* If youre there all the time, it is likely that you aren’t also
* You have things to talk about immediately to break the ice
* If she says no and you’re not completely socially inept, all you have to say is “no problem, feel free to say hi whenever you see me here. Im always open to new gym friends. Have a good workout.” And walk away. Ive asked out women a few times in the gym before. The notion that you or she has to change time or locations if you get rejected is nonsense. Just act like a normally socialized human after rejection and move on
* **Why you should ask someone out at the library**
* You likely go to the same college
* You at least up the odds of you both being introverted students (ie someone youd get along with more than someone you meet online or at a party)
* If she says no and you’re not completely socially inept, all you have to say is “no problem, feel free to say hi whenever you see me here. Im always open to new friends. If you see me here and want a break from studying, Im always open to taking breaks and talking.” And walk away

#### Why the “but you’re harassing women and they are afraid of you” argument is garbage, especially for the average Reddit (and now Medium) user

* Is there a subset of men who legitimately harass women? Absolutely. Is there a good reason that women should have their guard up for these specific men? Yes. Do 95–99% of men actually harass women. No
* Most men’s biggest fear is being rejected by women. I’ve personally learned to talk to women over the years and am pretty confident now when I’m around them. Asking out a woman, especially one that I find really beautiful, is still the thing that gives me more anxiety than any other activity. My heart literally shakes my chest. You can actually see if shaking my shirt. The only time I have gotten anywhere near as nervous as I do when asking out a woman that I’m very attracted to has been at the start of large speeches (ie 50 plus in the audience) or when I used to play sports and there was a decent-sized crowd (5k plus in attendance)
* **WOMEN — MOST MEN ARE TERRIFIED TO ASK YOU OUT**. By you telling guys on Reddit not to ask out girls in x environment, you are giving them the justification to living really lonely and isolating lives. Men’s depression is real, and one of the two primary causes is a lack of satisfying intimate relationships and lack of friends. The guys on Reddit are the guys that need encouragement. They aren’t having success on apps or in their social circles if they even have any. That’s why they come here. They aren’t generally bad guys. They are guys who are generally “not socially talented”, for lack of a better phrase. Do you really think a serial sexual harasser is reading Reddit advice on how to talk to women? No, they are fucking psychopaths who feel no emotion. The guys on here need encouragement.
* If you ask a woman out as a socially adept adult, 99% of the time they will not take your actions as “harassment”. Reddit (and the internet) is not Real Life

#### Why social circle is useful but deceptive

* Another piece of advice I hear on here is “join x club or do y activity to meet “quality” women”. That statement alone is entirely disingenuous. You are using social activities as a guise to pick up women, rather than gathering the courage to ask out women, whom you find attractive when you come across in your day to day life. Secondly, the notion that “quality” women exist in only these places is utter nonsense. They exist in many regular public and social environments, you just have to look
* Should you be social? Yes. Should you do social activities just to meet women? No. Is the current advice on a lot of forums to do just that? Yes, and its wrong

**Why I’m writing this**

* I am a guy who actually has had what some would deem “success” on dating apps. For the last 2.5 years, it has been my primary mode of meeting women. However, I have not had success in the sense of truly being in love or meeting women that I am deeply physically and emotionally attracted to. I have only been in love in my college and pre-college days because that is when I met women organically. I’ve had about 10 relationships (we’ll define a relationship as anything longer than 2 weeks of meeting in person) that lasted between 2 weeks and 6 months that came from the apps. I’ve probably been on 30–50 first dates, but I’ve honestly lost count.
* I don’t want this to be taken as not having success solely from lacking physical attraction. Have I gone out with girls who look nothing like their profile? Yes. I’ve gone out with a handful of very beautiful women from apps. With that being said, the conversation didn’t flow on our first date, I felt no emotional attraction, or they were beautiful, but just not the type of beauty that fits me best. I’m a very athletic guy who lives in the gym, and I like girls who are also really physically fit. Many of these girls were beautiful, but from conversations and their bodies, I could tell they weren’t gym rats like myself. Conversations were also sometimes hard primarily because we lacked common activities, common social circles, and common interests.
* As a side note, there were 3 women that I’ve worked with within the past that I would rank less than a 7 on physical attraction. If it was socially “acceptable” at work (or if I had the mindset at the time to reject the idea that it was “inappropriate”), I would’ve asked all of them out. They were women that I’d consider potentially “marriageable” material because I got to see how they acted “in person” and not through an iPhone. I’m not saying I would have married them, but I am saying that I had a deep attraction towards them that I have yet to feel towards someone Ive met through an app
* I’m tired of dating women that I’m not deeply attracted to and I’m tired of seeing garbage advice on Reddit. I’m sure many men and women on here feel exactly the same way that I do. I’ve lurked for a long time, but I finally made an account a couple of days ago solely to write about this topic.

#### My experiment

* Starting sometime in June, I am deleting all dating apps for meeting women. My methods of meeting women will be split up into 3 categories.
* ***“Day Game”*** — we’ll define this as meeting any woman in a normal day-to-day activity that I do. This could be the gym, shopping, taking a walk, etc
* ***“Night Game”*** — we’ll define this as meeting women at any party, bar or club venue. Concerts/festivals/sporting events (if any happen) will fall under this category, even if they occur during the day
* ***“Social Circle”*** — We’ll define this as social activities like fitness classes, intramural sports, etc
* I will also be giving up masturbation. This is an idea that Im taking from Mark Manson who has written books like “The Subtle Art of Not Giving a Fuck” and “Models: Attract Women Through Honesty.” He limits his masturbation to at most once a week. He does this because it forces him to be more social. I am doing it for the same reason — as a means to motivate myself to actually talk to people in real life. If I jerk off, it will just be an excuse not to put myself out there and meet potential future long term relationships that satisfy me
* I will set a number of women I want to ask out per month. For example, 10-day game approaches, 20-night game approaches, and 2 social circle approaches. I have not set the actual numbers yet. I will do the math first to see what is reasonable. For example, approaching 20 girls at the gym a month is unreasonable. Ill probably see a few that Im really into, and Ill focus on talking to them for that month. So for that, the goal may be an optimistic 5, with a minimum of 3. I don’t know yet
* The experiment will run until I get into a relationship that Im very satisfied with. This could last a month, or years. I have no idea

Hopefully I’ll learn things along the way and motivate other guys and girls to get the courage to ask out people they find attractive and ignore the haters that exist online",dating,t5_2qhb1,https://www.reddit.com/r/dating/comments/nk72ge/a_rejection_of_modern_dating_methods_delete_your/
