,id,created_utc,title,selftext,subreddit,subreddit_id,url
0,p9wsvh,1629713533,"""Red flags""","This is just me expressing an opinion.  
I feel like this expression gets thrown around a lot these days, and sometimes in a way that is really quite condescending, hate-filled and downright toxic.  
A ""red flag"" is something I thought to mean a character trait of a person that doesn't align with your values or doesn't attract you personally. Or someone who has deep issues with something - narcissistic personality disorder, alcohol, drug abuse, racist/sexist, being verbally and/or physically abusive, etc. Things like that. But people tend to use the term very loosely too - like say you get hurt or emotionally affected by something and want to talk about it and then that's suddenly a ""red flag"". Or maybe you have a bad day where your confidence is less than usual, and then that's a ""red flag""? Or maybe you handled something badly in the past, learned from your mistakes, changed completely and improved your ways, but then because of that one moment in time you have ""red flags"" in you, like you're just a bad person for life? I've seen people use this term so loosely like as if someone is unable to change or improve or become better. We're all works in progress. No one is perfect. By that logic we all have red flags all the time, but I think that's a belittling, disdainful and highly negative way to perceive human beings. We all have things to work on and most of us are just doing our best to become better each day.",dating,t5_2qhb1,https://www.reddit.com/r/dating/comments/p9wsvh/red_flags/
1,p9wy92,1629714203,"Meanig, Help i don't know what to do!",[removed],dating,t5_2qhb1,https://www.reddit.com/r/dating/comments/p9wy92/meanig_help_i_dont_know_what_to_do/
2,p9x0pc,1629714506,Is it possible to find a girlfriend when you feel inferior to women?,"I don't feel inferior to all of them. The woman I'm dating makes me feel better and I can be myself around her. But the average women totally makes me feel inferior to them. Women seem amazing, smart, beautiful, hard-working, interesting. If I'd stop dating this women it would take me forever to find another one that I'm interested in and also have the balls to approach her.",dating,t5_2qhb1,https://www.reddit.com/r/dating/comments/p9x0pc/is_it_possible_to_find_a_girlfriend_when_you_feel/
3,p9x7qc,1629715362,M4f,"(M4f)



Well My name is Justin I’m currently 19 as of August 7th currently living in nyc . Iv never been in a Serious relationship ... well if never been on any online dating sites but I’m interested to get to know someone even if it’s just a friends shot at first . I’ll give you a quick over look about me and what I’m lookin for in a woman I’m a young but I would believe an old soul. Iv been through a lot in my life but i believe it made me stronger I grew up in brooking but now live in nyc . I love family and enjoy the little things in life but have aspirations of becoming something great . Currently I’m working part time in Uber eats trying to find out my next move in life .. I was Once not to long ago surrounded myself with a group that was super toxic fights mental break downs you name it and because of it we all turned to drugs / alcohol because we those it was cool but I’m proud to say that I went to a program last August for my 18th b day and I was life changing now all I do is smoke a joint here and there . Life has been difficult as you can imagine because of of family issues and covid of course . But I want to change my life around and I want to be happy ! What I would like from a woman is someone who cares first of all and some one who can relate and someone who is full of no judgment some one with pure intentions and a good heart , someone that I know I can call or talk to when iv had a rough day . Ps pls fell free to message me if you want to talk to anyone about anything . Before I end this I would just like to add some things I’d like for you to know about me , I love boxing been involved with it since a boy , I love sorts boxing a foot ball , love fishing and whenever I can I love the outdoors . I love music sometimes it the only thing that keeps me sans hip hop / new York rap underground scene and you name it . I love finding new music and new shows to watch on my free time . One thing about me that I want to change is my weight and it’s a part of the reason why I haven’t been in a real relation ship I’m iv always been overweight and a bigger guy in general always was the big kid in school , I’m currently at my heaviest would 330+ 6’1 . If you read all this thank you idk at the end of the day who will see this but if you want to see where this road may or may not take us fell free to message me also One last thing I felt like I could make this 20 pages long but this is me keeping it short look forward to getting to know you thanks .!",dating,t5_2qhb1,https://www.reddit.com/r/dating/comments/p9x7qc/m4f/
4,p9x8s6,1629715488,What is it like to date an ENTJ?,[removed],dating,t5_2qhb1,https://www.reddit.com/r/dating/comments/p9x8s6/what_is_it_like_to_date_an_entj/
5,p9xawv,1629715745,How can I use my good looks to my advantage?,"So I'm a 20 year old guy whose never been on a date or had a gf, w bad social skills. Lately I've been trying to focus on self improvement and opening up to situations more, such as going clubbing for first time and making small talk with strangers or acquaintances. But despite being a good looking guy w a ripped body I still don't have high self esteem and get tongue tied whenever seeing a hot girl that I'd love to go talk to, I've only asked for 1 girl's number since beginning journey of self improvement. How can I best use my genetically good looks to my advantage and have girls chasing me? Or at the very least be able to get with the ones I once considered out of my league and now intimidate me more since all the pressure is on? It should make things easier for me but shit is as hard as ever",dating,t5_2qhb1,https://www.reddit.com/r/dating/comments/p9xawv/how_can_i_use_my_good_looks_to_my_advantage/
6,p9xbr2,1629715840,Sudden repulsive syndrome - is it self sabotage?,"Hey r/dating! 

I've been on 3 dates with this guy that I was really excited about, but ive been struggling with what i've come to learn is called ""sudden repulsive syndrome"" or ""the ick"": 

""A condition many people experience after dating an individual for a short amount of time. The individual is probably polite, nice, and generally pleasant to be around, **but one day, you suddenly find yourself disgusted by his or her appearance or actions""**

This seems to become a frequent thing with me. I meet someone, I get excited and then on our second or third date there is something insignificant about the persons mannerisms that changes my view of them completely. I've never come back from this, I havent found a way to reverse it so when it happens I've just come to accept that I cant really do much about it. 

I wonder if anyone else has this issue? I guess its worth to mention that I struggle with anxiety, depression and I was a polysubstance abuser (clean 9 months). My therapist thinks it may be some sort of self-sabotage mechanism that happens unwillingly, but we havent been able to reverse it and its very disheartening. I dont feel like its fair to keep dating people because it kinda feels like I string them along in a way? I dont like hurting people. 

I'd love to hear what you think about this.",dating,t5_2qhb1,https://www.reddit.com/r/dating/comments/p9xbr2/sudden_repulsive_syndrome_is_it_self_sabotage/
7,p9xfrj,1629716347,How did you feel/how are you supposed to feel after a first meeting/date?,"Hey everyone!

So I’ll admit I’m pretty inexperienced in this area &amp; this is kinda long so bear with me. 

I matched with this guy online, I wasn’t super into him but he was quite interested so I was like meh whatever I want to meet new people. So I asked him if he wanted to go for a walk &amp; just hang out, he accepted &amp; we met up yesterday.

When I first met him I was like ok he looks better in person but I’ll treat it as a friends vibe. We walked around this park chatted, it was good but I just felt I was hanging with a friend. 

Finishing the date/meeting he asked for my number I was like sure whatever. Then at the end I hugged him &amp; and I had my hand on his shoulders &amp; he had his hands around my waist &amp; he kind of held me there &amp; I could tell he wanted to kiss so I was like fuck it &amp; went for it, but I didn’t feel anything. If anything I was thinking damn he needs to slow down😂

This being said how did you guys feel on first dates? Are you supposed to feel sparks or something I’m confused right now especially since he’s texting me &amp; I kind of cba to reply :/",dating,t5_2qhb1,https://www.reddit.com/r/dating/comments/p9xfrj/how_did_you_feelhow_are_you_supposed_to_feel/
8,p9xib2,1629716593,Do short women date short men?,I’m 5’7 in a country where the average women is around my height however I heard that short women are also not interested in men around their height or slightly above and I’m worried this will put me at a disadvantage when I actually try to date women. Now I hear even women who are 5ft want men who are really tall like at-least 6ft as my height is considered short for them. how true is this?,dating,t5_2qhb1,https://www.reddit.com/r/dating/comments/p9xib2/do_short_women_date_short_men/
9,p9xjdp,1629716718,Am I overreacting?,"I (23 m) started talking to this girl (22 f) and we had what felt like a connection. We went on a movie date some days after and it went really well. We then found that we both have had experiences of domestic violence. A past relationship for her and growing up with family for me. We spoke about sex and she said she'd like to wait as she hasn't fully healed. 

Fast forward 2 weeks and I find out she knows a friend of mine (he doesn't know I know her). Then a couple days after I find out they have indeed been having sex. 

After finding this out I decided to delete myself from the situation and have barely been returning any of her texts. 

She texted once saying I'm overreacting and I only stopped talking to her because of my friend. I've just found it funny that she's yet to address the not being able to have sex because of DV. She's acting like we never had the conversation",dating,t5_2qhb1,https://www.reddit.com/r/dating/comments/p9xjdp/am_i_overreacting/
10,p9xp41,1629717372,Trouble establishing chemistry on dates,[removed],dating,t5_2qhb1,https://www.reddit.com/r/dating/comments/p9xp41/trouble_establishing_chemistry_on_dates/
11,p9xuhe,1629717983,'Still waiting',[removed],dating,t5_2qhb1,https://www.reddit.com/r/dating/comments/p9xuhe/still_waiting/
12,p9xvjc,1629718108,Medical professionals overrepresented in my dating pool,[removed],dating,t5_2qhb1,https://www.reddit.com/r/dating/comments/p9xvjc/medical_professionals_overrepresented_in_my/
13,p9y231,1629718840,complete 180,"So I et this girl at a party, introduced by a mutual friend. She was super touchy and flirty, asking me lots of questions, getting close etc. etc. I asked her for her number at the end of the night, and texted her the next day, asking her out for a drink. She agreed and asked me when I was free. I said Tuesday night. She waited 36 hours til 1130 on monday night to get back to me, apologizing for being 'disorganized'. I said no problem, and we met up the next night.

She asked me lots of questions about my dating history, what I look for in a woman. She refused to call it a 'date' in spite of all that, but i was adamant that it was of course a date. Two people getting together and seeing if they have a romantic connection. I told her I wasn't interested in just being friends. She commented several times that I was 'bold' and 'smooth'. As we left the restaurant we held hands and I gave her a soft kiss as we walked. We went to another bar and had another couple of drinks. She was very touchy and affectionate throughout. We kissed again a few times, and walked back to the subway, which was now closed. We walked round the corner to get cabs, sat on a bench and got pretty physical, kissing, touching, close contact etc. I ordered my cab and told her she could come back to mine if she wanted. She agreed with very little hesitation, although she said ""i know what type of guy you are...you're a scorpio, sex is your love language...I've been fucked over by guys like you in the past'. I said she had no idea what kinda guy I was and she'd have to take a risk.

We got the cab home and we got in to bed. We lay there for a while and kissed a little, although she batted me away when I tried to get more physical - repeating the same thing - 'I know what you're like' etc. I rolled over and we went to sleep. Next morning we woke up and we carried on cuddling, I rubbed her back and we chatted, she lay next to me hugging me etc etc., but no sex. I flirted a little with the boundary but I kept it kosher. Anyway, time to get up. We get dressed and go downstairs, drink a coffee and chat some more. She gets her stuff together and leaves, and gives me a tender kiss goodbye on the doorstep.

That evening I texted her 'I had a great time, would love to see you again soon'. and I got nothing back. I sent no follow up text, and just let it lie. TEN DAYS later, she texts me this:

Hey, I hope all is well with you. You're an awesome person but I want to keep things platonic between us. I want to be transparent as I feel you deserve that'. I replied 'that's a sweet message, so thanks, although I'm not impressed at all with how long it took you to send it. I'd love to get to know you better but I'd be lying if I claimed platonic intentions. Get in touch if you change your mind but bye for now xx

So weird. She seemed heavily in to me throughout the night, it just seems like a total flip around. People change their minds with the benefit of hindsight but I can't shake the feeling that she was up for the chase. Maybe gave herself away too much in the beginning, and had to pump the brakes. I won't be following up with her but would appreciate other ppls take on this.",dating,t5_2qhb1,https://www.reddit.com/r/dating/comments/p9y231/complete_180/
14,p9y547,1629719197,Does EXPECTATIONS kill?,"Hello, I would just like to ask you agree that expectations kill a person? like in any aspect in life for e.g, in relationships or in family. Just want to know you're opinions.",dating,t5_2qhb1,https://www.reddit.com/r/dating/comments/p9y547/does_expectations_kill/
15,p9yqba,1629721424,Hate waiting around!,[removed],dating,t5_2qhb1,https://www.reddit.com/r/dating/comments/p9yqba/hate_waiting_around/
16,p9yz9f,1629722348,A speechless experience,"On the first date the guy asked me the below questions: 

1. What would you do if your husband got into a car accident and was handicapped?
2. Would you quit your job if your husband told you that he would support the family and you don’t have to work?
3. If your husband decided to move out of the state or the country, would you go with him?
4. Would you quit your job and take care of the kids when you had babies?
5. Would you be a stay home mom? 

We went to the beach to watch sunset. He almost couldn’t wait to ask me these questions after we found our seat. Apparently watching sunset wasn’t of his interest at all. I didn’t get a chance appreciating nature either because he kept asking these questions. 

On our way to the beach, he complained about his ex girlfriend not contributing financially and dependent on him. She was a struggling actress. He also complained that she liked to dine out all the time (again it’s about money).

On our way back home, he asked me whether I’d sign a prenup if the guy asked to do so. He’s not a billionaire but an average person who holds a job, like me. 

Other than that, he was very generous with giving compliments on how I looked. It was very generic, not so genuine compliment though. So I got bored of his compliments soon but still tried to show appreciation. 

I am still traumatized by this experience. I’m speechless. I’m out of speech.

What’s wrong with him???",dating,t5_2qhb1,https://www.reddit.com/r/dating/comments/p9yz9f/a_speechless_experience/
17,p9z98r,1629723350,Afraid i might disappoint first date,"Hey all 👋. Posting on here because I appear to be in a little bit of a pickle. I’ve really struggled to get dates over the past few years/whole life. I went years without even speaking to a female. But lately I’ve had a major influx on matches on dating apps.

My fear is that I will not be the man they expect. Frankly because I’m really not. On my apps, I have in my bio that I am 6’5”, but in reality I’m only 5’3”. None of the pictures on the app are me, although I did try and find someone who looks similar to me. 

I also have added that I am a professional chef and have worked with Gordon Ramsey. I’ve never cooked a meal in my life, literally. 

I’ve spoken and set up many dates with some females, but I’m really getting nervous as it’s about time to go see them. How can I break the ice with them if it gets awkward?",dating,t5_2qhb1,https://www.reddit.com/r/dating/comments/p9z98r/afraid_i_might_disappoint_first_date/
18,p9zehw,1629723843,Date looked very different from their pictures,[removed],dating,t5_2qhb1,https://www.reddit.com/r/dating/comments/p9zehw/date_looked_very_different_from_their_pictures/
19,p9zjox,1629724343,"GF starting a new job, celebration ideas?","My girlfriend of 3 years is starting a new job in September and not sure what exactly to do to celebrate. I didn't do much on her last day at her old job (which she was tired of and didn't seem to make a big deal of).   


Im super close to going in on ordering a small pizza oven and the tools needed to use that as we both love thin crust wood oven pizza (especially her). Is that enough and obviously some drinks?  


Appreciate anyones feedback!",dating,t5_2qhb1,https://www.reddit.com/r/dating/comments/p9zjox/gf_starting_a_new_job_celebration_ideas/
20,p9zjpr,1629724345,How long until you accept you’ve been ghosted?,[removed],dating,t5_2qhb1,https://www.reddit.com/r/dating/comments/p9zjpr/how_long_until_you_accept_youve_been_ghosted/
21,p9zt7g,1629725253,"Hi! I'm a relationship coach who focuses on transformation through creating and raising consciousness. I support people to attract high-value partners, have better interpersonal relationships by improving their relationship with self. AMA!","Hello everybody! As the title says, I'm here for most of the day to answer questions you may have about all things relationships- be it with your partner, family, friends or acquaintances.  There may be times where I step away as I'm doing this on a day I also accommodate clients, as a heads up.

I operate from a space of spirituality, psychology, movement &amp; some philosophy.

Ask away!

TL;DR: Relationship coach here to connect and answer any questions on relationships. AMA!",dating,t5_2qhb1,https://www.reddit.com/r/dating/comments/p9zt7g/hi_im_a_relationship_coach_who_focuses_on/
22,pa0exg,1629727226,When should I (21 M) tell her (26 F) how old I am?,"I (21 M) am interested in this girl (26 F) from my dance class. We danced at a club together two weeks ago and we have a date this Wednesday. 

I don’t have a problem with the age gap, but she looks younger than she is. It wasn’t until we added each other on Instagram that I learned she’s 26.

I don’t have anything on my social media that gives away my age, but I think she also believes that I am older than I am. People tell me all the time that I look mature for my age (could be the beard haha.)

Should I wait to bring up the age thing until after a couple dates? Or should I tell her right away? I personally don’t think it matters, but I don’t want a situation where she feels like I wasn’t being transparent. Am I just overthinking things?",dating,t5_2qhb1,https://www.reddit.com/r/dating/comments/pa0exg/when_should_i_21_m_tell_her_26_f_how_old_i_am/
23,pa0jya,1629727671,"Need advice for someone (M,23) who went out on 3 dates with F,24","We met off hinge, went on dates thrice - had a great time, connected - but haven't kissed yet (tbh we only met in public). 

So last night i told her i liked her, and she replied it with a like (insta) and hahahah and then we continued talking like normal. 

She texted me again this morning- but I'm not sure? I made it pretty clear I'm not looking for friends before itself - so not sure how to go ahead now.",dating,t5_2qhb1,https://www.reddit.com/r/dating/comments/pa0jya/need_advice_for_someone_m23_who_went_out_on_3/
24,pa0kz6,1629727766,Let’s talk on Snapchat,"Is it possible to find a guy via online?
Text me on snap-   yalyson1",dating,t5_2qhb1,https://www.reddit.com/r/dating/comments/pa0kz6/lets_talk_on_snapchat/
25,pa0nty,1629728018,[M26] Was this insensitive?,"Hi,

I had been talking to a girl for about 4 months online before meeting her physically. This was because she was out of state and moving to the state I live in. (She wasn't moving for me - it was part of her plan)

&amp;#x200B;

When she was moving, I helped her out and let her stay at my place for a while. However she was moving with her single mom as well - so they needed a seperate place of their own since my place.

&amp;#x200B;

In the midst of all of this, getting a place to rent was hard because she didn't have a job. I didn't offer to become a guarantor. Anyways - after being at my place for a few days since moving in, her friend (who is some other guy mind you) - offered to be her guarantor.

&amp;#x200B;

This pissed me off a little, but I couln't blame her because I didn't offer to be her guarantor. I know this is silly, but I have a problem with the other guy, should I just step in and say fuck him I will be your guarantor? The thing is I really don't trust her financial situation, and honestly I am not in a position to carry someone else's burden, it has nothing to do with trust etc...",dating,t5_2qhb1,https://www.reddit.com/r/dating/comments/pa0nty/m26_was_this_insensitive/
26,pa0p6d,1629728136,"Girl on tinder wants to video chat, im delighted but also freaking out?","For the first time i had someone text me first, and it was something actually related to my profile. We had a short but fun conversation and i made my intentions clear, and she agreed for a date on Sunday. I gave her my number and we started talking and everything seems to be pointing to the right direction

&amp;#x200B;

She uses the kissy winky emoji thingy often, she sends hearts and seems to geniuenly enjoy my company

she asked me if up for a video chat this evening and i didnt see anything wrong but im kinda nervous because i havent done that before... any tips?",dating,t5_2qhb1,https://www.reddit.com/r/dating/comments/pa0p6d/girl_on_tinder_wants_to_video_chat_im_delighted/
27,pa0ry2,1629728381,Paying for 2nd date,So Im going to the zoo with a girl for a second date. She suggested it and bought us tickets online which they are requiring because of covid. I was planning on paying but since she got the tickets online it made things feel weird. Should I offer to pay her back when we meet up and if so should I give her money for just my ticket or both?,dating,t5_2qhb1,https://www.reddit.com/r/dating/comments/pa0ry2/paying_for_2nd_date/
28,pa0snx,1629728445,It’s not my fault I’m single at 22 it just happens,"I’m tall, 6’0, take care of my hygiene, I consider myself to be charismatic, fun, creative, very talkative. I have a deep buttery voice, I love video games, TV shows, Anime. I like to make videos on YouTube, write poetry as well as hobbies, I have a job, I recently got my B.A, I want to do my master’s degree next year, ect. 

   I’ve stopped blaming myself or thinking that I’m not good enough and just decided to be happy with who I am, somebody outta appreciate that at some point. I’m single because I haven’t landed the right girls and that’s fine",dating,t5_2qhb1,https://www.reddit.com/r/dating/comments/pa0snx/its_not_my_fault_im_single_at_22_it_just_happens/
29,pa19k3,1629729933,Girlfriend doesn’t wash hands,"When I first started dating my girlfriend I quickly noticed that she doesn’t wash her hands after using the bathroom. I didn’t want to let it bother me, so I chose not to think about it. Now, fast forward to the present.. we just moved in together and now it’s even more apparent that she doesn’t wash her hands. This morning I was brushing my teeth while she was on the toilet pooping, and when she was done, she got up, sprayed some air freshener, and then walked over and gave me a hug. And then proceeded to continue with her morning routine. No hand washing. And I almost threw up.

I don’t want to make this a bigger deal than it is.. and I don’t want to offend her in any way bringing it up, but I don’t think I can let her touch me anymore without thinking about her dirty poop hands.

How can I bring this up in a sensitive and respectful way?",dating,t5_2qhb1,https://www.reddit.com/r/dating/comments/pa19k3/girlfriend_doesnt_wash_hands/
30,pa1hnt,1629730616,"There’s something deeply agonisingly about knowing, because of being average, you can’t reasonably count on getting a beautiful partner in life.",[removed],dating,t5_2qhb1,https://www.reddit.com/r/dating/comments/pa1hnt/theres_something_deeply_agonisingly_about_knowing/
31,pa1ir5,1629730707,"There’s something deeply agonisingly about knowing, because of being average, you can’t reasonably count on getting a beautiful partner in life.",[removed],dating,t5_2qhb1,https://www.reddit.com/r/dating/comments/pa1ir5/theres_something_deeply_agonisingly_about_knowing/
