,id,created_utc,title,selftext,subreddit,subreddit_id,url
43,pol6y0,1631689976,Why is biology so unfair when it comes to dating ages?,"Numerous studies show the same thing every time. Men, no matter what age, tend to want to date a woman who is in her early 20's. Women in their 20's want to date a man only a few years older max. BUT, when women reach 30, they desire men up to 45 years old. At 40, they will desire men up to 60+ years old. 

Which basically means, if you are a 35-year-old or a 40-year-old or a 50-year-old man, and on and on, 70, 80, 90, 110...your brain, chemistry, core make up wants to date a girl who is 20-28 or so, in a perfect world 20-22. But, those girls are plain disgusted at the idea mostly. If you are 42 (like me), only a small minority of 20 somethings are hopping on this bus, but when they hit 30, studies say they're all about this. But, my brain (and studies) say, ""no thank you, I am trying to stay below 30."" 

I suspect, generally, that most women want to be taken care of. Feminism can fight many things but it can't fight basic human nature in the end. This makes sense, as studies tend to show having a master's degree as a man makes you way more desirable to a woman, and men tend to want a woman to max out at a bachelor's degree. Women think an older man can care for them better, emotionally and financially. But, also, I think most would agree (and again, studies show) that women, on average, peak physically in their 20's, while men peak in their 40's. That makes sense w the data that says a 30-year-old woman is happy to date a max up to 45 yrs old. Women in their 20's don't count in the peak area, as they only want dudes a few years older max, so they are the anomaly. I wonder why that is? They are at their peak physically, so would they not date men who are at their peak as well?  Is it being new to the world, as it were, that causes them to think 40 yr old dudes are grody? Interesting stuff. I would assume a lot of this has to do with fertility as well. Women need to be physically peaking at an earlier age for the fact that they lose fertility after 30 in a very deep dive curve (plus, a woman has only so many eggs at birth)...and men can keep producing sperm cells until they die. Women lose around 90% of their available eggs by age 30.

Personally, my preference at 42 is late 20's. A lot of that is based on, I have never been married and do not want to marry a woman who has been married, and I do not want to date a girl who has kids, which is more likely after 30. Also, at 42, maybe I am alone, but I rarely look at a woman in her 30's and think, ""oh wow, she's gorgeous."" Again, goes back to the studies that show women peak physically in their early 20's.  
   
Also, it's an unfair double standard, but culturally I think we see a woman who is 40 or close to it and never married, and we say, ""WHAT IS WRONG WITH HER?"" Whereas, a man can remain unmarried for nearly ever, and we don't judge him in the same way. To be fair, it makes sense scientifically- women are the choosers and men are the pursuers. A woman has a much higher probability of bagging a dude for marriage at an earlier age due to the fact that they have the pick of the litter (average looking women and above) and have around 4,000 times as many options at any given time than your average dude. 

Anyhow, just some thoughts that came up as I randomly found some study about dating preferences, age, etc.",dating,t5_2qhb1,https://www.reddit.com/r/dating/comments/pol6y0/why_is_biology_so_unfair_when_it_comes_to_dating/
44,polim1,1631691581,Any one else tired of finding women who turn out to ask for money,"I just found a woman, for like the um-teenth time on any website, we hit it off, seem to have good chemistry and I’m getting excited, right? 

Then, I start to notice there are holes in the way she talks and she asks the some of the same questions over, and then, over again.

Then the hard-hitting question: can you loan me money!?!?

Full stop at that point, right? 

I am so tired of finding scammers man for real!

Does this happen to anybody else, guys gals lmk!

Thanks for the responses in advance. 🎃",dating,t5_2qhb1,https://www.reddit.com/r/dating/comments/polim1/any_one_else_tired_of_finding_women_who_turn_out/
45,polkwp,1631691916,when you see profiles of 40+ single women who want marriage and children?,"I feel for them. I remember after I got divorced at 40, I got bombed by women in this age group. I didnt want children so never lead any of them on. 

so I wonder to myself 

-were they asleep at the wheel. a late bloomer. a loner mindset

-focused on career. no opportunity to meet someone along the way

-hard to get along with. picky. 

not sure as any or more can be said for each. I feel for them.  everyone deserves to find a partner for themselves. 

like eddie murphy said. dont find perfect. find someone as fucked up as you are

some of these women are absolutely gorgeous. and I wonder how the hell no one nabbed them?",dating,t5_2qhb1,https://www.reddit.com/r/dating/comments/polkwp/when_you_see_profiles_of_40_single_women_who_want/
46,polmo8,1631692166,Available for hookup,[removed],dating,t5_2qhb1,https://www.reddit.com/r/dating/comments/polmo8/available_for_hookup/
47,poltf2,1631693112,Guys: How often do your dates look worse in person than in photos?,I’m a girl who got rejected after a date so I wonder if that’s the reason why.,dating,t5_2qhb1,https://www.reddit.com/r/dating/comments/poltf2/guys_how_often_do_your_dates_look_worse_in_person/
48,pom62h,1631695040,I didn't respon to his message all evening as I was having a bad mental health day,"I have been seeing a guy for nearly 2 months now. We message a lot and usually the longest i'll take to reply is a few hours or overnight if I'm asleep. Yesterday I had a very stressful day at work and had a very bad mental health evening and didn't feel up to responding to anyone. He didnt message me again, so I assumed he'd thought I was busy and wasn't too concerned. When I messaged this morning he said he'd thought I'd ghosted him, I feel really terrible about this as it must have caused him a lot of anxiety. Now im really anxious ive somehow ruined things. How is best to appologise/ explain.",dating,t5_2qhb1,https://www.reddit.com/r/dating/comments/pom62h/i_didnt_respon_to_his_message_all_evening_as_i/
49,pom944,1631695520,Why do I need affection so much. (27M),"So a quick background i grew up in a highly dysfunctional house with little to no actual affection, even verbally. I've been to therapy and dealt with my past. I only seem to attract girls who are cold emotionally and physically and I want a girl who is super mushy and clingy and affectionate but my friends tell me its a bad thing to have. Granted they all come from loving homes though. Is it wrong for me to want that in a relationship? It seems impossible to even find a clingy girl so I believe maybe they are right. I listen to GF ASMR and that is like the closet I have ever felt to true love and happiness.",dating,t5_2qhb1,https://www.reddit.com/r/dating/comments/pom944/why_do_i_need_affection_so_much_27m/
50,pomes4,1631696407,Will bring an incredibly short female negatively impacted my dating life,"I’m 5’1 and my ex would constantly make comments on my height, ask me to wear platforms, and would constantly point out tall women and praise them. Then he’d point out short women and ridicule their height. I was already insecure about height but this led me to feeling much worse. It is now wayyy more on my mind. My friends also make fun of my height (even tho i’ve asked them not to) and they always send Tik Tok’s to the group chat that make fun of short girls. When I look online it seems the consensus is tal women are attractive. I mean I’m bi and I like tall girls. I’m 18 if this helps.",dating,t5_2qhb1,https://www.reddit.com/r/dating/comments/pomes4/will_bring_an_incredibly_short_female_negatively/
51,pomfg3,1631696482,How do you move from being in a relationship to being single?,How do you move from being with someone actually loving you to single life with having mediocre sex with a random girl maybe once a month? I was fine for years by myself before I started dating but now that I did experience a couple of relationships I find it hard to not jump into a new relationship right away... Both my exes moved on like that but I actually dont want to end up like that. Now after nearly a year I feel like single adult life just kind of sucks... Im not in university or somewhere with a ton of single women around me so you got to try hard to get in contact with anyone.. Idk this just a vent I guess,dating,t5_2qhb1,https://www.reddit.com/r/dating/comments/pomfg3/how_do_you_move_from_being_in_a_relationship_to/
52,pomfqu,1631696524,Why do men expect sex first two dates?,[removed],dating,t5_2qhb1,https://www.reddit.com/r/dating/comments/pomfqu/why_do_men_expect_sex_first_two_dates/
53,pomipi,1631696947,Long-term serious relationship,[removed],dating,t5_2qhb1,https://www.reddit.com/r/dating/comments/pomipi/longterm_serious_relationship/
54,pomkyt,1631697293,Everyone is beautiful is bullshit!,[removed],dating,t5_2qhb1,https://www.reddit.com/r/dating/comments/pomkyt/everyone_is_beautiful_is_bullshit/
55,pommx6,1631697595,"The ""Grass Is Greener"" Problem","I recently had a blindsided breakup, which I detailed here: [https://www.reddit.com/r/BreakUps/comments/pktlhu/dont\_beat\_yourself\_up/](https://www.reddit.com/r/BreakUps/comments/pktlhu/dont_beat_yourself_up/)

It's been about 5 weeks of No Contact and 6 weeks since the breakup, and I've done a lot of reflecting during this time. I've come to the conclusion that my ex broke things off because she got ""grass is greener"" syndrome and isn't yet mature enough to know that limerence is not love, and the honeymoon phase doesn't last forever.

I'm curious to know, has anyone else found themselves in this position? This seems to be a massive problem with modern dating. The rise of the internet and online dating has given the illusion that there is always someone better out there. That the ""ideal partner"" is just a swipe or a DM away!",dating,t5_2qhb1,https://www.reddit.com/r/dating/comments/pommx6/the_grass_is_greener_problem/
56,pomyym,1631699391,Matched with coworker on Hinge,"I have a crush on my coworker. Today he came across me on Hinge and commented on one of my photos saying “lmao” (I’m assuming because we are friendly and he didn’t expect to see me on there). I commented back, matching us. I want to use this opportunity to just tell him how I feel. I know dating coworkers can get messy but I know I’d regret it if I didn’t say anything. But I’m also super scared to get rejected. 

Does him commenting on my photo to begin with mean anything? An invitation to open up the convo? I feel like if it was anyone else, he might just have swiped left and ignored. Then again, we are friendlier than your average coworkers so maybe he felt more comfortable poking fun at the situation. But maybe I’m reading too much into it",dating,t5_2qhb1,https://www.reddit.com/r/dating/comments/pomyym/matched_with_coworker_on_hinge/
57,pon2p4,1631699949,Hello World!,[removed],dating,t5_2qhb1,https://www.reddit.com/r/dating/comments/pon2p4/hello_world/
58,ponuoe,1631703622,“You can’t love someone until you can love yourself” - Opinions?,"As above - would you say this is strictly true, false or there’s some kind of middle ground?",dating,t5_2qhb1,https://www.reddit.com/r/dating/comments/ponuoe/you_cant_love_someone_until_you_can_love_yourself/
59,poo3el,1631704642,I Can't Recover Myself,[removed],dating,t5_2qhb1,https://www.reddit.com/r/dating/comments/poo3el/i_cant_recover_myself/
60,pooo92,1631707096,35M. Plastic surgery changed everything for me,[removed],dating,t5_2qhb1,https://www.reddit.com/r/dating/comments/pooo92/35m_plastic_surgery_changed_everything_for_me/
61,pooquk,1631707358,F4M Add me on Snapchat casey_andy2021,[removed],dating,t5_2qhb1,https://www.reddit.com/r/dating/comments/pooquk/f4m_add_me_on_snapchat_casey_andy2021/
62,poowop,1631707983,date with an anti-vaxxer,"hi reddit, got a bit of a dating dilemma here and would very much appreciate some input.

i’ve been wanting to get back into dating as of recently so trying to give everyone who asks me out a fair chance, i’ve been talking to this guy for a week or so and we have a whole date night planned - he’s quite attractive and honestly i’ve been so excited to get dressed up and have fun regardless of the date outcome.

we ended up getting into the topic of the dark web and he told me he’d spent $200 on a fake covid passport (!!!!!) as he doesn’t want to put anything in his body that he doesn’t need, but didn’t want to miss out on festivals and techno events. 

i am very much pro-vaccine, but not going to get too political on here. i completely understand people’s anxiety surroundingthe vaccine as i was an absolute nervous wreck before i got mine, but i still went through with it to protect myself and others. i don’t agree with anti-vaxxers especially when it’s blatantly obvious they haven’t formed their own intelligent opinion on the matter and it’s clear they’ve got all of their information from facebook conspiracy theorists. anyway, i digress. 

i just think it’s such a stupid amount of money to spend on something that’s so pointless - like bro just go and get your free vaccines i don’t understand 😭 i honestly feel like i’d be going against my morals and values going on this date with him - but he’s already booked and paid for everything so i don’t know what to do. please give a girl some advice",dating,t5_2qhb1,https://www.reddit.com/r/dating/comments/poowop/date_with_an_antivaxxer/
63,pooxlh,1631708086,Got the first date of my life scheduled for tomorrow,I’m already prepared for disappointment. Here goes nothing,dating,t5_2qhb1,https://www.reddit.com/r/dating/comments/pooxlh/got_the_first_date_of_my_life_scheduled_for/
64,pooywl,1631708223,What would you do?,"Met a girl on the street, we are in the talking phaze (including a bit of sexting). Last weekend she had a night out and got a bit drunk and pretty much invited me for a fuck. I had a good excuse as I was working so I think it's not going to go sour. We ended it with ""you are lucky I couldn't be there"".

I never fucked anyone drunk, what is the morality of the situation?",dating,t5_2qhb1,https://www.reddit.com/r/dating/comments/pooywl/what_would_you_do/
65,pop04m,1631708357,khankudi customer care number 8⃣5⃣9⃣7⃣8⃣4⃣2⃣2⃣6⃣8⃣,[removed],dating,t5_2qhb1,https://www.reddit.com/r/dating/comments/pop04m/khankudi_customer_care_number_8597842268/
66,pop225,1631708560,I just came across the Bumble profile of a colleague who's married with children OMGGG,"...oh god, I won't be able to look at this man the same again, and I have to work with him every day as he's pretty senior",dating,t5_2qhb1,https://www.reddit.com/r/dating/comments/pop225/i_just_came_across_the_bumble_profile_of_a/
67,pop4ho,1631708830,Any guys In the Atlanta area need a companion dm me,[removed],dating,t5_2qhb1,https://www.reddit.com/r/dating/comments/pop4ho/any_guys_in_the_atlanta_area_need_a_companion_dm/
68,popb0a,1631709532,Girls make it hard on me but why?,"I sometimes feel girls like me but that my approach is not right so it doesn't materialize. Maybe we both make assumptions. 

Often I meet them thru social media or dating app. I always know how to talk to girls on text and how to flirt with them - they almost always want to go on a date with me.

Now I do not want to come across arrogant but I'm pretty attractive. I'm 6""2+ , blonde and in a very athletic shape because I've been doing gymnastics and swiming since I was little. 

I've no baldness, straight teeth, know how to dress, and no facial anomalies like funky ear shape or what so ever. 

Yet, girls I date, would rarely say something nice to me. And there must be something to say at least...

But allright - no biggy. 

On social media I am also never showing off my body - certainly no topless posts, and I've absolutely no narcistic or superficial traits. I can easily be with a girl that looks average and love her to death.

Besides my physical appearance (and again, I'm not anything better than anyone) - I'm also intelligent, know a lot about culture, art, music, history, and I've a serious job. 

But ok! You still can be this and that, if you're a dick, no girl wants you. Now here's the thing - I'm always showing much interest, asking the girl many questions about her work, education, family, lifestyle, what's important in relationships etc. I'm always respectful and authentic.

If we go out for lunch or drinks, I pay. I ask if she wants to drink something else, check if she's ok, etc. Before we say goodbye, if I liked the date, I always tell in person that I liked the date and wish to meet again (no specific date of course) - and I'm always getting a positive reply like ""sure, let's keep in touch"". 

But then, often they aren't showing much interest and I'm not sure if they are waiting for me to make a move or don't want to meet me again. Also with this last girl I met.

I'm not going to push. I need a green light from them i.e. asking me how I am, how was my day, or give me any kind of reason to propose another date. When I'm not getting that, it turns me off and I won't follow up with them.

Then, this particular girl then suddenly replied to my Instagram story (she didn't need to?) with a "" ;) "" emoji. I asked how she is doing and she asked ""how are you"" ? Sounds good to me.

So the next day I asked her if she would like to hang out with my in the evening - to only get a reply that she's having diner with her friends and thus ""can't meet tonight"". 

But no counter proposal, or something like ""I'd have liked to, but \_\_\_"".

This is the moment I stop. I won't even reply to her anymore or wish her a good diner.

What am I doing wrong?",dating,t5_2qhb1,https://www.reddit.com/r/dating/comments/popb0a/girls_make_it_hard_on_me_but_why/
69,popbkr,1631709592,What do i do now?,[removed],dating,t5_2qhb1,https://www.reddit.com/r/dating/comments/popbkr/what_do_i_do_now/
70,popg3u,1631710062,Should I be concerned/worried?,"My fiancé(28M)and I(24F)have been together for almost 4 years. I have him very much; however, he is different from most guys I’ve dated (in a good way). He’s patient, gentle, soft etc, but still enjoyed football games, sports and things like that. 

Recently he said something that kinda made me overthink. Now just for reference and background, my mom’s last marriage ended because of her husbands homosexual past and she’s told me in great detail about that marriage. I am still close to my stepfather and he doesn’t know that I know what went down. Now to get to the question! I work with individuals with developmental disabilities and one of my clients is super flirtatious in a cute way. So I jokingly said “gotta be careful she might try to take you from me” and he jokingly said “babe just tell her I’m gay”. Obviously because of what I’ve experienced in my mom’s marriage I automatically thought the worst and began overthinking. 

This made me think of other instances (and I’m probably overthinking these as well). So when we 1st started dating he went on a trip out of town with a group of college friends, there were guys and girls on this trip, they rented a Airbnb! when he got back I asked him where they stayed and he told me that they all stayed at the Airbnb. He said he and one of his college buddies shared a room and slept in the same bed. This was like our 1st year of dating so I didn’t think anything of it tbh. 

Another thing is when my mom first met him she asked me “is he ok?” Basically asking if he was gay. And I laughed at her, crazy enough she’s now IN LOVE with him. Like she legit loves him as her own and calls him all the time and it’s super sweet the relationship they’ve formed but now it’s like all those thoughts are coming back. 

Sexually, we have no problem. I have been holding out until marriage but we do engaged in other sexual activities and when we do he almost always initiates it. He grabs a handful of my boob every night before he sleeps. 

I guess my question is, should I be concerned? 

Tl;dr: fiancé said some things and it’s got my questioning some things.",dating,t5_2qhb1,https://www.reddit.com/r/dating/comments/popg3u/should_i_be_concernedworried/
71,popjzx,1631710466,Why can’t I find anyone that will match my energy.,"I spend a good bit of time thinking about the next person I might find myself in a relationship with. Typing that makes it sound a little crazy but we all have standards and expectations of the people we want in our lives so don’t judge me lol. 

My guy needs to be a romantic, a gentlemen, someone who will go out of their way to put others first. I’m a 21 year old female and I’m not ashamed to say I’ve had a lot of sexual partners, and out of all those sexual partners I’ve only ever had a few genuine connections. Out of those few I only ever received flowers from 3 men. It genuinely made me happy and to me its a perfect gift. To me is shows that you were thinking of me and wanted to do something nice for me. Lately the guys I’ve hung around, are not like that. Most of them just think about themselves and are seriously selfish people. Meanwhile I’m out here offering to cook you food, make sure you have everything you need. My love language is acts of service no doubt, I love showing the people I love that I care about them. I don’t ever want them to doubt that. Im not at all trying to gloat but I’m a very giving person I will go all out, buy you things, spoil your ass essentially. I’ve yet to meet another person to do any of those things for me. Are there guys out there who even do this? If so where the hell are you hiding. 

I’m not just saying it has to be monetary things, it’s the little things that win my heart. For example when I was talking to this guy, I mentioned to him that I wasn’t feeling good and I was on my period and cramping really bad. He came to my house after he got out of work with roses, a heating pad (that I still have lol) and soup from my favorite restaurant. For some people that might not be saying much but it was a surprise and so sweet. 

Being this way has it perks, but then it also has its downfalls too. For example for Valentine’s Day I got my boyfriend at the time, some gifts, searched for days for the perfect items and when it was time to exchange gifts I’ll all he got me was a bag of candy. I was so disappointed, I find myself disappointed a lot with people, they don’t put half as much effort into me as I would do for them. Now maybe I have my head up my ass and please tell me if I do but I don’t think I’m crazy here. Is it normal to be around someone who doesn’t do anything nice for you? I just want to meet someone who would want to show me that they care for me in the same capacity. Maybe the reality is none of those guys wanted to give any of those things to me, I wasn’t the person they would do that for. 

TL;DR can’t find anyone who matched my love language",dating,t5_2qhb1,https://www.reddit.com/r/dating/comments/popjzx/why_cant_i_find_anyone_that_will_match_my_energy/
72,popmru,1631710755,"Ever since I started dating women, as a woman, I feel like I understand men more.","Oh my goodness, women can be evil, insufferable, assholes. I honestly feel sorry for any guys out there that are nice with good intentions. Women can be absolutely devious and horrible. Give a girl a pretty face and she's breaking hearts left and right, unbelievable.",dating,t5_2qhb1,https://www.reddit.com/r/dating/comments/popmru/ever_since_i_started_dating_women_as_a_woman_i/
73,poq1k4,1631712211,"What do you think of a guy who says ""she's not the one"" behind the back of his girlfriend of six years ?","So details : I'm 23 (F) and went home for a few weeks, and there's this friend of the family I find cute but who is in a relationship. I don't know him too well, he was just nice to me when I was younger and I always thought he seemed sweet and kind. This summer I developed a full-on crush on him but he has a girlfriend so I thought ""nevermind, maybe another time if he's ever single again."" However he came to my parents' house recently and when my mother asked him jokingly if he intended on marrying his girlfriend of 6 years (he's 28 and the gf is 24) he said laughing ""**if she was the one, I would tell you.""** 

He still remained sweet all the other times I saw him, but this one moment where he said that about her made me realize he might not be so nice. Do you also think it's a clear red flag? I did meet the girlfriend in question and although you can't really know people from a few minutes of convo, I saw she was rather sweet and definitely not tyrannical enough for him to say this out loud (to my 68 year old mum, to make things weirder, whom he sees maybe once every 2 years).

 Do you also think this is a blatant red flag? I'm trying to find excuses for him but I can't. My crush is clearly blinding me because if I hear another guy say this about his gf in my day to day life, I usually immediately see him as a bit of an asshole. Except if his girlfriend is abusive (which I'm not saying she isn't, I don't know her) I find this to be a strange thing to say even if you've argued with her or something. Let me know your opinions.",dating,t5_2qhb1,https://www.reddit.com/r/dating/comments/poq1k4/what_do_you_think_of_a_guy_who_says_shes_not_the/
