,all_awardings,allow_live_comments,author,author_flair_css_class,author_flair_richtext,author_flair_text,author_flair_type,author_fullname,author_is_blocked,author_patreon_flair,author_premium,awarders,can_mod_post,contest_mode,created_utc,domain,full_link,gildings,id,is_created_from_ads_ui,is_crosspostable,is_meta,is_original_content,is_reddit_media_domain,is_robot_indexable,is_self,is_video,link_flair_background_color,link_flair_css_class,link_flair_richtext,link_flair_template_id,link_flair_text,link_flair_text_color,link_flair_type,locked,media_only,no_follow,num_comments,num_crossposts,over_18,parent_whitelist_status,permalink,pinned,pwls,retrieved_on,score,selftext,send_replies,spoiler,stickied,subreddit,subreddit_id,subreddit_subscribers,subreddit_type,thumbnail,title,total_awards_received,treatment_tags,upvote_ratio,url,whitelist_status,wls,removed_by_category,author_flair_template_id,author_flair_text_color
61,[],False,Massive-Blacksmith30,,[],,text,t2_g3u7y63n,False,False,False,[],False,False,1636212192,self.dating,https://www.reddit.com/r/dating/comments/qo2ib3/why_is_the_dating_community_like_this/,{},qo2ib3,False,True,False,False,False,True,True,False,#ffd635,dating,"[{'e': 'text', 't': 'Giving Advice'}]",7bca2c58-4211-11e5-9ecb-0e60d8112001,Giving Advice,dark,richtext,False,False,True,4,0,False,no_ads,/r/dating/comments/qo2ib3/why_is_the_dating_community_like_this/,False,0,1636212204,1,"I’m just gonna go on a little rant here….


I have seen so many posts about why people can’t get dates, why the community has changed so much, why does everyone wanna sleep around instead of finding a nice long term relationship etc….

Has anyone stopped to really think about that? All the girls say it’s the guys fault. That they are the complete package and guys only want sex, but what is the complete package? Girls make it so hard these days for men to want a relationship. Most are so high maintenance, all about the looks, and think they are high and fucking mighty, but that ruins it for all of the girls who have flaws, the girls who aren’t the whole package and don’t want the whole package. Girls who just want to be loved, but men are so scared about commuting because these high maintenance girls make it IMPOSSIBLE. 

The dating field is changing because people are changing. You can’t expect to always find someone out of your league, and you can’t expect to find the whole Dam package. People have faults, they have issues, and they have flaws, but than all the high class people overlook them, and they don’t even notice the lower class people because they feel they deserve perfection. But there is. No. Perfection. 

Step the hell back and look at the bigger picture. Just because that girl not that perfection doesn’t mean she won’t be a wonderful wife. Just because she is almost perfection doesn’t mean she will be a wonderful wife. 

Just because he isn’t perfect doesn’t mean he won’t be a wonderful husband. Just because he is perfect doesn’t mean he will be the perfect husband. 

Stop letting yourself get so stuck in your head about what you want, that you overlook the one that don’t quite meet the description. Put personality before looks and see what’s really out there. If you can’t find anyone, your either looking in the wrong place, or your looking for the wrong thing. 

Thanks for coming to my Ted talk.",True,False,False,dating,t5_2qhb1,1124103,public,self,Why is the dating community like this?,0,[],1.0,https://www.reddit.com/r/dating/comments/qo2ib3/why_is_the_dating_community_like_this/,no_ads,0,,,
62,[],False,Leading_Whole9064,,[],,text,t2_etbrzfjo,False,False,False,[],False,False,1636212365,self.dating,https://www.reddit.com/r/dating/comments/qo2kaw/35_f4m_looking_for_a_holidate/,{},qo2kaw,False,False,False,False,False,False,True,False,#ffb000,,"[{'e': 'text', 't': 'Tinder/Online Dating'}]",5214d2ac-61f1-11e8-8bb1-0ed15e4a39c0,Tinder/Online Dating,dark,richtext,False,False,True,0,0,False,no_ads,/r/dating/comments/qo2kaw/35_f4m_looking_for_a_holidate/,False,0,1636212376,1,[removed],True,False,False,dating,t5_2qhb1,1124103,public,self,35 [F4M] Looking for a Holidate,0,[],1.0,https://www.reddit.com/r/dating/comments/qo2kaw/35_f4m_looking_for_a_holidate/,no_ads,0,moderator,,
63,[],False,strangerthings___11,,[],,text,t2_ftuvo87r,False,False,False,[],False,False,1636212443,self.dating,https://www.reddit.com/r/dating/comments/qo2l6m/do_you_think_we_are_gonna_work_out_should_i_give/,{},qo2l6m,False,True,False,False,False,True,True,False,#ea0027,dating,"[{'e': 'text', 't': 'I Need Advice'}]",19ec58c2-9f74-11e7-81a1-0e2bf15991f0,I Need Advice,light,richtext,False,False,True,42,0,False,no_ads,/r/dating/comments/qo2l6m/do_you_think_we_are_gonna_work_out_should_i_give/,False,0,1636212454,1,"I (26) have been talking to this guy (34) for over a month already. He seems to be like a great person.

But... he doesn't seem to worry about the future which never even bothered me, to be honest, until earlier today.

He has a job and works 6 hrs a day, he barely sleeps. I assume because he's a gamer. And he's very unproductive (he's admitted and trying to work on this which truly makes me proud)

I'm very supportive when it comes to his life decisions. 2 weeks ago, he decided to stop drinking alcohol. I am so happy for him and told him to do baby steps and don't overwhelm himself.

He also decided to go to a therapist and enroll himself in a gym on his day off, but he didn't because he was lazy and that he hates himself for it. He usually misses his doctor's appointments. I didn't say anything like ""you should take actions"" because I don't want to pressure him. He just stays at home all the time.

On the other hand, I am a very ambitious woman. I work out, I got businesses, I have a lot of hobbies like hiking, travelling, drawing, playing the Ukulele, and most importantly, I work for my future.

So earlier today, I mentioned to him that I like to start another business which is a clothing line. I am a designer. And the response I got was ""Why are you so obsessed with making money?"" I told him that I am planning to buy my own house next year.

He said, house is expensive. I told him that I will need to loan it and will pay for it for 20 yrs and renting is something that I don't want to do forever. He rents an apartment, by the way.

Then he went to telling me that ""I don't know why people is so obsessed over wealth so much!""

I told him that I am not and that I grew up in a poor family, got molested by different people around me who are drug addicts and alcoholics. And I don't want that same thing to happen to my kids someday.

He said that he just wants someone to accept him for who he is... and I was like 🙄🙄 dude, you were the one who's judging me here. I didn't say a single word about how lazy you really are. I didn't, for once, call you out for his negative views in life.

I am not the type of person who can get easily mad about things like this. Because I try to understand the person first. I always tell myself, ""maybe he had a bad experience in the past."" I was super calm all throughout the argument.

And another thing, whenever I ask him ""What's your plan for today?"" (I am literally just asking what's he up to) he seems to get triggered by it. I guess by the word ""plan"" and he thinks that I am calling him out for having such a lazy ass!

But before we end the conversation, he said that he's sorry and that he went back to drinking beer again, that's why. Gosh, he just took all his frustrations out of me.

I told him that if something bothers him, he can try to ask me in a nice way because I'm happy to talk it through and I just don't want to talk to someone who's being driven by so much emotions.

Should I still give this a shot? Or should I stop it?",True,False,False,dating,t5_2qhb1,1124102,public,self,DO YOU THINK WE ARE GONNA WORK OUT? SHOULD I GIVE IT A SHOT OR SHOULD I STOP IT?,0,[],1.0,https://www.reddit.com/r/dating/comments/qo2l6m/do_you_think_we_are_gonna_work_out_should_i_give/,no_ads,0,,,
64,[],False,South_Group4353,,[],,text,t2_g9ryt6e9,False,False,False,[],False,False,1636214759,self.dating,https://www.reddit.com/r/dating/comments/qo3cki/how_do_i_approach_a_girl_on_the_bus/,{},qo3cki,False,False,False,False,False,False,True,False,#ea0027,dating,"[{'e': 'text', 't': 'I Need Advice'}]",19ec58c2-9f74-11e7-81a1-0e2bf15991f0,I Need Advice,light,richtext,False,False,True,2,0,False,no_ads,/r/dating/comments/qo3cki/how_do_i_approach_a_girl_on_the_bus/,False,0,1636214770,1,[removed],True,False,False,dating,t5_2qhb1,1124114,public,self,How do I approach a girl on the bus?,0,[],1.0,https://www.reddit.com/r/dating/comments/qo3cki/how_do_i_approach_a_girl_on_the_bus/,no_ads,0,reddit,,
65,[],False,JonjonChoy,,[],,text,t2_dj7xo579,False,False,False,[],False,False,1636215040,self.dating,https://www.reddit.com/r/dating/comments/qo3g2e/uh_oh_got_left_on_read/,{},qo3g2e,False,True,False,False,False,True,True,False,#ea0027,dating,"[{'e': 'text', 't': 'I Need Advice'}]",19ec58c2-9f74-11e7-81a1-0e2bf15991f0,I Need Advice,light,richtext,False,False,True,4,0,False,no_ads,/r/dating/comments/qo3g2e/uh_oh_got_left_on_read/,False,0,1636215052,1,"Hey uh so yeah, I 20M was texting this one girl 18F I know pretty well. Very good friends with the whole family and extended. Recently got left on read after asking about her mom's health and asked to be kept updated on the results of a doctor's appointment. She read it but hasn't given an update over the last 4 days but it looks like her mom is doing fine on social media.

So I hate playing games and I'm no player. I like serious, long-term relationships that have meaning. But to blast back to junior high for a bit, is it bad to be left on read? I know the connotations for each person is different, but in my experience, if a person really even cared or appreciated the other person they would do the decency of replying. I know the potential answers of 'oh she's probably busy' or 'she forgot and maybe she's a bad texter.' But, again, in my experience, this is never the case with girls since they seem overly attached to their phones nowadays (guys too), so there's pretty much no excuse to 'accidentally' forget to reply. I'm just peeved about this since it seems to happen often with a lot of opposite gendered friendships, and it's honestly so childish. 

Anyways, rant over. Best course of action at this point? We see each other twice a week in group settings so that'll be awkward as heck",True,False,False,dating,t5_2qhb1,1124114,public,self,Uh oh got left on read,0,[],0.99,https://www.reddit.com/r/dating/comments/qo3g2e/uh_oh_got_left_on_read/,no_ads,0,,,
66,[],False,Juice4377,,[],,text,t2_d132jmch,False,False,False,[],False,False,1636215181,self.dating,https://www.reddit.com/r/dating/comments/qo3huf/dating_as_a_childfree_woman_and_compromising/,{},qo3huf,False,True,False,False,False,True,True,False,#ea0027,dating,"[{'e': 'text', 't': 'I Need Advice'}]",19ec58c2-9f74-11e7-81a1-0e2bf15991f0,I Need Advice,light,richtext,False,False,True,65,0,False,no_ads,/r/dating/comments/qo3huf/dating_as_a_childfree_woman_and_compromising/,False,0,1636215193,1,"I've always had a very firm childfree stance. And I know that I will never have my own biological children. Therefore, when I start dating someone I make this very clear at the beginning - as I don't want somebody to waste their time or expect me to change my mind.

However, recently I started dating a friend and I KNOW they want babies and were in fact talking about having a baby this or next year with their ex partner. 

Even though it is early days, because I know their history and I know they want kids, I've made sure that they know this is out the question for me. I don't want them to have to give up on something to be with me. 

But they offered me a compromise - they'd love to adopt. They would be happy to be the primary care giver/parent and stay at home (theoretically). Surprisingly, I'm actually okay with this. I'm not somebody that typically likes kids all too much but I like them in small doses and I DO make the more money out of the two of us. 

Is this an okay foundation to work with moving forward? Don't want to waste anyone's time. They definitely want to be a dad and I think I would theoretically be okay with this compromise - but is it enough? Do you need to be sure of these things before getting into a relationship with someone that wants kids? 

Cheers for your thoughts.",True,False,False,dating,t5_2qhb1,1124115,public,self,Dating as a childfree woman and ... Compromising?,0,[],1.0,https://www.reddit.com/r/dating/comments/qo3huf/dating_as_a_childfree_woman_and_compromising/,no_ads,0,,,
67,[],False,Throwawayaccount0629,,[],,text,t2_d0ktymf6,False,False,False,[],False,False,1636215465,self.dating,https://www.reddit.com/r/dating/comments/qo3lcn/feelings_after_hookups/,{},qo3lcn,False,True,False,False,False,True,True,False,#00a6a5,dating,"[{'e': 'text', 't': 'Support Needed'}]",fd9c03b8-a1ce-11e7-9172-0e8c9f9ecf4c,Support Needed,dark,richtext,False,False,True,7,0,False,no_ads,/r/dating/comments/qo3lcn/feelings_after_hookups/,False,0,1636215477,1,"This guy (38M) and I (38F) used to know each other slightly when we were both married. I bumped into him on a dating app few months ago and came to know we both are divorced now. He asked me to meet for a drink to catch up as a friend. This time I definitely felt attracted to him. We infrequently kept in touch, eventually we both told we like each other and ended up hooking up. Which was a really bad idea for me as I am not a NSA sex type person. I started developing feelings for him. But he is very inconsistent and not keeping in touch kind of person. After that one time he only texted when he wanted to hookup. Also he would take more than a day to respond to my text, he told me he doesn’t check his phone when I brought it up. I broke it off today, then he asked if we can still meet and talk , he would like that( we had decent conversations during those hookups). He did asked me few times to come try rock climbing (his hobby) with him, as i was hesitating he asked we can just go as friends. Now I am bit confused whether there was actual interest from his side as well or he was purely hooking up.",True,False,False,dating,t5_2qhb1,1124116,public,self,Feelings after hookups,0,[],1.0,https://www.reddit.com/r/dating/comments/qo3lcn/feelings_after_hookups/,no_ads,0,,,
68,[],False,THEPhilThePain,,[],,text,t2_9hy0vyur,False,False,False,[],False,False,1636215477,self.dating,https://www.reddit.com/r/dating/comments/qo3lho/does_age_matter_that_much/,{},qo3lho,False,True,False,False,False,True,True,False,#ff4500,dating,"[{'e': 'text', 't': 'Question'}]",a9531dce-194e-11e5-b177-0eff099c3d1f,Question,light,richtext,False,False,False,3,0,False,no_ads,/r/dating/comments/qo3lho/does_age_matter_that_much/,False,0,1636215488,1,"I(18M) am interested in a girl(21F) but I don’t want to ask her out if age could play too much into it. 

I know some people say that “age is just a number” but seriously, for the women on here, would you date a guy that is younger? (I’m taller by a decent bit so I don’t think physical maturity would be in the way at all, especially since we are not in high school, rather we are in college)",True,False,False,dating,t5_2qhb1,1124116,public,self,Does age matter that much?,0,[],1.0,https://www.reddit.com/r/dating/comments/qo3lho/does_age_matter_that_much/,no_ads,0,,,
69,[],False,Glittering_Ad_2628,,[],,text,t2_9l98z6xt,False,False,False,[],False,False,1636216004,self.dating,https://www.reddit.com/r/dating/comments/qo3s0a/coping_with_being_a_longterm_single/,{},qo3s0a,False,True,False,False,False,True,True,False,#00a6a5,dating,"[{'e': 'text', 't': 'Support Needed'}]",fd9c03b8-a1ce-11e7-9172-0e8c9f9ecf4c,Support Needed,dark,richtext,False,False,True,7,0,False,no_ads,/r/dating/comments/qo3s0a/coping_with_being_a_longterm_single/,False,0,1636216015,1,"I am feeling a bit lost right now. I went on a fourth date with a girl I quite liked yesterday, but the whole thing petered out and I don’t think I’ll see her again. Right now I’m in the process of moving on, but I’m not really looking forward to actively trying to date again for several reasons.


1. Online dating is super exhausting to me. As a 25-year-old guy who’s decently attractive but not the top of the pillar, I barely get any matches. And when I do, there is no guarantee that the quality of the conversation is going to be good.


2. I don’t really feel like I have other options. Due to rising Covid cases, public spaces are closing down again and there are no chances for a single person to join any kind of fun activity where you’d just get to meet new people. 


3. I have a hard time meeting people in general. Since my past relationship ended in 2019, I've went on dates with exactly 3 women. At this rate, I won't be able to meet someone who's a good fit for me soon.


4. I’m going to go on an exchange semester in Japan starting in April. This is exciting, but also means that it’s probably a bad idea to again try to find someone because the relationship might not have enough time to develop to survive my time abroad. I’ve had the same line of reasoning half a year before, because my exchange was supposed to start in September. I felt like quite an idiot when it got postponed to April due to Covid.



5. I feel like I’m a romantic failure. I’ve had just two relationships, both of which did not last longer than six months. I’ve been single since about February 2019 and, looking at all my friends, it looks like I’m almost the only one who doesn’t get to play in the game of romance. 



At the same time, I’m also wondering what the point of all this is. How many more years is it going to take? How many more years are the only hugs that I’m gonna get be good-bye hugs? Sometimes, I wish I could just sleep through times of my life that are so emotionally unfulfilling.",True,False,False,dating,t5_2qhb1,1124118,public,self,Coping with being a long-term single,0,[],1.0,https://www.reddit.com/r/dating/comments/qo3s0a/coping_with_being_a_longterm_single/,no_ads,0,,,
70,[],False,bruhidkanymoretbh,,[],,text,t2_fc8w1ngo,False,False,False,[],False,False,1636216173,self.dating,https://www.reddit.com/r/dating/comments/qo3u2z/why_would_he_21m_tell_me19f_this/,{},qo3u2z,False,True,False,False,False,True,True,False,#ea0027,dating,"[{'e': 'text', 't': 'I Need Advice'}]",19ec58c2-9f74-11e7-81a1-0e2bf15991f0,I Need Advice,light,richtext,False,False,False,8,0,False,no_ads,/r/dating/comments/qo3u2z/why_would_he_21m_tell_me19f_this/,False,0,1636216184,1,"have been texting this guy for like 3 or 4 months and it's gotten like pretty heated and sexual I guess. I have gotten attached to him and idk I thought the feelings were mutual (we also live in different countries). However one day out of the blue i was telling him how I was not feeling well and he suggested I go out and added maybe I should go on a date with someone? Why would he tell me this, if I thought we had something going on? I'm so confused.",True,False,False,dating,t5_2qhb1,1124119,public,self,why would he (21m) tell me(19f) this?,0,[],1.0,https://www.reddit.com/r/dating/comments/qo3u2z/why_would_he_21m_tell_me19f_this/,no_ads,0,,,
71,[],False,calefornia94,,[],,text,t2_bi3stgjd,False,False,False,[],False,False,1636216393,self.dating,https://www.reddit.com/r/dating/comments/qo3wut/i_27f_feel_like_im_gonna_die_alone/,{},qo3wut,False,True,False,False,False,True,True,False,#ffb000,,"[{'e': 'text', 't': 'Tinder/Online Dating'}]",5214d2ac-61f1-11e8-8bb1-0ed15e4a39c0,Tinder/Online Dating,dark,richtext,False,False,True,50,0,False,no_ads,/r/dating/comments/qo3wut/i_27f_feel_like_im_gonna_die_alone/,False,0,1636216404,1,"Venting but could use some pointers. As someone who’s dealt with social anxiety all my life, growing up I never dated or hung out with guys much. My first kiss wasn’t until I was 21. It only happened because of tinder. I didn’t have a boyfriend or lose my virginity until I was almost 22. Again tinder. My only relationship was very toxic. The feeling of finally being in love kept me in an emotionally abusive relationship for almost 4 years. It’s been 2 years since I broke it off and I haven’t been on a single date. Online dating apps are just not for dating. They’re hookup apps. Either that or you text someone and suddenly communication stops or you never meet up. There’s just too many options.

Unfortunately I don’t go out much because I don’t have many friends (thanks social anxiety) That makes it hard to meet people. It’s usually just me and my best friend. So last night we went out and a guy I matched with was there. It was dark inside and he was with a couple friends. Maybe he didn’t see me. But because of my anxiety I avoided eye contact. I got a drink to relax a bit but by the time I was relaxed he was gone.

This guy has hinted at hanging out a couple times but nothing has been planned. He’s followed me on IG probably a year now. Last time he brought up hanging out I was sick and I haven’t heard from him since. We don’t talk often. Usually just reply to our stories. Anyways, after that encounter I’m like “this is why I’m gonna die alone” lol we were finally in the same room and I expected him to read my mind and come up to me. I just didn’t know what to say or do. My go to is avoiding eye contact and that’s why no one comes up to me. I know it makes me unapproachable. I feel like I’m too old to have this much anxiety around meeting men. Even being asked out online makes me incredibly nervous.

TLDR: I think I’m gonna die alone because of my social anxiety",True,False,False,dating,t5_2qhb1,1124119,public,self,I (27F) feel like I’m gonna die alone,0,[],1.0,https://www.reddit.com/r/dating/comments/qo3wut/i_27f_feel_like_im_gonna_die_alone/,no_ads,0,,,
72,[],False,02_Pac,,[],,text,t2_bvy7r986,False,False,False,[],False,False,1636216525,self.dating,https://www.reddit.com/r/dating/comments/qo3yh7/wingman/,{},qo3yh7,False,True,False,False,False,True,True,False,#ff4500,dating,"[{'e': 'text', 't': 'Question'}]",a9531dce-194e-11e5-b177-0eff099c3d1f,Question,light,richtext,False,False,True,2,0,False,no_ads,/r/dating/comments/qo3yh7/wingman/,False,0,1636216536,1,"Met a girl at the Student Party yesterday, seen here a couple times before.We danced a bit and so on... . Now she followed me on the gram: What should I write to her?",True,False,False,dating,t5_2qhb1,1124118,public,self,Wingman,0,[],1.0,https://www.reddit.com/r/dating/comments/qo3yh7/wingman/,no_ads,0,,,
73,[],False,Permuta_sonica,,[],,text,t2_fd8o9z3g,False,False,False,[],False,False,1636216917,self.dating,https://www.reddit.com/r/dating/comments/qo432t/guys_how_do_you_feel_about_going_on_a_date_second/,{},qo432t,False,True,False,False,False,True,True,False,#ffb000,,"[{'e': 'text', 't': 'Tinder/Online Dating'}]",5214d2ac-61f1-11e8-8bb1-0ed15e4a39c0,Tinder/Online Dating,dark,richtext,False,False,True,389,0,False,no_ads,/r/dating/comments/qo432t/guys_how_do_you_feel_about_going_on_a_date_second/,False,0,1636216927,1,I particularly don’t like to have sex when I am on my period and I always feel very insecure about going on dates when I am on my period because I always get paranoid about guys getting upset about I refusing to have sex because of it. Sometimes I feel like they may think that it was just a waste of time or something at the point of not wanting to see me anymore. Is it a big deal?,True,False,False,dating,t5_2qhb1,1124117,public,self,"Guys, how do you feel about going on a date (second date) and the girl refuse to have sex because she has her period?",0,[],1.0,https://www.reddit.com/r/dating/comments/qo432t/guys_how_do_you_feel_about_going_on_a_date_second/,no_ads,0,,,
74,[],False,Select_Effective2526,,[],,text,t2_d7q6lkj3,False,False,False,[],False,False,1636217825,self.dating,https://www.reddit.com/r/dating/comments/qo4der/feeling_lonely/,{},qo4der,False,True,False,False,False,True,True,False,#ea0027,dating,"[{'e': 'text', 't': 'I Need Advice'}]",19ec58c2-9f74-11e7-81a1-0e2bf15991f0,I Need Advice,light,richtext,False,False,True,8,0,False,no_ads,/r/dating/comments/qo4der/feeling_lonely/,False,0,1636217836,1,"Hello , I write this post because I'm feeling pretty lonely and sad. Not because I have no friends, because I got plenty of them but I feel that I need something more than a friend. So any advice for me??",True,False,False,dating,t5_2qhb1,1124119,public,self,Feeling lonely,0,[],1.0,https://www.reddit.com/r/dating/comments/qo4der/feeling_lonely/,no_ads,0,,,
