,id,created_utc,title,selftext,subreddit,subreddit_id,url
32,qe06cy,1634974085,Lawyer Bae,"So I am talking to a guy I met about 3 months ago and I really like him. On our first date we instantly had a connections. He is a lawyer and is currently back in school getting his MBA. So we are non exclusively talking long distance. He has mentioned over and over about me moving to be with him and I honestly want to. I really enjoy talking to him and we both agree we could start businesses together and create an empire. If i stayed with him we also discussed that I would definitely save money as i won’t pay for the mortgage. Right now I live in Atlanta and run a Airbnb and am in the process of renting out my first property to professionals. I’m also about to take my GA real estate license test. However he mentions he doesn’t know if he will ever get married. I am 22, he is 29 and I am scared to move about 14 hrs away to have the life I have always dreamed of. A new city with new opportunities and also having the companionship of a fine successful man. If I did move it wouldn’t be until summer 2022 and he has mentioned us starting a brand together and acquiring properties. Am I crazy to pursue this? In the past I’ve had successful men but they don’t make plans with me and show me support like he does. It’s so crazy we’ve been looking at houses on trulia. HELP!! I sadly don’t have friends to ask and dont want to involve my family.",dating,t5_2qhb1,https://www.reddit.com/r/dating/comments/qe06cy/lawyer_bae/
33,qe07gn,1634974219,28yr old MAN CHILD ditches date in the middle of the movie,"I met this 28yr old man child through a dating website, im 27. We had been texting for 2 weeks. I had been out of town but once i got back he asked me to the movies. First off i hate going to the movies as a first date because you cant even talk to get to know one another but i said what the heck i havnt been to the movies since cocid hit. We had been having great conversations before we even met and he seemed really into me. Anyways i drove to his town as thats where the theater is and he paid for my ticket before i even got there. Once we sat down we talked a bit before the movie started. The movie was about to start and he says to me “ill be right back im going to the bathroom.” 5mins pass by and i had a gut feeling he wasnt going to return. 30mins go by… nothing. I have really bad anxiety i couldnt even concentrate on the movie knowing i had just been stood up. I got up and left. Once i got to my car i deleted his number and message thread. I then went to the dating website to unmatch him and he had already done it before i could even get to it😂 I just dont understand how a grown ass man couldnt even have the decency and respect to get through a fucking movie, a movie y’all!😂🤦🏼‍♀️",dating,t5_2qhb1,https://www.reddit.com/r/dating/comments/qe07gn/28yr_old_man_child_ditches_date_in_the_middle_of/
34,qe0bg4,1634974768,Men: Did you ever feel that there was no way in hell that you were finding the right person (or anyone at all in that regard) and then Bam! one day you found her?,Just wanting to hear some motivational stories from you my brothers,dating,t5_2qhb1,https://www.reddit.com/r/dating/comments/qe0bg4/men_did_you_ever_feel_that_there_was_no_way_in/
35,qe0d94,1634975028,How do you guys learn to properly love yourself enough to feel happy with someone else?,"Do something I’m noticing about myself is that I have been very quick to dive in a bit too deep with new people I’m talking to romantically. They’ll be attractive, a nice person and able to have good conversation with me where we both bounce off each other easily, and yet in the last few months since my last relationship ended, I’ve not felt the ability to keep these feelings for anybody for longer then maybe a month while we talk. I’ll start to feel the feeling fading and start to feel bad that it is because I don’t want to hurt the other person. The reason it’s complicated for me is that I always end up feeling lonely when I try to focus on myself, and crave a partner who cares about me and know someone feels that way for me. Idk really how to talk myself through thoughts like these, or where to look for advice for this issue",dating,t5_2qhb1,https://www.reddit.com/r/dating/comments/qe0d94/how_do_you_guys_learn_to_properly_love_yourself/
36,qe0fdu,1634975336,Baby fever while being single in your 30’s,"I (33 year old female), want nothing more at this point in my life than to be a mother. This constant twinge is making being single unbearable. I’m not wanting to go into parenthood as a single parent by choice at this point. If I’m single by the age of 35 (in 14 months), I might consider it. Anyone going through this, and if so, what are your thoughts/how are you calming yourself down?",dating,t5_2qhb1,https://www.reddit.com/r/dating/comments/qe0fdu/baby_fever_while_being_single_in_your_30s/
37,qe0i3k,1634975718,Is it just me or do you just must be perfect in today’s dating world?,"Like you either hit it off immediately or no chances like ever. Which is quite hard. You have to be like a complete wholesome person. No red flags, no issues, no past, fit, adventureous, interesting, funny, caring. Which is kinda hard for a first date. To me it seems that like it’s either mutual love at first sight or one of you will get ghosted eventually. Because, actually like for a million reasons that other person you just just met a moment ago somehow just didn’t appear to be it. Instant decision making at it’s finest. Bellissima",dating,t5_2qhb1,https://www.reddit.com/r/dating/comments/qe0i3k/is_it_just_me_or_do_you_just_must_be_perfect_in/
38,qe0j10,1634975847,I need advice asap,I'm not really comfortable sharing this with the whole sub so if someone could dm me that would be cool,dating,t5_2qhb1,https://www.reddit.com/r/dating/comments/qe0j10/i_need_advice_asap/
39,qe0su3,1634977165,"Can a guy and a girl, who are just friends, be each other's wingman?","Can it work, cause drama, or will others assume the guy and girl are a couple? Anyone have experiences to share?",dating,t5_2qhb1,https://www.reddit.com/r/dating/comments/qe0su3/can_a_guy_and_a_girl_who_are_just_friends_be_each/
40,qe0v57,1634977509,Well I’m out of ideas lol,"In my 18years of this life I’ve never had a relation ship. And I know that’s not uncommon, however I’m in collage now and that’s we’re a lot of people find their s/o. I’m starting to lose hope as the days pass and the sky loses color.I feel as my prayers are waiting to be answers. It’s not even that I’m bad looking, im 6ft+ I work out and I have good face genetic, as well as a sense of humor. I don’t know what girls want. Im not trying to boast or have a pity party. Just trying to find a idea or a reason to not lose hope in dating.",dating,t5_2qhb1,https://www.reddit.com/r/dating/comments/qe0v57/well_im_out_of_ideas_lol/
41,qe0wow,1634977749,How can I be less clingy to my girlfriend?,"So I have a girlfriend that I love very much. However, I made her the center of my attention that I put all my focus on her and nothing else. Because of this, I come off as extremely clingy to her because I always feel the need of being with her and preferably alone with nobody else. It's to the point where I'm sad when she can't hang out with me and even when I hang out with her but it's with my other friends too I get really sad that I can't spend alone time with her. I know that I can't always be with her and that its selfish of me to be super clingy towards her, which is why I need advice on how I can be less clingy to her. I'm worried if this continues she'll be really upset and end up breaking up with me...",dating,t5_2qhb1,https://www.reddit.com/r/dating/comments/qe0wow/how_can_i_be_less_clingy_to_my_girlfriend/
42,qe153j,1634978909,"What screams ""I AM A FUCK BOY""?",What actions/signs does the guy give that indicates that he is a fuck boy?,dating,t5_2qhb1,https://www.reddit.com/r/dating/comments/qe153j/what_screams_i_am_a_fuck_boy/
43,qe17by,1634979219,boyfriend wanted to scale things back,"i've been friends with this guy for a few months and a few weeks ago we decided to confess feelings and pursue a more romantic relationship. the first few weeks were amazing, but suddenly he pulled back and said we needed to scale the relationship back. at first, i understood where he was coming from and agreed. he's almost 30, and i'm 24, and he'd previously been talking about marriage very early on which i mainly went along with because i figured it was the honeymoon phase at work. but by 'scaling back' he went almost entirely cold. no more affectionate messages, no more late night calls, nothing. around the same time he became very busy with family and became gradually even more unavaliable to the point id typically be left on read. at some point, he apologized for his behavior, but not much changed and i told him i'd prefer not to talk to him while he's this distant and busy because it's causing me stress. today he told me he'd be busy as he is with family for at least 2-3 more weeks and i was left on read again. i'm wondering if the relationship, as new as it still is, is even worth it with how much of a 180 he took. 
should i cut my losses or continue to be patient while he deals with his own things? i'm really at a loss here. we really connected and were good friends before, so im really troubled and heartbroken.",dating,t5_2qhb1,https://www.reddit.com/r/dating/comments/qe17by/boyfriend_wanted_to_scale_things_back/
44,qe18xk,1634979461,Starting to have feelings for a girl I work with. Advice?,"Hey Reddit

So I've been talking to a girl I work with for the past month or so and we've met up this week outside of work for a coffee, which went really well. So far so good. 

When I first got her number I asked to meet up and she said she was happy to do that, but only as friends as she is recently out of a long term relationship. I was totally fine with that, however as time has passed and I've gotten to know her better I think I'm starting to have feelings for her. During our coffee it was really good, just got to chat for ages (like 4 hours nonstop) about ourselves and really got to know each other, there was a little flirting too, at least I think there was. After our coffee she seemed really keen to meet up again but instead go for dinner and/or drinks next week. I feel like two single people going for dinner and drinks is a date? Maybe that's just me.

I'm anxious about the whole thing because I do really like her but I feel like I shouldn't tell her because she might say she still only wants to be friends and then it would probably ruin the connection we have as friends. I feel like I'm moving too fast, as we have only met up once outside of work, but I can't help the way I feel.

To summarise; I'm beginning to like a girl I work with, however she's recently single, so I don't want to tell her how I feel as it might put her under pressure. 

Any advice? Do I tell her? Or should I wait? Or just not tell her at all.",dating,t5_2qhb1,https://www.reddit.com/r/dating/comments/qe18xk/starting_to_have_feelings_for_a_girl_i_work_with/
45,qe1dy3,1634980082,It's me again.,[removed],dating,t5_2qhb1,https://www.reddit.com/r/dating/comments/qe1dy3/its_me_again/
46,qe1e5p,1634980111,How do I learn to trust my partner?,[removed],dating,t5_2qhb1,https://www.reddit.com/r/dating/comments/qe1e5p/how_do_i_learn_to_trust_my_partner/
47,qe1hvn,1634980641,"""Don't take yourself too seriously"" on OLD",What does that even mean and why is it on every other profile (men)?,dating,t5_2qhb1,https://www.reddit.com/r/dating/comments/qe1hvn/dont_take_yourself_too_seriously_on_old/
48,qe1yg3,1634983027,Long distance tips,So I just got into a long distance relationship. Can anyone give me tips,dating,t5_2qhb1,https://www.reddit.com/r/dating/comments/qe1yg3/long_distance_tips/
49,qe1yj3,1634983039,Do White woman hesitate to date Indians?,"There are a few drawbacks of Indian men for sure, like they think that White woman are like women's who they see in Hollywood movies. But not all men are like that. I have a cousin who lives in the US who got rejected by a White Girl. He is a nice person. He liked her for being kind, prolly got rejected for looks. So, do you guys hesitate to date Indian men for reasons which I want to know or you just basically don't count any racial or national factor?",dating,t5_2qhb1,https://www.reddit.com/r/dating/comments/qe1yj3/do_white_woman_hesitate_to_date_indians/
50,qe1zga,1634983179,What’s the best app to get into dating?,"(M-21) I’m from Mexico and I’ve tried tinder… my experience on tinder wasn’t good enough, I mean yeah you date but you only have options if you put money into it.
So… what’s the best app to date? In your opinion",dating,t5_2qhb1,https://www.reddit.com/r/dating/comments/qe1zga/whats_the_best_app_to_get_into_dating/
51,qe2elg,1634985168,I still have a crush on my ex,"Me and my ex broke up after a certain argument. We were playing a game, and then we had dinner.  We were just finishing but then I found her texting another guy.  She referred to him as “babe” and “sweetie”. When I asked her who he was, she got all defensive and saying he was “just a friend”. After the argument, I left her house and went back to mine. I wanted to apologise to her for getting in the fight. Does anyone have any advice?",dating,t5_2qhb1,https://www.reddit.com/r/dating/comments/qe2elg/i_still_have_a_crush_on_my_ex/
52,qe2how,1634985596,How long to wait to ask for another date?,[removed],dating,t5_2qhb1,https://www.reddit.com/r/dating/comments/qe2how/how_long_to_wait_to_ask_for_another_date/
53,qe2iix,1634985716,26F looking for something fun and nasty of tonight interested in meeting up ? Feel freee,"Being lonely is crazy, I'm here looking for chill vibes and I'm lonely tonight I wanna meetup with Smooth men
tonight and you know possibly maybe have fun
together if that's something you're into. A little about
me… First off.…..... I'm just a weird, socially awkward girlie.
I'm into Art, restaurants, listening to music, anything adventurous related. I mean.... I like tacos (fun fact) I have a boat load of dad jokes that would probably sink the ship (yes I know I'm lame) lol If any of this sounds interesting of just intrigued you in some sort of way feelfree to DM me, lets talk let's meet up",dating,t5_2qhb1,https://www.reddit.com/r/dating/comments/qe2iix/26f_looking_for_something_fun_and_nasty_of/
54,qe2jrm,1634985895,How do I bring up getting back together with ex?,"Me (25m) and my ex (23f) broke up 3 months ago mainly due to her work/uni commitments and she said when we broke up she couldn't commit the same to a relationship during this time.

However, we got back in contact and hung out the last 2 Thursdays to grab something to eat, she's mentioned she's been stressed but her uni work is almost over. She still playfully touches me, jokes, compliments and looks at me the same way she did when we were a couple, so something is still there imo.

What I wanted to know is, how do I bring up the discussion on trying again? I know what I want to say, in terms of taking it slow and seeing how it goes, along with setting boundaries. I'd much rather do this in person rather than text. Any guidance appreciated

TL:DR! Broke up 3 months ago, hung out a couple times, still feel there is something there, how do I go about discussing this with her and proposing the idea?",dating,t5_2qhb1,https://www.reddit.com/r/dating/comments/qe2jrm/how_do_i_bring_up_getting_back_together_with_ex/
55,qe2uo5,1634987285,What would it take for you to date someone with no job or home of their own?,So say someone was down on their luck and found themselves jobless and having to live with a friend or relative. They are looking for work and intend to rebuild their life. Would you consider dating someone in this situation? Why or why not?,dating,t5_2qhb1,https://www.reddit.com/r/dating/comments/qe2uo5/what_would_it_take_for_you_to_date_someone_with/
56,qe31eq,1634988132,I kissed a girl and... I'm confused if she liked it,"So, I matched with a girl on Tinder a year ago. We never got out somewhy (perhaps it was the lockdown, perhaps she didn't want to that much), but we kept contact through Insta and there was a mutual reaction to stories history for all these months - but nothing more.

Last weekend I was at a bar with a friend and I posted a story of it, and she replied that she was also there. I didn't catch the message on time but she invited me to another bar where she went to. We talked there for an hour alone and there was some nice vibes (at least that was what I thought), and at the end before she took a taxi we kissed (I was the one who made the move but she followed and it wasn't just a kiss on the lips, more like a passionate kiss that lasted for a while).

Right after she got home she texted me if I also was back and everything was alright. I answered that yeah, everything's fine etc and that it was a nice night. And I said goodnight. The following morning she just liked that message without answering. And we didn't talk for the entire week. Last night I also posted a story of a bar I was out (yes, I go to bars and post stories apparently, that's what I do!), she reacted to it, I texted her that she also seemed to have fun as she was in a live gig and she replied that ""it was a nice show"". Just that.

I'm pretty sure that she is not interested at all but there are some stuff that I can't understand. What do you think about that? Should I just leave it there?

Sorry about the tl;dr!",dating,t5_2qhb1,https://www.reddit.com/r/dating/comments/qe31eq/i_kissed_a_girl_and_im_confused_if_she_liked_it/
57,qe3c2d,1634989444,I'm 24f anyone in Virginia for a long-term relationship,"I'm 24f stays in Virginia, been single for 2 years now due to some personal issue. Now I'm ready for it now.  Anyone in Virginia ?",dating,t5_2qhb1,https://www.reddit.com/r/dating/comments/qe3c2d/im_24f_anyone_in_virginia_for_a_longterm/
58,qe3flz,1634989865,If I don’t laugh I cry,"Was ghosted whilst setting up a 4th date with a girl (2 ignored messages) despite high interest.

Just received a promotional halloween offer in my email from the bowling place that I last took her to - “👻 Grab our wicked deal before it ghosts! 👻”

If I don’t laugh I cry",dating,t5_2qhb1,https://www.reddit.com/r/dating/comments/qe3flz/if_i_dont_laugh_i_cry/
59,qe3gct,1634989959,Should I shut down ex's,"I have been in several relationships that have ended, most have ended amicably and stayed in contact as friends no bad blood at all. two of my ex's have hit hard times due to Covid retrenchments and the sometimes ask money to help them out. my current girlfriend doesn't know i chip in their accounts now and then just for them to make ends meet. I somehow think she won't be okay with this, cause I remember she read a text on my phone where i sent one of my ex's money for a cab to go pick up their kid from school and she had a fit of jealousy. I just don't believe in totally annihilating connections with my previous relationships, since we had connections and life experiences together it would be cruel and unjust to just shut them off or ghost them. But on one hand i feel it is not fair to keep stuff from my current GF cos secrets really kill a relationship,what should I do?",dating,t5_2qhb1,https://www.reddit.com/r/dating/comments/qe3gct/should_i_shut_down_exs/
60,qe3h2c,1634990044,Should I stop?,[removed],dating,t5_2qhb1,https://www.reddit.com/r/dating/comments/qe3h2c/should_i_stop/
61,qe3xmb,1634991887,My ex-girlfriend (22f) cheated on me(22m) while we were together.,[removed],dating,t5_2qhb1,https://www.reddit.com/r/dating/comments/qe3xmb/my_exgirlfriend_22f_cheated_on_me22m_while_we/
62,qe3zkf,1634992112,Are Men ruining dating for other men?,"Hi so my question today is are the really good looking men ruining potential dating and relationships for average men? 

I’m seeing a lot of men or ( fuckboys) sleeping with multiple girls or texting multiple girls (ik this has been a thing for thousands of years minus the texting part😂) but are they by giving hope to these girls that they will settle down with them while talking to another girl/ sleeping behind there back stopping average guys finding someone.

Generally there’s a lot of selectivity/filter these days
So my solution or proposed thing would be teach the value of virtue to everyone and the rewards that it holds? Interested to hear the replies",dating,t5_2qhb1,https://www.reddit.com/r/dating/comments/qe3zkf/are_men_ruining_dating_for_other_men/
63,qe3zmt,1634992120,Is she's just playing games?,"I'm a [20] Male been dating this [20] F in a long distance relationship. She been leaving me on delivered on snapchat hours upon hours sometimes days. She still take the time to view all my stories though.  So I decided to give her space and told her ""Hey, whenever you conformable text me whenever you're free"" her reply was ""Okay baby"" . It been 5days and she's haven't texted me since.  Her snapscore went up crazy alot too. The only reason I told her that because I was always the one pursuing her texting her 24/7, just to wait hours to get lacking replies. Should I message her or continue to see how long it goes for her not messaging me at all?

(BTW I told her how I felt multiple times, guess she's don't really love me as much as she's says she's do.)",dating,t5_2qhb1,https://www.reddit.com/r/dating/comments/qe3zmt/is_shes_just_playing_games/
64,qe48ne,1634993114,How do I tell someone that we can’t date because I don’t drive?,"I recently started talking to someone who I’ve come to really enjoy, but I don’t think it would work out because I feel like I still have a lot of “growing up” to do.

So first, I live in a very car-centric city in the U.S., but I don’t drive (and I don’t ever really plan on doing so). This would be fine if venues and amenities weren’t so spread out, but it can be tricky to do anything here without a car. I wouldn’t want to become a burden on them when it comes to going places (but I also don’t yet know whether or not they drive either). I typically use Uber/Lyft, but idk, the lack of a car might become annoying to them.

There’s also the fact that while I am in college, I’m not working currently. anddd I live at home with a parent. So basically I’m a high schooler!

I can’t reasonably ask someone, who conceivably has their sh*t together, to lower their dating standards like that just for me. The dilemma is that any of these (genuine) reasons are just going to be interpreted as me not liking them and trying to let them down easy, but that isn’t the case at all. While I definitely really like them, I think I’m just going to end up looking very juvenile without a car/job and living at home with parent.

I wasn’t really expecting to hit it off well with anyone (I haven’t ever really done dating at all), so I’m realizing I need to let them know these things now while it’s still new and we haven’t developed anything deep.

How do I tell them all this without coming off as insincere?",dating,t5_2qhb1,https://www.reddit.com/r/dating/comments/qe48ne/how_do_i_tell_someone_that_we_cant_date_because_i/
65,qe4cqm,1634993547,17M [friends] [ relationship],"I'm a teenager living out in India, Bangalore to be exact, I really want to make a bunch of friends, I am looking to get in a relationship but only after I get to know the person first.
Also I'm a really good listener...",dating,t5_2qhb1,https://www.reddit.com/r/dating/comments/qe4cqm/17m_friends_relationship/
66,qe4opc,1634994729,I'm just not feelin right about this,[deleted],dating,t5_2qhb1,https://www.reddit.com/r/dating/comments/qe4opc/im_just_not_feelin_right_about_this/
67,qe4pz3,1634994859,Anatomical Heart emoji meaning?,"When someone sends this 🫀 emoji, what does it mean?
For context, we where talking, about plans for today, he said wish we could cuddle but he'll see me later today and ""goodnight gossip gorl"" whatever that means. 
Also he sent the this ""🫀🦕"". I don't know what's with the dinosaur either lol I don't text alot and I don't use emojis often so I have no idea how to interpret any of this",dating,t5_2qhb1,https://www.reddit.com/r/dating/comments/qe4pz3/anatomical_heart_emoji_meaning/
68,qe4qya,1634994956,compared a girl to a porn star,"Hello,

it is not dating question cause this girl is not my crush nor date simply a friend yet maybe here I will find an answer

so we were discussing my (girl) friend (not a girlfriend) like what actress she looks like. I said that well her face does remind me of one of the porn stars (just face, nothing more). She said ,,fuuu :D "".

I mean I may not get why, but do you may know why is that? (btw I did not mention the name of the star nor showed her- simply that there are some look alikes). Maybe I crossed some line?

BTW she is 22 if it is relevant

Thank you in advance",dating,t5_2qhb1,https://www.reddit.com/r/dating/comments/qe4qya/compared_a_girl_to_a_porn_star/
69,qe4r9i,1634994985,I'm just not feelin right about this,"Hi

So um, I discovered the guy I'm dating hasn't yet deleted his dating app profiles. He told me he'd uninstalled the apps long time ago, prolly didn't care much to delete his account. But it's bothering me so much. I trust him. I do. And he's also sometimes scared that i don't trust him much because of which I cannot tell him all this... But it's bothering me so much that he's left a door open for getting back on those when things don't work out... I just feel so down. Idk why i just do. I wish I never saw that profile",dating,t5_2qhb1,https://www.reddit.com/r/dating/comments/qe4r9i/im_just_not_feelin_right_about_this/
