,id,created_utc,title,selftext,subreddit,subreddit_id,url
75,oeuejf,1625576289,I ran into a girl that I used to be crazy for. It messed me up,"To cut a long story short - I felt the most comfortable in my life around this girl ever. She's also a stunner as well. I just felt like she clicked all the boxes of ""What u/valli42 wants in a woman."" I know that's not enough time to kick the romanticization phase, but that's how I felt. 

 We hung-out 4 times and I'd usually spend the night and we'd get breakfast. We hooked up the 4th time. I get that's not that long, but it was enough for me to go ""I really, really like this girl.""

After we had sex I told her I liked her and I guess she didn't like that. I texted her a few more times trying to make plans but she always flaked out. Eventually, I just decided it was best for me to delete her number and move on.

We hooked up in December. We hadn't talked since March. I still think about her often, but I hadn't reached out more than a handful of times since December. There shouldn't be any bad blood between us. I never was rude or tried to make her feel bad for not liking me. I just laid my feelings out there and when they weren't reciprocated I just went ""okay."" I was unemployed, living with my parents, and 5 years younger at the time. I get her sentiment. She was kinda rude about it, but obviously I get why I wasn't a catch at the time.

I recently got employed and moved back into the city I met her in. I was grocery shopping and I looked up and she was right in front of me. Figured it would be better to say hi than to awkwardly stand behind her. She gave me a hug (I think) and asked where I was living/what my job was like, etc. She said she either missed me or wanted to hang out and I should text her. I told her I lost my contacts ( I didn't, I just deleted her number) and she was like ""oh I'll text you."" She probably won't but it was a nice gesture.

It just felt like Dazed and Confused by Led Zeppelin was blasting in the background. I won't get into details, but she didn't treat me well when we were hanging out. I was an option when she was bored.  Can't say for sure, but at the very least there's some emotional instability. I'm not saying this to beat up on her, but it's just what it is. Even if she were interested, she's not the best option for me and I know that. But at the same time I've never felt more comfortable around somebody ever in my life. She knows we clicked. She knows there was sexual tension. She just told me the night we met that she wouldn't date that much younger and I was stupid enough to think I could change that.

I guess this is all pretty much irrelevant at this point. I'm just ranting. I feel like shit. I had a dream about her. I woke up thinking about it. I can't focus. I've never really run into an ex or hookup before and it just fucked me up. If she does text me, what should I do? If she doesn't, how do I distract myself?",dating,t5_2qhb1,https://www.reddit.com/r/dating/comments/oeuejf/i_ran_into_a_girl_that_i_used_to_be_crazy_for_it/
76,oeuetr,1625576315,Bf kisses me a lot in front of his bro,Need a male perspective on it. Is this something sus I should know about?,dating,t5_2qhb1,https://www.reddit.com/r/dating/comments/oeuetr/bf_kisses_me_a_lot_in_front_of_his_bro/
77,oeuxb5,1625578082,I feel like a complete moron after a date bc I got ghosted,"I went on a date this weekend. Long story short I thought we had a good time but he ghosted me. I’ve never really been ghosted except one other time but it was bc something really bad had happened to them. 

Since being ghosted I have been just like- obsessively wondering what I did wrong. I care less that it didn’t work out. It was like a second date. But the dude has been persistently trying to get me out for a long time only to completely ghost so I feel like I did something really wrong.

I’ve thought about it a lot bc I have social anxiety that is pretty bad. Honestly I think I might have come across like I hated men or something when we were talking bc I mean I’ve had horrible experiences dating (not rly cheating but just people.... running over my boundaries and pressuring me sexually, people being aggressive or the alternative people just being really dumb and bordering like qanon when I saw them in person). I think I said a lot of things that when reflecting - probably didn’t come off too well even though he handled it well. But he seemed to get it and we joked about it. Really he gave me no indicators he had a bad time and talked about some of his past experiences as well. 

I don’t know if that’s WHY he ghosted me, that’s just my best guess.I just am like such a type A personality. I don’t like when people don’t like me. I don’t want anyone to hate me ever and I kinda feel like you have to have really negative emotions towards someone to ghost them. Like literally hated the date so much that they don’t deserve an explanation. I now feel like I was rude or something and it’s making me feel really bad. Esp since our circles are small and I don’t want people to think poorly of me.

I also feel like a moron since I texted after saying some cringe nice stuff- which maybe that also is the reason, maybe I was overly nice/showing interest. 

Overall, I am kind of just like disgusted with myself and internalizing the whole process now even tho I don’t even know WHY. I don’t care that it happened I just want to stop dwelling on it now. Words of advice? How to get my mind off it? Bc nothing I can rly do now except make sure to walk the line and be overly respectful during dates in the future 

TLDR; ghosted, driving me nuts. Want to stop dwelling on it.",dating,t5_2qhb1,https://www.reddit.com/r/dating/comments/oeuxb5/i_feel_like_a_complete_moron_after_a_date_bc_i/
78,oev5k4,1625578854,Does the height matter?,[removed],dating,t5_2qhb1,https://www.reddit.com/r/dating/comments/oev5k4/does_the_height_matter/
79,oev62f,1625578900,Sad girl,[removed],dating,t5_2qhb1,https://www.reddit.com/r/dating/comments/oev62f/sad_girl/
80,oev9xv,1625579257,Can't access Facebook Dating despite being over 18 and in the UK?,"I'd love to be able to join Facebook Dating, cos it sounds quite good, it's one of the largest OLD platforms, and as someone living in a low-population area, OLD is barely a viable option where I live so the size of the platform really matters.

I am 22, I live in the UK (which FB Dating is available in), yet for some unknown reason both me and my twin brother are unable to access FB Dating on mobile or PC - there is no Dating icon on mobile (I believe the icon used to be there about half a year ago) and when I go to sign up from PC, it tells me **""Facebook Dating is Unavailable. Facebook Dating is being rolled out to Facebook iOS &amp; Android users aged 18+ in selected markets.""** \- even though it should be rolled out in the UK and I am over 18.

Any ideas? Is there a way that I could access FB Dating or am I stuck without it unless anything changes? I assume I won't be able to contact Facebook cos it's impossible to speak to a human nowadays",dating,t5_2qhb1,https://www.reddit.com/r/dating/comments/oev9xv/cant_access_facebook_dating_despite_being_over_18/
81,oevjn3,1625580155,Where should I take her?,"So I was talking to a girl and we decided to go watch a movie, and in the same day we ended up making out in the mall's bathroom. At the end of the day she told me that she wanted to go on another date, but this time I would pick the place. The thing is, she made it clear that she wants to have it but I'm too shy to ask her out to go to a motel, and my house is not available since I live with other people, so where else can we go?",dating,t5_2qhb1,https://www.reddit.com/r/dating/comments/oevjn3/where_should_i_take_her/
82,oevnbx,1625580481,is he interested in me or confused by/ nervous because of my anxious behavior around him?,[removed],dating,t5_2qhb1,https://www.reddit.com/r/dating/comments/oevnbx/is_he_interested_in_me_or_confused_by_nervous/
83,oew0r9,1625581631,Pandemic dating!!!,"So I have trying all these different apps. 

Tinder: Sex
Bumble: Sex
Match: Stuck on their Ex!!!
Hinge: Don’t know what they want!!!
eHarmony: Looking for a pen pal.
OkCupid: Too crazy!!!
Plenty of Fish: Not my cup of tea.
Zoosk: Not enough options 
Elite: Not enough options!!!
Christian mingle: No one has it!!!

Where are the people who are willing to make the relationship work like people did back in the day? Not just waiting to swipe away?",dating,t5_2qhb1,https://www.reddit.com/r/dating/comments/oew0r9/pandemic_dating/
84,oew1gj,1625581691,The last conversation before things ended was about love,We dated for almost two months. He told me that he was showing his coworkers my picture and talking about how excited he was about his new girlfriend. He told me that his coworkers asked “Do you love her?” To which he responded “I don’t know. That’s a lot of pressure”. In reference to this conversation he asked me “what do you think about that?” And I said “I think people (referring to his coworkers) shouldn’t ask questions that they themselves wouldn’t want to answer”. A few days later he broke it off. It was an interesting last conversation and has me thinking that he may have been digging for a different answer. Or maybe he came to the realization that he didn’t feel that way.,dating,t5_2qhb1,https://www.reddit.com/r/dating/comments/oew1gj/the_last_conversation_before_things_ended_was/
85,oew1x5,1625581736,Tinder On Fire!!!,"Tinder On Fire by SJ

I started to date men
After my awful experiences 
Giving the world another chance
To find a man for romance
When I started to meet 
I found them to be cheats
Lying to make their way
Is all they try by what they say
In the hopes to get 
What they wanted when we first met
There were times when boys acted as Men
Now Men act as boys
And treat women like toys
Ripping them apart 
Without seeing their precious heart 
I needed a fresh start 
But I find myself in the games
Men play to reach their aim
As they know they are smart
And know how to play their part
To let a women fall for their charming way
As they walk away 
To the next lady they want to slay",dating,t5_2qhb1,https://www.reddit.com/r/dating/comments/oew1x5/tinder_on_fire/
86,oew1xs,1625581737,Casual nudity when hanging out with another couple at their pool... Red flag?,"I've been in a relationship with my boyfriend for about two months now, and we'd been seeing each other prior to that for a month. This past holiday weekend, we went to his friend's place for some grilling and a swim. I've met his friend and his longtime girlfriend before, and they both seem very friendly and welcoming. 

While we were all enjoying hanging out by the pool, I was sitting on the ledge of it with my feet in the water, while the other girlfriend was sunbathing on the lounge with her stomach down. She had her top half of her swimsuit untied and off to avoid tanlines. That was fine and I didn't think anything of it.

Soon after, the guys thought it would be funny to prank us girls as we were talking by running and jumping into the pool to splash us, but also they do so by doing it without their swim shorts on. Initially, it got a laugh but I was a little caught off guard by it. Right afterward, the girlfriend turned off with her top still off, and jumped right in. She and her boyfriend play fought in the water for a bit, until she put her arms around his neck and they embraced for a bit, which is the part that started to make me raise an eyebrow since he was still nude and she was topless. Meanwhile, my boyfriend swims over to me -- still nude -- and I jokingly asked, ""You going to just keep skinny dipping?"" 

Part of me wondered if he expected me to join in even though he didn't explicitly say it. I went over to the chair and grabbed his towel for him. I also felt a little weird as the other couple were basically embracing/making out a few feet away while the guy was fully naked and she was half naked. It almost felt like something more was about to happen and I don't know if it should be taken as a red flag?",dating,t5_2qhb1,https://www.reddit.com/r/dating/comments/oew1xs/casual_nudity_when_hanging_out_with_another/
87,oew31o,1625581831,Why does a guy keep insisting that I block him after rejecting him?,"TL;DR A guy kept insisting that I block him after rejecting him.

There was this guy whom I met a few years ago. I blocked him before because I didn't like how he kept saying he fell for me. 

We only had one encounter and that was when he asked for directions and I was heading in the same direction. So, I walked him to the pedicab (cycle rickshaw) which would take him to his destination. That's also the time he asked for my number and I gave it - my mistake.

At first, he was nice but he was becoming a bit too forward. He kept calling and messaging saying cheesy stuff. I had expressed that I didn't like him in any romantic way but he kept insisting that I blocked. So, I did.

This year, a few months ago, he added me on FB. Today, he messaged me. I recognized his name and asked if it was him. He just said maybe. At some point, he said it's him and he's surprised to meet me again on FB. He said he didn't know I was the one he added because he was just adding random people to increase his viewers. He also said that he doesn't know why I blocked him. So, we were talking and he said he still loves me. I told him, we're incompatible and that he barely knows me. I also said that we can be friends but nothing more. He responded to that saying I'm ""swinging"" - whatever it means. 

Now, he kept insisting that I block him. I don't like being ordered around. Why do I have to block when he could just go as I've been clear that I'm not attracted to him?",dating,t5_2qhb1,https://www.reddit.com/r/dating/comments/oew31o/why_does_a_guy_keep_insisting_that_i_block_him/
88,oew57k,1625582022,Dad advising me on my relationship through a dream?,"I lost my father to covid in December 2020. Needless to say it’s been a long and sad journey since. I recently broke up for one month with my bf. My father never mentioned “don’t date him” but there were instances where he would kindly point out “observations”me about my bf. While my bf and I were apart I found out he had been on a dating app and got to see some
of the messages. He was VERY active on the app; hitting up lots of women for possible dates etc. claims he never went on date although I did find an open table reservation for 2. I am still in shock over that. 
Just gives me a strange feeling because it makes me feel like he just wants to fill a void rather than sit on his feelings  as acknowledge his emotions and work on himself. Or even realizing his feelings are not really about me being the one but rather he just wants any other women replace me. I might be too “romantic” or out of reality with worlds savage mode. 
in any case; a friend who highly dislikes my bf and got to know my father tells me he had a dream with my father and on the dream my father was curious if I were in a relationship with my bf. Claims my father asked him to take him to where I live and find out if indeed I am in this relationship. Upon finding me with my bf home my father told my friend “Look what I told you, she doesn’t get it”. 
I have been feeling SO conflicted since my friend revealed this dream to me. Friend claims was not going to tell me. I don’t know what to do with all since I do feel a shift in the relationship yet can’t help but feel like loyalty has eroded. Any advice please 
Could my father be sending me advice through my friend?",dating,t5_2qhb1,https://www.reddit.com/r/dating/comments/oew57k/dad_advising_me_on_my_relationship_through_a_dream/
89,oew7c3,1625582206,Single,[removed],dating,t5_2qhb1,https://www.reddit.com/r/dating/comments/oew7c3/single/
90,oew88v,1625582289,Cheated on and left now I'm stuck,"So my ex-girlfriend cheated on me and dumped me for someone else and it completely ruined me. Its been a year and I'm still struggling she was my dream women in most respects. This is stupid but the night before she left me I had a dream that we would be together till old age. Since then I've just had a lot of rejections and first dates that go nowhere. I can feel myself giving up since I feel like she was the one. I'm in my 30s and in my eyes I don't feel like I'm attractive or bring much to to table. I feel like I have no chance compared to other men with women. On top of that I feel like all the good ones are taken at this point in life.

I guess what iam really asking is how do I not go deeper into depression from all of this and the absolute horrible outlook on my future?",dating,t5_2qhb1,https://www.reddit.com/r/dating/comments/oew88v/cheated_on_and_left_now_im_stuck/
91,oewbjw,1625582574,Falling in love ...,[removed],dating,t5_2qhb1,https://www.reddit.com/r/dating/comments/oewbjw/falling_in_love/
92,oewdlg,1625582755,"Men, do you find girls who don't talk about themselves boring?","When I meet a guy and strike up conversation, I mostly ask questions about him, talk more about what he does/likes, and don't talk much about myself. I only share those details when asked or when we've had more than one conversation.  Is that boring?",dating,t5_2qhb1,https://www.reddit.com/r/dating/comments/oewdlg/men_do_you_find_girls_who_dont_talk_about/
93,oewke1,1625583338,Tinder on Fire!!!,"Tinder On Fire by SJ

I started to date men after my awful experiences.
Giving the world another chance to find a man for romance. When I started to meet I found them to be cheats. Lying to make their way is all they try by what they say. In the hopes to get what they wanted when we first met. There were times when boys acted as men and now men act as boys and treat women like toys. Ripping them apart without seeing their precious heart. I needed a fresh start but I find myself in the games that men play to reach their aims. As they know they are smart and know how to play their part. To let a women fall for their charming way as they walk away 
to the next lady they want to slay.",dating,t5_2qhb1,https://www.reddit.com/r/dating/comments/oewke1/tinder_on_fire/
94,oewl6c,1625583406,I (29M) will be introducing my girlfriend (27F) of a little over a year to my parents soon. We met online - is it bad to tell family you met your girlfriend on an online dating app?,We met on one of the dating apps right before covid hit and I’d never seriously dated someone that I had met online. Is it bad to tell family and people this is how we met?,dating,t5_2qhb1,https://www.reddit.com/r/dating/comments/oewl6c/i_29m_will_be_introducing_my_girlfriend_27f_of_a/
95,oewohn,1625583673,What would you do?,"Hello everyone I recently started thinking about dating after my professional life destroyed my last long term relationship, unfortunately I am not the type to go to bars don't get me wrong I love going out,driving around,going on nature walks, and also being somewhat a homebody and playing video games and just relaxing at home with my so.

I'm just not really sure as I approach 30 how I would find people similar to myself, I feel like most people like me tend to keep to themselves and I am not they type to run up to a random person and ask them to hang out or in a date or anything.

Thanks I don't take any offence to your advice I have tried to branch out and see my friends and try new things I'm just not really enjoying it as much as I do other things",dating,t5_2qhb1,https://www.reddit.com/r/dating/comments/oewohn/what_would_you_do/
96,oewpyv,1625583794,Is it bad to want to be in love when you have sex for the first time?,"I feel like a loser being 27 year old female (turning 28 in the Fall) with no experience. I feel uncomfortable just telling a guy because all of them have already had sex. I want to have feelings for a guy and care about them before I have sex with them and I hope they would care about me, but I feel like with the way dating is right now that stuff doesn't even matter anymore. Everything is about sex, or everything is sexualized on social media and I certainly can't keep up with that.",dating,t5_2qhb1,https://www.reddit.com/r/dating/comments/oewpyv/is_it_bad_to_want_to_be_in_love_when_you_have_sex/
97,oewxbu,1625584419,How to act after sex?,"Hi all!

A bit of context- I've been going on dates with a friend of a friend. We've hung out at gatherings/parties probably about 5 times prior to going on a date. We went on a great date together but didn't have sex after (because it was a first date and I have boundaries about sex). That being said, we just went to a party together for the fourth and the alcohol was flowing and feelings were there... Bottom line, we had sex. This is super not charectoristic of me because I know how sensitive I can get after sex and I wanted to wait until I had a commitment with someone. That being said- it happened! 

I'm trying to be chill but it's hard not to question where we stand. It's hard for me to not be emotional after sex and I don't plan on texting him but I don't want to be dropped because I had sex. Does anyone have advice for the post-sex emotional tailspin? Lol",dating,t5_2qhb1,https://www.reddit.com/r/dating/comments/oewxbu/how_to_act_after_sex/
98,oewxp4,1625584449,Should I move for dating?,"I woke myself up by screaming in the middle of the night. I wasn’t having a nightmare. I screamed because I was in mental pain. The fear of being single in your 30s is tremendous. I see all the people around me settled down. 

I do online dating and it’s frustrating. I see women at work and they seem great but they are all taken. The women I see on OLD are just there for hook up or creepy. I tried OLD in a different country(UK) to see if the reason why I see these women is because of the location, and boom! I got matched with so many amazing women who are looking for serious connection. 

But I have a great career going here. I probably have to start over if I move. Should I still move?",dating,t5_2qhb1,https://www.reddit.com/r/dating/comments/oewxp4/should_i_move_for_dating/
99,oex1lf,1625584781,I(M21) am kinda shy type of guy and don’t talk much to people. Any advice ladies.,[removed],dating,t5_2qhb1,https://www.reddit.com/r/dating/comments/oex1lf/im21_am_kinda_shy_type_of_guy_and_dont_talk_much/
