,id,created_utc,title,selftext,subreddit,subreddit_id,url
0,poh33i,1631672524,I dated a single mom for the first time and after this I'm not sure I ever will again.,"I met this woman about 6 weeks ago and we really hit it off. We're both in our late 30s and had a ton in common. We had matched and chatted on a dating app and turned out we had a ton of mutual friends and acquaintances. We had fun together, genuinely enjoyed each others company and the sex was amazing. We both kind of fell very hard and very fast for one another.

A little background information, she has 2 very young kids, I've never had a child and she is the first single mom I have ever dated. When we very first started dating she told me that it was going to take someone very special for her to have another kid. I didn't really press the matter since I felt it was way too soon to have that discussion but I did tell her that I had hoped to be a father one day and felt like I would regret it for the rest of my life if I didn't. I was upfront and from my perspective I felt like she was going to see if I was that ""someone very special"" but we kind of shelved that issue for another day.

About 2 weeks later I was texting and mentioned something about ""when I have children"" and she replied ""don't you mean if""? I figured it was time to just be upfront with her. I told her that I did want to have a biological child, that I was super excited at the prospect of being a stepdad but that I really did want at least one child that came from me, that I wanted to share that kind of bond with a woman. I feel theres a level of intimacy that comes from sharing a child and I want that with whoever my wife would be.

We almost broke up over it but I guess she talked to her mother about this issue she changed her mind because the very next day after we almost break up she tells me she'd have children with me she even goes so far as whispering in my ear: ""I want to have your babies"" while we're having sex. She texts me the next day saying things like: ""I can't wait to have your smart babies"" and ""they're going to be beautiful"".

I found this to be kind of a red flag to be honest, we literally almost broke up the day before over this and the next day she's saying this to me in bed. Idk why I ignored it but I guess I felt like she meant it. I felt like she was genuine and I really felt safe and comfortable with her. She keeps telling me during sex how much she can't wait to be pregnant with my baby and texting me similar things. This is the first time a woman has ever expressed wanting to do this with me and it honestly is making me fall for her more. I'm on cloud 9 because I feel like I've finally met my person.

We continue dating and we plan this weekend together at her place, which includes us going to a wedding on that Sunday evening. Her kids are at their fathers house most of the weekend, but he needs her to watch them for a few hours on Sunday and she thinks it's a perfect time for me to meet them. I'm very apprehensive about meeting her children because I really felt like it was too soon, but this wasn't the first time she was pressuring me to meet them and I kinda gave in. I figured that it would need to happen eventually and I really felt like things were serious after all so I felt like this was really going to happen, so I agreed to meet her kids. 

Come Sunday I meet the kids and their honestly adorable. Apparently their dad really isn't present with them and they took to me right away. We played and had fun and the youngest one even cuddled up to me on the couch and fell asleep. Honestly, I had fallen for this woman, and her kids were great and I thought this couldn't be any more perfect. She loves me, wants to be with me, she wants to build a life with me, trusts me with her kids and wants to have a child with me. I'm really happy and thinking about how things have finally turned around for me. I was already in love with her and it wasn't hard to fall for the kids either. I was excited to think that I'd finally be what I'd always wanted to be, a good husband and father. 

We have a blast for the short time we have and then its time to drop them back off at their dad's and go to the wedding. On the way to the wedding she's driving and grabs her phone to text her friend, while driving, swerves and we almost go into the ditch at 70mph. I ask her to please not text while she's driving and she gets PISSED. We have our first fight. Its not to bad, it stays civil and we didn't yell at each other. She's mad because she doesn't like people telling her what to do but I said I wasn't going to apologize because I do not think asking someone to take my safety seriously is unreasonable or anything to be sorry for. I'm a paramedic and I explain to her that I've seen first hand what distracted driving does to people and the death I've seen. I won't apologize for asking someone to take safety seriously, especially after the things I have seen. 

The rest of the evening goes pretty well and we seem to have fun, but then on the way back to pick up her kids she starts telling me about how she's sad because she wants to go to grad school and she feels like she's never going to reach that goal because all she's going to be doing is having babies. She tells me how she wanted to go a few years ago but couldn't because of her husband (yeah their divorce isn't finalized yet but they've been separated over a year) wanted to have kids, then bailed on her and never helped with the newborn care. She says that she feels like she doesn't have control over her body and that she's just going to be a baby factory for the men she's with and I'm just sitting there listening and when she's done all I say is: ""If thats what you truly want then you should have just said that"". She doesn't really say anything and all I say is: ""I feel like I'm never going to get to be a dad.""

We pick up her boys from their dad's place and drive back to hers. I have school (I'm transitioning into nursing) the next day and she has work so I go home. In the morning we talk on the phone and her tone is different and she starts telling me that things she was fine with before she's all the sudden not fine with, for example me watching porn. She told me she didn't care in the beginning if I did and now she's telling me that she wants me to only go to her for sexual gratification and starts laying down all these strict rules. It honestly felt like she was trying to get me to break up with her but I agreed and we get off the phone but the more I think about it the more I'm bothered by all of this. So I call her that evening and I tell her that I don't want her to have to change the direction she wants her life to go in and that I think we have fundamental differences in what we want and its not fair for us to stay together. Its civil and I feel amicable. Then today I text her just to ask how she's doing and she's just PISSED off at me. She tells me she's mad that I met her kids and then broke up with her the next day (mind you she pressured me into meeting them), but then admits 2 texts later that shes was actually trying to break up with me that morning but didn't because I agreed to her new boundaries. She says that she feels like I tricked her into thinking I'd be fine with just being a step dad (which I made very clear I wanted to have a biological child and she said she wanted to have my babys and repeatedly said it during sex A LOT) and she's mad she spent the morning on the phone with me and then broke up with her that evening. 

There were a ton of other red flags outside of the whole children issue that aren't really relevant but everything just added up and I wanted to get out because I felt like dragging it out would be worse than just getting it over with now. Especially for her boys. 

I feel really terrible about all of this but I can't help but think that honestly I was the one who was being tricked. She told me she wanted to have more children with me and then confesses that she doesn't really want to AFTER I meet her kids. I feel like she was just trying to get me to meet her kids so I'd love them and say being a stepdad was enough. I feel like she was just trying to find a man to be a father to her kids because he exhusband is so uninvolved with the kids and she's overwhelmed by working fulltime and caring for young kids. I feel like she manipulated me but I still feel terrible about all of this. I honestly don't think I'll ever try to date a single mother ever again. 

I've learned that there really can be no compromise on the children issue. If you aren't on the same page from the beginning never trust that the other person has changed their mind. Its a hard full stop and there is no way to work around it. I should have never gone this far with this.",dating,t5_2qhb1,https://www.reddit.com/r/dating/comments/poh33i/i_dated_a_single_mom_for_the_first_time_and_after/
1,poh3fd,1631672559,Seems like nobody cares about health/fitness,[removed],dating,t5_2qhb1,https://www.reddit.com/r/dating/comments/poh3fd/seems_like_nobody_cares_about_healthfitness/
2,poh5rk,1631672811,Dating advice.,"I’m just flustered at the thought of even giving up my time to anyone. From anyone else’s experiences how did you get past a horrible break up involving your own children and their mom/dad. My ex (childrens father) hurt me pretty badly. Not just me but my kids as well. And I honestly just don’t know how to even go about this.  

My question is. 

How did you end up dealing with this better? 

What we’re some coping mechanisms that helped you get through this?",dating,t5_2qhb1,https://www.reddit.com/r/dating/comments/poh5rk/dating_advice/
3,pohaaw,1631673288,"Month long vacation with GF coming up, what should I keep in mind?","Hey everyone, I'm moving cities way across country in late December/early January and the lady friend is helping me. We drafted up a plan we're excited about to fly her out to me like Dec 28th and have New Years in the city I'm in now, and then do the cross country road trip, and then hang out in my new city I'm living in and then go back to where she is a few hours away from my new city, and just basically have a little move in trial run until I start my job and head back down to my new town at the end of January.  


Now I'm super hyped about this and she is too, we have a great relationship but then it hit me like, well fuck... Thats a lot of time together. I feel like maybe we'd run out of shit to talk about. But then I'm like wait no no no millions of couples move in together permentaly and are married like 10, 20, 30 goddamn 40 years and beyond so maybe I'm missing something? We've done some preliminary discussions about moving in together as a 2023 thing after she finishes her schooling. And we're both fully on board and excited. Me and the GF have been hanging out since January 2021. So about 6-7 months. By the time I move in the new place it would be about a year post meeting her.  


But I was lookin on quora and google and it seems that much time together can be detrimental to a relationship potentially. But I mean, eventually the endgame being either moving in or marriage is hell of a lot longer than a month long vacation and it seems like a lot of people happily figure it out. I dunno, maybe some Gafers with more experience than a mid 20s grasshopper can shed some light or share any insights or things to keep in mind?  


As always my love shines radiant on all of you! Thanks guys!

TLDR: Lotta time together with the girlfriend, love her but was a bit spooked after looking up what a lot of time does to some couples, any insight or things to keep in mind would be great.",dating,t5_2qhb1,https://www.reddit.com/r/dating/comments/pohaaw/month_long_vacation_with_gf_coming_up_what_should/
4,pohhgj,1631674051,Does he want me to notice him?,"He has viewed all of my stories for ages now lol. He rarely comments on them though.

He usually views my story promptly. Today I updated twice my story. The first he viewed 2 hours after I posted it like 12 noon when he had probably lunch break. Then I updated my story again in the evening and he viewed it within minutes lol. I don't know if he wants me to notice him…. 
he has several times viewed my story within minutes.",dating,t5_2qhb1,https://www.reddit.com/r/dating/comments/pohhgj/does_he_want_me_to_notice_him/
5,pohpuk,1631674915,He stopped talking after I said bye,"this guy ghosted me for 2 weeks, i said “what happened to facetime?” he left me on read….then he liked me on the app we met on. i asked him why he didn’t text back, he said he did but it never “sent” i was like whatever. i really wanted to get to know him, we facetimed once and he said i was his type for sure….then tonight he said we would facetime. i asked if he was ready, he said “he was resetting his phone” then i said “so are we not gonna facetime?” he said be patient. i said “okay, i just wanted to see you” an hour passed i said “so?” he changed the subject. after that i got mad, and told him that i am not into games. and told him bye and to take care. i thought he would have said something back. i hurried up and finished my homework so i could facetime for a long time as he said i am very disappointed right now.",dating,t5_2qhb1,https://www.reddit.com/r/dating/comments/pohpuk/he_stopped_talking_after_i_said_bye/
6,pohvew,1631675493,Straight m 35. Always get ignored by women and hit on by men,I don't know what it is about me but I get hit on by men a lot. Never by women. Went through the McDonald's drive thru today to get a happy meal for my daughter and the guy in the window was openly flirting with me. How can I be more appealing for women?,dating,t5_2qhb1,https://www.reddit.com/r/dating/comments/pohvew/straight_m_35_always_get_ignored_by_women_and_hit/
7,poi2yh,1631676286,Does he like me as more than a friend?,[removed],dating,t5_2qhb1,https://www.reddit.com/r/dating/comments/poi2yh/does_he_like_me_as_more_than_a_friend/
8,poi6gs,1631676657,does he like me more than a friend?,[removed],dating,t5_2qhb1,https://www.reddit.com/r/dating/comments/poi6gs/does_he_like_me_more_than_a_friend/
9,poi9tu,1631677014,How do I talk to this girl that lives in another dorm?,"Basically the title says it all, there's a girl that I am very attracted to that lives in the dorm right across from mine.

Now we've had a couple brief minor interactions. I'm an RA at my school and during move in I had to help her get into her room and sign her in on a separate occasion, however we talked very briefly. I doubt she even remembers my name. I see her around campus every so often but even then she'll have headphones in sometimes when she walks on her own.

I'm just trying to figure out what would be a good way towards approaching this situation to talk to her.

I'm not going to lie I also think she's very attractive and out of my league. She's in great shape and I'm overweight so I wouldn't envision her liking a guy like me. My confidence with this is low, but I figured I could use some advice.",dating,t5_2qhb1,https://www.reddit.com/r/dating/comments/poi9tu/how_do_i_talk_to_this_girl_that_lives_in_another/
10,poiaft,1631677078,"Where do I even find someone who will commit long term? My parents were each other's firsts at 23, they're still married, im 23 now, never been in love, dads best advice was to ""just be friends"" with women. It has never worked. I am so lost and my parents are of no help.","You inherit your romantic qualities from your parents, but if your parents have never developed those romantic qualities to pass onto you, how the hell do you find someone to love? My dad is autistic and extremely introverted, he is very knowledgeable and has taught me many things technical-wise, my mom is a rape victim who does not like to be touched or have sex, and it has created this ""friend"" dichotomy between my parents that is hard to explain. I was 378lbs, depressed, alone, and in online school for my whole high school career. Of course no one wanted to date me then, i knew no one to date. My whole adolescence I have always felt lonely. When i was a kid, the school I went to would sometimes lock me up in a closet for hours every other day because I was diagnosed autistic and had outbursts. They even sent letters to everyones parents saying I was a threat. My entire class ostracized me, teased me, bullied, whatever. ive been socially fucked over by fate and it has been a nightmare to get over. Over the last few years, ive lost 163lbs, now 215 at 6'6, and got fit, ive been saving my money, working all kinds of jobs, learning all kinds of things, and just investing in myself, but I've.... never been in love. I've got no game because I was never given the chance to develop any early on and it has snowballed into this awkward stage of life where I feel so isolated and lonely, i often believe I'll die alone. I hate it. I hate being so awkward and autistic at this old. It's so painful and i often have pains in my chest, i don't know who to trust anymore either.",dating,t5_2qhb1,https://www.reddit.com/r/dating/comments/poiaft/where_do_i_even_find_someone_who_will_commit_long/
11,poibga,1631677190,Interesting tidbits and anecdotes?,"I got a date next week with someone who I met online and we've talked for several weeks already and shared a few interests like (movies, food) and (religion, work).... 

I don't want to screw things up, so I decided to read some things online because I personally am not the best person when it comes to being chatty or interesting.  I can already see lots of awkward silences because I've done it in the past and especially in presentations that were embarrassing.  

I see myself as goofy and childish but really would like to have a few things in my sleeve that could fill the hour date.

What questions should I use that will make her do most of the talking?",dating,t5_2qhb1,https://www.reddit.com/r/dating/comments/poibga/interesting_tidbits_and_anecdotes/
12,poibyq,1631677249,Seems impossible to meet someone after college/adulthood 30+,"# 

work is a no go since i am self employed, but even if i took a traditional job, most people from my experience are never around my age. also, i think i would wise up not to intermingle worrk with relationship esp with metoo movement very prevalent.

next.. gym. everyone goes to gym to unwind and get their endorphines going, not to look for someone to chat up and asked out.

going out to clubs /bars - i might be able to get a causal fling AT BEST, but most people in this settling aren't out for long term and more or less not the quality people you'd want to go into a long term relationship with

groups/meetup - i tried this as a last resort, but it sort of ties in with work. you dont want to mix in relationship. why? because if she rejects you, she'll let everyone know and then if you ask someone else , it'll just get messy. you'd be the guy hitting up every girl in the group instead of just being there to meet people and have a good time.

so with that said WHERE ELSE CAN I MEET PEOPLE? it seems online dating is the only viable option since the intentions are clear from the getgo, but i also have my reservations...",dating,t5_2qhb1,https://www.reddit.com/r/dating/comments/poibyq/seems_impossible_to_meet_someone_after/
13,poid9h,1631677397,Getting a rejection text when I didn’t even express interest. How do I respond?,"I (25f) went out with a guy (28m) I met on an app last Thursday for dinner. Although it was pleasant chatting with someone new for a couple of hours, I wasn’t super interested after and had the mindset that if he reaches out for a second date I’d be fine to give it another go (I know chemistry can take time to develop), but if not then I’d be fine with the “mutual ghosting” thing too. I also paid for my own half of the meal (he did offer to pay though, but he didn’t seem super sure so I just said that it’s fine and that we can split). 

Well he texted me yesterday (out of the blue) thanking me for my time but that he didn’t feel much of a connection. While I figured that he was doing it be polite, it kind of…bothered me? I guess I’m of the mindset that if I had texted him saying how I hoped to meet again or something, sending that message makes sense. But just texting me out of the blue after one 1.5 hour date to reject me? When I didn’t even say I was interested? Idk…it made me feel bad. I know some may disagree with me but I don’t necessarily think an explicit rejection is needed after one date. 

There’s also the fact that I’m feeling a little more insecure about my appearance than usual after going thru quarantine for COVID; like my weight is the same, hair length is the same, and none of my pics are from before 2019, but I guess I feel like I’m just having to figure out my “mojo” again after all this time of high stress and isolation and not doing my makeup/shaving. And I’m also worried that the stress has aged me significantly in a short amount of time (because before COVID, I’d get a second date 100% of the time with those same pics…so maybe I’m wondering if I look super different to them now).

Any ways…how should I respond? And how do I not feel bad? And am I weird for being out off by that message?",dating,t5_2qhb1,https://www.reddit.com/r/dating/comments/poid9h/getting_a_rejection_text_when_i_didnt_even/
14,poie8u,1631677508,does he like me?,[removed],dating,t5_2qhb1,https://www.reddit.com/r/dating/comments/poie8u/does_he_like_me/
15,poieng,1631677551,Why do most men not prefer most women?,"Why do most men prefer women under 5'2? I always hear men saying they like small women, which would be under 5'2. Even all the tall guys I've seen are with women under 5'2 and most seem to think that only women that are in this range are desirable because they're ""small and cute."" I dont get it. Even my friends who are 5'4 to 5'7 get rejected because they are not ""small"" by male standards.",dating,t5_2qhb1,https://www.reddit.com/r/dating/comments/poieng/why_do_most_men_not_prefer_most_women/
16,poigrk,1631677791,Cultural differences dating a Mexican man,I’m 30 year old American woman and I just starting dating a man who is from Mexico who moved here 5 years ago (he is also 30) wondering what are some cultural differences in dating a Mexican man. He’s so sweet I’m just curious what he is accustomed to. Thank you!,dating,t5_2qhb1,https://www.reddit.com/r/dating/comments/poigrk/cultural_differences_dating_a_mexican_man/
17,poiudd,1631679266,Cold Approach Help Needed with a Woman at a Retail store,"So there was a beautiful woman who looked to be around my age (33) at a retail store and this cold approach does not work:

“Hey, I saw you across the way and just want to let you know that you are beautiful.
I would like to get to know you more, to get to know who you are.
Can I get your number and we can get coffee or tea or lunch sometime?”

Do you have suggestions about what I could say to her which would be actually successful in getting to know her and continuing the connection beyond that store?",dating,t5_2qhb1,https://www.reddit.com/r/dating/comments/poiudd/cold_approach_help_needed_with_a_woman_at_a/
18,poivsd,1631679422,Am I leading him on?,"Recently I made a friend (hanging out a few times a week for maybe a month) and it's obvious that he's considering courting me. He'll drop some subtle flirting and it seems like hes working up the courage to make a move.

I really like him so far but I cant get over my fear of commitment. When I notice a moment he's hinting at holding hands or he might put his arm around me, I feel really uncomfortable. I'm not sure why! I get excited but it also feels wrong. I instinctively tense up or want to move away every time. My last relationship has put me off dating for over a year and I don't know if I want something serious, but I don't want to waste his time. 

What can I do to make sure I dont hurt him just because I'm feeling awkward?",dating,t5_2qhb1,https://www.reddit.com/r/dating/comments/poivsd/am_i_leading_him_on/
19,poix3b,1631679569,"I got a second chance, then he disappeared. Search party?","Almost 3 years ago I broke up with a phenomenal man. The chemistry was perfect, and he was also my best friend. We dated for about half a year, and due to me still dealing with the grief of losing a parent, and not knowing who the hell I was, I broke things off. Long story short, I felt guilty for dating an atheist when I was religious at the time (I’m not religious anymore, ironically). 

A month ago he resurfaced. I had tried to reach out to him twice over the past few years to ask if I could talk to him, with no luck. He follows me on Instagram, we strike up a convo on how we’ve both been, and basically the major highlights of life over the past few years. 

We agreed to meet for drinks, and then I freaking got sick. Had to cancel, and told him I wanted to reschedule. We talked for a little bit, but then he disappeared again, ignoring my texts (I haven’t bombarded him with texts).

Do I just let this go, or do I try to win him back? I’ve thought about sending him a letter going into further detail about why I had to break things off, and how I’ve changed. I’ve missed this man for 3 years, but I also don’t want to pine after him forever. It was essentially the right person wrong time scenario.",dating,t5_2qhb1,https://www.reddit.com/r/dating/comments/poix3b/i_got_a_second_chance_then_he_disappeared_search/
