,all_awardings,allow_live_comments,author,author_flair_css_class,author_flair_richtext,author_flair_text,author_flair_type,author_fullname,author_is_blocked,author_patreon_flair,author_premium,awarders,can_mod_post,contest_mode,created_utc,domain,full_link,gildings,id,is_created_from_ads_ui,is_crosspostable,is_meta,is_original_content,is_reddit_media_domain,is_robot_indexable,is_self,is_video,link_flair_background_color,link_flair_css_class,link_flair_richtext,link_flair_template_id,link_flair_text,link_flair_text_color,link_flair_type,locked,media_only,no_follow,num_comments,num_crossposts,over_18,parent_whitelist_status,permalink,pinned,pwls,retrieved_on,score,selftext,send_replies,spoiler,stickied,subreddit,subreddit_id,subreddit_subscribers,subreddit_type,thumbnail,title,total_awards_received,treatment_tags,upvote_ratio,url,whitelist_status,wls,post_hint,preview,removed_by_category
35,[],False,idkburneridkidk,,[],,text,t2_e3k4cz8q,False,False,False,[],False,False,1630414311,self.dating,https://www.reddit.com/r/dating/comments/pf57jy/genz_guy_here_do_gen_z_girls_like_physical/,{},pf57jy,False,False,False,False,False,False,True,False,#ff4500,dating,"[{'e': 'text', 't': 'Question'}]",a9531dce-194e-11e5-b177-0eff099c3d1f,Question,light,richtext,False,False,True,0,0,False,all_ads,/r/dating/comments/pf57jy/genz_guy_here_do_gen_z_girls_like_physical/,False,6,1630414322,1,[removed],True,False,False,dating,t5_2qhb1,981260,public,self,"Genz guy here, do gen z girls like physical affection and compliments?",0,[],1.0,https://www.reddit.com/r/dating/comments/pf57jy/genz_guy_here_do_gen_z_girls_like_physical/,all_ads,6,,,moderator
36,[],False,cbrown_6969,,[],,text,t2_a1alpbeo,False,False,False,[],False,False,1630414917,self.dating,https://www.reddit.com/r/dating/comments/pf5dyx/we_been_broken_up_for_2_months_now_she_wants_to/,{},pf5dyx,False,True,False,False,False,True,True,False,#ea0027,dating,"[{'e': 'text', 't': 'I Need Advice'}]",19ec58c2-9f74-11e7-81a1-0e2bf15991f0,I Need Advice,light,richtext,False,False,True,21,0,False,all_ads,/r/dating/comments/pf5dyx/we_been_broken_up_for_2_months_now_she_wants_to/,False,6,1630414928,1,I can't get over the fact that she let another man inside her now she wants me it's hard because I do love her what do I do,True,False,False,dating,t5_2qhb1,981266,public,self,We been broken up for 2 months now she wants to get back together but she was sleeping with someone else in those 2 months!,0,[],1.0,https://www.reddit.com/r/dating/comments/pf5dyx/we_been_broken_up_for_2_months_now_she_wants_to/,all_ads,6,,,
37,[],False,Tmyriad,,[],,text,t2_40ka8e7i,False,False,False,[],False,False,1630415247,self.dating,https://www.reddit.com/r/dating/comments/pf5hej/would_you_date_someone_with_a_personality/,{},pf5hej,False,True,False,False,False,True,True,False,#ff4500,dating,"[{'e': 'text', 't': 'Question'}]",a9531dce-194e-11e5-b177-0eff099c3d1f,Question,light,richtext,False,False,True,52,0,False,all_ads,/r/dating/comments/pf5hej/would_you_date_someone_with_a_personality/,False,6,1630415258,1,"I (30M) recently found out I may have STPD, and it has me very concerned about whether I’ll find a partner or not. The common advice I hear from Reddit is that you should “fix you problems” before trying to date, but mental illness, especially personality disorders, can’t be completely fixed. Im just wondering if there are people willing to look past that.",True,False,False,dating,t5_2qhb1,981273,public,self,Would you date someone with a personality disorder if they sought therapy and medication?,0,[],1.0,https://www.reddit.com/r/dating/comments/pf5hej/would_you_date_someone_with_a_personality/,all_ads,6,,,
38,[],False,thefirststep999,,[],,text,t2_8q33vxkj,False,False,False,[],False,False,1630415738,self.dating,https://www.reddit.com/r/dating/comments/pf5mwy/what_do_people_get_by_leading_others_on/,{},pf5mwy,False,True,False,False,False,True,True,False,#00a6a5,dating,"[{'e': 'text', 't': 'Support Needed'}]",fd9c03b8-a1ce-11e7-9172-0e8c9f9ecf4c,Support Needed,dark,richtext,False,False,True,13,0,False,all_ads,/r/dating/comments/pf5mwy/what_do_people_get_by_leading_others_on/,False,6,1630415749,1,"Serious question. Is this to satisfy their ego, exert their power and control over the individual or are they mentally unhinged? 

I have been completely blind sighted by a guy who I thought was genuine and my heart is totally crushed by the mind games, extreme delays in communication. I just can’t believe it. 

I also can’t bring myself to block the person too but I think I should out of self respect. 

Are these people just evil?",True,False,False,dating,t5_2qhb1,981280,public,self,What do people get by leading others on?,0,[],1.0,https://www.reddit.com/r/dating/comments/pf5mwy/what_do_people_get_by_leading_others_on/,all_ads,6,,,
39,[],False,Kira-Shintr3,,[],,text,t2_8zo7vayk,False,False,False,[],False,False,1630416898,self.dating,https://www.reddit.com/r/dating/comments/pf5zez/is_there_any_other_place_to_share_your_story/,{},pf5zez,False,True,False,False,False,True,True,False,#ea0027,dating,"[{'e': 'text', 't': 'I Need Advice'}]",19ec58c2-9f74-11e7-81a1-0e2bf15991f0,I Need Advice,light,richtext,False,False,True,2,0,False,all_ads,/r/dating/comments/pf5zez/is_there_any_other_place_to_share_your_story/,False,6,1630416909,1,"Can you suggest any other subreddit wherein I can get advice or support? I would really appreciate it if you guys can. I want a subreddit wherein there are more elder people who actually have had experience with things like dating, career and marriage, I would also like if I get more male advice. Don't want it to be particularly related to dating tbh. Or is there any way wherein I can make my post only visible to 25-30+ individuals?",True,False,False,dating,t5_2qhb1,981306,public,self,Is there any other place to share your story?,0,[],1.0,https://www.reddit.com/r/dating/comments/pf5zez/is_there_any_other_place_to_share_your_story/,all_ads,6,,,
40,[],False,Ubernuber,,[],,text,t2_4wn3a,False,False,True,[],False,False,1630416971,self.dating,https://www.reddit.com/r/dating/comments/pf607d/made_a_post_about_a_girl_who_left_me_for_her_ex/,{},pf607d,False,True,False,False,False,True,True,False,#46d160,,"[{'e': 'text', 't': 'Success!'}]",6b44dc18-cc88-11eb-95f2-0ed00be16b15,Success!,dark,richtext,False,False,True,6,0,False,all_ads,/r/dating/comments/pf607d/made_a_post_about_a_girl_who_left_me_for_her_ex/,False,6,1630416982,1,"[original post](https://www.reddit.com/r/dating/comments/oqsddo/the_woman_i_was_seeing_said_i_made_her_feel_safe/?utm_medium=android_app&amp;utm_source=share)

So it's been a month. I made a post here a month ago venting about a failed potential relationship. The original post is linked above for a recap. 

About a day after posting my original post I (27m) decided to try out hinge, literally the first woman(23f) I match with ends up being one of the most amazing people I've ever met on dating apps. We immediately hit it off and our conversations last hours. Our first date went amazing, and we've been meeting up for dinner every week since. We've even planned a day where we can just spend all day together without worrying about work, just go to a lake and relax, and then riff on bad movies all night.

However, the girl from the original post keeps messaging me saying I'm an asshole for not talking to her anymore, but she made it clear in our last conversation she wanted nothing to do with me. I've since blocked her number, I don't need that stress in my life. It's not that I don't care about her, it's just that I know I'm not the person for her and our interactions just cause us both stress. I feel bad for not talking to her, but ultimately I know I can do nothing for her. It's not my place to try and fix her, only she can do that.",True,False,False,dating,t5_2qhb1,981306,public,self,Made a post about a girl who left me for her ex. An update!,0,[],1.0,https://www.reddit.com/r/dating/comments/pf607d/made_a_post_about_a_girl_who_left_me_for_her_ex/,all_ads,6,,,
41,[],False,depresso-espresssso,,[],,text,t2_83l3auqy,False,False,False,[],False,False,1630417196,self.dating,https://www.reddit.com/r/dating/comments/pf62jz/how_to_have_a_good_relationship_with_someone_with/,{},pf62jz,False,True,False,False,False,True,True,False,#00a6a5,dating,"[{'e': 'text', 't': 'Support Needed'}]",fd9c03b8-a1ce-11e7-9172-0e8c9f9ecf4c,Support Needed,dark,richtext,False,False,True,4,0,False,all_ads,/r/dating/comments/pf62jz/how_to_have_a_good_relationship_with_someone_with/,False,6,1630417207,1,"Hi so basically me(24m) and my partner (21f)have been dating for nearly two years but on her side there has always been a bit of a fear of commitment a d uncertainty but at the start we just put this down to it being her first relationship.

Over time it's gotten worse and she is in the process of looking for help in relation to ROCD, but I was just looking for tips snd help on how to make the best of the relationship. 

If anyone is in a relationship with anyone with ROCD I would appreciate your input

Thanks",True,False,False,dating,t5_2qhb1,981308,public,self,How to have a good relationship with someone with relationship anxiety/rocd,0,[],1.0,https://www.reddit.com/r/dating/comments/pf62jz/how_to_have_a_good_relationship_with_someone_with/,all_ads,6,,,
42,[],False,twa8u,,[],,text,t2_6gpwmu9t,False,False,False,[],False,False,1630417801,self.dating,https://www.reddit.com/r/dating/comments/pf68w9/my_boyfriend_and_his_collection/,{},pf68w9,False,True,False,False,False,True,True,False,#ea0027,dating,"[{'e': 'text', 't': 'I Need Advice'}]",19ec58c2-9f74-11e7-81a1-0e2bf15991f0,I Need Advice,light,richtext,False,False,True,16,0,False,all_ads,/r/dating/comments/pf68w9/my_boyfriend_and_his_collection/,False,6,1630417812,1,"Hello 

I am using some else's account 

I am 26 F in relation with a boy my age and I found that he has 10s of 1000s of screenshots and video grabs of not only porn stars but instagram models and actresses (downloaded from google search)

The latter 2 are in the higher quantity and I am worried. 

He used to freely give his phone from the time we were dating but I never bothered to see what's inside. 1 year into the relationship I ended up getting into his phone gallery and saw the collection he has where the instagram screenshots itself are more than 20,000. When confronted about it, he apologized saying that this is what he considers normal and unless they are all 21+; he doesnt have an issue pleasuring over them. I was shocked, but in that state; he asked me if I intend to see a change in what he does; to which I refused to answer (He demonstrates change when he sees logical).  A lot of them are regular people and not even influencers which made me feel odd. Its kinda odd, I dont think so lot of them are people that he even knows personally but there are 20,000+ of them. I dunno

Are there some boundaries that should I keep or make him keep?  Is this what you all boys do?",True,False,False,dating,t5_2qhb1,981317,public,self,My Boyfriend and his Collection,0,[],1.0,https://www.reddit.com/r/dating/comments/pf68w9/my_boyfriend_and_his_collection/,all_ads,6,,,
43,[],False,MeeMee8912,,[],,text,t2_du5x83nc,False,False,False,[],False,False,1630417964,self.dating,https://www.reddit.com/r/dating/comments/pf6ap6/tired_of_being_heart_broken_a_stepping_stone/,{},pf6ap6,False,True,False,False,False,True,True,False,#ea0027,dating,"[{'e': 'text', 't': 'I Need Advice'}]",19ec58c2-9f74-11e7-81a1-0e2bf15991f0,I Need Advice,light,richtext,False,False,True,12,0,False,all_ads,/r/dating/comments/pf6ap6/tired_of_being_heart_broken_a_stepping_stone/,False,6,1630417975,1,"31(F) Reddit lurker who is finally posting because I just can’t take it anymore. I live alone a foreign country (Paris, France) and I have had my heart broken so many times here I just can’t take it anymore. I don’t even know what I am doing wrong. Men who meet me at work or school have always expressed interest but I have exclusively dated online here and all of them have ended with me getting my heartbroken, usually around the 4 month mark. I have always been left for someone else. I feel like a stepping stone and a standby girl. Before I used to think I was a catch - I am good looking, smart &amp; funny but now I am wondering why nobody wants me. They always always to leave me so easily for the next girl &amp; commit to them but want nothing with me. What is wrong with me? I am not able to do anything because of this constant sadness - my work is not up to mark, my house is a mess and I’ve stopped socialising.",True,False,False,dating,t5_2qhb1,981320,public,self,Tired of being heart broken &amp; a stepping stone,0,[],1.0,https://www.reddit.com/r/dating/comments/pf6ap6/tired_of_being_heart_broken_a_stepping_stone/,all_ads,6,,,
44,[],False,okExpress24,,[],,text,t2_a6gafihp,False,False,False,[],False,False,1630418473,self.dating,https://www.reddit.com/r/dating/comments/pf6gd3/is_it_a_good_idea_to_talk_about_certain_medical/,{},pf6gd3,False,True,False,False,False,True,True,False,#ff4500,dating,"[{'e': 'text', 't': 'Question'}]",a9531dce-194e-11e5-b177-0eff099c3d1f,Question,light,richtext,False,False,True,7,0,False,all_ads,/r/dating/comments/pf6gd3/is_it_a_good_idea_to_talk_about_certain_medical/,False,6,1630418485,1,"There are times when hemorrhoids kinda come up which is basically like a swollen vein in my butt, and would bother and hurt a lot for a few days every so often, and so my girlfriend noticed how I kinda act a bit off or pained, so she's been getting worried and kept asking what was going on so at some point I did bring it up since I thought communicating this might be important since I would be as worried if I saw her in some pain and didn't know what was going on. would this be ok to talk about? or is medical stuff like this something you should keep to yourself?",True,False,False,dating,t5_2qhb1,981331,public,self,Is it a good idea to talk about certain medical stuff?,0,[],1.0,https://www.reddit.com/r/dating/comments/pf6gd3/is_it_a_good_idea_to_talk_about_certain_medical/,all_ads,6,,,
45,[],False,Surveygur,,[],,text,t2_e92fjgbe,False,False,False,[],False,False,1630418494,self.dating,https://www.reddit.com/r/dating/comments/pf6gma/what_would_you_say_are_your_nonnegotiable_traits/,{},pf6gma,False,False,False,False,False,False,True,False,#ff4500,dating,"[{'e': 'text', 't': 'Question'}]",a9531dce-194e-11e5-b177-0eff099c3d1f,Question,light,richtext,False,False,True,0,0,False,all_ads,/r/dating/comments/pf6gma/what_would_you_say_are_your_nonnegotiable_traits/,False,6,1630418504,1,[removed],True,False,False,dating,t5_2qhb1,981331,public,self,What would you say are your non-negotiable traits that you look for in a relationship?,0,[],1.0,https://www.reddit.com/r/dating/comments/pf6gma/what_would_you_say_are_your_nonnegotiable_traits/,all_ads,6,,,moderator
46,[],False,Glittering_Ad_2628,,[],,text,t2_9l98z6xt,False,False,False,[],False,False,1630419306,self.dating,https://www.reddit.com/r/dating/comments/pf6ppp/when_anxiety_overshadows_potential_feelings/,{},pf6ppp,False,True,False,False,False,True,True,False,#ea0027,dating,"[{'e': 'text', 't': 'I Need Advice'}]",19ec58c2-9f74-11e7-81a1-0e2bf15991f0,I Need Advice,light,richtext,False,False,True,2,0,False,all_ads,/r/dating/comments/pf6ppp/when_anxiety_overshadows_potential_feelings/,False,6,1630419317,1,"Hey r/dating community!  
I believe I am somewhat dysfunctional when it comes to dating.   
Maybe some of you can help me figure out how to overcome that.  


So, about me, I am a 25-year-old male about to begin my last year as a master's student. I would say I'm decently attractive although slightly smaller than average (5' 8 / 173cm), kind, smart, and occasionally funny. It's been about 3 years since my last relationship, a rather long period, but I'm trying to get back on the dating market. I'm definitely looking for something serious as I would not find casual encounters meaningful. When it comes to potential partners, I'm especially attracted to women who are educated, are not afraid to share their opinion, and are either really passionate or good at something that they do. As I am introverted and Covid is still very present here despite vaccinations, I have taken up dating mostly through dating apps. This hasn't been easy, but I manage to get a date once in a while.   


Just yesterday I met a girl for a first date. We had texted for about a month prior to that. We made lunch together at my place and I showed her a bit around town (there's nothing to interpret about the date's location; I think I simply give off a harmless vibe). I enjoyed myself and I think I quite liked her, but I'm not sure I was able to show that properly (eg maybe not enough compliments). As I mentioned before, I'm quite introverted and it takes me a while to feel comfortable enough around a person to be my true self (especially if that person is a woman). This takes forms such as that I'm afraid to put on music I like during a date and instead try to look for something more generic, or that I sometimes have quite a lot of inhibition preventing me from saying things that just come to mind. Adding to that are general insecurities that I have accumulated over the 3-year period of being single, mostly that I will fuck up by not being enthusiastic enough, focusing too much on the informational content of my speech rather than the social aspect, not asking enough questions, initiating physical contact too soon or too late, and not being able to sense my real feelings through this veil of anxiety. Anyways, the date lasted about 6 hours and we said our goodbyes. I texted her later that night because she had forgotten something at my place and also because I was keen on seeing her again. In the hours before I texted her, I felt anxious, much like if I feared failing an exam. I played the date back in my head, cringing at some of my behaviors. Apparently, though, she also had a good time, keen on meeting again, although we didn't set a second date yet.   


I'm aware that y'all do not know me and do not have any way to evaluate whether I am completely socially inept or reasonably normal. I'm just looking for advice on how to approach dating such that I can allow myself to feel emotions that are actually related to the person I'm meeting and not to my anxiety. On top of that, I know that it takes me a while to develop feelings for someone. So, even without the anxiety, I would often be clueless. I find it hard to escalate things physically just based off of some societal schedule for Western dating. Should I communicate that? I don't know... Anyways, my thoughts for the (potential) next date are that I should steer things more toward relationship talk (I know, I should have done that before) and try to be a bit more relaxed, although I don't know whether I'll be able to succeed at the latter.",True,False,False,dating,t5_2qhb1,981339,public,self,When anxiety overshadows potential feelings,0,[],1.0,https://www.reddit.com/r/dating/comments/pf6ppp/when_anxiety_overshadows_potential_feelings/,all_ads,6,,,
47,[],False,No-Pen-1291,,[],,text,t2_chrxl3yv,False,False,False,[],False,False,1630419520,self.dating,https://www.reddit.com/r/dating/comments/pf6s7t/i_broke_it_off_with_someone_yesterday_and_feel/,{},pf6s7t,False,True,False,False,False,True,True,False,#00a6a5,dating,"[{'e': 'text', 't': 'Support Needed'}]",fd9c03b8-a1ce-11e7-9172-0e8c9f9ecf4c,Support Needed,dark,richtext,False,False,True,3,0,False,all_ads,/r/dating/comments/pf6s7t/i_broke_it_off_with_someone_yesterday_and_feel/,False,6,1630419531,1,"Yesterday I broke it off with someone I’ve been talking to and hanging out with for the last 6 weeks. During that time we both had several trips/ time out of town, but we probably got together 5 or 6 times. The last time we hooked up and that’s what I feel the worst about. Then he had to go away with his family for a little over a week and we texted a couple times, then I didn’t hear from him for a week. When he got back he basically made a comment about that and that he was trying to gauge how I was feeling by not texting me. He was a very intentional dater, told me he wanted to be in something serious but, seemed to respect that I didn’t want to rush into something serious either. After feeling like he “tested” me I kinda freaked and said I think we are looking for different things and I’m just not ready right now. He called me out on giving mixed signals and that it had seemed like I wanted more than FWB. Now I’m confused myself, I know I don’t want to move forward with him, but I feel fucking shitty. I feel like I have no idea how to date, I want to eventually be in a relationship but I don’t want to rush into it and I’m so many ways it seems like it’s an all or nothing. I feel bad I can tell he was frustrated and hurt, I know he didn’t want to hook up just to have it end - and I did tell him the night we did that I wasn’t ready for an exclusive relationship yet- like this feeling of hurting someone is enough to just not want to date, or only do casual hookups. :(",True,False,False,dating,t5_2qhb1,981341,public,self,I broke it off with someone yesterday and feel like shit.,0,[],1.0,https://www.reddit.com/r/dating/comments/pf6s7t/i_broke_it_off_with_someone_yesterday_and_feel/,all_ads,6,,,
48,[],False,JID_Stan,,[],,text,t2_e7wl62bf,False,False,False,[],False,False,1630421905,self.dating,https://www.reddit.com/r/dating/comments/pf7jxq/keeping_things_interesting_over_facetime/,{},pf7jxq,False,True,False,False,False,True,True,False,#ea0027,dating,"[{'e': 'text', 't': 'I Need Advice'}]",19ec58c2-9f74-11e7-81a1-0e2bf15991f0,I Need Advice,light,richtext,False,False,True,6,0,False,all_ads,/r/dating/comments/pf7jxq/keeping_things_interesting_over_facetime/,False,6,1630421916,1,"I've been talking to this girl for about two weeks, we met at a party right before we both left for school and hit it off. We have mostly been texting and we have good conversations, so last night we decided to have our first FaceTime call. It was going smoothly in the beginning but once things started to stall out, she had to carry the conversation. She says she really likes me but I feel so awkward and I am worried that she will get bored of me soon, is there anything I can do to be more interesting face to face?",True,False,False,dating,t5_2qhb1,981383,public,self,Keeping things interesting over facetime,0,[],1.0,https://www.reddit.com/r/dating/comments/pf7jxq/keeping_things_interesting_over_facetime/,all_ads,6,,,
49,[],False,SirNamesAlotx,,[],,text,t2_3gemre3i,False,False,False,[],False,False,1630422089,self.dating,https://www.reddit.com/r/dating/comments/pf7mey/im_a_terrible_person_but_i_need_help/,{},pf7mey,False,True,False,False,False,True,True,False,#ea0027,dating,"[{'e': 'text', 't': 'I Need Advice'}]",19ec58c2-9f74-11e7-81a1-0e2bf15991f0,I Need Advice,light,richtext,False,False,True,30,0,False,all_ads,/r/dating/comments/pf7mey/im_a_terrible_person_but_i_need_help/,False,6,1630422100,1,"I've been going to the gym since the beginning of the year and I regularly see a girl there. I never really noticed her, because I thought her body was unattractive (plus I wasn't single), although she might have a pretty face (idk too much makeup), def pretty eyes (my weakness), maybe nice ass (another weakness). She often works out beside me or near me, eyes me and gives me a smile/sexy grin. Over all pretty flirty. She's said something to me a couple times before but I had my headphones in and just one worded her. Although she did cool off more recently

Recently my status changed and I was thinking about talking to her, but idk how to approach her. I def don't want anything serious and I don't want to make it awkward if I've been misreading her this entire time lol, maybe there was a sexier guy behind me this whole time. The other issue is I'm really not as sexy as I look, I'm worried my personality could drive her away as well.

Should I go for it? What should I say? ""Are you new to the gym?"" Lol",True,False,False,dating,t5_2qhb1,981387,public,self,"I'm a terrible person, but I need help",0,[],1.0,https://www.reddit.com/r/dating/comments/pf7mey/im_a_terrible_person_but_i_need_help/,all_ads,6,,,
50,[],False,theniceguy790,,[],,text,t2_ckcmehtr,False,False,False,[],False,False,1630422248,self.dating,https://www.reddit.com/r/dating/comments/pf7oev/dating_boss/,{},pf7oev,False,True,False,False,False,True,True,False,#ea0027,dating,"[{'e': 'text', 't': 'I Need Advice'}]",19ec58c2-9f74-11e7-81a1-0e2bf15991f0,I Need Advice,light,richtext,False,False,True,28,0,False,all_ads,/r/dating/comments/pf7oev/dating_boss/,False,6,1630422259,1,"I am a young man in my 30s. I slept with my boss after work in her office a few weeks ago (she has huge boobs, wears tight dresses, high heels, I couldn't resist). Apparently, she has told some of the other managers that we are dating and now they want me to either take a promotion (which would make me a manager) or move to another branch of the company at a different location a few miles away. I enjoy my job at the company, which is a financial services company, and I have no desire to be promoted. I live with my mother and make a decent $40,000 a year salary. I don't need a huge manager salary NOR do I want the responsibility of a manager. I actually like my co-workers and the location that I am at now, but management doesn't want me to continue to work at my current branch unless I take a promotion.

People always say ""don't shit where you eat"", but I have always had an easier time getting sex at work. I actually lost my virginity to a much older woman, who was a co-worker, when I was 18 years old. 

How should I handle this?",True,False,False,dating,t5_2qhb1,981386,public,self,Dating Boss,0,[],1.0,https://www.reddit.com/r/dating/comments/pf7oev/dating_boss/,all_ads,6,,,
