,all_awardings,allow_live_comments,author,author_flair_css_class,author_flair_richtext,author_flair_text,author_flair_type,author_fullname,author_is_blocked,author_patreon_flair,author_premium,awarders,can_mod_post,contest_mode,created_utc,domain,full_link,gildings,id,is_created_from_ads_ui,is_crosspostable,is_meta,is_original_content,is_reddit_media_domain,is_robot_indexable,is_self,is_video,link_flair_background_color,link_flair_css_class,link_flair_richtext,link_flair_template_id,link_flair_text,link_flair_text_color,link_flair_type,locked,media_only,no_follow,num_comments,num_crossposts,over_18,parent_whitelist_status,permalink,pinned,pwls,retrieved_on,score,selftext,send_replies,spoiler,stickied,subreddit,subreddit_id,subreddit_subscribers,subreddit_type,thumbnail,title,total_awards_received,treatment_tags,upvote_ratio,url,whitelist_status,wls,removed_by_category,post_hint,preview,author_cakeday
31,[],False,smdx459,,[],,text,t2_k15a2,False,False,False,[],False,False,1629608714,self.dating,https://www.reddit.com/r/dating/comments/p96i6v/during_a_date_is_it_a_good_sign_when_you_look_up/,{},p96i6v,False,True,False,False,False,True,True,False,#ea0027,dating,"[{'e': 'text', 't': 'I Need Advice'}]",19ec58c2-9f74-11e7-81a1-0e2bf15991f0,I Need Advice,light,richtext,False,False,True,13,0,False,all_ads,/r/dating/comments/p96i6v/during_a_date_is_it_a_good_sign_when_you_look_up/,False,6,1629608725,1,This is a dinner date that ended like an hour ago. No text yet 🙃 and the night ended with a hug with no indication of a 2nd date lol.,True,False,False,dating,t5_2qhb1,967340,public,self,During a date is it a good sign when you look up and catch them smiling and looking directly at you?,0,[],1.0,https://www.reddit.com/r/dating/comments/p96i6v/during_a_date_is_it_a_good_sign_when_you_look_up/,all_ads,6,,,,
32,[],False,ErwinKim12,,[],,text,t2_ctmx3906,False,False,False,[],False,False,1629608757,self.dating,https://www.reddit.com/r/dating/comments/p96ii3/so_is_he_into_me_or_is_he_just_friendly/,{},p96ii3,False,True,False,False,False,True,True,False,#ea0027,dating,"[{'e': 'text', 't': 'I Need Advice'}]",19ec58c2-9f74-11e7-81a1-0e2bf15991f0,I Need Advice,light,richtext,False,False,True,4,0,False,all_ads,/r/dating/comments/p96ii3/so_is_he_into_me_or_is_he_just_friendly/,False,6,1629608768,1,"SO is he being friendly or flirty PLS HELP

Okay so I did this teen science program in Texas a few weeks ago and I'm a really quiet guy and usually keep to myself. This other guy (LEt's call him Orren) I knew to be extremely outgoing, but I never really spoke to him despite the fact that we knew who each other were.

Anyways, the last day of camp, I noticed he followed me on Instagram. Okay. Interesting. I dunno how he found it? Very few people had my Instagram, especially people who I often saw around him.

Cut to a few weeks later, I make a instagram post regarding a mistake I made with my computer which was very funny. He messaged me a description of what to do next time. I thanked him and asked him how he was. He said good. I mentioned being glad he found me on Instagram because I was quiet at camp. He said he noticed that.

We continued to talk about school until Myers Briggs came up. he mentioned our personality types are compatible and that we would get along. We spoke about our passions until I had to go. I asked him if there was somewhere else I could contact him. He gave me his number..

Next day I text him that I'm in class and bored. We continued texting about our passions, and he began telling me about a cool project he was working on. (maybe trying to impress me?) He knew I was vegan (I made a post and in the caption was ""Vegan Ice Cream"" so he must've read it. (Maybe I'm looking into this too much idk.) He said he remembered small details about people and some people find it annoying. He also said there's an inside joke almost everywhere with him. He called himself flamboyant (I KNOW IT'S A STEREYOTPE BUT LIKE COME ON!) Next day I texted him again and the day after that I had anxiety and texted him ""sorry if I'm bothering you when I text you"" and he said ""Don't worry about it. I WAS DUMB AND TEXTED HIM ON BOTH INSTA AND IMESSAGE LITERALLY UGH.

I then texted him 8 hours later asking if we could call or text while I was away since I'm gonna be bored and have nothing to do. He said to call or text anytime and he'll respond if he's available. I then said ""Thanks for being so nice to me"" which like EWWW that sounds so weird but I'm not used to friendliness like this. Anyways PLS HELP. IDK if this is just friendship or if I'm making more out of it. If he wants to be friends I'm more than happy with that. He's very nice and smart but I'm still hopeful it IS what I think.",True,False,False,dating,t5_2qhb1,967339,public,self,So is he into me or is he just friendly?,0,[],1.0,https://www.reddit.com/r/dating/comments/p96ii3/so_is_he_into_me_or_is_he_just_friendly/,all_ads,6,,,,
33,[],False,Longjumping_Use_2797,,[],,text,t2_e2e320vu,False,False,False,[],False,False,1629609000,self.dating,https://www.reddit.com/r/dating/comments/p96kch/serious_relationship/,{},p96kch,False,False,False,False,False,False,True,False,#ffb000,,"[{'e': 'text', 't': 'Tinder/Online Dating'}]",5214d2ac-61f1-11e8-8bb1-0ed15e4a39c0,Tinder/Online Dating,dark,richtext,False,False,True,1,0,False,all_ads,/r/dating/comments/p96kch/serious_relationship/,False,6,1629609011,1,[removed],True,False,False,dating,t5_2qhb1,967340,public,self,Serious relationship,0,[],1.0,https://www.reddit.com/r/dating/comments/p96kch/serious_relationship/,all_ads,6,automod_filtered,,,
34,[],False,NumerousPart7597,,[],,text,t2_e2efysz7,False,False,False,[],False,False,1629609107,self.dating,https://www.reddit.com/r/dating/comments/p96l5q/it_happened_againbaby_24m_and_30f/,{},p96l5q,False,False,False,False,False,False,True,False,#24a0ed,,"[{'e': 'text', 't': 'Long Distance'}]",5dc9d60a-cc75-11eb-86e9-0ea78081bf43,Long Distance,dark,richtext,False,False,True,3,0,False,all_ads,/r/dating/comments/p96l5q/it_happened_againbaby_24m_and_30f/,False,6,1629609118,1,[removed],True,False,False,dating,t5_2qhb1,967341,public,self,It happened again.....Baby 24M and 30F,0,[],1.0,https://www.reddit.com/r/dating/comments/p96l5q/it_happened_againbaby_24m_and_30f/,all_ads,6,moderator,,,
35,[],False,blaze3579,,[],,text,t2_9q7nfn2q,False,False,False,[],False,False,1629609312,self.dating,https://www.reddit.com/r/dating/comments/p96mqp/how_do_i_answer_the_question_what_do_you_bring_to/,{},p96mqp,False,True,False,False,False,True,True,False,#ff4500,dating,"[{'e': 'text', 't': 'Question'}]",a9531dce-194e-11e5-b177-0eff099c3d1f,Question,light,richtext,False,False,True,195,0,False,all_ads,/r/dating/comments/p96mqp/how_do_i_answer_the_question_what_do_you_bring_to/,False,6,1629609324,1,"I have never been in a serious relationship. I'm very introverted and am mostly talking to guys through dating apps. 

I've had some guys ask me what can I bring to a relationship and I'm not sure how to answer that question. When asked I usually respond with things like I have a steady job, know how to cook, I'm independent. 

I'm not really sure if that's the right answer or if that's what guys want to know when they ask that question. 

Any advice would be appreciated.",True,False,False,dating,t5_2qhb1,967343,public,self,How do I answer the question 'what do you bring to the table'?,0,[],1.0,https://www.reddit.com/r/dating/comments/p96mqp/how_do_i_answer_the_question_what_do_you_bring_to/,all_ads,6,,,,
36,[],False,Brokenheartedcow,,[],,text,t2_bmaaabg0,False,False,False,[],False,False,1629610129,self.dating,https://www.reddit.com/r/dating/comments/p96syd/none_of_these_guys_on_dating_apps_are_looking_for/,{},p96syd,False,True,False,False,False,True,True,False,#ea0027,dating,"[{'e': 'text', 't': 'I Need Advice'}]",19ec58c2-9f74-11e7-81a1-0e2bf15991f0,I Need Advice,light,richtext,False,False,True,28,0,False,all_ads,/r/dating/comments/p96syd/none_of_these_guys_on_dating_apps_are_looking_for/,False,6,1629610139,1,What do you use and where do you go then if all of these guys just don’t want anything serious ?,True,False,False,dating,t5_2qhb1,967357,public,self,None of these guys on dating apps are looking for their soulmate,0,[],1.0,https://www.reddit.com/r/dating/comments/p96syd/none_of_these_guys_on_dating_apps_are_looking_for/,all_ads,6,,,,
37,[],False,trying_to_be_amelia,,[],,text,t2_4ve4d0wv,False,False,False,[],False,False,1629610435,self.dating,https://www.reddit.com/r/dating/comments/p96vdt/am_i_the_only_one_who_finds_follow_me_on/,{},p96vdt,False,True,False,False,False,True,True,False,#ff4500,dating,"[{'e': 'text', 't': 'Question'}]",a9531dce-194e-11e5-b177-0eff099c3d1f,Question,light,richtext,False,False,True,27,0,False,all_ads,/r/dating/comments/p96vdt/am_i_the_only_one_who_finds_follow_me_on/,False,6,1629610447,1,"The guy I started dating is going on a trip and texted ""follow me for pics @\[his instagram handle\]"". I don't know if I'm just old-fashioned, but I feel like if you want to show someone pics you should text them pics, and if you want to connect on social media you should say you want to connect \*with them\* on social media, not just say ""follow me to see (whatever it is) about my life."" The latter reads to me like an Instagram model pitch. I'm interested in getting to know him, not spectating a vacation which is what this sounds like. Are my expectations too high here?",True,False,False,dating,t5_2qhb1,967360,public,self,"Am I the only one who finds ""follow me on Instagram"" a bit rude?",0,[],1.0,https://www.reddit.com/r/dating/comments/p96vdt/am_i_the_only_one_who_finds_follow_me_on/,all_ads,6,,,,
38,[],False,psilver12,,[],,text,t2_8jlbbbei,False,False,False,[],False,False,1629611269,self.dating,https://www.reddit.com/r/dating/comments/p971m4/how_do_i_ask_this_girl_out_im_really_interested/,{},p971m4,False,True,False,False,False,True,True,False,#ff4500,dating,"[{'e': 'text', 't': 'Question'}]",a9531dce-194e-11e5-b177-0eff099c3d1f,Question,light,richtext,False,False,True,8,0,False,all_ads,/r/dating/comments/p971m4/how_do_i_ask_this_girl_out_im_really_interested/,False,6,1629611280,1,"
I matched with this girl on tinder and we talked, turns out we’re from the same high school and have the same major at our college. She gave me her number pretty quickly and she seemed interested in me. She stopped responding after a few texts, but it was abrupt and not with one word responses like “yeah” or “haha”. I know it seems like that means she’s totally done with me but I also just have this feeling that she would still be interested. It has been a week since it went silent and I’m settled in back on campus, so if I just texted her and asked her to dinner would that be wierd?",True,False,False,dating,t5_2qhb1,967377,public,self,How do I ask this girl out? I’m really interested in her,0,[],1.0,https://www.reddit.com/r/dating/comments/p971m4/how_do_i_ask_this_girl_out_im_really_interested/,all_ads,6,,,,
39,[],False,young-king-1283,,[],,text,t2_8vv6nzy3,False,False,False,[],False,False,1629611344,self.dating,https://www.reddit.com/r/dating/comments/p9726a/m4f_looking_for_my_soulmate/,{},p9726a,False,False,False,False,False,False,True,False,#ffb000,,"[{'e': 'text', 't': 'Tinder/Online Dating'}]",5214d2ac-61f1-11e8-8bb1-0ed15e4a39c0,Tinder/Online Dating,dark,richtext,False,False,True,0,0,False,all_ads,/r/dating/comments/p9726a/m4f_looking_for_my_soulmate/,False,6,1629611355,1,[removed],True,False,False,dating,t5_2qhb1,967380,public,self,[M4F] - Looking for my soulmate,0,[],1.0,https://www.reddit.com/r/dating/comments/p9726a/m4f_looking_for_my_soulmate/,all_ads,6,moderator,self,"{'enabled': False, 'images': [{'id': 'b46sDSn0Wx6ykmc6AQxVFJsr9Tv7de9kOTBhX_zf3R0', 'resolutions': [{'height': 56, 'url': 'https://external-preview.redd.it/eAC0vwzauQxTyY1b5rttuI_ktE4LOkJ3uk1qHJvhimo.jpg?width=108&amp;crop=smart&amp;auto=webp&amp;s=572779b283385fb5061d5c96e4799231e981a254', 'width': 108}, {'height': 113, 'url': 'https://external-preview.redd.it/eAC0vwzauQxTyY1b5rttuI_ktE4LOkJ3uk1qHJvhimo.jpg?width=216&amp;crop=smart&amp;auto=webp&amp;s=219d8cb82b99058e262a207f15e55c15a9cbb767', 'width': 216}, {'height': 168, 'url': 'https://external-preview.redd.it/eAC0vwzauQxTyY1b5rttuI_ktE4LOkJ3uk1qHJvhimo.jpg?width=320&amp;crop=smart&amp;auto=webp&amp;s=d852898cd5c3157178e3936f9dc9f5817418940b', 'width': 320}], 'source': {'height': 315, 'url': 'https://external-preview.redd.it/eAC0vwzauQxTyY1b5rttuI_ktE4LOkJ3uk1qHJvhimo.jpg?auto=webp&amp;s=3f6012830e45e561a074de4895e6691e9d80c190', 'width': 600}, 'variants': {}}]}",
40,[],False,uglyavocado7474,,[],,text,t2_decv19af,False,False,False,[],False,False,1629613111,self.dating,https://www.reddit.com/r/dating/comments/p97fjy/i_drunk_texted_him_but_he_hasnt_answered/,{},p97fjy,False,True,False,False,False,True,True,False,#ea0027,dating,"[{'e': 'text', 't': 'I Need Advice'}]",19ec58c2-9f74-11e7-81a1-0e2bf15991f0,I Need Advice,light,richtext,False,False,True,7,0,False,all_ads,/r/dating/comments/p97fjy/i_drunk_texted_him_but_he_hasnt_answered/,False,6,1629613123,1,I drunk texted a guy friend of mine that we should go out for a beer. He has seen it but not answered. Can I interpret this as he is not interested at all?,True,False,False,dating,t5_2qhb1,967408,public,self,I drunk texted him but he hasn't answered,0,[],1.0,https://www.reddit.com/r/dating/comments/p97fjy/i_drunk_texted_him_but_he_hasnt_answered/,all_ads,6,,,,
41,[],False,erinraspberry,,[],,text,t2_123o7d,False,False,False,[],False,False,1629613292,self.dating,https://www.reddit.com/r/dating/comments/p97guz/what_are_things_you_see_on_an_old_profile_that/,{},p97guz,False,True,False,False,False,True,True,False,#ffb000,,"[{'e': 'text', 't': 'Tinder/Online Dating'}]",5214d2ac-61f1-11e8-8bb1-0ed15e4a39c0,Tinder/Online Dating,dark,richtext,False,False,True,12,0,False,all_ads,/r/dating/comments/p97guz/what_are_things_you_see_on_an_old_profile_that/,False,6,1629613302,1,"Any gender, and anything from petty nonsense to more serious things!",True,False,False,dating,t5_2qhb1,967411,public,self,What are things you see on an OLD profile that make you immediately swipe left?,0,[],1.0,https://www.reddit.com/r/dating/comments/p97guz/what_are_things_you_see_on_an_old_profile_that/,all_ads,6,,,,
42,[],False,SecretDoctor8121,,[],,text,t2_4qysehnx,False,False,False,[],False,False,1629614008,self.dating,https://www.reddit.com/r/dating/comments/p97lv0/when_did_you_call_it_quit/,{},p97lv0,False,True,False,False,False,True,True,False,#ff4500,dating,"[{'e': 'text', 't': 'Question'}]",a9531dce-194e-11e5-b177-0eff099c3d1f,Question,light,richtext,False,False,True,15,0,False,all_ads,/r/dating/comments/p97lv0/when_did_you_call_it_quit/,False,6,1629614018,1,"Hi all.
Im a 33M single dad of a 3 yrs old(results of the only hookup,attention i've ever get).So the question is pretty much says it...why n when did you call it quit looking for relationships or romantic partner?
I tried these ""dating apps"" they never worked...when I was in my teens used to go out whit my cousines not too often maybe once a month but I was the guy always went home alone (They always got Hookups/long-terms) sometimes by myself....time goes by finished school (still kissless,virgin at the times only lost in cuz my cousine paid a hooker to kick start me"") so I just did my buisness..like get a job etc etc...now time pass by and after the last 17 mnth just completely given up...no longer has the apps (find them pointless) to be honest.No longer going out as all my cousines in relationship and I don't wanna be the 3rd wheel so and they obviously busy whit their SO and after a while they not even asks me anymore(they know my anwser)
Thats understandable plus I don't drink alcohol anyway.
Still hurt time to time but am I alone?Is that a validation reason to just stop looking as its just cause more pain and rather just shove all that behind me so its just one less fuckup of life?
Thanks for reading even if you can't contribute to the topic.",True,False,False,dating,t5_2qhb1,967423,public,self,When did you call it quit?,0,[],1.0,https://www.reddit.com/r/dating/comments/p97lv0/when_did_you_call_it_quit/,all_ads,6,,,,
43,[],False,ShotMaximum4940,,[],,text,t2_e2erro4z,False,False,False,[],False,False,1629614055,self.dating,https://www.reddit.com/r/dating/comments/p97m7t/where_to_take_her_out/,{},p97m7t,False,False,False,False,False,False,True,False,#ea0027,dating,"[{'e': 'text', 't': 'I Need Advice'}]",19ec58c2-9f74-11e7-81a1-0e2bf15991f0,I Need Advice,light,richtext,False,False,True,0,0,False,all_ads,/r/dating/comments/p97m7t/where_to_take_her_out/,False,6,1629614066,1,[removed],True,False,False,dating,t5_2qhb1,967425,public,self,Where to take her out?,0,[],1.0,https://www.reddit.com/r/dating/comments/p97m7t/where_to_take_her_out/,all_ads,6,moderator,,,
44,[],False,navetsitnasac,,[],,text,t2_7v8j6jvn,False,False,False,[],False,False,1629614093,self.dating,https://www.reddit.com/r/dating/comments/p97mgt/things_are_going_well_hope_to_keep_it_that_way/,{},p97mgt,False,True,False,False,False,True,True,False,#ea0027,dating,"[{'e': 'text', 't': 'I Need Advice'}]",19ec58c2-9f74-11e7-81a1-0e2bf15991f0,I Need Advice,light,richtext,False,False,True,3,0,False,all_ads,/r/dating/comments/p97mgt/things_are_going_well_hope_to_keep_it_that_way/,False,6,1629614104,1,"I (23f) have been talking to this guy (25m) he’s great, he has his shit together and I dig that a lot and just in general a good guy with good intentions. He’s very straight forward with what he wants in a potential relationship and I really respect that and agree with what he has to say. Something he mentioned is that he would like to spend a lot of time together whenever we’re free, which is chill with me, however I’m a very busy person, and he knows that
But I really don’t want to push him away because I don’t spend a lot of time with him
In the past, this kinda turned people off because I’m so busy and I really like this guy and don’t want to mess things up again
Wherever possible I make time to see him and we’re still in early stages of talking now",True,False,False,dating,t5_2qhb1,967426,public,self,"Things are going well, hope to keep it that way",0,[],1.0,https://www.reddit.com/r/dating/comments/p97mgt/things_are_going_well_hope_to_keep_it_that_way/,all_ads,6,,,,
45,[],False,stoneaasha,,[],,text,t2_e20zcet1,False,False,False,[],False,False,1629614905,self.dating,https://www.reddit.com/r/dating/comments/p97s2s/how_to_hack_snapchat/,{},p97s2s,False,False,False,False,False,False,True,False,#ffd635,dating,"[{'e': 'text', 't': 'Giving Advice'}]",7bca2c58-4211-11e5-9ecb-0e60d8112001,Giving Advice,dark,richtext,False,False,True,1,0,False,all_ads,/r/dating/comments/p97s2s/how_to_hack_snapchat/,False,6,1629614916,1,[removed],True,False,False,dating,t5_2qhb1,967434,public,self,How to hack Snapchat,0,[],1.0,https://www.reddit.com/r/dating/comments/p97s2s/how_to_hack_snapchat/,all_ads,6,moderator,,,
46,[],False,deernotdear,,[],,text,t2_e25sglgo,False,False,False,[],False,False,1629615267,self.dating,https://www.reddit.com/r/dating/comments/p97ufb/do_nerdy_guys_like_dumb_girls/,{},p97ufb,False,False,False,False,False,False,True,False,#ea0027,dating,"[{'e': 'text', 't': 'I Need Advice'}]",19ec58c2-9f74-11e7-81a1-0e2bf15991f0,I Need Advice,light,richtext,False,False,True,0,0,False,all_ads,/r/dating/comments/p97ufb/do_nerdy_guys_like_dumb_girls/,False,6,1629615278,1,[removed],True,False,False,dating,t5_2qhb1,967441,public,self,Do nerdy guys like “dumb” girls?,0,[],1.0,https://www.reddit.com/r/dating/comments/p97ufb/do_nerdy_guys_like_dumb_girls/,all_ads,6,moderator,,,
47,[],False,bandofhawkpippin,,[],,text,t2_9356az9g,False,False,False,[],False,False,1629617775,self.dating,https://www.reddit.com/r/dating/comments/p98an5/friendzone/,{},p98an5,False,True,False,False,False,True,True,False,#ff4500,dating,"[{'e': 'text', 't': 'Question'}]",a9531dce-194e-11e5-b177-0eff099c3d1f,Question,light,richtext,False,False,True,5,0,False,all_ads,/r/dating/comments/p98an5/friendzone/,False,6,1629617785,1,"A long time ago I matched with a girl on tinder, we talked for a bit about where we were from and stuff like that. I had pics of me boxing on my dating profile, and and she said she was looking to get into boxing. I thought things were going well until she kept calling me bro during the convo. This made me not interested in her anymore so I unmatched her, what made it worse is I seen her at my boxing gym the next day and I didn’t say anything to her. What’s the point of some women being on dating apps if they just want friends?",True,False,False,dating,t5_2qhb1,967482,public,self,Friendzone,0,[],1.0,https://www.reddit.com/r/dating/comments/p98an5/friendzone/,all_ads,6,,,,
48,[],False,Kishamarta,,[],,text,t2_dwcnq28g,False,False,False,[],False,False,1629617811,self.dating,https://www.reddit.com/r/dating/comments/p98avb/hookup/,{},p98avb,False,False,False,False,False,False,True,False,#ffb000,,"[{'e': 'text', 't': 'Tinder/Online Dating'}]",5214d2ac-61f1-11e8-8bb1-0ed15e4a39c0,Tinder/Online Dating,dark,richtext,False,False,True,2,0,True,all_ads,/r/dating/comments/p98avb/hookup/,False,6,1629617823,1,[removed],True,True,False,dating,t5_2qhb1,967482,public,nsfw,HOOKUP,0,[],1.0,https://www.reddit.com/r/dating/comments/p98avb/hookup/,promo_adult_nsfw,3,reddit,,,
49,[],False,oneunluckychap,,[],,text,t2_dpb38ge2,False,False,False,[],False,False,1629617861,self.dating,https://www.reddit.com/r/dating/comments/p98b8d/should_i_not_bother_putting_myself_outthere/,{},p98b8d,False,False,False,False,False,False,True,False,#00a6a5,dating,"[{'e': 'text', 't': 'Support Needed'}]",fd9c03b8-a1ce-11e7-9172-0e8c9f9ecf4c,Support Needed,dark,richtext,False,False,True,0,0,False,all_ads,/r/dating/comments/p98b8d/should_i_not_bother_putting_myself_outthere/,False,6,1629617872,1,[removed],True,False,False,dating,t5_2qhb1,967483,public,self,Should I not bother putting myself outthere......,0,[],1.0,https://www.reddit.com/r/dating/comments/p98b8d/should_i_not_bother_putting_myself_outthere/,all_ads,6,moderator,,,
50,[],False,Think_Rip875,,[],,text,t2_ddpneuhl,False,False,False,[],False,False,1629618747,self.dating,https://www.reddit.com/r/dating/comments/p98h5a/online_dating/,{},p98h5a,False,True,False,False,False,True,True,False,#ffb000,,"[{'e': 'text', 't': 'Tinder/Online Dating'}]",5214d2ac-61f1-11e8-8bb1-0ed15e4a39c0,Tinder/Online Dating,dark,richtext,False,False,True,3,0,True,all_ads,/r/dating/comments/p98h5a/online_dating/,False,6,1629618758,1,"Online dating gives you large no of options but at same time it is depressing &amp; time wastage, more leaned towards hookups not on meaningful relationships. 
Pour your views here !",True,False,False,dating,t5_2qhb1,967495,public,nsfw,Online dating,0,[],1.0,https://www.reddit.com/r/dating/comments/p98h5a/online_dating/,promo_adult_nsfw,3,,,,
51,[],False,Middle-Watch371,,[],,text,t2_9c293tyg,False,False,False,[],False,False,1629618856,self.dating,https://www.reddit.com/r/dating/comments/p98ht0/so_attracted_to_him_but_nothing_in_common/,{},p98ht0,False,True,False,False,False,True,True,False,#ea0027,dating,"[{'e': 'text', 't': 'I Need Advice'}]",19ec58c2-9f74-11e7-81a1-0e2bf15991f0,I Need Advice,light,richtext,False,False,True,5,0,False,all_ads,/r/dating/comments/p98ht0/so_attracted_to_him_but_nothing_in_common/,False,6,1629618867,1,"Dating this guy and the physical attraction is crazy, when I look in his eyes it feels like I get lost in them, it feels warm and smooth. When Im next to him I feel comfortable, protected, not nervous or uncomfortable, it feels so good and safe. He feels like home. When we joke we laugh so hard and tease each other and he’s so sweet to me too. But we can’t carry a conversation for long, and that’s my worry. Some guys I’ve felt like we could talk for hours and hours about everything but I wasn’t physically attracted to them. So I’d just be friends with them. With this guy, everything is so amazing but I can’t get deep with him. Or we’re not on the same page in conversation. Sometimes it feels like we’re forcing it. It doesn’t flow. But everything else feels so good. Does this mean it’s lust? We haven’t slept together and don’t plan to anytime soon. What do I do?",True,False,False,dating,t5_2qhb1,967497,public,self,So attracted to him but nothing in common,0,[],1.0,https://www.reddit.com/r/dating/comments/p98ht0/so_attracted_to_him_but_nothing_in_common/,all_ads,6,,,,
52,[],False,lurkdontpost1,,[],,text,t2_5tghk1ot,False,False,False,[],False,False,1629618879,self.dating,https://www.reddit.com/r/dating/comments/p98hxv/men_what_do_you_say_after_being_rejected_do_you/,{},p98hxv,False,True,False,False,False,True,True,False,#ff4500,dating,"[{'e': 'text', 't': 'Question'}]",a9531dce-194e-11e5-b177-0eff099c3d1f,Question,light,richtext,False,False,True,18,0,False,all_ads,/r/dating/comments/p98hxv/men_what_do_you_say_after_being_rejected_do_you/,False,6,1629618890,1,"Would like discuss your healthy options for handling rejection from women, unfortunately it seems it's common for men to lose their composure.  
What is an appropriate positive response you've used? Also have you remained friends after rejection?",True,False,False,dating,t5_2qhb1,967497,public,self,"Men, what do you say after being rejected? Do you respond at all?",0,[],1.0,https://www.reddit.com/r/dating/comments/p98hxv/men_what_do_you_say_after_being_rejected_do_you/,all_ads,6,,,,
