,all_awardings,allow_live_comments,author,author_flair_background_color,author_flair_css_class,author_flair_text,author_flair_text_color,awarders,banned_by,can_mod_post,contest_mode,created_utc,domain,full_link,gildings,id,is_crosspostable,is_meta,is_original_content,is_reddit_media_domain,is_robot_indexable,is_self,is_video,link_flair_background_color,link_flair_css_class,link_flair_richtext,link_flair_template_id,link_flair_text,link_flair_text_color,link_flair_type,locked,media_only,no_follow,num_comments,num_crossposts,over_18,parent_whitelist_status,permalink,pinned,pwls,removed_by_category,retrieved_on,score,send_replies,spoiler,stickied,subreddit,subreddit_id,subreddit_subscribers,subreddit_type,thumbnail,title,total_awards_received,treatment_tags,upvote_ratio,url,whitelist_status,wls,author_flair_richtext,author_flair_type,author_fullname,author_patreon_flair,author_premium,selftext,edited,author_cakeday
0,[],False,[deleted],,,,dark,[],moderators,False,False,1622437044,self.dating,https://www.reddit.com/r/dating/comments/nougsq/do_you_delete_your_dating_apps_profile_when_youre/,{},nougsq,False,False,False,False,False,True,False,,dating,"[{'e': 'text', 't': 'Question'}]",a9531dce-194e-11e5-b177-0eff099c3d1f,Question,dark,richtext,False,False,True,2,0,False,all_ads,/r/dating/comments/nougsq/do_you_delete_your_dating_apps_profile_when_youre/,False,6,deleted,1622440625,1,True,False,False,dating,t5_2qhb1,806529,public,default,Do you delete your dating apps profile when you're in a relationship?,0,[],1.0,https://www.reddit.com/r/dating/comments/nougsq/do_you_delete_your_dating_apps_profile_when_youre/,all_ads,6,,,,,,,,
1,[],False,Obscura616,,,,,[],,False,False,1622437704,self.dating,https://www.reddit.com/r/dating/comments/nourat/did_she_lost_interest_because_of_badsex_or_im/,{},nourat,True,False,False,False,True,True,False,,,"[{'e': 'text', 't': 'Tinder/Online Dating'}]",5214d2ac-61f1-11e8-8bb1-0ed15e4a39c0,Tinder/Online Dating,dark,richtext,False,False,True,15,0,False,all_ads,/r/dating/comments/nourat/did_she_lost_interest_because_of_badsex_or_im/,False,6,,1622441527,0,True,False,False,dating,t5_2qhb1,806548,public,self,Did she lost interest because of badsex or Im being paranoind? Need help here!!!!!,0,[],0.5,https://www.reddit.com/r/dating/comments/nourat/did_she_lost_interest_because_of_badsex_or_im/,all_ads,6,[],text,t2_5ansfsc0,False,False,"Sorry for the long paragraphs but I'm just trying to not get anything left out so you guys have more info about what happen here and could give me the best answer possible.


Met this girl more than a month ago on tinder, we saw each other 5 times, all the dates happen in her house, she is 22 and lives alone.By the 4th date we hook up but if I wanted it could had been on the 3rd date but I refuse cause she was a lil drunk that night.I remember since I met her I ask her what she was looking for in tinder and she said she was just bored and some friends of her told her she should join tinder that she was not looking for anything in particular. 

3rd time we saw each other was a little unexpected because we did not even plan to see each other that
night. She suddenly texted me late at night asking me to hang out with her in her house that she was out with her friends and that she was arriving soon to her house which it was true cause that night she posted some stories going out with her friends.When I get to her house she was drunk laying in her couch.We started making out and went to her bed then outofnowhere she started saying opening up to me. She said the reason she lives alone is because her ex left her a couple months ago and he was the one that encourage her to go and move on together but later on he left and that she is still mad at him.That night she cooked me a meal, I even slept with her till the next morning when she had to go to work like we were boyfriend and girlfriend lol. 

Then next day I went to her house again and we had sex.Not gonna lie the sex was not that good, we were both nervous specially me.I have anxiety and I get nervous when I'm with a new girl not all the time but sometimes I do. And this time I remember it took me a while to get hard while we were foreplaying  then I got hard but I struggle a lil bit to put the condom.We tried a few positions I even finger her and eat her out, she did not gave me oral cause she wanted me to get tested 1st before she did that.But when she got on top of me for some reason my erection was gone.It was getting back up but I struggle to put the condom on and got frustrated.She said is all good I understand is not big deal.We watch tv and talk for a bit then she suggested for me to get tested so I had no problem with the condom anymore and so we could had sex raw and with no fear of catching anything. 

Now me saying that she lost interest because of the bad sex is just me taking a guess here but I don't know I doubt it , because after we had sex she kept being as eager to see me and keep talking to me since the 1st day with the same amout of reciprocation even texting me 1st ,like there were no signs of a slow fade yet.Also the main sign that tells me it was the bad sex was because one day after we had sex I saw that she had uploaded a new picture on her tinder profile but I don't know. 

2 days after we had sex I asked her through text what she was even looking for with me just out of curiosity and she said I answer you that in person.Then we saw each other again this time we made out but did not have sex because she had done laser on her vagina to erase hair forever ,which it was true.Then she said she just got out of 3 year long relationship and is still pissed off at him which she told me before and she doesnt want to get on a new relationship while still thinking about him and also because she is super busy with school and her job.But she does likes me and wants to continue seeing me she said she wanted to but was just not ready I said is perfect then I said to her whenever a female tells me that I always think is a form of rejection lol and she told me trust me is not that is just I'm not ready yet.She even deleted her tinder profile in front of me for some reason. 

Then we continue texting like we use to but a couple days after that she kept going distant like no longer initiating texts, then texts getting dry, sometimes leaving on read, sometimes being online and not even opening my messages, everytime I asked her to hangout keep saying she was busy.One time she texted me and told me the reason she was a lil distant with me was because according to her I was posting quotes on my stories that were directed to her and she was a lil mad about that but that she did wanted to keep seeing me that she was just super busy.One time I confronted her and told her that if she was not interested she could simply just say it but she kept saying she was interested it just that she was busy. I honestly got tired of this she seemed no longer interested so I unfollow her from all social media and never texted her again, but she kept following me watching all my stories, sometimes reacts to my stories,liking my pictures, and one week after I go no contact with her she even commented a storie of mine saying ""Heeeeyyyy"" and I just reply with a "" what"" and she left me on seen and that was the last time we spoke to each other like 2 weeks ago and just yesterday she unfollowed me on IG after a month since I unfollowed her. So my question is why did she lost interest I mean she said she was not ready for something serious but wanted to keep seeing me and she was so eager to have sex with me again , I even took an hiv test for her and even wanted to go to chicago with me but then all that dissapear.Help me understand.",,
2,[],False,Acceptable-Photo2845,,,,,[],,False,False,1622438784,self.dating,https://www.reddit.com/r/dating/comments/nov7yx/destroy_my_dating_app/,{},nov7yx,True,False,False,False,True,True,False,,dating,"[{'e': 'text', 't': 'I Need Advice'}]",19ec58c2-9f74-11e7-81a1-0e2bf15991f0,I Need Advice,dark,richtext,False,False,False,8,0,False,all_ads,/r/dating/comments/nov7yx/destroy_my_dating_app/,False,6,,1622443000,1,True,False,False,dating,t5_2qhb1,806598,public,self,Destroy my dating app,0,[],1.0,https://www.reddit.com/r/dating/comments/nov7yx/destroy_my_dating_app/,all_ads,6,[],text,t2_brl2ylpa,False,False,"I created a dating app and I was successful. Successfully got a 9:1 male female ratio lol

I’d like some harsh feedback either to stop working on it or continue

Or maybe a co-founder with growth hacker abilities. 

Matchmerry dot c o m",,
3,[],False,truelymarry56,,,,,[],,False,False,1622439207,self.dating,https://www.reddit.com/r/dating/comments/novei6/how_to_get_more_clients_on_a_small_budget_for/,{},novei6,True,False,False,False,True,True,False,,dating,"[{'e': 'text', 't': 'Giving Advice'}]",7bca2c58-4211-11e5-9ecb-0e60d8112001,Giving Advice,dark,richtext,False,False,False,7,0,False,all_ads,/r/dating/comments/novei6/how_to_get_more_clients_on_a_small_budget_for/,False,6,,1622443559,2,True,False,False,dating,t5_2qhb1,806611,public,self,How to Get More Clients on a Small Budget for matrimonial sites?,0,[],0.75,https://www.reddit.com/r/dating/comments/novei6/how_to_get_more_clients_on_a_small_budget_for/,all_ads,6,[],text,t2_cdjoxvzg,False,False,"When you’re running an online matchmaking company, getting more clients is the best way to increase your revenue. However, with rising costs of living and expensive infrastructure, it’s hard to keep up with the competition. I’ll share some ideas that can help you improve your marketing and get more clients at the same time.
1. Share authentic leads. 
2. Connect to your clients. 
3. Serve best services to the clients.",,
4,[],False,Aggiealmonds,,,,,[],,False,False,1622439419,self.dating,https://www.reddit.com/r/dating/comments/novhqr/nice_guy_but_maybe_wrong_time/,{},novhqr,True,False,False,False,True,True,False,,dating,"[{'e': 'text', 't': 'Other'}]",fd9c03b8-a1ce-11e7-9172-0e8c9f9ecf4c,Other,dark,richtext,False,False,False,8,0,False,all_ads,/r/dating/comments/novhqr/nice_guy_but_maybe_wrong_time/,False,6,,1622443842,1,True,False,False,dating,t5_2qhb1,806619,public,self,Nice guy but maybe wrong time ?,0,[],0.67,https://www.reddit.com/r/dating/comments/novhqr/nice_guy_but_maybe_wrong_time/,all_ads,6,[],text,t2_70thniaa,False,False,So I (23f) went on a date with a guy (27m) on the weekend. He was super lovely and he made me laugh. However I walked away from the date feeling a bit conflicted. Throughout the date he mentioned his ex several times such as ‘my ex couldn’t do this’ or ‘my ex did that’. I actually said to him at one point you mention your ex may too much maybe tone it back which it then became more conscious of it. I’m just unsure how to progress because I don’t want to be with pursue something with someone who isn’t over their ex but he was a really nice guy and I don’t want to miss out on a opportunity.,,
5,[],False,mandz85,,,,,[],,False,False,1622439924,self.dating,https://www.reddit.com/r/dating/comments/novpij/how_did_i_get_it_so_wrong/,{},novpij,False,False,False,False,False,True,False,,dating,"[{'e': 'text', 't': 'I Need Advice'}]",19ec58c2-9f74-11e7-81a1-0e2bf15991f0,I Need Advice,dark,richtext,False,False,True,0,0,False,all_ads,/r/dating/comments/novpij/how_did_i_get_it_so_wrong/,False,6,moderator,1622444510,1,True,False,False,dating,t5_2qhb1,806633,public,self,How did I get it so wrong?,0,[],1.0,https://www.reddit.com/r/dating/comments/novpij/how_did_i_get_it_so_wrong/,all_ads,6,[],text,t2_cfprbiri,False,False,[removed],,
6,[],False,ThrowawayOof98765,,,,,[],,False,False,1622440670,self.dating,https://www.reddit.com/r/dating/comments/now0qv/when_no_one_finds_you_sexually_attractive/,{},now0qv,True,False,False,False,True,True,False,,dating,"[{'e': 'text', 't': 'Venting'}]",a616c322-194e-11e5-ab91-0ed1c06bdad7,Venting,dark,richtext,False,False,False,17,0,False,all_ads,/r/dating/comments/now0qv/when_no_one_finds_you_sexually_attractive/,False,6,,1622445569,2,True,False,False,dating,t5_2qhb1,806665,public,self,When no one finds you sexually attractive,0,[],1.0,https://www.reddit.com/r/dating/comments/now0qv/when_no_one_finds_you_sexually_attractive/,all_ads,6,[],text,t2_bvslr034,False,False,"19M, Asian, 5’7, skinny build with BMI classified as underweight. I tried eating a lot and hitting the gym, but it’s still not working.

I live in a dorm in an Australian university. I’m not ready for a serious relationship but I’d like to explore and have fun. I have no idea how to flirt and no prior sexual experience. 

It sucks when I want to have fun but no females finds me sexually attractive.  People have told me I look more like a 10 year old boy than a man due to my baby face. 

People are like “I hookup to satisfy my sexual needs”. I have sexual needs too. I tried my best to flirt with females but they don’t reciprocate. I understand no one owes me anything, so I’m not blaming anyone but myself for that, but I felt helpless. Seeing my friends hooking up makes me feel kinda jealous. 

Some of you might say “sex is overrated”, but hooking up is something that can easily be done by the others. It’s like playing a video game and all your friends have passed a certain level except you, no matter how hard you try.",,
7,[],False,LastTerm,,,,,[],,False,False,1622440807,self.dating,https://www.reddit.com/r/dating/comments/now2qk/asking_a_girl_out/,{},now2qk,True,False,False,False,True,True,False,,dating,"[{'e': 'text', 't': 'I Need Advice'}]",19ec58c2-9f74-11e7-81a1-0e2bf15991f0,I Need Advice,dark,richtext,False,False,True,7,0,False,all_ads,/r/dating/comments/now2qk/asking_a_girl_out/,False,6,,1622445759,1,True,False,False,dating,t5_2qhb1,806667,public,self,asking a girl out,0,[],1.0,https://www.reddit.com/r/dating/comments/now2qk/asking_a_girl_out/,all_ads,6,[],text,t2_vm15di6,False,False,"theres a girl im attracted to but we dont know each other well and i havent seen her in about 3 years. we just know each others names, what we look like, and just basic stuff like that and we have maybe spoken twice at most with short conversations. COVID has been tough because im not in a relationship and havent been in one for a long time. im a 21 year old man and im getting frustrated with being lonely, i want to date a girl or at least take my chances with girls im interested in, life is too short to not take risks and COVID has taught me that. i had a crush on this girl a couple of years ago when we both worked at sleep away camp but never put myself out there to talk to her and express my feelings. what should i do to get her attention and ask her out on a date? i have her facebook and i think snapchat but thats it. would it be weird to start messaging her out of nowhere on facebook? how should i reach out to her? i just want to know how to do this without seeming weird, desperate or anything like that. i like to believe that i actually have a chance but its hard to say. whats your advice on asking someone out in this situation? keep in mind that we dont live in the same city but we arent far apart from each other.",,
8,[],False,[deleted],,,,dark,[],,False,False,1622441280,self.dating,https://www.reddit.com/r/dating/comments/now9vt/do_i_go_for_my_english_teacher/,{},now9vt,False,False,False,False,False,True,False,,dating,"[{'e': 'text', 't': 'Question'}]",a9531dce-194e-11e5-b177-0eff099c3d1f,Question,dark,richtext,False,False,True,15,0,False,all_ads,/r/dating/comments/now9vt/do_i_go_for_my_english_teacher/,False,6,deleted,1622446400,0,True,False,False,dating,t5_2qhb1,806677,public,default,Do I go for my English teacher?,0,[],0.5,https://www.reddit.com/r/dating/comments/now9vt/do_i_go_for_my_english_teacher/,all_ads,6,,,,,,[deleted],,
9,[],False,Daddyyjayy1,,,,,[],,False,False,1622441921,self.dating,https://www.reddit.com/r/dating/comments/nowjh5/seeking_a_serious_partner/,{},nowjh5,False,False,False,False,False,True,False,,,"[{'e': 'text', 't': 'Tinder/Online Dating'}]",5214d2ac-61f1-11e8-8bb1-0ed15e4a39c0,Tinder/Online Dating,dark,richtext,False,False,True,0,0,False,all_ads,/r/dating/comments/nowjh5/seeking_a_serious_partner/,False,6,moderator,1622447281,1,True,False,False,dating,t5_2qhb1,806696,public,self,Seeking a serious partner,0,[],1.0,https://www.reddit.com/r/dating/comments/nowjh5/seeking_a_serious_partner/,all_ads,6,[],text,t2_cfasde0u,False,False,[removed],,
10,[],False,nemxxmi,,,,,[],,False,False,1622442959,self.dating,https://www.reddit.com/r/dating/comments/nowtey/i_want_to_meet_new_people/,{},nowtey,True,False,False,False,True,True,False,,,"[{'e': 'text', 't': 'Tinder/Online Dating'}]",5214d2ac-61f1-11e8-8bb1-0ed15e4a39c0,Tinder/Online Dating,dark,richtext,False,False,True,3,0,False,all_ads,/r/dating/comments/nowtey/i_want_to_meet_new_people/,False,6,,1622448175,0,True,False,False,dating,t5_2qhb1,806718,public,self,I want to meet new people,0,[],0.5,https://www.reddit.com/r/dating/comments/nowtey/i_want_to_meet_new_people/,all_ads,6,[],text,t2_6qavrhb9,False,False,"So I live in a third world country, and my prospects here are 0 to none. I’d love to meet some new interesting people that are more on my wavelength. Doing the unthinkable and leaving my Snapchat handle here ahaha - feel free to text :) @neshi_lee",,
11,[],False,SimpLord332,,,,,[],,False,False,1622443057,self.dating,https://www.reddit.com/r/dating/comments/nowuc3/i_wanna_know_whether_i_can_turn_a_rejection/,{},nowuc3,False,False,False,False,False,True,False,,dating,"[{'e': 'text', 't': 'I Need Advice'}]",19ec58c2-9f74-11e7-81a1-0e2bf15991f0,I Need Advice,dark,richtext,False,False,True,0,0,False,all_ads,/r/dating/comments/nowuc3/i_wanna_know_whether_i_can_turn_a_rejection/,False,6,moderator,1622448258,1,True,False,False,dating,t5_2qhb1,806718,public,self,I wanna know whether I can turn a rejection around or not(17M 17F),0,[],1.0,https://www.reddit.com/r/dating/comments/nowuc3/i_wanna_know_whether_i_can_turn_a_rejection/,all_ads,6,[],text,t2_cfq8mfqu,False,False,[removed],,
12,[],False,MillionaireMatchapp,,,,,[],,False,False,1622444779,self.dating,https://www.reddit.com/r/dating/comments/nox9vl/how_to_deal_with_being_rejected/,{},nox9vl,True,False,False,False,True,True,False,,dating,"[{'e': 'text', 't': 'Giving Advice'}]",7bca2c58-4211-11e5-9ecb-0e60d8112001,Giving Advice,dark,richtext,False,False,False,7,0,False,all_ads,/r/dating/comments/nox9vl/how_to_deal_with_being_rejected/,False,6,,1622449695,6,True,False,False,dating,t5_2qhb1,806742,public,self,How to Deal with Being Rejected？,0,[],1.0,https://www.reddit.com/r/dating/comments/nox9vl/how_to_deal_with_being_rejected/,all_ads,6,[],text,t2_c2akjruv,False,False,"Learning to handle rejection is all part and parcel of becoming a more confident individual. Having this attribute will go a long way in increasing your success rates with women and moving on from rough breakups. These 7 tips will guarantee that you’ll bounce back from rejection.no matter how much your self-esteem is damaged or the extent of your heartbreaks.

\#1 Allocate a period for grieving  
This is better known as an immediate remedy. Set a maximum timeframe for you to wallow in your state of despond, but have the discipline to ensure that you won’t think about it once the deadline comes.

\#2 Keep yourself surrounded with friends  
Humans are social creatures, and being immersed into social settings will allow youto keep your mind off things. The less you think about it, the higher your chances are of picking yourself up.

\#3 Accept the fact that you got rejected  
Once all’s been said and done, the fact of the matter is that you were rejected. There’s no better way to phrase it, and there’s no point telling it any other way. Don’t spend your days wondering what could have been or what you did wrong, and just accept it for what it is.

\#4 Don’t take it personally  
This is probably the hardest tip to follow, but it’ll come in time. Don’t blame yourself for what happened, because what’s not meant to be won’t be. Instead, take it as an opportunity for you to grow stronger.

\#5 Find a new hobby  
You’re going to spend a lot of time lying in bed with your mind clawing relentless at you about the rejection. You need to occupy yourself at home when you’re all by yourself. Getting a new video game works, or even learning an instrument.

\#6 Let nature take its course  
Once enough time has passed, you’ll come to realize that certain things just aren’t within your control. Admit that in certain situations, you have to let nature take its course and you can’t force someone to accept you.

\#7 Keep your chin up and move forward  
This is the part where you can finally let go of your internal suffering. Keep your head high and stride forward with nothing but pride, because you finally got over your rejection and it’s time for you to move on. You’ve learned valuable lessons that have made you become a better person, and you can now move on and focus your energy on tackling something or someone else.",,
13,[],False,fractilian,,,,,[],,False,False,1622446084,self.dating,https://www.reddit.com/r/dating/comments/noxku4/did_i_just_get_haunted_by_a_ghost/,{},noxku4,True,False,False,False,True,True,False,,dating,"[{'e': 'text', 't': 'I Need Advice'}]",19ec58c2-9f74-11e7-81a1-0e2bf15991f0,I Need Advice,dark,richtext,False,False,True,2,0,False,all_ads,/r/dating/comments/noxku4/did_i_just_get_haunted_by_a_ghost/,False,6,,1622450724,1,True,False,False,dating,t5_2qhb1,806763,public,self,Did I just get haunted by a ghost?,0,[],1.0,https://www.reddit.com/r/dating/comments/noxku4/did_i_just_get_haunted_by_a_ghost/,all_ads,6,[],text,t2_vfyuf,False,False,"Went to my friends hookah lounge upon full reopening, since pandemic mandates have been lifted. Was invited to sit at a table with this girl and her friend. After hours of amazing connecting and incredible open communication getting to know each other my friend and the ladies came back to hang out. With no intention of “getting some” She asked if she could kiss me and I obviously said yes. 

One thing led to another and we hooked up. Shortly after she went home and we exchanged a couple texts and after asking if she’d be down for a date (not a hookup) the texting ended. It’s been a couple days unreplied, did I just get haunted by my first ghost? Communication earlier on led me to believe we both acknowledged neither of us are a one night stand type. 

I feel like if you are not looking for a hookup they cause more damage than good for the person who I looking for something deeper. Really sucks.",,
14,[],False,PrettyMorgan,,,,,[],,False,False,1622446765,self.dating,https://www.reddit.com/r/dating/comments/noxqn5/f28/,{},noxqn5,False,False,False,False,False,True,False,,dating,"[{'e': 'text', 't': 'I Need Advice'}]",19ec58c2-9f74-11e7-81a1-0e2bf15991f0,I Need Advice,dark,richtext,False,False,True,15,0,True,all_ads,/r/dating/comments/noxqn5/f28/,False,6,moderator,1622451270,0,True,False,False,dating,t5_2qhb1,806772,public,nsfw,F28,0,[],0.5,https://www.reddit.com/r/dating/comments/noxqn5/f28/,promo_adult_nsfw,3,[],text,t2_c5js1e4v,False,False,[removed],,
15,[],False,AussieDatingDrama,,,,,[],,False,False,1622447338,self.dating,https://www.reddit.com/r/dating/comments/noxvn3/why_do_people_use_tinder_in_australia/,{},noxvn3,True,False,False,False,True,True,False,,,"[{'e': 'text', 't': 'Tinder/Online Dating'}]",5214d2ac-61f1-11e8-8bb1-0ed15e4a39c0,Tinder/Online Dating,dark,richtext,False,False,True,12,0,False,all_ads,/r/dating/comments/noxvn3/why_do_people_use_tinder_in_australia/,False,6,,1622451739,2,True,False,False,dating,t5_2qhb1,806778,public,self,Why do people use Tinder in Australia?,0,[],1.0,https://www.reddit.com/r/dating/comments/noxvn3/why_do_people_use_tinder_in_australia/,all_ads,6,[],text,t2_aocnf5v3,False,False,"Hi all, I am an honours student completing my research thesis on Motives of Tinder Users in Australia.    
If you are in Australia, 18+ and use (or have used) Tinder, you are invited to complete a research survey by the University of the Sunshine Coast. It should take less than 10 minutes to complete. \*Admin has approved this post. For more information or to participate go to:  

 [https://uniofsunshinecoast.syd1.qualtrics.com/jfe/form/SV\_bjZ4Cu8Mv8LfeLQ](https://uniofsunshinecoast.syd1.qualtrics.com/jfe/form/SV_bjZ4Cu8Mv8LfeLQ)",,
16,[],False,Throwaway7087MP96,,,,,[],,False,False,1622448086,self.dating,https://www.reddit.com/r/dating/comments/noy25b/seeking_advice_for_asking_to_meet_up/,{},noy25b,False,False,False,False,False,True,False,,dating,"[{'e': 'text', 't': 'I Need Advice'}]",19ec58c2-9f74-11e7-81a1-0e2bf15991f0,I Need Advice,dark,richtext,False,False,True,0,0,False,all_ads,/r/dating/comments/noy25b/seeking_advice_for_asking_to_meet_up/,False,6,moderator,1622452362,1,True,False,False,dating,t5_2qhb1,806791,public,self,Seeking Advice for asking to meet up,0,[],1.0,https://www.reddit.com/r/dating/comments/noy25b/seeking_advice_for_asking_to_meet_up/,all_ads,6,[],text,t2_cfsa8bl2,False,False,[removed],,
