,id,created_utc,title,selftext,subreddit,subreddit_id,url
57,rshjsk,1640913202,Do women on some level enjoy hurting men they don’t find attractive?,"I only started trying to date when I got into college and in the past 2 years every rejection has been crushing. 

I don’t find rejection in and of itself crushing it just girls seem to be so mean about it for no reason. 

Like I’ve been at a party and just start talking to a girl I was near and she cut me off as I was introducing myself to tell me I was “beneath her”. 

Another girl I met in class laughed in my face when I asked for her number. 

I’ve had a girl say “ew bye” when I start speaking. 

There’s been a few more pretty harsh ones and it feels like some girls just get a kick out of being mean. Like if they had just said that they weren’t interested I’d move on. But it’s like they’re taking the chance to get to be mean.

I know I shouldn’t let other peoples words make me feel this bad, but it’s hard to keep my confidence up when a girl’s reaction to me speaking to her is, “ew bye”.

Is rejection supposed to be like this? Is this just how girls are?",dating,t5_2qhb1,https://www.reddit.com/r/dating/comments/rshjsk/do_women_on_some_level_enjoy_hurting_men_they/
58,rshl4a,1640913318,When is a good timeline to make a relationship official?,This might sound like a highschoolish type question I just want some outside perspective on this. I've been seeing this girl for close to a month now and I like her alot and she seems to feel similarly. I'm totally down to make it official on my side but I dont wanna risk coming off too strong to her.,dating,t5_2qhb1,https://www.reddit.com/r/dating/comments/rshl4a/when_is_a_good_timeline_to_make_a_relationship/
59,rsi5km,1640914935,Christmas,"Hey so this (25) male and (25) female decided to visit the females parents for 8 days(From Christmas to January 2). This is the first time the male is meeting the entire family but has met the mom on a previous occasion. The male is a Black male and the female is a White woman. Basically what happened is the mother of the female decided it would be funny to make fun of the way a Black character on TV was talking. The couple pointed it out and said it wasn’t cool but the mother didn’t understand what the issue was and tried to deflect. She said if Black people can do it than why can’t and other forms of deflecting. Even though the mother apologized, she clearly didn’t genuinely mean the apology or at least understand why she needed to. This all happened on day 4 of being there and it has been tense in the house since. By day five the female decided that it would be better if the male left. The male then wanted to see if he could fix the relationship with the mom. The female insisted that the male just go home early so she can think about their relationship and how it can work long term. The male is confused because he was the one who was offended in all of this. Is this a reason for the male to break up with the female. The male feels like if the female doesn’t loves him like she says she does because she would not leave with him to spend New Years with him.",dating,t5_2qhb1,https://www.reddit.com/r/dating/comments/rsi5km/christmas/
60,rsi5w4,1640914964,What dating apps do you have the most and least success with?,"Tinder probably gives me the most matches with 2-3 a week but most of those convos barely even start. 

I find that on Hinge I have the most interactions/engagement because it allows us to bond over our personalities. So I’m that way I’d probably say Hinge is my most successful app since it feels the most human.

Meanwhile, I get hardly any matches on Bumble. But the two matches I have had where the girls started a convo (I’ve had quite a few match and then just time out) both resulted in dates. Bumble just isn’t having enough engagement with me for me to keep it though.

What has been your experiences with these dating apps?",dating,t5_2qhb1,https://www.reddit.com/r/dating/comments/rsi5w4/what_dating_apps_do_you_have_the_most_and_least/
61,rsi7w8,1640915135,I’ve been hitting all these hoes but nun of them dating me,[removed],dating,t5_2qhb1,https://www.reddit.com/r/dating/comments/rsi7w8/ive_been_hitting_all_these_hoes_but_nun_of_them/
62,rsidul,1640915641,Can a short and bald guy still be physically attractive to women?, I'm 5'6 and pretty much bald. I like to think I'm still decent looking because I have a decent amount of muscle and think my face is still not bad looking. Am I just coping? Can a short and bald guy still be physically attractive to women based purely on looks?,dating,t5_2qhb1,https://www.reddit.com/r/dating/comments/rsidul/can_a_short_and_bald_guy_still_be_physically/
63,rsies9,1640915719,Is not “feeling well” a good enough reason to cancel a meet up,"I’m so close of blocking him because this is not the first time that this has happened. I was about to hook up with this guy. About two hours before our scheduled meet up, I asked him how he was feeling (just wanted to check if he had covid symptoms). He didn’t reply. Twenty minutes before, I asked if I should change. He replied, “No. I’m not feeling well.” Is said,”was it so hard to text me an hour ago?.” He replied, “I haven’t been feeing well. Sorry.” I said, “is it covid? do you need a rapid test.” He replied, “No, I don’t think so.” This is when I started feeling like it’s just another way to bail out on me. Previously, he’s used a variety of ways. I just want to block him but I can’t help but think what if he’s seriously not feeling well.",dating,t5_2qhb1,https://www.reddit.com/r/dating/comments/rsies9/is_not_feeling_well_a_good_enough_reason_to/
64,rsiri1,1640916743,Toxic to untoxic?,"I have been doing a lot of thinking about toxic dating and relationships and am wondering if any of you believe you can turn a severely toxic situation into something healthy? And what would it take?

I ask because I don’t believe I’ve ever heard of anything happening. If anyone has any first hand experience with this, I’d love to hear?",dating,t5_2qhb1,https://www.reddit.com/r/dating/comments/rsiri1/toxic_to_untoxic/
65,rsiu3k,1640916967,What text would make you reconsider seeing someone that previously ghosted you?,"As the tin says, but if not a text, would they have to do something else?",dating,t5_2qhb1,https://www.reddit.com/r/dating/comments/rsiu3k/what_text_would_make_you_reconsider_seeing/
66,rsiyfc,1640917335,Who is right? Is my friend a cockblock?,[removed],dating,t5_2qhb1,https://www.reddit.com/r/dating/comments/rsiyfc/who_is_right_is_my_friend_a_cockblock/
67,rsizz3,1640917460,Was my friend a cockblock?,[removed],dating,t5_2qhb1,https://www.reddit.com/r/dating/comments/rsizz3/was_my_friend_a_cockblock/
68,rsj4uz,1640917867,Adress sex subject early on,"Me (M32) started dating a girl (F32) more or less 2 weeks ago, and we met by online dating.
We had the first date 2 weeks ago, just a drink at a bar. The connection was huge, but things didn't do any further that night. 
We kept texting alot after that that, and we started having deeper conversations, and is obvious that we start having feeling for each other, so not just a casual hookup (which was never a option for either).
After a week of texting, we had 2 other dates this week. 
The first a drink at my place, the next day a walk by the city, followed by dinner and drinks at my place.
Those two moments at my place lead to the beghinning of physical contact, with kissing, cuddling, and alot of touching (not sexually). 
So, those two times, in the heat of the moment, I tryed to go further. The first day, at a moment were my intention were clear, she asked if we can go slower, and I said ofc, and stoped. The next day, in the same situation, she asked me to calm down a bit, and I did. After both those moments we kept kissing, cuddling and caressing each other, with alot of feeling involved. 
We never talked openly about sex, but after those two moments, and using euphemisms, she said that is a matter of time. 
That said, I totally understant the ""taking things slower"", and not beeing ready to have sex, even when we'r at moment were everything points to that.
The ""problem"" is that I'm a very sexual person, with a big libido, and I'm kinda getting scared of she not beeing like that, which could be a problem on the long run, regarding compatibility. 
Also, after those two moments I'm affraid of trying anything again, since I don't want to have more of those ""stops"", or look pushy. 
So I don't really know what to do... Should I openly talk about sex with her, so early in the realtionship, and considering it's a never touched theme until now? Should I just wait to see? That scares me, that we reach the time of having sex, just to find out that we'r not on the same page, or don't have the same needs, I don't want to do that to her. 
This is grinding my mind, and I feel that this is already starting affecting my connection with her 😕",dating,t5_2qhb1,https://www.reddit.com/r/dating/comments/rsj4uz/adress_sex_subject_early_on/
69,rsj7ki,1640918086,Where do people in their late 30s find a match anymore?,Being single and 39 sucks. I don't do bars. Where do I meet someone,dating,t5_2qhb1,https://www.reddit.com/r/dating/comments/rsj7ki/where_do_people_in_their_late_30s_find_a_match/
70,rsjbv1,1640918450,Am I being illogical for not wanting to date man whores?,[removed],dating,t5_2qhb1,https://www.reddit.com/r/dating/comments/rsjbv1/am_i_being_illogical_for_not_wanting_to_date_man/
71,rsjbvk,1640918451,Yellow or Red flags?,"I (32m) met her (28f) on okcupid. She is cool. I've met with her 3 times. She lives with her parents which would be fine but she doesn't have access to the car...seemingly ever. I picked her up last time in front of her house and she told me to drive away quickly before her parents saw and then drop her off a few houses down. Also cut our date short because her parents were on her about staying home.
She said it's because she just doesn't like her parents in her business. 
Seems like a red flag in my head. What do you all think?",dating,t5_2qhb1,https://www.reddit.com/r/dating/comments/rsjbvk/yellow_or_red_flags/
72,rsjfis,1640918765,Best way to disclose cold sores?!,"I’m 20(M) in college! Recently starting getting cold sores after an initial outbreak earlier this semester. I don’t really mind them, but I know the virus is easy to spread and I want to do my best to let every future partner or fling I have know about it, but preferably in the most calm, easy, and educated manner possible. My question is if anyone’s had experiences with someone who disclosed cold sores, were you accepting and how did they do it well? Or anyone who has successfully disclosed cold sores to a partner, how did you go about doing it? Any advice would be amazing!",dating,t5_2qhb1,https://www.reddit.com/r/dating/comments/rsjfis/best_way_to_disclose_cold_sores/
73,rsjgzo,1640918894,Did I exaggerate by blocking him right away? Advice please :(,"I was supposed to meet up with my fwb, who I have seen only three times over the past year, mainly due to him cancelling all the time. About two hours before our scheduled meet up, I asked him how he was feeling (just wanted to check if he had covid symptoms). He didn’t reply. Twenty minutes before, I asked if I should start getting ready. He finally replied with, “No. I’m not feeling well.” Here's how the conversation went, 

Me: ”was it so hard to text me an hour ago?.”

Him: “I haven’t been feeing well. Sorry.” 

Me: “is it covid? do you need a rapid test?” 

Him: “No, I don’t think so.” 

Me: ""Does it boost your ego to get me to say yes and then bail on me?""

Him: ""Wtf. No.""

This is when I started feeling like it’s just another way to bail out on me. Previously, he’s used a variety of ways. Out of anger, I blocked him right away but I can’t stop feeling bad and wondering what if he's really sick. The cases of omicron are really increasing where I live and I really like him but I just couldn't handle him bailing on me again. He seemed really excited when we were planning it on Tuesday. Did I do the right thing? Should I add him back? I really don't know what to do ;(",dating,t5_2qhb1,https://www.reddit.com/r/dating/comments/rsjgzo/did_i_exaggerate_by_blocking_him_right_away/
74,rsjn4a,1640919412,rumors ruined potential relationship,"I’ll make it quick, since high school i’ve shortened my circle to people I can trust with anything I tell them. I’ve been continuously improving myself mentally and physically on a daily basis and I am proud of myself. Recently i’ve been talking to this girl that I developed some interest in and things didn’t work out for the stupidest reason. Someone I haven’t talked to in over 4+ years told her I was weird, it gave her the icks and backed off and started talking to someone else. I understand this was an emotionally immature thing to do on her part. However it makes me so livid that someone can be so bitter to say something like that. Due to past girls I took things slow and now it turns out i was too slow. How do I get over being mad I lost a potential girl from something out of my control.",dating,t5_2qhb1,https://www.reddit.com/r/dating/comments/rsjn4a/rumors_ruined_potential_relationship/
75,rsjpcr,1640919602,Is it weird that the only men who have ever asked me out have been strangers/near strangers?,"One guy asked me out who had been in a uni class with me the previous semester, but other than that the only men who have ever asked me out are men I’ve spoken to for less than 15 minutes.

I’ve definitely been attracted to men I went to school with or worked with but nothing ever came of it",dating,t5_2qhb1,https://www.reddit.com/r/dating/comments/rsjpcr/is_it_weird_that_the_only_men_who_have_ever_asked/
76,rsjt2g,1640919914,My ex [21F] broke up with me [23M] but wants to get back together with me. Wondering how to navigate this and make this work,"My ex broke up with me earlier this summer in July due to negative actions and behaviors I exhibited during the course of our relationship leading up to her choosing to break up with me. Prior to us breaking up, we had lived together in a shared apartment and had a very close and strong relationship. We both were deeply in love and behaved akin to a married couple, and she was very much in love with me.

That summer, she accepted an offer to an internship and I had mentally spiraled again, and she could no longer deal with the situation as it had deeply hurt her. It was not an amicable breakup in any sense, but was necessary and I recognize and understand why we broke up as I had done a lot to hurt our relationship. We kept in contact somewhat, especially given our shared space, and she had been consistent from the start about wanting us to be together again in the future.

Since this all happened, I have been serious about fixing my flaws as a person and in our relationship, and making the serious relationship we had before work with all of the experience I have gained since. A week ago, I found out she would be returning from the internship sooner than she was originally supposed to due to being fired. This was her dream job, so she has taken this hard and of course isn’t as enthusiastic or jumping right back into things. Since then, she has come back and is living temporarily with her family even though her things are still here, but does seem to want to live here again. She is firm about us getting back together, but that we need to take things slowly and she needs to figure out how we will proceed together to make things work. I’m autistic, and I am working to understand what she means but I do get what she is saying. I know this is normal when exes attempt to get back together, but it feels weird to imagine us not being serious or who we were before. I don’t know what we can do to make things like they were before when it comes to the love we shared and us living together, and I told her I could only feel comfortable with us not living together short term as we had lived together for nearly two years and I had moved down here so that we could live together and start our lives as a couple. I even was very close with her family, and temporarily lived with them.

What do we do now? What can I do to show her that I want to make this work and that I understand her? She is serious about wanting us make this work, but how can we proceed naturally and what would I be able to do to best maximize our chances of living together and getting closer to what we were before sooner rather than later? How can I best show her I’ve changed and that I am serious when it comes to everything?

TL;DR — ex and I broke up in July due to issues in our relationship, she came back to the area sooner than expected and we are now trying to make things work, but she wants to take things slowly.",dating,t5_2qhb1,https://www.reddit.com/r/dating/comments/rsjt2g/my_ex_21f_broke_up_with_me_23m_but_wants_to_get/
77,rsjtwm,1640919986,Question for ladies. Well gentlemen can answer too.,Ladies if you have a postgraduate degree would you date someone without a college degree/undergraduate/sixth form? Or is it a dealbreaker?,dating,t5_2qhb1,https://www.reddit.com/r/dating/comments/rsjtwm/question_for_ladies_well_gentlemen_can_answer_too/
78,rsk22o,1640920678,How to handle bad kisser,"I (39F) have been on 4 dates with a guy (42M) I met off a dating app. We talked for a couple weeks before we were able to meet up and each date we've progressively spent more time together, the 4th date lasting 8 hours. I'm physically attracted to him and we seem to have the same values and some similar interests. I sense some insecurity on his end and we both have expressed our desire to take things slow. On the 3rd date he kissed me and it was probably the worst kiss I've ever had. He was very stiff and when he pulled back, I must have made a face and we tried again but it was still not good. At the end of the 4th date we tried again and it was basically the same. He was pretty extroverted our first date but from the 2nd date on, he's been less confident. He has said he gets nervous and stiff around women he likes and hasn't dated allot, but has had a couple longterm relationships. I'm not sure if I should just cut things off, or if I'm being hasty because my relationships in the past have clicked sexually right away and obviously those didn't work out. How should I proceed to best get what I want and be kind to this good man?",dating,t5_2qhb1,https://www.reddit.com/r/dating/comments/rsk22o/how_to_handle_bad_kisser/
79,rsk52c,1640920949,Am I just overthinking it?,"I (20F) been seeing this guy (M31) for a few weeks now. We hung out the 5th time last night where he told me he liked me. He met my cousin (not planned) and everything went well. I haven’t heard from him today, which isn’t weird but usually I’d get a snap picture by now. Is this just an age difference thing? When should I start to worry? HELP!!",dating,t5_2qhb1,https://www.reddit.com/r/dating/comments/rsk52c/am_i_just_overthinking_it/
80,rskd8x,1640921662,Moving out soon but thinking of doing this before dad goes back abroad? Does it seem ok?,"Me [29M] and my GF [27F] have been dating for nearly 1 year. We live 2.5 hours away from each other and are going to be moving in together and renting in a flat next week.

The new flat will be 2 hours away from her current house, and 1 hour away from my place.

The job my gf is getting, she’s been trying for a very long time to get it, and got it in the city I’m living in, hence where the idea of renting and living in together came from. My situation at home is already complicated, so having the discussion of moving out with her was stressful but as it’s an opportunity she doesn’t want to lose out on, I sort of said I’ll move out with her as we are also a couple.

I’m the only child and me and my mum have lived together since I was born. She’s always been there for me and raised me up. My dad who currently lives with us, only just came back from living abroad 2 months ago. He’s going to return back abroad at the end of January, which will leave my mum alone. He’s not lived with us for around 6-7 years as they’ve separated.

My dad is early 70s and mum is early 60s.
My GFs dad is early 50s and her mum is early 40s. There is a big age difference I know which puts me at a disadvantage.

Now that I’m moving out very soon (in 3 days), today my close friend said to me if it was him, he wouldn’t move until February and he’d spend as much time as he can with dad before he goes back. Now I’m reevaluating all this. My GF won’t be happy as she really loves me and is very excited to move in and start this on another level of living together.

I didn’t really want to move out in the first place, but compromised as I originally jokingly hinted at my GF finding a job in my city, and moving here so we can live together, she took it serious and after months of interviews she got the job which starts next week.
It’s the job she’s been trying hard to get. We were originally planning to buy a house together but I realise it was a BIG NO as we were only together for 10 months! She refused to rent as she says it’s a waste of money, but I managed to convince her and we are going to rent now.

But as my parents are getting old and weaker, and I’m the only child, my mum doesn’t want me to move out as she’ll be lonely and she says I’ll only have one mother. It makes me sad when she talks like this.
This made my decision really hard to move out, I don’t want to but feel because I originally hinted at the idea to my GF, and it’s become a situation where I’ve made her feel hurt for changing my mind all the time, I felt I had to rent.

What should I do?

If I stay 5 nights here and 2 nights at the new flat for the next month, does it seem like it will be a problem for my GF? If she’s moving up here and I’m hardly there.b",dating,t5_2qhb1,https://www.reddit.com/r/dating/comments/rskd8x/moving_out_soon_but_thinking_of_doing_this_before/
81,rskdpn,1640921704,When will she (22F) realize I (39M) am not in love with her anymore?,"My wife of 4 years has not been the same woman I met back then. She has gained weight and has gotten entirely too ambitious making me feel emasculated. She says she wants a career and has all these ideas and I feel like I am left out of the equation. I feel like she should be more submissive like any proper lady would be. I became scared that she would try to compete with me or something, so I started seeing her cousin and she found out. She has lost her mind and now wants a divorce and full custody of my children, who does she think she is!?!??",dating,t5_2qhb1,https://www.reddit.com/r/dating/comments/rskdpn/when_will_she_22f_realize_i_39m_am_not_in_love/
82,rskebx,1640921758,Modern dating,"So male in his mid 30's here.    Early 2021 I came out of a decade long relationship.      I thought it would go the whole way but unfortunately it didn't.  

Took a little time for myself and started dating again.    I quickly found a women I clicked with.   We fell for eachother pretty fast.   

Things we starting to get serious and then her insecurities and mental issues blew up the relationship.  

So I'm single again. 

I'm finding its incredibly easy to pick to women and it's incredibly easy to have sex with different women.    Like super easy.   

I'm finding women are more aggressive hitting on me in real life too.  


Sounds great yeah?   Well NO!!!!  

Yeah sex is cool.   But I'm not looking for hook ups.   I'm looking for a long term relationship.   You know settle down.   


I'm finishing an epidemic of avoidant women, terrible communicators,   lots of women preach they don't need a man, then admit they are terrible at relationships / don't know how to be in one.  


What's gone on with the world?   I don't want to be juggling a load of women having casual relationships. 


I want something stable, long term with a women that is secure in a relationship.     To be honest I know I can have attractive women but it's not a deal breaker for me. 

Personally is key for me.  

Looks don't even matter to me.   I would happily date a women that wasn't considered conventualy attractive as long as the personality connection was there. 

When I connect everything about a women becomes attractive, and they become so beautiful to me. 


Anyways...   

I keep finding attractive women who just want casual with me, the women not so attractive have super crazy high self esteem issues.   

All I'm finding are fearful avoided types (seems to be the default) and I cannot stand fearful avoids disfunctional daring style. 

I'm secure, would like to date secure women or even on the anxious side of things.    

I say I don't mind anxious because my stability and personally usualy makes these types edge towards secure.   Plus anxious are open to communication. 


I don't like avoidants because I find they are terrible partners, that run from everything and are scared to communicate.   

I have no time or energy for that.",dating,t5_2qhb1,https://www.reddit.com/r/dating/comments/rskebx/modern_dating/
83,rskeii,1640921776,Where do I go?,Hi so i am an 18 M looking to jump into the dating game and I guess what I'm trying to say where is the best place to start wither it be a subreddit website or what ever I'm genuinely curious,dating,t5_2qhb1,https://www.reddit.com/r/dating/comments/rskeii/where_do_i_go/
