,id,created_utc,title,selftext,subreddit,subreddit_id,url
32,pa1jq4,1629730789,"There’s something deeply agonisingly about knowing, because of being average, you can’t reasonably count on getting a beautiful partner in life.","
I’m sitting here thinking 

The societal expectation is “stay within your lane”, don’t feel entitled to a supermodel, because supermodels mostly date other supermodels

“Get realistic expectations of a partner, and you’ll be happier” 

Etc etc. 


Just get someone less attractive but with a great personality, and learn to love them for who they are, as we would hope they love us for who we are 


Now, I don’t feel entitled by any means to a supermodel nor do I particularly want one right now. 

But I wanna play devils advocate and say, don’t you think there is something deeply disconcerting and despairing about this sense of absolute finality in sex and relationships? 

At least for me, it’s like a caste system we all just unconsciously accept. Models are the upper cast, then there’s average, below average castes, etc. We know it’s probably a good idea to “date in your league” to avoid disappointment 

I think we all know that the higher the “caste” of attractiveness you are, the more life opportunities and pleasures present themselves to you. Some superficial, others quite deeply enriching. And as a supermodel “caste”, it’s just accepted, and perfectly natural, that sex, dating and relationships with other beautiful people *just happen* organically 




I guess what I’m trying to say here is that, this unofficial, universally accepted heirarchy of looks we disappoints me, and only because I’m a loser in the heirarchy. Should I ever dream of dating a higher caste, I’ll be screamed down as a pig or all manner of belligerent insult 

To me beauty is a wonderful thing, and to wake up every day knowing that I’m effectively forbidden since birth. from easily accessing the world of beautiful people’s dating, hurts my soul.",dating,t5_2qhb1,https://www.reddit.com/r/dating/comments/pa1jq4/theres_something_deeply_agonisingly_about_knowing/
33,pa1p99,1629731216,How do I end this cycle?," I need advice or encouragement, anything really…

I keep on finding myself in this same cycle, I start seeing a guy we date for a couple of weeks, months. I set boundaries they tell me they are not looking for a relationship then weeks later they pop up on social media with a girlfriend.  

I’m so discouraged and can’t help but think that something is wrong with me as if I am not enough. This exact same scenario has happened to me TWICE with two different guys within the past six months-year. 

WHAT AM I DOING WRONG?!?!",dating,t5_2qhb1,https://www.reddit.com/r/dating/comments/pa1p99/how_do_i_end_this_cycle/
34,pa1xl4,1629731899,Advice,"This girl asked me out and I have hung out with her twice. My parents have zero idea about this and everytime we hang out I like sneak away and try to pretend i am going to the gym or smth. 

So I got 2 choices.
1. Just tell her it’s over
2. Tell my parents I am hanging out with this girl.

I have a feeling most people will recommend 2, but how. How do I tell my parents?
I can’t just not tell them since both times there was a close call to them finding out, eventually they definitely will.",dating,t5_2qhb1,https://www.reddit.com/r/dating/comments/pa1xl4/advice/
35,pa21hk,1629732213,How do you stay motivated when using dating apps?," 

I have tried dating apps on and off a few years (I am a straight female). I typically use bumble and hinge. I want a relationship, but it has seemed impossible to find someone who I feel attracted to, can have good conversation with, and is interested in me and willing to be in a relationship.

Here's a recent example. I matched with a guy on bumble, we texted for about two weeks. We had pretty good text conversations and then met up for drinks and ended up spending about 3 hours. The conversation was very easy, we had a decent amount of stuff in common. I could tell he wasn't someone just seeking a hook-up. When we parted he told me to text him to let him know that I got home okay. I text him later to let him know and he tells me he had a good time. I say me too and ask do you want to meet up again sometime. He messages me the following afternoon saying nice things about my looks and my intelligence, that the conversation was good, but that he feels no spark. It's not me it's him, apologizing etc. I then notice that he deleted his bumble account too.

Living up to someones expectation that you should have a spark after meeting off an app for the first time is a really high bar to meet and somewhat unrealistic IMO, but I don't want to focus on that too much as that is one person. I don't want to seem like I am letting one experience affect how I feel. For me it is a combination of poor experiences. I've used these apps for a while now off and on and it rarely leads to anything positive. I always seem to encounter two common situations: guys looking for a hookup/very casual situation (I often don't meet up in person with these matches, as I can more easily discern that it is not a good fit) or guys who seem normal, nice, select that they would be open to a relationship on an app and act interested but then kind of flip on you later. Basically, even the guys on the apps who indicate they would be open to a relationship often don't seem to be in the end.

I know people say to not take any of this app dating too seriously or be too hard on yourself but as a human it takes a toll sometimes and things can bother you whether you want them to or not. However, meeting someone naturally in real life is really unlikely in my current situation, so the apps seem to be the tool I have to keep using. The problem is that I increasingly get the feeling that maybe the people out there for me, if they exist, are not on the apps and I'll just never meet them.

Have any of you encountered similar challenges? How do you stay motivated to keep using the apps/meet up with more people and maintain a positive mindset?",dating,t5_2qhb1,https://www.reddit.com/r/dating/comments/pa21hk/how_do_you_stay_motivated_when_using_dating_apps/
36,pa23vj,1629732409,Is this guys using me to look better in dating?,"I (26m) have childhood friend. She (24f) been dating a guy. Us 3 have been hanging out a lot. Every time he has to find ways to attack me with insults disguised as jokes. He seems to enjoy putting people down to look better. 
I called him out privately but he didn’t stop. 

Should I just cut ties with both of them?",dating,t5_2qhb1,https://www.reddit.com/r/dating/comments/pa23vj/is_this_guys_using_me_to_look_better_in_dating/
37,pa2ad8,1629732938,Met on Christian Mingle,"We met on Christian mingle a month ago.

We have started talking on Christian mingle.

Week 2 we started talking on the phone and quickly started talking on Zoom.  We started talking for hours.

He has not asked me on a date and I have asked him.

He told me he has been pretty sick. 

He is sick I have seen him at home coughing really bad.

He keeps telling me in due time when he finally gets better we will meet. 

I’m willing to wait, but now our conversations are feeling forced.  It used to flow due to excitement. 

Now we talk like a boring couple.  How’s your day nonsense.  

How long is too long to wait to go on a date?  Should I move on? 

I’m starting to doubt this. I’ve dated people when I was sick. I know it’s covid time and I want to be safe. But I feel like I’m being strung along for some reason.  My intuition is making me rethink this.

I found myself putting him on a pedestal then I got frustrated because he was just constantly texting me and it was nonsense conversations. All day long talking isn’t a quality conversation .

I’m not waiting for him to text.  I’m going on with my day.

I just don’t want to waste time investing my hope in him. 
I like him.  But not meeting is making it seem like a pipe dream",dating,t5_2qhb1,https://www.reddit.com/r/dating/comments/pa2ad8/met_on_christian_mingle/
38,pa2bn7,1629733049,Dating a guy who wants to wait for marriage— help?,"So— I am a 26(f) and I work with an 18(m) who is truly such a gentleman who likes me. 
We both are college students, I am studying medicine and he is studying to be an anesthesiologist— well, anyways— he wants to wait to have sex until marriage. 
Well, with me being 26 I am no rookie to this. I clearly have had experience in having a sex life and he knows that. 
I asked him what the boundaries were when it comes to all of that because I truly do not want to make him feel uncomfortable.. and he said kissing is fine obviously and touching with consent. 


What the hell does touching with consent mean? 
Can someone who may be a virgin elaborate? Lol 

Also, I know there’s an age gap. But he truly is a sweet guy.",dating,t5_2qhb1,https://www.reddit.com/r/dating/comments/pa2bn7/dating_a_guy_who_wants_to_wait_for_marriage_help/
39,pa2dpo,1629733226,Dating and DUI?,"So i met this really cool girl.  (1 month of talking) 3 dates in &amp; were feeling each other. Like a match made in heaven type. Thing is, i got a dui &amp; have interlock device installed. Should i tell her now that ive gotten a dui before things might get serious?",dating,t5_2qhb1,https://www.reddit.com/r/dating/comments/pa2dpo/dating_and_dui/
40,pa2f3z,1629733343,Your treatment of the female species makes me sick,Can someone please give me a funny response to someone who wants to pay me to go out with them? What the actual fuck is wrong with men.,dating,t5_2qhb1,https://www.reddit.com/r/dating/comments/pa2f3z/your_treatment_of_the_female_species_makes_me_sick/
41,pa2ftd,1629733403,I am confused,"I (m19) met a girl (f19) at a meeting for freshmen at our college. We hit it off and had sex several times the following 2 days. Throughout that she told me several times that she likes me and wanted to cuddle all the time when we were alone. And i mean ALL the time. Anyway the party/meeting ended and i texted her a few times. She always took her time to reply and eventually said that she is not looking for a relationship and that it was a one time thing. It messed with me big time because the way she acted before was all... wanting something more? She seems cool with being friends but i dont know if im being manipulated somehow into being a kind of a backup. 

Any insight is welcome",dating,t5_2qhb1,https://www.reddit.com/r/dating/comments/pa2ftd/i_am_confused/
42,pa2m0g,1629733908,Just want to stop working and marry a rich guy,"I make 80K, have a bachelor degree, work at home, and have no reason to just give it all up. But I have problems with working for a boss. I hate the bureaucratic nature of most workplaces. I'm also very lazy when I work for something I don't care about. I would rather just have kids and be a mom. I feel like I should just marry someone I'm slightly attracted to and be a stay-at-home mom and get cheated on, if it means i don't need to work, and I can have sex at least once a day. That's how unhealthy my mental health is right now.",dating,t5_2qhb1,https://www.reddit.com/r/dating/comments/pa2m0g/just_want_to_stop_working_and_marry_a_rich_guy/
43,pa2qbn,1629734264,Does anyone else push people away when things get serious?,"I am a 31 year old gay man and have only been in about 3 serious relationships over my whole adult life. I’ve opened myself up recently to dating apps and even meeting guys through friends and there has been something I’ve noticed. After all of the dates I’ve been on, when things started to get the least bit serious, i lose interest. Full interest- out the window, completely lost.

I remember when I used to love hearing back from guys who were interested in me. But now, I can find the slightest detail off-putting, whether it’s the way they smile or the way they talk. 

Has anyone else gone through this? If you have and have gotten over it, what did you do to finally enjoy a mutual relationship?",dating,t5_2qhb1,https://www.reddit.com/r/dating/comments/pa2qbn/does_anyone_else_push_people_away_when_things_get/
44,pa2seo,1629734428,How to deal with feelings,[removed],dating,t5_2qhb1,https://www.reddit.com/r/dating/comments/pa2seo/how_to_deal_with_feelings/
45,pa2vpo,1629734677,What Asian Countries View Tattoos on women as bad?,[removed],dating,t5_2qhb1,https://www.reddit.com/r/dating/comments/pa2vpo/what_asian_countries_view_tattoos_on_women_as_bad/
46,pa2w23,1629734704,"Should you prioritize ""getting back on your feet"" before dating?","Since COVID hit, things haven't been so great. I've been freelancing and there hasn't been as much work coming in. In addition to freelancing, I've been searching for a full time new position. The money situation hasn't been great.   


With things not being so good, should I prioritize getting my life back together before dating? I haven't been in the greatest mood for dating. It also seems like women would prefer someone who is in a more secure position.   


I'm 39 and still haven't been in a serious relationship. I lack experience, and feel that I need to get some.",dating,t5_2qhb1,https://www.reddit.com/r/dating/comments/pa2w23/should_you_prioritize_getting_back_on_your_feet/
47,pa2zkb,1629734992,What’s up with people blocking others left and right,"I get if the other person is making you uncomfortable or threatening or making you feel unsafe for any reason but I see people talk about blocking others all the time on here. It’s not working out, we’re not compatible? BLOCK. Im not feeling it anymore? BLOCK. I dont want to deal with rejection or rejecting someone? BLOCK. 

It just feels a bit immature and like people cant handle the issue at hand face on. Like I mentioned before this doesnt include unsafe situations. When ive had guys block me it’s usually because they dont or cant deal with the feelings that come with breaking up and its really annoying. They just want to avoid the situation all together and its selfish and immature.",dating,t5_2qhb1,https://www.reddit.com/r/dating/comments/pa2zkb/whats_up_with_people_blocking_others_left_and/
48,pa31ya,1629735191,Gf doesn't give me proper attention,[removed],dating,t5_2qhb1,https://www.reddit.com/r/dating/comments/pa31ya/gf_doesnt_give_me_proper_attention/
49,pa37hz,1629735654,How do I reassure a shy guy? How do I make him more comfortable?,"I’ve (f,28) been seeing this guy (26) for almost two months now and things are going well. We‘re texting a lot, have a good time when we see each other and we like each other. He makes me laugh a lot. I feel very comfortable around him. He‘s really sweet. We went on 3 dates in total (he went on vacation for a while after our second date).

Even though he is pretty talkative with me and seems to trust me with telling me certain things I think he’s pretty shy and I don’t know what to do. I enjoy his company a lot (and I told him that) and he enjoys mine.

We haven‘t even really talked about what the other was looking for but I’m planning on doing that the next time we see each other. Normally I try to just go for the things that I want but I don’t wanna mess things up with this guy.

For the first date we had ice cream at a park and talked for a couple hours, the second date he asked me out for dinner and last night on our third date I went over to his place to watch a movie. And that was all we did. We watched a movie. I wasn’t expecting to hook up since I wanna take things slowly but we didn’t even cuddle or anything. Of course I also don’t wanna make him uncomfortable but how do I get him to loosen up with me? Not for hooking up but I want him to be more comfortable in general. What do I need to do? I tried putting my head and arms close to him without being too aggressive. I initially wanted to put my head on his shoulder but though that might be too much for him.

He mentioned that he‘s a very awkward person (and I can see that) so I’m assuming it‘s hard for him to be more assertive. Do I need to take on that part for him? Can a shy person try and tell me what to do? I‘m not the most outgoing person myself. Or does anyone have experience with a shy partner?

I apologize for being all over the place. I have a hard time putting my thoughts into words but hopefully you‘ll be able to understand what I’m trying to say :) thank you!",dating,t5_2qhb1,https://www.reddit.com/r/dating/comments/pa37hz/how_do_i_reassure_a_shy_guy_how_do_i_make_him/
50,pa3ha4,1629736479,How do I start a conversation with a crush without forcing it?,"I (20m) have had a crush on a girl from my highschool for a few years and a while ago she took her boyfriend out of her bio and deleted pictures and such, so I assume they broke up. Anyways I started a small conversation on Snapchat last week just asking her about her last name and it went pretty well but I didn’t try to force the convo to keep going. I haven’t talked to her much in person either so now the question is how do I continue to talk to her without being weird?",dating,t5_2qhb1,https://www.reddit.com/r/dating/comments/pa3ha4/how_do_i_start_a_conversation_with_a_crush/
51,pa3i5t,1629736554,Poor communicator and hard to make plans,"Long story short I've been trying to make plans with this girl for 2 weeks but she is a terrible communicator.

I asked her out previously and she said she said she was excited and agreed but had a busy schedule and would let me know by the end of the week. She didn't contact me for 2 weeks, so I reached back out to her in a Hail Mary. She responded but made no mention of the date. I told her she was sending me mixed signals and if she wanted to still go out, great. If not, not a big deal but I want to respect both our times and not invest in something that wont go anywhere.

She insisted she's interested so I proposed a day, time, and location for a date. She said she is busy but would let me know the day of. Of course, she was busy.

I know she is legit really busy right now but the lack of communication about availability is making it super hard on me. Should I just wait for her to plan something then? Move on?

She knows I'm interested, she says she is, but the logistics of making this happen are turning me off. I already called her out on the mixed signals once, so she is aware.",dating,t5_2qhb1,https://www.reddit.com/r/dating/comments/pa3i5t/poor_communicator_and_hard_to_make_plans/
52,pa3pbb,1629737169,so we’re dating now,i posted on here like a month ago freaking out about being in love with my best friend. he found out and revealed that he felt the same about me :))) now we’re together and went on our first date yesterday and i swear i’m falling further and further every day &lt;3,dating,t5_2qhb1,https://www.reddit.com/r/dating/comments/pa3pbb/so_were_dating_now/
53,pa3rj1,1629737353,Promise ring,[removed],dating,t5_2qhb1,https://www.reddit.com/r/dating/comments/pa3rj1/promise_ring/
54,pa3vdd,1629737685,“Girlfriend” essentially ghosted me,"
Earlier this year, I(25M) moved across the country for a new job. This was a complete new area to me that I barely knew. My job is mostly working alone so I don't get too much social interaction on a day to day basis aside from small talk. About 3 weeks after moving here I meet K(22F) through a dating app. She lives about an hour away from me, we FaceTime several times and instantly hit it off very well. Go on a few dates, and seem to be developing quite nicely. Before I know it essentially 2-3 months later we are dating pretty fully, sleeping at each others houses multiple times per week, and I even met her family once although it was by accident.

From the beginning we agreed to take things very slowly and let the relationship develop naturally. About three months in, I am on my way to visit K and spend the night there when she tells me she bought a bottle of liquor and is insistent on us drinking for some reason. I am not a huge drinker, but agreed nonetheless (I Know my limits pretty well.) We end up having about 4-5 shots. I know this is enough that will give me a good buzz but she got way more drunk than me. She starts telling me she loves me and wants to fully date me for real and stupid me believes it all and thinks Im really falling for this girl. The next few weeks or so go very well as our attachment seems to be growing.

Then due to our busy schedules, we aren't able to see each other for about a week. We had plans to hang out on a Monday night. I text her but she never answers me until later the next day.(pretty uncommon, we would always answer rather quickly) Meanwhile she posted on her snapchat story at 4-5AM several snaps of her out partying all night with 2 new guys she had met. She knows I am not the party type like that and that could be why she didnt ask me but I still feel like I deserved an explanation or something. She texted me back the next afternoon just saying hey and how her night was wild. I tell her (without trying to play the blame game) that I was really looking forward to hanging out and that I was somewhat uncomfortable with her behavior the previous night. We were pretty open and honest about everything and I had always been respectful towards any feelings and boundaries she had. 

This was the first scenario where something like this happened in our relationship and she immediately got defensive. We end up getting into a long argument through text and agree to FaceTime later that night because nothing was getting accomplished. We talk on FaceTime and things seem somewhat patched up (I never felt crazy hostility at any point) We never fully had a full resolution to everything yet when her phone dies mid FaceTime (this happened quite often when we would FaceTime, I could tell because it cut out mid sentence.) She never calls me back, so I decide to go to sleep and well talk the next day. I send her a good morning text and she answers in the afternoon how ""she isn't ghosting me but just wants some time to process everything."" I simply say ok well talk when you're ready. She then proceeded to not reach out at all for several weeks. 

&amp;#x200B;

I only sent 1 short follow up text a little over a week later saying I would really like to talk but other than that nothing. It has now been over a month and she still never hit me up. I pretty much accepted its over at this point but it all feels so fucked up like how can you do that after everything that we had been through. If you would have told me the last time I saw her would be it I would never believe it. It wasn't even like a breakup it was just nothing. 

I ended up just blocking her on social media recently and deleting her number in my phone and trying really hard to forget about everything but like I really dont see where I went wrong with anything. Maybe I am just older and more mature and she wasn't ready for the relationship and changed her mind?Is there something here I am missing???

 But to never talk about any of it or resolve anything or get any closure was really getting to me so I just had to shut her out and now am trying to completely move on which I am having a very hard time doing. I never made too many friends in this new area since I pretty much met her right after moving here and now several months later, it has been very difficult dealing with this whole situation. This has definitely taught me to make sure I really get to know who someone is first in any future relationship and definitely not get emotionally attached too quick because this was fucking horrible.",dating,t5_2qhb1,https://www.reddit.com/r/dating/comments/pa3vdd/girlfriend_essentially_ghosted_me/
55,pa423f,1629738220,How to build trust from nothing.,"19M. I have never trusted anyone fully or even halfway, I’d say a 4 on a scale of 1-10. Especially when it comes to girls or anyone who remotely shows any sort of interest in me or gives me any amount of affection, this also includes my mother and grandmother whom would obviously want to be loving towards me. Always kept friends at a distance and that caused us to eventually go our own way.

Having never been able to trust anyone how can I go about building trust in people, wether strangers or if I already know them. But Especially in any girl who shows affection/interest in me as this inability to trust has (in part) caused me to never date any girls.",dating,t5_2qhb1,https://www.reddit.com/r/dating/comments/pa423f/how_to_build_trust_from_nothing/
56,pa44t3,1629738442,Help ? Need advice,So my gf has always had roommates and they are always male and she had a high sex drive and has mentioned before that all her roommates always hit on her and try to hook up with her. Is that or this normal? I would think that if that happen you would get a female roommate but she said that she dosent get along with female roommate because of hair on the drain ..... should I be worried?,dating,t5_2qhb1,https://www.reddit.com/r/dating/comments/pa44t3/help_need_advice/
57,pa4gac,1629739347,Bumble dating app - is it really a better experience?,"Hello, 

I am totally new to Bumble dating app and I was wondering if anybody can share their experience with it? is there really any difference in terms of quality comparing to Tinder or OK Cupid? any advice? big thank you!",dating,t5_2qhb1,https://www.reddit.com/r/dating/comments/pa4gac/bumble_dating_app_is_it_really_a_better_experience/
