,id,created_utc,title,selftext,subreddit,subreddit_id,url
14,pptu0e,1631855245,How do I get my profile noticed?,"I’ve been on tinder and bumble for the last four months or so and have had only a handful of conversations with anyone. Part of my struggles has been my situation. I have kids and split with their mom a while ago, and on the off chance someone does match with me, and they message me back, as soon as they realize I have kids (because apparently no one reads bios?) it’s ghost town. Or they engage for a while and then just stop replying. And now I can’t even get anyone to like my profile. It’s completely dead. And it just seems like I see so many women complain about guys they meet on tinder. I’m not looking for hookups, I actually want a long term relationship, and I don’t ask for nudes or send unprompted dick pics. That should be the bare minimum but apparently it isn’t. So how do I get women to notice my profile, and how do I keep them engaged? Any advice would be appreciated.",dating,t5_2qhb1,https://www.reddit.com/r/dating/comments/pptu0e/how_do_i_get_my_profile_noticed/
15,pptvnv,1631855454,Hiding my nationality,"Hey everyone. This might be a weird post, but I have a genuine concern. I have been living in the USA for many years now. I have been trying to date and find a bf for awhile now, but I feel like guys often perceive me as an exotic lady being from Eastern European country. They often lie to me to be interested for the sake of going out with me. After a few dates they tell me or imply that me being from my country might be a problem to Beijing me around their family. I consider myself and I was told by many men that I look great, that I’m nice and intelligent. I treat dates well and I genuinely just want a good relationship with someone I have a chemistry and understanding with. But over and over I tend to meet people who are concerned with my nationality. I did not even pay attention to it at first but several friends have told me in the past that for her I’m “exotic”. Should I hide my nationality until the first date?I feel like hiding it is not polite and just go on a date to surprise a guy with my accent… is wrong. What do you think ? I need a decent advice. 😢Thank you 🙏🏻",dating,t5_2qhb1,https://www.reddit.com/r/dating/comments/pptvnv/hiding_my_nationality/
16,pptwy0,1631855609,My guy friend kissed me,"Ok context, I (27 f) hooked up with one of my best guy friends drunk like 7 years ago. Didn’t think much of it, he acted like nothing happened so I followed suit and ended up in a relationship about 3 months later. Fast forward to now, I just ended that long-term relationship and went to my guy friends (31 m) party.. He was a little tired when I got there (at 9:30pm) and I apologized for running late and offered to go home since he seemed tired. He insisted I hang out, I do, within a half hour it’s just us having a couple drinks. I had my friend set to pick me up in an hour, when I go to tell him my friend was there to pick me up, he pulled me in and kissed me.. I was shocked, but it was a nice kiss and though my relationship just officially ended, it had been over for a long time.. he texted me the next morning asking if I still wanted to grab food with other mutual friends and we did, when it was time to go he still wanted to hang out with me. I’ve been busy for a couple days and we haven’t been texting and I texted him to see if he was coming home for the weekend (he lives 40 min away) he said unfortunately he can’t this weekend “but I’ll see you next week homie..” we’ve always had a crazy connection and I’m just really confused by the attachment, the hookup attempt and then calling me homie?! How do I proceed with this? Do I even bother?",dating,t5_2qhb1,https://www.reddit.com/r/dating/comments/pptwy0/my_guy_friend_kissed_me/
17,ppu1q2,1631856207,Could she have really been pregnant?,"3 years ago I met this woman when i worked at walgreens. I was 20, she told me she was 35. She would come in like every 2-3 weeks roughly? She was pretty and always super flirty. I mean when she would come to the register, she would always put her hand on my hand and be like “You are so funny/cute!” I honestly wasn’t opposed to it and i wanted to ask for her number but was too shy. One time I was getting out of my car after my break and i saw her leaving the store! So i used it as an opportunity to get her number in which i did! We texted for a few weeks and till went on a date and back to her place and you know what happened then….

This went on for a span of several months of FWB. Heres the catch, if i ever ignored her via text, she would get super clingy and very irritated, I eventually would make up for it with more s3x. Back to her age, she said she was 35 however when i would google her, her public profile said she was 52, but she also had an aunt who owned her house and had the same name as her so i figured it could have been that? I mean she looked great but idk if id say she was 35. Well, towards the end of our FWB i started to ignore her more and she told me she was pregnant and even sent an ultrasound!!I couldnt believe it…However i did more research and turns out she bought a fake ultrasound online with her info on it. Like what!? After i found this information out, I actually didnt confront her about it and left it as is and blocked her. However though is it possible she very well could have? We had unprotected s3x once but i was only in her for a few thrusts before i put on a rubber. I haven’t seen or heard from her since. We also have done it when she was on her period too. If that helps.",dating,t5_2qhb1,https://www.reddit.com/r/dating/comments/ppu1q2/could_she_have_really_been_pregnant/
18,ppu4ml,1631856598,How do you prepare to meeting people in person after online dating...,[removed],dating,t5_2qhb1,https://www.reddit.com/r/dating/comments/ppu4ml/how_do_you_prepare_to_meeting_people_in_person/
19,ppuai1,1631857372,"When a guy says he doesn’t want a relationship, is that always true","I have a fwb and he flip flops, he will randomly bring up wanting to be single and not wanting a relationship but then constantly try to kiss and cuddle but when he’s drunk says something else... could he just be nervous to admit what he really feels or should I take what he’s saying for what it is ?",dating,t5_2qhb1,https://www.reddit.com/r/dating/comments/ppuai1/when_a_guy_says_he_doesnt_want_a_relationship_is/
20,ppuhf7,1631858349,My real life success rate for dates is 100%,"Granted I've only ever asked 2 people out and I'm currently single.

Hopefully not much longer though!

My online success rate is 0% so theres that.",dating,t5_2qhb1,https://www.reddit.com/r/dating/comments/ppuhf7/my_real_life_success_rate_for_dates_is_100/
21,ppujrc,1631858632,wdwddd,[removed],dating,t5_2qhb1,https://www.reddit.com/r/dating/comments/ppujrc/wdwddd/
22,ppuz3w,1631860780,"Yes, how dare I not out myself our like livestock",[removed],dating,t5_2qhb1,https://www.reddit.com/r/dating/comments/ppuz3w/yes_how_dare_i_not_out_myself_our_like_livestock/
23,ppv21c,1631861196,Why do some Western incels fetishize Eastern European and Asian women?,"I see too many guys on misogynistic forums who talk very bad about American women but keep on praising the women from Eastern Europe and Asia. These guys are mad about Eastern Europeans and Asian women. 

I think there are good and horrible women everywhere. It is pathetic to generalise an entire region.",dating,t5_2qhb1,https://www.reddit.com/r/dating/comments/ppv21c/why_do_some_western_incels_fetishize_eastern/
24,ppv5e9,1631861674,Dating without all the time commitment? Is it possible?,"My perfect dating experience would be just seeing someone once a week for dinner, a movie or other entertainment, sex, and sleep together/snuggle, then not see them again for maybe 1-2 weeks and repeat. 

I don't really want someone I need to talk to every day. Or to see them multiple times a week. I'm really quite busy with work, then working out, plus my hobbies and extra business I'm trying to start.

Does such a thing exist? I understand this is sort of what ""FWB"" is supposed to be but my understanding is a man needs to be a tall ripped/beautiful supermodel to get one of those or just ridiculously lucky. I dunno.

Or maybe you need a sugar baby for it. 

Does such a thing exist in normal dating?

Thanks.",dating,t5_2qhb1,https://www.reddit.com/r/dating/comments/ppv5e9/dating_without_all_the_time_commitment_is_it/
25,ppvc1f,1631862593,Should I wait to go to dentist to ask someone out?,"I've been chatting with this really cute girl at work lately and she seems pretty interested.   
I also have pretty bad oral health from years of neglect, and have a broken tooth for a while now and its almost broken completely off at this point. We pretty much always are wearing masks when we see eachother and I always chew gum at work.   


Should I wait until I get my dental issues treated before asking her out? Because I know my breaths pretty bad without a mask / not chewing gum. I don't think I could go an entire date without taking a sip of a beer / eating some food and then worrying about getting some gum back into my mouth asap... These dental problems have been holding me back in a lot of ways and it's really starting to affect me more and more.  


I'm kind of worried that might take too long and we'd both lose interest, I basically just need some people to tell me to get my friggin teeth fixed or I'll never be comfortable getting close to anyone :/",dating,t5_2qhb1,https://www.reddit.com/r/dating/comments/ppvc1f/should_i_wait_to_go_to_dentist_to_ask_someone_out/
26,ppveqe,1631862984,what do you think of the strengths and weaknesses of my girlfriend? does this have stable foundations for a good future?,[removed],dating,t5_2qhb1,https://www.reddit.com/r/dating/comments/ppveqe/what_do_you_think_of_the_strengths_and_weaknesses/
27,ppvix1,1631863581,"Dear men of reddit,","My coworker is about 5 feet 8, overweight, not particularly handsome, not particularly rich, not particularly outgoing and charismatic. Yet I know for a fact that multiple ladies in our workplace have giant crushes on him. One might even be in love with him.

""Why?"" You may ask.. Well let me tell:
He is genuinely one the most kind, respectful, tactful, reliable and caring men I've known. He is confident and unapologetically himself. He's also a true gentleman not in the ""nice guy"" type of way.

So guys please don't let the internet convince you that the only way to get girls is by being a 6 foot beefcake millionaire. 
Sure those are the guys who might get initial attention online and in bars etc.. But when it comes to real-life long term relationships and feelings those attributes don't come into play half as much as what you think.",dating,t5_2qhb1,https://www.reddit.com/r/dating/comments/ppvix1/dear_men_of_reddit/
28,ppvje8,1631863654,Am I crazy ??,[removed],dating,t5_2qhb1,https://www.reddit.com/r/dating/comments/ppvje8/am_i_crazy/
29,ppvkjv,1631863821,Constant swiping,"For what seems like years now I've been on multiple dating apps (Tinder, Bumble and a smattering of others) with very little luck. The best I've had from it was a 6-8 week period seeing a girl back in early summer last year, but that never went anywhere after she decided she wasn't looking for a relationship anymore. 

I try to keep active as much as possible and make sure I'm not swiping right on too many people, all in a bid to be shown to as many people as I can - I've read these things play a fairly big part in that. Pictures are the most recent I have and (at least I'd like to think) I look fairly decent. For reference I'm 21 M from UK. I very rarely get anyone swipe right on me, and the times I get that lucky, I never seem to find them when I'm swiping through the app myself. 

I'm not one for going out a great deal and, as everyone says, I don't want to be someone I'm not, just to try and find someone, because that won't be the real me. I've been told a million times that I'll find someone 'sooner or later' and that there's 'someone out there for everyone' but I'm getting past the point of losing faith and patience with these apps. 

I'm not looking to sleep around or anything like that, I just want a long term, happy relationship with someone I can settle down with... Is that too much to ask? 

If anyone would be happy to take a look over my tinder/bumble profile, maybe suggest some changes/improvements then I'd be all ears. 

Thank you!",dating,t5_2qhb1,https://www.reddit.com/r/dating/comments/ppvkjv/constant_swiping/
30,ppvoa2,1631864352,Advice on Dating My [M24] Former Teacher [F49],"Hey everybody! So, I have an English teacher that I’ve always had quite a crush on since time immemorial. I know, I know, quite the usual thing. We were always on good terms long after school was out, occasionally texting each other and all that.

After my last breakup I’ve been laying low for a while. Coincidentally, we’ve had quite some good conversations with her on the social media. So, gathering all of my courage, I asked her out (specifically saying ‘date’) and she agreed, even offering to go out and have some wine and talk stuff.

My question is, how do I make myself look the best to her? And do you think that the whole setup (me using the word ‘date’, her suggesting going out for drinks) suggest she might have a sexual interest?

Thanks in advance!",dating,t5_2qhb1,https://www.reddit.com/r/dating/comments/ppvoa2/advice_on_dating_my_m24_former_teacher_f49/
31,ppvr4q,1631864734,How to have a good eye contact with opposite gender ?,[removed],dating,t5_2qhb1,https://www.reddit.com/r/dating/comments/ppvr4q/how_to_have_a_good_eye_contact_with_opposite/
32,ppw65t,1631866983,Had my first real date yesterday (m20) and am so exited!!,"So after being properly devastated for quite a while from my previous gf and assuming that I’ll end up alone I began feeling okay with being on my own. However, last weekend I was at a sit-in party with friends and felt chemistry with a girl there. We talked a lot at the campfire already, yet I didn’t think much of it but she messaged me the day after.

I saw the „you miss 100% of the shots you dont take“ on here and decided to give it a try after a couple of days texting and she said yes! (Yay) -my point being: it really do be like that!

Although having had a gf before I never had a proper date (since we were friends before) and dating is soooo fun if it works out!
We hung out until late evening and I kissed her somewhere mid-date and it continued being great! I had so much fun yesterday jeiguchsbfifjrjek

All that being said, I’m not used to girls being attracted to me, don’t lose hope people it happens when you least expect it 😊
Thanks for listening to my little (positive) rant :)",dating,t5_2qhb1,https://www.reddit.com/r/dating/comments/ppw65t/had_my_first_real_date_yesterday_m20_and_am_so/
33,ppwlp4,1631869404,27(m4f) looking for a serious relationship,"Hey ya, hope you all are doing great. I’m currently doing my masters in Computer Science at Sweden. I am very athletic. Love working out, playing soccer and badminton. I love traveling. Planning a euro trip. And I have a good sense of humor. I can make you laugh your pants off. 😂 I watch a lot of TV shows. FRIENDS FAN. Could I be anymore Chandler?  
Looking for someone with a good heart and a good sense of humor. Someone to take long walks with, make silly jokes with and preferably start a YouTube channel with. If you’re in for this awesome trip of life. Let’s connect. My Instagram- a_for_arnob

Have an awesome day, good people.",dating,t5_2qhb1,https://www.reddit.com/r/dating/comments/ppwlp4/27m4f_looking_for_a_serious_relationship/
34,ppwpwh,1631870034,I fucked up by asking my friend on a date.... Not I feel horrible....,"Me:  I'm happy with myself and working towards a better place... And I know you are working on yourself.... I don't know... Like I don't want to impose... At all... But I keep thinking.... Maybe.. What if.....and similarly...
[Him First thing is that I am not Mad.. 
Second, is that I dont exactly dont know how to handle the situation..
But if u wanna talk, i wanna hear..
Him:  And maybe we can talk freeely on this post our work or something..
Me:  I just thought that you should know... And I really tried not to think like this... Like really... But I couldn't stop myself...And like..I kept thinking....When I'm at a place where I can think about this aspect of my life....I keep wondering if it should be you....
[Him: I am glad u said it, but i really dont know how to react to this..
Him:  It is kinda human that we feel a kind of attraction to opposite gender.. On that case even i have thought about What If u and me.. and that way but for some reason i didnt/dont feel it will workout.. i really donno what the reason is.. But it kinda felt that it won't kinda click.. 

I still donno and fear if you are gonna like this reply or not..
[Me: I did not think as far as how it will be or whether things will workout or not. Because of a lot of reasons.
It is a thought in my mind based on how I feel at present. 
I tried to not to think that thought for a long time but I just needed to be honest with you.
[Me; I also wanted to say that I'm very sorry that I was weird in the past months. Being irrational... I was afraid that I was dishonest with you and unable to find the right words to tell you....I took it out on you but you were as usual wonderfully kind and even apologized for my sanity....I am not great at expressing myself..... Not that it's an excuse or anything... 

But I really enjoy your company and would not like that to go away or change at allll. 
Given, I'll understand if you so choose to not want the same in terms of company.
[Him: My major fear is loosing you.. 
I am glad u said it or I would have continued being an idiot not understanding ur feelings and keep talking.. 

You are someone i value so much in my life and i literally dont wanna loose u..
Him: I still am in the midst of trying a way to handle this situation..",dating,t5_2qhb1,https://www.reddit.com/r/dating/comments/ppwpwh/i_fucked_up_by_asking_my_friend_on_a_date_not_i/
35,ppx64t,1631872472,Making guys wait,"Casual sex is rife now and it has cheapened sex and relationships massively. 

Guys will say what you want to hear to get you to have sex with them but they won’t stick around for a relationship. It’s old school but ever since I’ve been making guys work for it then the “love bombers” who swear they’re in love with me after a month have been slowly revealing their true ugly selves and they either throw a tantrum and leave when they don’t get what they want or they ghost. If they loved me then they would have respected my three month boundary. 

If you want to separate the wheat from the chaff and see if a guy is true to his word and really likes you then make them wait two or three months before sex.  🤷🏼‍♀️
I’ve been seeing a guy for two and a half months now and he’s been nothing but a gentlemen throughout! Admits the abstaining is difficult but says I’m worth it! 
There are guys out there ❤️",dating,t5_2qhb1,https://www.reddit.com/r/dating/comments/ppx64t/making_guys_wait/
36,ppx6sx,1631872583,What happened and what she think now?,"A woman knew me 13 years ago, she liked me a lot and at one point begged me to date her, but I declined all her advances and literally only went on one date with her, and knew her for a two year period hardly ever speaking with her. A whole 13 years past, not seeing or hearing from her for the whole 13 years (lost contact). We never had sex. Only one kiss once 13 years ago. 

One day 13 years later she happens to see me on tinder, she messeges me and says she could never have forgot my face, and she also mentioned that sometimes my name would pop into her head over the years saying your name is a name I couldn't forget. 

When I was talking to her on the dating site she gave me her number and we spoke on WhatsApp video chat, she spoke for 4 hours with me and was bright red in the face the whole time, I knew her face was red by me just being with her on video chat. I asked if I could come see her round her place, and she agreed with no hesitation. When I arrived at her place she was very well dressed and make up on etc (she later confessed that she deeply cleaned her place before I came), we talked, she told me my name often popped in her head over the years, and that I had broken her heart, and when I said 'im surprised you remembered my face still' she laughed and said ',your face is not a face I'd ever forget'. We kissed but It didn't go further. 

She did mention earlier she like me a lot except the shyness. But towards the end of the date I sensed something wrong, I thought she would be putty in my hands (arrogant I know), she carried on speaking to me, later she asked me to come around again, I said I couldn't go because I was fixing cupboards. She carried on speaking to me. But days later I actually got ghosted by her. She then unghosted me at one point when my father died and I told her, she then later went quiet again and I just left it. 

Can you decode what went wrong when before she loved me?",dating,t5_2qhb1,https://www.reddit.com/r/dating/comments/ppx6sx/what_happened_and_what_she_think_now/
37,ppxcwi,1631873415,Staying at his on 2nd date?,"I need advise so I stayed at his last Saturday after a night out (no sex) just spooning, kissing. We are going to the cinema tonight.. is it a good idea to stay at his after? I don’t want sex yet as I’m very guarded. Is he going to expect it do you think?",dating,t5_2qhb1,https://www.reddit.com/r/dating/comments/ppxcwi/staying_at_his_on_2nd_date/
38,ppxg76,1631873875,Should girls initiate the second date?,"So Monday I went on a first date with this nice girl from a mingle match. We chatted for about a week or two prior to the meeting and it seemed like we bonded well. I'm not good at flirting on the first few dates because I personally feel awkward doing it so soon. So I was mainly just treating her like a good friend. We were mainly smiling throughout the convos and she was happy. The only time I attempt flirting is from texting, but it's extremely minimal. I'm not the greatest catch either, so I'm no ken doll.

As I mentioned, the date just felt like good friends hanging out, not so much flirting and I was given a cheek when I went for the kiss which I thought was a letdown. However, that very next day she texted to see me again this weekend. She isn't the type that is looking for sex, which is fine, but I found it weird but flattering that she text me so soon to initiate a second date.

All I'm seeing online for tips are how ""Girls"" can reply after ""Guys"" ask for a date. For example ""If you want to tease him"" say this.... ""If you want to play hard to get"" say this.... In my position, I want to say something flirty but also to confirm the date. What are some ideas?",dating,t5_2qhb1,https://www.reddit.com/r/dating/comments/ppxg76/should_girls_initiate_the_second_date/
39,ppxlh9,1631874616,I screwed up,"Hi. A month ago, I (19M) hooked up and lost my virginity with a classmate at a party. There was also another girl at the party and we talked a lot. However she had to leave soon and so I texted her if she wanted to meet sometime. In the following month, I was spending time with the first girl and started to crush on her. So I decided to tell her but she shot me down. I was disappointed but at least I got it out of my system. The same day (after the confession) I was talking to the second girl and she mentioned our planned ""meeting"". I took it as a meeting between friends who didn't get time to talk during the party. She however, took it as a date invitation. After she told me this, I, a recently rejected guy, told her that I am fine with it and that it can be a date. Since she is a nice girl and we have much to talk about, I didn't see a problem since there was nothing going to happen between me and my crush. I am looking for a relationship anyway and also it would be nice to focus those feelings on someone esle and get to know her. Big mistake.

Both girls are friends and the first girl told the second about what I confessed to her that night. The second must have taken it badly and thought that I took her as a ""second choice"" or that I was trying to make the first one jealous. Anyway, she texted me the day before the planned meeting (a date at this point) and called me a jerk and a player. She also said that she hates two sided people and that it was a jerk move. I was baffled. It never occured to me that this situation might happen. Yes, it might appear that she was a second choice but I never intended it that way. I tried to explain myself and that it is just a terrible misunderstanding but the damage is already done. Not only that, if it spreads, I might be known as a player and girls will avoid me. I am definitely not a player. I have never had a relationship and I lost my virginity a month ago (the only sex I have had to date). I apologized and still feel bad. Both for her because she must have felt terrible but also for myself because I lost 2 girl friends in the span of a day and damaging information is being spread about me. 

What can be done?",dating,t5_2qhb1,https://www.reddit.com/r/dating/comments/ppxlh9/i_screwed_up/
