,all_awardings,allow_live_comments,author,author_flair_css_class,author_flair_richtext,author_flair_text,author_flair_type,author_fullname,author_patreon_flair,author_premium,awarders,can_mod_post,contest_mode,created_utc,domain,full_link,gildings,id,is_created_from_ads_ui,is_crosspostable,is_meta,is_original_content,is_reddit_media_domain,is_robot_indexable,is_self,is_video,link_flair_background_color,link_flair_css_class,link_flair_richtext,link_flair_template_id,link_flair_text,link_flair_text_color,link_flair_type,locked,media_only,no_follow,num_comments,num_crossposts,over_18,parent_whitelist_status,permalink,pinned,pwls,retrieved_on,score,selftext,send_replies,spoiler,stickied,subreddit,subreddit_id,subreddit_subscribers,subreddit_type,thumbnail,title,total_awards_received,treatment_tags,upvote_ratio,url,whitelist_status,wls,removed_by_category,author_cakeday
0,[],False,Yossi25,,[],,text,t2_cc54y,False,True,[],False,False,1625511195,self.dating,https://www.reddit.com/r/dating/comments/oedq3v/whats_an_important_lesson_youve_learned_from/,{},oedq3v,False,True,False,False,False,True,True,False,#ff4500,dating,"[{'e': 'text', 't': 'Question'}]",a9531dce-194e-11e5-b177-0eff099c3d1f,Question,light,richtext,False,False,True,4,0,False,all_ads,/r/dating/comments/oedq3v/whats_an_important_lesson_youve_learned_from/,False,6,1625511206,1,"Mine is to always be honest.  I used to do my best trying to solely put my best foot forward that I was ommisively leaving things out.

This painted a picture of something I'm not which created anxiety.  When she later learned the truth, she was pissed.

Lying, even by omission, is a total deal breaker.  

Now I'm just confidently honest.

What are things you've learned from dating?",True,False,False,dating,t5_2qhb1,879690,public,self,What's an important lesson you've learned from previous failed dates?,0,[],1.0,https://www.reddit.com/r/dating/comments/oedq3v/whats_an_important_lesson_youve_learned_from/,all_ads,6,,
1,[],False,Adrianna048,,[],,text,t2_d3w5wieh,False,False,[],False,False,1625511403,self.dating,https://www.reddit.com/r/dating/comments/oedsli/be_with_someone_who_can_love_you_widely_not_only/,{},oedsli,False,False,False,False,False,False,True,False,#ffb000,,"[{'e': 'text', 't': 'Tinder/Online Dating'}]",5214d2ac-61f1-11e8-8bb1-0ed15e4a39c0,Tinder/Online Dating,dark,richtext,False,False,True,3,0,False,all_ads,/r/dating/comments/oedsli/be_with_someone_who_can_love_you_widely_not_only/,False,6,1625511414,1,[removed],True,False,False,dating,t5_2qhb1,879692,public,self,Be with someone who can love you widely not only behind looked doors but even in front of the whole damn world. Someone accepts you with all his heart.,0,[],1.0,https://www.reddit.com/r/dating/comments/oedsli/be_with_someone_who_can_love_you_widely_not_only/,all_ads,6,moderator,
2,[],False,Embarrassed_Goose719,,[],,text,t2_d4l64t9k,False,False,[],False,False,1625511680,self.dating,https://www.reddit.com/r/dating/comments/oedw2z/should_i_try_to_date_this_person_long_distance/,{},oedw2z,False,False,False,False,False,False,True,False,#ea0027,dating,"[{'e': 'text', 't': 'I Need Advice'}]",19ec58c2-9f74-11e7-81a1-0e2bf15991f0,I Need Advice,light,richtext,False,False,True,11,0,False,all_ads,/r/dating/comments/oedw2z/should_i_try_to_date_this_person_long_distance/,False,6,1625511691,1,[removed],True,False,False,dating,t5_2qhb1,879707,public,self,should i try to date this person long distance?,0,[],1.0,https://www.reddit.com/r/dating/comments/oedw2z/should_i_try_to_date_this_person_long_distance/,all_ads,6,moderator,
3,[],False,HappyUnicorns789,,[],,text,t2_8a97pew1,False,False,[],False,False,1625511795,self.dating,https://www.reddit.com/r/dating/comments/oedxgp/should_i_move_on/,{},oedxgp,False,True,False,False,False,True,True,False,#ea0027,dating,"[{'e': 'text', 't': 'I Need Advice'}]",19ec58c2-9f74-11e7-81a1-0e2bf15991f0,I Need Advice,light,richtext,False,False,True,7,0,False,all_ads,/r/dating/comments/oedxgp/should_i_move_on/,False,6,1625511806,1,"I set up a second date with this girl and she agreed to go. The day before the date, she apologizes and says that she can’t make it because of a family gathering. She didn’t offer to reschedule and it’s been a couple of days of not hearing from her. I’m assuming she isn’t interested anymore, but she still follows me on social media. What do y’all think?",True,False,False,dating,t5_2qhb1,879709,public,self,Should I move on?,0,[],1.0,https://www.reddit.com/r/dating/comments/oedxgp/should_i_move_on/,all_ads,6,,
4,[],False,xyxyxy---,,[],,text,t2_2xz41k47,False,False,[],False,False,1625512342,self.dating,https://www.reddit.com/r/dating/comments/oee44s/how_to_keep_a_long_distance_relationship_going/,{},oee44s,False,True,False,False,False,True,True,False,#ea0027,dating,"[{'e': 'text', 't': 'I Need Advice'}]",19ec58c2-9f74-11e7-81a1-0e2bf15991f0,I Need Advice,light,richtext,False,False,False,4,0,False,all_ads,/r/dating/comments/oee44s/how_to_keep_a_long_distance_relationship_going/,False,6,1625512354,1,"So this guy slid into my dms a week ago and we have been talking ever since. He seems great. Problem is, we are 10,000km apart.

But i will be traveling to his city for university in around 2 months so the end is in sight, i just don’t know what we should really talk/ text about without learning everything about each other before we even meet (id like to be able to learn more abt him in person)

We have planned our first date and called each other a few times. Any ideas to keep the spark going?

We are in quite different timezones so things like watching a movie tgt might not be feasible.

Thanks!",True,False,False,dating,t5_2qhb1,879722,public,self,How to keep a long distance relationship going?,0,[],1.0,https://www.reddit.com/r/dating/comments/oee44s/how_to_keep_a_long_distance_relationship_going/,all_ads,6,,
5,[],False,saltwaterhippie1807,,[],,text,t2_5c2lvas9,False,False,[],False,False,1625512469,self.dating,https://www.reddit.com/r/dating/comments/oee5ph/i_was_dumped_for_wanting_to_see_a_drag_show/,{},oee5ph,False,True,False,False,False,True,True,False,#878a8c,dating,"[{'e': 'text', 't': 'Venting'}]",a616c322-194e-11e5-ab91-0ed1c06bdad7,Venting,light,richtext,False,False,True,374,0,False,all_ads,/r/dating/comments/oee5ph/i_was_dumped_for_wanting_to_see_a_drag_show/,False,6,1625512479,1,"I(34f) was dumped today after mentioning a few nights ago that my male friend was entering a drag beauty show and I wanted to go and support him. I didn’t even ask him to go with me. To make it even better he followed that with “you wanting to go to something like that means our political views are probably not the same” I’ll leave that for you to interrupt yourself, but I’d say I have to agree on that. 
Bullet dodged and a month wasted but I’d say I’m on the winning side",True,False,False,dating,t5_2qhb1,879724,public,self,I was dumped for wanting to see a drag show,0,[],1.0,https://www.reddit.com/r/dating/comments/oee5ph/i_was_dumped_for_wanting_to_see_a_drag_show/,all_ads,6,,
6,[],False,cbaichh,,[],,text,t2_90jhg27u,False,False,[],False,False,1625512497,self.dating,https://www.reddit.com/r/dating/comments/oee61o/how_do_you_accept_that_you_are_ugly_and_unwanted/,{},oee61o,False,True,False,False,False,True,True,False,#ff4500,dating,"[{'e': 'text', 't': 'Question'}]",a9531dce-194e-11e5-b177-0eff099c3d1f,Question,light,richtext,False,False,True,123,0,False,all_ads,/r/dating/comments/oee61o/how_do_you_accept_that_you_are_ugly_and_unwanted/,False,6,1625512508,1,"My only saving grace could be my career in the future but most women take care of themselves these days and don’t need men for support. This idea that most women are gold diggers is false. Even good looking broke men have women taking care of them trying to “fix” them. I have good personality qualities as I’ve been told by friends and even strangers but that doesn’t mean someone will or has to be attracted to you. 

I’m trying to accept that I’ll be the one that is always single all their life and never experience what it’s like to be liked by someone. But it’s hard. Everyone else gets married or at least get to date and have some experiences. But I guess it’s natural selection and I’m not one of the lucky ones.  As a guy I don’t get unconditional support or love and if I’m not good looking, rich, or comedian level funny. I’m pretty much worthless in the eyes of society. 

I don’t even have high standards. I’d just want someone who is female gender, over the age of 18, and isn’t a drug addict or violent.",True,False,False,dating,t5_2qhb1,879724,public,self,How do you accept that you are ugly and unwanted?,0,[],1.0,https://www.reddit.com/r/dating/comments/oee61o/how_do_you_accept_that_you_are_ugly_and_unwanted/,all_ads,6,,
7,[],False,oh_Hi-Mom,,[],,text,t2_d4ha92kx,False,False,[],False,False,1625512646,self.dating,https://www.reddit.com/r/dating/comments/oee7t5/am_i_approaching_how_to_act_on_a_first_date_right/,{},oee7t5,False,False,False,False,False,False,True,False,#ea0027,dating,"[{'e': 'text', 't': 'I Need Advice'}]",19ec58c2-9f74-11e7-81a1-0e2bf15991f0,I Need Advice,light,richtext,False,False,True,0,0,False,all_ads,/r/dating/comments/oee7t5/am_i_approaching_how_to_act_on_a_first_date_right/,False,6,1625512657,1,[removed],True,False,False,dating,t5_2qhb1,879725,public,self,Am I approaching how to act on a first date right?,0,[],1.0,https://www.reddit.com/r/dating/comments/oee7t5/am_i_approaching_how_to_act_on_a_first_date_right/,all_ads,6,moderator,
8,[],False,Yattiel,,[],,text,t2_8crgzcze,False,False,[],False,False,1625513249,self.dating,https://www.reddit.com/r/dating/comments/oeeewy/should_i_say_that_im_60_on_a_dating_profile_even/,{},oeeewy,False,True,False,False,False,True,True,False,#ff4500,dating,"[{'e': 'text', 't': 'Question'}]",a9531dce-194e-11e5-b177-0eff099c3d1f,Question,light,richtext,False,False,False,66,0,False,all_ads,/r/dating/comments/oeeewy/should_i_say_that_im_60_on_a_dating_profile_even/,False,6,1625513260,1,"I know this is a bit of a thing, and that I dunno, I'm just curious what people think. I mean with shoes on I'm close to 6'. Is it really that big of a deal irl? Cuz I'm sure it's more of a psychological numbers thing on the profile. What do you all think?",True,False,False,dating,t5_2qhb1,879739,public,self,"Should I say that I'm 6'0"" on a dating profile even if I'm 5'11"" bare foot?",0,[],1.0,https://www.reddit.com/r/dating/comments/oeeewy/should_i_say_that_im_60_on_a_dating_profile_even/,all_ads,6,,
9,[],False,GoofusPoofyPidove,,[],,text,t2_934uthg5,False,False,[],False,False,1625513349,self.dating,https://www.reddit.com/r/dating/comments/oeeg40/how_to_get_dating_by_facebook/,{},oeeg40,False,True,False,False,False,True,True,False,#ff4500,dating,"[{'e': 'text', 't': 'Question'}]",a9531dce-194e-11e5-b177-0eff099c3d1f,Question,light,richtext,False,False,True,4,0,False,all_ads,/r/dating/comments/oeeg40/how_to_get_dating_by_facebook/,False,6,1625513360,1,I have been trying to find how to get the dating by Facebook app but I can’t seem to find it. I tried using the help center to no avail. Is it unavailable in the US?,True,False,False,dating,t5_2qhb1,879740,public,self,How to get Dating by Facebook?,0,[],1.0,https://www.reddit.com/r/dating/comments/oeeg40/how_to_get_dating_by_facebook/,all_ads,6,,
10,[],False,notyobusinessbud,,[],,text,t2_aac7nmo1,False,False,[],False,False,1625513460,self.dating,https://www.reddit.com/r/dating/comments/oeehhu/how_can_i_25_f_tell_if_a_guy_25_m_is_only/,{},oeehhu,False,True,False,False,False,True,True,False,#ea0027,dating,"[{'e': 'text', 't': 'I Need Advice'}]",19ec58c2-9f74-11e7-81a1-0e2bf15991f0,I Need Advice,light,richtext,False,False,True,9,0,False,all_ads,/r/dating/comments/oeehhu/how_can_i_25_f_tell_if_a_guy_25_m_is_only/,False,6,1625513471,1,"I (25 F) met a guy (25 M) 1.5 months ago. I can’t tell if he’s using me for sex or if he likes me. He make plans for our dates in advance, usually a few days in advance through text. However, he only asks me on dates once/week. Not sure if this is a bad sign. We have been on 6 dates in the past 6 weeks. I tried to ask him if we could text a bit more in between dates (I’m aware this probably came off as needy, but I’m someone who is big on texting and it’s important to me). He told me he isn’t really a texter but that he would try texting me more. However, he didn’t. He really only texts to set up dates, which I’ve come to accept. He usually takes me out for drinks or to a hookah lounge in the evening typically around 8 PM and we’ll be out and about until 2 AM. After, we always go back to his or my place and have sex, and usually (4 out of the 6 times) spend the night with each other. He cuddles me, kisses me, and occasionally calls me pet names. He’s told me he likes falling asleep with me and cuddling me. He’s kissed me on the forehead and hugs me goodbye.

When I ask him about what he wants, though, he tells me he wants to go with the flow and get to know me more.. But I’m not sure what to think. I’ve asked him if we could hangout more than once/wk, but right now he’s working part-time and studying for the MCAT, so he claims he doesn’t have the time. I don’t know if he’s making excuses though. I’m not sure if he’s even all that interested in me, or if he’s only sticking around for sex. I mean, we only see each other once a week, don’t text in between dates other than to set up a date, and sex is always expected with every date. Does it seem like he is only interested in sex or something more? Any signs for how I can tell?",True,False,False,dating,t5_2qhb1,879747,public,self,How can I (25 F) tell if a guy (25 M) is only interested in sex or if he is interested in something more in the future?,0,[],1.0,https://www.reddit.com/r/dating/comments/oeehhu/how_can_i_25_f_tell_if_a_guy_25_m_is_only/,all_ads,6,,
11,[],False,Ok-Quote-6956,,[],,text,t2_a36sfi9w,False,False,[],False,False,1625513572,self.dating,https://www.reddit.com/r/dating/comments/oeeitu/question_about_sp/,{},oeeitu,False,True,False,False,False,True,True,False,#ff4500,dating,"[{'e': 'text', 't': 'Question'}]",a9531dce-194e-11e5-b177-0eff099c3d1f,Question,light,richtext,False,False,True,9,0,False,all_ads,/r/dating/comments/oeeitu/question_about_sp/,False,6,1625513583,1,I had a question about a sp.  Are there any private women/girl groups on here where they discuss guys they have dated? Let me know in the comments.,True,False,False,dating,t5_2qhb1,879753,public,self,Question about sp,0,[],1.0,https://www.reddit.com/r/dating/comments/oeeitu/question_about_sp/,all_ads,6,,
12,[],False,hiimaredditnoob,,[],,text,t2_11k4cv,False,False,[],False,False,1625513978,self.dating,https://www.reddit.com/r/dating/comments/oeenx1/should_i_admit_my_feelings_to_my_long_distance/,{},oeenx1,False,True,False,False,False,True,True,False,#ea0027,dating,"[{'e': 'text', 't': 'I Need Advice'}]",19ec58c2-9f74-11e7-81a1-0e2bf15991f0,I Need Advice,light,richtext,False,False,True,3,0,False,all_ads,/r/dating/comments/oeenx1/should_i_admit_my_feelings_to_my_long_distance/,False,6,1625513988,1,"We’ve been friends for over 2 years now despite living in different countries. In the past I think we kinda flirted with the idea of being interested in each other but due to circumstance not making being with eachother in person often easy, we pulled back feelings. I went on to “date” a couple guys and any time I thought of him, I would get a weird feeling of guilt over me and feeling scared of commitment because of its possible effects on my relationship with him
None of the men I was dating seemed to have the same bond with me that I shared with him

Well unfortunately, he will be leaving for the military next weekend for a year, and my contact with him will be extremely limited because of it. I’ve been really emotional about it especially now that the day is set and realizing how strongly I do feel for this person and wishing my future would be with him rather than others.

So is it even worth telling him? Or should I keep myself from a possibly uncomfortable conversation that we will both have on our mind for a year?",True,False,False,dating,t5_2qhb1,879762,public,self,Should I admit my feelings to my long distance friend?,0,[],1.0,https://www.reddit.com/r/dating/comments/oeenx1/should_i_admit_my_feelings_to_my_long_distance/,all_ads,6,,
13,[],False,okayvish,,[],,text,t2_73wxbe14,False,False,[],False,False,1625513987,self.dating,https://www.reddit.com/r/dating/comments/oeeo0f/how_can_to_get_rid_of_the_fear_of_rejection_and/,{},oeeo0f,False,True,False,False,False,True,True,False,#ea0027,dating,"[{'e': 'text', 't': 'I Need Advice'}]",19ec58c2-9f74-11e7-81a1-0e2bf15991f0,I Need Advice,light,richtext,False,False,True,2,0,False,all_ads,/r/dating/comments/oeeo0f/how_can_to_get_rid_of_the_fear_of_rejection_and/,False,6,1625513998,1,Background: This person isn’t a full stranger because we have mutual friends. I heard from their friend that he thought I was attractive but he hasn’t reached out on social media.,True,False,False,dating,t5_2qhb1,879762,public,self,How can to get rid of the fear of rejection and ask a person out?,0,[],1.0,https://www.reddit.com/r/dating/comments/oeeo0f/how_can_to_get_rid_of_the_fear_of_rejection_and/,all_ads,6,,
14,[],False,georgirose19,,[],,text,t2_x7cxs,False,False,[],False,False,1625514161,self.dating,https://www.reddit.com/r/dating/comments/oeeq77/not_committed_after_a_year_and_a_half_need_advice/,{},oeeq77,False,True,False,False,False,True,True,False,#ea0027,dating,"[{'e': 'text', 't': 'I Need Advice'}]",19ec58c2-9f74-11e7-81a1-0e2bf15991f0,I Need Advice,light,richtext,False,False,True,15,0,False,all_ads,/r/dating/comments/oeeq77/not_committed_after_a_year_and_a_half_need_advice/,False,6,1625514172,1,"Hello All, 
So I am in a little bit of a predicament and I would love peoples advice! Because I’m just not sure how to move forward. I will try and make it as summerized as possible while also give the main details. Okay here goes, soooo me (24F) and the guy I’m seeing (36M) met on tinder in February of 2020! We hit off so well right from the beginning, sexually and emotionally/ compatibility. Though, he had just broken up with his ex of 6 years 2/3 weeks prior of us meeting! Very intense. But he told me he had been emotionally checked out of the relationship for the past year or more and had just been getting up the courage to finally break it off after so long. So we agreed to be in a FWB situation because he obviously didn’t wanna be in a relationship again, but shared with me he doesn’t like seeing lots of people and just wants to find someone he connects well with. So he asked me to be exclusive FWB. I was hesitant at first because I was almost about a year from breaking off my previous relationship of 4 years so I could easily put myself in his shoes and respect how he felt. But I wasn’t sure if I was ready to be exclusively seeing someone, I was enjoying my freedom. But I decided to agree to exclusive fwb because I really liked his company and figured it would actually be healthy for me to simmer it down and focus on one person again, in a casual way.

More back story: his ex and him had a lease together so he agreed to let her keep the apartment til the lease is up and he will go stay with parents. That way he could also use this time to pay off some debt as well so it worked out for him. Anyways. Within like 2 weeks of us starting to see each other we became extremely connected very quickly. We have very similar lifestyles and get along GREAT. We communicate beautifully and seamlessly as well when it comes to day to day problem solving/ and saying how we feel. So we started working out together every day etc. and basically started acting like a couple. Except all the romantic things that come with being a couple of course. But we still go out together etc. he just doesn’t necessarily do romantic things or like take me on “dates”. 

So I am also young and living with parents currently, which means we both live in a compromised living space hahaha ahhhh and it feels like high school. Ugh. But! Oh boy oh boy the sex is ridiculous. Amazing. The most chemistry I’ve ever had with someone sexually and that’s (obviously) a huge basis of our relationship too. We both say we are having the best sex of our lives. 
So we did a lot of car fucking and then would try and get a room every 2 weeks or so to spend more time together etc. 

Long story short about 8 months down the road I express that we are super duper connected and basically a couple so why have we not become one yet? Again I was waiting and giving him loads of space. Never brought it up but in the back of my head I’m thinking like this does notttttt seem like any FWB situation at all. We are basically dating. And also exclusive remember! But I like him a lot so I went with it! I figured okay it’s only a matter of time before he asks to be his gf. But upon having that conversation he felt differently and his excuses were as follows:
1. I live at home and don’t feel like I’m in a place where I can offer a solid relationship. (Valid and I respect it if that’s the truth but I mean, you’re basically in one dude.) 
2. I don’t want to be committed. I’m enjoying my freedom and he very specifically said not freedom with seeing other people but freedom to not be obligated to what a relationship entails ( valid and I understand but again, it’s been 8 months of basically being in a relationship and he also went on to say that his ex is super jealous type, always asking where he is etc. I am not like that at all and have exemplified to him that I am nothing like her so I said if he and I were in a relationship you wouldn’t be dealing with those things it would be different, he still said he needed time ) 
3. He’s scared of what the ex will do if she finds out. She still possess his belongings which furnish the apartment she is staying in and also watching his dog until he gets a sufficient place to have the dog. So he’s scared she will take the dog or ruin his belongings. ( valid but if he really cared about that he could make a change to fix that issue)
Again I want to say I totally respect all of these things if they are truly his feelings but something just seems off based on how committed to me he actually has been so far. I would expect those things to come from someone I see maybe once a week and all we do is fuck, maybe sometimes do other things but we aren’t super committed to each other’s times and involved in each other’s lives so deeply. I actually have met his parents and did early on. It happened informally but now I actually run and manage his fathers retirement business for him! I know all of his family but here’s the other thing. He REFUSES to meet mine. His excuse for that is that he loathes meeting parents even if they are just his friends parents ans it’s been like that since high school and I believe him…but come on man. Grow up. 

So now we are at a year and 5 months of being exclusive with this guy apparently just as “fwb” 
He still refuses to meet my parents and I’m just about getting over it. But I REALLY REALLY REALLY like him and we are honeslty so perfect for each other in so many ways. I’m hanging on to that and hoping he will finally man up. Because a part of me doesn’t care what our label is, I’m just happy to have his company and share what I do have with him that’s why I’ve been around for so long now. But I’m at the point where I feel super ready for a relationship and I have so much love to give and I want to give it to someone, specifically him! 

When I bring it up he still says he doesn’t feel stable enough for a relationship. He says “I just need my own apartment again and my dog back and then things will be better” I’ve waited a year and a half for those things to happen! Why does he give me every reason to believe he wants to be in a relationship with me but actually doesn’t!!!! Should I wait and see if he comes around or tell him it’s time to lock me down or move on?  I’m soooooo sad about doing that cause again it will be like an actual breakup. We do lots of day to day thinfs together and I would miss that. But I also think maybe he needs to experience that and miss me a bit to realize what he’s missing. Idk. But I’m also scared of losing him. There is that part of me that wants to keep him locked down haha ;) and that’s why I haven’t tried to set an ultimatum. 

Any words of wisdom are much appreciated and that’s so much for your time and reading! Much love :).",True,False,False,dating,t5_2qhb1,879769,public,self,Not committed after a year and a half. Need advice!,0,[],1.0,https://www.reddit.com/r/dating/comments/oeeq77/not_committed_after_a_year_and_a_half_need_advice/,all_ads,6,,
15,[],False,okayvish,,[],,text,t2_73wxbe14,False,False,[],False,False,1625514228,self.dating,https://www.reddit.com/r/dating/comments/oeer0a/how_to_get_rid_of_the_fear_of_rejection_and_ask/,{},oeer0a,False,True,False,False,False,True,True,False,#ea0027,dating,"[{'e': 'text', 't': 'I Need Advice'}]",19ec58c2-9f74-11e7-81a1-0e2bf15991f0,I Need Advice,light,richtext,False,False,False,5,0,False,all_ads,/r/dating/comments/oeer0a/how_to_get_rid_of_the_fear_of_rejection_and_ask/,False,6,1625514240,2,Background: This person isn’t a full stranger because we have mutual friends. I heard from their friend that he thought I was attractive but he hasn’t reached out on social media.,True,False,False,dating,t5_2qhb1,879768,public,self,How to get rid of the fear of rejection and ask someone out?,0,[],1.0,https://www.reddit.com/r/dating/comments/oeer0a/how_to_get_rid_of_the_fear_of_rejection_and_ask/,all_ads,6,,
