,all_awardings,allow_live_comments,author,author_flair_css_class,author_flair_richtext,author_flair_text,author_flair_type,author_fullname,author_is_blocked,author_patreon_flair,author_premium,awarders,can_mod_post,contest_mode,created_utc,domain,full_link,gildings,id,is_created_from_ads_ui,is_crosspostable,is_meta,is_original_content,is_reddit_media_domain,is_robot_indexable,is_self,is_video,link_flair_background_color,link_flair_css_class,link_flair_richtext,link_flair_template_id,link_flair_text,link_flair_text_color,link_flair_type,locked,media_only,no_follow,num_comments,num_crossposts,over_18,permalink,pinned,retrieved_on,score,selftext,send_replies,spoiler,stickied,subreddit,subreddit_id,subreddit_subscribers,subreddit_type,thumbnail,title,total_awards_received,treatment_tags,upvote_ratio,url,parent_whitelist_status,pwls,whitelist_status,wls,removed_by_category,author_cakeday,post_hint,preview
0,[],False,second_SIX,,[],,text,t2_jxuh5elg,False,False,False,[],False,False,1645884955,self.dating,https://www.reddit.com/r/dating/comments/t1y277/dating_app_for_short_guys/,{},t1y277,False,True,False,False,False,True,True,False,#ff4500,dating,"[{'e': 'text', 't': 'Question'}]",a9531dce-194e-11e5-b177-0eff099c3d1f,Question,light,richtext,False,False,True,1,0,False,/r/dating/comments/t1y277/dating_app_for_short_guys/,False,1645884966,1,"So being a 42 year old attractive male standing at only 5'3""... Is there a known dating app for short guys since there's an app for everything else? The girls on the normal sites just seems so shallow when it comes to height... Any help appreciated!",True,False,False,dating,t5_2qhb1,1161915,public,self,Dating app for short guys??,0,[],1.0,https://www.reddit.com/r/dating/comments/t1y277/dating_app_for_short_guys/,,,,,,,,
1,[],False,SleepyPiplup99,,[],,text,t2_51ug58on,False,False,False,[],False,False,1645885213,self.dating,https://www.reddit.com/r/dating/comments/t1y5ec/how_to_start_the_next_conversation/,{},t1y5ec,False,True,False,False,False,True,True,False,#ea0027,dating,"[{'e': 'text', 't': 'I Need Advice'}]",19ec58c2-9f74-11e7-81a1-0e2bf15991f0,I Need Advice,light,richtext,False,False,True,1,0,False,/r/dating/comments/t1y5ec/how_to_start_the_next_conversation/,False,1645885223,1,"So for the first time I matched with a guy yesterday.

We message each other for about an hour. Talking about some hobbies we both had on our profiles and traveling.

Now that it's a new day I have no clue how to start a new conversation. It's my first time using a dating app.",True,False,False,dating,t5_2qhb1,1161914,public,self,How to start the next conversation,0,[],1.0,https://www.reddit.com/r/dating/comments/t1y5ec/how_to_start_the_next_conversation/,no_ads,0.0,no_ads,0.0,,,,
2,[],False,L_9D4_A,,[],,text,t2_2tuvbucd,False,False,False,[],False,False,1645885514,self.dating,https://www.reddit.com/r/dating/comments/t1y95g/when_is_the_last_time_you_had_sex/,{},t1y95g,False,True,False,False,False,True,True,False,#ff4500,dating,"[{'e': 'text', 't': 'Question'}]",a9531dce-194e-11e5-b177-0eff099c3d1f,Question,light,richtext,False,False,True,1,0,False,/r/dating/comments/t1y95g/when_is_the_last_time_you_had_sex/,False,1645885525,1,"For me it was last summer and even then it was a one night stand and wasn't great. Last good sex was summer 2019 and again, a one night stand. 

I'm getting to the point where I feel the need to master masturbate but don't even want to... Can't be bothered.",True,False,False,dating,t5_2qhb1,1161916,public,self,When is the last time you had sex?,0,[],1.0,https://www.reddit.com/r/dating/comments/t1y95g/when_is_the_last_time_you_had_sex/,no_ads,0.0,no_ads,0.0,,,,
3,[],False,VinceAndVic,,[],,text,t2_14nxff,False,False,False,[],False,False,1645886224,self.dating,https://www.reddit.com/r/dating/comments/t1yhrn/incredibly_shy_me_23m_got_a_date_with_one_of_the/,{},t1yhrn,False,True,False,False,False,True,True,False,#46d160,,"[{'e': 'text', 't': 'Success!'}]",6b44dc18-cc88-11eb-95f2-0ed00be16b15,Success!,dark,richtext,False,False,False,1,0,False,/r/dating/comments/t1yhrn/incredibly_shy_me_23m_got_a_date_with_one_of_the/,False,1645886234,1,"I can't believe it really. I was volunteering for the organisation of a local music event and so was she so that's how we met. I could feel we immediately clicked and even though I'm shy and didn't talk so so much with her, I could see she was kinda feeling the same and looking for me sometimes. We both had problems during the event and we both supported and assisted each other without any hesitation, it was so cute. But I'm so shy that even though I was dying to get her number or something, I wouldn't have made a move, because I never do. I noticed sometimes I could have made a move but I'm always so scared of rejection, and I never really know how to word things like that so I just do nothing, which is a shame really. I never had a girlfriend, and the few times something happened with some girls is because they made a move. But I'm trying to help this really and my best friend who was in attendance, knows this. When I told her about the situation she basically forced me and said we're not leaving till you make a move, so I did and she very enthusiastically gave me her number. Then I sent her a text and she was praising me, telling me she was so happy to meet me and was hoping to catch up soon.

I really can't believe it. She is so incredibly pretty, she has a cool style, we share the same passion, she seems so sweet, but yet I could see she's a very strong person too, which is something I love. I will ask her to catch up tomorrow, hoping all will go fine. I know it's just a date but I don't think I ever had one with someone I was so interested in, and the fact that she's maybe even more enthusiastic than me is mind boggling to me lol. 

Anyway, just wanted to share my happiness with you guys. Wish me luck!",True,False,False,dating,t5_2qhb1,1161922,public,self,Incredibly shy me (23M) got a date with one of the coolest girl I ever met!,0,[],1.0,https://www.reddit.com/r/dating/comments/t1yhrn/incredibly_shy_me_23m_got_a_date_with_one_of_the/,no_ads,0.0,no_ads,0.0,,,,
4,[],False,StormzU14,,[],,text,t2_7y0u362f,False,False,False,[],False,False,1645886270,self.dating,https://www.reddit.com/r/dating/comments/t1yib5/constant_blocking/,{},t1yib5,False,True,False,False,False,True,True,False,#ff4500,dating,"[{'e': 'text', 't': 'Question'}]",a9531dce-194e-11e5-b177-0eff099c3d1f,Question,light,richtext,False,False,False,1,0,False,/r/dating/comments/t1yib5/constant_blocking/,False,1645886280,1,"This has been on my mind for a while now. There's this one girl that I really like and we've been hanging out quite often recently. She enjoys my company a lot, at least that's what I'm able to tell. However, ever since we started going out (it's been 7 months so far), she would temporarily block me on all sorts of social media every once in a while. (she would block me for a straight week sometimes). Whenever I try approaching her regarding this topic, she would simply act as if she hadn't done anything. Has anyone ever been in this kind of situation? I'm seriously baffled here.",True,False,False,dating,t5_2qhb1,1161922,public,self,Constant Blocking,0,[],1.0,https://www.reddit.com/r/dating/comments/t1yib5/constant_blocking/,no_ads,0.0,no_ads,0.0,,,,
5,[],False,-macamina,,[],,text,t2_a9dp0d7a,False,False,False,[],False,False,1645886718,self.dating,https://www.reddit.com/r/dating/comments/t1yo0w/how_can_you_say_that_you_completely_healed_from/,{},t1yo0w,False,True,False,False,False,True,True,False,#ff4500,dating,"[{'e': 'text', 't': 'Question'}]",a9531dce-194e-11e5-b177-0eff099c3d1f,Question,light,richtext,False,False,False,1,0,False,/r/dating/comments/t1yo0w/how_can_you_say_that_you_completely_healed_from/,False,1645886729,1,"I (21f) had a 4-year relationship with my hs sweetheart. We decided to separate because of lack of time, miscommunication, college stuff, and some mild third party issue. 

It has been more than 2 years and in that span, I tried to moved on and understand myself more. Then, I entertained guys again. But I never entered a serious rs because of their red flags and I will end it as soon as i saw that we will have a big problem in the future because of incompatibility, and other reasons that I just felt. 

It was hard for me to move forward and I literally cry myself to sleep a year ago, as I thought he would be the guy I will end up with because we really had a good dynamics in our relationship/friendship. But looking back, it is so much better that we took our ways differently. It's a good choice that we ended our relationship 2 years ago. We're now both doing pretty good with our own lives. I have a full time job and currently in my final sem in college.


It just that, there's some time that I feel unease and strange. There's this void that came from our relationship that I can't figure out. That's why I want to know and read your advice on how can you say that you completely healed from you past relationship? I had a lot of growth from the past 2 years, but being completely healed from my first heartbreak is not one of them.",True,False,False,dating,t5_2qhb1,1161925,public,self,how can you say that you completely healed from your past relationship?,0,[],1.0,https://www.reddit.com/r/dating/comments/t1yo0w/how_can_you_say_that_you_completely_healed_from/,no_ads,0.0,no_ads,0.0,,,,
6,[],False,YassineHamed,,[],,text,t2_2f0f0lsf,False,False,False,[],False,False,1645886835,self.dating,https://www.reddit.com/r/dating/comments/t1ypgx/how_do_i_change_the_topic/,{},t1ypgx,False,True,False,False,False,True,True,False,#ea0027,dating,"[{'e': 'text', 't': 'I Need Advice'}]",19ec58c2-9f74-11e7-81a1-0e2bf15991f0,I Need Advice,light,richtext,False,False,True,1,0,False,/r/dating/comments/t1ypgx/how_do_i_change_the_topic/,False,1645886845,1,"So there’s this girl I have a huge crush on she’s beautiful, she’s nice, she’s funny and most importantly I feel great around her. The problem is because we study together we only really talk about school and things like that. I don’t mind it because I get to talk to her but I’d really love to talk about other things like hobbies and passions. I’d say I’m good at talking to girls , it’s just that I never talked to het that way and am scared of what may happen. Ps: we’re about 18",True,False,False,dating,t5_2qhb1,1161928,public,self,How do I change the topic,0,[],1.0,https://www.reddit.com/r/dating/comments/t1ypgx/how_do_i_change_the_topic/,no_ads,0.0,no_ads,0.0,,,,
7,[],False,bxyyrd,,[],,text,t2_cwvt0v0a,False,False,False,[],False,False,1645886871,self.dating,https://www.reddit.com/r/dating/comments/t1ypw0/when_to_kiss_her_what_are_signs_to_kiss_her/,{},t1ypw0,False,False,False,False,False,False,True,False,#ea0027,dating,"[{'e': 'text', 't': 'I Need Advice'}]",19ec58c2-9f74-11e7-81a1-0e2bf15991f0,I Need Advice,light,richtext,False,False,True,1,0,False,/r/dating/comments/t1ypw0/when_to_kiss_her_what_are_signs_to_kiss_her/,False,1645886882,1,[removed],True,False,False,dating,t5_2qhb1,1161928,public,self,When to Kiss her? What are signs to kiss her? Should I be patient?,0,[],1.0,https://www.reddit.com/r/dating/comments/t1ypw0/when_to_kiss_her_what_are_signs_to_kiss_her/,no_ads,0.0,no_ads,0.0,reddit,,,
8,[],False,throwaway01600752239,,[],,text,t2_9g0nnt2y,False,False,False,[],False,False,1645887079,self.dating,https://www.reddit.com/r/dating/comments/t1ysio/his_location_updated_on_tinder_is_cheating_likely/,{},t1ysio,False,True,False,False,False,True,True,False,#ffb000,,"[{'e': 'text', 't': 'Tinder/Online Dating'}]",5214d2ac-61f1-11e8-8bb1-0ed15e4a39c0,Tinder/Online Dating,dark,richtext,False,False,False,1,0,False,/r/dating/comments/t1ysio/his_location_updated_on_tinder_is_cheating_likely/,False,1645887089,1,"
Boyfriend (24M) and I (23F) met 3 months ago on tinder. We both kept our profiles but disabled discovery/removed ourselves from the swipe deck and deleted the app. I would occasionally redownload the app to read through our first conversations. His profile would always show as 34 km away, which is the exact distance of the apartment he lived in at the time he disabled and deleted his account. He recently moved closer but his profile still showed as 34 km away. Recently, I was on his profile and noticed his distance changed to 20 km away. His new apartment is exactly 17 km away from me. I have not allowed tinder to use my location, and I was at the same location I always was. 

I know your location doesn’t update unless you enable location and start swiping. I confronted the boyfriend about this and he denies ever swiping or even redownloading the app. He has never given me reason to believe he would cheat, quite the opposite actually. He says he could make up some white lie (to show his friends my profile or to read through our old conversations for example) to make me stop worrying about it but isn’t because he wants to be honest. He has let me go through his account and nothing would suggest he has been active recently, but of course, things can be deleted. I am tempted to believe him, would that make me a complete idiot? How likely is it that this is just a glitch or some other technical issue? No one in my life is experienced with dating apps so I’m turning to you guys.",True,False,False,dating,t5_2qhb1,1161929,public,self,"His location updated on tinder, is cheating likely?",0,[],1.0,https://www.reddit.com/r/dating/comments/t1ysio/his_location_updated_on_tinder_is_cheating_likely/,no_ads,0.0,no_ads,0.0,,,,
9,[],False,LrdFyrestone,,[],,text,t2_8xe8tsvx,False,False,False,[],False,False,1645887101,self.dating,https://www.reddit.com/r/dating/comments/t1ysrv/i_26m_wouldnt_be_married_today_if_i_hadnt_told_my/,{},t1ysrv,False,True,False,False,False,True,True,False,#46d160,,"[{'e': 'text', 't': 'Success!'}]",6b44dc18-cc88-11eb-95f2-0ed00be16b15,Success!,dark,richtext,False,False,True,1,0,False,/r/dating/comments/t1ysrv/i_26m_wouldnt_be_married_today_if_i_hadnt_told_my/,False,1645887111,1,"I've always kinda been a pushover when it came to women. I never made the first move. I was always a nervous wreck and stuttered over my words. When my wife and I first met, I was a nervous wreck but I knew I liked her. We weren't sure about each other at all. We just drove around town and talked.

After talking for about three months, I asked her on a date. As we're out having our night, her phone lit up with some dude on SC. She told me who it was, despite not needing to, and I said ""Sure go ahead and message him back."" This dude had basically ghosted her after they'd been out a few weeks prior and made zero effort. So when she replied back ""What's up?"" His response was shady and all ""Been busy."" Didn't even try and make time after ghosting for like 2 months. 

They small talked and I looked at this girl I liked a lot and was like ""Screw him. You don't need that kinda negativity in your life."" I just blurted it without thinking. In my head I was thinking, ""I can't let her get away. She's amazing."" I was jealous. So I grew some balls and made the move on her. 

The fact she said ""Yes"" to being my girlfriend still blows my mind after being together 2.5yrs and now married almost a year. My wife teases me for that day because of how protective I was despite not even being her partner at the time but she's glad that I did and I am too. 

I'm glad I manned up.",True,False,False,dating,t5_2qhb1,1161929,public,self,I (26m) wouldn't be married today if I hadn't told my wife (21f) to reply to the guy who ghosted her on snapchat when he texted her on our first date.,0,[],1.0,https://www.reddit.com/r/dating/comments/t1ysrv/i_26m_wouldnt_be_married_today_if_i_hadnt_told_my/,no_ads,0.0,no_ads,0.0,,,,
10,[],False,Distraughtsugardaddy,,[],,text,t2_4hvvjv8e,False,False,False,[],False,False,1645887551,self.dating,https://www.reddit.com/r/dating/comments/t1yycw/are_popular_people_harder_to_date/,{},t1yycw,False,True,False,False,False,True,True,False,#ea0027,dating,"[{'e': 'text', 't': 'I Need Advice'}]",19ec58c2-9f74-11e7-81a1-0e2bf15991f0,I Need Advice,light,richtext,False,False,True,1,0,False,/r/dating/comments/t1yycw/are_popular_people_harder_to_date/,False,1645887562,1,"I met this girl but she’s very popular. I am not as popular as her but it got me wondering, since she has way more options and friends and social events and outings all the time, and is frequently meeting new people all the time, does this make it more likely for her to sleep around and/or be harder to date?

If we take a semi famous person as an example, say someone who was on a tv show like Too Hot to Handle. They are getting offers all the time from thirst men and/or rich famous men DM’ing them. 

So is it harder to date these types of ppl?",True,False,False,dating,t5_2qhb1,1161929,public,self,Are popular people harder to date?,0,[],1.0,https://www.reddit.com/r/dating/comments/t1yycw/are_popular_people_harder_to_date/,no_ads,0.0,no_ads,0.0,,,,
11,[],False,Foxandread,,[],,text,t2_jch9olmr,False,False,False,[],False,False,1645887581,self.dating,https://www.reddit.com/r/dating/comments/t1yyqu/this_guy_told_me_he_was_trying_to_be_a_good_boy/,{},t1yyqu,False,True,False,False,False,True,True,False,#ea0027,dating,"[{'e': 'text', 't': 'I Need Advice'}]",19ec58c2-9f74-11e7-81a1-0e2bf15991f0,I Need Advice,light,richtext,False,False,True,1,0,False,/r/dating/comments/t1yyqu/this_guy_told_me_he_was_trying_to_be_a_good_boy/,False,1645887592,1,"

Awhile ago I slept with this guy who is in a relationship. And he tried to hookup with me again but I didn’t meet him. So during the summer he saw me wearing a sexy dress and he asked me if I was trying to give him a hard time. And when I asked him if I could practice Massage on him. He said he would love to but that he was trying to be a good boy. 

I’m actually talking to another guy now so i don’t think about him as much. But sometimes I see him where he works.",True,False,False,dating,t5_2qhb1,1161929,public,self,This guy told me he was trying to be a good boy. What does that mean?,0,[],1.0,https://www.reddit.com/r/dating/comments/t1yyqu/this_guy_told_me_he_was_trying_to_be_a_good_boy/,no_ads,0.0,no_ads,0.0,,,,
12,[],False,Interesting_Sand530,,[],,text,t2_584n843i,False,False,False,[],False,False,1645888205,self.dating,https://www.reddit.com/r/dating/comments/t1z73d/did_i_get_ghosted/,{},t1z73d,False,True,False,False,False,True,True,False,#ea0027,dating,"[{'e': 'text', 't': 'I Need Advice'}]",19ec58c2-9f74-11e7-81a1-0e2bf15991f0,I Need Advice,light,richtext,False,False,False,1,0,False,/r/dating/comments/t1z73d/did_i_get_ghosted/,False,1645888215,1,"  

So i have so far gone on two dates with this guy and we have been talking for pretty much three months now and we talk like almost everyday. However, we live somewhat far apart, which is why we have only met two times really, and also because of covid obviously. Anyway I asked him if he wanted to meet up and do something this week and at first he was like “yeah, tomorrow?” and then like “shoot, tomorrow is Friday, not Saturday.” So I went but on Saturday would you like to meet up and he said yes. And at this point were texting each other more frequently then usual, but Friday comes around and I notice that I am left on delivered longer then usual but its no big deal but just to make sure since I am the one who travels to his city I ask if we are still on tomorrow, (this is roughly translated cause we weren’t speaking in English) and he answered back “should we?” and so I said something along the lines of that’s what I’m asking so he wrote back “me too.” Then I was kind of like, I don’t remember word for word but I wrote “lmaooo if you don’t feel like or want to meet up anymore then just say that instead” because to me it really isn’t that big of a deal if someone cancels or just doesn’t feel like they want to hang out anymore. He responded with “hahah its not that I don’t want to meet up, I do. I’m just messed up and I feel mean.” 

I didn’t really understand what he meant by that so I wrote back, hahahhah what? Makes no sense. Why would you feel mean? 

He hasn’t responded and its been a week, he hasn’t blocked me or anything either (I think that if he had it would make me feel better actually, because then I know 100% where I stand). I am totally new to boys and everything like that and I don’t have any boy friends that I can ask. If you ghost someone you usually block them, no? maybe I’m being dramatic and hes just thinking or something, but it bugs me that he stopped responding when I asked him a question. Maybe I’m being dramatic or something idk. 

Anyway, right now I cant decide whether I should text him and see whats up or if I should just let it be.  Because I kind of want an explanation but at the same time i'm scared that he might say something thats mean. So should i just leave it or say something?",True,False,False,dating,t5_2qhb1,1161930,public,self,did i get ghosted?,0,[],1.0,https://www.reddit.com/r/dating/comments/t1z73d/did_i_get_ghosted/,no_ads,0.0,no_ads,0.0,,,,
13,[],False,Either-Treat8913,,[],,text,t2_a3wougca,False,False,False,[],False,False,1645888478,self.dating,https://www.reddit.com/r/dating/comments/t1zalx/is_it_ok_if_your_date_is_seeing_someone_else/,{},t1zalx,False,True,False,False,False,True,True,False,#ff4500,dating,"[{'e': 'text', 't': 'Question'}]",a9531dce-194e-11e5-b177-0eff099c3d1f,Question,light,richtext,False,False,True,1,0,False,/r/dating/comments/t1zalx/is_it_ok_if_your_date_is_seeing_someone_else/,False,1645888488,1,"In my contry, we start with exclusive dating most of the time (even if we're getting to know each other). But I heard there are steps to dating in western culture. 'Dating (You can see others) - exclusvie dating - in relationship' Like this.

So I'm curious, Assuming that it's been couple weeks since you got to know that person, You guys are not jealous at all even if you know that your date is meeting someone else? Or try not to care? Or you just leave him/her cuz you don't wanna be his/her another option?",True,False,False,dating,t5_2qhb1,1161930,public,self,Is it ok if your date is seeing someone else?,0,[],1.0,https://www.reddit.com/r/dating/comments/t1zalx/is_it_ok_if_your_date_is_seeing_someone_else/,no_ads,0.0,no_ads,0.0,,,,
14,[],False,nnqm,,[],,text,t2_i496w,False,False,False,[],False,False,1645888693,self.dating,https://www.reddit.com/r/dating/comments/t1zdez/online_dating_texting/,{},t1zdez,False,True,False,False,False,True,True,False,#ff4500,dating,"[{'e': 'text', 't': 'Question'}]",a9531dce-194e-11e5-b177-0eff099c3d1f,Question,light,richtext,False,False,False,1,0,False,/r/dating/comments/t1zdez/online_dating_texting/,False,1645888704,1,"(32M) Got out of a long-term relationship (9 yrs) more than six months ago. I've been venturing out on dating apps recently. I definitely feel rusty (we used websites back in my day lol) and wondering if this texting dynamic is common/normal...

I'm using Hinge and trying to comment with a like. I get a response and try to initiate a conversation, but the answers are one-liners and she doesn't ask me anything about myself or only reply once a day. Is this like waiting for the chase? Expecting the guy to drive all the conversation? 

Any tips appreciated! xD",True,False,False,dating,t5_2qhb1,1161929,public,self,Online Dating: Texting,0,[],1.0,https://www.reddit.com/r/dating/comments/t1zdez/online_dating_texting/,no_ads,0.0,no_ads,0.0,,,,
15,[],False,Dood7897,,[],,text,t2_2lfcvksu,False,False,False,[],False,False,1645888858,self.dating,https://www.reddit.com/r/dating/comments/t1zfli/is_a_double_date_as_a_first_date_a_good_idea/,{},t1zfli,False,True,False,False,False,True,True,False,#ff4500,dating,"[{'e': 'text', 't': 'Question'}]",a9531dce-194e-11e5-b177-0eff099c3d1f,Question,light,richtext,False,False,False,1,0,False,/r/dating/comments/t1zfli/is_a_double_date_as_a_first_date_a_good_idea/,False,1645888869,1,"I (22M) went out to a dancey bar and met a really cute girl who I danced with and made out with. Eventually I got her number. My good friend (22M) was also at the bar with me, as was this girl’s friend. It seemed that her friend was somewhat interested in my friend as well, but he never made a move. He eventually admitted that he regretted it and should have, but they had left at that point. I’m planning on texting her this morning to see if she’d be down to go on a date, but since it seems like my friend and her friend could be compatible I was thinking of asking if she wanted to go on a double date. I was thinking that it would be a fun idea and it would take pressure off all of us, individually. However, after reading some other posts on the topic, some people were suggesting it wasn’t a great idea for a first date because it won’t allow me to get to know her on an individual level. One thing to note though is that in most of these posts they were either going with an already well-established couple that was their date’s good friends or that the poster wasn’t brining their own friend along, it was just that the other two were friends and another rando joined. Anyway, thoughts on a double date as a first date?",True,False,False,dating,t5_2qhb1,1161931,public,self,Is a double date as a first date a good idea?,0,[],1.0,https://www.reddit.com/r/dating/comments/t1zfli/is_a_double_date_as_a_first_date_a_good_idea/,no_ads,0.0,no_ads,0.0,,,,
