,all_awardings,allow_live_comments,author,author_flair_background_color,author_flair_css_class,author_flair_text,author_flair_text_color,awarders,banned_by,can_mod_post,contest_mode,created_utc,domain,full_link,gildings,id,is_crosspostable,is_meta,is_original_content,is_reddit_media_domain,is_robot_indexable,is_self,is_video,link_flair_background_color,link_flair_css_class,link_flair_richtext,link_flair_template_id,link_flair_text,link_flair_text_color,link_flair_type,locked,media_only,no_follow,num_comments,num_crossposts,over_18,parent_whitelist_status,permalink,pinned,pwls,removed_by_category,retrieved_on,score,send_replies,spoiler,stickied,subreddit,subreddit_id,subreddit_subscribers,subreddit_type,thumbnail,title,total_awards_received,treatment_tags,upvote_ratio,url,whitelist_status,wls,author_flair_richtext,author_flair_type,author_fullname,author_patreon_flair,author_premium,selftext,edited,author_cakeday
17,[],False,Nobraindog,,,,,[],,False,False,1622449148,self.dating,https://www.reddit.com/r/dating/comments/noyb99/be_friends_with_a_guy_hoping_for_more/,{},noyb99,True,False,False,False,True,True,False,,dating,"[{'e': 'text', 't': 'Question'}]",a9531dce-194e-11e5-b177-0eff099c3d1f,Question,dark,richtext,False,False,False,29,0,False,all_ads,/r/dating/comments/noyb99/be_friends_with_a_guy_hoping_for_more/,False,6,,1622453235,2,True,False,False,dating,t5_2qhb1,806817,public,self,Be friends with a guy hoping for more?,0,[],1.0,https://www.reddit.com/r/dating/comments/noyb99/be_friends_with_a_guy_hoping_for_more/,all_ads,6,[],text,t2_a0b5j5wg,False,False,"So I see that all the advice on the internet regarding being friends with a girl in order for her to see your true value and fall for you eventually is that we as guys should never do it as it rarely works. And we as guys should have more respect for ourselves.

Now I’m wondering if this advice goes both ways. Would girls stay friends with a guy so that he eventually changes his mind and decides to date her. Is that something common for girls to do? Does it ever work?",,
18,[],False,Klj143,,,,,[],,False,False,1622449630,self.dating,https://www.reddit.com/r/dating/comments/noyfbh/hmmm/,{},noyfbh,True,False,False,False,True,True,False,,dating,"[{'e': 'text', 't': 'Question'}]",a9531dce-194e-11e5-b177-0eff099c3d1f,Question,dark,richtext,False,False,True,6,0,False,all_ads,/r/dating/comments/noyfbh/hmmm/,False,6,,1622453612,1,True,False,False,dating,t5_2qhb1,806820,public,self,Hmmm,0,[],1.0,https://www.reddit.com/r/dating/comments/noyfbh/hmmm/,all_ads,6,[],text,t2_b8skyblf,False,False,"How should I take a mans response, when he say. ""If we're living together."" We have only been dating a few months, and we are not officially, official.",,
19,[],False,Mcdonaldsishot,,,,,[],,False,False,1622451453,self.dating,https://www.reddit.com/r/dating/comments/noyv2d/fiance_acts_childish_after_lying_to_me/,{},noyv2d,True,False,False,False,True,True,False,,dating,"[{'e': 'text', 't': 'I Need Advice'}]",19ec58c2-9f74-11e7-81a1-0e2bf15991f0,I Need Advice,dark,richtext,False,False,True,5,0,False,all_ads,/r/dating/comments/noyv2d/fiance_acts_childish_after_lying_to_me/,False,6,,1622455052,1,True,False,False,dating,t5_2qhb1,806842,public,self,Fiance acts childish after lying to me,0,[],1.0,https://www.reddit.com/r/dating/comments/noyv2d/fiance_acts_childish_after_lying_to_me/,all_ads,6,[],text,t2_7gxtre2o,False,False,"My (f19) fiance (m21) lied 2 days ago about that he has to work 11:00 am. He was at my house and he used it as an excuse to not stay at my place. (There was a lot of shit going on, we could before stay up until 3 am but my father didnt accept this anymore and now when he stays we have to sleep when my parents sleep. He thinks its ruined but i accept this, because at his house this is the same.) (we have eastern parents but we live in europe) so back to what i was talking about.

The next morning i wake up at 11:50 am and i see no message from him, i call him and he doesnt pick up as usually. So i texted: shouldnt you be at work? He said: no i start at 01:00 pm. So i felt some kind of disgust. He knew this since when he was with me that evening and he still said 11:00 am.

He lied to me so he had a excuse to leave. He could have been honest. Why lie about the most simple things like holy shit?

I confronted him and his response is: “you see this as lying” then continues to disrespect me. He says: i dont feel like speaking to you anymore, bye, goodnight. So i didnt say anything until today, the next morning because i was so pissed. He did text me to send him money (this is normal, we do this all the time) but for the rest nothing. So i called him a lot of times this morning and he refuses to pick up and still disrespects me.

I feel like a piece of shit right now.",,
20,[],False,[deleted],,,,dark,[],moderators,False,False,1622452020,self.dating,https://www.reddit.com/r/dating/comments/noz0fu/instead_of_asking_her_out_ask_her_if_she_wants_to/,{},noz0fu,False,False,False,False,False,True,False,,dating,"[{'e': 'text', 't': 'Giving Advice'}]",7bca2c58-4211-11e5-9ecb-0e60d8112001,Giving Advice,dark,richtext,False,False,True,2,0,False,all_ads,/r/dating/comments/noz0fu/instead_of_asking_her_out_ask_her_if_she_wants_to/,False,6,deleted,1622455669,1,True,False,False,dating,t5_2qhb1,806856,public,default,Instead of asking her out ask her if she wants to buy your only fans then tell her to go fuck her self for not supporting sex workers if she gets mad,0,[],1.0,https://www.reddit.com/r/dating/comments/noz0fu/instead_of_asking_her_out_ask_her_if_she_wants_to/,all_ads,6,,,,,,,,
21,"[{'award_sub_type': 'GLOBAL', 'award_type': 'global', 'awardings_required_to_grant_benefits': None, 'coin_price': 80, 'coin_reward': 0, 'count': 1, 'days_of_drip_extension': 0, 'days_of_premium': 0, 'description': 'Everything is better with a good hug', 'end_date': None, 'giver_coin_reward': 0, 'icon_format': 'PNG', 'icon_height': 2048, 'icon_url': 'https://i.redd.it/award_images/t5_q0gj4/ks45ij6w05f61_oldHugz.png', 'icon_width': 2048, 'id': 'award_8352bdff-3e03-4189-8a08-82501dd8f835', 'is_enabled': True, 'is_new': False, 'name': 'Hugz', 'penny_donate': 0, 'penny_price': 0, 'resized_icons': [{'height': 16, 'url': 'https://preview.redd.it/award_images/t5_q0gj4/ks45ij6w05f61_oldHugz.png?width=16&amp;height=16&amp;auto=webp&amp;s=73a23bf7f08b633508dedf457f2704c522b94a04', 'width': 16}, {'height': 32, 'url': 'https://preview.redd.it/award_images/t5_q0gj4/ks45ij6w05f61_oldHugz.png?width=32&amp;height=32&amp;auto=webp&amp;s=50f2f16e71d2929e3d7275060af3ad6b851dbfb1', 'width': 32}, {'height': 48, 'url': 'https://preview.redd.it/award_images/t5_q0gj4/ks45ij6w05f61_oldHugz.png?width=48&amp;height=48&amp;auto=webp&amp;s=ca487311563425e195699a4d7e4c57a98cbfde8b', 'width': 48}, {'height': 64, 'url': 'https://preview.redd.it/award_images/t5_q0gj4/ks45ij6w05f61_oldHugz.png?width=64&amp;height=64&amp;auto=webp&amp;s=7b4eedcffb1c09a826e7837532c52979760f1d2b', 'width': 64}, {'height': 128, 'url': 'https://preview.redd.it/award_images/t5_q0gj4/ks45ij6w05f61_oldHugz.png?width=128&amp;height=128&amp;auto=webp&amp;s=e4d5ab237eb71a9f02bb3bf9ad5ee43741918d6c', 'width': 128}], 'resized_static_icons': [{'height': 16, 'url': 'https://preview.redd.it/award_images/t5_q0gj4/fpm0r5ryq1361_PolarHugs.png?width=16&amp;height=16&amp;auto=webp&amp;s=69997ace3ef4ffc099b81d774c2c8f1530602875', 'width': 16}, {'height': 32, 'url': 'https://preview.redd.it/award_images/t5_q0gj4/fpm0r5ryq1361_PolarHugs.png?width=32&amp;height=32&amp;auto=webp&amp;s=e9519d1999ef9dce5c8a9f59369cb92f52d95319', 'width': 32}, {'height': 48, 'url': 'https://preview.redd.it/award_images/t5_q0gj4/fpm0r5ryq1361_PolarHugs.png?width=48&amp;height=48&amp;auto=webp&amp;s=f076c6434fb2d2f9075991810fd845c40fa73fc6', 'width': 48}, {'height': 64, 'url': 'https://preview.redd.it/award_images/t5_q0gj4/fpm0r5ryq1361_PolarHugs.png?width=64&amp;height=64&amp;auto=webp&amp;s=85527145e0c4b754306a30df29e584fd16187636', 'width': 64}, {'height': 128, 'url': 'https://preview.redd.it/award_images/t5_q0gj4/fpm0r5ryq1361_PolarHugs.png?width=128&amp;height=128&amp;auto=webp&amp;s=b8843cdf82c3b741d7af057c14076dcd2621e811', 'width': 128}], 'start_date': None, 'static_icon_height': 2048, 'static_icon_url': 'https://i.redd.it/award_images/t5_q0gj4/fpm0r5ryq1361_PolarHugs.png', 'static_icon_width': 2048, 'subreddit_coin_reward': 0, 'subreddit_id': None, 'tiers_by_required_awardings': None}]",False,MysteriousGamer957,,,,,[],,False,False,1622452117,self.dating,https://www.reddit.com/r/dating/comments/noz1bq/safe_and_free_dating_site_for/,{},noz1bq,True,False,False,False,True,True,False,,dating,"[{'e': 'text', 't': 'Question'}]",a9531dce-194e-11e5-b177-0eff099c3d1f,Question,dark,richtext,False,False,False,8,0,False,all_ads,/r/dating/comments/noz1bq/safe_and_free_dating_site_for/,False,6,,1622455753,6,True,False,False,dating,t5_2qhb1,806857,public,self,Safe and free dating site for..,1,[],1.0,https://www.reddit.com/r/dating/comments/noz1bq/safe_and_free_dating_site_for/,all_ads,6,[],text,t2_bqq2mxbt,False,False,"Hey guys, so do y'all know any safe dating sites for transgender women?",,
22,[],False,Leather-Cash-513,,,,,[],,False,False,1622452245,self.dating,https://www.reddit.com/r/dating/comments/noz2ib/instead_of_asking_women_out_just_make_an_only/,{},noz2ib,False,False,False,False,False,True,False,,dating,"[{'e': 'text', 't': 'Giving Advice'}]",7bca2c58-4211-11e5-9ecb-0e60d8112001,Giving Advice,dark,richtext,False,False,True,6,0,False,all_ads,/r/dating/comments/noz2ib/instead_of_asking_women_out_just_make_an_only/,False,6,moderator,1622455860,1,True,False,False,dating,t5_2qhb1,806864,public,self,Instead of asking women out just make an only fans and ask them if they wanna buy pictures of your asshole,0,[],0.67,https://www.reddit.com/r/dating/comments/noz2ib/instead_of_asking_women_out_just_make_an_only/,all_ads,6,[],text,t2_bfsvbzqy,False,False,[removed],1622452447.0,
23,[],False,ihitrocksbottom,,,,,[],,False,False,1622452631,self.dating,https://www.reddit.com/r/dating/comments/noz5ud/guys_do_you_experience_this_as_well_on_dating_apps/,{},noz5ud,True,False,False,False,True,True,False,,dating,"[{'e': 'text', 't': 'Question'}]",a9531dce-194e-11e5-b177-0eff099c3d1f,Question,dark,richtext,False,False,True,14,0,False,all_ads,/r/dating/comments/noz5ud/guys_do_you_experience_this_as_well_on_dating_apps/,False,6,,1622456185,1,True,False,False,dating,t5_2qhb1,806870,public,self,"Guys, do you experience this as well on dating apps?",0,[],1.0,https://www.reddit.com/r/dating/comments/noz5ud/guys_do_you_experience_this_as_well_on_dating_apps/,all_ads,6,[],text,t2_2676bj4n,False,False,"We all have times when we might take a while to respond to a message. It might be because we are busy, we forgot etc. I've had many times where a woman has said sorry for late reply...  
and I'll always say 'no problem' unless it keeps happening, obviously.

&amp;#x200B;

But almost every single time I've done it and have said 'sorry for late reply...' they completely stop speaking to me. Why is that?",,
24,[],False,massivefailure123,,,,,[],,False,False,1622452834,self.dating,https://www.reddit.com/r/dating/comments/noz7qe/i_am_a_recently_single_young_male_and_i_am/,{},noz7qe,True,False,False,False,True,True,False,,dating,"[{'e': 'text', 't': 'I Need Advice'}]",19ec58c2-9f74-11e7-81a1-0e2bf15991f0,I Need Advice,dark,richtext,False,False,True,16,0,False,all_ads,/r/dating/comments/noz7qe/i_am_a_recently_single_young_male_and_i_am/,False,6,,1622456362,0,True,False,False,dating,t5_2qhb1,806873,public,self,"I am a recently single young male and I am struggling to cope with modern dating and how common ""hookup culture"" is. How do I get over this?",0,[],0.5,https://www.reddit.com/r/dating/comments/noz7qe/i_am_a_recently_single_young_male_and_i_am/,all_ads,6,[],text,t2_93qp1w8g,False,False,"Sorry for the vague title, hopefully I'll be able to clear things up.

Basically, I was in a long term relationship. 8 months a go I became single and since then have been going on lots of dates. I've met and slept with a few girls, but I'm struggling to cope with modern dating as it just makes me feel so low.

Here is my most recent situation and example. The girl I am currently seeing I really like and we get on so well, but the other day when she came round she said ""I want to tell you something, I really like spending time with you but I am also sleeping with other guys and wanted to let you know"". Now although I appreciate the honesty, this kind of stuff just seems so off for me and leaves me feeling terrible. I had to call the situation off as I really hated the fact she was sleeping with other people.

And it seems so common for people my age (early 20s) to get into these situations. That is just one example and I am struggling to find someone who wants something more meaningful, maybe I'm just not used to it? Maybe I see sex as a romantic thing and struggling to adjust to this casual free mindset. Maybe I'm just insecure? It's making me really low and I'm struggling to adjust to this modern dating era where everyone is so free. Whenever I meet a new girl now I'm instantly thinking they are not wanting anything serious. Any advice will be appreciated.",,
25,[],False,Leather-Cash-513,,,,,[],,False,False,1622452835,self.dating,https://www.reddit.com/r/dating/comments/noz7qi/personally_i_dont_even_approach_women_anymore/,{},noz7qi,True,False,False,False,True,True,False,,dating,"[{'e': 'text', 't': 'Giving Advice'}]",7bca2c58-4211-11e5-9ecb-0e60d8112001,Giving Advice,dark,richtext,False,False,True,2,1,False,all_ads,/r/dating/comments/noz7qi/personally_i_dont_even_approach_women_anymore/,False,6,,1622456362,0,True,False,False,dating,t5_2qhb1,806873,public,self,Personally I don’t even approach women anymore,0,[],0.5,https://www.reddit.com/r/dating/comments/noz7qi/personally_i_dont_even_approach_women_anymore/,all_ads,6,[],text,t2_bfsvbzqy,False,False,"I just sell them pictures of my asshole. 
    #lethercometoyou",,
26,[],False,[deleted],,,,dark,[],,False,False,1622452881,self.dating,https://www.reddit.com/r/dating/comments/noz85a/is_topped_talking_to_him_and_now_i_feel_bad/,{},noz85a,False,False,False,False,False,True,False,,dating,"[{'e': 'text', 't': 'I Need Advice'}]",19ec58c2-9f74-11e7-81a1-0e2bf15991f0,I Need Advice,dark,richtext,False,False,False,2,0,False,all_ads,/r/dating/comments/noz85a/is_topped_talking_to_him_and_now_i_feel_bad/,False,6,deleted,1622456399,0,True,False,False,dating,t5_2qhb1,806875,public,default,Is topped talking to him and now I feel bad?,0,[],0.5,https://www.reddit.com/r/dating/comments/noz85a/is_topped_talking_to_him_and_now_i_feel_bad/,all_ads,6,,,,,,[deleted],,
27,[],False,Giveittomama,,,,,[],,False,False,1622454367,self.dating,https://www.reddit.com/r/dating/comments/nozldr/men_of_rdating_i_would_like_to_get_married_in_4/,{},nozldr,True,False,False,False,True,True,False,,dating,"[{'e': 'text', 't': 'Question'}]",a9531dce-194e-11e5-b177-0eff099c3d1f,Question,dark,richtext,False,False,False,28,0,False,all_ads,/r/dating/comments/nozldr/men_of_rdating_i_would_like_to_get_married_in_4/,False,6,,1622457615,2,True,False,False,dating,t5_2qhb1,806885,public,self,"Men of r/dating, I would like to get married in 4 years",0,[],1.0,https://www.reddit.com/r/dating/comments/nozldr/men_of_rdating_i_would_like_to_get_married_in_4/,all_ads,6,[],text,t2_cauqw6cp,False,False,"What do men look for in women they would like to marry?

How does a man know when he is ready/wants to marry?",,
28,[],False,Mask421,,,,,[],,False,False,1622455533,self.dating,https://www.reddit.com/r/dating/comments/nozvxm/dont_even_know_where_to_start/,{},nozvxm,True,False,False,False,True,True,False,,dating,"[{'e': 'text', 't': 'I Need Advice'}]",19ec58c2-9f74-11e7-81a1-0e2bf15991f0,I Need Advice,dark,richtext,False,False,False,6,0,False,all_ads,/r/dating/comments/nozvxm/dont_even_know_where_to_start/,False,6,,1622458554,3,True,False,False,dating,t5_2qhb1,806911,public,self,Don't even know where to start,0,[],1.0,https://www.reddit.com/r/dating/comments/nozvxm/dont_even_know_where_to_start/,all_ads,6,[],text,t2_2q7ljsvp,False,False,"To give my problem a little more context, as hard as it is for me to do, is to share something from my life. I was bullied for much of my school years, all the way through my high school years. Combined with the fact that I have always been relatively introverted, this has ultimately led to me being very closed off to real life people, in fear that no matter what I share about myself with others will ultimately be used against me. Other problems would be that to this day I have difficulty distinguishing simple jokes from serious insults, which is why I have become more and more of a sarcastic asshole as a ""defense mechanism"". At least this was the state of 2-3 years ago. I have found a larger group of friends who have helped me to become less detached and more social. 

However, I am still too incompetent to know how to meet someone for a more intimate relationship. I don't know where to meet someone, nor how to approach someone when I do. These are probably all things I should have learned in school, but I was too busy building a wall around myself to avoid getting hurt. 

&amp;#x200B;

With the beginning of my studies, I had inwardly hoped maybe to meet someone like that. But then Covid-19 came along and threw that ""plan"" out the window. 

In the pandemic, I also ultimately realized how lonely and frankly pathetic my life has been so far. It has always boiled down to coming home from my commitments and then holed up in my room for the rest of the day. The only exception to this are the meetings with my friends, which now also only come at longer intervals, as they are studying in different cities. 

I tried to fill my life with hobbies like writing, gaming and since recently also regular sports. But at the end of the day I sit alone in my room again. And I know the solution, but I just don't know how to reach it.",,
29,[],False,Predator-7,,,,,[],,False,False,1622456040,self.dating,https://www.reddit.com/r/dating/comments/np00pu/a_girl_co_worker_is_asking_a_lot_of_questions_and/,{},np00pu,True,False,False,False,True,True,False,,dating,"[{'e': 'text', 't': 'I Need Advice'}]",19ec58c2-9f74-11e7-81a1-0e2bf15991f0,I Need Advice,dark,richtext,False,False,False,8,0,False,all_ads,/r/dating/comments/np00pu/a_girl_co_worker_is_asking_a_lot_of_questions_and/,False,6,,1622458975,1,True,False,False,dating,t5_2qhb1,806922,public,self,"a girl co worker is asking a lot of questions and paying particular interest in my ""girlfriend"" and dating life",0,[],0.67,https://www.reddit.com/r/dating/comments/np00pu/a_girl_co_worker_is_asking_a_lot_of_questions_and/,all_ads,6,[],text,t2_1t83wdtq,False,False,"so long story short we been working together 2 or 3 months, we get on well st work, I like her, she flirts, we used to text a lot, she flirted on there too, I did ask her out once to which something came up and couldn't make, I left it at that as didn't wna push.

last week I was meeting a friend who's a girl at lunch, she and the Co workers heard of it, jumped on it, immediately a huge deal was made of it omg he's going on a date who's the girl what's her name.

I went to a different department where her friend works, she was like I hear u have a hot date. I clarified it isnt, she said, if I were you, don't deny it, run with it, see what it does to certain people here.

so I stopped denying it, when I came back she asked me a million questions, what did she eat, where did we go, she then was extremely talkative and touchy.


I get home she's text girlfriend update plz, I reply what does she wna know and she's like

what she look like, hair colour, personality traits star sign etc etc.


so my question is this, why has she taken such an interest in ""my girlfriend"" and dating life.

is she jealous? does she like me?",,
30,[],False,donmacussi,,,,,[],,False,False,1622456476,self.dating,https://www.reddit.com/r/dating/comments/np04t7/fear_being_alone/,{},np04t7,True,False,False,False,True,True,False,,dating,"[{'e': 'text', 't': 'Venting'}]",a616c322-194e-11e5-ab91-0ed1c06bdad7,Venting,dark,richtext,False,False,False,2,0,False,all_ads,/r/dating/comments/np04t7/fear_being_alone/,False,6,,1622459347,1,True,False,False,dating,t5_2qhb1,806928,public,self,fear being alone,0,[],0.99,https://www.reddit.com/r/dating/comments/np04t7/fear_being_alone/,all_ads,6,[],text,t2_3ubgnqgn,False,False,"there's this girl that I've dated for almost ten months but we didn't see each other regularly because I lived in another city until recently. however, I've always felt our love is being faked because honestly I don't see a future with her. but I've been afraid to break up with her because I'm not sure there's a chance of me finding another girlfriend out there. as much as our relationship has become a little toxic, I prefer to think that that's better that being single/alone.",,True
31,[],False,IntegratedExemplar,,,,,[],,False,False,1622456490,self.dating,https://www.reddit.com/r/dating/comments/np04xr/how_do_i_change_my_demeanour_to_seem_like_a/,{},np04xr,True,False,False,False,True,True,False,,dating,"[{'e': 'text', 't': 'I Need Advice'}]",19ec58c2-9f74-11e7-81a1-0e2bf15991f0,I Need Advice,dark,richtext,False,False,False,27,0,False,all_ads,/r/dating/comments/np04xr/how_do_i_change_my_demeanour_to_seem_like_a/,False,6,,1622459359,3,True,False,False,dating,t5_2qhb1,806928,public,self,How do I change my demeanour to seem like a romantic option?,0,[],1.0,https://www.reddit.com/r/dating/comments/np04xr/how_do_i_change_my_demeanour_to_seem_like_a/,all_ads,6,[],text,t2_byw0pw3h,False,False,"It was something my friend said to me the other day:

""I thought you were asexual. I've never seen you with a partner and you never seemed the type.""

It got me thinking about how I came across to people. At 26, I've never had a girlfriend. There are probably a lot of reasons why, but I'm now wondering whether I'm coming across like someone who isn't interested in dating?

In truth, I haven't had many people attracted to me, so I by default assume they aren't (not incorrectly imo, it would be weird if more people were interested than not). Additionally, some advice I read was that you should forge authentic connections with people, and let those relationships develop naturally - whether they lead to romance or not is a coin toss.

I'm starting to question this advice because, well, clearly something isn't working here. Is there, therefore, a way of carrying myself and generally acting that will let interested parties know I'm available?",,
32,[],False,Zvenoom,,,,,[],,False,False,1622456596,self.dating,https://www.reddit.com/r/dating/comments/np05zk/how_to_not_get_in_awkward_situation_talking_url/,{},np05zk,True,False,False,False,True,True,False,,dating,"[{'e': 'text', 't': 'I Need Advice'}]",19ec58c2-9f74-11e7-81a1-0e2bf15991f0,I Need Advice,dark,richtext,False,False,False,2,0,False,all_ads,/r/dating/comments/np05zk/how_to_not_get_in_awkward_situation_talking_url/,False,6,,1622459453,1,True,False,False,dating,t5_2qhb1,806930,public,self,How to not get in awkward situation talking url with girl?,0,[],1.0,https://www.reddit.com/r/dating/comments/np05zk/how_to_not_get_in_awkward_situation_talking_url/,all_ads,6,[],text,t2_9yk7cx93,False,False,"I have anxiety ans im really funny and nice guy to talk with,but i afraid losing control of conversations,one girl will come later just friendly and in short how do i start question idk",,
33,[],False,RepresentativeSwan1,,,,,[],,False,False,1622456654,self.dating,https://www.reddit.com/r/dating/comments/np06jc/what_do_you_believe_is_the_reason_youre/,{},np06jc,True,False,False,False,True,True,False,,dating,"[{'e': 'text', 't': 'Question'}]",a9531dce-194e-11e5-b177-0eff099c3d1f,Question,dark,richtext,False,False,False,16,0,False,all_ads,/r/dating/comments/np06jc/what_do_you_believe_is_the_reason_youre/,False,6,,1622459502,1,True,False,False,dating,t5_2qhb1,806933,public,self,What do you believe is the reason you're struggling in dating?,0,[],1.0,https://www.reddit.com/r/dating/comments/np06jc/what_do_you_believe_is_the_reason_youre/,all_ads,6,[],text,t2_1eh85yrs,False,False,"It's very simple; if you are someone who is struggling in dating, I'm interested in knowing what you believe is the reason for that.",,
34,[],False,notyourbitchassagain,,,,,[],,False,False,1622456738,self.dating,https://www.reddit.com/r/dating/comments/np07ej/why_is_it_so_hard_for_anrabf_dating_on_reddit/,{},np07ej,False,False,False,False,False,True,False,,dating,"[{'e': 'text', 't': 'I Need Advice'}]",19ec58c2-9f74-11e7-81a1-0e2bf15991f0,I Need Advice,dark,richtext,False,False,True,0,0,False,all_ads,/r/dating/comments/np07ej/why_is_it_so_hard_for_anrabf_dating_on_reddit/,False,6,moderator,1622459578,1,True,False,False,dating,t5_2qhb1,806935,public,self,Why is it so hard for ANR/ABF Dating on reddit,0,[],1.0,https://www.reddit.com/r/dating/comments/np07ej/why_is_it_so_hard_for_anrabf_dating_on_reddit/,all_ads,6,[],text,t2_bb9elnip,False,False,[removed],,
35,[],False,notyourbitchassagain,,,,,[],,False,False,1622457022,self.dating,https://www.reddit.com/r/dating/comments/np0a0s/niche_dating_anrabf/,{},np0a0s,False,False,False,False,False,True,False,,dating,"[{'e': 'text', 't': 'Question'}]",a9531dce-194e-11e5-b177-0eff099c3d1f,Question,dark,richtext,False,False,True,0,0,False,all_ads,/r/dating/comments/np0a0s/niche_dating_anrabf/,False,6,moderator,1622459818,1,True,False,False,dating,t5_2qhb1,806937,public,self,Niche Dating ANR/ABF,0,[],1.0,https://www.reddit.com/r/dating/comments/np0a0s/niche_dating_anrabf/,all_ads,6,[],text,t2_bb9elnip,False,False,[removed],,
