,all_awardings,allow_live_comments,author,author_flair_css_class,author_flair_richtext,author_flair_text,author_flair_type,author_fullname,author_is_blocked,author_patreon_flair,author_premium,awarders,can_mod_post,contest_mode,created_utc,domain,full_link,gildings,id,is_created_from_ads_ui,is_crosspostable,is_meta,is_original_content,is_reddit_media_domain,is_robot_indexable,is_self,is_video,link_flair_background_color,link_flair_css_class,link_flair_richtext,link_flair_template_id,link_flair_text,link_flair_text_color,link_flair_type,locked,media_only,no_follow,num_comments,num_crossposts,over_18,parent_whitelist_status,permalink,pinned,pwls,retrieved_on,score,selftext,send_replies,spoiler,stickied,subreddit,subreddit_id,subreddit_subscribers,subreddit_type,thumbnail,title,total_awards_received,treatment_tags,upvote_ratio,url,whitelist_status,wls,removed_by_category,author_cakeday,post_hint,preview
52,[],False,LilyDaisy2,,[],,text,t2_ealq2sxh,False,False,False,[],False,False,1630904775,self.dating,https://www.reddit.com/r/dating/comments/pissyg/should_i_leave/,{},pissyg,False,True,False,False,False,True,True,False,#ea0027,dating,"[{'e': 'text', 't': 'I Need Advice'}]",19ec58c2-9f74-11e7-81a1-0e2bf15991f0,I Need Advice,light,richtext,False,False,True,5,0,False,all_ads,/r/dating/comments/pissyg/should_i_leave/,False,6,1630904786,1,"My boyfriend and I dated from 2017-2020. He dumped me TWO days before Valentine’s Day via text. Then proceeded to take his new girlfriend on our Valentine’s Day plans. That just really hurt because from 2017-2020 we had never done anything for my birthday or Valentine’s Day.  Yet I always pulled out all the stops for him on Valentine’s and his birthday. He went on to date another girl (different from the girl he dated one day after dumping me) during 2020. May 2021 we got back together. I was so happy. Because the whole year I missed him and just wanted him back. I never entered anything serious the whole time  because in my heart I knew I only wanted him. But now he just seems to keep hurting me every weekend. He is either lying about where he is; who he is with or who is texting. I don’t know how to believe anything he says anymore. We keep Having the same arguments we had in previous years. He never wants to take me out still! He never ask to take photos; and when I take photos of the two of us and I send them to him, he doesn’t save them. Yet he has all his photos of his previous ex (the one he dated in 2020. Who he was loyal to; took on dates &amp; took photos with and they only dated for four months). He still texts her. We’ve fought about it so many times; and every time he says he will stop but I catch him doing it again. He says he loves me and will change. But I don’t know if this will be any different from the last four years. I caught him texting her again on Thursday; he let me go through his phone . He kept telling me as i was going through it that me being so insecure and having to go through his phone is the reason it’s so hard to be with me. He made me feel so shit and insecure and pathetic for ever doubting him. Then I saw his texts with her on archived chats and I felt so betrayed that he had tried to make me feel crazy for suspecting. 
When I ask him why he won’t do these things; he used to try manipulate me into thinking it’s my fault because in 2017-2020 I was not the best partner. But he wasn’t either; which is what I don’t understand? I get I fucked up,and was disloyal before but he cheated on me countless times ; and when we got back together I was willing to start a fresh and try be better because I love him.
I told him he was manipulating me by saying that because if anything I should be the one with doubts . I then asked him “why was it so easy for you to want to do those things for her and why is it hard to do them for me?” 
He told me “I didn’t want to with her it just came naturally”. That just broke my heart. Because i don’t think I’m asking for much; I just wanna go on dates, have someone who wants to take photos with me, kisses me in public not only when he is drunk and someone who doesn’t lie to me or cheat. It is so frustrating because I know he is capable of giving me what I want I guess it’s just not “natural”. I left his place after that. I haven’t seen him the whole weekend. He keeps texting and calling saying he still says he loves me and wants to be with me and he’ll change. But I feel like I’d be an idiot to go back after everything. But a part of me thinks me maybe this time he will change. I mean if I could change; why can’t he?
This whole situation makes me feel like all those mean comments and things he did in 2017-2020 weren’t entirely my fault. Because this time I’m diagnosed and I’m on Meds; I’m doing therapy; I’m opening up, I’m not lashing out; I’m learning to communicate, I’m being loyal and not impulsive when I get hurt. And he is EXACTLY the same. The whole year we were apart I blamed myself that my illnesses and toxicity drove him away. I told myself maybe that’s why he didn’t do those things I wanted. I spent the whole year trying to fix myself; so if he ever came back I could show him I can be the girlfriend he wanted and deserved. And now he is back; and I’m trying so hard to do everything right. He tells me he loves how I’ve grown and changed. If that’s true why isn’t it natural for him to take me out? I fixed myself; why can’t he just  love me? Why isn’t it natural?",True,False,False,dating,t5_2qhb1,991218,public,self,Should I leave?,0,[],1.0,https://www.reddit.com/r/dating/comments/pissyg/should_i_leave/,all_ads,6,,,,
53,[],False,AcanthocephalaIcy728,,[],,text,t2_7yqsgfze,False,False,False,[],False,False,1630904829,self.dating,https://www.reddit.com/r/dating/comments/pistdx/i_20m_met_a_girl_20f_last_weekend_and_saw_her_a/,{},pistdx,False,True,False,False,False,True,True,False,#ea0027,dating,"[{'e': 'text', 't': 'I Need Advice'}]",19ec58c2-9f74-11e7-81a1-0e2bf15991f0,I Need Advice,light,richtext,False,False,False,5,0,False,all_ads,/r/dating/comments/pistdx/i_20m_met_a_girl_20f_last_weekend_and_saw_her_a/,False,6,1630904840,1,"This past weekend I met a girl at a bar at college. We were obviously drinking and pretty tipsy but hit it off. She went home with me and we hooked up. Everything seemed to go well. 

The next night, I went out to a difference place with a couple friends. I had gotten the girls number and we had agreed to see each other again, but I had not contacted her yet. We randomly met each other there again, and we talked the whole night before I walked her back to her place. Neither of us had drank much that night and were sober by the time we got back. I stayed with her but we didn't hook up past making out. We talked for a while that night and agreed to out to dinner sometime soon,she seemed pretty enthusiastic about it. So the next morning she dropped me off, and later that night I sent her a text saying that I enjoyed seeing her the past two days and was following up on going out to eat. 

Almost 2 days later, I have yet to hear back from her. Am I missing something? What did I do wrong?

She seemed pretty into me and excited to go out somewhere, so being ignored like this really bothers me. 

Thanks :)",True,False,False,dating,t5_2qhb1,991218,public,self,"I (20m) met a girl (20f) last weekend and saw her a couple times that weekend, but have not heard back from her since. What did I do wrong here? Thanks :)",0,[],1.0,https://www.reddit.com/r/dating/comments/pistdx/i_20m_met_a_girl_20f_last_weekend_and_saw_her_a/,all_ads,6,,,,
54,[],False,wigglywoo59,,[],,text,t2_4ijhmsz7,False,False,False,[],False,False,1630904951,self.dating,https://www.reddit.com/r/dating/comments/pisudn/he_showed_me_a_nude_of_his_ex_on_our_date/,{},pisudn,False,True,False,False,False,True,True,False,#00a6a5,dating,"[{'e': 'text', 't': 'Support Needed'}]",fd9c03b8-a1ce-11e7-9172-0e8c9f9ecf4c,Support Needed,dark,richtext,False,False,True,309,0,False,all_ads,/r/dating/comments/pisudn/he_showed_me_a_nude_of_his_ex_on_our_date/,False,6,1630904962,1,"Last night I (28 F) went out with a guy from work (37M). He took me to a comedy show and then we went out for drinks after. We’ve been talking for a few weeks now and we were having a good time. We’re a few drinks deep and at the bar he randomly says “wanna see a picture of my ex?” I am a bit taken aback.. but I say “yeah sure.” He then proceeds to take out his phone and show me a picture of a female from the stomach down, who is totally naked and only has heels on. She’s crossing one leg across the other so her vagina isn’t exposed. I look at him and say “are you serious right now?” I’m not sure what kind of response he was looking for. But I was truly disgusted and weirded out. He immediately sees the look on my face and goes what? It’s a good picture. I took it! Don’t worry I’ll delete it! Meanwhile I’m flabbergasted. I say “idc what you do.. I just don’t think that’s something you show someone on a date.. ever.” He goes yeah you’re right and starts to apologize. At this point I’m completely turned off and weirded out and ask him to take me home. He then tries to get me to invite him into my apartment. I tell him sorry but he’s ruined any chance he had with me. 

I’m bummed because the date was going well. I had a big crush on him. But now I just feel gross. Definite red flag. Not sure why he has that picture.. they broke up two years ago. I just had to share this story because I can’t comprehend that he actually did that lol. I don’t think we will be talking or going out ever again. I hope this isn’t a normal thing that people do. 

TL;DR: was out with a guy, went to a bar.. and he then shows me a nude of his ex. He appears to think there’s nothing wrong with that, at all.",True,False,False,dating,t5_2qhb1,991220,public,self,He showed me a nude of his ex on our date.,0,[],1.0,https://www.reddit.com/r/dating/comments/pisudn/he_showed_me_a_nude_of_his_ex_on_our_date/,all_ads,6,,,,
55,[],False,chairlifting,,[],,text,t2_q5qcc,False,False,False,[],False,False,1630905156,self.dating,https://www.reddit.com/r/dating/comments/pisvz4/advice_on_how_to_respond_to_a_girl_who_slid_in_my/,{},pisvz4,False,True,False,False,False,True,True,False,#ea0027,dating,"[{'e': 'text', 't': 'I Need Advice'}]",19ec58c2-9f74-11e7-81a1-0e2bf15991f0,I Need Advice,light,richtext,False,False,True,3,0,False,all_ads,/r/dating/comments/pisvz4/advice_on_how_to_respond_to_a_girl_who_slid_in_my/,False,6,1630905167,1,"My bio has something about me loving wine. A very attractive girl I've never met slid in saying ""I love wine."" What would be a smooth response to eventually set up a date?",True,False,False,dating,t5_2qhb1,991224,public,self,Advice on how to respond to a girl who slid in my DMs,0,[],1.0,https://www.reddit.com/r/dating/comments/pisvz4/advice_on_how_to_respond_to_a_girl_who_slid_in_my/,all_ads,6,,True,,
56,[],False,pimpdaddylex,,[],,text,t2_ed4awseu,False,False,False,[],False,False,1630905250,self.dating,https://www.reddit.com/r/dating/comments/piswsf/help/,{},piswsf,False,False,False,False,False,False,True,False,#ea0027,dating,"[{'e': 'text', 't': 'I Need Advice'}]",19ec58c2-9f74-11e7-81a1-0e2bf15991f0,I Need Advice,light,richtext,False,False,True,0,0,False,all_ads,/r/dating/comments/piswsf/help/,False,6,1630905261,1,[removed],True,False,False,dating,t5_2qhb1,991231,public,self,Help!!,0,[],1.0,https://www.reddit.com/r/dating/comments/piswsf/help/,all_ads,6,moderator,,,
57,[],False,Renegade257,,[],,text,t2_2tlehnq,False,False,False,[],False,False,1630905475,self.dating,https://www.reddit.com/r/dating/comments/pisyna/she_says_she_has_anxiety/,{},pisyna,False,True,False,False,False,True,True,False,#ea0027,dating,"[{'e': 'text', 't': 'I Need Advice'}]",19ec58c2-9f74-11e7-81a1-0e2bf15991f0,I Need Advice,light,richtext,False,False,True,4,0,False,all_ads,/r/dating/comments/pisyna/she_says_she_has_anxiety/,False,6,1630905486,1,"I’ve been talking to this girl for a couple months now, and we hung out once. Then she went on a two week family trip and we’d been talking about hanging out again when she got back. We talked non-stop while she was gone, and then she got back, we made plans, but then nothing for two days. I thought she ghosted me, but then she texted me and told me she was dealing with anxiety and that even though she wants us to stay connected, she’s not sure if she can open herself emotionally to being in a relationship with someone. We haven’t made plans since and the texting has gotten pretty scarce. Should I just let this one go and move on?",True,False,False,dating,t5_2qhb1,991237,public,self,She says she has anxiety,0,[],1.0,https://www.reddit.com/r/dating/comments/pisyna/she_says_she_has_anxiety/,all_ads,6,,,,
58,[],False,emotional_rapport,,[],,text,t2_9w1a0jtq,False,False,False,[],False,False,1630906662,self.dating,https://www.reddit.com/r/dating/comments/pit89c/is_this_a_red_flag/,{},pit89c,False,True,False,False,False,True,True,False,#ff4500,dating,"[{'e': 'text', 't': 'Question'}]",a9531dce-194e-11e5-b177-0eff099c3d1f,Question,light,richtext,False,False,True,5,0,False,all_ads,/r/dating/comments/pit89c/is_this_a_red_flag/,False,6,1630906673,1,"The guy I’ve been seeing for a few weeks went on a weekend away with his best friend and best friends girlfriend(I’ve never met either of them). They went to a party city near our hometown. I was invited but had to work and said I would join them for one night(tonight) as I was free and willing to drive the 2 hours to hang out with them. 

We chatted last night and I told him to let me know what was going on the next day so I could make plans to meet up. I said I didn’t want to come if they were bringing randos over to the air Bnb. He said they might invite people back but most likely not.

Today I didn’t hear anything from him. No messages at all through the day. I messaged a few hours ago to ask him what he was up to(to try to make plans) and it took him over an hour to get back to me and he sounded drunk. He asked me if I was coming up  around 10pm and I said no as it was now too late. He just sent a sad emoji.

I’m pretty upset because we had been messaging all weekend about how he wanted me to come up and was third wheeling it. I’m pissed because I waited around for him and I almost feel like this is shady and maybe he met someone as they are out drinking their faces off and going out. Or he’s just a flake. 

Is this a red flag?",True,False,False,dating,t5_2qhb1,991272,public,self,Is this a red flag?,0,[],1.0,https://www.reddit.com/r/dating/comments/pit89c/is_this_a_red_flag/,all_ads,6,,,,
59,[],False,willieverfeelalright,,[],,text,t2_ch7vrd4e,False,False,False,[],False,False,1630906701,self.dating,https://www.reddit.com/r/dating/comments/pit8k3/is_he_just_not_interested/,{},pit8k3,False,True,False,False,False,True,True,False,#ea0027,dating,"[{'e': 'text', 't': 'I Need Advice'}]",19ec58c2-9f74-11e7-81a1-0e2bf15991f0,I Need Advice,light,richtext,False,False,True,3,0,False,all_ads,/r/dating/comments/pit8k3/is_he_just_not_interested/,False,6,1630906712,1," I (F18) started talking to a guy (M19) a few months ago. Initially, it was really friendly and I had no thoughts of pursuing anything, but then we started to talk more and I began to like him (he's hard not to like since he's so charming). He also showed mutual interest, but then he stopped talking to me for a couple of weeks. I started to realize he was becoming more distant right before he ghosted me. I tried texting him and calling him a few times before I took the hint. I just assumed that he lost interest and started to pursue someone else. However, he came back after ghosting me. He pretended as if nothing had happened and didn't bring up the fact that he ghosted me until I confronted him about it; only then did he tell me his depression and life overwhelmed him to the point where he didn't want to talk to me anymore. I don't understand this as I've never experienced a situation like this and dislike ghosting people/value communication. After confronting him, he told me he was sorry and he wanted to continue talking to me. Following his return, I wanted to be a little more distant because I didn't want to get hurt again. I think because of this he tried to communicate with me more? I gave in and I started to talk to him more, while still being cautious. But I started to like him even more and my attachment grew. Right before he ghosted me, he told me he didn't like me as much as I liked him, but after coming back, he told me he did and was just afraid of the reality. He can be very confusing, telling me he wants one thing but then doing the other and it has always been like this. I believed him when he said this because his actions started to match his words: he started to spend more time with me, was more vulnerable with me, and acted very kind and understanding. But like all things, it came to an end. Over the last few days, he started displaying the same behavior as before and started to become distant again. I asked him about it but he won't go into specifics. I ask to call, he declines saying he is busy or has a migraine. I message him, he takes longer to respond. And when he does respond, it is very short and doesn't put forth the effort to continue the conversation. I don't know what to do or think anymore. Did he find someone better than me? Am I just a convenience to him? Maybe he really is going through a rough time, but it's unfair that I have to be left in the dark )':

Please tell me what his behavior means or what I should do. I'm blind-sided in situations like these.",True,False,False,dating,t5_2qhb1,991275,public,self,Is he just not interested?,0,[],1.0,https://www.reddit.com/r/dating/comments/pit8k3/is_he_just_not_interested/,all_ads,6,,,,
60,[],False,That_Bitch20,,[],,text,t2_6lpmtf63,False,False,False,[],False,False,1630906787,self.dating,https://www.reddit.com/r/dating/comments/pit98e/should_i_feel_awkward/,{},pit98e,False,True,False,False,False,True,True,False,#ea0027,dating,"[{'e': 'text', 't': 'I Need Advice'}]",19ec58c2-9f74-11e7-81a1-0e2bf15991f0,I Need Advice,light,richtext,False,False,True,7,0,False,all_ads,/r/dating/comments/pit98e/should_i_feel_awkward/,False,6,1630906799,1,Is it weird that a guy told me I’m the only black girl he’s ever dated ?,True,False,False,dating,t5_2qhb1,991279,public,self,Should I feel awkward ?,0,[],1.0,https://www.reddit.com/r/dating/comments/pit98e/should_i_feel_awkward/,all_ads,6,,,,
61,[],False,ahkd13,,[],,text,t2_55wqn55d,False,False,False,[],False,False,1630907315,self.dating,https://www.reddit.com/r/dating/comments/pitdem/intentional_misinterpretation_as_a_form_of/,{},pitdem,False,True,False,False,False,True,True,False,#ea0027,dating,"[{'e': 'text', 't': 'I Need Advice'}]",19ec58c2-9f74-11e7-81a1-0e2bf15991f0,I Need Advice,light,richtext,False,False,True,10,0,False,all_ads,/r/dating/comments/pitdem/intentional_misinterpretation_as_a_form_of/,False,6,1630907327,1,"My (33) gf (23) constantly and intentionally misinterprets what I say to her regarding exercise and fitness. I’m a certified personal trainer but I have a healthy one pack, eat whatever I want and exercise simply to slow my descent to obesity / for injury minimization. I am not a fitness Nazi and I don’t have any such expectations for my girlfriend. 

However, she feels differently. Here’s an approximate transcript of a conversation we just had:

Her: “My friend said that when I move in with you, I’m probably going to have a big glow-up.”
Me: “Yeah, it will be a lot of fun. When you move in, we can go to the gym together or you can take classes alone doing something you like and I’ll do my own thing my friends.”

Her: Why do you have to do that?
Me: Huh?
Her: I’m telling you someone tells me something nice and you have to tell me that I need to exercise and that I’m fat and ugly.
Me: I didn’t say any of those things…
Her: You just did. Why do you have to do that? Why can’t you just let me tell a story about someone saying something nice about me without telling me I’m fat and ugly?
Me: I didn’t…
Her: You did. You said I need to work out.
Me: I never said that. I said we could work out together and become a super fit couple.
Her: But that means that something is wrong with me now. So you’re basically saying I’m fat and ugly.
Me: As I’ve said many times before, that is not what I meant and that is the opposite of how I view you.
(Repeat ad infinity — or for two hours)

Any of you deal with this behavior? It’s exhausting and I don’t want to walk on eggshells with my future spouse — whether that’s my current girlfriend or someone else. We regularly have this type of conversation and it’s tiring. It’s also having a huge impact on my attraction towards my girlfriend. I just don’t see a future with this type of behavior in it. I’ve looked into it and it sounds like this type of behavior from her is referred to as “manipulative intentional misinterpretation.” 

From a website:

“Why People Manipulate

For some people, manipulation may be an inadvertent strategy for dealing with a cutthroat world in which discussing feelings is often taboo. Manipulation is part of the normal range of behavioral tactics, and most people engage in manipulative strategies from time to time. People whose primary style of interaction is manipulation, however, tend to share some traits in common. These include:

1. A need for control or power over others
2. A need to raise their own self-esteem
3. Fear of abandonment
4. Feelings of worthlessness, helplessness, or hopelessness
5.A willingness to prioritize their own feelings and desires over the needs and well-being of others”

Points 2-5 definitely sound like my girlfriend.

“How to Handle a Manipulator

Many of us are highly aware when we’re being manipulated, but are still left unsure of what to do. Because manipulators often play the victim, some victims of manipulation might excuse their behavior or insist that the manipulator doesn’t really know what he or she is doing. Manipulators thrive on hiding their motives, so it can be challenging to get them to admit their true intentions, and many people will refuse to do so even under pressure. Instead, try the following tactics:

1. Avoid allowing yourself to be shamed or guilted into doing something.
2. When a manipulator makes a covert threat, ask him or her about the threat.
3. Ask the manipulative person if he or she can tell you directly what he or she wants.
4. Avoid sharing how the manipulation makes you feel, as these feelings can later be used as a tactic by the manipulator.
5. Be direct, clear, and honest, and refuse to participate in the escalating game of manipulation.”

I chose actions 1 and 5, ending the call and asking for her to recognize that she’s being an overdramatic drama queen who is intentionally misinterpreting to create drama and to apologize. I also asked her to promise to stop being a drama queen in the future and picking random fights like this.

But given I’m in the eye of the storm, any advice? Should I end it before things get too serious and it’s harder to break away? I am losing a lot of attraction and trust in our relationship / her every time she does this and it’s very exhausting to avoid triggering her temper tantrums.",True,False,False,dating,t5_2qhb1,991293,public,self,Intentional misinterpretation as a form of manipulation,0,[],1.0,https://www.reddit.com/r/dating/comments/pitdem/intentional_misinterpretation_as_a_form_of/,all_ads,6,,,,
62,[],False,Prancer10,,[],,text,t2_72b03ijy,False,False,False,[],False,False,1630907391,self.dating,https://www.reddit.com/r/dating/comments/pitdyf/do_i_try/,{},pitdyf,False,True,False,False,False,True,True,False,#ea0027,dating,"[{'e': 'text', 't': 'I Need Advice'}]",19ec58c2-9f74-11e7-81a1-0e2bf15991f0,I Need Advice,light,richtext,False,False,True,3,0,False,all_ads,/r/dating/comments/pitdyf/do_i_try/,False,6,1630907402,1,"So I 20M was dating this girl 21F for a month and things were going great we have great chemistry and had real potential. Until she out of the blue said she doesn’t know what she wants and her perception of love is fucked up (because of past relationships, family divorce, etc) and made me feel like complete shit in the end because she felt unsure so I just gave her space and a week later said we needed to talk so we did and she apologized for how she acted and regretted what she said but still felt like she isn’t ready for a relationship (that was never brought up) “emotionally” and then asked if we could still be friends and if we could even date again? I’m so confused about all of this and don’t even know wether it’s worth sticking around and trying to make it work I really like her but am now fearful of getting hurt again. Help",True,False,False,dating,t5_2qhb1,991295,public,self,Do I try?,0,[],1.0,https://www.reddit.com/r/dating/comments/pitdyf/do_i_try/,all_ads,6,,,,
63,[],False,Tatti_11,,[],,text,t2_ebedxeyh,False,False,False,[],False,False,1630907601,self.dating,https://www.reddit.com/r/dating/comments/pitfmc/i_am_looking_for_a_serious_online_relationship/,{},pitfmc,False,False,False,False,False,False,True,False,#ffb000,,"[{'e': 'text', 't': 'Tinder/Online Dating'}]",5214d2ac-61f1-11e8-8bb1-0ed15e4a39c0,Tinder/Online Dating,dark,richtext,False,False,True,2,0,True,all_ads,/r/dating/comments/pitfmc/i_am_looking_for_a_serious_online_relationship/,False,6,1630907612,1,[removed],True,True,False,dating,t5_2qhb1,991299,public,nsfw,I am looking for a serious online relationship,0,[],1.0,https://www.reddit.com/r/dating/comments/pitfmc/i_am_looking_for_a_serious_online_relationship/,promo_adult_nsfw,3,reddit,,,
