,all_awardings,allow_live_comments,author,author_flair_css_class,author_flair_richtext,author_flair_text,author_flair_type,author_fullname,author_patreon_flair,author_premium,awarders,can_mod_post,contest_mode,created_utc,domain,full_link,gildings,id,is_created_from_ads_ui,is_crosspostable,is_meta,is_original_content,is_reddit_media_domain,is_robot_indexable,is_self,is_video,link_flair_background_color,link_flair_css_class,link_flair_richtext,link_flair_template_id,link_flair_text,link_flair_text_color,link_flair_type,locked,media_only,no_follow,num_comments,num_crossposts,over_18,parent_whitelist_status,permalink,pinned,pwls,retrieved_on,score,selftext,send_replies,spoiler,stickied,subreddit,subreddit_id,subreddit_subscribers,subreddit_type,thumbnail,title,total_awards_received,treatment_tags,upvote_ratio,url,whitelist_status,wls,removed_by_category,author_flair_background_color,author_flair_text_color,banned_by,edited,post_hint,preview
75,"[{'award_sub_type': 'GLOBAL', 'award_type': 'global', 'awardings_required_to_grant_benefits': None, 'coin_price': 80, 'coin_reward': 0, 'count': 1, 'days_of_drip_extension': 0, 'days_of_premium': 0, 'description': 'Everything is better with a good hug', 'end_date': None, 'giver_coin_reward': 0, 'icon_format': 'PNG', 'icon_height': 2048, 'icon_url': 'https://i.redd.it/award_images/t5_q0gj4/ks45ij6w05f61_oldHugz.png', 'icon_width': 2048, 'id': 'award_8352bdff-3e03-4189-8a08-82501dd8f835', 'is_enabled': True, 'is_new': False, 'name': 'Hugz', 'penny_donate': 0, 'penny_price': 0, 'resized_icons': [{'height': 16, 'url': 'https://preview.redd.it/award_images/t5_q0gj4/ks45ij6w05f61_oldHugz.png?width=16&amp;height=16&amp;auto=webp&amp;s=73a23bf7f08b633508dedf457f2704c522b94a04', 'width': 16}, {'height': 32, 'url': 'https://preview.redd.it/award_images/t5_q0gj4/ks45ij6w05f61_oldHugz.png?width=32&amp;height=32&amp;auto=webp&amp;s=50f2f16e71d2929e3d7275060af3ad6b851dbfb1', 'width': 32}, {'height': 48, 'url': 'https://preview.redd.it/award_images/t5_q0gj4/ks45ij6w05f61_oldHugz.png?width=48&amp;height=48&amp;auto=webp&amp;s=ca487311563425e195699a4d7e4c57a98cbfde8b', 'width': 48}, {'height': 64, 'url': 'https://preview.redd.it/award_images/t5_q0gj4/ks45ij6w05f61_oldHugz.png?width=64&amp;height=64&amp;auto=webp&amp;s=7b4eedcffb1c09a826e7837532c52979760f1d2b', 'width': 64}, {'height': 128, 'url': 'https://preview.redd.it/award_images/t5_q0gj4/ks45ij6w05f61_oldHugz.png?width=128&amp;height=128&amp;auto=webp&amp;s=e4d5ab237eb71a9f02bb3bf9ad5ee43741918d6c', 'width': 128}], 'resized_static_icons': [{'height': 16, 'url': 'https://preview.redd.it/award_images/t5_q0gj4/fpm0r5ryq1361_PolarHugs.png?width=16&amp;height=16&amp;auto=webp&amp;s=69997ace3ef4ffc099b81d774c2c8f1530602875', 'width': 16}, {'height': 32, 'url': 'https://preview.redd.it/award_images/t5_q0gj4/fpm0r5ryq1361_PolarHugs.png?width=32&amp;height=32&amp;auto=webp&amp;s=e9519d1999ef9dce5c8a9f59369cb92f52d95319', 'width': 32}, {'height': 48, 'url': 'https://preview.redd.it/award_images/t5_q0gj4/fpm0r5ryq1361_PolarHugs.png?width=48&amp;height=48&amp;auto=webp&amp;s=f076c6434fb2d2f9075991810fd845c40fa73fc6', 'width': 48}, {'height': 64, 'url': 'https://preview.redd.it/award_images/t5_q0gj4/fpm0r5ryq1361_PolarHugs.png?width=64&amp;height=64&amp;auto=webp&amp;s=85527145e0c4b754306a30df29e584fd16187636', 'width': 64}, {'height': 128, 'url': 'https://preview.redd.it/award_images/t5_q0gj4/fpm0r5ryq1361_PolarHugs.png?width=128&amp;height=128&amp;auto=webp&amp;s=b8843cdf82c3b741d7af057c14076dcd2621e811', 'width': 128}], 'start_date': None, 'static_icon_height': 2048, 'static_icon_url': 'https://i.redd.it/award_images/t5_q0gj4/fpm0r5ryq1361_PolarHugs.png', 'static_icon_width': 2048, 'subreddit_coin_reward': 0, 'subreddit_id': None, 'tiers_by_required_awardings': None}]",False,eatshitnerdface,,[],,text,t2_crwv0yh4,False,False,[],False,False,1624110677,self.dating,https://www.reddit.com/r/dating/comments/o3give/dating_with_bipolar_disorder/,{},o3give,False,True,False,False,False,True,True,False,#878a8c,dating,"[{'e': 'text', 't': 'Venting'}]",a616c322-194e-11e5-ab91-0ed1c06bdad7,Venting,light,richtext,False,False,True,6,0,False,all_ads,/r/dating/comments/o3give/dating_with_bipolar_disorder/,False,6,1624115944,0,"i have bipolar disorder

and because of the y’know, whole bipolar thing, it’s SO HARD to date people…

like, one week i’m madly in love with this person and want to marry them and the next everything they do infuriates me.

i’m not on meds so i can’t control it. And usually I just push through those periods where they seem repulsive because I know that i’ll eventually fall in love again.

it’s so annoying. anyone relate?",True,False,False,dating,t5_2qhb1,846975,public,self,dating with bipolar disorder,1,[],0.33,https://www.reddit.com/r/dating/comments/o3give/dating_with_bipolar_disorder/,all_ads,6,,,,,,,
76,[],False,Nerdy_Babe101,,[],,text,t2_3or563t8,False,False,[],False,False,1624111400,self.dating,https://www.reddit.com/r/dating/comments/o3grfl/the_waiting_till_he_initiates_after_initiating_a/,{},o3grfl,False,True,False,False,False,True,True,False,#ea0027,dating,"[{'e': 'text', 't': 'I Need Advice'}]",19ec58c2-9f74-11e7-81a1-0e2bf15991f0,I Need Advice,light,richtext,False,False,False,17,0,False,all_ads,/r/dating/comments/o3grfl/the_waiting_till_he_initiates_after_initiating_a/,False,6,1624116662,3,"I thought I was doing enough, by initiating short conversations, being flirty (he didn’t seem to realize) and waves. I then proceeded to not do any of those after feeling like he wasn’t interested. Perhaps the “chase” would work. He did initiate a wave after a few days, but that was all. 

I was really discouraged because I liked him. I also realized that I always wanted to talk to him when I saw him, so I decided on the friendly route. Now he actively engages with me and I’ve seen more of his personality 

We are still in the talking stage, but I find it shocking that potentially friendzoning him has seem to encourage him? Encourage him to talk to me and I recognize he’s interested

I know all guys are different but this surprised me. My mindset changed from pursing him to just being friendly and I wonder if this method works better for dating?


Random but I also seemed to stroke his ego when his friend and him stood there staring and I said hi to only
him (didn’t know the other guy)",True,False,False,dating,t5_2qhb1,846988,public,self,The waiting till he initiates after initiating a few times didn’t work for me. But being friendly and potentially friendzoning him made him seem more interested?,0,[],1.0,https://www.reddit.com/r/dating/comments/o3grfl/the_waiting_till_he_initiates_after_initiating_a/,all_ads,6,,,,,1624111904.0,,
77,[],False,banjobillyjoebob,,[],,text,t2_ao9c092f,False,False,[],False,False,1624111783,self.dating,https://www.reddit.com/r/dating/comments/o3gvtx/why_was_it_easier_for_boomers_to_have_a_social/,{},o3gvtx,False,True,False,False,False,True,True,False,#ff4500,dating,"[{'e': 'text', 't': 'Question'}]",a9531dce-194e-11e5-b177-0eff099c3d1f,Question,light,richtext,False,False,False,31,0,False,all_ads,/r/dating/comments/o3gvtx/why_was_it_easier_for_boomers_to_have_a_social/,False,6,1624117033,7,"They also actually seemed interested in meeting new ppl too. Now most millenials actually say: “i dont want to meet anymore ppl i had my fill in uni i just want to watch netflix tonight”

Could it be demographics as well? Like their are few ppl my age (24) and my neighborhood is mostly boomers!

Or working less than millenials leading to more time to meet? (Most millenials work above 40 hours)

Ie uni is really the only time to meet for millenials. However for boomers their was still a large enough pool post uni

(I mean boomers were the largest demographic post WWII

My mom and dad met in a coffee shop in NYC My dad was 24 and my mom was 21 i think. (my dad did not even go to uni at the time and my mom was in uni, now you would never see this)

(However my parents are still married but dysfunctional lol so maybe millenials learned to marry quick in uni to avoid meeting randomly and having dysfunctional relationships like my parents)",True,False,False,dating,t5_2qhb1,846995,public,self,why was it easier for boomers to have a social life post uni,0,[],1.0,https://www.reddit.com/r/dating/comments/o3gvtx/why_was_it_easier_for_boomers_to_have_a_social/,all_ads,6,,,,,,,
78,[],False,DysfunctionalSynapse,,[],,text,t2_ase6n1mt,False,False,[],False,False,1624112252,self.dating,https://www.reddit.com/r/dating/comments/o3h1gu/what/,{},o3h1gu,False,False,False,False,False,False,True,False,#878a8c,dating,"[{'e': 'text', 't': 'Venting'}]",a616c322-194e-11e5-ab91-0ed1c06bdad7,Venting,light,richtext,True,False,True,4,0,False,all_ads,/r/dating/comments/o3h1gu/what/,False,6,1624117480,1,[removed],True,False,False,dating,t5_2qhb1,847000,public,self,What?,0,[],1.0,https://www.reddit.com/r/dating/comments/o3h1gu/what/,all_ads,6,moderator,,,,,,
79,[],False,imthemoonlady,,[],,text,t2_cjr6wx5f,False,False,[],False,False,1624112345,self.dating,https://www.reddit.com/r/dating/comments/o3h2ir/a_quote_from_good_will_hunting/,{},o3h2ir,False,True,False,False,False,True,True,False,#ffd635,dating,"[{'e': 'text', 't': 'Giving Advice'}]",7bca2c58-4211-11e5-9ecb-0e60d8112001,Giving Advice,dark,richtext,False,False,False,69,0,False,all_ads,/r/dating/comments/o3h2ir/a_quote_from_good_will_hunting/,False,6,1624117569,9,"I think this quote from Good Will Hunting should always be remembered when you enter the dating world. 

“You're not perfect, sport, and let me save you the suspense: this girl you've met, she's not perfect either. But the question is whether or not you're perfect for each other.""",True,False,False,dating,t5_2qhb1,847004,public,self,A quote from Good Will Hunting,0,[],0.85,https://www.reddit.com/r/dating/comments/o3h2ir/a_quote_from_good_will_hunting/,all_ads,6,,,,,,,
80,[],False,banjobillyjoebob,,[],,text,t2_ao9c092f,False,False,[],False,False,1624112879,self.dating,https://www.reddit.com/r/dating/comments/o3h99g/what_mistakes_from_their_parents_relationships/,{},o3h99g,False,False,False,False,False,False,True,False,#ff4500,dating,"[{'e': 'text', 't': 'Question'}]",a9531dce-194e-11e5-b177-0eff099c3d1f,Question,light,richtext,True,False,True,6,0,False,all_ads,/r/dating/comments/o3h99g/what_mistakes_from_their_parents_relationships/,False,6,1624118087,1,[removed],True,False,False,dating,t5_2qhb1,847015,public,self,what mistakes from their parents relationships did millenials learn?,0,[],0.67,https://www.reddit.com/r/dating/comments/o3h99g/what_mistakes_from_their_parents_relationships/,all_ads,6,moderator,,,,,,
81,[],False,banjobillyjoebob,,[],,text,t2_ao9c092f,False,False,[],False,False,1624113005,self.dating,https://www.reddit.com/r/dating/comments/o3hb19/why_are_their_fewer_places_to_meet_the_opposite/,{},o3hb19,False,True,False,False,False,True,True,False,#ff4500,dating,"[{'e': 'text', 't': 'Question'}]",a9531dce-194e-11e5-b177-0eff099c3d1f,Question,light,richtext,False,False,True,30,0,False,all_ads,/r/dating/comments/o3hb19/why_are_their_fewer_places_to_meet_the_opposite/,False,6,1624118208,1,"my parents (boomers) met in a coffee shop in NYC. My dad was 24 when he met my mom (21) 

How come you never see this and how come millenials ONLY date in uni and then get married right after? 

They even seem creeped out about meeting people in random places? 

(i guess millenials are kinda right to be wary, my parents are dysfunctional though lol)",True,False,False,dating,t5_2qhb1,847019,public,self,why are their fewer places to meet the opposite sex these days?,0,[],0.56,https://www.reddit.com/r/dating/comments/o3hb19/why_are_their_fewer_places_to_meet_the_opposite/,all_ads,6,,,,,,,
82,[],False,Excellent_Rhubarb520,,[],,text,t2_85d1vg7t,False,False,[],False,False,1624113066,self.dating,https://www.reddit.com/r/dating/comments/o3hbsh/called_a_girl_cute_then_she_unmatched/,{},o3hbsh,False,True,False,False,False,True,True,False,#ffb000,,"[{'e': 'text', 't': 'Tinder/Online Dating'}]",5214d2ac-61f1-11e8-8bb1-0ed15e4a39c0,Tinder/Online Dating,dark,richtext,False,False,True,139,0,False,all_ads,/r/dating/comments/o3hbsh/called_a_girl_cute_then_she_unmatched/,False,6,1624118264,2,I matched with this girl on bumble. She said hi to me and called me “highly-educated”. I replied saying “Hello cutie pie” then she unmatched. I dont understand. She did said she is a feminist on her profile. Is that the reason? Do women find it offensive when men compliment their look in dating apps?,True,False,False,dating,t5_2qhb1,847020,public,self,Called a girl cute then she unmatched?,0,[],0.56,https://www.reddit.com/r/dating/comments/o3hbsh/called_a_girl_cute_then_she_unmatched/,all_ads,6,,,,,1624114022.0,,
83,[],False,Zenobith,,[],,text,t2_efgzw,False,False,[],False,False,1624113381,self.dating,https://www.reddit.com/r/dating/comments/o3hfth/opensource_dating_web_app/,{},o3hfth,False,False,False,False,False,False,True,False,,dating,"[{'e': 'text', 't': 'Other'}]",fd9c03b8-a1ce-11e7-9172-0e8c9f9ecf4c,Other,dark,richtext,False,False,True,2,0,False,all_ads,/r/dating/comments/o3hfth/opensource_dating_web_app/,False,6,1624118573,1,[removed],True,False,False,dating,t5_2qhb1,847025,public,self,open-source dating web app,0,[],1.0,https://www.reddit.com/r/dating/comments/o3hfth/opensource_dating_web_app/,all_ads,6,moderator,,,,,self,"{'enabled': False, 'images': [{'id': '3WZccZCy0KE7NJBtfRnl9lr515WXhp1aKy0Jm2CYHyQ', 'resolutions': [{'height': 54, 'url': 'https://external-preview.redd.it/XJ6geDxYzzg9iwgSQxDclsvCIox8HsLgIfv5zD_IzHw.jpg?width=108&amp;crop=smart&amp;auto=webp&amp;s=706670a8753e6eeb2218a4ee46f318859e26568c', 'width': 108}, {'height': 108, 'url': 'https://external-preview.redd.it/XJ6geDxYzzg9iwgSQxDclsvCIox8HsLgIfv5zD_IzHw.jpg?width=216&amp;crop=smart&amp;auto=webp&amp;s=6e5b14b093620bf43bd7fe4784bbbfb68ee1ce75', 'width': 216}, {'height': 160, 'url': 'https://external-preview.redd.it/XJ6geDxYzzg9iwgSQxDclsvCIox8HsLgIfv5zD_IzHw.jpg?width=320&amp;crop=smart&amp;auto=webp&amp;s=02b2ffffdfefe113ea3e4056d53a8c902cc9ad2f', 'width': 320}, {'height': 320, 'url': 'https://external-preview.redd.it/XJ6geDxYzzg9iwgSQxDclsvCIox8HsLgIfv5zD_IzHw.jpg?width=640&amp;crop=smart&amp;auto=webp&amp;s=d3b18c89fcfd36891bfe7934bd3384ac34482c19', 'width': 640}, {'height': 480, 'url': 'https://external-preview.redd.it/XJ6geDxYzzg9iwgSQxDclsvCIox8HsLgIfv5zD_IzHw.jpg?width=960&amp;crop=smart&amp;auto=webp&amp;s=57d188ae033d65a6913634260a26c0649c1a1358', 'width': 960}, {'height': 540, 'url': 'https://external-preview.redd.it/XJ6geDxYzzg9iwgSQxDclsvCIox8HsLgIfv5zD_IzHw.jpg?width=1080&amp;crop=smart&amp;auto=webp&amp;s=e978d278f16e09f20535215d498ec1811ed8b70d', 'width': 1080}], 'source': {'height': 600, 'url': 'https://external-preview.redd.it/XJ6geDxYzzg9iwgSQxDclsvCIox8HsLgIfv5zD_IzHw.jpg?auto=webp&amp;s=690188f7904b5c26c641b7110f200dfe734b72eb', 'width': 1200}, 'variants': {}}]}"
84,[],False,inferno63,,[],,text,t2_373nth0s,False,False,[],False,False,1624113669,self.dating,https://www.reddit.com/r/dating/comments/o3hjj9/we_need_friends_apps/,{},o3hjj9,False,True,False,False,False,True,True,False,#878a8c,dating,"[{'e': 'text', 't': 'Venting'}]",a616c322-194e-11e5-ab91-0ed1c06bdad7,Venting,light,richtext,False,False,False,20,0,False,all_ads,/r/dating/comments/o3hjj9/we_need_friends_apps/,False,6,1624118857,4,"I’m done with dating apps. I don’t want to go into it with those expectations hanging over my head like a dark cloud. Before apps people met each other under a different cloud. Under any normal event or occasion you met, you talked, your friends either knew them or heard of them. No pressure if what’s next because “next” happened as it should without a dating script. If you hung out again, we were not counting it as dates and applying dating rules like sex on date 3. I wish there was a way to meet friends with friends being the expectation. Then what happens, happens or not. Single would not be a requirement, everyone needs friends with similar interests.",True,False,False,dating,t5_2qhb1,847034,public,self,We need friends apps!,0,[],0.75,https://www.reddit.com/r/dating/comments/o3hjj9/we_need_friends_apps/,all_ads,6,,,,,,,
85,[],False,throwawaynewjjjkk,,[],,text,t2_2t7l5h57,False,False,[],False,False,1624114112,self.dating,https://www.reddit.com/r/dating/comments/o3hp2d/am_i_being_too_stubborn/,{},o3hp2d,False,True,False,False,False,True,True,False,#ea0027,dating,"[{'e': 'text', 't': 'I Need Advice'}]",19ec58c2-9f74-11e7-81a1-0e2bf15991f0,I Need Advice,light,richtext,False,False,False,13,0,False,all_ads,/r/dating/comments/o3hp2d/am_i_being_too_stubborn/,False,6,1624119293,0,"S, I have a crush on this girl. Found out she has recently got a bf. It wasn't that huge, but I do think a lot about her. Then I was in a group project with another girl. And she developed a crush on me I think.

This girl is super sweet, but she isn't that ""fun"".  Of late, she has been trying too hard. Always trying to message me for very irrelevant tasks. When I don't view her stories, she gets upset and down. I do care a lot about her, but not in that way. 

So, I am in a bit of sticky situation. If I don't date her, I feel guilty about not giving someone chance who has tried so hard. On the other hand, if I do decide to date her, I feel like dating your second choice because your actual crush isn't available is wrong and disrespectful. For now, I have been maintaining my distance with her. What should I do? Am I being too stubborn? Tbh, I am. I need what I need and I just can't settle for less. I have zero feelings for her. And I am not sure it will change.  But, she is so sweet and kind and pure?(this sounds creepy I dont know why). 

Am I overthinking? At this point, I am hoping my reading is wrong.",True,False,False,dating,t5_2qhb1,847045,public,self,Am I being too stubborn?,0,[],0.5,https://www.reddit.com/r/dating/comments/o3hp2d/am_i_being_too_stubborn/,all_ads,6,,,,,,,
86,[],False,JuneThrowaway2021,,[],,text,t2_ctcwta9d,False,False,[],False,False,1624114622,self.dating,https://www.reddit.com/r/dating/comments/o3hvik/i_f24_need_some_advice_and_soon/,{},o3hvik,False,True,False,False,False,True,True,False,#ea0027,dating,"[{'e': 'text', 't': 'I Need Advice'}]",19ec58c2-9f74-11e7-81a1-0e2bf15991f0,I Need Advice,light,richtext,False,False,True,45,0,True,all_ads,/r/dating/comments/o3hvik/i_f24_need_some_advice_and_soon/,False,6,1624119797,6,"Throwaway for obvious reasons. Apologies for the long post which I am typing on my phone. I (F24) been seeing this guy (M28) for about 8 months now. Let’s call him John. My last relationship ended rather badly when I realized that my then-boyfriend of nearly 2 years was cheating on me with his secretary. After that ended, I could not muster the courage to date again for over a year and a half. Then I met John at a mutual friend’s birthday party. We exchanged numbers and it just took off from there, I guess. John is my second serious boyfriend. I have had a couple of casual hookups apart from these two, and that’s it. 

The thing is, John is VERY attractive. Have you seen couples where you wondered ‘how did THIS guy land that gorgeous woman?!’. That’s kinda the story of my life, in reverse. Other women do not hesitate to make a move on him. In his own admission, he has been groped, touched, and kissed without consent multiple times. And when he recoils or pulls away, some women have followed him. He has been followed all the way home by women on at least two occasions. 

Once, I was 10 minutes late to a date due to traffic and when I reached, a couple of women were already flirting with him. One of them handed him her number AFTER she saw me. She actually accosted him in the mens’ room, handed her number over, and smirked at me before leaving the restaurant. 

I am no butterface, but this guy is WAYYY out of my league looks wise. I try to laugh it off when things like that happen, but it is getting to me. He swears he does not enable it, but I do not see him discouraging such women either. How difficult is it to say ‘no thanks, I have a girlfriend?!’. And he is way more sexually experienced. His partners have gone to extreme lengths to please him, and have done acts that frankly disgust me. 

Our sex life is great, but he has asked me to do things that I am not comfortable with. He asked me to rim him once, and when I refused, he just laughed and said ‘well, you will eventually’. And on another occasion, he opened what he calls his ‘panty drawer’ that had no less than 25 panties, thongs etc. in it. Yes, they were from the women he slept with previously. They are his ‘war trophies’, and he refuses to throw them out. I am so tempted to check his phone too, but nothing is out of place yet that suggests I should. Plus, the idea of invading his privacy like that is revolting to me. What should I do? Put my foot down and insist he push back on unwanted advances? Be the obsessed, insecure girlfriend and keep him on a tight leash? Or just play it cool? My older, married sister has met him and has said it is just a matter of time before he cheats.",True,False,False,dating,t5_2qhb1,847054,public,nsfw,I (F24) need some advice. And soon.,0,[],0.87,https://www.reddit.com/r/dating/comments/o3hvik/i_f24_need_some_advice_and_soon/,promo_adult_nsfw,3,,,,,,,
87,[],False,noodleheadnat,,[],,text,t2_3fnaii2e,False,False,[],False,False,1624114961,self.dating,https://www.reddit.com/r/dating/comments/o3i02n/summer_dating/,{},o3i02n,False,True,False,False,False,True,True,False,#ea0027,dating,"[{'e': 'text', 't': 'I Need Advice'}]",19ec58c2-9f74-11e7-81a1-0e2bf15991f0,I Need Advice,light,richtext,False,False,True,6,0,False,all_ads,/r/dating/comments/o3i02n/summer_dating/,False,6,1624120141,1,"Greetings. I need advice on a guy I just started hanging out with. So we’ve been snapping for a few weeks after he joined my friends birthday outing a month ago. I have been single for a year now and am ready to get back out there for some fun. I’m not looking for a relationship per se, or even sex at the moment. But just someone to enjoy spending time with. We went to see the sunset on Thursday and I packed a picnic. It was lovely. And then last night we went to the mall and then drinks with same (mutual) friend. 
So where I’m a little confused. Beach Thursday we got touchy after about two hours and I enjoyed it. Yesterday wasn’t as touchy, but it was daylight and we were either in the car or out in public so I get it. When we went to the first place for drinks, I felt some distance once his friend arrived. He kissed me goodnight at the end of it all but the last hour just felt a little odd. How do I not overthink this and just enjoy each other without trying to overthink everything. I’m 23F btw and he is 25M. Do I ask him to hang out again? Also do “summer flings” just naturally become so or do you have to declare it? I’m not trying to have that convo but I also realize it’s already so early so maybe I’m just being too anxious. Thanks y’all",True,False,False,dating,t5_2qhb1,847063,public,self,Summer dating,0,[],0.67,https://www.reddit.com/r/dating/comments/o3i02n/summer_dating/,all_ads,6,,,,,,,
88,[],False,Jobseeker2038,,[],,text,t2_ctcl56oh,False,False,[],False,False,1624115063,self.dating,https://www.reddit.com/r/dating/comments/o3i1e2/is_she_blowing_me_off/,{},o3i1e2,False,False,False,False,False,False,True,False,#ff4500,dating,"[{'e': 'text', 't': 'Question'}]",a9531dce-194e-11e5-b177-0eff099c3d1f,Question,light,richtext,False,False,True,5,0,False,all_ads,/r/dating/comments/o3i1e2/is_she_blowing_me_off/,False,6,1624120240,1,[removed],True,False,False,dating,t5_2qhb1,847065,public,self,Is she blowing me off,0,[],1.0,https://www.reddit.com/r/dating/comments/o3i1e2/is_she_blowing_me_off/,all_ads,6,moderator,,,,,,
89,[],False,No_Light8809,,[],,text,t2_b5fdzwn2,False,False,[],False,False,1624116876,self.dating,https://www.reddit.com/r/dating/comments/o3iobb/realized_im_going_to_die_alone_and_a_virgin/,{},o3iobb,False,True,False,False,False,True,True,False,#878a8c,dating,"[{'e': 'text', 't': 'Venting'}]",a616c322-194e-11e5-ab91-0ed1c06bdad7,Venting,light,richtext,False,False,False,33,0,False,all_ads,/r/dating/comments/o3iobb/realized_im_going_to_die_alone_and_a_virgin/,False,6,1624122017,0,Social anxiety and genetics did me dirty. Im a worthless piece of shit who can't even talk to people. Im 21 years old virgin who will never be desired or wanted. There isn't even a point in trying. Might as well kill myself.,True,False,False,dating,t5_2qhb1,847108,public,self,Realized im going to die alone and a virgin,0,[],0.38,https://www.reddit.com/r/dating/comments/o3iobb/realized_im_going_to_die_alone_and_a_virgin/,all_ads,6,,,,,,,
90,[],False,Awkward_Relation_999,,[],,text,t2_7dz38atf,False,False,[],False,False,1624117246,self.dating,https://www.reddit.com/r/dating/comments/o3it5d/im_47_and_only_younger_men_hit_on_me/,{},o3it5d,False,False,False,False,False,False,True,False,#ffb000,,"[{'e': 'text', 't': 'Tinder/Online Dating'}]",5214d2ac-61f1-11e8-8bb1-0ed15e4a39c0,Tinder/Online Dating,dark,richtext,False,False,True,0,0,False,all_ads,/r/dating/comments/o3it5d/im_47_and_only_younger_men_hit_on_me/,False,6,1624122385,1,[removed],True,False,False,dating,t5_2qhb1,847120,public,self,I'm 47 and only younger men hit on me,0,[],1.0,https://www.reddit.com/r/dating/comments/o3it5d/im_47_and_only_younger_men_hit_on_me/,all_ads,6,moderator,,,,,,
