,all_awardings,allow_live_comments,author,author_flair_css_class,author_flair_richtext,author_flair_text,author_flair_type,author_fullname,author_is_blocked,author_patreon_flair,author_premium,awarders,can_mod_post,contest_mode,created_utc,domain,full_link,gildings,id,is_created_from_ads_ui,is_crosspostable,is_meta,is_original_content,is_reddit_media_domain,is_robot_indexable,is_self,is_video,link_flair_background_color,link_flair_css_class,link_flair_richtext,link_flair_template_id,link_flair_text,link_flair_text_color,link_flair_type,locked,media_only,no_follow,num_comments,num_crossposts,over_18,parent_whitelist_status,permalink,pinned,pwls,retrieved_on,score,selftext,send_replies,spoiler,stickied,subreddit,subreddit_id,subreddit_subscribers,subreddit_type,thumbnail,title,total_awards_received,treatment_tags,upvote_ratio,url,whitelist_status,wls,removed_by_category,author_flair_template_id,author_flair_text_color
34,[],False,Feistypuffin,,[],,text,t2_8od06cuw,False,False,False,[],False,False,1636201529,self.dating,https://www.reddit.com/r/dating/comments/qnz6n6/a_vent_dating_as_a_woman/,{},qnz6n6,False,True,False,False,False,True,True,False,#00a6a5,dating,"[{'e': 'text', 't': 'Support Needed'}]",fd9c03b8-a1ce-11e7-9172-0e8c9f9ecf4c,Support Needed,dark,richtext,False,False,True,964,0,False,no_ads,/r/dating/comments/qnz6n6/a_vent_dating_as_a_woman/,False,0,1636201540,1,"I feel like hookup culture has brought out the worst in men. It’s not even their fault, WE sent the message that it’s acceptable. But I believe the apps (paradox of choice problems) and hookup culture (spits in the face of the very real FACT that most women have trouble separating sex and emotions) have RUINED dating. 

I am 32, a certified 8.5 according to my friend John 😂(who is quite hot himself and sleeps his way through our city), make 250k/ year (I don’t disclose this but I think they can tell I do well), very in shape, educated, worldly/cultured/traveled and very fun and outgoing with a huge social group and a ton of hobbies (I ski; do handmade ceramics, play tennis, workout, cook, travel). Super long Blonde hair, brown eyes, 5’4, 118 lbs with boobs and a butt if I do say so myself.

But goddamnit, the more I’ve glowed up in life or in looks, the men who are in my ‘“league’ or the male versions of me are getting chased down the street for dates and therefore they are just too spoiled for choice and won’t commit. 

My male equals (in a romantic match sense) who ARE good men who genuinely like having gfs/wives ALREADY HAVE ONE. They are literally taken.

The only hotties on the apps get too much attention and though we may end up dating for a teeny bit, they just want to keep playing the field.

When I see hotties out in ‘the wild’, they already have a girl by their side. 

There are just so many truly beautiful women (8s and above) and not enough men that can measure up for these super women. It’s so disappointing. There is this holy grail of a man we are ALL looking for, and then we finally think we found him and that man has already let the female attention/endless choice turn him into a fuckboy.

I’m at a loss. I was with someone for five years 4 years ago. SO handsome, so wonderful to me; so funny; so successful. Just all the things. And he was all in from day One, no games. I am over him now and have been for some time (he didn’t want to marry me after all that time, this wasted my half my 20s. but I say this to point out that I just can’t go backwards from that, you know?  I know what it’s like to be truly smitten and insanely in love with a serious catch who fits the things I want.


Anyway. Just venting I guess. I feel like I will have to settle for someone that doesn’t truly light me up sexually or at all, or be alone and never have children, and I just started crying in my therapists office the other day about it.

Any other women at this crossroad?",True,False,False,dating,t5_2qhb1,1124066,public,self,A vent- dating as a woman,0,[],1.0,https://www.reddit.com/r/dating/comments/qnz6n6/a_vent_dating_as_a_woman/,no_ads,0,,,
35,[],False,adamwilliams67,,[],,text,t2_1f0prtuj,False,False,False,[],False,False,1636202632,self.dating,https://www.reddit.com/r/dating/comments/qnzgu2/what_happened/,{},qnzgu2,False,True,False,False,False,True,True,False,#ea0027,dating,"[{'e': 'text', 't': 'I Need Advice'}]",19ec58c2-9f74-11e7-81a1-0e2bf15991f0,I Need Advice,light,richtext,False,False,False,2,0,False,no_ads,/r/dating/comments/qnzgu2/what_happened/,False,0,1636202643,1,"Me and this girl have been hanging out since October 20th. We hung out three times. The last time we hung out on Halloween night this past Sunday. We went on a ghost tour and everything went great. Afterwards, we went back to her car and just talked and she was all over me and we made out and everything was great. I told her to hit me up when she made it home and she said that she would but she never did. The next day she didn’t message me but we ended up making plans to go to the gym that afternoon. So I texted her around 4:30pm to ask her if she still wanted to go workout. Well she didn’t message me back for like three hours but I creeped and saw that she her Snapchat score kept going up so she was clearly ignoring me. She finally messages me back 3 hours later saying “I’m so sorry, I forgot and I got called into work tonight so I worked out earlier. I apologize.” And i said that it was okay and we just asked each other how are days went and that was that.

The next day we barley text each other and of course she’s putting me on the back burner but her snap score is just steadily going up so I’m just assuming that she’s met someone else at this point and I’m honestly bummed out about it. I mean, the other day we were joking with each other saying about how we have so many tinder people that we’re talking to. Well she ended up saying “nah, I’m not that type of girl” but of course that could be bs. I ended up just not texting her back because she would take hours to respond and she would say “sorry, I’ve been busy” but yet her snap score kept going up. So on Tuesday night I just told her to have a good night and she said “you too” and I haven’t heard from her since and her snap score is just skyrocketing so I just assumed that she’s not interested. I’m honestly bummed out about it.",True,False,False,dating,t5_2qhb1,1124073,public,self,What happened?,0,[],1.0,https://www.reddit.com/r/dating/comments/qnzgu2/what_happened/,no_ads,0,,,
36,[],False,kikokukake,,[],,text,t2_3wjoxqxd,False,False,False,[],False,False,1636202827,self.dating,https://www.reddit.com/r/dating/comments/qnzipt/what_do_you_like_least_about_dating_apps/,{},qnzipt,False,True,False,False,False,True,True,False,#ff4500,dating,"[{'e': 'text', 't': 'Question'}]",a9531dce-194e-11e5-b177-0eff099c3d1f,Question,light,richtext,False,False,True,10,0,False,no_ads,/r/dating/comments/qnzipt/what_do_you_like_least_about_dating_apps/,False,0,1636202838,1,I get so frustrated with people who take days to reply to a message.,True,False,False,dating,t5_2qhb1,1124073,public,self,What do you like least about dating apps?,0,[],1.0,https://www.reddit.com/r/dating/comments/qnzipt/what_do_you_like_least_about_dating_apps/,no_ads,0,,,
37,[],False,OroParaOso,,[],,text,t2_s44jg,False,False,False,[],False,False,1636203406,self.dating,https://www.reddit.com/r/dating/comments/qnzo80/she_broke_up_with_her_bf_and_wants_to_see_me/,{},qnzo80,False,True,False,False,False,True,True,False,#ea0027,dating,"[{'e': 'text', 't': 'I Need Advice'}]",19ec58c2-9f74-11e7-81a1-0e2bf15991f0,I Need Advice,light,richtext,False,False,True,11,0,False,no_ads,/r/dating/comments/qnzo80/she_broke_up_with_her_bf_and_wants_to_see_me/,False,0,1636203418,1,"I have been recently reconnecting with my (34m) ex gf (32f). We broke up approx 18 months ago after six months of dating. The relationship ended suddenly right as things were getting serious (meeting families, saying ILY, keys to apartments, etc.). I was heartbroken. She claimed it was related to a traumatic relationship she had which ended 6 months prior to meeting me. I could tell she was having a hard time.

Well recently, her and I have been reconnecting after not seeing each other for a year. We’ve hung out 4 times in the last 6 weeks. I told her early on I still had strong feelings for her and that she’s the woman I want to be with; and that dating other women felt disingenuous to me. She said it was music to her ears, but also said she had been “seeing” this older guy (42m) for a few months and felt like she should try to make it work with him, despite them having issues “weekly.” He was critical of her, flaked on plans, etc. She told me I might have to “play the long game.”

Well yesterday I sent her a text asking how she was doing and if she had plans for the weekend. She replied that her relationship with the older guy ended a few days earlier and she was reeling a bit, despite it “being for the best” and before any more time was wasted. She said she had been drinking and that she wasn’t telling me all of this because she felt like we needed to re-kindle. She said she’s glad her and I are still friends and that she’s appreciates me and asked if we could hang out at her place or mine this weekend.

The thing is, her and I are not really friends. When I’m with her, I treat her as a love interest (lots of flirting, touching, innuendo, etc.). She knows that I’m in love with her. 

I’m really not trying to be her rebound, but I absolutely do plan on seeing her ASAP. I want an LTR with her, but need some perspective here because I can already feel myself getting worked up over the possibility of getting back together. I understand there are red flags, and I’m considering those, but the heart wants what the heart wants and I can’t help that I’m crazy about her- she’s incredible. How might I proceed so that I can make sure she knows I care about her, but without manipulating the situation.

Any advice and feedback is appreciated! Thanks!

TL;DR: have been reconnecting with my ex gf who I still love. We’ve hung out a few times recently, despite her “seeing” another guy whom she complained about to me. Well they broke up a few days ago and she wants to see me, but also said she wasn’t telling me this to “re-kindle.” I should probably take that at face value, but there’s a ton of chemistry between us still (lots of flirting) and she knows exactly how I feel about her. I want her back.",True,False,False,dating,t5_2qhb1,1124074,public,self,She broke up with her bf and wants to see me…,0,[],1.0,https://www.reddit.com/r/dating/comments/qnzo80/she_broke_up_with_her_bf_and_wants_to_see_me/,no_ads,0,,,
38,[],False,green-vetements,,[],,text,t2_btwlntbd,False,False,False,[],False,False,1636203497,self.dating,https://www.reddit.com/r/dating/comments/qnzp3f/im_sure_tinder_and_bumble_just_triggers_my/,{},qnzp3f,False,True,False,False,False,True,True,False,#ffb000,,"[{'e': 'text', 't': 'Tinder/Online Dating'}]",5214d2ac-61f1-11e8-8bb1-0ed15e4a39c0,Tinder/Online Dating,dark,richtext,False,False,True,54,0,False,no_ads,/r/dating/comments/qnzp3f/im_sure_tinder_and_bumble_just_triggers_my/,False,0,1636203508,1,"I (31M) have been single for nearly a decade now. My last relationship was in my very early 20s and I haven't really gotten any good leads since then. 

I've started to try online dating 2 years ago and I can definitely say now with conviction that it led to nothing but disappointment. I did get matches which led to chats and dates who eventually turned into ghosts. I'm pretty sure girls have it better, with tons options.

I deleted multiple times already but found myself coming back to ""try my luck."" And today would be the last because I had my most traumatic experience ever.
After which I found myself feeling worthelss,  the most anxious I've ever been and depressed and even a bit suicidal.

I thought to myself: ""I guess I'd just die alone. Nobody would care. Maybe I'd be even be happier if I just vanish right now."" The moment I thought that to myself, it's comforting that there was an inner voice saying: WTF ARE YOU SAYING?! 

Here's the catch: I'm sure as hell I'm a keeper. I'm fit/athletic and I look so much younger for my age. If anything, maybe I'm ""too nice"" and I've heard that alot.

So, yeah. I'm done. Trying my best to go back to being positive.",True,False,False,dating,t5_2qhb1,1124077,public,self,I'm sure Tinder and Bumble just triggers my anxiety and depression. So I deleted it for good.,0,[],1.0,https://www.reddit.com/r/dating/comments/qnzp3f/im_sure_tinder_and_bumble_just_triggers_my/,no_ads,0,,,
39,[],False,FrostyShock389,,[],,text,t2_1r39tz2e,False,False,False,[],False,False,1636203552,self.dating,https://www.reddit.com/r/dating/comments/qnzpn5/should_i_give_up/,{},qnzpn5,False,True,False,False,False,True,True,False,#ff4500,dating,"[{'e': 'text', 't': 'Question'}]",a9531dce-194e-11e5-b177-0eff099c3d1f,Question,light,richtext,False,False,True,20,0,False,no_ads,/r/dating/comments/qnzpn5/should_i_give_up/,False,0,1636203563,1,"I (27M) have only ever had two very short lived relationships in my life, and both ended because I really don't know how to be romantically or intimately open, I've actually lost all of my friends because of how inept I was at dating (my first girlfriend, her and I shared the same group of friends, she got the group to set us up, and this was jr. year HS). 

I've made a few attempts at dating and haven't been successful at all, top it off that recently I've decided I'll focus on making friends again, there was this girl who took an interest in me, got my new group of friends to set up some test and I apparently failed, it felt like I was dragged into a pool of gasoline and given a box of matches, so I crawled out and lit a cigarette.

Am I just meant to be single? Should I save myself a lifetime of suffering and just give up on dating? I feel like just shriveling up and not even bothering, not even with casual sex. All of it just feels completely foreign and alien to me, I've read up and watched videos on dating and casual affairs, even asked friends on advice on it, nothing makes sense. Dating apps are just scams to me, I just feel like a creep at parties, I feel like people look at me like I have a third eye growing on my nose, it just seems like people who talk to me like they're just digging for info to laugh at me and kick me down.

I don't know what to do, I don't know how to be, I just feel worthless and a target of ridicule.",True,False,False,dating,t5_2qhb1,1124077,public,self,Should I give up?,0,[],1.0,https://www.reddit.com/r/dating/comments/qnzpn5/should_i_give_up/,no_ads,0,,,
40,[],False,rng437,,[],,text,t2_284513lc,False,False,False,[],False,False,1636203648,self.dating,https://www.reddit.com/r/dating/comments/qnzqx3/why_do_we_like_shitty_people/,{},qnzqx3,False,True,False,False,False,True,True,False,#ea0027,dating,"[{'e': 'text', 't': 'I Need Advice'}]",19ec58c2-9f74-11e7-81a1-0e2bf15991f0,I Need Advice,light,richtext,False,False,True,2,0,False,no_ads,/r/dating/comments/qnzqx3/why_do_we_like_shitty_people/,False,0,1636203659,1,"I had a thing with a guy back in college who was quite famous among girls. Every other girl used to flirt with him and I used to regularly hear about him. Met him somewhere and got a lot of attention from him. For some time I enjoyed it and played along but he never seemed serious and I started dating someone else. While I was dating someone else, he started appearing in classes I took and it was a little uncomfortable though he never said or did anything. Eventually he started dating someone else and I was relieved. 

Reconnected with him years later and he still seemed interested. I remembered his reputation from college and thought of giving him some benefit of doubt. He didn't share a thing about him while I kept talking and turned out he had a gf the whole time. There was definitely flirting between us. They were in a long distance. Had to cut him off but I was hurt. We still share social media space. He broke with his gf and came back and told me he loved me but I don't want to date someone like him. Then he reconnected with his gf and they are back together now. She moved to his country and are probably engaged. They probably never broke up properly and were still in touch. Sounds like a red flag to me. 

His only concern was we weren't in the same place which I could have easily made possible but didn't want to commit so early. He played with my feelings and kept his gf as a safe option. I didn't want to tell him that I could travel or study near wherever he is working. Now he knows that and he is trying to get in touch again and I am divided in two. I never gave it an honest chance but I know he is trouble. 

It's hard to see their social media ups and downs and to not feel bad when you're treated like that. A part of me wants to yell at him for treating me that way and other part of me knows nothing good is going to come out and I got out of it before getting invested. Feeling bad for sharing things with him and feeling stupid.",True,False,False,dating,t5_2qhb1,1124078,public,self,Why do we like shitty people?,0,[],1.0,https://www.reddit.com/r/dating/comments/qnzqx3/why_do_we_like_shitty_people/,no_ads,0,,,
41,[],False,Leather_Hedgehog5142,,[],,text,t2_82vk6eot,False,False,False,[],False,False,1636203756,self.dating,https://www.reddit.com/r/dating/comments/qnzs2e/doesnt_know_what_he_wants/,{},qnzs2e,False,True,False,False,False,True,True,False,#ea0027,dating,"[{'e': 'text', 't': 'I Need Advice'}]",19ec58c2-9f74-11e7-81a1-0e2bf15991f0,I Need Advice,light,richtext,False,False,True,8,0,False,no_ads,/r/dating/comments/qnzs2e/doesnt_know_what_he_wants/,False,0,1636203766,1,"I’ve been seeing this guy for about a month now, and things have been going really great. Yesterday I decided to ask him where he thinks this relationship is going. As for both of us this “relationship” kind of surprised us, and we didn’t expect it to happen, but it did. Anyway, he calls me and says he can’t promise he could give me the attention I need right now, and he’s not sure what he wants, I understood. The more I think about it, the more I feel like it’s a waiting game for him to decide when he doesn’t want this anymore. I tend to overthink a lot. I should mention that he said he wants to continue seeing me, and he’s not in it for sex and he thinks I’m the coolest girl he’s ever talked to, and he doesn’t think I’m wasting my time. But I also feel like if you wanted someone you would go for it?? Do you think it would be smart to take a week with no contact for him to clear his head and maybe think about things? Because I’m not going to wait forever even though this guy has been amazing so far. The way he spoke sounded like there was a happy ending at the end of this story. But it still scares me, I don’t want to get myself more emotionally invested for the chance of him deciding he doesn’t want this anymore. But I guess that’s kind of with every relationship? Just asking for general advice, thank you :)",True,False,False,dating,t5_2qhb1,1124078,public,self,Doesn’t know what he wants,0,[],1.0,https://www.reddit.com/r/dating/comments/qnzs2e/doesnt_know_what_he_wants/,no_ads,0,,,
42,[],False,Izob,,[],,text,t2_jdv5m,False,False,False,[],False,False,1636204655,self.dating,https://www.reddit.com/r/dating/comments/qo01vw/please_check_with_yourself_if_you_are_ready_to/,{},qo01vw,False,True,False,False,False,True,True,False,#ffd635,dating,"[{'e': 'text', 't': 'Giving Advice'}]",7bca2c58-4211-11e5-9ecb-0e60d8112001,Giving Advice,dark,richtext,False,False,True,30,0,False,no_ads,/r/dating/comments/qo01vw/please_check_with_yourself_if_you_are_ready_to/,False,0,1636204666,1,"I went on a date with a girl today who I thought was amazing. We clicked on so many things, I was really attracted to her and we had a good time. 

But this evening she sent me a msg saying that she wasn't ready for dating and that she had recently come out of a breakup that was still complicated.

I sympathise with her situation and respect she is still trying to figure out what she wants. But I'm also crushed. Mostly because I was hoping this could have gone somewhere... also because it's been a really hard year for me to meet someone.


I know we're only human... We're not perfect at thinking about ourselves... I guess I just wanted to rant to someone because this sucks.

Thank you",True,False,False,dating,t5_2qhb1,1124079,public,self,Please check with yourself if you are ready to date...,0,[],1.0,https://www.reddit.com/r/dating/comments/qo01vw/please_check_with_yourself_if_you_are_ready_to/,no_ads,0,,,
43,[],False,Least_Paramedic_7138,,[],,text,t2_eqczdnmy,False,False,False,[],False,False,1636205520,self.dating,https://www.reddit.com/r/dating/comments/qo0b2u/i_dont_get_it/,{},qo0b2u,False,True,False,False,False,True,True,False,#ea0027,dating,"[{'e': 'text', 't': 'I Need Advice'}]",19ec58c2-9f74-11e7-81a1-0e2bf15991f0,I Need Advice,light,richtext,False,False,True,59,0,False,no_ads,/r/dating/comments/qo0b2u/i_dont_get_it/,False,0,1636205531,1,Why do men keep acting like they have this special connection and getting me to open up just to have sex with me and then show absolutely no interest anymore?,True,False,False,dating,t5_2qhb1,1124083,public,self,i don’t get it,0,[],1.0,https://www.reddit.com/r/dating/comments/qo0b2u/i_dont_get_it/,no_ads,0,,,
44,[],False,Cheese-strings_21,,[],,text,t2_6ofyxhu4,False,False,False,[],False,False,1636205716,self.dating,https://www.reddit.com/r/dating/comments/qo0dby/best_way_to_slide_into_someones_dms_ive_always/,{},qo0dby,False,True,False,False,False,True,True,False,#ea0027,dating,"[{'e': 'text', 't': 'I Need Advice'}]",19ec58c2-9f74-11e7-81a1-0e2bf15991f0,I Need Advice,light,richtext,False,False,True,6,0,False,no_ads,/r/dating/comments/qo0dby/best_way_to_slide_into_someones_dms_ive_always/,False,0,1636205727,1,"I’ve known him since the 9th grade, we used to study together. Texted on and off over the years. I had a massive crush on him back in the day. 2 years ago I bumped into him at a party… we sat talking for a fair while. He then had to go use the washroom and asked me to wait for him. I did. He gave me his number and said call me if you move from here. So I sat put and waited.. for about 35 minutes 😅 he didn’t come back. I figured he wasn’t going to and felt too awkward to call so I left. The next morning he texted me saying hey where did you go? I was looking for you. There was a really long line at the washroom. I told him my friends were leaving and they were my ride home so I had to leave and there was no signal to call and tell him that. Anyway. He spoke for a few days after and haven’t spoken since. 
Good idea to slide into his dms and try to re-start the conversation? How? 😅",True,False,False,dating,t5_2qhb1,1124083,public,self,Best way to slide into someone’s DMs? I’ve always been interested in him but not sure if he is/has ever been. It’s been like 2 years since we last spoke. I just want to test the waters with a conversation haha,0,[],1.0,https://www.reddit.com/r/dating/comments/qo0dby/best_way_to_slide_into_someones_dms_ive_always/,no_ads,0,,,
45,[],False,unironicfleshlight53,,[],,text,t2_g4mgi59p,False,False,False,[],False,False,1636206044,self.dating,https://www.reddit.com/r/dating/comments/qo0h51/are_people_attractive_because_theyre_confident_or/,{},qo0h51,False,True,False,False,False,True,True,False,#ff4500,dating,"[{'e': 'text', 't': 'Question'}]",a9531dce-194e-11e5-b177-0eff099c3d1f,Question,light,richtext,False,False,True,293,0,False,no_ads,/r/dating/comments/qo0h51/are_people_attractive_because_theyre_confident_or/,False,0,1636206055,1,"Genuinely asking. 

It feels like a chicken or the egg scenario.

If you’re an attractive, tall, white guy you’re going to get a lot of attention from girls in your formative years. Like some guy that had sex for the first time when he was 14 I’d definitely going to be confident. He’s been able to get attention from girls his entire life. 

If you’re a ugly, shorter, ethnic guy like myself, no girls are going to like you. Not only that but when you do put yourself out there it’s just going to be rejection. There’s no possible way I could be anywhere as near as confident as a tall attractive whit guy who has had women fawning over him his entire life.

So really, are attractive people confident or are confident people attractive?",True,False,False,dating,t5_2qhb1,1124084,public,self,Are people attractive because they’re confident or are they confident because they’re attractive?,0,[],1.0,https://www.reddit.com/r/dating/comments/qo0h51/are_people_attractive_because_theyre_confident_or/,no_ads,0,,,
46,[],False,DaRealCptHindsight,,[],,text,t2_c93a78nu,False,False,False,[],False,False,1636206266,self.dating,https://www.reddit.com/r/dating/comments/qo0jmp/are_you_here/,{},qo0jmp,False,True,False,False,False,True,True,False,#ff4500,dating,"[{'e': 'text', 't': 'Question'}]",a9531dce-194e-11e5-b177-0eff099c3d1f,Question,light,richtext,False,False,True,3,0,False,no_ads,/r/dating/comments/qo0jmp/are_you_here/,False,0,1636206277,1,You might be. I have no idea where to look for you. I'll never give up hope of finding you. I know you exist. I just don't know where. I fear the world is so huge that we'll never meet. Perhaps we did and didn't even know it. It's so lonely without you.,True,False,False,dating,t5_2qhb1,1124086,public,self,Are you here?,0,[],1.0,https://www.reddit.com/r/dating/comments/qo0jmp/are_you_here/,no_ads,0,,,
