,id,created_utc,title,selftext,subreddit,subreddit_id,url
22,rse276,1640903231,"Looking for other peoples opinions on how I look, and possibly small ways to improve.","https://imgur.com/a/KD6YZDo

trying to see what others think of me appearance wise, I think I personally look good for who I am.",dating,t5_2qhb1,https://www.reddit.com/r/dating/comments/rse276/looking_for_other_peoples_opinions_on_how_i_look/
23,rse4ci,1640903399,Getting very self-conscious during sex with him,[removed],dating,t5_2qhb1,https://www.reddit.com/r/dating/comments/rse4ci/getting_very_selfconscious_during_sex_with_him/
24,rse7is,1640903628,"Any other guy a little jealous that in OLD, their female friends get to filter/pick out exactly the traits they want in a guy, while men have to take whatever we’re given?","I’ve noticed I’ve never heard any of my male friends ever say that the person they found online is exactly what they were looking for, it’s usually “she’s nice and cute” and when I asked them if they have anything in common, they say no

My female friends who found someone on this apps, usually:  “he has the same hobbies, interests, career, X hair color, X height, Hes X personality”

Very few of my male friends have been able to get a girlfriend that has the same career success hobbies or interests as them.
My female friends who have a lot going on have zero problem finding other men who have a lot going on. 

It makes me jealous women can actually be picky to find someone who really suits/matches them. 

I have a ton of hobbies, interests, a phenomenal career, above 6 feet, athletic, I cook, read, eat very healthy. 
I have no problem finding women who have none of those things who are into me. But if I set my standard to women are similar to me in the things I listed (except height), I would get 0 dates.

I understand that online dating heavily favors women, pretty kind of sucks as a guy that you have to go through several years of being alone before running into a girl who fits you in real life.",dating,t5_2qhb1,https://www.reddit.com/r/dating/comments/rse7is/any_other_guy_a_little_jealous_that_in_old_their/
25,rse8v1,1640903726,Dating in your 40s sucks,"I'm a 42 year old widow, no kids. I have a good job. Smart, attractive. 
I've tried dating apps, Reddit etc. only to encounter creeps, weirdos and stalkers. Dating just doesn't get any better the older you get. I know what I want and know how to spot red flags early. It's frustrating 😫",dating,t5_2qhb1,https://www.reddit.com/r/dating/comments/rse8v1/dating_in_your_40s_sucks/
26,rse9de,1640903764,Do I date him ? (22F),[removed],dating,t5_2qhb1,https://www.reddit.com/r/dating/comments/rse9de/do_i_date_him_22f/
27,rseik9,1640904446,"Just had a crazy idea, why isn't this a thing?","Forgive me if there actually is a thing like this, I wouldnt know.

But why don't they do like a dating app thing, but in real life? Like instead of just using an app to try and find someone, only to end up getting ghosted for the 15th time, because of literally any reason, why not go to some kind of matchmaking event. I dont mean like a club or a bar or something, but like a whole event dedicated to pairing people up?

Im just sitting there on youtube watching whatever comes on my recommended and I see a bunch of videos of doing IRL speed dating like those Jubilee videos, and I'm like,"" Dude that's actually pretty cool."" 

It'd be perfect for guys who absolutely suck at OLD but would shine in IRL dating but unfortuantely, for whatever reason cant easily meet people. Reasons like maybe their hobbies and interests arent well suited for social events (that attract an equal amount of attention from both sexes), or maybe they just living around an area where they might not be as appreciated as other areas, etc.  Me, I don't like the taste of alcohol, Im way to socially awkward to dance in public. But place me among friends, and I suddenly feel like I could dance a jig or too, just sayin lol

Imagine that, people actually going out to meet people, they see someone and get interested in their story, where if they just saw the same person online on their phone, they'd probably just not swipe on them, cause they might just not register as an actual person to them yet, if that makes sense. People don't gotta sit there and wonder as much if theres anything wrong with them, cause people are actually coming to talk to them.",dating,t5_2qhb1,https://www.reddit.com/r/dating/comments/rseik9/just_had_a_crazy_idea_why_isnt_this_a_thing/
28,rsej25,1640904483,Should I ask my friend out on a date or is it a bad idea?,[removed],dating,t5_2qhb1,https://www.reddit.com/r/dating/comments/rsej25/should_i_ask_my_friend_out_on_a_date_or_is_it_a/
29,rsenp0,1640904823,Symbol that you’re interested,"You ever see those parties where they give out different colored glow necklaces depending on your dating status? Do you think it it would be possible/beneficial to have a sort of universal rule for those? Obviously wouldn’t stop everyone, but I feel like in a bar for example, it’s a place where people want to be approached, but it would be nice if they just had a red bracelet telling me they didn’t, yknow?",dating,t5_2qhb1,https://www.reddit.com/r/dating/comments/rsenp0/symbol_that_youre_interested/
30,rses6q,1640905164,Felt bad leaving coffee date after 1.5 hours,I(22f) met a (29m) for a coffee date today. I had plans for dinner with my mom and brother tonight so we chose to get coffee instead of drinks. We talked in the cafe for an hour then walked around for 30 minutes. I left after 1.5 hour. I been out of the dating came for a little after being in a relationship. I feel guilty I left. I gave him a hug goodbye. Is 1.5 hour good enough for an initial meet up?,dating,t5_2qhb1,https://www.reddit.com/r/dating/comments/rses6q/felt_bad_leaving_coffee_date_after_15_hours/
31,rsexoc,1640905576,"24/M, New to Dating Life.","Hi r/dating.

Earlier this year I got out of a 8 year relationship that started in high-school and so I missed out on the whole dating scene and I'm completely lost. Just need some fresh pointers on getting started.

I've dabbled with tinder and Facebook dating a bit but don't see much coming from that, I'm a moderately attractive guy but I don't seem to get many matches and even the ones I get usually don't respond, I'm hearing that's pretty par for the course though. 

I'm a gamer and a homebody, even though I'm pretty extroverted and outgoing, I find it difficult to think going to a bar or something would find me the type of girl I'm looking for. Especially since I don't drink so I'd just be there awkwardly lol. Any suggestions in that regard?

Not really sure what to ask about cause it's all so new, but I'm hoping some of you may have some advice or something to help me get started.",dating,t5_2qhb1,https://www.reddit.com/r/dating/comments/rsexoc/24m_new_to_dating_life/
32,rsey1r,1640905604,"My ex said I would never meet someone like him in the future, and that I'd only date scums, am I doomed?",[removed],dating,t5_2qhb1,https://www.reddit.com/r/dating/comments/rsey1r/my_ex_said_i_would_never_meet_someone_like_him_in/
33,rsezj1,1640905713,How do you deal with dissapointment?,[removed],dating,t5_2qhb1,https://www.reddit.com/r/dating/comments/rsezj1/how_do_you_deal_with_dissapointment/
34,rsf1aw,1640905844,What’s the difference?,"Hello all. 

I would like to know more about the difference between a serious relationship and a relationship in which the partner is high maintenance.",dating,t5_2qhb1,https://www.reddit.com/r/dating/comments/rsf1aw/whats_the_difference/
35,rsf1r6,1640905880,How to deal with dissapointment?,"So for the last 4 months, I had started seeing a girl that I got on with very well, we had fun and I enjoyed seeing her. However, I was only able to see her because I had moved to near her area for work, I knew I would be moving after about 2 months of seeing her, and so we ended up going from an exclusive relationship to a casual one as trying to see her on a regular basis was difficult and we mutually decided it wouldn't last.

She has recently asked that we don't see each other anymore as a result which I can respect, but I'm filled with a horrible feeling as she has told me she has seen other people since I moved away from her. Even though we mutually agreed to have a casual relationship I can't help but feel a bit betrayed, I had myself gone out and met other girls on nights out but I could never bring myself to do anything as I just felt a lot of guilt about it.

I had asked to see her for the last 3 weeks but she has seemed very on and off about me seeing her, probably because she has been seeing someone else.

Any advice in how to deal with this and the best way to move on?",dating,t5_2qhb1,https://www.reddit.com/r/dating/comments/rsf1r6/how_to_deal_with_dissapointment/
36,rsf32d,1640905981,Hooked up with my close close friend… is this okay?,(f26 &amp; f25) We got drunk on her birthday this past weekend and has both been chatting about experimenting with girls. I then slept in her bed with her and it started with cuddling then things got heated up pretty quickly. It was hot and we both were checking in with each other the whole time. The morning after things were fine we haven’t really talked much about it other than laughing about it. What have you experiences been with sleeping with friends? Does it change the friendship?,dating,t5_2qhb1,https://www.reddit.com/r/dating/comments/rsf32d/hooked_up_with_my_close_close_friend_is_this_okay/
37,rsfbmi,1640906640,Is the way I experience crushes and relationships normal?,"It’s just so different then what I’ve heard from most people my age (I’m in high school)

Everyone talks about having a crush a heart pounding, butterflies in your stomach, and stuff like that but I just, don’t experience that? Like the way it works for me is I just kind of go “this person is really cool, I want to be around them a lot, we’d be a good couple”. Like it’s more of just enjoying a connection with a person then anything. I’ve been in a relationship and it made me happy because I liked being close to the person and I liked feeling wanted and just enjoying the connection but I didn’t really feel anything particularly different or intense but I definitely didn’t just see it as friendship.

Also I feel like I don’t feel like NEED a relationship in the way my friends do. Like they’ll talk about how they’re lonely and how they feel like something is missing and I just can’t relate, like a relationship could be nice but I feel fulfilled with just my friends too.

Is this normal? Sorry if this isn’t the right place to post this I couldn’t think of anywhere else",dating,t5_2qhb1,https://www.reddit.com/r/dating/comments/rsfbmi/is_the_way_i_experience_crushes_and_relationships/
38,rsfk7r,1640907299,Is this a valid reason to stop talking to him,"Today we had a 2 hour phone call which I thought was nice. But towards the end I brought up dating and ethnicity. He told me he prefers this certain group which i’m not it. Tbh I feel a bit insecure now, I was starting to like him and potentially wanted to meet him. But now I think I don’t want to anymore, I feel if he was attracted to me. It wouldn’t really be a strong attraction. I have never been in a relationship, so any advice would be greatly appreciated.",dating,t5_2qhb1,https://www.reddit.com/r/dating/comments/rsfk7r/is_this_a_valid_reason_to_stop_talking_to_him/
39,rsfsau,1640907935,Question for the boys!,What does it mean when a guy tells you that he’s not willing to get seriously involved for the moment? Do I continue dating him?,dating,t5_2qhb1,https://www.reddit.com/r/dating/comments/rsfsau/question_for_the_boys/
40,rsfvpp,1640908205,Why would my ex block me if I haven’t talked to him in almost 2 years? Why am I in their heads this much? 24 F,"So two years ago I dated a man for a few months who was basically insisting he was going to marry me, gave me the whole 9 yards. 

As you can imagine we broke up, and I truly haven’t talked to him in 2 years (I know that’s sometimes hard to believe on here but it’s the truth with me 😊). 

I recently had to make new social media but not a big deal at all. I got hacked (sucks but that’s life) 

Anyways I saw the Snapchat of my ex and his best friend, but I ignored it and went on my day. 

I went back the next day to show my sister something and they had blocked me! 

I’m not pretending to not care because I do. I just think it’s so strange and weird that they’d go out of their way to block me.

Especially because my phone number and last name are not tied to this account. 

Why would I be in their heads after 2 years? I haven’t contacted them, seen them or heard from them. 

TL;DR talking about my ex",dating,t5_2qhb1,https://www.reddit.com/r/dating/comments/rsfvpp/why_would_my_ex_block_me_if_i_havent_talked_to/
41,rsfw18,1640908230,Tips for online dating?,"I'm (19F) thinking about joining a dating app but am so confused on what to do and ngl, kinda scared. I'm looking for a genuine relationship, not at all interested in hook ups but have been told that that's all guys want, especially on dating apps. Is there a chance to find a genuine relationship on dating apps? And how do I know if someone is lying to me? Is there a way to make it clear that I'm not interested in hook ups or friends with benefits and will people even listen to that or ignore it and try anyway? Any basic tips are also appreciated btw! (Like tips about bio, pictures, conversations, apps, etc)",dating,t5_2qhb1,https://www.reddit.com/r/dating/comments/rsfw18/tips_for_online_dating/
42,rsg0bg,1640908578,Question,"I was asked by a guy on a dating app how my dating life is going. I don’t know what to say besides something like it’s ok, how’s yours. Advice needed.",dating,t5_2qhb1,https://www.reddit.com/r/dating/comments/rsg0bg/question/
43,rsg7ni,1640909155,Serious advice only.,**whats the point of getting education as a woman when most educated successful men dont give a shit abuot women education or how smart she is as long as hes fuckable? most lawyers I interacted with doesn't seem to care about womens eduacation or even whether or not she has college degree. they dont care if women are ambitious or not. one guy on dating app told me he would date someone as long as they are fun. we live in misogynistic acuity and this makes me feel completely hopeless about dating. do I have to give in and conform into sexism in society if I want to be accepted and loved by men? I dont wanna fight anymore. I ask question on dating app then men dont seem to care about how dumb women are. my therapist is useless and blamed me and told me I will not get the intimacy I need from men if I ask questions about my concerns relating to sexism ? how is this going to be healthy in long term if I only say things what they want to hear ? lol**,dating,t5_2qhb1,https://www.reddit.com/r/dating/comments/rsg7ni/serious_advice_only/
44,rsgab4,1640909370,I will be 23 in three months and I fear that guys won’t be interested in me anymore.,My time and youth is running out. I’m scared that guys won’t want me anymore because of my age. I fear that I’m getting too old for guys.,dating,t5_2qhb1,https://www.reddit.com/r/dating/comments/rsgab4/i_will_be_23_in_three_months_and_i_fear_that_guys/
45,rsgi74,1640910019,What would be a good dating app name?,[removed],dating,t5_2qhb1,https://www.reddit.com/r/dating/comments/rsgi74/what_would_be_a_good_dating_app_name/
46,rsgilu,1640910054,A word of advice for the young men that I wish I knew when I was a teen.,"I am 34 years old and I’ve had relationships with some wonderful women. I screwed all of them up in my 20’s. My 30’s have been more calculated but dating is much more challenging when your peers all have bad experiences in their past. I want to give you guys a chance to not be one of those bad experiences. 

It’s all about empathy. I see a lot of posts on the sub that complain about being lonely and the pretty people get all of the attention and the complainer gets none. Yeah, that sucks. Its no one’s fault until you get angry about it, then it’s yours. You know what it feels like to get no attention. Now, imagine what it feels like to be 100-120 pounds and gorgeous. You get all of the attention and 90% of those looking at you are either jealous, horny, or both. To make that worse they are all bigger and stronger than you. This is why many women get uncomfortable when complimented. They don’t know where the compliment came from and they don’t know where it’s going. If they are adults, there’s a very high probability that at some point, someone scared them or forced them into having sex with them. We would all frown at unsolicited attention after that. So dont get offended, try to understand. It’s okay to get your feelings hurt, but don’t tell her about it. She owes you nothing. 

Then, if/when the lady of your dreams should return the attention and affection. Be kind if she decides to stop it. You can be as sad as you want but don’t be ugly to her. You’ll never be glad that you told her something mean. If you are happy about being mean to someone that didn’t purposely hurt you, you are not a good person. 

Finally, be kind to yourself. We all get hurt. Learn from mistakes and forgive yourself for them.",dating,t5_2qhb1,https://www.reddit.com/r/dating/comments/rsgilu/a_word_of_advice_for_the_young_men_that_i_wish_i/
47,rsgnay,1640910458,Need your help!,[removed],dating,t5_2qhb1,https://www.reddit.com/r/dating/comments/rsgnay/need_your_help/
48,rsgoqu,1640910579,New dating app!,"Hi, I am collecting data for my new dating app. Please see the comments for link",dating,t5_2qhb1,https://www.reddit.com/r/dating/comments/rsgoqu/new_dating_app/
49,rsgp0t,1640910601,[M38] seeking advice on how to cope with being undateable,"To be blunt, I've gotten to this age without ever being ""date"" material, forget ""boyfriend"" material.
For two years, up until a few days ago, I had a friend-with-benefits. She told me I consistently brought her to orgasm by fingering (and sometimes cunnilingus), but reciprocation, in the form of fellatio, was rare, and PIV was always withheld until we tried it once and she stopped it minutes after it had started; in another thread I was informed I'd probably missed signs that she was faking it, hoping that I'd get better at it (which seems counter-productive to me, to be honest).
She was the only woman to ever be interested in doing anything with me.
I'm somewhere on the spectrum, so family have always counselled me not to try to date, and friends have always treated the idea of me dating as a joke.
I'd thought that I'd been making progress, but at the moment I'm so tired of being me.",dating,t5_2qhb1,https://www.reddit.com/r/dating/comments/rsgp0t/m38_seeking_advice_on_how_to_cope_with_being/
50,rsgpzh,1640910673,Getting ghosted,"I (27F) have been single for 3 years and met a guy (32M) that I felt a connection with. I thought the feeling was mutual because he would call me every night and we would talk for hours about anything and everything. We met through mutual friends, but sadly we live in different states. 
We would text all day and call each other every night for a few months before we decided he should come visit me for my birthday a few weeks ago. He stayed for a week and it was really nice to have him around. We slept together almost every night he was here and I thought that I had finally found a person I can trust and pursue a real relationship with. 
After he left, he stopped calling and texting me as much. He started being short with me, so I confronted him and said “is there a reason you aren’t talking to me as much?” He said “I’ve been busy. I do like you though.” 
I hear from him about once a day now… he said he “thought it would be healthy for us to have some space after spending a week together”. But he didn’t communicate that to me before he started becoming distant.
I don’t know what to do at this point. He is now leaving breadcrumbs like texting me “you are my best Christmas gift” then proceeding to only text me once or twice a day max. Seems like he wanted one thing from me and now that he got it he’s drifting away. 
Am I over thinking and should just trust that he likes me like he says he does? Or do I just drop this dude?",dating,t5_2qhb1,https://www.reddit.com/r/dating/comments/rsgpzh/getting_ghosted/
51,rsh05h,1640911533,Someone tell my friend this is a terrible idea.,"He found a profile on a dating app, he thinks him and this girl would get along, shes cute, etc. In her profile she mentions that she works at (name of city) zoo. He says he is just going to go to the zoo this weekend, find her, and try to get her number/ask her on a date etc. 

Ive told him this is a horrible idea, even if she never knows that he found her on a dating app. Its weird to flirt with someone while they are at work, no matter the occupation, and that hes going to seem like a creep because the zoo is 45 minutes from where we live and hes going alone. 

Someone give me something else to tell him because hes just not listening.",dating,t5_2qhb1,https://www.reddit.com/r/dating/comments/rsh05h/someone_tell_my_friend_this_is_a_terrible_idea/
52,rsh1vh,1640911681,How do you deal with envy of you’re more attractive friends and just more attractive people in general that have a lot of success at dating?,"So I’m 20 in college and really struggling dating and I’m beginning to face the idea that dating may not be for guys like me.

I’m not a good looking guy. I do the best with what I have but my best really isn’t enough for girls at my level.

I have a lot of friends who seemingly have no issue getting dates or just hooking up and I feel so much jealousy over this. Like it makes me feel good to here about the maybe 1 in 5 times my friends get rejected.

I’m also incredibly jealous of strangers. I know i cannot ever be enough o catch a girls eye, but I see that happen all the time to other guys and it makes me feel like such shit about myself.

How do I make myself not jealous of a life I really want which is realistically unavailable to me.",dating,t5_2qhb1,https://www.reddit.com/r/dating/comments/rsh1vh/how_do_you_deal_with_envy_of_youre_more/
53,rsh3sd,1640911847,Did I really fail a shit test?,"So, I had 2 dates with this girl at work. The last week she tried to test me. I've seen her talking to some other guy while walking to have lunch (I am sure she doesn't even care about him, because she was looking at my direction when I caught her staring at me and staying from miles away from that guy. She always stays super close to me when she talks to me and always looks at my eyes). After seeing her with him i just ignored her and that guy by not even saying hi. But I guess I failed hard shortly after that, because I've looked back to them to check if she's looking at my direction or no, then I just continued walking away. Did i really fail this test or not? I guess looking back was an error from my part...",dating,t5_2qhb1,https://www.reddit.com/r/dating/comments/rsh3sd/did_i_really_fail_a_shit_test/
54,rsh507,1640911952,"For those of you that see this post, I would like to know your thoughts on my Bumble profile. There is a link to some pictures in the body text.",[removed],dating,t5_2qhb1,https://www.reddit.com/r/dating/comments/rsh507/for_those_of_you_that_see_this_post_i_would_like/
55,rsh7mf,1640912179,Height issue,So I’m 5ft and there is constantly a problem if guys thinking I’m underage so they don’t approach me. What should I do? Do I need to get a visible tattoo? It happens a lot in public places most recently I was at the store and this guy and his friends were checking my ass out. One of his friends started getting mad at him saying I’m not old enough. I was so embarrassed that I left immediately. I’m not going to go up to them and tell them I’m old enough because I feel like that’s weird,dating,t5_2qhb1,https://www.reddit.com/r/dating/comments/rsh7mf/height_issue/
56,rsh9xa,1640912377,I need help asap (16M),"So me (16M) and my (16F) old friend went to a nightclub as a (date) after not having contact for more than 4 years.. what bothered me the most was that she grinded with another guy because i declined to dance with her multiple times.. and in the end we almost fought with the guy just for her and after that we kinda kept having fun together. The next day after sleeping at her parents house we went on another date for coffee with her old classmate for a reunion  (16M unattractive)  and in the end we left together but again nothing happened.. should i keep dating her or just dump her for the thing that she did at the club??

Btw both at these dates she was flirting with me constantly but i was not making a move  cuz i am kinda shy/uncomfortable around her 

Oh sry for my English btw",dating,t5_2qhb1,https://www.reddit.com/r/dating/comments/rsh9xa/i_need_help_asap_16m/
