,id,created_utc,title,selftext,subreddit,subreddit_id,url
74,poq5dk,1631712592,Does not getting matches on Tinder mean I have no chance irl?,"Hi,

So, I have tried Tinder for a couple of months, and I believe I have a profile with good pictures and bio, but unfortunately I only get very few matches, and when I do get them, the girls do not reply. 

It affects my confidence that I do not have any luck on Tinder, especially when I hear from friends that they get plenty of likes (70-80 likes as soon as they activate Tinder or visit a new city). I am average looking, have good style and a great career. 

Will I have better luck with girls in real life, or is Tinder a good indicator of what I can expect?",dating,t5_2qhb1,https://www.reddit.com/r/dating/comments/poq5dk/does_not_getting_matches_on_tinder_mean_i_have_no/
75,poq8k1,1631712893,Finallyyyy.,"I dont know if im just being emotional but im at the point of love where you just feel like bowing down with hands together, tears just rushing down and just thank Him for bringing such joy and plot twist to your plain,boring life and wishing him to be really the one HE sent which you dream. 😌😌😌",dating,t5_2qhb1,https://www.reddit.com/r/dating/comments/poq8k1/finallyyyy/
76,poqgxl,1631713691,Was it okay for me to do this?,"I messaged this girl that I thought seemed interesting on a dating app on Monday. We started talking and then she gave me her phone number, saying that she'd like to get to know me. We started texting throughout the day and I sent her a text Monday night around 8pm

I haven't gotten a response yet and I saw that she changed her name on the dating app to ""don't talk to me right now"".
I sent her a text asking if everything's alright.

Was it okay for me to do that? If she's going through some mental health stuff, I want to be respectful and give her some space, but I'm afraid I'll come off as clingy or something, since we've only known each other for a day, and it might seem weird to ask her if everything's okay because I haven't heard from her in a little while.",dating,t5_2qhb1,https://www.reddit.com/r/dating/comments/poqgxl/was_it_okay_for_me_to_do_this/
77,poqifz,1631713836,How much will my preference set me back in dating/sex,[removed],dating,t5_2qhb1,https://www.reddit.com/r/dating/comments/poqifz/how_much_will_my_preference_set_me_back_in/
78,poqm9n,1631714194,Struggling to comprehend my boyfriends past,"Hi everyone,

I ask that you give me grace and are kind in the comments as this has been super hard for me.

I am dating this man who has been super sweet, kind, loving etc. But for some reason I can’t shake off some of the things about his past. To give you some context, he’s way more experienced than I am and it’s hard for me to comprehend some of the things he did (i.e way more people he’s dated, FWBs - which I’ve never had as I am more of a long term person, etc) I understand the past is the past, but I’m not sure why it hurts me so much. I shouldn’t have necessarily asked for the nitty gritty details, but I did and now I can’t take that image off of my head. Beinf a more long term dater, I often times find it hard to be intimate and vulnerable at that level and for me it’s hard to understand how he gave that aspect of himself so easily to absolute strangers. 

Another thing is, idk why it bothers me that he follows a lot of NSFW womxn accounts on social media. He justified it saying he was single or only casually seeing people before for a couple years. He did unfollow them, but it just makes me feel a little whack. I know I need to work on myself and it’s on me but please be kind haha, I’m trying. 

Any advice or words of wisdom to get past this? I feel like I’m fighting this internal conflict all alone and it’s been so hard. I know everyone makes different life choices but I can’t help but feel a little sad / scared / anxious about the future. I’ve also spoken to him about this quite a few times and he’s been patient. But I’m just hoping I can drop those images and move on and let go. Looking forward to hearing from you.",dating,t5_2qhb1,https://www.reddit.com/r/dating/comments/poqm9n/struggling_to_comprehend_my_boyfriends_past/
79,poqyi6,1631715310,I don't get it (28m),"It's really frustrating when you meet someone in June, hit it off, date for three months, seem to have excellent physical and emotional chemistry, then seemingly out of nowhere, after spending a fantastic weekend together with both her friends and your friends, she breaks up with you. Because she wasn't ""feeling it"", whatever the hell that means. Personal opinion, I feel like it takes more than three months to fall for someone, but that's just me. Whatever, she wanted out, fine.

I don't know what I keep doing wrong. My shit is together, I'm told by all of my friends that I'm a caring, confident person with an amazing personality who shouldn't be single at all. I went back to the online sites last night a little while after she left and just got angry because I forgot how much I hated doing this.

I guess I just came on here to vent. Feel free to remove if inappropriate.",dating,t5_2qhb1,https://www.reddit.com/r/dating/comments/poqyi6/i_dont_get_it_28m/
80,por0hh,1631715479,Am I doing to much?,"I 22(M) started dating this girl 28(F) at work for about a month, we made it official and we have been together for about 4 months now.
Since day one I have spent every Friday or Saturday with her. Sometimes she gets out a little late then me and occasionally I will wait for her so we can talk for about 20min and head out. We recently started going to church together. 2 weeks ago her dad needed help painting a room so I spent the Sunday at her house for about 7hrs painting the room. I was happy to do the job and her dad paid me without me expecting it. 
We do text everyday after work. Sometimes she'll text me first, sometimes I will. We usually take 20-30min to reply. 
At times I feel we are getting bored of each other. I think the reason is because we work together. I'm here because I'm wondering if what I'm doing is good or am I giving her to much attention. Thank you. 
Also Ive only been in one serious relationship so im no exactly super experienced with being in a official relationship. Thanks",dating,t5_2qhb1,https://www.reddit.com/r/dating/comments/por0hh/am_i_doing_to_much/
81,por28y,1631715644,Am I being rude to her?,"So I've met this girl from another Uni in a group project where different students from differents unis participate together.
We developped a good friendship and during the summer break, we talked online for a whole 3 months daily and shared everything with each other.
Over the time I developped feelings for her and asked her out but aye kindly rejected ( didn't say no, she was very considerate and said she can't make a decision atm ).
Since then it's been 2 days and I didnt talk to her and replied briefly whenever she texted me.

Am I being rude to her? I enjoy her company but I'm also still hurt from the rejection. Should I ask her to give me some space or try to act normal until i eventually forget?
I geniuely like her company but I can't deal with her right now",dating,t5_2qhb1,https://www.reddit.com/r/dating/comments/por28y/am_i_being_rude_to_her/
82,por6h4,1631716016,Found out the guy I was talking to was taking Viagra before every date - even the first,"Okay so I had a pretty failed talking stage through July-August and it’s been a rollercoaster of emotions for me. So I began to talk to this guy who is best friends with MY best friends boyfriend, I have known of him for a year and we didn’t really get to talking till July. Well on our first date he took me to get lunch and then we ended up having sex at his place. For me, I wasn’t expecting it at all and it was kind of under the influence so I wasn’t going to beat myself up too much about it. Next thing you know it’s not until after that he tells me he doesn’t know what his intentions are and that he doesn’t want to lead me on too much (first red flag: why would you tell someone this AFTER having sex?)

Then his energy completely switches and doesn’t really put much effort into talking or seeing me but tbh I didn’t really care much. We hooked up twice after and the third time something happened that made me uncomfortable and sort of called it off (involves blood) I did like him and talking to him and we had chemistry so over time I did care a little 

Well, my best friend told me this past weekend that her bf told her that the guy was taking Viagra EVERYTIME before we linked “just in case”, when I explicitly remember being on Facetime with him and him going “Yeah i wasn’t expecting that at all!!!” And she doesn’t want me to tell him that I know he was taking the pills but tbh it pisses me off because I didn’t have the intentions of JUST having sex. Now we barely talk at all and I went off on him (didn’t tell him that I know about his pills) when I was drunk over text and yeah :) Am I tripping for no reason? There’s nothing wrong with taking those pills in general but it is wrong the way he went about this with me. What should i do?Just drop it?",dating,t5_2qhb1,https://www.reddit.com/r/dating/comments/por6h4/found_out_the_guy_i_was_talking_to_was_taking/
83,por6ji,1631716022,Dating a girl out of my league,I’ve been chatting with a girl who seems out of my league. I have been postponing actually meeting this person because I fear rejection. Any advice on how to proceed? How have you guys /girls handled this situation successfully?,dating,t5_2qhb1,https://www.reddit.com/r/dating/comments/por6ji/dating_a_girl_out_of_my_league/
84,por6pn,1631716037,"HUGE CRUSH on a begger that's the situation, i F17 live near where he M17? asks for money in the traffic, he's gorgeous really, and he's always in the same spot, he's not homeless though, but don't know how to approach cause he doesn't have a phone or anything should I just leave the boy alone?","I saw him almost sleeping in the sidewalk today and i melted, I don't know he should be a model or something",dating,t5_2qhb1,https://www.reddit.com/r/dating/comments/por6pn/huge_crush_on_a_begger_thats_the_situation_i_f17/
85,porieu,1631717038,Going down,My man thinks I’m ok with him not going down on me when I do it for him all of the time . I asked him why and he just says because he doesn’t like to so I told him yesterday that I wasn’t doing it anymore either because it’s just not right . Do you guys think I made the right decision,dating,t5_2qhb1,https://www.reddit.com/r/dating/comments/porieu/going_down/
86,portj7,1631718010,I see a lot of people here that are unsure of themselves!,"Just be you! If the other person doesn't like it then they are not meant to be with you. Don't change for other people... Change for you. If you have issues, resolve them for YOU! Be the change you want to see in the world.

I myself am a metalhead and always wear band t-shirts for example, which limits my options but so be it! I am myself and if I find someone who likes me for me, awesome! If I don't, then I'm also cool with that!

Don't settle, find someone that appreciates you for you!

Much love to you all! Just be patient and happy!",dating,t5_2qhb1,https://www.reddit.com/r/dating/comments/portj7/i_see_a_lot_of_people_here_that_are_unsure_of/
87,porvsj,1631718184,Should I ask for closure or ghost and move on?,"I (22F) had been JUST texting a guy (23M) I met on a dating app for around a year and a half. We spoke on call once during this period. We would talk about anything and everything under the sun and while I had developed feelings for him, I never made that known to him because he had moved cities just around the time we matched. 

There used to be times where we would go by without texting for a couple of weeks but then we would fall right into the loop once one of us initiated again. 

Cut short to August '21, I went back on a dating app because I got frustrated with this not amounting to anything. Met a guy, agreed on going on a date but the same day, my guy, texted again and I told him about how I have a date in a couple of hours but I like him and I don't want to pull through with this date. He confessed that he liked me back and asked me out on a virtual date. 

That virtual date still hasn't taken place to date, he stood me up once (which was justifiable, not getting into it). For the first two weeks after this confession, it was going too well but then he stopped calling back and started being a bit aloof. I suffer from anxiety and before he could call it off, I did it myself. But I couldn't bear the fact that I gave up this quickly after more than a year of waiting and I told him that and we both decided to give it a shot again. But since then, things haven't been going too well, he still stays aloof and keeps telling me that he's going to call/video call/text but he never does. I have told him time and again that if he's not willing to try then he should just me know that but he keeps saying he is interested, while I think he's not. My friend, who lives in the same city as him, also found him active on a dating app. I want to know what's going on and end it but I don't know if I should ask him for closure because at this point I'm finding myself to be desperate, trying too hard and looking like a massive fool.

I need advice because I'm not the kind who ghosts and ironically one of the very first things I said to him was, ""please never ghost me"", but I think he just wants to avoid confrontation and is stringing me along.",dating,t5_2qhb1,https://www.reddit.com/r/dating/comments/porvsj/should_i_ask_for_closure_or_ghost_and_move_on/
88,poryps,1631718437,Date at a restaurant,"Guy brought me on a date to a restaurant. 

We sat down. His phone didn’t work for the menu so he asks for a menu from the servers. 

He didn’t wait for me to look at the menu and just orders for himself.

I asked him to wait to order entrees cause I was not even ready.

“Why not, just get our order out of the way and order everything at once?”
 
Drinks were not even ordered. And he is ordering his meal. 

I order soup and tea first and continue to look at the menu.

I finally order my food. 

We get our food and start eating and he starts to grill me about my job. Which didn’t make me happy.

He orders more food. 

He eats and then orders soup. 
Eats and eats.

I’m not happy or comfortable.

Time for the bill.  

Instead of waiting for the check he shoves his credit card in the servers face and tells me the server was flirting with me and must want a big tip.

What on earth ?! Does this seem normal?!

I told him he was being rude and then he said I was being rude mentioning it.

😥😪",dating,t5_2qhb1,https://www.reddit.com/r/dating/comments/poryps/date_at_a_restaurant/
89,pos0wf,1631718631,The DANGER of Dating Someone Thirsty,[removed],dating,t5_2qhb1,https://www.reddit.com/r/dating/comments/pos0wf/the_danger_of_dating_someone_thirsty/
90,pos2ud,1631718807,Dating,[removed],dating,t5_2qhb1,https://www.reddit.com/r/dating/comments/pos2ud/dating/
91,pos387,1631718841,Why do very short women hate guys that aren't tall?,[removed],dating,t5_2qhb1,https://www.reddit.com/r/dating/comments/pos387/why_do_very_short_women_hate_guys_that_arent_tall/
92,pos5e5,1631719030,How should I find a guy ?,"I’m a 17f and I really want a boyfriend because I’ve never had a boyfriend in real life. I’ve had long distance relationships but it always turns out the guys not that into me. I think no one likes me because I’m overweight and not that pretty. But if I’m being completely honest I don’t think I’m going to drop 60 pounds anytime soon. I just wish there were guys who were attracted to me. The only way to find out is ask but I don’t have any friends and I’m already extremely socially awkward, it’s to a ridiculous point, when talking to people I don’t know I screw up my word order, I start lightly shaking, my throats feels tight, I talk too fast and I lose my breath. It’s just embarrassing. If I got rejected I know I wouldn’t be able to handle it properly. Hell if a guy online tells me nicely he’s not into me I’ll think about that one comment for months anytime I look at myself. I’m just really not confident and I’m really sensitive too. I don’t know how to meet people if I’m like this.",dating,t5_2qhb1,https://www.reddit.com/r/dating/comments/pos5e5/how_should_i_find_a_guy/
93,pos9f7,1631719393,Covid precautions and dating?,"Question for guys and girls - are you taking any covid precautions when meeting anyone?

Do you prefer to meet someone that takes covid seriously, or just going out there dating with “whatever happens happens”?

I’m not judging either side, I’m just curious how everyone is handling it.",dating,t5_2qhb1,https://www.reddit.com/r/dating/comments/pos9f7/covid_precautions_and_dating/
94,pose3f,1631719802,I saw a post that says you don't have to hold yourself to the same standards you set for a potential partner. Do you agree?,"A certain dating sub that had a post that suggested it's not necessary to hold yourself to the same standards you set for your male partner or future male partner.
Here's some examples they listed below:

•Not wanting to date a man that has a mental illness, even though you struggle with one yourself.

•Not wanting to date a man that lives with parents or roommates, even though you live with one of those yourself.

•Wanting someone to make a certain amount of income even though you yourself don't even make that much.

Personally, I don't think this is even realistic....",dating,t5_2qhb1,https://www.reddit.com/r/dating/comments/pose3f/i_saw_a_post_that_says_you_dont_have_to_hold/
95,posf6c,1631719892,ghosted me but I developed film and she’s on the roll,"background: I was talking to this girl for about a month and she ghosted me recently. We were bound to end bc we were both moving away to college, so if she didn’t end things I would’ve. 

On our first date I finished my film roll and I recently developed the pictures. Should I send her pictures to her? ngl they are pretty good",dating,t5_2qhb1,https://www.reddit.com/r/dating/comments/posf6c/ghosted_me_but_i_developed_film_and_shes_on_the/
96,posn08,1631720556,Should I continue talking to her after this?,[removed],dating,t5_2qhb1,https://www.reddit.com/r/dating/comments/posn08/should_i_continue_talking_to_her_after_this/
97,poso8m,1631720659,Deep Conversations,[removed],dating,t5_2qhb1,https://www.reddit.com/r/dating/comments/poso8m/deep_conversations/
98,postrs,1631721128,[30F] still lowkey stuck up on that guy [35M] I had 2 dates with 2 weeks ago who left me hanging. Trying to see other people but it just doesnt cut it.,"Just a bit of a background, I’ve been single for almost 2 years, and recently got back in the dating scene. 

Baseline, I’m very attractive and young looking. I also a good education, career and finances. I have no issues attracting men at all.

Personality type is INTJ-T. Thing is, I’m terrible at maneuvering through dating. I almost always give the wrong signals and tend to do even worse when I’m actually really interested in the person. I get in my head a lot. It takes a while for me to open up. This comes from anxiousness, and general distrust towards others intentions. 

I met this guy 2 weeks ago and went on 2 dates. I didnt have high hopes prior to meeting him since we barely spoke…. but unexpectedly, the first date went extremely well. We went for coffee and hit it off immediately. We had so much things in common, which is rare for me. And he sounds very intelligent and he had an important and demanding job (CIA background). He seemed extremely interested as well, asked a lot of background questions, and kept mentioning how very attractive I was, and how he thinks we have “potential”. So he asked me out on a second date as soon as possible. 

Second date came, he invited me to his place. I was extremely nervous because I havent gone to anyone’s place in a long time. Also, I was surprised how he came in very strong. Not in a sexual way, but in terms of flirting and the nature of personal questions, including probing about my personal life. Almost felt like I was being interrogated. I answered with honesty, more than I should have. He also seemed to put in a lot of effort and energy trying to entertain me. Which is cute but honestly everything was overwhelming. Couldnt keep up with the energy, flirting, probing, and my general nervousness. I got in my head and ended being unreceptive, awkward, and looking uncomfortable. Keep in mind that this was a person im interested in and wanted to get to know but ended up showing the most uninteresting and awkward side of me. I tried to drink to make it better. It didnt. We kissed. We ended the date cuddling and yes, it was terribly awkward. Because at this point his energy was drained as well. He asked me when we could hang out again so I told him im free during the weekend. He never followed through on that but instead, he asked me to message him on another platform. Which I did. 

Since I still like him, I messaged him and apologized about how off I was and that I was very nervous and tired. He replied after a day, saying thats it cool and that hes been busy. He says that we should “meet again once youre less tired”. I agreed. No communication after that. 

I’m not sure if at this point I should ask him out or just wait it out. I’m still interested in him but I dont wanna chase him at all. I simply want another chance, I think we could connect if I didnt get in my head and behaved how I normally would. 

Anyway, after that event…. I tried to talk to guys and keep my options open. The sheer ease of finding other people interested in you is baffling. Such is modern dating. Though honestly, I feel bad because I really just like this one guy now and I feel like the other guys are just alternatives. I havent felt this genuine interest in a long time. Ugh. 

Ive initially convinced myself he is uninterested but the reply surprised me, he shouldve just ghosted me and not asked me to get on some other platform and talk about meeting up again. Or I dont know. He seems pretty mature and straightforward to play games. Is this what 35 year old guys do? Need advise if I should ask out the guy or just dont text him again and move on?",dating,t5_2qhb1,https://www.reddit.com/r/dating/comments/postrs/30f_still_lowkey_stuck_up_on_that_guy_35m_i_had_2/
99,postwa,1631721137,Should I keep talking to her after this?,"So I (21M) met this girl (23F) at work and we hit it off very well. I’ve known her for about 2 months now. We have same type of humor, a lot of the same hobbies and general taste of things. After a day or two we started texting each other over Instagram dms then she gave me her number and we moved to talking there. Fast forward a week or two, messaging has become more flirty and I decided to ask her to go out together for dinner. She declined out of the fact that she was behind on packing for her upcoming move and she was low on money but she expressed that she really wanted to go. I was willing to pay for her but I decided not to be pushy if she was too busy. We both have fairly busy schedules so we could only go during late at night. Over the next couple days on social media she has been posting of herself going out every-night hanging out with other people that she’s known for the same amount of time as me and also going out for dinner at the place I asked her out to with those people. I’ve been thinking about wether I should even bother with this anymore. The more I think about it I just become sad or angry. What should I do?",dating,t5_2qhb1,https://www.reddit.com/r/dating/comments/postwa/should_i_keep_talking_to_her_after_this/
