,all_awardings,allow_live_comments,author,author_flair_css_class,author_flair_richtext,author_flair_text,author_flair_type,author_fullname,author_is_blocked,author_patreon_flair,author_premium,awarders,can_mod_post,contest_mode,created_utc,domain,full_link,gildings,id,is_created_from_ads_ui,is_crosspostable,is_meta,is_original_content,is_reddit_media_domain,is_robot_indexable,is_self,is_video,link_flair_background_color,link_flair_css_class,link_flair_richtext,link_flair_template_id,link_flair_text,link_flair_text_color,link_flair_type,locked,media_only,no_follow,num_comments,num_crossposts,over_18,parent_whitelist_status,permalink,pinned,pwls,retrieved_on,score,selftext,send_replies,spoiler,stickied,subreddit,subreddit_id,subreddit_subscribers,subreddit_type,thumbnail,title,total_awards_received,treatment_tags,upvote_ratio,url,whitelist_status,wls,removed_by_category,author_flair_template_id,author_flair_text_color
47,[],False,throwaway4978_,,[],,text,t2_g9gyr8oi,False,False,False,[],False,False,1636206362,self.dating,https://www.reddit.com/r/dating/comments/qo0kpz/i_think_this_attractive_older_woman_in_university/,{},qo0kpz,False,True,False,False,False,True,True,False,#ff4500,dating,"[{'e': 'text', 't': 'Question'}]",a9531dce-194e-11e5-b177-0eff099c3d1f,Question,light,richtext,False,False,True,24,0,False,no_ads,/r/dating/comments/qo0kpz/i_think_this_attractive_older_woman_in_university/,False,0,1636206373,1," There's this attractive older woman - I don't want to sound like the kind of guy who says '' I'm only attracted to 8/10 and above hehe '' but she really is beautiful - who started University  late, she said her family had financial problems when after she finished high school.

She's made friends with me and other guys/girls, we  hang out and help each other.. at some point she said she wanted to spend time alone with me because she likes studying with me and feels comfortable with me and said I'm more mature than most ''boys'' my age.. 

she started off with random acts of kindness. I had a headache a few weeks ago, couldn't focus, she was like '' I'll buy you a bottle of water and a cup of coffee '' ( we have a vending machine at University ).. she sits really close to me and sometimes she touches me with her legs.. we've chatted on Whatsapp a few times, yesterday she said '' I connect better with you, I'm so happy you're in the same classes as me.. haha '' .

I know someone is going to tell me to just ask her out and see what happens but it's easier said than done. I'll have to see her regularly for the 5  next years.  I'm not in love but I do have a crush, she looks very good and she's and very tall.. like, 4 cm taller than me.",True,False,False,dating,t5_2qhb1,1124086,public,self,"I think this attractive older woman in University (30f) is flirting with me (18m), I don't understand what her intentions are",0,[],1.0,https://www.reddit.com/r/dating/comments/qo0kpz/i_think_this_attractive_older_woman_in_university/,no_ads,0,,,
48,[],False,slobberdobber69,,[],,text,t2_csf24pzn,False,False,False,[],False,False,1636206423,self.dating,https://www.reddit.com/r/dating/comments/qo0lfe/white_collar_guy_went_on_a_date_with_a_blue/,{},qo0lfe,False,True,False,False,False,True,True,False,#ea0027,dating,"[{'e': 'text', 't': 'I Need Advice'}]",19ec58c2-9f74-11e7-81a1-0e2bf15991f0,I Need Advice,light,richtext,False,False,True,96,0,False,no_ads,/r/dating/comments/qo0lfe/white_collar_guy_went_on_a_date_with_a_blue/,False,0,1636206434,1,"Hey everyone, I'm still kind of laughing to myself over this and thought I'd share. 

For background, I trade power for a utility as a 30 y/o man. I haven't been having a ton of success in the ol' dating arena, and on a recent trip back to my hometown my dad said I should look up a certain gal whose a welder at the saw mill he works at. 

It was a pretty great date, we had lots and lots in common and we both felt like we hit it off. There's a little ""snag"" in my mind that this woman is wayyyy more useful than me however. I really admire blue collar skills (wasn't my strong suite) and I'm a little intimidated by her haha. 

Anyone ever find themselves in a similiar situation where the traditional gender roles are mildly reversed?",True,False,False,dating,t5_2qhb1,1124086,public,self,White collar guy - went on a date with a blue collar woman,0,[],1.0,https://www.reddit.com/r/dating/comments/qo0lfe/white_collar_guy_went_on_a_date_with_a_blue/,no_ads,0,,,
49,[],False,weirdo696969,,[],,text,t2_4vw8qp18,False,False,False,[],False,False,1636207847,self.dating,https://www.reddit.com/r/dating/comments/qo11hk/this_is_unrelated_but_rsocialskills_is_making_my/,{},qo11hk,False,True,False,False,False,True,True,False,#ea0027,dating,"[{'e': 'text', 't': 'I Need Advice'}]",19ec58c2-9f74-11e7-81a1-0e2bf15991f0,I Need Advice,light,richtext,False,False,True,7,0,False,no_ads,/r/dating/comments/qo11hk/this_is_unrelated_but_rsocialskills_is_making_my/,False,0,1636207858,1,"I am a 24M with a learning disability and Autism. My IQ is pretty average, though I often think it is way lower. I struggle to keep a job and relationships. 

Every job I had, people always talked very bad about me behind my back and it would lead to me being laid off shortly after. I want to improve myself and I often ask why you talk bad. I won’t take offense, I just want to know my flaws and downfalls. I find it way more offensive when they talk behind my back rather than being forward.

I barely get invited to collage parties and I was a loner in high school, my only group of friends I had were assholes who broke into my house and stole my brother’s PS4 and all his games. I quickly cut them out except one who is still cool. 

My ability to form relationships has made a huge impact on my adulthood development. I’m still very sheltered and every time I go out, I feel worse than when I stay (I often regret going out). 

I also have eccentric hobbies that very few people like. It’s hard finding other people that like the things I like (except fantasy football).

I am also yet to find a girlfriend. I feel that I can only find one if I improve my social life. My pessimistic self says that there is slim hopes I will ever form positive relationships. I act like Mark Zuckerberg when I talk and people think it is very weird. 

What if I don’t give up and I still end up like a loser living with my mom at 35?",True,False,False,dating,t5_2qhb1,1124092,public,self,This is unrelated but r/socialskills is making my post invisible. I want a more fulfilling social life,0,[],1.0,https://www.reddit.com/r/dating/comments/qo11hk/this_is_unrelated_but_rsocialskills_is_making_my/,no_ads,0,,,
50,[],False,BeastoftheWild9,,[],,text,t2_ew048g3q,False,False,False,[],False,False,1636208225,self.dating,https://www.reddit.com/r/dating/comments/qo15ot/i_think_i_have_a_problem_m18/,{},qo15ot,False,True,False,False,False,True,True,False,#ea0027,dating,"[{'e': 'text', 't': 'I Need Advice'}]",19ec58c2-9f74-11e7-81a1-0e2bf15991f0,I Need Advice,light,richtext,False,False,True,4,0,False,no_ads,/r/dating/comments/qo15ot/i_think_i_have_a_problem_m18/,False,0,1636208236,1,"Hey everyone, so I am an 18 year old college freshman. I am Black and Indigenous. Recently I’ve taken time to think about my love life and all my exes and what I noticed I’m attracted to. Now I wanna make clear that I love all races of women but for whatever reason I have a thing for white women. I’m embarrassed about it honestly and it’s weird. Two out of my three girlfriends have been white, and I just notice that often they catch my eye a bit more, I don’t like that though! I don’t wanna have a preference for any race. Any advice or tips for help?",True,False,False,dating,t5_2qhb1,1124098,public,self,I Think I Have A Problem (M18),0,[],1.0,https://www.reddit.com/r/dating/comments/qo15ot/i_think_i_have_a_problem_m18/,no_ads,0,,,
51,[],False,ppxzz,,[],,text,t2_g2j7v1f5,False,False,False,[],False,False,1636209010,self.dating,https://www.reddit.com/r/dating/comments/qo1ess/i_really_feel_insecure_because_i_have_never_been/,{},qo1ess,False,True,False,False,False,True,True,False,#ea0027,dating,"[{'e': 'text', 't': 'I Need Advice'}]",19ec58c2-9f74-11e7-81a1-0e2bf15991f0,I Need Advice,light,richtext,False,False,True,3,0,False,no_ads,/r/dating/comments/qo1ess/i_really_feel_insecure_because_i_have_never_been/,False,0,1636209021,1,"I have sort of put my life on wait. I kept saying myself that until I didn't have my life sorted out  I wouldn't be with anyone.

Life has helped me somehow. Not being an attractive girl, I never had any chances to be ""hit"" on someone and things just kept going.

However, now that I am in my late twenties I am realizing how much of stupid I have been and how I should instead have tried to do something.

I would have learnt a lot and now I totally feel a teenage.
Not only, life doesn't go as we plan and this behavior of mine has held me back a lot.

I kept justifying my behavior saying I was doing good, but I feel I have just lost precious years that wouldn't come back.


So how can I change this type of mentality where I keep thinking that I should be in a certain way before deciding to be with someone? 

I keep reading things on here where you should first be the best version of yourself. I am trying to do that, but as I said, life is not perfect and years don't come again. 

I just wished I had been much more courageous in my choices and hadn't let my insecurities justify my behavior.",True,False,False,dating,t5_2qhb1,1124099,public,self,"I really feel insecure because I have never been in a romantic relationship and it weights on me, especially now that I am in my late 20s",0,[],0.99,https://www.reddit.com/r/dating/comments/qo1ess/i_really_feel_insecure_because_i_have_never_been/,no_ads,0,,,
52,[],False,field-drunk,,[],,text,t2_g2ags38i,False,False,False,[],False,False,1636209051,self.dating,https://www.reddit.com/r/dating/comments/qo1fcd/i_no_longer_know_what_i_want/,{},qo1fcd,False,True,False,False,False,True,True,False,#ea0027,dating,"[{'e': 'text', 't': 'I Need Advice'}]",19ec58c2-9f74-11e7-81a1-0e2bf15991f0,I Need Advice,light,richtext,False,False,True,3,0,False,no_ads,/r/dating/comments/qo1fcd/i_no_longer_know_what_i_want/,False,0,1636209061,1,"I (19M) confessed to my friend of 5 years I actually love her, she friendzoned me so I told her I want to distance myself to save my sanity.

I've been looking for people to vent to and I found my elementary classmate, I talked to her about getting friendzoned and also been talking quite a lot and she seem interested in me. 

But I really don't know what I want right now and I have feelings of uncertainty. Should I just take a break on all social media and enjoy my hobbies again?",True,False,False,dating,t5_2qhb1,1124100,public,self,I no longer know what I want,0,[],1.0,https://www.reddit.com/r/dating/comments/qo1fcd/i_no_longer_know_what_i_want/,no_ads,0,,,
53,[],False,Grimmox96,,[],,text,t2_ekogi6oa,False,False,False,[],False,False,1636209492,self.dating,https://www.reddit.com/r/dating/comments/qo1kn8/excessive_sweating_during_sex_or_social/,{},qo1kn8,False,True,False,False,False,True,True,False,#ea0027,dating,"[{'e': 'text', 't': 'I Need Advice'}]",19ec58c2-9f74-11e7-81a1-0e2bf15991f0,I Need Advice,light,richtext,False,False,True,2,0,False,no_ads,/r/dating/comments/qo1kn8/excessive_sweating_during_sex_or_social/,False,0,1636209503,1,"Does it depend on the smell of the sweat, of the partner? Or do you just accept anything because of how nicely raw sex can be?
I usually sweat a lot, and especially in summertime I do too, I had one girl straight up cover her hand in my  sweat and lick it while looking at me. It turned me on even though I was suprised at first. But even though I like being sweaty which makes me feel like an athletic beast, it does make me insecure in certain situations like when I'm in a social setting at a bar or 1 on 1 with a girl.
How do you feel about this?",True,False,False,dating,t5_2qhb1,1124101,public,self,Excessive sweating during sex or social interactions,0,[],1.0,https://www.reddit.com/r/dating/comments/qo1kn8/excessive_sweating_during_sex_or_social/,no_ads,0,,,
54,[],False,LongingforSomethingo,,[],,text,t2_fwwscjjf,False,False,False,[],False,False,1636209947,self.dating,https://www.reddit.com/r/dating/comments/qo1qax/i_hooked_up_with_a_woman_had_a_great_time_would/,{},qo1qax,False,True,False,False,False,True,True,False,#ea0027,dating,"[{'e': 'text', 't': 'I Need Advice'}]",19ec58c2-9f74-11e7-81a1-0e2bf15991f0,I Need Advice,light,richtext,False,False,True,8,0,False,no_ads,/r/dating/comments/qo1qax/i_hooked_up_with_a_woman_had_a_great_time_would/,False,0,1636209958,1,"I hooked up with a woman a few days ago, and it was fun/exciting. She was very into me, plenty of cuddling, hand holding, and a lot of kisses. We took a shower together and she got on her knees and swallowed me. After I ordered her the uber home, she texted me saying she got home \^-\^!

I replied back saying last night was fun, and I had a great time. She didn't reply to that, but then she added me on snap the next day. 

 I don't really use Snapchat to be honest. So I don't think I will add her, but I do want to see her again.

I wanted to reinitiate and maybe reach out to her and take her on an actual date, but I'm not sure if that's a good idea? She didn't reply to my earlier text so I figured she had her fun and that was it. What would you recommend is a good way to say I'd like to see her again?",True,False,False,dating,t5_2qhb1,1124100,public,self,"I hooked up with a woman, had a great time would love to see her again, and she added me on snap, should I reach out?",0,[],1.0,https://www.reddit.com/r/dating/comments/qo1qax/i_hooked_up_with_a_woman_had_a_great_time_would/,no_ads,0,,,
55,[],False,courtknee36,,[],,text,t2_6fnwphao,False,False,False,[],False,False,1636210538,self.dating,https://www.reddit.com/r/dating/comments/qo1xt9/should_we_do_a_third_date/,{},qo1xt9,False,True,False,False,False,True,True,False,#ea0027,dating,"[{'e': 'text', 't': 'I Need Advice'}]",19ec58c2-9f74-11e7-81a1-0e2bf15991f0,I Need Advice,light,richtext,False,False,True,8,0,False,no_ads,/r/dating/comments/qo1xt9/should_we_do_a_third_date/,False,0,1636210550,1,"To keep it simple I (28F) went on a first date with (29M). We were both super nervous, but had a great time and decided to go on a second date. We went on a second date and had fun, but the activity we did didn’t allow us to talk much and it just seemed really awkward - not bad, just lots of awkward silence. We’ve still been texting this week and things seem a little different in our messages, but I don’t think we’re opposed to continuing to get to know each other. Should we give a third day a shot or should we let things just be after an awkward second date?",True,False,False,dating,t5_2qhb1,1124104,public,self,Should we do a third date?,0,[],1.0,https://www.reddit.com/r/dating/comments/qo1xt9/should_we_do_a_third_date/,no_ads,0,,,
56,[],False,idkburneridkidk,,[],,text,t2_e3k4cz8q,False,False,False,[],False,False,1636211474,self.dating,https://www.reddit.com/r/dating/comments/qo29si/i_dont_really_care_about_rejection_but_how_do_you/,{},qo29si,False,True,False,False,False,True,True,False,#ea0027,dating,"[{'e': 'text', 't': 'I Need Advice'}]",19ec58c2-9f74-11e7-81a1-0e2bf15991f0,I Need Advice,light,richtext,False,False,True,5,0,False,no_ads,/r/dating/comments/qo29si/i_dont_really_care_about_rejection_but_how_do_you/,False,0,1636211485,1,"I really like this girl and she feels the same. Neither of us are looking for anything serious cause we're both not in a place for it but we also both want something serious and committed at some point. I left it open and said if she ever wants to meet again she can just tell me and that what she says is holding her back is what I like the most about her anyway. Second to the fact she also wants to change like me.

Should I check back in a while if she doesn't reach out? I feel like she will anyway but I really just hate the thought of losing a good thing because of timing and mutual fear of getting too close too fast. It's what got us to be not in a place for a relationship to begin with. Both have trust issues. Another reason I'm falling for the idea of her. We would click on nearly every level. 

We could be so close and we both know it but it's just the timing. Is it right to keep her in the back of mind? She's really special and worth coming back to so I want to try again when we're both better off or start something no strings if at all possible. I'm gonna do that anyway may as well be with someone who wants me back at a later date.",True,False,False,dating,t5_2qhb1,1124104,public,self,"I don't really care about rejection, but how do you cope with it when you both like eachother a lot but it's just bad timing?",0,[],1.0,https://www.reddit.com/r/dating/comments/qo29si/i_dont_really_care_about_rejection_but_how_do_you/,no_ads,0,,,
57,[],False,Think-Teaching-5568,,[],,text,t2_etxwhbdf,False,False,False,[],False,False,1636211652,self.dating,https://www.reddit.com/r/dating/comments/qo2bxs/advice_please/,{},qo2bxs,False,True,False,False,False,True,True,False,#ea0027,dating,"[{'e': 'text', 't': 'I Need Advice'}]",19ec58c2-9f74-11e7-81a1-0e2bf15991f0,I Need Advice,light,richtext,False,False,False,2,0,False,no_ads,/r/dating/comments/qo2bxs/advice_please/,False,0,1636211663,1,Hi I'm 22f my birthday was just recently and it was horrible well actually the past few weeks have been really bad for me my feeling have been really weird I've been so sad and angry and before you ask no I'm not pregnant (went to doctor) anyway today me and my boyfriend of 4 years almost 5 got in a really really big fight he left to his mother's I said some things and did some things I really regret and I know I was wrong but I'm so tired of fighting about things I have no control over at all we live with my parents and my aunt and her husband well use to my aunt's husband was kicked out but my aunt still stays with us and My aunt and her husband are just dirty they don't clean up after themselves our living room is cluttered with totes and clothes of theirs that they refuse to clean and my parents honestly don't care as long as they still pay rent which puts a strain on me nd my bf because we're always cleaning up after them and it's been 2 years of it also I got fired from work about 4 months ago and finding work has been a hassle so he's basically taking care of me and him making sure we eat have clean clothes and just stuff we need I try to help but I didn't really have any savings we live paycheck to paycheck and his job doesn't pay the best so I know he's really stress out and I know Im not the best with talking about my feelings and communicating but I try and I don't think he realizes I try and I don't want him to ever think he's unloved because I love him hes everything to me  he's literally the best thing that's has ever happened to me but this time I'm really afraid I lost him for good ..,True,False,False,dating,t5_2qhb1,1124104,public,self,Advice please,0,[],1.0,https://www.reddit.com/r/dating/comments/qo2bxs/advice_please/,no_ads,0,,,
58,[],False,BlaqKoffee,,[],,text,t2_ary2cc6v,False,False,False,[],False,False,1636211784,self.dating,https://www.reddit.com/r/dating/comments/qo2dj0/is_asking_for_social_media_accounts_not_invasive/,{},qo2dj0,False,True,False,False,False,True,True,False,#ff4500,dating,"[{'e': 'text', 't': 'Question'}]",a9531dce-194e-11e5-b177-0eff099c3d1f,Question,light,richtext,False,False,True,24,0,False,no_ads,/r/dating/comments/qo2dj0/is_asking_for_social_media_accounts_not_invasive/,False,0,1636211794,1,"I'm curious to learn from both men and women if it doesn't feel  a little invasive when getting to know someone or whilst in the talking stages, they ask for your social media handle, example instagram or Facebook? I ask because social media accounts don't  only have pics of yourself for some people, you may have  family members, friends, kids, pets or other pics/videos of things in your life that are private that you wouldn't want exposed to someone you're still getting to know. I mean if they're just asking to exchange pics, I don't see a problem because they wanna know who they're talking to and if they're even attracted to the person, I get that,  but outright asking for IG/FB off the bat is what I don't get.. 

I've also noticed that when you decline to share them, the assumption is  that you're hiding something. Shouldn't one share those when they're ready? To those that do ask for them, what's your reason for asking for social media accounts Vs just asking for a picture or two?",True,False,False,dating,t5_2qhb1,1124106,public,self,Is asking for social media accounts not invasive?,0,[],1.0,https://www.reddit.com/r/dating/comments/qo2dj0/is_asking_for_social_media_accounts_not_invasive/,no_ads,0,,,
59,[],False,-yukfoo,,[],,text,t2_6y7gd4qt,False,False,False,[],False,False,1636211874,self.dating,https://www.reddit.com/r/dating/comments/qo2elf/why_do_i_have_the_urge_to_message_people_who_like/,{},qo2elf,False,True,False,False,False,True,True,False,#ff4500,dating,"[{'e': 'text', 't': 'Question'}]",a9531dce-194e-11e5-b177-0eff099c3d1f,Question,light,richtext,False,False,True,15,0,False,no_ads,/r/dating/comments/qo2elf/why_do_i_have_the_urge_to_message_people_who_like/,False,0,1636211886,1,"Why do i have the urge to text people who like me whenever i'm bored? I know it's the wrong thing to do and I realized that before I actually messaged, but it seems like it makes me a freaking manipulator... I genuinely don't know why I consider doing something that's going to waste both of our time and will only hurt them.",True,False,False,dating,t5_2qhb1,1124106,public,self,Why do I have the urge to message people who like me even though I don't feel the same?,0,[],1.0,https://www.reddit.com/r/dating/comments/qo2elf/why_do_i_have_the_urge_to_message_people_who_like/,no_ads,0,,,
60,[],False,hotrod237,,[],,text,t2_4t4i8w3z,False,False,False,[],False,False,1636212125,self.dating,https://www.reddit.com/r/dating/comments/qo2hjt/dont_know_what_to_feel/,{},qo2hjt,False,True,False,False,False,True,True,False,#ea0027,dating,"[{'e': 'text', 't': 'I Need Advice'}]",19ec58c2-9f74-11e7-81a1-0e2bf15991f0,I Need Advice,light,richtext,False,False,True,2,0,False,no_ads,/r/dating/comments/qo2hjt/dont_know_what_to_feel/,False,0,1636212135,1,"Long story short, started speaking with someone little over a month ago, things was hitting off great. 3 weeks into talking, I've noticed that they're still using the app and when confronted, they ask why is it my concern? ( for context, they said that they're tired of getting nothing but D pics and running into horny individuals, so they said that they gonna delete it, profile and all. I'm taking this as ' cool, I'll do the same thing since we're mainly speaking to each other and what not and figured that what we was having was something serious. Waited a few days and lo and behold, they're still on it) 

After some talking and understanding, noticed that it's been over a week since they've been on ( telling me that we are both moving up and moving foward, well, at the time anyway) last weekend we had a major blow out
( TL:DR, if something is bothering you, fucking tell me, dont shrug it off and say things like "" drop it "" or "" it happened yesturday, let's leave it there"" ) Basically a communication issue to where following my instinct, they're back on and on top of that, isnt hiding the reason to be on. Apparently, the person actually like hearing the desperate and lonely cries of people and essentially like toying with them for fun. Getting pics and stringing them along

Me personally, if you're That bored of your life to the point that either out of spite, you're messaging people to play with their emotions or just simply bored and have nothing else better to do, then I cant really see the point of continuing a friendship, FWB or anything else. Its disgusting, wierd and most importantly, just plain sad.

The relationship is amicable enough, but I just dont know where to go from there honestly, any ideas, tips or advice? Thank you",True,False,False,dating,t5_2qhb1,1124105,public,self,Dont know what to feel,0,[],1.0,https://www.reddit.com/r/dating/comments/qo2hjt/dont_know_what_to_feel/,no_ads,0,,,
