,id,created_utc,title,selftext,subreddit,subreddit_id,url
67,pq0pke,1631887228,I(18) have a date with a guy(21) any advice?,I met him off of bumble and we just started talking and laughing and I know the whole “first date in a public place” rule and tell someone where I’m going and I have that covered. Idk what to expect.,dating,t5_2qhb1,https://www.reddit.com/r/dating/comments/pq0pke/i18_have_a_date_with_a_guy21_any_advice/
68,pq0qmf,1631887326,"People, if you want to meet someone for a 1st date and they live a long distance away, meet them halfway. Don’t make them travel X hours/miles when you wouldn’t do the same.","A few weeks ago I matched with a girl on Tinder, and while we didn’t totally hit it off immediately, we ended up exchanging Snapchat usernames. Again, nothing serious. It was mostly sending goofy pictures/selfies, things we see during the day, pics of projects at work, etc. 

Last night after sending me a cute selfie she asked if we were ever going to meet up IRL. I told her I’d love to do that this weekend. However due to the fact that we live about an hour away from each other I suggested meeting somewhere halfway between us, and even gave a suggestion of specific places we can go to. She refused those options, and would like me to drive all the way up to her town, one that I’ve never actually visited ever, and didn’t give me a specific place to go to, like any particular restaurants or activities or anything . 

To me, this sounds ridiculous. I don’t know this person and she wants me to clear out my schedule to drive to an unfamiliar town for the chance to meet her, and even then it doesn’t guarantee that we’ll like each other or lead to additional dates with her. She’s not putting in the kind of effort I’d like from a prospective date. IMO if you want to meet someone that is a considerable distance from you, both people should coordinate a way of meeting halfway between them so not one person has to travel a significantly longer distance for a first date. My time is very valuable, and I don’t want to waste it in any way. 

Am I thinking this out the wrong way, or am I at least partially correct?",dating,t5_2qhb1,https://www.reddit.com/r/dating/comments/pq0qmf/people_if_you_want_to_meet_someone_for_a_1st_date/
69,pq0vg5,1631887768,Will I regret it?,"I think I need to end things with the girl I’m seeing. When we are together, things are great, but when we aren’t it’s like we are on two separate planets. There’s crazy chemistry in person but like how much is that worth holding on to when I can only see her once or twice a week, sometimes less. 

I feel like if I do it, I’ll regret it because there is crazy potential there, but at the same time right now it’s just a wear on me.",dating,t5_2qhb1,https://www.reddit.com/r/dating/comments/pq0vg5/will_i_regret_it/
70,pq0z6q,1631888096,How do I cope with constantly being rejected?,I feel like I’m always being rejected. I can so much as show an interest in a guy and then it leads to me being rejected and ghosted. It’s really making it so hard to find a relationship. It’s like I’m scared to put myself out there due to be rejected and when I do put myself out there I most likely get rejected. How can I cope with always being rejected?,dating,t5_2qhb1,https://www.reddit.com/r/dating/comments/pq0z6q/how_do_i_cope_with_constantly_being_rejected/
71,pq15in,1631888665,Escaping a forceful friend.,"This girl in my class i'm friends with has been having a lot of physical contact with me and even tried to kiss me etc and she doesn't stop with it even though i clearly stated i didn't want it. Today she asked me to go do something together, and i said yes cause i just wanted to hang out as friends and she didn't state it was a date. However before we were about to go together she already made pretty clear it was supposed to be a date by flirting alot and continueing with all of the physical contact. When we were about to go into town center we came across a classmate at the train station who was having trouble with getting access. So we went to him to help him out. Whilst we were there the train that i usually get to go home was about to arrive, and i quickly said to her that i had an appointment with a female friend tonight and had to get this train, cause the next train was delayed. She kept trying to force me into going on a date with her, this got me mad and i quickly hopped into the train without saying anything, and as i hopped in as it was about to depart she had no chance at all to follow me in the train. 

Who is the bad guy here? Me, escaping in such a way from her even though i said I would go hangout with her (she didn't state it was a date when she asked it) or is she the bad one here, by continously having alot of physical contact with me against my will, being pushy and trying to force me to go on date with her (and probably force me to have sex over there). I feel like i did the right thing, cause i clearly stated that i didn't want it and yet she kept having alot of physical contact with me and trying to force me in a date and probably sex afterwards.

But i feel like i also fucked up our friendship by doing this.",dating,t5_2qhb1,https://www.reddit.com/r/dating/comments/pq15in/escaping_a_forceful_friend/
72,pq16a1,1631888738,At what point is this overreacting?,"My girlfriend and I (both 25) have been officially dating about a month and a half. When we first met she gave me the disclaimer she was assaulted and needed time to warm up to me which I understood. In that time however, she gave me all these nitty gritty details of her sexual past when she wouldn’t even touch me. Eventually I confronted her about this and told her it bugged me but she turned it on me saying how she hasn’t been intimate since her assault. 

Anyways time passed and we started getting intimate. I will typically spend quite some time on her doing oral knowing how much she loves it and she will typically return oral for not more than 2 minutes, does it very slowly and never til I finish. Last night she asks me if that’s ok and I was like eh yea I mean if you don’t like to do it I understand and she proceeded to go back to her sexual past saying all other people she used to be with expected her to finish and she would do it. Like wtf. So I got upset and she once again turned it on me about Blah blah I haven’t been intimate since my assault and stuff like dude ok I get it but why share that with me then? I didn’t ask. She apparently doesn’t experience jealousy but I do especially when I don’t ask for details and when it’s about her doing something for others that she doesn’t do for me! Thoughts?",dating,t5_2qhb1,https://www.reddit.com/r/dating/comments/pq16a1/at_what_point_is_this_overreacting/
73,pq185p,1631888916,"My ex told me she will give me another chance, she just didn't want me to leave","Long story short, me and my ex thought we were the right person for each other, had the same ideas, tastes, and all of the other stuff. At some point we thought we were both identical but one day she told me that this relationships pains her. After a long day of not talking she messaged me saying she wants to give me a second chance since it would feel too empty. I accepted but she said that the second chance will not happen now, but in the future. I accepted that too. After a couple of days we talked about some random topic until I asked her if she was ready, she told me that she wasn't. Then I reminded her about the second chance and she told me that she promised that with the single reason of me leaving and not being near her. It just pains me, a lot, knowing that I am basically losing this person from my life. The person that I thought would be my ideal. The person that I wanted to spend my whole life with. I just feel broken",dating,t5_2qhb1,https://www.reddit.com/r/dating/comments/pq185p/my_ex_told_me_she_will_give_me_another_chance_she/
74,pq1a66,1631889092,OLD for Friends,"I was thinking about  looking for female friends via OLD. I  figure it being virtual initially would make it easier than irl. I've failed doing it irl because I just couldn't seem to convince them that I wasn't physically attracted to them. I would like actual  female friends. I figure if I set all meet ups during the day, wear nothing but sweats and Hanes t-shirts, and make sure to  split any expense, it would drive the point home.

So, have any of you had success with this? Are women even open to that?",dating,t5_2qhb1,https://www.reddit.com/r/dating/comments/pq1a66/old_for_friends/
75,pq1dgl,1631889387,What should I do with this guy?,"I have been going on dates with this guy. We have fun and everything was going fine, but lately he started to pull off. Like not texting back or not texting at all for days and don't making plans with me. He have texted saying sorry and explaining to me that he is going through a personal problem (a family thing) and that he is sad and that when he feels this wasy he tends to isolate himself.
We spent like 3 weeks without meeting and barely texting.
On Sunday we were supposed to have dinner together and watch a movie, but something happened about this family problem and he was sad, so he canceled saying sorry and we talked about what was making him sad. But around 1am he texted saying he couldn't sleep and that he needed a hug, so I went to his house, we talked, had sex for the first time and I slept with him.
He texted the next day, we chatted a little and then he stopped answering back, I texted on Tuesday, we exchanged a few lines and he went off again. He didn't text back until today.
How am I supposed to take this? I feel bad and ignored.
I know he must be going through something bad, but is that enough to ignore someone if you are supposedly interested?
I would like to get some opinions.",dating,t5_2qhb1,https://www.reddit.com/r/dating/comments/pq1dgl/what_should_i_do_with_this_guy/
76,pq1e0u,1631889442,I (26F) keep getting “the ick” with someone I’ve been seeing for 3 months,"I’ve been seeing a guy I met on hinge in May for 3 months now. I was initially attracted to him but slowly as I got to know him more I’ve seen quite a few “red flags” in my book that have given me the ick. I often get the ick in new relationships when they are just starting out so I initially ignored it and pushed through it, got over it and things were going well. I now have the dreaded ick again after initially getting over it. He’s a really great guy, seems like a genuine good person which initially attracted me to him. But from day 1 he has been kind of pushy to make things official which is usually not my style. I like to be more casual about things and take it slowly usually to prevent rushing into things and awkwardness surrounding a relationship that “went too fast”. He’s made it clear that he’s very into me and even “one step ahead of me” in our relationship but I keep flip flopping between being all in and regretting making things official which makes me totally uncomfortable. He seems slightly insecure because he’s constantly asking me if I’m okay or if somethings wrong and I feel like we’re having this conversation at least once a week. Which, to me, shouldn’t be the case especially in the beginning of a relationship. Hes 1 year younger than me and I can see his immaturity coming out in some ways surrounding his expectations in this relationship. He’s very possessive which is a HUGE turnoff to me , for example we went out with his friends last weekend and his guy friend had his arm around me because we were chatting and he literally yelled at his friend and “had a talking with him” about touching me. Which I thought was ridiculous and turned into a huge drunk fight in which he kept me up until 6 am demanding that we “fix it and talk it through now” in which I said let’s talk about it tomorrow morning when we’re not drunk anymore which I thought was reasonable. He then proceeded to start crying and I was so repulsed by him. He also says the cringiest things like “I like my night nights before bed” referring to us saying goodnight to each other either over the phone or text every single night. I literally feel like the guy in this relationship and he’s always acting like a needy clingy girl. We’re constantly having this discussion too. Looking for advice on if my feelings are justified and what to do. I don’t really want to end it but can’t get over this ick feeling that keeps coming up.",dating,t5_2qhb1,https://www.reddit.com/r/dating/comments/pq1e0u/i_26f_keep_getting_the_ick_with_someone_ive_been/
77,pq1fi3,1631889583,Not romantic/flirty enough?,"So I had a date over a week ago and it went for roughly 3.5 hours. We met up midway at a cute port town and walked around, talked, and then had dinner. I didnt go in for a kiss at the end (kind of general rule of thumb i have for myself is to not kiss on the first date. This can be debated, but it's something i prefer not to do. It has it's pros and cons.). I thought the date went well but guess not. I texted her later that night saying i had a good time and would like to get together again next week and she said she had a good time and thanked me for coming out. Fast forward, i texted her to see how she's doing and if she's free to get together. She responded saying she didnt feel a romantic vibe even though it was fun getting together and best wishes. 

Now, i know im not the best at flirting and this isnt the first time i've had this happen, but clearly it's something i struggle with. I know i should try and establish some sort of physical touch/connection. I'm not as ""witty"" or ""quick"" in the convos to have that push-pull or flirty-ness as i can over text just because i can think longer and it is frustrating because i lose out on people that might be really awesome. But i have a tendency to try and find ""can i be your best friend and a romantic partner"" so the first dates for me usually tend to be more of a compatibility check than anything else and i dont think this approach is working for me at this point and think i should be more flirty but am not sure...how to be.",dating,t5_2qhb1,https://www.reddit.com/r/dating/comments/pq1fi3/not_romanticflirty_enough/
78,pq1fm7,1631889594,Is Dating in Your 30s Really that Hard?,"Recently single guy here. I just lost the girl of my dreams. She was smart, beautiful, and generally everything I ever wanted. I turn 30 in December and am afraid that I won't be able to find someone like her at this point. I'm a catch on paper; good looking, I hit the gym and am in good shape, I have a good job as a structural engineer, and people generally find me funny, but still, I've always found it hard to meet girls and get dates, and as I get older, the dating pool seems to be getting smaller. Besides that, my friends are all getting married, moving away, and/or having kids so my social life has been shrinking too. Am I just being dramatic due to post breakup anxiety, or is it really that hard to find love in your 30s?",dating,t5_2qhb1,https://www.reddit.com/r/dating/comments/pq1fm7/is_dating_in_your_30s_really_that_hard/
79,pq1jdp,1631889937,Wanna learn the “secret language” that will make any woman feel an uncontrollable lust for you and only you.,[removed],dating,t5_2qhb1,https://www.reddit.com/r/dating/comments/pq1jdp/wanna_learn_the_secret_language_that_will_make/
80,pq1lv9,1631890167,Obsession Method,[removed],dating,t5_2qhb1,https://www.reddit.com/r/dating/comments/pq1lv9/obsession_method/
81,pq1mgd,1631890215,Should I Pursue A Relationship with This Girl?,"I (College-Aged, Male) am at a bit of a crossroads. I've become much more successful with women this last year. Learned the tricks, became more attractive, dressed well, and socialized correctly. However, I've not had a single real lasting relationship, and I'd like to give it a shot, though I struggled finding someone I could connect with. 

Well an opportunity has appeared. 

There's a girl, with whom I share what seems to be unreasonably high compatibility. We've met eachother a long time ago, but we only really got to get to know eachother very recently. She's already part of my main friend group, she and I are both very witty in conversation and often start joking and laughing sprees, last time we went together in a group, she non-stop complimented me on my appearance and smell (I dress formally and use cologne, even in casual social events, it's become a habit), the two of us were very much flirting, and a lot. And we talked about our dating struggles and difficulty finding someone to connect with (very cheesy, I know). It all felt very natural.   

This all came as a bit of a surprise because she and I share an unfortunate (but brief) history. That history is:

1. She used to be a very close friend's crush. The two of them are still on very friendly terms despite the disappointment my friend had with her. 
2. She lied to another very close friend that we shared about the fidelity of his girlfriend, and then pretended to not know anything when she saw my friends and I comforting him following the breakup. 
3. As a reaction to her lying to my friend, I confronted her on it, in front of him, and though I believe my words were justified, they were harsh. And I thought at the time she'd never want to speak to me or my friend again. 

And yet, she repaired her relationship with my friend, re-entered our friend group, and has been nothing but kind, friendly and flirtatious to me since. 

Under normal conditions, our history would immediately cross her out as a potential partner, without even a second of thought. Yet she left such a strong impression on me as of late.

Should I pass up this opportunity or try something? What are some things I should be looking out for?",dating,t5_2qhb1,https://www.reddit.com/r/dating/comments/pq1mgd/should_i_pursue_a_relationship_with_this_girl/
82,pq1oqo,1631890417,I need advice,"So I (26F) matched with a guy last weekend on Tinder, went out on a date and had a great time and he even wanted to come back over the following day to hang out (nothing sexual). He followed up saying he had a great time and all that. Here’s the thing: he hasn’t reached out all week but he has added me on Snapchat (hasn’t really snapped me though) and followed me on IG. Is he sending mixed signals or is it too early to tell? I don’t want to reach out to him if he is sending mixed signals because I’m afraid of looking like an idiot. I haven’t dated in a while so I’m just confused. Help!",dating,t5_2qhb1,https://www.reddit.com/r/dating/comments/pq1oqo/i_need_advice/
83,pq1ycq,1631891263,"Nipple piercings on guys. Yay, nay or meh?","Are they a turn on, turn off or you don't care bout them?",dating,t5_2qhb1,https://www.reddit.com/r/dating/comments/pq1ycq/nipple_piercings_on_guys_yay_nay_or_meh/
84,pq2a3k,1631892330,Are you too picky when choosing a partner?,"There are tons of people these days who get called out for being “too picky” or even having too high standards. What are you picky about when choosing a partner? Is it unreasonable? If you know you’re too picky, are you open to changing?",dating,t5_2qhb1,https://www.reddit.com/r/dating/comments/pq2a3k/are_you_too_picky_when_choosing_a_partner/
85,pq2i9t,1631893045,When do you feel comfortable doing oral on someone new?,[removed],dating,t5_2qhb1,https://www.reddit.com/r/dating/comments/pq2i9t/when_do_you_feel_comfortable_doing_oral_on/
86,pq2r52,1631893837,Just a quick vent about what could have been,[removed],dating,t5_2qhb1,https://www.reddit.com/r/dating/comments/pq2r52/just_a_quick_vent_about_what_could_have_been/
87,pq2yk4,1631894482,How do you know if you’re Talking ? 💀,"So it’s been awhile…haven’t really dated much the last 8 years or so and the “talking” stage wasn’t really a big thing back then. So my biggest confusion is how you know you’re in “talking” stage. Is this just when you are getting to know someone in the beginning of after mutual interest/feelings are expressed? 

Thank you in advance from a very confused potato 🥔",dating,t5_2qhb1,https://www.reddit.com/r/dating/comments/pq2yk4/how_do_you_know_if_youre_talking/
88,pq33f6,1631894893,i think im giving up,"Hey guys!
Honestly not too sure why i feel like writing this post but i guess getting a second opinion isnt always a bad thing. Im a 21 year old man and i think im just done with pursuing women.

Ive been rejected by hundreds of women at this point and i dont know if its just because im ugly or maybe im just not good enough for a person like that in my life but i think im just gonna get a dog and learn to love being lonely😂

I wish everybody here the best of success though in your dating endeavours!",dating,t5_2qhb1,https://www.reddit.com/r/dating/comments/pq33f6/i_think_im_giving_up/
89,pq34rt,1631895007,An introverted person who wants to date but doesn't know how to find one.,"     I'm a 23F who never had a bf or date in my life, desperately craving for one, and want to get married one day. I just don't know any casual places in real life to find a date that doesn't cost a load of money (No bars, cafes, and mall-type places). The free places in my town (Parks, libraries, and public galleries/museums) aren't areas where someone would want to be bothered or places that get much traction. Online dating didn't work since you have to dump a load of money to get any use out of them (Read in-app messages or look at more that 5 pics a day). How the do I even find someone?",dating,t5_2qhb1,https://www.reddit.com/r/dating/comments/pq34rt/an_introverted_person_who_wants_to_date_but/
90,pq34sk,1631895008,I need a bit of help…,"There is this girl i haven’t talked much to for like a year and a half, but i still have a crush on her. To give some context, we were classmates for 5 years before highschool, I could say that we were pretty close friends as we would go out many times and having many things in common to talk about. But since entering highschool we had our own things to do and problems to solve so we only reached out to wish the regular happy b-days to eachother, which I think is something of good manners. The thing is that I would really want start talking to her more and actually go out sometimes but I can’t find any good ideas or occasions to do it. How could I approach the situation or if to ditch it because it would seem weird. Any advice is welcomed! (btw I am 18 of age). If there is a better subreddit you can tell me and I can remove the post but this looked as my best chance. Thanks in advance!",dating,t5_2qhb1,https://www.reddit.com/r/dating/comments/pq34sk/i_need_a_bit_of_help/
91,pq36d4,1631895141,please if any women want to date me please let me know,[removed],dating,t5_2qhb1,https://www.reddit.com/r/dating/comments/pq36d4/please_if_any_women_want_to_date_me_please_let_me/
92,pq3eat,1631895816,Men’s advice. Instead of ‘I need to get her number’ reframe your thinking to ‘I’m going to make her day’,"The most powerful way to interact with others is with a high degree of authenticity. When a lot of guys approach women out in public, they are outcome focused first and foremost— a number, an eventual hookup, or sex is the objective. Of course, those are things we all want with a beautiful woman, but the problem is this objective-based mindset forms the basis of the conversation.

In this frame of mind, you are seeking something from her, which puts her in a subtle position of power of over you. The whole purpose of your interaction was contrived so that you can receive some form of validation from her. Guys get nervous approaching with this mindset because it frames the interaction in a way that he inherently believes is bothering her, it’s essentially a sales pitch.

If you see a beautiful woman, and she really sparks something in you, tell her without expectation. See where things go.

“Excuse me, I just have to tell you that you are gorgeous, and it made my day seeing you out and about here”

If you really feel it, are smiling genuinely, and aren’t overly nervous, slightly playful, most women will be pleasantly shocked. Most guys they encounter aren’t as bold, or if they are, are usually trying to hit on them.

She may smile, it may lead to a conversation, she may scowl, there are several potential outcomes. But outcome doesn’t matter when you are in this mind frame. Being bold enough to tell a woman that she made your day while having fun and not being concerned about the results is a powerful and freeing feeling.

It just has to be authentic and not a canned line with an intended result. And yes, it can be scary being that vulnerable with a stranger, but if you focus on trying to give them a positive experience where they wonder, “Who the fuck was that?” in a good way,and you walk away with the same level of confidence no matter how they respond, your overall interactions will be more positive.",dating,t5_2qhb1,https://www.reddit.com/r/dating/comments/pq3eat/mens_advice_instead_of_i_need_to_get_her_number/
