,id,created_utc,title,selftext,subreddit,subreddit_id,url
70,qe4u8y,1634995291,Why do a number of women want to be Friends when the courting stage fails?,"The only thing that makes semi logical sense is when she isn't physically attracted but everything else is good. But let's say in addition to this possibility, you also find you are quite different and not really a match. I don't get the point? I mean sure you can say it as a point of politeness, maybe even have an occassional chat on the ap, but what on earth would be the point of meeting? Obviously if you are in the same business, college program or something like that then maybe it makes sense, but without some type of professional or academic connection, I don't get it. 

This woman asked to meet purely as friends, and I didn't want to be rude so I was just vague about it, but she was clear from the getgo that she wasn't attracted to me physically but she was willing to overlook it. Stupidly at my age I continued things, but the more I got to know her the more I realized it would be a bad match and she felt the same way. I get this request fairly often, and actually on the ap I'm on it seems genuine most of the time. If they don't dig the cut of my jib they usually just wish me good luck or if they are nasty they give that squinty face and then block. 

Maybe I'm crazy but to me a friend requires a higher standard at least emotionally and having things in common. The only difference can be a lack of attraction if both are cool with it. And I don't think people that reject each other on dating aps are the best way of finding friends of the opposite sex.",dating,t5_2qhb1,https://www.reddit.com/r/dating/comments/qe4u8y/why_do_a_number_of_women_want_to_be_friends_when/
71,qe4wt9,1634995542,A successful date at last!,"I just got back from a date and here is a brief run down
I picked him up in my red car that I just bought today. I also paid the bills. I invited, so I paid!

I know is weird, but if a man gets intimidated by the good actions of a confident woman, then isn’t a good match anyway!
I guess it was a test and he passed!",dating,t5_2qhb1,https://www.reddit.com/r/dating/comments/qe4wt9/a_successful_date_at_last/
72,qe4yu7,1634995747,I (25M) have a crush on my friend's ex (22F) but the situation is complicated. Should I tell her?,"TLDR: I (25M) have a crush on the ex girlfriend (22F) of one of my best friends. I would like to tell her but feel like the situation is already complicated enough and that I shouldn't impose on her like that. 

Some context: Both me and my friend (24M), let's call him D, recently went through breakups after relationships of \~5 years. My gf left me and that wasn't easy for me, but it was not an ugly breakup. D on the other hand had been cheating on his gf, let's call her A, throughout their relationship, and now he had found himself a new gf, so he finally broke up with A in what became a very ugly breakup. A was heartbroken.

Now me and A had always gotten along well and I had always really liked her as a person. I have always felt bad about the way that D had treated her, and that I never had told her about him cheating on her. I was also pissed at D for his behavior. A and I began hanging out more, talking about our respective breakups, comforting each other and bonding over it. Before, I had only really known her as my friend's girlfriend, but I quickly felt that we were developing a bond of our own. Soon after I began crushing on her and I felt like it might be mutual, but I didn't want to tell her right away for several reasons: First, we had only recently become close, and I didn't want to give her the impression that I had only been hanging out with to her in order to get with her. Second, I didn't want to come off as D's horny friend that has always had the hots for her and has only been waiting for D and A to break up (Which wasn't the case, like stated above, I was also in a long term relationship previously. But somehow I was still worried about appearing as such). And third, and most importantly, A had just gone through a pretty bad breakup which she was still dealing with emotionally, so it just didn't feel right to inject my feelings for her into that situation of vulnerability. I figured I'll just give her some time to process and then I can tell her, no big deal.

Turns out though, that not everyone is considering these things. Another guy, a former friend of D's, let's call him M (24M), sees his chance and tells her that he has always had feelings for her. A tells me she doesn't have feelings for him and that she is not ready for a new relationship but she welcomes his affection anyway. They develop a sort-of-relationship. She doesn't have feelings for him and talks about ""being single"" when her and I hang out, but they spend a lot of time together, even vacation together. A and I still hang out and talk. I still have a crush on her and I'm still convinced the feeling might be mutual, I just feel it when I am with her. I get the feeling that her fling with M is not serious for her and that she is just happy not to be alone at this time. She is still processing the breakup with A and emotionally vulnerable.

I still want to tell her about my feelings, but I'm still worried about all the same stuff, especially now that M had come in and complicated the picture. At this point I have to move to a different city for work. When I say goodbye to A we promise each other to stay in close contact and to continue our newly developed bond. It was a strange moment, it almost felt like we were telling each other about our feelings between the lines of what we were actually saying. I move away, and A is constantly on my mind. My feelings for her are getting more intense. We exchange messages, but much less than what I hoped for. She is a busy girl who is still struggling emotionally, so I try not to read anything into it. I would like to tell her so many things, but I'm afraid of pushing her too hard.

My new city is not that far away, so I go home to visit after a couple weeks and I am really looking forward to seeing A again. When I finally see her it is great and she is also really happy to see me. I cringe internally at my crush-induced behavior and figure I should finally tell her, because I can't take it anymore and just want to know. Then I find out that A is now living with M because she lost her apartment, and my resolve to tell her is fading. But A makes sure to stress that they have separate rooms and that it is a temporary solution. I go home just as conflicted about the situation as before. 

I want to tell her, but it doesn't feel right to impose myself on her already complicated situation. She's still dealing with her breakup, and she has that thing with M going on. On top of that, I live in a different city for at least the next six months. She is also the ex of my friend D, who also hasn't properly processed their breakup yet. It's kind of selfish of me to want to tell her, I feel like. My heart tells me to just go for it, but I am worried that that might be pushing her too hard right now and that I might destroy our friendship. What do you think, Reddit?",dating,t5_2qhb1,https://www.reddit.com/r/dating/comments/qe4yu7/i_25m_have_a_crush_on_my_friends_ex_22f_but_the/
73,qe51d9,1634995994,Should i (17f) stop talking to this guy (19m),"I have been talking to this guy since the past 3 months.  We knew each other before we started talking. 3 months earlier, we started talking, we really hit it off then. He was extremely flirting most of the time we talked. Then we had an argument and didn't talk for a month.  4 days ago he texted me very casually and since then we have been talking very casually, no (extra) flirting. 
Before he started talking to me, he broke with his gf with whom he was in a relationship for 3 years. We were connected with each other on social media. He used to reply to my snaps/stories by commenting hot, sending fire &amp; heart emojis while he was in a relationship with that girl. They seemed serious because they used to post a lot about each other.
Now i am worried that even if we have a chance of dating in the future, he'd flirt with other girls.",dating,t5_2qhb1,https://www.reddit.com/r/dating/comments/qe51d9/should_i_17f_stop_talking_to_this_guy_19m/
74,qe55u9,1634996430,Just got stood up. Should I still go out on a date if he asks me?,"I matched with a guy and we have been texting for a week. He seems like a nice guy. Replies on time. Doesn't keep me waiting. Asks about my day, etc. He was on a road trip and just returned yesterday. We had originally planned on meeting tomorrow but he insisted that we meet yesterday after he reaches the city. He confirmed that we were still meeting yesterday in the evening after he reached. So, I left work early and reached the cafe where we had decided to meet. I text him to ask if he has left from home and he replies saying that he fell asleep. I tell him that I will wait for him to come. A few minutes later he sends a voice message saying that he's very tired and won't be coming after all. He wants to sleep. I was upset because
1. It he who insisted that we meet up on the same day after I finish work. sayin that he is excited to meet me. Although we had originally planned for tomorrow. I only agreed because he kept repeating that he couldn't wait to meet me
2. He just ditched me after I was already there and had taken the time and effort to reach there on time

I feel disrespected. I'm considering just telling him that we should probably not meet up at all? 
Am I overreacting?",dating,t5_2qhb1,https://www.reddit.com/r/dating/comments/qe55u9/just_got_stood_up_should_i_still_go_out_on_a_date/
75,qe5a1h,1634996834,So predictable? Communication,"Whilst I mean no disrespect to women, why have they become so predictable now?  Guys are meant to be the ones that are the game-players and the ones to let someone down?

When I was a bit younger and starting out and had a worse game; it would be very obvious that they weren't interested.  Now they show interest, then act very strange? They pull out but don't pull out.  They just make it so obvious that they are acting up but don't say otherwise?

It's happened a lot since COVID has happened. There's literally zero communication now when someone isn't interested. They just act up and hope that you just assume where you stand.",dating,t5_2qhb1,https://www.reddit.com/r/dating/comments/qe5a1h/so_predictable_communication/
76,qe5b8n,1634997382,Need some advice,"Hey guys, I’m a 23y male, dating a 21y female. We’ve been dating for about 3 years now, and for almost that entire time we’ve been dating long distance. Right now we live a state away from each other, and I should be moving back next year, but since I’m going to grad school next year I’m not sure I’ll make it back there. The distance has been nice because it makes us focus on ourselves and develop our careers, but it’s also widened a gap between us and made me look objectively at myself, her, and our relationship. 

While she has a ton of redeeming qualities, like being smart, beautiful, witty, explorative and great at golf,I can’t help but notice some other things as well. She doesn’t seem all that concerned with the future, economically or educationally, she just knows she wants to travel and have money. While I too want to travel and have money, I know that there are certain steps you have to take to get those things, like going to school and getting a job that doesn’t pay minimum wage, and starting a side hustle. She’s just started a community college last semester, and honestly I’m so proud about that, but I’m afraid she’s going to use it to have fun instead of doing what she needs to do. Don’t get me wrong, I want to her to have friends and hang out with other people besides me, I’m fine with that, I just know she gets distracted so easily. I’ve also noticed how she just spends money left and right, even though I’ve tried to help her set up a basic financial portfolio, and told her about the importance of a Roth IRA. 

Overall, it just seems like she’s really not thinking about her future long term, and that’s only one of the things. We haven’t gone all the way before, we’ve only tried before she says it’s too painful and stops. Whenever I see her in pain I feel bad and don’t push the subject, even though it leaves me extremely frustrated. Am I being a an ass for expecting sex from my girlfriend? I don’t think I am, but I always end up feeling like one when I ask if we can try. She has a hormonal disorder where she doesn’t get horny and doesn’t get her period as well as a few other things, so I try to be understanding. But honestly sometimes it feels like she just doesn’t even try to think about it from my side. My frustration with her is getting to the point where I don’t even want to have sex with her, and I’m constantly looking at other girls. It makes me feel like such an asshole, and my friends tell me it’s not my fault, but having been cheated on before I feel grossed out by myself when I do. 

The last thing is probably compromise. I just feel like it’s always gotta be her way.  Thing is that we both have strong personalities, so we fight a bit when we disagree, and things only start moving if I compromise, and sometimes she does. Thing is, I don’t know how much of this
Is just in my head, and how much of it is reality. I know I’m not texting her as much as I should and that im not as enthusiastic about our relationship as I used to be, but that’s because I don’t feel like I’m getting what I want from this relationship. 

Should we break up, am I being a dick, or is she?",dating,t5_2qhb1,https://www.reddit.com/r/dating/comments/qe5b8n/need_some_advice/
77,qe5br6,1634997463,Why is this girl who has friendzoned me keep talking about me and her choice to her friends?,"A common friend we share has told me that She has recently kept talking about what happened between us not only to him but to other friends too. I am afraid She was just making fun of me and of my feelings for her. 
You either like or dislike someone and in the very moment they ask you if you like them back you already know it, so why would this simple matter require receiving so much counseling from friends? 

I confessed my feelings for her 1 week ago, however She was already seeing it coming, because I made it clear in other ways that I liked her. Her friends knew about all the signals and special attentions I was giving her, long before I confessed.
It makes me confused as we guys won't spend so much time talking about a lady who's into us if don't like her back. 
Was it a heart-wrenching decision to put me in the friendzone so that She has to ponder it with her trusted friends? I heard rumors She is in a difficult relationship with a dude but She has never told me about it and, also, her behavior has cruelly strung me along.
Given the fact that it seems that I have occupied her mind a lot recently, do I have any hope She will come around about her decision or am I just delusional?
Blunt answers are welcome too! Thank you in advance!",dating,t5_2qhb1,https://www.reddit.com/r/dating/comments/qe5br6/why_is_this_girl_who_has_friendzoned_me_keep/
78,qe5iwd,1634998049,Hooking up as a dating strategy,"I use the word strategy loosely because it honestly hasn’t been that strategic in my case, but hooking up has been an effective way of “dating” for me. Women of Reddit, would you consider casually hooking up to be a valid dating strategy? Why or why not? Men, would you ever take a woman you were initially just hooking up with seriously? Why or why not?",dating,t5_2qhb1,https://www.reddit.com/r/dating/comments/qe5iwd/hooking_up_as_a_dating_strategy/
79,qe5l5f,1634998258,Two message chump,"So this week I  had some small measure of success on a dating app where I have gotten more that 0 match on a dating app at a grand total of 5. Each girl I messaged either something funny or something  about their profile, nothing too serious sexual or dark (I save that for after I'm  more comfortable with a person and they know that it's all a joke coming from me). But I got no more than 2 messages from each of these girls before they stopped replying. I just feel dejected that I  can't  get someone to want  to put in effort  to get to know me before they discard me. And I know they got there fuck ton of guys to go through but this is just depressing. And yeah I could  message again but thats just gonna  make them think I'm desperate  which leads to the same outcome either way. I honestly  just wanted to  vent a little so enough of the pity party. Tonight I'm  going out doing two shots for courage and trying to socialize.",dating,t5_2qhb1,https://www.reddit.com/r/dating/comments/qe5l5f/two_message_chump/
80,qe5rzg,1634998903,Is it normal not to feel sparks on the first date?,"I just went on a date with a guy who checks all the boxes on what I want. He was kind, funny, respectful, and all around perfect. But the vibe I got the whole time was like I had just spent time with a new friend. Is it normal to feel kind of neutral after meeting someone for the first time?",dating,t5_2qhb1,https://www.reddit.com/r/dating/comments/qe5rzg/is_it_normal_not_to_feel_sparks_on_the_first_date/
81,qe5tkg,1634999046,Is he loosing Interest in you? 😔,[removed],dating,t5_2qhb1,https://www.reddit.com/r/dating/comments/qe5tkg/is_he_loosing_interest_in_you/
82,qe5whx,1634999322,Dating advice if I live with my parents?,"So I'm currently living with my family which makes the dating game tricky since I can't really bring anyone home. For those of you who live with parents, how do you handle meeting people?",dating,t5_2qhb1,https://www.reddit.com/r/dating/comments/qe5whx/dating_advice_if_i_live_with_my_parents/
83,qe5yj3,1634999511,Sigh,[removed],dating,t5_2qhb1,https://www.reddit.com/r/dating/comments/qe5yj3/sigh/
84,qe6821,1635000414,"Do girls like guys with a story to tell, for example my struggle through depression, and leaving Islam as a religion, I have a feeling it may deter them away or something. Idk how to properly explain the question","I thought I may have an interesting story, but would these types be beneficial or detrimental",dating,t5_2qhb1,https://www.reddit.com/r/dating/comments/qe6821/do_girls_like_guys_with_a_story_to_tell_for/
85,qe6j68,1635001377,How does it feel to have a girlfriend?,[removed],dating,t5_2qhb1,https://www.reddit.com/r/dating/comments/qe6j68/how_does_it_feel_to_have_a_girlfriend/
86,qe6od0,1635002091,I went on a “date” tonight and this happened,"F19 
I met up with a guy M22 I matched on tinder around two months ago we only met up yesterday as our schedules never really aligned, we’ve been talking everyday. All was going great we have the exact same humour so a lot of jokes it was fun. Side note I make jewelery and a few weeks prior to this meet-up he said if I make him a necklace he’d buy me food and asked for restaurant recommendations and I gave him one. So he asked if I wanted to eat there, we get there I order just a starter cause I wasn’t that hungry he orders a starter, main and water. Food comes he asks me if I want to try his I declined and he kept offering so I said sure just to be polite I just took a tiny bit. I offered him mine and he took a big portion. I didn’t finish it and he ended up eating all my food leftovers. When the bill comes he asks to split it, I was a bit confused as prior he agreed to buy me food  for the necklace I made him. The waiter asked us to split it among our selves and he also makes me pay for the water he ordered? I just did because I wasn’t about to argue over money. Idk if I’m overreacting but it’s just weird to me. Lowkey feel like he used me for free jewellery. And throughout the whole entire date we never even had any serious conversation like he’s funny but he kind of over did it with the jokes and he can never be serious so it got a bit annoying. He was just too immature.",dating,t5_2qhb1,https://www.reddit.com/r/dating/comments/qe6od0/i_went_on_a_date_tonight_and_this_happened/
87,qe6p95,1635002172,A girl who stays after rejection,"What are the chances of a guy accepting a girl after rejection from him? 

More context would be that he likes her and enjoys her company, but felt that their goals are misaligned and that they are not able to communicate their needs well.  

The girl stays loyal by his side irregardless of his rejection. What are the chances for the guy to eventually accept this girl?",dating,t5_2qhb1,https://www.reddit.com/r/dating/comments/qe6p95/a_girl_who_stays_after_rejection/
88,qe6q5l,1635002251,Does this girl like me?,"So, this is a long story, but I am wondering, should I tell this girl I like her? There are so many hints that she likes me back, and even one of her FRIENDS said she is so obsessed with me. Now, this is a long story though, and although it may seem obvious to say I like her, there's much more that could make her say no, or the whole thing not to work out. Her friend told me that she likes me soo much, but also told me to not tell the girl I like about her friend telling me how she's obsessed with me. But recently, I unadded her on accident and she got pretty mad/pissed off at me, but she apparently was asking all her friends what to do, and all her friends literally contacted me asking me why (this is when one of her friends said she liked me so much), when it was all accidental, and I obviously added her back. But, although her friend put proof ( a screenshot) that she still likes me after I accidentally unadded her, do I still tell her I like her or what?

And how should I say it if I do, Like do i first talk about how her friends kindaaaaa exposed her, but it was in a good way because I like her back too, or the other way around",dating,t5_2qhb1,https://www.reddit.com/r/dating/comments/qe6q5l/does_this_girl_like_me/
89,qe70ck,1635003106,All of sudden she wants a relationship. Would it be right for me to commit?,"We been talking since November. We had only sex once in March. I would put a lot of effort in at the time for us to spend more time and she would always have an excuse. She had a one night stand during that time. She said she wasn’t having sex with me because she didn’t want to take things serious because she was busy with school and she lived far but now it’s different. Also, I ghosted after she went on a date two weeks ago and she kept calling me and messaging me. She said she went on that date because she doesn’t know what I am looking for and she is ready to date now",dating,t5_2qhb1,https://www.reddit.com/r/dating/comments/qe70ck/all_of_sudden_she_wants_a_relationship_would_it/
90,qe71k6,1635003210,Feeling decent but not great after 1st date.. what to do?,"As the title says, I feel decent but not great after a 1st date with a new girl. She's really nice and we had decent conversation with some moments of genuine fun. I feel decent but not necessarily super compelled. I find her quite cute and physically attractive, and I don't think that would be the major issue. I'm wondering if this is just because it's still too early or if there's an issue with compatibility. Help! What should I do? What are my options?",dating,t5_2qhb1,https://www.reddit.com/r/dating/comments/qe71k6/feeling_decent_but_not_great_after_1st_date_what/
91,qe7i20,1635004618,How to confirm a date in this Situation?,"Hey everyone, and happy Saturday. I got this puzzly situation, and I am not too sure how to make my move. Maybe I can get a few good suggestions. 

So I met this Girl on Tinder about a week ago we met on Tuesday and had an ''okay date'' (not great), I frequently go on Tinders dates and usually have a better time, but this girl got me really intrigued. Before our first date, we were on the phone for 2 hours, and ever since we would text a lot every evening. She would never, and I mean never initiate contact first (which in my opinion is a sign of a low interest), yet she would reply instantly every time. 

So last time we spoke was this Friday, and she mentioned she got some games at home. I asked if that's an invitation and she said that she doesn't know, so after a few texts we agreed on meeting at her place on Monday, she said she'll be free for sure (she was busy Sunday).

Now since she never initiates contact, I need to confirm time and address but I want to do this the right way.  Any advice would be appreciated! (we have a lockdown here, so there is no other way we can meet).

Thanks!",dating,t5_2qhb1,https://www.reddit.com/r/dating/comments/qe7i20/how_to_confirm_a_date_in_this_situation/
92,qe7lxg,1635004933,Should I lose weight before starting dating?,"I (22F) gained weight during lockdown. I went from 171lbs to 195lbs. I’m tall (5ft10) so I guess I don’t look that fat, but now I got love handles, my waist and hips are wider and I got more belly fat. I’m trying to lose weight by eating less and healthy, and being more active. But it’s takes so long before losing weight..Should i lose weight before going back into the dating scene? I know that being overweight is unattractive, and tbh i wouldn’t date an overweight guy either. But at the same i feel lonely and i miss dating. What should i do?",dating,t5_2qhb1,https://www.reddit.com/r/dating/comments/qe7lxg/should_i_lose_weight_before_starting_dating/
