,id,created_utc,title,selftext,subreddit,subreddit_id,url
23,qluo45,1635946736,I'm (33M) not entirely sure if girl I've been seeing (32F) is as serious as I am,"Hey everyone,

I (33 M) met up with a girl (32F) after speaking on Hinge for a few days. We had our first date on the 23rd of September and it went really well. We both don't drink so we shared a few cokes and spoke for about four hours. We exchanged numbers, moved to texting, and continued talking.

We both were busy after the date (I had a pre-planned trip with friends, and she and I both got vaccinated so had a mulligan week where we didn't plan on any dates). To keep the momentum going, I suggested a phone date and she agreed to it. We spoke for a few hours and continued texting afterwards. Side note - she lives at home with her mom and step dad and said she's very much a homebody.

She shared quite a lot with me after each date about her interests, and she admitted she is ""quite shy"" and introverted. I'm extroverted, not overly so, but I think the biggest issue I see for she and I is this difference. We feel the same in a lot of other areas and I feel really comfortable around her. She has stated the same.

I scheduled our second *real* date (mini-golf), but she had to cancel because her mom got sick and she thought it may have been Covid. At this point, since we hadn't known each other for that long, I wasn't sure what to think. I gave her the ""1-time free cancel pass"" and the benefit of the doubt. 

We continued texting, and our schedules lined up for our second date. We grabbed some coffee together.

I felt 95% of the date went well. She brought me a (gag) gift, laughed a lot, was very talkative and a bit more vulnerable about her shyness, etc. I felt very comfortable as well and liked where things were going.

So the last 5%. Admittedly, I lose track of time during conversation, and we'd been out for about 2 and a half hours. Her being shy and introverted, I wish I would have caught maybe some queues that she wanted to leave. During a break in the convo she did say she was getting tired and was hoping we could throw our coffees away and head out. She also mentioned she has a family thing coming up, and I'm also heading out of state in two weeks for about two weeks, and as we left she mentioned if we should ""plan on seeing other again after those trips"".

 I said agreed in the moment, but looking back if that were the case it would be a month before I see her again, which is the time between dates #1 and #2 as well (ignoring the phone date in between).

I gave it an hour and text her after the date thanking her for the gift and her time, and she responded as she normally has. However, I'm bit confused regarding her interest.

Is it just shyness/being out drains her? Should I position another phone date and be up front and ask her? 

What do you guys think? Thanks!

&amp;#x200B;

TL:DR

A month between date #1 and #2 (phone date in between), but lots of productive texting/positive banter/photos back and forth. She admitted to being ""quite shy"" and introverted, and is a homebody. Dates #1 and #2 went well, but I'm not sure if she's just a bit socially awkward or disinterested in seeing me again. She suggested date #3 after she and I's individual travel plans, which would make that date over a month away. Wondering at this point if I should be up front with her and ask if she's interested in where this is going, or let it play out naturally. Thanks!",dating,t5_2qhb1,https://www.reddit.com/r/dating/comments/qluo45/im_33m_not_entirely_sure_if_girl_ive_been_seeing/
24,qlup7i,1635946825,Why do people date multiple people casually with no intent to be with any of them?,"Question I never understood. I get it, people like attention, but why not focus effort to someone you actually are interested in?",dating,t5_2qhb1,https://www.reddit.com/r/dating/comments/qlup7i/why_do_people_date_multiple_people_casually_with/
25,qlupm3,1635946862,I (M 29) am tempted to ask her (28) out after haven't talked in years,"Alright so there's this girl I had crushed on in high school. We were pretty good friends, talked a lot, hung out together, I know her family / she knows mine. Still friends on FB, haven't talked to her since 2017.

The issue is I've lacked convinced so I never made any real moves / officially asked her out on a date before (or anyone for that matter). So now after college and in a stable job, I would like to start dating but am still probably over thinking everything.

I'm not sure what to say exactly. I basically want to meetup to catch up, but would like it to be as like a first date, instead of just as old friends. And at this point, I think I'd prefer just knowing straight up if she's not interested, rather than keep wondering.

So is it simple as:
Hey it's been a while, was wondering if you wanted to catch up over a sushi date on X at Y?

Is just throwing the word 'date' in there enough? 

What about 'hey cutie' or 'i always thought you were cute' to make it clear my intentions? Too much too soon?

Any advice is appreciated.",dating,t5_2qhb1,https://www.reddit.com/r/dating/comments/qlupm3/i_m_29_am_tempted_to_ask_her_28_out_after_havent/
26,qluwl7,1635947436,Is he just not Interested in me? Should I look somewhere else?,"Last month I matched with a guy on facebook dating, in the beginning he would ignore me after getting my phone number. It took about 2 weeks to actually have a conversation on the phone with him. Which we had last night, we talked for a little over an hour so we definitely had things to talk about. He was telling me about how he hasn’t been in a serious relationship since 2019. And that he has been meeting women and still uses hinge but he doesn’t seem to feel anything than being their friends. He told me hinge is the best app to meet people, since I have never used hinge before. I told him that I like meeting new people and seeing where the vibe leads to. I am not against friends or dating, either works for me. He asked me if I am talking to other people I was honest and said not really, because I don’t have any dating apps at the moment due to being focused on school since i’m almost done with this semester anyways. He did mention he is very picky with who he chooses to date. Overall, I feel we had a good conversation he texted me after saying “It was a nice talk”. I would really like to meet him, but he hasn’t brought it up at all. What should I do?",dating,t5_2qhb1,https://www.reddit.com/r/dating/comments/qluwl7/is_he_just_not_interested_in_me_should_i_look/
27,qluxkg,1635947515,not sure what happend,I was talking to this guy but he vanished this morning he said he thought he saw a future with me but I am starting to think he wasn't being serious because the conversation slowed down and he started to respond less he was 24 I am 27 why do guys do this ?. I wasn't sure if we would have met up anyways.,dating,t5_2qhb1,https://www.reddit.com/r/dating/comments/qluxkg/not_sure_what_happend/
28,qlv63d,1635948205,Help and moral support over an argument,"This always seems to happen - I (32M) am dating someone, everything seems fine, and then suddenly there is what I would see as a misunderstanding and a huge argument ends the relationship.

I personally HATE arguments. I will do everything I can to end it with at least one person happy and I will make sure that person is my partner if it can't be both of us. I will empathize, apologize, talk about what can be learned. Arguments do nothing for me.

I have been seeing a 31F for 3 weeks who seems just absolutely perfect in almost every way. Suddenly last night we were talking about pets and how she sees them as her children and I don't. I care about my cat but I just don't call it my child. It seemed like this wasn't OK with her because she kept asking about it and after a bit I just told her I felt like she didn't like my answer and was judging me. She told me I was putting words in her mouth and politely hung up.

I thought about letting it go but decided to text her and tell her I felt bad about how it ended and could tell she was upset. She said that I revealed ""a lot about myself in 30 seconds"" and that I put words in her mouth and that I was throwing off huge red flags - this just seemed so out of character to me to how she usually talks about me.

I tried very hard to express that I understood what I did wrong and that I could understand how she felt disrespected but it just seemed like there was nothing I could say or do. I barely slept at all last night and I'm miserable today. I texted her good morning and I said I would be giving her space today.

What do I even do. This is the most promising relationship I've had in the entire almost year and a half I've been dating. I hate this so much.",dating,t5_2qhb1,https://www.reddit.com/r/dating/comments/qlv63d/help_and_moral_support_over_an_argument/
29,qlvawc,1635948592,How can I tell if it’s a date?,"Over the past month of so I have developed feelings for a coworker. She works in a department then I do, so we don’t get that many chances to talk. And I usually see her talking with other co workers. But she is very friendly to me, and when we do talk we get along pretty well. I recently asked her if she wants to see the movie Eternals with me on Saturday, and go to dinner afterwards, to which she said that she’d love to. 
I am a freshman in college, but I’ve never really had any romantic experience so far. I don’t want to jump to conclusions, and assume that she sees this as a date, as far as I know, she might just see me as a friend from work, and she could already have a boyfriend. How do I know if it’s a date or not? And if it’s not, how do I make it one?",dating,t5_2qhb1,https://www.reddit.com/r/dating/comments/qlvawc/how_can_i_tell_if_its_a_date/
30,qlvdu6,1635948837,Income/wrath disparity and reciprocating gifts,"Gf of 4 months (31F) is incredibly kind and generous, she’s in a very unique position at the moment to have very minimal expenses (basically her only recurring expenses are food, phone bill, car insurance, internet and gas). She’s occupying a family members house for the foreseeable future rent free, owns her vehicle outright. She also has a couple sources of pretty solid reliable passive income, and has a lot of family money from some shared investments and properties which is doled out amongst the relatives frequently. I (34M) live comfortably and own a home and vehicle but work very hard, and don’t often have much “extra” money for things like trips or big purchases. 

Gf is so sweet and often buys me things for around the house as she says she does spend a lot of time there. Also has gotten me clothes (she claims she’s the one who has to look at me lol), bedding (again, she has a vested interest in this too), food, etc. I tell her this is definitely appreciated yet also unnecessary and I don’t like feeling that I “owe” someone. She insists it won’t ever be like that but I’ve just not experienced this dynamic before so I’m in uncharted waters. 
Most recently I got surprised with tickets to go to a major metropolitan area (we are from a smallish town with a low cost of living) to go see a major spectator event. Don’t get me wrong- I am ecstatic! But this is not something I would have or even could have spent my own money on. The holidays coming up make me wonder how I can reciprocate this in some way. 


Anyone else ever feel like this? What did you do or say about it?

In the relationship itself I can honestly say there are zero problems compatibility or communication wise… we’ve each met a couple of each others family members and friends, sleep overs one place or the other more nights a week than not, etc. Literally everything is dreamy but this one aspect just has me a little squirmy.",dating,t5_2qhb1,https://www.reddit.com/r/dating/comments/qlvdu6/incomewrath_disparity_and_reciprocating_gifts/
31,qlvfwe,1635949005,Can’t tell if he’s interested after first date?,"I (24f) went on a hinge date last night with a guy (27m). I had been talking to him for a few weeks last month on the app, then he didn’t respond for a while (like weeks). My last message to him was my phone number. Unexpectedly, the other day he texted me apologizing that he had gotten so incredibly busy the past few weeks he hadn’t checked the app but he just opened it and saw my number. He immediately asked me if I wanted to meet up for drinks. I told him yes and we met the next day. We had a great time, the conversation never lulled and I found that we had a lot in common. He also paid, which was nice. And he came out to my neighborhood to meet, which was also very sweet of him.

At the end of the night he walked me to my car which was very sweet as I didn’t park very close. However, I was a little thrown off because I was expecting a kiss but then he gave me a hug instead. It was extremely cold outside, so I know we both wanted to get home because we were standing in the freezing cold. I was shivering and I think he could tell. I still didn’t want to leave yet though! I was just so thrown off that he didn’t kiss me after such a good date. I hope I didn’t seem impatient by shivering and crossing my arms- I really was just super cold. 

He told me to text him when I got home so I did. I told him that I had a great time and that I had made it home. He responded saying he had a great time too. I responded a second time, saying I liked the bar we went to a lot and maybe we should do it again sometime and check out the bar next door (because when leaving our date he noted that the bar next-door looked pretty cool) and to have a good night. He then responded saying “Yes ____ is a classic” (referring to the bar we went to.) Then said he’s heard the other bar is pretty electric. Then he told me he hopes I have a Goodnight as well. 

I didn’t respond to his last message Bc it was the end of the convo plus it was super late…

And now it’s the next day. So I guess I’m confused on two things 1) why he didn’t kiss me at the end of the date and 2) why he didn’t suggest a second date either on the date or when I texted him saying we should check out the other bar next time… 

Should I just leave it for now and wait to see if he says anything else later this week? Or should I wait a couple days and message him suggesting meeting up again? I’ve took a long break from dating so I’m not really sure how to handle this. I’m busy this weekend as I’m having minor surgery on Friday lol, so I don’t wanna text him too soon. But I feel like we really clicked so I’d really want to see him again next week. But I’m just kind of confused on whether or not that’s what he wants.",dating,t5_2qhb1,https://www.reddit.com/r/dating/comments/qlvfwe/cant_tell_if_hes_interested_after_first_date/
32,qlvnqi,1635949656,Hello please am new here and I need a serious relationship who is truthful and ready to take care of me,[removed],dating,t5_2qhb1,https://www.reddit.com/r/dating/comments/qlvnqi/hello_please_am_new_here_and_i_need_a_serious/
33,qlvp9m,1635949789,(My first date) Gf,[removed],dating,t5_2qhb1,https://www.reddit.com/r/dating/comments/qlvp9m/my_first_date_gf/
34,qlvwxm,1635950386,Greeting,"What does it mean when a girl say helloooo in the text ? Does it mean anything ,?",dating,t5_2qhb1,https://www.reddit.com/r/dating/comments/qlvwxm/greeting/
35,qlvxdi,1635950420,Do people split the bill when getting a room during dating?,The condition is that when those two people are not available to use their own room. Like they have roommates or live with their parents?,dating,t5_2qhb1,https://www.reddit.com/r/dating/comments/qlvxdi/do_people_split_the_bill_when_getting_a_room/
36,qlvzuo,1635950619,"He (33) said he looses his mind every time he sees a girl with short hair, even though I don't look like that.","Just before we started dating, he said that he adores girls with extremely short hair. It's a kind of a fetish. I don't look like that, by the way. And now I feel super self-conscious every time I see a girl with short haircut. Even though he treats me right and says he likes me.
During our last date he said I would look good with short haircut. I feel like he will dump me that very second when he meets someone who looks more like a girl from his fantasies. 
Is it a reason to end our relationships? I like him a lot, but I just saw a girl with short hair at the shop and started crying.",dating,t5_2qhb1,https://www.reddit.com/r/dating/comments/qlvzuo/he_33_said_he_looses_his_mind_every_time_he_sees/
37,qlw234,1635950797,I love cuddles but he snores ....:(,"I’ve (29F) been seeing someone (35M) for a few weeks now. Everything seems good so far and I really like him. 

We’re both big on cuddling and now that it’s colder, enjoy it a lot more for warmth. 

I haven’t been sleeping well the last couple of weeks anyway so his snoring didn’t bother me as much as until last night, after a really hard workout. I wanted to SLEEP! I was a little excited when he said he had some work to finish so he might not stay the night because I knew I was going to want to sleep peacefully but after sex, we ended up cuddling and by then it was too late for him to leave. He spent the night. 

I kid you not at one point I dreamt there was a ghost in my living room that was making the noise but no, it was coming from behind me from my man. 

I asked him to turn his head the other way, and he complied. Then I told him that he’s snoring and so his head the other way makes sense. But somehow, at 4 am, his head was back my way in a cuddle and I couldn’t sleep again. 

I like him so much, I want to date him but I also want to sleep when I’m next to him. If we lived together or something, this situation would be fixed by me sleeping in a different bed after a nice warm cuddle. But we’re in the dating phase - and we’re going slowly so this is going to last a while. 

What advice do you have for me? Kick him to the couch? :’D (My couch would break his back)",dating,t5_2qhb1,https://www.reddit.com/r/dating/comments/qlw234/i_love_cuddles_but_he_snores/
38,qlw8e9,1635951324,Is it really a bad idea to ask early on what kind of relationship they are looking for?,"When I use dating apps and match with a girl I like, I will ask early on what kind of relationship they are looking for. I am only interested in serious relationships, so I want to see if we're on the same page. I've been told this is a bad idea, is it really though?

On top of that, I've noticed a huge majority say they are looking for something casual or nothing serious when asked, so I will tell them I'm only looking for something serious and wish them the best. However majority of the time they will start saying they'd actually like to try something serious, but at that point I sort of assume they aren't being honest, am I in the wrong for assuming that? I'm fine with playing the numbers game and only going for women who say that want something serious from the start to not waste time, is that a bad play?",dating,t5_2qhb1,https://www.reddit.com/r/dating/comments/qlw8e9/is_it_really_a_bad_idea_to_ask_early_on_what_kind/
39,qlwb7r,1635951558,"The painful feeling when two love each other, but cannot be together. Do you have a similar story? What happened to that relationship?","Welp I guess here’s my story. My mind is all torn up on this topic, I have so many conflicting feelings. But one thing I know is.. I’ll never love someone like him again. And nobody will love like him again.

It was November 2016. We were highschool juniors, I was a mostly depressed loner kid who was so done with well, everything. This was before I met him. I can’t call when the first time we met, but I think a Japanese phrase— “koi no yokan” explains this beautifully; it’s when two people meet and you know that you two, will eventually fall in love with each other. This is exactly how I felt.. Fast forward nearly two weeks (at this point we were talking in school and text as well) I was running some errands for my mother, and we just randomly encountered each other. Spending the day together, he kissed me all of a sudden. And that was it—this was how the most beautiful, magical fairytale 2 years have begun. I always reminisce of the time when we got bored in our prom so we ran away to play bowling when I see teenagers playing it… we both hated prom but our family kind of forced us to go. And many, many more overwhelmingly beautiful memories he gave to me.

I thought it would last forever, I really did. Until the day we were separated to go different colleges. 2 months passed before it was obvious this wasn’t working. How can it work when we’ve spent two long years together, almost seeing other every single day?

I (kind of forced myself to) date people, tried to enter into relationships but nothing was what we had. A couple failed and toxic short living relationships later I decided to abandon it all together. But, I knew that he himself was dating some others and he seemed happy—so I didn’t want to bother him. Maybe he was as miserable as me but I genuinely hope he isn’t. This feeling.. when your heart is longing for someone yet they aren’t there, maybe they have moved on already. It slowly burns your soul away, it sometimes get so unbearable that you desperately want to talk about it but the only person that can understand and give comfort, is not there anymore. Some days it gets so unbearable, you start to cry out of desperation. Thinking maybe someone will come and heal that wound, but knowing deep down that someone doesn’t exist.

Anyway now that feelings are out of the way—back to what made me begin to write this message. It was my birthday a couple days ago, and he called me to celebrate my birthday. To that point we’d chat occasionally but not so often. Well we talked about everything for about 5 hours. I know that he holds similar feelings for me. He admitted too that he never had found someone like me and that he doubts that he’d ever find, and here he was again, the human who I fell in love with, my best friend was there. I don’t even know, it was so beautiful so relaxing that I might have dreamt it lol. We really didn’t talk much after that.

And I desperately want to just call him and tell him everything, that we aren’t those teenagers anymore, that we can if we try, make it work, we are seniors, graduating next semester and have the chance, to possibly go to same city for graduate programs. I’m so confused and torn. I don’t want to distract or bother him so for now, I’m just holding my feelings back.

I’m not writing this post for advice on what to do, but rather I’m curious—did you have a similar relationship? What is your story? How did it end? 

Thank you in advance, beautiful strangers online. &lt;3",dating,t5_2qhb1,https://www.reddit.com/r/dating/comments/qlwb7r/the_painful_feeling_when_two_love_each_other_but/
40,qlwetx,1635951823,Advice,My boyfriend cheated on me. Am I wrong for making an only fans and Snapchat premium as revenge?,dating,t5_2qhb1,https://www.reddit.com/r/dating/comments/qlwetx/advice/
41,qlwllj,1635952372,Pig butchering scam (sha zhu pan) - attractive man/woman convinces you to use fake trading site,"You can search for “pig butchering scam” or “sha zhu pan” in r/Scams for more information. A detailed summary of this scam can found in this post: 
https://www.reddit.com/r/Scams/comments/na8oax/asian_guygirl_from_online_dating_mentors_you_to/?utm_source=share&amp;utm_medium=ios_app&amp;utm_name=iossmf

Be careful out there!",dating,t5_2qhb1,https://www.reddit.com/r/dating/comments/qlwllj/pig_butchering_scam_sha_zhu_pan_attractive/
42,qlwn95,1635952514,21[F4M] hi I am looking for some new friends and someone want To trade On SC: taniaschindler,[removed],dating,t5_2qhb1,https://www.reddit.com/r/dating/comments/qlwn95/21f4m_hi_i_am_looking_for_some_new_friends_and/
43,qlwnlx,1635952544,Free Netflixe for year only USA !,[removed],dating,t5_2qhb1,https://www.reddit.com/r/dating/comments/qlwnlx/free_netflixe_for_year_only_usa/
44,qlwp3u,1635952663,Everything happens for a reason,The age old advice of everything happens for a reason always seems to happen for someone else's reason. Like all my exs dumped me and found there forever SO during there time with me or right after. They are building strong life long relationships while I keep geting rejected and dating less compatible people.,dating,t5_2qhb1,https://www.reddit.com/r/dating/comments/qlwp3u/everything_happens_for_a_reason/
45,qlwp6u,1635952671,Is it hard to find a long-term relationship in America?," I want to find my own long-term relationship of more than 36M in the United States this year, because I am too lonely and boring.",dating,t5_2qhb1,https://www.reddit.com/r/dating/comments/qlwp6u/is_it_hard_to_find_a_longterm_relationship_in/
46,qlwpss,1635952723,"32/F [friendship/relationship] Looking for a true friendship, or a serious relationship","Hello everyone, I am from Asia and now I am in the US. I have been here for 3 years and hope to make more friends

&amp;#x200B;

Living in a strange country is difficult at first and I hope to meet more people from all over the world

&amp;#x200B;

I love to travel and want to go to Europe in the future

&amp;#x200B;

I hope to meet more friends from all over the world here

&amp;#x200B;

Send me a message",dating,t5_2qhb1,https://www.reddit.com/r/dating/comments/qlwpss/32f_friendshiprelationship_looking_for_a_true/
