,id,created_utc,title,selftext,subreddit,subreddit_id,url
47,qlwsht,1635952939,Catfish location - anybody gets this?,"Guy says he is from (A city) on his profile but after talking he says he is actually from B city which is more than 100kms from me. Is this a red flag? He told me on the first day of talking and said it is because he is from a small town with no single women his age....and that he has planning moving to the city soon. 

Help. How are we even supposed to date then lol",dating,t5_2qhb1,https://www.reddit.com/r/dating/comments/qlwsht/catfish_location_anybody_gets_this/
48,qlwu8d,1635953088,What do I do?,"I (23F) am dating a man(23M) , me and him have been going on dates for 7 months. On our first date, he has made it known that he is dating another person. occasionally, I do still ask if he likes me and he still says that he does. I asked him ""how am i supposed to know what i mean to you if you never tell me"" and he says ""I shouldn't have to"". even when I ask him how does he feel about me he never wants to tell me. I'm slowly losing confidence in being with him, and feel insecure. Yes I understand that dating comes with people who do mostly multi dating. I told him that at this point it just feels like polygamy and I want the love to myself. He wants me to stop worrying a lot, stop worrying about the future and constantly says he likes me and just wants for me to chill out. He also says that I try to push him away because I force myself to believe he doesn't like me but in my mind if its over 6 months and you still are dating somebody else then I am lacking something. It feels like I'm lacking something and every time I talk about how I feel about him, he says I'm too sentimental. It feels like I'm slowly backing away because Sometimes I don't feel good enough, why would it take so long just to only want to be with me.",dating,t5_2qhb1,https://www.reddit.com/r/dating/comments/qlwu8d/what_do_i_do/
49,qlwz8j,1635953493,"Fun, flirty bets for a first date?","So my dating app match and I are going for our first date and we made a bet to see who would blush first (things are going pretty well over text).

If I won, he has to draw something for me. If he won, he asked me to do something special that I've never done on other dates. Any ideas for something light hearted and flirty?

Thanks in advance!",dating,t5_2qhb1,https://www.reddit.com/r/dating/comments/qlwz8j/fun_flirty_bets_for_a_first_date/
50,qlx0m6,1635953601,What qualities should I improve to get in the game?,"I am m23,a computer science engineer,who has recently graduated and right now I am in search for a job.But my question is not related to this.

I have been a basic guy my whole life,not so good in sports and academics,seen my family facing financial hardships my whole life and I have also seen them facing like those hardships like a champ.I have never been in a relationship, I've had crushes on girls since my teenage but never pursued them in fear of getting rejected.My friend circle was filled with boys who didn't have to face any problem related to money,they have been in various relationships and at some point I started to envy them because of that.

But life goes on,right.So I've decided to change my life and work on my body and my personality.

So Advice and insights related to this matter would be appreciated.",dating,t5_2qhb1,https://www.reddit.com/r/dating/comments/qlx0m6/what_qualities_should_i_improve_to_get_in_the_game/
51,qlx7dt,1635954136,Should I be angry that my private messages to her aren't private at all?,"This girl and I have been chatting a lot through Facebook messenger lately and we've been saying a lot of things that I wouldn't want spread around and just this night, I started receiving all these laughing reacts to a bunch of my recent messages that I sent her. I asked her what was so funny and she told me it was just a messenger glitch. 

What I think happened was she handed her phone over to someone to read through all my private messages and they thought it was hilarious enough to laughing react to them all.

Not sure what I should do from here? Should I be angry and confront her for just letting whoever read our private messages? should I just stop talking to her since this is a breach of trust in that what I said was meant to be between just me and her? Or is there any truth to this glitch that she mentioned?",dating,t5_2qhb1,https://www.reddit.com/r/dating/comments/qlx7dt/should_i_be_angry_that_my_private_messages_to_her/
52,qlx9n0,1635954314,Met a giy,I met a guy who I’m really into and we’re both looking for a relationship and he’s said he’s looking to date me. I’ll snap him good morning but he won’t answer. If I double snap him he usually answers. Should I just wait for him to snap me first after the good morning snap?,dating,t5_2qhb1,https://www.reddit.com/r/dating/comments/qlx9n0/met_a_giy/
53,qlxkgj,1635955155,how do i know if i’m texting her too much? i really don’t want to be too clingy and scare her off,i went on a few dates with this girl and we’ve hooked up a few times. it seems like she really likes me but i’m so terrified of being too clingy. the only times i’ve really texted her have been to make plans. i want to text her more but i’m so scared. how do i know if it’s too much?,dating,t5_2qhb1,https://www.reddit.com/r/dating/comments/qlxkgj/how_do_i_know_if_im_texting_her_too_much_i_really/
54,qlxn5j,1635955328,Dating and Meeting People Online,"So I met this really nice girl and we both really liked each other online. We went out on a saturday for our first date for coffee and everything seemed to go well. We hung out for three hours just walking and talking and at the end I walked her back to the car and gave her hug. Personally it seemed like the both of us are trying to take things slow. What I mean is, like kissing and stuff like that. It’s more of were just trying to get to know one another before we dive all into this person. Also thought you should know that we are both Christians so we both believe in waiting before marriage. And she is 18 and I am 20, so we are young. 

Anyways, I told her after the date we should get back together again later next week. I didn’t call or text her because I was swamped with school and work. She then texted me in the middle of the week on a wednesday asking how I was doing. I texted her back and told her i was sorry for not getting back to her and told her I was just busy and stuff. We then planned another date for the next week on a Monday to see a movie.

So we went on our second date and saw the movie and had a great time. We talked after and we were both still passive about one another. I put my arm around her on the date and she was cool with it. But we talked after and I asked her if she needed to go home because it was around 8 o’clock at night, but she told me she could stay out longer with me. So then we went out to mcdonalds and got some food and we still had fun. After we went our separate ways and just gave a hug to each other. After I texted her later that night to see if she was okay and that she made it home safely and she did. I told her I had a great time and I look forward to Sunday with her. She said she had a great time as well and can’t wait either. 

&amp;#x200B;

So far this story sounds good and your probably wondering where this is going, now let me get to the part with why I’m questioning the whole thing. 

So we didn’t talk the rest of the week and she told me she was getting a new shift on our second date, that she was working night shifts. So that means her sleeping schedule is garbage because she works from 10 at night to 7 in the morning. So I texted her Saturday and asked how she was doing at work and she quite dry with her response say it was alright. I then asked if we were still a go for Sunday or are you to busy for that day. She told me she doesn’t think it’s going to work tomorrow and that’s all she said. And I was left scratching my head wondering if shes going be like, “But next Friday works!”

She didn’t really ask to reschedule, I just said ok and nothing more after that. We haven’t talked for about 4 days now and she hasn’t rescheduled with me or even texted me. I only have her snap and I’ve been posting Snapchat stories and she’s always the first to look at it. Not crazy or anything, but I thought it was interesting. 

So my question is, should I wait for her to text me back? Or should I text her and ask to go out again on a third date. Like I said, we both had a great time and she even told me over text she can’t wait. So what do I do?",dating,t5_2qhb1,https://www.reddit.com/r/dating/comments/qlxn5j/dating_and_meeting_people_online/
55,qlxzeh,1635956232,Situationship breakup rematched on hinge,"Curious to hear people's thoughts. A few months ago, a situationship ended on decent terms. I still think about him, and miss what we were growing. We are still connected on social media, but instead of reaching out, he sent a match on hinge. 

He originally wanted a relationship, but I was not ready. 

What would you do? Make fun and send him a screenshot, wait for him to actually reach out? I think something could be great between us, but not sure what next step should be.",dating,t5_2qhb1,https://www.reddit.com/r/dating/comments/qlxzeh/situationship_breakup_rematched_on_hinge/
56,qly9fm,1635957004,If you aren’t exclusive with someone yet is it bad to still have dating apps and still use them?,"This will be my third date with this girl and we seeming to mesh well together but I feel until we actually say we are exclusive to each other, I can still explore the dating apps or is this a no no?? Would appreciate all perspective but mostly from woman. Thanks in advance!!",dating,t5_2qhb1,https://www.reddit.com/r/dating/comments/qly9fm/if_you_arent_exclusive_with_someone_yet_is_it_bad/
57,qlyimq,1635957724,Anyone females in Essex UK looking to date? Inbox me ;),Anyone females in Essex UK looking to date? Inbox me ;),dating,t5_2qhb1,https://www.reddit.com/r/dating/comments/qlyimq/anyone_females_in_essex_uk_looking_to_date_inbox/
58,qlym7p,1635958001,Sex should be valued?,I want sex but I feel guilty hooking up so I'm trying to date. Is sex just sex or should I be valuing it more? Does dating actually make sex more meaningful?,dating,t5_2qhb1,https://www.reddit.com/r/dating/comments/qlym7p/sex_should_be_valued/
59,qlyu9u,1635958625,How do you get over making someone lose all their feelings for you?,"I met a guy on tinder a few years ago. We talked for a few weeks and went on a date. He lived any away from me and said that he usually doesn't drive that far to meet someone but that there was something about me. We held hands and made out on the date.

We had really good chemistry in person and over text. We told each other that we drove each other wild and he told me that he was falling for me, was obsessed with me, could see himself spending his life with me, and that he might be my perfect match.

But I got a little too clingy and needy when he said that it seemed like I didn't know if I wanted to be with him because I raised some concern about not knowing if we'd be sexually compatible because he seemed more sexual than me. He said that I acted crazy and made him lose all his feelings for me, and that he'd have to have sex with me to see if he could get them back. I didn't want to have sex with him so soon, so we went our separate ways.

I've tried to move on since then, but I'm finding it really difficult. It just really hurts to know that I had a really great guy who said that he was falling for me and obsessed with me, could see himself spending his life with me and might be my perfect match, and then I made him lose all those feelings he had for me and I wouldn't let him have sex with me to see if he could get them back.

I've gone on a few dates since then but I haven't found anyone that I had that same chemistry with, someone who liked me as much as he did, and I definitely haven't found someone as attractive as him. I really liked him and I pushed him away, and I've felt awful since then and just can't get over it.",dating,t5_2qhb1,https://www.reddit.com/r/dating/comments/qlyu9u/how_do_you_get_over_making_someone_lose_all_their/
60,qlywqp,1635958810,Why would a guy text you only to reply 1-2 days later?,"So I (F/27) have been on a first date with a guy (M/26) and it went well. He pretty much texted me right after (consistently) and then got a little busy with work. But he would still shoot a message apologizing for his late response etc. I told him that he doesn’t need to apologize if he got tied up in work. Anyways, we have been trying to set up a second date and he is the one initiating it. However, he shoots me a message asking me which days im available and starting a whole convo… but then replies 1-2 days later. Yesterday he did the same, started a whole convo and I replied, I haven’t received an answer since then. This has happened a few times now and I just don’t understand why he would text me in the first place only to not reply….. although I know he’d reply… but idk",dating,t5_2qhb1,https://www.reddit.com/r/dating/comments/qlywqp/why_would_a_guy_text_you_only_to_reply_12_days/
61,qlyzge,1635958988,Met the woman of my dreams and her daughter law wrecked our relationship.,"I guess this is a cathartic post because nothing can be done.

&amp;#x200B;

8 weeks ago I was out on a Friday night in a bar I sometimes play music at. I wasn't playing that night. Just hanging out. 

&amp;#x200B;

I met a gorgeous woman there. We hit it off right away. She was monstrously attractive to me. She was a tad drunk but not overly so and she was sweating and I could smell her pheromones. She smelled so damn good Inwas entranced with her and apparently her with me. She dropped the guy she was talking to and came over to me and we spent the whole night together. She wanted me to take her home but I never do that on the first night I meet a woman as a test. I want to make sure they really like me and it's not just alcohol so I dropped her off and said I would text her next day.

&amp;#x200B;

That weekend and week we texted back and forth and chatted in the phone a couple times and we were so compatible it was mind blowing. By the next Friday we were so excited to see each other. We played it off like it was just 2 friends hanging out but that lasted about 3 drinks before we were acting like a couple and generally having a blast. Took her back to my place and we had the most mind-blowing sex imaginable. That pretty much sealed the deal. We agreed that while we weren't exactly exclusive we wouldn't sleep with other people for a minute and see where things went.

&amp;#x200B;

The next Friday we meet in same bar, missing each other all week. We got drunk, went home and never got out of bed all weekend. We bonded in every way a human can. 

&amp;#x200B;

The next weeks flew by. Picnics in the park, her coming to shows and seeing me play music. Every weekend we got deeper into each other. Completely smitten with each other.

&amp;#x200B;

So 2 weeks ago she asked me if I wanted to spend the weekend at her place so I could meet her mom, son and daughter in law and their 5 month old baby boy. Sure!

&amp;#x200B;

We had a great time together at her place, partied down all weekend and in Sunday her family came over. We all had a great time. I brought out my harmonicas and played for the baby who was completely entranced by my performance and the night ended with me going home having hit a home run with her family.

&amp;#x200B;

Then the trouble started. That Tuesday she called me for our usual nightly phone date and she started asking me strange questions asking if I ever was abusive. Of course not! My exes may have a lot of negative stuff to say about me but I know for a fact none would never claim I was abusive. Then I heard a phrase I was going to hear a lot over the next couple weeks. ""My daughter in law says..""

&amp;#x200B;

I was ""too perfect"", "" too kind"",""too nice"", ""45 and no kids/never married? Red flag!"", ""No visible flaws"",""musician out too much"", "" moving too fast"", ""something not right about him"". She showed her articles about men who are sweet and kind and generous to sucker the women in before becoming monstrously abusive and violent.

&amp;#x200B;

I had worked very hard to build trust and safety for her and all my work was being undermined. I googled my court records and showed her I had no violence in it. A few traffic tickets and a 12 yr old pot possession charge. I explained I was just a typical "" nice guy who finishes last"" and I just got lucky with her. But I could tell her trust was wavering.

&amp;#x200B;

Well Halloween weekend came and she was distracted all weekend. I knew what the problem was and tried to show her Inwas sincere. I took her to my childhood homes and showed her around town and gave her a moderately priced necklace. Nothing fancy, just a token. Things were otherwise pretty good. We planned for my birthday on the 2nd of Nov. I hadn't had a steak in months and I wanted to go to local steakhouse and eat. 

&amp;#x200B;

So 1st comes next day and we're texting at work and everything is fine. That night when she called me for our nightly phone date she's in tears and asks me if I know some woman. Nope, never met her. 

&amp;#x200B;

""Well she seems to know you."" and goes into some crazy tale that I supposedly dated this woman in 2007 and became violent and abusive towards her and her kids and her brother tossed me out and I stalked her for weeks. 

&amp;#x200B;

I was completely shocked. I said I never met this woman I was with another ex in 2007 which she knew. She said the woman was the mother of a friend of her DIL.

&amp;#x200B;

I was crushed. I don't know this woman from anywhere and at worst she MIGHT have been a one night stand I ghosted the next day and forgot. But I certainly never acted like that. I had a clean record what more can she want?

&amp;#x200B;

So she said her DIL said in light of this ""evidence"" she cannot trust me around her baby and she would need to make a choice between the baby and me. 

&amp;#x200B;

Gf said she hated doing this to me but our relationship ""felt off"" and she just couldn't help wondering if I might be that way and her grandbaby was too important to take chances with and she decided she shouldn't see me anymore.

&amp;#x200B;

I was crushed! I told her that all I ever did was bring love and joy into her household, never gave even a hint of violence. Never even showed the capacity for it. It didn't matter she said, her DIL and son will never accept me and her family is close and their opinion matters and even though it's cruel, it's unfair and wrong to hurt me like this it had to end.

&amp;#x200B;

I always said if the day came she asked to not see me anymore I would respect it and said goodbye and hung up. Then cried over my broken heart.

&amp;#x200B;

I gave her a day to process and texted her asking if she was sure about this and she stayed firm. Her kids would never accept me and she was firm. I told her she didn't dodge a bullet breaking up with me, just badly hurting a generous and soft hearted man who only had the best intentions. She said she was sorry to hurt me was firm in her decision.

&amp;#x200B;

So I lost the greatest woman I met in over a decade and I'm devastated by it. I did nothing wrong and never met this other woman. I just don't understand why this happened to me when I was nothing but good and kind and sweet and why did that work against me?

&amp;#x200B;

So I spent my birthday in a bar with a buddy and dropping tears in my beer. Sure sux to be me right now.",dating,t5_2qhb1,https://www.reddit.com/r/dating/comments/qlyzge/met_the_woman_of_my_dreams_and_her_daughter_law/
62,qlyzu4,1635959011,Had a great second date with a girl last weekend. Should I see her again this week?,"We walked around a mountain and she invited me over to her place to sleep over. It's been about 4 days since I saw her, and am thinking about meeting her this weekend but at the same time I'm pretty busy with school. We don't text often, only to schedule another day to meet up. Should I see her again this weekend, or the next ?",dating,t5_2qhb1,https://www.reddit.com/r/dating/comments/qlyzu4/had_a_great_second_date_with_a_girl_last_weekend/
63,qlz2if,1635959204,Should I go for it?,[removed],dating,t5_2qhb1,https://www.reddit.com/r/dating/comments/qlz2if/should_i_go_for_it/
64,qlz3w3,1635959305,guys wtf i (20m) just found out my boyfriend is gay,[removed],dating,t5_2qhb1,https://www.reddit.com/r/dating/comments/qlz3w3/guys_wtf_i_20m_just_found_out_my_boyfriend_is_gay/
65,qlz4rq,1635959369,guys wtf i (20m) just found out my boyfriend is gay,[removed],dating,t5_2qhb1,https://www.reddit.com/r/dating/comments/qlz4rq/guys_wtf_i_20m_just_found_out_my_boyfriend_is_gay/
66,qlz5f6,1635959415,"24F, never been on a date or had a boyfriend","hi everyone, i’ve never been on a date or had a boyfriend and i’m worried that the lack of romantic attention in my formative years has really messed me up. i’ve liked boys during school/university, but nothing has ever come of it and i’ve been rejected a few times too which obviously dashed my confidence. 

i’m at the point now where i think about it a lot and would love a significant other to share things with but i’m genuinely concerned it won’t ever happen for me! i know people always say , you’ll find the one but when you haven’t ever had a boy knowingly like you, it does seem like it never will happen. 

i don’t think i’m really ugly, i’m kinda chubby but i’m cool!! i have amazing friends, a great job and a lovely family, where am i going wrong? dating apps suck and meeting people in person just doesn’t seem to be a thing anymore…",dating,t5_2qhb1,https://www.reddit.com/r/dating/comments/qlz5f6/24f_never_been_on_a_date_or_had_a_boyfriend/
67,qlz6d1,1635959490,I love you by accident?,"So in the throws of passion, I accidentally said I love you instead I love your body. My new girlfriend was saying it and I tried to say the same thing. We didn't really talk about it for a few weeks. Until a day ago. She asked me what I ment with that comment.  I told her the truth but I told her that I only want her and no one else that I'm extremely into her. 

Did I mess up bad? I really like this woman and we've been dating for about month and half. I just move slow with the L word",dating,t5_2qhb1,https://www.reddit.com/r/dating/comments/qlz6d1/i_love_you_by_accident/
68,qlz981,1635959709,Dating depressed girl,"Hi guys! I need tips or advice what to do.. I am (M) dating a girl i specially like for 3months now, but i think she is depressed.

She texts me a lot, not just random memes, some deep stuff too, we talk at phone like 3-4hours/day atleast once a week so i think she likes me.. But.. She has flaked me/cancelled planned dates days before couple times now in row. She has some family issues, school issues, trust issues (been in a violent  relationship couple years ago). She is just mentally broken. Today she cancelled our weekend plans again because she ""may have family things or then just too tired"" she has talked me about how mentally tired she is right now..  I did ask her is this really about bad time or do you just not want to see mee. She did answer in lighting speed that she likes to see me..

I really do not know what to do. Am i too understanding? I am overall very understanding person and good guy.

 I have some mixed feeling does she really like me or does she just need time right now. All advice is welcome, but do not really need those ""dump her"" comments.. this is not about that i do not have choice to choose who to date, it is about who i want to date.",dating,t5_2qhb1,https://www.reddit.com/r/dating/comments/qlz981/dating_depressed_girl/
