,all_awardings,allow_live_comments,author,author_flair_css_class,author_flair_richtext,author_flair_text,author_flair_type,author_fullname,author_is_blocked,author_patreon_flair,author_premium,awarders,can_mod_post,contest_mode,created_utc,domain,full_link,gildings,id,is_created_from_ads_ui,is_crosspostable,is_meta,is_original_content,is_reddit_media_domain,is_robot_indexable,is_self,is_video,link_flair_background_color,link_flair_css_class,link_flair_richtext,link_flair_template_id,link_flair_text,link_flair_text_color,link_flair_type,locked,media_only,no_follow,num_comments,num_crossposts,over_18,parent_whitelist_status,permalink,pinned,pwls,retrieved_on,score,selftext,send_replies,spoiler,stickied,subreddit,subreddit_id,subreddit_subscribers,subreddit_type,thumbnail,title,total_awards_received,treatment_tags,upvote_ratio,url,whitelist_status,wls,removed_by_category,post_hint,preview,author_cakeday
63,[],False,Jungle_Peasant,,[],,text,t2_bj99mr8,False,False,False,[],False,False,1629625415,self.dating,https://www.reddit.com/r/dating/comments/p99nw4/how_to_feel_better_after_all_this/,{},p99nw4,False,True,False,False,False,True,True,False,#00a6a5,dating,"[{'e': 'text', 't': 'Support Needed'}]",fd9c03b8-a1ce-11e7-9172-0e8c9f9ecf4c,Support Needed,dark,richtext,False,False,False,3,0,False,all_ads,/r/dating/comments/p99nw4/how_to_feel_better_after_all_this/,False,6,1629625426,1,"(If you wanna skip to the ""all this"" part, you can go to down to the three squiggly lines).

Almost two years ago I got interested in trying to find a possible partner by playing online games with random people and seeing how it felt. For a while it was just me helping out strangers but then one time this person texted me back and we hit it off. I was from Finland, she was from Denmark.

We started playing together and because of Covid we did this like every day for months and grew closer. Eventually flirty jokes turned into just flirting and it went to the next level. We started video chatting and things went really well for months. This was probably the best period of my life and I loved it 🥰

Then something happened that really shook things up. A couple of times she completely rejected me over some very little thing and said stuff like ""I'll never love you again""... But afterwards she said she was sorry and was more affectionate than before. But after she got over her thing, things went on just fine. 🤔

(This is about 8 or so months after we first met now): She had even asked her family what they though if she was with a younger guy from a different country, joking about living together, and we said ""I love you"" to each other all the time. I could tell it was definitely some sort of a romantic relationship now ❤

We started seriously talking about physically meeting. We agreed on me coming to stay at her apartment for a week in Denmark. So there I went and got on a plane. When I landed there I literally couldn't stop shaking ✈

~~~

We met and went to her place, both burning to get *close*, if you get my hint. I'll try to summarize basically what happened: I had troubles performing and it seriously fucked me up since I couldn't do what we both thought we were gonna do. She assured that it was okay and that there is time 😐

First couple days went okay, but this problem persisted within me. I just couldn't feel anything and I felt like I was letting her down. By the end of the week I realized I had let it get me down too much and apologized, she promised it was okay and that she still had a good time. I flew back home feeling really bad but still hopeful since she had assured me. We hung out as usual for a week or so and it seemed all normal.

Then suddenly... She went completely quiet for a couple of days and I wondered what the hell was going on. Afterwards she texted me with one of her ""I'll never love you"" meltdowns again... The moment when my heart sank was when she said that she had been just thinking for herself for the past couple of days and that she didn't think our thing could work 😟

This came out of nowhere and I had literally no control over myself. I had a giant panic attack. We still hung out after but the mood was bad and I was just trying to figure out what had happened. She gave me every single excuse but they didn't seem genuine to me. It continued like this for the following weeks, with me proving to her over and over again that we can still be friends. It was extremely painful especially because we had good times and she promised we could remain friends, but she always seemed to forget it later.

Then came New Year's Eve... We were just talking and my heart sank again. She texted me ""I have to tell you something but I think it will hurt you"". Then she revealed to me that she had been seeing some other guy since like a week after I visited her 😞

After this it was just months of extreme pain and confusion for me. Then came the day where I had to cut the contact. She kept blaming everything on me, even things that never happened. Every time she had a different excuse for it, ""you don't look good enough"", ""you are too young""... (she had always told me age was no issue). I had to stop talking to her and she was saying we couldn't be friends anyway...

---------

So... What the hell do I do now? I feel like it ended so suddenly that I never processed it. To this day (like 8 months after) I still lose sleep over thinking about it. I just don't understand if some of the thousands of excuses she said were actually true... Am I actually too ugly? Is there something wrong with me? 😟

All I know after the fact is that she definitely cheated on me. Not just the final time but she slept with some of her friends way before that, while she was having one of her meltdowns. She even boasted to me how she fucked her friend when she was just supposed to help him move in.

I didn't realize it until after this whole thing that she had constantly manipulated my feelings by sleeping with other guys, her meltdowns and by blaming me for things I wasn't guilty of.

I have lost hope of dating after months of being on dating apps since there is literally no-one my type on there, only gym freaks, and I'm rapidly also losing hope of making friends again (that's a whole another story). I can't trust people especially in dating since all the promises made to me were broken and I was cheated on and manipulated. What should I do? 🙁

Btw, if you read the whole thing, I wanna offer you a genuine hug 🤗 I miss hugs, hah...

(This is longer than I expected, whoops.)",True,False,False,dating,t5_2qhb1,967582,public,self,How To Feel Better After All This?,0,[],1.0,https://www.reddit.com/r/dating/comments/p99nw4/how_to_feel_better_after_all_this/,all_ads,6,,,,
64,[],False,homelessfish22,,[],,text,t2_bym63ygm,False,False,False,[],False,False,1629625626,self.dating,https://www.reddit.com/r/dating/comments/p99p9f/life_lesson_do_the_opposite_of_what_she_says/,{},p99p9f,False,True,False,False,False,True,True,False,#ffd635,dating,"[{'e': 'text', 't': 'Giving Advice'}]",7bca2c58-4211-11e5-9ecb-0e60d8112001,Giving Advice,dark,richtext,False,False,True,11,0,False,all_ads,/r/dating/comments/p99p9f/life_lesson_do_the_opposite_of_what_she_says/,False,6,1629625637,1,"Had a second date with a girl. Kissed on first date but didn’t want to go further until we had more dates.


Left her in the car for 20 minutes unintentionally, had something to sort out with my family inside.


She complained and demanded I take her home. So I took her home. 


She sent me a furious text about half an hour later but I didn’t see until the next day. She was mad at me for taking her home because she didn’t actually  want to go home, she wanted to stay out.



So there you go folks.",True,False,False,dating,t5_2qhb1,967581,public,self,Life lesson- Do the opposite of what she says.,0,[],1.0,https://www.reddit.com/r/dating/comments/p99p9f/life_lesson_do_the_opposite_of_what_she_says/,all_ads,6,,,,
65,[],False,wings-legs-tail,,[],,text,t2_6xfndinn,False,False,False,[],False,False,1629625709,self.dating,https://www.reddit.com/r/dating/comments/p99psc/i_had_no_chance_right/,{},p99psc,False,True,False,False,False,True,True,False,#ea0027,dating,"[{'e': 'text', 't': 'I Need Advice'}]",19ec58c2-9f74-11e7-81a1-0e2bf15991f0,I Need Advice,light,richtext,False,False,True,17,0,False,all_ads,/r/dating/comments/p99psc/i_had_no_chance_right/,False,6,1629625720,1,"I met a guy on a party and talked to him first. I think I was flirting a little bit and he should have understood it. I invited him to my friends table and he sat with us. But I noticed he is not really interested, so later in the evening I danced with another guy (only once, but close dance). The guy i like, was looking at me many times during the party, but he didn’t make any move :-( I’m a good dancer and many people were watching me, so probably it doesn’t mean anything that he looked as well… So sad, but I had no chance, right? 
Yes, and his partner died 3 months ago. But damn, first time since two years that I liked somebody",True,False,False,dating,t5_2qhb1,967583,public,self,"I had no chance, right ?",0,[],1.0,https://www.reddit.com/r/dating/comments/p99psc/i_had_no_chance_right/,all_ads,6,,,,
66,[],False,MicahMX700,,[],,text,t2_7ppo5un6,False,False,False,[],False,False,1629625745,self.dating,https://www.reddit.com/r/dating/comments/p99q14/i_feel_there_is_only_one_way_for_men_to_be/,{},p99q14,False,True,False,False,False,True,True,False,#00a6a5,dating,"[{'e': 'text', 't': 'Support Needed'}]",fd9c03b8-a1ce-11e7-9172-0e8c9f9ecf4c,Support Needed,dark,richtext,False,False,True,44,0,False,all_ads,/r/dating/comments/p99q14/i_feel_there_is_only_one_way_for_men_to_be/,False,6,1629625756,1,"So basically I've been looking on YouTube and some parts of Reddit for a few hours. The one type of advice on here for bed if they want to be attractive to women or attractive at all is it did you ever get super buff in bulk up and stuff like that. Usually I hear this device give it to do to really aren't even that skinny I really thought he was skinny at all. But I used to go to the gym and work out regularly I still do but I kind of feel like the only way open would probably be slightly bearable to look at, if I was built like Superman or The Incredible Hulk. I would probably take steroids except for the fact that I kind of don't want to look like that, and also that could be very damaging to my body, I've put on some muscle it has some kind of physique compared to what I did about 2 years ago, not to mention, with my hobbies in the stuff that I do on a regular basis I really don't see too much use outside of attracting women why I would need I have a body like that. But I've heard some places that would don't necessarily like that, some other places where it's absolutely unacceptable to women to not be ripped. So I'm kind of at a loss here.",True,False,False,dating,t5_2qhb1,967586,public,self,I feel there is only ONE way for men to be physically attractive.,0,[],1.0,https://www.reddit.com/r/dating/comments/p99q14/i_feel_there_is_only_one_way_for_men_to_be/,all_ads,6,,,,
67,[],False,young-king-1283,,[],,text,t2_8vv6nzy3,False,False,False,[],False,False,1629626474,self.dating,https://www.reddit.com/r/dating/comments/p99uok/37_m4f_meaningful_connections/,{},p99uok,False,False,False,False,False,False,True,False,#ffb000,,"[{'e': 'text', 't': 'Tinder/Online Dating'}]",5214d2ac-61f1-11e8-8bb1-0ed15e4a39c0,Tinder/Online Dating,dark,richtext,False,False,True,0,0,False,all_ads,/r/dating/comments/p99uok/37_m4f_meaningful_connections/,False,6,1629626612,1,[removed],True,False,False,dating,t5_2qhb1,967600,public,self,37 [M4F] - Meaningful Connections,0,[],1.0,https://www.reddit.com/r/dating/comments/p99uok/37_m4f_meaningful_connections/,all_ads,6,moderator,self,"{'enabled': False, 'images': [{'id': 'b46sDSn0Wx6ykmc6AQxVFJsr9Tv7de9kOTBhX_zf3R0', 'resolutions': [{'height': 56, 'url': 'https://external-preview.redd.it/eAC0vwzauQxTyY1b5rttuI_ktE4LOkJ3uk1qHJvhimo.jpg?width=108&amp;crop=smart&amp;auto=webp&amp;s=572779b283385fb5061d5c96e4799231e981a254', 'width': 108}, {'height': 113, 'url': 'https://external-preview.redd.it/eAC0vwzauQxTyY1b5rttuI_ktE4LOkJ3uk1qHJvhimo.jpg?width=216&amp;crop=smart&amp;auto=webp&amp;s=219d8cb82b99058e262a207f15e55c15a9cbb767', 'width': 216}, {'height': 168, 'url': 'https://external-preview.redd.it/eAC0vwzauQxTyY1b5rttuI_ktE4LOkJ3uk1qHJvhimo.jpg?width=320&amp;crop=smart&amp;auto=webp&amp;s=d852898cd5c3157178e3936f9dc9f5817418940b', 'width': 320}], 'source': {'height': 315, 'url': 'https://external-preview.redd.it/eAC0vwzauQxTyY1b5rttuI_ktE4LOkJ3uk1qHJvhimo.jpg?auto=webp&amp;s=3f6012830e45e561a074de4895e6691e9d80c190', 'width': 600}, 'variants': {}}]}",
68,[],False,Dirtyside_69,,[],,text,t2_cikjsy76,False,False,False,[],False,False,1629627544,self.dating,https://www.reddit.com/r/dating/comments/p9a1k4/i_want_connections_but_im_only_looking_for_fwb/,{},p9a1k4,False,True,False,False,False,True,True,False,#ffb000,,"[{'e': 'text', 't': 'Tinder/Online Dating'}]",5214d2ac-61f1-11e8-8bb1-0ed15e4a39c0,Tinder/Online Dating,dark,richtext,False,False,True,7,0,False,all_ads,/r/dating/comments/p9a1k4/i_want_connections_but_im_only_looking_for_fwb/,False,6,1629627555,1,"This is my first time being single since I’ve been a teen (M34). I’m not looking for ONS or just a hookup but I’m also not looking for long-term on any dating sites. 

What do women prefer, flirty small chatter for a day or two before me saying I’m looking for a NSA partner, say it in my profile, or after grabbing a drink? 

I don’t want to come off as I’m only looking for sex to turn off even more swipes but I really only want someone that wants to grab a drink here and there and basically hookup. I feel like my life is good, I have a great job, I’m busy every weekend so I don’t want to take care of someone else’s needs right now but my life is severely lacking in the intimacy department and I’m still young so not having sex feels really unhealthy to me lol.

One reason I’m really interested in women that are in ENM and polyamorous relationships.",True,False,False,dating,t5_2qhb1,967616,public,self,I want connections but I’m only looking for FWB,0,[],1.0,https://www.reddit.com/r/dating/comments/p9a1k4/i_want_connections_but_im_only_looking_for_fwb/,all_ads,6,,,,
69,[],False,turtlelevelslow,,[],,text,t2_10r0bj,False,False,False,[],False,False,1629627804,self.dating,https://www.reddit.com/r/dating/comments/p9a3bs/how_do_i_accept_that_my_face_is_less_than/,{},p9a3bs,False,True,False,False,False,True,True,False,#ea0027,dating,"[{'e': 'text', 't': 'I Need Advice'}]",19ec58c2-9f74-11e7-81a1-0e2bf15991f0,I Need Advice,light,richtext,False,False,True,8,0,False,all_ads,/r/dating/comments/p9a3bs/how_do_i_accept_that_my_face_is_less_than/,False,6,1629627815,1,"I understand that the main rules are 

1. Be attractive 
2. Don’t be unattractive 

I be been working on myself for awhile and I think I have a relatively decent life. I own my own condo, I have a awesome newer car, I’m getting promoted in the coming weeks, I have a cat and a dog at home and I go to the gym 4 times a week. 

For the longest time I’ve tried really hard to be attractive by having goals and by going to therapy to keep my mind from going all over the place. The hardest part has always been that I am not facially attractive. No matter how much my body looks, my face knocks me down a few pegs. I’m absolutely good at making sure I dress well, smell good, my hairs cut and nicely styled and that I am always respectable and can take rejection relatively well. 

The problem is that I still have an issue where I can’t approach women at bars or social settings to chat or flirt. Because I’m afraid that I’m simply too unattractive to approach them and that if I do then they’ll think I’m weird. I’ve slowly tried to make small talk at bars but I still feel like my face is honestly getting in my way, I always think that because I’m not congenitally attractive that they’ll think I’m weird or even stupid for even trying. Because of that I’ve usually never approached anyone at bars, on top of that I almost have no idea what to say or how to keep a conversation going because I’m always thinking that they think an ugly guy is trying to hit on them. 

I really need to accept that my face can’t change and idk how to psyche myself up to actually approach and talk to women. Because I’m at a point in my life where I absolutely need to get over this hump. I’m too old to still be worrying about this stuff but yet it’s still in my head that I’m competing against all these other attractive men at the bar. On top of that online dating hasn’t been very good to me either, since I know a majority is based on looks, just going to the subreddits and seeing the success of some guys makes me think that I absolutely have no shot against the competition and that I’m really playing a losing game.  

Does anyone have any pointers about how to simply let go and accept that you’re not good looking but still have something to offer? Because I know I have good qualities I just hate that my face is getting in the way of any change or progress.",True,False,False,dating,t5_2qhb1,967621,public,self,How do I accept that my face is less than attractive and not let it hold me back from approaching women?,0,[],1.0,https://www.reddit.com/r/dating/comments/p9a3bs/how_do_i_accept_that_my_face_is_less_than/,all_ads,6,,,,True
70,[],False,gogogaga_girl,,[],,text,t2_d8mq63s3,False,False,False,[],False,False,1629627936,self.dating,https://www.reddit.com/r/dating/comments/p9a43u/should_i_go_on_a_vacation_with_my_ex_who_cheated/,{},p9a43u,False,True,False,False,False,True,True,False,#ff4500,dating,"[{'e': 'text', 't': 'Question'}]",a9531dce-194e-11e5-b177-0eff099c3d1f,Question,light,richtext,False,False,True,37,0,False,all_ads,/r/dating/comments/p9a43u/should_i_go_on_a_vacation_with_my_ex_who_cheated/,False,6,1629627946,1,"Context : Me and my ex broke up 2.5 years ago. We are both 24 and we dated during university, on and off for 3 years. We had a toxic relationship, he cheated on me multiple times (went on tinder dates, pursued other women but never had sex with anyone else, so he claims atleast). Everytime he'd cheat, AND get caught, he'd come back crying and pleading asking for forgiveness and how he'd change the next time. Happened thrice and didn't change. (One of these 3 times he tried to fuck one of my best friends, God bless her, she not only removed herself but told me everything). Ultimately when Uni ended, we moved to different countries in the EU and broke up. 

We decided to stay friends. 
I have zero feelings for him and don't even think of him as a fruit but he seems to think of me as one of his most important friends. 

In the last year, I have really taken control of my life,
1. Working out and getting in shape
2. Going to therapy to get over the anxious attachment style the shitty relationship gave me.
3. Got back on OLD last month and been on 2 dates with an amazing guy.

The event : My ex got back to me yesterday and asked if I'd like to join him on a weekend gateway to Barcelona AS FRIENDS. He was looking for some company and would even plan most things.

The question:
Should I consider going? I don't trust the guy. I am sure he'll say something on seeing my transformation that'd probably hurt me. At the same time I wanna visit Barcelona so having a planned trip could help -- knowing I don't have feelings for him. 

I am confused.

TL, DR: Cheating ex invited me over to a vacation that he'd plan strictly as friends but I'm not sure if I should trust him.",True,False,False,dating,t5_2qhb1,967622,public,self,Should I go on a vacation with my ex (who cheated on me)?,0,[],1.0,https://www.reddit.com/r/dating/comments/p9a43u/should_i_go_on_a_vacation_with_my_ex_who_cheated/,all_ads,6,,,,
71,[],False,pinklove0015,,[],,text,t2_12k2j4,False,False,False,[],False,False,1629628789,self.dating,https://www.reddit.com/r/dating/comments/p9a9qx/in_love_with_the_ex/,{},p9a9qx,False,True,False,False,False,True,True,False,#ea0027,dating,"[{'e': 'text', 't': 'I Need Advice'}]",19ec58c2-9f74-11e7-81a1-0e2bf15991f0,I Need Advice,light,richtext,False,False,True,11,0,False,all_ads,/r/dating/comments/p9a9qx/in_love_with_the_ex/,False,6,1629628800,1,"I went on a fourth date with this guy who I thought was awesome. Then out of no where he told me he is still loves his ex. That she is the love of his life and he has never loved someone as much as her. I really was stunned and didn't want to get into a fight so when I got home I told him its not going to work out. He has been divorced from her since around 2012, she even cheated on him. Would you end it to?",True,False,False,dating,t5_2qhb1,967633,public,self,in love with the ex?,0,[],1.0,https://www.reddit.com/r/dating/comments/p9a9qx/in_love_with_the_ex/,all_ads,6,,,,
72,[],False,l008com,,[],,text,t2_1jzp8c5k,False,False,False,[],False,False,1629628873,self.dating,https://www.reddit.com/r/dating/comments/p9aabu/she_will_not_stop_seeking_exact_details_about_why/,{},p9aabu,False,True,False,False,False,True,True,False,#ea0027,dating,"[{'e': 'text', 't': 'I Need Advice'}]",19ec58c2-9f74-11e7-81a1-0e2bf15991f0,I Need Advice,light,richtext,False,False,False,6,0,False,all_ads,/r/dating/comments/p9aabu/she_will_not_stop_seeking_exact_details_about_why/,False,6,1629628884,1,"It wasn't a break up though, because we were not a couple. Like not even close. It's a weird story:

So we met on okcupid. We went on a few fun dates. I was pretty interested, i'd say my interest level was like.... a 7, 7.5 maybe. So we're talking and going on dates and i'm trying to push us into relationship territory and she shoots me down, she's not interested in dating, only friends. We hadn't hooked up or anything, it was just activity dates with flirting and great conversation. 

So some time goes by, its maybe a year later. We've been talking very sparsely if at all. I come up with an idea for a date she can't refuse, a trampoline park. As expected, she did not refuse. But she insist's it's not a date, we're just hanging out. 

So these ""dates but not dates"" go on for a long time and eventually we do start hooking up. I don't remember how long that went on for, I don't think very long, I think it was only a few times. Then I decided that I didn't think we were a great match as a couple so I said I think we should just be friends. This was genuine, I wasn't just doing it to be an ass or to ""gotcha"" her back. We had spent a lot of time together, and she is a very cool girl and very interesting but she's not someone I want to spend the rest of my life with. And I'm 40ish years old at this point, I've lost my taste for ""just for the hell of it"" relationships. She is mid 30s. 

Then the pandemic happened. So we've been friendzoned for over a year now. We have still been hanging out periodically but no hookups or anything romantic. She seems to be ok with being friends most of the time but then from time to time she is not. Lately it's gotten worse. We had a fun day kayaking in a cool spot, everything seemed to go great. Then the next day she was insisting I explain in much more detail what it is I ""don't like about her"". She's totally overreacting about how don't care about her etc etc. But this is the kind of thing she should have went through days, weeks, a month after we did not become a couple. Not a year and a half later. It's so confusing, I've been slow responding to many of her messages lately because I read them and it's like she's been on another planet, i don't understand her point of view at this point at all. 

I guess at the end of the day, the situation is pretty clear. She wanted to be in a relationship, I did not, she was ""dumped"" kinda, and feels bad about it. I get that and I sympathize more than you can imagine. But I still don't want to get into a relationship with her. My feelings are that from a romantic point of view, it came and went, it ran its course, time to move on. From a friends point of view, she's great and I would love to remain friends with her. I've remained friends with many of the girls i've gone on dates with on okcupid - but definitely not all. 

So now she wants a specific answer. And there are specific reasons. There are hygiene issues among many others. But I don't want to give her specifics because I don't want to lead her on and make her think these are problems to be fixed and then we can be together. - thought on the flip side, somehow apparently no one has ever told her about awful hygiene issues and i feel like someone should tell her. There are lots of reasons and listing them out would just pile on and make her feel really terrible. She has some self esteem issues already and this will just make it worse. After all this time, it is only now become clear that this is a situation where being friends isn't going to work. If she's in a bad place, talking to me at all is only going to make her worse. 

Any advice on how to handle this situation? It's so weird, it has so many unusual aspects that I'm not sure how to proceed.",True,False,False,dating,t5_2qhb1,967633,public,self,She will not stop seeking exact details about why I rejected her.,0,[],1.0,https://www.reddit.com/r/dating/comments/p9aabu/she_will_not_stop_seeking_exact_details_about_why/,all_ads,6,,,,
