,id,created_utc,title,selftext,subreddit,subreddit_id,url
93,qe7u0c,1635005623,Should i mention that im a blood donor on my dating profile (okcupid)?,"is it tacky thing to mention that im a blood donor?

i was also thinking of putting that im ""the type of person to research your mental health issues to figure out the best way to support you"". is that good or creepy?

context:

""Big hearted, creative, genuine, easy-going. A dreamer. I'd rather watch a documentary than party. The type of person to offer you the last slice of pizza. the type of person to research your mental health problems so i can figure out the best way to support you""

&amp;#x200B;

Thanks",dating,t5_2qhb1,https://www.reddit.com/r/dating/comments/qe7u0c/should_i_mention_that_im_a_blood_donor_on_my/
94,qe7utg,1635005695,Secret buddy,[removed],dating,t5_2qhb1,https://www.reddit.com/r/dating/comments/qe7utg/secret_buddy/
95,qe7y1m,1635005976,Just found out a guy ive been seeing and went on a date with is married. what do I do?,"The past 2 weeks ive been seeing this guy and been talking to him, we went on a date this weekend and then also went out on a night out with each of our friend groups together. One of his friends told my friend that he is married and has a wife. I clearly didnt beleive that as he is quite young and it seems insane if he married. My friend asked quizzed the guy on this information but he did not say anything or brushed it off. He left early without saying goodbye to me which was really strange and he messaged me late that night and said sorry he didnt say goodbye he went unwelcome as my friend was spreading rumours about him.

I felt bad for him actually as again i really did not believe he was married. I decided to just to look up his work business online as i was curious about it and so looked up his name on google and in the images section there is him and his wife on a wedding site. It said her name on it so i then looked that up on facebook and found his page too and all the posts of them together, it was the wedding anniversary a few days ago, and he is posting about it. He told me he is not on facebook or instagram. i just feel like such an idiot as me and him did get along well.

i dont know should i message him and tell him i know he is married or just ignore him, what do you think my next step should be??",dating,t5_2qhb1,https://www.reddit.com/r/dating/comments/qe7y1m/just_found_out_a_guy_ive_been_seeing_and_went_on/
96,qe7yph,1635006032,I got stood up today for my first date after a break-up,"I recently got out of a 7 month relationship. The ending was a little sudden. On a whim, I downloaded bumble but deleted it soon after. In that window, someone I went on a couple of dates with saw me and contacted me. He’s been insistent about going out, so I was excited. I thought it would be fun to casually see each other.

We agreed on Tuesday that we would do a picnic on Saturday afternoon. On Wednesday we discussed what foods to bring, but didn’t set up a specific time/place. That’s the last I heard from him. It’s now 12:30pm on Saturday, so I’m officially giving up. 

Maybe this is the universe telling me that I need a break from dating. I’m so tired of the constant disappointment and mind games.",dating,t5_2qhb1,https://www.reddit.com/r/dating/comments/qe7yph/i_got_stood_up_today_for_my_first_date_after_a/
97,qe81qq,1635006276,Is this sub an echo chamber made out of people who are unsuccessful with dating?,I just wonder why would a person that has no issues with dating be on this sub,dating,t5_2qhb1,https://www.reddit.com/r/dating/comments/qe81qq/is_this_sub_an_echo_chamber_made_out_of_people/
98,qe849o,1635006508,Threat or a joke?,"So I’ve been dating this guy for a little over 3 months, and I made a joke about how he said a word funny, which we always pick on each other. So anyways I made a joke and he kinda was slightly offended and asked me, Do I ever regret having a child and wonder what it would be like if my son wasn’t my child? And then he said do you wonder what it would be like if my son didn’t have his mom? And I said no never. And then he said well that’s what it’s gonna end up, your son isn’t going to have a mom. And I just got quiet. And he didn’t laugh or acknowledge what he said after. I got like this weird feeling. He also made a joke before saying if he stays at his parents house any longer someone is going to end up dead/ killed I can’t remember exactly but I can’t tell if he’s making a joke",dating,t5_2qhb1,https://www.reddit.com/r/dating/comments/qe849o/threat_or_a_joke/
99,qe888c,1635006832,Why should I even try anymore?,"I went on a date a couple of days ago and I thought it went well. She said she enjoyed it and would like to go on another date. Imagine my surprise when she is taking days to respond now. I just want to give up. This has happened to me over and over again, and I am completely hopeless. How can I ever expect to get a girlfriend if I do everything right and still nothing goes my way? Its so frustrating, and yeah, I’ll be alone, but at least I won’t have to deal with this anxiety anymore.",dating,t5_2qhb1,https://www.reddit.com/r/dating/comments/qe888c/why_should_i_even_try_anymore/
