,all_awardings,allow_live_comments,author,author_flair_css_class,author_flair_richtext,author_flair_text,author_flair_type,author_fullname,author_patreon_flair,author_premium,awarders,can_mod_post,contest_mode,created_utc,domain,full_link,gildings,id,is_created_from_ads_ui,is_crosspostable,is_meta,is_original_content,is_reddit_media_domain,is_robot_indexable,is_self,is_video,link_flair_background_color,link_flair_css_class,link_flair_richtext,link_flair_template_id,link_flair_text,link_flair_text_color,link_flair_type,locked,media_only,no_follow,num_comments,num_crossposts,over_18,parent_whitelist_status,permalink,pinned,pwls,retrieved_on,score,selftext,send_replies,spoiler,stickied,subreddit,subreddit_id,subreddit_subscribers,subreddit_type,thumbnail,title,total_awards_received,treatment_tags,upvote_ratio,url,whitelist_status,wls,removed_by_category,author_flair_background_color,author_flair_text_color,banned_by,edited,post_hint,preview
38,[],False,iori-yagami2,,[],,text,t2_4jgkhvh1,False,False,[],False,False,1624085472,self.dating,https://www.reddit.com/r/dating/comments/o3a4xs/almost_impossible_to_find_a_real_match_on_a/,{},o3a4xs,False,True,False,False,False,True,True,False,#ffb000,,"[{'e': 'text', 't': 'Tinder/Online Dating'}]",5214d2ac-61f1-11e8-8bb1-0ed15e4a39c0,Tinder/Online Dating,dark,richtext,False,False,True,6,0,False,all_ads,/r/dating/comments/o3a4xs/almost_impossible_to_find_a_real_match_on_a/,False,6,1624093231,1,"This might seem obvious for some, but I'm kinda new to online dating and please be nice and respectful with a newbie. I recently signed up for the FB dating service and it is very annoying to keep getting messages from matches that keep asking me for my WhatsApp number. The majority of this messages come from orientals or latinx matches, so when i see the pictures of these profiles you can see only cute and hot girls. So for those who have more experience on these things, I'm 99% sure these are all scams that ask you for your WhatsApp so they can get your number and maybe ask you for money in some way. I'm not longer giving away my WA number because i received an extortion threat from an unknown number and I can only assume it came from one of these profiles. That happened to me using the online service mentioned earlier, but I imagine this is a common occurrence in the online dating apps. I guess my concern is that maybe there is a teeny tiny bit of hope that one day you may perhaps find your love in an online dating app, but as times goes by, it looks like all these apps are just full of bots, fake profiles, and scams that makes it almost impossible to even find a real match. I'm new to this, so I ask you to respect and kindly provide your feedback or your experience using these apps.",True,False,False,dating,t5_2qhb1,846513,public,self,Almost Impossible to Find a Real Match on a Dating App...,0,[],1.0,https://www.reddit.com/r/dating/comments/o3a4xs/almost_impossible_to_find_a_real_match_on_a/,all_ads,6,,,,,,,
39,[],False,green_eye7,,[],,text,t2_31pvr6l6,False,False,[],False,False,1624086133,self.dating,https://www.reddit.com/r/dating/comments/o3aaaw/feeling_lonely_while_trying_to_date/,{},o3aaaw,False,True,False,False,False,True,True,False,#878a8c,dating,"[{'e': 'text', 't': 'Venting'}]",a616c322-194e-11e5-ab91-0ed1c06bdad7,Venting,light,richtext,False,False,False,31,0,False,all_ads,/r/dating/comments/o3aaaw/feeling_lonely_while_trying_to_date/,False,6,1624093798,3,"I am a 30 male trying my luck in online dating, had alot of disappointments and some were good experiences. I am a romantic, gentle, respectful, listener and introvert. I tried for over 2 years online dating and sometimes I ask myself where are the normal people, I don't like ONS because I want the emotional part that comes with intimacy. I am not an athlete but not obese just the good man, trying to be nice and not a ghosting, challenging man.

One of my friends told me I just look like a nice guy and somewhere it stuck into my head.

After unsuccessful dates, I just feel empty and lonely, I just want to cuddle and feel emotional. I think it also relates to childhood events that made me so emotional and wanting to attach.

Any tips? I thought of pshycologist but how about the cruel dating world?",True,False,False,dating,t5_2qhb1,846525,public,self,Feeling lonely while trying to date,0,[],1.0,https://www.reddit.com/r/dating/comments/o3aaaw/feeling_lonely_while_trying_to_date/,all_ads,6,,,,,,,
40,[],False,LEGEND-KILLER_-2K-__,,[],,text,t2_ckgoroz5,False,False,[],False,False,1624087260,self.dating,https://www.reddit.com/r/dating/comments/o3aiur/ex_dismissive_avoidant_girlfriend/,{},o3aiur,False,True,False,False,False,True,True,False,#ea0027,dating,"[{'e': 'text', 't': 'I Need Advice'}]",19ec58c2-9f74-11e7-81a1-0e2bf15991f0,I Need Advice,light,richtext,False,False,True,9,0,False,all_ads,/r/dating/comments/o3aiur/ex_dismissive_avoidant_girlfriend/,False,6,1624094747,1,"Me/My Ex Broke Up On Feb27th,2021(She Ended It ) 
. EX Girlfriend Is A  D.A.
. We Work At The Same Place
.  Shes 45 / Im 33
. Im Her Longest Relationship Ever
. Personality Changed In Dec 2019 When She Had An Hystercotomy
. Done No Contact In April

. ( 18.6.2021 )

Me and Ex Both Came Out Our LockerRooms At The Same Time. Could Hear Her Chuckling,As We Walked By Each Other. She Said “You Walk Funny Luke,Shaking Your Bum”I Laughed Back,Said I Never Knew I Did!! Was Just About To Walk Away and She Said You Got Something In Middle Of Your Hair.
Before I Could Do Anything,She Ran Her Hand Through My Hair.( looks like dry shampoo,she says.. it was ) 
Later On In The Day,She Pretended To Trip Me Over,Sticking Her Leg Out..As I Was Walking By,Carrying Stuff.
Then She Did A Little Dance That’s What You Look Like From Behind Luke.When Your Walking.
Is She Coming Round? OR Just Been Friendly?
( Couldn’t Look At Me In April/May )",True,False,False,dating,t5_2qhb1,846541,public,self,Ex Dismissive Avoidant Girlfriend,0,[],1.0,https://www.reddit.com/r/dating/comments/o3aiur/ex_dismissive_avoidant_girlfriend/,all_ads,6,,,,,,,
41,[],False,pop-t,,[],,text,t2_cm6ccmoc,False,False,[],False,False,1624087693,self.dating,https://www.reddit.com/r/dating/comments/o3alzs/is_it_possible_to_get_positive_reactions_from/,{},o3alzs,False,True,False,False,False,True,True,False,#ff4500,dating,"[{'e': 'text', 't': 'Question'}]",a9531dce-194e-11e5-b177-0eff099c3d1f,Question,light,richtext,False,False,True,10,0,False,all_ads,/r/dating/comments/o3alzs/is_it_possible_to_get_positive_reactions_from/,False,6,1624095092,1,"I've spent so many hours of my life taking photos of myself or having others take photos of me and none of them work. Online dating doesn't work because without good photos (ie. a good face) you don't get likes as a man.

I used to go to bars/clubs all the time when I was younger and most women would ignore me or give me one word answers or ""I have a boyfriend"" when I would try to talk to them. 

I'm extroverted and sociable by nature but you can't force someone to match to you or talk to you if they don't want to.

What do you think? Is it possible to get positive reactions from women online or in bars/clubs if you have a below average height &amp; face?

Please speak from personal experience, not hypotheticals.",True,False,False,dating,t5_2qhb1,846548,public,self,Is it possible to get positive reactions from women online or in bars/clubs if you have a below average height &amp; face?,0,[],0.67,https://www.reddit.com/r/dating/comments/o3alzs/is_it_possible_to_get_positive_reactions_from/,all_ads,6,,,,,,,
42,[],False,RedditnobodyX,,[],,text,t2_bl6b39dt,False,False,[],False,False,1624087705,self.dating,https://www.reddit.com/r/dating/comments/o3am2r/the_golden_rule_of_online_dating/,{},o3am2r,False,True,False,False,False,True,True,False,#ffd635,dating,"[{'e': 'text', 't': 'Giving Advice'}]",7bca2c58-4211-11e5-9ecb-0e60d8112001,Giving Advice,dark,richtext,False,False,False,23,0,False,all_ads,/r/dating/comments/o3am2r/the_golden_rule_of_online_dating/,False,6,1624095101,6,"If a person you are communicating with is interested in you romantically the effort will be there to be a part of your life. Don’t blow up the other persons phone just give the person a call and leave a voice message or shoot them a text message, if they value you they will make time to reply and an effort to go out on dates with you. Sometimes it’s that simple. It makes dating a whole lot more easier… the amount of people I’ve heard who ignore someone hoping the other person gets the hint but the other person keeps lighting up their phone like it’s Christmas with messages and texts is alarming. Be persistent but be sensible and don’t pursue something that isn’t there. Yes this is obvious to some but sometimes others overlook the simple things and that’s okay, so long as we learn. Have a good weekend ladies and gentlemen:)",True,False,False,dating,t5_2qhb1,846548,public,self,The golden rule of online dating,0,[],1.0,https://www.reddit.com/r/dating/comments/o3am2r/the_golden_rule_of_online_dating/,all_ads,6,,,,,,,
43,[],False,LarryGotter,,[],,text,t2_17ynjdq,False,False,[],False,False,1624090188,self.dating,https://www.reddit.com/r/dating/comments/o3b4sn/getting_good_morning_or_good_night_messages/,{},o3b4sn,False,True,False,False,False,True,True,False,#ff4500,dating,"[{'e': 'text', 't': 'Question'}]",a9531dce-194e-11e5-b177-0eff099c3d1f,Question,light,richtext,False,False,False,15,0,False,all_ads,/r/dating/comments/o3b4sn/getting_good_morning_or_good_night_messages/,False,6,1624097151,2,Anyone else feel like the loose all interest when they get good morning/night messages after only talking online for a few days? It's not like we have met yet. Or we are talking into the night and I need to go to bed. It's just randomly. It's happened a few times now.,True,False,False,dating,t5_2qhb1,846582,public,self,Getting good morning or good night messages.,0,[],1.0,https://www.reddit.com/r/dating/comments/o3b4sn/getting_good_morning_or_good_night_messages/,all_ads,6,,,,,,,
44,[],False,Emerging-Techulator,,[],,text,t2_c53sloi1,False,False,[],False,False,1624091097,self.dating,https://www.reddit.com/r/dating/comments/o3bcer/advice_on_using_dating_app_with_gps/,{},o3bcer,False,True,False,False,False,True,True,False,#ffb000,,"[{'e': 'text', 't': 'Tinder/Online Dating'}]",5214d2ac-61f1-11e8-8bb1-0ed15e4a39c0,Tinder/Online Dating,dark,richtext,False,False,True,5,0,False,all_ads,/r/dating/comments/o3bcer/advice_on_using_dating_app_with_gps/,False,6,1624097933,1,"I like to here people's opinion on here about what they think about dating/chat apps that allow you to chat and find strangers within your proximity by scanning people nearby using GPS? What are the good, bad and your overall conclusion on using these apps to hookup or break the ice with a stranger to find love.

Most dating apps allow you to specify how many mile radius to find people nearby (I am not talking about these). I am talking about super nearby, like in front of your eyes, meaning going into a bar or grocery stores and see profiles of people that you can actually see, bump into or even approach. Maybe you can even see/meet someone at work that you don't normally interact with but like and didnt know was available. Is this good or a little scary to use? Appreciate your thoughts or feedback, whether you have experience using some of these apps or not.",True,False,False,dating,t5_2qhb1,846595,public,self,Advice on using dating app with GPS...,0,[],1.0,https://www.reddit.com/r/dating/comments/o3bcer/advice_on_using_dating_app_with_gps/,all_ads,6,,,,,,,
45,[],False,wubeditionx7,,[],,text,t2_um1ee,False,False,[],False,False,1624091303,self.dating,https://www.reddit.com/r/dating/comments/o3be5j/thinking_for_sure_i_will_be_single_till_35_or/,{},o3be5j,False,True,False,False,False,True,True,False,#ea0027,dating,"[{'e': 'text', 't': 'I Need Advice'}]",19ec58c2-9f74-11e7-81a1-0e2bf15991f0,I Need Advice,light,richtext,False,False,True,6,0,False,all_ads,/r/dating/comments/o3be5j/thinking_for_sure_i_will_be_single_till_35_or/,False,6,1624098112,1,Ive posted here many times and i have to say ive gotten some help from people on here and also some terrible things said to me just out of nowhere. Anyways I go to work and come home and go to bed at like 2 or 3 cause i get off at 11 i work 3 to 11 at a hotel during Tuesday Wednesday and Thursday and then Friday Saturday i work 11 to 7 overnight and then come home and sleep and wake up at 3 and do it again at 11. What im saying is idk how im ever gonna meet anyone and dating apps are the worst thing invented since they just go off of looks and they are a pay for nothing basically unless you look like a angel or a god basically. But yeah ive had all 3 tinder hinge and bumble ive had people edit the profile for me ive changed it myself ive done everything possible and i could probably say i gotten 5 spams and 5 real likes that just talked for less than a day or deleted me instantly cause it was an accidental like or something.  Also people have told me to find hobbies or go out to places but im in south dakota i hate bars i dont smoke drink or do any type of drugs i hate sports and im kinda scared talking to people i dont know alot of the time especially if they are a girl that i would like or something. My hobbies are gaming music movies cars and collectibles also hanging with my cousin and my one good friend. None of that is really something i could go to around here accept im going to slipknot concert in iowa in September which im pumped for. Anyway though i guess im just gonna be single till who knows when but im assuming either forever or way later like 35 or 40 or something when i have my own house and idk i guess im just stuck and have no clue how to go about dating and im 25 btw and ive never had a date never really hung out with a girl and still would consider myself a virgin and yeah just wish something would happen soon.,True,False,False,dating,t5_2qhb1,846598,public,self,Thinking for sure i will be single till 35 or later,0,[],0.99,https://www.reddit.com/r/dating/comments/o3be5j/thinking_for_sure_i_will_be_single_till_35_or/,all_ads,6,,,,,,,
46,[],False,The_ImmortalSandcat,,[],,text,t2_c9ht1wdk,False,False,[],False,False,1624091354,self.dating,https://www.reddit.com/r/dating/comments/o3bekg/deleted_social_media_awhile_back_but_going_to/,{},o3bekg,False,True,False,False,False,True,True,False,#ea0027,dating,"[{'e': 'text', 't': 'I Need Advice'}]",19ec58c2-9f74-11e7-81a1-0e2bf15991f0,I Need Advice,light,richtext,False,False,False,7,0,False,all_ads,/r/dating/comments/o3bekg/deleted_social_media_awhile_back_but_going_to/,False,6,1624098154,1,"(M, 24) I'm from a very small town. Due to a stressful job and just not having a real dating pool to work with, I eventually deleted my Facebook, Instagram, Snapchat, everything but Reddit. All I would see on these apps was stuff about dating, which was irrelevant to my life in a small town with basically just a job and a gym to go to. Also deleted them because they're kind of bad in general, a lot of toxicity. 

But I'm going to a pretty big college in a big city in August. I'm attractive, and I work out (not saying that to brag, only for context). Idk if or when I might date. But the world, especially among teens and 20-somethings, largely uses social media for socializing and for being seen online by potential partners. I've heard that some people in my age range (I'm 24) consider someone without social media as strange or anti-social. When I had deleted my social media accounts, I still had Tinder for a while, and a girl I matched with seemed to want to know me better. She asked me to chat with her on Instagram. I told her I deleted it, that I got sick of social media. Then she unmatched me, as if to think I was a creepy scammer. So social media seems like a must-have. 

I really don't miss having social media, I feel happier without it. But it could be a seen negatively somehow by potential partners. Can you realistically date people today with just texting and phone calls? Would someone I meet in college react negatively if I say I don't do social media? I haven't been hanging out with people since early high school, so I'm kind of out of the loop on this. What are your thoughts?",True,False,False,dating,t5_2qhb1,846599,public,self,"Deleted social media awhile back, but going to college soon. Wondering if it's needed for dating",0,[],1.0,https://www.reddit.com/r/dating/comments/o3bekg/deleted_social_media_awhile_back_but_going_to/,all_ads,6,,,,,,,
47,[],False,[deleted],,,,,,,,[],False,False,1624091819,self.dating,https://www.reddit.com/r/dating/comments/o3biff/unsure_whether_i_27f_should_catch_up_with_my/,{},o3biff,False,False,False,False,False,False,True,False,#ea0027,dating,"[{'e': 'text', 't': 'I Need Advice'}]",19ec58c2-9f74-11e7-81a1-0e2bf15991f0,I Need Advice,light,richtext,False,False,True,4,0,False,all_ads,/r/dating/comments/o3biff/unsure_whether_i_27f_should_catch_up_with_my/,False,6,1624098550,0,[deleted],True,False,False,dating,t5_2qhb1,846608,public,default,Unsure whether I (27F) should catch up with my ex-boyfriend (35M). Advice?,0,[],0.33,https://www.reddit.com/r/dating/comments/o3biff/unsure_whether_i_27f_should_catch_up_with_my/,all_ads,6,deleted,,dark,,,,
48,[],False,cmcmaree,,[],,text,t2_3ofpen98,False,False,[],False,False,1624091910,self.dating,https://www.reddit.com/r/dating/comments/o3bj6z/was_i_overeacting/,{},o3bj6z,False,True,False,False,False,True,True,False,#ff4500,dating,"[{'e': 'text', 't': 'Question'}]",a9531dce-194e-11e5-b177-0eff099c3d1f,Question,light,richtext,False,False,False,12,0,False,all_ads,/r/dating/comments/o3bj6z/was_i_overeacting/,False,6,1624098626,1,"Met on bumble this guy and been chatting for a few weeks, he was really keen to meet up last weekend but my city I live in Australia was in lockdowns and couldn’t meet up. I offered a compromise to do some cooking together on video call over the weekend, he picked the day and what we cooked and was introducing me to his housemates on video call. For the past few weeks he kept saying we can go out to restaurants, we can travel together, we can do hobbies together... really over the top and coming on strong tbh
This weekend he asked late on Friday to
meet on Sunday but to me it seemed a bit of an afterthought, Sunday is not a great day to do things as I have chores and errands to do and when he asked to meet Sunday he didn’t say when or where or what we would do and he didn’t ask me what I’d like to do so it was concrete plans. He said he’d drive close to my area but there isn’t anything to do so I suggested to meet in the city area for coffee in the morning as Sunday is a bit of busy day to get organised for the work week, basically I was the one making compromises and then I didn’t hear back for 5 hours today so I just deleted him from Instagram, bumble and told him it’s not gonna work because he didn’t really organise anything and last weekend he seemed keen to meet and then he never put in plans into action this weekend and I felt lied to and truth is I do and I feel manipulated because one minute it is we can do this together and we can do that together but there was no effort really, just a lot of talk and that gives me the message he wasn’t very interested, so maybe my reaction was for the best! Idk! I feel disappointed though... like maybe I was led on a bit and empty promises and i feel let down",True,False,False,dating,t5_2qhb1,846610,public,self,Was I overeacting?,0,[],1.0,https://www.reddit.com/r/dating/comments/o3bj6z/was_i_overeacting/,all_ads,6,,,,,1624092538.0,,
49,[],False,Living-Ice2055,,[],,text,t2_9lttxwec,False,False,[],False,False,1624092393,self.dating,https://www.reddit.com/r/dating/comments/o3bnbe/is_it_true_that_if_a_person_whos_in_their_early/,{},o3bnbe,False,True,False,False,False,True,True,False,#ea0027,dating,"[{'e': 'text', 't': 'I Need Advice'}]",19ec58c2-9f74-11e7-81a1-0e2bf15991f0,I Need Advice,light,richtext,False,False,False,24,0,False,all_ads,/r/dating/comments/o3bnbe/is_it_true_that_if_a_person_whos_in_their_early/,False,6,1624099030,2,"I (F24) recently met this guy and we hit it off. He asked me out later thinking I'm in my mid to late 20s and he's in his early 30s. Despite the chemistry and the attraction, my friends tell me that if a guy is in his 30s, still doesn't have his life together and is hitting on a girl in her early/mid 20s then he has serious problems and should be avoided. Is it true? Should I be concerned and start to distance myself?",True,False,False,dating,t5_2qhb1,846618,public,self,Is it true that if a person who's in their early 30s and is attracted to a girl in her early 20s is a person to be avoided?,0,[],0.67,https://www.reddit.com/r/dating/comments/o3bnbe/is_it_true_that_if_a_person_whos_in_their_early/,all_ads,6,,,,,,,
50,[],False,[deleted],,,,,,,,[],False,False,1624092810,self.dating,https://www.reddit.com/r/dating/comments/o3bqcz/serious_question_if_you_ladies_had_to_rate_me_on/,{},o3bqcz,False,False,False,False,False,False,True,False,#ff4500,dating,"[{'e': 'text', 't': 'Question'}]",a9531dce-194e-11e5-b177-0eff099c3d1f,Question,light,richtext,False,False,True,4,0,False,all_ads,/r/dating/comments/o3bqcz/serious_question_if_you_ladies_had_to_rate_me_on/,False,6,1624099362,1,,True,False,False,dating,t5_2qhb1,846629,public,default,"Serious question, if you ladies had to rate me on a scale of 1-10 what would it be? Dealing with a breakup so feeling alittle insecure.",0,[],1.0,https://www.reddit.com/r/dating/comments/o3bqcz/serious_question_if_you_ladies_had_to_rate_me_on/,all_ads,6,deleted,,dark,moderators,,,
51,[],False,Relative_Button,,[],,text,t2_bcgdsuqk,False,False,[],False,False,1624092859,self.dating,https://www.reddit.com/r/dating/comments/o3bqpf/finding_a_personal_physically_attractive_and_not/,{},o3bqpf,False,True,False,False,False,True,True,False,,dating,"[{'e': 'text', 't': 'Other'}]",fd9c03b8-a1ce-11e7-9172-0e8c9f9ecf4c,Other,dark,richtext,False,False,True,7,0,False,all_ads,/r/dating/comments/o3bqpf/finding_a_personal_physically_attractive_and_not/,False,6,1624099402,1,"i’ve experienced this a fair amount…finding someone physically attractive and just not feeling an emotional connection or chemistry. my best friend said this about me as well…he thinks i’m attractive and cares about me but he isn’t into me emotionally, granted his exes have been very toxic.",True,False,False,dating,t5_2qhb1,846630,public,self,finding a personal physically attractive and not feeling an emotional connection,0,[],1.0,https://www.reddit.com/r/dating/comments/o3bqpf/finding_a_personal_physically_attractive_and_not/,all_ads,6,,,,,,,
52,[],False,ca1991,,[],,text,t2_lzth9,False,False,[],False,False,1624092998,self.dating,https://www.reddit.com/r/dating/comments/o3brq5/how_to_approach/,{},o3brq5,False,True,False,False,False,True,True,False,#ea0027,dating,"[{'e': 'text', 't': 'I Need Advice'}]",19ec58c2-9f74-11e7-81a1-0e2bf15991f0,I Need Advice,light,richtext,False,False,True,2,0,False,all_ads,/r/dating/comments/o3brq5/how_to_approach/,False,6,1624099520,0,"So I used to small talk with this girl early high school years maybe like 14 years ago never hooked up or hung out at that time.   Always had each other on social media but haven't talked in years..  from what I know shes been in a serious relationship for at least the last 6 years but anyways lets get to the point..

I work 3rd shift and when I got home from work I randomly got a message from her unexpectedly on facebook asking ""do you live on so so street?  And I answered yeah.  Shes like ""I've seen your car the other day while I was taking a walk the same car I see on your facebook, I live on so and so street also""  fast forawd we find out we live about 4 houses from each other.  She closed on the house last summer with her boyfriend,  I've been at my house for 5 years now.  So okay cool we can be neighborhood friends,  shes a very attractive sexy girl btw.  Well I left it alone after that for awhile..  all sudden while I'm at work ar 1am I get the ""wyd"" message on a Friday night.. and just last night it happened again..  I keep it cool and kinda see her intentions here even tho after I answer she keeps me on read and we dont really talk during day I'm assuming cuz she has a boyfriend.  But that wyd messagea I'm assuming shes trying to have a sneaky link and I'm just not sure how to pursue and if it's to close to home.. it's hard not to because shes a beautiful woman lol",True,False,False,dating,t5_2qhb1,846634,public,self,How to approach??,0,[],0.5,https://www.reddit.com/r/dating/comments/o3brq5/how_to_approach/,all_ads,6,,,,,,,
53,[],False,[deleted],,,,,,,,[],False,False,1624093392,self.dating,https://www.reddit.com/r/dating/comments/o3bus4/advice_to_the_guys_one_thing_you_should_do_after/,{},o3bus4,False,False,False,False,False,False,True,False,#ffd635,dating,"[{'e': 'text', 't': 'Giving Advice'}]",7bca2c58-4211-11e5-9ecb-0e60d8112001,Giving Advice,dark,richtext,False,False,True,0,0,False,all_ads,/r/dating/comments/o3bus4/advice_to_the_guys_one_thing_you_should_do_after/,False,6,1624100010,1,,True,False,False,dating,t5_2qhb1,846634,public,default,"Advice to the guys:- One thing you should do after meeting a girl you like is to find out if she's a bitchy feminist or not ASAP. If she's a bitchy feminist with unrealistic standards, leave her alone. She can keep looking for that guy who meets all her crazy standards.",0,[],1.0,https://www.reddit.com/r/dating/comments/o3bus4/advice_to_the_guys_one_thing_you_should_do_after/,all_ads,6,deleted,,dark,moderators,,,
