,id,created_utc,title,selftext,subreddit,subreddit_id,url
0,pd5dxa,1630135473,Should I ask what happened or just stop talking to him?,"I (23f) recently downloaded tinder again and I thought I was having really good luck this time. I matched with a guy who I have a lot in common with, and he seemed genuinely excited to meet up with me. We talked a lot and it really looked like we would get along. The day of our date comes around and he didn't mention it at all. I was fine with waiting for another day. But ever since then he hasn't been talking to me anymore. His responses are low-effort, and when I asked him if he'd meet with me again he just never responded. 

I'm thinking of asking if I came on too strong, as I'd really like to know what happened. But it seems like he doesn't want to talk to me. He hasn't blocked me or unfriended me yet though, so maybe he wants me to ask? I really don't know. We haven't spoken in a week",dating,t5_2qhb1,https://www.reddit.com/r/dating/comments/pd5dxa/should_i_ask_what_happened_or_just_stop_talking/
1,pd5f5q,1630135655,"Have you ever caught feelings for someone you felt you weren’t compatible with for a serious relationship? If so, how’d you go about it?",[removed],dating,t5_2qhb1,https://www.reddit.com/r/dating/comments/pd5f5q/have_you_ever_caught_feelings_for_someone_you/
2,pd5get,1630135848,"I have a busted lip, should I still go to this date tonight?","Hi guys, 

Tonight I (22F) have my first date with this guy (23). But there is one issue. 

Yesterday i accidentally bit my lip after my dentist appointment. Now my lip is a bit swollen and has this white/yellowish circle on it. It looks awful! I will put on some lipstick to cover it up. But I don’t think the swelling will be gone for tonight.

What should I do? Should I still go through with the date or maybe reschedule it?",dating,t5_2qhb1,https://www.reddit.com/r/dating/comments/pd5get/i_have_a_busted_lip_should_i_still_go_to_this/
3,pd5i4w,1630136103,"Giving up on dating, it's just to taxing on my heart, mind and soul.","Well, I have been divorced for officially a year now and dated a bit using the apps a few months after the initial separation. It wasn't bad at first but I always eventually got ghosted, more than likely due too the many options that women have on the dating apps these days. Well I deleted the apps and focused on myself for months and months after and eventually started talking to a woman I met in person at her work. I casually flirted with her a few times and she reciprocated, so I eventually manned up and asked her out in person. She said yes and my heart fluttered. I felt immense joy all while reminding myself that it very well could be too good to be true, so don't allow myself to get hurt. Well I took her on a date and bought her dinner, we had a fairly good conversation and the food was decent. Afterwards I simply gave her a hug and said my goodbyes. She texted me shortly after and said that she had a good time and wondered what I thought of the date. I told her that I thought it was good and would like to take her out again if she's interested. She said that she would love to. Well to shorten a long story she started responding to text less and less, made excuses as to why she responded late, a definite cap. Now she has completely ghosted me, I know I need to let this go but I'm genuinely sick of being shit on in the dating game. I'm physically fit, I am a gentleman and I of course paid for the meal. My question is why do people act like they're interested when they're not?",dating,t5_2qhb1,https://www.reddit.com/r/dating/comments/pd5i4w/giving_up_on_dating_its_just_to_taxing_on_my/
4,pd5na7,1630136874,Once in a lifetime moment,"So, I haven't dated in a long time. But a beautiful lady stepped out a pizza shop and said she has saw me around town and was glad to see me. She ran out and shook my hand. She had wet eyes, and my heart went into hers. Sadly she had to meet up with her friends. I am saddened to yet miss out an opportunity to have a relationship. 

I haven't a clue on how to (respectfully) get a date",dating,t5_2qhb1,https://www.reddit.com/r/dating/comments/pd5na7/once_in_a_lifetime_moment/
5,pd5qq2,1630137408,LDRs rarely work,"I dont know how but I always end up in one, (meeting online) and of course I think this is ""the one"" and it never works out. I guess it's because I don't know how to meet locally. Every time I get myself in a LDR I hear the horror stories of it not going to work and of course I think the one I'm In is different.",dating,t5_2qhb1,https://www.reddit.com/r/dating/comments/pd5qq2/ldrs_rarely_work/
6,pd5tf4,1630137797,Why do guys bring up sex even before meeting. How is this supposed to impress anyone?,"When I call them out on it, they think women are too sensitive 🤷‍♀️ or closed minded.

Examples of things guys I've matched with text me on our first conversation - 

""I have a high testosterone so I am usually ready for sex anytime and so I consider myself very macho"".

Or another comment I got was

""My man hormones are missing having sex and cuddling women during covid"". 

Other ones ""I'm looking for a woman who is willing to show skin and wear revealing clothes""",dating,t5_2qhb1,https://www.reddit.com/r/dating/comments/pd5tf4/why_do_guys_bring_up_sex_even_before_meeting_how/
7,pd5utu,1630138013,27M and never had a girlfriend,[removed],dating,t5_2qhb1,https://www.reddit.com/r/dating/comments/pd5utu/27m_and_never_had_a_girlfriend/
8,pd5zsz,1630138756,What is the impact on a girl when the father is not in her life and she has had guys in the past who led her on and then abandoned?," I'm a 39 year old guy and I was dating a mid 30s woman. We were talking on the phone for a few months and then we went on 4 dates. I made a good amount of mistakes with her (acting kind of clingy by texting too much, not going for a kiss and thus confusing it into friendship, etc.) but she also has a past that she said impacts her to the day. She decided to end things after date 4 saying she prefers friendship.

I want to understand how much of it was my mistakes and how much was it her past that contributed to this not working out? She did some odd things throughout. For example, we started talking on the phone every day immediately after we met (we met online dating and she was initially long distance but then moved very close to where I live). But, then for no reason, she just stopped talking for 2 weeks. At that point, we were still talking but at a much slower pace and I thought it might be over (she later explained that bc a guy led her on from long distance, she got scared with me). However she got back to the point of showing interest again and then we went on the 4 dates. But, in the dates, she was always very guarded and it was hard to even initiate touch or hold hands or put my arm around her. There would be zero response. And then she even invited me to her place for dinner and drinks (the 4th date) but again, she wouldn't really allow touch or physical intimacy. I ultimately asked to kiss her good night after this 4th date and she said yes. Regardless, she still ultimately said she wanted friendship. Additionally, she sometimes posts things on social media about how she doesn't need a guy as long as she has her girlfriends who matter most to her.

Is it more likely that this girl was driven to friendship by my mistakes or could she be kind of scarred from past bad experiences with guys which prevents her from crossing certain emotional levels of connection? Part of the reason it became friend-y was also because she didn't let it become anything more than friends by not responding well to the flirtation and touching escalation.",dating,t5_2qhb1,https://www.reddit.com/r/dating/comments/pd5zsz/what_is_the_impact_on_a_girl_when_the_father_is/
9,pd6378,1630139281,Girls I date lose interest in sex fairly quickly.,"Not to toot my own horn but I'm a fairly attractive, active, tall, guy that tries to make my partners feel valued and appealing. My past few partners have all lost interest in having sex with me despite when we do we orgasm simultaneously or we both orgasm at some point. Not that that's the goal but it fairly frequently happens. What are some female recommendations besides the same ol same ol ""foreplay starts by doing the dishes"" which I do. I also make the meals. What the fuck.",dating,t5_2qhb1,https://www.reddit.com/r/dating/comments/pd6378/girls_i_date_lose_interest_in_sex_fairly_quickly/
10,pd6694,1630139721,M21 went clubbing with F22 and friends,"I really just want to vent right now, i was in invited to go to a club with a couple female coworkers and one of the coworkers started doing classic girl physical touch like touching my stomach and holding my hand. 

For extra context there was another two dudes who were way more ripped than i was (I’m decently fit) and noticed that they were also getting a bit of attention

So after we were done partying i drove some girls to the dudes apartment where we said we would meet up (i was DD because i don’t drink and everyone else was drunk) and while we are chilling at the dudes house i asked F22 if she wanted to meet up at my place for some fun to which she said yeah lets do it.

So i ended up having to drive two of the girls to their apartment because they needed a ride back and F22 said she would meet me at my place. For context now its like 1:30 a.m 


So i wait for a bit then while I’m chilling and waiting i call her, no answer. So i sent a text asking if she wanted me to meet her somewhere and she takes like 30 min to respond. Then says “sad datyy” i wait for more info but nothing so i ask if she is still tryna meet up then texts me saying “im dunzo”


Just fucking tell me if you don’t want to its chill. I got gps and see that you’re alone at super buff dudes apartment i can put two and two together 

Just don’t tell me one thing then go screw another dude. Im not even jealous I’m just mad. In her defense shes probably drunk.

Im done... if anyone has anything encouraging to say ill take it.",dating,t5_2qhb1,https://www.reddit.com/r/dating/comments/pd6694/m21_went_clubbing_with_f22_and_friends/
11,pd69t1,1630140267,Stargazing date ideas,"Okay so, im going stargazing with this boy tonight, and I'm wondering what essentials I should bring to make it cute and romantic",dating,t5_2qhb1,https://www.reddit.com/r/dating/comments/pd69t1/stargazing_date_ideas/
12,pd6oxe,1630142578,😰🤧,[removed],dating,t5_2qhb1,https://www.reddit.com/r/dating/comments/pd6oxe/_/
13,pd6vl2,1630143650,Fwb problem. Need your help,"I (21f) had a fwb (23m) few years back. We used to solely meet for fooling around. Also, we used to talk about our personal life, friends and all of that. I started having feelings for him and I confessed the same. But he said he just got out of a breakup and its way too ealy to have something serious and it won't be good for both of us as we had religious differences. Since we have religious difference, it is impossible for us to have a future together, and that sucks. 


We both stay far from each other and were busy with our lives. So with time, the sex started becoming monotonous. But we still decided to keep on meeting since we were comfortable with each other and liked what we had. 


Later we stopped meeting because I felt that my needs weren't being met (and I still had feelings for him) and it's not okay for my mental health to continue all this. I used to give him emotional and financial support knowing that him and I could never be us.


I came to know from a friend that he started seeing someone from the same religious background. But he never said that. He still used to text me saying that he misses me and all of that. I never reciprocated with the same energy because I knew he's dating someone else and I thought it would be weird if i brought up this subject.


One day he texted me that he misses me alot and it wasn't for sex. He said that I think of him as someone who is 'cheapo and creepo' and as if he is some monster. He started saying sorry plenty of times and I had no clue why. He said that he really wants to see me somewhere away from the room and that he wants to be better with me and to give him another chance. I wasn't sure because I knew he was in a relationship and when I confronted him he said he was in a relationship but he broke up because there was no peace. 


When I replied him with ""im not sure"" he said ""Its okay. You dont have to. Im glad I got to talk to you and tell you how I feel""


Guys I need your honest opinion here, what should be my next step? I'm perplexed.

Tl;dr- ex fwb is back and wants to meet me and give him another chance so that he could be ""better with me"". What should I do next?",dating,t5_2qhb1,https://www.reddit.com/r/dating/comments/pd6vl2/fwb_problem_need_your_help/
14,pd71ej,1630144595,What pictures would you like to see on a guys online dating profile?,"I'd like to know what photos you'd like to see or not see on a guys online dating profile. I've read online that shirtless selfies, pics with fish and group photos can be a no-no. I don't use social media and don't like to have my photo taken so I'm interested in reading your replies so I can go out and take some nice photos for my profile. I don't need to have photos on my social media but I do on my dating profiles haha",dating,t5_2qhb1,https://www.reddit.com/r/dating/comments/pd71ej/what_pictures_would_you_like_to_see_on_a_guys/
15,pd7d48,1630146236,Who ghosted who?,"Met guy on tinder.  Went on a fun date within about a week. He was a gentleman and paid for the go carts and then dinner. We both had drinks and laughed a lot.  Next day we sent texts back and forth, he said it was awesome. Ended with the typical goodnight and then nothing.  Granted, I was waiting for him to text me, he never did so I didn’t text him either. It’s been about 5 days. Should I have texted him? Thoughts?",dating,t5_2qhb1,https://www.reddit.com/r/dating/comments/pd7d48/who_ghosted_who/
16,pd875f,1630150410,I was a rebound!!,"This is just a short rant I wanted to write and get off my mind. I was with my ex for two months (hardly an ex I know) but it was that fiery intense relationship I truly believed was gonna last forever. We did everything together and moved insanely fast into the relationship. I didn’t trust my gut which told me the whole time he wasn’t over his ex because all the signs were there that he wasn’t but I was so infatuated with him and got distracted and in the end got hurt. He told me he respected me to much to lie to me and told me he was going to try and get back with her. A few days later he thanked me for everything than took me off of all his social media. It was a very weird interaction and I’m honestly glad it’s over. I saw a picture of them together today so that’s mainly why I’m writing this cause I haven’t thought of him in a while and saw that he really did get back with her so quickly. It’s just weird is all because I know I don’t want to be with someone like that, but the fact that I let myself be a rebound and let myself get hurt when all the signs were there is kind of embarrassing. Regardless, it happened and is in the past, the photo just gave me a pit in my stomach for a moment.",dating,t5_2qhb1,https://www.reddit.com/r/dating/comments/pd875f/i_was_a_rebound/
17,pd8bu5,1630151055,is a later reply after a first date always a sign of disinterest?,"or can it also be an indication of something else (e.g. thinking about next moves, etc.)?",dating,t5_2qhb1,https://www.reddit.com/r/dating/comments/pd8bu5/is_a_later_reply_after_a_first_date_always_a_sign/
18,pd8dj7,1630151289,Have you ever thought about everything else but while you’re in the act of having sex?,Sometimes I (23F) will be having sex with my bf (27M) and my mind will just wonder and I have to bring it back to the current moment. It’s not often but it has happened a small handful of times.,dating,t5_2qhb1,https://www.reddit.com/r/dating/comments/pd8dj7/have_you_ever_thought_about_everything_else_but/
19,pd8i54,1630151914,"I have never fallen in love with anyone, is something wrong here?",[removed],dating,t5_2qhb1,https://www.reddit.com/r/dating/comments/pd8i54/i_have_never_fallen_in_love_with_anyone_is/
20,pd8yc9,1630153929,Feeling deflated. No one reciprocates interest. Trying to figure out how I can improve?,"Im a 28m who just recently got back into flirting/dating after not trying for a long time. I dont have a big head or anything, but I had this idea that I wouldnt have that hard of a time finding someone to date. I like to think im average looking if not slightly above average, I got a career, I take care of my health, got hobbies like climbing, biking, playing guitar, hiking... and I like to think Im a positive and friendly person.   


But I've been rejected and felt nothing from other women. Im trying to figure out where Im going wrong. I am a little dusty on my social skills from a year of isolation, but Im working on it.   


Its like I ask ""how is it going"" and the response is emotionless. And I'll ask about them and never have anyone ask me about mine. And then head turns away. I get clear body signal that they are trying to be friendly, but are not interested.  


Im not trying to play victim. As frustrating as it is to get stone walled over and over again, I feel like Id be dumb not to see that I am doing something wrong.   


People talk about how confidence is attractive. I have confidence, but sometimes the rejections or cold responses sting and make me spiral about why this happens.   


I guess I just need to keep on working on myself and trying. The rejections kind of wear on me, but maybe I need to adjust my expectations? Maybe 1 out of every 50 women might show interest. IDK, made that number up.   


Any advice?",dating,t5_2qhb1,https://www.reddit.com/r/dating/comments/pd8yc9/feeling_deflated_no_one_reciprocates_interest/
21,pd8zyx,1630154123,Got Friendzoned by the girl i love.,"I’m 24(m) and she’s 25(f) , we were schoolmates and recently i had a chance to meet her , I had a crush on her in school but this time  she had flirtatious vibe and I started leaning on it , fast forward a couple of weeks we were making out on a regular basis and  after my past failed relationship i wanted to keep things casual , but I caught feelings for her and started thinking about her all day , meeting her was the best time of the day for me , I started skipping workouts, my work and all the other stuff in my life just to go out with her and while all this was going on  i told her how madly in love I’ve fallen and all about how i feel for her but she thought we were just friends with benefits and now only friends because she doesn’t want to deal with emotional attachments from my side moreover she asked me not to call or text her anymore, now i am feeling low and kinda hurt by the way she said everything without compassion makes me doubt that if she even like me in the first place. Now i cannot get her out of my mind since past 2 weeks, it is kinda messing up my productivity and sleep, i am 2
way under confident now and my social anxiety is through the roof. I though it will get better with time but it is not , what should i do

Ps- I apologise if there are any typos, wrote this in one go.",dating,t5_2qhb1,https://www.reddit.com/r/dating/comments/pd8zyx/got_friendzoned_by_the_girl_i_love/
22,pd906z,1630154147,"I just asked a girl out, after a year from my breakup, and she said yes.","I JUST ASKED A GIRL OUT AFTER MORE THAN A YEAR AND SHE SAID YEEEEEEEEESSSSSSSSS YEEESSSSSSSSSSSSSSSSS

Ok I’m sorry, it’s a little thing but I’m so euphoric. Don’t give up guys, if this happened for me after being a loner for so long it can happen to everyone.

Lots of love.",dating,t5_2qhb1,https://www.reddit.com/r/dating/comments/pd906z/i_just_asked_a_girl_out_after_a_year_from_my/
23,pd92a2,1630154402,Any advice salvaging my botched confession?,"I confessed to a “friend” Ive known for about 5 months, but messed it up and said “I’m in love with you but it’s get overable” and she said “wtf go to hell” 😭

I tried to explain I just meant I don’t want to make her uncomfortable and she said “ No need to go through anything just for me to be “ get overable” in the end 🤷🏽‍♀️” 

Not sure how to make this right…From her responses I can’t tell if she’s rejecting me bc she doesn’t like me or if maybe she does like me but she’s offended. I also don’t know if I should contact her first or give her time to reach out to me. Any advice please?

If someone said what I wrote to you, what would you assume they meant?

TLDR: Accidentally offended my crush &amp; really need help making it right.",dating,t5_2qhb1,https://www.reddit.com/r/dating/comments/pd92a2/any_advice_salvaging_my_botched_confession/
24,pd94lk,1630154683,Causal relationship advice.....,"So I just need some advice.  

Im 30(m) and I've been seeing this girl (27) for about 9 months now, and before I start I wanna add that I'm the only guy she has ever dated, kissed or done anything sexually with minus actual sex. So she really has no idea what she is doing dating wise or how to act around men in general.  

She originally told me she didn't want anything serious at first, and just wanted something casual. So me being the hopeful romantic just went along with it trying to be causal. Well that didn't last long, and I'm so in love with this girl I don't know what to do.

Now I've told her I like her, and she liked me too but wants to stay casual. Now she always makes sure to keep it as platonic as possible when messaging or talking with me, so as not to lead me on and be respectful to me. Which I appreciate, but she gives me so many mixed signals, and from how we fool around and the fact we do so many things as a couple that I'm just confused.   

I afraid to keep pushing and talk to her about this anymore, or even open up emotionally to her just because I never thought I could feel like this again. I don't wanna do too much and scare her away, but at the same time I don't know if can keep being casual cause I really do love her and it kills me being able to say it to her. 

Soo sorry for the rant, please be gentle but be honest cause I don't know what to do 😔  

Thanks..",dating,t5_2qhb1,https://www.reddit.com/r/dating/comments/pd94lk/causal_relationship_advice/
25,pd964n,1630154854,How do you even start dating again?,"A few months ago I (27, M) got out of a very long-tern relationship, (6.5 years) and most of my early and mid-twenties were defined by that relationship. Now that I've started over again in life (new job, apartment, just moved to a totally new location a few states away) how do you actually meet people to start dating? Also, from what I can tell it's a very rural place that I moved to, so I'm not sure how reliable dating apps or OLD will be. 

Anyway, I took time to heal and look back at what happened and hopefully will grow from it. I feel like I'm ready to start dating, but I don't know how to go about any of it. How do you meet potential partners, how do you set up dates, what are dos and don'ts, how do you get across what you want without scaring her (I'm looking for a heterosexual relationship) away? Help is greatly appreciated.",dating,t5_2qhb1,https://www.reddit.com/r/dating/comments/pd964n/how_do_you_even_start_dating_again/
26,pd989e,1630155121,I’m discouraged.,"M (24) here. I am honestly discouraged with the dating life. As I am focusing on myself, I am also investing time to put myself out there &amp; meet new people. Trying to get a date is very hard, much as trying to get a girls number. I don’t think I’m a ugly guy, I’m average. When I approach a lady I don’t know, I’m polite about it, I’ll introduce myself, ask for her name, make small talk about the setting we’re in, then I’ll give her number contact information. I never like to ask a girl for her info cause I don’t want her to feel pressure that she has to give it to me. I CAN take no for an answer, there’s been times we’re I have got rejected &amp; I polite tell them “no problem, have a good day” &amp; smile. It just seems to now girls just don’t want to be approached. I mean I think it’s so pathetic that we now rely on meeting people through social media &amp; even then it’s hard to get a message back. I don’t think it’s weird AT ALL, if you see an attractive person that you don’t know &amp; want to approach them, what’s weird about that? You find them attractive &amp; want to get to know them. Unfortunately I don’t have considerate friends that invite me out so it’s easier to meet new people, I’m having to do this on my own. Honestly I’m just looking into investing time on getting to know someone but I’m very discouraged that my results are negative",dating,t5_2qhb1,https://www.reddit.com/r/dating/comments/pd989e/im_discouraged/
27,pd9alq,1630155403,Sugar Zone✧*ﾟ | DISBOARD: Liste de serveurs Discord,[removed],dating,t5_2qhb1,https://www.reddit.com/r/dating/comments/pd9alq/sugar_zoneﾟ_disboard_liste_de_serveurs_discord/
28,pd9bqq,1630155546,Why?,"Why is it that some women take such pride when men can't understand them.   They say things like ""you really think you have women figured out don't you"", and try to insult your intelligence.  I feel like it is nothing to be proud of at all.   Nothing to be ashamed of either,  but why would you be so happy to have poor communication skills just because it makes men uncomfortable or appear beneath them.   🤔",dating,t5_2qhb1,https://www.reddit.com/r/dating/comments/pd9bqq/why/
29,pd9cyo,1630155661,Sugar Zone✧*ﾟ | Discord server discord.gg/sweetzone,[removed],dating,t5_2qhb1,https://www.reddit.com/r/dating/comments/pd9cyo/sugar_zoneﾟ_discord_server_discordggsweetzone/
