,id,created_utc,title,selftext,subreddit,subreddit_id,url
56,mhw4qy,1617286253,A little mindfulness does help!,"So we’re all aware of the dating world today and how it can be extremely draining. I understand that putting yourself out there is the only way to find a partner and rarely does it just fall in your lap, however I feel like we can all agree that it’s exhausting at times. 

I’m a 26F and have only experienced short term relationships. I’ve earned a masters degree, am very independent, love my friends and family, and have my own interests and hobbies. I only started dating in my early 20s and will admit that my own insecurities, unrealistic expectations, and avoidant tendencies make it even more difficult to date. However, I’m actively working on these things to ready myself for a healthy relationship.

Recently I’ve had an epiphany that really shifted my perspective and I’m hoping it may help some people. 

Since I’ve started dating I’ve approached it rather apathetically and carelessly even though I desire a long term partnership. I’ve always compared myself to others and equated my lack of a relationship to my worth. We all can agree that our worth is not determined by our relationship status and that everyone’s life path looks extremely different, even though many of the people around us are coupled up and in love. I’ve also witnessed a fair number of relationships that start out of desperation, which is something I don’t desire and would rather be single than with someone I feel lukewarm about but am with them for attention, comfort, etc. Always being the third wheel and experiencing everyone else entering into relationships stirred up quite a bit of bitterness in my own conscience. I always thought to myself “why them and not me? I’m dating and have been patient and have been single for a long time so why do they find what they’re looking for but I can’t?”

What I failed to realize was that I was so focused on idealizing the perfect partner/ relationship without taking into consideration the facets of a healthy relationship or looking for a potentially healthy partner. I would completely ignore red flags because he was “my type” or because I liked the way he made me feel (ego boosts suck). I’ve rejected guys that probably would have been ideal partners, but since they didn’t meet my “expectations” or make me feel a certain way, I didn’t want it. Another universal truth I’ve had a hard time accepting is that no one can make us happy - healthy relationships consist of two content people. The happier and more confident we are with ourselves will show when we’re dating. 

I’m committed to taking time away from dating and distractions to focus on a few things: 1. Who am I, really? I think I have an idea, but we evolve. 2. What/ who do I even want? 3. Realizing relationships don’t define our worth, who we are, and what we’ve accomplished so far. 4. Being at peace with my situation at all times, no matter what. 

I feel content and I’m peaceful since redirecting my train of thought in regards to dating and relationships. I no longer feel anxious about dating (or lack thereof) and have been focusing on how I can better myself and work on myself so that when the time does come, I can date with purpose. That doesn’t mean dating will get any easier, but shifting my perspective and remaining mindful of the process may allow me to eventually navigate the dating pool slightly more successfully.

Best of luck to all the daters out there!",dating,t5_2qhb1,https://www.reddit.com/r/dating/comments/mhw4qy/a_little_mindfulness_does_help/
57,mhw815,1617286508,This Chinese Dating App Just Won April Fools' Day,[removed],dating,t5_2qhb1,https://www.reddit.com/r/dating/comments/mhw815/this_chinese_dating_app_just_won_april_fools_day/
58,mhw8wp,1617286580,Age difference,"M21. Obligatory “Never had a girlfriend” statement here. Interested in someone I work with. Never dated before and there’s an age difference of 19 years(I know, bad ideal, pretty sure she’s not a cougar but I like a lot about her and I’m still trying cuz why not? My chances are low af anyway). So for those in a relationship with a age gap, what should I expect to be the main issue besides generational differences if we end up together. We work the same job and I make a little more but I don’t have the life experience she does. (Which is why I’m working on a lot of things right now, I want to become a man that could take care of her). Also how would I approach someone with an age difference in order to court her?",dating,t5_2qhb1,https://www.reddit.com/r/dating/comments/mhw8wp/age_difference/
59,mhwdzs,1617286999,No response after date,So I went on a date with woman two days ago and I think it went great and it seemed like it. We went out to a nice restaurant and watched a movie after and kissed. We were having fun the whole nice. Yesterday I texted her saying that I’d really enjoyed our time and would like to go out again. But she hasn’t responded. Did she not enjoy it?,dating,t5_2qhb1,https://www.reddit.com/r/dating/comments/mhwdzs/no_response_after_date/
60,mhweo7,1617287048,"Should I just become an asshole to be cooler, (especially for hookups)?","I guess I wouldnt call myself, ""comfortable in my own skin"", and I have a problem with comparing myself to other men. Especially with the men in my university. I see a lot of them who are perceived as likeable and really cool amongst peers. Some of them are really popular and liked by everyone. The thing is, they're assholes. Or at least from what I can tell. They disregard other peoples feelings, and dont really give a shit about anything except what they want, and dont care who they hurt. It usually reels good results for them, i.e more friends, more of what they want, more hookups. They're more confrontational, mean and often sarcastic when it comes to picking on others. 

&amp;#x200B;

I dont really like the idea of hurting others just to get what I want, but it seems to workout for them, plus they get more rewards for it for some reason. Girls seem to just gravitate towards them and somehow they get more girls every week. 

&amp;#x200B;

Some are loud while others are just quiet and speak when they have something to say, the quiet types tend to get more girls than the loud ones for some reason but they still have that mean behavior. 

&amp;#x200B;

Me on the other hand, I'm more mild mannered. Im not really confrontational, when someone says something thats meant to insult me, It just...doesnt, I usually ignore it, I dont really know how to respond in a witty or sarcastic ways that the ""assholes"" at my university do so I just tend to ignore it, some of my friends think that I ignore it because im offended, but I just really dont have a way of responding thats funny or witty, and I cant really bother to spend energy to do that. If I do end up responding to something insulting i just say, ""Thank you' with a smile and thats about it. I have a small group of friends that I'm usually ok with being talkative, but I guess for some reason, girls from an outside perspective dont like guys who are too talkative. Like I'm a good listener, from what others tell me, but I guess me talking to much isnt masculine, or ""alpha"" idk. I guess I have a wierd hobby, I like spray painting in my free time, and I think Im really good at it, but girls at my university dont think too much of it, they tend to gravitate towards guys with musical talent like guitar or piano, which I wish but I really have no interest in  creating music. 

&amp;#x200B;

I'm not really looking for a girlfriend, but Im open to one. But I just like hooking up, which I cant say ive done much of since it was only twice, and they only hooked up with me because the guys they wanted werent interested in them so they settled for me. So maybe adopting an asshole-ish attitude would help? 

&amp;#x200B;

what do you guys think?

&amp;#x200B;

EDIT: Its not that all the girls in my university are like that, its jsut the majority that go to clubs and parties where hookups happen",dating,t5_2qhb1,https://www.reddit.com/r/dating/comments/mhweo7/should_i_just_become_an_asshole_to_be_cooler/
61,mhwix8,1617287384,I just ghosted a woman. Did I have good reason to?,"I have never really been on a date or quasi relationship when I had to ghost somebody.  But I think I ran into my first nutjob that required drastic action. Here's a list of winning phrases uttered by her over the course of a week's interaction.  Me:  30 y/o M.     Her:  28 y/o W

First date -

Her:   Oh! You work for a (insert large multi national employer here).  You must be doing awfully well for yourself!

2 days after the first date (via text) -

Her:   I just came really hard!

Me:  That'd awesomeness.  A good orgasm is a reward in and of itself.

Her:  No. You are missing the point.  I thought about you for the past 45 minutes while I did it!

Second date (we were smoking hookah after at a buddies house) -

She was resting her head on my arm and she was getting heavy.  I asked her to move a bit and she loses it!

Her:  oh! So it's gonna be like that now huh?!?! I see how it is.  U don't like me anymore!

Me:  no. Literally my arm was falling asleep.  That's it!

Her:  whatever.... (she then doesn't talk to me for 10 minutes while glaring at me)

She calls me every night. Snapchats me throughout the day and is kinda a bother at this point. 

Blocked her number a few days ago after 8 missed calls and 35 missed snaps.

Was I justified?!",dating,t5_2qhb1,https://www.reddit.com/r/dating/comments/mhwix8/i_just_ghosted_a_woman_did_i_have_good_reason_to/
62,mhwlsx,1617287622,Hook up went wrong,"A few months ago I hooked up with a male friend who is HIV positive and I was half penetrated. He was not wearing a condom and I did not know of his condition until after the incident. It was one of my first few hook up experiences and I was so reckless. I was speechless when he confessed to me a week later but I’m raging now although I tested negative. I was stupid but it was selfish of him to do that. I vow to never hook up again after the traumatising incident. He’s on treatment and also trying to convince me that it’s okay to date a HIV positive partner but I don’t want to due to the social stigma. If you were me, what would you have done?",dating,t5_2qhb1,https://www.reddit.com/r/dating/comments/mhwlsx/hook_up_went_wrong/
63,mhwp2q,1617287898,When life gifteth lemons,"Squeeze them into your eyes and feel the pain! Who needs April fool's day, when your entire life is a joke :D 

Be safe out there everyone!",dating,t5_2qhb1,https://www.reddit.com/r/dating/comments/mhwp2q/when_life_gifteth_lemons/
64,mhwtm9,1617288262,Seemingly every avenue to meet single women is completely dominated in numbers by men. What am I supposed to do?,"Go on a dating app - 90% male

Any Meetup or local group that I’ve tried - over 90% male

Go to a bar - overflowing with guys

Even tried treating myself at a coffee shop - every table in the building was occupied by one male

You see where I’m going with this. I can’t seem to go anywhere to interact with single women that isn’t absolutely swarming with desperate, lonely, and overly aggressive dudes. And I now live in a city that is supposed to have way more women than men. It just doesn’t make sense, and to be honest, it’s really starting to get under my skin. I want to get back into dating, but there’s no realistic way to do this with these kinds of crazy gender ratios. I wholeheartedly believe in what I have to offer, but I need a chance to be able to show that.

Have other people had this experience?

Does anyone have any advice for how to deal with this?",dating,t5_2qhb1,https://www.reddit.com/r/dating/comments/mhwtm9/seemingly_every_avenue_to_meet_single_women_is/
65,mhwtzm,1617288291,How to trust new people you dating with? And actually should I trust?,"Sorry for my bad English.
Well, I'm 29F and I had ""serious"" relationship 3 times. 6, 2 and 2 years. I received proposal 3 times. Said yes 3 times. And all 3 of them cheated. One of them used to cheat on me every single time he didn't like what and how I'm speaking or the tone of my voice.

I don't know if it's something wrong with me, that makes my bf to cheat, or it's something wrong with me that makes me to choose guys like them. 

Anyway, I don't know how to trust people anymore. I had a nice guy once, and he left me because ""one of your foot is always outside the door"". Like he felt that I can leave him anytime. 

I really can't understand, why should I trust him, and what would stop him from cheating. Or not him, maybe other guy. 

I tried to be in open relationship, and it was kinda ok, but exhausting. So it's not really for me. 

Thanks to anybody who read this.",dating,t5_2qhb1,https://www.reddit.com/r/dating/comments/mhwtzm/how_to_trust_new_people_you_dating_with_and/
66,mhwyg1,1617288654,Was he in it for genuine reasons?,"A bit of advice on some of these behaviours from a guy I recently started talking to on a dating app. 

I matched with him and he seemed very keen and talkative and we started messaging. He was messaging every day and this is boy something I’m used to but as we got on I soon started getting used to hearing from him every day. Also did a few calls and he would call me on the way home from work. 
I’m a take it slow type of gal as I’m looking for a genuine connection and try to take testing frequency as a pinch of salt. 
I met him twice and we had great dates where he seemed really interested in me. He was also suggesting road trips and possible things we can do in the future together. 
I had to go out of town recently for 2 weeks abs I explained this and said “it’s great getting to know you but as I’m out of town the next few weeks, if you are keen to get to know each other better when I’m back - I’ll let you know when I’m back but in the meantime we can do FaceTime. 
He seemed keen on this but as I’ve tried to keep in touch when I’m away I can feel the change and shift in how behaviour. I tried to suggest a FaceTime but he said it was late and messaging was dry so I stopped messaging but leaving it with a speak soon. 
I haven’t heard anything in almost a week and would now feel a bit silly messaging when I’m back considering his lack of interest now. 
Was he every genuine in the first place? I’ve also had a dating experience where the guy messaged every day and was overly keen and as soon as I slowed it down he admitted it was just for a hookup. 
Is this a tactic to build intimacy quickly via text and future fake like that?",dating,t5_2qhb1,https://www.reddit.com/r/dating/comments/mhwyg1/was_he_in_it_for_genuine_reasons/
67,mhx3yi,1617289106,Did I get stood up or was I warned?,"Sort of been talking to this girl for a couple of months. Never quite “dating”. In the past month or two we started texting and snap chatting. Ended up meeting twice. Last time we met two weeks ago it went well and we left with a kiss. 
The other day i asked if she could do dinner and she said she may able to but had a group project to work on and would let me know.  Day before the meet and she texted me again and said something along the lines of “I’ll keep you updated when we finish, but if you made other plans I understand it was last minute”. Seemed genuine. Either way The day of I never heard from her. That was yesterday. So far still nothing 

Sure it could have been that the thing took longer, but simple communication would have been easy. Was I warned enough? Posted stories on snap since. Nothing conclusive. Could be nothing if I get a message later, but not trying to be walked on (though this post isn’t helping lol). Kind of sucks after going really well in person any advice? I got nothing to lose but the right approach (or cut off) could make a difference.",dating,t5_2qhb1,https://www.reddit.com/r/dating/comments/mhx3yi/did_i_get_stood_up_or_was_i_warned/
68,mhxcnd,1617289800,"Three women in their 30s discuss modern dating, and its hilarious.",[removed],dating,t5_2qhb1,https://www.reddit.com/r/dating/comments/mhxcnd/three_women_in_their_30s_discuss_modern_dating/
69,mhxk9d,1617290399,Is it okay to re-contact a girl I was talking to? (please read context),"Will try to be concise and only include the most important details as I tend to ramble/include non-important things.

I recently met a girl through a dating app. We had a few video calls and one in-person date, and things were looking really great. However, the day after our in-person date she told me that she had thought she was a in a place to date someone, but didn't think she was ready for that (she's in a phase of big transition right now). She told me that made her sad because I had a lot of what she was looking for. I asked if she was open to discussing it and she said she just didn't think dating was wise for her right now. Everything ended amicably. This was a little less than 3 weeks ago.

The last thing I told her (via text) was that I promised she wouldn't hear from me again, I wished her the best, etc., including that I would delete her number so I couldn't contact her again. I also told her that if in the future she contacts me, I might be open to rekindling our relationship.

On one hand, I told her I wouldn't contact her again, and I take promises seriously. However, I think I've also done myself a disservice in saying I might be open to trying again and leaving that open-ended, as now I'm just hoping that in the future she contacts me (which could very well be never). Would it be okay to contact her explaining this and ask 1) is there a possibility of us dating again in the future? and 2) if so, can we set a timeline, for example, ""lets talk around the beginning of June"" or something?

TL;DR - Met a girl. Things were going well, but she decided she wasn't ready to date yet. Last text I sent her was saying I wouldn't contact her again, but if she contacted me I might be open to trying again. Would it be okay to contact her asking if that's even a possibility, and if so, if we could set a concrete time for us to talk about the possibility?

Thanks for reading this whole thing if you did.",dating,t5_2qhb1,https://www.reddit.com/r/dating/comments/mhxk9d/is_it_okay_to_recontact_a_girl_i_was_talking_to/
70,mhxnzb,1617290693,Men that don't read profiles,[removed],dating,t5_2qhb1,https://www.reddit.com/r/dating/comments/mhxnzb/men_that_dont_read_profiles/
71,mhxrmp,1617290996,I used to get girls all the time. What happened?,"Hey Reddit, I'm coming to you as a 26 year old man  because I'm getting over a breakup from a long term relationship (8 years). I don't feel as if my body style has considerably changed since I was getting dates as a whee lad (pre 18yo) but I'm not getting many matches on Tinder and it's hurting my ego even more, especially after being cheated on which is what ended my recent relationship. In all fairness, I just left a toxic relationship and didn't exactly grow in it, so while I'm employed, I don't have a ""nice"" job or career going for me yet. Perhaps it's my area, perhaps it's my photos, my bio, etc that are holding me back, perhaps I look way worse than my ego has always believed, but it kinda sucks so if there are any tips I could have on the dating market I'd appreciate it. Is Tinder not the ""go to"" app to meet people on anymore? I don't know if I'm looking to hookup or find something long term, but if anyone could give a guy some general tips on where to turn and what makes one ""dateable"" I'd greatly appreciate it. Trying to pick up the pieces from this heartbreak and get her out of my head.",dating,t5_2qhb1,https://www.reddit.com/r/dating/comments/mhxrmp/i_used_to_get_girls_all_the_time_what_happened/
72,mhxrrz,1617291007,Facebook Dating?,I've been off of Facebook for about 6 months and decided to go back on. Is Facebook dating really any good at find someone? Looks like every other dating app. Swipe right or left.,dating,t5_2qhb1,https://www.reddit.com/r/dating/comments/mhxrrz/facebook_dating/
73,mhxsre,1617291085,25 M Looking for a longterm friend,"Hi i am 25 male from germany and just want a Female friend to Chat with some advice and just to have fun. :D
Looking forward to Chat with you. ( Snapchat or kik)",dating,t5_2qhb1,https://www.reddit.com/r/dating/comments/mhxsre/25_m_looking_for_a_longterm_friend/
74,mhxu3x,1617291198,"Platonically called ex, had a fight that kept me up at night. Am I not ready to date?","Been close to a year since my (26M) seven year relationship died from her (25F) pulling away, and a few months since it was officially over.

**Light, camera, queue juicy drama.**

Among our many conversations then, she said she's going to take at least a year until she starts dating again. The other day I found out via mutual friend that she already started though, doing every wrong thing. The classic why don't they call me back in the AM phase.

I didn't and don't want anything romantic with her, but the news stuck in my head. For most of the day it kept bothering me in some way I don't understand. Friend told me that's normal and I shouldn't worry about it. Eventually the thoughts morphed into a ""noooo person I know super well don't do that to yourself!"" This made sense, at least.

Being the dummy I am, at this point I decide to call her. Move our interactions to being friends instead of brief texts once in a blue moon. Encourage her to date smart, wish her the best, pure intentions only. Figured many years together and her saying before that she cares about me platonically would make this fine.

_Boy was I wrong_

In like my fifth sentence or something I got a smidge sarcastic with ""not going to date for a year? my ass!"", **in context of saying** she _can_ do whatever she wants, it's none of my business, but I just wanted to make sure she's ok and doing the right thing for herself. Saying that hit a nerve for her is an understatement. Latched onto my brief sarcasm, and I got yelled at for it indeed being none of my business and interrogated about who sold her out by telling me. Mmmmk.

That made me mad. I was trying to do something nice, but instead got yelled at for very briefly and in passing calling her out on being dishonest. Five minute call later, I said not so nicely that I don't need this and hung up. Sent an angry scoldy text asking for an apology afterwards, backhandedly wishing her the best otherwise.

Not a proud moment, pretty much the reverse of clear empathetic communication between human beings. But catharsis in its own right. Don't think we'll talk again, noticed she even took me off her social media as a result 🤷‍♂️

Now to the real issue.

The whole thing stirred some stuff up in me. Reminded me of that feeling of a friend turning away from me, kind of like what I felt in the few conversations we still had toward the end of dating. This was the closest person I had for years, now right off the cuff rejecting an attempt at basic friendship and in a not so hot way either.

Guess it's fine, I don't need those kinds of issues in my life. But still, seven years into nothing.. Didn't sleep much tonight. Brain keeps cycling on this, like it hasn't done for a month and a half now.

Idk if this is the really bad kind of baggage and means I should back off on myself starting to date yet. On the daily, I'm excited for trying something new with someone else and am clear of my past. But my strong emotional response tonight, even if not romantically oriented, makes me wonder if I'm really ready.

Your any and all thoughts?

---

Tl;dr Reached out to ex who left me after many years to check in about her handling things ok, and got it thrown in my face. Kept me up at night, though otherwise I'm feeling over her. Don't know if it means I'm not ready to date.",dating,t5_2qhb1,https://www.reddit.com/r/dating/comments/mhxu3x/platonically_called_ex_had_a_fight_that_kept_me/
75,mhy4al,1617292029,Lied about my virginity,"Hey. 
So this I embarrassing.
I(20f) got drunk with my friends the other day and I felt the urge to meet a guy (22) who I have been texting for some days. I know him from my past but we have never been alone and it has been years since I last saw him. 
I texted him early in the evening and he responded late. He ordered a cab for me and we went to his place. We drank and smoked a bit 🍃. We kissed and he started touching my ass and I was not interested in having sex since I don’t do one night stands. I got the feeling that he was only interested in sex and that I was down for having sex with him even though I didn’t know him that well. I didn’t like that he saw me like that so I told him I was a virgin and saved myself for marriage. I knew he would respect me a lot if I said that cause he come from a very religious background were virgins are a big plus for men. I am obviously not a virgin and I’m actually interested in getting to know him cause we vibed really well. I’m afraid of what he will think of me when I tell him I’m actually not a virgin and how do I even tell it? Please help this is embarrassing",dating,t5_2qhb1,https://www.reddit.com/r/dating/comments/mhy4al/lied_about_my_virginity/
