,id,created_utc,title,selftext,subreddit,subreddit_id,url
0,rsby12,1640897722,The guy(20M) I've (21F)been seeing cancelled on me 3 times.,[removed],dating,t5_2qhb1,https://www.reddit.com/r/dating/comments/rsby12/the_guy20m_ive_21fbeen_seeing_cancelled_on_me_3/
1,rsbypb,1640897777,Anxiety over size,"I do not try to date (even though I want to) because of my 🍆 size. I just find it pointless, I can’t imagine any female ever wanting me sexually and the thought of devoting time to someone and having it not happen just because of that would be so embarrassing… I also do not want to waste their time. 

Any other guys feel this way? Did you get over it? All my friends are in committed relationships and I’m the odd one out.. I know they find it weird I never talked to a girl before. 

I have rejected every single girl that has come my way (and a lot have) because of this issue. It’s really weighing me down.",dating,t5_2qhb1,https://www.reddit.com/r/dating/comments/rsbypb/anxiety_over_size/
2,rsbz4o,1640897805,I’ve never dated before really…,"I’m 26 and I’ve never dated before really? I went on one date in high school before confirming I’m only into women, got stood up the first time I tried to date online and I did have a sort of flirtation with someone, but it went no where. I recently redownloded Bumble and want to try again, but I’m stuck in a ‘my only friends are online, I’m socially awkward and I don’t know how to date’ sort of place. 

Any advice is welcome for like trying to put myself out there. I’m just a ball of anxiety and worry that I’ll just come off as a weirdo.",dating,t5_2qhb1,https://www.reddit.com/r/dating/comments/rsbz4o/ive_never_dated_before_really/
3,rsc747,1640898350,The guy(20M) I've (21F) been seeing keeps cancelling on me,"I went out on a date with this guy a week ago. We had a really good time and connected amazingly well. We told each other we'll see each other again very soon .

A day later he texted me asking me to meet him. But at the very last minute he cancelled on me. His reason seemed genuine so I didn't think much of it. A few days later , he asked me to meet him again but cancelled yet again an hour or so before we were supposed to me. I was a lil annoyed this time but I told him it's alright. 

Today, he asked me to meet him again. I confirmed whether he'll actually be able to see me this time and he repeatedly promised me that he will come for sure. But an hour later after we were supposed to see each other he called me and told me it's getting difficult for him to come and said that he's really sorry for doing this again and again. I was visibly pissed this time and I told him I might not see him again. 

Tbh,  his reasons did seem legit but every single time we've planned on meeting I've cancelled on other people for him and him cancelling the very last minute every single time has been extremely inconvenient for me. 

I do really like him and I've really looked forward to meeting him. That phone call was the last we spoke. If he would've called me or even texted later to genuinely apologize I would've let it pass but he didn't. 

Should I text him or should I just let it be and move on? I'm very confused.
Also, was I in the wrong for reacting the way I did? 

Thanks in advance :)",dating,t5_2qhb1,https://www.reddit.com/r/dating/comments/rsc747/the_guy20m_ive_21f_been_seeing_keeps_cancelling/
4,rsc8wb,1640898479,Pet names,How do I nicely tell a new guy that I don’t like being called names. I know he means well and is probably just doing it cause he thinks that’s what girls like but every time he calls me cutie I throw up a little in my mouth!,dating,t5_2qhb1,https://www.reddit.com/r/dating/comments/rsc8wb/pet_names/
5,rsceh9,1640898879,Is it weird I don’t want to date at the age of 31? I’m still a virgin.,"I’m 31 years old and I’ve never dated. I’m also autistic and don’t really mesh well with people.

The downside is I’ve never been attracted to people and I don’t feel strongly about dating. I’ve had people say I’m attractive although I’m short and quite sensitive.

I’ve never been head over heels for someone and I don’t feel strongly for putting myself out there. I don’t get enjoyment out of it and I don’t like socializing either.",dating,t5_2qhb1,https://www.reddit.com/r/dating/comments/rsceh9/is_it_weird_i_dont_want_to_date_at_the_age_of_31/
6,rsci9g,1640899152,Did I ruin it before the date happened or am I overthinking?,"Go this girls number who is a best friend of my friends fiancé (never met her before. We agreed to go on a date last night but she postponed it until next week because she was under the weather and wanted to get tested for covid first. With the exception of today, we have been texting back in forward with her giving more simple answers and me getting very conversational and detailed. There was a solid flow and she was at least responding. 

All the advice and feedback I’ve been seeing online when the situation occurs that a date is far out, has suggested to keep the conversation to a minimal and small talk. I’ve already told her a lot about myself and even got personal a few times. It didn’t seem to matter too much but I’ve decided to take a break from her today just in case and not sending any texts. 

Am i doing the right thing or just overthinking, and from here on out what should I do in the time being before the date?",dating,t5_2qhb1,https://www.reddit.com/r/dating/comments/rsci9g/did_i_ruin_it_before_the_date_happened_or_am_i/
7,rscl2h,1640899358,Tips for communicating in my relationship?,"I (22F) have been dating my boyfriend (27) for almost 3yrs. I’ve been feeling emotionally neglected for quite some time now and attempted to communicate my feelings, but he either thinks I’m trying to be mean or argue, or just doesn’t seem to care or fully understand.

He just spends our time “together” watching movies, basketball highlights, and tik tok. When we do talk it’s about what he’s watching or he’s telling me to clean something. If I try to have a conversation, he either doesn’t fully pay attention or interrupts me as if I wasn’t just in the middle of speaking. His brother, who’s visiting for the holidays, interrupted me the same way and my boyfriend thought it was the most hilarious thing. It was so embarrassing and disrespectful.

Not sure if maybe I just need to word everything differently or just give up. I’ve let him know I feel alone even when he’s next to me, and that it feels like he doesn’t like spending time with me or talking to me or that I feel disrespected when he interrupts me. I’m always met with practically the same replies about how we were together the whole time, or that he thinks he has ADD or ADHD and it’s hard for him to pay attention (which I understand, but he hasn’t made an effort to get diagnosed or anything), or he just gets upset and ignores me more.

I know different people respond to different forms of communication, and maybe that’s why I can’t get through to him. All my friends irl aren’t really paying attention to what I say either and just tell me to dump him which is useless. I am new to trying to communicate, and would love to hear different tips and opinions.",dating,t5_2qhb1,https://www.reddit.com/r/dating/comments/rscl2h/tips_for_communicating_in_my_relationship/
8,rscscr,1640899881,Practice dates as a service?,"I (31F) am currently poly-saturated but weirdly I miss going on first dates. I really like meeting and getting to know new people, learning about new places around town, flirting a bit, bringing people out of their shell, etc. It occurred to me that some people might be interested in going on a practice date where they could try having conversations and such in a more relaxed/zero-stakes context, and I could provide any feedback if they wanted. I guess the idea is this might be helpful for men who are nervous about approaching and talking to women in general.

Do you think this is something anyone would be interested in? I've heard of dating coaches so I guess this would be something similar to that.",dating,t5_2qhb1,https://www.reddit.com/r/dating/comments/rscscr/practice_dates_as_a_service/
9,rscuaw,1640900019,Did I say the right thing or was I being too harsh?,"A guy (20M) I talked to for 3 months straight suddenly messaged me (18F) after a month of silence

He suddenly disappeared a month ago and greeted me merry Christmas last 25th. I was infatuated with him back then and with him leaving me on read made me feel really bad and confused. Officially, I can say that don’t have feelings for him. 

Now that we’re talking again, he tells me that he can’t really explain why he suddenly stopped and said that I should’ve initiated. I told him I’m the last person to text and joked that maybe I should also respond after a month to be fair. He then goes to say that Its my choice and I’m not obliged to talk to him and I told him “why so serious?” I proceeded to tell him that “if I wanted to stop talking to you I’d tell you not just suddenly disappear” and he told me “wow upfront”. I then said “just being honest” to which he replied “ok ok noted”.

That was his last message earlier and I left him on inbox. 

It just sucks how it feels like he can enter my life on whenever he finds it convenient. 
He replies hours later and I thought that now we’re talking again, it’d change but it didn’t. 

I feel so naked compared to him since I’ve been so transparent with him back then. It’s like he knows so much about me but I don’t know him.",dating,t5_2qhb1,https://www.reddit.com/r/dating/comments/rscuaw/did_i_say_the_right_thing_or_was_i_being_too_harsh/
10,rscz0b,1640900362,How to stay motivated about dating... when you are unsuccessful on it.,"I  am a 30M with a good job, own apartment and have several hobbies to do  at the weekend. Quite sporty, more on the skinny side and 6ft tall.

I  have been paying tinder for 6 months and recently deleted the app  because of the poor experience. I got around 10 matches per month and I  was able to set 4 dates in the whole 6 months. None of them went into a  second date or even a kiss.

1st  one was a younger girl new in the city, we were texting the whole  afternoon abot and I finally told her I was open to meet at the weekend.  She texted me a couple of days later and we decided to go for a walk  this afternoon. We spend a couple of hours talking, I think she laughed a  lot and we had a good time. When I tried to kiss her goodbye she  refused and after that she ghosted me. Now I think since she was new in  the city just went out with the first polite guy (clearly not a rapist)  who made her feel safe to go on a walk.

2nd  was an older girl, she wanted to meet right away the afternoon we  matched. we shared similar career profiles therefore we had a lot of  things to talk, she was quite sporty and she suggested seeing each other  again and going for sports. I didnt find the right moment to kiss her  but I wasnt worried since she suggested seeing each other again. A few  days later I tried to meet her again and she told me she was busy and  later on she told me she left the city. Now I think she was bored at  home and wanted to meet just for one afternoon.

3rd  was a younger girl, she is living in a little town and I am living in  the city, I told her she could come to my city and visit some places. Of  course she did, we spend the whole day talking, walking and having  drings. She clearly stated she does not kiss on a first date (aka dont  try to kiss me). I told her no problem, and I enjoyed the rest of the  afternoon  with her. Now I think she wanted to get out of her little  town and come to the city with somebody and I was a safe option for her,  polite, educated, not a weirdo.

4th  was an older girl with similar career profile at 2nd. I was working for  some days on her city and matched with this good looking girl. She  wanted to meet right away this afternoon. I told her I was only going to  spend a couple of days on her city but she wanted to meet anyway. I  bought a little gift for her because I am grateful with people that want  to spend time with me, I obviously wouldnt try to make any move because  we were not going to see each other again. We had a good time together  and I enjoyed the time with her. She CLEARLY stated she was bored at  home, new in the city and without any friends there, I didnt care about  this and told her that was great to match and spend some good time  together. But, Now I think, as the previous 3 girls, she just was bored  at home and kind of utilized me as a safe option to hang out when all  the main options are not available. Thinking twice, I should have  refused meeting her, it was CLEAR that she was not interested  romatically on me because I dont even live on her city, she would rather  dated another guy from her city if she had the option. I feel stupid  now.

4th girl texted me week  later, but we live like 2500km away. I didnt understand that though. I  answered politely because at this time I hadn't analyzed my whole  experience . Was she playing any game? I dont know. Now I am feeling  like shit, because I always try to care about them when I go on a date  and the very few dates I got after months paying tinder were just  utilizing me when they are bored when there is no other option.

Reading  many girls on this subreddit I learnt that when a girl is interested  she puts herself on your scope, texts you, waits for your answer and  they are really willing to spend time with you OVER the rest of the  things. I also learnt that attractive guys here have girls that  GENUINELY want to spend time with them.

I really think I have many things to share with a potential partner, either for something casual or something more meaninful. I am 0% clingy and I care a lot for other people. I am trying to put my self out there, but dont want to pay tinder anymore and my options are close to zero. How to stay motivated in this situation? I dont care about rejection, I understand that probably these girls utilised me when they were bored... OK, but I do care more about the lack of opportunities.",dating,t5_2qhb1,https://www.reddit.com/r/dating/comments/rscz0b/how_to_stay_motivated_about_dating_when_you_are/
11,rsd1b9,1640900532,Does every girl who is in shape and under 26 call themselves a model these days?,Just recently started dating again. The last 3 women I went on a date with have claimed they are models. And another one a few weeks ago claimed she models in her spare time. Im not that old early 30s. And the art industry is a major part of my life. But when did every decent looking girl become a model?,dating,t5_2qhb1,https://www.reddit.com/r/dating/comments/rsd1b9/does_every_girl_who_is_in_shape_and_under_26_call/
12,rsd682,1640900897,My GF of 1 year (F.27) just told me (M.29) that she has no feelings for me.,"Me, male 29 i met this girl online around Jan/21, we talked for like 2 months then we met for the first time, she liked me and i also liked her, we agreed since the start that this gonna be a serious relationship since we both want to get married, we were very happy and cool, until problems started to fall one after another, she got problems with her parents (till now), then got Covid-19, then she lost her job and got depressed ever since.

She started avoiding talking to people sometimes when she is depressed too much, but i was patient with her, i didn't push her or anything. sometimes when we are chating i tell her ""MARRY ME"" she said 'YES' everysingle time, even tho i've never confessed my feelings for her, but she knows i love her, anyways to keep this short, since im really hurt, she asked me to meet her for a last time to see if she has feelings for me, she said that she will do her best to be in a good mood since in our last date (50days ago) she wasnt feeling well, and she said maybe her bad mood ruined her way to know hat she feelis towards me, now the date will be next week between 2-6 January, and i accualy don't know how to approach this date, because if she feels nothing she is gonna break up with me, but i LOVE HER :'(

can you guys help me through this?

PS: she confirmed to me that she will do her best to be in a good mood, to not let her depression cloud her feelings.

tl;dr: after 1 year dating, only texting, sometimes phone calls, we have been out for 2 dates, she told me that she has no feelings for me and she wants to meet me for the last time to see if there are feelings for me or no, if no she's gonna break up with me. im seeking guidance for this probably last date",dating,t5_2qhb1,https://www.reddit.com/r/dating/comments/rsd682/my_gf_of_1_year_f27_just_told_me_m29_that_she_has/
13,rsd7yh,1640901021,How to get over the anxiety of being ghosted again,"Once upon a time I got ghosted by the person I was actively in a relationship with. We were together for 3-4 months and then one day, radio silence. It was obviously a confusing and anxiety-provoking situation, but what made it worse was he had made future plans with me and we had a flight booked to meet his family in the upcoming months. 

I now have a new relationship and am terrified of the same thing happening. I know it's not me, I'm confident in myself, self-aware, and have good self-esteem. But it really messed with my head and made me feel this anxiety of getting too close to someone will end with them ghosting me again. I don't live day-to-day with this person looking for signs or in constant fear, it just gets triggered when I don't see them for an extended period of time. 

It pisses me off because I don't even think people who do ghost others (and tried to eventually come back) understand how damaging it could be, or they just completely disregard how it will effect them in future relationships. 

Anyway, anyone who has successfully overcome this type of anxiety, what did you do?",dating,t5_2qhb1,https://www.reddit.com/r/dating/comments/rsd7yh/how_to_get_over_the_anxiety_of_being_ghosted_again/
14,rsdedi,1640901483,Going out for a drink with a long-time friend of a friend: How does it usually end?,"Hi everyone,

I'm a guy (37m) that is pretty much a workaholic and have just been focussing on work and advancing my career the past few years.

As a result, and as you can imagine, I don't really get out much and me at social gatherings is becoming a rare sight, so I have virtually no interaction with the opposite sex outside of work.

In the last two years I have noticed a trend on Facebook with long-time female friends of my friends contacting me and asking if I would like to go out for a drink with them. Some of them I know from high school, others from my partying days in my 20's, some I've never even spoken to directly and others I'm a bit more familiar with.

My usual reaction is one of surprise as they tend to be totally out of the blue and unexpected and up until now I have never followed up on any of the requests to go out with them.

I might be guilty of essentially hiding behind my work and using that as an excuse to avoid any kind of social interaction, although I am also genuinely busy most of the time anyways.

Last month I got another request to go out for a drink and it was from a female I have known for some time. The last time I met her in person was a few year's back at a friend's wedding. She was dating a guy back then and I believe their relationship of a few years didn't end well and she has since been stuck on the dating app scene.

I genuinely like her and want to take her up on the offer but at my age I'm not really looking for drinking buddies or casual friendships and I'm afraid this might land into one of those categories.

I'm guessing I should just go for a drink with her first and see where things go from there. At the very least I will have an idea of what she wants and then I can decide if that is something I want too or not.

Any advice on how to manage my expectations or how to approach this?",dating,t5_2qhb1,https://www.reddit.com/r/dating/comments/rsdedi/going_out_for_a_drink_with_a_longtime_friend_of_a/
15,rsdfho,1640901565,Dating Advice for the Men on here.,"I have been dating for quite a while now and I just wanted to give some advice to the Men since I notice they have had some questions about dating.

1. First and foremost, the height thing, don't let that get you down:  If someone is going to be that shallow, then move on. They are not worth YOUR time, which is valuable. Time is the only thing here that you cannot get back. Always keep your head held up high.
2. If they don't have a car, move on: Unless you live in a city with really good transportation, I would want to know why someone does not have a car, either way, I do not want to be their taxi driver/uber/lyft. And trust me, if you date someone that doesn't have a car, then that is exactly what you will be.
3. Same thing for if they don't have a job: I don't even get onto dating apps if I wasn't working because I should be spending that time, to look for a job. Why should this be any different? How do you know that they can even keep a job, or will even work? You don't need dead weight. If they are not working, then next.
4. Keep your standards reasonable: By reasonable, I mean, don't have them too low(most of the time of what I see) or too high either. Be realistic about your expectations. Once you can zero in on what you can get, don't let anyone tell you that you don't deserve it.
5. Stop the sex talk: Ok, I get it, you want to get laid, but talking about sex right away, just makes you look desperate and pathetic. Stop with the sex talk, and no sending d%\^k pics either! The last time someone I knew did that, I was at a party, and EVERYONE saw it! Keep that for when you have established a relationship.
6. Again, your time is valuable: I can't repeat this enough. I had a date this morning with a woman that went on and on and on about her child custody hearing like I gave a shit. I am not Dr. Phil, and I cut the date 30 mins short, made an excuse and left. I won't waste my time on someone and you shouldn't waste your time either. If the date is not going well, or you see red flags, get the hell out of there. 
7. Paying: Kinda goes with #6, I don't mind paying, but if we got to a public spot and I am getting red flags, then I am splitting the check. If you already know that it will not work, then there is no point in paying. And don't do it thinking you will get sex either, because even if you do, with all the red flags, it still will not be worth it. Five seconds of heaven is not worth the drama or the hassle. Be strong.  No restaurants/drinks on the first date either. That is a bad idea and is either setting you up to either be used for money, or some sort of #metoo action. 

That is all I have so far. I don't know if everyone will agree, but just figured that I would put it out there. This can also be reverse engineered and used mostly for women too, but I don't think women are sending d%$k pics tho haha.",dating,t5_2qhb1,https://www.reddit.com/r/dating/comments/rsdfho/dating_advice_for_the_men_on_here/
16,rsdjoe,1640901846,Should I end it with my date?,"I texted her “That’s good, you’re on my mind.” to her voice message saying she is very happy staying at her best friends family’s place for Christmas and New Years as she is lonely here. And she didn’t reciprocate? No response to that text?",dating,t5_2qhb1,https://www.reddit.com/r/dating/comments/rsdjoe/should_i_end_it_with_my_date/
17,rsdr9n,1640902416,How can I stop being jealous of my ex bf?,[removed],dating,t5_2qhb1,https://www.reddit.com/r/dating/comments/rsdr9n/how_can_i_stop_being_jealous_of_my_ex_bf/
18,rsdtbv,1640902569,Got ditched by a prostitute (didn't know),"The other night I was out, this chick started talking to me, so I buy her drinks, we're talking, talking. Then she hits me with it, $200 and we can boom boom.

I'm like oh let me think about it and she tells me she's going to the bathroom for the second time (half an hour ago she was in there for 10~mins) and for whatever reason, I look to see where she's going and I see a guy talk to her, then they just go into the bathroom together.

Oof, ouchie ouchie",dating,t5_2qhb1,https://www.reddit.com/r/dating/comments/rsdtbv/got_ditched_by_a_prostitute_didnt_know/
19,rsdvz8,1640902765,How can I stop being jealous of my ex bf?,[removed],dating,t5_2qhb1,https://www.reddit.com/r/dating/comments/rsdvz8/how_can_i_stop_being_jealous_of_my_ex_bf/
20,rse06z,1640903076,SHE BLOCKED ME HELP,"So i met this girl I tinder we met up and hangout out the night went well.We talked and got something to eat then next thing u know by the end of the night we’re making out(didn’t smash).The following days we were snap chatting everyday a lot and didn’t really notice any signs till the day before she blocked me she flaked that night but said she’ll hit me up soon ,she never did and I was just suddenly blocked 2 days later on snap.With no explanation. I actually started to like this girl a little so it sucks what should I do hit her up on Instagram or just take my L and move on.On a side note we have a college class together so I might see her there..should I casually ask her or nah.",dating,t5_2qhb1,https://www.reddit.com/r/dating/comments/rse06z/she_blocked_me_help/
21,rse0ih,1640903101,I want other peoples opinions on how I look and how to possibly improve.,[removed],dating,t5_2qhb1,https://www.reddit.com/r/dating/comments/rse0ih/i_want_other_peoples_opinions_on_how_i_look_and/
