,id,created_utc,title,selftext,subreddit,subreddit_id,url
62,ofa28m,1625625831,"Girl I met on my birthday, who asked for MY number, canceled our date the day before, because of too many exes and old flames hitting her up. On the same day my grandma dies.","I really don’t ask for much for a date, just turned 28 and a month is the longest relationship I’ve ever had, which broke my former record of 2 weeks of seeing the same person. This girl and I talked back and forth for the week leading up to the date, my grandmother dies in an expected way, she had been on her death bed for 3 months now, and I had been looking forward to seeing this girl again since I’d met her, to have her drop a message why she had to cancel, namely because of multiple exes and old flames hitting her up all at once, and not wanting to get involved with anyone new just yet.

I mean I get it, and I really appreciated the honesty, but why ask for my number or tell me you weren’t seeing anyone when I asked you directly? Is it because through our messages you noticed I was a good guy that you didn’t want to mess around with and hurt so you end it quickly?

I don’t know, I’m just so sad, lonely, and tired of never having anything meaningful relationship with a woman.",dating,t5_2qhb1,https://www.reddit.com/r/dating/comments/ofa28m/girl_i_met_on_my_birthday_who_asked_for_my_number/
63,ofa2tq,1625625893,Dating when friends are all settled down,"What’s up everyone? Just wanting to get some advice. I’m a single male in my late 20s who up until recently has been completely content being single. I’ve been really trying to find my place in life and haven’t had interest in settling down. But literally all of my friends are either engaged or married and I’m feelin’ a bit lonely. I’m a pretty good looking guy, military officer, and a graduate degree in a STEM field but I have literally zero opportunities to meet women. I’m stationed a little bit outside of a big metro area but my friends aren’t too interested in adventures on the weekends and they have pretty busy lives. I hate dating apps, lots of matches but little conversation. I don’t really have a problem meeting women when I go out, I just have no idea how to actually put myself out there. Has anyone ever had to go at it alone in a city? I’m perfectly content getting out and exploring on my own, I just don’t want to look creepy as hell. Thanks for any advice!",dating,t5_2qhb1,https://www.reddit.com/r/dating/comments/ofa2tq/dating_when_friends_are_all_settled_down/
64,ofa64g,1625626245,Am I over reading the situation,I (30m) work @ a carrot 🥕 facility. There's this female who is interesting. She speaks Spanish. I do my best to try to conversant with her. Which is difficult being i only speak a little Spanish. I understand a great deal. Well to get to why I'm posting. Sometimes she will pass by me &amp; give my arm or shoulder a graze. I've been distant for fear of embarrassing myself thinking I know how to talk good Spanish &amp; end up pronouncing the words wrong. The chances we do end up passing each other she tell me hi or how I'm doing. Is she just being nice or is she wanting me to be more assertive?,dating,t5_2qhb1,https://www.reddit.com/r/dating/comments/ofa64g/am_i_over_reading_the_situation/
65,ofa83c,1625626446,I lied to my BF,"I lied to my bf saying i went to walk at the park alone when in fact i went with out girl coworker who is and has been a very good friend of mine. I felt that I was better off saying I was alone bc i felt like I would be judged for hanging out with her outside of work. 

I feel crushed and horrible that I lied and my BF is ignoring me because of it. I have been trying to communicate and talk things out to try and understand one another but he just isnt answering. 

I have asked what he wanted and if he didn’t want to be with me anymore because of it then he should just tell me, but nothing. Ive tried calling numerous times.. &amp;nothing. 

I just want to be able to communicate and see what he wants..

Idk what to at this point. I really love this guy and I messed up by lying to him. I dont want to lose him.",dating,t5_2qhb1,https://www.reddit.com/r/dating/comments/ofa83c/i_lied_to_my_bf/
66,ofa9mm,1625626602,Forever A Loner,"A few months ago I made the decision that I want to remain single for the rest of my life because of the fact society and social media has made it pointless to be in a relationship. I’ve only dated one person in my entire life and this happened over 2 years ago. We were friends for a year and a half before we dated. We dated for 6 months. He dumped me via text telling me that he has a new girlfriend. We tried to stayed friends, but it didn’t work out too well. He made me feel like I was the “side chick”. So I stopped staying in contact completely with him. It’s been over a year since that happened. I’m very young and I feel that being with someone is pointless. I’m a person who wants to get married and have a family. But it seems like it’s not worth going through due to society’s and social media’s perspective. I refuse to catch feels, have a crush, or shoot my shot because it’s a trap waiting to happen. If I see a guy that is good looking, I’ll admit that he’s good looking. I won’t catch feelings or anything. My mom, sister, and best friend thinks I’m way over my head, but I made up my mind. I rather be single for the rest of my life. Despite having bad luck with love, I’m also feel that I don’t have what a guy is looking for. I’m not a size 2 and I don’t have a pretty face. I don’t fit the bill that a guy is looking for.",dating,t5_2qhb1,https://www.reddit.com/r/dating/comments/ofa9mm/forever_a_loner/
67,ofaab6,1625626669,Finding someone?,How do you find someone in this pandemic to even just talk to? College student but it's all online so super lonely 🙁. Also not the hottest guy in the room 🤷‍♂️,dating,t5_2qhb1,https://www.reddit.com/r/dating/comments/ofaab6/finding_someone/
68,ofabo6,1625626807,"Girl said she doesn't feel a connection, but is down to hangout again should I just move on or is there still a chance?",So I met up with this girl the other week at her place and we went on a walk and watched a movie and I'm not sure if she wanted me to make a move or not because I'm bad at that if I'm gonna be real. And afterwards I texted her if she wanted to chill again and she said sure but when I asked if she wanted to cuddle and watch a movie she said she didn't feel that type of connection with me but was still down to watch a movie with me. So I'm not sure if she's completely not interested in dating me and just wants to be friends or if she has to get know me better before wanting to do intimate things like cuddling. Me personally I feel like she doesn't like me but I was just curious about feedback from others.,dating,t5_2qhb1,https://www.reddit.com/r/dating/comments/ofabo6/girl_said_she_doesnt_feel_a_connection_but_is/
69,ofae48,1625627036,Late 20s no good options left,I’m in my late 20s and I feel like all the relationship material women are taken. The only women available are fat or they were sleeping around for most of their early 20s so they have a huge body count. Should I just try my luck with college girls?,dating,t5_2qhb1,https://www.reddit.com/r/dating/comments/ofae48/late_20s_no_good_options_left/
70,ofaf1e,1625627128,I don't know why I can't get women in america,"I am a kind person.I am faithful.I have serious intentions.women in the past have said I'm attractive.but american women of all races just don't like me at all.I do look like a Muslim ethnicity and that is probably it.

But there's the thing.I do amazing on foreign dating sites.afrointroductions,filipinacupid,asian dating,latin American cupid etc I am flooded with girls .I had a long term relationship long distance with a Ethiopian girl and a filipina girl that both said I was attractive and were surprised I didn't have a gf since moving to america from Holland.one of them said I looked like a ladysman.

But the same pics I use on their that elicit wows can barely get ANY matches on tinder or any western dating site.

And the women that do match me only want my validation of choosing them.

This has made me very depressed and angry.I don't know what's wrong with me besides my MENA appearance (I'm black,native,Italian  and white biracial)if that's the reason please just be honest.it would give me peace that it's out of my control to change people's racist mindset.I do get hostility everywhere I go too.

Do you think it's just that I'm hated because of my racial appearance ?I'm not ugly at all.",dating,t5_2qhb1,https://www.reddit.com/r/dating/comments/ofaf1e/i_dont_know_why_i_cant_get_women_in_america/
71,ofai5y,1625627442,"Is it possible to date someone who rejected me in the past, or should I just move on?","A few years ago when I was 23 (f) and he was probably around 29 (m) I think, I went on maybe 3 or 4 dates with this guy. He was already a practicing attorney and I was in my second year of law school. I really liked him and I felt like we had a good connection. He gave me really good advice on navigating through law school and encouraged me in pursuits and dreams I had that I was afraid to pursue or take risks on. I think we made each other laugh and ultimately had a good connection. But then one day he texted me and told me that he knew we hadn’t gotten to the point of talking about being exclusive or in a relationship but he was really busy with an increasing work load and other obligations and he didn’t feel like it was fair to waste my time if I wanted a relationship with him and that he had a blast spending time with me and he hoped he hadn’t hurt my feelings and he wanted to maintain some sort of friendship. I had told him that it was okay, and I understood and that I still wanted to remain friends with him.  I really appreciated his honesty with this text message, and to be honest I wasn’t really free to have a good committed relationship at that time either because I was in the worst part of school. 

&amp;#x200B;

I saw him about maybe two or three months after this happened and he came to say hi to me, but I was a little awkward because I honestly did kind of have feelings for him still but he was really kind and friendly.   

So later, I made the stupid mistake of getting into a relationship with a different guy. Maybe a year later I think I heard the first guy had a short lived girlfriend, but I’m not sure. Fast forward to around November of 2020 and the guy I was dating and I broke up. I ran into the first guy at a bar, but I was there were pandemic restrictions in place and people were supposed to stay at their own tables so i didnt say hi to him, but my sister said she kept catching him looking over at us. KK fast forward a few months and pandemic restrictions are a lifted and I run into him at a restraunt. I was exhauseted I hadn’t slept all night because of a family emergency. He came to say hi and it was kind of awkward again, but cute, and both my friends said that he seemed to be interested in me. 

Later I posted about the family emergency and he sent me a really nice message and we talked a bit about what was going on and it was sentimental and comforting. I apologized to him for not being friendly when I saw him the weekend before and explained the reason why, he said he hadn’t taken it that way. 

&amp;#x200B;

He’s been liking all my pictrues on social media and we’ve been chatting a little bit, but I dont know if its all in my head, or what is going on. Or if he is interested or I am reading to much into it. 

&amp;#x200B;

He was/is everything I’ve always wanted in a romantic partner. He is an exceptionally kind and caring person, he and I share a lot of the same values, his family seems really cool. I’ve dated other guys recently and none of them are really as special as he is, like I just realized I’ve kind of shut these other guys in a way because they just are not him. 

&amp;#x200B;

So I don’t know what to do here, should I leave him alone, or should I ask him out and tell him I’d like another chance. Or was the first rejection like a hard boundary that I shouldn‘t cross?",dating,t5_2qhb1,https://www.reddit.com/r/dating/comments/ofai5y/is_it_possible_to_date_someone_who_rejected_me_in/
72,ofarar,1625628404,"I (23M) and a woman (18F) have serious crushes on each other, get along, seem compatible, but I’m having issues with the age gap.","We recently started working for the same company. Her cousin (my friend) casually introduced us to each other, about 4 months ago. Nothing but to introduce us as friends. She found me attractive from the get go, and I found her attractive as well, but I immediately forgot about it since she is still 18.  

Fast forward a couple months, we started to talk to each other when we see each other, it’s a big building so maybe for 20 minutes every couple days. She has expressed to her cousin how she has very strong feelings for me and I have started to like her more. She has the personality traits I look for in a girl. She’s also not a high school girl. She’s in college, works full time, provides for her own housing, is independent, and confident.  

So I’m talking to her cousin, I tell him I’m thinking about asking her out. He has given me his support and thinks it’s a good idea. He mentions to me she actually wants to ask me out. In person. Which has never happened to me before, and I find amazing.  

I’m worried about a couple issues. All revolving around the age. I don’t want to be seen as a creep. I don’t want to lose respect of friends, co workers, family.  

I plan on saying yes when she asks me. However my concern is if we wanted to become more serious and how people might view that.",dating,t5_2qhb1,https://www.reddit.com/r/dating/comments/ofarar/i_23m_and_a_woman_18f_have_serious_crushes_on/
73,ofaz40,1625629205,Crush on Coworker Who’s Last Day Is Tomorrow,"I apologize ahead of time, cause I’m venting and telling the story, post may be a little long.

So I started this job about 3 4 months ago, and when I start a new job I usually keep to myself until someone interacts with me. Fast forward to now I fit in perfectly with everybody, talk and connect well with most of my coworkers, although it’s a few that I’ve never said one word to, but that’s to be expected.

I recently got moved to another area in the warehouse where it’s this cute girl that I really wanted to get to know, but since she’s super shy and seems to have a little social anxiety, just approaching her like I normally would a girl I was interested in might have made her to nervous to talk, so I thought.

So I started simple, introducing myself, asking her how she was doing, how long she’s worked there, stuff like that. But I was usually carrying to conversations as she wasn’t giving me much to go off of, which is cool, in my mind she’s not interested so I’ll fall back, wouldn’t be the first time. But, we start playing this little eye tag game, where she’s starring when she thinks I’m not looking and I indulge, so I do the same back. We do this little game for about a week or so. So in my mind I’m like, at the very least she’s interested in what I got going on.

Now mind you, she literally only talks to her sister at our job who’s last day was Friday and that’s how I found out that her last day is tomorrow. Also my homie through me an oop, he told me today before our shift started that if I wanted it to talk to her, today and tomorrow is all I got. 

So today, again I said wassup, and these are my exact words, “hey wassup, I heard this is your last week.” She says “hey, and yea tomorrow is my last day.” I say “dang that sucks, just when I was starting to develop a little crush on you, what you got planned after this.” We talk a little more after that before we gotta get back to work. Weird and corny to tell her that, yes I know, but I wanted to see how she would react, or what she would say, I think it made her nervous a little bit, but that’s why I asked the follow up question “what you got planned after this,” to give her an out from that crush comment just in case that made her uncomfortable. After that we don’t see each other the rest of the shift and don’t get to talk.

Tomorrow her last day and I plan on telling that I wish her luck, wish we got to know each other a little bit more, but I’m rooting for her nonetheless, something along those lines. Now I know the easy thing to do is to just ask for her number but she hasn’t really gave me anything that would suggest she’d want to talk, which is why I told her I had a crush on her just to see what she should would do.

So I guess my question is for all of you, what would you have done differently from the beginning up until tomorrow, her last day.

Again, sorry for the long post.",dating,t5_2qhb1,https://www.reddit.com/r/dating/comments/ofaz40/crush_on_coworker_whos_last_day_is_tomorrow/
74,ofba52,1625630396,Recently received revealing picture lol…. Is she interested?,So recently a good coworker of mine sent me revealing and really hot pictures lol…the catch is she has a boyfriend… so my question is do i pursue or forget about it lol,dating,t5_2qhb1,https://www.reddit.com/r/dating/comments/ofba52/recently_received_revealing_picture_lol_is_she/
75,ofbc0o,1625630580,"I really don't want to break this vulnerable guy I've been talking to, feeling guilty and don't know how to make it better","I've recently made an amazing friend on a mental health Discord that's been supportive to me and we've shared a lot of deep stuff chatting and also hung out on voice chat. I really value him as a person, but he's in a vulnerable place and grown over attached to me and started telling me how much he craves love from me - as someone with BPD I find this terrifying. It all feels so full-on that he talks about craving love and he wants me to fill something hollow inside him and I've told him I can't do that, and it feels like too much pressure.

I've tried to tell him that we've not even video called yet, we live far away in different countries and he's moving way too quickly with stuff but he doesn't seem to see these things as problems, provided I could have feelings for him.

 I've made it clear that I want him to expect nothing from me because I can make no promises, and we should try voice chatting and video calling more. I've told him I want to support him to grow in his confidence as a friend as he has quite low self esteem with dating, and I've told him I want to help him use dating apps and give him advice about girls. But this really upset him as he says he doesn't like or want girls from a dating app, he rarely gets matches and finds using the app really de-humanizing and depressing. He said he specifically wants me or someone like, and when I suggested the other girl he'd been talking with from the app, he got really mad and said he wasn't ok. This is upsetting me as I feel attached to him emotionally.

I've told him I want to slow things down and maybe call.  I actually feel quite scared of him right now but also guilty because when I was feeling sexually frustrated I did start talking in a sexual way with him which he liked and I feel I've led him on, which is causing me guilt. I apologised for this.  


I don't know what to do about him because I fear what he's gonna do next as he's unstable and told me he was crying.",dating,t5_2qhb1,https://www.reddit.com/r/dating/comments/ofbc0o/i_really_dont_want_to_break_this_vulnerable_guy/
76,ofbdpe,1625630754,In your opinion what makes a kiss bad and can you build chemistry for it to get better?,"What are some things that make a kiss not great? I don’t mean the extremes like bad breath, aggressive biting or too wet. Like maybe it didn’t excite you, maybe he had facial hair or her lips were too thin/thick etc? Have you every experienced mediocre kissing in the beginning but they got better with time?",dating,t5_2qhb1,https://www.reddit.com/r/dating/comments/ofbdpe/in_your_opinion_what_makes_a_kiss_bad_and_can_you/
77,ofbfu2,1625630985,(23m) Finding Companionship in a Small Town," Hey guys,

After being single for my entire life, I'm currently trying to find a life partner. My current search is pretty perturbing.

I was able to get a job in a small town and I'm not sure how to find a partner. There are only two things to do: eat out and go to church. The online dating scene isn't doing that well for my region.

Does anyone have any ideas?",dating,t5_2qhb1,https://www.reddit.com/r/dating/comments/ofbfu2/23m_finding_companionship_in_a_small_town/
78,ofbrsf,1625632349,Ghosting is the best option in some(limited) cases.,"I see people on here saying ghosting is NEVER acceptable. Can you please stop? Dating is seriously complicated. Are there patterns? Should you apply rules that help you navigate such a complicated and crazy scene in a manner that creates the least amount of pain and destruction for all? Yes and yes…

However, I’m sure if people were to think about various scenarios, they could come up with tons of examples where ghosting made the most sense whilst being the kindest possible course of action. In the end, should you ghost someone? Generally speaking, of course not. But to say it’s NEVER appropriate, which a lot of people  on here do, is just flat out refusing to even consider the multitude of different situations and personalities across the dating spectrum.

Here’s a real world example. I went on a date. My date was 80 pounds heavier than she looked in her profile. She met me at the front door of the restaurant and says, “Well I’m never seeing you again.”.

So in this real world example, she is, flat out, telling me she expects that she will never see or hear from me again. After the date, we said our goodbyes and neither of us ever texted each other again. I have zero regrets.

Now I’m sure some of you will think, well that’s really not ghosting. Yeah, I’m not talking to you. I’m talking to the people who think, regardless of the situation, you just have to give the person your explanation.",dating,t5_2qhb1,https://www.reddit.com/r/dating/comments/ofbrsf/ghosting_is_the_best_option_in_somelimited_cases/
79,ofc0e5,1625633343,Dating a man with an odd nose structure,[removed],dating,t5_2qhb1,https://www.reddit.com/r/dating/comments/ofc0e5/dating_a_man_with_an_odd_nose_structure/
80,ofc1bc,1625633453,Dating a man with an odd nose structure,"Hi all,
I’m a 23M and have a ""rhino"" nose. Been laughed at my whole life by fellow classmates and have received some strange looks from strangers. Aside from the other important qualities of deeming one as attractive, ladies, do you find a nose of this shape to be a deal breaker ? Do you find it appealing? Looking for brutal honesty opinions",dating,t5_2qhb1,https://www.reddit.com/r/dating/comments/ofc1bc/dating_a_man_with_an_odd_nose_structure/
81,ofc1dm,1625633459,She does not respond much to my texts and we've been on 5 dates,[removed],dating,t5_2qhb1,https://www.reddit.com/r/dating/comments/ofc1dm/she_does_not_respond_much_to_my_texts_and_weve/
82,ofc2p8,1625633621,She (27F) does not respond much to my (28M) texts and it's been 5 dates,"Hi all, I'm in need of an advice here. A girl (27F) I (28M) have been seeing after 5 dates over the span of 2 months hasn't been responding to my texts with much substance at all (short answers and no questions back). She hasn't been the best texter since before date #1 and mentioned that she has very little experience dating.

Also, she recently got a new job and said that she's super busy. That being said, all dates/video chats were set up and planned by me and it seemed like she's not putting in much effort nowadays. We had the exclusivity talk recently and she agreed, but I feel like she's either losing interest/overly prioritizing her job (sometimes responded to me 1-2 days later). I'm afraid that she may be interested, but her comfort zone/idleness in putting in the effort is stronger than her interest in me. What do you all think? Thank you.",dating,t5_2qhb1,https://www.reddit.com/r/dating/comments/ofc2p8/she_27f_does_not_respond_much_to_my_28m_texts_and/
83,ofc300,1625633658,Suggestions to improve Match,"Hi all! I'm a new member of the product team at Match.com and am trying to get honest feedback on the app--how do you guys think the app could be improved? I'm open to any type of comment, ranging from pricing to the user interface to the quality of matches.

Additionally, as you probably know, the platform is targeted towards folks over 30 (35 to be specific) and a paywall was introduced last year. Are there any other defining characteristics that you guys have noticed?",dating,t5_2qhb1,https://www.reddit.com/r/dating/comments/ofc300/suggestions_to_improve_match/
84,ofc54l,1625633923,Looking for a date,Any girl interested in having an online date with me?,dating,t5_2qhb1,https://www.reddit.com/r/dating/comments/ofc54l/looking_for_a_date/
