,all_awardings,allow_live_comments,author,author_flair_css_class,author_flair_richtext,author_flair_text,author_flair_type,author_fullname,author_patreon_flair,author_premium,awarders,can_mod_post,contest_mode,created_utc,domain,full_link,gildings,id,is_created_from_ads_ui,is_crosspostable,is_meta,is_original_content,is_reddit_media_domain,is_robot_indexable,is_self,is_video,link_flair_background_color,link_flair_css_class,link_flair_richtext,link_flair_template_id,link_flair_text,link_flair_text_color,link_flair_type,locked,media_only,no_follow,num_comments,num_crossposts,over_18,parent_whitelist_status,permalink,pinned,pwls,retrieved_on,score,selftext,send_replies,spoiler,stickied,subreddit,subreddit_id,subreddit_subscribers,subreddit_type,thumbnail,title,total_awards_received,treatment_tags,upvote_ratio,url,whitelist_status,wls,removed_by_category,author_flair_background_color,author_flair_text_color,banned_by,edited,post_hint,preview
17,[],False,No_Coconut_9010,,[],,text,t2_cjccg23g,False,False,[],False,False,1624077241,self.dating,https://www.reddit.com/r/dating/comments/o387mi/getting_over_ex/,{},o387mi,False,True,False,False,False,True,True,False,#ea0027,dating,"[{'e': 'text', 't': 'I Need Advice'}]",19ec58c2-9f74-11e7-81a1-0e2bf15991f0,I Need Advice,light,richtext,False,False,True,5,0,False,all_ads,/r/dating/comments/o387mi/getting_over_ex/,False,6,1624086284,1,"I dated my ex for two years and ended the relationship a few months ago. I keep having days of feeling great, but I still catch myself breaking down and crying missing him even though (I know believe) he was verbally abusive (lots of gaslighting) and would make me cry a few days each week.

I know deep deep deep down I did the right thing, ending it. But why do I feel like maybe he was right, maybe I just wasn’t doing enough/maybe love is enough? I still love despite what we went through. Help :(",True,False,False,dating,t5_2qhb1,846389,public,self,getting over ex,0,[],1.0,https://www.reddit.com/r/dating/comments/o387mi/getting_over_ex/,all_ads,6,,,,,,,
18,[],False,pop-t,,[],,text,t2_cm6ccmoc,False,False,[],False,False,1624077474,self.dating,https://www.reddit.com/r/dating/comments/o389ud/stop_using_fear_of_rape_as_an_excuse_for_bad/,{},o389ud,False,False,False,False,False,False,True,False,#ffd635,dating,"[{'e': 'text', 't': 'Giving Advice'}]",7bca2c58-4211-11e5-9ecb-0e60d8112001,Giving Advice,dark,richtext,False,False,True,2,0,False,all_ads,/r/dating/comments/o389ud/stop_using_fear_of_rape_as_an_excuse_for_bad/,False,6,1624086493,1,[removed],True,False,False,dating,t5_2qhb1,846391,public,self,Stop using fear of rape as an excuse for bad behavior. Both men and women can be raped. Men and women are forced into sex at roughly equal rates. It's not an excuse for hating a whole gender or treating people like garbage.,0,[],0.57,https://www.reddit.com/r/dating/comments/o389ud/stop_using_fear_of_rape_as_an_excuse_for_bad/,all_ads,6,moderator,,,,1624078947.0,,
19,[],False,VioIetie,,[],,text,t2_cmxwyun2,False,False,[],False,False,1624077861,self.dating,https://www.reddit.com/r/dating/comments/o38dj7/i_played_myself_up_at_the_end/,{},o38dj7,False,True,False,False,False,True,True,False,#ea0027,dating,"[{'e': 'text', 't': 'I Need Advice'}]",19ec58c2-9f74-11e7-81a1-0e2bf15991f0,I Need Advice,light,richtext,False,False,False,9,0,False,all_ads,/r/dating/comments/o38dj7/i_played_myself_up_at_the_end/,False,6,1624086835,1,"So there’s this guy I really like, and we’ve been flirting for around 3 months now. At first, I didn’t really like him, and he came off as very clingy, so I was cold to him. But later on, I apologized saying how I wasn’t used to the attention. And that’s when we started talking A LOT everyday. Then we went on a date once and planned a second. He said when he gets his schedule in a week, he’ll let me know, but it’s already been a week and he even told me he DID get his schedule. But still nothing about the second date. I might be overthinking this but recently, his texts has been really dry, more and more dry. More and more inconsistent, like he does not respond as fast as he used to as well. Everyone is telling me he lost interest. I feel really heartbroken and sad, because this is the second guy I ever liked seriously and wanted a connection with. What should I do? I want to confess but at the same time I feel like it’s over, he basically rejected me already. Am I overthinking too much?",True,False,False,dating,t5_2qhb1,846401,public,self,I played myself up at the end,0,[],1.0,https://www.reddit.com/r/dating/comments/o38dj7/i_played_myself_up_at_the_end/,all_ads,6,,,,,,,
20,[],False,GayIsNay,,[],,text,t2_13jc1n,False,False,[],False,False,1624078058,self.dating,https://www.reddit.com/r/dating/comments/o38f64/talking_to_random_people/,{},o38f64,False,True,False,False,False,True,True,False,#ea0027,dating,"[{'e': 'text', 't': 'I Need Advice'}]",19ec58c2-9f74-11e7-81a1-0e2bf15991f0,I Need Advice,light,richtext,False,False,False,13,0,False,all_ads,/r/dating/comments/o38f64/talking_to_random_people/,False,6,1624087004,2,Anyone got any advice for an introvert to go up to a random person and talk to them.,True,False,False,dating,t5_2qhb1,846403,public,self,Talking to random people,0,[],1.0,https://www.reddit.com/r/dating/comments/o38f64/talking_to_random_people/,all_ads,6,,,,,,,
21,[],False,ContourOneFoot,,[],,text,t2_6i6l3,False,False,[],False,False,1624078218,self.dating,https://www.reddit.com/r/dating/comments/o38gom/did_i_over_think_this/,{},o38gom,False,True,False,False,False,True,True,False,#ff4500,dating,"[{'e': 'text', 't': 'Question'}]",a9531dce-194e-11e5-b177-0eff099c3d1f,Question,light,richtext,False,False,True,30,0,False,all_ads,/r/dating/comments/o38gom/did_i_over_think_this/,False,6,1624087150,1,"First, the irony is not lost on me by making a Reddit post about over thinking. 


Okay, so I work at a retail store that has a coffee “hut” in the parking lot. It’s mainly for drive through but there is a walk up to another window for pedestrians to order. I go there on break or when I arrive and have been for a long time now. I talk to the baristas enough to know some more intimate details of their lives like one is moving out of the country with her fiancé at the end of summer. I come from a VERY small town, (sub 1,000) to me these people have become my “friends” to some degree. And I don’t know if that feeling is just because in a small town everyone is your friend to some degree? I even went and played disc golf with one of the male baristas on a day we had off. 

One of the baristas I’ve always thought was pretty (from the mask up) but I kinda always thought she was taken or just uninterested because she never really wanted to chit-chat with me which is fine. But as of late she started being more inquisitive, randomly asking me where I went to high school, what my favorite type of music, basic stuff. But it was a noticeable change in our interactions.

I’m the type where, I won’t ask out a woman when she is on shift. She’s just working, she is doing her job, any and everything I notice about her behavior could be basically be chalked up to customer service. A couple of the barista’s and I follow eachother on Instagram and in a quick bit I found her. I decided just following her and seeing what happened would be a more appropriate way to see if she was interested.

She followed me back but when I messaged her “how was your first day at work without a mask?” I was left on seen. 

Idk it feels like I messed up? Or maybe she doesn’t think much of it. But I feel a little embarrassed. I just want to hear what someone else thinks of this situation.",True,False,False,dating,t5_2qhb1,846409,public,self,Did I over think this?,0,[],1.0,https://www.reddit.com/r/dating/comments/o38gom/did_i_over_think_this/,all_ads,6,,,,,,,
22,[],False,Franchesca8899,,[],,text,t2_73c3mcjw,False,True,[],False,False,1624079128,self.dating,https://www.reddit.com/r/dating/comments/o38pou/am_i_asking_for_too_much/,{},o38pou,False,True,False,False,False,True,True,False,#878a8c,dating,"[{'e': 'text', 't': 'Venting'}]",a616c322-194e-11e5-ab91-0ed1c06bdad7,Venting,light,richtext,False,False,False,11,0,False,all_ads,/r/dating/comments/o38pou/am_i_asking_for_too_much/,False,6,1624087960,2,"This is about many different people and many situations. I 22F am sick and tired of people treating me as a second priority. 

My friend asked me out on a date. Four hours before we were supposed to go out he said that a dinner which he has to attend before seeing me will run quite late so we can’t watch the movie which we scheduled. I said that’s alright even though I’ve been looking forward to it all week- I even got my eyebrows done. 

My friends are always suuuuuper busy seeing their boyfriends and don’t seem to have time for me, even when I plan things way in advance.

No one else wants to watch this movie with me because it’s too scary- it’s The Conjuring. 

It’s not just about the movie. Whether it be dinner plans, lunch, or any fun activity I wanna do they always have some kind of excuse that they drop on me last minute. Most people just wanna go out and get drunk which is something that I don’t wanna do.

I’m just tired, disappointed and lonely.",True,False,False,dating,t5_2qhb1,846425,public,self,Am I asking for too much?,0,[],0.75,https://www.reddit.com/r/dating/comments/o38pou/am_i_asking_for_too_much/,all_ads,6,,,,,,,
23,[],False,SuccessfulComputer80,,[],,text,t2_948yugbz,False,False,[],False,False,1624079750,self.dating,https://www.reddit.com/r/dating/comments/o38v0e/my_girlfriend_hasnt_talked_to_me_in_two_weeks/,{},o38v0e,False,False,False,False,False,False,True,False,#ea0027,dating,"[{'e': 'text', 't': 'I Need Advice'}]",19ec58c2-9f74-11e7-81a1-0e2bf15991f0,I Need Advice,light,richtext,False,False,True,0,0,False,all_ads,/r/dating/comments/o38v0e/my_girlfriend_hasnt_talked_to_me_in_two_weeks/,False,6,1624088492,1,[removed],True,False,False,dating,t5_2qhb1,846434,public,self,"My girlfriend hasn't talked to me in two weeks, what should I do",0,[],1.0,https://www.reddit.com/r/dating/comments/o38v0e/my_girlfriend_hasnt_talked_to_me_in_two_weeks/,all_ads,6,moderator,,,,,,
24,[],False,lil_slurpie,,[],,text,t2_4c90923m,False,False,[],False,False,1624080563,self.dating,https://www.reddit.com/r/dating/comments/o391j9/i_am_not_the_ideal_match_for_my_type/,{},o391j9,False,True,False,False,False,True,True,False,#ea0027,dating,"[{'e': 'text', 't': 'I Need Advice'}]",19ec58c2-9f74-11e7-81a1-0e2bf15991f0,I Need Advice,light,richtext,False,False,True,3,0,False,all_ads,/r/dating/comments/o391j9/i_am_not_the_ideal_match_for_my_type/,False,6,1624089166,1,"So I don’t know if it’s more so if an personality thing or it’s person to person. but I noticed in the broad viewing that I’m not the ideal match for my type. I like as corney as it sounds emo and e-girl type personality and clothing choice. But at the same time I’m don’t dress or have the personality like that, it could be seen as the exact opposite 😂. Should I give up or keep on trying my luck with this type?",True,False,False,dating,t5_2qhb1,846439,public,self,I am not the ideal match for my type,0,[],1.0,https://www.reddit.com/r/dating/comments/o391j9/i_am_not_the_ideal_match_for_my_type/,all_ads,6,,,,,,,
25,[],False,robinkhokhar,,[],,text,t2_ro9rt,False,False,[],False,False,1624080733,self.dating,https://www.reddit.com/r/dating/comments/o392zz/you_can_date_on_facebook_for_free/,{},o392zz,False,False,False,False,False,False,True,False,#ffb000,,"[{'e': 'text', 't': 'Tinder/Online Dating'}]",5214d2ac-61f1-11e8-8bb1-0ed15e4a39c0,Tinder/Online Dating,dark,richtext,False,False,True,2,0,False,all_ads,/r/dating/comments/o392zz/you_can_date_on_facebook_for_free/,False,6,1624089316,1,[removed],True,False,False,dating,t5_2qhb1,846442,public,self,You can date On Facebook for free.,0,[],1.0,https://www.reddit.com/r/dating/comments/o392zz/you_can_date_on_facebook_for_free/,all_ads,6,moderator,,,,,,
26,[],False,robinkhokhar,,[],,text,t2_ro9rt,False,False,[],False,False,1624080832,self.dating,https://www.reddit.com/r/dating/comments/o393uo/you_can_do_online_dating_on_facebook/,{},o393uo,False,False,False,False,False,False,True,False,#ffb000,,"[{'e': 'text', 't': 'Tinder/Online Dating'}]",5214d2ac-61f1-11e8-8bb1-0ed15e4a39c0,Tinder/Online Dating,dark,richtext,False,False,True,2,0,False,all_ads,/r/dating/comments/o393uo/you_can_do_online_dating_on_facebook/,False,6,1624089399,1,[removed],True,False,False,dating,t5_2qhb1,846443,public,self,You can Do Online dating on Facebook,0,[],1.0,https://www.reddit.com/r/dating/comments/o393uo/you_can_do_online_dating_on_facebook/,all_ads,6,moderator,,,,,,
27,[],False,Ambitious-Ring-2789,,[],,text,t2_cq3630q7,False,False,[],False,False,1624080836,self.dating,https://www.reddit.com/r/dating/comments/o393w0/am_available_for_meet_up_anyone_interested_dm_me/,{},o393w0,False,False,False,False,False,False,True,False,#24a0ed,,"[{'e': 'text', 't': 'Long Distance'}]",5dc9d60a-cc75-11eb-86e9-0ea78081bf43,Long Distance,dark,richtext,False,False,True,2,0,False,all_ads,/r/dating/comments/o393w0/am_available_for_meet_up_anyone_interested_dm_me/,False,6,1624089402,1,[removed],True,False,False,dating,t5_2qhb1,846443,public,self,Am available for meet up anyone interested dm me and you can also add me on my snap : soniacory21,0,[],1.0,https://www.reddit.com/r/dating/comments/o393w0/am_available_for_meet_up_anyone_interested_dm_me/,all_ads,6,reddit,,,,,,
28,[],False,HunterAnii,,[],,text,t2_79qne5bm,False,False,[],False,False,1624081222,self.dating,https://www.reddit.com/r/dating/comments/o396y5/not_sure_where_we_stand/,{},o396y5,False,True,False,False,False,True,True,False,#ea0027,dating,"[{'e': 'text', 't': 'I Need Advice'}]",19ec58c2-9f74-11e7-81a1-0e2bf15991f0,I Need Advice,light,richtext,False,False,False,6,0,False,all_ads,/r/dating/comments/o396y5/not_sure_where_we_stand/,False,6,1624089720,1,"I went on 2 dates with a girl I met online and talked to for about 3 weeks. we both had a great time. we kissed, held hands, hugged etc etc. But she's going away and coming back in 2 months. Now I am not sure what to do or where we stand because we never directly stated what we are.",True,False,False,dating,t5_2qhb1,846447,public,self,Not sure where we stand..,0,[],1.0,https://www.reddit.com/r/dating/comments/o396y5/not_sure_where_we_stand/,all_ads,6,,,,,,,
29,[],False,TigerAgreeable6809,,[],,text,t2_8xi4aqht,False,False,[],False,False,1624081322,self.dating,https://www.reddit.com/r/dating/comments/o397pm/alone_for_5_years_changes_you/,{},o397pm,False,True,False,False,False,True,True,False,#878a8c,dating,"[{'e': 'text', 't': 'Venting'}]",a616c322-194e-11e5-ab91-0ed1c06bdad7,Venting,light,richtext,False,False,False,37,0,False,all_ads,/r/dating/comments/o397pm/alone_for_5_years_changes_you/,False,6,1624089798,4,"So im 28 male, single and f*cking lonely for the last 5 years. Tried everything. Im not even that ugly. 

Dates with no chemistry (the girls never like me) so not much of a decent hug during all this time! 

I feel like with this experience i can say that eventually you feel NORMAL being alone, as sad as this may sound. 

You dont feel bad on Valentine's Day or on your birthday, you just live through. 

Its like if you loose your emotions. I cant even find a better way than that to describe it. 

I cant say for every single person and their needs, but you CAN survive living lonely and alone. Even if it makes you depressed. 

I know the disappointment of going back from a date where not only goes wrong, but the girl abandons you in the middle of the date cause you are not a tall muscular hot guy. 

People can be mean to you and they dont really give a f*ck about it. 

I dont expect nothing from Tinder anymore, its always the same thing. 

What i realize is the less you show interest on a girl that REALLY IS into you, the more she will like you. If she is just needy she will forget you in a few days and move on. 

You can survive lonely, not being happy tho, but most of you will handle. 

Many will go through dozens of date until something good come up. At least it PROBABLY wont be 5 years. 

Finally, dont ask others for love, this shit gotta be real. Each one of you deserve REAL LOVE. 

Hope you all have a great weekend.",True,False,False,dating,t5_2qhb1,846450,public,self,Alone for 5 years changes you,0,[],0.75,https://www.reddit.com/r/dating/comments/o397pm/alone_for_5_years_changes_you/,all_ads,6,,,,,,,
30,[],False,divergentamoeba,,[],,text,t2_5o82w8jm,False,False,[],False,False,1624081494,self.dating,https://www.reddit.com/r/dating/comments/o3993e/im_confused_need_advice/,{},o3993e,False,True,False,False,False,True,True,False,#ea0027,dating,"[{'e': 'text', 't': 'I Need Advice'}]",19ec58c2-9f74-11e7-81a1-0e2bf15991f0,I Need Advice,light,richtext,False,False,True,8,0,False,all_ads,/r/dating/comments/o3993e/im_confused_need_advice/,False,6,1624089947,1,"Hey !! I'm a 17yo guy. I am preparing for a pretty important college entrance exam (JEE in India). I am a pretty good student and mostly the school topper. I really didn't enjoy online classes in lockdown and about October of last year I got into a relationship with a girl (Let's call her X)... 

 Her last bf of 3 years dumped her as he had to focus on his college career and exams. Also, the situation at her place is not that great and she's very disconnected from the rest of her family too. All this caused her to have major mental health issues and she's in depression and has abandonment issues as well... 

I really love her but our conversations are like i'm more of her therapist than her boyfriend and I really try to solve her issues or guide her through it. This is taking a toll on my mental health as well as studies. I'm usually a really cheerful guy who gets along with all the cliques in school but nowadays I rarely speak to anyone plus my marks have dropped from around 96/100 to 65/100.

I really care about her so i'm conflicted about what to do and how to break it to her or not...

Option 1: I continue the relationship but take a break of 6 months or so which will be extremely difficult for her as she's really attached

Option 2: I break up with her and focus on my studies and prioritize my mental health. If anything, I can try to patch up again after my exams if both of us are still interested.

Sorry for the long message but I just needed to give you an idea of what i'm going through. Thank you so much for reading this and I'm looking forward to your suggestion",True,False,False,dating,t5_2qhb1,846452,public,self,I'm confused !! Need Advice !!,0,[],1.0,https://www.reddit.com/r/dating/comments/o3993e/im_confused_need_advice/,all_ads,6,,,,,,,
31,[],False,Mendizzy7,,[],,text,t2_1az74xmj,False,False,[],False,False,1624082280,self.dating,https://www.reddit.com/r/dating/comments/o39flt/i_am_30_years/,{},o39flt,False,True,False,False,False,True,True,False,#ffb000,,"[{'e': 'text', 't': 'Tinder/Online Dating'}]",5214d2ac-61f1-11e8-8bb1-0ed15e4a39c0,Tinder/Online Dating,dark,richtext,False,False,False,2,0,False,all_ads,/r/dating/comments/o39flt/i_am_30_years/,False,6,1624090629,1,"It seems all the dating scene is gone. Everything is reduced to dating apps and people in those dating apps scamming people out of money or cards. Is there anything out there in the world.? I have this boomer mentality that I am
Going to meet someone and she’s going to be amazing I guess I am in LA La LA land. I am from LA and I am looking to find my “soul mate” If you want to talk let me know. I am whiling to text you and get to know you. Not desperate just want to bunk my theory.",True,False,False,dating,t5_2qhb1,846459,public,self,I am 30 years,0,[],1.0,https://www.reddit.com/r/dating/comments/o39flt/i_am_30_years/,all_ads,6,,,,,,,
32,[],False,[deleted],,,,,,,,[],False,False,1624083194,self.dating,https://www.reddit.com/r/dating/comments/o39mwc/advice_to_men_310_wins_is_a_great_dating_average/,{},o39mwc,False,False,False,False,False,False,True,False,#ffd635,dating,"[{'e': 'text', 't': 'Giving Advice'}]",7bca2c58-4211-11e5-9ecb-0e60d8112001,Giving Advice,dark,richtext,False,False,True,36,0,False,all_ads,/r/dating/comments/o39mwc/advice_to_men_310_wins_is_a_great_dating_average/,False,6,1624091389,1,[deleted],True,False,False,dating,t5_2qhb1,846475,public,default,Advice to Men: 3/10 wins is a great dating average,0,[],1.0,https://www.reddit.com/r/dating/comments/o39mwc/advice_to_men_310_wins_is_a_great_dating_average/,all_ads,6,deleted,,dark,,,,
33,[],False,[deleted],,,,,,,,[],False,False,1624083195,self.dating,https://www.reddit.com/r/dating/comments/o39mws/love_in_colorado/,{},o39mws,False,False,False,False,False,False,True,False,#ffb000,,"[{'e': 'text', 't': 'Tinder/Online Dating'}]",5214d2ac-61f1-11e8-8bb1-0ed15e4a39c0,Tinder/Online Dating,dark,richtext,False,False,True,2,0,False,all_ads,/r/dating/comments/o39mws/love_in_colorado/,False,6,1624091391,1,[deleted],True,False,False,dating,t5_2qhb1,846475,public,default,Love in Colorado,0,[],1.0,https://www.reddit.com/r/dating/comments/o39mws/love_in_colorado/,all_ads,6,deleted,,dark,,,,
34,[],False,adebayoojo4real,,[],,text,t2_70g3kv48,False,False,[],False,False,1624083319,self.dating,https://www.reddit.com/r/dating/comments/o39nxl/what_would_you_do/,{},o39nxl,False,True,False,False,False,True,True,False,#ff4500,dating,"[{'e': 'text', 't': 'Question'}]",a9531dce-194e-11e5-b177-0eff099c3d1f,Question,light,richtext,False,False,True,6,0,False,all_ads,/r/dating/comments/o39nxl/what_would_you_do/,False,6,1624091493,1,"supposing you have a girl friend/boyfriend that you so much love and cherish, but it happens both of you could not end up in marriage.

the question now is :

As a guy/lady will you still sustain your friendship with such person even after marrying another person or knowing that you both can't end up in marriage.",True,False,False,dating,t5_2qhb1,846479,public,self,What would you do,0,[],1.0,https://www.reddit.com/r/dating/comments/o39nxl/what_would_you_do/,all_ads,6,,,,,,,
35,[],False,so6_666,,[],,text,t2_biu4n7h3,False,False,[],False,False,1624084158,self.dating,https://www.reddit.com/r/dating/comments/o39umd/almost_every_guy_i_online_date_turns_out_to_be/,{},o39umd,False,False,False,False,False,False,True,False,#ffb000,,"[{'e': 'text', 't': 'Tinder/Online Dating'}]",5214d2ac-61f1-11e8-8bb1-0ed15e4a39c0,Tinder/Online Dating,dark,richtext,False,False,True,0,0,False,all_ads,/r/dating/comments/o39umd/almost_every_guy_i_online_date_turns_out_to_be/,False,6,1624092173,1,[removed],True,False,False,dating,t5_2qhb1,846488,public,self,Almost every guy I online date turns out to be cunts the moment i give them my socials.,0,[],1.0,https://www.reddit.com/r/dating/comments/o39umd/almost_every_guy_i_online_date_turns_out_to_be/,all_ads,6,automod_filtered,,,,,,
36,[],False,havefun_gofast,,[],,text,t2_3pujgwl2,False,False,[],False,False,1624084589,self.dating,https://www.reddit.com/r/dating/comments/o39y61/signs_actions_signifying_attraction/,{},o39y61,False,True,False,False,False,True,True,False,#ff4500,dating,"[{'e': 'text', 't': 'Question'}]",a9531dce-194e-11e5-b177-0eff099c3d1f,Question,light,richtext,False,False,True,15,0,False,all_ads,/r/dating/comments/o39y61/signs_actions_signifying_attraction/,False,6,1624092529,1,"I have no issues talking with women, but I am horrible at reading signs. Ladies, can you please provide some insight into how you present youself to men who you are interested in? Thanks!",True,False,False,dating,t5_2qhb1,846496,public,self,Signs &amp; actions signifying attraction,0,[],1.0,https://www.reddit.com/r/dating/comments/o39y61/signs_actions_signifying_attraction/,all_ads,6,,,,,,,
37,[],False,Elina33a,,[],,text,t2_cmzdw03f,False,False,[],False,False,1624085074,self.dating,https://www.reddit.com/r/dating/comments/o3a1y2/sex/,{},o3a1y2,False,False,False,False,False,False,True,False,#46d160,,"[{'e': 'text', 't': 'Success!'}]",6b44dc18-cc88-11eb-95f2-0ed00be16b15,Success!,dark,richtext,False,False,True,8,0,False,all_ads,/r/dating/comments/o3a1y2/sex/,False,6,1624092914,0,[removed],True,False,False,dating,t5_2qhb1,846507,public,self,Sex,0,[],0.5,https://www.reddit.com/r/dating/comments/o3a1y2/sex/,all_ads,6,reddit,,,,,,
