,all_awardings,allow_live_comments,author,author_flair_css_class,author_flair_richtext,author_flair_text,author_flair_type,author_fullname,author_is_blocked,author_patreon_flair,author_premium,awarders,can_mod_post,contest_mode,created_utc,domain,full_link,gildings,id,is_created_from_ads_ui,is_crosspostable,is_meta,is_original_content,is_reddit_media_domain,is_robot_indexable,is_self,is_video,link_flair_background_color,link_flair_css_class,link_flair_richtext,link_flair_template_id,link_flair_text,link_flair_text_color,link_flair_type,locked,media_only,no_follow,num_comments,num_crossposts,over_18,parent_whitelist_status,permalink,pinned,pwls,retrieved_on,score,selftext,send_replies,spoiler,stickied,subreddit,subreddit_id,subreddit_subscribers,subreddit_type,thumbnail,title,total_awards_received,treatment_tags,upvote_ratio,url,whitelist_status,wls,removed_by_category,post_hint,preview,author_cakeday
53,[],False,catchingnails,,[],,text,t2_9y40migi,False,False,False,[],False,False,1629620219,self.dating,https://www.reddit.com/r/dating/comments/p98qxu/how_do_you_balance_being_confident_and_being/,{},p98qxu,False,True,False,False,False,True,True,False,#ea0027,dating,"[{'e': 'text', 't': 'I Need Advice'}]",19ec58c2-9f74-11e7-81a1-0e2bf15991f0,I Need Advice,light,richtext,False,False,True,7,0,False,all_ads,/r/dating/comments/p98qxu/how_do_you_balance_being_confident_and_being/,False,6,1629620231,1,"I know confidence is very attractive, and no one wants to hear someone go on about their insecurities, but I also know that being honest and vulnerable with one another is what deepens a relationship. How do I stop feeling like no one wants to know that much about me, or to see me as a shy, self-conscious person and just let someone in?",True,False,False,dating,t5_2qhb1,967515,public,self,How do you balance being confident and being vulnerable with the person you’re dating?,0,[],1.0,https://www.reddit.com/r/dating/comments/p98qxu/how_do_you_balance_being_confident_and_being/,all_ads,6,,,,
54,[],False,Air-Constant,,[],,text,t2_7m2edhmw,False,False,False,[],False,False,1629620568,self.dating,https://www.reddit.com/r/dating/comments/p98t4g/my_dating_life_is_a_joke/,{},p98t4g,False,True,False,False,False,True,True,False,#ea0027,dating,"[{'e': 'text', 't': 'I Need Advice'}]",19ec58c2-9f74-11e7-81a1-0e2bf15991f0,I Need Advice,light,richtext,False,False,False,10,0,False,all_ads,/r/dating/comments/p98t4g/my_dating_life_is_a_joke/,False,6,1629620579,1,"Ok my friends, first of all I don't want to brag about a single thing about me or my life (since I am very depressed about both of them). But I am truly losing any hope. Sorry in advance for the lenght. English is not my main language.

First of all, people constantly say me that I have a very good personality (caring, funny and entertaining. I like talking about history and philosophy. I read a lot) and model tier looks (you can check my pics on my profile. I am also 6'1).

Let's go now for the three ""advices"" that people give me every single time I vent about my singleness:

1- ""That's a matter of time"". Absolutely false. I see people that jump from a relationship to another in a matter of days / weeks, while for me, I had a bunch of lame and short relationships and a single LTR ended about 2 years ago. Since then, nothing. I tried everything, but nothing. Not even a single kiss lmao.

2- ""Work on yourself bro"". Lame and pretty unrespectful advice imo. I have many friends (and with many I mean around 30 people I hang out with regularly), I work, have cool hobbies, perfect personal hygiene and I am graduating very well in Uni. But everything seems to be useless. People are interested in nothing but themselves. Plus, I hate social. I am a pretty timid person. I don't like to brag every day on a social about my life posting my pics. Fun fact: menawhile I see sociopaths that get a different girl every month.

3- ""Hit the gym"". I literally work as a nude model for people that learns to draw. So yea, I lift. Since 2018. Lmao.

The only girl that is sincerely interested in me lives in another country (fml) and here, in my country, all I've got for these 2 years is ghosting, rejections and so on. I tried Tinder and made a ton of matches (about ~130) but every single time, if I manage to meet these girls, they see me only as a friend or simply Ghost me after the first date.

So, if my personality, my looks and my social / working life are fine, what the hell am I supposed to do at this point? Conquering a freakin star? Lmao.",True,False,False,dating,t5_2qhb1,967523,public,self,My dating life is a joke,0,[],1.0,https://www.reddit.com/r/dating/comments/p98t4g/my_dating_life_is_a_joke/,all_ads,6,,,,
55,[],False,anti-Griefer,,[],,text,t2_6d46mnrz,False,False,False,[],False,False,1629620655,self.dating,https://www.reddit.com/r/dating/comments/p98tnq/the_people_i_date_usually_dont_appreciate_me/,{},p98tnq,False,True,False,False,False,True,True,False,#ea0027,dating,"[{'e': 'text', 't': 'I Need Advice'}]",19ec58c2-9f74-11e7-81a1-0e2bf15991f0,I Need Advice,light,richtext,False,False,True,4,0,False,all_ads,/r/dating/comments/p98tnq/the_people_i_date_usually_dont_appreciate_me/,False,6,1629620665,1,"When I'm dating someone they always walk all over me. Never make effort, always late, don't try to look nice.

 Why?",True,False,False,dating,t5_2qhb1,967527,public,self,The people I date usually don't appreciate me,0,[],1.0,https://www.reddit.com/r/dating/comments/p98tnq/the_people_i_date_usually_dont_appreciate_me/,all_ads,6,,,,
56,[],False,Kind_Win_7484,,[],,text,t2_e2f8vh6b,False,False,False,[],False,False,1629621433,self.dating,https://www.reddit.com/r/dating/comments/p98yqi/has_dating_impacted_your_gutinstincts/,{},p98yqi,False,False,False,False,False,False,True,False,#ea0027,dating,"[{'e': 'text', 't': 'I Need Advice'}]",19ec58c2-9f74-11e7-81a1-0e2bf15991f0,I Need Advice,light,richtext,False,False,True,2,0,False,all_ads,/r/dating/comments/p98yqi/has_dating_impacted_your_gutinstincts/,False,6,1629621444,1,[removed],True,False,False,dating,t5_2qhb1,967540,public,self,Has dating impacted your gut/instincts?,0,[],0.99,https://www.reddit.com/r/dating/comments/p98yqi/has_dating_impacted_your_gutinstincts/,all_ads,6,moderator,,,
57,[],False,TAOGtenetGOAT,,[],,text,t2_czectrg1,False,False,False,[],False,False,1629621774,self.dating,https://www.reddit.com/r/dating/comments/p990wk/early_dates_first_moves/,{},p990wk,False,True,False,False,False,True,True,False,#ea0027,dating,"[{'e': 'text', 't': 'I Need Advice'}]",19ec58c2-9f74-11e7-81a1-0e2bf15991f0,I Need Advice,light,richtext,False,False,True,6,0,False,all_ads,/r/dating/comments/p990wk/early_dates_first_moves/,False,6,1629621784,1,"Let’s keep this short and sweet: On a first/second date, how should I go in for a more romantic move to really show her my feelings (more than the occasional flirty chatting)?",True,False,False,dating,t5_2qhb1,967541,public,self,Early dates - first moves,0,[],1.0,https://www.reddit.com/r/dating/comments/p990wk/early_dates_first_moves/,all_ads,6,,,,
58,[],False,HacksMe,,[],,text,t2_12h19r,False,False,False,[],False,False,1629622030,self.dating,https://www.reddit.com/r/dating/comments/p992iu/how_much_time_do_you_give_to_see_if_theres_a/,{},p992iu,False,True,False,False,False,True,True,False,#ea0027,dating,"[{'e': 'text', 't': 'I Need Advice'}]",19ec58c2-9f74-11e7-81a1-0e2bf15991f0,I Need Advice,light,richtext,False,False,True,4,0,False,all_ads,/r/dating/comments/p992iu/how_much_time_do_you_give_to_see_if_theres_a/,False,6,1629622041,1,I’ve (23M) been using dating apps on and off for a few years now and haven’t found someone that I have a connection with. The women I match with are very good looking and usually have similar interests. Even then it’s hard for me to be attracted to them. I feel like I’m forcing interest in them and it makes texting feel like a chore to be honest. So how long do you give someone to see if there’s a connection? Do you decide during the texting phase or wait until the first date or later to make a judgement?,True,False,False,dating,t5_2qhb1,967542,public,self,How much time do you give to see if there’s a connection,0,[],1.0,https://www.reddit.com/r/dating/comments/p992iu/how_much_time_do_you_give_to_see_if_theres_a/,all_ads,6,,,,
59,[],False,IllustriousBit8871,,[],,text,t2_86zt69ii,False,False,False,[],False,False,1629622299,self.dating,https://www.reddit.com/r/dating/comments/p9944z/you_need_to_shower_shawty/,{},p9944z,False,True,False,False,False,True,True,False,#ffb000,,"[{'e': 'text', 't': 'Tinder/Online Dating'}]",5214d2ac-61f1-11e8-8bb1-0ed15e4a39c0,Tinder/Online Dating,dark,richtext,False,False,False,6,0,False,all_ads,/r/dating/comments/p9944z/you_need_to_shower_shawty/,False,6,1629622310,1,"Okay so it wasnt really like a date more of a meet thingy idk. So like rwo weeks ago I matched with this girl, we started talking and it went good. She was kinda weird and had some drug problems but im kinda used to people having that so I ignored that red flag and thought I would give her a shot. We talked through snapchat alot, and her intentions were crystal clear. She was reaaaally into me, even told me that her self. Eventually I just asked if she wanted too meet so I invited her to my studio to listen to some music and smoke a joint. She pulls up and I let her in. We sit down and listen to some music while I roll. Right off the bat she pulls up her phone and uses it. At first I didnt think much of it cus I was rolling a joint. We went outside, smoked then went in again. This is where she started to just stare into her phone and barely talked to me. Whenever I tried to spark up a convo it was very short lived. And whenever she had something to say it was either about her wanting to get fucked up on stims or alcohol or that shes so depressed. Plus she smelled fucking horrible. Like i dont mean that “its been a long day” type of sweat I mean that “I aint got no shower cus showering is bad “ type of sweat. She fucking hated everything. Now I aint saying she wrong for being depressed but this girl was fucking hopeless. I got so bored I called a friend and asked if he wanted come and chill and he was on his way. I asked of she was hungry and she replied that she wasnt but hadnt eaten today. So me being who I am I bought her hella food cus not eating is fucking stupid and nobody gon die in my watch. On the way from where we got food we met up with my friend and was so happy. We went back to the stu and I just forgot about her. Eventually i had to go home so we all walked to the tram station. It was like a 25 minute walk and the whole way this girl put her hood up, put on headphones walked behind us. At this point I did not give a single flying fuck about her. When we got to the tram station her tram was arriving in 15 mins. I didnt feel like waiting for her tram to get there so I just said bye and left. Luckily didnt have to take a tram home so I just walked and talked to my friend about how fucked this girl was. 

Moral of the story never ignore red flags, even if its minor. Dont waste time on some smelly",True,False,False,dating,t5_2qhb1,967548,public,self,You need to shower shawty,0,[],1.0,https://www.reddit.com/r/dating/comments/p9944z/you_need_to_shower_shawty/,all_ads,6,,,,
60,[],False,amahtez,,[],,text,t2_8yy6xa6o,False,False,False,[],False,False,1629622799,self.dating,https://www.reddit.com/r/dating/comments/p997b0/did_i_say_or_do_something_that_causes_her_to/,{},p997b0,False,True,False,False,False,True,True,False,#ea0027,dating,"[{'e': 'text', 't': 'I Need Advice'}]",19ec58c2-9f74-11e7-81a1-0e2bf15991f0,I Need Advice,light,richtext,False,False,True,12,0,False,all_ads,/r/dating/comments/p997b0/did_i_say_or_do_something_that_causes_her_to/,False,6,1629622809,1,"It's not like I go out of my way to **TELL THE ENTIRE WORLD THAT HOOK-UP CULTURE IS GROSS!!!**

I really don't care for how people live their lives, I have my own problems to worry about, and by problems I mean *things that keep me up at night.*

I don't feel the need to judge others, yet alone belittle them; I always felt that it was a very **pathetic** thing to do and comes from some sort of personal insecurity; I mean.... *if I'm accomplished and content with my life and continue to strive for the things that give my own life meaning, value, worth and happiness; why would I ever waste my time demeaning someone else's life?* **Anyone else agree???**

The part is people just can't grasp that you can exercise preference, without necessarily *insulting* them, I am not saying you aren't *valuable* I just don't think we are **compatible.**

I had matched with this woman on tinder, not only did she catch me eye but I also got anxiety while texting her lol. **I was extremely attracted to her!** it almost felt to good too be true. We spent several days exchanging texts and also facetiming, it felt so natural. 
The chemistry was undeniable, and she insisted that **we meet up and hang out.**

She asked me out, and I was very ecstatic! I didn't want to get my hopes up that she may be a potential lover, but even as a friend I'd be happy because *she just wasn't all beauty, she had brains and a very intoxicating personality that just made time go by so fast everytime I interacted with her!*

I was okay to be her friend in case things didn't workout, I didn't have it necessarily in my mind that we would date; possibility but not a probability. 

Anyways, we hung out the first time, and it was **magical.** This woman showered me in so many compliments I felt like Brad Pitt! I've always been told I'm extremely attractive but it's hard to believe other people's compliments when you don't think too highly of yourself. I don't necessarily have low self-esteem **I just don't I'm all that.** Past relationships shown me *how quickly I can be replaced* so clearly I can't be that good looking lol.

She was funny, sweet, thoughtful and generous! I had to fight her to let me pay the bill. **By the 3rd time we went out, I had it already in my mind that she would make a life long friend If we decided not to date, just because I saw that much value in her as a person; people like her you keep around, they add tremendous joy to your life, and life is just suffering so why not suffer with someone who makes you happy?**

In the midst of our third date, we decided to eat out at a pretty nice spot, and then she kind of interrogated me about sex lol. I got really shy because I just get anxiety talking about sex to people because it's usually something I'm extremely private about and really only discuss it with my partner. She questioned me on *kinks, fetishes, favorites, to-do's &amp; not-to-do's and it got down to size.* I just got hit with questions and although I answered truthfully, my face was at pink as bubble gum just because I was super shy and anxious talking about it. **She told me it was cute that I'm so shy about it and that I probably wasn't a** *""F#ck boy""* which didn't make any sense to me. 

This is where things went south, she asked me about my partner history *(the amount of people I've been with)* and I told her the truth, only **4,** and she just refused to believe me. She kept calling me a liar and was obviously getting annoyed. But I had to really explain to her a timeline to get her to shut up about it, it didn't make sense why 4 people was such a big deal. **I pretty much told her that I've only been in 4 relationships, all serious; and those are the only 4 women I've been with and cared to be with at the time.**

She said it was *""weird, and suspect""* which I asked, why? Why would that be weird. Is it because it was 4 serious relationships? I know it sounds like a lot. So I went on to explain to her how all 4 ended since I'm still relatively young **(only 25 atm)**.

1. H.S sweet heart, we broke up because she wanted to ""experiment"" with dating while in college. I didn't care to beg for her to stay since I'm pretty sure this was premeditated. Needless to say, this hurt deeply. 
2. Old best friend, great girl, decided to take things further. Was an amazing relationship, but I was moving and she couldn't come because she pretty much established her career in our home city. Painful breakup but still friends. 
3. Old coworker, she cheated sadly. Apparently, I didn't ""give her enough attention"". Shotgun wound to the chest. 
4. Wonderful girl I forced myself to date to stop grieving over being cheated on. Therapist said terrible idea, I didn't care. We eventually agreed to be friends when I realized it wasn't right to try and ""replace"" my ex, she began dating someone else. Ironically, around the time I stopped grieving and started dating again she just happened to be single. We dated, it was amazing, but she wanted to get married and have kids **now** but I wanted to wait just because I was still traumatized &amp; wanted to get to know her a bit more. She refused to compromise and left. Very tough situation but at least she apologized, I offered her friendship, she wanted to ""try again"" but the damage was done. Still friends. 
(Whats wrong with waiting so I can thoroughly get to know you? I just wanted to protect my heart :-/)

After I told her all of this, she finally understood and dropped this preconceived notion that I was *""lying""*, she said usually men have way more partners and its not often you see someone like me with so little.. I  explained to her that I can't really have sex with someone I don't love, because I don't have a desire too; that's why I haven't been with a lot of people. She questioned me further to dig deeper and I just told her how I felt. **I don't do hookups because I think I'm worth more than an orgasm that's all. I deserve to be loved, appreciated and cared for, and I'm not just a penis a girl can use for a climax, I'm a human being with feelings and would rather date and have sex with someone meaningful than give my body to someone where to them I'd be meaningless. I told her I'm not just a number for another girls body count, and I have more value than that.** When she said what do I think about people who do hook-up often and have been with a lot of people, I told her I personally thought it was gross and I told her about my teammates back in the football team who would just run through every girl on campus and how disgusting I thought it was.

**She snapped on me, and said I was insecure and projecting my own insecurities.** Then she told me she's been with 32 different people and doesn't feel ""disgusting"", she pretty much just snapped and got offended but I never meant to offend her, she kept asking questions and I transparently let her know how I think AND  why I reason this way, I was just being sincere with someone I thought would be a great friend and potentially a great lover.

She ended up calling me an insecure misogynist and said I have ""little dick energy"" but why? Why would she say such cruel things to me? I don't have insecurities outside of the insecurity I got from the trauma of my ex cheating and none of it is a physical or societal insecurity, it's just an insecurity that the person I love won't be loyal to me. That's all.

But why would she say such hurtful things and make statement that weren't true? It hurt a lot, to be honest.

I was so flabbergasted by what she said that I ended the date right there. I opted to pay since I thought it'd be a gift for the pleasant memories prior to this, and dropped her home. We haven't spoken since. 

Why would someone react this way? Can anyone guide me please?",True,False,False,dating,t5_2qhb1,967554,public,self,Did I say or do something that causes her to react so harshly?,0,[],1.0,https://www.reddit.com/r/dating/comments/p997b0/did_i_say_or_do_something_that_causes_her_to/,all_ads,6,,,,
61,[],False,harryjustin,,[],,text,t2_dhz9srn1,False,False,False,[],False,False,1629623973,self.dating,https://www.reddit.com/r/dating/comments/p99exk/am_single_who_is_ready_to_love_up_here/,{},p99exk,False,False,False,False,False,False,True,False,#ffb000,,"[{'e': 'text', 't': 'Tinder/Online Dating'}]",5214d2ac-61f1-11e8-8bb1-0ed15e4a39c0,Tinder/Online Dating,dark,richtext,False,False,True,4,0,False,all_ads,/r/dating/comments/p99exk/am_single_who_is_ready_to_love_up_here/,False,6,1629623984,1,[removed],True,False,False,dating,t5_2qhb1,967568,public,self,Am single who is ready. To love up 💓💓 Here,0,[],1.0,https://www.reddit.com/r/dating/comments/p99exk/am_single_who_is_ready_to_love_up_here/,all_ads,6,reddit,,,
62,[],False,throw-away5654565,,[],,text,t2_e2hvrir4,False,False,False,[],False,False,1629624605,self.dating,https://www.reddit.com/r/dating/comments/p99is6/i_wanna_ask_someone_out_but_i_am_worried_about_an/,{},p99is6,False,False,False,False,False,False,True,False,#ea0027,dating,"[{'e': 'text', 't': 'I Need Advice'}]",19ec58c2-9f74-11e7-81a1-0e2bf15991f0,I Need Advice,light,richtext,False,False,True,2,0,False,all_ads,/r/dating/comments/p99is6/i_wanna_ask_someone_out_but_i_am_worried_about_an/,False,6,1629624617,1,[removed],True,False,False,dating,t5_2qhb1,967575,public,self,I wanna ask someone out but I am worried about an age gap. I am younger and I could use some advice.,0,[],1.0,https://www.reddit.com/r/dating/comments/p99is6/i_wanna_ask_someone_out_but_i_am_worried_about_an/,all_ads,6,reddit,,,
