,id,created_utc,title,selftext,subreddit,subreddit_id,url
84,rskivq,1640922172,Thinking about reconnecting with an old flame? He’s stuck on my mind.,I (25F) dated this guy (25M) for 3 months at the end of 2019. It was more casual but we had a strong connection and spent so much time together. Covid hit and we lost touch. I ended up moving to a different state in the middle of the pandemic and that’s when he finally reached out to me. I apologized for not telling him and he told me to reach out if I’m back in town. It’s been almost 2 years since he reached out and I am going to be visiting and really want to text him But I’m worried it’s been too long and he forgot about me or is with someone else. I don’t want to look dumb. What do I do? How would I approach it?,dating,t5_2qhb1,https://www.reddit.com/r/dating/comments/rskivq/thinking_about_reconnecting_with_an_old_flame_hes/
85,rskjo7,1640922243,Can I please get some insight on my Bumble profile?,"Okay so I decided to work on my bumble profile and to be honest I think it’s pretty good, but not good enough.
And so I would like some insight please.
I took some snap shots of my profile and here is the link to those snapshots: ttps://docs.google.com/document/d/1nxrJlZ4Fwl6FTtePLuP_ZIspTzWFTwZVy7KNurshzSY/edit
I decided to take the h out of the https because I can’t post the full link because my post will get removed by a bot, so just go to your search bar and type in the h first and then paste the rest of the link and hit search.
And then please give me your insight.",dating,t5_2qhb1,https://www.reddit.com/r/dating/comments/rskjo7/can_i_please_get_some_insight_on_my_bumble_profile/
86,rskl2f,1640922369,Talking to crushes,I always wanted to ask you guys how many have you had problem talking to your crush and how it actually go and what you said to her. Can tips are helpful?,dating,t5_2qhb1,https://www.reddit.com/r/dating/comments/rskl2f/talking_to_crushes/
87,rsklc7,1640922393,Have you got time to read this? How to comfort him?,[removed],dating,t5_2qhb1,https://www.reddit.com/r/dating/comments/rsklc7/have_you_got_time_to_read_this_how_to_comfort_him/
88,rsklqo,1640922429,"I am on the fence about this date, should I go or just stay home?","I like to think I am a pretty good judge of character so I have a date tomorrow with this woman, and I am already getting bad feelings.

1. We already rescheduled once, and then she put it 3 days out. I think anything over 48 hours is a bad sign, but her reasoning is because she wanted it to be on her day off..understandable.
2. Today, I asked her if she was excited to see me and her answer was ""Kinda"". I told her that she did not have to see me if she did not want to, as I want someone who is just as excited to see me as I am excited to them. She then blamed her work and her kids(who are adults) and said that she was overworked. Said she would call me when she got off.
3. She did call me and told me that her daughter might have Covid and if not, then she would come. Two hours later, still not hearing anything, I texted her and she said that her daughter did not have covid.
4. We got the location picked out but she said it was too far for her even though we live in the same city. I had to go and pick another location which she seemed to be fine with even though it was almost the same distance.
5. After we got the location picked, she then said that she would pay for herself as she didn't want to have a ""spending limit"". I have never mentioned a limit or implied anywhere that I am cheap or do not pay for dates. Plus, we are going to Starbucks..how expensive can it be? When I asked why she said that, she said it was a joke. (im not laughing)
6. Now due to all of this, I am heavily suspicious and I think she is only meeting up to be nice it sounds like. I asked her if she gave any thought as to how it will be when we meet, and she ignored the question.

Keep in mind that after she rescheduled the first time, i was not able to answer her for most of the day due to being sick, and she messaged me saying that she hoped i found what i was looking for. I had to call her and leave her a message telling her i was sick and i had to go into work the same day. It seems like she likes talking to me, but is too quick to let someone go. What do you guys think?",dating,t5_2qhb1,https://www.reddit.com/r/dating/comments/rsklqo/i_am_on_the_fence_about_this_date_should_i_go_or/
89,rskn3u,1640922552,At what point should I expect/ask for exclusivity?,"Hi all, first time posting in this community, so sorry if this is inappropriately formatted for this.

I'm a 23 year old guy who's been perpetually single for a while now. I've dated a bit here and there, but I keep having the same experiences, and I'm wondering to what extent it is a flaw in how I'm perceiving dating and to what extent it is just the women I've dated. 

Multiple times now, I'll meet someone, befriend them, know them for a little while, then start dating them. As soon as I start dating them, the tone shifts, and there's a disconnect. The primary thing being that I start to get invested, and they are going on dates with multiple people, which makes me lose interest.

I guess I'm just trying to understand what the general protocol is on dating, if there's a general logic to the madness. I could easily see my view on dating being at a high school level, as, when I start dating a person, they are all I focus on. The idea of dating a different person before breaking it off with this person is aberrant to me. This could also be because I see so few people. There are pockets of time between people I start and stop dating, so scarcity might just be making me hyperfixate.

But no matter how I think about it, intellectually I just think (unless obviously you're poly in some capacity) that exclusivity in dating is a given, and not necessarily a commitment. If you're not interested in the person, or you're interested in someone else more, break it off and go see that person. That's what makes sense to me. Obviously that becomes more complicated as you've invested in a person and built a relationship with them. If you start to develop feelings for someone who isn't your partner, you have to examine what your needs and wants are, and if you're really attracted to someone else or if you're just fundamentally unhappy in the relationship, but that's tangential to this post. I just think that if you're going on dates with three different people a week, how are you going to be engaged and receptive to the experience each date has to offer, good or bad?

The crux of what I'm asking here is, to what extent is exclusivity a commitment? Should I reexamine my values here or is it a normal thing to lose interest when the person you've started dating continues to see other people while seeing you? Is there a general number of dates where you can start to anticipate exclusivity? Or is there no rhyme or reason to anything and I'm just grabbing at the void here?

Thanks,

LC",dating,t5_2qhb1,https://www.reddit.com/r/dating/comments/rskn3u/at_what_point_should_i_expectask_for_exclusivity/
90,rskodp,1640922664,casual relationship situation,"A ramble of dot points:

\- I've got myself into a casual relationship with someone I like who wants a casual.

\- he uses to text me a lot. but now days it's pretty minimal. 

\- i saw from a distance that he's been texting someone on messenger (with the purple bts theme on messenger.. so as if it's not a girl lol - i also need glasses so everything is blurry, can't see properly lol. and it's more lengthy messaging too compared to me). 

\- I know he was out during the day on Wednesday, and I saw him on Wednesday night because he had this parking ticket for Wednesday (didn't look through it, i just glanced at it). (He also had a backpack and his hat out near his desk. Lol I think that he maybe out with this on the day.)

\- He was especially warm and bubbly that day. And super smiley on the phone. 

\- It may seem like i'm overthinking at this point. But with  these data points in my face.. i only gather this because out interactions are almost shallow and these are the only things I have gathered from my recent visit. 

\- i think we've both been super introverted to each other. i honestly don't know how to talk to him. i think it's me and it's him, a two way thing, that we ended so quiet with each other. it's odd because i can be so much more talkative with anyone else. so i know i'll need to open up and try to make him open up too if i want a sustainable friendship at least.

\- verbally we're pretty distant. but in terms of actions, we show consideration for each other. 

\- the fact that i have a crush on him. i don't know what I am suppose to do.

\-  even if a relationship doesn't work out, i think i have too much affection for him to not see him anymore. seems like sex is the only way to see him. to be clear, he's not a bad person, he just make his terms clear too. 

\- i need some advice for my situation",dating,t5_2qhb1,https://www.reddit.com/r/dating/comments/rskodp/casual_relationship_situation/
91,rskugh,1640923212,Some people slip into and out of relationships easily and others it is few and far between to find a connection. Your thoughts,30F from NY.  I am looking at half of my friends and they are always slipping into relationships like it is no big deal.  And seem to find guys they like easily.  I never had that experience.  I am curious what is the different between people are always seem to be in a relationship vs people who have a hard time finding connection. A connection to me seems so rare and precious.  What gives!  Thanks!,dating,t5_2qhb1,https://www.reddit.com/r/dating/comments/rskugh/some_people_slip_into_and_out_of_relationships/
92,rskukh,1640923215,Can't understand women's obsession with wanting to be friends and being so entitled when I'm not interested.,"Had a thing going on with this girl during the summer for a bit, I manifested my interest in dating her, she turned me down, I didn't make a scene or anything and that was that. Now mind you this was a girl I had met a few months prior through a social gathering where we talked a bit but not much, nothing happens and we don't talk until months later during summer where we see each other a few times, I suggest and she turns me down.

Basically we haven't known each other for years or since childhood or anything like that. I haven't bothered to reach out to her and kept the discussions pretty short and straight to the point since then.

On Xmas eve I get a text from her being super snarky: ''Even though you don't talk to me anymore, merry Christmas.'' 

Big ew.

I don't get why women are so obsessed with 'being friends' even though we've never gotten to that point. Maybe it's my version of friendship but for this case we were never really friends, just mere acquaintances but somehow that's seen as such a terrible thing. I've had this happen a few times now, I manifest my interest in dating a girl and get turned down, afterwards they give me the ''But we can still be friends!''...I didn't ask? I'm not interested in that?

Personally if I find someone attractive I can't be friends with them, but again that's just me. I think friendship with attraction is never going to be genuine since it's always going to be hanging over our heads. But the sheer entitlement coming from women surrounding friendship makes me think that it's the female equivalent of the guy who buys you a drink and expects sex in return. 

Yes, I had a nice conversation with you. No, we're not going to bffs.",dating,t5_2qhb1,https://www.reddit.com/r/dating/comments/rskukh/cant_understand_womens_obsession_with_wanting_to/
93,rsl28g,1640923880,looking alot younger than my actual age,"my biggest struggle in dating my whole like have been the fact that i look way too young, i am 26 and women from my job tought i was 17 or 18. I do have a beard but that haven’t helped, girls around my age arent interested because they think i am too young for them, the only girls who show any interest are between 15-18",dating,t5_2qhb1,https://www.reddit.com/r/dating/comments/rsl28g/looking_alot_younger_than_my_actual_age/
94,rsl2ar,1640923886,Suddenly Gay?,"I(25/m) text this in a sleepless night at the peak of a weeklong confusion. I really don’t know if I’m suddenly gay or bisexual and what happened to me. 

The whole last year my love-life was a total mess, I was in love with my best friend *with benefits* (23/f) and suffered pretty much to the point I had huge depression. Till today I sometimes fell like I’m not over her. 

In addition to this I’m so confused right now with my sexuality and really don’t know what to do. The thing is, I didn’t felt in love with a man or had a crush on a specific man. It was out of the blue that I started thinking when I saw a cute man: „Maybe I’m gay.“ It wasn’t like, I want to date that guy or make out with this guy it was really just: „Maybe I’m gay.“ and it confuses me like hell. I really don’t know what I want, but I can’t get over that thought. Until this year my whole life, it wasn’t something that I thought about at all. I was in love with women and had pretty good relationships with women. I even don’t think that I get aroused by thinking of men or looking at hot men it’s more like that the thought „Maybe I’m gay.“ is coming in my mind. But it comes in my mind so often and even while I look at man who clearly aren’t attractive. Like way too old man or really dirty ones. Persons I would never ever date trigger this thought.

I life in a community/country that is pretty open to queer people and I’ve a group of friends that would totally be fine with me dating man so I could honestly just go for it. But I can’t and I don’t know why, I don’t even know if this is what I want or if my depressiv brain just messes with me. 

I‘m waiting nearly a year for an therapist appointment so I guess I need to figure this out myself.",dating,t5_2qhb1,https://www.reddit.com/r/dating/comments/rsl2ar/suddenly_gay/
95,rsl6cj,1640924257,Should there be a speed to swiping?,"Hi, 30F.  When I just moved to a small city, I had nothing to do for the first two weeks and spent a little too much time speedily swiping on dating apps.  And I saw very nice profiles.  But once that first two weeks went through I havent had any luck even seeing a nice profile.  Or getting matches . It is like I swiped through all the eligible men, ran through everyone without much luck 😬. Now what do I do… and any ideas why this happened?  Thanks!

Positive posts and responses only, no shaming.",dating,t5_2qhb1,https://www.reddit.com/r/dating/comments/rsl6cj/should_there_be_a_speed_to_swiping/
96,rsl8op,1640924477,Crush on someone from work. What do I do?!,"I started a new job a few months ago, and a guy I work with recently rejoined the team located out of this regional office. He has been very nice and gentleman-ly but others have noticed that he recalls small things about me, our boss has suggested we date, and we went to dinner alone at a fancy restaurant in front of the ocean over a weekend. And he paid, the bill was nearly $200. Sometimes when he suggests we do something, he invites other people from our team, so I don’t know if he likes me or not. 

Have any of you ever had a crush on someone you work with? Did you do anything about it? I don’t know whether or not he likes me but I also am thinking, it’s probably a bad idea considering we work together…can anyone lend any advice?",dating,t5_2qhb1,https://www.reddit.com/r/dating/comments/rsl8op/crush_on_someone_from_work_what_do_i_do/
97,rslbwh,1640924781,I don’t even know really…,"So I [31m] got divorced over 2 years ago. It was a bad situation that brought the worst out in me. I move back to my hometown, change careers and start trying to “start over.” Until about 3 months ago, I had absolutely no luck. I worked consistent 60+ hours weeks to rebuild myself financially, so my only option was dating sites. No luck whatsoever, until I met a girl and we started hanging out a lot. I ignored some red flags, and we started dating officially when she pressured me into it (being divorced, I was trying to move slow). After moving way too fast, and her expressing that she wanted to be in love I find out (not from her) that she has an OF. 

It crushed me. She was actively posting on it while begging me to be in love with her. How does anyone find a partner nowadays with shit like this? I’m so close to just accepting my loneliness and giving up.",dating,t5_2qhb1,https://www.reddit.com/r/dating/comments/rslbwh/i_dont_even_know_really/
98,rsldi9,1640924937,why is it so hard?,"I’m put in competition with all sorts of guys, much better looking guys, stronger guys, taller guys. It’s all a game. And I don’t make the cut for the majority of women. I’ve tried dating apps to no avail. Every conversation has ended sooner or later. Most ghost, a few flake, many don’t even respond to my openers. I’m convinced I’ll be forever alone, I’ve been convinced since I was 14 years old. I just don’t make the cut.",dating,t5_2qhb1,https://www.reddit.com/r/dating/comments/rsldi9/why_is_it_so_hard/
99,rslds7,1640924963,Splitting bill on first date,"As a woman, I always offer to split the check on the first date because it seems rude to not offer. Lately though, every guy immediately accepts without a second thought. Even if they asked me out and the bill isn’t too much (for example tonight it was $40 total.) It makes me feel like they don’t like me. 

I know I’ve seen men complain about the amount they spend on dates on this sub, but I’m just giving my perspective as someone who always offers to split and is always taken up on it. It’s getting really annoying to me and I would like to be actually taken out once in awhile.",dating,t5_2qhb1,https://www.reddit.com/r/dating/comments/rslds7/splitting_bill_on_first_date/
