,all_awardings,allow_live_comments,author,author_flair_css_class,author_flair_richtext,author_flair_text,author_flair_type,author_fullname,author_patreon_flair,author_premium,awarders,can_mod_post,contest_mode,created_utc,domain,full_link,gildings,id,is_created_from_ads_ui,is_crosspostable,is_meta,is_original_content,is_reddit_media_domain,is_robot_indexable,is_self,is_video,link_flair_background_color,link_flair_css_class,link_flair_richtext,link_flair_template_id,link_flair_text,link_flair_text_color,link_flair_type,locked,media_only,no_follow,num_comments,num_crossposts,over_18,parent_whitelist_status,permalink,pinned,pwls,retrieved_on,score,selftext,send_replies,spoiler,stickied,subreddit,subreddit_id,subreddit_subscribers,subreddit_type,thumbnail,title,total_awards_received,treatment_tags,upvote_ratio,url,whitelist_status,wls,removed_by_category,author_flair_background_color,author_flair_text_color,banned_by,edited,post_hint,preview
0,[],False,another_account_69,,[],,text,t2_biyx4c71,False,False,[],False,False,1624064894,self.dating,https://www.reddit.com/r/dating/comments/o34uqg/just_posting_to_put_good_energy_out_in_the/,{},o34uqg,False,True,False,False,False,True,True,False,#878a8c,dating,"[{'e': 'text', 't': 'Venting'}]",a616c322-194e-11e5-ab91-0ed1c06bdad7,Venting,light,richtext,False,False,False,4,0,False,all_ads,/r/dating/comments/o34uqg/just_posting_to_put_good_energy_out_in_the/,False,6,1624075073,2,"So I feel like I’ve been trying to do everything right but I fall short. It’s difficult to feel like I’m genuinely adequate for the girl I’d dream of being in love with even though I try.

In reality I’m probably desirable but I’m a 24 year old guy with a good job and cool interests and good health + fitness, but I’m missing out on even meeting girls my age. 

The mental statistics don’t seem to favor me ever falling in love with a woman that actually wants me around.

Fomo is hitting me rn. It feels like the world is always on the edge of being turned upside down and that life is just going to be boring and terrifying once civilization crashes into global warming etc…

The clock is ticking on everyone’s life regardless. I just want to be happy and feel love even though I know that humans are entitled to neither in reality.

I hope you are all able to achieve satisfaction and feel love and do freak shit while you’re able to enjoy it. Hopefully this isn’t a lame vent and I’ll look back at this post having found someone - reflecting on loneliness and sexual fomo as a thing of the past lol",True,False,False,dating,t5_2qhb1,846149,public,self,Just posting to put good energy out in the universe. Existential hope is hard sometimes.,0,[],1.0,https://www.reddit.com/r/dating/comments/o34uqg/just_posting_to_put_good_energy_out_in_the/,all_ads,6,,,,,,,
1,[],False,deepdig2020,,[],,text,t2_8ozfkoyr,False,False,[],False,False,1624065087,self.dating,https://www.reddit.com/r/dating/comments/o34wo3/dear_women_start_actively_approaching_instead_of/,{},o34wo3,False,True,False,False,False,True,True,False,#ffd635,dating,"[{'e': 'text', 't': 'Giving Advice'}]",7bca2c58-4211-11e5-9ecb-0e60d8112001,Giving Advice,dark,richtext,False,False,False,202,0,False,all_ads,/r/dating/comments/o34wo3/dear_women_start_actively_approaching_instead_of/,False,6,1624075252,16,"As a guy I get flattered as I'm starting to know this more attention as I get older but also as a guy all I have been taught is all the horrible ways a man could or could not be approaching a woman and that has stopped me from approaching as much as I would

But I do start to feel salty when a girl is sending flirty signals towards me because I'm wondering why she just can't ask me out directly

As a guy I hate my gender role and I hate having to pursue and letting my reputation or self-esteem on the line

Girls is 2021 and it's time to take the reins and start approaching and risking projection just like men",True,False,False,dating,t5_2qhb1,846150,public,self,Dear women. Start actively approaching instead of sending ambiguous signals,0,[],0.81,https://www.reddit.com/r/dating/comments/o34wo3/dear_women_start_actively_approaching_instead_of/,all_ads,6,,,,,,,
2,[],False,berriesforest,,[],,text,t2_ct1gpg8x,False,False,[],False,False,1624065242,self.dating,https://www.reddit.com/r/dating/comments/o34y7f/how_to_start_to_date_in_your_late_20s_when_you/,{},o34y7f,False,False,False,False,False,False,True,False,#ea0027,dating,"[{'e': 'text', 't': 'I Need Advice'}]",19ec58c2-9f74-11e7-81a1-0e2bf15991f0,I Need Advice,light,richtext,False,False,True,0,0,False,all_ads,/r/dating/comments/o34y7f/how_to_start_to_date_in_your_late_20s_when_you/,False,6,1624075395,1,[removed],True,False,False,dating,t5_2qhb1,846155,public,self,"How to start to date in your late 20's, when you haven't had any dating experience?",0,[],1.0,https://www.reddit.com/r/dating/comments/o34y7f/how_to_start_to_date_in_your_late_20s_when_you/,all_ads,6,moderator,,,,,,
3,[],False,berriesforest,,[],,text,t2_ct1gpg8x,False,False,[],False,False,1624065282,self.dating,https://www.reddit.com/r/dating/comments/o34yll/how_to_start_dating_when_you_havent_had_any/,{},o34yll,False,False,False,False,False,False,True,False,#ea0027,dating,"[{'e': 'text', 't': 'I Need Advice'}]",19ec58c2-9f74-11e7-81a1-0e2bf15991f0,I Need Advice,light,richtext,False,False,True,0,0,False,all_ads,/r/dating/comments/o34yll/how_to_start_dating_when_you_havent_had_any/,False,6,1624075431,1,[removed],True,False,False,dating,t5_2qhb1,846156,public,self,How to start dating when you haven't had any experiences?,0,[],1.0,https://www.reddit.com/r/dating/comments/o34yll/how_to_start_dating_when_you_havent_had_any/,all_ads,6,moderator,,,,,,
4,[],False,Proof-Tap4772,,[],,text,t2_cnhi1r0b,False,False,[],False,False,1624066354,self.dating,https://www.reddit.com/r/dating/comments/o359ao/how_to_heal_and_move_on/,{},o359ao,False,True,False,False,False,True,True,False,#ea0027,dating,"[{'e': 'text', 't': 'I Need Advice'}]",19ec58c2-9f74-11e7-81a1-0e2bf15991f0,I Need Advice,light,richtext,False,False,False,12,0,False,all_ads,/r/dating/comments/o359ao/how_to_heal_and_move_on/,False,6,1624076434,2,How do I handle the pain of a guy I really like leaving me for another girl and moving on so fast. It’s been months since this happens and I feel no better. I’m seeing a therapist soon because it’s been so tough. I feel as if I lost the one.  We didn’t date for that long but I still feel that for some reason.,True,False,False,dating,t5_2qhb1,846182,public,self,How to heal and move on,0,[],1.0,https://www.reddit.com/r/dating/comments/o359ao/how_to_heal_and_move_on/,all_ads,6,,,,,,,
5,[],False,FitnessBabbbe,,[],,text,t2_a35fbpjh,False,False,[],False,False,1624066613,self.dating,https://www.reddit.com/r/dating/comments/o35bss/26_yr_old_female_i_only_get_approached_by_old_men/,{},o35bss,False,True,False,False,False,True,True,False,#ea0027,dating,"[{'e': 'text', 't': 'I Need Advice'}]",19ec58c2-9f74-11e7-81a1-0e2bf15991f0,I Need Advice,light,richtext,False,False,True,91,0,False,all_ads,/r/dating/comments/o35bss/26_yr_old_female_i_only_get_approached_by_old_men/,False,6,1624076676,2,"I'm a 26 yr old female. I'm sort of short &amp; skinny 5'3 &amp; been between 100 lbs-115 lbs for the last 10 yrs! My measurements are 31-25-35 so small pear shape (maybe my small boobs are a turn off lol). I go to the gym often &amp; workout. I even have the outline of some abs going. I think my face looks alright. I have a slight overbite, but that's the only thing a bit unattractive I find about my face. 

I get told I look young for my age. Been told in my 20s I look anywhere from 13-19 yrs old. Maybe that's the deterant in person? I think I have decent style. I wear a little bit of every type of clothing, but I try to find things that fit me well. Like probably most anyone else sometimes I wear sweats, jeans/leggings &amp; a sweater, sports wear, dresses, skirts, crop tops &amp; shorts etc. depending on what I'm doing for the day. 

I have dark brown hair &amp; eyes &amp; pale skin. I had my hair long for yrs, but after bleaching &amp; dying it blonde &amp; red last yr I cut in short because it was breaking off from being damaged. I'm a little self conscious about it now. Maybe guys prefer girls with the pretty blue/green eyes? I wear light makeup. Usually foundation that matches my skin tone &amp; possibly some mascara. I'll put on more makeup if I have plans with someone. 

I'm outgoing &amp; often get told I'm really friendly. I also get told I'm funny, &amp; I think I have a good mixed sense of humor of silly &amp; sarcastic depending who I'm talking to. I don't get out in general much to the bar/club scene though because I usually hang out with friends one on one &amp; don't have a group of girls to go out with every weekend type of thing. 

I asked one of my guy friends to rate me once &amp; he said 7.5 &amp; also has told me not to be worried about approaching guys. 

All this being said I can count on one hand the amount of times I've been genuinely asked out. I've been on dates with only 3 people in my life. 

The usual type of guys I get are either 
• Guys 50 or older like the 80 yr old that hit on me at the gym &amp; told me he likes my ""school girl physique"", the 60 yr old customer at an old job that leaned on my cart &amp; said ""I see you here all the time. Your really pretty"" etc. 
• Broke guys that use me for money. ""Can I borrow $20 for gas money"" *sob story with it* 
• Clingy guys at jobs I've had that try to linger around me so much I start to get in trouble for them being around me &amp; not doing their work. 
• Married guys. A factory job I worked I swear the married guys there flocked to me. Lol 
• Guys that message me on social media like Instagram usually saying something like ""hey beautiful"" &amp; they're usually overweight. I mean, I honestly don't like my guys skinny skinny by any means, I like a little chunk, but they're like double chin overweight

All this makes me start to think people are lying when they say I'm attractive &amp; I must be ugly if guys never genuinely like me &amp; these are the type of guys I'm getting. I'm nervous that if I'm still single at 30 I'll be single forever. Usually at this point I even just say I don't want or care about a relationship, but that's more self preservation.",True,False,False,dating,t5_2qhb1,846188,public,self,26 yr old female I only get approached by old men or overweight less than average attractive guys &amp; they only want me for a hookup,0,[],1.0,https://www.reddit.com/r/dating/comments/o35bss/26_yr_old_female_i_only_get_approached_by_old_men/,all_ads,6,,,,,,,
6,[],False,girldownthestreet76,,[],,text,t2_3vsy00ia,False,False,[],False,False,1624067207,self.dating,https://www.reddit.com/r/dating/comments/o35hf5/men_or_boys_of_reddit_why_would_you_text_a_girl/,{},o35hf5,False,True,False,False,False,True,True,False,#ff4500,dating,"[{'e': 'text', 't': 'Question'}]",a9531dce-194e-11e5-b177-0eff099c3d1f,Question,light,richtext,False,False,False,46,0,False,all_ads,/r/dating/comments/o35hf5/men_or_boys_of_reddit_why_would_you_text_a_girl/,False,6,1624077196,6,"So i’ve been talking to this guy who lives in the city i’m going to college in, problem is i don’t move there for another 2 months. 

But me and him really hit it off and from the first message he sent to me I knew he was different. He’s been texting me everyday since for a month and a half now, some days we talks more than other but it’s still conversation nonetheless. It’s fun, it’s flirty, it’s easy. Easy being kind of hard to find for me. He mostly texts me first starting convos with a joke then asking me what i’m doing, how’s my day, what my plans are. 

I guess i’ve just never had this before (i’m 18F) so i guess i’m just asking to the guys if this was you why would you be doing it? Could he have bad intentions? Do you guys think he actually likes me and is just trying to get to know me better before we meet ? 

btw i know that this isn’t a relationship, to me in my side of it i like him and i feel like our personalities match  and i like spending time talking to him and getting to know him so that the only thing left for us would be to meet and see if the in person is as good as the online.",True,False,False,dating,t5_2qhb1,846194,public,self,"Men or “Boys” of Reddit, Why would you text a girl almost everyday?",0,[],1.0,https://www.reddit.com/r/dating/comments/o35hf5/men_or_boys_of_reddit_why_would_you_text_a_girl/,all_ads,6,,,,,,,
7,[],False,[deleted],,,,,,,,[],False,False,1624067608,self.dating,https://www.reddit.com/r/dating/comments/o35l1r/girl_i_was_chatting_with_f29_tells_me_about/,{},o35l1r,False,False,False,False,False,False,True,False,,dating,"[{'e': 'text', 't': 'Other'}]",fd9c03b8-a1ce-11e7-9172-0e8c9f9ecf4c,Other,dark,richtext,False,False,True,0,0,False,all_ads,/r/dating/comments/o35l1r/girl_i_was_chatting_with_f29_tells_me_about/,False,6,1624077557,1,,True,False,False,dating,t5_2qhb1,846203,public,default,Girl I was chatting with F(29) tells me about having a boyfriend two weeks into online video chatting,0,[],1.0,https://www.reddit.com/r/dating/comments/o35l1r/girl_i_was_chatting_with_f29_tells_me_about/,all_ads,6,deleted,,dark,moderators,,,
8,[],False,International_Zone42,,[],,text,t2_bav4hv00,False,False,[],False,False,1624068959,self.dating,https://www.reddit.com/r/dating/comments/o35y18/dating_in_your_twenties/,{},o35y18,False,True,False,False,False,True,True,False,#ffd635,dating,"[{'e': 'text', 't': 'Giving Advice'}]",7bca2c58-4211-11e5-9ecb-0e60d8112001,Giving Advice,dark,richtext,False,False,False,7,0,False,all_ads,/r/dating/comments/o35y18/dating_in_your_twenties/,False,6,1624078775,2,"I see a lot of posts from people with dating issues/questions/stress’ and I myself who can resonate with a lot of these topics wanted to share my general thoughts. For context, I’ve never had a women accept my romantic advances which is quite unfortunate but I’m not going to tell myself lies that ""it just wasn’t meant to be or maybe god is saving me for something better"". Telling ourselves this, at least for me, was a way of providing emotional comfort when my ego took a blow from the countless rejections. The truth is, it could’ve been a wide variety of reasons why the opposite party doesn’t want your advances.. and your looks more likely than not would have a significant part of it. 

Sure a great personality, manners alongside with ambitions is all considered attractive in a human but displacing the importance of physical appearance when entering the dating scene is absolutely absurd. I would classify myself as slightly below average looking and throughout my experience I can confidently say my looks made a part of the dating game challenging. Idk if this is harsh or pointless to write but I hope youngsters like myself who come on Reddit everyday reading about others problems can take this at face value and make the necessary adjustments to get results. 

To add, I’m quite certain there will be disagreements, so feel free to let me know what kind of experiences you guys have went through that may differ from mine.",True,False,False,dating,t5_2qhb1,846232,public,self,Dating in your twenties,0,[],1.0,https://www.reddit.com/r/dating/comments/o35y18/dating_in_your_twenties/,all_ads,6,,,,,,,
9,[],False,LustnLexi,,[],,text,t2_ct2mbv6w,False,False,[],False,False,1624071260,self.dating,https://www.reddit.com/r/dating/comments/o36jtl/hookup/,{},o36jtl,False,False,False,False,False,False,True,False,#46d160,,"[{'e': 'text', 't': 'Success!'}]",6b44dc18-cc88-11eb-95f2-0ed00be16b15,Success!,dark,richtext,False,False,True,0,0,True,all_ads,/r/dating/comments/o36jtl/hookup/,False,6,1624080886,1,[removed],True,True,False,dating,t5_2qhb1,846290,public,nsfw,Hookup,0,[],1.0,https://www.reddit.com/r/dating/comments/o36jtl/hookup/,promo_adult_nsfw,3,moderator,,,,,,
10,[],False,SilentSamurai,,[],,text,t2_8huib,False,False,[],False,False,1624071263,self.dating,https://www.reddit.com/r/dating/comments/o36juo/asked_3_different_people_if_they_wanted_to_go_on/,{},o36juo,False,True,False,False,False,True,True,False,#878a8c,dating,"[{'e': 'text', 't': 'Venting'}]",a616c322-194e-11e5-ab91-0ed1c06bdad7,Venting,light,richtext,False,False,False,39,0,False,all_ads,/r/dating/comments/o36juo/asked_3_different_people_if_they_wanted_to_go_on/,False,6,1624080888,2,"Did this on Tuesday. They all said it would be great to grab a drink, we had a pretty good prior conversation. Had a bit more dialogue with them all this week, then tried to confirm plans yesterday with all of them.

And here we are on Friday.

*Nothing.*

I'm not trying to stack these dates all on the same day like some sort of asshole. But it's become so goddamn common for people to put off dates at the last second or ghost that I've started going for two on the same day. This time I went for the triple, because surely I'd get *one* person to commit to the easiest of dates.

It's just unreal on paper how many dates I've ""had"" vs. how many have actually happened. I'd ask for someone to confirm that it's just not me, but I really don't want to find out this may be common.

Maybe there's something wrong with how I'm approaching dating life? Maybe I just got lucky and all 3 suck?

Either way, I'll be back at it tomorrow. Tonight I'm gonna go hit up the watering hole and just shake my head in disbelief.",True,False,False,dating,t5_2qhb1,846290,public,self,Asked 3 different people if they wanted to go on dates for Friday...,0,[],1.0,https://www.reddit.com/r/dating/comments/o36juo/asked_3_different_people_if_they_wanted_to_go_on/,all_ads,6,,,,,,,
11,[],False,-ethereality-,,[],,text,t2_3ekgdf5u,False,False,[],False,False,1624071834,self.dating,https://www.reddit.com/r/dating/comments/o36ph7/what_are_some_positive_things_that_resulted_from/,{},o36ph7,False,True,False,False,False,True,True,False,#ff4500,dating,"[{'e': 'text', 't': 'Question'}]",a9531dce-194e-11e5-b177-0eff099c3d1f,Question,light,richtext,False,False,True,14,0,False,all_ads,/r/dating/comments/o36ph7/what_are_some_positive_things_that_resulted_from/,False,6,1624081413,1,"For example, I picked up yoga as a daily practice after meeting someone.",True,False,False,dating,t5_2qhb1,846305,public,self,What are some positive things that resulted from dating someone?,0,[],1.0,https://www.reddit.com/r/dating/comments/o36ph7/what_are_some_positive_things_that_resulted_from/,all_ads,6,,,,,,,
12,[],False,tardyaaron14,,[],,text,t2_588ox89d,False,False,[],False,False,1624072498,self.dating,https://www.reddit.com/r/dating/comments/o36vwf/im_at_the_bar_with_the_girl_ive_had_a_falling_out/,{},o36vwf,False,True,False,False,False,True,True,False,#ea0027,dating,"[{'e': 'text', 't': 'I Need Advice'}]",19ec58c2-9f74-11e7-81a1-0e2bf15991f0,I Need Advice,light,richtext,False,False,False,22,0,False,all_ads,/r/dating/comments/o36vwf/im_at_the_bar_with_the_girl_ive_had_a_falling_out/,False,6,1624082006,3,In February I had a fallen out with a girl I was talking to since November. I have spoke or seen her since then. I walked I just walked into my favorite bar and I saw her with some other guy. I  definitely don't want to pick things with her but if we cross paths do I say hi or just act like I don't see her?,True,False,False,dating,t5_2qhb1,846319,public,self,I'm at the bar with the girl I've had a falling out with out with in Februar. Should I say hi to her or ignore her?,0,[],1.0,https://www.reddit.com/r/dating/comments/o36vwf/im_at_the_bar_with_the_girl_ive_had_a_falling_out/,all_ads,6,,,,,,,
13,[],False,Neopint15,,[],,text,t2_6xc8nnu2,False,False,[],False,False,1624073201,self.dating,https://www.reddit.com/r/dating/comments/o37285/how_do_guys_view_a_girl_in_her_mid20s_without_a/,{},o37285,False,True,False,False,False,True,True,False,#ff4500,dating,"[{'e': 'text', 't': 'Question'}]",a9531dce-194e-11e5-b177-0eff099c3d1f,Question,light,richtext,False,False,False,34,0,False,all_ads,/r/dating/comments/o37285/how_do_guys_view_a_girl_in_her_mid20s_without_a/,False,6,1624082616,3,"At this time in my life, not working a good paying job has been a huge insecurity for me. I have a undergraduate degree and have plans to apply to medical school. In the meantime, I plan to apply to nursing (2 years) in case I can’t get into medicine. 

I live in a small town where jobs are scarce and any government or hospital job requires bilingualism, even for entry positions. I hadn’t realized how difficult it would be to get a job coming out of university. Currently, I work, but they aren’t well paying jobs. 

Would a guy look at this negatively at my age? I always get anxious about this topic when it comes up and worry that guys with good jobs or education won’t like it.",True,False,False,dating,t5_2qhb1,846323,public,self,How do guys view a girl in her mid-20s without a career?,0,[],0.72,https://www.reddit.com/r/dating/comments/o37285/how_do_guys_view_a_girl_in_her_mid20s_without_a/,all_ads,6,,,,,,,
14,[],False,nancypancy91,,[],,text,t2_2jg1mbte,False,False,[],False,False,1624073635,self.dating,https://www.reddit.com/r/dating/comments/o376u6/anybody_tired_of_dating/,{},o376u6,False,True,False,False,False,True,True,False,#878a8c,dating,"[{'e': 'text', 't': 'Venting'}]",a616c322-194e-11e5-ab91-0ed1c06bdad7,Venting,light,richtext,False,False,False,64,0,False,all_ads,/r/dating/comments/o376u6/anybody_tired_of_dating/,False,6,1624083030,7,I get inundated with guys being overly sexual. And the one person I was interested in is not mentally stable. I’m just so disappointed. I’m gonna give myself an evening to rethink my life choices and hopefully make a decision that will be beneficial for my future :),True,False,False,dating,t5_2qhb1,846330,public,self,Anybody tired of dating ?,0,[],1.0,https://www.reddit.com/r/dating/comments/o376u6/anybody_tired_of_dating/,all_ads,6,,,,,,,
15,[],False,IndieDC3,,[],,text,t2_2le6i2h6,False,False,[],False,False,1624076174,self.dating,https://www.reddit.com/r/dating/comments/o37x9z/need_advice_with_this_situation/,{},o37x9z,False,True,False,False,False,True,True,False,#ea0027,dating,"[{'e': 'text', 't': 'I Need Advice'}]",19ec58c2-9f74-11e7-81a1-0e2bf15991f0,I Need Advice,light,richtext,False,False,False,11,0,False,all_ads,/r/dating/comments/o37x9z/need_advice_with_this_situation/,False,6,1624085336,3,"So been talking to this girl for about two months. She said she fell in love with my last month. We hung out a lot at first. A lot of texts, phone calls. Here the past week and a half, seldom see her, talk to her and rarely respond to my texts. There hasn’t been any love bombing going on. To me, actions speak louder than words. Why the sudden disappearance? Communication speaks volume, say how you feel. I’ve been wanting to talk to her about things but there hasn’t been chances. Should I just live the space until she wants to talk or not, should I send a text how I feel and leave it at that? 

I’ve been through a lot in my past and with this person it felt more “right” and never felt that before because everything felt natural. Now I feel like my soul is being ripped apart slowly again. She is 31, I’m 32 so I find it childish to act like this and not just wanting to talk about. Part of me wants to send a lengthy text and just let it be and the other half wants to just leave it  alone and maybe she’ll come back around? We were supposed to hangout tomorrow night but I find that, that’s not going to happen.

Any advice would be appreciated.",True,False,False,dating,t5_2qhb1,846372,public,self,Need advice with this situation!,0,[],1.0,https://www.reddit.com/r/dating/comments/o37x9z/need_advice_with_this_situation/,all_ads,6,,,,,,,
16,[],False,BeRed_,,[],,text,t2_73foas2z,False,False,[],False,False,1624076263,self.dating,https://www.reddit.com/r/dating/comments/o37y5x/broken_up_due_to_my_hectic_schedule/,{},o37y5x,False,True,False,False,False,True,True,False,#ea0027,dating,"[{'e': 'text', 't': 'I Need Advice'}]",19ec58c2-9f74-11e7-81a1-0e2bf15991f0,I Need Advice,light,richtext,False,False,True,8,0,False,all_ads,/r/dating/comments/o37y5x/broken_up_due_to_my_hectic_schedule/,False,6,1624085416,1,"Hi r/dating, need some suggestions, I have been dating this girl for 5 years, but in the last 2 days things got weird, as I had a week of 2hour sleep per day on average, and at the end of week my body just gave up, i ended up having nausea and forcing myself to sleep I slept for about 16 hours. In the meantime my girlfriend called me and messaged me some thing bout 4-5 messages but me being asleep, she thought I was ignoring her and she just deleted all that. I asked her for 2 days about what happened, she won't tell me and then would go on to block me from everywhere, I don't know what to do, i couldn't write to her a long ass paragraph because I was studying for my exams too. 

I need suggestions to what should I do now? Where have I been wrong since she's not telling me anything and I don't wanna loose her.",True,False,False,dating,t5_2qhb1,846377,public,self,Broken up due to my hectic schedule,0,[],1.0,https://www.reddit.com/r/dating/comments/o37y5x/broken_up_due_to_my_hectic_schedule/,all_ads,6,,,,,,,
