,id,created_utc,title,selftext,subreddit,subreddit_id,url
30,pd9hk6,1630156180,Tired of Being a Single Virgin,"35/m 

I have my own place now and I need to get laid but these hookup sites are all sketchy and charge $30 a month and probably won't even get me any results. Hell, at this point I'd settle for a hooker as long as there's no danger and I have a ton of condoms.",dating,t5_2qhb1,https://www.reddit.com/r/dating/comments/pd9hk6/tired_of_being_a_single_virgin/
31,pd9jj1,1630156413,I am so lost,"I (17M) have been talking to this girl (17F) for a year and 4 months. Most of the time I have felt that she wasn't into me because she is pretty closed off. That really messed me up for a while. However we had a talk the other day and she made it clear that she does like me, but I can't tell if I feel the same way anymore.

All summer we only went on 2 'dates' and we are both super busy until the end of October which is when we plan to get together again. We still talk over text nearly every day but I feel like the conversations are getting pretty bland and repetitive. We are both seniors in high school and we never seam to talk at school outside of a minute or two because we are both awkward when there are other people around.

There never really was chemistry between us but I liked her because she is truly something else. At this point I feel like I'm looking for more of an emotional connection not something that feels forced. I just really don't know what to do at this point..

last year we did not go to prom because she had work which was fine, but she has never really seemed to have time for 'us', I always thought that would change but so far it hasn't. We never really see each other much and when we do its weird.

I don't want to break things off because I know she is going through some mental things and also in the same friend group so that would mess things up too. Like I said, she is the perfect person in my eyes the only downside is she is very closed off and not very affectionate.

I really need advice, thanks!",dating,t5_2qhb1,https://www.reddit.com/r/dating/comments/pd9jj1/i_am_so_lost/
32,pd9jxd,1630156460,Does This Girl Like me?,"I’ve already posted this a few times but I want as many outside opinions I can get


So there’s a co worker I think likes me and I like her too. We’re both 17 and here’s the story so far. I originally didn’t like her because she trash talked me to another co worker about me taking all the customers at the registers (not on purpose but I just made eye contact first). Anyway a few weeks after that I had to help her at registers and she was super friendly, I remember thinking “man she’s talking a lot for not knowing me”. But I was super dry and blunt because I was mad at her remark she made at the time. She did things like ask what time I got off and then acted disappointed when I got off before her. Before I left I had to buy something and I went to her register. When I did she said “oh hey, it’s been awhile) and smiled and had a flirty look on her. She also was messing around with me and being mean in a playful way. Like messing with me when my card didn’t work and said “well we close in 30 minutes so if you don’t get it by then idk what to tell you” but it was flirty like I said


Fast forward a few weeks later and I see her one day and I decide to put what she said behind me and kinda have a “fresh start”. I started taking to her and it went so well. I made her smile and laugh a lot and she was playing with her hair a lot. I was looking to see if she played with her hair when I wasn’t talking to her and she was but not as much. It went so well that day. The next day I worked tho she was busy and around other co workers so it was hard to talk with her. I finally wanted to at least say hi. When I did I went full blown stupid and froze and just wave. I said nothing but she did the same, waved and said nothing. For some reason I looked away and then looked back. I have no clue why. When she left I told her bye and she said it back but she didn’t seem flirty or interested at all. I thought I ruined it until today and yesterday


Yesterday she was there and I noticed she had her hair dyed. I wanted to compliment but decided not to because after last time I didn’t wanna make it worse. So I just told her good bye and she said “bye, hey did you get your hair cut?” I did so I said yeah. She said “it looks really nice”. I said “thank you!” And went on. She asked “do you work tomorrow?” I said “yeah wby?” She said “not until Thursday”. I said “I work tomorrow and Wednesday but not again until Sunday” she replied “I think I work Sunday!” I said “ok nice, see you!” And left. Today is when it gets amazing. Today she came in as a customer and checked out at my register. When she came up she was playfully being mean and stuff. I got to the screen where I couldn’t scan her discount and she said “wow do I need to do your job? I think I do, cause I will if you can’t” we both made each other smile and laugh a lot and it didn’t feel like a normal conversation, but like she was flirting the whole time. I asked her “do you need a bag?” She said “if it makes your life harder I totally need a bag”. When she went to leave she asked “you work Sunday right?” I said “yeah, you do right?” She said “yeah!” I said “nice I’ll see you then, btw I like your hair!”. So I finally complimented her new hair

So after my ted talk what do you guys think? Does she like me or not? No other girls at my work act like this. It’s never this playful with this much bantering. So do y’all think she likes me?",dating,t5_2qhb1,https://www.reddit.com/r/dating/comments/pd9jxd/does_this_girl_like_me/
33,pd9n64,1630156789,2 hours late for the second date?,"Today I’m supposed to have a second date with a guy I met a few weeks ago. And if you’re wondering why I even have the time to write this post, well… 

at First when we agreed on today he said that he’d pick me up not later than 2:15 pm. I was totally fine with it. Then a few days ago he asked if 2-3 pm was definitely fine for me. I said yeah. and today at 12 am I messaged him and didn’t get a reply. so I called him to make sure everything was fine and today was still going as planned. after picking up he said he was stressed and would leave his house at 2-2:30. that would be later than we planned but okay. he didn’t tell me why, nor did he even say sorry. and he has to drive for an hour to my town, so yeah. Then a few minutes ago (exactly 3 pm) I got a text that he is leaving home now. That means he’ll be here almost 2 hours late and I’m kinda pissed. Like I started getting ready at 12 because I like to take my time and wanted to shower/ shave and whatever.

 I really don’t know what to do now. Like I’ll go out with him today but I really hope he will have an explanation and will say sorry. I already dated a guy who was always late before and I hated it. If we are supposed to meet at 2:15 I expect you to be here at 2:15, not 4. Should I give him a second chance and see what he has to say later? Or should I just let it be after today? What pisses me about it is also the fact that I had to call and ask. I wonder if he’d even tell me that he was going to be late if I didn’t ask about it.",dating,t5_2qhb1,https://www.reddit.com/r/dating/comments/pd9n64/2_hours_late_for_the_second_date/
34,pd9o2s,1630156886,Can’t stop thinking about a rejection I had.,"19M here. I matched with this girl on Tinder and we spoke on Instagram for a bit. I genuinely really liked her but the convos started to go dry and I eventually got impatient and asked her if she was into me and she said she wasn’t into me. Fine. I wished her well and ‘moved on’. But I just can’t get her out of my head. I’ve accepted that it ain’t happening but she just can’t escape my mind. 

Are there any ways that I can ‘move on’? 

(Not sure if this belongs here, if not I’ll delete this. But please recommend a sub for me)",dating,t5_2qhb1,https://www.reddit.com/r/dating/comments/pd9o2s/cant_stop_thinking_about_a_rejection_i_had/
35,pd9vis,1630157696,What means when a girl uploads a story on Instagram like this and how should you react?,https://www.instagram.com/p/CSzV_BWNDPo/?utm_medium=copy_link,dating,t5_2qhb1,https://www.reddit.com/r/dating/comments/pd9vis/what_means_when_a_girl_uploads_a_story_on/
36,pda2rx,1630158481,Had the “what are we” talk and was told things were blooming but now I was forcing it,"I’ve (28) been seeing this guy (37) for two months now. When we met both of us were 6 months out of long term relationships. Up to this point he’s been amazing &amp; a lot of what I want in a man. He’s been the one to initiate contact and chase me up to this point and during the first few dates told me he was looking for a relationship/I check a lot of boxes for him 

I decided to have the “what are we” talk with him last night and it didn’t go very well in my opinion. He said he’s not ready for a relationship yet at this point but “likes me and enjoys spending time with me”. From everything I’ve read, that’s a red flag…. All I asked was if this is something casual to him or if he saw a possibility of a future. He said that he likes how things have been going &amp; blooming but me bringing this up feels like I’m forcing it. Said he doesn’t feel ready for a label on it &amp; that his feelings aren’t developed enough yet. He didn’t say it in a douchey way, but he was saying things like “I’m sorry I know that’s probably not what you want to hear”. He did say he’s only dating me and doesn’t want to talk to anyone else.

Should I run? :( I don’t want a label right now either but I do really like him and have developed feelings for him. The exclusivity thing was all I had really hoped to get out of the convo, which I did..but his hesitance to say there was even a possibility of a future is concerning to me. He treats me like a girlfriend so it’s confusing. Everyone says look at men’s actions, not words, soo I’m left feeling lost.",dating,t5_2qhb1,https://www.reddit.com/r/dating/comments/pda2rx/had_the_what_are_we_talk_and_was_told_things_were/
37,pda6s3,1630158895,"Girl purposedly not making eye contact for the entire night then asking me out, I am confused",[removed],dating,t5_2qhb1,https://www.reddit.com/r/dating/comments/pda6s3/girl_purposedly_not_making_eye_contact_for_the/
38,pdaea5,1630159630,"Almost 27[M], never had a girlfriend or been on a single date in my life and I'm losing hope can anyone offer me any advice?",[removed],dating,t5_2qhb1,https://www.reddit.com/r/dating/comments/pdaea5/almost_27m_never_had_a_girlfriend_or_been_on_a/
39,pdaftu,1630159793,"Almost 27[M], never had a girlfriend or been on a single date in my life and I'm losing hope can anyone offer me any advice?"," 

The title says most of it, but I'll elaborate a bit.

First off, I just want to clarify that I'm not desperate, but I am losing any hope of ever finding a woman in my life. This is in large part because my social life has been very vapid for as long as I can remember. It doesn't help with the fact that I am a Highly Sensitive Person (HSP) with severe ADHD, Rejection Sensitive Dysphoria, and Aspergers. All of which have made my life in general a living hell for over a decade.

That said, the last 10 years have been utterly brutal for me overall socially. Most of my experiences and overall interactions with most women I've come across have been for a lack of a better term, either utter shit or lackluster. Even with girls who have been friends of mine, they eventually ghost me in the end, regardless if I'm on good terms with them. The last one who decided to ghost me was a former college classmate and buddy of mine. In the dating world, most interactions I've had have been IRL and I've never had my feelings returned. I've gone for older women and younger women, fat and skinny, it doesn't matter. At bars, the women have been vicious and rude.. and I don't understand it at all.

This kind of behavior prompted me to look in other communities and I didn't meet any success there either. I've tried to go out with foreign women, but when that happened, I got either stood up or burned. Granted, these women were living in America and/or were Americanized, so maybe I'll still give the ones overseas the benefit of the doubt..

Keep in mind that nearly all of my dating experience has been IRL and not online. I don't even bother with dating apps because they go nowhere.

I have repeatedly taken breaks from the dating world every now and then. 2011-2014 were the years that I really tried. 2018-2019 and then early 2020 were when I tried again, but to no success.

At this point, I have no clue what to do. I'm slightly above average-looking I've always come across as kind, chill/relaxed and confident in myself. Yet, I can never get what I yearn for.. I want to be married and have a family of my own one day, but I honestly don't know if I will ever find it here in America..

Can anyone offer me any advice on how to go about dating?",dating,t5_2qhb1,https://www.reddit.com/r/dating/comments/pdaftu/almost_27m_never_had_a_girlfriend_or_been_on_a/
40,pdassj,1630161066,Looking for a man, hi im johanssonjoana  24years old and I am looking for fun and also to meet a new person for hook ups hit me up,dating,t5_2qhb1,https://www.reddit.com/r/dating/comments/pdassj/looking_for_a_man/
41,pdavox,1630161336,Does anyone else (guys) hate how almost every girl is taken?,[removed],dating,t5_2qhb1,https://www.reddit.com/r/dating/comments/pdavox/does_anyone_else_guys_hate_how_almost_every_girl/
42,pdb38n,1630162043,How to start/ keep ldr going for a few more weeks?,"So I’m moving out of state in about a month and decided to switch bumble to travel mode and get a feel for women where I’m going. Matched with a girl and she’s really nice, super pretty, all around seems like a good person and someone I’d like to date. And she seems interested in me too. She had gotten out of a six year relationship a year ago and she said our situation is ideal for her as dating is something that makes her anxious and nervous so getting to know each other over the next several weeks before we actually meet would help her be less anxious and nervous about it. We have a fair bit in common and have talked about her showing me around when we get there and all the places we want to go. We’ve also been very open about things like non-negotiables, what we want in our partner, stuff like that. 

Anyways, even though we’ve had really good, productive conversations so far, and I will say even though she’s always responsive and seems engaged in conversation, she’s a very dry texter. I don’t just want to call her out on it and come off as rude as I really do like her and can’t wait to actually meet her, but figuring out where to go next, and then having to do that for four more weeks is honestly kind of tiring. We’ve also only been talking for about a week or so, so I don’t want to jump the gun either and ruin everything before it even technically started. Idk what do I do to keep the momentum going for just a little longer?",dating,t5_2qhb1,https://www.reddit.com/r/dating/comments/pdb38n/how_to_start_keep_ldr_going_for_a_few_more_weeks/
43,pdb3vm,1630162104,Suddenly have feelings for a good friend! What to say or do?,"I recently realized that I might have feelings for a guy friend. We've been friends for decades, but we're both busy introverts and rarely meet up. We chat online every day. He's single and so am I, but I'm not sure if I can handle a relationship. My life is a mess; I can barely take care of myself.   


Do you think I can ask him to out to see if we click? I'm worried he'll feel imposed upon, if he's already so busy with work and daily issues?  If I ask, should I say ""hang out"" or say ""date""?",dating,t5_2qhb1,https://www.reddit.com/r/dating/comments/pdb3vm/suddenly_have_feelings_for_a_good_friend_what_to/
44,pdb4sx,1630162188,How is your dating life going?,,dating,t5_2qhb1,https://www.reddit.com/r/dating/comments/pdb4sx/how_is_your_dating_life_going/
45,pdb56u,1630162224,Short term daters: What are the reasons you've broken it off with someone under 6 months?,"I've typically been a long term dater, and recently realized that deal breakers for me have to be huge. So what are your reasons for breaking it off? What breaks a deal?",dating,t5_2qhb1,https://www.reddit.com/r/dating/comments/pdb56u/short_term_daters_what_are_the_reasons_youve/
46,pdb93d,1630162598,Suddenly have feelings for a good friend. What should I do?,"I just realized that I might have feelings for a guy friend. We've been friends for decades, but we're both busy introverts and rarely meet up. We chat online every day.  We've both been single our whole lives. I'm not even sure if I want a relationship, but lately I've been thinking about him constantly and my heart beats faster and get butterflies.

Do you think I can ask him to out to see if we click? I'm worried he'll feel imposed upon, if he's already so busy with work and daily issues. If I ask, should I say ""hang out"" or say ""date""?",dating,t5_2qhb1,https://www.reddit.com/r/dating/comments/pdb93d/suddenly_have_feelings_for_a_good_friend_what/
47,pdbb13,1630162788,MY DATE TOLD ME I SHOULD HAVE WORE A SKIRT TO SEE HIM INSTEAD OF PANTS. SHOULD I BE OFFENDED??,"

Soo i went out on a second date with a guy I’ve been talking to for 2 weeks and the first date I wore a dress and he gave me a lot of compliments but last night I wore tight leggings &amp; a tank top cause we were going out for Mexican food ( place was super casual) &amp; bowling &amp; he made this comment saying “ I wish I could really see your legs “ &amp; I was like you can see them &amp; he was like “ no I wanna really see them in a mini skirt leggings get in the way “. I kinda cried inside I felt like he was saying I looked ugly. Anyways is this my fault ? &amp; should I drop him ?  He didn’t compliment how I looked last night either 🤦🏾‍♀️🙄",dating,t5_2qhb1,https://www.reddit.com/r/dating/comments/pdbb13/my_date_told_me_i_should_have_wore_a_skirt_to_see/
48,pdbrao,1630164246,Have you Heard about search engine for dating sites?,"Dating sites are a popular way to find love on the Internet. Which one to choose? To increase your chance of happiness, we reviewed all of them and chose the best ones.
for more check out link in Comment",dating,t5_2qhb1,https://www.reddit.com/r/dating/comments/pdbrao/have_you_heard_about_search_engine_for_dating/
49,pdc19q,1630165128,Dating Coach Certification,[removed],dating,t5_2qhb1,https://www.reddit.com/r/dating/comments/pdc19q/dating_coach_certification/
50,pdc1z9,1630165190,Dating with Hashimoto's (times of insane fatigue)?,"31F, I've had issues with getting insanely tired for years, from what I'm 99% positive is hashimoto's or some sort of thyroid issue (the best way I can explain it is ... blob-like, my mind just sort of stops working and it's hard to maintain conversations or even form full sentences at the worst points). It's more than just ""oh I'm tired and need to sleep."" I've gone to loads of doctors for help but nothing seems to help. 

It can be really rough when I'm in a relationship with someone and have more obligations, like maybe hanging with him and his friends/family etc. If I get drained when we're out I feel like *such* a bummer, normally I just don't go out a ton myself. 

But, I don't want to spend forever alone ... has anyone had experience dating/being in a relationship with a fatigue disorder?",dating,t5_2qhb1,https://www.reddit.com/r/dating/comments/pdc1z9/dating_with_hashimotos_times_of_insane_fatigue/
51,pdc6vc,1630165632,"AITA for cancelling a date because he didn't check in beforehand, and tell me where precisely we are going","I matched with a man on a dating app. We were talking for a few days. We had one phone call on Wednesday night, where I felt like he was pretty tipsy. I knew he was coming home from a boy's night (on a weekday for some reason), and on the call there was something a bit off. He shouted at a passerby who allegedly said something racist to him, he kept talking over me and interrupting me. But still, I was like let me give him a chance. We agreed for a date on Saturday afternoon / today. 

Yesterday night I video called him on my way home from dinner, as I was a bit intimidated as men kept cat calling me or staring at me. We talk for a good few hours even once I get home. Here he's a bit more calm, he's indoors because the night before he said he had another huge night out and he was nursing a hangover. This time we talk properly about our spiritual journeys and professional goals, and we have things in common. On this call, he discusses a date again for the next day. He mentions he will pick a museum before we go out for a late lunch for our date. Nothing is confirmed but we hang up around midnight and I go about my day. 

So today comes around. And I hear nothing from him until half 2 ish when he asks if I'm bringing a handbag with me. At this point, for me the date isn't happening. I have a standard *when someone invites me on a date, they should be confirming a few hours ahead, the time, location and whether everything is still ok*. He didn't, so when he checked in, I said no. He called me, and he got angry, swore at me and then called me a flakey fucker. 

I know I could have confirmed with him, but he asked me out. The good manners I look for is the person who asked me out, for whom I cancelled other plans, should be checking in, confirming time and location a few hours before or I'm not going. This person didn't tell me where I'm going, which museum we were supposed to be going. It was a bit weird. 
For me, when it comes to online dating, I'm trying to be as cautious as possible and any thing that remotely wastes my time or fails to uphold the traditional standard i.e. you should check in ahead of the set time to let me know where I am going, isn't for me. This is both due to safety and because it's just respecting my time imo. 

More info: He swore at me again over text, before he admitted there was a misunderstanding. 

So am I an asshole for cancelling this date because he didn't check in?",dating,t5_2qhb1,https://www.reddit.com/r/dating/comments/pdc6vc/aita_for_cancelling_a_date_because_he_didnt_check/
52,pdcb0i,1630166007,Gym crush at work,"So I work part time at a gym at the front desk and developed a big crush on a regular customer there. I feel like it’s too weird of a dynamic to make a move cause I don’t wanna make him uncomfy to workout there and I have a lot of other coworkers so it just feels to awkward to take a convo past polite small talk. I think he may like me back tho cause he always makes a point to greet me and smile and wave and even if I’m busy I can still tell he is happy to see me. The two times I’ve ran into him outside of work I’ve unfortunately been on a phone call so I wasn’t able to talk but we gave each other big smiles and waved. No clue what to do next, it’s getting frustrating tbh",dating,t5_2qhb1,https://www.reddit.com/r/dating/comments/pdcb0i/gym_crush_at_work/
53,pdcbqp,1630166072,How can I stop overthinking new relationships?,"Hi all, 

I’m not sure if anyone else has had this problem. For me, when I start to feel the blossoming of a new relationship my mind goes hyperactive thinking of ways it won’t work out in the long term. This can be really frustrating as I tend to really sabotage potential relationships with my own anxiety. 


My brain just thinks things like “you won’t grow with him.” “He is too ____” “he has ____” and mind you, these would usually be valid concerns if you knew the person well enough to formulate those opinions. I really want to try and give things a try but I think I’m so scared of it not being “the perfect match” (wether or not that even exists) to give anyone a try. I also think I’m just scared of breakups in general but, I don’t know. I am scared of wasting my time when life can be so short. 

Any advice? I’m still decently young, 21F. I’ve been in two relationships and both of them ended up with me feeling extremely stuck. Is that where this fear is coming from??",dating,t5_2qhb1,https://www.reddit.com/r/dating/comments/pdcbqp/how_can_i_stop_overthinking_new_relationships/
54,pdcguo,1630166533,Overcoming Insecurities,I feel like my boyfriend is losing feelings and it could be because of my insecurities. I’ve always had a problem with insecurities and I have no idea how to overcome them!,dating,t5_2qhb1,https://www.reddit.com/r/dating/comments/pdcguo/overcoming_insecurities/
55,pdci0l,1630166634,I really love r/dating guys are you with me,[removed],dating,t5_2qhb1,https://www.reddit.com/r/dating/comments/pdci0l/i_really_love_rdating_guys_are_you_with_me/
