,all_awardings,allow_live_comments,author,author_flair_css_class,author_flair_richtext,author_flair_text,author_flair_type,author_fullname,author_is_blocked,author_patreon_flair,author_premium,awarders,can_mod_post,contest_mode,created_utc,domain,full_link,gildings,id,is_created_from_ads_ui,is_crosspostable,is_meta,is_original_content,is_reddit_media_domain,is_robot_indexable,is_self,is_video,link_flair_background_color,link_flair_css_class,link_flair_richtext,link_flair_template_id,link_flair_text,link_flair_text_color,link_flair_type,locked,media_only,no_follow,num_comments,num_crossposts,over_18,parent_whitelist_status,permalink,pinned,pwls,retrieved_on,score,selftext,send_replies,spoiler,stickied,subreddit,subreddit_id,subreddit_subscribers,subreddit_type,thumbnail,title,total_awards_received,treatment_tags,upvote_ratio,url,whitelist_status,wls,post_hint,preview,removed_by_category
51,[],False,NotZurg,,[],,text,t2_93f5lkbz,False,False,False,[],False,False,1630422779,self.dating,https://www.reddit.com/r/dating/comments/pf7usx/25m_disabled_never_been_in_a_relationship/,{},pf7usx,False,True,False,False,False,True,True,False,#ea0027,dating,"[{'e': 'text', 't': 'I Need Advice'}]",19ec58c2-9f74-11e7-81a1-0e2bf15991f0,I Need Advice,light,richtext,False,False,True,8,0,False,all_ads,/r/dating/comments/pf7usx/25m_disabled_never_been_in_a_relationship/,False,6,1630422790,1,"I am on multiple dating apps however nobody seems to want to talk to me and don't know what to do..


I'm 25 and in a wheelchair...

Any advice?",True,False,False,dating,t5_2qhb1,981401,public,self,25(m) disabled never been in a relationship,0,[],1.0,https://www.reddit.com/r/dating/comments/pf7usx/25m_disabled_never_been_in_a_relationship/,all_ads,6,,,
52,[],False,Interesting_Gur_8143,,[],,text,t2_e023el92,False,False,False,[],False,False,1630422850,self.dating,https://www.reddit.com/r/dating/comments/pf7vna/finances_with_a_growing_relationship/,{},pf7vna,False,True,False,False,False,True,True,False,#ea0027,dating,"[{'e': 'text', 't': 'I Need Advice'}]",19ec58c2-9f74-11e7-81a1-0e2bf15991f0,I Need Advice,light,richtext,False,False,True,11,0,False,all_ads,/r/dating/comments/pf7vna/finances_with_a_growing_relationship/,False,6,1630422862,1,"For context: my girlfriend and I have been together 3 years. I have always made more money than her and thus have assumed most of the bills. We are 23 and own a home in southern California. We make six figures combined, my income being double hers.

Earlier this year she landed a great job in a field she has been wanting to be in for a long time. I'm happy for her. 

Now that she is making actual money, would it be fair if she took over some more bills? Or should our system that worked when she had less money still apply?

She obviously wants to keep the old system, and I don't blame her. Her hard work is paying off. But she noticeably has more spending money at the end of the day than I do. Which is fine, but also it would be nice if we both had the same amount of spending money.

Let me know your thoughts, thanks!",True,False,False,dating,t5_2qhb1,981404,public,self,Finances with a growing relationship,0,[],1.0,https://www.reddit.com/r/dating/comments/pf7vna/finances_with_a_growing_relationship/,all_ads,6,,,
53,[],False,Emergency_Hour_3597,,[],,text,t2_e6zrb8rs,False,False,False,[],False,False,1630422956,self.dating,https://www.reddit.com/r/dating/comments/pf7wyh/dating_after_a_long_term_relationship/,{},pf7wyh,False,False,False,False,False,False,True,False,#ea0027,dating,"[{'e': 'text', 't': 'I Need Advice'}]",19ec58c2-9f74-11e7-81a1-0e2bf15991f0,I Need Advice,light,richtext,False,False,True,0,0,False,all_ads,/r/dating/comments/pf7wyh/dating_after_a_long_term_relationship/,False,6,1630422966,1,[removed],True,False,False,dating,t5_2qhb1,981407,public,self,Dating after a long term relationship,0,[],1.0,https://www.reddit.com/r/dating/comments/pf7wyh/dating_after_a_long_term_relationship/,all_ads,6,,,moderator
54,[],False,Traditional-Row-3828,,[],,text,t2_4hp9rkju,False,False,False,[],False,False,1630423007,self.dating,https://www.reddit.com/r/dating/comments/pf7xm1/hhhb/,{},pf7xm1,False,True,False,False,False,True,True,False,#ea0027,dating,"[{'e': 'text', 't': 'I Need Advice'}]",19ec58c2-9f74-11e7-81a1-0e2bf15991f0,I Need Advice,light,richtext,False,False,True,2,0,False,all_ads,/r/dating/comments/pf7xm1/hhhb/,False,6,1630423018,1,"Nsnsns

My bf says i will text u when i feel like . Idk if im not giving him space by texting him everyday as we r in a ldr . What should i do ? Not text him so that he can have space and miss me ?? Idk what is wrong . What should i do ?",True,False,False,dating,t5_2qhb1,981409,public,self,Hhhb,0,[],1.0,https://www.reddit.com/r/dating/comments/pf7xm1/hhhb/,all_ads,6,,,
55,[],False,Gabriella_2314,,[],,text,t2_e7tzz8xw,False,False,False,[],False,False,1630423134,self.dating,https://www.reddit.com/r/dating/comments/pf7z11/_/,{},pf7z11,False,False,False,False,False,False,True,False,#00a6a5,dating,"[{'e': 'text', 't': 'Support Needed'}]",fd9c03b8-a1ce-11e7-9172-0e8c9f9ecf4c,Support Needed,dark,richtext,False,False,True,1,0,False,all_ads,/r/dating/comments/pf7z11/_/,False,6,1630423146,1,[removed],True,False,False,dating,t5_2qhb1,981414,public,self,🥰,0,[],1.0,https://www.reddit.com/r/dating/comments/pf7z11/_/,all_ads,6,self,"{'enabled': False, 'images': [{'id': 'yyI2opSpOuxy5tZBaOtXTIvhxZOzz0-gkXPwiGG8X8o', 'resolutions': [{'height': 60, 'url': 'https://external-preview.redd.it/gYKOikEViBJA9S75tdEQinPvLVCkuauqWuRoKmQIg00.jpg?width=108&amp;crop=smart&amp;auto=webp&amp;s=0fc8aa34d8a0328460c3cba71b7e0c599a4f3c10', 'width': 108}, {'height': 121, 'url': 'https://external-preview.redd.it/gYKOikEViBJA9S75tdEQinPvLVCkuauqWuRoKmQIg00.jpg?width=216&amp;crop=smart&amp;auto=webp&amp;s=24fb9afabcce013748d8bf5a2dee8251685166c7', 'width': 216}, {'height': 180, 'url': 'https://external-preview.redd.it/gYKOikEViBJA9S75tdEQinPvLVCkuauqWuRoKmQIg00.jpg?width=320&amp;crop=smart&amp;auto=webp&amp;s=544359b7136355aef5cf78e9f12f7e26d4d4b5a1', 'width': 320}, {'height': 360, 'url': 'https://external-preview.redd.it/gYKOikEViBJA9S75tdEQinPvLVCkuauqWuRoKmQIg00.jpg?width=640&amp;crop=smart&amp;auto=webp&amp;s=3aa08fbc8d77ced2bf953aa925bcba74212f413c', 'width': 640}, {'height': 540, 'url': 'https://external-preview.redd.it/gYKOikEViBJA9S75tdEQinPvLVCkuauqWuRoKmQIg00.jpg?width=960&amp;crop=smart&amp;auto=webp&amp;s=13745eb04b60afc97eb568549032013290689781', 'width': 960}], 'source': {'height': 576, 'url': 'https://external-preview.redd.it/gYKOikEViBJA9S75tdEQinPvLVCkuauqWuRoKmQIg00.jpg?auto=webp&amp;s=d08a6b369fe5ca0b2ec308df94252f59d03b2e91', 'width': 1024}, 'variants': {}}]}",moderator
56,[],False,After-Substance4283,,[],,text,t2_dk64vu3u,False,False,False,[],False,False,1630423189,self.dating,https://www.reddit.com/r/dating/comments/pf7zo6/how_much_does_money_matter/,{},pf7zo6,False,False,False,False,False,False,True,False,#ff4500,dating,"[{'e': 'text', 't': 'Question'}]",a9531dce-194e-11e5-b177-0eff099c3d1f,Question,light,richtext,False,False,True,2,0,False,all_ads,/r/dating/comments/pf7zo6/how_much_does_money_matter/,False,6,1630423202,1,[removed],True,False,False,dating,t5_2qhb1,981414,public,self,How much does money matter?,0,[],1.0,https://www.reddit.com/r/dating/comments/pf7zo6/how_much_does_money_matter/,all_ads,6,,,reddit
57,[],False,United-Joke8871,,[],,text,t2_dobkolab,False,False,False,[],False,False,1630423314,self.dating,https://www.reddit.com/r/dating/comments/pf814l/on_a_break/,{},pf814l,False,True,False,False,False,True,True,False,#ffd635,dating,"[{'e': 'text', 't': 'Giving Advice'}]",7bca2c58-4211-11e5-9ecb-0e60d8112001,Giving Advice,dark,richtext,False,False,True,13,0,False,all_ads,/r/dating/comments/pf814l/on_a_break/,False,6,1630423325,1,"My boyfriend (28) and I (26) are on a break. It’s mostly my fault however when he said he needs time he never gave a specific time and the longer this goes on the more I’m thinking he’s just stringing me along until he’s ready to break up fully. I messaged him to ask how long the break will be but no response. Does the no response means he has no respect for this relationship anymore? I have some self respect left and I want to leave this relationship with some dignity. Why won’t he just answer my question and let me know how much time he needs? 
What should I do? Should I just end it?",True,False,False,dating,t5_2qhb1,981418,public,self,On a break,0,[],1.0,https://www.reddit.com/r/dating/comments/pf814l/on_a_break/,all_ads,6,,,
58,[],False,Lonely_Gentlem4n,,[],,text,t2_734h74y8,False,False,False,[],False,False,1630423584,self.dating,https://www.reddit.com/r/dating/comments/pf84ak/whats_your_opinion_on_dating_a_friends_ex_when/,{},pf84ak,False,True,False,False,False,True,True,False,#ff4500,dating,"[{'e': 'text', 't': 'Question'}]",a9531dce-194e-11e5-b177-0eff099c3d1f,Question,light,richtext,False,False,True,39,0,False,all_ads,/r/dating/comments/pf84ak/whats_your_opinion_on_dating_a_friends_ex_when/,False,6,1630423597,1,"So here's my situation. I've been seeing a girl who was going out with my friend. My friend cheated on her and basically used her for sex. On my part, i'm interested in a romantic relationship with her and we both are entertaining the option. The way my friend treated her repulses me at the highest point. I know some people say friend's exes are a no no, but i'm wondering if in this situation some of y'all would change your mind over such a situation.",True,False,False,dating,t5_2qhb1,981422,public,self,What's your opinion on dating a friend's ex when your friend treated her horribly ?,0,[],1.0,https://www.reddit.com/r/dating/comments/pf84ak/whats_your_opinion_on_dating_a_friends_ex_when/,all_ads,6,,,
59,[],False,atlasdrugged91,,[],,text,t2_2tzwy5oe,False,False,False,[],False,False,1630423630,self.dating,https://www.reddit.com/r/dating/comments/pf84uu/texting_during_the_week/,{},pf84uu,False,True,False,False,False,True,True,False,#ea0027,dating,"[{'e': 'text', 't': 'I Need Advice'}]",19ec58c2-9f74-11e7-81a1-0e2bf15991f0,I Need Advice,light,richtext,False,False,True,4,0,False,all_ads,/r/dating/comments/pf84uu/texting_during_the_week/,False,6,1630423641,1,"after a good first date. Texted after the date a little. What do you guys think? If the texting and online chat was long and mutually wordy (in a good way) and then radio silence during the week… think we’re just waiting until the weekend to make plans again?

I have a pretty busy life and I know she does too, maybe I’m not used to meeting people who don’t want to text all the time. But if I said it doesn’t have me a little worried I’d be lying! What do y’all think? Thanks",True,False,False,dating,t5_2qhb1,981424,public,self,Texting during the week…,0,[],1.0,https://www.reddit.com/r/dating/comments/pf84uu/texting_during_the_week/,all_ads,6,,,
60,[],False,Eenormay,,[],,text,t2_45dhl02l,False,False,False,[],False,False,1630424260,self.dating,https://www.reddit.com/r/dating/comments/pf8c9p/does_watching_a_man_or_woman_give_their_number_to/,{},pf8c9p,False,True,False,False,False,True,True,False,#ff4500,dating,"[{'e': 'text', 't': 'Question'}]",a9531dce-194e-11e5-b177-0eff099c3d1f,Question,light,richtext,False,False,True,5,0,False,all_ads,/r/dating/comments/pf8c9p/does_watching_a_man_or_woman_give_their_number_to/,False,6,1630424271,1,"Let’s say you’ve just worked up the nerve to talk to this person and maybe ask for their number if things go right. But before you get there, another person swoops in and has a brief conversation and your interest hands them their phone number. Do you still go for it, or do you abort the mission? Does it depend on anything specific?",True,False,False,dating,t5_2qhb1,981434,public,self,Does watching a man or woman give their number to another person before you get a chance to ask for it first deter you from still asking for it?,0,[],1.0,https://www.reddit.com/r/dating/comments/pf8c9p/does_watching_a_man_or_woman_give_their_number_to/,all_ads,6,,,
61,[],False,Oceansnail,,[],,text,t2_qvi1a,False,False,False,[],False,False,1630425305,self.dating,https://www.reddit.com/r/dating/comments/pf8ol4/what_happened_here/,{},pf8ol4,False,True,False,False,False,True,True,False,#ff4500,dating,"[{'e': 'text', 't': 'Question'}]",a9531dce-194e-11e5-b177-0eff099c3d1f,Question,light,richtext,False,False,True,11,0,False,all_ads,/r/dating/comments/pf8ol4/what_happened_here/,False,6,1630425316,1,"I got chatting with a girl on an app. At one point she suggested we meet irl, I agreed. And then she essentially disappeared as in shes never online anymore. During the chatting phase she was online multiple times a day everyday. I dont really understand whats happening here, is this normal for women?",True,False,False,dating,t5_2qhb1,981451,public,self,What happened here?,0,[],1.0,https://www.reddit.com/r/dating/comments/pf8ol4/what_happened_here/,all_ads,6,,,
62,[],False,sup-girl-where-u-at,,[],,text,t2_5781fkby,False,False,False,[],False,False,1630425393,self.dating,https://www.reddit.com/r/dating/comments/pf8pm7/crush_on_my_friend/,{},pf8pm7,False,True,False,False,False,True,True,False,#ea0027,dating,"[{'e': 'text', 't': 'I Need Advice'}]",19ec58c2-9f74-11e7-81a1-0e2bf15991f0,I Need Advice,light,richtext,False,False,True,10,0,False,all_ads,/r/dating/comments/pf8pm7/crush_on_my_friend/,False,6,1630425404,1,"I’m a 24 F and I have this guy friend that I have been platonically friends with for years, but recently I think I’ve started to like him as more than a friend. I even think I might have started catching feelings. I told him super casually that basically i would be open to dating him if he ever wanted to try it to see if it worked. He was really nice about it but basically said that even though he liked me, he didn’t think we could work out due to work, where we live, etc. 

I have been having a hard time getting over my ex (we broke up 6 months ago), and this is the first time I’ve kinda had feelings for someone else. Even though I’m disappointed he didn’t want to date me, I feel like this is a sign that I am ready to start dating again. 

My last relationship lasted almost 3 years, so I’m nervous to put myself back out there and I really don’t know where to begin. Online dating apps have been tough for me because I’m not great at texting and I just haven’t felt a connection to any guy that I’ve met online. 

I guess I’m just looking for general advice on how to move on from heartbreak, get your confidence back, and open yourself up to meeting someone new. Also wouod like to know any alternative suggestions to online dating (like where is it easy to meet people?) 

Thanks for any comments I get 💕",True,False,False,dating,t5_2qhb1,981452,public,self,Crush on my friend,0,[],1.0,https://www.reddit.com/r/dating/comments/pf8pm7/crush_on_my_friend/,all_ads,6,,,
63,[],False,n_oyster,,[],,text,t2_cs14snh8,False,False,False,[],False,False,1630425715,self.dating,https://www.reddit.com/r/dating/comments/pf8tmn/cant_sleep_my_friend_is_asleep_next_to_me_on_the/,{},pf8tmn,False,True,False,False,False,True,True,False,#00a6a5,dating,"[{'e': 'text', 't': 'Support Needed'}]",fd9c03b8-a1ce-11e7-9172-0e8c9f9ecf4c,Support Needed,dark,richtext,False,False,True,16,0,False,all_ads,/r/dating/comments/pf8tmn/cant_sleep_my_friend_is_asleep_next_to_me_on_the/,False,6,1630425726,1,"I'm writing this post as my friend who I have fallen deeply for sleeps beside me. We met on a dating app 6 months ago and it was bit awkward (bcos of my inexperience) but we mostly vibed well. However, she decided that we were better off friends.

I moved city and we spoke occasionally until a few months ago when randomly our paths crossed again. We caught up and it seemed to light a spark that wasnt there before. We have hung out a few times in each city since. 

She's over for a few days and there has been a lot of flirting, holding hands, grabbing my arm, and resting head on my shoulder. We look like a couple in love. We're also sleeping on the same bed and there has been occasional cuddling at night. But she has been casually talking about other guys she's seeing / plans to see and it's clear that this is nothing more than just a friendship. This is her last night. She lies asleep next to me but I can't sleep because I know she doesn't feel the same way. She is literally so close but unattainable :(

Is this a toxic friendship? Should I tell her how I feel or should I just leave it and keep a distant presence?",True,False,False,dating,t5_2qhb1,981458,public,self,Can't sleep. My friend is asleep next to me on the same bed. I have deep feelings for her but I know she doesn't feel the same.,0,[],1.0,https://www.reddit.com/r/dating/comments/pf8tmn/cant_sleep_my_friend_is_asleep_next_to_me_on_the/,all_ads,6,,,
64,[],False,JP24Avatar,,[],,text,t2_98thq5e2,False,False,False,[],False,False,1630425970,self.dating,https://www.reddit.com/r/dating/comments/pf8wov/dating_tips/,{},pf8wov,False,True,False,False,False,True,True,False,#ea0027,dating,"[{'e': 'text', 't': 'I Need Advice'}]",19ec58c2-9f74-11e7-81a1-0e2bf15991f0,I Need Advice,light,richtext,False,False,True,16,0,False,all_ads,/r/dating/comments/pf8wov/dating_tips/,False,6,1630425981,1,"Why is it that most of the girls I get with are just trying to sleep with me and nothing more? I’m looking for a relationship and every time I met a girl who seemed like a nice sweet girl, all they wanted to do was sleep together. And when I turned them down and said let’s go on a few dates and get to know each other, it seems to back fire and they just ghost me and run away. I’m really confused on why this is happening and even with the nice girls I know. Like when I want to get to know someone on an intellectual level, they run away. In the past men used to do this all time and there are still men today who do this of course. But it seems that everything has been flipped upside down, where women are doing the same thing now. I don’t advocate that men should do that to women either, I don’t think it’s right or appropriate.

&amp;#x200B;

Another great example is my relationship right now. She’s a very sweet and nice girl, but after going on a few dates with her I got to know her a lot more and what she wants. All she wants to do is make out and not get to know each other on an intellectual level. We actually have a lot in common, but it seems like she was just let out of her cage when she met me, because her family is Catholic which would make a lot of sense lol. She just went back to college which is now a long distance relationship and now she says she’s to busy to talk with me. She told me that when she gets back in town, lets get together on weekends to hangout. But I’ve seen things like this so many times now, that I know what she’s doing. What do you even do? And why are women treating me like a sex toy? Of course not all women are like this, but majority of them are nowadays which is sad. Answers anyone?",True,False,False,dating,t5_2qhb1,981465,public,self,Dating tips,0,[],1.0,https://www.reddit.com/r/dating/comments/pf8wov/dating_tips/,all_ads,6,,,
65,[],False,ArenadoStubble,,[],,text,t2_12dxs1mr,False,False,False,[],False,False,1630426180,self.dating,https://www.reddit.com/r/dating/comments/pf8z89/what_is_the_etiquette_for_a_postponed_date/,{},pf8z89,False,True,False,False,False,True,True,False,#ea0027,dating,"[{'e': 'text', 't': 'I Need Advice'}]",19ec58c2-9f74-11e7-81a1-0e2bf15991f0,I Need Advice,light,richtext,False,False,True,7,0,False,all_ads,/r/dating/comments/pf8z89/what_is_the_etiquette_for_a_postponed_date/,False,6,1630426192,1,Someone I just started dating said they need to postpone the next date (3rd time hanging out). Is it on them to set up the next date? Should I be passive and let them lead or should I pick another time? This has happened to me before and I usually never hear from them again.,True,False,False,dating,t5_2qhb1,981467,public,self,What is the etiquette for a Postponed Date?,0,[],1.0,https://www.reddit.com/r/dating/comments/pf8z89/what_is_the_etiquette_for_a_postponed_date/,all_ads,6,,,
66,[],False,Substantial-Echo2886,,[],,text,t2_a7ewlsih,False,False,False,[],False,False,1630426525,self.dating,https://www.reddit.com/r/dating/comments/pf93bb/how_to_date_responsibly/,{},pf93bb,False,True,False,False,False,True,True,False,#ffd635,dating,"[{'e': 'text', 't': 'Giving Advice'}]",7bca2c58-4211-11e5-9ecb-0e60d8112001,Giving Advice,dark,richtext,False,False,True,2,0,False,all_ads,/r/dating/comments/pf93bb/how_to_date_responsibly/,False,6,1630426536,1,"First off all hello and thank you for reading this post.
I'm not quite sure if this post will help anybody but I hope it does.

So I'm quite interested in dating myself and have been browsing through Reddit community's all about dating and stuff.

But sometimes I wonder why they are so many people trying to get into a relationship as fast as possible. With out any regards for themselves and their emotions or for there partners feelings.
There are also the people that want to date with out being truly happy, by themselves and for themselves first and I don't quite understand, why.
I have read about people complaining, about things they have no control over, like there hight, face and etc., and I'm not saying that they shouldn't let out there concerns, it's good for oneself to let it all out, but it shouldn't be an obsession or an excuse to you to make yourself more miserable.

I know it's already a long post but i wanted to give you all a bit of advice even if it is obvious.

1. Take your time, don't rush yourself or others, most people forget that it takes time to life, to learn new things, and to find love.

2. Be happy first and have your life sorted out because a relationship is not just fun and games, many believe it is not there responsibility to take care of there partner, but that's just wrong and irresponsible.

3. A Crush and someone you love a two different things, it might be obvious but many often forget that.

4. Respect your Partner always be Respectful, you are both trying to achieve the same thing.

5. Know your boundaries and communicate these to your partner.

6. It's okay to have argument's it's actually normal, just know how to calm the anger of you both.

7. Don't blame yourself if a relationship doesn't work out, just reflect on your past, cry and try better next time, your life is long and there are many opportunities to find new love.

8. Invest time and effort In to your partner and I don't mean just at the beginning of your relationship but the rest of your life.

9. Be prepared to be mentally and emotionally exhausted form time to time, in these moments you need a partner that is prepared to protect you and be supportive of you.

10. Follow your heart not your desire, because short term things hurt if you are not prepared for them.

It maybe quite obvious to most of you but it is just a friendly reminder to take yourself seriously and be honest with yourself and the people around you. I hope you all take care and date responsibly for everyone's safety and  well-being.

I'm sorry for my English please excuse it. Have a nice day and have fun.",True,False,False,dating,t5_2qhb1,981474,public,self,How to date Responsibly,0,[],1.0,https://www.reddit.com/r/dating/comments/pf93bb/how_to_date_responsibly/,all_ads,6,,,
67,[],False,__Naima__,,[],,text,t2_dtltyh67,False,False,False,[],False,False,1630427832,self.dating,https://www.reddit.com/r/dating/comments/pf9j1n/25m_there_is_not_much_realpractical_dating_advice/,{},pf9j1n,False,False,False,False,False,False,True,False,#ff4500,dating,"[{'e': 'text', 't': 'Question'}]",a9531dce-194e-11e5-b177-0eff099c3d1f,Question,light,richtext,False,False,True,0,0,False,all_ads,/r/dating/comments/pf9j1n/25m_there_is_not_much_realpractical_dating_advice/,False,6,1630427844,1,[removed],True,False,False,dating,t5_2qhb1,981500,public,self,[25/M] There is not much real/practical dating advice. Practical tips for dating without apps?,0,[],1.0,https://www.reddit.com/r/dating/comments/pf9j1n/25m_there_is_not_much_realpractical_dating_advice/,all_ads,6,,,automod_filtered
68,[],False,Ok-Geologist4609,,[],,text,t2_b284tnpe,False,False,False,[],False,False,1630428134,self.dating,https://www.reddit.com/r/dating/comments/pf9mmj/interview_for_a_relationship_experiment/,{},pf9mmj,False,False,False,False,False,False,True,False,#00a6a5,dating,"[{'e': 'text', 't': 'Support Needed'}]",fd9c03b8-a1ce-11e7-9172-0e8c9f9ecf4c,Support Needed,dark,richtext,False,False,True,2,0,False,all_ads,/r/dating/comments/pf9mmj/interview_for_a_relationship_experiment/,False,6,1630428145,1,[removed],True,False,False,dating,t5_2qhb1,981512,public,self,Interview for a relationship experiment,0,[],1.0,https://www.reddit.com/r/dating/comments/pf9mmj/interview_for_a_relationship_experiment/,all_ads,6,,,reddit
