,all_awardings,allow_live_comments,author,author_flair_css_class,author_flair_richtext,author_flair_text,author_flair_type,author_fullname,author_patreon_flair,author_premium,awarders,can_mod_post,contest_mode,created_utc,domain,full_link,gildings,id,is_crosspostable,is_meta,is_original_content,is_reddit_media_domain,is_robot_indexable,is_self,is_video,link_flair_background_color,link_flair_css_class,link_flair_richtext,link_flair_template_id,link_flair_text,link_flair_text_color,link_flair_type,locked,media_only,no_follow,num_comments,num_crossposts,over_18,parent_whitelist_status,permalink,pinned,pwls,removed_by_category,retrieved_on,score,selftext,send_replies,spoiler,stickied,subreddit,subreddit_id,subreddit_subscribers,subreddit_type,thumbnail,title,total_awards_received,treatment_tags,upvote_ratio,url,whitelist_status,wls,post_hint,preview
0,[],False,Icy_Reference_515,,[],,text,t2_8xm9i67w,False,False,[],False,False,1620837602,self.dating,https://www.reddit.com/r/dating/comments/nat59x/how_do_i_get_rid_of_the_toxic_red_pill_misogynist/,{},nat59x,False,False,False,False,False,True,False,,dating,"[{'e': 'text', 't': 'I Need Advice'}]",19ec58c2-9f74-11e7-81a1-0e2bf15991f0,I Need Advice,dark,richtext,False,False,True,0,0,False,all_ads,/r/dating/comments/nat59x/how_do_i_get_rid_of_the_toxic_red_pill_misogynist/,False,6,automod_filtered,1620837613,1,[removed],True,False,False,dating,t5_2qhb1,769971,public,self,How do I get rid of the toxic Red Pill misogynist thoughts I have been having?,0,[],1.0,https://www.reddit.com/r/dating/comments/nat59x/how_do_i_get_rid_of_the_toxic_red_pill_misogynist/,all_ads,6,,
1,[],False,rach2199,,[],,text,t2_88f6igb7,False,False,[],False,False,1620837927,self.dating,https://www.reddit.com/r/dating/comments/nata16/is_this_gross/,{},nata16,True,False,False,False,True,True,False,,dating,"[{'e': 'text', 't': 'I Need Advice'}]",19ec58c2-9f74-11e7-81a1-0e2bf15991f0,I Need Advice,dark,richtext,False,False,True,8,0,True,all_ads,/r/dating/comments/nata16/is_this_gross/,False,6,,1620837940,1,"I apologize if this is totally the wrong place to post this it just wouldn’t let me anywhere else!

Okay so I’m kind of embarrassed about this and it was only my third time doing anal. I don’t know who else to talk about this with so here I am! I am a 22F and the guy I was with was a 27M. We have hung out before a few times and done anal once and it was good. It had been a few months since we had hung out and we got food and were hanging and things were going super well so we fell back into our usual ways of not being able to keep our hands off each other. 

He asked if we could do anal and I was a little hesitant but said yes. It hurt a bit but he was considerate and gentle and caring. We did it for a while switching positions until he said he was close to cuming. He was taking a video on my phone, I was in doggy. He came inside me and when he pulled out there was a medium sized drop of dark stuff and a little fleck of dark stuff that dropped out (poop and maybe a little blood-gross I know!).. he wiped it off quickly and got a towel. so he didn’t say anything was sweet and gave me a towel but I kinda worried about it anyways cuz it’s anal. When he was setting alarms and stuff I watched the video and saw it and was mortified. He was sweet and we cuddled and fell asleep and the next morning we had vaginal sex and it was great. 

We never addressed the gross dripping that  accompanied his cum. I am still so embarrassed though! Is this normal? Am I super gross or something? I guess if he was gonna cum in me and I hadn’t cleaned out earlier (I didn’t know we were gonna do anal) then something would’ve come out. Do you think he was disgusted though? I feel bad and gross kind of but I really wanted to please him and it was mostly enjoyable. 

If you have anything thoughts about my silly and embarrassing experience please share your honest thoughts but also please be kind if possible-I have ocd and anxiety so you better believe it’s going to be driving me nuts for weeks anyways lol",True,False,False,dating,t5_2qhb1,769980,public,nsfw,Is this gross?,0,[],1.0,https://www.reddit.com/r/dating/comments/nata16/is_this_gross/,promo_adult_nsfw,3,,
2,[],False,Sugardaddydenizi,,[],,text,t2_bws78tgn,False,False,[],False,False,1620837975,self.dating,https://www.reddit.com/r/dating/comments/natas5/im_looking_for_a_serious_sugar_baby_im_ready_to/,{},natas5,True,False,False,False,True,True,False,,,"[{'e': 'text', 't': 'Tinder/Online Dating'}]",5214d2ac-61f1-11e8-8bb1-0ed15e4a39c0,Tinder/Online Dating,dark,richtext,False,False,True,2,0,False,all_ads,/r/dating/comments/natas5/im_looking_for_a_serious_sugar_baby_im_ready_to/,False,6,,1620837986,1,"I’m looking for a serious sugar baby ,I’m ready to spoil you financially baby.text me on my number (518) 406-0429 for quick pay up ❤️",True,False,False,dating,t5_2qhb1,769981,public,self,"I’m looking for a serious sugar baby ,I’m ready to spoil you financially baby.text me on my number (518) 406-0429 for quick pay up ❤️",0,[],1.0,https://www.reddit.com/r/dating/comments/natas5/im_looking_for_a_serious_sugar_baby_im_ready_to/,all_ads,6,,
3,[],False,calicopyjamas,,[],,text,t2_bfv93oj0,False,False,[],False,False,1620838193,self.dating,https://www.reddit.com/r/dating/comments/nate29/why_do_people_post_nothing_but_group_photos_on/,{},nate29,True,False,False,False,True,True,False,,dating,"[{'e': 'text', 't': 'Question'}]",a9531dce-194e-11e5-b177-0eff099c3d1f,Question,dark,richtext,False,False,True,48,0,False,all_ads,/r/dating/comments/nate29/why_do_people_post_nothing_but_group_photos_on/,False,6,,1620838204,1,"When scrolling through a lot of men’s profiles it’s like trying to play a game of Where’s Wally. Are you on the left or...? Seriously I’ve had some where there’s either no clear photo of them on their own where their face is recognisable, they look too similar to their friends to the point you can’t tell them apart, or there’s literally no lone photo of them whatsoever. It doesn’t make you look cool or sociable, it’s just annoying and I end up swiping left. Do any men on here get the same thing with women? Genuinely curious.",True,False,False,dating,t5_2qhb1,769985,public,self,Why do people post nothing but group photos on their dating profiles?,0,[],1.0,https://www.reddit.com/r/dating/comments/nate29/why_do_people_post_nothing_but_group_photos_on/,all_ads,6,,
4,[],False,temporaryAMA,,[],,text,t2_4x7aff4a,False,False,[],False,False,1620838946,self.dating,https://www.reddit.com/r/dating/comments/natoue/how_do_i_progress_with_a_girl_i_met_and_want_to/,{},natoue,True,False,False,False,True,True,False,,dating,"[{'e': 'text', 't': 'Question'}]",a9531dce-194e-11e5-b177-0eff099c3d1f,Question,dark,richtext,False,False,True,5,0,False,all_ads,/r/dating/comments/natoue/how_do_i_progress_with_a_girl_i_met_and_want_to/,False,6,,1620838956,1,"I met a girl last week while attending a lesson. I struck conversation with her over the breaks we had and I think I'd like to know her better. I found her to be quite pretty and fun to talk with, we had things in common

I forgot to ask her number but I decided to follow her on instagram and shoot her a message saying who I was and how she was doing. She followed me back and said she was good and asked me back. She also used those blushing smiley's in her text which is a good thing, right?

I then asked her some questions what she was currently doing which thinking back is probably a bad idea since she's already told me these things about her and they're not really that interesting to talk about. I asked her what she was up to this week and tried to steer the conversation into something we might have in common hoping to ask her if she wants to meet up. Or is that too soon? I think she's also a bit busy since she has exams coming up

Do people like to text a bit before meeting in person? I always feel like texting is very boring especially if it's with someone I barely know. Should I just ask her if she's free and wants to go out some day?",True,False,False,dating,t5_2qhb1,770005,public,self,"How do I ""progress"" with a girl I met and want to date? Should we talk over text first?",0,[],1.0,https://www.reddit.com/r/dating/comments/natoue/how_do_i_progress_with_a_girl_i_met_and_want_to/,all_ads,6,,
5,[],False,Gold-Wedding-1000,,[],,text,t2_7peytiqp,False,False,[],False,False,1620839005,self.dating,https://www.reddit.com/r/dating/comments/natpqg/would_you_continue_to_see_someone_knowing_they/,{},natpqg,True,False,False,False,True,True,False,,dating,"[{'e': 'text', 't': 'Question'}]",a9531dce-194e-11e5-b177-0eff099c3d1f,Question,dark,richtext,False,False,False,4,0,False,all_ads,/r/dating/comments/natpqg/would_you_continue_to_see_someone_knowing_they/,False,6,,1620839016,1,Would you continue if they might might have to move out of the country and it’s been 2 months of the talking stage.,True,False,False,dating,t5_2qhb1,770007,public,self,Would you continue to see someone knowing they have to move soon?,0,[],1.0,https://www.reddit.com/r/dating/comments/natpqg/would_you_continue_to_see_someone_knowing_they/,all_ads,6,,
6,[],False,Massive_Tower8105,,[],,text,t2_c2mbo98t,False,False,[],False,False,1620839017,self.dating,https://www.reddit.com/r/dating/comments/natpw6/dating_question_for_other_desi_girls/,{},natpw6,False,False,False,False,False,True,False,,dating,"[{'e': 'text', 't': 'I Need Advice'}]",19ec58c2-9f74-11e7-81a1-0e2bf15991f0,I Need Advice,dark,richtext,False,False,True,0,0,False,all_ads,/r/dating/comments/natpw6/dating_question_for_other_desi_girls/,False,6,moderator,1620839027,1,[removed],True,False,False,dating,t5_2qhb1,770007,public,self,Dating question for other Desi girls,0,[],1.0,https://www.reddit.com/r/dating/comments/natpw6/dating_question_for_other_desi_girls/,all_ads,6,,
7,[],False,littlemisseskisses,,[],,text,t2_9fdhwp8f,False,False,[],False,False,1620839547,self.dating,https://www.reddit.com/r/dating/comments/natxjr/how_to_set_expectations_without_coming_off_as/,{},natxjr,True,False,False,False,True,True,False,,dating,"[{'e': 'text', 't': 'I Need Advice'}]",19ec58c2-9f74-11e7-81a1-0e2bf15991f0,I Need Advice,dark,richtext,False,False,True,18,0,False,all_ads,/r/dating/comments/natxjr/how_to_set_expectations_without_coming_off_as/,False,6,,1620839557,1,"I’ve (F24) been seeing this guy (M30) for a few weeks now. We’ve been on a few dates and recently hooked up for the first time last weekend. He made it pretty clear he’s doing his own thing, seeing other girls, sometimes sleeping with other girls, and he’s also a very busy business owner. I’m in the same boat, don’t really want anything serious but enjoy his company a lot and every time we hang out it’s never any less than 6 hours at a time and we always have a blast. I wish this didn’t happen to women so often after we get physically intimate with men but it does. Now that we’ve had sex I kind of want to communicate that my expectations are that we would talk...more.. during the week. We usually see each other once a week but he never initiates a conversation with me but he’s always the one to makes plans. He’s expressed to me that girls have gotten clingy with him in the past and I want to avoid that. I’m not expecting phone calls every night or either of us becoming exclusive but it’d be nice to get a “Hey, how’s your day going” text from time to time. Do you think that’d scare him off or that he’d appreciate the honesty? I just know my worth and know that being physically intimate with someone would take a little more effort on their part..",True,False,False,dating,t5_2qhb1,770021,public,self,How to set expectations without coming off as needy,0,[],1.0,https://www.reddit.com/r/dating/comments/natxjr/how_to_set_expectations_without_coming_off_as/,all_ads,6,,
8,[],False,s199320,,[],,text,t2_4jn7g5ck,False,False,[],False,False,1620839562,self.dating,https://www.reddit.com/r/dating/comments/natxs0/does_your_tinderbumblehinge_profile_ever_just_die/,{},natxs0,False,False,False,False,False,True,False,,dating,"[{'e': 'text', 't': 'Question'}]",a9531dce-194e-11e5-b177-0eff099c3d1f,Question,dark,richtext,False,False,True,2,0,False,all_ads,/r/dating/comments/natxs0/does_your_tinderbumblehinge_profile_ever_just_die/,False,6,moderator,1620839573,1,[removed],True,False,False,dating,t5_2qhb1,770021,public,self,Does your tinder/bumble/hinge profile ever just die a death and you get no likes at all?,0,[],1.0,https://www.reddit.com/r/dating/comments/natxs0/does_your_tinderbumblehinge_profile_ever_just_die/,all_ads,6,,
9,[],False,s199320,,[],,text,t2_4jn7g5ck,False,False,[],False,False,1620839687,self.dating,https://www.reddit.com/r/dating/comments/natzmg/does_your_tinderhingebumble_profile_ever_just_die/,{},natzmg,True,False,False,False,True,True,False,,dating,"[{'e': 'text', 't': 'Question'}]",a9531dce-194e-11e5-b177-0eff099c3d1f,Question,dark,richtext,False,False,True,9,0,False,all_ads,/r/dating/comments/natzmg/does_your_tinderhingebumble_profile_ever_just_die/,False,6,,1620839698,1,"All three of my profiles always just seem to get to a point where nothing happens, it’s evident I’m not even being shown to people. What do I do just delete and remake? 

Not sure I get their biz model. Do desperate people really pay when the app has given them nothing for weeks on end?",True,False,False,dating,t5_2qhb1,770024,public,self,Does your tinder/hinge/bumble profile ever just die and you get no more likes?,0,[],1.0,https://www.reddit.com/r/dating/comments/natzmg/does_your_tinderhingebumble_profile_ever_just_die/,all_ads,6,,
10,[],False,Particular-Dot-2100,,[],,text,t2_c32c3mdi,False,False,[],False,False,1620840074,self.dating,https://www.reddit.com/r/dating/comments/nau538/please_help_me_i_was_to_needy/,{},nau538,False,False,False,False,False,True,False,,dating,"[{'e': 'text', 't': 'I Need Advice'}]",19ec58c2-9f74-11e7-81a1-0e2bf15991f0,I Need Advice,dark,richtext,False,False,True,0,0,False,all_ads,/r/dating/comments/nau538/please_help_me_i_was_to_needy/,False,6,moderator,1620840085,1,[removed],True,False,False,dating,t5_2qhb1,770033,public,self,Please help me I was to needy,0,[],1.0,https://www.reddit.com/r/dating/comments/nau538/please_help_me_i_was_to_needy/,all_ads,6,,
11,[],False,goffic_toesauce_fag,,[],,text,t2_60ede30c,False,False,[],False,False,1620840852,self.dating,https://www.reddit.com/r/dating/comments/naug0a/i_feel_like_im_toxic/,{},naug0a,True,False,False,False,True,True,False,,dating,"[{'e': 'text', 't': 'Venting'}]",a616c322-194e-11e5-ab91-0ed1c06bdad7,Venting,dark,richtext,False,False,True,3,0,False,all_ads,/r/dating/comments/naug0a/i_feel_like_im_toxic/,False,6,,1620840864,1,"I've been with my man for almost a year now. And I'm really happy in this relationship and he seems like he's happy but I'm hella insecure so I feel like I'm toxic sometimes. I fear I might be manipulating him without realizing it. He says I'm not even in the slightest. My ex would build me up just to tear me down hard and sometimes I feel like I'm no better than that. We don't exactly argue and when we do, we blame ourselves for starting it rather than each other. I'm probably really not but sometimes it just feels like I'm being too much.",True,False,False,dating,t5_2qhb1,770051,public,self,I feel like im toxic,0,[],1.0,https://www.reddit.com/r/dating/comments/naug0a/i_feel_like_im_toxic/,all_ads,6,,
12,[],False,Gashope,,[],,text,t2_3x5bwr08,False,False,[],False,False,1620840983,self.dating,https://www.reddit.com/r/dating/comments/nauhx1/please_help_me_she_lost_interest_because_i_was/,{},nauhx1,True,False,False,False,True,True,False,,dating,"[{'e': 'text', 't': 'I Need Advice'}]",19ec58c2-9f74-11e7-81a1-0e2bf15991f0,I Need Advice,dark,richtext,False,False,True,6,0,False,all_ads,/r/dating/comments/nauhx1/please_help_me_she_lost_interest_because_i_was/,False,6,,1620840995,1,"I matched with this girl in tinder a month ago, we meet and have a good date, we end up with cuddling and having sex. I leave next morning and she text me that she would love to see me again, I agree. 

We start seeing each others every other day for 2 weeks (and everytime we sleep over and stay until evening). It was always her who intiated texting etc. I got addicted to this girl, and wanted to be with her 24/7 (My mom passed away 7 months ago and i have a massive void, and she accidently started to fill )

One day i proposed that we should be friends because I was not sure if I liked her or if i liked the feeling she gave me. I instantly regret it and though and took it back and apologized and said lets just continue to date and see where it goes. She accepted. 

Last week was when the neediness started to show with actions,. When she wanted to leave to study etc, i asked her  to please stay another night etc. In the end it all got too much. And we had the discussion of where we stand in the relationship and she said that its best if we stopped seeing each others.

Monday I ask her how she feels and that im ready to change this neediness, and I have to understand that she has a life outside of me etc, she says ""Do you rly think it can work then""? i say i think so. She says  ""We can meet up end of week to see how we feel etc"" I tell her that I have to go the the doctor now, she wishes me good luck and I tell her that it went well, and says ""good""

&amp;#x200B;

I havent heard from her since then, she always used to text me, etc. and its killing me. What do i do?",True,False,False,dating,t5_2qhb1,770055,public,self,Please help me she lost interest because I was needy,0,[],1.0,https://www.reddit.com/r/dating/comments/nauhx1/please_help_me_she_lost_interest_because_i_was/,all_ads,6,,
13,[],False,lowkeyhighkeyexpert,,[],,text,t2_358y94dm,False,False,[],False,False,1620841064,self.dating,https://www.reddit.com/r/dating/comments/nauj3f/she_suddenly_stopped_texting_and_blocked_me/,{},nauj3f,True,False,False,False,True,True,False,,dating,"[{'e': 'text', 't': 'I Need Advice'}]",19ec58c2-9f74-11e7-81a1-0e2bf15991f0,I Need Advice,dark,richtext,False,False,True,26,0,False,all_ads,/r/dating/comments/nauj3f/she_suddenly_stopped_texting_and_blocked_me/,False,6,,1620841075,1,"So I’m in a bit of a situation and can’t figure out what in the heck is going on... Here’s the story:

Im a 20M and a couple of months ago (coincidentally on my bday), I met this girl (20F) over an app online. She lives about 6-8 hours away by drive. We clicked pretty easily and imo, we had a decent vibe going. We texted a little on the app then I asked for IG. I was new to online dating so I wasn’t sure about procedure and ended up asking her out  or for a call pretty much after getting her ig. She said she wanted to take things slow and that it wasn’t a “no”. I totally respect that and told her and we ended up chatting pretty much everyday after.

At first, our exchanges were a few hours apart (I took about an hour at most to reply while she often took 2-3 hrs). Gradually, it became 2hrs for me and 15+ hrs for her. I know, possible red flag. 

About 3-4 weeks ago, I get her number cause I’m using ig less (and I wanted to get her number). But I know she’s a double major and doing a bunch of other stuff, so she’s super busy and I get that.

Anyhoo, two weeks ago I send her a reply and boom... no reply. I was worried about her and decided to give her a week before following up. The last day before I test her, she posts a pic (arguably her at her cutest imo) on her story. I think to myself that maybe she’s still busy so I give her a few more days. A couple of days later, she posts another story about some awareness thing. Next day, I can’t find her account on ig. I use my other account and see her account so my assumption is that I’m blocked.

Over the next few days, a few minor things happen: I lose sleep worrying about why all this happened, I look back on old texts to see if I said something wrong, and I give up on the idea of dating.

Yesterday, I decide that I need to know what’s going on and text her asking her if everything’s ok. Again, no reply... yet.

As I write this, I’m eating my breakfast and trying to watch a lecture online, or a lack thereof. I’ve been thinking of why this would happen and this is what I’ve come up with:

1. She’s fallen for someone else.
2. She wants to focus on her studies/work rn.
3. I said something I shouldn’t have.
4. She’s working for the CIA undercover and can’t make contact.
I know that last one sounds a little unorthodox but I can’t figure out anything else. 1 and 2 don’t make because we previously talked about how she would reject someone (it came up in a convo about her friends) and she would be straightforward. As for 3, our texts are largely “fun-filled” and a lot of jokes. Not to mention that nothing I could have said  would even make her do this.

My plan thus far is:
1. Give her a couple of days to reply to the text I sent yesterday.
2. Call her if she doesn’t reply by then.
3. If she doesn’t pick up or if I’m blocked over text too, then I’ll text her sister asking her whats going on or if the my girl is ok.
4. If this still doesn’t work, I’ll have to go meet her in person somehow.
I need closure about what’s going on because I can’t stop thinking about her and that’s messing with my schedule.

If you guys have read this far, please tell me what you think. I’ve never been in this situation and I don’t know what to do. 

Also, I know this may not count as dating but it’s a pandemic and I really like her so yeah...

Any advice is much appreciated.",True,False,False,dating,t5_2qhb1,770057,public,self,She suddenly stopped texting and blocked me?!,0,[],1.0,https://www.reddit.com/r/dating/comments/nauj3f/she_suddenly_stopped_texting_and_blocked_me/,all_ads,6,,
14,[],False,Coolyugi101,,[],,text,t2_c2lfcow4,False,False,[],False,False,1620841507,self.dating,https://www.reddit.com/r/dating/comments/naupbm/what_is_the_fastest_way_to_get_over_someone_that/,{},naupbm,True,False,False,False,True,True,False,,dating,"[{'e': 'text', 't': 'Question'}]",a9531dce-194e-11e5-b177-0eff099c3d1f,Question,dark,richtext,False,False,False,3,0,False,all_ads,/r/dating/comments/naupbm/what_is_the_fastest_way_to_get_over_someone_that/,False,6,,1620841518,1,"I (m) was in a relationship with this (f) and we made it work at the start and we continue to grow and grow but soon we got into some small fights not really big problem yet. Sometime later it my birthday and I spend it with people I was close with including (f) and on the way back it was just me and the (f) I got in the back with her and than I started tear up outta no where I hugged her and told her not to leave she promised not to....... But she did and now I'm hear, so what the best way to move on?",True,False,False,dating,t5_2qhb1,770069,public,self,What is the fastest way to get over someone that you love ?,0,[],0.99,https://www.reddit.com/r/dating/comments/naupbm/what_is_the_fastest_way_to_get_over_someone_that/,all_ads,6,,
