,id,created_utc,title,selftext,subreddit,subreddit_id,url
0,qlrtug,1635936550,*no need to reply. I'm just venting*,"I met a girl in February 2021 in a very very very weird way through one app. I just out of boredom asked her if she wants to see my d pic. She agred, she saw and she wanted me to be her fwb. We started talking and talking, she kinda fell in love with me after we talked for a bit but she said that she isn't sure about her being in love with me altough we can try. Well few times we met and did some naughty things in my car. Meanwhile i fell in love with her but she said that she's sure she isn't ready and we can be fwb's and just that. I got frustrated about it and i stooped contacting her with her saying that she really doesn't wanna have a boyfriend for a really long time. Fast forward to the October 2021 i contacted her, apologised for my behavior thinking she still has no bf because i wanted to revive our fwb relationship. And this is where things went wrong. She said she's okay with reviving our relation but without the fwb part cause she has all of a sudden a bf.. and i'm crushed. I feel really devastated because in the end i'm always a 2nd option or not even an option. It doesn't matter if i'm trying to be with someone or even to just have sex. At the end they just fall in love with another guy and i'm feeling stupid and used as a teddy bear for their dark times until they found someone else. I'm just gonna cry and try to get my shit together. Stupid hope",dating,t5_2qhb1,https://www.reddit.com/r/dating/comments/qlrtug/no_need_to_reply_im_just_venting/
1,qls2w5,1635937612,Should I tell my new dating partner that I still have feelings for my ex boyfriend who is still my friend?,"I am in a dilemma. I'm currently dating someone new for a month now. We both told each other that we fell in love with one another. And it's beautiful and great and everything is awesome. 

I am also still friends with my ex boyfriend. We separated 3 years ago and worked alot on forming a friendship and we made it work. He has a new girlfriend now since 2 years already and we are all very good with each other. My new dating partner also knows that we are close friends and is totally fine with it.

What is also important to say: I still have feelings for my ex. He knows about that and we are very honest to each other. Also VERY important: I don't want a relationship with him anymore. I just still like him alot and that is perfectly fine. So there is NO problem here. So conclusion: my ex and me will never be in a relationship again because neither of us wants that. He also has no feelings for me anymore. 

But I really want to be honest with the guy I am dating currently. Because we have been honest to each other about really heavy stuff already and I appreciate this so much ! And I feel like I have to tell him that I also still like my ex. I wanna tell him that it doesn't change anything between us. Because it doesn't. 

I believe that you can love more than one person at a time and that love is not a finite resource. I talked about stuff like this with him already and he agreed. But I didn't tell him that it's the case here that I still have feelings for someone else.  

I don't really know what to do. I kind of wanna tell him and tell him that it won't change anything between us and that I will never date my ex again in any way, but on the other hand I sometimes feel that I shouldn't tell him because in the end it doesn't change anything and I am scared that he might leave. Maybe it could cause more damage than making sense telling him. Maybe he doesn't need to know? I don't know.  

Has anyone ever been in a similar situation and could give me some advice on this ?",dating,t5_2qhb1,https://www.reddit.com/r/dating/comments/qls2w5/should_i_tell_my_new_dating_partner_that_i_still/
2,qls9p7,1635938389,Girl didn't want a second date now 2 weeks later is asking to see me,We seemed to have good conversations before our first date. She would text me good morning would want to talk on the phone alot. Had our first date at a hockey game. She said her favorite player was who ever. And I was like oh yeah? Is it because he's cute. She giggled a d said yes. I'm from Boston so I was joking and said i know what you mean I have a small crush on Tom Brady. I also mentioned before that I like to listen to Adele when I do cardio. I'm like running away from. Sadness. Anyways date went good but after she said she doesn't see this going any where. Okay cool. Part of dating. Now she messages me saying she thought I was too feminine because of the Tom Brady Adele comment. But her friend said it just meant I was secure in myself. She was like I would like to see you again now. Like it's a honor to see her. I said no thanks. Lol I'm not into that stupid insecure macho tough guy shit. I killed people in war with my bare hands. I don't give a shit about looking tough. If you don't like Adele you are lying.,dating,t5_2qhb1,https://www.reddit.com/r/dating/comments/qls9p7/girl_didnt_want_a_second_date_now_2_weeks_later/
3,qlschz,1635938693,Formal advice,[removed],dating,t5_2qhb1,https://www.reddit.com/r/dating/comments/qlschz/formal_advice/
4,qlsjg6,1635939442,Post covid dating,"What do you think about the dating during ""post covid"" times?🤔 I find it so hard to date tbh, i've become so picky and i think i still prefer to stay home rather than going out..",dating,t5_2qhb1,https://www.reddit.com/r/dating/comments/qlsjg6/post_covid_dating/
5,qlsl05,1635939608,How to get into a committed relationship? {19F},"So I know I’m still young and all that, but I would really like to date around while I still have the spirit for it haha

I’ve only ever dated people online before, but it was while I was still a minor and I would say only one was serious. Even if I do count that one relationship, that’s just about the sum of my dating experience.

I do have anxiety when meeting new people (physically) and especially with men. I don’t typically adhere to societal norms, so I’m clueless about what to do when going on dates (men and women included). I’m more of the ‘do what I want’ kind of person lol I do at least know not to make an ass of myself, keep off my phone, ask questions, etc. But flirting? Knowing when the vibe is off? How to know if they’re into me? Nada.

So I’d like to know some signs a date is going well or even how to go about setting up a first date. Also, at what point do dates turn into a relationship? I’ve always felt that it’s single until asked (or vice versa) to be in a closed monogamous relationship but apparently that’s not how it works??

I do ‘talk’ to more than one person at a time to keep my options open too. I have made a faux pass in the past before by mentioning other guys I was talking to in conversation with another guy I was talking to. He had to explain to me why being so forthcoming wasn’t always the best lol

Oh and when is a good time to have your first kiss or vaginal sex? I haven’t been on many dates and honestly the ones I have been on ended up with us having sex or just becoming friends. I have had issues with offering sex when I wasn’t interested in *just* that, but I felt like it was something I had to offer or else they’d lose interest (this only happens with men).

And yes, I DO have unresolved trauma but we are working on that !! Much thanks in advance :)",dating,t5_2qhb1,https://www.reddit.com/r/dating/comments/qlsl05/how_to_get_into_a_committed_relationship_19f/
6,qlsni4,1635939873,What does it mean when a guy will only flirt with you through text but in person act cold and distant?,"Have a guy friend who always only ever talks in person if I initiate first or if any of our friends are in the circle. We're in our twenties and have nothing really in common except our mutual friends and age. He initiates texts and calls me attractive on the texts but won't flirt or approach me in person. Is is moreso him trying not to give the impression he likes me in front of our friends, or him being shy? He doesn't seem the type to want to date me, we've been friends for a couple months and he hasn't asked me out. He's only impñied hanging out, which is a friend term. He knows I'm single, and he's single. He does however flirt through text.",dating,t5_2qhb1,https://www.reddit.com/r/dating/comments/qlsni4/what_does_it_mean_when_a_guy_will_only_flirt_with/
7,qlsq7z,1635940152,21 M looking for anything,Very lonely guy looking for space or physics nerds to chat about the wonders of our universe. ❤️,dating,t5_2qhb1,https://www.reddit.com/r/dating/comments/qlsq7z/21_m_looking_for_anything/
8,qlss7m,1635940365,Why do some people only date a certain ethnic group?,"There's some white women that will exclusively date black men.
There some east Asian women that will exclusively date white men.
There's some black men that will only date white women.
I don't understand how some people are not attracted to there own ethnic group.",dating,t5_2qhb1,https://www.reddit.com/r/dating/comments/qlss7m/why_do_some_people_only_date_a_certain_ethnic/
9,qlt1ck,1635941292,“You’re fine you overthink”,I’ve known her for 4months I asked if I could send her a dick pic she didn’t replay so I apologized and she responded “youre fine you overthink” but hasn’t texted me since I said happy Halloween thoughts?,dating,t5_2qhb1,https://www.reddit.com/r/dating/comments/qlt1ck/youre_fine_you_overthink/
10,qltazn,1635942284,How do I date as an asexual?,"Hey people, hope you all are having a good day : ) 

I hate to admit it but I'm having some difficulties, I have tried multiple dating apps and make it very clear on my profile I'm ace with a brief description of what I am in hopes it would clear up any confusion.

I've tried dating other aces but the problem is the dating pool is so tiny I end up speaking to someone half way across the planet, which is fine I'm just not good with long distance. 

I'm 22, 6'2, 150lbs and pretty average when it comes to looks so I feel my sexual orientation is the reason I'm having some difficulties on dating apps. 

Any other aces here have any solid advice?",dating,t5_2qhb1,https://www.reddit.com/r/dating/comments/qltazn/how_do_i_date_as_an_asexual/
11,qltbx0,1635942377,"A girl who ghosted me via OLD came to my workplace yesterday...it was, interesting...","About a month back I was on tinder and matched with a person who I tried (and failed) to organize plans with. I gave her my number and attempted to organize something with her, and it was like pulling teeth. Pretty much a similar story to what a lot of people on here go through. One response a day, very non-committal to actually organizing a solid day and time down. I ended up getting frustrated with the situation and blocked that person out of my phone because (like most people) I have zero time for being messed around or bread crumbed. 

Fast forward a month on and a couple of cute girls come down to where I work just as I begin shift. With it being a hospitality focused job, I have to interact with customers to sell more drinks and get photos for the website. I noticed this girl but didn't realize it was this person I had met on tinder, she didn't look like her photos (actually preferred her real life looks) and I didn't make the connection who I was talking to. After I took a few photos and had a bit of banter, I walked away joking that the photo I had taken was awesome and she should whack it on her social media ASAP. She responded ""Well I don't have you on my socials, do I?"" and proceeds to add herself to my Facebook.

She leaves, messages me straight away, and we've been talking since. We have solid plans organised, she responds almost immediately even if I've left it hours through being busy. It is like talking to a completely different person. I'm guessing she hasn't realized who I am either and has no idea of our previous disastrous interaction. But it's crazy how different the conversation is after meeting in person as opposed to matching on a dating app.

I don't drink alcohol or go to clubs so it's hard for me to meet people and having women at work be so forward is incredibly rare, but stuff like this makes me wish I was a naturally more social person and could just meet people organically in person, it's SO much nicer than dealing with being constantly ghosted or treated like crap on those apps.",dating,t5_2qhb1,https://www.reddit.com/r/dating/comments/qltbx0/a_girl_who_ghosted_me_via_old_came_to_my/
12,qltcqp,1635942464,Is it worth contacting her again after a long time?,"I went on a few great dates with this girl, but when it came to being intimate, I had issues with performance due to a problem with my foreskin, and that just killed the vibe. I enjoyed my time with her and there was attraction, until I couldnt really perform due to that issue. Now that problem is resolved, i want to send her a message again. She lives near me, and my barber is right near where her art pop up is. I've not actually seen her in 6 months, but I did enjoy my time with her, is it worth messaging again? I am tired of going on dating apps, I cant catch a break on one atm.",dating,t5_2qhb1,https://www.reddit.com/r/dating/comments/qltcqp/is_it_worth_contacting_her_again_after_a_long_time/
13,qltdo9,1635942560,How 'Golden Penis Syndrome' is ruining dating for university women: Deficit of male students means men develop inflated egos and become 'Casanovas' who 'cheat' - despite a 'lack of social and sexual skills',[removed],dating,t5_2qhb1,https://www.reddit.com/r/dating/comments/qltdo9/how_golden_penis_syndrome_is_ruining_dating_for/
14,qltf20,1635942688,Meetup.com or similar experiences,"So I really want a relationship, unfortuantly I did not have any look with online dating. I'm at a point where I'm thinking about joining random meetups or similar just to meet single women in real life and maybe something happens. But I'm not sure because it would be really just for me to meet women I don't have any interest in getting new friends I don't like having to many people in my life, it's hard for me to keep up. So I don't know I'm quite introverted, I hate being in large groups but like I said online dating does not work for me and really think I will maybe try to join random social events primarily to meet women obviously I won't hit on anyone or act like creep at a meet up and just hope that something  happens naturally.  

I would appreciate input or maybe if some one can offer his or her experiences if you where in the same predicament.",dating,t5_2qhb1,https://www.reddit.com/r/dating/comments/qltf20/meetupcom_or_similar_experiences/
15,qltf3g,1635942692,How 'Golden Penis Syndrome' is ruining dating for university women: Deficit of male students means men develop inflated egos and become 'Casanovas' who 'cheat' - despite a 'lack of social and sexual skills'," 

I read an article on Mail Online (can't post links) and I can see where they are coming from, but I can't help to notice that non college educated men, especially blue collar workers that in most cases make above average salaries and in places like the US easily reach a 6 figure salary, aren't even considered as people (the article simply ignores their existence) and ascribes money, degree and looks as the only viable traits for a long term relationship.

I'm definitely not trying to take any digs or jabs at anyone, but ask people here out of genuine curiosity, especially women if they agree with this stance and why because my cursory observations and anecdotal evidence doesn't really seem to support this. So... A guy in this forty's with a stable life and income, that's let's say average across the board is *'unmarriageable'?* I would like to know why.

*'We're seeing generation of young men who think they're Adam Driver or Michael B. Jordan. Of course, it's not about them. It's the ratio.'* 

*In his book, Birger makes the case that 'hookup culture' among students 'trickles down into post-college dating' and that 'lopsided ratios have been a driving force behind both the rise of the hookup culture and the declining marriage rates among the university educated.*

*'Of course, university sex ratios wouldn't matter so much if we were all more open-minded about whom we date and eventually marry (which I think we should be).* 

*'But at the same time university sex ratios have been skewing female, there's been a simultaneous increase in what academics call 'assortative mating'. That's a fancy way of saying that college grads only want to date and marry other grads.*

*'There's been a ton of scholarly research on how sex ratios affect culture, and what it shows is that the dating culture tends to be more monogamous when men are in oversupply.* 

*'But when men are in undersupply, the dating culture becomes less monogamous — men are more likely to treat women as sex objects and treat relationships as disposable.'* 

*He says the shift in attitude may be subconscious for men, adding it's 'human nature' to get carried away after receiving excessive attention.* 

*'If a guy is getting a lot of attention from women, he's going to think he's deserving of all that attention. It's human nature. When women get a lot of attention from men, some women think they're special too.'* 

*He also believes that this phenomenon is prevalent in workplaces with a higher female to male ratio.* 

*'Because of the way the math works, Golden Penis Syndrome probably affects men in their 30s and 40s more than those in their 20s. At least the heterosexual ones. Imagine you have a dating pool that starts out with 40 women and 30 men, which is a 4:3 ratio.* 

*'Once half of the women get married — once 20 of the women get married to 20 of the men — the dating pool among the remaining singles becomes 20 women and 10 men — a 2:1 ratio. This is why we all know so many fabulous women in their 30s and 40s who cannot seem to find a decent guy.'* 

*He says that older women seeking a husband should avoid men who have never married into their late 30s and 40s who have high-paid - even dubbing some of them 'unmarriageable'.*",dating,t5_2qhb1,https://www.reddit.com/r/dating/comments/qltf3g/how_golden_penis_syndrome_is_ruining_dating_for/
16,qltigs,1635943000,How do we meet new people nowadays? Help a girl out :),[removed],dating,t5_2qhb1,https://www.reddit.com/r/dating/comments/qltigs/how_do_we_meet_new_people_nowadays_help_a_girl_out/
17,qlto6v,1635943543,He wants to slow down things but it's too distant,"I (23f) met a guy (29m) through Reddit 2 weeks ago. He started liking me after we met. 5 days later, as we were chatting until 6am in the morning, I started liking him too. We work in the same field (but he's a senior and I'm a junior), we share similar views in life and similar hobbies and bucket lists. We missed each other a lot. We would talk about how we would do fun things together. I thought he could be a partner in crime in my personal and work life. 3 days after we chatted almost the whole day everyday, he spent a night at my place (but no sex yet). For some people it might move too fast, but for me it was a perfect pace, because I was searching for a partner in crime for a long time. Before he went home from my place, he told me that he woke up from his dream already and he wanted to face the reality. He wanted us to date first exclusively until he figured out what he really wanted in a relationship (he said he would figure that out in &gt;2 months), and then see if we are still compatible, because relationship for him is a lot of responsibilities. We also said that we should slow down things and start knowing each other slowly. I agreed to that, but I didn't know that it would be that slow. We are now really distant - we would only chat to agree when to meet and that's it. But I know that actually he really enjoyed texting. He's not curious about me anymore nor I feel that he misses me. I suddenly feel very lonely. I realised I made a huge mistake of having too much expectations, imagining us doing these fun things together. Should I still give him a chance?",dating,t5_2qhb1,https://www.reddit.com/r/dating/comments/qlto6v/he_wants_to_slow_down_things_but_its_too_distant/
18,qltr1x,1635943818,23f interested in a guy who is 46.," Is this age gap appropriate? I've never considered dating someone much older, but I think that I really like him, just not sure if there's going to be any problems because of our age gap. What do you think?",dating,t5_2qhb1,https://www.reddit.com/r/dating/comments/qltr1x/23f_interested_in_a_guy_who_is_46/
19,qltvez,1635944238,Would this be a dealbreaker/red flag for you?,"I have ptsd and depression; while i know that i am loveable regardless, i also know that i lost several friends because of this...

(I am really not here for support, or anything; i just heard/red increasingly often that this is considered a red flag...)

I do know that this sub is definitely not representative, but i would like to know if this would be a dealbreaker/red flag for you (if you're comfortable maybe mention your gender)?",dating,t5_2qhb1,https://www.reddit.com/r/dating/comments/qltvez/would_this_be_a_dealbreakerred_flag_for_you/
20,qlughq,1635946097,Women and men are not equal,"My fiance thinks that men and women  are not equal bc women are weaker.  I think we can be equally  strong, right?",dating,t5_2qhb1,https://www.reddit.com/r/dating/comments/qlughq/women_and_men_are_not_equal/
21,qluhre,1635946203,Red flag?,How big of a red flag is it when someone brings a flask and adds liquor to his drink on the first date? He’s not cheap so I didn’t think it was that he didn’t want to pay for an extra shot. He had an actual flask. Which makes me wonder does he drink it whenever…,dating,t5_2qhb1,https://www.reddit.com/r/dating/comments/qluhre/red_flag/
22,qluks7,1635946460,Should I meet this guy in person?,I met this guy on Tinder over the summer he and I have been talking on and off. I actually stopped responding to his messages. Anyway lately we've been talking more and he says that he feels comfortable talking to me. And it seems like we really get along via text. I did tell him initially that it takes me time to really open up. And he seems to be ok with that he's told me what he's looking for. And has been honest with me about his current situation. He's into Poly and is currently involved with this married couple. And he wants to be with someone else. I told him we could be friends and he seems to be ok with this. I want to meet him but I wonder what will happen if I decide to get involved with him. Like what if he starts to like me more?,dating,t5_2qhb1,https://www.reddit.com/r/dating/comments/qluks7/should_i_meet_this_guy_in_person/
