,id,created_utc,title,selftext,subreddit,subreddit_id,url
85,ofcamm,1625634576,"I’m beautiful, smart, finically stable but can’t find the right man! Why??","As people around me see me, I’m extremely sexy, abd beautiful. 35 but everyone thinks I’m 25 to 27. 
I take care of my appearance and I look generally good.

I work, I have a good career and I have a daughter who is nice and I take good care if her. I’m open minded, like to laugh but if anyone gets so close they would definitely see the melancholy U always try yo hide. 
My life was not easy, I’m in therapy but I lost way confidence in my self. 

I forgot the strategies about how I can keep a man! 
If I like someone, I get confirmation and i take distance not to show this sad side, or to avoid over-sharing the overwhelming details.

I hate dating apps now, it is full of sh****
But i need to have bf as it is almost 2 years alone now. 

Any idea where to start?",dating,t5_2qhb1,https://www.reddit.com/r/dating/comments/ofcamm/im_beautiful_smart_finically_stable_but_cant_find/
86,ofcar2,1625634591,What should I do...,Most of the people that I went to school with is already starting to get married and settle down but here I am a single 20M still living at home with mom and dad but I do have a job and make decent money for my area and I'm saving money for my own place. My question is should I try to find a gf now or just wait till I actually move out,dating,t5_2qhb1,https://www.reddit.com/r/dating/comments/ofcar2/what_should_i_do/
87,ofcclp,1625634810,How to take it next level,I’m trying to talk to this girl but she’s not super talkative but I think she’s into me. She’s hard to make laugh but she doesn’t seem like she talks to a lot of guys even though she’s attractive. I’ve only had good conversations with her drunk and I’ve only hung out with her in groups. How can I take it to a better level and get her to see me on a more boyfriend level? I’m in Highschool btw.,dating,t5_2qhb1,https://www.reddit.com/r/dating/comments/ofcclp/how_to_take_it_next_level/
88,ofcgiq,1625635284,What is up with the new post lockdown dating games?,I got out of long term relationship last year and feel like I should start seeing people but what js with these new strategic moves and games and where and how to find a good person in this era? I am already nervous about socialising after a year of isolation and now this.,dating,t5_2qhb1,https://www.reddit.com/r/dating/comments/ofcgiq/what_is_up_with_the_new_post_lockdown_dating_games/
89,ofcj4g,1625635600,He said my belly was beautiful,"Y'all....I gained quite a bit of weight after having a kid, and I DEFINITELY am not confident with the way I look now...
The guy I just started seeing, when he saw my belly and thighs for the first time touched them and told me how absolutely beautiful I was. I damn near cried. 
I think I found a winner😁😁",dating,t5_2qhb1,https://www.reddit.com/r/dating/comments/ofcj4g/he_said_my_belly_was_beautiful/
90,ofcm3i,1625635948,Hung up on a dude from the past while married,"I really need to vent. I'm probably gonna be dragued for even saying any of it but I've been keeping it bottled up for years! First of all I'm happily married with two kids and we want many more, probably 5-6. I love my husband. It's hard work being married and working on ourselves but we have really built a beautiful life and I wouldn't change a thing from the past. I grew a lot in the past few years and I owe a lot to my husband because he was there when I needed it. He's far from a saint and so am I but we love our family together!
Before I was with him I used to have a friend. We met at work, he was a customer and friend of a collegue of mine... We lost track for a bit after I stopped working there because he was in a long term relationship and I had kind of a story with that friend of ours. He was always flirting with girls even though he was in a relationship so I thought he was a player and didn't think much of him.
One day, out of the blue he reached out to me and asked me out, just as friends. Wanted to chat. So he came by and picked me up and we went out. He payed for everything even though I didn't want him to. Said he was italian and had to. Brought me back home and that was that. He wasn't with his gf anymore and I was single. Since there had been something between me and his friend I didn't think anything could happen. Bro code and all. So I really saw him as just a friend. As time went by, we kept talking. I didn't realize it back then, I don't know why, but he was actually always complimenting me. For example, he wanted to come and pick me up once and I didn't want because I wasn't wearing makeup and ready to to be. He said I was still the most beautiful girl ever or something along those lines. He always told me I was beautiful, but not in a flirty way? At least I didn't think of it that way. He talked to me almost everyday. We would go out together 2-3x a week. Usually late at night. He would pick me up, always pay... Eventually, I kinda started wondering if he would eventually make a move? But instead, he started having me meet his friends, and would always say stuff like : you would go very well with him, or this guy is probably your type, or my friend thought you were pretty, etc. Etc. Etc. He would always tell me I was like his little sister and everything. By that point I realised he didn't see me like that, and I started to keep myself from seeing him like that, too. He seemed upset about his bad breakup. He told me he cried in his shower, and that he never told stuff like that to anyone. At some point, I also realised he had no clue his friend and I went out a few times, and I told him. We kept seeing each other but it got weird, I don't know when. He brought me on a DATE once. A date with another girl! A girl he didn't really like I think but still. The first girl he had slept with since his gf. She was his standard girl, very well-groomed and toned, fit, gym everyday girl. Which I'm not! I'm a bit on the curvier side although healthy, I love running and cycling, but I don't hit the gym. That date was so weird. He said he didn't like her, and wanted my ""opinion"" on her. I mean... Do you know how hard it was to see him with her? But I was a good friend. I told him she was sweet. Which she was. Even though she hated me but I can understand. Who brings his girl pal on a date with his well.. date? We went to grab some coffees and it was sooo awkward. After that I realised he really wasn't into me. He still kept complimenting me. He still kept seeing me 2-3x a week. Always driving, always paying, even though I fought him on this. We would always text and write to each other.
But since he wasn't interested, I started going out with other guys. It had been going on for months.. so I met my ex-boyfriend and had a fling with another man, too. Nothing serious, but I told him about it. He always gave the best advices but I knew he thought I was silly. I just felt it in the way he spoke. I was, too. My ex was an asshole. Eventually, we had a falling out. We spent a bit of time without seeing each other. When we spoke again, I had met my husband. He came to my place of work at some point (worked in a sexshop where I met my husband). He said he wanted to buy some stuff for a girl he was seeing and see the new guy I was dating. Later, he told me for sure he was gay and made fun of him a bit. I got upset and so did my husband (bf then). After a while, that man and I stopped talking again. I reached out 2-3x but he either answered very basic answers of just didn't answer at all.
I didn't think about him that much after that. But some time later I found an old convo with him and it made me wonder if he might have liked me, or if I was simply foolish. When it's hard with my husband, I think of what might have been. I will never reach out to him. I'm trying to forget about him altogether, to respect my husband.
But seeing those conversations with that man... remembering our nights out together, talking for hours on end, eating fastfood in his car, driving all night long, then chatting with him online before bed... I wonder if I hadn't gone out with his friend... If I had let him the time to heal from his previous relationship.. what might have been. Maybe I just read to much into everything. But he made me feel like the most beautiful woman alive. He was always there. And I miss his friendship. It's been 7 years. He probably don't even remember me.
I just want to silence those thoughts in my head. Even if he never could have liked me. Even if I know we wouldn't have been right for each other at the time. I was too young and too stupid. I was 19 and he was 27 or 28. We were not at the same place... And now, I have children that I love more than anyone in the world and I wouldn't change a thing in my past because it would mean that they wouldn't be there. I just feel like he's the one that got away and I hope that finally saying it, even to a bunch of strangers, and not keeping it bottled up will help put it to test. I hope I forget him someday.
Thanks for reading.",dating,t5_2qhb1,https://www.reddit.com/r/dating/comments/ofcm3i/hung_up_on_a_dude_from_the_past_while_married/
91,ofcryk,1625636661,Should I continue this relationship?,"So for background knowledge I have been friends with this girl for almost 3 years and 1.5 years ago I started to like her, I liked her and eventually fell in love with out her ever knowing but then we kinda lost touch for about five months and I got over her and only had a crush on her but not a lot. Then two months ago we started talking again but she and I started flirting but I was never that seriously flirting but she was and during that time only felt alittle bit of attraction. Then a month ago she came out and said she had feelings for me and at the time I still thought I had feelings for her, so we started dating and now I feel nothing most the time and even sometimes I’m repulsed by her. Is this wrong to feel? Should I just break up with her or stay alittle longer because it’s only a month in and who knows if I might start liking her again. Plz help",dating,t5_2qhb1,https://www.reddit.com/r/dating/comments/ofcryk/should_i_continue_this_relationship/
92,ofctec,1625636843,So need advice,"So I messaged this a girl that I hung out with once, so a while back from commenting on her picture of a nice scenery she posted, I told her we should hang out and take pics she said yeah she's down, messaged her assigned a date she said she was busy that day and then i fell asleep replied why i could only. That day but she never read it now she liked one of my memes couple days ago, she recently uploaded a picture should I like the pic even though I didnt get a reply back?",dating,t5_2qhb1,https://www.reddit.com/r/dating/comments/ofctec/so_need_advice/
93,ofcvn7,1625637131,AITA for trying to reach out to a girl who's may or may not be trying to ghost me.,[removed],dating,t5_2qhb1,https://www.reddit.com/r/dating/comments/ofcvn7/aita_for_trying_to_reach_out_to_a_girl_whos_may/
94,ofd15z,1625637826,"I recently got a breakup and am feeling, what should I do?",[removed],dating,t5_2qhb1,https://www.reddit.com/r/dating/comments/ofd15z/i_recently_got_a_breakup_and_am_feeling_what/
95,ofd1lf,1625637887,Is she a catfish?,[removed],dating,t5_2qhb1,https://www.reddit.com/r/dating/comments/ofd1lf/is_she_a_catfish/
96,ofd72r,1625638595,Is my boyfriend starting to lose interest in me?,"We have been together for 5 months and we haven't met each other for 2 months because of COVID19. 

He rarely online during the day (sometimes he stays offline for several days) since 2 months ago. Meaning that he never text me first. I have raised this issue to him and he said that he just not the type to text and he hate seeing all the unread text from his groups. He also said that he only replies to my text. It's true, he always reply to my text but only at night. There was one time he just ignore my text and didn't text me for whole week.

He never calls me. It was always me who initiate the calls. However, when I try to end the call, he would always stop me and ask me to stay. 

His friends know about me. He post about me online and I was invited to join his group WhatsApp with his friends last month.

I just don't understand him. He rarely says romantic words but when I sulk or mad, he will say that he loves me. 

He never compliments me and always tease me (i don't really mind though but looking at his action, it starting to bother me).

He always on discord playing games with his friends. However when I ask to call me, he would leave his games and spend his time with me. Only if I ask for his time. 

Idk if I'm overly sensitive but as this is my first relationship ever, I am so confused with his treatment in this relationship.

Please give me some advice on how to handle this kind of situation. I'm sorry for my bad english as I'm not a native speaker. 

Tldr; my unemployed boyfriend of 5 months rarely text me and never calls me. Is he starting to lose interest in me?",dating,t5_2qhb1,https://www.reddit.com/r/dating/comments/ofd72r/is_my_boyfriend_starting_to_lose_interest_in_me/
97,ofd77j,1625638609,Should I text him ?,"(Sorry if I posted in the wrong subreddit &gt;&lt; )

 So I dated this guy  who’s leaving the country in one month (we’re both forigen students  and I accept dating him because I was leaving the county soon too) we both knew our relationship was not serious and we were just having fun. (I Didn’t sleep with him btw)

The day he left to the airport  I hugged and kissed him goodbye. Ever since that day I didn’t stop thinking about him and miss him  everyday.  Its been three months since he left.  Recently,  our conversation became dry and dies quickly.  He comments on my Instagram stories  and reacts to them sometimes but nothing more. 

I’ve been feeling so lonely these days and I keep fighting the urge to  text him because If I do I might  mess things up. I also don’t want to sound so desperate and annoying.

My friend told me i should move on and stop worshiping him lol . But I just want to keep our conversation alive. I thought maybe it’s okay if i chat with him about my new job for example or the new city recently I moved to.. 


I know I’m over reacting and making big Beal of nothing but do you think it’s okay if  I text him or just leave it ?",dating,t5_2qhb1,https://www.reddit.com/r/dating/comments/ofd77j/should_i_text_him/
98,ofdal0,1625639056,If a man acts like he doesn’t have feelings,"If a man acts like he doesn’t have feelings, I’m going to treat him like he doesn’t have feelings. Don’t behave as if you do not have feelings if you do not want someone to treat you like you don’t have feelings. Communicate your feelings if you want them to be respected. Don’t get passive aggressive and pretend they’re not there. When I ask you wants wrong, don’t say “nothing”. I guess you’re butthurt cause I refuse to admit that I miss you. And you refuse to say that it hurts your feelings. So I’ll never say it. Fuck you and your feelings if you pretend you don’t have any.",dating,t5_2qhb1,https://www.reddit.com/r/dating/comments/ofdal0/if_a_man_acts_like_he_doesnt_have_feelings/
99,ofdri0,1625641272,Body language says one thing bur her words and actions say another,"Organising a 4th date with a girl, she keeps agreeing to do things together but her body language reads different. It's hard for me though  because I often spend more time avoid people's eye contact than looking at them, even when sat directly opposite, so I don't give the best impression. But, I do always watch people, even when I look like I'm not, and her body language is confusing... So, I'm confused...

But, if she keeps agreeing to go out with me, is that a good or bad sign? I mean, she might just be bored or just too nice to turn me down or something...",dating,t5_2qhb1,https://www.reddit.com/r/dating/comments/ofdri0/body_language_says_one_thing_bur_her_words_and/
