,all_awardings,allow_live_comments,author,author_flair_css_class,author_flair_richtext,author_flair_text,author_flair_type,author_fullname,author_is_blocked,author_patreon_flair,author_premium,awarders,can_mod_post,contest_mode,created_utc,domain,full_link,gildings,id,is_created_from_ads_ui,is_crosspostable,is_meta,is_original_content,is_reddit_media_domain,is_robot_indexable,is_self,is_video,link_flair_background_color,link_flair_css_class,link_flair_richtext,link_flair_template_id,link_flair_text,link_flair_text_color,link_flair_type,locked,media_only,no_follow,num_comments,num_crossposts,over_18,parent_whitelist_status,permalink,pinned,pwls,retrieved_on,score,selftext,send_replies,spoiler,stickied,subreddit,subreddit_id,subreddit_subscribers,subreddit_type,thumbnail,title,total_awards_received,treatment_tags,upvote_ratio,url,whitelist_status,wls,removed_by_category,author_cakeday,post_hint,preview
64,[],False,bnano999,,[],,text,t2_3u12z94i,False,False,False,[],False,False,1630907810,self.dating,https://www.reddit.com/r/dating/comments/pith6z/how_do_i_43m_apologize_to_my_girlfriend_21f_after/,{},pith6z,False,True,False,False,False,True,True,False,#ea0027,dating,"[{'e': 'text', 't': 'I Need Advice'}]",19ec58c2-9f74-11e7-81a1-0e2bf15991f0,I Need Advice,light,richtext,False,False,True,2,0,False,all_ads,/r/dating/comments/pith6z/how_do_i_43m_apologize_to_my_girlfriend_21f_after/,False,6,1630907821,1," So 2 days ago we were being intimate and everything was going great and all, but right in the middle of going at it I randomly remembered a joke I heard from m favorite comedian that I watched earlier that day. It was so funny that I chuckled and wasn't as hard anymore. When she noticed this, she gave me a bit of a confused look, which made me laugh even more and it actually made me piss myself while I was still inside her. I thought it was just a little at first but after a few moments I realized it was a lot. When she noticed my pee was leaking out of her, she freaked out. I tried to explain to why I messed up, but she didn't want to hear me and went back to her place for the night.

Fast-forward to earlier today, I knew I needed to make it up to her. So I bought her a chocolate cake (because she said chocolate was her favorite) and I wanted to surprise her when she gets home from work by showing at her apartment with me waiting there. I also dressed up as Batman too because she said a couple months ago that he was her favorite super hero. While I was waiting for her to get there, I was getting nervous, and when I get nervous I start to drink. I messed up and drank way more than I should have, which made me come up with the stupidest plan to not have any pants on when she gets there so she can see that I'm not peeing myself. I know it sounds stupid, but when I was drunk, It sounded like the smartest plan ever.

So when she arrived, she saw me walk towards her drunk with my Batman cape and mask with my wiener hanging out holding a chocolate cake, and she peppersprayed me. This caused me to drop the cake on my cock and roll on the floor uncontrollably with pain while also staining her freshly steam-cleaned carpet while I was rolling. It took me a couple minutes to explain to her it was me and my plan and everything. She got really mad and told me to leave.

I just got back to my apartment a little bit ago and I don't know what to do. I tried calling her nonstop and she won't pick up. Has this kind of thing ever happened to any of you? I really need advice.",True,False,False,dating,t5_2qhb1,991304,public,self,How do I [43M] apologize to my girlfriend [21F] after awkward sex?,0,[],1.0,https://www.reddit.com/r/dating/comments/pith6z/how_do_i_43m_apologize_to_my_girlfriend_21f_after/,all_ads,6,,,,
65,[],False,ThrowRA90978998,,[],,text,t2_ed4q5mq5,False,False,False,[],False,False,1630907877,self.dating,https://www.reddit.com/r/dating/comments/pithpz/how_do_i_43m_apologize_to_my_girlfriend_21f_after/,{},pithpz,False,False,False,False,False,False,True,False,#ea0027,dating,"[{'e': 'text', 't': 'I Need Advice'}]",19ec58c2-9f74-11e7-81a1-0e2bf15991f0,I Need Advice,light,richtext,False,False,True,0,0,False,all_ads,/r/dating/comments/pithpz/how_do_i_43m_apologize_to_my_girlfriend_21f_after/,False,6,1630907888,1,[removed],True,False,False,dating,t5_2qhb1,991311,public,self,How do I [43M] apologize to my girlfriend [21F] after awkward sex?,0,[],1.0,https://www.reddit.com/r/dating/comments/pithpz/how_do_i_43m_apologize_to_my_girlfriend_21f_after/,all_ads,6,moderator,,,
66,[],False,bnano999,,[],,text,t2_3u12z94i,False,False,False,[],False,False,1630907962,self.dating,https://www.reddit.com/r/dating/comments/pitie1/how_do_i_43m_apologize_to_my_girlfriend_21f_after/,{},pitie1,False,True,False,False,False,True,True,False,#ea0027,dating,"[{'e': 'text', 't': 'I Need Advice'}]",19ec58c2-9f74-11e7-81a1-0e2bf15991f0,I Need Advice,light,richtext,False,False,True,5,0,False,all_ads,/r/dating/comments/pitie1/how_do_i_43m_apologize_to_my_girlfriend_21f_after/,False,6,1630907973,1,"So 2 days ago we were being intimate and everything was going great and all, but right in the middle of going at it I randomly remembered a joke I heard from m favorite comedian that I watched earlier that day. It was so funny that I chuckled and wasn't as hard anymore. When she noticed this, she gave me a bit of a confused look, which made me laugh even more and it actually made me piss myself while I was still inside her. I thought it was just a little at first but after a few moments I realized it was a lot. When she noticed my pee was leaking out of her, she freaked out. I tried to explain to why I messed up, but she didn't want to hear me and went back to her place for the night.

Fast-forward to earlier today, I knew I needed to make it up to her. So I bought her a chocolate cake (because she said chocolate was her favorite) and I wanted to surprise her when she gets home from work by showing at her apartment with me waiting there. I also dressed up as Batman too because she said a couple months ago that he was her favorite super hero. While I was waiting for her to get there, I was getting nervous, and when I get nervous I start to drink. I messed up and drank way more than I should have, which made me come up with the stupidest plan to not have any pants on when she gets there so she can see that I'm not peeing myself. I know it sounds stupid, but when I was drunk, It sounded like the smartest plan ever.

So when she arrived, she saw me walk towards her drunk with my Batman cape and mask with my wiener hanging out holding a chocolate cake, and she peppersprayed me. This caused me to drop the cake on my cock and roll on the floor uncontrollably with pain while also staining her freshly steam-cleaned carpet while I was rolling. It took me a couple minutes to explain to her it was me and my plan and everything. She got really mad and told me to leave.

I just got back to my apartment a little bit ago and I don't know what to do. I tried calling her nonstop and she won't pick up. Has this kind of thing ever happened to any of you? I really need advice.",True,False,False,dating,t5_2qhb1,991312,public,self,How do I [43M] apologize to my girlfriend [21F] after awkward sex?,0,[],1.0,https://www.reddit.com/r/dating/comments/pitie1/how_do_i_43m_apologize_to_my_girlfriend_21f_after/,all_ads,6,,,,
67,[],False,IndependentOutcome47,,[],,text,t2_ag8vn0ut,False,False,False,[],False,False,1630909054,self.dating,https://www.reddit.com/r/dating/comments/pitrdw/i_21_m_have_had_my_confidence_torn_down_and_cant/,{},pitrdw,False,True,False,False,False,True,True,False,#ea0027,dating,"[{'e': 'text', 't': 'I Need Advice'}]",19ec58c2-9f74-11e7-81a1-0e2bf15991f0,I Need Advice,light,richtext,False,False,True,19,0,False,all_ads,/r/dating/comments/pitrdw/i_21_m_have_had_my_confidence_torn_down_and_cant/,False,6,1630909065,1,"I’m not sure how to start this. I’m new to this thread and Reddit in general. Lately I’ve been feeling very unwanted. I’ve never been in an actual relationship or even dating territory. It’s not that I am unattractive or have a toxic personality (or at least I hope not), but women seem to always want to be “just friends” with me. I am always the one people want to vent to or sometimes ask advice. I basically feel like a free therapist, and while I am psych major wanting to go into the field of therapy, I don’t want my social or romantic life to consist of only that. 

I’ve been led on by women. Lied to. Used as a self esteem booster and then forgotten about, just to be picked back up again when she is feeling down. Used as a rebound guy. I can never be in any situation. That is normal. It is always complicated. It’s gotten to the point where I have to tell women that if they don’t like me in that way, to just tell me so I know and I don’t have to make a fool of myself. And that only made her take even longer to tell me (went on for five months, decided she didn’t like me that way in February, didn’t actually tell me until May).

I have been on one ACTUAL date and that was the only girl who I got to be upfront with me. We are still friends but she is moving. 

I am tired of being used. I really want someone to actually care about me. I want someone to look at me and want me as a person, not just want something from me. But I can’t trust women anymore. My confidence is at an all time low, and I am severely depressed. I don’t know if there is something wrong with my personality. I don’t know what I hope to find by posting this. I know it turned into a bit of a rant, and I appreciate those of you who stuck around this far. I might consider posting full stories of some of these situations if this ends up helping. Any and all advice is appreciated.

Note: I types this on my phone so apologies if it’s not perfect.",True,False,False,dating,t5_2qhb1,991333,public,self,I (21 m) have had my confidence torn down and can’t trust women anymore.,0,[],1.0,https://www.reddit.com/r/dating/comments/pitrdw/i_21_m_have_had_my_confidence_torn_down_and_cant/,all_ads,6,,,,
68,[],False,jahanny,,[],,text,t2_psxtu,False,False,False,[],False,False,1630910167,self.dating,https://www.reddit.com/r/dating/comments/pitzvr/youll_never_be_able_to_change_someones_physical/,{},pitzvr,False,True,False,False,False,True,True,False,#ffd635,dating,"[{'e': 'text', 't': 'Giving Advice'}]",7bca2c58-4211-11e5-9ecb-0e60d8112001,Giving Advice,dark,richtext,False,False,True,21,0,False,all_ads,/r/dating/comments/pitzvr/youll_never_be_able_to_change_someones_physical/,False,6,1630910178,1,"I see a lot of men posting on this sub complaining about womens preferences around height / fitness. In the last few days there has been a lot of posts comparing men demanding 'fit' bodies to women demanding 'tall' bodies. 

As a short man, I am used to being looked over (lol) for taller men. I have been tempted to come here and vent too, or bite back at women who say i'm too short. But i've realised there's no point. 

You can't change someones preferences. People will continue to act on their preferences in silence. Most won't tell you you are being rejected due to height / weight / attractiveness. They'll just say there wasnt a connection - and that's ok. 

Before posting on here, it's worth considering if you're actually going to lead to meaningful change - it's one thing to vent, but another to demand strangers change their physical standards for you. 

I recently reached out to an ex to ask why she seems much happier when her new boyfriend than she was with me, as I always suspected it was my height. She said a few things, but in the end admitted the attraction never came for her, even though she tried. She was careful not to mention my height but i read the subtext. 

I ended up taking a few days to think about what she said - she tried to build the attraction, but couldn't. Many things are out of our control - my height one of them, her attraction another. Who am I to demand another change their standards? 

The only thing I can do is become a better man with more to offer than my height.",True,False,False,dating,t5_2qhb1,991369,public,self,You'll never be able to change someones physical preferences re: Height / weight,0,[],1.0,https://www.reddit.com/r/dating/comments/pitzvr/youll_never_be_able_to_change_someones_physical/,all_ads,6,,,,
69,[],False,baby-andrea,,[],,text,t2_2o3xtuxk,False,False,False,[],False,False,1630910479,self.dating,https://www.reddit.com/r/dating/comments/piu2a5/should_i_stay_or_part_ways/,{},piu2a5,False,True,False,False,False,True,True,False,#ea0027,dating,"[{'e': 'text', 't': 'I Need Advice'}]",19ec58c2-9f74-11e7-81a1-0e2bf15991f0,I Need Advice,light,richtext,False,False,True,8,0,False,all_ads,/r/dating/comments/piu2a5/should_i_stay_or_part_ways/,False,6,1630910490,1,"So I’ve been seeing a guy for about a month. We haven’t hung out in 2 weeks, but text a lot and he’s pretty good with responding quickly. Tonight he was supposed to come over I texted him a few hours before, then 3 hrs later I text again asking if were still on. It’s been 2 hrs since the last text and he hasn’t responded. I’m assuming I won’t hear from him till tomorrow. Would I be overreacting if I cut him off after this? How would you proceed?",True,False,False,dating,t5_2qhb1,991373,public,self,Should I stay or part ways?,0,[],1.0,https://www.reddit.com/r/dating/comments/piu2a5/should_i_stay_or_part_ways/,all_ads,6,,,,
70,[],False,AngelKatt-xo,,[],,text,t2_arzambtm,False,False,False,[],False,False,1630911067,self.dating,https://www.reddit.com/r/dating/comments/piu6st/dating_advice/,{},piu6st,False,False,False,False,False,False,True,False,#ea0027,dating,"[{'e': 'text', 't': 'I Need Advice'}]",19ec58c2-9f74-11e7-81a1-0e2bf15991f0,I Need Advice,light,richtext,False,False,True,0,0,False,all_ads,/r/dating/comments/piu6st/dating_advice/,False,6,1630911078,1,[removed],True,False,False,dating,t5_2qhb1,991386,public,self,Dating advice,0,[],1.0,https://www.reddit.com/r/dating/comments/piu6st/dating_advice/,all_ads,6,moderator,,,
71,[],False,NoobtonicMaster,,[],,text,t2_2twq95kq,False,False,False,[],False,False,1630911257,self.dating,https://www.reddit.com/r/dating/comments/piu898/scenario_you_are_kissing_someone_on_the_lips_then/,{},piu898,False,False,False,False,False,False,True,False,#ff4500,dating,"[{'e': 'text', 't': 'Question'}]",a9531dce-194e-11e5-b177-0eff099c3d1f,Question,light,richtext,False,False,True,2,0,False,all_ads,/r/dating/comments/piu898/scenario_you_are_kissing_someone_on_the_lips_then/,False,6,1630911268,1,[removed],True,False,False,dating,t5_2qhb1,991388,public,self,Scenario : You are kissing someone on the lips then you accidentally puke into their mouth. What do you do afterwards?,0,[],1.0,https://www.reddit.com/r/dating/comments/piu898/scenario_you_are_kissing_someone_on_the_lips_then/,all_ads,6,moderator,,,
72,[],False,SeniorText,,[],,text,t2_1am4x1m3,False,False,False,[],False,False,1630911372,self.dating,https://www.reddit.com/r/dating/comments/piu98d/what_if_you_have_nothing_in_common_regarding/,{},piu98d,False,True,False,False,False,True,True,False,#ea0027,dating,"[{'e': 'text', 't': 'I Need Advice'}]",19ec58c2-9f74-11e7-81a1-0e2bf15991f0,I Need Advice,light,richtext,False,False,True,9,0,False,all_ads,/r/dating/comments/piu98d/what_if_you_have_nothing_in_common_regarding/,False,6,1630911382,1,"I've been talking to this guy, and it seems like we have nothing in common in terms of interests and hobbies, and the only thing we share is that we work in education, of course the content dries out within those conversations as well.

The thing is though, he has great communication skills and is a kind, caring, thoughtful and understanding person. I don't think the short-term chemistry is really there but the long-term compatibility is, as we share the same values as people (good communication, understanding, kindness). I'm also a realistic person and know that you can't always get a 'spark' with everyone you try to date.

&amp;#x200B;

Chemistry is great in the short-term but if you don't have long-term compatibility then it's not going to work. 

What if in the meantime, it seems like the person you are talking to as all the great qualities that you look for and also possess, but the at the same, the initial chemistry isn't there? How long do you wait/not wait for that overall attraction and spark to build up?",True,False,False,dating,t5_2qhb1,991391,public,self,"What if you have nothing in common regarding interests, hobbies but like their values as a person?",0,[],1.0,https://www.reddit.com/r/dating/comments/piu98d/what_if_you_have_nothing_in_common_regarding/,all_ads,6,,,,
73,[],False,Conscious-Tough-7883,,[],,text,t2_clkmx1q2,False,False,False,[],False,False,1630912004,self.dating,https://www.reddit.com/r/dating/comments/piuem1/httpswwwdigistore24comredir358077mahendrat/,{},piuem1,False,False,False,False,False,False,True,False,#24a0ed,,"[{'e': 'text', 't': 'Long Distance'}]",5dc9d60a-cc75-11eb-86e9-0ea78081bf43,Long Distance,dark,richtext,False,False,True,2,0,False,all_ads,/r/dating/comments/piuem1/httpswwwdigistore24comredir358077mahendrat/,False,6,1630912015,1,[removed],True,False,False,dating,t5_2qhb1,991407,public,self,https://www.digistore24.com/redir/358077/MahendraT/,0,[],1.0,https://www.reddit.com/r/dating/comments/piuem1/httpswwwdigistore24comredir358077mahendrat/,all_ads,6,moderator,,,
74,[],False,AffectionateJaguar,,[],,text,t2_zpvy0oi,False,False,False,[],False,False,1630912632,self.dating,https://www.reddit.com/r/dating/comments/piujl3/guys_who_cant_handle_rejection/,{},piujl3,False,True,False,False,False,True,True,False,#00a6a5,dating,"[{'e': 'text', 't': 'Support Needed'}]",fd9c03b8-a1ce-11e7-9172-0e8c9f9ecf4c,Support Needed,dark,richtext,False,False,True,24,0,False,all_ads,/r/dating/comments/piujl3/guys_who_cant_handle_rejection/,False,6,1630912643,1,"Went on a first date with a guy for light snacks and drinks. It went well. Very normal first date. It’s hard to tell whether there was a sparkle since it was only a first date. 

Before I met with him I hung with a male friend in the same plaza and my friend walked me to the restaurant where my date was waiting. 

Then we texted a bit after the first date. I’ve been swamped with work and moving to a new house so my texting was slow and I kept it concise. He asked to go on a hike two days ago. I actually don’t like going on a hike with people I’m not familiar with. But I forgot to text back. Guess I was thinking of how can properly turn him down in hiking. 

Then today he messaged me as below:

“You know i have never met someone like you before, swapping date next to another, and still feeling good about it. I didnt say anything and almost wantes to dump you in front of the restaurant. Anyway, i dotn have time to waste with such disgraceful person. Byebye”

Looks like some guys out there have a very fragile ego. Why would people attack others for not showing as much interest and attention as they want? Holly Duck!",True,False,False,dating,t5_2qhb1,991412,public,self,Guys who can’t handle rejection,0,[],1.0,https://www.reddit.com/r/dating/comments/piujl3/guys_who_cant_handle_rejection/,all_ads,6,,,,
75,[],False,parasite921,,[],,text,t2_ed2zl8o6,False,False,False,[],False,False,1630912666,self.dating,https://www.reddit.com/r/dating/comments/piuju3/soulcrushing_search_for_a_partner_what_are_my/,{},piuju3,False,False,False,False,False,False,True,False,#ffb000,,"[{'e': 'text', 't': 'Tinder/Online Dating'}]",5214d2ac-61f1-11e8-8bb1-0ed15e4a39c0,Tinder/Online Dating,dark,richtext,False,False,True,0,0,False,all_ads,/r/dating/comments/piuju3/soulcrushing_search_for_a_partner_what_are_my/,False,6,1630912677,1,[removed],True,False,False,dating,t5_2qhb1,991412,public,self,soul-crushing search for a partner. What are my options?,0,[],1.0,https://www.reddit.com/r/dating/comments/piuju3/soulcrushing_search_for_a_partner_what_are_my/,all_ads,6,moderator,,,
76,[],False,New_Style_9376,,[],,text,t2_8z0yu96o,False,False,False,[],False,False,1630913150,self.dating,https://www.reddit.com/r/dating/comments/piunlo/35m4f_laco_cal/,{},piunlo,False,True,False,False,False,True,True,False,#ffb000,,"[{'e': 'text', 't': 'Tinder/Online Dating'}]",5214d2ac-61f1-11e8-8bb1-0ed15e4a39c0,Tinder/Online Dating,dark,richtext,False,False,True,3,0,False,all_ads,/r/dating/comments/piunlo/35m4f_laco_cal/,False,6,1630913161,1,"I'm just just a boy who looking for 
Girls who want boys
Who like boys to be girls
Who do boys like they're girls
Who do girls like they're boys
(Dancing)
No for a real I am just a goofball that just wanted to find one that is just do to live.
Smiple as that. So surprise me and show you are real and dm me I don't well not a first anyway",True,False,False,dating,t5_2qhb1,991422,public,self,35m4f LACO Cal,0,[],1.0,https://www.reddit.com/r/dating/comments/piunlo/35m4f_laco_cal/,all_ads,6,,,,
77,[],False,ladyneckbeard,,[],,text,t2_fak1j,False,False,False,[],False,False,1630913830,self.dating,https://www.reddit.com/r/dating/comments/piusky/i_26f_went_on_what_i_thought_was_a_date_only_for/,{},piusky,False,True,False,False,False,True,True,False,#00a6a5,dating,"[{'e': 'text', 't': 'Support Needed'}]",fd9c03b8-a1ce-11e7-9172-0e8c9f9ecf4c,Support Needed,dark,richtext,False,False,True,7,0,False,all_ads,/r/dating/comments/piusky/i_26f_went_on_what_i_thought_was_a_date_only_for/,False,6,1630913841,1,"I've (26F) been working with this guy (31M), let's call him Dan, and he tutored me with some school work for the past few months. This was not affiliated with my school by the way. On our last day working together I asked him if he wanted to get a drink with me to celebrate my finishing my program. He said yes. I should also mention that we'd mostly interacted over zoom prior to this, aside from once in early August when we did an in-person session at a Starbucks.

We decide to go to a bar and get some drinks and we split fries. We talked about past relationships, dating apps, etc. Things seemed to be going well, at least I thought. I went to the bathroom and when I came back, Dan paid the bill and asked me if I wanted to go on a walk with him and get a hot drink. Usually when someone asks if you want to go to a secondary location that means they're interested and want to spend more time with you, right?

So we go to a Starbucks, I get us some tea and we sit outside. We're sitting pretty close together on some steps for a while, talking for a bit. He indicated that he wanted to head home because he had some chores in the morning so I thought that it was my time to make a move. So I asked, ""should I make a move?"" To my surprise, he says no, that due to living with his parents due to the pandemic, he hasn't thought about dating and isn't something he's interested in right now. That it's hard meeting people now, especially people who live nearby who would want to go on walks and listen to audiobooks. Anyway I went home feeling incredibly dejected.

The next day I texted him that I'd be down to be walking buddies if it wasn't awkward for him. He said ""Great, glad to hear it,"" and we made small talk over text for a bit. A few days later I asked him if he was busy over the long weekend and wanted to go on a walk. He texted me, ""A friendly walk or are you secretly trying to change my mind?"" I said I wanted a friendly walk and then he didn't answer and I texted him 6 hours later asking if that's a no to the walk. He said he's not opposed to it but maybe not this weekend.

Overall, I'm generally confused about what happened and what's going on. If he wasn't interested, why extend what we were doing, or even come out to meet me at all?",True,False,False,dating,t5_2qhb1,991434,public,self,I (26F) went on what I thought was a date only for him (31M) not to be interested in me,0,[],1.0,https://www.reddit.com/r/dating/comments/piusky/i_26f_went_on_what_i_thought_was_a_date_only_for/,all_ads,6,,,,
78,[],False,kimnvy,,[],,text,t2_3v47hczu,False,False,False,[],False,False,1630914383,self.dating,https://www.reddit.com/r/dating/comments/piuwjk/online_dating_nightmare_dissociative_identity/,{},piuwjk,False,False,False,False,False,False,True,False,#ffd635,dating,"[{'e': 'text', 't': 'Giving Advice'}]",7bca2c58-4211-11e5-9ecb-0e60d8112001,Giving Advice,dark,richtext,False,False,True,0,0,False,all_ads,/r/dating/comments/piuwjk/online_dating_nightmare_dissociative_identity/,False,6,1630914394,1,[removed],True,False,False,dating,t5_2qhb1,991447,public,self,Online dating nightmare - dissociative identity disorder,0,[],1.0,https://www.reddit.com/r/dating/comments/piuwjk/online_dating_nightmare_dissociative_identity/,all_ads,6,automod_filtered,,,
