,id,created_utc,title,selftext,subreddit,subreddit_id,url
0,ppsuxy,1631851167,Why did her communication change when we moved off the dating app?,"hey ya’ll :) longtime lurker here and i’ve learned a lot from reading everyone’s advice in this sub so i figured i’d get your input on a situation i’ve been pondering with!

so i (24) matched with this girl (20) on Tinder just under a month ago. we hit it off right from the start and came to learn that we had a lot of common interests and similar goals in life. we were communicating consistently and constantly (multiple replies every hour) on the app and everything was going well. i put out a few date ideas and she liked one of them so we were progressing towards setting up a time to meet up. during our convos my tinder app started glitching for some reason (the way some matches disappear and then reappear with the convos reset) and i asked for her number and we moved the convo to texting instead cause I didn’t want to risk any glitches in the chat.

now before i continue i just want to point out that consistent and clear communication is super important to me. i don’t mean i need someone that’s clingy or anything but rather someone that clearly communicates what’s on their mind or what emotions they’re feeling, NOT someone who beats around the bush or makes it unclear to me where they stand.

anyways, the instant we moved to text it’s like she became a totally different person. her replies became late (every 2-3 days), short (1 sentence replies) and showed minimal effort (no reciprocation of questions) and felt cold if i’m being honest. this was absolutely not the case when we were still communication on Tinder. i let the inconsistency slide a few times because i know having a busy lifestyle can hinder your ability to prioritize certain communications but i eventually called her out on it. she apologized and explained her situation as to how she’s working 2 jobs to get ready for college and is so drained that she just passes out pretty much every night and she didn’t mean to leave me hanging. i was skeptical but i’m a reasonable man so i gave her the benefit of the doubt.

during all this, i ended up leaving town for about a week or so to go visit my parents before i started grad school. i tried my best to continue communication with her during my time away (although it proved rather difficult with her late replies) and told her i wanna schedule our date once i get back and she agreed to it.

fast forward to me finally getting back and telling her i’m back in town and now she’s practically a ghost and replies once a week.

i’ve already made the decision to move on from her and don’t plan on responding any longer, but what i REALLY can’t wrap my head around and wanna know is why did her style and frequency of communication suddenly change when we moved things to text? and is there anything i could improve on my part to avoid this from happening in the future?

also apologize for the long post, wanted to give any necessary details that might help with your suggestions. thanks in advance and looking forward to reading your responses :)",dating,t5_2qhb1,https://www.reddit.com/r/dating/comments/ppsuxy/why_did_her_communication_change_when_we_moved/
1,ppsv5a,1631851190,"I texted asking if she made it home okay. I’m okay with getting ghosted, but no response has me wondering that maybe she didn’t make it home okay","Title is my dilemma.  Date seemed to go okay I guess. She laughed very hard at my jokes and stuff, but was also very nervous.",dating,t5_2qhb1,https://www.reddit.com/r/dating/comments/ppsv5a/i_texted_asking_if_she_made_it_home_okay_im_okay/
2,ppt2jc,1631852007,How long before a guy misses a girl?,"So we dated for a few months, saw each other a few times a week and then went two weeks without seeing each other. I asked him about it, he said he was busy with work. Then said he met someone else. 

Problem is, I miss him. We went from constantly texting all day, going out on dates and having fun to nothing. It’s been 5 days and nothing. I obviously haven’t moved on, and am hurt he moved on so fast.

Do guys ever come back after something like that? When do they start to miss the other person? 


Any advice would help.",dating,t5_2qhb1,https://www.reddit.com/r/dating/comments/ppt2jc/how_long_before_a_guy_misses_a_girl/
3,ppt2jm,1631852008,Looking for a man who can satisfy me I charge,[removed],dating,t5_2qhb1,https://www.reddit.com/r/dating/comments/ppt2jm/looking_for_a_man_who_can_satisfy_me_i_charge/
4,ppt325,1631852064,I think I'm in love with my (taken) best friend.,"Please bear with me -- this might be a long read.

I (20F) have a guy best friend (20M) who I have known for about 7 years. We met in the eighth grade and we got closer as friends over the years. When I first knew him, I discounted him completely. He had asked me out on several occasions but I never once accepted because I simply didn't see him that way. He always took it really well and wouldn't make it awkward or weird. To be completely frank, he was not my type for a long time. It kind of became a running joke between us that he was ""always in love with me"" and I would ""always reject him"". 

Fast forward a couple years to high school. We went to different schools so we barely saw each other. We both dated (many) different people and had a good, albeit more distant than before, friendship going on. I'll also admit that puberty was good to him and he became quite good-looking. We both showed up to our mutual friend's birthday after not seeing each other for a long time and things just picked up where we left off. Our dynamic has always been very flirty but in a joking way with the assumption that we both knew it would never happen, so that was the energy that day. In retrospect, we definitely looked like a couple -- the birthday girl's mom referred to us as ""the lovebirds"" unknowingly, he was laying on my lap, I was playing with his hair -- but I didn't think much of it. Later that night, he kissed me (like a quick peck on the lips), to which I reacted with a certain extent of surprise but I was not opposed to it. I brushed it off.

About two weeks after that night, I went on vacation with my family. I was in the airport on New Year's Eve when he drunk texted me saying that he was ""in love with me"" and ""had actual feelings for me"". I was taken aback -- after all, I thought that kiss was more of a joke than anything (for context, we both have had a lot of casual things without any feelings involved). I told him I didn't believe him and would talk to him when he was sober. The next day, he stood by what he said and told me he wants to be in a relationship with me. I accepted without much thought and told him ""sure, let's give it a go.""

I should mention that I, though in denial at the time, was recovering from an abusive relationship I had left just about a year ago. Needless to say, this caused a lot of insecurity and pain points for me even if I did not recognize it. Us ""dating"" lasted only about a month. We didn't sleep together but we did everything else; we got close to it but he would tell me that he ""wanted to prove everyone wrong that we weren't just in it for the sex.""

After I told him I wanted to just be friends again, he took it very well and respected my decision. Things got back to normal soon after and our dynamic had once again returned to what it always had been -- flirty with the knowledge that it would never happen (again). He moved away for college so I saw him even less. Every time he would come back to town I wouldn't have the time to see him. We kept in touch through FaceTime calls and such, but we never really hung out.

3 years after we dated (or tried to), I was in his city because of work. We had made plans to hang out in advance because we hadn't seen each other in so long, and I was only going to be in town for a little bit. I had just moved away from home and was feeling very lonely and homesick. I went to his place with full intention of seeking solace in a familiar face. We had a couple drinks, smoked a couple joints, and he told me he was having second thoughts about his current girlfriend. One thing led to another, and in a stunning turn of events, we slept together. 

The actual act was unremarkable -- it wasn't the best sex I've ever had or anything like that. It was the comfort, the familiarity, the closeness that got to me. Because I haven't seen him in so long, I forgot how fond of him I was. I was simply overjoyed to hold his face in my hands, or to have his arms around me. He kept telling me he couldn't believe this was happening. I couldn't find the words to tell him what I did or did not believe. 

The next morning, he told me that we should ""probably keep this to ourselves"". I agreed, saying that our dynamic still ""feels like nothing had happened"" and joked that it probably won't happen again for another 3 years. When I left, we hugged goodbye. I wanted, instead, to kiss him goodbye. 

It has now been about a week since that night. I haven't stopped thinking about him -- I count the hours between text backs (the length of time, I believe, hasn't changed; I just notice it much more now), I think about seeing him again, and that night replays in my head on repeat. I don't know how, or whether I even should, tell him about this. I don't want to put our friendship in jeopardy. I also don't want to date long distance (I'm moving across the country in a month). Not to mention, he still hasn't broken it off with his girlfriend (I know. I'm sorry. I do feel badly about this part). What is the right thing to do in this situation? We haven't talked about it since it happened and I don't want to bring it up if I don't know what to say.",dating,t5_2qhb1,https://www.reddit.com/r/dating/comments/ppt325/i_think_im_in_love_with_my_taken_best_friend/
5,ppt4e3,1631852223,How do I go about knowing what a guy wants without asking him?,"So here’s my ongoing issue with guys: if you ask them what they want too early on, a lot of the time they lie and say they want a relationship just so you’ll keep going out with them to boost their confidence, and then they tell you a month later that they’re not “ready” for a relationship or have commitment issues. It’s happened three times to me already. The first one sucked because i genuinely believed this dude wasn’t playing me. I was naive back then, though. It’s weird because I didn’t even sleep with any of these men, so it’s not like they were using me for sex. I absolutely hate hookup culture, and I usually make that clear straight away so I’m not wasting their time in case that’s what they were looking for. But yet they still continue to go out with me. I think maybe they assume that a FWB will inevitably arise, but when they realize it’s not going to, they dip. I’m also a 20 year old girl dating 20 year old college guys, so immaturity is also a factor here. Anyway, I’ve tried making little ‘adjustments’ in the way i present MY wants. I used to say that I wanted a relationship right off the bat, but then they convinced me they wanted one too and tried to play me. I wish they would just be honest lol. 

Here’s the scenario I am in right now: I’ve been talking to a guy and we just went on our first date the other day. It went great! He asked me to go out again this weekend. It’s very hard to tell what he wants, because he’s not really a sweet talker like the other guys were. He’s not really trying to convince me that he’s a certain way or wants a certain thing. He hasn’t brought up the relationship topic, and we’ve been talking for weeks. I want to find out what he wants, but I feel like i will keep running in the same scenario. Is there another approach i should take that would be better than my previous situations?",dating,t5_2qhb1,https://www.reddit.com/r/dating/comments/ppt4e3/how_do_i_go_about_knowing_what_a_guy_wants/
6,ppt9sz,1631852850,The 50 First Dates Project: Am I Destined To Die Alone Or Have I Just Not Tried Hard Enough,"I've just gone on the worst date of my life. Which I guess isn't saying much. I'm 21 years old, female, and have only been on 5 first dates. Ever. 

I've always had crippling anxiety when it comes to dating-- I get sick to my stomach before going out, have bouts of insomnia, and get progressively more anxious the more intense the relationship gets. For that reason, I've sabotaged a few good things and have avoided putting myself out there. While my best friends have fallen in love, have had wild one-night stands, and candle-lit dinners, I've watched from the sidelines, mystified. How did this all come so easily to them?

But recently, after starting therapy and making a concerted effort to work on myself, I made the decision that I was ready to PROPERLY give dating a go. Instead of complaining about my situation, I was actually wanted to face my fears. I didn't necessarily think it was going to be easy. But I guess I really didn't think it would be this hard. I'd met great guys when I wasn't ready, so it stood to reason they would be around when I finally decided to turn on my green light, right?

WRONG. Man, I should have listened when people told me it was messy out here. It's been a week and I've been ghosted once, I've had to dump someone I wasn't even dating (yikes), and I've gone out with a bonafide weirdo (he run into oncoming traffic to kick a man's truck, and has a massive tattoo of Satan who he talked to like it was a pet). I was seriously wondering if it was even worth it. You have to put so much of yourself on the table, you have to put SO much energy into dating and...  It would be so much easier to throw in the towel and give up. No more sleepless nights, no more nausea, no more creeps. 

But my friends keep pushing me to be better. Damn them and their kind hearts! Screw them and their good advice!

They said good things aren't meant to come easy. They said 5 bad dates is too small of a sample size. They said I needed to go on 50 first dates before I could say I'd really given it a go. And I really do want to try. I don't want to keep sabotaging myself. Sometimes you gotta take the advice of the people who love you, ya know?

SO to make this fun for myself, I'm going to document the process. I'm hoping then bad dates will seem less like a waste of time and more like a good story. I'm hoping this might keep me accountable. Hopefully, I'll meet someone cool. If I don't I'll at least have learned something about myself. At least I'll have faced my fears. 

If anyone has any sage advice in the following categories feel free to share!

1) How to reduce relationship or dating anxiety and pre-date panic attacks/ why this might be happening to me in the first place (I honestly don't know what I'm so nervous about, in general, I'm a pretty self-assured person, so I don't really think it's performance anxiety, but I don't know what other issue it could even be...)

2)  How to weed out weirdos when dating online

3) Natural ways to meet people in person, particularly on a uni campus/ how to approach people 

4) Good first date ideas/ suggestions/ hacks and tricks to make it go smoother

5) Any dating horror stories to make me feel less alone

6) Any success stories to give me hope

5 down. 45 to go. 

Wish me luck.",dating,t5_2qhb1,https://www.reddit.com/r/dating/comments/ppt9sz/the_50_first_dates_project_am_i_destined_to_die/
7,pptb97,1631853024,Whats the matter with this girl?,"I (28 M) met this girl from college on Tinder and we spend about 3 months during Covid talking every day, she was really sweet and showing love for me. Like planning stuff together. 

Due the pandemic we never met in person, even tho we both go to same school (online during this whole time). 

One day she stopped answering me, told she was busy, family was sick, and never answered me again. When was her bday i texted her and she answered pretending she barely knew me. 

But the thing is she follows me on instagram and sees every damn story i post and never unfollowed me. Almost a year already. 

I begged for an answer and she ignored me. And yet she still follows me and i have no idea why. If she wants to run from me why she sees my stuff and do not unfollow like every girl does? 

What you guys think?",dating,t5_2qhb1,https://www.reddit.com/r/dating/comments/pptb97/whats_the_matter_with_this_girl/
8,pptbhp,1631853053,how do gfs deal with bfs with baby mommas and kids? if initially you know that that lifestyle aint for you and still chose to stay with him. i srsly want to know how you overcome/get over/accept / respect the situation…..,[removed],dating,t5_2qhb1,https://www.reddit.com/r/dating/comments/pptbhp/how_do_gfs_deal_with_bfs_with_baby_mommas_and/
9,pptbp0,1631853078,Feel like I’m being pursued by a girl for once?,"So last weekend I was at this concert, I was having a lot of fun and dancing with people, doing my thing, and towards the end of the night this guy told me to hit on this girl bc he said I was good looking lol. I’m really shy so I rarely approach girls, but I just grabbed her hand, we started dancing, we ended up making out, and I kissed her goodbye.

I was so drunk that I honestly didn’t remember what she looked like, but when I was drunk I thought she was really pretty and cute. This sounds kind of mean, but she sent me a picture and it was different from what I remember and she didn’t look like what drunk me thought. It’s not that she’s ugly or anything she’s just not really my type.

I had set up a date before I had the picture sent, so now I feel bad about sort of going on a date where I might not like the girl, but I figure that recalling that night might be fun and interesting, and it could be just fun to hangout. 

And even more interesting is that she seems super responsive, and only one other time has a girl ever asked me how my day was, she also asks what I’ve been doing, how I’m feeling, sending me heart emojis, not one dry response, fast responses, and I guess this is what real interest looks like. She’s the one who keeps the conversation going, I feel like I don’t really have to try, and she seems super nice and thoughtful, which makes me feel bad bc I’m not as into her. 


I feel like I’ve been on that side of the coin sometimes so it’s interesting to see the other side, but in the past I was just head over heels for the girl and the girl might’ve been neutral or liked me as well, but she could never match my energy 100 percent over text. In person I find is where you can truly tell, but messages are an extra spice that not every girl I’ve talked to has been good with.",dating,t5_2qhb1,https://www.reddit.com/r/dating/comments/pptbp0/feel_like_im_being_pursued_by_a_girl_for_once/
10,ppteq5,1631853444,how do you not feel worthless when you're unattractive to a large majority of women?,"I'm 24 years old and haven't had a girlfriend to date, had sex once and only once at 23. I know I'm not attractive to most women except the very rare odd case here and there. I fall short in height, social status, race, and every metric imaginable. Everyone I know explored themselves and had fun in college, I'm one year away from graduation and the feeling of not having experienced anything is crushing me. Does it get better or is this just how my life will be forever?",dating,t5_2qhb1,https://www.reddit.com/r/dating/comments/ppteq5/how_do_you_not_feel_worthless_when_youre/
11,pptms4,1631854390,Is it harder to get laid on double dates?,I’ve been offered several times to go on double dates and triple dates but I’m currently just into fwb situations. In your guys experience are double/triple dates a bad idea if ur just tryin to get laid fast,dating,t5_2qhb1,https://www.reddit.com/r/dating/comments/pptms4/is_it_harder_to_get_laid_on_double_dates/
12,ppto4n,1631854554,he ALWAYS pays for our dates but didn’t ask for our checks together this time,[removed],dating,t5_2qhb1,https://www.reddit.com/r/dating/comments/ppto4n/he_always_pays_for_our_dates_but_didnt_ask_for/
13,pptooq,1631854624,My girl hurts me emotionally 💔,"First thing bout me is I'm so emotional and caring.


my girl(20F) she is immature and pretty dumb she says she love me and she mean it but she is so disrespectful and arrogent she think that she is right all the time!!

I'm (20M) so tired of her she brings past in conversation and we're kinda in long distance cause of pandemic college haven't started yet so she's not in city we mostly talk on voice call no video calls.
She is so hardhead she don't listen to me she think she know better than me.
I'm her first and i already had 4 relationships and so much outer world experience she don't know much bout it she don't know how to respect and deal with boyfriend and how is outside world,

i mean i don't want to be the bad boyfriend here i don't want to be the guy who left her and she'll get new boyfriend then she'll do those things that i wanted her to do for me. I don't want to loose her i want her for long long time maybe I'll get married if everything goes right but she is so hardhead when she get angry or upset which is all the time 

But her nice side is she is so sweet and lovely childish and listens to me but she forgot the difference between what is bad in relationship and what is not.

Help me guys 😫



Here's some context it's from my last post : 


me : i'm more of a american style person (live's in asia) i care about small things or i care so much about anything and i love technology and i've been in 1 relationship before that breakup was horrible when i was in high school i'm 20 and i'm in college, and i think i know so many things and i act like i have so much experience and i know everything i like to take control of everything only if i know about that thing and so many time it turns out i was right and my plans never fails { this is how i'm }

my girl : from small village simple innocent and childish and little dumb more caring and talkative she loves me truly and she's honest and loyal

&amp;#x200B;

okay so we've been in relationship almost 22 Months and in the start i was super dumba$$ i broke her heart so many times but i was honest and i came back and made that situation right or solve the problem or convinced her but i didn't had that much of experience and after somedays things goes normal and after some time or days things goes same way i did some small thing she take it on heart and fight happens,

i'm more of introvert but i like friends i like to talk with them on chat but whenever me and my girl meet's she checks my mobile and i accept that sometime i fucked up i accidently sent NSFW gif to my bestie and she saw it which i accept as my fault and my girl got wrong idea and i also explained her what was the situation and she got convinced in 2 to 3 days but she keeps taking it out so many times.

i always convinced her even when i was in anger or frustration thinking of she's sweet and innocent and i hurt her even tho it wasn't my fault, i didn't care about my self respect and tried to convince her and still she don't respect me.

whenever i tell her watch this show for example i said watch friends and how i met your mother and modern family just to get a idea what is relations are and why they're valuable and how to treat each other she just directly denies it and says that ""it's a wrong influence that you're getting and learning from tv shows""

and here's the problem she always disrespects me and tell me that you have no personality and so many things and in my defence i know i made so much of bad impression on her but i didn't did that intentionally whenever i try to do something it goes wrong way and speaking of personality i have but i chose to not show her ‘cause  i'm her first love and i wanted to be an open to her as much as i can i was always honest to her no matter what and i was also loyal to her i never cheat on her ever but still she don't buy it if some argument happened she always disrespects me and i was the one who convinced her all the time and she always keep bringing stupid past things and then i feel like not to be with her anymore and i also get angry.

i know i did those things but can't she just move on i'm not that person anymore she changed me so much she showed me what is true gentlemen but she also makes me feel like i'm in jail trapped she just trying to control my life

i'm the guy who is eagle and she's like ""NO YOU Can't FLY""

in the start i was not in love with her i love her but little and by seeing her honesty and loyalty i just don't want to leave her and i know i know if i ever get that kind of girl who is honest and loyal.

now it's too much man i just can't handle it she disrespects and insult me so much.

please guys tell me can i change her in good way and stop this all shit or just last option is to break up with her.",dating,t5_2qhb1,https://www.reddit.com/r/dating/comments/pptooq/my_girl_hurts_me_emotionally/
