,id,created_utc,title,selftext,subreddit,subreddit_id,url
82,pa72xx,1629747254,Dating isn’t what it seems,"I think dating is seen by most as this thing that is necessary to have the best life. To be the happiest version of yourself. When it’s totally not the case.

If you’re out there feeling sorry for yourself because you can’t find the right partner, you’re completely in the wrong. The problem is you’re unhappy with your life. And you’re taking it out on something external.

The real cause is probably mental illness and you don’t even know it. And what is the cause of this? Inflammation. The crappy things we put into our bodies that our bodies don’t know what to do with (anything besides water, meat, fruit &amp; veg). It’s amazing how much happier you can become when you eliminate inflammation from your life. All of a sudden you think more clearly and you’re not constantly tired and miserable all the time. You can suddenly see that for the majority of your life you were blaming your misery on external situations (bad dating life, bad job, poor luck) when really it was your brain that was inflamed and you would be unhappy even if all of those things were fixed",dating,t5_2qhb1,https://www.reddit.com/r/dating/comments/pa72xx/dating_isnt_what_it_seems/
83,pa7563,1629747450,(M29),[removed],dating,t5_2qhb1,https://www.reddit.com/r/dating/comments/pa7563/m29/
84,pa75ns,1629747492,Guy that I love is suddenly distant,"I met a guy on a hookup site. Obviously,I wasn't looking for anything serious when I met him there, but when we started going on dates, he didn't get sexual with me. We've been regularly seeing each other for a month now and he made it clear that he was looking for a serious relationship, he also treated me really well, showed a lot of interest and introduced me to some of his friends at a birthday party, which he had invited me to and he was fine with meeting my parents for my birthday party. I invited him to my birthday party at a separate apartment though and he told me that he fell in love with me and gave me an amazing gift. He told me that he loved me after we had sex, but things became terrible after that as I found out that the condom broke and I was more than stressed and he supported me through it. However, immediately after the incident I asked him about STIs and he said that the results would be in the next day, but on that day, he told me that he simply didn't take that test and that there is a misunderstanding. I was super confused amd frustrated about it and he told me that he would take the STI test to calm me, so it got better. But I did tell him that I needed time to deal with the anger, which he totally understood and I sent him a friendly text when I was over it and that's when I sensed that he started pulling away. I went camping and he didn't even bother asking whether I made it home safely, which he used to do or walk me home. It's heartbreaking!",dating,t5_2qhb1,https://www.reddit.com/r/dating/comments/pa75ns/guy_that_i_love_is_suddenly_distant/
85,pa75p8,1629747496,Why did he give me a wrong phone number if he wanted to see me again?,"So I met this guy at the gym and he took me to the cinemas on the same day. After the date finished he said he wanted to see me the next day at the gym so I asked for his number and then we said bye. He claimed that he didn’t have his phone with him that day. 

When I got home I texted him on WhatsApp and he read the message. So then I texted with my name saying ‘It’s … from the gym’ and that message only showed one tick. 

So later that evening I rang him on anonymous because I suspected he had given me the wrong number and a lady answered. I asked ‘is this…?’ Mentioned his name and the lady said ‘no you’ve got the wrong number’. 

So I didn’t really want to see him again because there were red flags when I saw him but I wanted to tell him I didn’t want to see him again over text. I didn’t want to make it awkward and tell him in person because we go to the same gym. But why did he give me the wrong number when he asked to see me again at the gym the next day?",dating,t5_2qhb1,https://www.reddit.com/r/dating/comments/pa75p8/why_did_he_give_me_a_wrong_phone_number_if_he/
86,pa7bq5,1629748026,Has your t-shirt ever helped you secure a date?,"This is probably a daft question but I am curious to read the results.

Basically, I've always believed that a t-shirt is a good way to ""advertise"" your interests in public. I've had a few looks here and there after wearing certain t-shirts relating to bands and shows so I'm curious as to how many met a significant other because that happened to have a certain top on that day.


21M btw.",dating,t5_2qhb1,https://www.reddit.com/r/dating/comments/pa7bq5/has_your_tshirt_ever_helped_you_secure_a_date/
87,pa7i8l,1629748606,How much energy and time to give to looking for potential dates?,"There must be a point where its either you arent doing enough or you are putting way to much energy into it to the point its an unhealthy obsession.  Im 28m and have been really passive which has not worked for me. I have friends who just tell me it'll happen when the time is right or they you'll just now when you meet them. That is BS to me. Im out of college. If I dont get out I dont meet people. If I dont ask people out everyone thinks im their friend. If I dont work on myself and try to be better at talking with people I probably should throw in the towel.   


Right now I'm trying to find people through my social circle. Im kind of striking out and may need to broaden my circle. I got this one girls number, but it's someone I have been talking to at social event and it was because she was interested in checking out my climbing gym sometime. So I felt there might be something there, but will need to explore it more the next time I see her.   


And I just got rejected from someone else in my social circle last week. So I dont want to come accross to people that Im jumping from one person to the next, but if I think I might be interested then who can blame me?? I just dont want to be that dude that gets known with asking everyone out.   


Side tracking a little. My point is that I really want to be looking for dates, but I think there is a balance that I need to find. For instance I'm not going out tonight and I kind of wish I was because of fomo. When I know I'll probably be out several times this week.   


Where is the balance in your opinion?",dating,t5_2qhb1,https://www.reddit.com/r/dating/comments/pa7i8l/how_much_energy_and_time_to_give_to_looking_for/
88,pa7jjl,1629748722,How do you tell the difference between romantic and platonic interest? What are some things you'd do for someone that you wouldn't normally do unless you were romantically interested?,"This guy I know is so sweet and patient with me, makes me laugh so much too. How do I tell if his actions aren't just out of kindness?",dating,t5_2qhb1,https://www.reddit.com/r/dating/comments/pa7jjl/how_do_you_tell_the_difference_between_romantic/
89,pa7m86,1629748938,I’m looking for serious relationships,[removed],dating,t5_2qhb1,https://www.reddit.com/r/dating/comments/pa7m86/im_looking_for_serious_relationships/
90,pa7mls,1629748968,Guy added me on fb and ig but we have not met yet,"I started to exchange  messages with this guy on Hinge. Then he proceeded to ask me for my number and then While he was away visiting his family he ask me if I could exchange fb and ig with him. I noticed on his ig several women liking on his pictures but barely any friends that are in his ig follow him. We been talking to each for a month and a week. I understand after he came from vacation he was swamp with work. I saw him on the fort’s page with some activities he was involved with.  Yet, ever since I added him he has been less proactive in texting me. I had been the one initiating conversation and leading to the point that just recently I ask him hey let’s do a phone call if five minutes. He told me he had plans that night to which I reply when are you available? I’ m flexible. He left me on read. I have decided not to do a follow up for about a week maybe a little bit longer. He is not been active online but I noticed when he is online and sees my stories. What would you make up this? 


Another observation, I recall seeing all of his albums pics were easily for me to view but as of last week I can only dee the pics that he is tagged in, public post and his private post posted in the past. What would you make up this? Is he setting up to ghost me or just leaving me hanging? I want to give him the chance to know each other but sometimes I feel like I getting mixed signals. Thought of sending him a message at the end of weeks sling him how can we improve our communication and where does he sees things going forward with our interaction (so I can adjust expectations accordingly). Will this be too much on my end?


It does not help that I also suffered from anxiety.  Normally, I am very independent and could careless but for some reason this guy has come to challenge certain things when it comes to getting to know someone. I am used to getting ghosted very quickly but with this guy I feel like I do not what is going to happen.  Also, is he taking me seriously in getting to know me? I know I posted several things about relationships and anxiety on my stories and wonder if that could have scared him away?

He is in his 40s and I am in my late 30s. It feels like I am new to dating but I am not😅. Maybe is because we have different dating styles? Different communication and ways of knowing each other?",dating,t5_2qhb1,https://www.reddit.com/r/dating/comments/pa7mls/guy_added_me_on_fb_and_ig_but_we_have_not_met_yet/
91,pa7mp2,1629748976,How to not rush in a new relationship after being only in a relationships for 10 years,"Tl;dr: 1. just got divorced recently
2. met a girl who was really into me
3. developing already feelings, but I want to enjoy being free.

Hey guys, Im 27m. I divorced with my wife few days ago. It was a long process over few months, so we are doing better than before.

I began to meet new people and I wrote to a girl I met recently on work-related place without any intention.

She was really interested in me, chatted with me the whole time and she made so many compliments and didnt even try to hide her feelings towards to me. 

We discovered some mutual hobbies, interests, sexual preferences and planned a date next week.

She knows about my situation and understands I dont want to be in a relationship. She said, she is in a similar situation.

All of sudden she is writing only few times a day. In comparison to whole day texting with so much interest and affection, its like nothing.

Maybe its a strategy, but Im worrying to „lose“ her. Because she is the only person Im chatting with now and I really like her. 

I discovered myself want to be in a relationship mode again, but since I never had a time to be a free single, I wanted to use this time to meet seceral people. But I can‘t get this new girl off my mind.

I am so unexperienced in flirting and being single. I dont want to rush in a new relationship, but I want her so badly.

Can you give me some advices?",dating,t5_2qhb1,https://www.reddit.com/r/dating/comments/pa7mp2/how_to_not_rush_in_a_new_relationship_after_being/
92,pa7ri0,1629749384,Could it be me,"Quick background: I’m 9 months pregnant, haven’t wanted any type of affection due to hormones running wild. We already have 1 child together and got engaged earlier this year after almost 5 years. 

Recently my intuition was telling me something is off about my fiancé. He doesn’t usually spend much time on his phone. However, I caught him smiling at his phone, differently than he would have been over any post or guy chat messages. The next morning I woke up for work and decided why not just take a peak (even though I trust him and rarely ever do this.) Well the last person he texted happened to be his new coworker (who he has to have communication with at and outside of work due to type of job.) Initially I thought “nahhh it’s too soon” then again you never know. Well turns out they were talking pretty inappropriately about “tips and tricks” for certain areas of the body. They didn’t get into details, but still why is this going on for messages throughout the last conversation?  

I spoke to him that night and his “reason” for this was because he is lacking attention at home. Because I wasn’t giving him the affection and physical attention he needed. My point to him was why didn’t he communicate these before he got to this point and he said I should have known after the way he was acting. Also why would he allow himself to get to that point if he could just speak to me about his concerns? 

Days after we spoke still feel like crap about him talking to her and now any time i see her name pop up on his phone I’m a bit bothered and deep down want to see what they’re talking about. He brought up therapy and I’m up for it, but really don’t think we need it if after all these years we’ve dealt with a lot already on our own and have no problem with communication til now. Not sure if I’m just getting too over my head because of these hormones and insecurities I feel being 9 months pregnant, what should I do?",dating,t5_2qhb1,https://www.reddit.com/r/dating/comments/pa7ri0/could_it_be_me/
93,pa81de,1629750213,I'm an anxious person and it has always shown.,"For as long as I can remember I have been an anxious person from child to adulthood. I have seen multiple therapists and been on medication. I've learned a lot of ways to deal with it and can tackle everything in my life now with a sort of nervous-confidence if that makes sense.

I have a lot more self respect now too, but I've always had this uneasy vibe I think that turns people away from me and meeting people is harder than ever. It makes me sad because I've never had a love life mostly due to this weakness, 24 M btw. 

It gets a little better every day, but I feel way behind the curve.",dating,t5_2qhb1,https://www.reddit.com/r/dating/comments/pa81de/im_an_anxious_person_and_it_has_always_shown/
94,pa84cy,1629750479,Am available for Hookups,"25[F4M] looking out here for any horny dude ,I'm available for meet up ,sexting ,blow job and erotic massage' message my kik if you are interest on -25[F4M] looking out here for any horny dude ,I'm available for meet up ,sexting ,blow job and erotic massage' message my kik if you are interest on - vanessabrown122",dating,t5_2qhb1,https://www.reddit.com/r/dating/comments/pa84cy/am_available_for_hookups/
95,pa84mq,1629750503,Prenup or not?,"To those that are well off, if you’re currently dating a SO, and have decided to take the next step into the relationship, have you thought about signing a prenup ? 


This is why I think marriage can sometimes be a pain in the A@@. I’m just curious how you feel about the whole ordeal ?",dating,t5_2qhb1,https://www.reddit.com/r/dating/comments/pa84mq/prenup_or_not/
96,pa85zu,1629750619,She didn’t actually say she rejected me but I still felt rejected,"
Met a girl at my retail job about a year ago. Started talking to her and she started joining me on my breaks at work just about everyday we worked together. She immediately caught my interest as in my experience girls who are not interested do not go out of their way to talk to me or take breaks with me

Over the next 6 months i started to get to know her better in time we spent talking on our breaks. These talks would usually end up going 5-15 minutes over our scheduled break time once we got to know each other better. 

She started asking me more personal questions about my life, interests, and school. Alot more personal questions than ive ever had with any other co workers. She would ask about my family and follow up on the things I told her. 

She told me a lot about herself as well and always seemed excited to sit down and talk with me. She always wanted to know what I was up to on the weekends and told me she wanted to go to some museum once the pandemic was over. 

She even mensioned to me that she was single on valentines day and asked if i gad any plans. Then proceeded to randomly tell me that a few coworkers hit on her but she wasn’t interested. I changed the topic as i was un comfortable. 

 After about 6 months i finally got up the nerve to ask for her number. She gave it to me with no hesitation.  Texted her the next day and we texted back and forth about 6 times until i got distracted and didn’t get back to her until the next day. Texted her the next day and had to go to bed early and left the convo. 

The next day I texted her but got no response… thought i was ghosted but then texted her a day or two after and she texted back  I then asked her if she wanted to go out on a date to which she said she didn’t think she could because she had a brother with health issues and may me vulnerable to the pandemic. I thought this was her way of rejecting me. 

I told her i understood and I wouldn’t talk to her anymore. I understand how awkward it can be to be asked out and I didn’t want her to be un comfterbal. She said I didn’t need to do that as she really enjoyed our relationship. She told me to treat her the same and said a few other things that confirmed she understood I asked her out. 

Didn’t talk to her or hear from her until I saw her at work next. I tried to avoid her but that was impossible once she sat down with my on my break. We talked for an hour and the topic of that never came up. I didn’t know where I stood or how she felt about the whole thing. I decided i just needed to get over her

I texted her a few days later and asked her if it was ok if she could not talk to me at work because I needed to get over my feelings for her. I also told her I thought she was a cool person and was my friend, but I just needed some time but id like to remain friends. 

She told me that she was into someone else and I tried to convince her to shoot her shot because i thought we were just friends at this point. She agreed to being friends and I thought everything was fine until the next time i saw her she seemed very upset. 

It was not my intention to hurt her in any way, i just didn’t want her to feel uncomfterbal or anything like that. I texted her that afternoon and said it was ok if she wanted to talk to me at work again but i got no response

She seems to be aware and knows when people are hitting on her. She seemed used to it so idk why she wouldn’t just tell me she wasn’t interested. 

I went up and tried to apologize to her the next time i saw her but she wouldn’t even face me and said she just wanted to be vague. 

Today I was sitting in the break room alone minding my own business then she sat down across the room. My friend called me and after 30 seconds of talking to her on the phone, she gets up and hurries out of the break room. Just kinda weird.

TL;DR: met a girl and thought we clicked. Asked her out and she told me she couldnt at the time because of a vulnerable family member(before vaccines) and I assumed she was lying.",dating,t5_2qhb1,https://www.reddit.com/r/dating/comments/pa85zu/she_didnt_actually_say_she_rejected_me_but_i/
97,pa87nh,1629750752,Going on a first date with a super smart guy,"So I (23F) is going out on a first date with a super smart guy (26M) and im extremely nervous. He's and engineer deeper into his career while I'm still figuring things out for my career. I'm nervous but I'm not 100% sure why cus I have dated smart guys in the past. Maybe it's cause my last first date was about two and a half years ago so it might just be first date nerves.

Any tips/advice on just having fun and dealing with first date nerves especially when someone is super smart?? thanks!!",dating,t5_2qhb1,https://www.reddit.com/r/dating/comments/pa87nh/going_on_a_first_date_with_a_super_smart_guy/
98,pa8c2k,1629751149,Ending a short term fling,"I’ve been seeing a girl for about 5 weeks, not long I know. However, things have gone quite fast. Slept together on the first date, spent lots of time together, cooked her meals, taken her out etc. 

However, her replies are starting to get slow and dead, she’s airing me more often and it feels like the flames dying out… which is annoying as I can’t tell whether I have caught feelings or whether I just don’t like the thought of not being in control of whether I get to stay with her.

In my heart I do want to keep seeing her, but in my head I feel I should end it as it’s drawing too much of my attention away from my own goals. 

Has anyone been through anything similar or have any general advice? I know this sounds deep for a 5 week fling but I do catch feelings easy and tend to get in deep quite quickly.

Thanks!",dating,t5_2qhb1,https://www.reddit.com/r/dating/comments/pa8c2k/ending_a_short_term_fling/
99,pa8cqv,1629751210,How to navigate dating as an unattractive man?,"Hi all! Just want to say I love the subreddit so I'd thought I'd pick your brains with a question(s) that have been on my mind lately.

How do you ask a women out when asking out can be problematic in of itself? It seems like the general discourse is that doesn't matter, women despise being hit on by guys they are not interested 100% of the time.

Rejection doesn't really bother me, there are a million and a half reasons not to date someone so there's no reason to take it personally. How ever my main concern is accidentally bothering / harassing a women or making her feel uncomfortable, unsafe or creeped out =( . So much so that I (26 M) haven't really ever bothered to make many moves so as to not be a part of the problem

Thanks for reading!",dating,t5_2qhb1,https://www.reddit.com/r/dating/comments/pa8cqv/how_to_navigate_dating_as_an_unattractive_man/
