,all_awardings,allow_live_comments,author,author_flair_background_color,author_flair_css_class,author_flair_text,author_flair_text_color,awarders,banned_by,can_mod_post,contest_mode,created_utc,domain,full_link,gildings,id,is_crosspostable,is_meta,is_original_content,is_reddit_media_domain,is_robot_indexable,is_self,is_video,link_flair_background_color,link_flair_css_class,link_flair_richtext,link_flair_template_id,link_flair_text,link_flair_text_color,link_flair_type,locked,media_only,no_follow,num_comments,num_crossposts,over_18,parent_whitelist_status,permalink,pinned,pwls,removed_by_category,retrieved_on,score,send_replies,spoiler,stickied,subreddit,subreddit_id,subreddit_subscribers,subreddit_type,thumbnail,title,total_awards_received,treatment_tags,upvote_ratio,url,whitelist_status,wls,author_flair_richtext,author_flair_type,author_fullname,author_patreon_flair,author_premium,selftext,edited,author_cakeday
74,[],False,confused_jr,,,,,[],,False,False,1622471173,self.dating,https://www.reddit.com/r/dating/comments/np4m6k/i_left_her_and_i_feel_good/,{},np4m6k,True,False,False,False,True,True,False,,dating,"[{'e': 'text', 't': 'Venting'}]",a616c322-194e-11e5-ab91-0ed1c06bdad7,Venting,dark,richtext,False,False,False,101,0,False,all_ads,/r/dating/comments/np4m6k/i_left_her_and_i_feel_good/,False,6,,1622472459,2,True,False,False,dating,t5_2qhb1,807194,public,self,I left her and I feel good,0,[],1.0,https://www.reddit.com/r/dating/comments/np4m6k/i_left_her_and_i_feel_good/,all_ads,6,[],text,t2_8uf3ahyf,False,False,"This post is about my experience in a 2 year relationship and how it turned out for me.

It wasn't an easy task to open up to a person of the opposite gender in the first place. I count my friends on 2 or 3 fingers because I really don't feel comfortable socializing. She was my first girlfriend. And I would still like to have her in my life but not as a girlfriend.

I'll tell you why,
She had this urge to share everything with her girl best friends and one day in the middle of our conversation, her friends pointed out about my nature and the way I don't socialize with people and rubbed it in my face to make me realize  how I should be thankful to have her and that no-one would ever consider me and there you could see my girlfriend just standing there and kinda seconding that whole opinion.


It was at that moment I realized that she was always just curious about my insecurities and used them to get into my head and the face of concern she put on at that time is really holding me back from talking to anyone else. 

Now, the moment someone tries to ask about things that bother me or tries to get personal, my first reaction is to just push them away.",,
75,[],False,1MLsugar,,,,,[],,False,False,1622472763,self.dating,https://www.reddit.com/r/dating/comments/np56zl/what_are_some_new_features_you_want_to_see_in/,{},np56zl,True,False,False,False,True,True,False,,,"[{'e': 'text', 't': 'Tinder/Online Dating'}]",5214d2ac-61f1-11e8-8bb1-0ed15e4a39c0,Tinder/Online Dating,dark,richtext,False,False,False,14,0,False,all_ads,/r/dating/comments/np56zl/what_are_some_new_features_you_want_to_see_in/,False,6,,1622473948,2,True,False,False,dating,t5_2qhb1,807221,public,self,What are some new features you want to see in dating apps?,0,[],1.0,https://www.reddit.com/r/dating/comments/np56zl/what_are_some_new_features_you_want_to_see_in/,all_ads,6,[],text,t2_83ksf4ka,False,False,"This may be unrelated, but I think despite so many dating apps out there, new one's are still coming in and solving problems or spicing things up, I am also thinking of exploring the space and would love to hear what people think works best, or can be the next big app",,
76,[],False,Difficult_Bedroom904,,,,,[],,False,False,1622473565,self.dating,https://www.reddit.com/r/dating/comments/np5i0h/can_guys_and_girls_just_be_friends/,{},np5i0h,False,False,False,False,False,True,False,,dating,"[{'e': 'text', 't': 'I Need Advice'}]",19ec58c2-9f74-11e7-81a1-0e2bf15991f0,I Need Advice,dark,richtext,False,False,True,0,0,False,all_ads,/r/dating/comments/np5i0h/can_guys_and_girls_just_be_friends/,False,6,moderator,1622474722,1,True,False,False,dating,t5_2qhb1,807238,public,self,Can guys and girls JUST be friends,0,[],1.0,https://www.reddit.com/r/dating/comments/np5i0h/can_guys_and_girls_just_be_friends/,all_ads,6,[],text,t2_cfp5ju5w,False,False,[removed],,
77,[],False,-lamppost-,,,,,[],,False,False,1622473620,self.dating,https://www.reddit.com/r/dating/comments/np5iq3/back_injuries_and_other_excuses/,{},np5iq3,True,False,False,False,True,True,False,,dating,"[{'e': 'text', 't': 'Question'}]",a9531dce-194e-11e5-b177-0eff099c3d1f,Question,dark,richtext,False,False,True,9,0,False,all_ads,/r/dating/comments/np5iq3/back_injuries_and_other_excuses/,False,6,,1622474774,1,True,False,False,dating,t5_2qhb1,807239,public,self,Back Injuries and Other Excuses,0,[],1.0,https://www.reddit.com/r/dating/comments/np5iq3/back_injuries_and_other_excuses/,all_ads,6,[],text,t2_3p3i19j5,False,False,"In the past year I’ve had 3 different men tell me they have had serious back injuries they are recovering from.  I’m a pretty active person so It did give me pause but I didn’t let on and continued messaging and not long after they stopped messaging. At first I figured they just decided we weren’t compatible because I am active but now I’m wondering if this isn’t an excuse to just get out of the convo and when I didn’t shut them down they just trailed out. I know there is no way to really know.  

So now I’m curious people of Reddit — what excuses do you use to get out of a date, convo or meetup to avoid conflict?",,
78,[],False,Expensive_Let_2720,,,,,[],,False,False,1622474590,self.dating,https://www.reddit.com/r/dating/comments/np5vy8/how_many_dates_before_you_get_intimate_with/,{},np5vy8,False,False,False,False,False,True,False,,dating,"[{'e': 'text', 't': 'I Need Advice'}]",19ec58c2-9f74-11e7-81a1-0e2bf15991f0,I Need Advice,dark,richtext,True,False,True,6,0,False,all_ads,/r/dating/comments/np5vy8/how_many_dates_before_you_get_intimate_with/,False,6,moderator,1622475705,1,True,False,False,dating,t5_2qhb1,807266,public,self,How many dates before you get intimate with someone ?,0,[],1.0,https://www.reddit.com/r/dating/comments/np5vy8/how_many_dates_before_you_get_intimate_with/,all_ads,6,[],text,t2_9n1agh5e,False,False,[removed],,
79,[],False,hadoocanfan,,,,,[],,False,False,1622475358,self.dating,https://www.reddit.com/r/dating/comments/np66bk/good_dating_advise/,{},np66bk,True,False,False,False,True,True,False,,dating,"[{'e': 'text', 't': 'Giving Advice'}]",7bca2c58-4211-11e5-9ecb-0e60d8112001,Giving Advice,dark,richtext,False,False,True,4,0,False,all_ads,/r/dating/comments/np66bk/good_dating_advise/,False,6,,1622476416,0,True,False,False,dating,t5_2qhb1,807289,public,self,Good dating advise!,0,[],0.33,https://www.reddit.com/r/dating/comments/np66bk/good_dating_advise/,all_ads,6,[],text,t2_cdyti6a3,False,False,"I think the reason women give a lot of bad relationship advise is because they only know what it's like to be a women and they have no experience what it's like to actually have to deal with a women!!!! 

 I think the best example I can give is..  a doctor would never ask a mentality deranged crazy person for advice on how to train another mentality deranged crazy patient.

Why because the person only knows how to be crazy and has no  experience to work with crazy people.

The expiration to this is lesbians.  I find them wise oricals !

They both experience what it is like to be a women and have the experience actually dealing with women on a romantic level. 


Out of interest do you find men also tend to give bad advise to women?   Or are men genuinely more simple creatures to deal with and you don't need as much experience?",,
80,[],False,GenCustard,,,,,[],,False,False,1622476399,self.dating,https://www.reddit.com/r/dating/comments/np6k96/weve_been_on_five_dates_and_things_were_never/,{},np6k96,True,False,False,False,True,True,False,,dating,"[{'e': 'text', 't': 'I Need Advice'}]",19ec58c2-9f74-11e7-81a1-0e2bf15991f0,I Need Advice,dark,richtext,False,False,False,8,0,False,all_ads,/r/dating/comments/np6k96/weve_been_on_five_dates_and_things_were_never/,False,6,,1622477390,1,True,False,False,dating,t5_2qhb1,807321,public,self,We've been on five dates and things were never official. Should I call to end things or is a message OK?,0,[],1.0,https://www.reddit.com/r/dating/comments/np6k96/weve_been_on_five_dates_and_things_were_never/,all_ads,6,[],text,t2_l218d,False,False,"I've been talking to this girl since mid-March. As stated above, we've been on five dates (always proper dates, never just casually hanging out) and have texted pretty much every day since we started talking. We have not had sex or been otherwise intimate aside from some kissing.  


I've enjoyed her company but honestly don't feel a strong connection. I had assumed we'd see each other again, but didn't really picture things working out long term.   


It's been a couple of weeks since we last saw each other - mostly because we live a good 2 hours apart and I've been legitimately busy both weekends with moving. However, I think she attributed this to a lack of interest, because last night she texted me and asked if I wanted to just be friends.   


I don't want to lead her on, so I figure this is the best time to lay it all on the table. Given the specifics of our situation, is a message OK or do I owe her a phone call?",,
81,[],False,boopbeepboopbap,,,,,[],,False,False,1622476575,self.dating,https://www.reddit.com/r/dating/comments/np6mkc/guys_how_would_you_feel_if_a_girl_you_barely_know/,{},np6mkc,True,False,False,False,True,True,False,,dating,"[{'e': 'text', 't': 'I Need Advice'}]",19ec58c2-9f74-11e7-81a1-0e2bf15991f0,I Need Advice,dark,richtext,False,False,True,15,0,False,all_ads,/r/dating/comments/np6mkc/guys_how_would_you_feel_if_a_girl_you_barely_know/,False,6,,1622477559,1,True,False,False,dating,t5_2qhb1,807326,public,self,"Guys, how would you feel if a girl you barely know tried contacting you that way ?",0,[],1.0,https://www.reddit.com/r/dating/comments/np6mkc/guys_how_would_you_feel_if_a_girl_you_barely_know/,all_ads,6,[],text,t2_c1utm93z,False,False,"Hi, I (19F) met a guy during a course last week and really liked him. We were partnered together for an exercise and I just had the best feeling with him. I'm usually very shy and anxious around new people but it seemed so easy with him, we couldn't stop bantering and laughing. During the break we hung out with other people but still were talking a lot just the two of us. He seemed to enjoy talking to me as well, so it's maybe not only a one-way feeling. Or he's just very friendly. I'd love to get to know him better, just as friends or more if we both feel like it.

But despite all that talking, we never exchanged significant informations. I had to leave early at the end of the course to catch my train, but I regret it because I really wanted to ask him for his number...

I have no way to find him again. I don't know his last name, I don't know where he's studying, I don't know anything. The course was an unique event and not affiliated with anything else, I have no chance of running into him again.


The only option I have would be to ask the course organizer to ask them to give him my email or number (so he has the choice to contact me himself). But that honestly feels creepy and kinda desperate, and I'm not even sure they would do it or have the time for it. Maybe if I make up a lie that justifies needing to contact him it would work better, but that seems really out of line.

But at the same time, I don't want to miss my chance. What I felt with him was really unique.

People have told me that I should go for it, that it's cute and romantic. But I know that if our genders were switched up, their opinions would be very different.

So, guys, if a girl you met for 3 hours tried to contact you that way, how would you feel ? Especially if she used a lie to get your contact ?


I guess it depends on wether you like her or not, but I can't claim anything about his feelings

TL;DR : I met a guy during a course, liked him (maybe mutual), didn't get the time to exchange contacts. Now I'm considering getting his contact through the course organizer, but it seems creepy. How would you feel ?",,
82,[],False,ken-9495,,,,,[],,False,False,1622477932,self.dating,https://www.reddit.com/r/dating/comments/np7504/my_ex_is_back/,{},np7504,True,False,False,False,True,True,False,,dating,"[{'e': 'text', 't': 'Question'}]",a9531dce-194e-11e5-b177-0eff099c3d1f,Question,dark,richtext,False,False,False,11,0,False,all_ads,/r/dating/comments/np7504/my_ex_is_back/,False,6,,1622478867,2,True,False,False,dating,t5_2qhb1,807361,public,self,My ex is back !,0,[],1.0,https://www.reddit.com/r/dating/comments/np7504/my_ex_is_back/,all_ads,6,[],text,t2_c34pk9gq,False,False," After a 4 years of relationship he ghosted me ..

Our relationship wasn't perfect, we were just hurting each other as he said, even if we were so in love. we used to have breaks and it was me who talk first but in our last breakup I didn't, I know he won't show up so I've decided to move on. It wasn't easy it took me more that a year to get convinced that what he had is finally over. I'm dating now a lovely man who helped a lot with this, he knew that I was dealing with a heartbreak, he has my back and I'm not ready to loose him no matter what.

Last month my ex texted me, I was super mad at him I refused to talk, I wasn't ready to return back to the past, I was so rude I blocked him. I told my bf about it.

From that time, I've been thinking a lot about it, what if he just wanted to check of me, what if he feel sorry about what he did, maybe I need to hear that apologie that i've been always waiting for to stop hating him, cuz I want to feel nothing towards him. I wanted to focus on my new relationship.

I texted him back yesterday, "" sorry for being rude, Im doing good thank u for asking, I moved on don't worry about me I feel much better""

He answered, he told me that he's ready to explain himself, the reasons why he ghosted me.. we spend the whole night talking about it,It was his was to solve things, running away and cutting off communication, he apologized and I feel so relieved.

My question is :

Should I tell my bf ? last time he told that I did the right thing ignoring him, I'm afraid that he can't understant why I did that, that I needed a closure ..

Should I tell my ex that I have a bf ? I didn't have the chance to tell him that yesterday.",,
83,[],False,throwaway88689,,,,,[],,False,False,1622478032,self.dating,https://www.reddit.com/r/dating/comments/np76c5/im_over_being_black_in_dating/,{},np76c5,True,False,False,False,True,True,False,,dating,"[{'e': 'text', 't': 'Venting'}]",a616c322-194e-11e5-ab91-0ed1c06bdad7,Venting,dark,richtext,False,False,False,108,0,False,all_ads,/r/dating/comments/np76c5/im_over_being_black_in_dating/,False,6,,1622478966,4,True,False,False,dating,t5_2qhb1,807362,public,self,I’m over being black in dating,0,[],1.0,https://www.reddit.com/r/dating/comments/np76c5/im_over_being_black_in_dating/,all_ads,6,[],text,t2_8gpfkvhc,False,False,"You know I’m over this being a POC thing. It’s not what I signed up for in life and I didn’t ask to be born this way. Every racial group of gay men all love white men or will only settle down with them. So many men only come to me with interest of sex and will tell me “they’re not looking or ready for a relationship,” but I will find them paired up with the most average white boy the next month. I feel like I was given a bad deck of cards here and it’s not fair that I wasn’t given the gift of being white. And then people say “oh well personality matters too,” umm bullshit. Have you met gay men? You could be the shittiest person on the planet and as long as you’re white, tall, and have abs they will worship the ground you walk on. And they never follow me back on Instagram either. We will share like 10 mutuals I’ll have more followers than them and they never follow me back yet the follow my white mutual friends that they haven’t met. Interesting...",1622478337.0,
84,[],False,[deleted],,,,dark,[],moderators,False,False,1622478035,self.dating,https://www.reddit.com/r/dating/comments/np76d8/dick_size_it_isnt_an_innate/,{},np76d8,False,False,False,False,False,True,False,,dating,"[{'e': 'text', 't': 'Giving Advice'}]",7bca2c58-4211-11e5-9ecb-0e60d8112001,Giving Advice,dark,richtext,False,False,True,0,0,False,all_ads,/r/dating/comments/np76d8/dick_size_it_isnt_an_innate/,False,6,deleted,1622478969,1,True,False,False,dating,t5_2qhb1,807362,public,default,Dick size- it isn't an innate,0,[],1.0,https://www.reddit.com/r/dating/comments/np76d8/dick_size_it_isnt_an_innate/,all_ads,6,,,,,,,,
85,[],False,Julie_Iverson,,,,,[],,False,False,1622478456,self.dating,https://www.reddit.com/r/dating/comments/np7bow/boyfriend_issues/,{},np7bow,False,False,False,False,False,True,False,,dating,"[{'e': 'text', 't': 'Question'}]",a9531dce-194e-11e5-b177-0eff099c3d1f,Question,dark,richtext,False,False,True,0,0,False,all_ads,/r/dating/comments/np7bow/boyfriend_issues/,False,6,moderator,1622479363,1,True,False,False,dating,t5_2qhb1,807374,public,self,Boyfriend issues,0,[],1.0,https://www.reddit.com/r/dating/comments/np7bow/boyfriend_issues/,all_ads,6,[],text,t2_cg0dy3a3,False,False,[removed],,
86,[],False,amz_f1n,,,,,[],,False,False,1622478469,self.dating,https://www.reddit.com/r/dating/comments/np7bul/how_to_handle_possible_rejection/,{},np7bul,True,False,False,False,True,True,False,,dating,"[{'e': 'text', 't': 'Question'}]",a9531dce-194e-11e5-b177-0eff099c3d1f,Question,dark,richtext,False,False,True,6,0,False,all_ads,/r/dating/comments/np7bul/how_to_handle_possible_rejection/,False,6,,1622479375,1,True,False,False,dating,t5_2qhb1,807374,public,self,How to handle (possible) rejection?,0,[],1.0,https://www.reddit.com/r/dating/comments/np7bul/how_to_handle_possible_rejection/,all_ads,6,[],text,t2_bu4wagc5,False,False,"Hey!
So i (16M) was thinking about asking a girl out. I suddenly had the urge to just don't give a shit and shoot my shot.
I chickened out partly due to there not being an easy moment to do it, also due to me scared of rejection.
Anyone got some tips? I just don't wanna be scared anymore and just be myself",,
87,[],False,Nearby_Signature8914,,,,,[],,False,False,1622478753,self.dating,https://www.reddit.com/r/dating/comments/np7fiv/should_i_ghost_my_fwbex/,{},np7fiv,True,False,False,False,True,True,False,,dating,"[{'e': 'text', 't': 'I Need Advice'}]",19ec58c2-9f74-11e7-81a1-0e2bf15991f0,I Need Advice,dark,richtext,False,False,False,12,0,False,all_ads,/r/dating/comments/np7fiv/should_i_ghost_my_fwbex/,False,6,,1622479634,2,True,False,False,dating,t5_2qhb1,807378,public,self,Should I ghost my fwb/ex?,0,[],1.0,https://www.reddit.com/r/dating/comments/np7fiv/should_i_ghost_my_fwbex/,all_ads,6,[],text,t2_ce22v4rl,False,False,"I need help! Early twenties f here. Ive been in an on and off unbalanced fwb situation with a guy 10 years older than me for the past 2 and half years. It started out with dating ( I was in college) than transitioned when he kind of shittily said he couldn’t commit/I lived too far away.

It’s been unbalanced and difficult because I was younger and naive and had stronger feelings, which he acknowledged but tried to shrug off, I think in the hope that he could get more sex and friendship from me (because we do have a good time when we hang out.)

However, I now live two states away and I’ve grown a lot and just don’t really see the appeal anymore of a directionless relationship. I’ve been living in an emotionally abusive family situation and he’s offered me to go visit. It could be nice to get away but the idea of playing house and having sex with someone who’s not my boyfriend and who leads a lifestyle I don’t agree with just doesn’t sound like the right move.

The thing is I have already rescheduled the flight once. He’s bought stuff in preparation for my visit. I don’t want to be an asshole. I care about him. But I don’t see the value in continuing this. My childish, romantic feelings have dissipated and now I see they are the only things that kept me in this situation.

So here are my choices:

Go, enjoy some time away after 1 year uninterrupted in a toxic household

Cancel my flight and ghost

Make up an excuse for a second time, cancel flights, slowly stop talking

OR: and this is pretty lame, but I’ve been thinking of saying I’m having a terrible herpes outbreak and can’t go. I actually do have herpes (he knows) so it wouldn’t be that far fetched.

I know this sounds like a no brainer but I have a dysfunctional family and therefore low self esteem and it is very very hard to advocate for myself, especially against people who have shown me kindness- which he has, despite his many flaws and our incompatibilities.

How do I do this without oversharing, being an asshole, etc? I have already made myself vulnerable in front of him many times only to humiliate myself because of his emotional limitations.

TLDR; I have a flight booked to see a fwb I’ve been in a dysfunctional situationship with for over 2 years and I want to cancel without too much collateral damage. The alternative is spending two more months in my toxic home situation, which is doable but heavy on my soul.",,
88,[],False,More_Froyo_4172,,,,,[],,False,False,1622478755,self.dating,https://www.reddit.com/r/dating/comments/np7fjl/the_worst_pictures_to_see_on_a_dating_profile/,{},np7fjl,True,False,False,False,True,True,False,,,"[{'e': 'text', 't': 'Tinder/Online Dating'}]",5214d2ac-61f1-11e8-8bb1-0ed15e4a39c0,Tinder/Online Dating,dark,richtext,False,False,False,669,0,False,all_ads,/r/dating/comments/np7fjl/the_worst_pictures_to_see_on_a_dating_profile/,False,6,,1622479635,3,True,False,False,dating,t5_2qhb1,807378,public,self,The worst pictures to see on a dating profile?,0,[],1.0,https://www.reddit.com/r/dating/comments/np7fjl/the_worst_pictures_to_see_on_a_dating_profile/,all_ads,6,[],text,t2_9o93enjy,False,False,"So I’m honestly curious to see the response! Men and women, straight or otherwise, what are the worst and biggest turn-off pictures you see on dating profiles?

I’m a straight woman and for me I can’t stand, in order of worst to kinda acceptable;


Pictures of them with other women that are clearly not their mother/ sister🤦🏻‍♀️

Shirtless mirror selfies (especially at the gym)🙄

Anything with the typical douche f boy face🤮

Them with exclusively fish/fishing pictures

Mirror selfie’s in general

Car pictures. As in just their car/truck. 😑

Them with said car/truck intentionally

Tons of pictures with the same guy friends making it hard to tell which one is the topic of interest",,
89,[],False,Careful_Analysis9758,,,,,[],,False,False,1622478958,self.dating,https://www.reddit.com/r/dating/comments/np7i7d/girl_wants_to_meet_up_just_after_matching/,{},np7i7d,True,False,False,False,True,True,False,,,"[{'e': 'text', 't': 'Tinder/Online Dating'}]",5214d2ac-61f1-11e8-8bb1-0ed15e4a39c0,Tinder/Online Dating,dark,richtext,False,False,True,15,0,False,all_ads,/r/dating/comments/np7i7d/girl_wants_to_meet_up_just_after_matching/,False,6,,1622479823,1,True,False,False,dating,t5_2qhb1,807383,public,self,Girl wants to meet up just after matching?,0,[],1.0,https://www.reddit.com/r/dating/comments/np7i7d/girl_wants_to_meet_up_just_after_matching/,all_ads,6,[],text,t2_buxvgum8,False,False,"Hi guys,

I'm new to tinder. I matched with some girl last night and she was surprised at how friendly I came across. She told me she doesn't use tinder much so she asked for my number pretty much off the bat.

She texted me ""Hey. So what city are you from? and if you don't see my profile it's bc I activated the hidden mode as I'm talking with you"". Idk i thought that was a bit odd to completely shut her tinder off immediately after but okay haha.

She just asked about relationships and I told her I just got out of something and so did she. She said shes still sad about it and i said i had as well. She said she isnt really looking for anything serious right now.

She first talked about meeting at a cafe but then she said why dont you come over this evening (not really evening, it was nearly 4am lmao). She said she has a gin bottle she could use help finishing and offered to pick me up. I was honestly not feeling like getting picked up that late but said Id love to later in the week after work.

She then went on to say lets catch up and that she uses something called noon-light safe which I had to look up myself as I didn't know what it was. I fell asleep but just woke up to a link to something regarding noon-light and she explained how it works saying itll give me some private number for her to send her my address or something.

She seems legit but what you guys think? Should I maybe ask to meet somewhere public first?",,
