,all_awardings,allow_live_comments,author,author_flair_css_class,author_flair_richtext,author_flair_text,author_flair_type,author_fullname,author_patreon_flair,author_premium,awarders,can_mod_post,contest_mode,created_utc,domain,full_link,gildings,id,is_created_from_ads_ui,is_crosspostable,is_meta,is_original_content,is_reddit_media_domain,is_robot_indexable,is_self,is_video,link_flair_background_color,link_flair_css_class,link_flair_richtext,link_flair_template_id,link_flair_text,link_flair_text_color,link_flair_type,locked,media_only,no_follow,num_comments,num_crossposts,over_18,parent_whitelist_status,permalink,pinned,pwls,retrieved_on,score,selftext,send_replies,spoiler,stickied,subreddit,subreddit_id,subreddit_subscribers,subreddit_type,thumbnail,title,total_awards_received,treatment_tags,upvote_ratio,url,whitelist_status,wls,removed_by_category,author_cakeday
16,[],False,newmommy0317,,[],,text,t2_b88k2zw9,False,False,[],False,False,1625514781,self.dating,https://www.reddit.com/r/dating/comments/oeexo1/would_you_stay/,{},oeexo1,False,True,False,False,False,True,True,False,#ff4500,dating,"[{'e': 'text', 't': 'Question'}]",a9531dce-194e-11e5-b177-0eff099c3d1f,Question,light,richtext,False,False,True,14,0,False,all_ads,/r/dating/comments/oeexo1/would_you_stay/,False,6,1625514791,1,Would you stay with someone who constantly accused you of cheating and had you falsely admit to it. Then using that “confession” as the main reason/ cause for their cheating and the whole reason the relationship is as bad as it is .,True,False,False,dating,t5_2qhb1,879778,public,self,Would you stay?,0,[],1.0,https://www.reddit.com/r/dating/comments/oeexo1/would_you_stay/,all_ads,6,,
17,[],False,Iwasntbornthisway,,[],,text,t2_d1cf6syt,False,False,[],False,False,1625515552,self.dating,https://www.reddit.com/r/dating/comments/oef6s6/mixed_signals/,{},oef6s6,False,True,False,False,False,True,True,False,#ea0027,dating,"[{'e': 'text', 't': 'I Need Advice'}]",19ec58c2-9f74-11e7-81a1-0e2bf15991f0,I Need Advice,light,richtext,False,False,True,6,0,False,all_ads,/r/dating/comments/oef6s6/mixed_signals/,False,6,1625515563,1,"I've (F29) been getting mixed signals from guy I'm dating (M29).

He says he wants to take things slow to get to know one another, but then made the claim that he feels he really knows me. He shared that he wants to fall in love but then keeps a distance from me. He also only asks me to hang out the day of, as opposed to giving some notice. It's made me feel like an option.

Last night I went out with some friends and we ended up getting some fast food late at night. Low and behold the guy I am seeing was behind me with a woman in the passenger seat. I recognized the woman in the car as someone he's described as one of his best friends. I tried not to think anything of it since I've met her and she knows we are dating.

This morning, I asked him how the rest of his evening was because he hadn't texted me back all night and I wanted to see if he would say what he did. He said that he got fast food and sat by himself all night. I was so taken aback for a number of reasons but mostly because if this is a friend and there is nothing to hide, why omit that information?

What are ya'll thoughts? Is it irrational in your opinion to break things off?

&amp;#x200B;

TL;DR ; caught guy in a lie, wanting to break things off.",True,False,False,dating,t5_2qhb1,879798,public,self,Mixed signals,0,[],1.0,https://www.reddit.com/r/dating/comments/oef6s6/mixed_signals/,all_ads,6,,
18,[],False,ResidentCollar2315,,[],,text,t2_2j5xseq3,False,False,[],False,False,1625516080,self.dating,https://www.reddit.com/r/dating/comments/oefd0x/trying_to_understand_after_a_breakup/,{},oefd0x,False,True,False,False,False,True,True,False,#ff4500,dating,"[{'e': 'text', 't': 'Question'}]",a9531dce-194e-11e5-b177-0eff099c3d1f,Question,light,richtext,False,False,False,3,0,False,all_ads,/r/dating/comments/oefd0x/trying_to_understand_after_a_breakup/,False,6,1625516092,1,"Its been almost two months since we broke up. We decided to end it because it was the best for both of us and we tried to stay friends but before we broke up I found out that 2 weeks into our relationship that she kissed a close friend, and at the time even though I was moving states away I thought that we could move past it because it was so long ago, but I couldn't trust her so very wrongly I snooped through her social media and other things (I know i should not have done this and it was very wrong there is no justifying that) and found out that during our relationship she was messaging other guys, posting lewd pictures behind my back when I told her I didnt like it and she got dms from guys who saw those pictures, she also sent money to a guy all while we were dating. And two weeks after we broke up, we were talking as friends and I find out that she spent a copious amount of money $50+ to uber to another guys house late at night. I honestly would be dealing with this better but the thing that bothers me most is that during our relationship she asked me not to talk to other girls, especially a best friend of mine since middle school, and she asked me to wait a while after we broke up to see someone because it would hurt if i found someone right away, she asked me not to do all these things and then I find out that she did all of those things and tried to hide it by lying about it. Im over being mad about it to be honest, it is what it is, but I just wanna understand why a person would ask their significant other not to do something but instead they do it themselves (i also asked her not to do these things). So genuinely can someone help me try to understand why someone would do that? I've been trying to give reason to why she did those things but I just can't. The only reasons I can think of is that I was not enough for her, or she did not find me attractive or lost interest at a certain point. And i just wanna see if its possible that there is another answer",True,False,False,dating,t5_2qhb1,879805,public,self,Trying to understand after a breakup.,0,[],1.0,https://www.reddit.com/r/dating/comments/oefd0x/trying_to_understand_after_a_breakup/,all_ads,6,,
19,[],False,AlexDangerGuy7,,[],,text,t2_blmphadm,False,False,[],False,False,1625516169,self.dating,https://www.reddit.com/r/dating/comments/oefe56/i_have_a_crush_on_my_best_friend/,{},oefe56,False,True,False,False,False,True,True,False,#ea0027,dating,"[{'e': 'text', 't': 'I Need Advice'}]",19ec58c2-9f74-11e7-81a1-0e2bf15991f0,I Need Advice,light,richtext,False,False,False,5,0,False,all_ads,/r/dating/comments/oefe56/i_have_a_crush_on_my_best_friend/,False,6,1625516180,1,"Hi. My [16M] name is Ryan. Back in April I reunited with an old friend of mine named Chloe [16F]. I hadn't seen her in person in over a year due to the pandemic. Me, her and some friends went to see a movie together. When my friend Daniel was handing out the tickets Chloe blurted out ""Im sitting by Ryan."" After the movie she hugged me and nobody else before she left with her dad. I think she likes me back but i there are also valid reasons as to why she wouldn't hug the others. I need help to work up the confidence to just tell her how I feel. The only problems is she is my best friend and I'm too afraid to loose her if she does feel the same way. I feel like things would become awkward. I just need the confidence to ask her out but i don't know how to work it up.

TL;DR: I have a crush on my best friend and am to afraid to ask her out.",True,False,False,dating,t5_2qhb1,879809,public,self,I have a crush on my best friend,0,[],1.0,https://www.reddit.com/r/dating/comments/oefe56/i_have_a_crush_on_my_best_friend/,all_ads,6,,
20,[],False,RexItaliae476,,[],,text,t2_zeg64,False,False,[],False,False,1625516229,self.dating,https://www.reddit.com/r/dating/comments/oefeus/how_can_i_understand_what_i_am_doing_wrong/,{},oefeus,False,True,False,False,False,True,True,False,#ea0027,dating,"[{'e': 'text', 't': 'I Need Advice'}]",19ec58c2-9f74-11e7-81a1-0e2bf15991f0,I Need Advice,light,richtext,False,False,True,9,0,False,all_ads,/r/dating/comments/oefeus/how_can_i_understand_what_i_am_doing_wrong/,False,6,1625516240,1,"Hey everyone! Hope you're doing well! So I (24M) have never been in a relationship, or kissed a girl. I like to think that I don't look monstrous. I am pretty overweight, but it doesn't show as much as my weight measurement would supposedly indicate.

Many people I know have expressed without prompting on my end that I am a fun, intelligent and kind person, the extent to which I believe them varies from day to day though. This lack of dating and intimacy has been affecting me negatively for years as I do not have any other source of affection in my day to day life. I have been living away from my family for the past 7 years.

I tried dating apps, and put my best foot forward, using pictures and writing my bio with the help of multiple people, but after weeks of trying I never managed to speak to anyone on those apps. 

I don't lack in confidence, at least in everything not related to women, but seeing the complete and utter lack of interest from women in anything beyond friendship is utterly demoralizing. As everybody around me is constantly slipping in and out of relationships, I can't help but compare myself to them and end up at least a little envious. I also maintain a decent social life and I have a hobby or two on the side.

Instead of placing the blame on others, I'd like to look inwards and see what part of that is manifesting outwards and keeping women uninterested.

What questions should I be asking myself? And thanks in advance for all the help!",True,False,False,dating,t5_2qhb1,879810,public,self,How can I understand what I am doing wrong?,0,[],1.0,https://www.reddit.com/r/dating/comments/oefeus/how_can_i_understand_what_i_am_doing_wrong/,all_ads,6,,
21,[],False,throwaway4566780,,[],,text,t2_bh9yc94l,False,False,[],False,False,1625516542,self.dating,https://www.reddit.com/r/dating/comments/oefilh/how_to_not_personalize_feeling_rejected_when_guys/,{},oefilh,False,True,False,False,False,True,True,False,#ea0027,dating,"[{'e': 'text', 't': 'I Need Advice'}]",19ec58c2-9f74-11e7-81a1-0e2bf15991f0,I Need Advice,light,richtext,False,False,False,29,0,False,all_ads,/r/dating/comments/oefilh/how_to_not_personalize_feeling_rejected_when_guys/,False,6,1625516553,1,"I think it might be related to my physical appearance.


I'm having this problem with my neighbor.

 I moved to my apartment a few months ago &amp; met my neighbor when he brought a package to me that went to his building instead of mine. a few days went by &amp; I saw him again coming home from work. I'm not exactly a social butterfly, &amp; I'm really nervous/shy. So I'm not big on small talk without getting uncomfortable fast. It's been months since this happened, but in, April I was taking some bags out my car &amp; saw him again. He asked if I needed help. I genuinely did not need help lol. He stayed by my car &amp; said ""I know I never asked but...do you have a man"" I said ""no, I don't"". Then he sadly replied ""We should chill sometime""


I ""chill"" all the time in the comfort of my own home, I'm good. That was what I said to him. 


I don't accept chill as a form of going or hanging out. It translates over to I just wanna hookup. So that was that. Few weeks go by, I see him here and there. Last few days I've been seeing him alot more than usual, either checking the mail, coming in the parking lot as he's taking his garbage out. Yesterday he came to my door. I opened it and he told me happy fourth. He asked if I'm watching the fireworks tonight and I said no. He asked what was I doing and I said I'm making bags &amp; finishing some sketches. He said ""do you need help?"" I said no, have a good night &amp; closed the door.



Idk why I feel bad but idk how to stop personalizing the behavior. I always see it as a red flag when a guy just wants to hang out instead of actually going out. And it's not just him, even with dating most of the time for me, the guy never wants to date, only Netflix and chill. I'm not dating or messing around right now. Trying to work on my self esteem and self worth. But I'm starting to think that I'm not physically attractive, &amp; men who only want to chill just want to sleep around and not actually take me seriously as anything other than someone to sleep with.


Idk if it counts for anything, but I am fat. I'm 5'4, 190, I usually have my hair braided or in an afro, I'm brown skin. I dress normally I guess you could say? Lol. I mostly wear graphic tees, jeans, leggings, when I work I wear scrubs. I'm not girly though. I don't skirts, heels, dresses etc, I was way lighter last year, I gained alot of weight during covid. Guys NEVER approach me in person, and it's been taking a toll on my self esteem. Why am I only good enough to chill with, what's wrong with me? I'm very kept to myself, I mostly go to work and go home. I started eating cleaner and started going to the gym last month, I haven't yet saw any results, but it still makes me really sad to know that he just wants to see me in a chill setting and not a dating setting. He's never even asked for my number. Is it because I'm not pretty enough to date? I'm really wondering. 


Most of the time I feel like the female that guys just wanna sleep with, not the female that guys wanna date and take seriously. But after deciding to focus on just work and my mental/emotional health, I haven't been dating. I deleted all my socials including the dating profiles. I just feel so cheap and not good enough when I'm only viewed as the woman to sleep with. I don't think it's my vibe or I give off any weird energy. I'm pretty soft spoken, really bubbly, kept to myself etc. How do I stop feeling like I'm the problem? I know it's not personal, but when it happens repeatedly it feels as if it is. Thanks.",True,False,False,dating,t5_2qhb1,879818,public,self,"How to not personalize feeling rejected when guys just want to ""chill"" instead of actually going out? (I'm the female)",0,[],1.0,https://www.reddit.com/r/dating/comments/oefilh/how_to_not_personalize_feeling_rejected_when_guys/,all_ads,6,,
22,[],False,FarUnderstanding1356,,[],,text,t2_7v07v6m0,False,False,[],False,False,1625516614,self.dating,https://www.reddit.com/r/dating/comments/oefjet/when_did_you_start_facetiming_a_guy_youre_talking/,{},oefjet,False,True,False,False,False,True,True,False,#ea0027,dating,"[{'e': 'text', 't': 'I Need Advice'}]",19ec58c2-9f74-11e7-81a1-0e2bf15991f0,I Need Advice,light,richtext,False,False,False,4,0,False,all_ads,/r/dating/comments/oefjet/when_did_you_start_facetiming_a_guy_youre_talking/,False,6,1625516625,1,"Immediately after the first date? Second? Was he the one to ask you about it? And was it kind of interview-y, or just a natural conversation?

Background: I (22F) have been consistently talking to this guy (26M) for about 3 weeks now. We text and snap pretty consistently and went on our first date a little over a week ago. Haven’t made solid plans for a second date yet since I just got back from a trip, but we’re both expecting to see each other again soon. I’m also kinda shy and the thought of FaceTiming a guy I’m interested in makes me nervous, but I want to start getting out of only texting.

Let me know your thoughts + tips + experiences!",True,False,False,dating,t5_2qhb1,879822,public,self,When did you start FaceTiming a guy you’re talking to/seeing?,0,[],1.0,https://www.reddit.com/r/dating/comments/oefjet/when_did_you_start_facetiming_a_guy_youre_talking/,all_ads,6,,
23,[],False,DullAdeptness710,,[],,text,t2_7u1drsbv,False,False,[],False,False,1625516921,self.dating,https://www.reddit.com/r/dating/comments/oefmvy/ons_fwb_with_my_ex/,{},oefmvy,False,True,False,False,False,True,True,False,#ff4500,dating,"[{'e': 'text', 't': 'Question'}]",a9531dce-194e-11e5-b177-0eff099c3d1f,Question,light,richtext,False,False,True,2,0,False,all_ads,/r/dating/comments/oefmvy/ons_fwb_with_my_ex/,False,6,1625516933,1,"So I started hooking up with my ex girlfriend after 7-8 years. She had a lot of sex and got out of a 3y relationship after a year or so. I played around and had several ONS but nothing special. 

I wrote her to hook up and she quickly replied on IG with yes. We wrote a little bit not much, mainly because of me. And hooked up.

We first started to chill on the couch and ate something, also we pretended to watch some movies. First one was boring, but thanks to that we cuddled, got a little bit closer and ended up in bed at the second movie. We cuddled and had sex the hole night in bed. I did teach her something she didn’t know that she like and she me also. We both wanted just sex. We made that clear at the beginning. But we also talked about everything. - Really everything what happened in the last years, talked about my ONS partners, her relationship and a lot of other things (friends, family, ..).

The next morning we smoked one together and drank a coffee then she went home. Currently we’re writing.

I don’t want to give her the wrong signals to get together in a relationship, but I have nothing against FWB. How can I turn this in something like FWB or know if she’s ok with that? 25M.",True,False,False,dating,t5_2qhb1,879827,public,self,"ONS, FWB with my ex",0,[],1.0,https://www.reddit.com/r/dating/comments/oefmvy/ons_fwb_with_my_ex/,all_ads,6,,
24,[],False,mr-mewing,,[],,text,t2_2y1morgy,False,False,[],False,False,1625517188,self.dating,https://www.reddit.com/r/dating/comments/oefpxh/i_asked_a_girl_out_but_and_she_said_yes_but_after/,{},oefpxh,False,True,False,False,False,True,True,False,#ea0027,dating,"[{'e': 'text', 't': 'I Need Advice'}]",19ec58c2-9f74-11e7-81a1-0e2bf15991f0,I Need Advice,light,richtext,False,False,False,10,0,False,all_ads,/r/dating/comments/oefpxh/i_asked_a_girl_out_but_and_she_said_yes_but_after/,False,6,1625517199,1,"so I've been meeting up with a very shy girl I've been walking with her for hours now and we kissed a few times and she started to be a little flirty at some point.

but yesterday she sends a huge message that she was scared to push me away and to hurt my feelings and that she founded it hard to be open about her feelings. after that I said that she doesn't need to be scared to push me away and the days after she texted my a lot more than often but when we met again for a walk she seemed less interested than usual we still kissed and cuddled after that I asked her out where she responded with a clear yes!.

The day after I asked when she had time, but she responded with a huge response with that It would be better to go out another time because it was the first time she came in this kind of situation and she doesn't know what to do with it.. but she was willing to find it out further because she founds my a  very nice and funny guy, but she didn't have feelings for my for now 

so she thought it was too early to go out with me but she still wanted to date me further.

&amp;#x200B;

but my question is do girls can get feelings for a guy after some time or should it be more instance?",True,False,False,dating,t5_2qhb1,879837,public,self,I asked a girl out but and she said yes but after a day she said she wasn't ready for it,0,[],1.0,https://www.reddit.com/r/dating/comments/oefpxh/i_asked_a_girl_out_but_and_she_said_yes_but_after/,all_ads,6,,
25,[],False,HotBoy386,,[],,text,t2_d4mpb2vz,False,False,[],False,False,1625517320,self.dating,https://www.reddit.com/r/dating/comments/oefrez/lets_have_a_good_time/,{},oefrez,False,False,False,False,False,False,True,False,#46d160,,"[{'e': 'text', 't': 'Success!'}]",6b44dc18-cc88-11eb-95f2-0ed00be16b15,Success!,dark,richtext,False,False,True,0,0,False,all_ads,/r/dating/comments/oefrez/lets_have_a_good_time/,False,6,1625517331,1,[removed],True,False,False,dating,t5_2qhb1,879844,public,self,Let’s have a good time,0,[],1.0,https://www.reddit.com/r/dating/comments/oefrez/lets_have_a_good_time/,all_ads,6,moderator,
26,[],False,steadycallingmyphone,,[],,text,t2_abofztwg,False,False,[],False,False,1625517415,self.dating,https://www.reddit.com/r/dating/comments/oefsj7/if_she_likes_you_she_will_make_time_and_effort/,{},oefsj7,False,True,False,False,False,True,True,False,#878a8c,dating,"[{'e': 'text', 't': 'Venting'}]",a616c322-194e-11e5-ab91-0ed1c06bdad7,Venting,light,richtext,False,False,False,7,0,False,all_ads,/r/dating/comments/oefsj7/if_she_likes_you_she_will_make_time_and_effort/,False,6,1625517426,1,"Last night all of my friends were busy, So I met up with this flakey girl who I been talking to since November who asked me to hangout because her friend ditch on their plans to go on a date. I always have to go her area when we usually meet because she claims she has no time to be traveling that far to see me. But last night we met somewhere halfway at a park to watch the fireworks. I always end the night with blue balls because we heavily makeup and feel on each other but nothing happens. We have only had sex one time back in March at my apartment the only time she has come over to me. Anyways she was telling me how she doesn’t like the new guy her friend is talking to because he plays hard to get and she doesn’t like that her friend always goes to see him which is a two hour drive and he never comes to her. Even though at this point I have no expectations with this girl I just hangout with her because I had no other plans, when she told me that I stood quite for a few seconds because she always telling me how her and friend have no time to date because they are always busy with nursing school and are broke",True,False,False,dating,t5_2qhb1,879844,public,self,If she likes you she will make time and effort,0,[],1.0,https://www.reddit.com/r/dating/comments/oefsj7/if_she_likes_you_she_will_make_time_and_effort/,all_ads,6,,
27,[],False,HotBoy386,,[],,text,t2_d4mpb2vz,False,False,[],False,False,1625517501,self.dating,https://www.reddit.com/r/dating/comments/oeftif/central_florida_looking_for_fun/,{},oeftif,False,False,False,False,False,False,True,False,#ff4500,dating,"[{'e': 'text', 't': 'Question'}]",a9531dce-194e-11e5-b177-0eff099c3d1f,Question,light,richtext,False,False,True,0,0,False,all_ads,/r/dating/comments/oeftif/central_florida_looking_for_fun/,False,6,1625517512,1,[removed],True,False,False,dating,t5_2qhb1,879847,public,self,Central Florida looking for fun,0,[],1.0,https://www.reddit.com/r/dating/comments/oeftif/central_florida_looking_for_fun/,all_ads,6,moderator,
28,[],False,Hi_babyy,,[],,text,t2_d019ii7m,False,False,[],False,False,1625517796,self.dating,https://www.reddit.com/r/dating/comments/oefwxz/_/,{},oefwxz,False,False,False,False,False,False,True,False,#ea0027,dating,"[{'e': 'text', 't': 'I Need Advice'}]",19ec58c2-9f74-11e7-81a1-0e2bf15991f0,I Need Advice,light,richtext,False,False,True,2,0,False,all_ads,/r/dating/comments/oefwxz/_/,False,6,1625517807,1,[removed],True,False,False,dating,t5_2qhb1,879852,public,self,🥺,0,[],1.0,https://www.reddit.com/r/dating/comments/oefwxz/_/,all_ads,6,moderator,
29,[],False,Hi_babyy,,[],,text,t2_d019ii7m,False,False,[],False,False,1625517901,self.dating,https://www.reddit.com/r/dating/comments/oefy4l/send_something_to_make_a_sad_girl_happy/,{},oefy4l,False,False,False,False,False,False,True,False,#ea0027,dating,"[{'e': 'text', 't': 'I Need Advice'}]",19ec58c2-9f74-11e7-81a1-0e2bf15991f0,I Need Advice,light,richtext,False,False,True,2,0,False,all_ads,/r/dating/comments/oefy4l/send_something_to_make_a_sad_girl_happy/,False,6,1625517911,1,[removed],True,False,False,dating,t5_2qhb1,879856,public,self,"Send something to make a sad girl, happy",0,[],1.0,https://www.reddit.com/r/dating/comments/oefy4l/send_something_to_make_a_sad_girl_happy/,all_ads,6,moderator,
30,[],False,Professional-Sadness,,[],,text,t2_cgwya5ti,False,False,[],False,False,1625517942,self.dating,https://www.reddit.com/r/dating/comments/oefylx/ive_never_dated_someone_outside_of_dating_apps/,{},oefylx,False,True,False,False,False,True,True,False,#ea0027,dating,"[{'e': 'text', 't': 'I Need Advice'}]",19ec58c2-9f74-11e7-81a1-0e2bf15991f0,I Need Advice,light,richtext,False,False,True,17,0,False,all_ads,/r/dating/comments/oefylx/ive_never_dated_someone_outside_of_dating_apps/,False,6,1625517953,1,"(25M) The only girlfriends or hookups I had were only from Tinder and they never were really meaningful in the sense that we shared almost nothing. I feel like girls I meet IRL all have a boyfriend, and yet they are the most interesting and the ones I have a lot in common with.  
I'm single since 2019 and this is getting kinda hard lately. I feel really alone even though I have a hookup I see once a week. I need to  share more than sex with someone.

 I'm not really sure if it's the good subreddit to post this on but I kinda needed to get this out of my chest. Maybe you guys have some answers or advice to go through this.",True,False,False,dating,t5_2qhb1,879856,public,self,I've never dated someone outside of dating apps,0,[],1.0,https://www.reddit.com/r/dating/comments/oefylx/ive_never_dated_someone_outside_of_dating_apps/,all_ads,6,,
