,id,created_utc,title,selftext,subreddit,subreddit_id,url
31,of8w4e,1625621541,"She thought I must be gay because I'm hygienic. 100% serious question, is the average guy really that terrible?","So I met this girl at the gym Lucy (fake name) and we went out and dated for about a week before I had to move recently. Honestly wonderful experience sweetest girl I've ever dated. Smart, cute, sweet, honestly basically a dream come true, a welcome experience and change of pace from my usual nightmare dates (check my past posts about my last ltr).

So I mentioned too her (amongst the countless things we talked about) that my last gf thought I was bi when she first met me. I thought this was weird as I'm 100% straight, and wasn't really sure why she thought that. Lucy said that she herself thought I was either bi or gay at first. I asked why and she said because I was clean, didn't stink, didn't have holes in my clothes, was nice and respectful, and listened to her. 

...Is the bar really that low? I know I've had lot's women tell me about shitty guys but... really... is it that bad? Is being clean and not being a dick really so abnormal in the average heterosexual guy that the first thought is he must be gay or bi? 

I legitimately want to know, is it that bad out there?",dating,t5_2qhb1,https://www.reddit.com/r/dating/comments/of8w4e/she_thought_i_must_be_gay_because_im_hygienic_100/
32,of8xvs,1625621724,Am I being ghosted?,"Went on two dates with a girl. I think they went well, but no great opportunity to kiss. Wanted to set up a future date so sent a text to open the dialogue a day after our second date. The text referred to a joke we had been talking about in our second date. She didn’t respond.

Have I been ghosted? Should I try to revive it? I’m leaning towards moving on and maybe I’ll get lucky and she messages me.

If I was into a girl, I would never not respond to a text. So I assume the same for her. The text didn’t have a question, but a simple “lol” or “haha” or “that’s funny” would be the bare minimum. My only hesitation is that sometimes girls, IME, are bad texters (probably due to having a plethora of suitors). I have been able to revive a small percentage of these situations tho. 

I guess I’m just scared to get the full ghost by not getting a response to the second (double) text.",dating,t5_2qhb1,https://www.reddit.com/r/dating/comments/of8xvs/am_i_being_ghosted/
33,of8zzm,1625621939,The League waitlist,"I know the waitlist for the League is a process but I logged in this morning and was showing as number 110,000 on the waitlist and now it’s showing I’m number 1 on the waitlist. Is there some glitch going on at the moment? Almost seems too good to be true. And the “concierge” is clearly just copy and pasting messages and not actually reading them.",dating,t5_2qhb1,https://www.reddit.com/r/dating/comments/of8zzm/the_league_waitlist/
34,of90ef,1625621982,What are the best ways to start a conversation with a girl through text?,"This is the first time I've really had the chance to talk to someone, and I don't want to make it awkward and mess it up.",dating,t5_2qhb1,https://www.reddit.com/r/dating/comments/of90ef/what_are_the_best_ways_to_start_a_conversation/
35,of92eg,1625622193,Online dating apps? Shadowbanned?,"Am I shadowbanned on these dating apps?

I have made multiple in a row because I thought it was messed up because I didn’t have any matched and it’s usually 40-50 on bumble in about 30mins of making the app and about 3-4 on hinge.. so getting 2-3 matches on bumble and nothing on hinge in hours doesn’t seem correct.. not a flex, mainly saying that there’s something wrong. how long should I wait before making another new account to see if the algorithm didn’t shadowban my account again? 2-3 weeks? What do you guys recommend I do?

Tl;dr online dating app shadow bans",dating,t5_2qhb1,https://www.reddit.com/r/dating/comments/of92eg/online_dating_apps_shadowbanned/
36,of93el,1625622298,Asking guys what relationship they’re seeking,"Hi, am new-ish to dating apps! Have had them for like a week now, with hinge being my primary.

I’ve realized (maybe a tad too late) that while texting/small-talking with my matches, that I forgot to ask them what their relationship goals were. 

Would it be too weird/awkward to ask them now, point blank, or should I wait until there’s a better point during our convo to ask? 

I don’t want to waste their time if it turns out they want something different. I personally am seeking something a bit more than casual. Would appreciate any advice! 

Tyia :)",dating,t5_2qhb1,https://www.reddit.com/r/dating/comments/of93el/asking_guys_what_relationship_theyre_seeking/
37,of94oi,1625622430,Should I just accept rejection?,[removed],dating,t5_2qhb1,https://www.reddit.com/r/dating/comments/of94oi/should_i_just_accept_rejection/
38,of97dh,1625622699,"Girls how many dates with guys do you go out in a week,,?",Don't be shy. No one will judge. Well no one can see your face so you're good. I'm only curious,dating,t5_2qhb1,https://www.reddit.com/r/dating/comments/of97dh/girls_how_many_dates_with_guys_do_you_go_out_in_a/
39,of98ho,1625622817,Not in a good place,"I’m focusing on myself and not actively looking for a relationship but idk I’m just mentally tired. I wish I could meet a woman and it was a gradual relationship of being friends then dating and being with each other, it’s so hard. I feel like the older I get the more I realize that nice guys get overlooked or we’re ignored. I wish I had the life I wanted and not the one I had. I want someone to be with right now not out desperation or to “save me” but to be with.",dating,t5_2qhb1,https://www.reddit.com/r/dating/comments/of98ho/not_in_a_good_place/
40,of9afn,1625623022,So much of dating involves drinking it kinda sucks.,"I’m not an amateur when it comes to weekend drinking. But, there is a point in which you want to cut down or focus on fitness. 

It’s hard to date when you don’t drink. Many people my age want to go for a drink. Or, they want to do food and drinks.",dating,t5_2qhb1,https://www.reddit.com/r/dating/comments/of9afn/so_much_of_dating_involves_drinking_it_kinda_sucks/
41,of9b1j,1625623088,Tonight’s date,[removed],dating,t5_2qhb1,https://www.reddit.com/r/dating/comments/of9b1j/tonights_date/
42,of9e78,1625623387,Second date,"Tonight’s date

Had a second date tonight, the first one went okay and I was indifferent about the girl. Second one went a lot better and we were vibing well. As we were walking out she said “let’s go out again” and we started talking about when we were free. When I was about to leave I went in for the kiss and she gave me the cheek….first time that’s happened hahah. Called her when I got home to make sure she got back and we talked for a few minutes and I said “starting to like you” (ya stupid I know). Trying to figure out what my next move is 😂",dating,t5_2qhb1,https://www.reddit.com/r/dating/comments/of9e78/second_date/
43,of9i6b,1625623794,Does anyone 12 years old?,[removed],dating,t5_2qhb1,https://www.reddit.com/r/dating/comments/of9i6b/does_anyone_12_years_old/
44,of9ix5,1625623867,Why do I only seem to date guys who can't get their crap together?,"""Get your crap together"" means hold a steady job, be able to afford rent/mortgage, have their own transportation, have their own place to live.

I am 30 now, and I wish I understood why I go for guys like this. I have always had a job, I've always paid rent for my own place, I have my own car.

Boyfriend when I was 23: he didn't have a job most of the time, didn't have a car, lived with his parents.

Boyfriend #2: had a job and paid rent, but no car.

Boyfriend #3: he had a car but no job, played poker for money. Lived with his mom.

Boyfriend #4: had a job making really good money. Had a car. Did not have his own place to live, was going through a divorce.

Boyfriend #5: has a car, no steady job due to health problems, lives with parents.

Do I attract these guys, or do I seek them out? I have no clue.

I would like to get married one day but I can't marry someone who doesn't have their act together as an adult.",dating,t5_2qhb1,https://www.reddit.com/r/dating/comments/of9ix5/why_do_i_only_seem_to_date_guys_who_cant_get/
45,of9jt1,1625623961,Why do breakups have to hurt so damn bad??,"I’ve recently broken things off w my gf (my first gay relationship) after 8 months as I was feeling a bit suffocated in the relationship and couldn’t keep up with the time commitment, wanted to be more involved in community and was feeling the urge to want less bounds and our arguments were taking more energy than I felt worth it. We decided to end it civilly but we both love and care about each other soo much. We’re still friends and plan on potentially “easing back into things” if life allows. I feel much freer no longer being in the bounds of a relationship, but I miss her terribly…Why does this have to suck so badly??",dating,t5_2qhb1,https://www.reddit.com/r/dating/comments/of9jt1/why_do_breakups_have_to_hurt_so_damn_bad/
46,of9ju6,1625623964,after a bad relationship and too much cheating i can say im fully healed☺️☺️☺️,lots of things i learn.. that will help me improve better im now focus on doing charity works and community pantries,dating,t5_2qhb1,https://www.reddit.com/r/dating/comments/of9ju6/after_a_bad_relationship_and_too_much_cheating_i/
47,of9k2z,1625623986,My bitch of an ex who broke my heart got married to her best friend recently who she said she didn't find sexually attracted to at all and the feeling was mutual.,[removed],dating,t5_2qhb1,https://www.reddit.com/r/dating/comments/of9k2z/my_bitch_of_an_ex_who_broke_my_heart_got_married/
48,of9k5f,1625623993,Women and dating tribes. I think I am done going after the wrong ones.,"Ok so I have been on the dating game since forever and I have come to the conclusion that there are certain tribes that women belong to(and men too). I live in Canada and from my experience the traditional Canadian women on average will not accept easily a guy that looks like he does not belong to his tribe(if you're ethnic ... you don't match). Like for women attraction is mostly social and if you don't belong to her tribe ... you won't get in easily. Of course if you're hyper social and a master talker with a zillion friends, you probably will get in. But that's not me and not many people most likely lol.

Like I've recently been matching with a lot of foreign women and it's amazing how open they are. Like first they match with me then we talk and there is no bs like a banter and stuff. Of course we tease each others and have fun. But it feels so much more fluid. Also the women from my ethnicity seem to be more reserved and submissive. Like here in Canada the ladies seem to have a zillion other dudes looping around them on Instagram and I just feel like a number to them. They don't seem to be looking for anything serious too. Of course not everyone is the same but I have been on dating apps for 10 years and I'm seeing a trend here.

All that to say, I think I'm done going after the traditional Canadian lady. I think I'm going to look at foreigners.",dating,t5_2qhb1,https://www.reddit.com/r/dating/comments/of9k5f/women_and_dating_tribes_i_think_i_am_done_going/
49,of9lno,1625624145,"How Much I Loved Dating, And Am Thinking I'd Love To Be A Matchmaker","Before I met my STBXW, I (52M) loved to date. 

This was in the early 1990s, before OLD, and dating for the most part was organic. But how much fun I had meeting new people and going out on dates. I worked in a nightclub and although I was not every person's type (e.g. I was not super tall or super buff or a bad boy, so to speak) I had a fresh-faced look to me that combined (working in a club plus okay looking) made it so I never had a shortage of dating opportunities. And how much I loved to date back then. I'm heterosexual (note: also a firm supporter of LGBTQ) and dated a wide range of ages and types of girls because I loved just going out, hearing their stories, and feeling that rush of getting to know someone I was attracted to\*

Then I met my STBXW, and was faithful to her for an our entire relationship so put all dating aside, but then after she ended our marriage last year I entered the dating pool again (this time utilizing OLD). What I learned is that at 52 I had not changed a bit since I was in my early 20s -- I still loved to date, still enjoyed getting to know people on an intimate level, was comfortable dating all types of women, and didn't have  issues finding people to date (OMG I love OLD). 

I had no intentions of settling down again, but then I met a magical person, and with zero reservations then or now have focused exclusively on her (53HLF). But I do miss the magic of dating, of getting to know new people on their best behavior (note: I love interviewing for jobs and interviewing potential employees for this very same reason!). 

So my point of all this is this: I'm wondering if I'd like being a matchmaker. And if people use matchmakers. And if so what their experiences were. And how they found them. And what words of wisdom any one reading this might have. What I imagine is interviewing potential men and women daters, getting to know their stories and interests/goals, then trying to find a match for them, charging a reasonable rate (and not some exorbitant fat fee that some services charge) while also providing feedback when applicable. 

My current SO, who is so kind and loving and sexual and balanced and who knows me so very well, has said I'd love being a matchmaker and that I'd be good at it. And she likes to joke that I am a human anthropologist, since I love meeting people and hearing their stories so much (I'm that person you find yourself dumping your life's story to at a coffee shop or hotel bar or on an airplane, and at the end of the conversation we part ways and you realize you dumped your story on someone without knowing who they are and realizing you'll never see them again :) ). And all of this is one of the reasons I drive Lyft/Uber on the side and I volunteer at various organizations on the weekends -- I enjoy talking to people.

Anyway, sorry for the long post. And I am very grateful for any thoughts/wisdom that you have. Maybe it's a crazy pipe dream I have, and that's okay to say, too. 

Thank you!!

NOTES

(\*) I was never interested in hookups. I love PDA and monogamous sex, and was a promiscuous kisser on dates, but the main excitement for me was the dating, and I was selective when it came to actual PiV/sex :)",dating,t5_2qhb1,https://www.reddit.com/r/dating/comments/of9lno/how_much_i_loved_dating_and_am_thinking_id_love/
50,of9ltd,1625624160,Sad and looking for love,[removed],dating,t5_2qhb1,https://www.reddit.com/r/dating/comments/of9ltd/sad_and_looking_for_love/
51,of9mpy,1625624253,I’m sad and alone,"I’m really sad right now, honey. I need someone who can make me happy. I’ll promise to do my best to keep you happy too, baby.",dating,t5_2qhb1,https://www.reddit.com/r/dating/comments/of9mpy/im_sad_and_alone/
52,of9noq,1625624349,Does it seem like he likes me? How can I let him down easy?,"

 I am a girl and me and my friend are both in our 20’s. I’m starting to feel that he is starting to like me. We have known each other for a couple of years but we only started hanging out recently. There was a point where we would spend hours on the phone together at night but i realized that we shouldn’t do that if we’re not in a relationship because i feel that it isn’t appropriate. After the first time we hung out he expressed that he would like to hang out more often because he enjoys my company. We hung out once more  but something that I noticed is that I don’t feel comfortable around him. I have no idea why this is though. I feel uneasy and I’m constantly thinking of things that we could talk about. I usually make up some excuse if he wants to hang out because I don’t want him to start liking me and then have that awkward conversation. I could be wrong about him liking me but he has told me that he doesn’t view dating as dating. He sees dating as hanging out with someone until someone wants the relationship to progress. So part of me started thinking that maybe he is hoping for that with our relationship? If we’re out together at church for example he would introduce me to all of the people that is important to him. He even invited me to a family party but I did not go because if they see him with a girl they’re going to assume that there’s something going on and I don’t want to give him or them the wrong idea.
Just a few more random things I want to add:
-If he expresses that he wants to hang out and I mention that I am hanging out with another friend he would say something like, “oh I thought we were going to hang out.”",dating,t5_2qhb1,https://www.reddit.com/r/dating/comments/of9noq/does_it_seem_like_he_likes_me_how_can_i_let_him/
53,of9num,1625624365,Am I overreacting - how do I manage disappointment?,"For the past few weeks, I’ve been speaking with this guy online (met on tinder). We spoke constantly, everyday. I would say we get along extremely well, he’s always encouraging conversation if this is any indicator. He’s expressed attraction to me and so on. About two days ago he shared with me that he went on a date - I have absolutely no problem with this as I have gone on dates as well. However, I’m a bit disappointed as he never expressed a desire to actually meet with me. We live quite close to one another so I can’t say that could be the reason. 

Honestly I never brought it up, however as he has always been the one pursuing me so I assumed he would at some point. So I’ve greatly reduced the amount of time I spend talking to him because I feel as though I am wasting my time. He has continued to try to talk but honestly I’m not feeling it anymore because it seems like it is going no where to me - no point in talking online all day with what seems to be no desire to meet - so I rarely respond.

Is this the wrong way to go? Should I hold out longer and see if he ever brings it up or just move on? Thanks.",dating,t5_2qhb1,https://www.reddit.com/r/dating/comments/of9num/am_i_overreacting_how_do_i_manage_disappointment/
54,of9otp,1625624458,Something a therapist told me,"I was in a relationship for 7 years with a pretty great guy. 
Over time all these little moments had added up to a huge Mountain of pain and problems. 
Women and men ( in my opinion) tend to have very different roles in a relationship. When my partner and I were living together it felt like I was caring for a child. I was carrying the burden of responsibility. Everything from house chores, groceries, laundry, bills, cleaning, pet care. 
At first it wasn’t a big deal but over time I began asking for help. I communicated the weight I felt and resentment I was building in always feeling like the “adult”. 
Daily my partner would let me down. 
I would ask for help every day, beg for help. 
We decided to see a therapist because the stress was feeding into my depression and bleeding into so much of my life, even now after two years single I still feel anger and fear about being with someone for this reason. 
A therapist told us that as a women I would always carry this load. I would always be “nesting” and my counterpart would likely always need guidance. She asked if making him lists and him completing those tasks would help me and I told her no. No because it’s just ONE more fucking thing I have to do. 
I DONT want to generalize… but I feel like men will never get it. I’m sure there’s men out there that take care of a home wonderfully… but I can’t find them. 
Has anyone experienced this and been able to happily cohabitate?",dating,t5_2qhb1,https://www.reddit.com/r/dating/comments/of9otp/something_a_therapist_told_me/
55,of9pgs,1625624526,Is she interested in dating me?,"matched with a girl about a month ago whom ive known of for a few years within our local rock climbing community. Have mutual friends but had never actually met each other. I am very blown away that we've connected!

We have caught up 2 times on our own and a few more times with mutual friends. Half of the catch ups we've had she has initiated with me.

Anyway, today we caught up for the second time to go climbing (just us two) after msging most the day. Its a good vibe, both pushing and encouraging each others climbing, and just general chatting with slight flirtation.

She is very busy and would have about 30 other people she could climb and do things with and that would be stoked to have time with her, but she has given me her saturday again and weve locked in a plan to catch up for the day (its currently Tuesday)

I feel this girl is way out of my league, though I am highly self critical.

Does this sound like she is atleast slightly interested in dating or something more than just friends?

Thanks!",dating,t5_2qhb1,https://www.reddit.com/r/dating/comments/of9pgs/is_she_interested_in_dating_me/
56,of9qcn,1625624612,Should I wish her mom happy bday even though I have never met her and she doesn’t know about me?,She left open a conversation we were having last night on snap when I answered her this morning and today she send me a snap and I asked her a question about it and she left me on open again. I know tomorrow she going to send me a snap about her mom because it’s her moms birthday. She always tells me about her mom how similar she is to my mom but her mom doesn’t know about me and she told me to my mom about her. Last guy she was seeing she told me that she told her mom about him right away. Would I be rude if I ignore her and don’t say nothing about her mom bday? It’s just annoying that she has a tendency sometimes of ignoring me and talk to me the next day about something totally different  Like last saturday send her snap of what I was eating and she didn’t respond but then the next day she text talking about something else. Even though she gets mad when I ignore her,dating,t5_2qhb1,https://www.reddit.com/r/dating/comments/of9qcn/should_i_wish_her_mom_happy_bday_even_though_i/
57,of9r62,1625624690,Couldn’t get my dick hard,So today I went to this girls house and me and her have been talking for a while and have been flitting a lot but today when I went over we really hit it off and we ending up having sex at least we kinda did When she was sucking my dick I couldn’t get hard even when she stroked it I would get a little hard then when she was ready for me to put it in I went soft again and then we ending up stopping and idk if this is normal I’m 17 and my friends think I lost my virginity and they are celebrating that I did but I didn’t. And now I’m scared she’s gonna tell people what happened and I’m gonna be fucked up in my head. Any advice,dating,t5_2qhb1,https://www.reddit.com/r/dating/comments/of9r62/couldnt_get_my_dick_hard/
58,of9uk4,1625625037,How often should you text someone who is noncommittal on scheduling a date,"I reached out to someone to schedule a second date. they indicated they might be free on Sunday, because the class they are taking is coming to an end at the end of the week, but they also have some family stuff this weekend so they arent sure.

Obviously this isnt the most encouraging answer and could just be a blow off, but it also lines up with what we were talking about on our first date (in terms of a class and homework taking up a lot of her time) so im willing to not write it off yet. My question is if I should text much between now and then? or just let it sit until Friday or Saturday and touch base then? I generally worry about texting too much or not enough because im naturally someone who rarely texts people",dating,t5_2qhb1,https://www.reddit.com/r/dating/comments/of9uk4/how_often_should_you_text_someone_who_is/
59,of9ur8,1625625058,Single again after 8 years being married... What now?,"It's a simple but at same time a complex question. 
I married in a time where the society and people interacted in a broad different way from now, so, i am still a very passionated e emotion-sided people.

How do find my place in this new terms world?

ps. Im 25 y.o. and getting old faster.",dating,t5_2qhb1,https://www.reddit.com/r/dating/comments/of9ur8/single_again_after_8_years_being_married_what_now/
60,of9x04,1625625287,Dated a guy for the first time in 3 years...welp forgot how much i hate it.,"Dated and was seeing this guy for some time...for background I am F26 he is M29. Was going really good, I was happy, he seemed happy. He asked me last night about getting more serious. 

Welp, my bad guys. He texts tonight saying ""I don't think we should talk anymore, you're going too fast."" Well you're the one who asked about getting serious, having sex, asking me to stay over your condo almost every night, meeting your friends, etc., not me dude. 

My bad. I tried. Forgot how much i hate this process, never works out. Going to go in my box again and not come out.",dating,t5_2qhb1,https://www.reddit.com/r/dating/comments/of9x04/dated_a_guy_for_the_first_time_in_3_yearswelp/
61,ofa1eq,1625625744,"Men, don't let them tell you otherwise. Erectile Dysfunction is a deal breaker for most women.",[removed],dating,t5_2qhb1,https://www.reddit.com/r/dating/comments/ofa1eq/men_dont_let_them_tell_you_otherwise_erectile/
