,id,created_utc,title,selftext,subreddit,subreddit_id,url
40,ppxobj,1631875007,The last few girls I went on dates with had a similar problem.,"After a long relationship, I decided to try dating again. 

I met the chicks through tinder, which I am not a fan of. 

Usually we go on walks, and have long conversations. I like to get to know people :) to see what makes them unique.

The last few girls however, brought a certain expectation with them. I felt like I was supposed to entertain them. Like they were the price and I had to work hard to get it.
In these moments I always wondered, why am I not the price? 
I am educated, work out and and have no financial stress. 
My ex said that I am a total catch, and if our life goals would be similar it could have worked out. 

Shouldn’t men and women equally try to prove themselves to be a fit for the the person they date?",dating,t5_2qhb1,https://www.reddit.com/r/dating/comments/ppxobj/the_last_few_girls_i_went_on_dates_with_had_a/
41,ppxotc,1631875077,Starting to struggle with sexual chemistry,"Our honeymoon period was shortlived I'd say, never had that whole, constantly sleeping together ripping each others clothes off etc, just got very comfortable with each other very quickly and thats due to us both working alot. 

Weve been away with each other, had loads of fun, have loads in common but when it comes to sex, it's very vanilla and doesn't happen all that often.

I'd say we maybe have sex on average once every 2 weeks. And even then, I always go down on her and initiate. The foreplay isn't reciprocated (which is okay, there is a reason behind it) but I need something, lingerie, for it to be initiated for once, anything! It's really becoming a struggle and it's making me turn back to watching porn again because it's that few and far between when we do.

We were even away for a special occasion a few weekends ago and didn't even have sex then. It's just seems she isn't that interested in me.

Its putting a strain on my feelings because we're both still young and I find her very attractive and have a high libido. I'm just being left frustrated often.

Weve been together about 7 months now and we've already had the sex talk once previously. I just don't know what to do.",dating,t5_2qhb1,https://www.reddit.com/r/dating/comments/ppxotc/starting_to_struggle_with_sexual_chemistry/
42,ppxu4q,1631875797,different communication style,[removed],dating,t5_2qhb1,https://www.reddit.com/r/dating/comments/ppxu4q/different_communication_style/
43,ppxu8k,1631875812,What is the consensus on selfies with cats on a dating profile for a 36/m…..?,[removed],dating,t5_2qhb1,https://www.reddit.com/r/dating/comments/ppxu8k/what_is_the_consensus_on_selfies_with_cats_on_a/
44,ppxud1,1631875828,I’m down to fuck text me on Kik ( cynthiapowell12) I’m available for hook up,[removed],dating,t5_2qhb1,https://www.reddit.com/r/dating/comments/ppxud1/im_down_to_fuck_text_me_on_kik_cynthiapowell12_im/
45,ppxyhy,1631876372,What is the consensus on a selfie with a cat on a dating profile for a 36/m………?,"Just wondering. I’ve had my little guy since 5ish weeks, is now 7 years old and is basically attached at the hip to me. Is one of the most cuddly and friendly kittehs you’d ever meet. When he was young I made sure to give him special attention and to hold him quite a lot so he’d be more likely to be fond of people.

It just seems like there is a real stigma against guys who own a cat and somehow it’s taboo and that if they post a pic with theirs, much less even own one they are automatically seen as weak beta males. Not even sure why. I wouldn’t ask this if I hadnt seen it on many girls profiles where they “can’t do guys with cats.” 

So I guess it’s almost forbidden to even admit you own a cat, if youre a guy. 

Personally, the girls who have appreciated that over the years have seemed to be just a different kind of type. A really good type.

Thoughts….?",dating,t5_2qhb1,https://www.reddit.com/r/dating/comments/ppxyhy/what_is_the_consensus_on_a_selfie_with_a_cat_on_a/
46,ppy1lj,1631876719,making up after fight,[removed],dating,t5_2qhb1,https://www.reddit.com/r/dating/comments/ppy1lj/making_up_after_fight/
47,ppy3lr,1631876971,Loyal Sugar Baby needed,[removed],dating,t5_2qhb1,https://www.reddit.com/r/dating/comments/ppy3lr/loyal_sugar_baby_needed/
48,ppy5vo,1631877265,Is dating becoming more political?,"In my teens and early 20s, politics had rarely come up on dates. Now, into my mid-20s I have noticed that this is becoming much more prevalent. Amongst people my age it is apparently hugely disparaging that I vote for the Conservative party in the UK (centre-right).

With how I vote comes all sorts of connotations that I am an anti-vaxxer, unsympathetic to poor people, pro-Brexit, hate immigration etc. None of which are true. But there seems to be a desire to put people into binary simplistic categorisations - very much the ""either you're with us against us"" attitude.

I often see online dating profiles which say ""please do not swipe right if you're a Tory"".

Has anyone noticed that this is becoming more common in the modern dating, or am I just becoming more attuned to it? 

And if so, any idea on why this might be? I would imagine that it is a symptom of how polarised our society has become. But I find it such a shame that our society is moving in such divided times.",dating,t5_2qhb1,https://www.reddit.com/r/dating/comments/ppy5vo/is_dating_becoming_more_political/
49,ppy8rz,1631877618,Should I pursue a guy with seemingly no backbone?,"I mean don't get me wrong....he's very very sweet....but it's to a point where he just seems to let people push him around. Like with everything. He's quite socially awkward to add on. I'd never take advantage of him but I'm just worried that I'm gonna be the one making all of the decisions &amp; calling the shots. I think to myself: ""well maybe I could teach him how to be a man"" but then I think that he'll become dependent on me. He's also really nice though and fun and his family seems really cool (which is very important to me). I know he'll never ask me on a date because he's too scared, so I'm considering doing it...what do you guys think?",dating,t5_2qhb1,https://www.reddit.com/r/dating/comments/ppy8rz/should_i_pursue_a_guy_with_seemingly_no_backbone/
50,ppyrk2,1631879906,How do you deal with oral during the beginning stages of dating?,[removed],dating,t5_2qhb1,https://www.reddit.com/r/dating/comments/ppyrk2/how_do_you_deal_with_oral_during_the_beginning/
51,ppz10q,1631880964,Desirability and black women,"Hey

Some context about me( 23F) so you can understand why I’m writing this. 
I’m a african woman who was born and raised in Northern Europe(Sweden) 
When it comes to dating and relationships I have never had issues with that since most of my relationships have been with Northern Europe men. I’m seen as attractive by the larger mass of people here, and it sounds so ego speaking about yourself like that but it is important in this context. I’m tall and very skinny wich is the norm here.

But what I constantly see online is black women, usually from the US write an repeat that black women are undesirable. They keep repeating that black women are unwanted by men and it just really upsets me that I have to be put in the same category as these women who keep demeaning themselves. I have never experienced being undesirable or rejected but it feels like they are so adamant in reinforcing that. 

And of course there are people who might be racist or just awful people who also say these things. But I have seen white/latino/black and asian guys compliment black girls and a black girl will literally respond, “No, we are seen as to bottom of the totem pole” like…can’t you just accept that people find you attractive?

And maybe black women, sometimes it’s not because of your race. There is other factors that might make you undesirable. 

Body shape/ body type and of course weight, a lot of you are overweight so that will be a problem.
Behavior and way of speaking.
Dress sence and other things that might ad to guys not being attracted not your skin tone. 

Because this black women and undesirable thing has now gone globally and is just upsetting to be put in a category that I have never experienced.

A few might be upset by what I’ve written but that’s just how I see it.",dating,t5_2qhb1,https://www.reddit.com/r/dating/comments/ppz10q/desirability_and_black_women/
52,ppz83j,1631881764,Date falls for me the one time I didn't want someone to,"This probably isn't anything you'll be able to learn from, I just want to share this for catharsis.


I (M24) have been a serious relationship kinda guy my whole life. After a tough breakup 2 years ago, soon followed by the pandemic, I occasionally dipped back into the dating scene to try and find ""the one"", but didn't have much luck with that.

This time, I met someone (F28) who I went along great with and was really attracted to, but I just couldn't imagine our relationship working long-term. So we decided to be friends with benefits instead (her idea). Since I hadn't had sex in 2 years, I was stoked. 

We finally met in person after texting for a few weeks, and ended up in bed about an hour later. It went great, we both really enjoyed the experience and I was looking forward to repeating this a couple of times.

Unfortunately, just two days later she texted me that she'd developed feelings for me which she thought she could suppress, but just ended up making this more difficult for her. She said it's probably for the best to end all communication so she can move on, which I agreed to.


TL;DR: I, a serious relationship guy, try casual sex once, woman develops feelings for me the one time I didn't want that to happen, and ends things, basically turning the planned ""friends with benefits"" arrangement into a one night stand",dating,t5_2qhb1,https://www.reddit.com/r/dating/comments/ppz83j/date_falls_for_me_the_one_time_i_didnt_want/
53,ppz8e6,1631881800,"Were you ever ambivalent about a potential match, then found out about a certain aspect of their personality, or a hobby they had, and suddenly you found yourself really attracted to them?","For example, maybe you discovered they had a Dark Souls tattoo, or you found out they were an anarchist, or you found out they were into BDSM, or you found out they volunteered at the local homelessness charity, or whatever it may be.",dating,t5_2qhb1,https://www.reddit.com/r/dating/comments/ppz8e6/were_you_ever_ambivalent_about_a_potential_match/
54,ppzgr8,1631882707,Not sure when to ask her out,"Before I start explaining my problem I first have to give some history about my [19M] relationship with this girl [19F].

I couple years ago when I was 16-17 I was working at a supermarket with the mentioned girl. We always talked with eachother and had fun there, after some months she messaged me on Snapchat. After some time of talking I was realising that she was dropping hints of a date, and that she was interested in me. I chose to ignore her advances because I was a bit scared of going on a date with someone, as I never had a girlfriend back then, so I sort of stopped talking to her.

Now looking back at this I realise that I was an idiot for being scared. Now I still follow her and see the things she posts, and a part of me regrets not asking her out. So yesterday after 2 years I sent her a message to start a conversation again, and so we’ve been talking again. Now the problem is I’m not sure if she still has these feelings for me, and I would like to ask her to maybe hang out some day, but I’m not sure of when to drop the question. Should I do it now and not waste time, or is it too fast and should I wait a couple of weeks?

Also I’m not sure what an ideal place for a hangout/ date is? I was thinking of something active like ice skating, there is a place nearby where we could go. The idea of just going to a restaurant to eat or drink sounds a bit boring or something else like that. Is that a good idea, and any other proposals would be appreciated.",dating,t5_2qhb1,https://www.reddit.com/r/dating/comments/ppzgr8/not_sure_when_to_ask_her_out/
55,ppzn2a,1631883402,Ghosted?,"I added a post about someone I’ve been matched on Hinge and have been texting for the past month and a half. We’ve been back and forth, he lives in OC and I was in the bay area. He still pursued me, I came into town last week, he just started school and work full time, and he hasn’t been able to make time to meet with me. He told me earlier this week that he is off work Friday night and Sunday all day. I told him I’m going to be in Vegas (I told him this before). The next day I realized I can come back one day earlier. So I told him I’ll actually be in town Sunday and asked if he can solidify the date because I haven’t been able to tell if he still wanted to actually meet or if he lost interest. His texts used to be daily, and they have trickled out since he started school. I texted him this last night, and haven’t heard anything since. Do you think he is over it and ghosted?",dating,t5_2qhb1,https://www.reddit.com/r/dating/comments/ppzn2a/ghosted/
56,ppzsu0,1631883992,Dating can be tiresome,"I posted last weekend that I ended up having a slight crush on my last date. We went out, had a great time together and even made out at the end.

For the first time since my breakup last year, I felt light and genuinely happy that I was dating again.

We both kept texting, but I found that when she texts, she seems a different person than when she is in real life. Meaning, she would take a long time to text at times, but it seemed that she wanted to keep in touch. I adapted to the way she texted and invited her to dinner last Tuesday.

She said she couldn’t because of work, so it was postponed to the weekend. I said it was absolutely fine, there was no need for rushing things. And I meant it. I even asked her if she liked Japanese food, she said she loved it and so I said “I’ll take you to a great Japanese restaurant then. Trust me”.

A few days went by where nothing was said between us. I decided to text her “good morning” on Thursday. Got no reply. And now it’s Friday.

It’s the third time that I’ve thought she has ghosted me, but it seems like it’s for real this time.

Bear in mind that if she doesn’t want to meet me or talk to me anymore, then that’s absolutely fine. Yes, I’m not a fan of ghosting people, especially after someone says that they would have dinner with you, but at the same time, people change their minds and that’s totally fine too. I’m in no way trying to blame this on anyone.

I just wanted to vent a little, because I have difficulty dealing with this. I really wanted to be with this girl again and just talk with her. I wanted to explore this feeling a little more, since I lost a lot of trust after my breakup and wanted to feel excited for dating again like I did last week.

I would normally send a text asking whether the dinner would happen or not, but I’m trying to learn that if someone doesn’t text you, it either means that they are too busy or most likely they are just not interested in you anymore. I’m trying to teach myself self value and so, if someone thinks that I’m worth it, then they will reach out to me too.

I want to reach a point where my brain isn’t constantly battling my emotions, but rather my emotions feel the same as the way that I think. Meaning, if my brain is telling me that I did everything I could, then I want my emotions to feel the same way. And right now, they don’t.

It also doesn’t help that I saw my ex-girlfriend last Sunday (at a wedding) who has been dating someone for the past few months. I’m happy for her, but it still stings a bit.

So, I’ve just been feeling a lot of emotions this week that have chipped away my confidence a bit. I know that with due time, I’ll regain it again and I’ll be even stronger. But right now, I just needed to talk about this.",dating,t5_2qhb1,https://www.reddit.com/r/dating/comments/ppzsu0/dating_can_be_tiresome/
57,ppzttt,1631884099,"Yes, girls, men like when you make the first move, or a move"," 

They like when you call them first, send a message, when you ask them out, when YOU hug them or even kiss them.. Imagine how it makes you feel when a guy you like does all those things, now imagine that guys are gonna feel 10 times better because they dont usually experience those things.",dating,t5_2qhb1,https://www.reddit.com/r/dating/comments/ppzttt/yes_girls_men_like_when_you_make_the_first_move/
58,pq00bh,1631884758,"High value men know what breeds sexual chemistry, and they will never rush you to have sex too early on ""to test it""","Imagine a scenario: you're going on a date with what you presume to be a gentleman. The date goes great, you have lots of fun and good conversations flow efortlessly. You both realize you enjoy each others company and would like to enjoy it again. At the end of the date, he admits he really likes you and wants to kiss you. The date ends with a kiss, a strong hug and you go your merry way. You think to yourself how great that was, how much fun you had, how comfortably the conversation flew, how easily you made jokes and laughed your asses off. Soon enough questions in your head start popping up about how good it could be next time- where would we go? What could I about? Is there a burning topic on your mind you'd love to share and contemplate with someone? Will he kiss you even harder next time? 
 

The second date comes around. This time, there's a lot more hugs and kisses. You're anxious to have his hands all over you. His kisses can't help but turn you on. But he's taking it slow. The convos are still running smoothly, you're making even weirder jokes, and that awkward laugh of yours comes out. He is thrilled, not disgusted by it, and you laugh even more. You realize how easy it is to be comfortable around him. You demand more cuddles. And so you cuddle into the night. At some point, you realize he has a boner from all the cuddling, but he's still taking it slow. Very gently, he lowers his hand from your waist to your leg, ""accidentally"" touching your butt in the process. But you like it. You want him to squeeze it. But he doesn't. Your mind goes crazy over the fact he's not gripping you as hard as you'd like. But it's not because he doesn't like you. It's because he's taking it slow. And so, your mind goes crazy over getting touched by him. You want more, and he's very slow.

The date ends with a more passionate kiss and you wish each other a good night. Throughout the next few days, he chooses one day for a date and immediately asks you up front about your schedule, while also keeping some casual small talk active. He's now become a person you're gonna send texts about whatever funny/weird happened to you. Now you're getting connected. The texting never dies, but is kept on a casual level. No burning topics discussed, if possible, leave that for when you meet live. Just casual and carefree. 
 
The third date is a bit more romantic- he takes you out to a dinner with live music. You're enjoying the meal, the music, and his muscles as you lean against him and enjoy the atmosphere. You're chilling. At some point he turns to you and says something along the lines of ""I like what we have going on. I think we're compatible enough to be committed to each other and I want you to be my girlfriend."" You're over the moon now. Of course you'll say yes.  And so you do. A smile runs over his cheeks all the way to his ears as he leans in for a kiss and locks you in a hug. You spend the night enjoying each other, the music, and the food. After the date ends, he expresses how happy he is to be with you. He makes sure you get home safely and sends you a barrage of hearts for good night (or something, whatever)... 
 
Still, no sex. It makes you wonder and makes you crazy - do I turn him on enough? When will he take me to bed? The way he treated you so far made you feel so good in your own skin that you just want to share that feeling with him. You want that sex, and you want it bad. So far he's done nothing but make you feel good, comfortable and safe. He's observant of your reactions and knows how to react to you. He knows what you like and what you want- he wants it too. So why is he waiting? 
 
You're not there yet. He values your intimacy and wants you to enjoy it to the fullest- he's not gonna rush it. He too , wants to know just how vulnerable HE can be around you before you two get to perform sexually. He's not gonna risk any awkward accidents at that stage with someone who could wound him severely over it. He wants to know he can trust you, and he wants you to know you can trust him too. Sex has to come in a relaxed environment, and if that's not there- tensions will ensue, and you're not really gonna enjoy yourself, unless you zone out. That's not good sex, and he knows it. He wants you to be able to laugh and enjoy yourself while being in your most vulnerable position. And until that level of trust is there, you two won't have sex. And that's okay. 
 
By the time you two do have sex, you'll be crazy from waiting. You will want to be all over him. And you'll probably try to, because waiting has made you crazy, and because you've grown so comfortable around him, you'll have no problem trying out all the funky weird stuff that's been clogging your mind from the first moment he touched you. You don't worry about his reaction, because you already know his reaction.
 
With those two cards at hand, you're sure to have sexual chemistry. All it took for that was ensuring the level of trust and comfort is reached before you act on the impulses sent by your dysfunctional amygdala. 
 
Sexual chemistry is not an inborn trait. It's something you have to work for.",dating,t5_2qhb1,https://www.reddit.com/r/dating/comments/pq00bh/high_value_men_know_what_breeds_sexual_chemistry/
59,pq01zx,1631884923,I just can’t see myself ever actually having a relationship.,"I (22M) have never had a woman show any interest in me. I try to think back as hard as I can and I come up blank. At the end of the day, I’m too quiet to meet women in real life and not physically attractive enough to meet women online. I have the supposedly all important “confidence” in things that no one else cares about. 

I just don’t see it happening. I am simply not the type of person that women want in a relationship.",dating,t5_2qhb1,https://www.reddit.com/r/dating/comments/pq01zx/i_just_cant_see_myself_ever_actually_having_a/
60,pq079c,1631885454,How to move forward in a relationship,"M19 here, so I’ve been seeing this girl for a few months now, we see each other about once a week, we have great chemistry in general and I’m quite confident that she’s somewhat into me. The problem is, none of us is really making any steps towards anything. So the question I have, how to push a relationship forward? How can I show here that she matters and I want to be with her?

Thanks!",dating,t5_2qhb1,https://www.reddit.com/r/dating/comments/pq079c/how_to_move_forward_in_a_relationship/
61,pq085p,1631885546,Girl that is dating is flirting with me,"Recently i became friends with a girl i like, and we've been talking a lot and playing games.  
The problem here is that i was going to ask her out after she started flirting so much with me but i found out she is dating a random guy, but it really seems like she's into me, and now i'm afraid to talk about it and sound weird.",dating,t5_2qhb1,https://www.reddit.com/r/dating/comments/pq085p/girl_that_is_dating_is_flirting_with_me/
62,pq0hfv,1631886454,what are some Problems women and men alike face in dating world TODAY?,"I find that for many men TODAY are getting much fewer options than decades past. Many are lonely and are desperate. Many are reaching their 30s, where they dream of becoming a father and building a family , but instead living unattached , sexless lives where their only real interaction is behind a screen.

&amp;#x200B;

Whereas For majority women, they are getting more options than ever before. If they don't like someone out of boredom, or there are problems within the relationship, or they see a new shiny person there is no incentive to remain in a relationship. They do, however, have to deal with many unsolicited attention and many bad crops to get the ones they want. Their standards are obscenely unrealistic. Many love the idea of the marriage but don't actually want the marriage, or the man for that matter. Many want everything ( her career, the best man, the family , the whole 9 yards), otherwise she is settling.

&amp;#x200B;

This is coming from experience. Is there validity in this?",dating,t5_2qhb1,https://www.reddit.com/r/dating/comments/pq0hfv/what_are_some_problems_women_and_men_alike_face/
63,pq0mdw,1631886937,Can you truly be friends with a FWB??,[removed],dating,t5_2qhb1,https://www.reddit.com/r/dating/comments/pq0mdw/can_you_truly_be_friends_with_a_fwb/
64,pq0ng1,1631887042,Whats the best way to tell a girl in college that I have feelings for her,,dating,t5_2qhb1,https://www.reddit.com/r/dating/comments/pq0ng1/whats_the_best_way_to_tell_a_girl_in_college_that/
65,pq0nha,1631887045,Lesbian looking to make friends. Would you like to be my friends?,[removed],dating,t5_2qhb1,https://www.reddit.com/r/dating/comments/pq0nha/lesbian_looking_to_make_friends_would_you_like_to/
66,pq0nsz,1631887075,Who else gave up dating after years of constant rejection? How are you feeling today and how's life going?,"It's really bad knowing no one will ever want me. Knowing that no matter what I do I will never be good enough. But, it's not up to me.",dating,t5_2qhb1,https://www.reddit.com/r/dating/comments/pq0nsz/who_else_gave_up_dating_after_years_of_constant/
