,all_awardings,allow_live_comments,author,author_flair_css_class,author_flair_richtext,author_flair_text,author_flair_type,author_fullname,author_is_blocked,author_patreon_flair,author_premium,awarders,can_mod_post,contest_mode,created_utc,domain,full_link,gildings,id,is_created_from_ads_ui,is_crosspostable,is_meta,is_original_content,is_reddit_media_domain,is_robot_indexable,is_self,is_video,link_flair_background_color,link_flair_css_class,link_flair_richtext,link_flair_template_id,link_flair_text,link_flair_text_color,link_flair_type,locked,media_only,no_follow,num_comments,num_crossposts,over_18,parent_whitelist_status,permalink,pinned,pwls,retrieved_on,score,selftext,send_replies,spoiler,stickied,subreddit,subreddit_id,subreddit_subscribers,subreddit_type,thumbnail,title,total_awards_received,treatment_tags,upvote_ratio,url,whitelist_status,wls,removed_by_category,post_hint,preview,author_cakeday
0,[],False,ascendedbeing55,,[],,text,t2_907nuidd,False,False,False,[],False,False,1629601443,self.dating,https://www.reddit.com/r/dating/comments/p94v5p/i_failed/,{},p94v5p,False,True,False,False,False,True,True,False,#ea0027,dating,"[{'e': 'text', 't': 'I Need Advice'}]",19ec58c2-9f74-11e7-81a1-0e2bf15991f0,I Need Advice,light,richtext,False,False,False,15,0,False,all_ads,/r/dating/comments/p94v5p/i_failed/,False,6,1629602081,1,"
I have been talking to this girl but shes like in no means to have a relationship since she just broke up w her ex two weeks ago. it was interesting at first when we talked for a couple days , i got her number nd learned about her . shes p boring tbh but its got so dry recently and i just gave up kinda . is it ggs",True,False,False,dating,t5_2qhb1,967233,public,self,i failed,0,[],1.0,https://www.reddit.com/r/dating/comments/p94v5p/i_failed/,all_ads,6,,,,
1,[],False,-Progress-4521,,[],,text,t2_dwnztpnf,False,False,False,[],False,False,1629601523,self.dating,https://www.reddit.com/r/dating/comments/p94vts/first_time_having_sex_with_new_guy_and_i_was/,{},p94vts,False,True,False,False,False,True,True,False,#ff4500,dating,"[{'e': 'text', 't': 'Question'}]",a9531dce-194e-11e5-b177-0eff099c3d1f,Question,light,richtext,False,False,True,14,0,False,all_ads,/r/dating/comments/p94vts/first_time_having_sex_with_new_guy_and_i_was/,False,6,1629602144,1,"OK question for the men mostly. I slept with this guy that I have a lot of chemistry with.  Throughout the night we probably did it twice. I did tell him that I haven’t slept with anyone in like a really long time. 

But without going into too much detail I was very dry down there. I don’t wanna go into too much detail but I recently had a bikini wax that irritated my skin so it was a little sore down there. I didn’t tell him that or anything but I’m pretty sure he could pick up on how I was dry. Like for example he couldn’t get it in most of the time. Like it kept slipping out. I told him that I’m super attracted to him so I think that I made that obvious? I’m thinking maybe he thinks I was nervous since I haven’t slept with anyone in a really long time.

TLDR; If you find yourself in a situation like this with a girl after sleeping with her what would your thoughts be? Would it encourage you to want to try again to “win” her over or would you think that she’s not good in bed?",True,False,False,dating,t5_2qhb1,967233,public,self,First time having sex with new guy and I was really dry. I am super attracted to him and I don’t want him to think I wasn’t,0,[],1.0,https://www.reddit.com/r/dating/comments/p94vts/first_time_having_sex_with_new_guy_and_i_was/,all_ads,6,,,,
2,[],False,lana_del_reymysterio,,[],,text,t2_yc5ab,False,False,False,[],False,False,1629601543,self.dating,https://www.reddit.com/r/dating/comments/p94w0v/how_do_you_know_if_your_lack_of_dating_success_is/,{},p94w0v,False,True,False,False,False,True,True,False,#ea0027,dating,"[{'e': 'text', 't': 'I Need Advice'}]",19ec58c2-9f74-11e7-81a1-0e2bf15991f0,I Need Advice,light,richtext,False,False,False,15,0,False,all_ads,/r/dating/comments/p94w0v/how_do_you_know_if_your_lack_of_dating_success_is/,False,6,1629602163,2,"An atheist, left wing black male is probably not going to do as well in southern U.S. states. A poor or middle class person is probably going to struggle a bit more in a city with a culture that values higher class/income/status. A person with intellectual or highly niche interests is probably going to have a harder time in a country town.

So if you're not having success dating, how do you know if it's due to something you're doing or a disparity between your personality and that of the vibe/culture/demographics/social dynamics of where you're living?

I'm 24M and I live in a city (not U.S.) that while quite educated, has a very introverted and socially conservative (meaning reserved) culture. It's a small ish population (500k) where there's a culture that everyone knows everyone. I almost never see people my age talking to each other (meaning strangers) casually while out and about. I certainly never see (nor have experienced) any overt flirtatious behaviour of any kind. 

Whereas my personality is a bit more bubbly, openly friendly, and curious about new people. I can talk to anyone and hold a conversation no problem provided they engage back. I find it hard to meet women my age here that I click with because our vibes don't match and they don't really engage with me in conversation in the way that I would like. This is the case regardless of if they're actually interested in me or not.

I realised recently that all of the women who I've seriously dated as well as pretty much all my female friends have been women who didn't originally grow up here where I live. Every time I've met women in a different city/country or online from a different city/country, we've hit it off and we've become friends. I've asked some of these women if there's anything that I do that's off-putting and they honestly couldn't find anything.

&amp;#x200B;

So given that the general advice I see here seems to be either to ""work on yourself"" or ""you must be doing something wrong"", how do you know whether it's really a \*you\* issue, or a where you're living issue?",True,False,False,dating,t5_2qhb1,967233,public,self,How do you know if your lack of dating success is due to you or due to where you're living?,0,[],1.0,https://www.reddit.com/r/dating/comments/p94w0v/how_do_you_know_if_your_lack_of_dating_success_is/,all_ads,6,,,,
3,[],False,Southern-Biscotti-78,,[],,text,t2_dfqpvetl,False,False,False,[],False,False,1629601614,self.dating,https://www.reddit.com/r/dating/comments/p94wmn/just_a_quick_question/,{},p94wmn,False,True,False,False,False,True,True,False,#ff4500,dating,"[{'e': 'text', 't': 'Question'}]",a9531dce-194e-11e5-b177-0eff099c3d1f,Question,light,richtext,False,False,True,7,0,True,all_ads,/r/dating/comments/p94wmn/just_a_quick_question/,False,6,1629602217,0,"I’m dating someone and I am really wanting to progress further.

We’ve known each-other for years and have been dating for around 2 months, I want to have a conversation with them to know what they want from our relationship if they want to progress any further etc.

But my problem is that I am extremely emotional, and no matter how they react I will cry and it won’t just be a couple of tears it will be full on ugly crying.

Is it acceptable to talk to them about this through text? 

I know it’s better to talk about this stuff in person but I don’t think they’d appreciate a 23 year old man crying on their shoulder because they said they love me (or because they said they don’t want to go any further)",True,False,False,dating,t5_2qhb1,967234,public,nsfw,Just a quick question,0,[],0.5,https://www.reddit.com/r/dating/comments/p94wmn/just_a_quick_question/,promo_adult_nsfw,3,,,,
4,[],False,INTERNETCHECKS,,[],,text,t2_95bb9vmu,False,False,False,[],False,False,1629601628,self.dating,https://www.reddit.com/r/dating/comments/p94wqp/hot_take_all_women_cheat/,{},p94wqp,False,False,False,False,False,False,True,False,#ffd635,dating,"[{'e': 'text', 't': 'Giving Advice'}]",7bca2c58-4211-11e5-9ecb-0e60d8112001,Giving Advice,dark,richtext,False,False,True,2,0,False,all_ads,/r/dating/comments/p94wqp/hot_take_all_women_cheat/,False,6,1629602227,1,[removed],True,False,False,dating,t5_2qhb1,967234,public,self,Hot take: all women cheat,0,[],1.0,https://www.reddit.com/r/dating/comments/p94wqp/hot_take_all_women_cheat/,all_ads,6,moderator,,,
5,[],False,doubledelta88,,[],,text,t2_doe8mrkg,False,False,False,[],False,False,1629601818,self.dating,https://www.reddit.com/r/dating/comments/p94ydv/breaking_the_language_barrier/,{},p94ydv,False,True,False,False,False,True,True,False,#ea0027,dating,"[{'e': 'text', 't': 'I Need Advice'}]",19ec58c2-9f74-11e7-81a1-0e2bf15991f0,I Need Advice,light,richtext,False,False,False,7,0,False,all_ads,/r/dating/comments/p94ydv/breaking_the_language_barrier/,False,6,1629602375,1,"So I've been meaning to ask this girl out at work but she doesn't speak English. I'm wondering what advice do y'all have for breaking through that and getting her to know the real me. Right now, it's just a thumbs up and a smile. I do have a great smile but that can only carry me so far.",True,False,False,dating,t5_2qhb1,967236,public,self,Breaking the language barrier?,0,[],1.0,https://www.reddit.com/r/dating/comments/p94ydv/breaking_the_language_barrier/,all_ads,6,,,,
6,[],False,moaningcustard,,[],,text,t2_cvaak2mz,False,False,False,[],False,False,1629601960,self.dating,https://www.reddit.com/r/dating/comments/p94zmo/dating_apps/,{},p94zmo,False,True,False,False,False,True,True,False,#ffb000,,"[{'e': 'text', 't': 'Tinder/Online Dating'}]",5214d2ac-61f1-11e8-8bb1-0ed15e4a39c0,Tinder/Online Dating,dark,richtext,False,False,False,9,0,False,all_ads,/r/dating/comments/p94zmo/dating_apps/,False,6,1629602486,1,"Are dating apps (bumble, tinder) safe to use with your real name and pic?",True,False,False,dating,t5_2qhb1,967237,public,self,Dating apps,0,[],1.0,https://www.reddit.com/r/dating/comments/p94zmo/dating_apps/,all_ads,6,,,,
7,[],False,Scarletsilversky,,[],,text,t2_a899ktr6,False,False,False,[],False,False,1629602302,self.dating,https://www.reddit.com/r/dating/comments/p952iu/how_do_you_know_when_your_sos_craxy_exes_are/,{},p952iu,False,True,False,False,False,True,True,False,#ff4500,dating,"[{'e': 'text', 't': 'Question'}]",a9531dce-194e-11e5-b177-0eff099c3d1f,Question,light,richtext,False,False,False,26,0,False,all_ads,/r/dating/comments/p952iu/how_do_you_know_when_your_sos_craxy_exes_are/,False,6,1629602754,3,"I went on a few dates with some guy who mentioned that his longest relationship was with a psycho who verbally abused him with extreme paranoia issues. Found out that he cheated on said girlfriend multiple times then harassed the shit out of her trying to win her back until legal action was taken. I blocked him on everything and, thankfully, he didn’t know where I lived and never tried to reach out to me, but he seemed like a shy, charming guy. I would have never known that he would do something like that. 

So now I’m wondering if there are telltale signs that the person you’re dating was the “crazy one” in their past relationships? You can argue that anyone who talks badly about their exes or calls them a psycho is obviously lying, but that girl who got cheated on and stalked seems to have valid grounds to call her ex crazy. I’d rather not wait until the other person tries to harm or harass me",True,False,False,dating,t5_2qhb1,967238,public,self,How do you know when your SO’s “craxy exes” are actually crazy or if your SO was the problem?,0,[],1.0,https://www.reddit.com/r/dating/comments/p952iu/how_do_you_know_when_your_sos_craxy_exes_are/,all_ads,6,,,,
8,[],False,Mission-Ask-1134,,[],,text,t2_8psl8e1z,False,False,False,[],False,False,1629602348,self.dating,https://www.reddit.com/r/dating/comments/p952wa/i_was_single_and_onoff_depressed_over_the_course/,{},p952wa,False,True,False,False,False,True,True,False,#ffd635,dating,"[{'e': 'text', 't': 'Giving Advice'}]",7bca2c58-4211-11e5-9ecb-0e60d8112001,Giving Advice,dark,richtext,False,False,True,6,0,False,all_ads,/r/dating/comments/p952wa/i_was_single_and_onoff_depressed_over_the_course/,False,6,1629602788,1,"So I want to kind of vent and share my experience with how my life was very depressing and how it has recently changed after I thought it never would, this is mainly an effort to help someone who may have been mentally in the same spot as me. So back in 2016 ish the girlfriend I dated throughout high school and I had broke up after 2.5 years and that kind of ruined me because of how she treated me for the last couple months (just not showing nearly any interest). I was going to a College where I was miserable and had terrible teachers who treated you like trash (I believe out of the 4 semesters there were 2 good teachers). A bunch of my friends started treating me different and slowly but surely, they started going 1 by 1 and soon enough I would have almost no friends. Now sure there were a few good things to happen here and there, but for the majority, since 2016 ish I was constantly on and off a wreck, and I never really told anybody because they wouldn't understand. I was beginning to think that my life would forever be an emotional rollercoaster of just ups and downs day in and day out, and it all changed a week ago. I ended up coming across a girl that is the same age as me, we would hangout when we were younger but lost touch over the years, and out of nowhere I ran into her and we got to catching up. Now we are starting to hangout more and more, and we have gone on a few dates.  Very safe to say we are into each other and its like she revived a part of me that died many moons ago.  I was thinking my life would be a lonely dark cave for the rest of my life as foolish as it sounds, but I know there are others out there who can relate. Now again I am not making this post to look for sympathy by any means, just wanted to share my experience and say for those who want to give up or maybe have had a similar scenario to mine; the light at the tunnel will come. It may sound cliche but it could take weeks, months, years, hell even a decade. You have to do anything it takes to be happy and push yourself to get there because it will happen and I can ASSURE you that.",True,False,False,dating,t5_2qhb1,967239,public,self,"I was single and on/off depressed over the course of 5 years. I want to share my experience with a recent change in my life that proves that no matter how much you think something good won't happen, it will.",0,[],1.0,https://www.reddit.com/r/dating/comments/p952wa/i_was_single_and_onoff_depressed_over_the_course/,all_ads,6,,,,
9,[],False,jasonbre38,,[],,text,t2_andcuzjn,False,False,False,[],False,False,1629602360,self.dating,https://www.reddit.com/r/dating/comments/p952zr/quick_question/,{},p952zr,False,True,False,False,False,True,True,False,#ea0027,dating,"[{'e': 'text', 't': 'I Need Advice'}]",19ec58c2-9f74-11e7-81a1-0e2bf15991f0,I Need Advice,light,richtext,False,False,False,5,0,False,all_ads,/r/dating/comments/p952zr/quick_question/,False,6,1629602797,2,"I meet this girl at my gym. I haven't known her long and we don't really interact. However she did go pick up something for me. I wasn't able to go one afternoon because I worked long hours and she offered to do so for me. Like I said I don't really know her, I know her name but that's pretty much it. I don't go to the gym to talk to or meet girls, Am I reading too much into this because I love my gym and I don't want to make it an awkward place. But she seem nice and she's really cute.",True,False,False,dating,t5_2qhb1,967239,public,self,Quick question,0,[],1.0,https://www.reddit.com/r/dating/comments/p952zr/quick_question/,all_ads,6,,,,
10,[],False,heartbeenbroke96,,[],,text,t2_c1bpeq2r,False,False,False,[],False,False,1629602415,self.dating,https://www.reddit.com/r/dating/comments/p953g1/how_the_hell_do_u_guys_date/,{},p953g1,False,False,False,False,False,False,True,False,#00a6a5,dating,"[{'e': 'text', 't': 'Support Needed'}]",fd9c03b8-a1ce-11e7-9172-0e8c9f9ecf4c,Support Needed,dark,richtext,False,False,True,0,0,False,all_ads,/r/dating/comments/p953g1/how_the_hell_do_u_guys_date/,False,6,1629602842,1,[removed],True,False,False,dating,t5_2qhb1,967239,public,self,how the hell do u guys date??,0,[],1.0,https://www.reddit.com/r/dating/comments/p953g1/how_the_hell_do_u_guys_date/,all_ads,6,moderator,,,
11,[],False,Broseph_Stalin357,,[],,text,t2_dhaejmho,False,False,False,[],False,False,1629602597,self.dating,https://www.reddit.com/r/dating/comments/p954zr/is_it_normal_to_see_sex_as_meaningless_once/,{},p954zr,False,True,False,False,False,True,True,False,#ff4500,dating,"[{'e': 'text', 't': 'Question'}]",a9531dce-194e-11e5-b177-0eff099c3d1f,Question,light,richtext,False,False,False,9,0,False,all_ads,/r/dating/comments/p954zr/is_it_normal_to_see_sex_as_meaningless_once/,False,6,1629602979,2,"For context (M) I used to see sex as this deep connection thing, I looked at it as a sacred thing but since being in a relationship with someone for 4 years where I was cheated on constantly with multiple people. I no longer put value on sex, something inside of me just snapped and it means nothing to me. 

Is it normal to go thru this or is this something that can happen but is not common?",True,False,False,dating,t5_2qhb1,967241,public,self,Is it normal to see sex as meaningless once someone cheats on you?,0,[],0.75,https://www.reddit.com/r/dating/comments/p954zr/is_it_normal_to_see_sex_as_meaningless_once/,all_ads,6,,,,
12,[],False,throwaway29229292299,,[],,text,t2_dlbrzbp7,False,False,False,[],False,False,1629602766,self.dating,https://www.reddit.com/r/dating/comments/p956d8/not_sure_what_to_do_after_a_night_with_someone/,{},p956d8,False,True,False,False,False,True,True,False,#ea0027,dating,"[{'e': 'text', 't': 'I Need Advice'}]",19ec58c2-9f74-11e7-81a1-0e2bf15991f0,I Need Advice,light,richtext,False,False,True,7,0,False,all_ads,/r/dating/comments/p956d8/not_sure_what_to_do_after_a_night_with_someone/,False,6,1629603107,1,"I ( M32 ) recently went out on a date with a younger girl ( F23 ) and had a pretty decent time. She was very reserved and shy but I didn’t think much of it. We went to get dinner, some ice cream after, and then we ended up back at my place. We decided we were going to watch a movie but first we were going to smoke. I live in Seattle so it’s legal here.

We head upstairs to the bathroom, and I start doing my thing and rolling up. After a couple passes I can’t help but notice she’s looking a bit anxious and I ask her if she’s alright. I think I hit a nerve because she looked like she was on the verge of tears by my question. She was hesitant, and wanted reassurance I wasn’t going to tell anyone what she was going to say. This of course makes me curious and a bit weirded out. I promise her. 

She tells me I’m the first person she’s had socialization with in years outside of her family. She tells me she left a very abusive family where she was pretty much trapped in the middle of nowhere. She said she hasn’t had friends since she was a small child, wasn’t allowed to leave the house, forced to do homeschooling, emotionally abused, physically etc. and even when she became an adult it wasn’t as simple as just leaving since she was stranded with nothing. 

She told me she had gotten a PTSD diagnosis years ago and was able to collect disability for it after some headaches. Apparently this was the reason she was able to save up and finally leave. However she expressed fear of her family trying to do something to her. That they might come looking for her. I could tell she wanted to file a report but was too scared of that as well. She showed me images, videos, screenshots, dating all the way back to even 2014. Tbh it all added up and seems legit. According to her she only left less than a week ago and “tried dating” for the first time because she needed some form of human contact. 

She’s never had a job before and I know that what little income she’s getting isn’t sustainable. I know she’ll eventually have to go back or end up homeless. I don’t think she can work with how on edge she is. I know it’s not my issue but I can’t help but feel bad for her. What would you all do in my situation? Should I encourage her to file a report or leave it be? We’ve been texting since then and she wants to meet again.",True,False,False,dating,t5_2qhb1,967244,public,self,Not sure what to do after a night with someone. Not sure if it was a joke or not. Need serious advice,0,[],1.0,https://www.reddit.com/r/dating/comments/p956d8/not_sure_what_to_do_after_a_night_with_someone/,all_ads,6,,,,
13,[],False,justguessyes,,[],,text,t2_5axrpblj,False,False,False,[],False,False,1629602866,self.dating,https://www.reddit.com/r/dating/comments/p95776/should_i_go_on_a_third_date_with_this_guy/,{},p95776,False,True,False,False,False,True,True,False,#ea0027,dating,"[{'e': 'text', 't': 'I Need Advice'}]",19ec58c2-9f74-11e7-81a1-0e2bf15991f0,I Need Advice,light,richtext,False,False,True,11,0,False,all_ads,/r/dating/comments/p95776/should_i_go_on_a_third_date_with_this_guy/,False,6,1629603188,1,"So I had my first date a week ago with this guy I matched with. We went on a walking downtown + ice cream date and it was pretty great. It was nonstop conversation and smiles, we had a lot in common, both are hoping for a serious relationship. even talked about things we could do together on future dates. However, there was nothing SUPER flirtatious and no physical contact except for a very short hug at the end. He did text me almost immediately after that he wanted to kiss me but wanted to be respectful/careful (especially with the covid situation), and scheduling a second date.

Second date was this morning, we planned on bringing takeout to a park and going on a walk there after eating. Since it was really close to his place, I picked him up in my car (maybe this was the first mistake, and i should have suggested he drive instead?). We ate and talked, but it seemed a little more awkward than last time, and at some point in the convo I also started to realize that he didn't seem as cute as I thought he was the first time. After we finished eating I asked if he still wanted to walk, but he said that he had to head out and get ready for something else later. At this point, I was thinking, alright, he lost interest in me, but I park in his driveway, we had some awkward end of date convo still in the car, and then he asks if he can kiss me. I was caught off guard and not comfortable yet, so I said ""ahh sorry, not yet..."" and he said he understood, but left the car without even a hug or anything. I texted him after to apologize again, saying that I'm just nervous in general with kisses, and thanked him for asking first and also for the lunch. I again thought he lost interest, but he's texted a few times already and seems still open to talking/going on another date. Now I'm not sure how to go forward. 

I guess for some context, I'm a female in my early 20s, and have never been in a relationship and have never been kissed. I obviously would love to have a kiss, but I have had a few instances of guys overstepping my physical boundaries and borderline harassing me before, so I ideally would like some physical touch progression (ex. nudge, legs touching, hand holding, ANYTHING) to gauge how comfortable I am and not to be caught off guard before a kiss. I liked that he was respectful to ask me before kissing, but it also kind of turned me off since it seemed so out of the blue and awkward. 

So far he seems like he would be interested in a third date, but I don't know if I should keep talking to him. From what I have heard, it seems like the 3rd date is a ""signal"" that a girl is definitely ready to kiss a guy if they haven't done it already. I would be interested in going on a third date to see if I am still attracted to him, but I don't want to set the expectation that I'm ready to kiss or lead him on in case I'm not attracted. I also don't want to be in a situation where he just ""goes for it"". Should I just be honest about my uncertainty and ask him to be friends? Should I be honest and tell him that I'm unsure but still open to seeing if there's a connection? Should I just continue texting and go on the next date as if the second one wasn't awkward? He does seem like a great, respectful guy, so I don't want to hurt him or anything.

TLDR: Went on a great first date with a guy but there was basically no physical contact. Second date was awkward, he cut it short, and then I rejected his kiss because I wasn't ready. Again to physical contact even though there were many opportunities, and I'm not sure if I like him anymore. Should I go on a third date to see what happens?

Thank you!!",True,False,False,dating,t5_2qhb1,967245,public,self,Should I go on a third date with this guy?,0,[],1.0,https://www.reddit.com/r/dating/comments/p95776/should_i_go_on_a_third_date_with_this_guy/,all_ads,6,,,,
