,id,created_utc,title,selftext,subreddit,subreddit_id,url
69,qlzcul,1635959980,FWB: He’s confused! End it now?,"Backstory: Me (30 F) and my FWB partner (26 M) entered this FWB back in Jan 2021. Initially, he claimed he wanted to pursue a long term relationship. But after a month, he later changed his mind after I confronted him regarding his true intentions. I ended up breaking it off with him (Feb 21) because I told him all he simply had to do was be honest. At that time , FWB was actually best for me due to my own circumstances. He was upset because of my choice. 

As summer passes, he will contact me sporadically but I’ll ignore him. This past August we rekindled in the midst of him getting a new job and  mom dying. 

We agreed to keep it strictly FWB. But it’s not happening. We are doing couple things: spending a lot time together, check ins , GM/Gn msgs, FaceTimes me while he’s working and during breaks (I work at home) , I spend the night over his place now a few days through the week or we get a hotel since him and his immediate family still lives there, tells me he misses me, spend hours on FaceTime while I work or once he’s off. Planning for my birthday, we go on dates ...couple stuff. 

He recently expressed he really likes me , developed feelings for me, admires my drive , ambition, etc etc. I motivate him. He thinks I’m the type of woman he needs. I feel the same  way.  But when I asked him “what are we doing?” He simply says he’s afraid of commitment.  

I told him today that I’m stopping all the extra activities we do, the physical and emotional intimacy , etc because it’s complicating things and I rather end it completely instead of being stringed along. Now he’s confused and keep questioning why??? 

What should I do? Is he reeeally using me as a placeholder until he finds better? Enjoying the benefits without the title? I’ll hate to stick around just to be hurt. It’ll be a year in Jan 22 for us knowing each other.",dating,t5_2qhb1,https://www.reddit.com/r/dating/comments/qlzcul/fwb_hes_confused_end_it_now/
70,qlzgzb,1635960295,My best friend loves me!,"So I’m a 21F and my friend is a 32M. We met in college and have bonded and shared a friendship for over four years now. Since graduating we’ve both moved and pursued our careers, however we always have made time to be there for each other and hangout when we can. Four years ago we talked about our relationship and friend zoned each other, I think he pushed for our friendship more. Now fast forward to today he loves me. He told me over dinner last night and it really shocked me. He’s my closest friend I’m afraid of losing him. Is being in a relationship worth risking our history?",dating,t5_2qhb1,https://www.reddit.com/r/dating/comments/qlzgzb/my_best_friend_loves_me/
71,qlzuqf,1635961362,Hi I want to meet some new girls.,Hey i want to meet some new girls to talk to. Add me on snapchat u/cediknabbert.,dating,t5_2qhb1,https://www.reddit.com/r/dating/comments/qlzuqf/hi_i_want_to_meet_some_new_girls/
72,qlzvb3,1635961409,My friend dislikes my boyfriend,"I have been friends with this girl on and off for about 6 years and have been with my boyfriend for 5. After a recent hangout my friend messaged me saying she doesn’t want to be around my boyfriend anymore because he makes fun of her. I am always present when we hang and all he says is “you are lame” as a joke. And according to her those comments make her cry after our hangout. I honestly think she’s overreacting because my boyfriend is a very social bubbly person who would never intentionally hurt anyone. 

What do you all think?",dating,t5_2qhb1,https://www.reddit.com/r/dating/comments/qlzvb3/my_friend_dislikes_my_boyfriend/
73,qm00v0,1635961833,180 disinterest.,"A few women now have pursued me for weeks, I give in, we go out a few times, things go well. I get invested in continuing things and they suddenly disappear.

I feel like my behaviour towards them doesn't change that much. And they started it, I feel like me caring won't be am issue.

This has happened three times so I think I'm doing something wrong but I don't know what.

Advice?",dating,t5_2qhb1,https://www.reddit.com/r/dating/comments/qm00v0/180_disinterest/
74,qm01oh,1635961898,Question for people who do hookups,"I had a girlfriend for 2 months. She was really hot.

 I found out she has a number of hookups she can call any time that she's been seeing for years. I'm pretty jealous she can get sex immediately and whenever. I'm also made uncomfortable that any attractive girl likely has this resource.

That said, she is pretty much addicted to hookups and it has sabotaged all her relationships -- she hasn't had anything last more than a few months yet she's in her mid 20s.

 To note, she's also the sweetest girl I have met to date, but has emotional issues...

So, is this normal? Or is she somewhat weird?",dating,t5_2qhb1,https://www.reddit.com/r/dating/comments/qm01oh/question_for_people_who_do_hookups/
75,qm0421,1635962086,Do I have dating phobia?,"I used to have a guy I liked a lot and apparently, he was very clingy and I didn't like it so when he asked me out, I was like no coz I feel like I'm entering a place which is complicated. It's been 3 years since then. Now, I finally found a guy who I think is perfect but I don't want to date him! I feel like what if he gets clingy too? What am I gonna do if I get bored of him? I cannot date him just for fun. And this keeps happening to me, I get afraid. What do I do?",dating,t5_2qhb1,https://www.reddit.com/r/dating/comments/qm0421/do_i_have_dating_phobia/
76,qm05r2,1635962220,Why is he making such an effort now?,"Matched with this guy countless times. The last time we matched was probably a month ago. He asked if I wanted to meet up and the vibe I got was he wanted to hookup. So I was straightforward and told him I want more than a fwb. He said he just got out of a relationship and wasn’t interested in that so we went our separate ways. 

Last night I get a message and it’s from him. He said “fuck it, let’s give it a shot” so I said ok, although my hopes aren’t high. He then asked when we could get together for dinner, I told him when I was free and he said he was busy. He then proposes days I can’t do. Where do we even go from here? He’s being unreasonable and just saying “busy” when I say “how about next weekend?” 

He’s the one who asked me to do something but can’t make it work? Why is he even making an effort out of nowhere? I made it clear I’m not looking to have sex anytime soon with him so… what’s his end goal?",dating,t5_2qhb1,https://www.reddit.com/r/dating/comments/qm05r2/why_is_he_making_such_an_effort_now/
77,qm06bl,1635962264,When did yall know you were ready or okay with dating someone with a kid?,"Of course if you never wanted to have kids then the answer is no, but for someone like me who wants kids at some point its real heard to know at what point im okay with being a step dad. Im 28m. i feel young to date someone with a kids, but Im seeing lots of single people with kids.   


I find the idea really complicating. At some point in the dating process your introduced to their kid and they become apart of the dating thing. Then what about their real dad?   


So far I swipe no on anyone who has a kid, but at some point I may need to change this. I just like the idea of being in a relation for several years before kids.   


If I were to meet someone IRL that I really liked and we clicked and I found out they had a kid then it would be different, but OLD I'm avoiding it.",dating,t5_2qhb1,https://www.reddit.com/r/dating/comments/qm06bl/when_did_yall_know_you_were_ready_or_okay_with/
78,qm06qw,1635962296,Do you have “the one that got away”?,[removed],dating,t5_2qhb1,https://www.reddit.com/r/dating/comments/qm06qw/do_you_have_the_one_that_got_away/
79,qm0ghf,1635963038,Why do my married female friends check up on me while my single female friends don’t?,"As a single man, I’ve been experiencing a pattern. My married female friends consistently send me text messages asking how I am, sending me invites to events, sending me happy holiday messages, etc while my single female friends never do… 

With my single female friends, I always have to initiate the conversation. 

I don’t want to ask any of them them specifically why they do this (because this would seem a bit intrusive), but it’s an occurring pattern I’ve noticed for years.

And yes they all know I’m single…",dating,t5_2qhb1,https://www.reddit.com/r/dating/comments/qm0ghf/why_do_my_married_female_friends_check_up_on_me/
80,qm0hb4,1635963101,Would you call this a date?,"So I am (23 F). I have never been in a relationship before. The first guy that I have ever approached wanted only to hook up ( spoiler alert: didn't get the hints me being me AKA stupid). Anyways, he lives in an apartment complex where one of my friends also live, so I met him there like a couple of times. We only hung out for like a couple of hours both times, flirted just a little bit, talked about some stuff, and over all more friendly than anything else, no kissing goodbye no nothing. So is that considered a date or not? If I speak to someone else, can I say I have never been on a date before and not be lying?",dating,t5_2qhb1,https://www.reddit.com/r/dating/comments/qm0hb4/would_you_call_this_a_date/
81,qm0he8,1635963107,Idk wtf is going on,"
I liked this guy for about 4 years, this year I finally decided to tell him because its my last year at school. 
Turns out he feels the same way about me so we decided to take things slow and “start talking” and i told him i don’t wanna everybody to know just yet, its been about two weeks and we barely talk we don’t text at all, and all we do is make eye contact and im getting really confused and starting to think that he doesn’t like me anymore.
I am waiting for him to talk to me first because my anxiety wont let me to talk him.
I don’t know what to do and its driving me insane.",dating,t5_2qhb1,https://www.reddit.com/r/dating/comments/qm0he8/idk_wtf_is_going_on/
82,qm0q9y,1635963794,Having Second Thoughts. I don't know what to make of them. Please help,[removed],dating,t5_2qhb1,https://www.reddit.com/r/dating/comments/qm0q9y/having_second_thoughts_i_dont_know_what_to_make/
83,qm0usi,1635964146,I just would like to vent that the holiday season makes me feel so lonely,"I’ve only had one serious relationship when I was 23 (not 27) and it didn’t last long. All my other dating encounters since then have either been casual or ones where we date 1-3 months and things end. 

I’ve never had a dating partner during the holidays, and although I feel EXTREMELY blessed for my friends and family during the holidays, I still feel lonely at no dating prospects. 

I recently was dating someone, and got my hopes up and imagined a future, but it ended after 2 months. The holidays approaching highlight that emptiness. Don’t get me wrong, I’m ok being single. I’d rather be single than with the wrong person. But, it doesn’t take away from the sentiment.",dating,t5_2qhb1,https://www.reddit.com/r/dating/comments/qm0usi/i_just_would_like_to_vent_that_the_holiday_season/
84,qm0zgu,1635964499,I felt defeated so I gave up online dating,"It's hard enough to find someone that is genuine and likes me for me in real life, I[24F] initially thought trying online dating would be *easier.* It's not. At least not for me it isn't. I feel like the majority people on those dating apps are just horny teenagers, old perverted men and fake wannabe celebrity personalities. Oh and the guys who are always ""flexing"", showing cash, showing the ""drip"" and materialistic stuff... all things I could really care less about. That doesn't turn me on and it sure as hell doesn't grab my attention. Just feels like nobody is actually serious on dating apps anymore, whereas I was. A bunch of fucking clowns honestly. Meanwhile, all of the actual genuinely sweet, awesome and down to earth guys and girls are constantly overlooked.

And I don't use Tinder, just wanted to clarify that. Never liked it to be honest! I already know literally almost nobody is looking for a genuine relationship over there😒",dating,t5_2qhb1,https://www.reddit.com/r/dating/comments/qm0zgu/i_felt_defeated_so_i_gave_up_online_dating/
85,qm11b2,1635964652,Does anyone else feel hurt when…,"The person you used to talk to a lot but then lost connection to and stopped talking for a couple weeks so that time with that person is over?

Like you know it’s not going any farther than what already happened but you have that tiny thought in the back of your mind that it could still happen one day but then out of nowhere, they unfriend you on social media and now it’s completely official that they’re done with you?

This just happened to me and to be honest it hurt a lot more than I thought it would. I was feeling a lot better trying to move on from that situation but now that they don’t even want to associate me on social media I feel sad again. Can someone help me find my crown?",dating,t5_2qhb1,https://www.reddit.com/r/dating/comments/qm11b2/does_anyone_else_feel_hurt_when/
86,qm126i,1635964721,Giving a small gift on the second date?,"I’m (25 f) going on my second date with a guy (27 m) on Saturday night this week. Our first date was a success and we immediately made plans to get to get her this weekend. 

During our first date he was telling me about the German Shepherd puppy he just got. I thought it was super cute how animated he got when he told me about the puppy. So today at the store I happened to see some chew toys for sale and I picked one up. 

What would you think of someone bringing something like this to your second date? Is it a little weird to bring a dog toy on a date? I was thinking of putting it in a little gift bag so he’s not carrying rubber bone around with him. FWIW I’ve known this guy for a while before we went on a date.",dating,t5_2qhb1,https://www.reddit.com/r/dating/comments/qm126i/giving_a_small_gift_on_the_second_date/
87,qm19cq,1635965276,I've been seeing this girl for 3 months now and we still havent had sex,"I started dating this girl i met in tinder about 3 months ago, shes ok with kissing but never wanted to take it further... well on saturday she asked me if I wanted to watch a movie at her house and I thought this was my chance, finally. after having dinner we got in bed to watch the movie and i started touching her a little, but she grabbed my hands and told me to stop. I asked her if she wanted me to leave and said no its fine. so we kept watching the movie. I asked her if we could kiss and she said yes but told me to put my hands away. while we were kissing I got horny and tried to grab her again and she got angry and told me to stop. I said I was really horny and that I needed to cum and she told me to just jack off so I pulled my pants down and started doing it, she was like wtf I meant in the toilet but I just kept going. I asked her if I could kiss her while doing it, she agreed... she even brought me a towel afterwards to clean up then we fell asleep. i went home the next morning, she seemed normal, not pissed or anything. we're still texting and making plans for this weekend so I think things are fine but I don't know. how normal is it for people to date for months and not have sex? if she was ok with sleeping next to me then she must have expectation that something was going to happen right? do you think theres some kind of problem here, I don't want to be pushy but I dont know what else to do I'm very confused.",dating,t5_2qhb1,https://www.reddit.com/r/dating/comments/qm19cq/ive_been_seeing_this_girl_for_3_months_now_and_we/
88,qm1g6v,1635965805,Lonely,"My name is juuu and I’m lonely (m24) Nyc 
Call or text me 9295108010 please please",dating,t5_2qhb1,https://www.reddit.com/r/dating/comments/qm1g6v/lonely/
89,qm1i8e,1635965957,"Career began to enter a stable period, very busy and very full, but back home, began to feel lonely","I am a 38F. 

I'm looking for something meaningful. 

I want to find a man who is as enthusiastic as I am. 

A person who thinks about me all day and is not afraid to send text messages. 

I am very strange, very casual, and sometimes I say the wrong thing. 

I hope there is a man over 35 years old who can talk to me endlessly.",dating,t5_2qhb1,https://www.reddit.com/r/dating/comments/qm1i8e/career_began_to_enter_a_stable_period_very_busy/
90,qm1loj,1635966203,What do these signals mean,"Little bit of context: I’m 5’11, light skin, decent shape(little chubby on the sides but arms are toned), flattop &amp; well dressed. So I was on campus and sat down in the lounge since all the tables were full. There was a couple sitting together (didn’t know until later) and the girl had glanced at me when I was on my laptop. When I moved to the table in front of them, her boyfriend got up and went behind her to give her a big hug and was kissing her cheek. I went back to work and when I looked up, she quickly looked back down on her sheet. I’m thinking it was just random eye contact then when I looked up again after 5 minutes she did it again. I been single all my life (23M) and don’t know if I’m over analyzing. What do you ladies think?",dating,t5_2qhb1,https://www.reddit.com/r/dating/comments/qm1loj/what_do_these_signals_mean/
91,qm1oqf,1635966435,I keep getting dates but...,[removed],dating,t5_2qhb1,https://www.reddit.com/r/dating/comments/qm1oqf/i_keep_getting_dates_but/
92,qm1sd6,1635966703,Is it possible to predict someone's age before asking them out/asking their number?,"I'm in my mid twenties (female) and just started at a new gym. I always see the same people whenever I go and there is a guy that I like, we talked once for like 2 minutes and now we say hi to each other all the time. I have a crush on him and am trying to muster up the courage to ask him to hang out/ask his number - but have no idea how old he is because I am not good at guessing men's age. I would feel weird if he is younger or much older than me - just a personal preference, nothing wrong with age gaps though!! 

If you are going to tell me to just ask him out anyways without knowing his age, please just don't respond because I already know I can do that, I just want to see if it is even possible to predict someone's age based on limited information. 

Also, I do not know his last name so I cannot just look him up on Facebook to see his birthday.",dating,t5_2qhb1,https://www.reddit.com/r/dating/comments/qm1sd6/is_it_possible_to_predict_someones_age_before/
93,qm1tyy,1635966825,Can You Spare A Moment?,"A lot of things has happened in the last couple of days that has shaken me to my core. First is the trauma of coming to the realization that I just may lose the main mother figure in my life and I’m straight terrified. She’s in critical care now. While there to go visit her I fell and sprained my ankle… but hours earlier I strained my back trying to lay her on the ground for the ambulance. So I message someone who I thought cared (my wayward bf), who claims he loves my family and especially her… I got no answer. It’s been days and it’s looking bleak. I’m in constant pain mentally and physically. I’m breaking down, all I want is a hug, something to ease my mind. I find out he can answer messages (he answered his brother, even called) but not mine. I can’t take the thoughts in my head. Can I get some positivity? I need some peace however I can get it right now.",dating,t5_2qhb1,https://www.reddit.com/r/dating/comments/qm1tyy/can_you_spare_a_moment/
94,qm1wsp,1635967041,Do Not Be Fooled By This Woman's ''Advice'',[removed],dating,t5_2qhb1,https://www.reddit.com/r/dating/comments/qm1wsp/do_not_be_fooled_by_this_womans_advice/
95,qm1y01,1635967132,Looking for anything,I’m 21 M looking for a female. I’m really looking for anything atm. I’m from the SF bay area in California. Currently I work at walmart and I just chill in my free time. Hmu if you wanna hang or smth.,dating,t5_2qhb1,https://www.reddit.com/r/dating/comments/qm1y01/looking_for_anything/
96,qm1yrh,1635967189,Am I the toxic one?,"So backstory- together for over a year and moved in together at the 9 month point. Throughout the relationship, things were never simple. He struggled with OCD so whether he was stressed about his ocd, or working 24/7, there was always other things he was worried about. His ocd was to do with cleanliness so I used to do everything to make sure I was as clean as possible, bring cleaning products to him, google ways to help him and I'd travel to clean his entire flat weekly before we lived together. He was also paranoid sometimes about my past and believed that due to me getting male attention before him, that I'd cheat on him and if I didn't respond to texts straight away, or if I didn't answer calls he would accuse me of cheating. I've never cheated on anyone and always been faithful. 
He was demanding in the sense of he wanted things done and them done now. He would ask for me to cook and to bake him things to take to his flat. He lived an hour away at this point and would call me at midnight and ask me if I could leave mine at 5am with the food to get to his for when he woke up. I'd do it everytime. I don't drive so I'd rather get cabs, or public transport. 
A couple of times I said no, and refused to do things for him, such as cook, or give him massages all the time, and he would quite simply just break up with me. 

Things got better in January after 6 months together, and in March he suggested renting a place together. We did this but straight away there was issues. He didn't like the rug I laid, didn't like how I done things. I rarely went out anywhere; but when I did it was constant calls asking when I'd be home. On his bday I arranged things to be delivered including presents and his favourite food, he went out with his friends instead. I was upset and packed a few clothes to go to my mums house. In anger, I threw a few of my clothes towards our kitchen. He was sitting by our window in the other direction and claimed I tried to assault him by throwing things. He called our estate agent, told them he was unsafe and needed to get out the tenancy as I was abusive. The agent called me and told me what he had said and told me she was sorry I was dealing with him and to get out ASAP before he ruined my life. 

I took him back, and on my birthday 1 month later he ended it with me when I asked him about a night out he was going on and he said he only got back with me after his bday for an easy life and was planning on leaving the tenancy at our 6 month break clause. He went out that night with condoms. The next day I was begging him to stay and apologising. I touched his arm to apologise and comfort him and he accused me of sexually assaulting him and told me I needed his consent. 

He moved out and I texted for days, begging him; pleading. Telling him how much I loved him. He said if I handed in my notice to leave the flat he would speak to me. I did that and then he still ignored me. He eventually blocked me. He came back a few days later, had sex with me and then accused me of trying to trap him into pregnancy, despite being on the IUD. He left again and after more begging he blocked me. 3ish weeks went by and he came back, same thing happened again and for the past 3 months we've been casually seeing eachother. He seems to be nicer these days and recently he's been very very affectionate and loving. I asked him about this and if he was feeling any different and wanted to get back together, and he turned on me and basically said we should stop seeing eachother, we're on a merry go round and that we need to move on. That same night he messaged and asked me where I was and if he could come over. I said no. 

He messaged a couple of days later basically saying he should've never asked to see me and he just wanted sex. He said we should stop speaking and that he will not be responding to any messages I send. And one of the reasons he doesn't want me is because I message too much and he's too tired to deal with me. 
I left it 4 days and messaged today asking how he is, as I do care for him. I said I am sorry if I'd made him feel any way or made him feel forced into seeing me. Asked him if he meant what he said and if he really wants nothing to do with me anymore.. and he ignored me. 
I messaged again and said if it's easier than responding he can just block me so I get the message and then that way I won't try anymore. And he's read it and ignored it and not blocked me. 

I'm so confused. But the more I think of it, the more I wonder if I'm the toxic one and I'm the reason why things are like this?",dating,t5_2qhb1,https://www.reddit.com/r/dating/comments/qm1yrh/am_i_the_toxic_one/
97,qm1z72,1635967222,Is it possible for me to find my partner here?,"The weather began to slowly become cold, we also want to wear more clothes, I hope you do not catch a cold, from strangers care.

&amp;#x200B;

You good, happy to make friends here chat, I am a girl, like sports like diving, playing golf, swimming, going to the beach for a walk, a low parachuting, bungee jumping, skiing, horseback riding, travel, because I seldom go to other countries to travel, the outbreak before no outbreak of time I often go to travel, go to Europe, France, Germany, Turkey, China, Many countries have also been to Africa to help some refugees, so that they can get better help, but my own strength is not enough, so I hope you can also help that country,

By the way, I'm looking for an interesting chat, and friendship, to see what kind of relationship takes place and see how far we can go.

And I'd love for you to text me.",dating,t5_2qhb1,https://www.reddit.com/r/dating/comments/qm1z72/is_it_possible_for_me_to_find_my_partner_here/
