,id,created_utc,title,selftext,subreddit,subreddit_id,url
0,of60oc,1625611583,What do women look for in dating sites?,"So going to almost 2 years actively being in dating sites, and in all 2 years and numerous messages which are only left on read I've only gotten 5 replies which 3 are just bots and the other 2 only said I'm not what they're looking for. 

I'm starting to feel like dating sites are just scams for men to pay and keep paying since we'll spend days messaging girls only to get no replies. Kind of starting to feel bad about myself. 

I don't know if it's just the way I try to initiate a conversation or just the way I look (kind of starting to feel i'm hideous) but I sometimes look at myself and well I'm not the ugliest nor the most attractive, I could loose some weight for improvement, I'm a nice guy, educated, good job, have a good heart and intentions, so why is it so hard to get a reply?  What do women look for on dating sites? what kind of messages attract their attention? 

&amp;#x200B;

And just for curiosity, do any guys get bombarded with messages???",dating,t5_2qhb1,https://www.reddit.com/r/dating/comments/of60oc/what_do_women_look_for_in_dating_sites/
1,of61x8,1625611693,"How much of one's own past should one dredge up, and when, exactly, should it be so dredged?","Hi, all!

Long-time lurker; first-time poster.

I am 38, a man, occasionally bearded. A couple of years ago, I stepped out of the dating pool and have remained on the sidelines ever since. There are, to my mind, plenty of good reasons for doing so. But I have reached a point where I am beginning to think that dating is, inevitably, going to be part of my future and, in any case, *ought* to be part of my future; it is something that I desire to do, both for myself and for the sake of the happiness of whoever it is that I wind up with. That said, it is difficult to know where to begin, for reasons that I will go into below.

I spent much of my twenties teaching English abroad in quite a few less-than-friendly locales. Along the way, I picked up a pretty gnarly anxiety disorder and -- along with it -- a tendency to self-medicate. (Such is the grisly fate of many a TEFL instructor.) For a long stretch of my thirties, this arrangement was manageable: I was, to all appearances, an alcoholic, but a highly functional one. I was friendly, hyper-social, productive, creative; given to drinking too much and talking too much while drunk, but never violent and seldom snarky or mean. But, needless to say, this arrangement didn't hold. Hangovers turned into acute withdrawal, which demanded further drinking to stave off death. This all came to a head right around the time the pandemic hit. I required medical treatment to help wean me from the alcohol and the benzodiazepines that had once shielded me from panic, but were now threatening to take my life.

I am, by now, a year and three months sober. I am fortunate in that drinking did not take a toll on my physical health; I am fortunate in that sobriety is easy for me. A kind of mental switch was flipped at my lowest point, and the old habits of a decade appeared to evaporate all of an instant. From that point forward, I put in the work. I spent two months in intensive outpatient treatment; I attend weekly meetings, meditate, exercise obsessively, read the Stoic philosophers, and do all of the things that one is supposed to do when threatened by a deadly disease. I do not struggle with cravings and have not come close to a relapse, though I well know that I must also remain mindful of the risk -- pride goeth before destruction and what have you.

I believe (as all of us do) that I have quite a lot to offer someone. I am en route to a Master's program and, provided that the United States does not disintegrate within the next few years (admittedly a bold assumption), I anticipate being quite happy and successful in life. But all that said: I still harbor too many doubts to mention. 

I do not any longer doubt my commitment to sobriety or my ability to remain sober, but I worry that my past will forever remain nipping at my heels. How to begin to explain my past to a future partner? How to provide her with the sort of assurances necessary to sustain a relationship, when addicts are *notorious* for backsliding, for falling back into destructive and antisocial patterns of behavior, for playing fast and loose with the truth? Even if I no longer fear these aspects of the booze-addled personality that I cobbled together over the years, how could I possibly demonstrate this to someone who, at first, will know me not at all?

In the past, I have been forthcoming with others about my struggles. For as appreciated as honesty is in some circles, it can also alienate people. Most of us have an addict in our lives, and it is natural to associate the addicts that we meet with the addict that we *know*. Needless to say, it is often a painful association, and not one that some people are willing to engage with. So I tread more cautiously these days; I tell those who wish to know, but refrain from bringing it up where I don't have to. Obviously, in a relationship, this is exactly the sort of stuff I would want to -- and need to -- share with someone.

But how to go about it? This certainly isn't first date fare. It might not even be second or third date material. But the past, no matter how grim and no matter how compromising, eventually must be shared with one's partner, because it is the past that makes us who we are. I feel that my past has strengthened me; without having flirted with death for so long, I might not have such a strong appreciation for life; I might not be so dedicated to the principles that make me a good person or, at any rate, that make me a much better person than I was before. So all of this must be shared. But I also have to assume that my background will be disqualifying for a lot of people; it will also sow distrust into whatever trust exists; but I suppose that is my question. Is this the sort of thing that people are willing to work with, or is it best to remain sequestered in my house with my cat until I've tucked more sobriety under my belt?

Thanks for any and all feedback! And cheers to all those who have struggled with addiction, or with partners who have; it is truly one of the most fearsome predators on earth, and I am lucky to have survived it. Anything else that I get out of life from this point forward is a bonus.",dating,t5_2qhb1,https://www.reddit.com/r/dating/comments/of61x8/how_much_of_ones_own_past_should_one_dredge_up/
2,of68hv,1625612269,How much of a turn-off are braces for women?,"M here. I’ve always viewed braces as a middle-high school thing, but now I have to get them at the age of 20 for a few years. 
So now I’m really concerned about how they would look. What’s your opinion on braces at this age? Do you generally find them ugly/gross? Is it ever a dealbreaker for potential relationships?",dating,t5_2qhb1,https://www.reddit.com/r/dating/comments/of68hv/how_much_of_a_turnoff_are_braces_for_women/
3,of6d5l,1625612697,The complement issue,"When I complemented a female on her looks, she said she didn’t believe even though I know I was being genuine. How do I handle this situation? This can be mentally frustrating",dating,t5_2qhb1,https://www.reddit.com/r/dating/comments/of6d5l/the_complement_issue/
4,of6iqy,1625613206,I give up on dating men lol,"Just when I thought I found a “normal” guy who has a job, isn’t mentally abusive, wasn’t a player, told me he wanted something serious and long term, even deleted his dating apps in front of me - welp, got ghosted! I’m not too upset, I’ve moved on, I wasn’t that into him anyways but to top it all off I just found out (after many suspicions) that he lied about his father passing away back at the end of may. There was no obituary in the newspaper or online which I thought was fishy. And then I looked up his father on LinkedIn, and his father was active on it 4 days ago. Um, excuse me what? Sir, how are you active on LinkedIn? I thought you were supposed to be dead. Wtf is wrong with people.",dating,t5_2qhb1,https://www.reddit.com/r/dating/comments/of6iqy/i_give_up_on_dating_men_lol/
5,of6ov9,1625613779,Will it happen when I least expect it? Leaving it to destiny,"Long story short as I have ranted before I have deleted dating apps for a month now since they were destroying my mental health and I was tired of always swiping/looking for someone. I believe in destiny, but just wanted to hear people’s thoughts of it to happen without me being on apps or pressuring myself to find someone?",dating,t5_2qhb1,https://www.reddit.com/r/dating/comments/of6ov9/will_it_happen_when_i_least_expect_it_leaving_it/
6,of6ql3,1625613946,sad story: 24(M) got dumped/discarded in the middle of uni prom by 24(F) prom date.,"i have always had a crush on this girl in class, so when college prom rolled along (my uni had a prom), i mustered up my courage to ask her to be my date. Surprisingly, she said yes!

on the evening before the prom, i spent about 2 hours and a sum of money to make myself as good looking as possible for my date. I got a new haircut and went shopping for a new shirt. I bought a new body fitting shirt which i thought looked pretty good. 

The prom started with a 3 course meal dinner. We sat down in our respective tables. Halfway through the first course my prom date dissappeared. i thought she had gone to the toilet.  

15 minutes passed and she was still not back yet. i got worried and excused myself from the table, went to look for her, thinking that she must have fainted or something. Went to the toilet, she wasn't there. texted her, no reply. 

Eventually, i came back to the table after all the course meals were already served, and then asked the girl sitting next to me (someone else's prom date) on the table whether they have seen my prom date. she looked at me with a pitiful expression and then told me that my prom date was with another guy on table no 15. 

my heart sank. it was like the worst day of high school all over again. I looked at table 15 and sure enough, she was there, with a tall, jock-looking guy who looked like he was in uni on an athletic scholarship. I saw the way she acted with him was so different towards me, she was laughing, pawing him, her hands on his lap and shoulder. later on, i heard that they had just met while she was on her way to the front of the hall to take pictures, and promptly hit it off. 

I pretended like everything was ok and put on a fake smile on my face, proceeded to eat my meal. after that, it was all i could take and i decided to go home because i felt like crying. did not want anyone to see my man tears. so i quickly made for the exit and.....ran into my prom date with her new jock date of all people!

at first, i pretended not to see them, hoping i could make a beeline for the exit as quick as possible before she saw me becasue i was so embarassed of myself. but she saw me and, probably feeling sorry for me, blurted out ""hey, where are you going?"" i blurted out in reply: ""not feeling well, going home now"". i could tell she was feeling sorry for me from her facial expression, so she whispered to me: ""i'm sorry"". then she went back to taking pictures with her new jock date. 

i felt like i had been hit by a ton of bricks when i got to my car. i stayed in my car for an entire hour crying, not just out of sadness, but out of embarassment.",dating,t5_2qhb1,https://www.reddit.com/r/dating/comments/of6ql3/sad_story_24m_got_dumpeddiscarded_in_the_middle/
7,of6sau,1625614113,"33M, single and ready to mingle.","Looking for Female to chat, date and something serious long-term",dating,t5_2qhb1,https://www.reddit.com/r/dating/comments/of6sau/33m_single_and_ready_to_mingle/
8,of6tog,1625614238,Feeling unwanted,[removed],dating,t5_2qhb1,https://www.reddit.com/r/dating/comments/of6tog/feeling_unwanted/
9,of72mx,1625615128,LTR ended but I still have hopes we will reconnect in the future. Anybody have any experience in this?,"Hi, thank you for taking the time to read this. I will keep it short but if you’re interested to know more or just for a conversation, message me :) 

My (24F) now ex-bf (23M) broke up with me about a month ago after being together for 3.5 years.
He said he doesn’t feel the same anymore and doesn’t see a future with me. 
I saw some signs but I thought there was a consensus of growing together and working on things because we loved each other. 
I still have foolish hopes that we will reconnect and get back together in the future. 

If you have any similiar experience, advice, anything of the sort let me know. Thank you.",dating,t5_2qhb1,https://www.reddit.com/r/dating/comments/of72mx/ltr_ended_but_i_still_have_hopes_we_will/
10,of76lk,1625615500,Breaking up with girlfriend after one month over chemistry?,"So I’ve (23M) been exclusive with this girl (21F) for a month now and we dated a bit before that, and I got this realization that there is not that much chemistry. At the beginning we clicked fairly well, we had similar interests and life goals. But as I got to know her and date her properly I’ve realized we’re quite different people. She self describes herself as a non social introvert and spends most of her time at home watching TV and I tend to be more of a social extroverted out with my friends getting drinks kind of guy.

Other wise she’s an amazing person, she’s smart as a whip and creative and beautiful. But I have this inkling feeling that although our similarities in hobbies and interests, we may not have a lot of similarities in values and compatibility.


I’ve been thinking on breaking up with her for this reason but I also don’t know if that’s also because the honeymoon phase is over and the issue is actually that I can’t accent stable companionship. I’ve seen a lot of post of people breaking up for losing the ‘spark’ and I’d hate to break off a perfectly healthy relationship because I was too caught up in my own self doubt.

Am I being stupid or has the relationship run it’s course?",dating,t5_2qhb1,https://www.reddit.com/r/dating/comments/of76lk/breaking_up_with_girlfriend_after_one_month_over/
11,of77yb,1625615629,15 and 13... How much of an age gap is too much?,"I see a lot of people saying the age gap limit for teenagers dating is 2 years, and I see a lot saying it's weird. I'm kind of going through a rough situation, I'm turning 15 and the boy I like is 13. He's not all that immature and we've been talking for a year. He's in 8th and I'm going into 10th, please let me know your thoughts and advice",dating,t5_2qhb1,https://www.reddit.com/r/dating/comments/of77yb/15_and_13_how_much_of_an_age_gap_is_too_much/
12,of78y4,1625615726,Why do girls put themselves in situations?,"When ur dating a girl, why do they put themselves in situations that will cause weird dudes creeping on them. You may call it insecure but if it was the reverse, girls would get mad at their bf for so and so. My girl doesnt do it but like if u have a bf, why are u entertaining dudes or acting dense when it looks like they are trying to make moves on you. Nobody likes to see their gf or bf get hit on or flirted with and they are being nice about it. Usually when a girl tries some weird shit with me, i clown them and run them off aggresively. If a girl was hitting on me and i was being nice about it, my gf would give me the passive aggresive 1 word responses. So why is it mainly girls bluntly allowing themselves in situations?",dating,t5_2qhb1,https://www.reddit.com/r/dating/comments/of78y4/why_do_girls_put_themselves_in_situations/
13,of7fso,1625616359,What are the successful men doing that i'm not?,"So I'm (M,22, 6'1, 183lbs) currently grinding away 40hrs per week at this wonderful job that's called a trade. I love it, it's fun work, super engaging, and chill. It pays well too! Working out is like, a #1 staple in my daily routine so I'm super fit, and in shape. Just for the record though, I'm not lifting for women, it keeps me sane and is a pretty good stress reliever but here's the problem. I've been starting to get these episodes where I just have an intense desire for human affection. Not being too fond of relationships at the moment, even though it's a possibility, my skin hunger is going fucking nuts right now. As you can see, i'm kind of motivated to get out there in the dating market and see what's out there for me. Here's a few issues i'm working on so hopefully you guys can help out a bit!

1. I have very few friends, which has never bothered me, but I am making an effort to speak more to others. I'm not weird or anything, just very selective of who I let into my inner circle.
2. Living in Jacksonville, there are not that many great places to meet women without having to cough up a few dollars for a drink. What I mean is, I don't like to go to bars frequently, or nightclubs. Nightclubs are too expensive to even begin to speak to women. (VIP area, expensive drinks, etc.) 
3. The only women visibly interested aren't anywhere near my preference.

(Don't get me wrong here, i'm handsome, and very smooth with my approach when it comes to women, but my main issue is trying to figure out what the high value men are doing compared to my futile efforts in the dating world, thanks!)",dating,t5_2qhb1,https://www.reddit.com/r/dating/comments/of7fso/what_are_the_successful_men_doing_that_im_not/
14,of7giq,1625616426,Idk what to do anymore,"(21M) Idk what to do anymore. I was never v popular with girls growing up, but in my later teens had an amazing relationship that lasted a few years. After we split up, I've had several things with girls that have just never ended up working out. It's been two years now and I've not had any proper relationships since. I cant put my finger on it, but nothing has worked ever since this last relationship and I have no idea why or what to do. I'm really losing confidence in myself. Any advice? I'd try anything rn",dating,t5_2qhb1,https://www.reddit.com/r/dating/comments/of7giq/idk_what_to_do_anymore/
15,of7gx9,1625616465,30F wondering about the reality of B.O. in relationships,"I’ve been single for a very long time but in the last year, I got into a serious relationship and now we are looking to move in together. 

The thing that I’m worried about though is the reality of being around each other and smelling each other’s everyday smells… For example, I’ve never been around him after a workout or when I’ve been working in the garden all day. Usually when he seems me, I’m freshly showered and all scented up. Don’t get me wrong, I don’t have chronic body odor but I am a little bit riper than average after vigorous activity…so I’m worried about him smelling me and me even being surprised by the new smells I’ll encounter while living with him.

I’m curious to hear people’s experiences when they first move in with a partner and how you dealt with new smells. More specifically if it bothered you, how did you bring it up gently?",dating,t5_2qhb1,https://www.reddit.com/r/dating/comments/of7gx9/30f_wondering_about_the_reality_of_bo_in/
16,of7iel,1625616604,Changing username,"Hi.  As they say all things must come to an end.  I'm deleting this username because it kind of wasn't that good...I do have another one --&gt; Moo\_shade if you are interested in following that one! K, see you on that one.",dating,t5_2qhb1,https://www.reddit.com/r/dating/comments/of7iel/changing_username/
17,of7ly2,1625616945,how do i move forward after being cheated on?,basically the title - giving this guy i’ve been seeing for 8 months another chance after cheating on me (sexting;still counts as cheating) how do i move forward and not worry about his female friends that he claims are strictly just friends? thanks!,dating,t5_2qhb1,https://www.reddit.com/r/dating/comments/of7ly2/how_do_i_move_forward_after_being_cheated_on/
18,of7u8m,1625617751,cheated several times,[removed],dating,t5_2qhb1,https://www.reddit.com/r/dating/comments/of7u8m/cheated_several_times/
19,of7x6x,1625618038,oh man,"What does a girl want her bf to do for her? My girl: quiet but laughs a lot, has a lot of fun on our dates. But bored a lot, and unfortunately I work a lot.",dating,t5_2qhb1,https://www.reddit.com/r/dating/comments/of7x6x/oh_man/
20,of7yex,1625618155,I was monkey branched and I barely recovered.,"I still feel nauseous thinking about the entire situation. 

A lot of money, tears, years, and opportunities were wasted on recovering from trauma—all because someone chose to be emotionally dishonest.

And yet, I'm still trying to put myself out there. Sometimes I feel like I would rather be alone. Then I cry about it.",dating,t5_2qhb1,https://www.reddit.com/r/dating/comments/of7yex/i_was_monkey_branched_and_i_barely_recovered/
21,of838h,1625618635,Why isn’t interested in sex?,"I am 28 she is 26. We been speaking since November. She calls me and texts me everyday. We live 1 1/2 hour from each other. We had sex once at my apartment the only time she has come over and we tried again to have sex in March in her car but she was rushing me because she was paranoid and I couldn’t get excited. Last Friday, she gave me a handjob in her car until I orgasmed and the whole time she was telling me not to get my hopes up she’s not doing nothing more. On sunday, she was rubbing on my erection and she asked me who is going to take care of it once she leaves. She claims she’s a busy nursing student who doesn’t have time to come see me so I always go to her and I take her out to eat which she never pays because she claims that she is broke. Whenever I tell her to come over to hangout , she tells me she’s just not coming over to have sex even though she claims to be a freak. We always have a good time and have a lot laughs when we together but that part bothers me because it feels like she is leading me on",dating,t5_2qhb1,https://www.reddit.com/r/dating/comments/of838h/why_isnt_interested_in_sex/
22,of8c31,1625619545,Wants to talk?,[removed],dating,t5_2qhb1,https://www.reddit.com/r/dating/comments/of8c31/wants_to_talk/
23,of8e6s,1625619744,Manipulation,[removed],dating,t5_2qhb1,https://www.reddit.com/r/dating/comments/of8e6s/manipulation/
24,of8f08,1625619821,Change for couples,[removed],dating,t5_2qhb1,https://www.reddit.com/r/dating/comments/of8f08/change_for_couples/
25,of8gfl,1625619951,can i still have a normal relationship with a thin penis? Im nervous that my girth will not make her satisfied,"Im 6.5 inches long but 4.3 girth at the thickest area and 4.2 thinnest area.


My size makes me insecure and i feel like most women wont enjoy it.",dating,t5_2qhb1,https://www.reddit.com/r/dating/comments/of8gfl/can_i_still_have_a_normal_relationship_with_a/
26,of8i8c,1625620127,I regret never trying.,"Hi, I’m a 22m, entering my last year of college this fall.

I think the biggest regret I have in life so far is that I never tried dating. Any (of the admittedly few) relationships I’ve ever had with a girl were 100% platonic. I’m definitely attracted to women, I just never made an effort.

Anytime a girl would try to talk to me in class, I could never really open up to them. I guess I’ve always assumed I wasn’t good enough for them or that they were just being nice.

So instead of ever being rejected by a girl, I’ve spent the last three years of college basically rejecting myself... and that really hurts.",dating,t5_2qhb1,https://www.reddit.com/r/dating/comments/of8i8c/i_regret_never_trying/
27,of8pum,1625620907,Modern day dating,Modern day dating isn’t even worth attempting right? I’m becoming more and more at peace with it. I just regret not making it a priority in like 2010-2011 before social media took over,dating,t5_2qhb1,https://www.reddit.com/r/dating/comments/of8pum/modern_day_dating/
28,of8qc1,1625620956,Bumble's the best dating app because you know the woman is actually interested in you since she messages first.,[removed],dating,t5_2qhb1,https://www.reddit.com/r/dating/comments/of8qc1/bumbles_the_best_dating_app_because_you_know_the/
29,of8uo9,1625621397,Should I shoot my shot with a former coworker?,"I manage staff at a clinic and one of the ladies who works with me was recently fired. She is very nice, but got into an argument with a different manager and was fired for a silly reason. I always got flirtatious vibes from her, but because I was her manager I never acted on that because it would be way out of line for me to do so. Now that she's fired, would it be worth it to send a text letting her know how I felt? 

I'm still hesitant because I let her know she could use me as a reference and as a result there's still an awkward power dynamic where she may not want to say no because she doesn't want to risk losing a reference. I'd still give her a stellar reference either way, but she may not know that.

Should I go for it or am I out of line as her former supervisor?",dating,t5_2qhb1,https://www.reddit.com/r/dating/comments/of8uo9/should_i_shoot_my_shot_with_a_former_coworker/
30,of8viv,1625621480,They Won't Fulfill My Sexual Needs,"They give out their number, are willing to meet for a first date. I don't initially spam them with dick pics and ask for netflix n chill, but after a few weeks slowly initiate the conversation into sex and they just bail always. I'm not some 12yo who hasn't hit puberty. Why do I have to always walk on egg shells about this topic? Do they expect me to marry them first before sex? I just don't get it. They are trying to get everything they can out of me, but it's like once they need to put in their side of the work for the relationship to work they just jump ship.",dating,t5_2qhb1,https://www.reddit.com/r/dating/comments/of8viv/they_wont_fulfill_my_sexual_needs/
