,all_awardings,allow_live_comments,author,author_flair_css_class,author_flair_richtext,author_flair_text,author_flair_type,author_fullname,author_is_blocked,author_patreon_flair,author_premium,awarders,can_mod_post,contest_mode,created_utc,domain,full_link,gildings,id,is_created_from_ads_ui,is_crosspostable,is_meta,is_original_content,is_reddit_media_domain,is_robot_indexable,is_self,is_video,link_flair_background_color,link_flair_css_class,link_flair_richtext,link_flair_template_id,link_flair_text,link_flair_text_color,link_flair_type,locked,media_only,no_follow,num_comments,num_crossposts,over_18,parent_whitelist_status,permalink,pinned,pwls,retrieved_on,score,selftext,send_replies,spoiler,stickied,subreddit,subreddit_id,subreddit_subscribers,subreddit_type,thumbnail,title,total_awards_received,treatment_tags,upvote_ratio,url,whitelist_status,wls,removed_by_category,author_cakeday,post_hint,preview
0,[],False,Tehgoldenfoxknew,,[],,text,t2_eapk4l7s,False,False,False,[],False,False,1630888001,self.dating,https://www.reddit.com/r/dating/comments/piooy6/how_to_ask_out_someone_out_on_a_date/,{},piooy6,False,True,False,False,False,True,True,False,#ea0027,dating,"[{'e': 'text', 't': 'I Need Advice'}]",19ec58c2-9f74-11e7-81a1-0e2bf15991f0,I Need Advice,light,richtext,False,False,True,29,0,False,all_ads,/r/dating/comments/piooy6/how_to_ask_out_someone_out_on_a_date/,False,6,1630888012,1,"I matched with someone on Tinder last week and we’ve been talking everyday since. The only issue is that she lives about an hour away and we are both stem related majors. 

I want to ask her out on a double date to mini golf but every time I get close to asking I get awkward and can’t seem to find the right timing. 

I’m normally not an awkward person, but I keep getting flustered. I don’t know why I can’t seem to bring myself to do it. 

Anyone have tips for the right timing? Or am I over thinking things? 

Sorry for the post, I’m just inexperienced and don’t want to screw things up.",True,False,False,dating,t5_2qhb1,990808,public,self,How to ask out someone out on a date?,0,[],1.0,https://www.reddit.com/r/dating/comments/piooy6/how_to_ask_out_someone_out_on_a_date/,all_ads,6,,,,
1,[],False,Cosack,,[],,text,t2_e6lnm,False,False,False,[],False,False,1630888520,self.dating,https://www.reddit.com/r/dating/comments/piotop/changed_hairstyle/,{},piotop,False,True,False,False,False,True,True,False,#ea0027,dating,"[{'e': 'text', 't': 'I Need Advice'}]",19ec58c2-9f74-11e7-81a1-0e2bf15991f0,I Need Advice,light,richtext,False,False,True,6,0,False,all_ads,/r/dating/comments/piotop/changed_hairstyle/,False,6,1630888531,1,"27M, have been dating 24F with woven in braids for a few months. Suddenly, she decides to take them out and switch to her natural hair, which looks completely different. I don't find her nearly as attractive with this hairstyle. She looks like a different person.

How do I have this conversation without being super mean? Every metaphor I can think of here is really mean.

No double standards here btw. I've styled my hair most days for most of my life since I discovered hair products, and regularly get haircuts to keep the overall style in check. There isn't even a time commitment difference here: from her words, her braids were effectively zero maintenance between once in half a year four hour visits to a salon. My one hour at the barber once a month or two adds up to about the same.",True,False,False,dating,t5_2qhb1,990815,public,self,Changed hairstyle,0,[],1.0,https://www.reddit.com/r/dating/comments/piotop/changed_hairstyle/,all_ads,6,,,,
2,[],False,Registeelurgirl,,[],,text,t2_26ug255m,False,False,False,[],False,False,1630889270,self.dating,https://www.reddit.com/r/dating/comments/pip0ml/women_of_reddit_do_you_talk_to_your_girlfriends/,{},pip0ml,False,True,False,False,False,True,True,False,#ff4500,dating,"[{'e': 'text', 't': 'Question'}]",a9531dce-194e-11e5-b177-0eff099c3d1f,Question,light,richtext,False,False,True,7,0,False,all_ads,/r/dating/comments/pip0ml/women_of_reddit_do_you_talk_to_your_girlfriends/,False,6,1630889281,1,"# 

for us, when we like a girl we mostly keep it to ourselves. but when things escalate like if she becomes our GF, we might invite our bros to know some details like how we met, etc

I would think it is a bit different for girls? like maybe you might see a cute guy at a running club, at your new job and you immediately share that with your gf's? you might ask your gf for advice, what you should do to get him to notice you? or do you also keep it entirely to yourself?

if it is the former, what exactly do you talk about? how has it help you eventually get the guy if that was your end goal?",True,False,False,dating,t5_2qhb1,990834,public,self,"women of reddit, do you talk to your girlfriends about guys/crushes like how guy's do?",0,[],1.0,https://www.reddit.com/r/dating/comments/pip0ml/women_of_reddit_do_you_talk_to_your_girlfriends/,all_ads,6,,,,
3,[],False,aaaaddddhhhlllppp,,[],,text,t2_ecwyd509,False,False,False,[],False,False,1630889333,self.dating,https://www.reddit.com/r/dating/comments/pip16m/am_i_a_bad_person_for_leading_someone_on_and_then/,{},pip16m,False,False,False,False,False,False,True,False,#00a6a5,dating,"[{'e': 'text', 't': 'Support Needed'}]",fd9c03b8-a1ce-11e7-9172-0e8c9f9ecf4c,Support Needed,dark,richtext,False,False,True,1,0,False,all_ads,/r/dating/comments/pip16m/am_i_a_bad_person_for_leading_someone_on_and_then/,False,6,1630889343,1,[removed],True,False,False,dating,t5_2qhb1,990835,public,self,Am I a bad person for leading someone on and then refusing to have sex,0,[],1.0,https://www.reddit.com/r/dating/comments/pip16m/am_i_a_bad_person_for_leading_someone_on_and_then/,all_ads,6,moderator,,,
4,[],False,supbiatches1,,[],,text,t2_1v1ted4b,False,False,False,[],False,False,1630889525,self.dating,https://www.reddit.com/r/dating/comments/pip2w2/does_anyone_else/,{},pip2w2,False,True,False,False,False,True,True,False,#ff4500,dating,"[{'e': 'text', 't': 'Question'}]",a9531dce-194e-11e5-b177-0eff099c3d1f,Question,light,richtext,False,False,True,56,0,False,all_ads,/r/dating/comments/pip2w2/does_anyone_else/,False,6,1630889536,1,"Does anyone else wish they could ""turn off"" their desire to find love or affection? These emotions seem to be nothing but a great burden. I wish there was some way to stop it altogether.",True,False,False,dating,t5_2qhb1,990836,public,self,Does anyone else?,0,[],1.0,https://www.reddit.com/r/dating/comments/pip2w2/does_anyone_else/,all_ads,6,,,,
5,[],False,Equivalent-Western56,,[],,text,t2_b8b99y3c,False,False,False,[],False,False,1630889554,self.dating,https://www.reddit.com/r/dating/comments/pip35y/dmed_my_crush_she_responded_but_im_confused/,{},pip35y,False,True,False,False,False,True,True,False,#ea0027,dating,"[{'e': 'text', 't': 'I Need Advice'}]",19ec58c2-9f74-11e7-81a1-0e2bf15991f0,I Need Advice,light,richtext,False,False,True,6,0,False,all_ads,/r/dating/comments/pip35y/dmed_my_crush_she_responded_but_im_confused/,False,6,1630889565,1,"I dmed this girl who I had some mutual friends with back in high school when she transferred to our college. She responded and we talked a bunch then I invited her out and she said yes then day of she flakes and promises we will go soon. Then I ask her if she’s free on another day and she is busy then and outlined the rest of her schedule and was busy every day for the next couple weeks but asked if I would be free this weekend to do hang out but I had plans to go to one of the best CFB game of the year that I already paid for. She said most of the time she couldn’t do anything she had plans already with friends, so I am not sure where to go from there and she didnt respond to my last message a few days ago. So, advice?",True,False,False,dating,t5_2qhb1,990837,public,self,"DMed my crush - She responded, but I’m confused.",0,[],1.0,https://www.reddit.com/r/dating/comments/pip35y/dmed_my_crush_she_responded_but_im_confused/,all_ads,6,,,,
6,[],False,loosethoughts101,,[],,text,t2_cv7e7rey,False,False,False,[],False,False,1630889618,self.dating,https://www.reddit.com/r/dating/comments/pip3ri/long_distance_advice/,{},pip3ri,False,True,False,False,False,True,True,False,#ea0027,dating,"[{'e': 'text', 't': 'I Need Advice'}]",19ec58c2-9f74-11e7-81a1-0e2bf15991f0,I Need Advice,light,richtext,False,False,True,3,0,False,all_ads,/r/dating/comments/pip3ri/long_distance_advice/,False,6,1630889630,1,"I met this guy on tinder and when we hung out in person we realllyyyy clicked. We had the same life goals, talked for hours and I just had the best time ever. The only problem is he lives in a different state. I see him when he comes to visit maybe 2-3x a month for work and when we see each other in person it’s amazing. However, when we’re away from each other, we rarely talk. We text a couple of times a week and he usually messages me first asking asking me how my day was and what i’m up to, but our texting convo is always so dry and boring. We never facetime or call either because i’m worried we’ll have nothing to talk about (even though we talk for hours in person). He posted on his snap story today and i’m pretty sure he’s on a date. It makes sense because it’s not like we’re in a serious relationship so of course he’s dating around but idk if I should just give up on him…it’s been 2 weeks since i’ve last seen him and we’re both not sure when he’ll be back in my state for work (we only see each other when he’s here for work). 
im honestly tempted to delete his number and unfriend him on social media. Although I really like him, I just don’t think long distance will work for us and it makes me sad knowing he’s dating around and i’m here waiting for him to come visit again 
I’m kinda scared to text him about ending things because it’s not like we’re in a relationship or anything (idk what we are) so he’d probably be weirded out that i’m asking him to end things when there’s nothing wrong 

or should I just wait things out, date other people like him and see if him and I work? idk what to do:(

he’s a super sweet guy though, we’ve been on 8 dates and didn’t sleep with each other until the 5th date and he told me he wanted to wait for me to be ready because he didn’t want me to think he was only using me for sex (when we first started talking I told him that was one of my concerns). there’s nothing wrong with our “relationship” at all besides him being in another state and us rarely ever talking besides a couple of times a week

i need advice please:(",True,False,False,dating,t5_2qhb1,990839,public,self,long distance advice,0,[],1.0,https://www.reddit.com/r/dating/comments/pip3ri/long_distance_advice/,all_ads,6,,,,
7,[],False,kikiswirline456,,[],,text,t2_nowm36j,False,False,False,[],False,False,1630890177,self.dating,https://www.reddit.com/r/dating/comments/pip8sn/i_need_love_advice/,{},pip8sn,False,True,False,False,False,True,True,False,#ffd635,dating,"[{'e': 'text', 't': 'Giving Advice'}]",7bca2c58-4211-11e5-9ecb-0e60d8112001,Giving Advice,dark,richtext,False,False,True,4,0,False,all_ads,/r/dating/comments/pip8sn/i_need_love_advice/,False,6,1630890188,1,"So, I have this really cute co-worker. We’ll call him Steve. Steve seems nice and we have fun joking around with each other during our shift. I can’t deny that there is an attraction growing and a part of me wants to ask him out so I can get to know him better. But I am scared for the following reasons:

1. I have been rejected sooooooooooooooooooo many times and there’s no telling if he will be different. 

2. I am still not 100% over my last crush. We’ll call him luke. I made several posts about that guy but long story short…I met Luke last year and I thought he was probably the best guy on earth. He was was a recovering alcoholic and I spent a year hoping that he would fall in love with me but a few months ago, he started dating someone else and I still feel those after-effects of feeling insufficient and worthless.

3. He is five years older than me. I am almost 26 and he is 30. I am not sure if he would like younger women.",True,False,False,dating,t5_2qhb1,990851,public,self,I need love advice,0,[],1.0,https://www.reddit.com/r/dating/comments/pip8sn/i_need_love_advice/,all_ads,6,,,,
8,[],False,GoldLightzz,,[],,text,t2_7e6z9sct,False,False,False,[],False,False,1630890460,self.dating,https://www.reddit.com/r/dating/comments/pipbdt/if_you_cant_handle_me_at_my_worst_then_you_dont/,{},pipbdt,False,True,False,False,False,True,True,False,#ffd635,dating,"[{'e': 'text', 't': 'Giving Advice'}]",7bca2c58-4211-11e5-9ecb-0e60d8112001,Giving Advice,dark,richtext,False,False,False,44,0,False,all_ads,/r/dating/comments/pipbdt/if_you_cant_handle_me_at_my_worst_then_you_dont/,False,6,1630890471,1,"Run away from people who say this. You're not entitled to handle anyone at their worst. Those people think it's okay to act like a jerk because ""they're going through something.""  There's never an excuse to be a jerk. They don't try to be a good partner because they feel it's your responsibility to put up with their toxic behavior. You're not their parent, why should you deal with that? Run far away and never look back. Find someone who makes a partner even when they're having a bad day.",True,False,False,dating,t5_2qhb1,990856,public,self,"""If you can't handle me at my worst then you don't deserve me at my best.""",0,[],1.0,https://www.reddit.com/r/dating/comments/pipbdt/if_you_cant_handle_me_at_my_worst_then_you_dont/,all_ads,6,,,,
9,[],False,Dogs-are-life-99,,[],,text,t2_2lexe324,False,False,False,[],False,False,1630890662,self.dating,https://www.reddit.com/r/dating/comments/pipd8l/how_do_you_sound_interesting_on_online_dating/,{},pipd8l,False,True,False,False,False,True,True,False,#ffb000,,"[{'e': 'text', 't': 'Tinder/Online Dating'}]",5214d2ac-61f1-11e8-8bb1-0ed15e4a39c0,Tinder/Online Dating,dark,richtext,False,False,True,7,0,False,all_ads,/r/dating/comments/pipd8l/how_do_you_sound_interesting_on_online_dating/,False,6,1630890673,1,How do you come off as interesting on online dating? I’m on Bumble and can’t seem to say anything funny and interesting for guys to even message me back 😥I get matches but I when I message them I don’t even even get a message back.,True,False,False,dating,t5_2qhb1,990861,public,self,How do you sound interesting on online dating?,0,[],1.0,https://www.reddit.com/r/dating/comments/pipd8l/how_do_you_sound_interesting_on_online_dating/,all_ads,6,,,,
10,[],False,Liddle_Tike,,[],,text,t2_eczmb62j,False,False,False,[],False,False,1630890834,self.dating,https://www.reddit.com/r/dating/comments/pipeqp/is_she_interested_in_me_or_am_i_just_getting_my/,{},pipeqp,False,False,False,False,False,False,True,False,#ea0027,dating,"[{'e': 'text', 't': 'I Need Advice'}]",19ec58c2-9f74-11e7-81a1-0e2bf15991f0,I Need Advice,light,richtext,False,False,True,0,0,False,all_ads,/r/dating/comments/pipeqp/is_she_interested_in_me_or_am_i_just_getting_my/,False,6,1630890845,1,[removed],True,False,False,dating,t5_2qhb1,990861,public,self,Is she interested in me or am i just getting my hopes up?,0,[],1.0,https://www.reddit.com/r/dating/comments/pipeqp/is_she_interested_in_me_or_am_i_just_getting_my/,all_ads,6,moderator,,,
11,[],False,Zenithtrap888,,[],,text,t2_2amfzby4,False,False,False,[],False,False,1630891029,self.dating,https://www.reddit.com/r/dating/comments/pipgk8/can_someone_tell_me_to_stop_overthinking/,{},pipgk8,False,True,False,False,False,True,True,False,#ea0027,dating,"[{'e': 'text', 't': 'I Need Advice'}]",19ec58c2-9f74-11e7-81a1-0e2bf15991f0,I Need Advice,light,richtext,False,False,True,7,0,False,all_ads,/r/dating/comments/pipgk8/can_someone_tell_me_to_stop_overthinking/,False,6,1630891040,1,"I’ve been on 6 dates total seventh one is next week with me 27M and the girl I’m seeing 27F we’ve gone on romantic dates, we’ve been physical , sleepovers, we talk daily.

Problem is I still have this thought in the back of my mind that at any point this whole thing between us is just going to end unexpectedly, because she’s going to lose interest etc. I can’t be the only one that thinks this way right? For example at the current moment she hasn’t texted me in over a day. Just gets me thinking",True,False,False,dating,t5_2qhb1,990866,public,self,Can someone tell me to stop overthinking?,0,[],1.0,https://www.reddit.com/r/dating/comments/pipgk8/can_someone_tell_me_to_stop_overthinking/,all_ads,6,,,,
12,[],False,Alternative_Engine97,,[],,text,t2_53bpbucj,False,False,False,[],False,False,1630891320,self.dating,https://www.reddit.com/r/dating/comments/pipj42/moving_out_of_parents_house_for_better_dating/,{},pipj42,False,True,False,False,False,True,True,False,#ea0027,dating,"[{'e': 'text', 't': 'I Need Advice'}]",19ec58c2-9f74-11e7-81a1-0e2bf15991f0,I Need Advice,light,richtext,False,False,True,4,0,False,all_ads,/r/dating/comments/pipj42/moving_out_of_parents_house_for_better_dating/,False,6,1630891332,1,"Is there any point to moving out during a pandemic for better dating prospects? 

I am Iate 20s, work from home for now, and live in my parents home in the suburbs currently (not paying rent), but easily make enough money to move out anywhere i want in the U.S. I don’t mind living with my parents at all, but am aware that it is probably the kiss of death for a man who is looking to date. 

I currently get no matches at all on dating apps, and am concerned that i would get lonely due to living alone during the pandemic. 

Is there anything i am missing out from a dating or life perspective by continuing to live at home? 

It seems like moving won’t really increase my options at all?",True,False,False,dating,t5_2qhb1,990870,public,self,Moving out of parents’ house for better dating prospects?,0,[],1.0,https://www.reddit.com/r/dating/comments/pipj42/moving_out_of_parents_house_for_better_dating/,all_ads,6,,,,
13,[],False,opeitschristine,,[],,text,t2_b5n28f1m,False,False,False,[],False,False,1630891343,self.dating,https://www.reddit.com/r/dating/comments/pipjaw/thinking_of_making_an_online_dating_profile/,{},pipjaw,False,True,False,False,False,True,True,False,#ea0027,dating,"[{'e': 'text', 't': 'I Need Advice'}]",19ec58c2-9f74-11e7-81a1-0e2bf15991f0,I Need Advice,light,richtext,False,False,True,3,0,False,all_ads,/r/dating/comments/pipjaw/thinking_of_making_an_online_dating_profile/,False,6,1630891354,1,"Hi all, 

As the title suggests, I’m thinking of downloading a dating app once I have more time to focus on that aspect of my life, but I’m a bit confused on which pictures to use for my profile? I have a lot of hobbies, friends, and am a really fun person, however I don’t really have any pictures of myself doing those things.

I don’t like using my phone a lot as is, so whenever I’m at an event, I don’t even think about taking pictures. I don’t have any social media either, would people think that’s weird?

Another issue is that I flat out don’t have any pictures of myself other than a few selfies. Self confidence isn’t an issue at all, it just is what it is. Should I have a friend take some pictures of me/have a photoshoot? Any advice on how to make a nice profile would be great!",True,False,False,dating,t5_2qhb1,990870,public,self,Thinking of making an online dating profile…,0,[],1.0,https://www.reddit.com/r/dating/comments/pipjaw/thinking_of_making_an_online_dating_profile/,all_ads,6,,,,
14,[],False,Alarmed-Dependent-91,,[],,text,t2_dwyuh4km,False,False,False,[],False,False,1630891571,self.dating,https://www.reddit.com/r/dating/comments/pipl9n/im_19_year_old_and_need_some_advice/,{},pipl9n,False,True,False,False,False,True,True,False,#ea0027,dating,"[{'e': 'text', 't': 'I Need Advice'}]",19ec58c2-9f74-11e7-81a1-0e2bf15991f0,I Need Advice,light,richtext,False,False,True,3,0,False,all_ads,/r/dating/comments/pipl9n/im_19_year_old_and_need_some_advice/,False,6,1630891582,1,"not going to give a whole story on my life and why i feel worthless and all that, long story short, my past ex girlfriends mentally and physically abused me, after i thought they were the one, some just didnt work out because of covid and distance, just need some advice on what i can do to not get mentally  and phsysically abused and how does one keep a relationship stable

should i be looking for someone that has similar interests? i cant ask anyone else, going online probably isnt the best place to go, but, i have nobody else...",True,False,False,dating,t5_2qhb1,990879,public,self,im 19 year old and need some advice,0,[],1.0,https://www.reddit.com/r/dating/comments/pipl9n/im_19_year_old_and_need_some_advice/,all_ads,6,,,,
15,[],False,homelessfish22,,[],,text,t2_bym63ygm,False,False,False,[],False,False,1630891646,self.dating,https://www.reddit.com/r/dating/comments/piplw8/got_lead_on_should_i_be_more_straight_up_for/,{},piplw8,False,True,False,False,False,True,True,False,#00a6a5,dating,"[{'e': 'text', 't': 'Support Needed'}]",fd9c03b8-a1ce-11e7-9172-0e8c9f9ecf4c,Support Needed,dark,richtext,False,False,True,4,0,False,all_ads,/r/dating/comments/piplw8/got_lead_on_should_i_be_more_straight_up_for/,False,6,1630891657,1,"I was seeing a girl for the last 3 months or so. She seemed like a good girl looking for a genuine connection. I had plans to try and turn it into a relationship right after the first date. It was heading that way... well it felt like at least. Had sex a few times. Cuddled and even talked about having a future together. She would cook for me in the mornings and call me baby and everything 


I was worried about scaring her off. Even though on the inside I wanted to, so I never pushed for it to be official official. I wanted to give it time and just keep seeing her and let it happen naturally. 


I get a threatening message this morning from her boyfriend. He’s been with her for the last 2 years and I didn’t even know. She told me she was single when we met. I just blocked them both. 



I was still seeing other people but the more I got to know her, I started to cut off my casual partners. I was waiting for us to be official before I completely stopped talking to others. 


I think for the future, if I like somebody I shouldn’t wait it out. I should just ask her to make her my partner. Get my answer quicker.",True,False,False,dating,t5_2qhb1,990883,public,self,Got lead on. Should I be more straight up for future dates?,0,[],1.0,https://www.reddit.com/r/dating/comments/piplw8/got_lead_on_should_i_be_more_straight_up_for/,all_ads,6,,,,
16,[],False,vs51,,[],,text,t2_qbaz079,False,False,False,[],False,False,1630891660,self.dating,https://www.reddit.com/r/dating/comments/pipm0r/i_cant_get_over_her_it_just_hurts_when_anything/,{},pipm0r,False,True,False,False,False,True,True,False,#00a6a5,dating,"[{'e': 'text', 't': 'Support Needed'}]",fd9c03b8-a1ce-11e7-9172-0e8c9f9ecf4c,Support Needed,dark,richtext,False,False,True,10,0,False,all_ads,/r/dating/comments/pipm0r/i_cant_get_over_her_it_just_hurts_when_anything/,False,6,1630891671,1,"We broke up after 9 months because the logistics weren't adding up. We needed/wanted to be in different places because of family + work. I might be holding on to the best parts of her only, and maybe I should move on, but it just really fucking sucks. I almost feel guilty forcing the need to ""move on"", but I also don't know if I can make it work.",True,False,False,dating,t5_2qhb1,990885,public,self,I can't get over her. It just hurts when anything triggers her memory.,0,[],1.0,https://www.reddit.com/r/dating/comments/pipm0r/i_cant_get_over_her_it_just_hurts_when_anything/,all_ads,6,,,,
17,[],False,Valuable_External363,,[],,text,t2_ec9fs0m9,False,False,False,[],False,False,1630891974,self.dating,https://www.reddit.com/r/dating/comments/pipot1/feeling_pretty_awful_25f_here_rejected_by_25m_for/,{},pipot1,False,False,False,False,False,False,True,False,#00a6a5,dating,"[{'e': 'text', 't': 'Support Needed'}]",fd9c03b8-a1ce-11e7-9172-0e8c9f9ecf4c,Support Needed,dark,richtext,False,False,True,2,0,False,all_ads,/r/dating/comments/pipot1/feeling_pretty_awful_25f_here_rejected_by_25m_for/,False,6,1630891984,1,[removed],True,False,False,dating,t5_2qhb1,990892,public,self,"feeling pretty awful, 25F here rejected by 25M for having the same deformity",0,[],1.0,https://www.reddit.com/r/dating/comments/pipot1/feeling_pretty_awful_25f_here_rejected_by_25m_for/,all_ads,6,reddit,,,
18,[],False,Available-Force-6518,,[],,text,t2_dxaj5owm,False,False,False,[],False,False,1630892175,self.dating,https://www.reddit.com/r/dating/comments/pipqlu/is_it_ok_to_ask_my_brothers_ex_gf_out_on_a_date/,{},pipqlu,False,True,False,False,False,True,True,False,#ea0027,dating,"[{'e': 'text', 't': 'I Need Advice'}]",19ec58c2-9f74-11e7-81a1-0e2bf15991f0,I Need Advice,light,richtext,False,False,True,15,0,False,all_ads,/r/dating/comments/pipqlu/is_it_ok_to_ask_my_brothers_ex_gf_out_on_a_date/,False,6,1630892186,1,"Hello, I'm a m(31) and my bro is (39). I just got out of a 7 year relationship.. so I waited a couple months now I'm ready to get back on the dating bandwagon. I am doing the online dating but atm no luck, 
Now I was gonna give a shout out to my bros ex who Is my age and ask if she wants to go get coffee or food and catch up. She was really close with my family (will probably get her number from my sister or mom) is this a bad idea? I would like some input before I send her a message. Oh and they haven't been together in about 4 years if you want a time of last time they were together",True,False,False,dating,t5_2qhb1,990896,public,self,Is it OK to ask my brothers ex gf out on a date?,0,[],1.0,https://www.reddit.com/r/dating/comments/pipqlu/is_it_ok_to_ask_my_brothers_ex_gf_out_on_a_date/,all_ads,6,,,,
