,id,created_utc,title,selftext,subreddit,subreddit_id,url
14,nk7key,1621888249,She told me we shouldn’t waste each others time?,"After the first date I told her I had a sexual dream about her and suggested we get a hotel room. A few days later she tells me “Hey, I noticed you’ve been more distant, not sure why but if moving slow is not what you’re truly looking for I think it’s best we don’t waste each others time. You can correct me if I’m wrong but that’s the impression I’m getting.” Does this mean she’s not interested ?",dating,t5_2qhb1,https://www.reddit.com/r/dating/comments/nk7key/she_told_me_we_shouldnt_waste_each_others_time/
15,nk7o2q,1621888509,"A peck, a smooch, or a passionate embrace, all have a greater physical &amp; emotional impact on us than we might think. Whether you're in a new relationship or many years into one, dating each other &amp; tending to your romance always brings a great benefit",[removed],dating,t5_2qhb1,https://www.reddit.com/r/dating/comments/nk7o2q/a_peck_a_smooch_or_a_passionate_embrace_all_have/
16,nk7qit,1621888693,Can’t tell if she’s (29f) ghosting me (32m) or just busy. Should I send this text?,"Been seeing a girl for the last 3 weeks. Everything seemed to be going really well –hung out several times, crashed at each other’s places a couple times each, did the thing – but what used to be us texting several times per day has turned into her not texting at all.

Backstory, she travelled to another state for a friends baccalaureate party over the weekend. Other than her sending my a video on IG of herself, I haven’t heard anything from her. I figured it’s cause she was busy and having a good time.

We also had previously said we would definitely let the other know if either of us loses interest – we both have plenty of options when it comes to dating.

Now it’s Monday and I believe she got back late yesterday. She’s “liked” a couple of my new photos on Instagram today, but that’s it. 

I’m frankly really confused and wish I knew one way or the other whether she was still interested in exploring things between us or not. 

Later today or tomorrow if I don’t hear from her, I was thinking of sending the following text. What do you guys think?

*Hey PersonThatMightBeGhosting,

I’ve really enjoyed getting to know you over the last few weeks but the lack of communication as of late leads me to believe you’ve lost interest here – which is of course totally fine. I just wanted to text one last time before writing this off and going on my merry way. Hope you had a fun weekend.*",dating,t5_2qhb1,https://www.reddit.com/r/dating/comments/nk7qit/cant_tell_if_shes_29f_ghosting_me_32m_or_just/
17,nk7t1j,1621888871,"M25, Unable to get a girl friend","I M(25) have been told by many friends that I look great and can have any good girl I want to be in a relationship with. I am 6'2 with fair skin, jawline  and impressive post graduate degree. But no girl directly showed interest, I mean they give me a look sometimes but never showed any interest specifically.
I had low confidence and anxiety issues in the past but I have recovered from it. How to be more appealing in eyes of girls.",dating,t5_2qhb1,https://www.reddit.com/r/dating/comments/nk7t1j/m25_unable_to_get_a_girl_friend/
18,nk7uuw,1621888994,"I'm having trouble being seen as attractive. I understand some of the reasons, I guess, but what can I do, especially when there's someone I know who shouldn't be? ( 27 M )",[removed],dating,t5_2qhb1,https://www.reddit.com/r/dating/comments/nk7uuw/im_having_trouble_being_seen_as_attractive_i/
19,nk7wol,1621889123,What should I do for my situation?,"Now at 33, I have become quite independent, I live by myself in my own home that I half own and half rent, I have a small online business and I hang out with my family; parents, aunt uncle, nans from once or twice a week. I've got one close friend but he's turned into a disappointment, getting worse each year; drugs, mental health, etc.

So, I'm in at home a lot, sometimes by choice and other times because I have no other outlets. I don't have the confidence, drive or ambition, know how, to go and find a friend etc. I would like the idea of travelling, but who with? I've always travelled with the mentioned mate, but that's become far to problematic due to them been in a mess.

I've not looked for a partner (sexual partner) never been my thing and my libido feels really low for my age and I haven't orgasmed for a long time. Probably asexual.

What should I do, I would probably find a like minded person ideal. But not a sexual partner. Dating feels hard, It's a bit like I have autism (or something), in some ways, as I am smart, intendent but really struggle at some basic things and get some forms of social phobia.",dating,t5_2qhb1,https://www.reddit.com/r/dating/comments/nk7wol/what_should_i_do_for_my_situation/
20,nk7x8g,1621889163,Is the smell from my genitalia enough for a woman over 30 to fall in love with me?,I have stinky genitals and i have a crush on another over 30 year old woman again. I was interested if I can emanate more smell from my genitals that she will be drawn like a cartoon finger roping Tom from Tom and Jerry into a sweet pie,dating,t5_2qhb1,https://www.reddit.com/r/dating/comments/nk7x8g/is_the_smell_from_my_genitalia_enough_for_a_woman/
21,nk86fe,1621889805,"I dont like instagram but i think a lot of people want to see what u look like and who you are before going out. Is it normal to make an Instagram only for ""thirst trapping"" or to show people yourself?",Yea usually they ask for snapchat or Instagram and im like... I dont have that...,dating,t5_2qhb1,https://www.reddit.com/r/dating/comments/nk86fe/i_dont_like_instagram_but_i_think_a_lot_of_people/
22,nk8aul,1621890113,Pettiest turnoffs... I'll go first: Excessive emojis,"I've  been speaking to a guy for the last few weeks and we recently went on  our second date. He is such a sweet, chatty, sensitive guy and I really  enjoy our time together. However. It makes me feel super judgemental but  his emoji usage for a man of 33 is... odd to me. He uses emojis with  seemingly no real purpose/ context with his favorites being the fire  emoji, the 100 emoji and the eyes emoji as well as 3 to 6 laughing and  crying emojis for emphasis. I don't know whether he texts his friends  and family like this or whether he wants to relate to me as I'm much younger.

Don't  get me wrong, I do like emojis but I've never experienced  anything  like this... He communicates mostly normally in person so it's just  texting that really makes me cringe. There is no polite way to mention  it so I guess I'll just ride it out for now and see whether it develops  into more of an ick or I can overlook it.

What are your minor things that you feel bad about finding kind of annoying?",dating,t5_2qhb1,https://www.reddit.com/r/dating/comments/nk8aul/pettiest_turnoffs_ill_go_first_excessive_emojis/
23,nk8e5i,1621890334,"What does it mean when you don't have strong romantic (or even sexual) feelings for someone, but it hurts when they talk about dating/sleeping with/etc. with other people?","I have been finding this to be the case recently, and I have no idea where it comes from. It has happened with women I am friends with; some I have dated before, some I have never even THOUGHT of dating. All of whom I am perfectly content to remain only friends with.

I'm sure this is a selfish thing, but I have no idea where it came from or what to do about it.",dating,t5_2qhb1,https://www.reddit.com/r/dating/comments/nk8e5i/what_does_it_mean_when_you_dont_have_strong/
24,nk8v5k,1621891579,Did I rebound already or am I about to rebound?,"
I (25F) got married at 19 &amp; divorced at 22 (I mean who didn’t see that coming). As soon as I left my ex husband, I started a casually dating &amp; met my most previous ex, let’s call him John. Apologies in advance for rambling. 

John was never anyone I expected to end up dating, but he’s a fantastic people person &amp; I absolutely loved how fun he was  so about 4 months after meeting on tinder we started dating as officially boyfriend &amp; girlfriend. Two weeks later he got a dui &amp; lost his job but that didn’t matter to me since again, still wasn’t expecting anything suuuper serious &amp; was just trying to let loose. Eventually (8 months) things got more serious, “I love you”s where said, &amp; he started getting his life together somewhat. Flash forward 2 years later &amp; I realize, I don’t just want to have *fun* anymore. I care about him, we’ve spent so much time together, but I’m realizing I healed from the hurt of my failed marriage &amp; want to try it again some day. He however is pretty comfy in his lifestyle but still says he wants to progress. Not much progressed, things festered within me &amp; when I brought it all up he cried a lot &amp; asked if we could go on a break while he sorts out some priorities instead of just breaking up then &amp; there. 

During this time I of course felt unspectacular since he wasn’t moving at the same pace as I was, and hopped on bumble to see what else was out there. Had some casual chats, flirted, exchanged Snapchat’s, and planned on going out with a guy, let’s name him Ted. Things didn’t end up happening so I deleted him off Snapchat, thinking he had been trying to ghost me.  No worries, I wasn’t expecting anything to happen &amp; didn’t want anything too. 

Back to John. Our break ended after a week &amp; a half, we decided to give it another go as long as he continued to show me he wanted to progress our relationship as well as continue to working on himself (prioritize work, no excessive drinking, take control of his life’s goals, treat me more like his girlfriend of 2 years instead of one of his bros). Well, not even a week later he was back to doing what he wanted &amp; I started feeling the resentment building up for giving him another chance. I realized how much he helped me grow as a human being since being so broken, and as much as I loved him I realized I don’t think he will be the person I reach my own personal goals with (I am very career oriented now &amp; plan on settling down before I’m 30, where as he is not). He saw the breakup coming, we reminisced the good times, cried &amp; laughed, said we still loved each other then parted ways. Healthiest breakup of my life. 

So, was that a rebound? (My best friend believes it was)

The reason I question it is the next day after the breakup, I added Ted back on Snapchat &amp; we went out a few days later. Quick I know, but again I felt very happy about how healthy the breakup went &amp; don’t mind the idea of meeting someone new since I finally know exactly what I want out of life. We actually had a fantastic time &amp; Ted surprisingly ticked a lot of boxes of what I would want from a serious partner (not rushing into anything now, but it’s refreshing knowing that). I wasn’t expecting to want to go on another date but here we are. 

Is this going to end up being considered a rebound?? (My best friend also believes it will be) Or should I give it more time before attempting a second date?",dating,t5_2qhb1,https://www.reddit.com/r/dating/comments/nk8v5k/did_i_rebound_already_or_am_i_about_to_rebound/
25,nk8wp2,1621891694,Would you continue seeing someone if you have great first/second date chemistry but know there is a unavoidable end date to the relationship?,"For example, end date means they are going out of state or abroad for work or education within a year. 

This situation has happened to me three times now, and each time I just cut my losses and left before the relationship deepened or things got complicated (eg navigating long distance). After talking my guy and gal friends (late 20s-early 30s), I learned I was in the minority and that most would continue to see the person. I’m just curious to hear what people on this sub say to see if I’m actually in the minority. Or maybe is this the type of opinion that changes according to age?",dating,t5_2qhb1,https://www.reddit.com/r/dating/comments/nk8wp2/would_you_continue_seeing_someone_if_you_have/
26,nk93jo,1621892228,Hello every I’m new here on this site I’m I welcome come? And beside I’m also here to make friends,And nothing but a serious relationship I’m tired ok? I just wanna settle down,dating,t5_2qhb1,https://www.reddit.com/r/dating/comments/nk93jo/hello_every_im_new_here_on_this_site_im_i_welcome/
27,nk9bxy,1621892856,Emotional baggage,"My boyfriend had many bad past experiences in dating due to which he got lots of trust issues with me, I totally understand it and I always assure him that I am not like his other past experiences and I genuinely love him. 
Today he asked me if I am ready to carry his emotional baggage
I didn't know how to react to this, and at that moment I said I definitely will. 
But now I don't know what he really meant by the emotional baggage thing, and how should I react to this
Pls help guys",dating,t5_2qhb1,https://www.reddit.com/r/dating/comments/nk9bxy/emotional_baggage/
28,nk9c9v,1621892880,how to get a boy,[removed],dating,t5_2qhb1,https://www.reddit.com/r/dating/comments/nk9c9v/how_to_get_a_boy/
29,nk9m3h,1621893649,He has loose skin and is insecure about it. How do I make him feel comfortable?,"So this guy and I are fairly new to dating, it’s only been a little over a month. He has open up to me and feels very comfortable around me and constantly expresses that. And I feel the same around him. He told me that he was super obese a year ago and he seems to be really hard on himself when it comes to himself in general. He has lose skin from the weight loss and he’s insecure about it. That and because of bad things that happened in his past relationships that lasted 10 years makes him want to take things slow. We have not had sex yet because of that but I’m ok with it and  enjoy just being around him.


Every time we meet up he is wearing long sleeves so I’m not sure to what extent he has and he’s still on his weight loss journey. When the time comes for us to engage in sexual stuff, how should I approach it? Do I touch the loose skin or avoid it? I just want him to fell comfortable because I don’t care about that. I like him as he is. Any advice is great.",dating,t5_2qhb1,https://www.reddit.com/r/dating/comments/nk9m3h/he_has_loose_skin_and_is_insecure_about_it_how_do/
30,nk9sm2,1621894158,Substance use is really popular?,"I hope that title isn't too clickbait-y, it just sounds really funny to me.

Anyways, the bulk of things:
I think that I realize that drinking, smoking/vaping (the devil's grass (ha!) or otherwise), and some recreational drugs sprinkled here and there has always been an enjoyable pastime for people. I think a lot of people older than me (a 20 y/o NB) always talk a lot about meeting people at bars or random smoking spots, but it seems even more prevalent in online dating nowadays to ask people to engage in recreational substance use as a way of meeting potential people. I personally have no problem with other people doing so! I think that substances in moderation is a good and fun time, and this is coming from someone with a lot of generational addiction in the family. However, I don't really do any of that, and it seems to be gaining much more popularity with the pandemic seemingly changing for the better. Yes, I'm young, and I have a lot of time to explore my interest in the aforementioned activities, but I personally just don't really care for them. It seems to be getting harder and harder to meet people who, on the surface of these dating apps, seem okay with another person who doesn't engage with it at all.

Tl;dr - I don't really have any questions like ""What do I do?"", so I guess this turned into more of a rant about substance use being super popular on dating apps. It sucks! I want to try things eventually, with someone I'm comfortable with, but I just want to date and do the dirty without perceived pressure to be okay around all that stuff.

Awkward sidenote: After a recent ""get-together"" (what would I even call it?) with someone, I've personally learned that kissing cigarette smokers is actually fine or even pretty good! I hate the smell of anything smoked (except that fresh BBQ), something I internally cringed at when they started smoking in front of me later! 😂😭 This sucks.

Yours truly,
Bored Redditor",dating,t5_2qhb1,https://www.reddit.com/r/dating/comments/nk9sm2/substance_use_is_really_popular/
31,nk9yy0,1621894655,Would love others' opinions on this,"Been talking to/seeing a guy for a few weeks now. He seems really nice, but one thing that I've noticed is that he extensively talks about himself. He has only asked about me a few times. I get that maybe it's a personality thing and maybe it's on me to talk about myself so I've tried to do that and as far as I can tell he doesn't tune out when I do. Over the past weekend I graduated medical school and I'd told him, quite a few times, that it was going to be this weekend. (due to covid related guest restrictions he could not attend). He totally forgot that I graduated. He sent me a picture of him hanging out with his friends and told me what a nice weekend he had with his friends but literally forgot I graduated. I'd told him what a big deal in my life it was.

 I'm wondering if this guy is just someone who is self centered and talks about himself all the time. Or if I should give him more of a chance. Anyone have any opinions?",dating,t5_2qhb1,https://www.reddit.com/r/dating/comments/nk9yy0/would_love_others_opinions_on_this/
32,nka2k4,1621894950,Happiness from Heatbreak - A Poem,[removed],dating,t5_2qhb1,https://www.reddit.com/r/dating/comments/nka2k4/happiness_from_heatbreak_a_poem/
33,nka4ki,1621895123,Happiness from Heartbreak - A Poem by Frank Reteguiz,"ck and Llewyn’s Publishing Company, LLC

￼

Open Menu

Happiness from Heartbreak

How Could I be Happy from Heartbreak?

The expected end came and went.

I fought to avoid it but we were two worlds apart.

My heart didn’t see what the eyes saw,

It only felt you. 

 

I tried my best,

But what you wanted was just a toy and I wanted more.

You wanted the fruits of a relationship without its toils.

I wanted it all.

 

I cried and mourned for the beauty that I hope would prevail,

For the good I saw in your eyes. 

I didn’t give a fuck about your baggage, I would have helped you carry it.

But what you did to me is what you did to others,

You left me on my knees.

 

How Could I be Happy from Heartbreak?

You changed me.

Our time together was enough.

Enough for you to show the best of me.

Enough to show me a world where it’s possible for me to be that man to someone.

 

My heart aches, my eyes burn from the streams of tears,

But my spirit is full of hope. 

I will miss you dearly.

A tragic dusk made for a beautiful dawn.

 You gave me one last gift in the end,

I am now ready for love.",dating,t5_2qhb1,https://www.reddit.com/r/dating/comments/nka4ki/happiness_from_heartbreak_a_poem_by_frank_reteguiz/
34,nkafw0,1621896012,My Boyfriend with MDD broke up with me and I can’t let him go,[removed],dating,t5_2qhb1,https://www.reddit.com/r/dating/comments/nkafw0/my_boyfriend_with_mdd_broke_up_with_me_and_i_cant/
35,nkaio7,1621896221,Dating for out-of-state college student,[removed],dating,t5_2qhb1,https://www.reddit.com/r/dating/comments/nkaio7/dating_for_outofstate_college_student/
36,nkaq52,1621896814,How do you know when you’re in love? I feel like you can love someone but not be in love with them. What’s the difference?,[removed],dating,t5_2qhb1,https://www.reddit.com/r/dating/comments/nkaq52/how_do_you_know_when_youre_in_love_i_feel_like/
37,nkar9c,1621896901,What are some things I can do to make my boyfriend happy while we're temporarily long distance?,[removed],dating,t5_2qhb1,https://www.reddit.com/r/dating/comments/nkar9c/what_are_some_things_i_can_do_to_make_my/
38,nkat8i,1621897058,Dating for Out-of-State College Student,"Hey guys, I wanted to get some advice on dating for an out-of-state college student.

For context, I live roughly six hours away from my university, and nearly nobody from my state attends it (think sub 100 in a pool of ~30,000). I'm not sure how I want to approach dating during my time there. If I get into a relationship with someone at my school, I'd have to do long-distance for my summer break and just visit them/have them visit me during that time.

Is that my best option? I could try dating while home for the summer, but I don't think I'd be up for long-distance stuff for a full year while both of us would be at different colleges. If anyone has been in the same spot as me, what did you do, and how did it work out for you?",dating,t5_2qhb1,https://www.reddit.com/r/dating/comments/nkat8i/dating_for_outofstate_college_student/
39,nkat93,1621897060,"So I know this is an odd post, but I’ve been on a bit of a dating dry spell with quarantine and I’m moving to Australia at summer’s end with a girl I’ve been talking to and want to get some of my, let’s say, mojo back before I get there.","That’s exactly it. I live in Detroit, so preferably someone around there. I used to model and I’m a good looking guy (willing to exchange photos if anyone’s interested. Or just look at my post history, I have photos.) I’m a UX Designer. DM if interested",dating,t5_2qhb1,https://www.reddit.com/r/dating/comments/nkat93/so_i_know_this_is_an_odd_post_but_ive_been_on_a/
40,nkb3fh,1621897879,Would any ladies be willing to give me advice on my tinder profile?,"Title explains it all. If you're willing, please shoot me a DM. Thank you! :D",dating,t5_2qhb1,https://www.reddit.com/r/dating/comments/nkb3fh/would_any_ladies_be_willing_to_give_me_advice_on/
41,nkb8f3,1621898288,"Girls, what's your experience in cold approaching men?","I am a girl, almost 30. I have only approached 2 strangers in my life. But got all rejected. I like to know your experience of approaching guys in public?

One is a neighbour we used to catch the same bus home after work. After a couple of months, I talked to him first and asked if he likes to grab a coffee sometime. I approached him because I found him checking me out a few times, which encouraged me to talk to him. It turns out he was married. Unfortunately I did not check out his hand...my bad. But he was friendly, he said :""I would love to, but I am married."" I was super embarrassed, I apologised and ran away.

Few years later, I often run into this cute guy at train station after work. Also I found him looking at me a few times and look away quickly when I look back at him. My friend encouraged me to talk to him, they said he must be shy. But I am not so sure. One night, I was standing in the middle of the platform waiting for the train. He walked over to me and stood right next to me. Usually, he would walk to the end of the platform to wait for the train. But this time he stood next to me. I really thought he wanted to talk to me but he is just too shy to approach me. So finally the next day, I gave him a quick note with my number on it. He texted me and said ""Sorry, I've been seeing someone."" I am very annoyed at myself mis-interpreted all those signs. I just want to dig a hole in the ground and jump straight in. And I have been very upset over this. It happened last week.

It reminds me of some guys' posts here saying that girls checking them out but after the guys approached them, girls either say they are not interested or they have a bf. I can understand how frustrated you are...

I am curious to know girls what's your experience of cold approaching guys? Any success?",dating,t5_2qhb1,https://www.reddit.com/r/dating/comments/nkb8f3/girls_whats_your_experience_in_cold_approaching/
42,nkbaci,1621898448,Is it okay for a 19 year old to date a 16 year old,"Don’t judge me but I’m a senior I’m already 18 and I got my yearbook the other day and I was looking for my crush in my yearbook, well I thought I had found her and thought she was a sophomore but the names did not match because I heard her name in person, so today I relooked in my yearbook and found out she’s a freshman, I’m getting held back so I’ll be 19 next year and I guess my crush will be 16, when I thought she was a sophomore I was like “okay this will work out I’ll make my move next year and she’ll be 17 and I’ll only be 19 so that wouldn’t be much of an age gap” but when I realized that she’s a freshman I said “oh crap I might not be able to make my move since it’s a 3 year gap so all my hopes and dreams of being with her went down the drain unless I can get some answers to see if this is okay for a 19 year old held back senior to date a 16 year old sophomore.",dating,t5_2qhb1,https://www.reddit.com/r/dating/comments/nkbaci/is_it_okay_for_a_19_year_old_to_date_a_16_year_old/
43,nkbi37,1621899099,How do you get a guy to approach you?,"I’m far from confident enough to approach a guy, so how do I (obliviously) get him to approach and talk to me",dating,t5_2qhb1,https://www.reddit.com/r/dating/comments/nkbi37/how_do_you_get_a_guy_to_approach_you/
44,nkbl0t,1621899341,I blocked him for my own mental health and I feel like shit,He reciprocated for the first time after a year and half of me silently pining for him. He then never messaged me again and I can’t stand it. I know I made the right decision but it’s an uncomfortable feeling. Although the uncomfortable feeling probably means it’s the best thing for me - I could use some support,dating,t5_2qhb1,https://www.reddit.com/r/dating/comments/nkbl0t/i_blocked_him_for_my_own_mental_health_and_i_feel/
