,id,created_utc,title,selftext,subreddit,subreddit_id,url
67,nkf5ak,1621910434,I got kind of ghosted after 1 month with no explanation,"I started seeing this guy after he hit me up and asked to hang out. We hung out quiet a bit over a month (this was February). He was super into it and I know because of how he acted. He would tell me how he felt and he would compliment me plenty. Things were going well. Until we didn’t hang out for about 4 days (because he wouldn’t make plans) and his texts started getting longer between texts and dryer. He stopped complimenting me. Then he started leaving me on read. I was confused as to why this was because he had texted me saying how he misses me a few days prior. After he left me on read for a bit I asked if he wanted to end it, he didn’t answer the question but responded with how much he enjoyed when we are together and he was going through a bit right now. I said I understood and asked again if he wanted to end it because he seemed as though he did ( no response, he ignored the question completely) Then we would have small talk over text for the next week and a half. He would ignore me for a while and text other people before me. I don’t understand how someone could just waste my and their own time for no reason (we never did anything sexual).",dating,t5_2qhb1,https://www.reddit.com/r/dating/comments/nkf5ak/i_got_kind_of_ghosted_after_1_month_with_no/
68,nkf5im,1621910453,Is it time to move on?,"So I 23f been seeing this guy 28m since February,  he's super nice, treated me good whenever we met up, we aren't dating since he is focusing on work, he's in the military but he just stationed at my state for couple of years, so we been talking non stop everyday since February but last week Tuesday night was the last time we talked..he sent me goodnight snap and I replied good night (we always text on snapchat), now it has been six days, last time he did this was last month we didn't speak for two days, and I msg him saying what's up and he was like he been tierd with work etc but we started speaking again everyday since up until last week ;( I thought he might been busy and would text me when he is free but whenever I post snapchat stories he's always the first one to see, and I just posted it a story and of course he's the first one too see it 😔 should I msg him or move on? I don't wanna look desperate but at the same time I don't want to look like I'm ignoring him since he was always the one sending me msg first like ""good morning"" since he  wakes up around 5 for work and I awake up later time.",dating,t5_2qhb1,https://www.reddit.com/r/dating/comments/nkf5im/is_it_time_to_move_on/
69,nkf9wr,1621910837,Is it weird for me to talk to a guy who’s 21 when I’m 25?,I’m 25(F) and this guy who I’ve known for a while is being really persistent in trying to take me out. I haven’t really been talking to him much because I’m iffy about our age difference but I do think we get along really well. He’s 21 about to go on 22. Is this an awkward or unsettling age difference? Would hanging out with him/letting him take me out make me a creep?,dating,t5_2qhb1,https://www.reddit.com/r/dating/comments/nkf9wr/is_it_weird_for_me_to_talk_to_a_guy_whos_21_when/
70,nkfel7,1621911249,i'm a clown: a venting memoir,[removed],dating,t5_2qhb1,https://www.reddit.com/r/dating/comments/nkfel7/im_a_clown_a_venting_memoir/
71,nkfrop,1621912406,Is everything okay?,"I have been talking to this woman for around three months at this point. Everything was great from the beginning and we seemed to be falling for each other. We didn’t have our first date until a month ago, but it was amazing. Since then we’ve gone on three dates. 

Our last date this past Saturday, she invited me over to her apartment to smoke. We made out and fell asleep. She asked me to leave when we woke up and I sobered up. On the way home she wrote me a text saying she apologizes if I feel like I was kicked out and she just feels she wants to take things slow. I let her know that I am perfectly happy with how everything is going between us. 

Yesterday and today, she only responded to my texts twice. I know it’s still early, I just can’t help but think that I made her feel bad somehow.",dating,t5_2qhb1,https://www.reddit.com/r/dating/comments/nkfrop/is_everything_okay/
72,nkfs90,1621912461,It feels like I don't fit in with most people on online dating sites especially Tinder,"I moved to Los Angeles last year from a small town in NY. I thought that maybe the dating scene would be more diverse. It's not the only reason I moved. I moved to do more with my art and pursue a creative career. Maybe other people who live in LA can relate. I get discouraged when I see tons of women here are into hiking, biking, etc. Yes, I know not everyone fits into a mold. I look at the dating profiles on apps like Tinder and the women come across as obsessed with vanity. I get the impression they they want to be Instagram models. Maybe I'm taking the Hollywood/media stereotype of Los Angeles. I tried to talk about this with the asklosangeles subreddit and they got defensive. Maybe I'm the problem for not wanting to adapt and change my interests? I get frustrated with online dating. I want to meet someone I have somethings in common with. I'm into gaming, art, comics, Science Fiction, and Fantasy. I want to be with someone I don't have to feel like I need to constantly compromise with. I look at these profiles and some of them just push their Instagram and Snapchat. Then they have pictures of them out in the city with the girls having a drink. It just brings a flood of bad associations like women in college who got drunk with the frat bros. It's not my lifestyle yet there seems to be so many of them. I know I can't judge a book by its cover at the same time I don't have a lot to go in with some of these profiles. I'm not heavily into the clubbing scene, going out and drinking, biking, hiking, etc. Maybe I am judgemental and I am the problem I don't know. Enlighten me. What are your thoughts?",dating,t5_2qhb1,https://www.reddit.com/r/dating/comments/nkfs90/it_feels_like_i_dont_fit_in_with_most_people_on/
73,nkfuq8,1621912684,Advice on dating/ on what I should do,Never really went out on a real date But I have been talking to this girl for around 2 months now .I really like her she’s got a great personality she does the same things I do which is going out hiking and going to the beach. I don’t know what to do next or if I should do anything because I have class with her 8 Hours a day all the same classes and lunch. We’re taking the same Certificate program and there are 6 other students in the class and it’s 8 hours a day.,dating,t5_2qhb1,https://www.reddit.com/r/dating/comments/nkfuq8/advice_on_dating_on_what_i_should_do/
74,nkfyw4,1621913069,"Is the desire for variety in sexual partners a reality that I need to face, when in a relationship?","I’ve (23, F) been dating this guy (24) for a while and he ticks all my boxes; he’s sweet, funny, kind and ambitious. But there are two things about him that really trigger me. I know that I suffer from low self-esteem and that I can be a jealous person, so I don’t want this to dictate my life and I’d rather get your opinion:

He made this comment that while flying (he’s a pilot), he will be around many beautiful airhostesses who he’d want to fuck, and that I have to trust him enough to make sure he won’t. I know that it’s normal to get attracted to others in a relationship, but I don’t think I’ve ever experienced something like that myself. When I was in a relationship, I had no desire to have sex with anyone else and I got the impression from the guys that I was dating that it was the same for them. Are all guys really like this? Am I being too unrealistic expecting him to only be attracted to me? 

Other than that he told me that he’s had a sexual relationship with some of his friends, which kind of irritates me. I know that it’s all in the past, but I just couldn’t bear the thought of hanging out with his friends, knowing this information. Besides this, since the sexual relationship in question with some friends was continuous, I’m not sure if he still would want to fuck them now. 

For me, wanting to have sex with someone else in a relationship, is almost as bad as actually sleeping with someone else. And it’s not like he’s sex deprived or something. We have A LOT of sex. It’s clearly that he just wants variety, claiming that it’s only a human thing.

What would you do in this situation? I don’t want to give him up just like that, because it’s been a really long time that someone’s made me feel that way and apart from this, I have no complaints. The thing is that he knows that I can be triggered by these kinds of comments, but chose to make them anyways, saying that he’d rather be open and honest.",dating,t5_2qhb1,https://www.reddit.com/r/dating/comments/nkfyw4/is_the_desire_for_variety_in_sexual_partners_a/
75,nkg2rt,1621913431,help me out here,"i'm trying to put on weight for the ladies. I'm currently 6'0, 200 pounds(overweight yes), but I need to put on more weight. I want to hit 275 by July. Any diet tips on how I can put on this weight?",dating,t5_2qhb1,https://www.reddit.com/r/dating/comments/nkg2rt/help_me_out_here/
76,nkg4qh,1621913614,Outdated pictures for Online Dating,"Hello everyone, I recently met this girl on Hinge. She is cool and a nice person however there is a problem. Now she is the girl from her pictures but they are outdated. She was thinner in her pictures and says that because of staying in the house during the quarantine she gained a decent amount of weight. Nothing on her profile has how she looks currently. I've seen how she looks through facetime. How would you all navigate this?",dating,t5_2qhb1,https://www.reddit.com/r/dating/comments/nkg4qh/outdated_pictures_for_online_dating/
77,nkg98t,1621914057,This might sound superficial but I just can't seem to find a guy with symmetrical facial features,"Generally, when it comes to dating I really know what I want

Appearance wise I need symmetry! 

It must be a really old school request? Some nations see facial symmetry as beauty. 

In my background symmetry and having non crooked nose, none wonky eyes and symmetrical smiles are considered beauty and I've never settled for less. Not every symmetrical face is my type. 

But I don't want a guy with the above features

Particularly am asymmetrical head or odd head shape. 

This is superficial but I look quiet symmetrical in the face and I want my man too. 

I live in the England, UK and the main struggle I have of finding a guy my type is their facial appearance.",dating,t5_2qhb1,https://www.reddit.com/r/dating/comments/nkg98t/this_might_sound_superficial_but_i_just_cant_seem/
78,nkgh46,1621914812,How do I deal with relationship FOMO?,"I'm about to turn 21 and I honestly can't help but feel depressed about it everyday. I've never been in a relationship and God knows if a girl has ever liked me. Love is glorified in movies, music, pictures throughout history...it is everywhere we go. It has always been a part of human existence. But it has also become a constant reminder that I've never experienced what everyone else is experiencing. Being held by someone. Being valued. I know that people say it's not a big deal, but it's so hard not to feel like I'm losing out on something that makes life meaningful for so many people. Being loved. I've never felt that and who knows if I ever will. Constant rejection has made me so negative and cynical...I'm most likely to second guess myself if a girl ever shows interest me because of how commonplace rejection and loneliness is in my life.

Self-improvement has pretty much been my life these past few years...I don't really have an option but to focus and spend time on myself. And yeah..great, I have a stable career and a good body now. But I still feel so unhappy. People paint a picture of discipline and motivation, which is cool and all, but will a life of constant self-obsession really make me happy? None of that means anything if I can't cherish the beauty of life without a partner...otherwise it all just feels so bleak and lonely.

I don't know...just had to get that off my chest. Sometimes the pain gets so unbearable that I need to write it out. Hopefully someone can provide some reconciliation or advice on how I can overcome my longing desire for love and affection.",dating,t5_2qhb1,https://www.reddit.com/r/dating/comments/nkgh46/how_do_i_deal_with_relationship_fomo/
79,nkgiee,1621914935,Question for men,"Would you date a girl who is from a dysfunctional family? I wasn’t really sure who to talk to about this because I’m scared  my friends would judge me so I am turning to Reddit and opening up about it for the first time. As hard as it is for me to say this I’m ashamed of my father. My father always got into arguments with my mother growing up. He was around but never really a father figure at all. My mom was always stressed out and yelling at us because she worked at a restaurant from 10am-9pm and was barely making ends meet. My siblings and I were always caught in the middle. Tables thrown, doors slamming yet she never left him. My fathers just been a leech all his life, could never keep a cent in his pocket, smokes, has a gambling problem. It’s still pretty traumatizing because he drove this really beat up car around in middle school and high school to pick me up and would yell if I was even 10 minutes like and someone actually came up to me and said is that your father the other kids that he was a homeless man....but back to the main points. We don’t eat together, my mom can never have a proper conversation with me or my sister it’s always constant lecturing about one issue or another. I know my mom loves us but I feel like the way I am is due to this. I’m scared all never truly be able to open up about this with a guy. It’s always surface level conversations and flirting. I feel so ashamed about my family and never bring my family up because i never let it get that far because I’m scared that I’ll be judged. I’m scared of having to walk the aisle down alone because my father has never acted like my father and above all I’m scared my future partner would see that you family as a deal breaker. When I see normal families around me I really wished I had that but I know other people have it way worse than me. Having shelter, food, and a mom that cares in her own ways should be enough but I’m really scared that I’ll never able to find someone who will accept me for me.",dating,t5_2qhb1,https://www.reddit.com/r/dating/comments/nkgiee/question_for_men/
80,nkgp0o,1621915543,"Is it fizzling, or am I overthinking?","Hi Reddit,

I \[26m\] have been seeing someone \[28m\] regularly for about three months. Things were difficult with Covid logistics in the beginning, but we were seeing each other at least once a week and had a talk about how we weren't seeing anyone else. He's not out to many people, including his family, which is a bit of a minefield, but I want to see where things go. 

At some point I want to have a serious conversation about it - I get that everyone is on their own journey with sexuality, but I also don't want to feel dishonest about the person I'm seeing, which is essentially what'll happen if he can't be authentic with me.

At any rate, we used to text regularly - but over the last week or so I've noticed we're playing phone tag with about a day in-between. When either of us are out of town this is normal, and I still have feelings for him so I'm probably overplaying it, but I can't help thinking we're losing steam. He postponed plans on Sunday, and I missed a message from him last night. So - am I right to be concerned, or am I overthinking?

TIA!",dating,t5_2qhb1,https://www.reddit.com/r/dating/comments/nkgp0o/is_it_fizzling_or_am_i_overthinking/
81,nkgygd,1621916432,Too formal text after date?,"Had a girl cook dinner for me on our third date and we hooked up for the first time. Texted her a few days later saying ""Hi X! Had a great time. I appreciate you cooking. Food was great!"" and then she replied, ""haha so formal feel like I’m hearing back from a job interview"". Kinda just seems like a weird thing to text after someone said they had a good time. Any thoughts?",dating,t5_2qhb1,https://www.reddit.com/r/dating/comments/nkgygd/too_formal_text_after_date/
82,nkh6k5,1621917256,I made a decision to do the right thing and I don’t regret it.,"A few days ago a girl in another group that I'm in posted that she had been cheating on her fiance because she was bipolar and manic. She was hiding all of this from him. She wanted to marry him because she didn't want to deal with her bipolar alone, if they were married it would be just as much his responsibility to manage it as it was hers. Some people agreed with her  and said that she should definitely wait to tell him she was bipolar until after they got married, that way if he was impulsive and tried to leave her then it would be a lot harder for him to do that and if he did she would at least be able to take half of his stuff and therefore not be left with nothing. Apparently the cheating didn't need to be brought up because it wasn't even really her that did it, it was someone else, so it really didn't affect their relationship. I took screenshots of the entire thing and sent them to her fiance. I told him I was sorry. He thanked me and said that I shouldn't feel bad or be sorry. I don't feel bad for doing it. I'll do it again. I don't care. I do feel bad for him though. He seemed like a nice guy. I don't understand why people are like that. Why people are so devoid of conscience. I just don't get it. 

I always advice people to trust but verify. No one like to live with regrets or wonder what the future may hold when you can get the answer's now!!! Cheating shows a lack of morality, it is a mindset that is created and shaped from early childhood. It shows opportunistic traits. It demonstrates a lack of intrinsic moral fibre. It shows that the person thought so little about their partner that they then made a calculated decision to have sex with someone else. So the reason it is once a cheater always a cheater is because you cant change the nature of a snake.
To be honest cheating starts with a message. It's why i recommend that people seek the truth before it gets too late. 
I have a Direct/Recommended source of a hacker, He ranks amongst white hats like Kevin Mitnick, Tim Berners Lee, a co-founder of Ecatel hosting Contact Koch He’s always ready to render his services 24/7. He can help hack into any device, including Facebook, hangouts, Twitter, snapchat, Instagram, whatsapp, IOS and Android smart phones,Game cheats/hacks (mine craft, fort nite, e.t.c) tracking emails and also any other 3rd party apps. e.t.c .
Contact him: telegram: jailbreak321..If you also need specialized and experienced hacking into Educational Institutions, websites, GPS tracking, credit card hacking, loan application with Bad credit, DOT and CDL violation fix, fast processing of unemployment benefits, Financial relief forms and services  extended benefits for unemployed persons
&gt; Website Access (SQLi , Session Hijacking, XSS)
&gt;  Phone Hacking/Monitoring Guides/tutorials
&gt; Game Hacking
&gt;Hacking tutorials for as low as $99.99
&gt; Verification of ID .me, EDD,SBA all within 24hrs.
&gt; Clearing of Criminal Records 
&gt;  Retrieval of old/hacked facebook account.
and other 3rd party apps.
Clear Delayed ID me With EDD
- “Under review”/ UISD removal,
- Add money to PUA
- Fraud fix on Bank account ( B.O.A, CHASE e.t.c )
- IRS seed stage start up $100k and above if you qualify.
- Work from home(minimum wage $1800)
- Date check and extension on PEUC/FEDEd/PEUX/PUA
then you should contact him {Telegram: jailbreak321} or kochdamon@yahoo.com as he gets it done within 24hrs.with less hassle.",dating,t5_2qhb1,https://www.reddit.com/r/dating/comments/nkh6k5/i_made_a_decision_to_do_the_right_thing_and_i/
83,nkhfj7,1621918157,I just got ghosted,I met a guy on Bumble a while back and we’ve been talking. We went on a date and decided we wanted to go on another so we planned one through conversation later on. We’ve been talking a lot and today...he ghosted me. It’s an absolute gut punch. I’m waiting for some alone time so I can cry. I hate this so much. I just want to know what I did but I’m not going to get an answer which I hate even more. I just want to be good enough for someone....,dating,t5_2qhb1,https://www.reddit.com/r/dating/comments/nkhfj7/i_just_got_ghosted/
84,nkhmkn,1621918856,"30 year old guy, zero success with women in USA. Should I go to Southeast Asia to get an actual date?",[removed],dating,t5_2qhb1,https://www.reddit.com/r/dating/comments/nkhmkn/30_year_old_guy_zero_success_with_women_in_usa/
85,nkhtg9,1621919545,Advice,"Hello everyone. I would like to ask you for advice. As I discovered, I have a few problems with meeting people I would like to date. Mainly because I am kind of introverted, so I don't go out on my own and I can't make the first move, or even say hi to someone if my intention is to date them, I always need some kind of mediation. I have tried multiple dating services and so far none of the women was a match for me. Maybe I have high standards or maybe it's something else but I feel like lowering the standards is not a way to be truly happy.
If you have any suggestions on what to try I would be most grateful. Preferably if it's some kind of service if it's based in the Czech Republic.
But what I think would help me the most is knowing how to build the courage and confidence to talk to someone...
Thank you all very much.",dating,t5_2qhb1,https://www.reddit.com/r/dating/comments/nkhtg9/advice/
86,nki6aw,1621920914,Second date was somehow better than our first. (Long read),"Had my second date today and it was somehow better than the first!
I'm 28 male she's 28 Female.

It was rainy so we chilled at her place and I met her child and brother for the first time!
So I brought coffee and a 20 pack of Timbits, we sat and talked then she took me to her room and thing's got even more romantic.

We rolled up a few joints and toked together while listening to music, I got all lovey dovey because I was baked so we talked and cuddled.
Eventually I gave her a massage she layed down and I rubbed her back mounting her from behind I worked from her shoulders down to her back thighs and yes I massaged her butt.

I was actively trying to seduce her again but her little one came and wanted to cuddle up with mommy with her tablet and blanket.

 she started saying her back hurts too so I gave her little one a little back rub too while I massaged mom.
Her daughter is 2 but knew already to give us alone time but she wanted loves too so nap time came and her brother comes over so we roll up another joint and talked about school, our jobs and video games.

I hit it out of the park with her brother he actually likes me, she told me he can be finicky with people but he liked me we geeked out over Dark Souls.

So I spent 6hrs with her but it was so quick she just before I had to leave I told her that I could give her a better massage in her room now that we're alone and I suggested our 3rd date to be a sleep over, she said not yet and now those puppy dog eyes won't work.

Again I was hoping to have sex with her today but I don't feel the need to rush like I do with most girls usually I'd be concerned that she hasn't yet.
I.

I think she's teaching me how to be a proper boyfriend, I moved so fast with so many girls, I know realized I was doing it wrong I've slept with all my exes day one all of them are now well exes.

But I'm going to keep trying to seduce her with increasing levels of romance and getting creative with my seduction, I just hope it isn't too long of a wait for intimacy I like her and I'm starting to fall for her hard, I'd like to get more physical.
Tomorrow I'm bringing my impact driver over and putting together a play set for her daughter.

One question is am I doing this right? Am I being a good boyfriend? (Haven't made it official yet but I feel like I already am her boyfriend)",dating,t5_2qhb1,https://www.reddit.com/r/dating/comments/nki6aw/second_date_was_somehow_better_than_our_first/
87,nkij2u,1621922261,Need help on when/if to message,"I was at a bar I normally go to, I’m known there for playing cup pong and I don’t drink. Anyway it was towards the end of the night and these two girls come up to me and my friend. They pretty much came up to me and said they saw me slaying at pong and stuff and made some small talk offered to buy me a drink (I let them get me a soda after they insisted on getting me something). I got their snapchats and they had to go do something but the blonde told me to come back for karaoke night (which I will). Me and my friend left shortly after. My question is, the one I thought was cute, how/when should I message her? They kinda came up to me like I was a celebrity but I want to continue talking to the blonde/see if I have a shot. Advice appreciated",dating,t5_2qhb1,https://www.reddit.com/r/dating/comments/nkij2u/need_help_on_whenif_to_message/
