,all_awardings,allow_live_comments,author,author_flair_css_class,author_flair_richtext,author_flair_text,author_flair_type,author_fullname,author_is_blocked,author_patreon_flair,author_premium,awarders,can_mod_post,contest_mode,created_utc,domain,full_link,gildings,id,is_created_from_ads_ui,is_crosspostable,is_meta,is_original_content,is_reddit_media_domain,is_robot_indexable,is_self,is_video,link_flair_background_color,link_flair_css_class,link_flair_richtext,link_flair_template_id,link_flair_text,link_flair_text_color,link_flair_type,locked,media_only,no_follow,num_comments,num_crossposts,over_18,parent_whitelist_status,permalink,pinned,pwls,retrieved_on,score,selftext,send_replies,spoiler,stickied,subreddit,subreddit_id,subreddit_subscribers,subreddit_type,thumbnail,title,total_awards_received,treatment_tags,upvote_ratio,url,whitelist_status,wls,removed_by_category,author_cakeday,post_hint,preview
36,[],False,WhatsUpDudeee,,[],,text,t2_1sr22or1,False,False,False,[],False,False,1630897846,self.dating,https://www.reddit.com/r/dating/comments/pir5ae/is_it_unattractive_to_not_have_a_friend_group/,{},pir5ae,False,True,False,False,False,True,True,False,#ff4500,dating,"[{'e': 'text', 't': 'Question'}]",a9531dce-194e-11e5-b177-0eff099c3d1f,Question,light,richtext,False,False,False,26,0,False,all_ads,/r/dating/comments/pir5ae/is_it_unattractive_to_not_have_a_friend_group/,False,6,1630897857,1,"I'm about to graduate college this term, and going into a PhD program. Even though I've been going to college the past 4 years, I don't have a friend group. I don't have a group friends where I regularly do things, I actually don't even have one friend that I regularly do things. I've always been extremely introverted, even more so in high school. Over the past 4 years, I have been a little more social, but I just don't have friends to do things with, I genuinely don't. *Occasionally*, I might go grab lunch/coffee with a friend, but it's not frequent.

Is having little to no friends unattractive? I'm afraid that the day I start dating someone they'll ask me to introduce them to my friend group, but I literally don't have one. The though of this gives me anxiety.

Also, not sure if this will make a difference but I'm a guy",True,False,False,dating,t5_2qhb1,991041,public,self,is it unattractive to not have a friend group?,0,[],1.0,https://www.reddit.com/r/dating/comments/pir5ae/is_it_unattractive_to_not_have_a_friend_group/,all_ads,6,,,,
37,[],False,justsomerandomguy530,,[],,text,t2_49sqha84,False,False,False,[],False,False,1630898090,self.dating,https://www.reddit.com/r/dating/comments/pir7bu/how_do_i_get_closer_with_this_girl/,{},pir7bu,False,True,False,False,False,True,True,False,#ea0027,dating,"[{'e': 'text', 't': 'I Need Advice'}]",19ec58c2-9f74-11e7-81a1-0e2bf15991f0,I Need Advice,light,richtext,False,False,True,4,0,False,all_ads,/r/dating/comments/pir7bu/how_do_i_get_closer_with_this_girl/,False,6,1630898101,1,"In one of my classes, we had to make groups of three that we would be working with for a while. This girl sitting behind me asked if I wanted to be in her group, so I said sure and joined her. I was thinking of asking for her number but got too nervous, however,  without saying anything she opened her phone and put it on my desk to put my number in, so it worked out. I’m pretty sure she just did it so we could contact each other about homework, exams, etc. I want to get closer with her without coming off too strong so things aren’t awkward if she doesn’t want anything. What should I do?",True,False,False,dating,t5_2qhb1,991048,public,self,How do I get closer with this girl?,0,[],1.0,https://www.reddit.com/r/dating/comments/pir7bu/how_do_i_get_closer_with_this_girl/,all_ads,6,,,,
38,[],False,Scoliosissucks,,[],,text,t2_dd8uequi,False,False,False,[],False,False,1630898314,self.dating,https://www.reddit.com/r/dating/comments/pir9cg/how_to_get_over_crushing_on_this_guy/,{},pir9cg,False,True,False,False,False,True,True,False,#24a0ed,,"[{'e': 'text', 't': 'Long Distance'}]",5dc9d60a-cc75-11eb-86e9-0ea78081bf43,Long Distance,dark,richtext,False,False,True,4,0,False,all_ads,/r/dating/comments/pir9cg/how_to_get_over_crushing_on_this_guy/,False,6,1630898326,1,I have this crush on this guy.. I feel like I’m in middle school again. I’m extremely attracted to him which I totally shouldn’t be. He’s a recruiter which I’ve been told are very good liars and stuff. Dammit. But we have so much in common and I’m seeing him tomorrow for the first time since may. I feel like I made him into something in my head that he isn’t. I’ve been so good at separating my emotions from practical reasoning but idk with this i can’t. He was extremely into me also but now he’s telling me he isn’t ready for anything rn blah blah. He keeps telling me how sweet I am and stuff but I just don’t know what to think and if I am crazy for feeling like this.,True,False,False,dating,t5_2qhb1,991059,public,self,How to get over crushing on this guy,0,[],1.0,https://www.reddit.com/r/dating/comments/pir9cg/how_to_get_over_crushing_on_this_guy/,all_ads,6,,,,
39,[],False,pizzaprez202,,[],,text,t2_d6hfgdc9,False,False,False,[],False,False,1630898756,self.dating,https://www.reddit.com/r/dating/comments/pird93/would_you_leave_if_this_happened/,{},pird93,False,True,False,False,False,True,True,False,#ff4500,dating,"[{'e': 'text', 't': 'Question'}]",a9531dce-194e-11e5-b177-0eff099c3d1f,Question,light,richtext,False,False,True,13,0,False,all_ads,/r/dating/comments/pird93/would_you_leave_if_this_happened/,False,6,1630898767,1,If you found out your boyfriends mom was overweight (not obese but overweight). I have seen this happen,True,False,False,dating,t5_2qhb1,991068,public,self,Would you leave if this happened,0,[],1.0,https://www.reddit.com/r/dating/comments/pird93/would_you_leave_if_this_happened/,all_ads,6,,,,
40,[],False,Weener_dog7,,[],,text,t2_e7oya4kz,False,False,False,[],False,False,1630898810,self.dating,https://www.reddit.com/r/dating/comments/pirdqu/my_boyfriend_makes_me_feel_guilty_about_a_time_i/,{},pirdqu,False,True,False,False,False,True,True,False,#ea0027,dating,"[{'e': 'text', 't': 'I Need Advice'}]",19ec58c2-9f74-11e7-81a1-0e2bf15991f0,I Need Advice,light,richtext,False,False,True,19,0,False,all_ads,/r/dating/comments/pirdqu/my_boyfriend_makes_me_feel_guilty_about_a_time_i/,False,6,1630898822,1,"So my boyfriend and I were in a talking stage for a while before making it official. Getting to know each other in a very open way. He knew I was talking to another guy at the time, (and him to whatever girl) but we agreed (and I highly encouraged) that whatever else we were doing we told the other person at least to be safe (health-wise). I started falling in love with my now bf but the other guy I was talking to was suicidal and depressive. It was the first time I had been in a situation like that and the last time I tried telling him anything about not wanting to continue our fling, or whatever it was, he had a panic attack over the phone (to which I panicked and immediately started looking up “what to do when someone is having a panic attack over the phone) to which the only thing that actually seemed to work was reassuring him that we were okay. But I don’t think he’s the type to purposefully manipulate. The next time he and I saw each other I tried telling him again, for sure this time. Except to my surprise he started to have another panic attack in front of me and it was the first I had witnessed. Quite bizarre, if it was an act he overplayed it, otherwise panic attacks are pretty scary when you feel like you’re the cause yet you want to find the solution. What started as a truthful confession of wanting to cut things off turned into me taking 10 steps back into reassuring him that everything was fine. It went as far as us kissing and having sex. Only when I had sex with him I felt really disgusting with myself. During and after. Having sex with someone you don’t like (anymore) is not a nice feeling at all and I’m a terribly emotional being so I can’t seperate sex and emotions. Had nothing to do with him and everything to do with my emotional state. I didn’t feel comfortable talking about the sex part to my now bf at that time but I did mention the rest of the story (sex was permissible between us, it’s the fact that I lied about it that hurts him he says). I mentioned the kiss and not the sex. I didn’t tell him because what happened didn’t feel right, and coming out feeling discgusted with yourself isn’t something you wanna share with a guy you’re really into and want to get into a relationship with. Or at least that’s where my head was at. I recently told him what actually happened and anytime it’s mentioned he says he’s rlly hurt by it and kinda guilts me (unwantingly) but doesn’t care to understand my point of view. Not to justify a lie, but coming from your significant other I expected a little more understanding? So I’m constantly having to remind myself that we weren’t together, it was a complicated situation and that I handled it the best I knew how at that moment. Am I wrong? Should I feel more guilty?",True,False,False,dating,t5_2qhb1,991069,public,self,My boyfriend makes me feel guilty about a time I slept with a guy before we were exclusive ?,0,[],1.0,https://www.reddit.com/r/dating/comments/pirdqu/my_boyfriend_makes_me_feel_guilty_about_a_time_i/,all_ads,6,,,,
41,[],False,ThrowawayLonely17283,,[],,text,t2_ecw74gfq,False,False,False,[],False,False,1630899020,self.dating,https://www.reddit.com/r/dating/comments/pirfn3/lonely_and_feeling_down_i_am_tired_of_my/,{},pirfn3,False,False,False,False,False,False,True,False,#ea0027,dating,"[{'e': 'text', 't': 'I Need Advice'}]",19ec58c2-9f74-11e7-81a1-0e2bf15991f0,I Need Advice,light,richtext,False,False,True,0,0,False,all_ads,/r/dating/comments/pirfn3/lonely_and_feeling_down_i_am_tired_of_my/,False,6,1630899032,1,[removed],True,False,False,dating,t5_2qhb1,991075,public,self,"Lonely and feeling down, I am tired of my circumstances...",0,[],1.0,https://www.reddit.com/r/dating/comments/pirfn3/lonely_and_feeling_down_i_am_tired_of_my/,all_ads,6,moderator,,,
42,[],False,Lowd_WRX,,[],,text,t2_1ttpowoc,False,False,False,[],False,False,1630899474,self.dating,https://www.reddit.com/r/dating/comments/pirjkt/impossible_to_find_a_significant_other/,{},pirjkt,False,True,False,False,False,True,True,False,#ea0027,dating,"[{'e': 'text', 't': 'I Need Advice'}]",19ec58c2-9f74-11e7-81a1-0e2bf15991f0,I Need Advice,light,richtext,False,False,True,16,0,False,all_ads,/r/dating/comments/pirjkt/impossible_to_find_a_significant_other/,False,6,1630899484,1,"I am twenty-two years old, I have never had a girlfriend, and I am still a virgin. Throughout high school, I was skinny and had pretty bad acne. I always thought, ""once this acne goes away I'll start getting chicks"", but unfortunately that has not been the case. Since high school, my acne has mostly cleared up (still get a small breakout every once in a while but it's never bad), I've put on some muscle, and I've improved my social skills exponentially. Despite these improvements, I have still had minimal success with the opposite sex. There have been times when I meet someone cool, play it smooth, and almost finish the job. Every time this happens the opposing party completely loses interest when I am at the finish line. I legitimately believe that these individuals dig my vibe but my horrendous looks sway them last minute to turn me down. I'm 5'10, unattractive, and a red-headed male so I believe I am already at the bottom of the totem pole for the dating/sexual scene. Meanwhile, a friend of mine who I would consider being around my level in attractiveness will go on a dating app, tell a chick he matches with that he's well endowed, and bam he's getting laid within two nights. I don't know what to do anymore, and being ""more confident"" hasn't worked for me either.",True,False,False,dating,t5_2qhb1,991088,public,self,Impossible to find a significant other,0,[],1.0,https://www.reddit.com/r/dating/comments/pirjkt/impossible_to_find_a_significant_other/,all_ads,6,,,,
43,[],False,Throwerofaways69420,,[],,text,t2_8zpp4iwg,False,False,False,[],False,False,1630899760,self.dating,https://www.reddit.com/r/dating/comments/pirm27/tinders_hot_takes_thing_is_proof_to_me_looks_are/,{},pirm27,False,True,False,False,False,True,True,False,#ffb000,,"[{'e': 'text', 't': 'Tinder/Online Dating'}]",5214d2ac-61f1-11e8-8bb1-0ed15e4a39c0,Tinder/Online Dating,dark,richtext,False,False,True,9,0,False,all_ads,/r/dating/comments/pirm27/tinders_hot_takes_thing_is_proof_to_me_looks_are/,False,6,1630899771,1,"Well, when it works at least lol 
But I’ve matched with a couple of girls on their and the conversation was great, until they got to see my pics 🙃
Then of course, they let the time expire or just dipped. 
I know, I know, there’s lots of reasons they could’ve dipped and it’s just tinder blah blah blah, but I can’t help but convince myself looks are everything, i mean shit, it’s pretty obvious to me.",True,False,False,dating,t5_2qhb1,991098,public,self,Tinders hot takes thing is proof to me looks are way the most important thing,0,[],1.0,https://www.reddit.com/r/dating/comments/pirm27/tinders_hot_takes_thing_is_proof_to_me_looks_are/,all_ads,6,,,,
44,[],False,ThrowawayEXrmuslim,,[],,text,t2_ed2k6kd5,False,False,False,[],False,False,1630899848,self.dating,https://www.reddit.com/r/dating/comments/pirmu6/hi_i_need_some_help_as_am_trying_to_figure_out/,{},pirmu6,False,False,False,False,False,False,True,False,#ea0027,dating,"[{'e': 'text', 't': 'I Need Advice'}]",19ec58c2-9f74-11e7-81a1-0e2bf15991f0,I Need Advice,light,richtext,False,False,True,0,0,False,all_ads,/r/dating/comments/pirmu6/hi_i_need_some_help_as_am_trying_to_figure_out/,False,6,1630899859,1,[removed],True,False,False,dating,t5_2qhb1,991100,public,self,Hi! I need some help as am trying to figure out things,0,[],1.0,https://www.reddit.com/r/dating/comments/pirmu6/hi_i_need_some_help_as_am_trying_to_figure_out/,all_ads,6,moderator,,,
45,[],False,Mean_Palpitation_121,,[],,text,t2_dp3h3sni,False,False,False,[],False,False,1630900152,self.dating,https://www.reddit.com/r/dating/comments/pirpkb/what_can_i_say_to_her_now_that_i_hurt_her/,{},pirpkb,False,True,False,False,False,True,True,False,#ea0027,dating,"[{'e': 'text', 't': 'I Need Advice'}]",19ec58c2-9f74-11e7-81a1-0e2bf15991f0,I Need Advice,light,richtext,False,False,True,3,0,False,all_ads,/r/dating/comments/pirpkb/what_can_i_say_to_her_now_that_i_hurt_her/,False,6,1630900163,1,"
Met a girl at my retail job about a year ago. Started talking to her and she started joining me on my breaks at work just about everyday we worked together. She immediately caught my interest as in my experience girls who are not interested do not go out of their way to talk to me or take breaks with me

Over the next 6 months i started to get to know her better in time we spent talking on our breaks. These talks would usually end up going 5-15 minutes over our scheduled break time once we got to know each other better. 

She started asking me more personal questions about my life, interests, and school. Alot more personal questions than ive ever had with any other co workers. She would ask about my family and follow up on the things I told her. 

She told me a lot about herself as well and always seemed excited to sit down and talk with me. She always wanted to know what I was up to on the weekends and told me she wanted to go to some museum once the pandemic was over. 

She even mensioned to me that she was single on valentines day and asked if i gad any plans. Then proceeded to randomly tell me that a few coworkers hit on her but she wasn’t interested. I changed the topic as i was un comfortable. 

 After about 6 months i finally got up the nerve to ask for her number. She gave it to me with no hesitation.  Texted her the next day and we texted back and forth about 6 times until i got distracted and didn’t get back to her until the next day. Texted her the next day and had to go to bed early and left the convo. 

The next day I texted her but got no response… thought i was ghosted but then texted her a day or two after and she texted back  I then asked her if she wanted to go out on a date to which she said she didn’t think she could because she had a brother with health issues and may me vulnerable to the pandemic. I thought this was her way of rejecting me. 

I told her i understood and I wouldn’t talk to her anymore. I understand how awkward it can be to be asked out and I didn’t want her to be un comfterbal. She said I didn’t need to do that as she really enjoyed our relationship. She told me to treat her the same and said a few other things that confirmed she understood I asked her out. 

Didn’t talk to her or hear from her until I saw her at work next. I tried to avoid her but that was impossible once she sat down with my on my break. We talked for an hour and the topic of that never came up. I didn’t know where I stood or how she felt about the whole thing. I decided i just needed to get over her

I texted her a few days later and asked her if it was ok if she could not talk to me at work because I needed to get over my feelings for her. I also told her I thought she was a cool person and was my friend, but I just needed some time but id like to remain friends. 

She told me that she was into someone else and I tried to convince her to shoot her shot because i thought we were just friends at this point. She agreed to being friends and I thought everything was fine until the next time i saw her she seemed very upset. 

It was not my intention to hurt her in any way, i just didn’t want her to feel uncomfterbal or anything like that. I texted her that afternoon and said it was ok if she wanted to talk to me at work again but i got no response

She seems to be aware and knows when people are hitting on her. She seemed used to it so idk why she wouldn’t just tell me she wasn’t interested. 

I went up and tried to apologize to her the next time i saw her but she wouldn’t even face me and said she just wanted to be vague. 

Today I was sitting in the break room alone minding my own business then she sat down across the room. My friend called me and after 30 seconds of talking to her on the phone, she gets up and hurries out of the break room. Just kinda weird.

TL;DR: met a girl and thought we clicked. Asked her out and she told me she couldnt at the time because of a vulnerable family member(before vaccines) and I assumed she was lying.",True,False,False,dating,t5_2qhb1,991113,public,self,What can I say to her now that I hurt her feelings by basically accusing her of lying about a sick relative,0,[],1.0,https://www.reddit.com/r/dating/comments/pirpkb/what_can_i_say_to_her_now_that_i_hurt_her/,all_ads,6,,,,
46,[],False,Odd_Satisfaction_420,,[],,text,t2_7y941r8i,False,False,False,[],False,False,1630900817,self.dating,https://www.reddit.com/r/dating/comments/pirvdi/i_feel_so_shallow/,{},pirvdi,False,True,False,False,False,True,True,False,#ffb000,,"[{'e': 'text', 't': 'Tinder/Online Dating'}]",5214d2ac-61f1-11e8-8bb1-0ed15e4a39c0,Tinder/Online Dating,dark,richtext,False,False,True,2,0,False,all_ads,/r/dating/comments/pirvdi/i_feel_so_shallow/,False,6,1630900833,1,I've started online dating and have swiped right on just a handful of guys on three separate apps. I don't want to lower my standards just because. I don't live in a big city so I thought it might be that but is just online dating isn't the best option?,True,False,False,dating,t5_2qhb1,991125,public,self,I feel so shallow,0,[],1.0,https://www.reddit.com/r/dating/comments/pirvdi/i_feel_so_shallow/,all_ads,6,,,,
47,[],False,Quirky_Prune_208,,[],,text,t2_c5iakwt2,False,False,False,[],False,False,1630901247,self.dating,https://www.reddit.com/r/dating/comments/pirz6m/is_it_unattractive_to_women_for_a_man_to_have/,{},pirz6m,False,True,False,False,False,True,True,False,#ff4500,dating,"[{'e': 'text', 't': 'Question'}]",a9531dce-194e-11e5-b177-0eff099c3d1f,Question,light,richtext,False,False,True,16,0,False,all_ads,/r/dating/comments/pirz6m/is_it_unattractive_to_women_for_a_man_to_have/,False,6,1630901258,1,Is it unattractive for a man to have very long hair (I don't mean like John Wick I mean like past the nipples),True,False,False,dating,t5_2qhb1,991137,public,self,Is it unattractive to women for a man to have long hair,0,[],1.0,https://www.reddit.com/r/dating/comments/pirz6m/is_it_unattractive_to_women_for_a_man_to_have/,all_ads,6,,,,
48,[],False,MobileCow8218,,[],,text,t2_b7cb3v6t,False,False,False,[],False,False,1630901697,self.dating,https://www.reddit.com/r/dating/comments/pis36s/compliment_or_insult/,{},pis36s,False,False,False,False,False,False,True,False,#ea0027,dating,"[{'e': 'text', 't': 'I Need Advice'}]",19ec58c2-9f74-11e7-81a1-0e2bf15991f0,I Need Advice,light,richtext,False,False,True,0,0,False,all_ads,/r/dating/comments/pis36s/compliment_or_insult/,False,6,1630901707,1,[removed],True,False,False,dating,t5_2qhb1,991143,public,self,Compliment or insult,0,[],1.0,https://www.reddit.com/r/dating/comments/pis36s/compliment_or_insult/,all_ads,6,moderator,,,
49,[],False,throwawayghostacct,,[],,text,t2_bhoh0mbp,False,False,False,[],False,False,1630902786,self.dating,https://www.reddit.com/r/dating/comments/piscgw/why_would_former_crush_be_watching_my_snap/,{},piscgw,False,True,False,False,False,True,True,False,#ff4500,dating,"[{'e': 'text', 't': 'Question'}]",a9531dce-194e-11e5-b177-0eff099c3d1f,Question,light,richtext,False,False,True,2,0,False,all_ads,/r/dating/comments/piscgw/why_would_former_crush_be_watching_my_snap/,False,6,1630902798,1,"I recently started talking to and old flame on Snapchat again.  We both had feelings, but went our seperate ways after we both did some hurtful things and had a talk about not being ready for a relationship.  It was tough, but needed to happen.  She wanted to stay friends, I thought no contact was best.  I reached out to her after two months because I found myself thinking about her again and the hurtful things were no where near my mind.  I still wanted her in my life, but recognized a relationship wouldn't be healthy for me.

Intially, she asked me to meet her so we could talk, but hours later intiates the conversation over text.  We talk about what happened.  I'm okay with letting it go and say I'd like to be friends while we work on ourselves.  We're carrying a conversation of near instant replies until 2am that night.

I'll get instant replies when I snap her.  If I don't snap her within a day or two, she will reach out to me.  

Strange thing... She views my snap stories anonymously some how and I don't get what I means.

I know this because one day I posted a snap story I wanted her to see.  Waited all day for her to see it.  She never showed up as a viewer.  Right when it's about to expire, I get a snap from her and her name magically appears as one of the first people to view my story.  

Another time, she literally replied to my story with a snap message, but she never showed up as viewing it.  

I read online you can put your phone on airplane mode to view a story anonymously.  Why would she be doing this?",True,False,False,dating,t5_2qhb1,991176,public,self,Why would former crush be watching my snap stories anonymously?,0,[],1.0,https://www.reddit.com/r/dating/comments/piscgw/why_would_former_crush_be_watching_my_snap/,all_ads,6,,,,
50,[],False,chuckydoll67895432,,[],,text,t2_czww9i4b,False,False,False,[],False,False,1630904205,self.dating,https://www.reddit.com/r/dating/comments/piso2w/going_on_my_first_grown_up_date_any_advice/,{},piso2w,False,True,False,False,False,True,True,False,#ea0027,dating,"[{'e': 'text', 't': 'I Need Advice'}]",19ec58c2-9f74-11e7-81a1-0e2bf15991f0,I Need Advice,light,richtext,False,False,True,7,0,False,all_ads,/r/dating/comments/piso2w/going_on_my_first_grown_up_date_any_advice/,False,6,1630904216,1,"I’m 21f and was asked out by a very handsome 29m to dinner last week, and it’s coming up, and I’m a little nervous; that’s a joke. I’m really nervous. We’ve been texting about where to meet for dinner, so there’s been a little conversation but not much after that. In excited to get all dolled up, but the pre-date jitters are hitting hard. Are there things I should be aware of when conversing with him? Should I be a little alarmed about the age difference? Any advice or testimonials would be greatly appreciated(:",True,False,False,dating,t5_2qhb1,991202,public,self,"Going on my first grown up date, any advice??",0,[],1.0,https://www.reddit.com/r/dating/comments/piso2w/going_on_my_first_grown_up_date_any_advice/,all_ads,6,,,,
51,[],False,Arcadia28,,[],,text,t2_e7e6rt4l,False,False,False,[],False,False,1630904379,self.dating,https://www.reddit.com/r/dating/comments/pispfx/to_look_or_not_to_look/,{},pispfx,False,True,False,False,False,True,True,False,#ea0027,dating,"[{'e': 'text', 't': 'I Need Advice'}]",19ec58c2-9f74-11e7-81a1-0e2bf15991f0,I Need Advice,light,richtext,False,False,True,5,0,False,all_ads,/r/dating/comments/pispfx/to_look_or_not_to_look/,False,6,1630904389,1,"I'm a bit confused, do you look or love or no.
I've heard and seen people say don't look of it, if your looking for a decent relationship, but if you want to do a hook up than that's just fine.",True,False,False,dating,t5_2qhb1,991206,public,self,To look or not to look,0,[],1.0,https://www.reddit.com/r/dating/comments/pispfx/to_look_or_not_to_look/,all_ads,6,,,,
