,all_awardings,allow_live_comments,author,author_flair_css_class,author_flair_richtext,author_flair_text,author_flair_type,author_fullname,author_patreon_flair,author_premium,awarders,can_mod_post,contest_mode,created_utc,domain,full_link,gildings,id,is_created_from_ads_ui,is_crosspostable,is_meta,is_original_content,is_reddit_media_domain,is_robot_indexable,is_self,is_video,link_flair_background_color,link_flair_css_class,link_flair_richtext,link_flair_template_id,link_flair_text,link_flair_text_color,link_flair_type,locked,media_only,no_follow,num_comments,num_crossposts,over_18,parent_whitelist_status,permalink,pinned,pwls,retrieved_on,score,selftext,send_replies,spoiler,stickied,subreddit,subreddit_id,subreddit_subscribers,subreddit_type,thumbnail,title,total_awards_received,treatment_tags,upvote_ratio,url,whitelist_status,wls,removed_by_category,author_cakeday
31,[],False,ct1077,,[],,text,t2_4udb30si,False,False,[],False,False,1625517987,self.dating,https://www.reddit.com/r/dating/comments/oefz47/is_this_rude_of_me/,{},oefz47,False,True,False,False,False,True,True,False,#ff4500,dating,"[{'e': 'text', 't': 'Question'}]",a9531dce-194e-11e5-b177-0eff099c3d1f,Question,light,richtext,False,False,True,11,0,False,all_ads,/r/dating/comments/oefz47/is_this_rude_of_me/,False,6,1625517997,1," I've been talking to this girl for about 2 months now, she's very nice and we met on Hinge. Although sometimes we'll be texting and she'll disappear for like a day and respond back so it's kind of hard to have a text conversation, I get it because i'm busy myself and prefer meeting in person rather than texting forever. I've asked her if I can take her out a few times and she always says yes but kind of goes AWOL on me before we can fully plan it out. I told her that I was going away for the month of July for training and that they'd be taking my phone, and she said she wishes she would've known that earlier because she's been taking her time to know me and now i'm leaving in a few days, but still continues the disappearing game. The other night she texted me ""hey"", and I responded and didn't hear back from her for another full day when she said happy 4th of July. Lol. Then she said ""we should do something tomorrow so we can get to know each other"" and I was cool with that, so I asked her what time works best for her? . So I sent ""I hope you have a happy 4th, can't wait to see you"". Well it is now tomorrow and almost 2:00 in the afternoon, still nothing, and I got curious so I looked on snapchat and noticed she's been active all day. Kind of over it and feel like it's a waste of time to pursue, so I sent a message saying ""Hey, you're a very nice girl and it was nice getting to know you, but I don't really have time for the disappearing act. Hope you find what you're looking for"". Am I the asshole or am I just missing something. I mean it kind of sucks when you don't want to make plans with anyone else all day because you told someone you'd hangout with them, and you're just waiting on them to give you a time but they never do and proceed to post things on snapchat.",True,False,False,dating,t5_2qhb1,879856,public,self,Is this rude of me?,0,[],1.0,https://www.reddit.com/r/dating/comments/oefz47/is_this_rude_of_me/,all_ads,6,,
32,[],False,rocanony,,[],,text,t2_cwqsjfdn,False,False,[],False,False,1625518162,self.dating,https://www.reddit.com/r/dating/comments/oeg148/my_prince_must_be_lost/,{},oeg148,False,True,False,False,False,True,True,False,#ea0027,dating,"[{'e': 'text', 't': 'I Need Advice'}]",19ec58c2-9f74-11e7-81a1-0e2bf15991f0,I Need Advice,light,richtext,False,False,False,17,0,False,all_ads,/r/dating/comments/oeg148/my_prince_must_be_lost/,False,6,1625518172,1,"I’m been single my whole life. I’m in my early twenties and I thought things would change when I graduated high school but it didn’t. No one in high school liked me and no one in college likes me. Everyone says I have a great personality and they wish they were funny and outgoing like me. But I guess that’s not enough. Lately I’ve been getting insecure to go out with my friends because they always get hit on whether it’s creepy guys or nice looking guys. No one comes my way. I don’t think I’m bad looking but maybe I am lmao. It’s just been really hard and I know I’m in my early twenties but seeing everyone around me boo’d up sucks. I never had a boyfriend and I’m starting to think I never will. Idk if I need to change and be less outgoing. Or maybe I look intimidating. Maybe these are all turn offs. My friends say I’m pretty but you know how it goes, they’re my friends. I’m basically the DUFF (designated ugly fat friend). My friends are beautiful. I know people say the right guy will come along but damn it’s been years and he is no where to be found. I’ve had crushes and told them but rejection after rejection. Kinda numb to it and over it. But I want love. Every time I manifest a boyfriend, one of my friends gets a boy. Lmao it’s like universe is laughing at me. I don’t think I need to change who I am and I don’t like the idea of wearing a lot makeup or dressing a certain way to get a guy. I just wanna be me.",True,False,False,dating,t5_2qhb1,879859,public,self,My prince must be lost,0,[],1.0,https://www.reddit.com/r/dating/comments/oeg148/my_prince_must_be_lost/,all_ads,6,,
33,[],False,lmaoplanes,,[],,text,t2_51z0zxxy,False,False,[],False,False,1625518758,self.dating,https://www.reddit.com/r/dating/comments/oeg80s/is_it_okay_to_post_gymweightlifting_videos_in_old/,{},oeg80s,False,True,False,False,False,True,True,False,#ff4500,dating,"[{'e': 'text', 't': 'Question'}]",a9531dce-194e-11e5-b177-0eff099c3d1f,Question,light,richtext,False,False,True,8,0,False,all_ads,/r/dating/comments/oeg80s/is_it_okay_to_post_gymweightlifting_videos_in_old/,False,6,1625518769,1,"The gym/weightlifting is a big part of my life and I'm not afraid to say my physique is one of my better selling points.

I do a lot of ""PR"" lift videos on my social feeds in tank tops, etc. and wondering if it's considered a ""douche"" move to post these types of videos?
They definitely show off my physique favorably and also show me doing something that is a big part of my life (5 days a week I go to the gym).

What do you guys think? It's not a gym mirror selfie or anything and I'm still wearing a shirt (albeit a tank top).",True,False,False,dating,t5_2qhb1,879866,public,self,Is it okay to post gym/weightlifting videos in OLD profile?,0,[],1.0,https://www.reddit.com/r/dating/comments/oeg80s/is_it_okay_to_post_gymweightlifting_videos_in_old/,all_ads,6,,
34,[],False,undercover__giraffe,,[],,text,t2_d4nty677,False,False,[],False,False,1625519337,self.dating,https://www.reddit.com/r/dating/comments/oegexj/i_23f_am_looking_to_date_girls_but_feel_so_behind/,{},oegexj,False,False,False,False,False,False,True,False,#ea0027,dating,"[{'e': 'text', 't': 'I Need Advice'}]",19ec58c2-9f74-11e7-81a1-0e2bf15991f0,I Need Advice,light,richtext,False,False,True,0,0,False,all_ads,/r/dating/comments/oegexj/i_23f_am_looking_to_date_girls_but_feel_so_behind/,False,6,1625519348,1,[removed],True,False,False,dating,t5_2qhb1,879885,public,self,I [23F] am looking to date girls but feel so behind - where to start?!,0,[],1.0,https://www.reddit.com/r/dating/comments/oegexj/i_23f_am_looking_to_date_girls_but_feel_so_behind/,all_ads,6,moderator,
35,[],False,undercover__giraffe,,[],,text,t2_d4nty677,False,False,[],False,False,1625519421,self.dating,https://www.reddit.com/r/dating/comments/oegfuy/dating_girls_for_the_first_time_how_to_get_over/,{},oegfuy,False,False,False,False,False,False,True,False,#ea0027,dating,"[{'e': 'text', 't': 'I Need Advice'}]",19ec58c2-9f74-11e7-81a1-0e2bf15991f0,I Need Advice,light,richtext,False,False,True,0,0,False,all_ads,/r/dating/comments/oegfuy/dating_girls_for_the_first_time_how_to_get_over/,False,6,1625519432,1,[removed],True,False,False,dating,t5_2qhb1,879888,public,self,Dating girls for the first time - how to get over my 'latecomer shame'?,0,[],1.0,https://www.reddit.com/r/dating/comments/oegfuy/dating_girls_for_the_first_time_how_to_get_over/,all_ads,6,moderator,
36,[],False,RAThrowAway298329,,[],,text,t2_d4nk938f,False,False,[],False,False,1625519483,self.dating,https://www.reddit.com/r/dating/comments/oeggjl/girl_ive_been_seeing_for_3_months_wants_to_date/,{},oeggjl,False,False,False,False,False,False,True,False,#ff4500,dating,"[{'e': 'text', 't': 'Question'}]",a9531dce-194e-11e5-b177-0eff099c3d1f,Question,light,richtext,False,False,True,7,0,False,all_ads,/r/dating/comments/oeggjl/girl_ive_been_seeing_for_3_months_wants_to_date/,False,6,1625519494,1,[removed],True,False,False,dating,t5_2qhb1,879888,public,self,Girl I've been seeing for 3 months wants to date other people?,0,[],1.0,https://www.reddit.com/r/dating/comments/oeggjl/girl_ive_been_seeing_for_3_months_wants_to_date/,all_ads,6,moderator,
37,[],False,wowburritos,,[],,text,t2_5mqsl2px,False,False,[],False,False,1625519533,self.dating,https://www.reddit.com/r/dating/comments/oegh37/does_anyone_else_struggle_w_this/,{},oegh37,False,True,False,False,False,True,True,False,#ea0027,dating,"[{'e': 'text', 't': 'I Need Advice'}]",19ec58c2-9f74-11e7-81a1-0e2bf15991f0,I Need Advice,light,richtext,False,False,True,6,0,False,all_ads,/r/dating/comments/oegh37/does_anyone_else_struggle_w_this/,False,6,1625519543,1,"I (20) tend to fixate on one person at a time even if I’m not super into them. As soon as they start to pull away or stop texting me much tho I will immediately start thinking about them all the time and wait for their next text kinda thing.

Went on a couple of dates w this guy I’ve known for like three weeks. The last time we saw each other was on Friday and he still hasn’t texted me. Personally thought it was going good but now I feel like I’m going to get ghosted and I’m very upset :(

I know logically I should probably just dust myself off and move on but I still feel really upset. How can I stop hyperfixating on people?",True,False,False,dating,t5_2qhb1,879889,public,self,Does anyone else struggle w this?,0,[],1.0,https://www.reddit.com/r/dating/comments/oegh37/does_anyone_else_struggle_w_this/,all_ads,6,,
38,[],False,HotBoy386,,[],,text,t2_d4mpb2vz,False,False,[],False,False,1625519765,self.dating,https://www.reddit.com/r/dating/comments/oegjno/40yearold_male_feeling_lonely/,{},oegjno,False,False,False,False,False,False,True,False,#ea0027,dating,"[{'e': 'text', 't': 'I Need Advice'}]",19ec58c2-9f74-11e7-81a1-0e2bf15991f0,I Need Advice,light,richtext,False,False,True,0,0,False,all_ads,/r/dating/comments/oegjno/40yearold_male_feeling_lonely/,False,6,1625519775,1,[removed],True,False,False,dating,t5_2qhb1,879893,public,self,40-year-old male feeling lonely,0,[],1.0,https://www.reddit.com/r/dating/comments/oegjno/40yearold_male_feeling_lonely/,all_ads,6,moderator,
39,[],False,BrownAndyeh,,[],,text,t2_3cdpaz8b,False,False,[],False,False,1625519858,self.dating,https://www.reddit.com/r/dating/comments/oegkpm/i_psych_myself_out/,{},oegkpm,False,True,False,False,False,True,True,False,#878a8c,dating,"[{'e': 'text', 't': 'Venting'}]",a616c322-194e-11e5-ab91-0ed1c06bdad7,Venting,light,richtext,False,False,True,4,0,False,all_ads,/r/dating/comments/oegkpm/i_psych_myself_out/,False,6,1625519868,1,"Confession / rant
When I see a women by herself, rather than walk up and say hello, I spend the time wondering: is she single?, maybe she’s just waiting for a friend, I should leave her alone. What will I say? 

It’s all dating 101, I know I have to just do it.. sink or swim: better than nothing.",True,False,False,dating,t5_2qhb1,879895,public,self,I psych myself out.,0,[],1.0,https://www.reddit.com/r/dating/comments/oegkpm/i_psych_myself_out/,all_ads,6,,
40,[],False,Douer3,,[],,text,t2_d1hwc0ys,False,False,[],False,False,1625520073,self.dating,https://www.reddit.com/r/dating/comments/oegn6b/whys_he27_never_been_in_a_relationship_is_it/,{},oegn6b,False,True,False,False,False,True,True,False,#ffb000,,"[{'e': 'text', 't': 'Tinder/Online Dating'}]",5214d2ac-61f1-11e8-8bb1-0ed15e4a39c0,Tinder/Online Dating,dark,richtext,False,False,True,6,0,False,all_ads,/r/dating/comments/oegn6b/whys_he27_never_been_in_a_relationship_is_it/,False,6,1625520084,1,"Hi, everyone! I(F 25) first use a dating app called okcupid and on that know a man who’s working as a programmer in Germany now. But he doesn’t like his work and his land and tells me he wants to fly to japan at once when its border is open. We met 2 times on zoom and he decided to meet me in my city after that. He likes talking a lot about his past and his interest. After he reached my city at noon I led him to a Asia restaurant. We both ordered a soup for ourselves and when we were paying bill I also took out my wallet. When he said we paid for own, Indeed, I wasn’t comfortable!! He even asked me to buy 2 bottles of water for ourselves. I don’t want man always pay for me but at least for the first date you should ask for pay for me… or I’ll doubt what’s wrong with me…

He like studying law of attraction a lot and tried to train me in a way taught in a video on YouTube when we walked past a part. After training he sat next to me on the bench and he held me my hand. I could see that he was a bit nervous but he was seemed also quite happy. He told me he hadn’t never been in a relationship and he didn’t like the way that German girls talked to him…I was just surprised by that and want to know if all these are normal? Is it normal to hold hands on first date?

Later he gave me a yellow stone as a present, btw what does that mean? ?In China we seldom send others stones as gifts.",True,False,False,dating,t5_2qhb1,879903,public,self,Why’s he(27) never been in a relationship? Is it normal to hold hands on first date?,0,[],1.0,https://www.reddit.com/r/dating/comments/oegn6b/whys_he27_never_been_in_a_relationship_is_it/,all_ads,6,,
41,[],False,meogdon,,[],,text,t2_cg8rk4q4,False,False,[],False,False,1625520085,self.dating,https://www.reddit.com/r/dating/comments/oegnbf/flirting_styles/,{},oegnbf,False,True,False,False,False,True,True,False,#ea0027,dating,"[{'e': 'text', 't': 'I Need Advice'}]",19ec58c2-9f74-11e7-81a1-0e2bf15991f0,I Need Advice,light,richtext,False,False,True,10,0,False,all_ads,/r/dating/comments/oegnbf/flirting_styles/,False,6,1625520097,1,What are ways you can flirt with a female through text before a planned date 4 days from now that you have with her?,True,False,False,dating,t5_2qhb1,879904,public,self,Flirting styles?,0,[],1.0,https://www.reddit.com/r/dating/comments/oegnbf/flirting_styles/,all_ads,6,,
42,[],False,Curious_otterr,,[],,text,t2_bf5k5rnh,False,False,[],False,False,1625520492,self.dating,https://www.reddit.com/r/dating/comments/oegs10/want_to_give_up_in_trying_after_first_date_in_a/,{},oegs10,False,True,False,False,False,True,True,False,#878a8c,dating,"[{'e': 'text', 't': 'Venting'}]",a616c322-194e-11e5-ab91-0ed1c06bdad7,Venting,light,richtext,False,False,False,5,0,False,all_ads,/r/dating/comments/oegs10/want_to_give_up_in_trying_after_first_date_in_a/,False,6,1625520504,1,"I (20F) feel terrible right now, I think I’m better off alone, I don’t want to be played with. 

I went on date with a guy (25M) to an arcade, he was very pushy with kissing me and I caved in after being touched deprived for so long,

We went to his apt and after talking to each other non stop, we started talking about his profession (pharma) and we found out we were both psychedelic heads.
We both took micro doses and we had laughs, deep conversation, and non stop sex in-till 4 am.

We feel asleep and woke up, he kept trying to look into my eyes and tell me how beautiful I was. I said I had to go but he was asking me to stay a little bit. I initiated sex again, then I went to take a shower, he followed me in. On my way out he for a kiss goodbye but I was half way out of the door. 

We didn’t really text a lot before, and I was okay with it because my days were pretty packed and I wouldn’t use my phone all day.

Now it’s Monday- and I haven’t heard from him. That’s answer enough to know he doesn’t like me enough. I have a feeling he goes through a lot of girls as he had a drawer full of sex toys.

I feel like I was used only for sex, and I think I should just stop trying to find companionship. I feel so much regret as of now.

I deleted his number and contact, I know when a guy likes you he at least texts you if you came home safe, but I guess not. 

TLDR: sex on first date, was an amazing night, so much chemistry, so much in common, be he hadn’t text me yet, I get the hint he doesn’t like me as much. I feel like i don’t have the emotional strength to keep dating. I think I not meant to have a companion",True,False,False,dating,t5_2qhb1,879915,public,self,Want to give up in trying after first date in a whole year,0,[],1.0,https://www.reddit.com/r/dating/comments/oegs10/want_to_give_up_in_trying_after_first_date_in_a/,all_ads,6,,
43,[],False,becky_sean,,[],,text,t2_d35e0q25,False,False,[],False,False,1625520727,self.dating,https://www.reddit.com/r/dating/comments/oeguro/relationship/,{},oeguro,False,False,False,False,False,False,True,False,#ffb000,,"[{'e': 'text', 't': 'Tinder/Online Dating'}]",5214d2ac-61f1-11e8-8bb1-0ed15e4a39c0,Tinder/Online Dating,dark,richtext,False,False,True,2,0,False,all_ads,/r/dating/comments/oeguro/relationship/,False,6,1625520737,1,[removed],True,False,False,dating,t5_2qhb1,879921,public,self,Relationship,0,[],1.0,https://www.reddit.com/r/dating/comments/oeguro/relationship/,all_ads,6,reddit,
44,[],False,letmalk,,[],,text,t2_3rhqddk7,False,False,[],False,False,1625520938,self.dating,https://www.reddit.com/r/dating/comments/oegx2z/what_is_the_best_way_you_have_been_rejected/,{},oegx2z,False,True,False,False,False,True,True,False,#ff4500,dating,"[{'e': 'text', 't': 'Question'}]",a9531dce-194e-11e5-b177-0eff099c3d1f,Question,light,richtext,False,False,False,9,0,False,all_ads,/r/dating/comments/oegx2z/what_is_the_best_way_you_have_been_rejected/,False,6,1625520949,1,"Since i've started seeing someone for some time, I have had to  reject people asking me out a couple of times and it's always difficult because I don't want to be rude. 

So what is the best way to go about it?",True,False,False,dating,t5_2qhb1,879924,public,self,What is the best way you have been rejected?,0,[],1.0,https://www.reddit.com/r/dating/comments/oegx2z/what_is_the_best_way_you_have_been_rejected/,all_ads,6,,
45,[],False,LarryLobster-,,[],,text,t2_d4jpsx6n,False,False,[],False,False,1625520997,self.dating,https://www.reddit.com/r/dating/comments/oegxr8/how_does_everyone_else_approach_sex_during/,{},oegxr8,False,False,False,False,False,False,True,False,#ff4500,dating,"[{'e': 'text', 't': 'Question'}]",a9531dce-194e-11e5-b177-0eff099c3d1f,Question,light,richtext,False,False,True,0,0,False,all_ads,/r/dating/comments/oegxr8/how_does_everyone_else_approach_sex_during/,False,6,1625521008,1,[removed],True,False,False,dating,t5_2qhb1,879926,public,self,How does everyone else approach Sex during dating/relationships?,0,[],1.0,https://www.reddit.com/r/dating/comments/oegxr8/how_does_everyone_else_approach_sex_during/,all_ads,6,moderator,
46,[],False,juggernaut12312,,[],,text,t2_ch6znwu5,False,False,[],False,False,1625521215,self.dating,https://www.reddit.com/r/dating/comments/oeh0az/my_time_will_come/,{},oeh0az,False,False,False,False,False,False,True,False,,dating,"[{'e': 'text', 't': 'Other'}]",fd9c03b8-a1ce-11e7-9172-0e8c9f9ecf4c,Other,dark,richtext,False,False,True,0,0,False,all_ads,/r/dating/comments/oeh0az/my_time_will_come/,False,6,1625521226,1,[removed],True,False,False,dating,t5_2qhb1,879933,public,self,My time will come,0,[],1.0,https://www.reddit.com/r/dating/comments/oeh0az/my_time_will_come/,all_ads,6,moderator,
47,[],False,Lillian365,,[],,text,t2_d0tdmogx,False,False,[],False,False,1625521333,self.dating,https://www.reddit.com/r/dating/comments/oeh1nx/im_down_for_quick_hookup/,{},oeh1nx,False,False,False,False,False,False,True,False,#ffb000,,"[{'e': 'text', 't': 'Tinder/Online Dating'}]",5214d2ac-61f1-11e8-8bb1-0ed15e4a39c0,Tinder/Online Dating,dark,richtext,False,False,True,2,0,False,all_ads,/r/dating/comments/oeh1nx/im_down_for_quick_hookup/,False,6,1625521345,1,[removed],True,False,False,dating,t5_2qhb1,879937,public,self,I’m down for quick hookup,0,[],1.0,https://www.reddit.com/r/dating/comments/oeh1nx/im_down_for_quick_hookup/,all_ads,6,reddit,
48,[],False,throawy2021,,[],,text,t2_d4ocb70r,False,False,[],False,False,1625521435,self.dating,https://www.reddit.com/r/dating/comments/oeh2tb/meeting_someone_in_online_school/,{},oeh2tb,False,False,False,False,False,False,True,False,#ea0027,dating,"[{'e': 'text', 't': 'I Need Advice'}]",19ec58c2-9f74-11e7-81a1-0e2bf15991f0,I Need Advice,light,richtext,False,False,True,0,0,False,all_ads,/r/dating/comments/oeh2tb/meeting_someone_in_online_school/,False,6,1625521446,1,[removed],True,False,False,dating,t5_2qhb1,879940,public,self,Meeting someone in online school!!!,0,[],1.0,https://www.reddit.com/r/dating/comments/oeh2tb/meeting_someone_in_online_school/,all_ads,6,moderator,
49,[],False,cmjaxon81,,[],,text,t2_4lx15arn,False,False,[],False,False,1625521749,self.dating,https://www.reddit.com/r/dating/comments/oeh6by/never_used_a_dating_app_before_am_i_missing_out/,{},oeh6by,False,True,False,False,False,True,True,False,#878a8c,dating,"[{'e': 'text', 't': 'Venting'}]",a616c322-194e-11e5-ab91-0ed1c06bdad7,Venting,light,richtext,False,False,True,75,0,False,all_ads,/r/dating/comments/oeh6by/never_used_a_dating_app_before_am_i_missing_out/,False,6,1625521760,1,"I was on TikTok and I commented on a person’s video expressing frustration regarding dating apps. I stated I’ve never used one. I meet people through social networking, the gym, mutual friends, and work. I’ve always found dating apps to be off putting and creepy. It’s like people are not people but products to shop for. 

As a woman the lingering fear is this guy a killer or psycho has been another reason. Closest thing to a dating app in my social media accounts but those connections see my entire personality not a limited number of photos and 250 character intro. My past dates took time to build a connection online first before it progressed. 

There are times I do want to meet someone who is outside of my typical network but from what I’ve seen and read the expectation of sex within the first five minutes has turned me off I’m old fashioned. Like 3-5 dates before it becomes physical, or weeks of talking online.  I like slow progression but I see folks treat relationships like a fast food line or a microwave.",True,False,False,dating,t5_2qhb1,879950,public,self,Never used a Dating App Before Am I Missing Out?,0,[],1.0,https://www.reddit.com/r/dating/comments/oeh6by/never_used_a_dating_app_before_am_i_missing_out/,all_ads,6,,
50,[],False,Queen-of-meme,,[],,text,t2_62ocvc2r,False,False,[],False,False,1625522023,self.dating,https://www.reddit.com/r/dating/comments/oeh9j0/you_stay_single_if_you_stay_unrealistic/,{},oeh9j0,False,True,False,False,False,True,True,False,#ffd635,dating,"[{'e': 'text', 't': 'Giving Advice'}]",7bca2c58-4211-11e5-9ecb-0e60d8112001,Giving Advice,dark,richtext,False,False,True,13,0,False,all_ads,/r/dating/comments/oeh9j0/you_stay_single_if_you_stay_unrealistic/,False,6,1625522034,1,"Harsh truth but if you are single year after year but rejecting every guy who isn't a doctor or taking you on expensive dates or for guys who only swipe on every super skinny girl, you're not being realistic.

Girls. In the real world,  you won't meet a millionaire or someone who comes down in a limo car and take you to a exclusive fancy date. Stop reading 50 shades and wake up. Doctors or guys with big bank accounts find ladies irl and they will choose someone in their own circles and class. 

Guys. She won't be blonde or brunette or whatever is your type"" and have the looks of a sexy actor with DD cups. Stop mixing porn with dating. Unless you look like a underwear model, model looking girls will not match with you, they are way too shallow to accept you. 

Instead. Find a match that is cute ""enough""  on your level someone who will see something in you too, chat, talk, get to know them a little. 

Focus on how they make you feel. Are they kind to you? Are they making you laugh? Do you think they're cute / handsome? Do you feel that you can be yourself around them? Do you like how they smell? Do you admire who they are? Do you feel like they see you? 


You should be picky. But for the right reasons.  Don't judge what they wear or what food they order or what job they have or other pointless details things that doesn't say much about who they are, be open to getting to know the person inside the shell. Be more curious than judgemental.",True,False,False,dating,t5_2qhb1,879955,public,self,You stay single if you stay unrealistic.,0,[],1.0,https://www.reddit.com/r/dating/comments/oeh9j0/you_stay_single_if_you_stay_unrealistic/,all_ads,6,,
