,all_awardings,allow_live_comments,author,author_flair_background_color,author_flair_css_class,author_flair_text,author_flair_text_color,awarders,banned_by,can_mod_post,contest_mode,created_utc,domain,full_link,gildings,id,is_crosspostable,is_meta,is_original_content,is_reddit_media_domain,is_robot_indexable,is_self,is_video,link_flair_background_color,link_flair_css_class,link_flair_richtext,link_flair_template_id,link_flair_text,link_flair_text_color,link_flair_type,locked,media_only,no_follow,num_comments,num_crossposts,over_18,parent_whitelist_status,permalink,pinned,pwls,removed_by_category,retrieved_on,score,send_replies,spoiler,stickied,subreddit,subreddit_id,subreddit_subscribers,subreddit_type,thumbnail,title,total_awards_received,treatment_tags,upvote_ratio,url,whitelist_status,wls,author_flair_richtext,author_flair_type,author_fullname,author_patreon_flair,author_premium,selftext,edited,author_cakeday
36,[],False,notyourbitchassagain,,,,,[],,False,False,1622457513,self.dating,https://www.reddit.com/r/dating/comments/np0eqc/dating_niches/,{},np0eqc,False,False,False,False,False,True,False,,dating,"[{'e': 'text', 't': 'Other'}]",fd9c03b8-a1ce-11e7-9172-0e8c9f9ecf4c,Other,dark,richtext,False,False,True,0,0,False,all_ads,/r/dating/comments/np0eqc/dating_niches/,False,6,moderator,1622460246,1,True,False,False,dating,t5_2qhb1,806947,public,self,Dating Niches,0,[],1.0,https://www.reddit.com/r/dating/comments/np0eqc/dating_niches/,all_ads,6,[],text,t2_bb9elnip,False,False,[removed],,
37,[],False,notyourbitchassagain,,,,,[],,False,False,1622457565,self.dating,https://www.reddit.com/r/dating/comments/np0f66/hello/,{},np0f66,False,False,False,False,False,True,False,,dating,"[{'e': 'text', 't': 'Other'}]",fd9c03b8-a1ce-11e7-9172-0e8c9f9ecf4c,Other,dark,richtext,False,False,True,0,0,False,all_ads,/r/dating/comments/np0f66/hello/,False,6,moderator,1622460290,1,True,False,False,dating,t5_2qhb1,806946,public,self,hello,0,[],1.0,https://www.reddit.com/r/dating/comments/np0f66/hello/,all_ads,6,[],text,t2_bb9elnip,False,False,[removed],,
38,[],False,ImportantCoffee8550,,,,,[],,False,False,1622458524,self.dating,https://www.reddit.com/r/dating/comments/np0nww/help_with_my_date/,{},np0nww,True,False,False,False,True,True,False,,,"[{'e': 'text', 't': 'Tinder/Online Dating'}]",5214d2ac-61f1-11e8-8bb1-0ed15e4a39c0,Tinder/Online Dating,dark,richtext,False,False,True,11,0,False,all_ads,/r/dating/comments/np0nww/help_with_my_date/,False,6,,1622461106,1,True,False,False,dating,t5_2qhb1,806960,public,self,Help with my date,0,[],1.0,https://www.reddit.com/r/dating/comments/np0nww/help_with_my_date/,all_ads,6,[],text,t2_bpn5w6t6,False,False,"Hello everyone, it is my first time writing here. I met this guy on Tinder, we are both 24, and we went on 2 dates already. In the second one he was constantly watching the hour like he wanted to go. In the text he is super open and we have talked for more than 3 months almost everyday, and also when he is drunk he always text me with more confidence inviting me to his place. There was no physical contact, is he interested?",1622459396.0,
39,[],False,Vast-Magician2105,,,,,[],,False,False,1622459197,self.dating,https://www.reddit.com/r/dating/comments/np0uhg/when_should_i_ask_the_girl_ive_been_dating_for/,{},np0uhg,True,False,False,False,True,True,False,,dating,"[{'e': 'text', 't': 'I Need Advice'}]",19ec58c2-9f74-11e7-81a1-0e2bf15991f0,I Need Advice,dark,richtext,False,False,True,12,0,False,all_ads,/r/dating/comments/np0uhg/when_should_i_ask_the_girl_ive_been_dating_for/,False,6,,1622461682,1,True,False,False,dating,t5_2qhb1,806972,public,self,When should I ask the girl I've been dating for over a year to be my girlfriend?,0,[],1.0,https://www.reddit.com/r/dating/comments/np0uhg/when_should_i_ask_the_girl_ive_been_dating_for/,all_ads,6,[],text,t2_88fnsmwg,False,False,"Hey guys! Using a throwaway as I'm not 100% sure if she uses Reddit or not.

Just under a year and a half ago, I started talking to the girl I'm now head over heels for. We hit it off instantly and have been talking pretty much every day since we met. However, we only just met up in person this last week. We don't live too far apart, but with Covid and everything going on we decided to not take any chances and wait until things got back to normal. We spoke at length about what we'd both like out of a relationship and when we got onto the topic of ""us"", we agreed it would be best to not give it a label until we met in person.

So we met up a few days ago and it was perfect. She's a beautiful, kind, caring soul and we both said that it was worth the wait to finally meet each other. I'll spare you all the mushy stuff, but we got pretty close while on the date so it's pretty clear that the attraction goes both ways!

Now we've met, all of the worries I had about ""will she still like me when she sees me in person"" have vanished which is awesome! But now I find myself constantly wondering ""when should I ask her if she wants to be my girlfriend?""

Part of me thinks I should let her be the one to bring it up, as I don't want to come across as too clingy or needy. But on the opposite side of the coin, if she wasn't serious about this she surely wouldn't have been talking to me for the last 16 months?

My head is admittedly still a bit frazzled after our date and I've had butterflies ever since, so I'd really appreciate any advice!",,
40,[],False,Flamestranger,,,,,[],,False,False,1622459706,self.dating,https://www.reddit.com/r/dating/comments/np0zke/i_feel_really_dry/,{},np0zke,True,False,False,False,True,True,False,,dating,"[{'e': 'text', 't': 'I Need Advice'}]",19ec58c2-9f74-11e7-81a1-0e2bf15991f0,I Need Advice,dark,richtext,False,False,False,10,0,False,all_ads,/r/dating/comments/np0zke/i_feel_really_dry/,False,6,,1622462114,2,True,False,False,dating,t5_2qhb1,806979,public,self,I feel really dry,0,[],1.0,https://www.reddit.com/r/dating/comments/np0zke/i_feel_really_dry/,all_ads,6,[],text,t2_5vcc0ol,False,False,"Whenever I'm talking to anyone, but especially people I'm interested in, I feel like I cant keep  proper conversation without being socially awkward or resorting to the same questions",,
41,[],False,mafhio,,,,,[],,False,False,1622459759,self.dating,https://www.reddit.com/r/dating/comments/np104m/what_exactly_is_effort/,{},np104m,True,False,False,False,True,True,False,,dating,"[{'e': 'text', 't': 'Question'}]",a9531dce-194e-11e5-b177-0eff099c3d1f,Question,dark,richtext,False,False,False,10,0,False,all_ads,/r/dating/comments/np104m/what_exactly_is_effort/,False,6,,1622462159,2,True,False,False,dating,t5_2qhb1,806979,public,self,What exactly is effort?,0,[],1.0,https://www.reddit.com/r/dating/comments/np104m/what_exactly_is_effort/,all_ads,6,[],text,t2_c8rbglm,False,False,My girlfriend keeps saying I don't show effort but what exactly is it? I'm there when she needs me to be in person and on call. FYI she belongs to a conservative family so I see her like once a week at best. I can admit to the fact during our time together I've been more wrong than she has and have been more shit too. Said a lot of things I shouldn't have and so on. Our relationship came into start right after her previous one like barely a few weeks later (whole story to this). She just keeps mentioning I show no effort but I just dont know what I can do with the distance between us. If effort means talking and being there then I'm there with her when she needs me to be. We are at a shaky stage where I said a lot and she is saying I need to do more or she'll leave. I just don't wanna lose her and be better. But don't exactly know where to start..,,
42,[],False,throwawaypls2020,,,,,[],,False,False,1622459922,self.dating,https://www.reddit.com/r/dating/comments/np11sn/you_dont_have_to_be_the_most_interesting_person/,{},np11sn,True,False,False,False,True,True,False,,dating,"[{'e': 'text', 't': 'Venting'}]",a616c322-194e-11e5-ab91-0ed1c06bdad7,Venting,dark,richtext,False,False,True,11,0,False,all_ads,/r/dating/comments/np11sn/you_dont_have_to_be_the_most_interesting_person/,False,6,,1622462302,1,True,False,False,dating,t5_2qhb1,806981,public,self,"You don't have to be the most interesting person in the world, but please have something...",0,[],0.67,https://www.reddit.com/r/dating/comments/np11sn/you_dont_have_to_be_the_most_interesting_person/,all_ads,6,[],text,t2_5dpimrar,False,False,"I used to be in the opinion that it's NOT up to you to be interesting, it's up to the other party to be interested. That is... Until I met this guy.

He's in his 30s and has been single his whole life (nothing wrong with that), he's been trying to date, but according to him he's too unlucky in love, and sometimes he blames it on his race (not in the bitter entitled way, I should add).

We got to talking, and few months after, I realized what the problem is. He has no hobby whatsoever (not even gaming), has no passion or topic of interest, and doesn't like reading or even watching the news. He spends his days watching netflix. As a result, he can't hold conversations for shit. You talk about climate change, and dude could only contribute ""oh that's bad..."", talk about nature and animals, and dude doesn't even know what platypus is, talk about shopping, dude hates shopping (said he left it to his mom to do it), talk about tech, dude's not in touch with what mobile phones are out there, talk about travelling, dude never left town and doesn't seem to have any intention to (also completely blanked out when i shared my stories so I stopped), talk about current affairs and news, and you'd be lucky to get any sort of signs that he was interested, even when I asked about what he does at work, it was super vague (I guess he's not used to talking/explaining).

He NEVER made jokes, never said anything remotely witty, and can't understand jokes either... I introduced him to my friend who tried to break the ice by teasing him lightly (nothing mean at all - his phone was acting up when they tried to exchange numbers, so my friend said something along the line haha your phone doesn't consent to this exchange huh), and he apologized (very sincerely too). Uh... 

He tried to pick up guitar because he thought that would get him girls, but gave up when he realized it doesn't. 

He is the most boring person I've ever met.... And everytime we talk, it's up to me to drive the conversation. I have to conduct a bloody interview everytime... I always feel so exhausted and drained afterwards.

In an attempt to help him, I asked him if there's anything he wants to try doing, or even mildly interested in, and got... None... Threw some suggestions (like hiking and stuff), and got rejected because he thinks it's not fun to do those unless with a girlfriend (went nowhere when I tried to persuade him otherwise). Even when hanging out with his group of friends (that he said he couldn't connect with), he's just there, not talking, not participating, just tagging along silently (he said this). He also has very low self esteem and as a result has victim paranoia problems. 

He said I'm his only real friend, which made me feel guilty, because it's not mutual... I asked if he's struggling with mental health, and he said he's ok apart from really wanting a girlfriend, but he always gets ghosted after few conversations (not too surprised...). I tried to help him find something, anything, to be interested in, to live for, a goal, and got nowhere.

Not sure how he can get a girlfriend if he doesn't change... Not sure why I'm posting here either, just a little frustrated with him I guess.

To clarify, it's ok to be this kind of person of you're happy, but he's not, he's super unhappy with with social life (friends &amp; girlfriend department).",,
43,[],False,[deleted],,,,dark,[],moderators,False,False,1622460681,self.dating,https://www.reddit.com/r/dating/comments/np19t3/i_am_afraid_to_communicate_with_men_in_real_life/,{},np19t3,False,False,False,False,False,True,False,,dating,"[{'e': 'text', 't': 'Question'}]",a9531dce-194e-11e5-b177-0eff099c3d1f,Question,dark,richtext,False,False,True,2,0,False,all_ads,/r/dating/comments/np19t3/i_am_afraid_to_communicate_with_men_in_real_life/,False,6,deleted,1622462979,1,True,False,False,dating,t5_2qhb1,806994,public,default,I am afraid to communicate with men in real life. I can only through social networks.,0,[],1.0,https://www.reddit.com/r/dating/comments/np19t3/i_am_afraid_to_communicate_with_men_in_real_life/,all_ads,6,,,,,,,,
44,[],False,stellahunts19,,,,,[],,False,False,1622460870,self.dating,https://www.reddit.com/r/dating/comments/np1bnn/what_do_i_do/,{},np1bnn,True,False,False,False,True,True,False,,dating,"[{'e': 'text', 't': 'Question'}]",a9531dce-194e-11e5-b177-0eff099c3d1f,Question,dark,richtext,False,False,True,5,0,False,all_ads,/r/dating/comments/np1bnn/what_do_i_do/,False,6,,1622463147,1,True,False,False,dating,t5_2qhb1,806994,public,self,What do i do?,0,[],1.0,https://www.reddit.com/r/dating/comments/np1bnn/what_do_i_do/,all_ads,6,[],text,t2_a0m37u2m,False,False," I am afraid to communicate with men in real life. I can only through social networks. As soon as the guy speaks to me, I'm ready to run home and hide under the bed. Perhaps this is due to the fact that in childhood my father beat me ...",,
45,[],False,c_delesc,,,,,[],,False,False,1622460873,self.dating,https://www.reddit.com/r/dating/comments/np1bom/stop_asking_people_what_they_do_for_a_living/,{},np1bom,True,False,False,False,True,True,False,,dating,"[{'e': 'text', 't': 'Venting'}]",a616c322-194e-11e5-ab91-0ed1c06bdad7,Venting,dark,richtext,False,False,False,27,0,False,all_ads,/r/dating/comments/np1bom/stop_asking_people_what_they_do_for_a_living/,False,6,,1622463149,3,True,False,False,dating,t5_2qhb1,806995,public,self,Stop asking people what they do for a living!,0,[],0.71,https://www.reddit.com/r/dating/comments/np1bom/stop_asking_people_what_they_do_for_a_living/,all_ads,6,[],text,t2_bn1hmnms,False,False,"Alright, I remember NYE’s 2019 (before covid closed everything) I said to myself next time I go on a date Im not going to ask what they do for a living. ESPECIALLY, because most people put that info on their dating app. 

I don’t know, i find it a very superficial question. I hated being asked that even when I had my fancy and well-payed job. 

I don’t think the job you have says too much about you ... now .. how about we start asking people DO YOU LOVE what you do? 
Because think about it, if they do they will tell you about their job... (if that’s what u want to know) if they don’t love it you will find out why and you can even learn more about their character. 

Do I make sense? 

I can def afford my part of the date regardless of what that person does for a living so I guess that’s why’s at the end of the day it doesn’t matter to me.",,
46,[],False,WonderfulResolve9252,,,,,[],,False,False,1622461241,self.dating,https://www.reddit.com/r/dating/comments/np1fg6/why_do_some_guys_not_like_their_girlfriends/,{},np1fg6,True,False,False,False,True,True,False,,dating,"[{'e': 'text', 't': 'Question'}]",a9531dce-194e-11e5-b177-0eff099c3d1f,Question,dark,richtext,False,False,False,263,0,False,all_ads,/r/dating/comments/np1fg6/why_do_some_guys_not_like_their_girlfriends/,False,6,,1622463483,2,True,False,False,dating,t5_2qhb1,807000,public,self,Why do some guys not like their girlfriends wearing revealing clothes when they follow a ton of provocative women/models on social media?,0,[],1.0,https://www.reddit.com/r/dating/comments/np1fg6/why_do_some_guys_not_like_their_girlfriends/,all_ads,6,[],text,t2_aon56905,False,False,A lot of guys have issues with their girlfriends wearing revealing clothes and showing their cleavage etc but they would follow a ton of provocative/almost naked women on Instagram. What’s their perspective? In a way isn’t the girlfriend just being one of those girls that their boyfriend find attractive on social media? Why are the guys not okay with their girlfriends doing the same thing?,,
47,[],False,NatureTrekker,,,,,[],,False,False,1622461796,self.dating,https://www.reddit.com/r/dating/comments/np1l9j/guy_sending_6_paragraph_long_messages/,{},np1l9j,True,False,False,False,True,True,False,,dating,"[{'e': 'text', 't': 'I Need Advice'}]",19ec58c2-9f74-11e7-81a1-0e2bf15991f0,I Need Advice,dark,richtext,False,False,True,16,0,False,all_ads,/r/dating/comments/np1l9j/guy_sending_6_paragraph_long_messages/,False,6,,1622463988,0,True,False,False,dating,t5_2qhb1,807008,public,self,Guy sending 6+ paragraph long messages,0,[],0.5,https://www.reddit.com/r/dating/comments/np1l9j/guy_sending_6_paragraph_long_messages/,all_ads,6,[],text,t2_4d4oglco,False,False,"I’ve been talking to this guy for just 2 days and all of his messages are literally 6+ paragraphs. I appreciate that he’s engaging and that we appear to have a lot in common, but it’s too much. I’m already exhausted talking to him. 

I know dating is supposed to require some effort but this feels like a job. Is this normal? How do you handle long-winded people on these apps?",1622461995.0,
48,[],False,SimpleCookie5477,,,,,[],,False,False,1622462603,self.dating,https://www.reddit.com/r/dating/comments/np1u37/how_to_date_a_man_in_his_mid_30s_when_im_in_my/,{},np1u37,False,False,False,False,False,True,False,,dating,"[{'e': 'text', 't': 'I Need Advice'}]",19ec58c2-9f74-11e7-81a1-0e2bf15991f0,I Need Advice,dark,richtext,False,False,True,2,0,False,all_ads,/r/dating/comments/np1u37/how_to_date_a_man_in_his_mid_30s_when_im_in_my/,False,6,reddit,1622464703,1,True,False,False,dating,t5_2qhb1,807022,public,self,How to date a man in his mid 30s when I'm in my early 20s ?,0,[],1.0,https://www.reddit.com/r/dating/comments/np1u37/how_to_date_a_man_in_his_mid_30s_when_im_in_my/,all_ads,6,[],text,t2_cfud36lx,False,False,[removed],,
49,[],False,kimmmy23,,,,,[],,False,False,1622463211,self.dating,https://www.reddit.com/r/dating/comments/np20f2/im_available_for_hookup_serious_minded_people/,{},np20f2,False,False,False,False,False,True,False,,,"[{'e': 'text', 't': 'Tinder/Online Dating'}]",5214d2ac-61f1-11e8-8bb1-0ed15e4a39c0,Tinder/Online Dating,dark,richtext,False,False,True,2,0,False,all_ads,/r/dating/comments/np20f2/im_available_for_hookup_serious_minded_people/,False,6,reddit,1622465224,1,True,False,False,dating,t5_2qhb1,807031,public,self,I’m available for hookup serious minded people please,0,[],1.0,https://www.reddit.com/r/dating/comments/np20f2/im_available_for_hookup_serious_minded_people/,all_ads,6,[],text,t2_bygh8q7y,False,False,[removed],,
50,[],False,[deleted],,,,dark,[],moderators,False,False,1622463531,self.dating,https://www.reddit.com/r/dating/comments/np23wp/top_six_reasons_for_turning_down_your_first_date/,{},np23wp,False,False,False,False,False,True,False,,dating,"[{'e': 'text', 't': 'Giving Advice'}]",7bca2c58-4211-11e5-9ecb-0e60d8112001,Giving Advice,dark,richtext,False,False,True,4,0,False,all_ads,/r/dating/comments/np23wp/top_six_reasons_for_turning_down_your_first_date/,False,6,deleted,1622465498,1,True,False,False,dating,t5_2qhb1,807036,public,default,Top Six Reasons For Turning Down Your First Date,0,[],1.0,https://www.reddit.com/r/dating/comments/np23wp/top_six_reasons_for_turning_down_your_first_date/,all_ads,6,,,,,,,,
51,[],False,suppadupapoopa,,,,,[],,False,False,1622464127,self.dating,https://www.reddit.com/r/dating/comments/np2a8k/wondering_if_i_should_reach_out/,{},np2a8k,True,False,False,False,True,True,False,,dating,"[{'e': 'text', 't': 'I Need Advice'}]",19ec58c2-9f74-11e7-81a1-0e2bf15991f0,I Need Advice,dark,richtext,False,False,False,9,0,False,all_ads,/r/dating/comments/np2a8k/wondering_if_i_should_reach_out/,False,6,,1622466008,1,True,False,False,dating,t5_2qhb1,807048,public,self,Wondering if i should reach out,0,[],0.99,https://www.reddit.com/r/dating/comments/np2a8k/wondering_if_i_should_reach_out/,all_ads,6,[],text,t2_cdcdlc06,False,False,"Hello everybody this is my first time posting here (also don't mind the username this is not my main account)

So a little backstory, back in april 2020 my fiancé of 4 years dumped me, it was harsh but i went on with my life.
A few months later i met a girl through reddit and everything went pretty well, i explained her my situation and asked her if we could take things slow if we were to start dating, to which she agreed.

So we kinda started dating, it went pretty well up until a second lockdown was instated in my country, my mental health took a nose dive and i realized i hadn't fully healed.
I wasn't in the right place for dating and i broke up with her trying to be as honnest as i could and wishing her well.

After that i went no contact and focused on myself, that was 6 months ago.

Cue to now i'm in a better place mentaly and i've been wondering how she's been doing and thinking about her a lot.
So my question would be if i should reach out ?
Maybe she's better off left alone.

What would be your take on that ?

Tl;dr : Broke up with a girl because i wasn't ready to date and mental health problems, went on to focus on myself.
6 months later i'm in a better place and Wondering if i should reach out",1622464705.0,
52,[],False,Fit_Signature_7773,,,,,[],,False,False,1622464262,self.dating,https://www.reddit.com/r/dating/comments/np2bq7/i_dont_know_what_im_doing_wrong/,{},np2bq7,False,False,False,False,False,True,False,,dating,"[{'e': 'text', 't': 'Venting'}]",a616c322-194e-11e5-ab91-0ed1c06bdad7,Venting,dark,richtext,False,False,True,0,0,False,all_ads,/r/dating/comments/np2bq7/i_dont_know_what_im_doing_wrong/,False,6,moderator,1622466124,1,True,False,False,dating,t5_2qhb1,807053,public,self,I don't know what I'm doing wrong.,0,[],1.0,https://www.reddit.com/r/dating/comments/np2bq7/i_dont_know_what_im_doing_wrong/,all_ads,6,[],text,t2_cfq7cq40,False,False,[removed],,
53,[],False,rid0756,,,,,[],,False,False,1622464883,self.dating,https://www.reddit.com/r/dating/comments/np2i9f/need_advice_on_girl_who_ended_talking_phase/,{},np2i9f,True,False,False,False,True,True,False,,dating,"[{'e': 'text', 't': 'Question'}]",a9531dce-194e-11e5-b177-0eff099c3d1f,Question,dark,richtext,False,False,True,11,0,False,all_ads,/r/dating/comments/np2i9f/need_advice_on_girl_who_ended_talking_phase/,False,6,,1622466685,1,True,False,False,dating,t5_2qhb1,807065,public,self,Need Advice On Girl Who Ended Talking Phase,0,[],1.0,https://www.reddit.com/r/dating/comments/np2i9f/need_advice_on_girl_who_ended_talking_phase/,all_ads,6,[],text,t2_bdo53ya2,False,False,"So, I was talking this girl who I really liked and a had a strong interest in. She was intellectual, unique and open minded. I honestly have not had feelings for a girl since the past 5 years, hence why I knew she was special. It was all going smooth, her talking on the phone, constant laughs and understandings and all that. I wake up to a text from her saying she wants to end it because she was struggling with personal problems from past,present and future. All of which I understood but thing is, I honestly can’t keep her off my mind. I genuinely liked her and we both told each other how we feel. I feel as if though there is a chance of me taking her out but clueless if I should tho. I plan on hitting her up in two weeks to say hello and ask how she is doing just to help cope with her struggles, but man I am unsure in my position.",,
54,[],False,free_-_spirit,,,,,[],,False,False,1622464982,self.dating,https://www.reddit.com/r/dating/comments/np2jdu/why_do_some_people_specifically_men_kiss_with/,{},np2jdu,True,False,False,False,True,True,False,,dating,"[{'e': 'text', 't': 'Question'}]",a9531dce-194e-11e5-b177-0eff099c3d1f,Question,dark,richtext,False,False,False,19,0,False,all_ads,/r/dating/comments/np2jdu/why_do_some_people_specifically_men_kiss_with/,False,6,,1622466777,1,True,False,False,dating,t5_2qhb1,807066,public,self,"Why do some people, specifically men, kiss with their eyes open?",0,[],0.67,https://www.reddit.com/r/dating/comments/np2jdu/why_do_some_people_specifically_men_kiss_with/,all_ads,6,[],text,t2_5id421wi,False,False,"I found it offensive when an ex would do this quite frequently. He was emotionally avoidant though, but I wonder if it could possibly be a somewhat healthy or normal thing some guys do?",,
55,[],False,Alwayseekingadvicee,,,,,[],,False,False,1622465174,self.dating,https://www.reddit.com/r/dating/comments/np2lgv/as_a_woman_should_i_be_weary_of_men_that_pursue/,{},np2lgv,True,False,False,False,True,True,False,,dating,"[{'e': 'text', 't': 'Question'}]",a9531dce-194e-11e5-b177-0eff099c3d1f,Question,dark,richtext,False,False,False,8,0,False,all_ads,/r/dating/comments/np2lgv/as_a_woman_should_i_be_weary_of_men_that_pursue/,False,6,,1622466946,2,True,False,False,dating,t5_2qhb1,807066,public,self,"As a woman, should I be weary of men that pursue me heavily? If so, why?",0,[],1.0,https://www.reddit.com/r/dating/comments/np2lgv/as_a_woman_should_i_be_weary_of_men_that_pursue/,all_ads,6,[],text,t2_bmewqf5g,False,False,"I am a pretty independent person and it takes me a while to really like anybody. I have noticed that the men I tend to end up dating are the ones who pursue me heavily over a long time. It has had less than desirable results longterm..... And I wonder if that is just a coincidence because that is the dating game.... or if it's the type of men I am letting into my life.

Any men or women have thoughts here?",,
