,id,created_utc,title,selftext,subreddit,subreddit_id,url
20,poiyi0,1631679732,My girlfriend got mad at me for potentially hanging out with a new female coworker. Is it ok?,"Me, 21 male just got a new job with a lot of new people and I have a coworker there that shares same interests as me and also has ADHD issues which we love to chat about together since we are only one there with such diagnosis.

We clicked, and became instant friends in such short span I work there so we decided to maybe, hangout this weekend if time allows. We haven't made ANY plans besides ""maybe this weekend"".

Here is the issue, my girlfriend of 2 years. She is sweet an amazing but if she doesn't like something in slightest, she hates it and if she likes it, she just loves to insane levels, so it's either 0 or a 100 emotion wise and it wasn't like that when I met her.

I have came after work today, and since I know her well and didn't want to make it seem like I'm hiding anything from her, since it's also includes another female I just told her ""Hey im going to hangout with my coworker this weekend, she has ADHD too and we gonna prolly get something to eat and imma be back by 8 or so(I get off at 6 so barely 2 hours of being away from my gf)"".

She freaked out, she started saying stuff such as that I'm doing this because she isn't enough for me(I lived through pandemic with her, 24/7 for the past 2 years.), that I'm trying to replace, upgrade etc. She mentioned that I can ""do what I want with her"" so I assume sex, so she thinks I want to cheat on her.

Few months ago we were at the party and then her crush came to the same party and in the HS they had a thing together. I didn't care about it after she explained why she got all nervous all of the sudden, but litteraly day after she asked me if I would be ok if she hangs out with him someday. I asked her if that would be just him and her or more people and she said just him and her and I told her I wouldn't mind as long as I meet him and he doesn't give me any reason not to trust him. Like I mentioned before, I trust my gf so I would need to know him and what kind of person he is now(she hasn't seen him for the past 2 years.) She agreed and told me she was asking it theoretically to see what I say and we never brought it up until today.



In my head it seems hella messed up that she blatantly told me I cannot be friends with a coworker just because it's a female. I tried explaining to her that I would love them both to meet each other, and my coworker knows that I'm in a relationship.

For the past 3 months or so financially we were tight and that was stressing both of us out but it would go to that point where she would yell at me, tell me she doesn't love me, she hates me, she changed her mind on proposal and marriage(she lost proposal ring too), and weekly changes mind about her feelings towards me.
It's tough for me, so I just was happy to find this person that has same issues as me ADHD wise that I could relate to, but im unable to due to this whole situation with my gf.

What are my options besides breaking up?(we have a lease that isn't due until december July 2022).She mentioned that even me saying that I want to hangout with someone else breaks her heart and she doesn't know how to feel about this.
I had about 2,3 friends before I met her but they were very very close to me but now I have 0 friends.
Right now she locked herself in the room, refusing to communicate to me while I'm in the living room on the couch.

I do understand my options are limited but at this point I just need a advice or push towards the right direction because I'm clearly confused as to what to think or do.",dating,t5_2qhb1,https://www.reddit.com/r/dating/comments/poiyi0/my_girlfriend_got_mad_at_me_for_potentially/
21,poj2bu,1631680179,I don’t know if I’ll ever love anyone more than her,"Ok to get to the point I’m only 18 so I have my entire life ahead of me and I know it sounds stupid to say the title 

But when I was younger my first love was this girl who was really cute, but also understood me a lot 

We used to take acid and just chill together throughout New York City creating memories. But she was 2 years younger than me in highschool being that young she never really experienced as much as I’ve seen.

But in the end it never worked out and we just stayed friends but as time when on she was never the same.

Now I’ve dated many people and I’ve never felt the same connection as I did with her and honestly I miss her but she doesn’t exist anymore in a way ( we both got older ) Time has gone on and we have both changed and went on our separate ways along time ago. 

But that doesn’t change the fact I haven’t felt the same connection and it really makes me sad and whenever I do drugs I think of the memories we had and that makes me feel like I honestly don’t care anymore so I do anything to make me forget ( that’s not the right word but Idk it there is one )

I’m just wondering if anyone has been in my shoes before!",dating,t5_2qhb1,https://www.reddit.com/r/dating/comments/poj2bu/i_dont_know_if_ill_ever_love_anyone_more_than_her/
22,poj3mv,1631680325,This girl F(20) played me so badly and I can’t understand why,"Why did this girl F(20) play me so badly? What did she even gain from this?


There was this girlF(20) I M(21) really liked and I done a lot  of things for her and she give good signals for asking for a relationship but in the end she done me so dirty 

Here’s the things we done and the signals 

1. I always check on her mental health because she opened about her depression to me and said I’m  only person she ever told this to and  even told me about her suicidal thoughts 

2. Always use to walk her home at night after studying together 

3. When she was broke I bought her food and never asked for the money back because her parents don’t give her money (it was only two times) 

4. She always comes to me and be like guy a said this about me you don’t think it’s true.  E.g a guy called her stupid once so she’s always looking for my reassurance 

5. I always involve her when she get left out because she’s shy 

6. She always downplays her self because of lack of confidence and I always uplift her 

7. She would say flirty stuff like I’m only the girl that can make you listen to juice wrld because what we have is special 

8. Then one time a Romantic song comes on and she whispers to me the lyrics could describe us in the future 

9. Always looking at me weirdly when I’m talking about girls 

10. We went to the beach together and took photos and everyone say we look like boyfriend and girlfriend in the photo


I was finally going to ask her out on a date I invited her on a walk and at the end I was going to ask her out on a date. 

She rejected my walk invite 

Went home and spoke to my friend on the phone and he said he just spoke to the girl on the phone and she told him there was this guy I use to like a lot romantically and I don’t like him anymore. She told him if you can guess the guy I will tell you if it’s right or wrong. He says my name and she straight away says no and puts up a wired face expression and then she’s like don’t get me wrong I like the guy but he’s so annoying at times and a overreactor I could never ever date him. 

I don’t understand why she lead me on just to trash my name. I’m actually really upset about this 

It’s not necessarily about the fact she wouldn’t date me it’s the way she completely throw my name under the bus she attacked my character as well after me always being there for her 

Then yesterday I say bye to my friend at the train Station as soon as I see this girl I leave the station I want nothing to do with her and then she sends a text saying we didn’t get to say hi to each other 😢. I just left her on open 

I know I have to move on her from her I’m just typing for closure I just want to know the answer why did she do all of this just to trash me and never have any dating interest in me. Right now it feels like I done a maths test and couldn’t do one of the questions and I’ve just gone home and I want to figure it out because of my curious nature.",dating,t5_2qhb1,https://www.reddit.com/r/dating/comments/poj3mv/this_girl_f20_played_me_so_badly_and_i_cant/
23,poj5fn,1631680538,Ways to get over someone and get them off of your mind?,"Almost 24/7 I have this girl on my mind and not only that but the images of her being so happy and madly in love with another guy. I had to watch that for a whole football game long and I can't get it off of my mind. I use it as fuel when I'm working out but other than that I hate it and I just want it erased from my mind. What makes it worse is I have to work with these people and watch them flirt even more. I just want to hopefully start police academy so I can leave this job. I keep trying to tell myself that she's just some other waitress now just like all of the other ones and that's it.. but its not working, she stays on my mind. I know what some of yall are going to say that I'm being pathetic and need to get over it and others are going to say to get a hobby. I have one it's hockey but it costs a lot of money plus I don't have a vehicle to get to the games. But any other methods will be greatly appreciated",dating,t5_2qhb1,https://www.reddit.com/r/dating/comments/poj5fn/ways_to_get_over_someone_and_get_them_off_of_your/
24,poj637,1631680612,I’m trying to stay calm with someone with undiagnosed ADHD *rant*,"I’ve been dating/talking to this guy off and on for 4 years. I honestly don’t know what the relationship is but we definitely have a connection. However, I CAN NOT get any meaningful conversation out of him via text, on the phone, or in person due to his short attention span. In person, he’s distracted by his multiple TVs, remembering what he has to do and doing it in that moment, or hearing his phone beep. Through text, he only like to focus on a topic that he wants to talk about and as soon as he’s not interested, he stops talking. We could be in the middle of a deep conversation in the afternoon and he’ll leave me hanging until the next morning saying “good morning baby”. I’ve asked him to stop ignoring the previous message but  he says it’s not ignoring, he’s just changing the subject since it’s a new day and thinks I’m off it. I told him, that wasn’t true and I still want my last texts acknowledged. He’s also distracted during phone conversations.  I try to let him go at his own pace when he expresses how he feels because if I try to pull it out, it fails. However, it’s only like he can say a few meaningful sentences at a time. I know he’s capable of communicating properly because he did it well during the first year of dating. Now it feels like I’m pulling teeth and something ALWAYS comes up.
He thinks the problem is him not responding on time. I keep explaining the problem is he keeps disregarding what I’m saying and changing the subject or just gets straight up distracted. He keeps saying he’s not doing it on purpose and I believe him TO AN EXTENT but it feels ridiculous to have it happen so often and him just using the excuse of being too busy. He can text me straight away when I complain about it but can’t hold the original conversation. I don’t get it.",dating,t5_2qhb1,https://www.reddit.com/r/dating/comments/poj637/im_trying_to_stay_calm_with_someone_with/
25,poja38,1631681090,Missed clues,I want to hear the times when you missed a clue or just straight out missed the person was flirting with you,dating,t5_2qhb1,https://www.reddit.com/r/dating/comments/poja38/missed_clues/
26,pojc2s,1631681331,Should I lower my standards?," I hate to sound like an ahole, but I am (28M) I been super focused on my career and my dating life have almost been non-existent like a broke college student's bank account. I'm super competitive almost to a perfectionist, making dating hard. I'm super picky with who I date because I want my next relationship to be marriage. (Might be weird for a guy to want marriage) The way I think about it is if I want to spend the rest of my life with her, then she has to be almost perfect for me. But lately, I been feeling lonely as my friends are getting married and in serious relationships, or moving away due to jobs. I feel like I will never find the one. Am I wrong to want this or should I lower my standards?",dating,t5_2qhb1,https://www.reddit.com/r/dating/comments/pojc2s/should_i_lower_my_standards/
27,pojct4,1631681423,Is everyone here making atleast 100k a year?,"
Because it seems like it lol. Apparently only 9% of men in the u.s make 100k a year yet it seems commonplace on reddit. Why is this? Is everyone here in coding or programming or something? Everyone software engineers? 

It isn't just the men either, it seems like most of women on reddit make the same.",dating,t5_2qhb1,https://www.reddit.com/r/dating/comments/pojct4/is_everyone_here_making_atleast_100k_a_year/
28,pojgbs,1631681876,A bit lost on this one,"Hey, I’m in a funny situation… she ended her relationship with a guy about a week and a half ago. I assumed she still needs time but when we talked she showed a huge amount of interest and even flirted with me more than I expected… yesterday I asked her if she wants to grab some coffee in the near future and she told me that she should be honest with me. 
“I don’t want a relationship, nor am I looking for one at the moment. I feel like I first need to find myself, because I think I got a little lost in those 2 years (that’s how long her previous relationship lasted).” Then came the all mighty: “You’re really such a sunshine, but I don’t want you to get hurt right now and give you false hope”. I hate that sentence 
I was honest with her and told her that I’m interested in her and that, well… I don’t want to miss a chance like this. I told her I understand this situation.

I’m aware of the situation and I know that I rushed this a little, but she kept flirting and replying back to my texts faster than ever. I believe that there is no problem that can not be fixed, but I can’t find the solution to my problem on my own amd would greatly appreciate it if you replied to me. I think my best bet right now is to simply keep contact with her and talk every now and then, but man… I’m scared that there’s just gonna be a guy that comes around just that one week when we didn’t text and boom… all of this for nothing. I usually never cared if something like this happened, but she is the most beautiful human being my eyes have ever seen and she has the personality I’ve always wish a girl would have. Thanks in advance. 

(P. S.) we’re talking now, trying to get on the same page",dating,t5_2qhb1,https://www.reddit.com/r/dating/comments/pojgbs/a_bit_lost_on_this_one/
29,pojovv,1631682933,Short guy mental problems. lowering standards results. Anyone relate?,"Hello, so im a really short guy at 5ft2 with a kinda messed up face. When I was young it didnt really bother me, but as I grew older it started to bother me cause of my limited options in dating.

What I did to get into relationships though was to start asking out the most attractive woman I could find and then slowly going down in attractiveness level as I got rejections. Eventually I started getting steady success but with women I wasnt attracted to at all.

Idk why but I decided to date one of these women but there was never a strong feeling of attraction which ended up dooming the relationship. I tried to give women a shot theough personality to see if attraction would grow but it didnt. I noticed that I was really monotone in all the relationships. Felt lile I was fighting my mind.

However something strange started happening to my mental state sonce that first relationship. I noticed that I started findinng different women attractive but not in the dreamy kinda of way when I was young but more of a grimy feeling.

I also noticed my mental state start to change. I start to feel giddy when bad  and violent things happen to people and ive been having sadistic and violent dreams.
I stopped dating for a long time but im still having violent dreams and I feel some euphoria in my dreams. Wth is wrong with me. What happened? My mental state is starting to concern me more than anything now.",dating,t5_2qhb1,https://www.reddit.com/r/dating/comments/pojovv/short_guy_mental_problems_lowering_standards/
30,pojptm,1631683052,In all honesty should I 25m just wait for a relationship to find me?,Im worn out i keep going on dating apps and snapchat and sometimes bars to initiate any sort of conversation friendship or anything but i feel im always either ghosted or given up on for someone else or ignored or 1 word responsed. Idk what to do anymore and idk if anyone is gonna give me advice thats gonna change anything cause im getting closer to 26 and no relationship and virgin still. Its like a total on and off thing too cause i feel like i want a relationship and the next hour or 2 i hear all the horror stories and oh this person got divorced or this person broke up with this person or this person is in an abusive relationship. Honestly just lost at this point and i barely have faith in humanity and barely can trust anyone anymore and these days everything is completey opposite of what it used to be back in 2000s or 1998 when i was way younger and people seemed more chill. Any advice or just wanna chat leave a comment or chat me.,dating,t5_2qhb1,https://www.reddit.com/r/dating/comments/pojptm/in_all_honesty_should_i_25m_just_wait_for_a/
31,pojqcf,1631683120,How do you not get bitter towards the opposite sex?,This question is for both men and women.  I sometimes start getting bitter at my dating failures.,dating,t5_2qhb1,https://www.reddit.com/r/dating/comments/pojqcf/how_do_you_not_get_bitter_towards_the_opposite_sex/
32,pojvql,1631683792,Where do I draw the line on what to feel and what to act on?,[removed],dating,t5_2qhb1,https://www.reddit.com/r/dating/comments/pojvql/where_do_i_draw_the_line_on_what_to_feel_and_what/
33,pojyxh,1631684187,Am I over her?,"Sorry if this is a long one. 

I’m a 19 year old male. When I was 17 I fell in love for the first time. Real love like in the movies. I met her on my first day working at the zoo near my house, and immediately we were both just completely infatuated by each other. We talked and became best friends pretty much all summer, but we were always very obviously flirty with each other. We’d go out to get ice cream almost every night. We’d never get any, just sit in the parking lot and talk for hours and hours. She was a few years older than me (20 to be exact), so she was hesitant about becoming anything more than friends, even though she obviously really wanted to. After months of us being flirty and touchy and staying up all night talking we finally kissed and began the “talking stage”, and a few months after that we started dating. We dated for almost a year, and we’re “together” for probably 14-15 months. We hung out almost every day. The only problem was that she was very controlling, but I never even noticed it because I was so incredibly obsessed with her as she was with me. During the time we were dating I dropped almost all of my friends, didn’t see any of them for months. She would freak out and cry any time I would go out with friends, especially if their were other girls there(literally like if it was a big group and a few girls were also there, or even if I was with a friend and his girlfriend). She basically didn’t allow me any friends,she would even be upset if a girl I knew texted me just to be like “hey in having a party and everyone’s coming”. But for a while I saw nothing wrong because I loved her so much. Eventually thst all caught up to us, and with me leaving for college lingering over us we ended up breaking up. But it wasn’t any regular breakup. She was so convinced I cheated on her or was trying to cheat on her with literally no reasoning, she didnt trust me at all. After almost a full year of dating, my first real girlfriend, and forsure my first love. While I was a work one day (this is the next summer so we worked at different places) she just sent me a paragraph about how I was a terrible person and I never loved her and all things like that, said we were over, and blocked me on everything. I mean everything: Snapchat, Facebook, Instagram, phone number, etc. I had no way to reach out. Literally none, she was a very introverted person, one of the reasons she would never meet my friends. So she had few friends, and the ones she did have weren’t very close, so I couldn’t reach out to them to get her to talk to me. Just like that, I never spoke to her again, I read that last hateful message after a year of falling in love, and I was never able to speak to her again. I took it very hard, understandably, but I felt “over it” after around 3 months. 
Well now it’s almost a year and a half after we broke up. 
I barely ever think about her, but every once in a while( a couple times a month) she pops into my head. I’ve had relationships with other girls, but they all went sour after a short period of time. It was never because I was thinking of her or anything like that. But any time I would start to like a girl, it would fizzle away fast, even once I had her, just a few days later I would want nothing to do with them. Not in a mean way, like I wish it didn’t happen but I just couldn’t see myself with them. I hated all PDA, even just small touches, I could barely even talk to them and I can’t figure out why. It’s happened multiple times. I’ve also just lost a lot of interest in relationships all together. I still feel a sex drive in myself, but it passes quick and then I don’t even think about anything like that. I don’t understand what is going on with me. 

It’s been almost a year and a half. I don’t think about her often at all. Could this be a closure thing? Should I try and reach out to her for closure? And if I should what should I even say?",dating,t5_2qhb1,https://www.reddit.com/r/dating/comments/pojyxh/am_i_over_her/
34,pok069,1631684351,Did The Club Scene… but still,[removed],dating,t5_2qhb1,https://www.reddit.com/r/dating/comments/pok069/did_the_club_scene_but_still/
35,pok4ep,1631684903,"""NO I'm 100% single""","(21M)I've been infatuated with this girl I only know through social media and I asked her if she was single and she said yes , I'm having trouble on what to say without sounding creepy, any suggestions 🤔",dating,t5_2qhb1,https://www.reddit.com/r/dating/comments/pok4ep/no_im_100_single/
36,pok4f3,1631684905,How can I start dating again? (I'm antisocial},[removed],dating,t5_2qhb1,https://www.reddit.com/r/dating/comments/pok4f3/how_can_i_start_dating_again_im_antisocial/
37,pok9qz,1631685612,How to date when you don't drink alcohol or coffee?,"I like to do things like visit national parks, go to the beach, or do anything fun outdoors. I don't really to bars or drink alcohol. Overall, I honestly don't know how to date. I'm 29 and only have been in one relationship that lasted 11 years. I never got a chance to date in my life. I have 25+ matches on Tinder but I always talk to them until the conversation dies out because I just don't know how to proceed past the texting stage. Any advice?",dating,t5_2qhb1,https://www.reddit.com/r/dating/comments/pok9qz/how_to_date_when_you_dont_drink_alcohol_or_coffee/
38,pokfde,1631686313,Do people in relationships emit a certain energy that makes them more attractive?,"Im going to keep this short. I met a girl last weekend and we had a lot in common and she was totally my type physically and mentally and everything. After talking to her a few guys came to me to compliment how I was dresses. I then asked them to wingman me for this girl but they told me she had a boyfriend. Id say, seems like the past 10 girls I asked out are all taken. This is probably the story of my life. What is up with this?",dating,t5_2qhb1,https://www.reddit.com/r/dating/comments/pokfde/do_people_in_relationships_emit_a_certain_energy/
39,pokjk3,1631686860,site where ppl rate who is better looking,"me and my friend r arguing who is better looking,and we need a site where we can post both of our pictures and ppl to vote who is better looking

does any1 know about such site ?",dating,t5_2qhb1,https://www.reddit.com/r/dating/comments/pokjk3/site_where_ppl_rate_who_is_better_looking/
40,pokktr,1631687032,Looking for intimacy but not interested in anyone,"(22F) I feel icky if I sleep with a man before we have an established connection, but lately I’m horny all the time and it’s rare for me for feel this way. I haven’t gone out with anyone  Recently that I like find attractive enough to want to sleep with them and the person I did like stopped showing interest. I’m tired of feeling this way (can’t solve it on my own) but I don’t think there’s anything I can do? Do you have any advice?",dating,t5_2qhb1,https://www.reddit.com/r/dating/comments/pokktr/looking_for_intimacy_but_not_interested_in_anyone/
41,pokrrl,1631687994,Hello everyone! I'm so sexy and I want to date anyone.If you want add me now.,[removed],dating,t5_2qhb1,https://www.reddit.com/r/dating/comments/pokrrl/hello_everyone_im_so_sexy_and_i_want_to_date/
42,pol558,1631689724,Will losing weight make me more attractive ( look at my profile to see picture),"I am 5'8 and weight 296 pounds...how many pounds of weight should I lose to be considered buff, not fat or muscular type.

Will losing weight make my face more attractive or body more attractive to the opposite sex?",dating,t5_2qhb1,https://www.reddit.com/r/dating/comments/pol558/will_losing_weight_make_me_more_attractive_look/
