,all_awardings,allow_live_comments,author,author_flair_css_class,author_flair_richtext,author_flair_text,author_flair_type,author_fullname,author_patreon_flair,author_premium,awarders,can_mod_post,contest_mode,created_utc,domain,full_link,gildings,id,is_crosspostable,is_meta,is_original_content,is_reddit_media_domain,is_robot_indexable,is_self,is_video,link_flair_background_color,link_flair_css_class,link_flair_richtext,link_flair_template_id,link_flair_text,link_flair_text_color,link_flair_type,locked,media_only,no_follow,num_comments,num_crossposts,over_18,parent_whitelist_status,permalink,pinned,pwls,removed_by_category,retrieved_on,score,selftext,send_replies,spoiler,stickied,subreddit,subreddit_id,subreddit_subscribers,subreddit_type,thumbnail,title,total_awards_received,treatment_tags,upvote_ratio,url,whitelist_status,wls,post_hint,preview
48,[],False,limonkas,,[],,text,t2_8foj23ob,False,False,[],False,False,1620850834,self.dating,https://www.reddit.com/r/dating/comments/nayd8j/guys_who_pay_for_girls_on_dates_why_do_you_do_it/,{},nayd8j,True,False,False,False,True,True,False,,dating,"[{'e': 'text', 't': 'Question'}]",a9531dce-194e-11e5-b177-0eff099c3d1f,Question,dark,richtext,False,False,True,148,0,False,all_ads,/r/dating/comments/nayd8j/guys_who_pay_for_girls_on_dates_why_do_you_do_it/,False,6,,1620850845,1,"Background: I am a student and went on 4 dates with a guy who makes quite a bit of money.
I usually pay for myself because I just don’t like the concept of money integration in a relationship, especially in the beginning when I haven’t decided if I like the guy.

So, the thing is, he ALWAYS wanted to pay for me. Every time I said that I would handle it he refused and insisted on paying saying that he just wants to make me feel good.

And after those dates I discovered some qualities that made us incompatible. I met him for the last time saying that it wouldn’t work out.  And he said “you know, when a guy pays for a girl, he is expecting something in return”

It was so offending! I was shocked that he viewed me as someone who would sleep with a guy because he bought me a burger😖😖

And this only reinforced my belief of paying for myself in the beginning

Guys who still pay for girls on dates, why do you do it? Does it have something to do with your expectations? Or is it of pure chivalry?",True,False,False,dating,t5_2qhb1,770315,public,self,"Guys who pay for girls on dates, why do you do it?",0,[],1.0,https://www.reddit.com/r/dating/comments/nayd8j/guys_who_pay_for_girls_on_dates_why_do_you_do_it/,all_ads,6,,
49,[],False,Item_Simple,,[],,text,t2_bml3ug0o,False,True,[],False,False,1620850953,self.dating,https://www.reddit.com/r/dating/comments/nayex2/are_there_any_short_women_that_like_short_men/,{},nayex2,True,False,False,False,True,True,False,,dating,"[{'e': 'text', 't': 'Question'}]",a9531dce-194e-11e5-b177-0eff099c3d1f,Question,dark,richtext,False,False,True,24,0,False,all_ads,/r/dating/comments/nayex2/are_there_any_short_women_that_like_short_men/,False,6,,1620850964,1,"I feel as though most short women are strict about height, but are there ones that like short men?",True,False,False,dating,t5_2qhb1,770316,public,self,Are there any short women that like short men?,0,[],1.0,https://www.reddit.com/r/dating/comments/nayex2/are_there_any_short_women_that_like_short_men/,all_ads,6,,
50,[],False,risha2019,,[],,text,t2_56jpxr9b,False,False,[],False,False,1620851394,self.dating,https://www.reddit.com/r/dating/comments/naykwl/is_it_ok_to_park_a_relationship_for_now/,{},naykwl,True,False,False,False,True,True,False,,dating,"[{'e': 'text', 't': 'I Need Advice'}]",19ec58c2-9f74-11e7-81a1-0e2bf15991f0,I Need Advice,dark,richtext,False,False,True,17,0,False,all_ads,/r/dating/comments/naykwl/is_it_ok_to_park_a_relationship_for_now/,False,6,,1620851405,1,"Been seeing a guy for about 2 months now, the first month was super lovely and we chatted constantly and went on a few dates but now life has just gotten in the way for both of us. He’s super busy working 2 jobs and I’m struggling to juggle life with a new job and my mental health. Plus we live an hour and a half away from each other. 

Is it ok to just talk to him and say that we should just leave things for now and revisit this in 6 months when I have a better handle on my life and he has some down time. I mean just stay friends in the meantime so there’s not pressure or expectations for dating. 

He’s so wonderful and probably the most caring guy I’ve ever dated so I don’t really want to throw in the towel completely and be done with him! Btw, we’re both 27.",True,False,False,dating,t5_2qhb1,770323,public,self,Is it ok to park a relationship for now?,0,[],1.0,https://www.reddit.com/r/dating/comments/naykwl/is_it_ok_to_park_a_relationship_for_now/,all_ads,6,,
51,[],False,Emergency-Delivery51,,[],,text,t2_8lwtepte,False,False,[],False,False,1620851738,self.dating,https://www.reddit.com/r/dating/comments/naypr2/honry_and_wetwant_to_be_fucked_hard/,{},naypr2,False,False,False,False,False,True,False,,dating,"[{'e': 'text', 't': 'Other'}]",fd9c03b8-a1ce-11e7-9172-0e8c9f9ecf4c,Other,dark,richtext,False,False,True,2,0,False,all_ads,/r/dating/comments/naypr2/honry_and_wetwant_to_be_fucked_hard/,False,6,moderator,1620851749,1,[removed],True,False,False,dating,t5_2qhb1,770331,public,self,"Honry and wet,want to be fucked hard",0,[],1.0,https://www.reddit.com/r/dating/comments/naypr2/honry_and_wetwant_to_be_fucked_hard/,all_ads,6,,
52,[],False,Electrical-One-4231,,[],,text,t2_c3gsys2s,False,False,[],False,False,1620851806,self.dating,https://www.reddit.com/r/dating/comments/nayqme/advice/,{},nayqme,False,False,False,False,False,True,False,,dating,"[{'e': 'text', 't': 'I Need Advice'}]",19ec58c2-9f74-11e7-81a1-0e2bf15991f0,I Need Advice,dark,richtext,False,False,True,0,0,False,all_ads,/r/dating/comments/nayqme/advice/,False,6,moderator,1620851817,1,[removed],True,False,False,dating,t5_2qhb1,770334,public,self,advice?,0,[],1.0,https://www.reddit.com/r/dating/comments/nayqme/advice/,all_ads,6,,
53,[],False,chess300,,[],,text,t2_c3f5b49b,False,False,[],False,False,1620851968,self.dating,https://www.reddit.com/r/dating/comments/nayss0/what_am_i_supposed_to_do_now/,{},nayss0,False,False,False,False,False,True,False,,dating,"[{'e': 'text', 't': 'I Need Advice'}]",19ec58c2-9f74-11e7-81a1-0e2bf15991f0,I Need Advice,dark,richtext,False,False,True,6,0,False,all_ads,/r/dating/comments/nayss0/what_am_i_supposed_to_do_now/,False,6,moderator,1620851979,1,[removed],True,False,False,dating,t5_2qhb1,770337,public,self,what am i supposed to do now,0,[],1.0,https://www.reddit.com/r/dating/comments/nayss0/what_am_i_supposed_to_do_now/,all_ads,6,,
54,[],False,TyGustavGans,,[],,text,t2_zdfae,False,False,[],False,False,1620852490,self.dating,https://www.reddit.com/r/dating/comments/naz03z/could_this_work/,{},naz03z,True,False,False,False,True,True,False,,dating,"[{'e': 'text', 't': 'I Need Advice'}]",19ec58c2-9f74-11e7-81a1-0e2bf15991f0,I Need Advice,dark,richtext,False,False,False,3,0,False,all_ads,/r/dating/comments/naz03z/could_this_work/,False,6,,1620852502,1,"So I've been seeing this girl for about a month 1/2 now, we talked about starting a relationship but both realized, our feelings for each other are not quite ""there"" yet. I don't know if we should keep trying or stop it all together, I don't wanna loose her, but I just don't know what to do, anyone got advice?

tl;dr: Been seing a girl, we are both not ready for a relationship, should we keep dating or stop",True,False,False,dating,t5_2qhb1,770352,public,self,Could this work?,0,[],1.0,https://www.reddit.com/r/dating/comments/naz03z/could_this_work/,all_ads,6,,
55,[],False,Delmitus1,,[],,text,t2_302klg20,False,False,[],False,False,1620852552,self.dating,https://www.reddit.com/r/dating/comments/naz0x6/ladies_is_it_attractive_for_men_to_look_deeply/,{},naz0x6,True,False,False,False,True,True,False,,dating,"[{'e': 'text', 't': 'Question'}]",a9531dce-194e-11e5-b177-0eff099c3d1f,Question,dark,richtext,False,False,False,73,0,False,all_ads,/r/dating/comments/naz0x6/ladies_is_it_attractive_for_men_to_look_deeply/,False,6,,1620852564,1,I do this to sometimes to someone I’ve been seeing for a little while and I’ve noticed a smile creeps up on her consistently while she’s talking. Whenever I don’t she can keep a straight face like Batman. I’m just wondering if I’m reading too much into it.,True,False,False,dating,t5_2qhb1,770354,public,self,"Ladies, is it attractive for men to look deeply into your eyes while you talk to them?",0,[],1.0,https://www.reddit.com/r/dating/comments/naz0x6/ladies_is_it_attractive_for_men_to_look_deeply/,all_ads,6,,
56,[],False,Think_Cheesecake6448,,[],,text,t2_9esk12zx,False,False,[],False,False,1620852647,self.dating,https://www.reddit.com/r/dating/comments/naz25t/why_do_people_led_you_on_and_act_like_they_care/,{},naz25t,True,False,False,False,True,True,False,,dating,"[{'e': 'text', 't': 'Venting'}]",a616c322-194e-11e5-ab91-0ed1c06bdad7,Venting,dark,richtext,False,False,True,17,0,False,all_ads,/r/dating/comments/naz25t/why_do_people_led_you_on_and_act_like_they_care/,False,6,,1620852658,1,"I (23f) started hooking up with this guy (28m) in December of 2020, we met on tinder, talked for maybe two weeks before meeting up the first time. He invited me over to “hangout” at his place so I knew what he was looking for by that, and it was completely fine with me. I went over, we watched a movie and hooked up, I didn’t spend the night or cuddle a lot with him. kinda just chill for a little and then went home. I tend to not be too affectionate with people I’m casual with to “protect” myself and I normally don’t have an issue with it. Fast forward 4 months later I got comfortable and wanted to be affectionate with him, I spent almost every weekend with him, we would cook, watch movies, have sex, cuddle, get to know each other on a deeper level. We both opened up about our childhood, past traumas and etc. This man seemed like he genuinely cared about me and wanted me, he made me feel so comfortable and vulnerable with him, in the best way possible. I was using dating apps a lot less, stop seeing other people because I realized I really wanted to only see him. I was getting to the point of telling him how I felt but he started getting dry when I reached out and then *poof* ghosted. Why  do this? I was so cool with just keeping it casual but I genuinely thought he wanted to get to know me, he liked me, and possibly wanted more.",True,False,False,dating,t5_2qhb1,770358,public,self,"Why do people led you on, and act like they care and then ghost you?",0,[],1.0,https://www.reddit.com/r/dating/comments/naz25t/why_do_people_led_you_on_and_act_like_they_care/,all_ads,6,,
57,[],False,SeaweedOdd1330,,[],,text,t2_bsotq5nd,False,False,[],False,False,1620852820,self.dating,https://www.reddit.com/r/dating/comments/naz4j5/need_some_advice_on_this/,{},naz4j5,True,False,False,False,True,True,False,,dating,"[{'e': 'text', 't': 'I Need Advice'}]",19ec58c2-9f74-11e7-81a1-0e2bf15991f0,I Need Advice,dark,richtext,False,False,True,16,0,False,all_ads,/r/dating/comments/naz4j5/need_some_advice_on_this/,False,6,,1620852831,1,I’ve been seeing this girl from the last 8 months. I took it slow at the start because I was still a little cautious after my last relationship ended badly. We made it official after 2 months of dating. We used to talk/text the whole day everyday and something just felt off from the last 3 weeks. She cancelled 3 times at the last minute. I called her once and she was crying saying she feels depressed and feels like her life is worthless. I know she’s hurt herself in the past and it just makes me really anxious not know how she’s been the last week. I gave her some space and we casually texted in between but we didn’t talk the last 2 days and she starts up the conversation asking how my day has been and we talked for sometime. We planned on meeting yesterday but she cancelled again saying she has to spend time with her family and proposed that we can meet on early morning Sunday. I feel like she’s gonna cancel again as she’s been doing it from the last 3 weeks. I’ve been trying to be supportive and ask her how she’s been but I don’t even know what’s going on with us and it’s been making me anxious.,True,False,False,dating,t5_2qhb1,770364,public,self,Need some advice on this.,0,[],1.0,https://www.reddit.com/r/dating/comments/naz4j5/need_some_advice_on_this/,all_ads,6,,
58,[],False,zarumar,,[],,text,t2_5kqg7jr3,False,False,[],False,False,1620852919,self.dating,https://www.reddit.com/r/dating/comments/naz5xt/can_sex_turn_into_emotional_connectiontrue/,{},naz5xt,False,False,False,False,False,True,False,,dating,"[{'e': 'text', 't': 'I Need Advice'}]",19ec58c2-9f74-11e7-81a1-0e2bf15991f0,I Need Advice,dark,richtext,False,False,True,0,0,False,all_ads,/r/dating/comments/naz5xt/can_sex_turn_into_emotional_connectiontrue/,False,6,moderator,1620852930,1,[removed],True,False,False,dating,t5_2qhb1,770365,public,self,Can sex turn into emotional connection/true intimacy?,0,[],1.0,https://www.reddit.com/r/dating/comments/naz5xt/can_sex_turn_into_emotional_connectiontrue/,all_ads,6,,
59,[],False,whatworldisthis2020,,[],,text,t2_1yd4nu5w,False,False,[],False,False,1620853102,self.dating,https://www.reddit.com/r/dating/comments/naz8en/whats_happening_here/,{},naz8en,True,False,False,False,True,True,False,,dating,"[{'e': 'text', 't': 'I Need Advice'}]",19ec58c2-9f74-11e7-81a1-0e2bf15991f0,I Need Advice,dark,richtext,False,False,False,16,0,False,all_ads,/r/dating/comments/naz8en/whats_happening_here/,False,6,,1620853113,1,"Have you ever talked to someone in the beginning you are interested in a romantic way and as times goes by. You are the other person may lose interest. You still text and hangout occasionally. 

For example, we text and used to be super flirty and such, but last hangout it was pretty dull. Like I think they are less engaging but still responds and initiate 

Does this person just like my company as a friend only? Should I just pull the plug and just associate in a friendly manner too",True,False,False,dating,t5_2qhb1,770370,public,self,What’s happening here,0,[],1.0,https://www.reddit.com/r/dating/comments/naz8en/whats_happening_here/,all_ads,6,,
60,[],False,thehappinesselixir,,[],,text,t2_3ulfm5sk,False,False,[],False,False,1620853741,self.dating,https://www.reddit.com/r/dating/comments/nazhb7/am_i_reading_too_much_into_her_texts/,{},nazhb7,True,False,False,False,True,True,False,,dating,"[{'e': 'text', 't': 'Question'}]",a9531dce-194e-11e5-b177-0eff099c3d1f,Question,dark,richtext,False,False,True,14,0,False,all_ads,/r/dating/comments/nazhb7/am_i_reading_too_much_into_her_texts/,False,6,,1620853753,1,"So I’m 22M met this 21F from uni from one of the school clubs, initially we hit it off really well and were texting a lot from early Feb till mid March, sometimes even through the night till about 4am. Could really tell we really clicked with similar interests and backgrounds/ upbringings. But the messages kind of died down as mid semester tests and end semester finals came around, and during finals it was sometimes just 1-2 texts per week. Being an introvert, I was kind of hurt and thought she was losing interest with such a drastic change in texting habits. 

She’s in com science and I’m a double major so we have really packed academic schedules and since I don’t stay in hostel, I’ve only had 1-2 study dates during the school term with her. Since exams ended, I did ask her out for dinner initially but she rescheduled for lunch and we had a great time a few days back, talked for three hours with almost no silence and she initiated walking about the area + dessert enthusiastically. Mustered a bit of courage at the end to ask if she wanted to go out next week and she said sure, and to arrange a time since both our internships are starting. From what I know from talking with her, I don’t think she’s the type to lead people on (she’s never had a bf before), but I’m just a little confused why the texts have become more sporadic. Should I broach the subject with her on the next date or just let it slide? Or are texts a non-indicator of interest at all because she always agrees to go out just that lengthier convos in text have kind of died since school started getting more hectic? Her actions face to face always seem to show a lot of interest (comparing our first study date with lunch days ago) -eg. Some light touches and she’s always asking me to try/finish her food, offering her drink to me first",True,False,False,dating,t5_2qhb1,770383,public,self,Am I reading too much into her texts?,0,[],1.0,https://www.reddit.com/r/dating/comments/nazhb7/am_i_reading_too_much_into_her_texts/,all_ads,6,,
61,[],False,WestonGirl888,,[],,text,t2_72jf7mng,False,False,[],False,False,1620855006,self.dating,https://www.reddit.com/r/dating/comments/nazz5h/female_dating_online_40sexperience_and_input_from/,{},nazz5h,False,False,False,False,False,True,False,,,"[{'e': 'text', 't': 'Tinder/Online Dating'}]",5214d2ac-61f1-11e8-8bb1-0ed15e4a39c0,Tinder/Online Dating,dark,richtext,False,False,True,0,0,False,all_ads,/r/dating/comments/nazz5h/female_dating_online_40sexperience_and_input_from/,False,6,moderator,1620855018,1,[removed],True,False,False,dating,t5_2qhb1,770417,public,self,Female dating online 40s-experience and input from men,0,[],1.0,https://www.reddit.com/r/dating/comments/nazz5h/female_dating_online_40sexperience_and_input_from/,all_ads,6,,
62,[],False,GetGreenGetBaked,,[],,text,t2_12rabs,False,False,[],False,False,1620855203,self.dating,https://www.reddit.com/r/dating/comments/nb01zj/passionate_love_assurance/,{},nb01zj,True,False,False,False,True,True,False,,,"[{'e': 'text', 't': 'Tinder/Online Dating'}]",5214d2ac-61f1-11e8-8bb1-0ed15e4a39c0,Tinder/Online Dating,dark,richtext,False,False,True,7,0,False,all_ads,/r/dating/comments/nb01zj/passionate_love_assurance/,False,6,,1620855214,1,"Has anyone ever heard of this site? This chick I'm messaged on insta via her Feeld profile is asking to meet through there, so I'm just looking for some confirmation, to see if it's legit or a scam.",True,False,False,dating,t5_2qhb1,770420,public,self,Passionate Love Assurance,0,[],1.0,https://www.reddit.com/r/dating/comments/nb01zj/passionate_love_assurance/,all_ads,6,,
63,[],False,Kris-french,,[],,text,t2_c3hpgk85,False,False,[],False,False,1620855281,self.dating,https://www.reddit.com/r/dating/comments/nb033i/i_miss_women_over_50_in_malta/,{},nb033i,False,False,False,False,False,True,False,,,"[{'e': 'text', 't': 'Tinder/Online Dating'}]",5214d2ac-61f1-11e8-8bb1-0ed15e4a39c0,Tinder/Online Dating,dark,richtext,False,False,True,0,0,False,all_ads,/r/dating/comments/nb033i/i_miss_women_over_50_in_malta/,False,6,moderator,1620855293,1,[removed],True,False,False,dating,t5_2qhb1,770424,public,self,I miss women over 50 in Malta.,0,[],1.0,https://www.reddit.com/r/dating/comments/nb033i/i_miss_women_over_50_in_malta/,all_ads,6,,
64,[],False,startchat,,[],,text,t2_c3i3crov,False,False,[],False,False,1620856041,self.dating,https://www.reddit.com/r/dating/comments/nb0dap/startchat_is_similar_to_omegle_and_azar_but_with/,{},nb0dap,False,False,False,False,False,True,False,,,"[{'e': 'text', 't': 'Tinder/Online Dating'}]",5214d2ac-61f1-11e8-8bb1-0ed15e4a39c0,Tinder/Online Dating,dark,richtext,False,False,True,0,0,False,all_ads,/r/dating/comments/nb0dap/startchat_is_similar_to_omegle_and_azar_but_with/,False,6,moderator,1620856052,1,[removed],True,False,False,dating,t5_2qhb1,770437,public,self,StartChat is similar to Omegle and Azar but with a good algorithm.,0,[],1.0,https://www.reddit.com/r/dating/comments/nb0dap/startchat_is_similar_to_omegle_and_azar_but_with/,all_ads,6,,
65,[],False,SeulementPourToi,,[],,text,t2_77pm5zbg,False,False,[],False,False,1620856364,self.dating,https://www.reddit.com/r/dating/comments/nb0hjo/i_emotionally_cheated_on_the_most_amazing_woman/,{},nb0hjo,True,False,False,False,True,True,False,,dating,"[{'e': 'text', 't': 'I Need Advice'}]",19ec58c2-9f74-11e7-81a1-0e2bf15991f0,I Need Advice,dark,richtext,False,False,True,7,0,False,all_ads,/r/dating/comments/nb0hjo/i_emotionally_cheated_on_the_most_amazing_woman/,False,6,,1620856375,1,"So there is a lot to unpack here, I'm not sure where to start...

For relationships, one of the worst things that can damage or even destroy them is self doubt, and that might be the catalyst for the end of the relationship between I and and the most amazing woman I have met.
I have only met not even a handful of women throughout my 32 years, that I have felt a true connection with. 

I met my current partner through a dating app and has been going amazingly well, so amazing that I couldn't believe that there were no issues, until I started thinking about how this person couldn't be accepting of me. I showed my vulnerable ,anxious, shy side and she kept on telling me it's ok, that we can take as long as I want to go through the process of getting to know one another. Again the self doubt creeping in and saying""theres got to be something that isn't right"".

She has kissed,hugged and shown me love that I wouldn't have thought was possible. She has an amazing smile and a face I love to see whenever I get to hang out with her. She's very sexy, appearance, voice and her confidence. I love the way she carries herself. She's also a very optimistic person and happy and outgoing person and I love that.

This is me: Happy but have anxiety. I love to laugh and am outgoing but think too much about what to say and what I am doing. This id where my self doubt comes in- I WAS a 32 year old virgin with barely any experience in dating...and I had never kissed a woman before. 

So what I did is I started to doubt, even after we agreed to be exclusive, that things would go smooth. I also thought to myself,after someone texted me on tinder right before I was going to delete it, to just make sure I am ready to be committed. I'm not justifying this, I'm just expressing my thought process. I thought I would just text one girl and see if she could distract me. I texted her for 4 or 5 days and ended it, after seeing that I was only seeing her as a friend and nothing more.I didn't wish to meet up or see anyone, every time I saw my partner, I would forget about the girl from tinder. I realized that and stopped texting the tinder girl.

And that's another thing is that whenever I thought of my partner I would think of her as a woman, an adult, not a girl, not someone that seems like she needs to grow up. Looks like I have some growing up too.

What happened is that my partner saw my phone two times with the tinder notification on it. She confronted me and I told her about why it was still on my phone, I don't blame her for not believing me. It seems like she may believe me that I have not even met up with another woman, I would not do that unless things ended between us. 

My question is that how can this be fixed, is there anyone with experience with this same situation(emotional cheating) and how do you show that the person you cheated on,that you still truly love them and want to show comitment?

This has given me so much anxiety, that I can barely function and is definitely my biggest fuck up of my life. This just happened last night, so its hard to even function right now. It took 5 hours for me to start my day. I would be so happy if this worked, I would do anything to show her how much I care and wouldn't think about hurting her.",True,False,False,dating,t5_2qhb1,770443,public,self,I emotionally cheated on the most amazing woman,0,[],1.0,https://www.reddit.com/r/dating/comments/nb0hjo/i_emotionally_cheated_on_the_most_amazing_woman/,all_ads,6,,
