,id,created_utc,title,selftext,subreddit,subreddit_id,url
56,pdcnvd,1630167160,How do I text past the original response?,"I (M18) spent most my teenage years quite socially confined by choice (social anxiety mixed with a general disinterest in meeting new people) so I’m not really that good at texting girls or sliding into their DMs.

I’ve finally gotten my head around the sort of thing to say to get an actual reply rather than aired (basically just be confident and don’t just say “hey”) but don’t really know where to go from getting that original reply and lead it into a conversation they’ll be interested in.

I don’t use dating apps at the moment, I’m not quite there yet, so the sort of “ask them about their interests” doesn’t really apply because they don’t often post what they are. 

Anyway, I’m just not too sure where to go from after they’ve replied. Stuff like “so where you from” isn’t an interesting starter.

Any help is appreciated.",dating,t5_2qhb1,https://www.reddit.com/r/dating/comments/pdcnvd/how_do_i_text_past_the_original_response/
57,pdcpid,1630167309,Adddd me,[removed],dating,t5_2qhb1,https://www.reddit.com/r/dating/comments/pdcpid/adddd_me/
58,pdcqij,1630167397,Ready to date mature women and so far I'm getting poor advice. I am a young professional and want to be able to have at least some women to date...,"I am working on my wardrobe and hair. I also noticed women do like cologne and a clean car/home 😂 

What are some tips to open a conversation up?

Should I compliment her then begin to talk or do I ...
Wait for an open sign for her to come up to her?",dating,t5_2qhb1,https://www.reddit.com/r/dating/comments/pdcqij/ready_to_date_mature_women_and_so_far_im_getting/
59,pdcr0e,1630167443,Why do people not want to solidify a relationship even when they’re very compatible?,"The intention is not to come off as complaining but just out of curiosity! I[F 18] started talking to this guy [M 19] about a month ago and we get along really well, lots of things in common, identical sense of humor.  We went on on a walk about 2 weeks ago (we’re in Australia so the lockdown is still on) and it was definitely the same in person. However, I’m seeing that he may be slowly losing interest, and I wonder if there is anything in general that would just cause somebody to lose interest even though you’re compatible. The only thing that I can think of is that he seemed put off by the fact that I don’t smoke weed , but Ive made it clear that I don’t care if he smokes or not, cause I usually hang out with people that get stoned a lot. In my head it doesn’t seem like that big of a deal to stop being pursued , so I’m wondering if that’s not the case, or if there is anything else I am not aware of. Any help welcome!",dating,t5_2qhb1,https://www.reddit.com/r/dating/comments/pdcr0e/why_do_people_not_want_to_solidify_a_relationship/
60,pdcsdj,1630167563,"Date is very pushy, I have to keep the relationship at bay",[removed],dating,t5_2qhb1,https://www.reddit.com/r/dating/comments/pdcsdj/date_is_very_pushy_i_have_to_keep_the/
61,pdctzo,1630167707,The last 5 dates flaked/canceled on me. Most recent girl said she wanted to get to know me better before going out... is this an actual thing?,"So the last 5 dates I had they were canceled last minute or just flat-out flaked on. I usually chat with them a bit but try to secure a date in person we I can get to know them more in person. I don't wait long to try to get a date and it seems things are alright until they just cancel on me and never get back to me. Is this just common in the dating scene now or do I need to get to know them before a date...which confuses me because I thought the entire point of dates was to get to know each other..  


If it helps, I met most of these women on dating apps but two of them I met in person.",dating,t5_2qhb1,https://www.reddit.com/r/dating/comments/pdctzo/the_last_5_dates_flakedcanceled_on_me_most_recent/
62,pdcvg5,1630167841,How do I know if my friend is attracted to me,"This one I’m mainly looking for advice from women. I’m a m (23) and I have a friend that I’ve known for a long time but see fairly irregularly due to her genuinely busy schedule. Everytime we hang out and watch a show at my place she always cuddles up to me. I love her dearly as a friend and am more than happy just to leave it but I’m very attracted to her and I can’t tell if she cuddles up just because she just needs a bit of affection for a friend or if she’s testing the waters for the more physical side of things. So women of reddit, would you cuddle up to a friend that you don’t feel any attraction towards?",dating,t5_2qhb1,https://www.reddit.com/r/dating/comments/pdcvg5/how_do_i_know_if_my_friend_is_attracted_to_me/
63,pdd1uz,1630168414,Relationship advice book recommendations?,"I'm trying to read more/listen to audiobooks more, and I thought relationship advice books would be a good way to start. There's so many though, and it's difficult to tell which are good and which aren't worth the time to read. Do people here have suggestions on books they've found useful or that do a good job of tying in research and giving advice based on it? Thanks!",dating,t5_2qhb1,https://www.reddit.com/r/dating/comments/pdd1uz/relationship_advice_book_recommendations/
64,pdd2me,1630168483,Sending flowers (address found through internet) – cool or creepy?,"So I'm above 40 years old and in a new long distance romance that has yet to be consummated.   But, she is coming to see me in 4 weeks time, which is great!   

I would love to send her some flowers, and I'm sure she would enjoy the flowers and the gesture.  The only issue I have is she never gave me her address.  I found it quite easily online, but I think maybe that will feel creepy, but I do love the surprise nature of sending a gift.

A few other notes.  I know generally where she lives (she's from my hometown) and have seen her apartment on video chat, etc.  It's not as if she has been hesitant to share with me.   But as someone who is quite adept at using the internet I realize that often people don't understand how easy addresses can be found and it comes off as if I invested time &amp; energy to find out this seemingly private info.

So, women of reddit – would flowers arriving at your home from someone you like, and are going to visit, creep you out if you knew you'd never given them your address?",dating,t5_2qhb1,https://www.reddit.com/r/dating/comments/pdd2me/sending_flowers_address_found_through_internet/
65,pdd93x,1630169060,"Is this normal or love bombing, did I miss out?",[removed],dating,t5_2qhb1,https://www.reddit.com/r/dating/comments/pdd93x/is_this_normal_or_love_bombing_did_i_miss_out/
66,pddezv,1630169599,I can't tell if I'm boring or if the people I talk to are boring,"I think I'm a pretty decent guy. I'm not good looking, but I can have a conversation, I'm somewhat confident, I dress nice, I have a good job, etc. I have hobbies and, modesty aside, I'm a smart guy with a quick wit

At least, that's what I think. Because what I've noticed in sooo many conversations online is that girls will barely respond to me with anything more than 3 or 4 words. Sometimes these girls are just not interested at all but this happens with Tinder matches and girls who start conversations with me

I mean I always make an effort to send longer messages and ask questions and all I get are short, dry answers and stuff like ""ahahahahah yeah"" which leaves me with nothing to say

And the other thing is, I don't feel like this happens to other friends of mine. They manage to have conversations with these women (honestly, from the little I've seen, these don't seem that interesting either, but at least they're answering properly)

I'm starting to think I might be the boring one but I don't really know how to fix that",dating,t5_2qhb1,https://www.reddit.com/r/dating/comments/pddezv/i_cant_tell_if_im_boring_or_if_the_people_i_talk/
67,pddgym,1630169781,Cheating.,How can you stand a partner that is constantly cheating behind your back and Also stupid enough to think you did not know. #TiredAF,dating,t5_2qhb1,https://www.reddit.com/r/dating/comments/pddgym/cheating/
68,pddke3,1630170088,What is going on?,"         So i[18m] recently got out of a bad break up with a long term girlfriend of 2 years, to say the least it wasn't that messy but left me feeling a little stung, betrayed, and worth less than before for how things closed off. Like any other man who is trying to get over self confidence issues I tried to cover them up with women and I download tinder INSTANTLY buy tinder plus (cuz I know how these apps work) and started swiping away. I get a few matches text back and forth you know the whole tinder 1 word to a question thing until I find a girl [18f] (not gonna use her real name) Alice, me and Alice instantly hit it off from the second we started chatting I really enjoyed talking to her. We had been talking for 2 days at this point about really down to earth shit getting to know each other, and had even scheduled a date (which i dont know if i was being too forward for this i am extremely new to dating again). The pictures she had posted on her tinder were really weird lighting and either making weird faces, so I asked her for her Instagram and she gave it over. BUT again i couldnt find pictures of her face and we had already switched over to normal texting at this point so I ask her if she can just take a picture of her face in normal lighting. She sends over a picture of the side of her face and again I ask her to just send a picture of her face, at this point I realized that she did have normal pictures on her Instagram they were just a couple scrolls down.
         Then this story takes a really weird turn she tells me that she's getting a new phone tomorrow and that she may not be able to talk and I tell her thats completely fine, then I go back to her Instagram to see what other pictures she has on her page and it pops up with an error ""user not found"" weird I say to myself and I go back to check the people I follow on my page and search up her @ and its not there. I then ask Alice about this I say to her ""what happened to your instagram""  she says ""what happened to it?"" i say ""yeah i dont see you in my following anymore"" she says ""I didnt do anything to it"" then i say ""is it on my end? Can you add me again"" she then says ""Yell ill try to but i think it could be mine to? My phone is acting up really badly"" i reply ""are you sure"" but my message isnt delivering and at this point i completely understand whats going on she blocked me and i think to myself why would she ever do that. I thought it was really strange and from what I've learned from talking to her for the last 3 days super out of character so i message her on tinder again and say ""hey i dont know why u blocked me but I think you looked fine I'm not that shallow"" to which i get unmatched and at this point im just confused. To where I think I made a mistake which im completely fine admitting I grab my brothers phone and text her saying ""Hey alice I was really enjoying talking to you"" ""I really dont want things to end this way if you want to explain what happened I am not going to hold anything over you I just want to know whats going on"" and she replies to my surprise ""im sorry i panicked and message me back on your phone"". We then talk about what happened to where she tells me in a bunch of long winded responses that she had been stalked and worried about showing her face, and at this point I dont believe anything coming from her mouth because she had already lied to me but im not going to tell her that. We have our date in 3 days WHAT DO I DO, I am extremely understanding of shit like this but I dont understand the need to lie to me. I dont want to drive to some place to get stood up, if anyone could give me advice i would really appreciate it.",dating,t5_2qhb1,https://www.reddit.com/r/dating/comments/pddke3/what_is_going_on/
69,pddl0g,1630170145,What is going on,"So i[18m] recently got out of a bad break up with a long term girlfriend of 2 years, to say the least it wasn't that messy but left me feeling a little stung, betrayed, and worth less than before for how things closed off. Like any other man who is trying to get over self confidence issues I tried to cover them up with women and I download tinder INSTANTLY buy tinder plus (cuz I know how these apps work) and started swiping away. I get a few matches text back and forth you know the whole tinder 1 word to a question thing until I find a girl [18f] (not gonna use her real name) Alice, me and Alice instantly hit it off from the second we started chatting I really enjoyed talking to her. We had been talking for 2 days at this point about really down to earth shit getting to know each other, and had even scheduled a date (which i dont know if i was being too forward for this i am extremely new to dating again). The pictures she had posted on her tinder were really weird lighting and either making weird faces, so I asked her for her Instagram and she gave it over. BUT again i couldnt find pictures of her face and we had already switched over to normal texting at this point so I ask her if she can just take a picture of her face in normal lighting. She sends over a picture of the side of her face and again I ask her to just send a picture of her face, at this point I realized that she did have normal pictures on her Instagram they were just a couple scrolls down.
     Then this story takes a really weird turn she tells me that she's getting a new phone tomorrow and that she may not be able to talk and I tell her thats completely fine, then I go back to her Instagram to see what other pictures she has on her page and it pops up with an error ""user not found"" weird I say to myself and I go back to check the people I follow on my page and search up her @ and its not there. I then ask Alice about this I say to her ""what happened to your instagram""  she says ""what happened to it?"" i say ""yeah i dont see you in my following anymore"" she says ""I didnt do anything to it"" then i say ""is it on my end? Can you add me again"" she then says ""Yell ill try to but i think it could be mine to? My phone is acting up really badly"" i reply ""are you sure"" but my message isnt delivering and at this point i completely understand whats going on she blocked me and i think to myself why would she ever do that. I thought it was really strange and from what I've learned from talking to her for the last 3 days super out of character so i message her on tinder again and say ""hey i dont know why u blocked me but I think you looked fine I'm not that shallow"" to which i get unmatched and at this point im just confused. To where I think I made a mistake which im completely fine admitting I grab my brothers phone and text her saying ""Hey alice I was really enjoying talking to you"" ""I really dont want things to end this way if you want to explain what happened I am not going to hold anything over you I just want to know whats going on"" and she replies to my surprise ""im sorry i panicked and message me back on your phone"". We then talk about what happened to where she tells me in a bunch of long winded responses that she had been stalked and worried about showing her face, and at this point I dont believe anything coming from her mouth because she had already lied to me but im not going to tell her that. We have our date in 3 days WHAT DO I DO, I am extremely understanding of shit like this but I dont understand the need to lie to me. I dont want to drive to some place to get stood up, if anyone could give me advice i would really appreciate it.",dating,t5_2qhb1,https://www.reddit.com/r/dating/comments/pddl0g/what_is_going_on/
70,pddpxn,1630170593,Getting a little tired of hearing: “Let’s just be friends” It’s exhausting tbh,"I know that failure is important in order to achieve success but it becomes tiresome overtime to constantly hear that, it’s exhausting ngl. Then it all becomes worse when you’re just friends with that girl and you start liking them even more, so you’re left in a situation where you risk ruining the friendship by trying to get out of the friend zone or just accept she’s not into you and suppress your feelings because that’s the right thing for the friendship. 

It’s tiresome.",dating,t5_2qhb1,https://www.reddit.com/r/dating/comments/pddpxn/getting_a_little_tired_of_hearing_lets_just_be/
71,pddybv,1630171335,"If someone goes on vacation after 2 dates and communication is limited, should you keep meeting other people?","I know I'm overthinking it here but just bear with me. I had two very good dates with a new guy earlier this month. Right after our 2nd, he left for a month long vacation abroad. We texted for the first few days, but not in a week now. He said before he left he wanted to see me when he got back, was sad to leave right after meeting me, etc. But to be fair, all of this fondness was after a few glasses of wine and some making out so I'm not sure how seriously to take it. 

Should I assume he is doing his own thing in Europe and I should keep dating and seeing other people? I'm not seeing anyone else at the moment so I would be starting something(s) new. Or after two good dates, is there any expectation that you would wait for him? 

I just assume most men in their twenties on a European vacation wouldn't exactly be waiting around for me, especially since we had no conversation about exclusivity and since he hasn't been texting every day or anything like that. But if I'm mistaken and he's actually hoping I'll wait for him, I would do it in a heartbeat because we had a really good connection.",dating,t5_2qhb1,https://www.reddit.com/r/dating/comments/pddybv/if_someone_goes_on_vacation_after_2_dates_and/
72,pde527,1630171952,Did I creeped her out? But How?,"I’m studying at uni, We’ve been looking at eachother for a long time, So I approached her. I was nervous few times talking to her as she was my type. We were talking a bit everyday, Just usual small talk - it was Cool. One time I asked her that we Can go out in the meantime while studying - she never replied to it. Since that day, she has been acting really weirdly, Almost like she was scared of me or something. I only asked her….

Since that day I only say Hi when I see her and don’t talk to her anymore - Just leaving her alone. She still stares at me sometimes that Way she was looking at me Before we started talking - flirtatious. But many times I’ve seen her she Just Put her eyes down and seems sad or something or looking terrified.",dating,t5_2qhb1,https://www.reddit.com/r/dating/comments/pde527/did_i_creeped_her_out_but_how/
73,pde8vo,1630172296,How to know if a person is interested?,"I'm a dude and I've always been okay with women. But I usually misread some signs of attraction. Like after a while a friend would say they used to like me but I never got the hints. I've been in a couple online relationships but not in real life. Right now I think two people like me, my cousin's friend and my friend. My friend has showed me her sketch book and she's had feelings for me before. My cousin's friend is a mystery we share intimate subjects texting but idk. I'm gonna be an adult and dating is getting even harder. Hope anybody could help me. Thanks!",dating,t5_2qhb1,https://www.reddit.com/r/dating/comments/pde8vo/how_to_know_if_a_person_is_interested/
74,pdecd5,1630172612,Person I've been seeing for some time has now stopped initiating phone/text conversations,"We've met up a few times already and all seemed to be going well. But for a couple of weeks now she stopped initiating text and phone conversations. She has told me in the past that she suffers from social anxiety (which I believe is genuinely the case). But now I feel that I'm putting in too much effort and I'm beginning to lose interest in her. 

Should I just assume she lost interest in me and move on?",dating,t5_2qhb1,https://www.reddit.com/r/dating/comments/pdecd5/person_ive_been_seeing_for_some_time_has_now/
75,pdel9s,1630173439,If he doesn’t want to be exclusive after 6 dates is it worth continuing?,"I’ve been seeing this guy for about 2 months that I met on hinge but because of vacations and such we’ve only gone on 6 dates. 2 of the dates have been sleepovers (no sex) so we spent 12+ hours together and texted/had phone calls while I was away on vacation &amp; in between dates. 

On our 6th date I told him I’d be ready to only see each other (not be in a relationship, just only dating/hooking up with each other). He said although he hasn’t been on any other dates in 2 weeks, he’s not ready for that and seemed uncomfortable with the conversation. 

Was it way too early to bring that up? If he’s not ready now, will he ever be or is he just looking to keep things casual? Looking for a male opinion on this maybe… should I keep seeing him in hopes he will be ready in the next monthish or move on? 

Any advice is appreciated, thank you 😊",dating,t5_2qhb1,https://www.reddit.com/r/dating/comments/pdel9s/if_he_doesnt_want_to_be_exclusive_after_6_dates/
76,pdesgt,1630174073,Should I ask my manager out?,"I (23M) have recently been getting to know my manager (20F) for a couple month’s now at this fashion retail job. We haven’t exchanged contact information or anything like that yet(probably because it isn’t allowed) but we have been having casual conversations. 

There was this time where asked me to help with the paper work at the office and she even ranted to me about how unfair the district manager was being. We even talk about are goals and what we want to accomplish. She will be hot &amp; cold some days she seems interested and other days she will be casual like this one time when we were alone for a brief second at the office she asked “do you have plans tonight” I just responded with “not really what about you” and she just told me she was going to sleep after a long day of work. 

Once we were leaving the store we did this cute little handshake we never did before lol and then as I was about to leave I was about to ask her something I think I said something like “hey-“ she responded with “hm?” In a soft feminine tone. I didn’t ask her because the other manager was right there but I just said “next time” and walked away. 

The other day was pretty casual but There was this moment where she was looking for a manager in the store so she said “let me see your microphone” so I gave her the antenna over the register and she for some reason lean forward enough for me to see the top of her dress was unbuttoned so seen her cleavage even the bra strap (which was crazy cause I could have sworn it was buttoned earlier) but yea guys that was my short story idk I might really asked this girl out especially once I leave the job. 

But what are your thoughts do you think she’s interested or just being friendly?",dating,t5_2qhb1,https://www.reddit.com/r/dating/comments/pdesgt/should_i_ask_my_manager_out/
77,pdeuqm,1630174297,Should I date again??,"I was in a 4 year relationship with this girl. It was going really well and despite the age gap of around 4 years we were really compatible with each other. Right one year ago on 4th of September to be precise, she told me that she is bisexual and is in love with a girl. Before I could discuss the scenario with her, she broke up with me and blocked me completely out of her life. It was a big breakdown for me as all of this happened within a week's time and I was destroyed completely. I started taking therapy and slowly started to normalise my life again. When I think of it, I do feel i should have supported her during that time. Her sexuality wasn't a problem for me but the fact that she liked someone else than me freaked me out and maybe that created some tension!
Today it's almost one year to that and I can say I have 50-60% recovered from that trauma of breakup. Yes I do have a lot of friends but being in a relationship for 4 years I do feel alone on that part. I feel there should be someone by my side to support me and stuff. I have thought of it but being committed again scares me because of what I have been through. I am really confused about what to do. Also I don't have much of girl friends so that's the other scenario as well! And I don't know whether the dating apps are a good way to do it. What should I do? Should I suppress the feeling and focus on myself or should I try finding someone? Need advice!",dating,t5_2qhb1,https://www.reddit.com/r/dating/comments/pdeuqm/should_i_date_again/
78,pdey02,1630174597,What's wrong with teaching a student if she is girl?,I have been staying in a relationship for 10years.we're totally intimate each other.but for 6months I have been teaching a girl.that's the problem of my girl friend. She couldn't tolerate it totally.she doesn’t believe me.she is getting offended.she told me she couldn’t take any relationship with me if I teach my student.what should I do now?,dating,t5_2qhb1,https://www.reddit.com/r/dating/comments/pdey02/whats_wrong_with_teaching_a_student_if_she_is_girl/
79,pdf2xv,1630175052,Am I in the wrong for not talking to a girl after we had sex?,[removed],dating,t5_2qhb1,https://www.reddit.com/r/dating/comments/pdf2xv/am_i_in_the_wrong_for_not_talking_to_a_girl_after/
