,id,created_utc,title,selftext,subreddit,subreddit_id,url
45,nkbuoz,1621900152,Advice on anxious attachment after a date,"I (24F) realize I have a very anxious attachment style and it’s something I’ve actively tried working on for a very long time. That being said, it’s still something I struggle with. I struggle the most after going on a date with someone and not knowing where they stand. I aim for straight-forward communication to help calm my nerves, but not everyone is willing to be as honest or straight forward. Does anyone who also has an anxious attachment style have any advice on how to get over those “post-date” nerves that come from not knowing where the other person stands/if they’re still as into you as they were before? Thank you!",dating,t5_2qhb1,https://www.reddit.com/r/dating/comments/nkbuoz/advice_on_anxious_attachment_after_a_date/
46,nkc3l5,1621900920,Am I jumping to conclusions or am I being ghosted?,"So I(26f) have been talking to this guy (26m) for a few weeks and I thought we were really into each other. We were sharing a lot and he told me he was ""hooked"" on me. 

Now, I only realized I had feelings for him after he said this so maybe I was a bit clingy the day after. I haven't heard from him since the day before yesterday. He never opened my last Snapchat but he looked at my story yesterday. Idk. Part of my wants to block him so I can stop thinking about him but it's only been two days. Is it too soon to assume I'm being ghosted? 

Honestly, I'm really feeling heartbroken over this. I know it's silly but I'm a survivor and divorcee so it isn't easy for me to catch feels at this point.",dating,t5_2qhb1,https://www.reddit.com/r/dating/comments/nkc3l5/am_i_jumping_to_conclusions_or_am_i_being_ghosted/
47,nkc58e,1621901060,"If you have all those ""normal"" things people suggest you change in your life to become more attractive as a person, what to do when it still dosen't work out?","Most of the time when guys like me; 30 years old, virgin, only kissed 2 girls, never had a girlfriend, ask for help there are some standard tips you get. Start working out, leave your moms basement, make positive changes in your life, meet new people, get female friends, fix your clothes, etc. 

I am quite certain i am not the first one to hear advice like that, and honestly, they are good advices. But what do you do when you seemingly have your shit together?

I often get complimented about my body due to working out pretty much my whole life, 185cm (6'1), graduating within a month with a master of science, always have friends to call or reach out to when i am bored or just want to hang out. 10-15 of these friends even bothered to plan a secret birthday party for my 30th birthday. Both female and male friends. Often hear that ""everyone likes pickminfuckface"", can easily entertain people at parties or when hanging out. AND i get girls hitting on me, often girls that i meet a few times at some event or similar. BUT, tinder is not working out for me, got like 10 matches when swiping right on every girl i found in my town.

So, how come i ended up a wizard? (wizard when virgin at 30 right?) Not really sure. Spent 6 months with a psychatrist talking about this, he couldn't really give me a background for the problem, he only said it sounded like anxiety. Triggered when girls hit on me and i am interested in them. I freeze up, get afraid and pretty much do anything to avoid the situation. 

I got some tools from the psychatrist to be able to handle these situations, but i need to practice by actually being exposed to situations with girls i am interested in and vice versa. But this shitty pandemic is not really the perfect time for that. So i have no idea if this really works.

So, what else can i do to increase my chances to finally experience intimacy and love? Anyone been in a similar situation that got advice? Should i dare try tinder again?

Or am i doomed to for ever seek advice from professionals to try figure out my brain and behaviour that is preventing me from having a normal sex/love life?

Thanks!",dating,t5_2qhb1,https://www.reddit.com/r/dating/comments/nkc58e/if_you_have_all_those_normal_things_people/
48,nkcbf7,1621901598,Just asked girl [20F] I've [20M] been seeing if she wanted to facetime,"I've been seeing this girl for a month up until we both left college for the summer (started a month ago). Been on a couple long dates that I thought went really well. Well enough for me to be falling a little hard for her.

I want to make sure she knows I'm into her. I mean, I've complimented her on a couple occasions, told her I wanted as much time with her as possible (regarding our final date before the summer), but I guess I wanted to make certain that she knows since right now, we can't really do much together apart from snapchat. 

I had been thinking about asking her if she wanted to FaceTime for about a little under a month now. I kept putting it off because of my nerves. But today, I asked myself a couple questions. 

If not now, when? It's not like we're just magically going to get more comfortable with each other, making it easier to FaceTime by just snapchatting. 

What do I have to lose? Well she could say no which would tell me where I stand with her. Assuming she has the time and says yes, what's worst case then? Probably just some break in conversation, which is never as bad as I think it is

And then I had a friend tell me the other day ""no successful person didn't take any risks"" and well, that's true. Sometimes you just have to say fuck it. 

So I asked her. I'm anxious as hell rn, and itll probably get worse when she agrees to, or agrees to a different day. Fuck.",dating,t5_2qhb1,https://www.reddit.com/r/dating/comments/nkcbf7/just_asked_girl_20f_ive_20m_been_seeing_if_she/
49,nkcd5d,1621901751,Am I a D*ck?,I met this girl with whome we had once a drunken casual sex type of thing. I had a flight next morning to catch so I left her place and went.(I tried to wake her up a bit to say goodbye but kinda half hearthedly because I wasn't sure if thats ehat I should do). We didn't talk much since then until now. Now we met again and talked about meeting again at her place. (I offered a pub but she got straight to the point and told to lets go at her place.) We had sex again and she asked me to sleep with her. I said ok. But then she told me that she got to go to work really early in the morning. I was working the night before so I didn't had much sleep. So I told her that I would rather get a good sleep at my place and we can meet tomorrow after work for a coffee. After some 'nagging'(should use a better word my vocab is not perfect) she finally let me go. I kinda feel bad that she would feel insulted and used after this but I wanted to have a good night sleep and wasn't interested in a relationship with her. I'm planning to sleep at her place two days later without sex and talk this through with her,dating,t5_2qhb1,https://www.reddit.com/r/dating/comments/nkcd5d/am_i_a_dck/
50,nkceph,1621901889,Am I coming off too strong should I have approached differently,"So I messaged a girl I liked for a few years we don’t know each other we met at a university party few years ago but not friends or acquaintances follow each other on instagram like some each other’s pics ect. I dm her “ I’m in Italy atm been wanting you for time now when I’m back would you like to go for drinks x” 
she replies “wanting me 😅 yeah drinks sounds nice”
I got back and organised the date “hey are you free next Saturday I’m gonna book swingers crazy golf for us there’s cocktails there meet at oxford circus for 9” 

I just wanna be direct and get the ball rolling but I understand why it can come off too strong. I don’t know I always was told be direct. Did I come off to strong is there a better way to approach getting dates.",dating,t5_2qhb1,https://www.reddit.com/r/dating/comments/nkceph/am_i_coming_off_too_strong_should_i_have/
51,nkcjma,1621902323,Does anyone else feel in retrospect that they loved their ex more as a fantasy than an actual person?,"I talked to two of my exes recently on the phone, we had really nice chats both and I'm no longer really into either (a bit, but not too much), but with one it hit me that, despite the fact this relationship seemed so intense and full of being ""in love"" at the time, I don't particularly respect her, I've never really deeply cared about what happens in her life apart from me the way I do friends and family, and that I don't really like her that much as a person. In retrospect, so much of my ""passion"" for her was the fact that she was really good looking and that I felt she was out of my league and I had this fantasy that somehow she would be the end of insecurities and boredom in my life.

The other ex I talked to and I realized, now that I'm over her, I really love her as a friend. She's such a wonderful, empathic, incredibly sensitive and intelligent and real person I can almost see more clearly now that it's not a romantic thing. It's crazy the illusions being in a passionate relationship give us about who we're with when our need for love and affirmation distorts obvious realities. The ancient greeks had it so right that sexual/romantic love (eros) can't compete with deep friendship (philia). When you're no longer into someone and get back down to earth you really see how someone's moral fiber, intelligence, and empathy are so much more important than their looks or surface charm.",dating,t5_2qhb1,https://www.reddit.com/r/dating/comments/nkcjma/does_anyone_else_feel_in_retrospect_that_they/
52,nkcsqa,1621903076,Dating in your 30's...,[removed],dating,t5_2qhb1,https://www.reddit.com/r/dating/comments/nkcsqa/dating_in_your_30s/
53,nkcyvo,1621903633,Getting rejected is still a beneficial experience,"I just wanted to preface this saying that I'm fairly new to the dating game. Me and my first gf broke up before lockdown hit my country and having been pretty much in and out of lockdown since then until only recently, dating is fairly new to me. I've had some successes, some people I knew irl and asked out and some on tindr. Through it all I also got rejected...alot. When I first got rejected, I took it pretty hard, I think because I was so new to dating and it's the first time i've been actively pursuing relationships and such. My first relationship came when I wasn't looking for it so it was kinda disheartening to be putting in effort and have it not come to anything.

But after a few rejections, I had some successes. Now I'd start seeing someone for a lil bit and then it would fade out. The first few times this happened I felt kind of disheartened , because I wasn't used to it. But now I'm becoming so comfortable being rejected. When it happens I just shrug my shoulders, feel proud that I at least made the effort and got my answer in the end and then I move on. If I go on a few dates then get rejected, that can be a bit of a harder blow but (as cliche as it sounds) it's character building. You realise that theres no guarantee that things will work out with anyone but if they don't work out you'll come out the other end and be ok. I remember for a while having a massive ""losing"" streak, where I didn't get any dates for months. But I realised that's just life, things go up to come down again and so on. Sometimes the downs last longer but they don't have to be negative experiences! It's a real magnifying glass on your self esteem and any issues you might have. You gotta question why you feel that way, why are giving someone that much power to make you sad and why you shouldn't take it too personally. Sometimes people just don't like you in that way, and that's ok.

Bottomline is, you've got to have perseverance. Not perseverance in bugging one person who rejects you but just perseverance to keep trying with other people. Keep an open mind, have enough confidence in yourself that you know you'll be happy even if you get rejected or you don't get that second/third date. It's all a learning experience, and furthermore I've learnt to spot warning signs and red flags. Know when to give up or when someone you are speaking too has lost interest but is just replying to stay polite. 

So yeah, to anyone who is having a bit of a dry streak, don't stress. Keep your head up and believe that you are worthy of someone, you just haven't found the right someone yet. Everything will work out just fine, just keep at it and try not to get disheartened. Saying that, don't be afraid to take a break from dating if that's what you need. Remember that you come first, and that other people should put themselves first too so it's ok if they do that and reject you because it doesn't feel right for them. But if you can handle it, go out there, take some licks but keep ticking because you never know what's just around the corner!",dating,t5_2qhb1,https://www.reddit.com/r/dating/comments/nkcyvo/getting_rejected_is_still_a_beneficial_experience/
54,nkcz8t,1621903664,Advice?,Need a witty response to someone saying “We could make our own movie.” After I asked him for movie recs. Haven’t dated in a while so i’m a little rusty. Help me get back in the game guys!,dating,t5_2qhb1,https://www.reddit.com/r/dating/comments/nkcz8t/advice/
55,nkd4ow,1621904125,"Engaged to be married, but she wants me to stop using dental dams"," I have been dating this girl for almost a year and we clicked on everything, it was nuts, so of course i asked her to marry me asap.

Only  problem is I been using a dental dam this whole time and she hasn't been happy about it. She never liked it the first time, but she put up with  it. Recently however she got all the sexual testing and apparently shes clean from all the diseases (but they didn't test for herpeh???).

Anyway shes been demanding I stop using it and go down raw without the dam but I  can't do it. To get her off my back, I told her I cant because I like the flavor of the dam (strawberry) but last week she poured a strawberry smoothi on it and  expected me to go to town but I froze and left the room... now she knows  I actually don't wanna do it and shes pissed.

Wedding is off according to her and her mom wont let me in the house to talk.

Don't know what to do Im stressing but I cant stop using the dam I want to be  healthy and disease free for our children. Any thoughts??? I think I ruined the marriage unless i can go downtown like some kind of hungry seabeast but I cant my body wont let me its unsafe and kinda nasty tbh. I just want to be safe why  can't women get that.",dating,t5_2qhb1,https://www.reddit.com/r/dating/comments/nkd4ow/engaged_to_be_married_but_she_wants_me_to_stop/
56,nkdb1e,1621904659,Is it wise to keep your options open?,"Say you’re particularly interested in one person, do you keep your options open in case it all goes to hell? Eg texting, hanging out with other people, etc. Thanks!",dating,t5_2qhb1,https://www.reddit.com/r/dating/comments/nkdb1e/is_it_wise_to_keep_your_options_open/
57,nkdiwr,1621905348,Staying In Touch After First Date,"So I will keep this short and sweet;

Went on a first date last Thursday, went well, got along, she texted me after that she had a great time. I was leaving town the next day and returning today, so I said we should do it again when I get back and she said yes.

We texted off and on all weekend, nothing intense but just a bit of chit chat.

Last night I sent her a text asking when she may be available to get together this week and she responded this morning saying that she may be working late all week before she leaves town next weekend and doesn't know her schedule at the moment, she went on to explain that she lost an employee at work (this had been mentioned as a possibility on our first date), and needs to reshuffle/transition people and only has a week to do it. Then asked if I fly back today, which i said yea.

Totally understandable, and probably stressful, so obviously she is busy. I texted her saying basically that really sucks that that happened, what a pain it must be, and that that's a lot to deal with.

Followed that up with ""I am really flexible in the evening this week so just let me know!""

And didn't hear anything back after that. I don't want to lose touch with her, especially just because she is having a busy week, that I totally understand. Now to the question, do I just leave it at that? I don't want to bug her. If I was busy, and someone I wanted to see again sent that I would at least have replied ""i definitely will!"" or something of that nature, goes two ways right? Or do I just keep texting her random chit chat? Reminder, it has only been one date.",dating,t5_2qhb1,https://www.reddit.com/r/dating/comments/nkdiwr/staying_in_touch_after_first_date/
58,nked2e,1621907974,First date helpfully,Hey guys im from a forgien country and i move to the US. in my culture we dont have dating. I really want to start dating. but i dont know how to start and what to do or even what to talk about with a stranger woman if we are getting lunch or something. Please give me some tips. Anything will be appreciated even if there's expensive courses i will take them ( i live in nyc btw) thanks in advance,dating,t5_2qhb1,https://www.reddit.com/r/dating/comments/nked2e/first_date_helpfully/
59,nkehs9,1621908359,I'm 36 and I don't have a girlfriend.,"Hello, is being 36 years old male without a family yet (Wife/girlfriend  and children) feels bad to be at this age?  I have a stable job on the IT department.  I only have experienced 2 relationships that came into my life.  First girlfriend when I was 24 lasted only 3 months because her ex-bf came back to her.  I became the rebound guy.  2nd girlfriend we lasted only for a year but a lot of quarrels on the relationship because she is unfaithful but I always forgive and understand her.  I am not a late bloomer, when I was still 18 years old I kept on courting women but with no luck and was always in an unrequited love.  I am also a reserved-type of a guy.  I only date only 1 girl and I can't date several girls because my feelings can only focus one girl.  I am so depressed right now, I hope you guys can help me and let me know if being at this age still single is ok or not.  Thanks.",dating,t5_2qhb1,https://www.reddit.com/r/dating/comments/nkehs9/im_36_and_i_dont_have_a_girlfriend/
60,nketi4,1621909379,"In your age group, which is harder: finding a person of the opposite sex willing to have casual sex with you, finding a person of the opposite sex willing to befriend you platonically or finding a person of the opposite sex willing to have a long-term relationship with you?","I'm curious to hear about other people's situation.  Write them in order from easiest to hardest, specifiy your age and gender.",dating,t5_2qhb1,https://www.reddit.com/r/dating/comments/nketi4/in_your_age_group_which_is_harder_finding_a/
61,nkeu5a,1621909435,I am 18 M...,"Im a 6'5"" 18 year old Male on the chubbier side living in Texas. I am looking for women 18 and older obviously. I honestly dont mind skinny, avg, chubby, or bbw women, Im not too picky. I am into gaming, art, YouTube, and anime. I can listen to any kind of music but my preferences are Metal, Rock, and Rap. Honestly Im trying to look for a girl who can really understand and dig me and maybe play a few matches of COD lol. If anyone is interested dm me.",dating,t5_2qhb1,https://www.reddit.com/r/dating/comments/nkeu5a/i_am_18_m/
62,nkeuh9,1621909464,DATING APPS - do you hate them?,[removed],dating,t5_2qhb1,https://www.reddit.com/r/dating/comments/nkeuh9/dating_apps_do_you_hate_them/
63,nkew4e,1621909614,Theory:,"Online dating attracts immature people.

By this I mean, it provides all the incentives for immature people to want to join. For instance, a need for instant gratification which is a sign of immaturity. 

I think this is why we see so much ghosting and mistreatment. We are dealing with people who are immature and are attracted to online dating for that reason.

What do you think?",dating,t5_2qhb1,https://www.reddit.com/r/dating/comments/nkew4e/theory/
64,nkf324,1621910227,Cat just died and I think I’m being blown off by my bf,"  
My cat I had for 10 years just died in my arms this morning. I was a total wreck. He had cancer and wasn't doing well but he might have pulled though. I stayed up all night dripping food and water into his mouth and he passed in my arms this morning. ive been a crying moping mess all day and now Idk y but I’m mad at my bf.

We had plans to go out tonight because he’s leaning to his relatives for 2 months tom(his flight is at 12) but last night I called him and told him I didn't know about tommow night(tonight) bc he was so sick I thought I was gonna have to put him down in the morning(this morning) and if I didn’t put him down i didn’t know if I could leave my baby in my roomates care for the night. He said he really wanted me to come over and even if he was put down he said he didn’t want me to be alone and I could just be sad over at his place.

he passed away this morning in my arms and after I took him in I just laid around. I feel like total shit.

he messaged me at 4oclock. ( I thought it was because he’d slept in bc he stayed up late with me but he posted earlier. I was upset at first that he didnt txt me as soon as he got up but I’m just overreactiNg so I’m not really mad I guess.) he just says “hey.” And I text him that Oliver(my cat) passed this morning. he gave the usual Im sorry and how are you holding up and I tell him I’ve just been lazing around and my roomie got me food but I’m not feeling hungry just like a blob. He replied that he wasnt hungry either and that he was out w/ 2 friends and he didnt order anything. I just text him how I’m feeling and I’m sad and shit. i can tell he didn’t really know what to say and his replies start coming 10 min after I send him something and I know he’s out with friends so I feel bad so I just say “I’ll let you get back to your friends text later?” And he just says yea and thats it.

its now 7:30(the original time i said I’d come over) and not a word. It’s been 2 hrs Since we texted and I think he’s at his place with his friends. idk y but I just don’t want to be alone and even tho I’d just curl up into a ball over there and cry I don’t want to sleep alone in my bed for the first time in 10 years. I’m really with him bc I feel like I’m being avoided bc I’m depressed. Is it wrong if me to be mad at him right now? I know last night I said I didn’t know how I’d feel or if I’d be up to it to come over but now I feel so alone. I just want to be held. I didn’t tell him that Im lonely and I want to mope at his place tho. do I even have the right to be upset? How do I get myself to not be mad at him. i dont want to tell him he can’t hang out with fries and he has to be around me but Im so overwhelmed with emotion right now I don’t think I’m thinking straight. What do you guys think? we’ve dated for 2.5 years now and I’m 21(f) he’s 22(m)",dating,t5_2qhb1,https://www.reddit.com/r/dating/comments/nkf324/cat_just_died_and_i_think_im_being_blown_off_by/
65,nkf3re,1621910292,Do you think he will be back and want to continue where we left off?,"I was talking to a guy I met online, we really connected added each other on everything and texted on and off for a while. He was pretty bad at texting but was engaging with his messages, and we were going to video call. He admitted he had been in a horrible place and needs to focus on his life and I deserve attention. He said he would be lucky to get to know me but just needs to figure out his life first. He was super open and honest in his text and seems super into me, do you think he will be back and want to continue where we left off?",dating,t5_2qhb1,https://www.reddit.com/r/dating/comments/nkf3re/do_you_think_he_will_be_back_and_want_to_continue/
66,nkf47b,1621910334,my bf and i talked about sexual topics,"i have a boyfriend, and we are now going 2 years in our relationship this coming september. last night, we talked about sexual topics, like our fetishes in bed, our preferences in one’s body, and etc. it didn’t make me uncomfortable, but i was kind of worried that now we’re quite comfortable about this kind of topic, we might do it, and i absolutely don’t want that because i am still not ready.

i’m here because i need some advice on how to control our urge whenever we are in that kind of “moment”, and i don’t want him to think that that because i’m okay with us talking about this kind of topic, i want us to do it.",dating,t5_2qhb1,https://www.reddit.com/r/dating/comments/nkf47b/my_bf_and_i_talked_about_sexual_topics/
