,id,created_utc,title,selftext,subreddit,subreddit_id,url
0,oen1ui,1625543170,hi,[removed],dating,t5_2qhb1,https://www.reddit.com/r/dating/comments/oen1ui/hi/
1,oen23l,1625543199,"Ladies, if a tall handsome man cold approached you, would you talk to him?","Ik a lot of women will say they don't like to be approached any where outside a bar or club. But I think that's bs. Even if you are at a grocery store running errands if a tall attractive man approached you, you'd probably make time to talk to him. Right?",dating,t5_2qhb1,https://www.reddit.com/r/dating/comments/oen23l/ladies_if_a_tall_handsome_man_cold_approached_you/
2,oen2c2,1625543228,hi,[removed],dating,t5_2qhb1,https://www.reddit.com/r/dating/comments/oen2c2/hi/
3,oen35g,1625543316,hi,"41F looking for a soulmate ,i want to love again as if i have never been hurt before ,i am not here for fun chat ,i based my relationship on trust and understanding ,we can chat",dating,t5_2qhb1,https://www.reddit.com/r/dating/comments/oen35g/hi/
4,oen3ww,1625543396,Add me on kik if your interested in me samanthababe112,[removed],dating,t5_2qhb1,https://www.reddit.com/r/dating/comments/oen3ww/add_me_on_kik_if_your_interested_in_me/
5,oen7or,1625543808,so tired of getting fatfished,just put up to date pictures on your profile please. i had a date today that was 40 pounds larger than her pictures.,dating,t5_2qhb1,https://www.reddit.com/r/dating/comments/oen7or/so_tired_of_getting_fatfished/
6,oenc1p,1625544267,Girl that I have been seeing for 3 months wants to date other people?,[removed],dating,t5_2qhb1,https://www.reddit.com/r/dating/comments/oenc1p/girl_that_i_have_been_seeing_for_3_months_wants/
7,oencsq,1625544357,"[Serious] Women who are considered attractive, what are your thoughts on an average guy who is to shy and timid to ask you out in fear of not being attractive enough or cool?",I'm just wondering if I would be able to get some advice or insight about this a bit more and see if it can help me in the future,dating,t5_2qhb1,https://www.reddit.com/r/dating/comments/oencsq/serious_women_who_are_considered_attractive_what/
8,oendax,1625544414,Best way to deal with break ups? She’s even down talking me…,"Long story short I was with my ex for 10months until last night I pulled up to get some things and seen another dude car outside her house inside her apartment. So I went got some of my people and we went back and I told her bring my stuff outside. After that she started texting me things like I’m ugly, I’m not her type, she never had feelings, she used me, she was with him, idk our relationship felt reall and the love did. Yes we argued a lot towards the end which made her consider space but idk. She moved on pretty quickly. Idk how to go about this yes I’m thinking about her all day but I KNOW I must move on",dating,t5_2qhb1,https://www.reddit.com/r/dating/comments/oendax/best_way_to_deal_with_break_ups_shes_even_down/
9,oeneul,1625544579,I hate that alot of average guys cant really date a consistently like that in their 20s.,"It just really sucks honestly.  Everyone knows that women are at their peak attraction in their early to mid 20s. So in turn women get the cream of the crop men while the overwhelming majority of men under below average struggle to get scraps. This is why you constantly see very lonely and depressed at their dating lives. One of the most common questions you hear on the dating sub is why is online dating so unbelievably hard for men.


 Its very hard to find gfs or just laid as a guy that is not above average and above during his 20s. Even if you are going for unattractive or average themselves.  So unless a guy bulks up Hugh Jackman, makes alot of money, or looks like Harry Styles is just freaking tough. Or he might as sit out for his 20s and date at 30s.

Its a very tough game to win. Older women dont want you because they dont like dating younger men. And even younger women dont want you because they like older men as well. They want a guy with experience. Which alot of younger guys dont have.

Studies support that 51 percent of men in the US are single between the 20s and 30s range. Let that sink in",dating,t5_2qhb1,https://www.reddit.com/r/dating/comments/oeneul/i_hate_that_alot_of_average_guys_cant_really_date/
10,oenfzr,1625544706,Looking for an indian girl to date M24,"Looking for an indian girl to date, Caring and loving, idk what to say more. Hit me up in chats if you wanna know me",dating,t5_2qhb1,https://www.reddit.com/r/dating/comments/oenfzr/looking_for_an_indian_girl_to_date_m24/
11,oenn3c,1625545502,"Those who've dated avoidant attachment people, how did you make it work?","Currently dating someone who is avoidant attachment who I like so much, but having trouble due to them exhibiting all the standard avoidant attachment behaviors.  Any advice or tricks would be appreciated.",dating,t5_2qhb1,https://www.reddit.com/r/dating/comments/oenn3c/those_whove_dated_avoidant_attachment_people_how/
12,oeno5j,1625545633,Who has a gamer bf here?,"Hi! I have a bf who is a gamer and he plays black desert online. “I just want to know what is roulette in this game”. Based on my researches players tend to quit the game after doing the roulette. And I’m concerned because he’s too sad. He didn’t mention why he is sad tho. I just heard from his friends that he did a roulette and the next thing is he won’t be playing anymore. I just want to understand him more. I’m not a gamer, so I kinda don’t understand these technical terms in a game. Also, I don’t know what words to comfort him or such.",dating,t5_2qhb1,https://www.reddit.com/r/dating/comments/oeno5j/who_has_a_gamer_bf_here/
13,oenuzk,1625546446,Lip Fillers vs Natural Lips,"I am watching a reality TV show and I couldn't help but noticed the amount of overly done lips on many of the cast members. Is there a difference between kissing someone with filler vs none?

 Disclaimer this is not hating towards anyone who has them it's their choice their bodies. This is just simple curiosity.",dating,t5_2qhb1,https://www.reddit.com/r/dating/comments/oenuzk/lip_fillers_vs_natural_lips/
14,oenyky,1625546873,"How do I tell my guy best friend, who I met on bumble 2 years ago, that I have caught feelings but still be friends if he doesn't feel the same way?","We've never really been normal friends I guess... when I wasnt interested in him romantically we would send each other screenshots of potential lovers and would give each other dating advice. We always flirt with each other. The past 3-4 months something has just clicked and I have started seeing him differently. Hes everything I want in a partner. But, at the same time, i havent told him because he is still extremely important to me as a friend. Probably the most realest, supportive people I have ever met. I was an idiot to friendzone him. But idk if he feels the same anymore since hes been on dates with girls but none of it really amounts to anything. Theyve only been one or two dates and then they ghost each other.",dating,t5_2qhb1,https://www.reddit.com/r/dating/comments/oenyky/how_do_i_tell_my_guy_best_friend_who_i_met_on/
15,oenytl,1625546902,Ex calling me a stalker to people after she stole my credit card,[removed],dating,t5_2qhb1,https://www.reddit.com/r/dating/comments/oenytl/ex_calling_me_a_stalker_to_people_after_she_stole/
16,oeoblw,1625548358,Is this normal in a relationship?,There’s been a few weird things that make me question my boyfriends behavior. One is recently for my birthday he was upset I didn’t post anything about him but was seen on social media having fun with others. However he never posts me and claims he doesn’t need social media for approval or validation and he likes his business private. He’s met all of my family and granted his isn’t the best I’m never around them. He has a young daughter and I respect that but is also very defensive around her and when I ask if there is anything weird with his bm. He won’t directly answer it he will just say “I’ve told you already and you’re not respecting it” I’m starting to feel like I’m crazy here,dating,t5_2qhb1,https://www.reddit.com/r/dating/comments/oeoblw/is_this_normal_in_a_relationship/
17,oeofg3,1625548811,[M31] I prefer dating younger women. Will this be difficult and frowned upon?,"I’m 31, and kind of feel like my 20’s were wasted. I was living in a stressful city, broke, working a dead end job, pursued a career that went nowhere, had health issues, death in the family and a very stressful relationship in my mid 20’s and haven’t dated anyone in the past 3.5 years. 

I’ve gotten healthy both mentally and physically, put on healthy weight and feel strong, starting my own business, spent tons of money fixing my teeth, have a good amount of money saved up and living in a smaller town that I love.

I feel like I’ve barely scratched the surface on the things I want to accomplish and experience in life. My last relationship was also my first and she was so fixated on the future and wanting marriage, it felt way too intense and serious for a first relationship. It want fun. 

The dates I’ve gone on with women my age don’t feel light and fun. It seems like they want to lock a life partner down and there’s just an underlying focus and pressure. It feels too archaic. 

I just feel like I’m in a different place in life than a lot of my friends and the women I’ll go out with.

Makes me think someone younger might be better.",dating,t5_2qhb1,https://www.reddit.com/r/dating/comments/oeofg3/m31_i_prefer_dating_younger_women_will_this_be/
18,oeokfr,1625549408,4-5 year age gap,[removed],dating,t5_2qhb1,https://www.reddit.com/r/dating/comments/oeokfr/45_year_age_gap/
19,oeol47,1625549489,What should I do now lol,[removed],dating,t5_2qhb1,https://www.reddit.com/r/dating/comments/oeol47/what_should_i_do_now_lol/
20,oeoo0v,1625549834,What should I do if I don’t feel anything when I kiss my boyfriend?,"I’ve been dating him for about a month now, and it’s my first time dating a dude. We’re both well into university, but neither of us are very experienced in the dating field (I’m bi, and had only dated women prior to this).

Now I know I AM attracted to men, both romantically and sexually. But when I kiss women, it kinda feels like an explosion of fun awesomeness. When I kiss him, no matter how much I like him, my heart barely even starts to race. (It’s not that he’s a bad kisser, and I do find him attractive, things just don’t make my heart go boom)

He’s an amazing boyfriend, who is loving, caring, and treats me like an equal. I don’t want to end my relationship with him over this, but I’m worried it’s too big of a flaw. 

Any advice?",dating,t5_2qhb1,https://www.reddit.com/r/dating/comments/oeoo0v/what_should_i_do_if_i_dont_feel_anything_when_i/
21,oeoqez,1625550117,"For those of you who met your current/past partners in person, where did you meet them?","I'm not sure whether I've asked this question here before, so forgive me. I’m 23f, and for reasons I won’t get into, I’m not able to get into dating apps. I’ve never been in a relationship or have any dating experience (except for one date), and since I never get approached/attention irl, I don’t know where to start. I also don’t know where to even meet people, considering I don’t drink or party, and that the meetup app in my city mostly consists of people 40+ (or is inaccessible for similar reasons). I can't really meet people through my friends, either.

I'm wondering how or where you've met your partners, and especially in your 20s.",dating,t5_2qhb1,https://www.reddit.com/r/dating/comments/oeoqez/for_those_of_you_who_met_your_currentpast/
22,oeottz,1625550531,Why are women so outraged when a guy asks them out?,"It's OK if you're not interested, just bloody say so. It's fine, we're all adults here and we all know the rules. You can just say ""oh, thanks for the offer, bit I'm not down for that"". Hell,  even make up an excuse and tell me your fake boyfriend wouldn't like that. It's cool. 

What I don't understand is why some women act like I've committed a crime against humanity for daring to ask them out. They get completely defensive, angry, embarrassed, or blow it up into some big deal. It's just a bloody offer for a drink or a chat. 

Is this the result of recent feminist movements rying to convince women that men are out to use and abuse them? It's getting frustrating. I think at least 40-50% of women I ask out act so childish and defensive over it.",dating,t5_2qhb1,https://www.reddit.com/r/dating/comments/oeottz/why_are_women_so_outraged_when_a_guy_asks_them_out/
23,oeow3s,1625550803,Feelings of depression after hook up 😞what to say,"I’ve been asking lots of questions in this sub, I have no idea why I am hurting so much because of a stranger.

I’ve (20F) been celibate for a year before this happened.

I matched with guy (25) that I thought was out of my league. He’s tall, Brit accent, blonde, witty with a good job. So I ignored him because I know he got options.  We wouldn’t text really, I would be so tired leaving home at 6 am and coming back at 7 pm, I had no energy to text during the weekday. Well some way or another I let him take me to the arcade on Saturday. 

He was being really fuckboyish, trying to charm me and make out with me fairly quickly. I had no intentions to have sex with him, but when he said we should watch a movie I thought at the theaters but we went to his apt.

While there we talked we had lots in common and we made each other laugh so much. One thing lead to another and we started making out. I would stop him then he’d try again later. Almost 2 hrs

As we started talking about his job in pharma- I found out we were both shroom heads. He had some so we both took a small dose.

We had lots of fun, talking about family, our love for sports, ghosts, sunny refrences and lots of sex intill 4am. He couldn’t get enough, it was a lot. 

We woke up the next day, he kept gazing in my eyes and telling me I was beautiful. I told him I had to go but he wanted me to stay. I eventually took a shower and he followed me in there saying more cheeses stuff.  I’m not gonna lie I thought he really liked me and I wanted to see him again.

When I was leaving out the door he told me he wanted a good bye kiss but I was already half the way out. I just said see you later. 

He hast texted me since that encounter on Sunday morning. Now it’s Monday night. I guess I was just a pump and dump to him. 

I know he will text me during the week, but idk if I should tell him I don’t wanna meet up anymore as I felt so much Shame after the hookup.  

I really fell used, and worthless. I regret having sex with him, he doesn’t even check in with me if I got home safe. I want him to know I’m hurt, but idk if that will be in my best interest 

TLDR: hookup that seemed very into me beyond sex but  doesn’t check up on me after almost 2 days. I want him to know that I got a little hurt but im assuming he wouldn’t care in the first place",dating,t5_2qhb1,https://www.reddit.com/r/dating/comments/oeow3s/feelings_of_depression_after_hook_up_what_to_say/
24,oep334,1625551711,I like someone but I can't get their attention,"I really like a girl and I want to ask her on a date, but there's a few issues. One, she has trouble trusting people, two, I'm afraid of rejection and losing her as a friend, and 3, I just can't get her attention in that way. I look for signs but I can't see any. I don't know if I should move on or what because it's really wearing on me and idk what to do. I really do want to tell her, I'm just afraid that if I do and she rejects me, things will get awkward and I'll lose her as a friend.",dating,t5_2qhb1,https://www.reddit.com/r/dating/comments/oep334/i_like_someone_but_i_cant_get_their_attention/
25,oep4gm,1625551881,im really angry at the world. why does it have to be like this. how can i accept it and move on?,[removed],dating,t5_2qhb1,https://www.reddit.com/r/dating/comments/oep4gm/im_really_angry_at_the_world_why_does_it_have_to/
26,oep55i,1625551969,Does it matter?,"I have been OLD for a few months and started out on Tinder but feel like I am scrapping the bottom after my last date recently. After that experience I thought I would give Bumble a try, since it’s a little more in depth so my question is, does it REALLY MATTER which platform I use? Better chances to find something meaningful on there or is it all the same?",dating,t5_2qhb1,https://www.reddit.com/r/dating/comments/oep55i/does_it_matter/
27,oep6kh,1625552153,Your Social Network is the Most Important Thing when it comes to finding potential dating partners,"Hey everyone, 23M here and I would like to share my thoughts on finding potential dates. For the last 5 years or so I've been attempting to use dating apps like Tinder, Bumble, and Hinge to find dates. After very little success (literally 2 dates in 5 years), I've given up on these apps. Dating apps just don't work anymore. I used to think it was the app's fault, but now I've realized online dating just really doesn't work. Most popular websites like Instagram, Reddit, Twitch, and various dating apps are still heavily male dominated. The result is men desperately trying to get the attention of a handful of women whose inboxes are flooded with messages from guys. Apps like Tinder are basically impossible to get dates on due to the dating market being so saturated with guys. Making yourself stand out in a sea of men is increasingly harder to do.

On top of that, I've found online dating for women poses several annoyances and risks many men tend to overlook. For women, meeting up with a guy she just met online can be dangerous, as she has limited information about the guy and if he truly has honest intentions (of course this works the other way around for guys, but rarely is a problem). Women also have to deal with a ridiculous amount of thirsty guys who do things like ask for nudes right away, act like simps, and/or send dick pics. In general, people are allowed to act wayyyyyyy worse online than they can in person, hence this behavior.

I've given up on online dating, but it made me think. . . how have other people done it? I've realized most people I know who are in relationships or at least have sexual partners didn't actually meet online. They usually met through a social network, mainly either school, work, church, some other organization, or mutual friends. It's kind of strange since these networks don't have the purpose of finding partners, but turns out they're much better at it than Tinder ever could be. These methods of meeting potential partners has several advantages I've never considered. I think the biggest one is having more information about the other person. When you meet a potential partner through one of these methods, you can usually find out more information about them through your social network. As a guy, I've realized having another person, especially a woman, vouch for you and your character can be useful when dating. This helps other women trust you and lets her know you're not dangerous. I think this is why many women use mutual friends to find them dates.

Using your social network also has other side benefits. Often times, it gives you and the other person something to talk about (i.e. work, school, mutual friends, ect.) It might also be easier to integrate them in your social gatherings if they're already in your network. Of course, the risk is if you two get serious and then break up, it could cause a rift in the social group so be careful.

Most of my family and friends met through one of these means. My parents met at college, grandparents through high school, two sets of aunts/uncles through college, one set of aunt/uncle through a company, my brother and his gf through high school, and a couple of my good friends met at our high school. I can't think of any serious couple I know well who met through Tinder or something similar.

The crazy thing is, I really figured this out through something called FetLife. I've recently gotten into the BDSM/Kink community. Most people in the BDSM community have a profile on Fetlife, which is like a kinky version of Facebook. There's a lot of guys on there that just try to use it as a dating service, and of course it doesn't work. They never get any responses to messages, and no one will meet up with them. The key is actually getting involved in the community and going to in-person events. When going to events (called ""munches""), you get your face out there, people start to recognize you and trust you, and you build friendships. This all helps your reputation, and can lead to more dates than just stalking profiles online. Your social network really helps, and you get to meet cool people!

Getting out of the kink world, I would say if you want to find more dates, build your social network. To do this, try to get involved in local events or communities in person (especially now since things are starting to open up again). Go out of your way to talk to new people and build connections. I will say don't do something for the SOLE purpose of picking up women (e.g.  if you don't like pottery, don't join a pottery class with the sole intent of dating, you will be miserable). If your only interests are all male dominated interests (gaming, sports, cars,), it's going to be a bit more difficult to follow this advice, but I'd still say socialize with people just to build community.

tl;dr: online dating doesn't work due to lack of trust, better to use social network since there's already established trust and reputation and you build community",dating,t5_2qhb1,https://www.reddit.com/r/dating/comments/oep6kh/your_social_network_is_the_most_important_thing/
28,oepcnw,1625552965,Is it a turnoff to women if a guy hasn’t “made it” yet by 31.,"I’m currently working as a bartender and am about to launch my own business which should be profitable within the next few months and has a lot of potential to make a lot of money down the road. I live in a smaller town and sold my car since I don’t need it, and had to move in with my mom since she lost her job due to covid layoffs and I’m helping her pay half the rent. Is this a big turnoff ??",dating,t5_2qhb1,https://www.reddit.com/r/dating/comments/oepcnw/is_it_a_turnoff_to_women_if_a_guy_hasnt_made_it/
