,all_awardings,allow_live_comments,author,author_flair_css_class,author_flair_richtext,author_flair_text,author_flair_type,author_fullname,author_is_blocked,author_patreon_flair,author_premium,awarders,can_mod_post,contest_mode,created_utc,domain,full_link,gildings,id,is_created_from_ads_ui,is_crosspostable,is_meta,is_original_content,is_reddit_media_domain,is_robot_indexable,is_self,is_video,link_flair_background_color,link_flair_css_class,link_flair_richtext,link_flair_template_id,link_flair_text,link_flair_text_color,link_flair_type,locked,media_only,no_follow,num_comments,num_crossposts,over_18,permalink,pinned,retrieved_on,score,selftext,send_replies,spoiler,stickied,subreddit,subreddit_id,subreddit_subscribers,subreddit_type,thumbnail,title,total_awards_received,treatment_tags,upvote_ratio,url,parent_whitelist_status,pwls,whitelist_status,wls,removed_by_category,author_cakeday,post_hint,preview
37,[],False,sexycouple676,,[],,text,t2_k3rstzux,False,False,False,[],False,False,1645897350,self.dating,https://www.reddit.com/r/dating/comments/t22m10/sex_advice/,{},t22m10,False,False,False,False,False,False,True,False,#ea0027,dating,"[{'e': 'text', 't': 'I Need Advice'}]",19ec58c2-9f74-11e7-81a1-0e2bf15991f0,I Need Advice,light,richtext,False,False,True,0,0,False,/r/dating/comments/t22m10/sex_advice/,False,1645897361,1,[removed],True,False,False,dating,t5_2qhb1,1161968,public,self,Sex advice,0,[],1.0,https://www.reddit.com/r/dating/comments/t22m10/sex_advice/,no_ads,0.0,no_ads,0.0,moderator,,,
38,[],False,LrdFyrestone,,[],,text,t2_8xe8tsvx,False,False,False,[],False,False,1645897373,self.dating,https://www.reddit.com/r/dating/comments/t22mbi/unless_asked_be_careful_about_giving_advice_or/,{},t22mbi,False,True,False,False,False,True,True,False,#ffd635,dating,"[{'e': 'text', 't': 'Giving Advice'}]",7bca2c58-4211-11e5-9ecb-0e60d8112001,Giving Advice,dark,richtext,False,False,True,1,0,False,/r/dating/comments/t22mbi/unless_asked_be_careful_about_giving_advice_or/,False,1645897383,1,"It's easy to forget sometimes.  You want to help but unless you're asked for it, sometimes you do more harm than good.

I have to remind myself this all the time. I see the discomfort cues and then back off if I do give unsolicited advice.",True,False,False,dating,t5_2qhb1,1161967,public,self,"Unless asked, be careful about giving advice or ideas when someone is upset.",0,[],1.0,https://www.reddit.com/r/dating/comments/t22mbi/unless_asked_be_careful_about_giving_advice_or/,no_ads,0.0,no_ads,0.0,,,,
39,[],False,sadbutfine01,,[],,text,t2_29ew6bxh,False,False,False,[],False,False,1645897393,self.dating,https://www.reddit.com/r/dating/comments/t22mkd/anxiety_over_unsure_feelings/,{},t22mkd,False,True,False,False,False,True,True,False,#00a6a5,dating,"[{'e': 'text', 't': 'Support Needed'}]",fd9c03b8-a1ce-11e7-9172-0e8c9f9ecf4c,Support Needed,dark,richtext,False,False,True,1,0,False,/r/dating/comments/t22mkd/anxiety_over_unsure_feelings/,False,1645897404,1,"This is a vent so don't feel pressured to read the whole thing.

Yesterday I (F21) decided to take a break from my relationship (I say I because unfortunately it was not something my boyfriend (M22) wanted initially). He was sad about it, but it was a relief to be able to tell him what I needed, and he understood. We've only been together for 2 months (dating or sleeping together since october). It is my first relationship and he is all I ever wished for in a man. In the beginning I wasn't very interested and never thought this would end in a relationship, but we got a long so well, the sex and intimacy was great and then we decided to be together in december. I've never felt more safe, calm and loved by a man before.

I don't know what happened two weeks in but as i remember it, intrusive thoughts just came out of nowhere: ""Do I really like him?"", ""Are we a good match?"", ""Will this work out?"" and ever since i've been really sad and gotten a lot of anxiety because of this back and forth (some days it has been all good but this week it has been horrible). He has been very sure of his feelings the whole time we've seen each other, whilst things have gone slower for me. I've never experienced anxiety before so it has been a bit traumatizing. The worst part is that he is the most amazing person ever, and he has showed me so much love and appreciation. I've never gotten that appreciation from someone else before, he has truly been the most amazing boyfriend ever, so I have no idea why I gotten these doubts from. He has been the most helpful person and one of my rocks during this, but it all has gotten a bit conflicting, when most of the anxiety regards thoughts about the relationship (I think?), and I've felt a bit bad for what he has had to gone through with me. It feels like half of the relationship have been him comforting me, which feels wrong.

The anxiety got so bad that I now decided that I need a break. He is very positive that everything will work out and all he wants is to be with me, which is what I hope for too. We had a good talk and spent some time together yesterday before parting ways. Today has been hell. I woke up and all I wanted to do was call him, the rest of the day has been switching from trying to calm down and crying so much because it hurts so much. All I want is to be able to have a healthy relationship with him, and i'm afraid that i feel we've gone too fast and therefore this break was inevitable, and that it feels a bit hopeless. So i go between feeling hopeless and thinking we have to break up but then thinking everything will be fine. I try to focus on myself but, I can't stop thinking of him and how much it will hurt if this ends (for me too, but he's madly in love with me and I care and love him too and don't want to see him hurt). The worst part is that he said ""I love you"" this week when I was feeling down, and even though I love him too it felt a bit too soon, but I know he only meant well (and i said I love him too but wishes to tell him ""for real"" when i feel better). I'm so scared to make the wrong decision that it hurts.

I will see a therapist on wednesday and wishes that I can see things clearer, but I try to not put too much pressure on that one meeting.

I know I should not force anything from myself and take this time to heal and try to figure my feelings out, but it is so hard. People are welcome to share their opinions, but in this time I would love to hear people who've been in a similar situation and what has gotten them to feel better/through the day.",True,False,False,dating,t5_2qhb1,1161967,public,self,Anxiety over unsure feelings,0,[],1.0,https://www.reddit.com/r/dating/comments/t22mkd/anxiety_over_unsure_feelings/,no_ads,0.0,no_ads,0.0,,,,
40,[],False,Unlucky_Ad_3686,,[],,text,t2_hyg8n6wg,False,False,False,[],False,False,1645897640,self.dating,https://www.reddit.com/r/dating/comments/t22pui/overwhelmed_or_unreasonable/,{},t22pui,False,False,False,False,False,False,True,False,#ea0027,dating,"[{'e': 'text', 't': 'I Need Advice'}]",19ec58c2-9f74-11e7-81a1-0e2bf15991f0,I Need Advice,light,richtext,False,False,True,0,0,False,/r/dating/comments/t22pui/overwhelmed_or_unreasonable/,False,1645897650,1,[removed],True,False,False,dating,t5_2qhb1,1161968,public,self,Overwhelmed or unreasonable?,0,[],1.0,https://www.reddit.com/r/dating/comments/t22pui/overwhelmed_or_unreasonable/,no_ads,0.0,no_ads,0.0,automod_filtered,,,
41,[],False,woodland-haze,,[],,text,t2_iad1z36m,False,False,False,[],False,False,1645897804,self.dating,https://www.reddit.com/r/dating/comments/t22rys/long_time_single_unable_to_develop_a_crush_on/,{},t22rys,False,True,False,False,False,True,True,False,#ea0027,dating,"[{'e': 'text', 't': 'I Need Advice'}]",19ec58c2-9f74-11e7-81a1-0e2bf15991f0,I Need Advice,light,richtext,False,False,True,1,0,False,/r/dating/comments/t22rys/long_time_single_unable_to_develop_a_crush_on/,False,1645897814,1,"I haven’t had a crush since I was 12.
Which isn’t a big deal, except now I’m 19 and have had no dating / relationship experience whatsoever.
I want to be able to fall in love with people, preferably people I already know. But if years have passed and I still feel nothing, I doubt someone is just gonna “fall out of the sky” soon. I’ve always been terrible at meeting people.
So I’m trying online dating as a last resort to find someone I like, but it just makes me nervous since I don’t know these people and I worry they’ll probably just judge me when they find out how awkward, lacking in self esteem, and inexperienced I am. 
I’m also a lesbian and neurodivergent so that probably limits my dating pool a lot. 

TL;DR completely inexperienced, neurodivergent, and sexual minority young adult worried that my inability to develop crushes + the turnoff of me being completely inexperienced and socially awkward as I grow older and older might mean I’ll be forever alone.",True,False,False,dating,t5_2qhb1,1161969,public,self,"Long time single, unable to develop a crush on anyone",0,[],1.0,https://www.reddit.com/r/dating/comments/t22rys/long_time_single_unable_to_develop_a_crush_on/,no_ads,0.0,no_ads,0.0,,,,
42,[],False,Hobomojoe,,[],,text,t2_1zkjyr3y,False,False,False,[],False,False,1645898729,self.dating,https://www.reddit.com/r/dating/comments/t23539/my_date_got_cancelled_i_got_unmatched_does_anyone/,{},t23539,False,True,False,False,False,True,True,False,#ff4500,dating,"[{'e': 'text', 't': 'Question'}]",a9531dce-194e-11e5-b177-0eff099c3d1f,Question,light,richtext,False,False,True,1,0,False,/r/dating/comments/t23539/my_date_got_cancelled_i_got_unmatched_does_anyone/,False,1645898739,1,Pretty much the title and I'm a little bummed out bc i was really looking forward to something. Yeah im in the northwest of England if that helps anyone.,True,False,False,dating,t5_2qhb1,1161966,public,self,"My date got cancelled, I got unmatched. Does anyone have any suggestions on what I can do tomorrow?",0,[],1.0,https://www.reddit.com/r/dating/comments/t23539/my_date_got_cancelled_i_got_unmatched_does_anyone/,no_ads,0.0,no_ads,0.0,,,,
43,[],False,BuiltLikeAStick,,[],,text,t2_7qb1w92d,False,False,False,[],False,False,1645898759,self.dating,https://www.reddit.com/r/dating/comments/t235hv/my_feelings_for_her_wont_go_away/,{},t235hv,False,True,False,False,False,True,True,False,#ea0027,dating,"[{'e': 'text', 't': 'I Need Advice'}]",19ec58c2-9f74-11e7-81a1-0e2bf15991f0,I Need Advice,light,richtext,False,False,True,1,0,False,/r/dating/comments/t235hv/my_feelings_for_her_wont_go_away/,False,1645898769,1,"I (21M) have been talking to this girl on two occasions, once in spring last year and the other around christmas time. The first time things went really well for a short while, before she changed and started to become more blunt and just seemed less interested so i stopped messaging her. Then towards christmas she messaged me saying she’d missed me and we started talking again, once again things went really well for a short while only for her to start acting uninterested. 

I’ve pretty much had feelings for this girl ever since the first time we spoke, and they just will not go away. I blocked her to stop myself messaging her because i know it will only go the same way again, but part of me really misses her and wishes we were still in contact. I just don’t know what to do.

TL;DR: feelings for girl won’t go away, she already seems uninterested after a short while, what do i do?",True,False,False,dating,t5_2qhb1,1161966,public,self,My feelings for her won’t go away,0,[],1.0,https://www.reddit.com/r/dating/comments/t235hv/my_feelings_for_her_wont_go_away/,no_ads,0.0,no_ads,0.0,,,,
44,[],False,Illustrious_Emu5396,,[],,text,t2_jbz8pal4,False,False,False,[],False,False,1645899440,self.dating,https://www.reddit.com/r/dating/comments/t23eqa/first_rejection_in_a_long_time_how_to_deal/,{},t23eqa,False,True,False,False,False,True,True,False,#00a6a5,dating,"[{'e': 'text', 't': 'Support Needed'}]",fd9c03b8-a1ce-11e7-9172-0e8c9f9ecf4c,Support Needed,dark,richtext,False,False,True,1,0,False,/r/dating/comments/t23eqa/first_rejection_in_a_long_time_how_to_deal/,False,1645899451,1,"I (31F) am super bummed out about a recent rejection and having a really hard time with it. Apologies for the long post in advance, this is a bit of a vent session too. This was my first true step in the dating world after being single for 4 years after a ending a long-term relationship. I don’t date often because I don’t choose to spend time with guys who I am not interested with, and in the past, guys I was interested with turned into long-term boyfriends so I don’t have a lot of experience in rejection from a dating stand-point. 

I started talking to a guy (33M) on OLD who was from my hometown. We had several mutual friends in HS, but were never friends. I was flattered that he liked one of my pictures and we talked online for about two weeks before I gave him my phone number and we moved to text for another two weeks, before he asked me out for dinner and drinks one Friday night. He lives far away and only comes into town on the weekends. 

First date went well, but he was definitely way more shy and awkward than any guy I’ve ever dated or even socialized with. When he did open up, he was funny and witty. I was also a little nervous because I am about 50+ lbs heavier than I was in HS, and I was worried he would be disappointed when we finally met in person. At the end of the date, he walked me to my car and hugged. I thought it went okay, but no major sparks and didn’t expect much out of it. 

After first date, he continues to text me everyday. Not long conversations daily, but he’d always check in once a day to see how my day was going. If I didn’t respond to his text the night before, he’d still text the next day. The next weekend, he asked me what I was doing Friday night but never made concrete plans. I mentioned that it would be nice to see him again and he asked me out to dinner that night. Afterwards, he invited me to go out for drinks with his friends afterwards. I felt like that was a great time. At the end of the night, same thing. Walked me to my car and a hug good night. We texted a little afterward and said thanks for going out, I know I twisted your arm a little. He said not at all, the whole point of coming into town Friday night was so we could hang out. 

Now - the rational mind in me is telling myself that this is not a love connection. I ignored a few red flags that I normally would find undesirable. He basically is a college student living in a 30-year old’s body. But, for some reason, I still found myself drawn to this guy. We text every day. He even sent a couple of flirty text messages which took my by surprise. I told him so and he admitted he was very shy but he was glad that I haven’t given up on him yet. We went on another dinner and drinks date and I felt like he opened up a lot about past relationships and his dating life in general. Still just a hug good bye and no kiss. 

Fast forward to this weekend, he invited me to an event yesterday that would have me meeting all his friends in the same place. I asked if it would be weird and he said no and even offered to hang out before to chill and have dinner at my house. We do that and right before the party (I literally changed and everything), he tells me that before I commit to going, that he didn’t see us dating and didn’t want to continue leading me on. I decided that it probably wasn’t a good idea that I go, opted to stay home and let him know no hard feelings. 

TLDR: I know this is a situation that probably happens often and it’s not an anomaly, but the rejection really stings. In hindsight, I should have checked in earlier to see where his head was at, but was worried that it might scare him off. Obviously, will not be making that same mistake again. I know in my heart that it probably wasn’t going to work out long-term and I should be grateful it ended sooner rather than later, but I just keep wondering where I went wrong.",True,False,False,dating,t5_2qhb1,1161963,public,self,First Rejection in a Long Time. How to deal?,0,[],1.0,https://www.reddit.com/r/dating/comments/t23eqa/first_rejection_in_a_long_time_how_to_deal/,no_ads,0.0,no_ads,0.0,,,,
45,[],False,Maho3126,,[],,text,t2_7s7duxq0,False,False,False,[],False,False,1645899461,self.dating,https://www.reddit.com/r/dating/comments/t23ezu/guy_ghosted_after_i_refused_to_hookup/,{},t23ezu,False,True,False,False,False,True,True,False,#00a6a5,dating,"[{'e': 'text', 't': 'Support Needed'}]",fd9c03b8-a1ce-11e7-9172-0e8c9f9ecf4c,Support Needed,dark,richtext,False,False,True,1,0,False,/r/dating/comments/t23ezu/guy_ghosted_after_i_refused_to_hookup/,False,1645899471,1,"I met this guy from hinge on paper he seem great,
I wanted a relationship and causal as well and he seem gamed for it.
Well for the past week being in school I've been so busy and he been begging to see me take me out.
Yesterday I told him i will see him for 30 minutes,he just wanted to see me.
Well I hung out in his car we made out talked kissed his hands all over me.
I said we might can have fun time next week,he said he wanted me naked in his bed today.
So he pulled out his private and this is daytime and asked me to suck it,I joked and said do me as well and he said his car to little. Well
I told him I had to go his kiss and enthusiasm went out the window,I told him text me when he got home,never did ignored my texts and today he knew it was my birthday.
I cried alot because usually I'm the girl to give it up and get ghosted and now I'm trying to change and not giving it up im ghosted as well🤧",True,False,False,dating,t5_2qhb1,1161963,public,self,Guy ghosted after I refused to hookup,0,[],1.0,https://www.reddit.com/r/dating/comments/t23ezu/guy_ghosted_after_i_refused_to_hookup/,no_ads,0.0,no_ads,0.0,,,,
46,[],False,Ortzi7,,[],,text,t2_3bo4m13r,False,False,False,[],False,False,1645899684,self.dating,https://www.reddit.com/r/dating/comments/t23hyt/small_ears/,{},t23hyt,False,True,False,False,False,True,True,False,#ff4500,dating,"[{'e': 'text', 't': 'Question'}]",a9531dce-194e-11e5-b177-0eff099c3d1f,Question,light,richtext,False,False,True,1,0,False,/r/dating/comments/t23hyt/small_ears/,False,1645899695,1,"Question for women, (and men why not) do you think little ears are attractive ?",True,False,False,dating,t5_2qhb1,1161961,public,self,Small ears ?,0,[],1.0,https://www.reddit.com/r/dating/comments/t23hyt/small_ears/,no_ads,0.0,no_ads,0.0,,,,
47,[],False,OutcastByChoice,,[],,text,t2_9myipoyt,False,False,False,[],False,False,1645899866,self.dating,https://www.reddit.com/r/dating/comments/t23kd1/is_it_normal_what_am_i_doing_wrong/,{},t23kd1,False,True,False,False,False,True,True,False,#ffb000,,"[{'e': 'text', 't': 'Tinder/Online Dating'}]",5214d2ac-61f1-11e8-8bb1-0ed15e4a39c0,Tinder/Online Dating,dark,richtext,False,False,True,1,0,False,/r/dating/comments/t23kd1/is_it_normal_what_am_i_doing_wrong/,False,1645899876,1,"I Am a 26-year-old male living in Brazil, am 179cm tall… and overall dating has always been hard for me. In high school I only dated one girl for 3 months (and I studied there for 6 years)…

Well I’ve been out of High School since 2013 and have to rely on dating apps since I don’t go out much.

I believe due to my persistence my dating life recently got something of boost and I was able for the first time to date young, very attractive girls in their early to mid-20s. With 2 such encounters in a span of 2 weeks. 

But noticed a pattern: both of these girls had no intention of pursuing anything serious or lasting. They only wanted a guy to kiss and cuddle for a while and that’s it. While I feel flattered that this type of girls are interested in me at all, I really wish I would meet someone to settle with. Being 26 and jumping from girl to girl feels unnatural.",True,False,False,dating,t5_2qhb1,1161962,public,self,Is It Normal? What Am I Doing Wrong?,0,[],1.0,https://www.reddit.com/r/dating/comments/t23kd1/is_it_normal_what_am_i_doing_wrong/,no_ads,0.0,no_ads,0.0,,,,
48,[],False,NotaRobot1500,,[],,text,t2_pbh3u8b,False,False,False,[],False,False,1645899902,self.dating,https://www.reddit.com/r/dating/comments/t23kt8/hooked_up_with_a_friend_caught_some_feelings_how/,{},t23kt8,False,True,False,False,False,True,True,False,#ea0027,dating,"[{'e': 'text', 't': 'I Need Advice'}]",19ec58c2-9f74-11e7-81a1-0e2bf15991f0,I Need Advice,light,richtext,False,False,True,1,0,False,/r/dating/comments/t23kt8/hooked_up_with_a_friend_caught_some_feelings_how/,False,1645899912,1,"
Me (30 M) went to a wedding two weeks ago and roomed with a mutual friend (28 F) that I’ve know over a long period of time but I’ve only briefly interacted with when get together were planned. It was all very fast in the sense we woke up after hooking up and had to go wake up the other friends in other rooms to go to the airport and had no time to interact after waking up in the king bed. 


She is pretty busy so it’s been tough to get her to come to the reunions our friends have planned in the last two weeks. I feel like I could casually just tell her that I got some feeling and would like to spend some time together to get to know her better. Here’s the kicker, another good friend of mine is interested in her after the wedding. We both talked about it since he disclosed it to me and I told him I had intentions of asking her out and told me to go ahead but I know he is still interested. He previously told the former bride and I don’t know how much she is helping him but I feel I need to make a move soon. I asked her when she is not working (she is a nurse) but hasn’t answered. She had to be at the hospital at 6am. I feel like I want to be more direct and tell her I want to have some coffee with her (and maybe tell her I want to talk to her about something?) 


What do you think could be the best move to make to meet her as soon as possible?",True,False,False,dating,t5_2qhb1,1161961,public,self,"Hooked up with a friend, caught some feelings. How do I approach communicating it?",0,[],1.0,https://www.reddit.com/r/dating/comments/t23kt8/hooked_up_with_a_friend_caught_some_feelings_how/,no_ads,0.0,no_ads,0.0,,,,
49,[],False,shortbeard21,,[],,text,t2_tzkqx1i,False,False,False,[],False,False,1645900009,self.dating,https://www.reddit.com/r/dating/comments/t23m76/update_advice_on_how_start_keep_a_conversation/,{},t23m76,False,True,False,False,False,True,True,False,#ea0027,dating,"[{'e': 'text', 't': 'I Need Advice'}]",19ec58c2-9f74-11e7-81a1-0e2bf15991f0,I Need Advice,light,richtext,False,False,True,1,0,False,/r/dating/comments/t23m76/update_advice_on_how_start_keep_a_conversation/,False,1645900019,1,"Update to: https://www.reddit.com/r/dating/comments/s9spgy/advice_on_how_start_keep_a_conversation_going/

Update: I'll try and make this brief. So it turns out we both really like John Candy the actor. I made a post about what movie would you pick to test someone. To see if you're a great match. I said either Uncle Buck or what about Bob. She said we should watch a movie together since we have similar taste. So far we haven't do to me having crappy internet. But that's led to us talking more. 

She messaged me out of the blue the other day. Just to say hey and talk about the Bible study she's going to. We had a bit of an airplane Leslie Nielsen moment. I asked her what the Bible study was about? She said they talked about books of the Bible. I said yeah it's a pretty good book. she thought that was pretty funny. Later I shared a selfie of my hair all messed up. Said I forgot to put a hat on and went to the store like that. She thought it was cute. She then shared a selfie she took. She looked great as always. But basically said she's been feeling gross lately do too gaing weight. I told her she was far from gross. I also said you can't weigh awesome and that's the only scale that counts. She appreciated it and laughed. She even messaged me the next morning just to say hey. 

But now I've got a new problem. The group were a part of has made today saddie Hawkins day. Basically guys put their name and selfie in the comments. Then girls can DM them to ask them out. She hearted the post and said aww yeah. I liked the post. I'm just not sure if I should put my name down in the comments. I know that their is a few other girls that probably like me in the group. But I definitely don't want messages from them. I only want a message from this one specific girl. So I can't decide if I want to put my name down or not. I'm pretty sure she like likes me but I'm not sure if she's just being nice.",True,False,False,dating,t5_2qhb1,1161962,public,self,Update Advice on how start / keep a conversation going.,0,[],1.0,https://www.reddit.com/r/dating/comments/t23m76/update_advice_on_how_start_keep_a_conversation/,no_ads,0.0,no_ads,0.0,,,,
