,id,created_utc,title,selftext,subreddit,subreddit_id,url
25,mhqm0t,1617264546,Is there something wrong with me?,"For context, 

I am a 24 year old woman living in Western country. 

I have never had a boyfriend or anything more than a couple months. 

I feel very inadequate and feel like my worth comes from being somebody's girlfriend.

Ill admit Im a bit of a romantic as I enjoy the cute little things like gifts for your significant other. I feel like Ill never be able to have a boyfriend and am destined for a life alone. 

Everyone around me is finding their partner and I feel like my expiry date has passed. 

I know it sounds transactional and all but it just feels like theres a barrier Im not able to break. Dating is so hard and weird.   
Im very introverted so dating apps is basically my go to. 

I wish I could find someone with the click of my fingers. Its quite sad. 

Rant over.",dating,t5_2qhb1,https://www.reddit.com/r/dating/comments/mhqm0t/is_there_something_wrong_with_me/
26,mhqoqy,1617264921,Is he just not that into me?,"So I’ve been seeing this guy, and his communication has been terrible. He will message me like once every three days, I called him out on it and he said this. Basically telling me he’s really busy right now. He does have a pretty serious car business and is in school full time &amp; working but I just feel like responding once every three days is insane to me. He also is apparently a terrible texter and prefers to talk in person. Is he just not interested in me? What is the truth? And what do other see when they here this situation?

“I get that you want to be pursued and all the traditional stuff. I’m a traditional guy too, but at some point life gets more untraditional then what we’re used to. Understanding what phase we’re both in at this moment in life and cooperating with it is really important rn. You have an idea of the stuff of I am doing right now, my degree, my business and a new career in real estate. All those require a lot of learning and dedication. You should know that and be able to cooperate and be supportive of me in that way.

sidenote - this is an ex I dated a couple years ago, he came back into my life telling me he wanted to take things seriously with me and wanted a relationship",dating,t5_2qhb1,https://www.reddit.com/r/dating/comments/mhqoqy/is_he_just_not_that_into_me/
27,mhqqoz,1617265176,An advice i read that I want to repeat/share,"I just wanted to post it here in case it helps someone. It has helped me a few times.

Whenever im very sad about an unrequited love and I cant let a person go even after we have stopped talking, i usually spend nights ""laying alone, with my head on the phone, thinking of you till it hurts"" and sometimes crying.

However hard it is, i try to convince myself they also are not thinking about me. I dont go as far to think about why. I just think ""fuck them, they are not thinking about me, so im not going to waste my evening on them either"".

Granted, i also channel the times she left me standing there into anger for bench pressing. I still can't forget the person but i waste less time now, I hope this helps other people too.",dating,t5_2qhb1,https://www.reddit.com/r/dating/comments/mhqqoz/an_advice_i_read_that_i_want_to_repeatshare/
28,mhqzd4,1617266384,my partner (M31) doesnt want sex when im on my period,"i (F23) have a fairly new bf (M31) - weve been dating for about four months now. everything is perfect - sex is awesome, im really falling for him etc. = just UNREAL really i like him a lot

but whenever im on my period, we dont have sex. seems legit. but my friend just told me that she always has sex on her period and that her bfs never cared. (i then asked most of my female friends and most do have sex with their partners on their period).

so yesterday i told my bf that im supposed to get my period today (which i did) and were supposed to spend the whole weekend together (our first weekend together like this) - so id love to have sex with him all the time this weekend. so i told him about my period and asked him if hed care having sex on it (as i wouldnt) and he seemed a bit hesitant, so i felt hed rather not.

and now im having an inner dilemma - one part of me thinks that period should be really normalized and having sex on it should be ok, wed just extra clear ourselves before and after. so that part of me is a bit sad/annoyed that hes making a deal out of it. but the other part of me is really understanding, its just something hes obviously not comfortable with, so no prob, ill obviously not push him into anything and well just wait for a few days and enjoy the weekend doing something else than sex haha. 

so my question is what are your stances on period sex and to what extent should i (or anyone) accept that your partner doesnt want period sex and be understanding or are my negative thoughts about his dissmisal reasonable?",dating,t5_2qhb1,https://www.reddit.com/r/dating/comments/mhqzd4/my_partner_m31_doesnt_want_sex_when_im_on_my/
29,mhri4x,1617268853,"Why does it always have to be me to give guys multiple chances? Is it the dopamine I get? Coz im pretty much a loner. But finally found solace in my own company. And happiness. As soon as a guy comes, he just topples and crumbles it all. I hate being vulnerable. Should I not date?",[removed],dating,t5_2qhb1,https://www.reddit.com/r/dating/comments/mhri4x/why_does_it_always_have_to_be_me_to_give_guys/
30,mhril0,1617268914,Should I stop cutting peoples' slack? And treat em as they treat me?,"Why does it always have to be me to give guys multiple chances? Is it the dopamine I get? Coz im pretty much a loner. But finally found solace in my own company. And happiness. As soon as a guy comes, he just topples and crumbles it all. I hate being vulnerable. Should I not date?",dating,t5_2qhb1,https://www.reddit.com/r/dating/comments/mhril0/should_i_stop_cutting_peoples_slack_and_treat_em/
31,mhrnyy,1617269644,I(24m) feel really insecure about my girlfriends (24)ex boyfriend who is a NFL player. How do I feel less insecure?,[removed],dating,t5_2qhb1,https://www.reddit.com/r/dating/comments/mhrnyy/i24m_feel_really_insecure_about_my_girlfriends/
32,mhrp8r,1617269811,Guy that I’m talking to recently out of a 5 year relationship,"I met this guy a few weeks ago at the local pub, since then we would have a chat at the pub while we were both there. He then added me on Instagram and we started to talk on there - on and off. Last weekend we were both out and decided that I would come and meet up with him at his mates place. We ended up kissing and stayed the night at his mates place and caught an Uber to his place (he still lives at home with his parents) the next morning. When we got inside and after we went in his room, he came in and asked if I wanted to meet his mum. So I went out and met her. As we were leaving so that he could drop me home his mum asked were I lived and said “that will be a bit further away when we move into our new place”, my interpretation is that it was hinting I would see him again. Since we’ve been talking and he’s been saying things like I looked so good the other night, we should go out for dinner and hang out this coming weekend. He is a really nice guy and we get along so well. I’m genuinely into this guy and am starting to like him as more than a friend but I don’t know how I feel about the fact he’s recently been in a 5 year relationship and not knowing exactly when it was they broke up except that it was recent. Should I just see where it goes with this guy or is it risky?",dating,t5_2qhb1,https://www.reddit.com/r/dating/comments/mhrp8r/guy_that_im_talking_to_recently_out_of_a_5_year/
33,mhs2ur,1617271534,Do you guys think I did the right thing?,"About 2 years ago I met this girl off tinder, I loved her but things didn't workout. We dated for about 7 months. I still think of her.The problem was she had some red flags

* She had a really big sexual past, she'd been with at least 50 different guys
* She said her ex was  psycho, abusive, cheater and a narcissist , she didn't tell me why it ended or why she stayed with him. She still wore his jjacket.
* She posted selfies on instagram in her bra and panties
* She told me she thought all men lie and cheat because her dad had an affair
* She dressed really tarty heavy make up, fake lashes, excessive perfume, super short squirts, low cut tops with boobs/bright red bra out
* Super insecure and had little to no self repsect for herself
* Was really immature, irresponsible.
* Wwas reallly needy and clingy e.g. she cried a few times when i couldn't see her and she would always say ""sad"" ""ignore""  when i didn'ttext back straight away

there were many other things

I always think if i did the right thing or not by not deciding to have a serious relationship wih her?",dating,t5_2qhb1,https://www.reddit.com/r/dating/comments/mhs2ur/do_you_guys_think_i_did_the_right_thing/
34,mhs5fv,1617271846,Please give me advice,"I am dating guy and when we are together everything is perfect beetwen us. When we are not together he doesn't contact me so often. 
We talked about that and he told me he doesn't want to obligate and define our relationship. He says he likes me and likes spending time with me but he still doesn't feel anything emotional. He says that he doesn't want someone get hurt in our story.
My opinion is that he likes me and he feels something but he stop his feelings because he is scared. He told me that he doesn't let that emotions control him and that he learned how to control them. 
What should I do now? Let him go or fight for him?",dating,t5_2qhb1,https://www.reddit.com/r/dating/comments/mhs5fv/please_give_me_advice/
35,mhs76o,1617272060,Question,"Have you ever been in a situation where your SO has told you to stop being friends with a specific person? If so, what was the reason and did you cut ties with said person? I often have found myself (not anymore) in this situation where I was the friend getting cut off.",dating,t5_2qhb1,https://www.reddit.com/r/dating/comments/mhs76o/question/
36,mhsno5,1617274061,If someone cancels a third date because they are ‘sick’ would you just assume that it’s an excuse and that they aren’t interested?,"I.e sorry can we reschedule I’m sick. 

Most of the time, this is an excuse right?",dating,t5_2qhb1,https://www.reddit.com/r/dating/comments/mhsno5/if_someone_cancels_a_third_date_because_they_are/
37,mhsnp6,1617274064,Dating anxiety sucks,"I always feel like I’m annoying a guy that I’m dating. 3 years ago I was verbally abused by a guy for 6 months and he always told me I was annoying/a burden. Even with a lot of therapy, it comes back to haunt me when I start dating someone 
For example, if I message/snap a guy I’m dating and they don’t see it right away (like within 2 hours) I automatically think they are sick of me and will leave me. Or they are planning to leave me. 
I am mindful of sending messages. I’m not the kind that texts/snaps every 2 minutes. I sometimes get too ahead of myself and may send too much in an hour, but I’ve learned to be mindful of this. 

Anyone else feel this way?",dating,t5_2qhb1,https://www.reddit.com/r/dating/comments/mhsnp6/dating_anxiety_sucks/
38,mhsnrp,1617274072,Being ugly really affects every corner of my existence and I’m not sure I can cope much longer,"(22M). I get ignored by women. Most never make eye contact with me at all the same way I literally watch those same women and observe them make eye contact with the hotter guys. What is the point of putting in effort in yourself if it becomes unrecognised because of ugly genetics. I’m naturally of skinny built so by nature working out won’t show much difference of me as I have been training hard for the last six years. I have good hygiene and I am very clean most days of the week. I try to be happy and have hobbies and interests. But most people I know who are in relationships have *none* of these things, because they are not ugly and don’t need them!",dating,t5_2qhb1,https://www.reddit.com/r/dating/comments/mhsnrp/being_ugly_really_affects_every_corner_of_my/
39,mhsqim,1617274415,I learned to give a f*** about the people who dont reply back,"So my last gf broke up with me at the start of 2021.
That shit hit me hard and I was not sure if I will find someone new I will/can love.
She cheated on me with some other dude in her neighbourhood.
I got tinder last week and finally learned to give a f*** about the people who dont reply back in 2 days.
A lot of the girls out there match with you, read your message but dont reply back.
Just fucking block them / delete the match and you feel so much better.
They dont care texting you back so you should not care blocking them.

Hate me for this but its the truth.",dating,t5_2qhb1,https://www.reddit.com/r/dating/comments/mhsqim/i_learned_to_give_a_f_about_the_people_who_dont/
40,mhtjr1,1617277628,Will Facebook auto login lovoo app?,[removed],dating,t5_2qhb1,https://www.reddit.com/r/dating/comments/mhtjr1/will_facebook_auto_login_lovoo_app/
41,mhtjtd,1617277636,"Saying “nice to meet you” while making out, what does that mean ??","So I just dated a guy last week, we found a good place to eat and drink a little bit, everything goes while, and he just started to make out with me, kiss my neck and cheek all that stuff, except lips (I just said no to him lol). 
After we leaved the restaurant, I thought we are going back to our own home but he just took me to a park and hugging me making out with me again, I had to said it feels sooooo good but I just don’t want thing to go that fast, so I keep said no whenever he tried to kiss my lips. And he just look at me and said “it’s nice to meet you” lol I replied“me too?!” And we just kept making out. 
I know it’s just a casual date, but what does saying “ nice to meet you” while making out mean ? Does that mean nice to meet you and I wanna fuck you ? Lol",dating,t5_2qhb1,https://www.reddit.com/r/dating/comments/mhtjtd/saying_nice_to_meet_you_while_making_out_what/
42,mhtol6,1617278157,My experience online dating during lockdown!,[removed],dating,t5_2qhb1,https://www.reddit.com/r/dating/comments/mhtol6/my_experience_online_dating_during_lockdown/
43,mhtuzc,1617278801,Why do my online dating convos always seem to fizzle out?,"I’ve been having this issue where all my online dating conversations seem to fizzle out and die fairly quick. I keep messaging but after 5 or so messages the girl stops. I’m wondering why this might be. I included a selection of messages below which corresponded to roughly the point where the convo died. I’m wondering if you guys might give me some pointers. ( there’s allot, feel free to read as much or as little as you want).

Some general patterns of mine:
- I generally respond in 1-6 hours to a given message.
- Usually paragraph format, not overly long( IMO), but I’m almost always the one sending longer messages 
- I’m a bit prone to typos and grammatical errors 

My messages : https://imgur.com/a/xPamWMz

My profile: https://imgur.com/a/otZMLZG

Thanks so much!",dating,t5_2qhb1,https://www.reddit.com/r/dating/comments/mhtuzc/why_do_my_online_dating_convos_always_seem_to/
44,mhtvyt,1617278901,"I didn’t know dating would be this hard, do people have similar situations like this?","A common theme I run into: 

Talk to someone on a dating app, exchange numbers. Conversations go well, ask to talk on the phone, they agree, but either have last minute excuses or not hear from them anymore.

Scenario B; talk to someone on dating app, exchange numbers, we do talk on the phone with no problem, set up a date, not hear from them again on the day of the date or last minute excuse.

I don’t get this and it happens a lot. I usually like to talk on the phone/video chat within the first few days because it seems like people flake if you hold out too long, and for myself, texting for weeks has no mental stimulation for me and I’ll start losing interest. Words on a screen only go so far.

But both of those scenarios happen a lot, even when they seem super interested. It’s really putting me in a bad spot because it’s mentally exhausting getting to re know someone new  multiple times because people can’t communicate and rather ghost you.",dating,t5_2qhb1,https://www.reddit.com/r/dating/comments/mhtvyt/i_didnt_know_dating_would_be_this_hard_do_people/
45,mhu3ks,1617279675,28F went on my first date tonight :),"It went great, he was super lovely, funny and easy to talk to. The only thing is, I'm not great at initiating or reading the physical cues....there was an opportunity at the end of the date when he dropped me home that I could've stayed and chatted a bit longer, and maybe it would have ended with a kiss. But I was really unsure how he felt about me so I basically just said goodnight and left. Tbh he was a little awkward with it too, so it felt overall quite friendly. I'll txt him tomorrow to let him know I had a great time and would like to go out again. He knows I'm new to online dating but I doubt he realizes that was my first ever date....should I bring it up and when? Eventually I'll need to address my inexperience in case it's a dealbreaker for him. If you were in his position, would you want to know asap or would it not really matter as long as you were into her?",dating,t5_2qhb1,https://www.reddit.com/r/dating/comments/mhu3ks/28f_went_on_my_first_date_tonight/
46,mhuidv,1617281130,Does anyone else really have zero interest in going on dates anymore?,"It’s almost always disappointing and frustrating, I’m sick of paying for useless dinners

I would rather do something I know I would enjoy than drag myself through a nerve-racking ordeal that usually doesn’t lead to a second date.",dating,t5_2qhb1,https://www.reddit.com/r/dating/comments/mhuidv/does_anyone_else_really_have_zero_interest_in/
47,mhus45,1617282048,Has anyone went on a date with someone who can't speak English fluently?,"I received a super like on Tinder from this man from Korea visitng my state. I didn't think much of it because super likes are usually by accident. 

Well, we ended up speaking and we seemed to be compatible through chat. (He can write English fine.) 

We are making Friday night plans and tells me he finds it hard to understand people verbally and to speak full sentences. 

How did you go about this situation? 

We are going to an arcade so it's not much conversation happening and I said I would learn a few key Korean words.",dating,t5_2qhb1,https://www.reddit.com/r/dating/comments/mhus45/has_anyone_went_on_a_date_with_someone_who_cant/
48,mhuuh5,1617282247,Taking it slow??,[removed],dating,t5_2qhb1,https://www.reddit.com/r/dating/comments/mhuuh5/taking_it_slow/
49,mhuuq0,1617282269,How do you politely ask a guy if he's just looking for sex?,"I met this guy through a mutual friend a couple years ago. We didn't really talk much at first. Two years later I started a new job and he works at the same place and trained me. 

We became close really quickly. We started officially dating about a week ago. He has spent the night at my place every night the last few days. We have had sex like five times already. Tuesday night we had sex in the car, then had sex at work in the bathroom last night. Then once again a couple hours ago. 


Seriously we are fucking like rabbits. We do other things too but we mostly just have sex. He is the first guy I've had sex with. I have given bjs and been fingered but never penetration. 


I wonder if he actually likes me or just wants sex. He is the one that initiates it. 

---
**tl;dr**: Guy I'm dating only seems to want sex. I don't know if he actually likes me or just wants sex.",dating,t5_2qhb1,https://www.reddit.com/r/dating/comments/mhuuq0/how_do_you_politely_ask_a_guy_if_hes_just_looking/
50,mhux0x,1617282466,They will survive without you,"To all those who say that they don't want to break up with him/her because they don't want to hurt his/her feelings. You know what? You'd be surprised how many people don't care and don't have hurt feelings so don't value yourself that high by thinking that this person won't survive without you. He/she will survive. The question is how much it is I ""don't want to hurt his/her feelings"" and how much ""I will keep him/her until I find someone better""...? Be honest with yourself",dating,t5_2qhb1,https://www.reddit.com/r/dating/comments/mhux0x/they_will_survive_without_you/
51,mhv56p,1617283181,LDR,Who’s in favor of having a long distance relationship? Will you do it for love or would you rather be with someone you could be with in person?,dating,t5_2qhb1,https://www.reddit.com/r/dating/comments/mhv56p/ldr/
52,mhvpus,1617285002,29yo Male Dateless Virgin,"This is something that has been bugging me for a while now. I am a (almost) 29 year old male. I have a full time, well paying job. I pay taxes, I live on my own and I am completely independent. I have never had a gf, never really been on a date and I didn't even kiss a girl until I was 26 (seriously it's the only intimate interaction I've ever had with a female, not even cuddling or shit like that and it only happened once). I went through 4 years of college with no success and have had none since. I have tried online dating with absolutely no success whatsoever (I've even gotten to the point where I swipe right on EVERYONE and still nothing) on the rare occasion I do match with an online dating service, I tried to message and they rarely ever get back with me and on the super rare occasion they do message me back, they'll usually only talk to me for a bit before just stop replying. I am not a misogynist, bigot, a**hole etc or some right wing d****. What the f*** is wrong with me? Ill admit I can be a little eccentric at times and I know I am really really short for a man (5'5"") but damn. Am I just destined to be alone?",dating,t5_2qhb1,https://www.reddit.com/r/dating/comments/mhvpus/29yo_male_dateless_virgin/
53,mhvxw2,1617285687,How to find some one to chat in this app?,"I've been on Reddit about a year now but still, I haven't met anyone with whom I could chat in a meaningful way ... If you are up for the task text me anytime 😉",dating,t5_2qhb1,https://www.reddit.com/r/dating/comments/mhvxw2/how_to_find_some_one_to_chat_in_this_app/
54,mhw0c4,1617285892,Why do people think adding me on a different social media platform after flaking on our date makes me forget about it? It's unbelievable how stupid people are.,"Don't know if any of you have experienced this, but I \[28M\] have had a few times over the years being on and off online dating the following progression:

1) Match with a girl, we get chatting. 

2) Chat goes well! We arrange a date, we exchange numbers, move things onto whatsapp.

3) Keep the chat chill but engaging leading up to the date, ask them the day before if they're still up for it, always a yes.

4) Day of the date, no word, then when I message ""on my way see you soon"" I get a flaked on with ""ah sorry I can't make today, completely forgot I had plans, I'll let you know when I'm next free"" 

5) I begrudgingly respond with a ""no worries!"" and then move the chat to archive and just don't bother to chase them, because hey, someone who flakes at that short notice just isn't worth it.

6) Weeks, sometimes months later, I get an add from them on instagram, snapchat or whatever being like ""hey hows it going? remember me?"" Snapchat is the worst one because then they just plague me with selfie after selfie after selfie which you know is being sent to a mass of people, then I get accused of being ""quiet"" because I don't respond to them. 

Like... I've even had before where one girl said ""hey yeah it's me we were supposed to hang out, don't know what happened but we never did"" LIKE WTF then I calmly remind them that THEY flaked and then they get all uppidy about it. Another scenario, a girl months after flaking added me on instagram and said ""I recognise you from somewhere, but don't know where.. but you're cute so hey"" 

Are people REALLY this stupid!??",dating,t5_2qhb1,https://www.reddit.com/r/dating/comments/mhw0c4/why_do_people_think_adding_me_on_a_different/
55,mhw1a4,1617285970,Dating after breakup,Roughly 6 months ago me and my gf of nearly 3 years split up. I've been going on dates but I haven't felt anything akin to the spark I felt with my ex. On top of that when I find myself talking to women I always go for the ones that mirror the qualities of my ex. I have 2 questions. Is that normal to go for women that mirror the qualities of your ex? and Should I stop trying to date right now since Im not getting any sort of spark?,dating,t5_2qhb1,https://www.reddit.com/r/dating/comments/mhw1a4/dating_after_breakup/
