,id,created_utc,title,selftext,subreddit,subreddit_id,url
76,mhy4dp,1617292034,People with bad communication skills,"Are the worst.

So I had been going on dates with this person for a few weeks. Things had been going slowly but well, and we had planned on going a date this past Monday. I texted her on Friday trying to throw out some date ideas, and all of a sudden she stopped responding. She doesn't text all weekend, either.

Now I'd gotten the sense that her interest was waning so I thought that if her not texting back means she really isn't that interested she should tell me. So when Monday came along and she doesn't say anything, I'm thinking ""what the fuck"". It wasn't until I texted her two hours before we were supposed to meet that she calls me ""to be honest"" and say she ""wasn't feeling it.""

I'm not mad about the fact that things ended. What I am mad at was how it ended. I didn't get the sense that she was going to text me had I not said anything; maybe it's the cynic in me, but I feel she would have been more than fine ghosting if she could get away with it. Good riddance. 

But seriously, though, why are people so bad at communicating?",dating,t5_2qhb1,https://www.reddit.com/r/dating/comments/mhy4dp/people_with_bad_communication_skills/
77,mhy8i8,1617292354,how am I supposed to go and date and have a healthy dating lifestyle if the goverment keeps closing buisness every 2 week,how am I supposed to go and date and have a healthy dating lifestyle if the goverment keeps closing buisness every 2  week and also I have been taking care of my at risk parent I am not too fan about virtual video call dates,dating,t5_2qhb1,https://www.reddit.com/r/dating/comments/mhy8i8/how_am_i_supposed_to_go_and_date_and_have_a/
78,mhyikk,1617293091,I'm giving up on all things life.,"I'm giving up on living later today. Everything is either bad, sad, or a combination of both. This past year has especially brought the worst out of everyone, and I'm beyond exhausted, plus isolated and feeling very detached where as others aren't. When it comes to dating and anything relating to that? Completely hopeless. I don't know why I try. It's as if trying to meet anyone these days is just a neverending string of disappointing experiences or crossing paths with people who have no other end game beyond a self-esteem demolition derby in trying to dunk on you or reject you because it evidently makes them feel good about themselves, or because they can (i.e. they always have options, so they could give a fuck about how they treat others on their way to getting whatever they want from this life.)

I don't want to live in this world anymore. This place sucks. Get me out of here. So that's what I'm doing -- I'm going. Everyone disappears anyway.",dating,t5_2qhb1,https://www.reddit.com/r/dating/comments/mhyikk/im_giving_up_on_all_things_life/
79,mhyogu,1617293520,Should i just move on,"Its been since december since I've been blocked by this girl who really liked me and i really liked her but after our first date it was really just a one and done hookup which is what i told her i hate, having sex and never speaking again. This one really hurts though because we had a lot in common and she seemed genuinely into me, but after that first night she flaked on me for a wine and cuddles night (only thing we could do because of lockdowns) and started being cold when I was talking about doing more things than just sex. I feel like i wasn't intimate withh her enough before having sex and was coming off as a person who just wants sex. I deleted her because it really hurt that she just completely lost interest in me and would barely text me back anymore or respond to stories and i couldnt handle seeing her stories at the time or her private stories. Flash forward 3 months to today, and i feel like ive gotten stronger about my emotions and been taking care of myself and my focus isnt on women. But now I really miss her aura/vibe and wanted to see how she was doing and made a new snapchat to text her which is bad enough i assume. She added me last night and i texted her this morning a couple jokey texts about how the $1400 stimulus check reminded me of 1400 lies i told her and how i wish i was the irs so i could tax them back. She was responding well and asked who it is, and i sent her pictures and told her she didnt have to respond.. and that i hope all is well with this little emoji❄️
She then said Lmaooo😂 You're too much
I didnt expect it to be you
Im good lol
That hit me hard asf and i assumed she meant shes good on talking to me again, but looking at our convo I think she migjt have meant she's doing good but i guess ill never know because I left her on read so as not to be even more annoying and viewed her most recent stories, and about an hour later I was deleted. Atleast not blocked this time, but it seems as though she never wants me to contact her again. Should I have given her more time or just moved on when i had the chance.. It's been 3 months and i still think about her atleast once a day even when I try my hardest not to, it just seems like I'll never be able to get over her and even if i did find a new girl it just seems like it'll be to fill the void she left. I wasn't looking for anything at all before she added me on snapchat back in september of 2020, was completely happy by myself, and now my chest hurts and it feels like im just going to guard myself from ever loving someone after going through this talking stage and fucking up by having a sort of soul bond with someone who considered me a quick fling. Also her privacy settings are set to friends only, so i can no longer view her stories or even chat with her which is the main thing i enjoyed was talking to her and joking around.",dating,t5_2qhb1,https://www.reddit.com/r/dating/comments/mhyogu/should_i_just_move_on/
80,mhyojx,1617293527,Dating older women,"I’m 21, male, and I am into older women. By older I mean women ages 40-65. Do you think it would be weird to start dating older women? I’m not even sure if any older women would want to date a 21 year old.",dating,t5_2qhb1,https://www.reddit.com/r/dating/comments/mhyojx/dating_older_women/
81,mhz4za,1617294786,"I really hate when people say ""I want what's best for you and I both"" and then turn around and try to manipulate you into something that's not in your best interest at all.","I've been seeing this new guy who is absolutely wonderful and like...probably the best person I've ever spent time investing in. It's really spotlighted how many shitty experiences I've had with people before and it's helped me realize that my needs/hopes/desires for a partner exist in real life. This morning we were talking and it triggered a memory for me of another guy I was seeing a few months back for a brief period. The guy at that time had become suddenly distant/inconsistent and I finally sat him down and casually initiated a conversation about ""I really like you, I just need some effort/communication/honesty from your end if we're gonna keep getting to know each other"". 

Dude winds up telling me he's not over his last relationship, he's unavailable, he didn't know how to tell me he couldn't give me what I wanted, etc. He specifically said he wanted what was best for us both. But when I was like ""It's all good no hard feelings, you don't owe me anything and that's dating but fwb isn't for me"" he kept dropping side comments for the *rest of the conversation* saying stuff like, ""I feel so bad, I'm so conflicted"" and all the shit he wasn't going to get to do anymore (specifically sex-related). It literally felt like I was coaching him through the conversation because it was like he was trying to get me to feel sorry for him that ***he*** **couldn't give** ***me*** **what** ***I*** **wanted**. Then at the end he asked if I wanted to stay the night one last time lmao. 

People be wildin' out.",dating,t5_2qhb1,https://www.reddit.com/r/dating/comments/mhz4za/i_really_hate_when_people_say_i_want_whats_best/
82,mhzixt,1617295856,Trying to fix my relationship after i cheated.,"So yes, i made the big mistake to cheat my gf. We were dating for 2 months before we got together but in those 2 months i still had sex with my fwb i had in the past. Once me and my gf made it official i quit having sex with the fwb girl and told her everything. Now my gf is heart broken and insanely angry with me. She has alot of moodswings where first she tells me to go away and later asking me to come hug her and kiss her. She told me she is changing her mind every 5 seconds between staying with me or leaving me. We were madly in love and i havent felt these feelings for someone ever.

Now ive told her sorry multiple times and ive taken action to proof her i can change. I deleted all other girls on social media, broke all contact with the fwb girl and shared my fb and instagram pw. Im doing all these things but not getting anyfeedback wether we are still going for this or if she is going to leave me. Her explenation is , we are in a grey zone. 

Last night she told me we just had to talk face to face because it is way better than on social media. Which is true because we had some calls and during those calls we can laugh and she tells me she still loves me and we both cry etc.. when on social media she is just acting really mad. 

Now i was wondering, what else can i do to show her that im serious and that i really want to give it my all and show her that i can be loyal and that i am going to be loyal.

Thanks for the advice in advance",dating,t5_2qhb1,https://www.reddit.com/r/dating/comments/mhzixt/trying_to_fix_my_relationship_after_i_cheated/
83,mhzm49,1617296099,Hey I'm Lucy,I'm looking for a [FRIENDSHIP] [RELATIONSHIP] hybrid type of thing that I think could be pretty interesting. It's for specific stuff if you need that specified start a chat with me. I'm on the younger side. [F4M],dating,t5_2qhb1,https://www.reddit.com/r/dating/comments/mhzm49/hey_im_lucy/
84,mi05f6,1617297558,I feel unloveable and I'll likely die alone,"I can't believe how flawed of a person I am. I'm a 22 year old guy who's never been on a date or in a relationship, and I don't think I ever will be. I'm too messed up and broken for someone to see me as a person worth spending their time with. I'm incredibly ugly with messed up teeth that make it literally impossible for me to smile, I have severe mental issues and disorders that make me feel like I'm not even human. I never laugh at anything, I talk with zero emotion in my voice, I have severe social anxiety disorder, depression, anger issues, probably more Ive never been diagnosed with (Im seriously mentally ill, I cant stress it enough, my dad has schizophrenia and I got most of his mental problems). Im asexual on top of all of this so my chances of ever finding love are just dead. I have no self esteem after years of bullying and constantly being called ugly, even to this day by random girls when Im just trying to live my life. Anytime I see someone normal I just want to die, I just can't get over how much life has thrown at me that make every day unbearable to go through. I just want people to like me, but the way I am, I'm better off dead than living this way. Is there really any hope for someone like me? I find it hard to believe when nobody in my life has ever treated me with kindness or love.",dating,t5_2qhb1,https://www.reddit.com/r/dating/comments/mi05f6/i_feel_unloveable_and_ill_likely_die_alone/
85,mi07x2,1617297746,When life gives you lemons - make gin,[removed],dating,t5_2qhb1,https://www.reddit.com/r/dating/comments/mi07x2/when_life_gives_you_lemons_make_gin/
86,mi0aoc,1617297957,I’m taking a break from love and closing my heart off for now. But I’m afraid I may miss out on somebody during my break.,"What if the right person comes along and I can’t give my heart to them because I’m still healing?

Yeah there’s not a whole lot else to say so sorry for the short post.",dating,t5_2qhb1,https://www.reddit.com/r/dating/comments/mi0aoc/im_taking_a_break_from_love_and_closing_my_heart/
87,mi0i9f,1617298495,Should i stay or should i go,"Hello good people of Reddit. 
 Im 38yo and Dad to two beautiful daughters my beloved wife passed away from cancer 6 years ago. First year of her passing was pretty dark for me alcohol,drugs whatever comes to mind while my kids at their grandparents, but i pulled through from that rabbit hole thanks to my girls. Since then i pretty much dedicate my life to my little ones and never touch any substance ever again. While im trying everything i can to do right by them in the back of my head a thought always telling me im not doing enough for them and they are gonna need a female figure in their life and im gonna fuck up along the way somehow while they growing up.
 My therapist suggested for me to try meet/date new people but i think it's not fair to anyone to date someone emotionally scarred as me. Besides that i know im gonna compare people i date to my late wife and find flaws every little action they do even if i don't want to. With that mind set even i start a relationship i know it can't last and became more unnecessary pain for both people . Are there any people among you have similar experiences as mine and how you get through this situation or any girls who live with a step mother and how that affected you positively or negatively to you or the absence of a mother figure. 
Thanks for your input have nice one wherever you are.",dating,t5_2qhb1,https://www.reddit.com/r/dating/comments/mi0i9f/should_i_stay_or_should_i_go/
88,mi0kcn,1617298651,Is he no longer interested? Can someone please give me advice,"I went on a date Saturday. I tried to plan a second date with him. He seemed interested, but was busy on the day I suggested. He asked if he could get back to me later this week. It’s been almost 5 days now and I still haven’t heard back from him. I don’t know what to do.

If anyone could help me out please message me or reply here. I’ll send you the texts so you can understand my situation better. Thanks!",dating,t5_2qhb1,https://www.reddit.com/r/dating/comments/mi0kcn/is_he_no_longer_interested_can_someone_please/
89,mi0mi7,1617298818,Fwb? I don’t even know,[removed],dating,t5_2qhb1,https://www.reddit.com/r/dating/comments/mi0mi7/fwb_i_dont_even_know/
90,mi0o61,1617298938,What do about childhood being a drag on dating/relationships?,"My childhood was super boring. It seems to be a problem in dating. Most people I'm dating have all these happy memories of trips and summer camps and get always or stuff like that.

My childhoold was basically watching TV. That's all my parents did. We never went out except for pizza/chain food, never traveled anywhere, never took vacation, and I never did any summer camps. My parents literally had no interest in life other than TV. They would go to work, come home, and watch TV until they went to bed, and all weekend, watch TV. We only went out to shop. That's it. For 18 years of my life. I worked since I was 15 to help pay the bills, and didn't have much time for sports or clubs. I had to save up to pay for college.

The people I go out with get really turned off when they find this out. Like go from flirting ot distance, turned off. Sometimes on the first dat,e sometimes on later dates. Whenever it comes up, it's an issue. The only people who seem to want ot date me are those who don't talk about their childhood either. 

Anyone else deal with this kind of thing? I'm not sure what i'm Uppose to do, start lying? It's awkward when someone goes on and on about how wonderful their parents and childhood were, and asks you what your favorite memory is, and it's like 'oh when my dad and I went to the dump to return bottles and spend the money on dunkin donuts once a month...' and they look disgusted at you. But that's the truth for me? 

It's like, people are freaked out when they find out I was poor growing up, that seems to the the gist of it? Most of the women I date have rich parents because I live in a very HCOL area. I never traveled or went ot a nice restaurant until I was like 20.",dating,t5_2qhb1,https://www.reddit.com/r/dating/comments/mi0o61/what_do_about_childhood_being_a_drag_on/
91,mi0rcq,1617299180,Cream pie,[removed],dating,t5_2qhb1,https://www.reddit.com/r/dating/comments/mi0rcq/cream_pie/
92,mi11do,1617299959,Caught feelings on the person I least expected,"I have been learning a different language for fun for about 2-3 months and there is this girl that I really like. I don't know how to put this, but at first i didn't see any appeal to her but as time went on, her personality, attitude, hardworking nature and positivity drew me closer and closer to her. 
She is 5 years younger than me and we text almost daily.

 Although she doesn't reply to some texts and just abruptly end conversations out of the blue, I believe we have meaningful conversations. I am pretty sure that she might not see me the same way I see her, my assumption is that she thinks of me as a friend almost like a brother. I really don't want to mess the friendship I have with her up so I won't be confessing anything atleast for the time being.

 Is it okay for me to go forward this relationship romantically??  Should I??  
Is the lack of replies a sign of ""she's not that into you?""
Am I overthinking things? 
The language classes ends in 6 months so I am waiting to see how things turn out from here. 
Any advice??",dating,t5_2qhb1,https://www.reddit.com/r/dating/comments/mi11do/caught_feelings_on_the_person_i_least_expected/
93,mi123s,1617300011,What are the chances that nothing will happen?,[removed],dating,t5_2qhb1,https://www.reddit.com/r/dating/comments/mi123s/what_are_the_chances_that_nothing_will_happen/
94,mi17i8,1617300402,Will people think Its weird for me M23 to date F27 ?,"I’m most likely going to do it regardless of peoples opinions, but I’m curious as to how people view the age gap (just over 4 years). She is working while I still have 14 months of school left.",dating,t5_2qhb1,https://www.reddit.com/r/dating/comments/mi17i8/will_people_think_its_weird_for_me_m23_to_date_f27/
95,mi1a0h,1617300592,Weekend sexaway after 3 dates with a girl in a different city?,[removed],dating,t5_2qhb1,https://www.reddit.com/r/dating/comments/mi1a0h/weekend_sexaway_after_3_dates_with_a_girl_in_a/
96,mi1aiz,1617300630,Date with my crush turned me off? Help,[removed],dating,t5_2qhb1,https://www.reddit.com/r/dating/comments/mi1aiz/date_with_my_crush_turned_me_off_help/
97,mi1smr,1617302006,"I'm confused, friends or more?","Hi all!  Looking for what you would make of this weird situation.

I have a guy friend (he's 32M, I'm 32F) who is one of my very closest friends.  We've gone backpacking together, on road trips, even flown to visit our hometown together.  Early on in our friendship, he made it known that he was interested (asked where I would have kissed him if given the chance), and I friend-zoned him because at that point in my life I had just gotten out of a long relationship and was just trying to be single and vibe.  Well, years go by and we get closer and I start to like him as more than a friend.  I know that he had dated women because he talked about one woman he was hooking up with and also he would have me navigating us on his phone and Bumble messages would pop up.  Around this past October, I felt the urge to tell him how I felt; my feelings had been getting stronger and it just felt like the right thing to do.  So, I send him a long text message telling him how I liked him as more than a friend, how my feelings for him were confusing but kept getting deeper, and how I never acted on it because I was afraid to ruin our friendship.  DAYS LATER he texted me about something else but never really responded to my ""declaration of feelings"" text.  A few weeks after my text, he came over my place to cat/house-sit because I was leaving town for a week for a trip.  It was after midnight because I had been working, and I had a 3am flight to catch, so I was trying to get a little bit of sleep.  He walks into my place and immediately says: ""Sooo we need to talk.""  I basically say ""Do we have to?  I really want to get some sleep.""  He looks super relieved and says ""Yeah, I didn't really want to have that conversation tonight anyways.""  Cool cool.  So, I go on my trip and come back and we have lunch and I tell him all about it.  We have hung out many times since then, we text almost every day about dumb daily shit, but have still never had that ""conversation"".  He recently invited me to come with him to his friends' wedding in Alaska, and we're planning the trip and I am super excited (Alaska!), but he has said stuff like ""Yeah, I don't want you to feel weird because it's a wedding, just thought you'd like to see Alaska"".

Sooo basically, my question is, what should I do?  Is he into me?  Or did I blow it?  Is the ball in my court or his?  Essentially, my main priority is keeping our friendship intact, but my heart wants more and I'm not sure how to go about it delicately.  Thanks for reading, sorry it's so long!",dating,t5_2qhb1,https://www.reddit.com/r/dating/comments/mi1smr/im_confused_friends_or_more/
98,mi1vz5,1617302270,How to find someone while on lockdown?,"I am 17M; it's been about an year since the lockdown started in my city. The places such as school, where you can meet someone are ""gone"" because of the pandemic. Although I receive the attention while driving in the bus and etc, I am kinda shy to ask for the number. I tried using dating apps several times, but they are just not working for me...",dating,t5_2qhb1,https://www.reddit.com/r/dating/comments/mi1vz5/how_to_find_someone_while_on_lockdown/
99,mi230f,1617302813,25F Why does every guy I date use me for sex . I hate dating,[removed],dating,t5_2qhb1,https://www.reddit.com/r/dating/comments/mi230f/25f_why_does_every_guy_i_date_use_me_for_sex_i/
